s ɔ p t ʊ ʊ s ʊ m	s ʊ m p t ʊ oː s ʊ m
r ɔ g ʊ m	r ɔ g ʊ m
a b n ɛ g aː r ɛ	a b n ɛ g aː r ɛ
k ɔ lː ɛ k t j oː n ɛ m	k ɔ lː eː k t j oː n ɛ m
k ɔ n w ɛ n iː r ɛ	k ɔ n w ɛ n iː r ɛ
p ɛ r m a n eː ɛ r ɛ	p ɛ r m a n eː r ɛ
aʊ r ɔ r a m	aʊ r oː r a m
p a n ɪ k ʊ ɛ l a m	p aː n ɪ k ʊ l a m
ɪ n t r oː ɪ t ʊ m	ɪ n t r ɔ ɪ t ʊ m
k r ɔ n ɪ k ʊ m	kʰ r ɔ n ɪ k ʊ m
ɪ n w ɪ t a t j oː n ɛ m	ɪ n w ɪ t aː t j oː n ɛ m
ɔ r j ɪ uː n d ʊ m	ɔ r j ʊ n d ʊ m
f r ɛ m ɪ t ʊ m	f r ɛ m ɪ t ʊ m
t ɪ m oː n ɛ m	t eː m oː n ɛ m
f a j aː l ɛ	f a k j aː l ɛ m
ʊ p ɛ r ɛ r ʊ m	ɔ p ɛ r aː r j ʊ m
w a k ɪ lː aː r ɛ	w a k ɪ lː aː r ɛ
ɔ b l ɪ t ɛ r aː r ɛ	ɔ b l ɪ tː ɛ r aː r ɛ
ɪ n k a n ɛ t ɛ r ɛ	ɪ ŋ k aː n eː s k ɛ r ɛ
t ɛ t r ʊ m	t aɪ t r ʊ m
m ɛ d j ɔ k r ɛ m	m ɛ d ɪ ɔ k r ɛ m
r ɛ p t aː r ɛ	r ɛ p ʊ t aː r ɛ
m ɪ n ɔ r aː r ɛ	m ɪ n oː r aː r ɛ
d ɛ t ɛ n ɛ r ɛ	d eː t ɪ n eː r ɛ
a s uː m ɛ r ɛ	a sː uː m ɛ r ɛ
ɪ m p ɛ t r aː r ɛ	ɪ m p ɛ t r aː r ɛ
l a k uː s t r ɛ m	l a k ʊ s t r ɛ m
ɛ r oː r ɛ m	ɛ rː oː r ɛ m
a s ɛ r t j ɔ m	a sː ɛ r t j oː n ɛ m
t r a n s p ɔ r t aː r ɛ	t r aː n s p ɔ r t aː r ɛ
w ɪ k ɪ n a m	w iː k iː n a m
uː s ɪ t aː t ɛ m	uː s ɪ t aː t ʊ m
m a ŋ ɪ k a m	m a n ɪ k a m
ɪ m p r ɛ k aː r ɛ	ɪ m p r ɛ k aː r iː
a s ɪ m ɪ l aː r ɛ	a sː ɪ m ʊ l aː r ɛ
ɪ p n ɔ t ɪ k ʊ m	h y p n oː t ɪ k ʊ m
t ɪ m ɪ d ʊ m	t ɪ m ɪ d ʊ m
s ɔ l ʊ t ʊ m	s ɔ l uː t ʊ m
k a l a m ɪ t ɔ s ʊ m	k a l a m ɪ t oː s ʊ m
ɔ s t ɛ n s ɪ w ʊ m	ɔ s t eː n s iː w ʊ m
aʊ t ɔ r ɪ t aː t ɛ m	aʊ k t oː r ɪ t aː t ɛ m
s ɛ n t iː r ɛ	s ɛ n t iː r ɛ
ɪ m p uː d ɛ n t ɛ m	ɪ m p ʊ d ɛ n t ɛ m
a n j lː a m	a ŋ n ɛ lː a m
k ɔ n mː ɔ t j oː n ɛ	k ɔ mː oː t j oː n ɛ m
d ɛ g r a d a t j oː n ɛ m	d eː g r a d aː t j oː n ɛ m
s t r aː g ʊ m	s t r aː g ɛ m
k ɔ n ɛ k s j oː n ɛ m	k ɔ nː ɛ k s j oː n ɛ m
m eː ɪ s t ɪ ɛ r ɛ	m ɪ n ɪ s t ɛ r j ʊ m
k ɛ d ɛ r ɛ	k eː d ɛ r ɛ
k ɪ r k ʊ n w ɛ n ɪ r ɛ	k ɪ r k ʊ m w ɛ n iː r ɛ
f ɔ lː ɪ k ʊ ʊ l ʊ m	f ɔ lː ɪ k ʊ l ʊ m
s ɔ m n ɔ l j ɛ n t ʊ m	s ɔ m n ɔ l ɛ n t ʊ m
ɪ n t ɛ r w ɛ r t ɪ r ɛ	ɪ n t ɛ r w ɛ r t ɛ r ɛ
d ɪ r ɪ m ɛ r ɛ	d ɪ r ɪ m ɛ r ɛ
ɔ pː ɔ r t uː n ɪ t aː t ɛ m	ɔ pː ɔ r t uː n ɪ t aː t ɛ m
p aʊ p ɛ r t aː t ɛ m	p aʊ p ɛ r t aː t ɛ m
k ɔ k ʊ l ʊ m	k ʊ k ʊ lː ʊ m
m a n t ɛ b ʊ m	m a ŋ k ɪ p ɛ m
t uː b ɛ r ɔ s ʊ m	t uː b ɛ r oː s ʊ m
f uː m oː s ʊ m	f uː m oː s ʊ m
a t ɛ n d ɛ r ɛ	a tː ɛ n d ɛ r ɛ
r a n ʊ m	a r aː n ɛu m
oː d j ʊ m	ɔ d j ʊ m
ɪ n mː ɔ l aː r ɛ	ɪ mː ɔ l aː r ɛ
r a k ɪ m ɔ s ʊ m	r a k eː m oː s ʊ m
ɛ k s t ɪ r p a t j oː n ɛ	ɛ k sː t ɪ r p aː t j oː n ɛ m
m a l ɪ ŋ n ʊ m	m a l ɪ ŋ n ʊ m
k a r a m ɛ lː ʊ m	k a l a m ɛ lː ʊ m
p ɔ lː ɪ k ɛ m	p ɔ lː ɪ k ɛ m
r eː k aː l k ɪ t r aː r ɛ	r ɛ k a l k ɪ t r aː r ɛ
k ɔ t j oː n ɪ n ɪ l a m	k ɔ kː ɪ n a m
m t ɛ m p eː r aː r ɛ	t ɛ m p ɛ r aː r ɛ
w ɪ w aː k ɛ	w iː w aː k ɛ m
g r a t ɪ t ʊ m	g r aː t ʊ iː t ʊ m
k ʊ n d n a t j oː n ɛ m	k ɔ n d ɛ m n aː t j oː n ɛ m
k a t ɪ n ʊ m	k a t iː n ʊ m
a m ɪ k a l ɛ	a m iː k aː l ɛ m
j aː d ɛ m	iː l ɛ
t aʊ r ɪ f ɔ r m ɛ	t aʊ r ɪ f oː r m ɛ m
r aː m ʊ m	r aː m ʊ m
t ɛ rː ɛ ʊ m	t ɛ rː ɛu m
ʊ m k m	a w ʊ ŋ k ʊ l ʊ m
w ɛ r ɪ f ɪ k a t j oː n ɛ	w ɛ r ɪ f ɪ k aː t j oː n ɛ m
eː l uː k uː b r aː r ɛ	eː l uː k ʊ b r aː r ɛ
a pː a r ɛ n t ɛ m	a pː a r ɛ n t ɛ m
w ɪ t ɛ lː ʊ m	w ɪ t ɛ lː ʊ m
w ɪ b r a t j oː n ɛ m	w ɪ b r aː t j oː n ɛ m
d ɛ t ɛ s t a t j oː n ɛ m	d eː t ɛ s t aː t j oː n ɛ m
k lː aʊ s uː lː a m	k l aʊ s ʊ l a m
f ɪ ʊ a m	f iː d uː k j a m
f ɪ d aː r ɛ	f iː d ɛ r ɛ
f l ɛ b ʊ l ɛ m	f l eː b ɪ l ɛ m
f aː k t oː r ɛ	f a k t oː r ɛ m
s uː pː l ɪ k a t j ʊ ɛ m	s ʊ pː l ɪ k aː t j oː n ɛ m
s iː n ʊ m	s ʊ iː n ʊ m
k ɛ n t uː r j a m	k ɛ n t ʊ r j a m
kʷ a d r uː p l ɪ k aː r ɛ	kʷ a d r ʊ p l ɪ k aː r ɛ
k ɛ r t ɪ t uː d ɪ n ɛ m	k ɛ r t ɪ t uː d ɪ n ɛ m
eː kʷ ʊ m	aɪ kʷ ʊ m
kʷ a d r uː p l aː r ɛ	kʷ a d r ʊ p l aː r ɛ
d ɛ r ɪ s oː r j ʊ m	d eː r iː s oː r j ʊ m
ɪ n d a g a r ɛ	ɪ n d aː g aː r ɛ
ɪ n s k r ɪ w ɛ r ɛ	iː n s k r iː b ɛ r ɛ
k a t ʊ m	k aʊ t ʊ m
d ɛ p r ɛ k a r ɛ	d eː p r ɛ k aː r iː
l ɛ n a d ɔ r ɛ	l ɪ ŋ n aː t oː r ɛ m
k a n ɔ r ʊ m	k a n oː r ʊ m
m ɛ l ʊ d j a m	m ɛ l oː d j a m
p j ɛ a n ɛ m	p aɪ aː n ɛ m
b a s ɪ l ɪ k ʊ m	b a s ɪ l ɪ k ʊ m
f ɪ l j a l ɛ	f iː l j aː l ɛ m
n uː m ɛ r ʊ s ɪ t a t ɛ m	n ʊ m ɛ r oː s ɪ t aː t ɛ m
s ʊ s t r ɛ ɛ r ɛ	s ʊ b t r a h ɛ r ɛ
a m s k ɔ n d ɛ r ɛ	a b s k ɔ n d ɛ r ɛ
a r m ɪ lː a m	a r m ɪ lː a m
s k ɔ p a m	s k oː p a m
ɪ ŋ g uː r j a m	ɪ n ɪ uː r j a m
aʊ k s ɪ l j aː r ɛ	aʊ k s ɪ l j aː r ɛ m
r ɛ w ɔ k a t j oː n ɛ m	r ɛ w ɔ k aː t j oː n ɛ m
s t r ɪ g ɛ m	s t r ɪ g ɛ m
ɪ n k ɛ t aː r ɛ	ɪ ŋ k ɛ p t aː r ɛ
k ɛ n s uː r a m	k eː n s uː r a m
w a k ɪ lː a t j oː n ɛ m	w a k ɪ lː aː t j oː n ɛ m
w a r j ɛ g a t j oː n ɛ m	w a r ɪ ɛ g aː t j oː n ɛ m
l a k r ɪ m oː s ʊ m	l a k r ɪ m oː s ʊ m
f ɪ d ʊ m	f iː d ʊ m
d ɛ n t aː l ɛ	d ɛ n t aː l ɛ m
a t r ʊ m	aː t r ʊ m
p r ɔ d ɪ g j ʊ s j ʊ m	p r oː d ɪ g j oː s ʊ m
p ɛ r d ɛ r ɛ	p ɛ r d ɛ r ɛ
r ɛ n ʊ ɪ r ɛ	r ɛ n ʊ ɛ r ɛ
d ɪ fː a m a t oː r j ʊ m	d ɪ fː aː m aː t oː r j ʊ m
k uː l p aː r ɛ	k ʊ l p aː r ɛ
a r g ɛ n t ʊ m	a r g ɛ n t ʊ m
s a l uː t aː r ɛ	s a l uː t aː r ɛ
f r a t ɛ r n ɪ t aː t ɛ m	f r aː t ɛ r n ɪ t aː t ɛ m
r eː w ɛ n ɪ r ɛ	r ɛ w ɛ n iː r ɛ
a k r ɛ t j oː n ɛ	a kː r eː t j oː n ɛ m
l ɪ b r a t j ɔ m	l iː b r aː t j oː n ɛ m
l uː b r ɪ k ɪ t ɛ m	l uː b r ɪ k ɪ t aː t ɛ m
a k t ʊ m	aː k t ʊ m
a d ɪ p ɛ m	a d ɪ p ɛ m
k r ɛ p a t uː r a m	k r ɛ p aː t uː r a m
k ɔ n s oː n aː r ɛ	k oː n s ɔ n aː r ɛ
m ɪ g r aː r ɛ	m ɪ g r aː r ɛ
k ɔ n t r ɪ s t aː r ɛ	k ɔ n t r iː s t aː r ɛ
k ɔ ɛ r t ɪ j ɔ m	k ɔ ɪ r k ɪ t j oː n ɛ m
p l aː n t aː r ɛ	p l a n t aː r ɛ
ɛ k s k uː r s j oː n ɛ m	ɛ k s k ʊ r s j oː n ɛ m
ɪ n k j ɛ n s ʊ m	ɪ ŋ k eː n s ʊ m
p uː d ɪ k ʊ m	p ʊ d iː k ʊ m
f ɛ k ʊ l ɛ n t ʊ m	f aɪ k ʊ l ɛ n t ʊ m
f ɛ l ɪ k ɪ t aː t ɛ m	f eː l iː k ɪ t aː t ɛ m
m ɛ t r ɛ a m	m ɛ t r ʊ m
uː b ɪ k a t j oː n ɛ m	ʊ b ɪ k aː t j oː n ɛ m
ɪ r m a n d aː d ɛ m	g ɛ r m aː n ɪ t aː t ɛ m
g l ʊ k aː r ɛ	g l oː k iː r ɛ
g a rː ɪ r ɛ	g a rː iː r ɛ
a b ɪ t a t j oː n ɛ m	h a b ɪ t aː t j oː n ɛ m
m uː n ɪ k ɪ p aː l ɛ	m uː n ɪ k ɪ p aː l ɛ m
r aː s ɛ n aː r ɛ	r ɛ s ɪ ŋ n aː r ɛ
uː n ɪ k ʊ m	uː n ɪ k ʊ m
j ɛ r m aː n ʊ m	g ɛ r m aː n ʊ m
r uː g iː r ɛ	r uː g iː r ɛ
k ɔ ŋ g uː r aː r ɛ	k ɔ n ɪ uː r aː r ɛ
r ɛ k l ɪ n aː r ɛ	r ɛ k l iː n aː r ɛ
d ɪ s ɛ kː aː r ɛ	d eː s ɪ kː aː r ɛ
w ʊ l p ɪ n ʊ m	w ʊ l p iː n ʊ m
l ɔ ŋ g a n ɪ m ɪ t aː t ɛ m	l ɔ ŋ g a n ɪ m ɪ t aː t ɛ m
ɔ r ɛ k ʊ j a m	ɔ r ɪ k l a m
s k ʊ d ɛ lː a m	s k ʊ t ɛ lː a m
a d ɔ n k ʊ m	a d ʊ ŋ k ʊ m
j uː g ʊ l aː r ɛ	j ʊ g ʊ l aː r ɛ
k r ɛ s p ʊ m	k r ɪ s p ʊ m
t r a n s ɪ g ɛ r ɛ	t r aː n s ɪ g ɛ r ɛ
k ʊ p ʊ l aː r ɛ	k oː p ʊ l aː r ɛ
ɪ m p l ɔ r aː r ɛ	ɪ m p l oː r aː r ɛ
a lː ɛ g aː r ɛ	a lː ɛ g ɛ r ɛ
t a r d ɪ m ʊ m	t a r d ʊ m
p r ɛ m ɔ n ɪ t ɔ r ɛ m	p r aɪ m ɔ n ɪ t oː r ɛ m
f a b r ʊ m	f a b r ʊ m
d ɛ k ɪ m a t j ʊ n ɛ m	d ɛ k ɪ m aː t j oː n ɛ m
d ɪ m a n aː r ɛ	d iː m aː n aː r ɛ
f ʊ n d a t oː r ɛ	f ʊ n d aː t oː r ɛ m
p ɛ r f ɪ d ʊ m	p ɛ r f ɪ d ʊ m
d ɛ r ɛ t uː r a m	d iː r ɛ k t uː r a m
k ɔ n t r ɪ t ʊ m	k ɔ n t r iː t ʊ m
w ɛ r m ɛ m	w ɛ r m ɛ m
p ɛ r kʰ a m	p ɛ r k a m
uː n k ɪ n ʊ m	ʊ ŋ k iː n ʊ m
l a t r aː r ɛ	l a t r oː n ɛ m
s a k r ɪ l ɛ g ʊ m	s a k r ɪ l ɛ g ʊ m
l a p ɪ d ɛ	l a p ɪ d ɛ m
r ɛ p a r aː r ɛ	r ɛ p a r aː r ɛ
n ʊ t r ɪ r ɛ	n uː t r iː r ɛ
m aː g ɪ k ʊ m	m a g ɪ k ʊ m
f a k ɛ t j a m	f a k eː t j a m
a l ɪ t ʊ m	h aː l ɪ t ʊ m
p r ɛ s t a n t j a m	p r aɪ s t a n t j a m
m uː r aː l a m	m uː r aː l ɛ m
k ɔ m p aː t r ɛ m	k ɔ m p a t r ɛ m
a w j ɛ s ʊ m	aː w ɛ r s ʊ m
t ɔ m ʊ m	t ɔ m ʊ m
p r ɛ k l a r ʊ m	p r aɪ k l aː r ʊ m
ɛ r a m	aɪ r a m
k ʊ n k ɪ t a t j oː n ɛ m	k ɔ ŋ k ɪ t aː t j oː n ɛ m
ɛ k iː r sː ɪ k aː r ɛ	ɛ k sː ɪ kː aː r ɛ
m ɛ r ʊ m	m ɛ r ʊ m
s p uː r j ʊ m	s p ʊ r j ʊ m
k ɔ n k r ɛ t j ʊ n ɛ	k ɔ ŋ k r eː t j oː n ɛ m
a k t ʊ w aː r j ʊ m	aː k t w aː r j ʊ m
s a l uː b r ɛ m	s a l uː b r ɛ m
s p oː s ʊ m	s p oː n s ʊ m
s ʊ b ɪ t aː n ɛu m ʊ m	s ʊ b ɪ t aː n ɛu m
d ɪ l uː ɪ r ɛ	d iː l ʊ ɛ r ɛ
k ʊ m p r a t ɔ r ɛ	k ɔ m p a r aː t oː r ɛ m
uː l t r ɪ k ɛ	ʊ l t r iː k ɛ m
a b lː a k t aː r ɛ	a b l a k t aː r ɛ
p r ɛ s aː r ɛ	p r ɛ t j aː r ɛ
m ɛ s t ʊ m	m aɪ s t ʊ m
ʊ r ɪ n a m	uː r iː n a m
ɪ n w ɪ d j a m	ɪ n w ɪ d j a m
d ɛ s ɪ d ɛ r aː r ɛ	d eː s iː d ɛ r aː r ɛ
t ɛ d j oː s ʊ m	t aɪ d j oː s ʊ m
d ɛ s uː m ɪ r ɛ	d eː s uː m ɛ r ɛ
t ɔ r ʊ m	t aʊ r ʊ m
j ɛ j uː n ʊ m	j eː j uː n j ʊ m
k uː p ɪ d ɪ t ɛ m	k ʊ p ɪ d ɪ t aː t ɛ m
s a j ɛ t aː r ɛ	s a g ɪ tː aː r ɛ
s p ɛ k uː l a t oː r ɛ	s p ɛ k ʊ l aː t oː r ɛ m
s ʊ l k ʊ m	s ʊ l k ʊ m
k ɔ n s ɪ ŋ n aː r ɛ	k oː n s ɪ ŋ n aː r ɛ
p aː s t ʊ m	p aː s t ʊ m
ɔ l aː r ʊ m	ɔ lː aː r j ʊ m
a ɛ r ɛ ʊ m	aː ɛ r j ʊ m
m a t r ɔ n aː l ɛ m	m aː t r oː n aː l ɛ m
l uː m ɪ n oː s ʊ m	l uː m ɪ n oː s ʊ m
a f j a n t aː r ɛ	a fː ɪ d ɛ n t j aː r ɛ
ɪ n k ɔ n s t a n t ɛ m	ɪ ŋ k oː n s t a n t ɛ m
k a t a r a k t a m	k a t a r a k t a m
d ɛ k r ɛ m ɛ n t ʊ m	d eː k r eː m ɛ n t ʊ m
l a k ɛ r aː r ɛ	l a k ɛ r aː r ɛ
ɔ b s ɛ d ɛ r ɛ	ɔ b s ɪ d eː r ɛ
p a t ɛ r n ʊ m	p a t ɛ r n ʊ m
kʷ ɔ t ɪ d j aː n ʊ m	kʷ ɔ t iː d j aː n ʊ m
a b j ɛ k t aː r ɛ	a b ɪ k ɛ r ɛ
k r eː w ɛ n t j a m	k r eː d ɛ n t j a m
m a s k l ʊ m	m a s k ʊ l ʊ m
f ʊ ŋ g oː s ʊ m	f ʊ ŋ g oː s ʊ m
s t r ɪ d ɛ r ɛ	s t r iː d ɛ r ɛ
s t r ɛ m ɛ t ɛ r ɛ	t r ɛ m eː s k ɛ r ɛ
w aɪ r d s a m	w ɪ r ɪ d ɛ m
s k r ɪ b a m	s k r iː b a m
k a t ɛ k ɪ d zː aː r ɛ	k a t eː kʰ iː zː aː r ɛ
m aː g ʊ m	m a g ʊ m
l a m a m	l aː m a m
d ɪ s w aː ɪ d ɛ r ɛ	d ɪ sː w aː d eː r ɛ
p eː r g ʊ l ɛ m	p ɛ r g ʊ l a m
s ʊ mː ɪ n ɪ s t r a r ɛ	s ʊ b m ɪ n ɪ s t r aː r ɛ
a n uː l aː r ɛ	aː n ʊ l aː r ɛ m
d ʊ m aː r ɛ	d ɔ m aː r ɛ
kʷ a t r aː t ʊ m	kʷ a d r aː t ʊ m
d ɛ n ʊ n k t j aː s j ʊ m m	d eː n ʊ n t j aː t j oː n ɛ m
p a r eː r a f ʊ m	p a r a g r a pʰ ʊ m
p r uː n ʊ m	p r uː n ʊ m
a lː ɔ ŋ g aː r ɛ	eː l ɔ ŋ g aː r ɛ
s ʊ p ɛ r b j ʊ m	s ʊ p ɛ r b ʊ m
l aʊ r ɛ t ʊ m	l aʊ r ɛ aː t ʊ m
s ɛ k r n ɛ r ɛ r ɛ	s eː k ɛ r n ɛ r ɛ
k ɔ n d ɛ n s a t j oː n ɛ m	k ɔ n d eː n s aː t j oː n ɛ m
rː ɛ p ɛ n t ɛ r ɛ	p aɪ n ɪ t eː r ɛ
ɔ k k ɪ d ɛ n t aː l ɛ	ɔ kː ɪ d ɛ n t aː l ɛ m
ɪ lː ɛ g aː l ɛ	ɪ lː eː g aː l ɛ m
t ɪ t uː b eː r ɛ	t ɪ t ʊ b aː r ɛ
s t aː n ʊ m	s t a nː ʊ m
m ɔ n d aː r ɛ	m ʊ n d aː r ɛ
oː s ʊ m	oː s ʊ m
r ɛ lː a k s a t j oː n ɛ m	r ɛ l a k s aː t j oː n ɛ m
a r j ʊ lː ʊ m	h a r ɪ ɔ l ʊ m
s t r j a m	s t r j a m
k ɔ n s uː l t a t j oː n ɛ m	k oː n s ʊ l t aː t j oː n ɛ m
k ɔ n k ɔ r d j a m	k ɔ ŋ k ɔ r d j a m
r ɛ f l ɔ r ɪ r ɛ	r ɛ f l oː r eː r ɛ
ɔ k uː l aː r ɛ	ɔ k ʊ l aː r ɛ m
m uː n ɪ t j ɔ m	m uː n iː t j oː n ɛ m
a m aː r ɛ	a m aː r ɛ
l ɔ m b ʊ m	l ʊ m b ʊ m
k ɔ k s a l ɛ	k ɔ k s aː l ɛ m
b a s ɪ l ɪ k a m	b a s ɪ l ɪ k a m
s t j ɛ r k ʊ kʷ ɛ	s t ɛ r k ʊ s
l ɪ b ɛ lː uː l a m	l iː b ɛ lː ʊ l a m
a m a t ɔ r j ʊ m	a m aː t oː r j ʊ m
k ɪ t ɛ r j oː r ɛ	k ɪ t ɛ r j oː r ɛ m
k a p ɪ t a t j oː n ɛ m	k a p ɪ t aː t j oː n ɛ m
s uː pː oː n ɛ m	s ʊ pː oː n ɛ r ɛ
t r a n s m ɪ s j oː n ɛ m	t r aː n s m ɪ sː j oː n ɛ m
k ɔ r j ɛ n d oː l ʊ m	k ɔ r j a n d r ʊ m
n ɔ k ɛ t ʊ m	n ʊ k eː t ʊ m
f uː r t ɪ w ʊ m	f uː r t iː w ʊ m
r ɔ n k aː r ɛ	r h ɔ ŋ kʰ aː r ɛ
t ɛ n ɔ r ɛ	t ɛ n oː r ɛ m
m uː t aː r ɛ	m uː t w aː r iː
p ɛ r k uː t ɛ r ɛ	p ɛ r k ʊ t ɛ r ɛ
t ʊ n d ɛ r ɛ	t ɔ n d eː r ɛ
m j ɛ d ʊ m	m ɛ t ʊ m
d ɪ k eː s p ɛ r a t j oː n ɛ m	d eː s p eː r aː t j oː n ɛ m
f ɪ l ɔ s ɔ f j a m	pʰ ɪ l ɔ s ɔ pʰ j a m
a d uː l aː r ɛ	a d uː l aː r iː
ɪ n uː l t ʊ m	ɪ n ʊ l t ʊ m
k ɪ r k ʊ n l ɔ k uː t j ɔ n ɛ	k ɪ r k ʊ m l ɔ k uː t j oː n ɛ m
ɪ n w ɔ l w ɛ r ɛ	ɪ n w ɔ l w ɛ r ɛ
k ɔ n s ɪ l ɛ ʊ m	k oː n s ɪ l j ʊ m
d ɔ m ɛ s t ɪ k ʊ m	d ɔ m ɛ s t ɪ k ʊ m
ɪ ŋ g l ɛ s ɛ m	a ŋ g l eː n s ɛ m
ɛ k s t r uː d ɪ r ɛ	ɛ k s t r uː d ɛ r ɛ
k ɔ m p a s ɪ b lː ɛ m	k ɔ m p a sː ɪ b ɪ l ɛ m
ɛ k s t ɛ n s ɪ w ʊ m	ɛ k s t eː n s iː w ʊ m
a t ʊ m	aː t ʊ m
r a d j aː r ɛ	r a d j aː r ɛ
m eː s a m	m eː s a m
p uː ŋ n aː k ɛ	p ʊ ŋ n aː k ɛ m
p a l ʊ d oː s ʊ m	p a l uː d oː s ʊ m
s ʊ w ɛ n ɪ r ɛ	s ʊ b w ɛ n iː r ɛ
k ɪ r k ʊ n f l uː ɪ r ɛ	k ɪ r k ʊ m f l ʊ ɛ r ɛ
g r aː l ʊ m	g r aː k ʊ l ʊ m
h ɔ r b ʊ m	ɔ r b ʊ m
p ɛ r ɪ t j a m	p ɛ r iː t j a m
s ɛ f ɪ r ʊ m	z ɛ pʰ y r ʊ m
d ɔ l aː r ɛ	d ɔ l aː r ɛ
l uː pː ɪ n ʊ m	l ʊ p iː n ʊ m
g r aː n d ɪ k ʊ m	g r a n d ɪ n ɛ m
ɪ n f a n t j a m	iː n f a n t j a m
ɛ n ɛ r w aː r ɛ	eː n ɛ r w aː r ɛ
s t ʊ l t ʊ m	s t ʊ l t ʊ m
ɔ l ɪ g aː r k a m	ɔ l ɪ g a r kʰ a m
j ɛ t aː r ɛ	j a k t aː r ɛ
m ʊ l k ɛ r ɛ	m ʊ l k eː r ɛ
t r ɪ b ʊ l ʊ m	t r ɪ b ʊ l ʊ m
f a m aː r a l a m	f eː m ɛ lː a m
s ɔ lː ɪ k ɪ t uː d ɪ n ɛ m	s ɔ lː ɪ k ɪ t uː d ɪ n ɛ m
w ɛ r m ɪ n ɔ s ʊ m	w ɛ r m ɪ n oː s ʊ m
ɛ k s t ɛ r j ɔ r ɛ	ɛ k s t ɛ r j oː r ɛ m
t oː r ʊ w ɪ s k ʊ m	t ʊ r b ɪ s k ʊ m
ɪ n w ɛ s t ɪ g a t j oː n ɛ m	ɪ n w ɛ s t iː g aː t j oː n ɛ m
l aː t ʊ m	l aː t ʊ m
p ɔ s t ɛ r ʊ m	p ɔ s t ɛ r ʊ m
p l aː n t ʊ m	p l a ŋ k t ʊ m
s ɪ k aː r j ʊ m	s iː k aː r j ʊ m
r aː k ɛ m ʊ m	r a k eː m ʊ m
w ɛ r n aː k ʊ l ʊ m	w ɛ r n aː k ʊ l ʊ m
t ɪ l a m	t eː l a m
a n w ʊ m	a nː ʊː m
ʊ rː ɛ ʊ m	h ɔ rː ɛu m
p ɛ r ɪ t a r t ɛ	p ɪ g r ɪ t aː r iː
a g a p ɛ m	a g a p eː n
l ɪ m p j ɪ d ɛ m	l ɪ m p ɪ d ʊ m
a n aː t r aː kʷ ɛ	a n a t ɛ m
p r ɔ s p ɛ r aː r ɛ	p r ɔ s p ɛ r aː r ɛ
k ɔ h ɔ l p ɛ m	k ɔ l a pʰ ʊ m
l ɪ b ɛ r a l ɪ t aː t ɛ m	l iː b ɛ r aː l ɪ t aː t ɛ m
a l ɪ ɛ n ʊ m	a l ɪ eː n ʊ m
r eː w ɛ d ɛ r ɛ	r ɛ w ɪ d eː r ɛ
s a k r ɪ f ɪ k j ʊ m	s a k r ɪ f ɪ k j ʊ m
r ɔ m iː k ɛ	r ʊ m ɪ k ɛ m
f aː rː aː g ɪ n ɛ	f a rː aː g ɪ n ɛ m
s ɪ g ɪ lː aː r ɛ	s ɪ g ɪ lː aː r ɛ
m ɛ t ɛ r ɛ	m ɪ tː ɛ r ɛ
ɔ r b ɪ k ɛ	ɔ r b ɛ m
t uː g uː r j ʊ m	t ʊ g ʊ r j ʊ m
a k ɛ d ɛ r ɛ	a kː eː d ɛ r ɛ
kʷ a l ɪ f ɪ k aː r ɛ	kʷ aː l ɪ f ɪ k aː r ɛ
n ɔ m ɪ n a t j oː n ɛ	n oː m ɪ n aː t j oː n ɛ m
n aʊ f r a g ʊ m	n aʊ f r a g ʊ m
eː l ɛ k t j ʊ n ɛ	eː l eː k t j oː n ɛ m
aʊ d uː n aː r ɛ	a d uː n aː r ɛ
k ɔ nː ʊ m	k ʊ nː ʊ m
w ɪ n oː s ʊ m	w iː n oː s ʊ m
l eː j ɛ r ɛ	l ɛ g ɛ r ɛ
f ɛ d ʊ m	f ɔ ɪ d ʊ s
b ɛ n ɛ d ɪ k ɛ r ɛ	b ɛ n ɛ d iː k ɛ r ɛ
a k ɛ p t j oː n ɛ m	a kː ɛ p t j oː n ɛ m
p r ɛ g ʊ d ɪ t j ʊ m	p r aɪ j uː d ɪ k j ʊ m
a n ɛ k s ʊ m	a nː ɛ k s ʊ m
eː b uː r n ɛ ʊ m	ɛ b ʊ r n ɛu m
f ɛ t ɛ r ɛ	f eː t eː r ɛ
p ʊ ɛ r ɪ l ɪ t aː t ɛ m	p ʊ ɛ r iː l ɪ t a t ɛ m
f uː n ɛ s t ʊ m	f uː n ɛ s t ʊ m
k ɔ n t ɪ n w ʊ m	k ɔ n t ɪ n ʊː m
s p uː t aː r ɛ	s p uː t aː r ɛ
p uː lː uː l aː r ɛ	p ʊ lː ʊ l aː r ɛ
ɪ n s p ɛ k s k j oː n aː r ɛ	iː n s p ɛ k t aː r ɛ
j ʊ ŋ g ɛu m r ɛ	j ʊ ŋ g ɛ r ɛ
m a r ɪ t aː r ɛ	m a r iː t aː r ɛ
uː ŋ n d aː r ɛ	ʊ n d aː r ɛ
s kʰ ɪ k uː t a m	k ɪ k uː t a m
a rː aː m	a rː h a m
w j ɔ ʊ l aː r ɛ	w ɪ ɔ l aː r ɛ
f ɔ r ɛ aː r ɛ	f ɔ r aː r ɛ
f ɛ rː aː r ʊ m	f ɛ rː aː r j ʊ m
k a w ɪ lː aː r ɛ	k a w ɪ lː aː r iː
s ɛ n d aː r ɛ r ɛ	s ɛ d eː r ɛ
d ɛ t ɛ r m ɪ n aː r ɛ	d eː t ɛ r m ɪ n aː r ɛ
ɪ rː ɔ g a r ɛ	ɪ rː ɔ g aː r ɛ
k a n t aː r ɛ	k a n t aː r ɛ
a b ɪ l ɛ	h a b ɪ l ɛ m
m ɔ d ɛ r aː r ɛ	m ɔ d ɛ r aː r iː
s ɛ rː aː r ɛ	s ɛ rː aː r ɛ
f a m uː l ʊ m	f a m ʊ l ʊ m
k j ɛ r w a m	k ɛ r w a m
s ɛ p ʊ l aː r ɛ	s ɛ p ɛ l iː r ɛ
ɪ m b ɛ r b ɛ m	ɪ m b ɛ r b ɛ m
r ʊ ʊ m	r ʊ b ʊ m
ɪ n w ɪ t aː r ɛ	ɪ n w iː t aː r ɛ
ɪ m b ʊ ɪ r ɛ	ɪ m b ʊ ɛ r ɛ
