ɪ n s uː l s ʊ m	iː n s ʊ l s ʊ m
k ɔ p ʊ l aː r ɛ	k oː p ʊ l aː r ɛ
p ɔ s t ʊ l aː t j oː n ɛ m	p ɔ s t ʊ l aː t j oː n ɛ m
p ɛ n ɛ t r aː r ɛ	p ɛ n ɛ t r aː r ɛ
w ɪ t r ʊ m	w ɪ t r ʊ m
a dː iː k k j oː n ɛ	a dː ɪ k t j oː n ɛ m
t uː n d aː r ɛ	t ʊ n d ɛ r ɛ
w iː d uː ɪ t ɛ m	w ɪ d ʊ ɪ t aː t ɛ m
ɪ n t r ɪ n t ɛ k ʊ m	ɪ n t r iː n s ɛ k ʊ m
ɪ n k ʊ rː ɛ r ɛ	ɪ ŋ k ʊ rː ɛ r ɛ
ɪ n f a n d ʊ m	iː n f a n d ʊ m
ɛ t ʊ m	eː t ʊ m
k r iː b ʊ m	k r iː b r ʊ m
k a l a m ʊ m	k a l a m ʊ m
d eː s w aː n ɛ iː r ɛ m	eː w aː n eː s k ɛ r ɛ
m ʊ l t ɪ p l ɪ k aː t j oː n ɛ m	m ʊ l t ɪ p l ɪ k aː t j oː n ɛ m
a d k aː m aː n t ɛ m	a d a m a n t ɛ m
h ɔ m b r a m	ʊ m b r a m
ɪ n s ɪ ŋ n j a m	iː n s ɪ ŋ n ɛ
a fː aː s k ɪ n aː r ɛ	f a s k ɪ n aː r ɛ
t r k ʊ w r ʊ m	t uː b ɛ r
f a t ɪ g aː r ɛ	f a t iː g aː r ɛ
s uː m ɪ r ɛ	s uː m ɛ r ɛ
r ɛ k ɛ t a m	r ɛ k ɛ p t a m
p ɛ r s eː k ɪ r ɛ	p ɛ r s ɛ kʷ iː
w ɛ n d ɪ ŋ aː t oː r ɛ m	w ɪ n d ɪ k aː t oː r ɛ m
m uː g ɪ t ʊ m	m uː g iː t ʊ m
k ɔ n m ʊ t aː r ɛ	k ɔ mː uː t aː r ɛ
s t r ɪ ŋ g ɛ r ɛ	s t r ɪ ŋ g ɛ r ɛ
eː l iː m ɪ n aː t j oː n ɛ m	eː l ɪ m ɪ n aː t j oː n ɛ m
r ɪ s ɛ n aː r ɛ	r ɛ s ɪ ŋ n aː r ɛ
m a n s ʊ eː t uː j d n n ɛ m	m aː n s ʊ eː t uː d ɪ n ɛ m
a p r ɪ r ɛ	a p ɛ r iː r ɛ
l a b p ɛ t ɛ m	l a p ɪ d ɛ m
ɪ n d ɪ g ɛ n t a m	ɪ n d ɪ g ɛ n t j a m
f eː r uː l a m	f ɛ r ʊ l a m
n ɛ n j a m	n eː n j a m
m a r ɪ s k a m	m a r ɪ s k a m
d eː t ɛ r m ɪ n aː r ɛ	d eː t ɛ r m ɪ n aː r ɛ
g ɛ n j ɪ aː l ɛ	g ɛ n j aː l ɛ m
t a r d ɪ m ʊ m	t a r d ʊ m
ɔ b l ɪ g aː r ɛ	ɔ b l ɪ g aː r ɛ
ɪ m p ɛ r ɛ	ɪ m p a r ɛ m
g eː n t ɪ l iː t aː t ɛ m	g ɛ n t iː l ɪ t aː t ɛ m
k ɔ n k ɔ r d j a m	k ɔ ŋ k ɔ r d j a m
w ɛ r s ɪ pʰ ɪ k aː r ɛ	w ɛ r s ɪ f ɪ k aː r ɛ
l ɔ ŋ g ɛ w ʊ m	l ɔ ŋ g aɪ w ʊ m
p ɛ d ɪ k a m	p ɛ d ɪ k a m
s ɔ l ɛ r ɛ	s ɔ l eː r ɛ
k r ɛ m a m	k r aː m ʊ m
a k ɛ r b iː t aː t ɛ m	a k ɛ r b ɪ t aː t ɛ m
t ʊ rː n ɛ m	t ʊ rː ɛ m
a n ɪ k ɪ l aː r ɛ	a nː ɪ h ɪ l aː r ɛ
a m p l ɪ f ɪ k aː r ɛ	a m p l ɪ f ɪ k aː r ɛ
n uː t r ɪ k aː r ɛ	n uː t r iː k aː r ɛ
a b aː l ɪ ɛ n aː r ɛ	a b a l ɪ eː n aː r ɛ
r iː k s a m	r ɪ k s a m
s ɪ b l w aː r ɛ	s iː b ɪ l aː r ɛ
p a r ɪ eː t aː l ɛ	p a r ɪ ɛ t aː l ɛ m
k ɔ n s oː l iː d aː t j ʊ n ɛ m	k oː n s ɔ l ɪ d aː t j oː n ɛ m
s iː l ɪ k j ʊ m	s ɪ l ɪ k j ʊ m
s ɛ n s ʊ aː l ɪ t aː t ɛ m	s ɛ n s w aː l ɪ t aː t ɛ m
m ɛ r g ɛ r ɛ	m ɛ r g ɛ r ɛ
kʰ aː k aː r ɛ m	k a p t j aː r ɛ
a rː aː m	a rː h a m
m uː l t aː r ɛ m	m ʊ l t aː r ɛ
k a l ɪ g a m	k a l ɪ g a m
eː k s p l aː n aː r ɛ	ɛ k s p l aː n aː r ɛ
a n uː lː aː r ɛ	a nː uː lː aː r ɛ
ɛ rː aː r ɛ	ɛ rː aː r ɛ
k ɔ w aː r ɛ	k ʊ b aː r ɛ
ɛ r ɛ m ʊ m	h ɛ r eː m ʊ m
r ɛ l a k s aː r ɛ	r ɛ l a k s aː r ɛ
p ɛ s t ɛ m	p ɛ s t ɛ m
p r w w ɛ r r n ʊ m	w eː r
a l iː t ʊ m	h aː l ɪ t ʊ m
l aʊ r ɛ t ʊ m	l aʊ r ɛ aː t ʊ m
p r oː f eː t j a m	p r ɔ pʰ eː t iː a m
f ɛ k ʊ l ɛ n t ʊ m	f aɪ k ʊ l ɛ n t ʊ m
d uː ɛ k ɛ n t ʊ m	d ʊ k ɛ n t oː s
l ɛ n a d oː r ɛ	l ɪ ŋ n aː t oː r ɛ m
k ɔ n t ɛ n t j oː s ʊ m	k ɔ n t ɛ n t j oː s ʊ m
ɔ pː r ɪ mː ɛ r ɛ	ɔ pː r ɪ m ɛ r ɛ
t r aː n s k r ɪ w ɛ r ɛ	t r aː n s k r iː b ɛ r ɛ
m a k ɛ lː aː j ʊ m	m a k ɛ lː aː r j ʊ m
w ɔ l aː	w ɪ ɔ l a m
p ɛ n uː r j a m	p eː n uː r j a m
w ɛ r b aː l ɛ	w ɛ r b aː l ɛ m
a m aː t ɔ r j ʊ m	a m aː t oː r j ʊ m
f ɪ r m ɛ m	f ɪ r m ʊ m
s ɔ n rː eː d ɪ r ɛ	s ʊ b r iː d eː r ɛ
s t ɪ r p ɛ m	s t ɪ r p ɛ m
p ɔ s p oː n ɛ r ɛ	p ɔ s t p oː n ɛ r ɛ
p r aɪ ɔ k ʊ p aː r ɛ	p r aɪ ɔ kː ʊ p aː r ɛ
b a s ɪ l ɪ k ʊ m	b a s ɪ l ɪ k ʊ m
a kː r ɪ t a t ɛ	aː k r ɪ t aː t ɛ m
a s k ɛ n d ɛ r ɛ	a s k ɛ n d ɛ r ɛ
m ɔ r d aː k ɛ	m ɔ r d aː k ɛ m
h m ɔ ɔ w eː r ɛ	eː m ɔ w eː r ɛ
f ɔ lː ɪ k ɪ l ʊ m	f ɔ lː ɪ k ʊ l ʊ m
d iː m ɪ t ɛ r ɛ	d iː m ɪ tː ɛ r ɛ
m a t ɛ r n ʊ m	m aː t ɛ r n ʊ m
l aʊ r ɪ r ʊ m	l aʊ r ʊ m
k a d uː k ʊ m	k a d uː k ʊ m
s uː k k j n aː r ɛ	s uː g ɛ r ɛ
s ɛ n aː t ʊ m	s ɛ n aː t ʊ m
a l t aː r ɛ	a l t a r ɛ m
f ɪ n k ʊ j ʊ m	f eː n ʊ k ʊ l ʊ m
l a r w a m	l aː r w a m
l iː ɪ t aː r ɛ	l iː m ɪ t aː r ɛ
k r ɔ t aː l ʊ m	k r ɔ t a l ʊ m
s uː b ʊ g aː r ɛ	s ʊ b j ʊ g aː r ɛ
f r eː m ɪ t ʊ m	f r ɛ m ɪ t ʊ m
ɪ n w ɔ l w ɛ r ɛ	ɪ n w ɔ l w ɛ r ɛ
s a l k ɪ r ɛ m	s a l ɪ k ɛ m
s p ɛ k ʊ l aː t ɪ w ʊ m	s p ɛ k ʊ l aː t iː w ʊ m
p ɔ r t aː b ɪ r ɛ	p ɔ r t aː b ɪ l ɛ m
r ɛ s ɔ n aː r ɛ	r ɛ s ɔ n aː r ɛ
p ɛ r g ʊ l ɛ m	p ɛ r g ʊ l a m
a sː iː s ʊ m	a sː ɛ sː ʊ m
k iː d a m	k iː d a m
r ɛ k ɔ rː eː r ɛ	r ɛ k ʊ rː ɛ r ɛ
uː n iː k ʊ m	uː n ɪ k ʊ m
k ɔ n k ɪ n iː t aː t ɛ m	k ɔ ŋ k ɪ nː ɪ t aː t ɛ m
b ɛ l ɪ k ʊ m	b ɛ lː ɪ k ʊ m
k r uː ɛ n t ʊ m	k r ʊ ɛ n t ʊ m
f r uː k t oː s ʊ m	f r ʊ k t ʊ oː s ʊ m
t r aː b aː l	t r a b aː l ɛ m
a w ɛ s t r uː t j ʊ m	s t r uː tʰ j oː n ɛ m
b a s ɪ l ɪ s k ʊ m	b a s ɪ l ɪ s k ʊ m
m ɔ n ɛ t aː	m ɔ n eː t a m
m ɛ n d ɪ k aː r ɛ	m ɛ n d iː k aː r ɛ
k iː m iː kʷ ɛ m	k iː m ɪ k ɛ m
a pː r ɔ k aː r ɛ	a pː r ɔ p j aː r ɛ
s a l w aː r ɛ	s a l w aː r ɛ
aʊ d ʊ n aː r ɛ	a d uː n aː r ɛ
k ɛ r k ɪ n ɛ ʊ m	k ɪ r k ɪ n ʊ m
s a l t aː t j ʊ n ɛ m	s a l t aː t j oː n ɛ m
l a t ɪ f ʊ n d j ʊ m	l aː t ɪ f ʊ n d j ʊ m
w ɛ r m eː l j ʊ m	w ɛ r m ɪ k ʊ l ʊ m
ɛ s ʊ g aː r ɛ	ɛ k sː uː k aː r ɛ
s ʊ s p ɛ n d ɛ r ɛ	s ʊ s p ɛ n d ɛ r ɛ
k ɔ n t r ɪ t j oː n ɛ m	k ɔ n t r iː t j oː n ɛ m
s ɔ l t ʊ m	s ɔ l uː t ʊ m
ɪ n t ɛ ɪ r ɛ	ɪ n t ʊ eː r iː
j ʊ w ɛ n k ʊ m	j ʊ w ɛ ŋ k ʊ m
f ɔ r n aː t ɛ m	f ɔ r n aː k ɛ m
l uː k ɛ r n a m	l ʊ k ɛ r n a m
ɛ n k a n ɪ t ɛ r ɛ	ɪ ŋ k aː n eː s k ɛ r ɛ
a l ɔ s a m	a l aʊ s a m
l uː k j d ʊ m	l uː k ɪ d ʊ m
a d ʊ m b r aː r ɛ	a d ʊ m b r aː r ɛ
r ɔ s t r ʊ m	r oː s t r ʊ m
a m ɛ r ɪ t aː r ɛ	m ɛ r iː d j aː r ɛ
a p l ʊ m	a m p l ʊ m
p a r t ɪ k ʊ l a m	p a r t ɪ k ʊ l a m
d eː f ɛ r ɪ r ɛ	d eː f ɛ rː ɛ
k uː r w aː r ɛ	k ʊ r w aː r ɛ
s uː k p t ʊ m	s uː m p t ʊ m
l a k uː s t r ɛ m	l a k ʊ s t r ɛ m
a n t r ʊ m	a n t r ʊ m
uː r b ɛ m	ʊ r b ɛ m
w ɪ t ɛ r ɛ m	w ɛ t ɛ r ɛ m
k ɔ r w ɪ n ʊ m	k ɔ r w iː n ʊ m
w ɛ r s ɪ k ʊ l ʊ m	w ɛ r s ɪ k ʊ l ʊ m
s ʊ p ɛ r ɛ p ʊ n ɛ r ɛ	s ʊ p ɛ r p oː n ɛ r ɛ
ɛ n s ɛ m	eː n s ɛ m
s a k r ɪ f iː k aː t oː r ɛ m	s a k r ɪ f ɪ k aː t oː r ɛ m
d eː k ɔ r aː r ɛ	d ɛ k ɔ r aː r ɛ
b a j l ʊ m	b aː j ʊ l ʊ m
t r iː g ɛ s iː m ʊ m	t r iː g eː s ɪ m ʊ m
a b s t r ʊ s ʊ m	a b s t r uː s ʊ m
ɔ l iː g aː r k a m	ɔ l ɪ g a r kʰ a m
r iː p a m	r iː p a m
eː k s p ʊ ŋ n aː r ɛ	ɛ k s p ʊ ŋ n aː r ɛ
ɔ r n aː r ɛ m	oː r n aː r ɛ
r aː z ɔ n aː b ɪ l ɛ m	r a t j oː n aː b ɪ l ɛ m
d eː ɪ ɛ n eː r aː r ɛ	d eː g ɛ n ɛ r aː r ɛ
n a t aː t ɔ r j ʊ m	n a t aː t oː r j ʊ m
p r eː k aː r ɛ	p r ɛ t j aː r ɛ
a g iː l ɪ t aː t ɛ m	a g ɪ l ɪ t aː t ɛ m
s ʊ mː ɪ n ɪ s t r aː r ɛ	s ʊ b m ɪ n ɪ s t r aː r ɛ
ɪ n ʊ m	iː n ʊ m
l ɛ g aː t ʊ m	l eː g aː t ʊ m
a s aː r ʊ m	a s a r ʊ m
k ʊ n aː r ɛ	k ʊ n ɛ aː r ɛ
a l ɔ k aː r ɛ	a lː ɔ k aː r ɛ
t r a k j ʊ m	tʰ r aː k j ʊ m
r uː b iː g ɪ n oː s ʊ m	r oː b iː g ɪ n oː s ʊ m
a fː j a n t aː r ɛ	a fː ɪ d ɛ n t j aː r ɛ
n ɛ g ɔ k j aː t j oː n ɛ m	n ɛ g oː t j aː t j oː n ɛ m
d a t a m	d a t a
ɛ k s ɛ k r aː r ɛ	ɛ k sː ɛ k r aː r iː
m a t aː s a m	m a t a k s a m
f uː g aː k ɛ	f ʊ g aː k ɛ m
s a l ʊ t aː r ɛ	s a l uː t aː r ɛ
a b aɪ w l a m	a p ɪ k ʊ l a m
g a l ɛ n a m	g a l eː n a m
t ɔ r k ɛ r ɛ	t ɔ r kʷ eː r ɛ
f l aː m eː lː g ʊ m	f a m eː l ɪ k ʊ m
w ɛ r t ɪ g ɛ n ɛ	w ɛ r t iː g ɪ n ɛ m
k iː t ɛ r j oː r ɛ	k ɪ t ɛ r j oː r ɛ m
d iː s t r aː ɛ r ɛ	d ɪ s t r a h ɛ r ɛ
k ɔ r j a n d ʊ r ʊ m	k ɔ r j a n d r ʊ m
m eː n t ʊ m	m ɛ n t ʊ m
b ɔ m b aː r d a m	b ɔ m b a r d a m
k a p r ɪ n ʊ m	k a p r iː n ʊ m
n eː s k j ʊ m	n ɛ s k j ʊ m
ɛ k k s t iː ŋ gʷ ɛ r ɛ	ɛ k s t ɪ ŋ gʷ ɛ r ɛ
f r uː s t a m	f r ʊ s t a m
s t uː d j aː r ɛ	s t ʊ d eː r ɛ
k a p t aː r ɛ	k a p t aː r ɛ
w ɪ t ɛ lː ʊ m	w ɪ t ɛ lː ʊ m
k ɛ l j n t ɛ m	k a l ɛ n t ɛ m
k ɔ m p ɛ t ɛ n t j a m	k ɔ m p ɛ t ɛ n t j a m
k a b n ʊ t ʊ m	k aː n uː t ʊ m
r eː t oː r ɛ	r h eː t ɔ r ɛ m
d ɛ n t aː t ʊ m	d ɛ n t aː t ʊ m
aɪ b aː n ʊ m	h ɛ b ɛ n ʊ m
k ʊ l t ɛ lː ʊ m	k ʊ l t ɛ lː ʊ m
a pː aː r aː r ɛ	a pː a r aː r ɛ
p a l p ɛ b r aː l	p a l p ɛ b r aː l ɛ m
h f ɪ r ɛ l ʊ m	f iː l ɪ ɔ l ʊ m
d eː s ɪ s t ɛ r ɛ	d eː s ɪ s t ɛ r ɛ
a m ʊ r k j a m	a m ʊ r k a m
ɛ k s aː k t j oː n ɛ m	ɛ k s aː k t j oː n ɛ m
k uː r ɛ t ʊ r a m	k uː r aː t uː r a m
s uː b ɔ r n aː r ɛ	s ʊ b oː r n aː r ɛ
k a l k ɛ n ʊ m	k a l k aː n ɛu m
f a k t oː r ɛ m	f a k t oː r ɛ m
p r ɔ p r j ʊ m	p r oː p r j ʊ m
f uː n ɪ k ʊ l ʊ m	f uː n ɪ k ʊ l ʊ m
t ɛu l j aː m	t eː g ʊ l a m
a pː ɛ n d eː r ɛ	a pː ɛ n d ɛ r ɛ
a n g ɛ l ɪ k ʊ m	a ŋ g ɛ l ɪ k ʊ m
k a n aː n ɛ	k a n ɔ n ɛ m
n ɔ m ɪ n aː t j oː n ɛ m	n oː m ɪ n aː t j oː n ɛ m
m uː n ɪ f ɪ k ʊ m	m uː n ɪ f ɪ k ʊ m
d ɛ m oː r aː r ɛ	d eː m ɔ r aː r iː
k uː k ɪ n aː r ɛ	k ɔ kʷ iː n aː r ɛ
l ɛ n aː r ɛ	l ɪ ŋ n aː r iː
g ɔ k ʊ n d iː t aː t ɛ m	j uː k ʊ n d ɪ t aː t ɛ m
p ɔ p ɛ r t aː t ɛ m	p aʊ p ɛ r t aː t ɛ m
ɪ n w ɛ n t r ɪ k ɛ	ɪ n w ɛ n t r iː k ɛ m
k ɔ m ɪ t j ʊ m	k ɔ m ɪ t j ʊ m
s ɔ n ʊ	s ɔ m n ʊ m
m iː k a m	m iː k a m
d ɛ s k r ʊ w ɛ r ɛ	d eː s k r iː b ɛ r ɛ
p r a k t ɪ k ʊ m	p r a k t ɪ k ʊ m
w a n r ɛ	w a nː ʊ m
s uː p uː t aː r ɛ	s ʊ pː ʊ t aː r ɛ
l a m ɪ n t ʊ m	l aː m ɛ n t ʊ m
b a r a t r ʊ m	b a r a tʰ r ʊ m
g uː s t ɪ f iː k aː t oː r ɛ m	j uː s t ɪ f ɪ k aː t oː r ɛ m
ɔ n uː s t ʊ m	ɔ n ʊ s t ʊ m
k ɔ s t aː t ʊ m	k ɔ s t aː t ʊ m
ɪ n oː w aː t j oː n ɛ m	ɪ nː ɔ w aː t j oː n ɛ m
k r iː m ɪ n ɛ m	k r iː m ɛ n
t uː	t uː
r eː t ɪ n aː k ʊ l ʊ m	r ɛ t ɪ n aː k ʊ l ʊ m
t ɛ rː ɛ n ʊ m	t ɛ rː eː n ʊ m
p oː ɛ k oː m	p aʊ k ʊ m
p ɛ r t ʊ r b aː r ɛ	p ɛ r t ʊ r b aː r ɛ
b eː n ɛ f aː t r ɛ	b ɛ n ɛ f a k ɛ r ɛ
f a w oː r ɛ m	f a w oː r ɛ m
l ɔ r ɪ k a m	l oː r iː k a m
t ɛ s t ʊ d n ɛ m	t ɛ s t uː d ɪ n ɛ m
ɪ m p ɛ lː ɛ r ɛ	ɪ m p ɛ lː ɛ r ɛ
d ɔ l ʊ r oː s ʊ m	d ɔ l oː r oː s ʊ m
a ŋ g ʊ s t aː r ɛ	a ŋ g ʊ s t aː r ɛ
f uː r t ɪ w ʊ m	f uː r t iː w ʊ m
l eː ŋ g ʊ l a m	l ɪ ŋ g ʊ l a m
m ɪ s t ʊ r a m	m ɪ s t uː r a m
w ɛ r aː k ɛ	w eː r aː k ɛ m
ɪ n k oː l ʊ m ɛ m	ɪ ŋ k ɔ l ʊ m ɛ m
d ɔ r m ɪ t aː r ɛ	d ɔ r m iː t aː r ɛ
k ɔ lː ʊ m	k ɔ lː ʊ m
d iː s ɪ m ʊ l aː t j oː n ɛ m	d ɪ sː ɪ m ʊ l aː t j oː n ɛ m
a w eː n ɪ r ɛ m	a d w ɛ n iː r ɛ
a k sː ɛ m	a k s ɛ m
aɪ s t ɪ j ʊ m	aɪ s t aː t ɛ m
b ɔ rː aː g ɪ n ɛ	b ɔ r aː g ɪ n ɛ m
a oː l ʊ m	a w ʊ l ʊ m
a p ɛ l ɪ t aː r ɛ	a pː ɛ lː ɪ t aː r ɛ
uː s ɛ r ʊ m	ɔ s t j aː r j ʊ m
b ɛ t ʊ l a m	b ɛ t ʊ l a m
a sː ʊ p t j oː n ɛ m	a sː uː m p t j oː n ɛ m
m uː n ɪ k ɪ p aː l ɛ	m uː n ɪ k ɪ p aː l ɛ m
p r oː l ɛ t aː r j aː t ʊ m	p r oː l eː t aː r j ʊ m
d iː s k r eː p aː r ɛ	d ɪ s k r ɛ p aː r ɛ
f a w a m	f a b a m
a rː oː g aː r ɛ m	a rː ɔ g aː r ɛ
ɪ ŋ g r aː t ʊ m	ɪ ŋ g r aː t ʊ m
t eː m p ɛ r aː r ɛ	t ɛ m p ɛ r aː r ɛ
n uː d ɪ r ɛ m	n ɔ k eː r ɛ
t oː s oː n ɛ m	t oː n s j oː n ɛ m
k ɔ ŋ gʷ r ʊ m	k ɔ ŋ g r ʊː m
f uː l m ɪ n aː r ɛ	f ʊ l m ɪ n aː r ɛ
eː r aɪ d ŋ aː t ɛ m	h eː r eː d ɪ t aː t ɛ m
d ɛ s t ɪ t ʊ ɛ r ɛ m	d eː s t ɪ t ʊ ɛ r ɛ
k ɛ s a t j oː n ɛ m	k ɛ sː aː t j oː n ɛ m
ɪ n t ɪ m aː t j oː n ɛ m	ɪ n t ɪ m aː t j oː n ɛ m
s ɔ l aː r ɛ	s oː l aː r ɛ m
f ɛ s t ɪ w ʊ m	f ɛ s t iː w ʊ m
s eː n s ʊ m	s eː n s ʊ m
ɛ r ɛ m ʊ m	ɛ r eː m ʊ m
ɛ s t r ɛ n a m	s t r eː n a m
s ʊ b s t a n t j a m	s ʊ b s t a n t j a m
a l aː b a s t r ʊ m	a l a b a s t r ʊ m
ɛ b aɪ t ɛ m	h ɛ b ɛ t ɛ m
ɔ b w j aː r ɛ	ɔ b w j aː r ɛ
k ɔ sː t ʊ m	k ɔ ɪ t ʊ m
s ɛ p aː r aː r ɛ	s eː p a r aː r ɛ
p r oː d ɪ g aː r ɛ	p r oː d ɪ g ɛ r ɛ
p ɛ r d ɛ r ɛ	p ɛ r d ɛ r ɛ
m ɛ r ɪ d j oː n aː l ɛ	m ɛ r iː d j oː n aː l ɛ m
l uː b r ɪ k ʊ m	l uː b r ɪ k ʊ m
k a s t r aː t ʊ m	k a s t r aː t ʊ m
a n ʊ n k aː r ɛ	a nː uː n t j aː r ɛ
a l t ɪ s ɪ m ʊ m	a l t ɪ sː ɪ m ʊ m
s ɔ l a m	s ɔ l ɛ a m
w ɔ t ʊ m	w oː t ʊ m
d iː r ɪ m ɛ r ɛ	d ɪ r ɪ m ɛ r ɛ
l a t r aː r ɛ m	l a t r oː n ɛ m
ɛ k s ɪ g ʊ m	ɛ k s ɪ gʷ ʊ m
kʷ a l ɪ t aː t ɛ m	kʷ aː l ɪ t aː t ɛ m
w ɔ g aː r ɛ	w ɔ k aː r ɛ
l uː k uː b r aː t j oː n ɛ m	l uː k ʊ b r aː t j oː n ɛ m
ɔ sː a r j ʊ m	ɔ sː aː r j ʊ m
n a w iː k ɛ lː a m	n aː w ɪ k ɛ lː a m
b a p t ɪ s t ɛ r j ʊ m	b a p t ɪ s t eː r j ʊ m
a k k ɛ d ɛ r ɛ	a kː eː d ɛ r ɛ
j uː r a m ɛ n t ʊ m	j uː r aː m ɛ n t ʊ m
s k oː t j a m	s k ɔ t j a m
eː l ɛ w aː r ɛ	eː l ɛ w aː r ɛ
l a r g ʊ m	l a r g ʊ m
f eː t oː r ɛ	f eː t oː r ɛ m
w ɛ t r ɪ kʷ ɛ m	w iː t ɪ k ɛ m
p l ɛ n ɪ t ɛ m	p l eː n ɪ t aː t ɛ m
k a l aː r ɛ	kʰ a l aː r ɛ
uː s uː r aː r j ʊ m	uː s uː r aː r j ʊ m
j ɔ j ʊ m	l ɔ l j ʊ m
eː l uː ɛ r ɛ	eː l ʊ ɛ r ɛ
p r ɛ s t aː r ɛ	p r aɪ s t aː r ɛ
s t ɪ p ʊ l aː r ɛ	s t ɪ p ʊ l aː r iː
b r aː k aː	b r aː k a m
eː s ɛ k aː r ɛ	ɛ k sː ɪ kː aː r ɛ
m a r t ɪ r ɛ	m a r t y r ɛ m
r iː t ʊ m	r iː t ʊ m
f ɔ m ɪ n t ʊ m	f oː m ɛ n t ʊ m
k ɔ n s ʊ l t aː t j oː n ɛ m	k oː n s ʊ l t aː t j oː n ɛ m
g uː d eː ʊ m	j uː d aɪ ʊ m
k ɔ n s ɛ r w aː t j oː n ɛ m	k oː n s ɛ r w aː t j oː n ɛ m
k ɛ r b a m	k ɛ r w a m
ɪ n k eː r ɛ r ɛ	ɪ ŋ kʷ iː r ɛ r ɛ
m a l ɛ d ɪ k ɛ r ɛ	m a l ɛ d iː k ɛ r ɛ
a pː r ɛ n s j oː n ɛ m	a pː r ɛ h ɛ n s j oː n ɛ m
aɪ r k ɛ r ɛ	eː r ɪ g ɛ r ɛ
t r aː n k ʊ b s t a n t j aː r ɛ	t r aː n s ʊ b s t a n t j aː r ɛ
n ɔ b ɪ l ʊ n j ʊ m	n ɔ w ɪ l uː n j ʊ m
ɔ s p ɪ k j ʊ m	h ɔ s p ɪ t j ʊ m
k uː l a m	k uː n a m
k iː r k ʊ n pʰ l uː ɪ r ɛ m	k ɪ r k ʊ m f l ʊ ɛ r ɛ
ɔ eː n ɪ s ɛ n r ɛ m	ɔ m n ɪ s k ɪ ɛ n t ɛ m
p l ʊ m b aː r j ʊ m	p l ʊ m b aː r j ʊ m
ɛ s ʊ m	ɪ p s ʊ m
j uː j ɛ r ʊ m	j uː g ɛ r ʊ m
d iː s ɪ m ɪ l ɛ	d ɪ sː ɪ m ɪ l ɛ m
g r a w ɪ d ʊ m	g r a w ɪ d ʊ m
p r oː k ɛ l a m	p r ɔ k ɛ lː a m
t r aː n s f uː g a m	t r aː n s f ʊ g a m
s uː p ɛ r b ʊ m	s ʊ p ɛ r b ʊ m
s t ɔ r n ɪ n ʊ m	s t ʊ r n ʊ m
l ɔ n g ɪ t ʊ d ɪ n ɛ m	l ɔ ŋ g ɪ t uː d ɪ n ɛ m
k a t ɛ d r a m	k a tʰ ɛ d r a m
d ɪ ŋ n aː t j oː n ɛ m	d ɪ ŋ n aː t j oː n ɛ m
l a k aː r j ɛ m	l a sː aː r ɛ
d ɔ m ɛ s t ɪ k ʊ m	d ɔ m ɛ s t ɪ k ʊ m
r uː k ʊ m	r oː s k ɪ d ʊ m
r a p t aː r ɛ	r a p t aː r ɛ
p r iː w aː t ʊ m	p r iː w aː t ʊ m
p r ɛ m ɪ t j a m	p r iː m ɪ t j a m
r ɔ k d r ɪ k ʊ n ɛ m	r ɪ d ɪ k a m
k ɔ k ʊ l ʊ m	k ʊ k ʊ lː ʊ m
ɪ n iː t j ʊ m	ɪ n ɪ t j ʊ m
f uː l g iː r ɛ m	f ʊ l g eː r ɛ
a b ʊ m aː s ʊ m	a b ɔ m aː s ʊ m
b ʊ k iː n	b uː k ɪ n a m
k ɔ n k ʊ r s ʊ m	k ɔ ŋ k ʊ r s ʊ m
a p oː k aː l ɪ p s ɛ m	a p ɔ k a l y p s ɛ m
s t ɪ w aː r ɛ	s t iː p aː r ɛ
k ɔ l uː b r ɪ n ʊ m	k ɔ l ʊ b r iː n ʊ m
r ɛ p r ɛ n s ɪ b ɪ l ɛ m	r ɛ p r ɛ h ɛ n s ɪ b ɪ l ɛ m
ɔ r d ɪ n aː r j ʊ m	oː r d ɪ n aː r j ʊ m
r ɛ p r ɛ n s j oː n ɛ m	r ɛ p r ɛ h ɛ n s j oː n ɛ m
k ʊ l p a m	k ʊ l p a m
t a pː ɛ t ɛ m	t a p eː t ɛ m
k aː m ɪ n ʊ m	k a m iː n ʊ m
l ɔ k uː t oː r ɛ	l ɔ k uː t oː r ɛ m
g ɪ n ɛ s t aː	g ɛ n ɛ s t a m
b ɛ l j aː r j a m	b eː l w a m
r a m ʊ m	r aː m ʊ m
a k iː n ʊ m	a k ɪ n ʊ m
t ɔ p s ɛ k aː r ɛ	t ɔ k s ɪ k aː r ɛ
ɪ n f a n t j a m	iː n f a n t j a m
p r aɪ k ɛ d ɛ r ɛ	p r aɪ k eː d ɛ r ɛ
t ɛ n ɛ b r a m	t ɛ n ɛ b r a m
g ɔ n d ʊ m	g ɔ m pʰ ʊ m
k r uː ɛ n t aː r ɛ	k r ʊ ɛ n t aː r ɛ
k ɔ n t ɪ n w ʊ m	k ɔ n t ɪ n ʊː m
k ɔ l ɔ r aː r ɛ	k ɔ l oː r aː r ɛ
f ɪ d ɛ l ɛ	f ɪ d eː l ɛ m
f a b ɛ lː a m	f aː b ɛ lː a m
ɔ r eː g a n ʊ m	ɔ r iː g a n ʊ m
t ɔ r ʊ m	t ɔ r ʊ m
