d ɛ t ɛ r j ɔ r a t j oː n ɛ m	d eː t ɛ r j oː r aː t j oː n ɛ m
s ɔ m n ɪ f ɛ r ʊ m	s ɔ m n ɪ f ɛ r ʊ m
d ɛ k r ɛ t a l ɛ	d eː k r eː t aː l ɛ m
s a ŋ k t j oː n ɛ m	s aː ŋ k t j oː n ɛ m
ɔ p r ɪ m ɛ r ɛ	ɔ pː r ɪ m ɛ r ɛ
n ɛ s ɛ	n ɛ s k iː r ɛ
a kː a d ɛ m j a m	a k a d eː m iː a m
r ɛ t r a k t j oː n ɛ m	r ɛ t r a k t j oː n ɛ m
kʷ a l ɪ f ɪ k aː r ɛ	kʷ aː l ɪ f ɪ k aː r ɛ
t ɛ r s ʊ m	t ɛ r s ʊ m
f l aː g r aː r ɛ	f l a g r aː r ɛ
b l aː t a m	b l a tː a m
r aː p t ʊ m	r a p t ʊ m
p r ɔ d ɪ g j ɔ s k j ʊ m	p r oː d ɪ g j oː s ʊ m
p a k aː r ɛ	p aː k aː r ɛ
k ɛ l ɛ b r a t j ɔ n ɛ	k ɛ l ɛ b r aː t j oː n ɛ m
k ɔ r j aː k ɛ ʊ m	k ɔ r j a k ɛu m
t uː r p ɪ t uː d ɪ n ɛ	t ʊ r p ɪ t uː d ɪ n ɛ m
j uː r a m ɛ n t ʊ m	j uː r aː m ɛ n t ʊ m
k ɔ n t ɛ n d ɛ r ɛ	k ɔ n t ɛ n d ɛ r ɛ
d ɪ w uː l g a t j oː n ɛ m	d iː w ʊ l g aː t j oː n ɛ m
p r ɔ w ɔ k a t ɪ w ʊ m	p r oː w ɔ k aː t iː w ʊ m
a m b ɪ t ʊ m	a m b iː t ʊ m
s k a l j aː r ɛ m	s k aː l aː r ɛ m
a d uː l aː r ɛ	a d uː l aː r iː
m uː r ɪ k ɛ m	m uː r ɪ k ɛ m
a k ɛ d ɛ r ɛ	a kː eː d ɛ r ɛ
w ɔ g aː r ɛ	w ɔ k aː r ɛ
s ɪ t j ʊ m	s ɪ t ʊ m
s ɪ r a m	s eː r ʊ m
ɛ r ɪ m a n d aː d ɛ m	g ɛ r m aː n ɪ t aː t ɛ m
b l a t ɛ r aː r ɛ	b l a t ɛ r aː r ɛ
p ɛ r p ɛ t r aː r ɛ	p ɛ r p ɛ t r aː r ɛ
ɪ m n ʊ m	h y m n ʊ m
s ʊ l k aː r ɛ	s ʊ l k aː r ɛ
k ɔ n d n a t j oː n ɛ m	k ɔ n d ɛ m n aː t j oː n ɛ m
ʊ n ɪ k ʊ m	uː n ɪ k ʊ m
m ɛ s k ɛ r ɛ m	m ɪ s k eː r ɛ
m a t aː s a m	m a t a k s a m
t r ɪ n ɪ s aː t ɛ m	t r iː n ɪ t aː t ɛ m
h ɛ s p eː t ɛ m	h ɔ s p ɪ t ɛ m
j aː s p ɪ d ɛ m	j a s p ɪ d ɛ m
a m s k ɔ n d ɛ r ɛ	a b s k ɔ n d ɛ r ɛ
k iː n d ɛ l a	k a n d eː l a m
ɪ n k ɔ lː uː m ɛ m	ɪ ŋ k ɔ l ʊ m ɛ m
f ɪ r ɛ m	f ɪ ɛ r iː
p uː l w ɪ n a r ɛ	p ʊ l w iː n a r
a k ɛ t aː b ʊ l ʊ m	a k eː t aː b ʊ l ʊ m
aʊ s p ɛ d aː r ɛ	h ɔ s p ɪ t aː r iː
d ɛ k ɛ d ɛ r ɛ	d eː k eː d ɛ r ɛ
s p ɛ l ʊ n k a m	s p eː l ʊ ŋ k a m
eː m ɛ t ɛ r ɛ	eː m ɪ tː ɛ r ɛ
a rː ɔ g aː r ɛ	a rː ɔ g aː r ɛ
ɪ n f ɪ r m r ɛ	iː n f ɪ r m aː r ɛ
s a n a b ɪ l ɛ m	s aː n aː b ɪ l ɛ m
p aː d r ɛ m	p a t r ɛ m
l a k t aː r ɛ	l a k t aː r ɛ
f ɛ s t ɪ n a r ɛ	f ɛ s t iː n aː r ɛ
p a l uː d ɛ m	p a l uː d ɛ m
k l a r ɪ t aː t ɛ m	k l aː r ɪ t aː t ɛ m
t ɛ k s t uː r a m	t ɛ k s t uː r a m
k r oː s t aː r ɛ	k r ʊ s t aː r ɛ
a lː ɔ ŋ g aː r ɛ	eː l ɔ ŋ g aː r ɛ
d ɛ n ʊ n k t j a s j ʊ m	d eː n ʊ n t j aː t j oː n ɛ m
s ʊ m p t ʊ m	s uː m p t ʊ m
p j ɛ r ɪ n a m	p ɛ r n a m
f aː m a m	f aː m a m
f j ɛ r ʊ m	f ɛ r ʊ m
k a s t r aː t ʊ m	k a s t r aː t ʊ m
ɪ n t ɛ g r ʊ m	ɪ n t ɛ g r ʊ m
ɪ n k ɛ n d j ʊ m	ɪ ŋ k ɛ n d j ʊ m
k ɪ r k ʊ l aː r ɛ	k ɪ r k ʊ l aː r ɛ m
k ɛ r w ɪ s a m	k ɛ r w ɛ s j a m
r ɛ kː a t aː r ɛ	r ɛ k a p t j aː r ɛ
d ɛ b ɪ lː ɪ t aː r ɛ	d eː b ɪ l ɪ t aː r ɛ
p ɛ l aː m b ɔ lː aː r ɛ	p ɛ r a m b ʊ l aː r ɛ
k ɔ n t uː m aː k ɛ	k ɔ n t ʊ m aː k ɛ m
ɪ n s ɛ ŋ n j aː r ɛ	iː n s ɪ ŋ n aː r ɛ
n aː s ʊ m	n aː s ʊ m
k r ɪ m ɪ n ɔ s ʊ m	k r iː m ɪ n oː s ʊ m
j gː aː n t s a gː ʊ m	z ɪ n z a l a m
f aː ɪ n a m	f aː g ɪ n ʊ m
n ʊ d iː a m	n oː d aː r ɛ
d ɪ m a n aː r ɛ	d iː m aː n aː r ɛ
a k eː b ʊ l ɛ ʊ m	a kʷ ɪ f ɔ l j ʊ m
s p ɛ k ʊ j ʊ m	s p ɛ k l ʊ m
r uː g iː r ɛ	r uː g iː r ɛ
k r ɪ t ɛ r j ʊ m	k r ɪ t ɛ r ɪ ɔ n
d ɛ n ɔ m ɪ n a t j oː n ɛ m	d eː n oː m ɪ n aː t j oː n ɛ m
n uː t aː r ɛ	n uː t aː r ɛ
k ɔ sː ʊ m	k ɔ sː ʊ m
f ɛ s t ʊ m	f eː s t ʊ m
b l ɪ k ɛ m ɛ	b l a s pʰ eː m aː r ɛ
r ɛ f ɔ r m a t j oː n ɛ	r ɛ f ɔ r m aː t j oː n ɛ m
t r ɪ f oː l ʊ m	t r ɪ f ɔ l j ʊ m
a d ɔ r ɪ m ɛ t ɛ r ɛ	a dː ɔ r m iː s k ɛ r ɛ
w ɛ t uː s t ʊ m	w ɛ t ʊ s t ʊ m
d ɛ n ɔ m ɪ n aː r ɛ	d eː n oː m ɪ n aː r ɛ
n ɛ g ɔ t j a t j oː n ɛ m	n ɛ g oː t j aː t j oː n ɛ m
d j ɛ k ɪ m aː r ɛ	d ɛ k ɪ m aː r ɛ
ɪ d ɛ n t ɪ k ʊ m	iː d ɛ n t ɪ k ʊ m
p ɛ g a t oː r ɛ	p ɛ kː aː t oː r ɛ m
f l ɛ k s j oː n ɛ m	f l ɛ k s j oː n ɛ m
w ɛ r m ɛ m	w ɛ r m ɛ m
r ɛ m ɛ k ɛ r ɛ	r ɛ m ɪ s k eː r ɛ
p ʊ r p ʊ r a m	p ʊ r p ʊ r a m
s ɛ r w aː r ɛ	s ɛ r w aː r ɛ
s ɛ n aː t ʊ m	s ɛ n aː t ʊ m
t ɛ r t j a r ɛ	t ɛ r t j aː r ɛ
p a r ɪ r ɛ	p a r ɛ r ɛ
p ɛ r k uː t ɛ r ɛ	p ɛ r k ʊ t ɛ r ɛ
g l aː d j ʊ m	g l a d j ʊ m
a n ɔ t a t j oː n ɛ m	a nː ɔ t aː t j oː n ɛ m
f ɛ rː aː t ʊ m	f ɛ rː aː t ʊ m
b uː b ɔ n ɪ k ʊ m	b uː b oː n ɪ k ʊ m
j ɛ t aː r ɛ	j a k t aː r ɛ
w a r oː n ɛ m	w aː r oː n ɛ m
s ʊ s p ɪ r j aː r ɛ	s ʊ s p iː r aː r ɛ
eː kʷ ɪ l ɪ b r j ʊ m	aɪ kʷ ɪ l iː b r j ʊ m
k ɔ m p l a k ɛ r ɛ	k ɔ m p l a k eː r ɛ
w oː t ʊ m	w oː t ʊ m
a pː l aʊ s ʊ m	a pː l aʊ s ʊ m
t r ʊ n k aː r ɛ	t r ʊ ŋ k aː r ɛ
p ɛ r g oː l ɛ m	p ɛ r g ʊ l a m
s ɛ s kʷ ɪ p ɛ d a l ɛ	s eː s kʷ ɪ p ɛ d aː l ɛ m
k ɔ n d ɛ n s a t j oː n ɛ m	k ɔ n d eː n s aː t j oː n ɛ m
a gː l uː t ɪ n r ɛ	a gː l uː t ɪ n aː r ɛ
a r k a n ʊ m	a r k aː n ʊ m
s t ɪ n d ɛ r ɛ	s k ɪ n d ɛ r ɛ
ɪ n w ɛ s t iː r ɛ	ɪ n w ɛ s t iː r ɛ
s ɪ m p l ɪ k ɛ m	s ɪ m p l ɪ k ɛ m
n ɛ s p ɪ l a m	m ɛ s p ɪ l ʊ m
ɛ k z ɛ m p l aː r ɛ	ɛ k s ɛ m p l aː r ɛ m
m a s k ʊ l ɪ n ʊ m	m a s k ʊ l iː n ʊ m
ɛ k r b oː s ʊ m	a r b ʊ t ʊ m
a s t ɪ l a m	a sː ʊ l a m
p r ɔ d uː k t j oː n ɛ m	p r oː d ʊ k t j oː n ɛ m
r ɛ f ɔ r m aː r ɛ	r ɛ f oː r m aː r ɛ
a l t ɛ r k aː r ɛ	a l t ɛ r k aː r iː
r ɛ k j ɛ n ɛ m	r ɛ k ɛ n t ɛ m
l a m ɛ n t ʊ m	l aː m ɛ n t ʊ m
eː ɪ k j aː k ʊ m	aɪ g y p t j a k ʊ m
k ɪ r k ɪ n ɛ ʊ m	k ɪ r k ɪ n ʊ m
k ɔ n w ɛ n j ɛ n t j a m	k ɔ n w ɛ n ɪ ɛ n t j a m
k ʊ p l a m	k oː p ʊ l a m
f l ɛ m a m	pʰ l ɛ g m a
m j ɛ r d a m	m ɛ r d a m
m uː l t t ʊ d n ɛ m	m ʊ l t ɪ t uː d ɪ n ɛ m
f uː r ɪ b ʊ n d ʊ m	f ʊ r ɪ b ʊ n d ʊ m
k a l uː m nː j a m	k a l ʊ m n j a m
eː kʷ ɪ w a l ɛ r ɛ	aɪ kʷ ɪ w a l eː r ɛ
k aʊ t ɛ l a m	k aʊ t eː l a m
d ɛ w w ɛ r ɛ	d eː w ɔ w eː r ɛ
r ɔ s m a r ɪ n ʊ m	r oː r ɛ mː a r iː n ʊ m
k uː r aː r ɛ	k uː r aː r ɛ
a g r ɛ s t ɛ m	a g r ɛ s t ɛ m
a n a r k j a m	a n a r kʰ j a m
f ɛ r uː l ʊ m	f ɛ r ʊ l a m
w aː r j ʊ m	w a r j ʊ m
t r aː w ɛ m	t r a b ɛ m
l a k t ɛ ʊ m	l a k t ɛu m
k ɔ n s a ŋ gʷ ɪ n ɪ t aː t ɛ m	k oː n s a ŋ gʷ ɪ n ɪ t aː t ɛ m
a r k a m	a r kʰ a m
aɪ t ɛ r ɛ	aɪ tʰ ɛ r ɛ m
t r ɛ s ɔ r ʊ m	tʰ eː s aʊ r ʊ m
r ɛ g m ʊ s g aː r ɛ	m ʊ sː aː r ɛ
s t r aː d a m	s t r aː t a m
k a n t aː r ɛ	k a n t aː r ɛ
m uː k ɔ r ɛ	m uː k oː r ɛ m
m a n j ʊ m	m a ŋ n ʊ m
k oː l oː n ʊ m	k ɔ l oː n ʊ m
p ɛ r ɛ g uː d ɪ k aː r ɛ	p r aɪ j uː d ɪ k aː r ɛ
w ɛ r ɛ k ʊ n d ʊ m	w ɛ r eː k ʊ n d ʊ m
a k ɛ p t j oː n ɛ m	a kː ɛ p t j oː n ɛ m
a k lː a r aː r ɛ	a kː l aː r aː r ɛ
a t ɛ n d ɛ r ɛ	a tː ɛ n d ɛ r ɛ
m ɔ r ɪ r ɛ	m ɔ r iː
f ɪ n a l ɪ t eː t ɛ m	f iː n aː l ɪ t aː t ɛ m
d eː m ɔ n s t r a t j oː n ɛ m	d eː m oː n s t r aː t j oː n ɛ m
k ɔ r uː s k a r ɛ	k ɔ r ʊ s k aː r ɛ
p ɛ r d ɛ r ɛ	p ɛ r d ɛ r ɛ
a s p ɛ r s j oː n ɛ m	a s p ɛ r s j oː n ɛ m
n ɔ t r ɪ k ʊ m	n uː t r iː k j ʊ m
a p ɛ fː l a m	a p ɪ k ʊ l a m
d eː ŋ ɪ f ɪ k aː r ɛ	d ɛ ɪ f ɪ k aː r ɛ
f a y a l ɛ	f a k j aː l ɛ m
a r k aː r ʊ m	a r k w aː r j ʊ m
k eː b aː r ɛ	k ɪ b aː r ɛ
k a l k ɔ l a t j oː n ɛ m	k a l k ʊ l aː t j oː n ɛ m
a p a r ɪ t j ʊ m	a pː aː r ɪ t j oː n ɛ m
d ɪ l oː r ɛ	d ʊ l k oː r ɛ m
s ɔ lː aː k ʊ m	s oː l aː k j ʊ m
k ɪ r k ʊ n s k r iː w ɛ r ɛ	k ɪ r k ʊ m s k r iː b ɛ r ɛ
t ɛ n t aː r ɛ	t ɛ m p t aː r ɛ
k ɔ n s t a n k j ʊ m	k oː n s t a n t j a m
m eː ɪ s t ɪ ɛ r ɛ	m ɪ n ɪ s t ɛ r j ʊ m
s a l uː t aː r ɛ	s a l uː t aː r ɛ
r ɛ s k ɪ n d ɛ r ɛ	r ɛ s k ɪ n d ɛ r ɛ
a pː a r aː r ɛ	a pː a r aː r ɛ
a d ʊ m b r aː r ɛ	a d ʊ m b r aː r ɛ
kʷ aː d r ʊ m	kʷ aː d r ʊ m
w oː ɪ s	w oː s
ɛ k s ɔ r t a t j oː n ɛ m	ɛ k s h ɔ r t aː t j oː n ɛ m
a b r ɛ w j a t j oː n ɛ m	a bː r ɛ w j aː t j oː n ɛ m
a s k ɛ n d ɛ r ɛ	a s k ɛ n d ɛ r ɛ
ɪ m p ɛ lː ɛ r ɛ	ɪ m p ɛ lː ɛ r ɛ
k a l l ɛ m	k aʊ l ɛ m
k a r n ɪ f ɪ k ɛ m	k a r n ɪ f ɪ k ɛ m
m ɛ m b r a n a k ɛ ʊ m	m ɛ m b r aː n aː k ɛu m
a lː ʊ n d ʊ l a m	a l aʊ d a m
s ʊ g j a k ɛ r ɛ	s ʊ b j a k eː r ɛ
ɔ r ɪ f ɪ k ʊ m	h ɔ rː ɪ f ɪ k ʊ m
r ɛ l ɛ w aː r ɛ	r ɛ l ɛ w aː r ɛ
s a l g ɪ ɛ m	s a l ɪ k ɛ m
t a k s aː r ɛ	t a k s aː r ɛ
m a n t ɪ p fː j ʊ m	m a ŋ k ɪ p j ʊ m
k ɔ s t uː m ɛ m	k oː n s ʊ eː t uː d ɪ n ɛ m
k ɪ b ʊ m	k ɪ b ʊ m
ɛ k n a m a m	iː l ɪ k ɛ m
n ɔ k ɛ t ʊ m	n ʊ k eː t ʊ m
ɪ rː ɛ g ʊ l aː r ɛ	ɪ rː eː g ʊ l aː r ɛ m
d ɛ f r aʊ d a t j oː n ɛ m	d eː f r aʊ d aː t j oː n ɛ m
s ɔ l aː r ɛ	s oː l aː r ɛ m
f a s k ɪ n j ʊ m	f a s k ɪ n ʊ m
p a n ɪ kː ʊ ɛ l a m	p aː n ɪ k ʊ l a m
ɔ l ɛ aː t ʊ m	ɔ l ɛ aː t ʊ m
a m a t ɔ r j ʊ m	a m aː t oː r j ʊ m
ɛ k s k r ɛ t aː r ɛ	ɛ k s k ɛ r n ɛ r ɛ
g a w ɛ t a m	g a b a t a m
w ɛ n d ɪ t oː r ɛ	w eː n d ɪ t oː r ɛ m
aʊ d ɪ t oː r j ʊ m	aʊ d iː t oː r j ʊ m
n ʊ m ɛ r ʊ m	n ʊ m ɛ r ʊ m
ɪ m b ɛ k ɪ lː ɪ t aː t ɛ m	ɪ m b eː k ɪ lː ɪ t aː t ɛ m
d ɛ f ɛ k t j oː n ɛ m	d eː f ɛ k t j oː n ɛ m
m a t r ɪ t ɪ d a m	m aː t r ɪ k iː d a m
r uː t ɪ lː aː r ɛ	r ʊ t ɪ l aː r ɛ
p uː n ɪ r ɛ	p uː n iː r ɛ
ɪ n f ɛ r ɛ r ɛ	iː n f ɛ rː ɛ
p a lː uː s t r ɛ m	p a l uː s t r ɛ m
t ɛ r ɛ b r a m	t ɛ r ɛ b r a m
a b r ɛ w j aː r ɛ	a bː r ɛ w j aː r ɛ
eː d ɪ f ɪ k aː r ɛ	aɪ d ɪ f ɪ k aː r ɛ
ɪ n w ɪ t a t j oː n ɛ m	ɪ n w ɪ t aː t j oː n ɛ m
ɪ n d uː r aː r ɛ	ɪ n d uː r aː r ɛ
ʊ s t ʊ l aː r ɛ	ʊ s t ʊ l aː r ɛ
ɔ s t ɛ n s ɪ w ʊ m	ɔ s t eː n s iː w ʊ m
b ɛ b ɪ t oː r ɛ	b ɪ b ɪ t oː r ɛ m
l a b oː r ʊ m	l a b oː r ɛ m
ʊ s uː r ɛ m	uː s uː r a m
w ɛ k sː a t j oː n ɛ m	w ɛ k s aː t j oː n ɛ m
k ɪ n t uː r a m	k ɪ ŋ k t uː r a m
k l ɪ m a t ɪ r ɪ k ʊ m	k l iː m a k t eː r ɪ k ʊ m
ɔ s p ɪ t j ʊ m	h ɔ s p ɪ t j ʊ m
eː l ɪ m ɪ n a t j oː n ɛ m	eː l ɪ m ɪ n aː t j oː n ɛ m
t r uː k ɛ	t r ʊ k ɛ m
t ɛ k s t ʊ m	t ɛ k s t ʊ m
k ɔ m uː n ɛ	k ɔ mː uː n ɛ m
w a l ɛ t uː d ɪ n aː r j ʊ m	w a l eː t uː d ɪ n aː r j ʊ m
p ɛ r ɛ g r ɪ n aː r ɛ	p ɛ r ɛ g r iː n aː r iː
p r ɛ k ɔ n ʊ s k ɛ r ɛ	p r aɪ k ɔ ŋ n ɔ s k ɛ r ɛ
a l t ɛ r k a t j oː n ɛ m	a l t ɛ r k aː t j oː n ɛ m
k ɪ t ʊ m	k iː d a m
s t r aː t ʊ m	s t r aː t ʊ m
r ɔ g ɪ n ɛ m	r oː r ɛ m
l uː n aː r ɛ	l uː n aː r ɛ m
h l ɛ m ɔ s ɪ n a m	ɛ l ɛ eː m ɔ s y n a m
w aː t ɛ m	w aː t ɛ m
w ɛ r s ɪ k ʊ l ʊ m	w ɛ r s ɪ k ʊ l ʊ m
p ɛ r t ɛ n ɛ ɛ r ɛ	p ɛ r t ɪ n eː r ɛ
d ʊ ɛ k j ɛ n t oː s	d ʊ k ɛ n t oː s
k ʊ k ɪ n aː r ɛ	k ɔ kʷ iː n aː r ɛ
a k r ɪ t uː d ɛ m	aː k r ɪ t uː d ɪ n ɛ m
eː m ɛ r g ɛ r ɛ	eː m ɛ r g ɛ r ɛ
ɪ lː a t j oː n ɛ m	ɪ lː aː t j oː n ɛ m
m ɔ n t ʊ oː s ʊ m	m ɔ n t ʊ oː s ʊ m
ɛ k s ɪ b ɛ r ɛ	ɛ k s h ɪ b eː r ɛ
b a l n ɛ aː r j ʊ m	b a l n ɛ aː r j ʊ m
p ɛ r ɪ k ɪ r ɪ r ɛ	p ɛ r kʷ iː r ɛ r ɛ
p ɛ k aː r ɛ	p ɛ kː aː r ɛ
a pː ɔ r t aː r ɛ	a pː ɔ r t aː r ɛ
p r ɔ p r ɪ j ɛ t aː t ɛ m	p r oː p r ɪ ɛ t aː t ɛ m
m ɔ d ɛ r a t oː r ɛ	m ɔ d ɛ r aː t oː r ɛ m
k a n t ʊ m	k a n t ʊ m
a gː r a w aː r ɛ	a gː r a w aː r ɛ
f l ɔ w	f l ʊ w j ʊ m
m aː s a m	m a sː a m
b ɪ s t a m	b eː s t j a m
k ɔ l ɛ g ʊ m	k aʊ l ɪ k ʊ l ʊ m
aʊ g uː r aː r ɛ	aʊ g ʊ r aː r ɛ
s ɛ n s a t j oː n ɛ m	s eː n s aː t j oː n ɛ m
b r aː k a m	b r aː k a m
g r a t ɛ ɪ t ʊ m	g r aː t ʊ iː t ʊ m
a k r ɪ m oː n j a m	aː k r ɪ m oː n j a m
r ɛ p ɛ r k uː s j oː n ɛ m	r ɛ p ɛ r k ʊ t ɛ r ɛ
k ɔ p ɛ r t uː r a m	k ɔː p ɛ r t uː r a m
l uː k a n ɪ k a m	l uː k aː n ɪ k a m
d ɪ p r eː n d ɛ r ɛ	d eː p r ɛ h ɛ n d ɛ r ɛ
r eː m a n ɛ r ɛ	r ɛ m a n eː r ɛ
t r a n s ɪ r ɛ	t r aː n s iː r ɛ
k ɔ n s ɔ l ɪ d aː r ɛ	k oː n s ɔ l ɪ d aː r ɛ
p aː s t ʊ m	p aː s t ʊ m
l uː p ɪ n ʊ m	l ʊ p iː n ʊ m
t r a b a l ɛ m	t r a b aː l ɛ m
a l ɛ	ɪ lː ʊ ŋ k
l a m ɛ n t aː r ɛ	l aː m ɛ n t aː r ɛ
m uː r aː l a m	m uː r aː l ɛ m
kʷ ɛ r ɛ l a m	kʷ ɛ r eː l a m
w ɛ s t iː m ɛ n t ʊ m	w ɛ s t iː m ɛ n t ʊ m
k ɔ n f ɪ j aː r ɛ	k oː n f iː d ɛ r ɛ
f uː g aː k ɛ	f ʊ g aː k ɛ m
p a r a d ɔ k s ʊ m	p a r a d ɔ k s ʊ m
j uː r a t oː r ɛ	j uː r aː t oː r ɛ m
ɔ fː ɛ r t ɔ r j ʊ m	ɔ fː ɛ r t oː r j ʊ m
t r a b ɛ k ʊ l a m	t r a b eː k ʊ l a m
r ɛ f l uː ɪ r ɛ	r ɛ f l ʊ ɛ r ɛ
t ɔ r t ʊ m	t ɔ r t ʊ m
m ɛ d ɪ t a b ʊ n d ʊ m	m ɛ d ɪ t aː b ʊ n d ʊ m
r ɛ s t ɪ t uː ɪ r ɛ	r ɛ s t ɪ t ʊ ɛ r ɛ
r aː j a m	r a j a m
j uː r ʊ m	ɪ uː s
w ɪ k ɪ s ɪ t uː d ɪ n ɛ	w ɪ k ɪ sː ɪ t uː d ɪ n ɛ m
ɪ n t eː l ɛ g ɛ r ɛ	ɪ n t ɛ lː ɛ g ɛ r ɛ
m a g ɛ s t aː t ɛ m	m a j ɛ s t aː t ɛ m
p ɛ n ɛ t r a r ɛ	p ɛ n ɛ t r aː r ɛ
eː w ɛ l aː r ɛ	eː w ɪ g ɪ l aː r ɛ
k ɛ t aː r ɛ	kʷ ɪ eː t aː r ɛ
k s k uː s a t j ɔ n ɛ	ɛ k s k uː s aː t j oː n ɛ m
n ɛ g aː r ɛ	n ɛ g aː r ɛ
k ɔ n s ɪ ŋ n a t j oː n ɛ m	k oː n s ɪ ŋ n aː t j oː n ɛ m
h t aː t ɛ m	t a t ɛ m
r ɛ p l ɪ k aː r ɛ	r ɛ p l ɪ k aː r ɛ
ʊ l t ɔ r ɛ	ʊ l t oː r ɛ m
ɪ n kʷ j ɛ t aː r ɛ	ɪ ŋ kʷ ɪ eː t aː r ɛ
k aː t aː r l ʊ m	k a p ʊ l ʊ m
f aː s t ʊ m	f aː s t ʊ m
p r ɔ s ɛ n j ɔ k ɛ m	p r ɔ s k eː n j ʊ m
a d ɔ n k ʊ m	a d ʊ ŋ k ʊ m
l ɛ t ɪ t j a m	l aɪ t ɪ t j a m
k ɔ r n ɛ ʊ m	k ɔ r n ɛu m
k ɔ n k ʊ rː ɛ r ɛ	k ɔ ŋ k ʊ rː ɛ r ɛ
t ɛ r m ɪ t ɛ m	t a r m ɪ t ɛ m
w a d oː s ʊ m	w a d oː s ʊ m
m ɛ n d aː k ɛ m	m ɛ n d aː k ɛ m
a d aː m a n t ɛ m	a d a m a n t ɛ m
ɔ m ɪ t ɪ t ʊ m	h ɔ m ɪ k iː d a m
l aʊ d ɛ m	l aʊ d ɛ m
k a d uː k ʊ m	k a d uː k ʊ m
a s	a sː ɛ m
f r ɛ k ɛ n t r ɛ	f r ɛ kʷ ɛ n t aː r ɛ
a s ʊ p t j oː n ɛ m	a sː uː m p t j oː n ɛ m
b ɛ n ɛ w ɔ l ʊ m	b ɛ n ɛ w ɔ l ʊ m
d ɛ n eː g aː r ɛ	d eː n ɛ g aː r ɛ
a s k ɛ n s j oː n ɛ m	a s k eː n s j oː n ɛ m
r ɛ p r ɛ h ɛ n s ɪ b ɪ l ɛ m	r ɛ p r ɛ h ɛ n s ɪ b ɪ l ɛ m
n uː b ɛ m	n uː b ɛ m
a d uː d ɪ k a t j oː n ɛ m	a d ɪ uː d ɪ k aː t j oː n ɛ m
s ɔ r t ɪ r ɛ	s ɔ r t iː r iː
a pː r ɛ h ɛ n s j oː n ɛ m	a pː r ɛ h ɛ n s j oː n ɛ m
s ɔ lː ɪ k ɪ t a t j oː n ɛ m	s ɔ lː ɪ k ɪ t aː t j oː n ɛ m
p aː r ɪ d ʊ m	p a r d ʊ m
w ɛ k sː aː r ɛ	w eː k s aː r ɛ
k ʊ ŋ n a t ʊ m	k ɔ ŋ n aː t ʊ m
s a l ɪ w a r ɛ	s a l iː w aː r ɛ
w a r d aː r ɛ	w a r d aː r ɛ
s ɪ k s ɪ t aː t ɛ m	s ɪ kː ɪ t aː t ɛ m
w ɛ ɛ m ɛ n t ɛ m	w ɛ h ɛ m ɛ n t ɛ m
n eː g r ɛ t ɛ r ɛ	n ɪ g r eː s k ɛ r ɛ
k ɛ s p eː t ɛ m	k aɪ s p ɪ t ɛ m
aʊ s p ɪ k j ʊ m	aʊ s p ɪ k j ʊ m
b ɛ a j ɛ l ɛ m	b aː j ʊ l ʊ m
ɛ k ɛ lː ɛ r ɛ	ɛ k s k ɛ lː ɛ r ɛ
g a rː uː l ʊ m	g a rː ʊ l ʊ m
s ɪ d ɛ r ɛ ʊ m	s iː d ɛ r ɛu m
d ɛ k ɪ m a l ɛ	d ɛ k ɪ m a l ɛ m
t ɪ t ɪ lː r ɛ	t iː t ɪ lː aː r ɛ
f l uː m ɛ m	f l uː m ɛ n
p ɛ r ɪ k l ɪ t aː r ɛ	p ɛ r iː k l ɪ t aː r iː
b a l b ʊ t a r ɛ	b a l b uː t iː r ɛ
ɪ n f ɛ s t aː r ɛ	iː n f ɛ s t aː r ɛ
l ʊ k t aː r ɛ	l ʊ k t aː r iː
s ʊ m ʊ m	s ʊ mː ʊ m
r ɛ lː a k sː a t j oː n ɛ m	r ɛ l a k s aː t j oː n ɛ m
k ɛ l ɛ b r ɛ m	k ɛ l ɛ b r ɛ m
m ɔ l ɛ k ʊ l a m	m oː l ɛ k ʊ l a m
r ɛ d ɪ t ʊ m	r ɛ d ɪ t ʊ m
l uː k ɛ r n a m	l ʊ k ɛ r n a m
k ɔ n k ɛ r ɪ r ɛ	k ɔ ŋ kʷ iː r ɛ r ɛ
p r ɛ s a g j aː r ɛ	p r aɪ s aː g iː r ɛ
ɪ n s uː l t ʊ m	iː n s ʊ l t ʊ m
k ɔ a b ɪ t aː r ɛ	k ɔ h a b ɪ t aː r ɛ
m ɪ n uː l a s	m ɪ n uː t j a m
k ɔ l ɔ m b a m	k ɔ l ʊ m b a m
s p oː s ʊ m	s p oː n s ʊ m
s ɔ m ɛ t ɛ r ɛ	s ʊ mː ɪ tː ɛ r ɛ
a d ɪ r ɛ	a dː ɛ r ɛ
a t r ɪ b uː ɪ r ɛ	a tː r ɪ b ʊ ɛ r ɛ
m ɛ n oː r ɛ	m ɪ n oː r ɛ m
ɪ w ʊ m	iː w ʊ m
a d m ɪ n ɪ s t r aː r ɛ	a d m ɪ n ɪ s t r aː r ɛ
p a r ɔ n ɔ m aː s j a m	p a r ɔ n ɔ m a s j a m
a n ɪ m	a n iː s ʊ m
r a s t r ɛ lː ʊ m	r aː s t ɛ lː ʊ m
a ɛ r ɛ ʊ m	aː ɛ r j ʊ m
k ɔ k ʊ m	s ɔ kː ʊ m
k a n d ɔ r ɛ	k a n d oː r ɛ m
p r ɛ d a t oː r ɛ	p r aɪ d aː t oː r ɛ m
r eː w ɔ l w ɛ r ɛ	r ɛ w ɔ l w ɛ r ɛ
m a n ɪ f j ɛ s t ʊ m	m a n ɪ f ɛ s t ʊ m
ɔ r aː t j oː n ɛ m	oː r aː t j oː n ɛ m
k ɔ n d uː k t j oː n ɛ m	k ɔ n d ʊ k t j oː n ɛ m
eː t ɛ r ɛ ʊ m	aɪ tʰ ɛ r j ʊ m
d ɪ s ɛ m ɪ n aː r ɛ	d ɪ sː eː m ɪ n aː r ɛ
k ɔ n s ɛ r w aː r ɛ	k oː n s ɛ r w aː r ɛ
r ɛ l ɛ k aː r ɛ	r ɛ l ɪ g aː r ɛ
g r ɛ m b ʊ m	g r ɛ m j ʊ m
