k ɔ l oː n j aː ɛ	k ɔ l oː n j a m
m iː n aː k a m	m ɪ n aː k ɛ m
d ɛ w j aː r ɛ	d eː w j aː r ɛ
p a k ɪ f ɪ k ʊ m	p aː k ɪ f ɪ k ʊ m
p aɪ lː aː r ʊ m	p ɛ lː aː r j ʊ m
k ɔ kʷ uː s	k ɔ kː ʊ m
k ɔ l ɔ m b	k ɔ l ʊ m b a m
w ɛ n t ɪ l aː t j oː n ɛ	w ɛ n t ɪ l aː t j oː n ɛ m
s ɔ ŋ n a m	z oː n a m
s ɔ l ɪ k ɪ t uː d ɪ n ɛ m	s ɔ lː ɪ k ɪ t uː d ɪ n ɛ m
m uː l t a m	m ʊ l t a m
t ɔ r ʊ m	t ɔ r ʊ m
ɪ n g l ɛ s k ɛ m	a ŋ g l eː n s ɛ m
d ɪ s t ɛ n d ɛ r ɛ	d ɪ s t ɛ n d ɛ r ɛ
l ɔ k a m	l uː t ɛu m
s ʊ b t r aː k t j oː n ɛ m	s ʊ b t r a k t j oː n ɛ m
w ʊ l g ʊ m	w ʊ l g ʊ s
aː ɛ ɔ m	ɛ kː ʊ m
s t aː p ɛ d ɛ m	s t a p ɛ d ɛ m
a l k j oː n ʊ m	a l k y ɔ n ɛ m
ɪ n f ɛ s t aː r ɛ	iː n f ɛ s t aː r ɛ
k ɪ k aː pʰ a m	k ɪ k aː d a m
m ɛ n uː t j j aː m	m ɪ n uː t j a m
ɔ b l ɪ g aː t j oː n ɛ	ɔ b l ɪ g aː t j oː n ɛ m
d ɔ n ɛ m	d oː n ʊ m
n ɛ r w oː s ʊ m	n ɛ r w oː s ʊ m
ɪ n k r eː m ɛ n t ʊ m	ɪ ŋ k r eː m ɛ n t ʊ m
p ʊ t aː r ɛ m	p ʊ t aː r ɛ
ɪ d ɛ n t ɪ k ʊ m	iː d ɛ n t ɪ k ʊ m
h uː n g ɛ r ɛ	ʊ ŋ g ɛ r ɛ
p ɔ r k a h m	p ɔ r k a m
k ɪ d a m	k iː d a m
ɔ l w ɛ r ɛ	w ɔ l w ɛ r ɛ
a d aː m a n t ɛ m	a d a m a n t ɛ m
g r a t a m	k r aː t ɛ m
g j aː t j ʊ m	g l a k ɪ ɛ m
s p uː t ʊ m	s p uː t ʊ m
j uː s t ʊ m	j uː s t ʊ m
ɛ pː ɪ s t oː lː ɛ m	ɛ p ɪ s t ɔ l a m
kʷ ɛ p ʊ aː r ɛ	kʷ ɪ eː t aː r ɛ
p r ɛ m ɪ k j a m	p r iː m ɪ t j a m
k ɛ l ɪ b ʊ m	k aɪ l ɪ b ɛ m
d eː n ʊ n m ʊ t j aː t j oː m	d eː n ʊ n t j aː t j oː n ɛ m
l f iː r ʊ m	g l iː r ɛ m
a r m aː t ʊ m	a r m aː t ʊ m
n ɛ kʷ ɪ t j a m	n eː kʷ ɪ t j a m
m ɛ t a m	m eː t a m
r ɛ s ɔ n aː r ɛ	r ɛ s ɔ n aː r ɛ
s eː n aː r ɛ	s ɪ ŋ n aː r ɛ
f uː d ʊ g ɪ n a m	f iː d uː k j a m
d ɛ k r ɛ m ɛ n t ʊ m	d eː k r eː m ɛ n t ʊ m
t a n t ʊ m	t a n t ʊ m
k s p a n d ɛ r ɛ	ɛ k s p a n d ɛ r ɛ
k ɔ m p ʊ ŋ g ɛ r ɛ	k ɔ m p ʊ ŋ g ɛ r ɛ
k a s ʊ m	k aː s ʊ m
a s t r ʊ m	a s t r ʊ m
j uː r a m ɛ n t ʊ m	j uː r aː m ɛ n t ʊ m
s ɪ t j ʊ m	s ɪ t ʊ m
f a b ʊ l oː s ʊ m	f aː b ʊ l oː s ʊ m
k ɔ p ɛ r t uː r a m	k ɔː p ɛ r t uː r a m
kʷ ɪ n t ʊ m	kʷ iː n t ʊ m
aʊ t ɔ n aː l ɛ m	aʊ t ʊ m n aː l ɛ m
d ɪ l aː k ɛ r aː r ɛ	d iː l a k ɛ r aː r ɛ
m uː s ɪ t aː r ɛ	m ʊ sː ɪ t aː r ɛ
r ɛ n ɔ w aː t j oː n ɛ	r ɛ n ɔ w aː t j oː n ɛ m
s ɪ j ɛ n ʊ m	s ʊ iː n ʊ m
t ɔ k s ɪ k aː r ɛ	t ɔ k s ɪ k aː r ɛ
ɛ r b aː k ɛ ʊ m	h ɛ r b aː k ɛu m
t a l ʊ t n ʊ m	t aː l ʊ m
k r ɛ m a m	k r aː m ʊ m
r ɪ k s a m	r ɪ k s a m
s uː s ɛ kʷ ɪ r ɛ	s ʊ b s ɛ kʷ iː
m a g ɛ s t aː t ɛ m	m a j ɛ s t aː t ɛ m
s k uː rː ɪ l ɛ m	s k ʊ rː iː l ɛ m
s ɔ l ɪ d aː r ɛ	s ɔ l ɪ d aː r ɛ
s ɛ r oː t ɪ n ʊ m	s eː r oː t ɪ n ʊ m
b ɔ m b ʊ m	b ɔ m b ʊ m
ɔ l aɪ ɔ s ʊ m	ɔ l ɛ oː s ʊ m
m uː k ɔ r ɛ	m uː k oː r ɛ m
ɪ mː uː t aː r ɛ	ɪ mː uː t aː r ɛ
s k oː p a m	s k oː p a m
l aː k ɛ r ɛ m	l ɪ k eː r ɛ
r ɔ s t r ʊ m	r oː s t r ʊ m
m ɪ l ɪ t aː r ɛ	m iː l ɪ t aː r ɛ
l a k s ʊ m	l a k s ʊ m
r ɛ l ɪ kʷ j a m	r eː l ɪ kʷ j aː s
f ɛ r m ɛ n t ʊ m	f ɛ r m ɛ n t ʊ m
oː	ʊ m
k ɔ n j ʊ g aː r ɛ	k ɔ n j ʊ g aː r ɛ
s p ɛ r aː r ɛ	s p eː r aː r ɛ
p a g a n t aː t a m	p aː g aː n ɪ t aː t ɛ m
kʷ ɛ s t j ɔ n aː r j ʊ m	kʷ aɪ s t j oː n aː r j ʊ m
w ɪ t uː p ɛ r aː t j oː n ɛ m	w ɪ t ʊ p ɛ r aː t j oː n ɛ m
p ɪ g r ʊ ɪ t j a m	p ɪ g r ɪ t j a m
r z ɪ r ɛ m	r ɛ a g eː r ɛ
ʊ s ʊ aː l ɛ m	uː s w aː l ɛ m
k ɔ n s uː d m aː r ɛ	k oː n s ʊ mː aː r ɛ
s ʊ mː ɪ t k ɪ d ɛ m	s ʊ mː ɪ t aː t ɛ m
k ɛ l ɛ b r aː r ɛ	k ɛ l ɛ b r aː r ɛ
w a sː ɛ lː ʊ m	w aː s k ɛ lː ʊ m
b ɛ lː ʊ m	b ɛ lː ʊ m
p a g uː r ʊ m	p a g uː r ʊ m
p a l uː d aː m ɛ n t m	p a l uː d aː m ɛ n t ʊ m
m ɛ l ɔ n ɛ m	m eː l oː n ɛ m
k a l a m ɛu	k a l a m ʊ m
m a t r ɪ t iː t j ʊ m	m aː t r ɪ k iː d j ʊ m
m a l ɔ w eː r ɛ	eː m ɔ w eː r ɛ
s a l w aː r ɛ	s a l w aː r ɛ
f ɛ m ɛ l a m	f eː m ɛ lː a m
p a s aː r ɛ	p a n d ɛ r ɛ
f r aɪ n aː r ɛ m	f r eː n aː r ɛ
s uː b s ɪ d j ʊ m	s ʊ b s ɪ d j ʊ m
t uː m ɛ f aː r ɛ	t ʊ m ɛ f a k ɛ r ɛ
a b aː k ʊ l ʊ m	a b a k ʊ l ʊ m
t ɔ r t ɪ l ɛ m	t ɔ r t ɪ l ɛ m
f l ɔ r ɪ l ɛ g ʊ m	f l oː r ɪ l ɛ g j ʊ m
k ɔ n w ɔ k aː r ɛ	k ɔ n w ɔ k aː r ɛ
a r g ɪ n t oː s ʊ m	a r g ɛ n t oː s ʊ m
f oː n d ɛ l ɪ t m t ɛ m	f ɪ d eː l ɪ t aː t ɛ m
ɪ n ɔ b ɪ l ɛ m	ɪ ŋ n oː b ɪ l ɛ m
k ɛ n s oː r ɛ m	k eː n s oː r ɛ m
k r z s t aː r ɛ	k r ʊ s t aː r ɛ
k r aː t ɪ k ʊ l a m	k r aː t ɪ k ʊ l a m
r uː g a m	r uː g a m
m uː n ɪ k ɪ p j ʊ m	m uː n ɪ k ɪ p j ʊ m
t ɛ t r ɪ k ʊ m	t aɪ t r ɪ k ʊ m
s k uː rː ɛ r ɛ	ɛ k s k ʊ rː ɛ r ɛ
h ɔ s p eː t ɛ m	h ɔ s p ɪ t ɛ m
m a n g aː r ɛ m	m a n d uː k aː r ɛ
f ɔ r t iː t ʊ m	f ɔ r t ʊ iː t ʊ m
ɔ n ɔ r ɪ f iː k ʊ m	h ɔ n oː r ɪ f ɪ k ʊ m
ʊ n iː f oː r m ɛ m	uː n ɪ f oː r m ɛ m
a kː uː t aː b ɪ l ɛ	a kː uː s aː b ɪ l ɛ m
ɛ k s k ɔ g iː t aː r ɛ	ɛ k s k oː g ɪ t aː r ɛ
m ʊ s t ʊ m	m ʊ s t ʊ m
f ʊ r j oː s ʊ m	f ʊ r j oː s ʊ m
w a g aː b ʊ n d ʊ m	w a g aː b ʊ n d ʊ m
l ɔ t ʊ m	l ʊ t ʊ m
uː m b r aː t ɪ k ʊ m	ʊ m b r aː t ɪ k ʊ m
s ɛ s kʷ ɪ p ɛ d aː l ɛ	s eː s kʷ ɪ p ɛ d aː l ɛ m
a d k ʊ n t ʊ m	a d j ʊ ŋ k t ʊ m
ɔ b l aː t j oː n ɛ m	ɔ b l aː t j oː n ɛ m
a tː r ɪ b ʊ t j oː n ɛ m	a tː r ɪ b uː t j oː n ɛ m
l ɔ n r d ʊ m	l uː r ɪ d ʊ m
a b s uː r d ɛ d aː t ɛ m	a b s ʊ r d ɪ t aː t ɛ m
p r ʊ ɛ w a m	p r ɔ b a m
ɔ kː ʊ rː ɛ r ɛ m	ɔ kː ʊ rː ɛ r ɛ
p r ɔ w ɔ k aː t oː r ɛ	p r oː w ɔ k aː t oː r ɛ m
eː kʷ iː w ɔ k aː r ɛ	aɪ kʷ ɪ w ɔ k aː r ɛ
m ɪ r t ɪ lː ʊ m	m y r t ɪ lː ʊ m
ʊ l t ɛ r j oː r ɛ	ʊ l t ɛ r j oː r ɛ m
ɪ l uː s j ɛu n ɛ m	ɪ lː uː s j oː n ɛ m
f a b r ʊ m	f a b r ʊ m
ɛ t ʊ m	eː t ʊ m
t r a w ɛ m	t r a b ɛ m
p ɔ r n oː g r aː f j aː m	p ɔ r n ɔ g r a pʰ j a m
k a n t ɪ k ʊ m	k a n t ɪ k ʊ m
ɪ n t ɛ r w ɛ n t j oː n ɛ m	ɪ n t ɛ r w ɛ n t j oː n ɛ m
p ɛ l aː k ʊ m	p ɛ l a g ʊ s
d uː r ʊ m	d uː r ʊ m
m ɛ s ɛ m	m ɛ sː ɛ m
a p aɪ lː ɪ t aː r ɛ	a pː ɛ lː ɪ t aː r ɛ
ɪ m p ɛ r aː t ʊ r j ʊ m	ɪ m p ɛ r aː t oː r j ʊ m
ɪ m f ɔ r t uː n j ʊ m	iː n f ɔ r t uː n j ʊ m
r ɛ w ɔ k aː r ɛ	r ɛ w ɔ k aː r ɛ
ɪ m b ɛ k ɪ lː ɪ t aː t ɛ m	ɪ m b eː k ɪ lː ɪ t aː t ɛ m
m ɔ s t r ʊ s ʊ m	m oː n s t r ʊ oː s ʊ m
m ɔ r ɪ r ɛ	m ɔ r iː
s ɔ l aː r ɪ ʊ r ɛ	s oː l aː r j ʊ m
f r aː t ɛ r n aː l ɛ m	f r aː t ɛ r n aː l ɛ m
r ɛ k uː s aː t j oː n ɛ m	r ɛ k uː s aː t j oː n ɛ m
p r oː w ɛ eː r ɛ	p r oː w ɪ d eː r ɛ
p a ɪ s ɛ m	p aː g eː n s ɛ m
k ɔ k ɪ n ɪ l a m	k ɔ kː ɪ n a m
s a ŋ gʷ ɪ r aː r ɛ	s a ŋ gʷ ɪ n aː r ɛ
p a n w ɛ r ɛ m	p aː n aː r j ʊ m
ɪ n iː kʷ ʊ m	ɪ n iː kʷ ʊ m
w ɛ h s aː r ɛ m	w eː k s aː r ɛ
s ɔ l ɪ k ɪ t aː t j oː n ɛ m	s ɔ lː ɪ k ɪ t aː t j oː n ɛ m
s ɛ k t ɪ m aː n a m	s ɛ p t ɪ m aː n a m
s aː b l ʊ m	s a b ʊ l ʊ m
m uː r ɛ	m uː r ɛ m
m ɪ n k ɪ aː m	m ɛ n t ʊ l a m
b ɛ s t j aː r j ʊ m	b eː s t j aː r j ʊ m
f ɪ r m ɛ m	f ɪ r m ʊ m
s k uː t ʊ m	s k uː t ʊ m
s ɛ r w ɪ l ɛ	s ɛ r w iː l ɛ m
l uː k ɛ r n a m	l ʊ k ɛ r n a m
kʷ a l ɪ f iː k aː r ɛ	kʷ aː l ɪ f ɪ k aː r ɛ
p a s t ɪ k n aː k a m	p a s t ɪ n aː k a m
n ɪ d ʊ m	n iː d ʊ m
ɛ n s ɛ m	eː n s ɛ m
s t ɛ r k ʊ m	s t ɛ r k ʊ s
k ɔ n t ɛ n d eː r ɛ	k ɔ n t ɛ n d ɛ r ɛ
w a g aː r ɛ	w a g aː r iː
p ɪ s aː r ɛ	p iː n s ɛ r ɛ
k a w aː r ɛ	k a w aː r ɛ
ɪ n k aː r n aː r ɛ	ɪ ŋ k a r n aː r ɛ
n ɪ m ʊ n	n eː m ɪ n ɛ m
d ɛ k s t eː r ɪ t aː t ɛ m	d ɛ k s t ɛ r ɪ t aː t ɛ m
w ʊ l t ʊ m	w ʊ l t ʊ m
p r ɔ t ɛ s t aː r ɛ	p r oː t ɛ s t aː r iː
ʊ s ɛ r ɛ m	ɔ s t j aː r j ʊ m
r uː b ɪ g ɪ n oː s ʊ m	r oː b iː g ɪ n oː s ʊ m
s uː p l ɪ k aː t j oː n ɛ m	s ʊ pː l ɪ k aː t j oː n ɛ m
d aː b oː l iː k ʊ m	d j a b ɔ l ɪ k ʊ m
s uː p oː r ɛ m	s ʊ pː oː n ɛ r ɛ
f a s t ɪ d j ʊ m	f a s t iː d j ʊ m
ɔ l f aː t ɔ r j ʊ m	ɔ l f a k t oː r j ʊ m
d aː d ɪ t ʊ m	d a t ʊ m
k ɔ n f ɛ r ɛ r ɛ	k oː n f ɛ rː ɛ
f ɪ m ʊ m	f ɪ m ʊ m
a w ɪ k ɛ s ʊ m	aː w ɛ r s ʊ m
s oː n ʊ m	s ɔ m n ʊ m
h aː b y l aː r ɛ	f aː b ʊ l aː r iː
d ɪ s k ʊ rː eː r ɛ	d ɪ s k ʊ rː ɛ r ɛ
d eː l aː t oː r ɛ	d eː l aː t oː r ɛ m
l ɛ mː a m	l ɛ mː a
k ɔ m p ɛ t ɪ t j oː n ɛ	k ɔ m p ɛ t iː t j oː n ɛ m
a l iː t ʊ m	h aː l ɪ t ʊ m
k ɔ r j aː k ɛ ʊ m	k ɔ r j a k ɛu m
kʷ a d r ɪ l aː t ɛ r ʊ m	kʷ a d r ɪ l a t ɛ r ʊ m
s p ɛ s ʊ m	s p ɪ sː ʊ m
f ɔ r n ɪ k aː r ɛ	f ɔ r n ɪ k aː r iː
j ɪ r aː r ɛ	g y r aː r ɛ
l aʊ d ɛ m	l aʊ d ɛ m
s eː k w aː k ɛ	s ɛ kʷ aː k ɛ m
ɪ n k ɛ n s ʊ m	ɪ ŋ k eː n s ʊ m
s a ŋ gʷ ɪ n ɔ l ɛ n t ʊ m	s a ŋ gʷ ɪ n ɔ l ɛ n t ʊ m
a d j uː r aː t j oː n j ɛ m	a d ɪ uː r aː t j oː n ɛ m
t r iː k ɛ n aː r j ʊ m	t r iː k eː n aː r j ʊ m
w ɪ w ɪ d ʊ m	w iː w ɪ d ʊ m
b l eː s t ɪ m ɛ	b l a s pʰ eː m aː r ɛ
p r aː w ʊ m	p r aː w ʊ m
a gː r ɛ d ɛ r ɛ	a gː r ɛ d iː
k ɛ k ʊ m	s ɔ kː ʊ m
w ɪ k ʊ m	w iː k ʊ m
d eː f ɔ r m aː t j oː n ɛ m	d eː f oː r m aː t j oː n ɛ m
f a k iː r aː l ɛ m	f a k j aː l ɛ m
k l aː w ʊ m	k l aː w ʊ m
ɔ r ɪ ɛ n t ɛ m	ɔ r ɪ ɛ n t ɛ m
w ɛ r ɪ f ɪ k aː t j oː n ɛ m	w ɛ r ɪ f ɪ k aː t j oː n ɛ m
k ɔ rː ɛ a m	k ɔ rː ɪ g j a m
s ɛ m ɛ m	s eː m ɛ n
t ɔ d aː r eː r ɛ	t ɔ lː ɛ r ɛ
p r aɪ m ɔ n iː t oː r ɛ m	p r aɪ m ɔ n ɪ t oː r ɛ m
ɪ n mː ɪ s m ɪ m s ɛ	ɪ mː ɪ s k eː r ɛ
f eː r iː r ɛ	f ɛ r iː r ɛ
a kʰ r ɛ s t ɛ m	a g r ɛ s t ɛ m
ɪ l uː t ɪ r ɛ	ɪ lː uː d ɛ r ɛ
t r ɪ t ʊ m	t r a k t ʊ m
r ɛ f ɛ k t j oː n ɛ m	r ɛ f ɛ k t j oː n ɛ m
m a n s ʊ ɛ t uː d ɪ n ɛ m	m aː n s ʊ eː t uː d ɪ n ɛ m
a b n ɔ r m ɛ m	a b n oː r m ɛ m
f ɪ k ʊ m	f iː k ʊ m
a r g ɪ lː a m	a r g ɪ lː a m
f ɛ k ʊ n d ʊ m	f eː k ʊ n d ʊ m
s a p oː r ɛ	s a p oː r ɛ m
a w ɛ n a m	a w eː n a m
r ɛ k l aː m aː r ɛ	r ɛ k l aː m aː r ɛ
d eː k ɔ r aː r ɛ	d ɛ k ɔ r aː r ɛ
r a n ʊ m	a r aː n ɛu m
d ɛ k ɪ m aː t j oː n ɛ m	d ɛ k ɪ m aː t j oː n ɛ m
w ɛ n j a m	w ɛ n j a m
w ɛ n ɛ r aː r ɛ	w ɛ n ɛ r aː r iː
n a t j oː n ɛ m	n aː t j oː n ɛ m
a k a m	a k j a m
a r k a m	a r kʰ a m
a b h ɪ l ɛ m	aː b ɪ l ɛ m
kʷ a d r ʊ p l aː r ɛ	kʷ a d r ʊ p l aː r ɛ
d j aː l ɛ k t ʊ m	d j a l ɛ k t ɔ n
p r ɔ m ɛ s a m	p r oː m ɪ sː ʊ m
r ɛ k ɪ t aː t j oː n ɛ m	r ɛ k ɪ t aː t j oː n ɛ m
s aɪ l w a m	s ɪ l w a m
ɪ r aː k ʊ n d ʊ m	iː r aː k ʊ n d ʊ m
s eː g aː r ɛ	s ɛ k aː r ɛ
k s p ɛ n d eː r ɛ	ɛ k s p ɛ n d ɛ r ɛ
p ɛ t aː t ʊ m	p ɪ tː a k j ʊ m
a kː uː s aː t j oː n ɛ	a kː uː s aː t j oː n ɛ m
t r aː n s p oː r eː r ɛ	t r aː n s p oː n ɛ r ɛ
ɔ pː oː n ɛ r ɛ m	ɔ pː oː n ɛ r ɛ
d eː s t ɪ t j oː n g ɛ r ɛ m	d ɪ s k ɪ ŋ g ɛ r ɛ
n ɪ n f a m	n y m pʰ a m
p r oː n ʊ m	p r oː n ʊ m
a sː ɔ k j aː r ɛ	a sː ɔ k j aː r ɛ
k ɛ l ɛ s t j r aː l ɛ	k aɪ l ɛ s t j aː l ɛ m
a b r ʊ k aː t j oː n ɛ m	a b r ɔ g aː t j oː n ɛ m
k r uː ɛ n t ʊ m	k r ʊ ɛ n t ʊ m
t ɔ r p ɛ d ʊ m	t ɔ r p eː d ɪ n ɛ m
aɪ r uː g ɪ n oː s ʊ m	aɪ r uː g ɪ n oː s ʊ m
ɪ n t ɛ l ɛ g ɪ r ɛ	ɪ n t ɛ lː ɛ g ɛ r ɛ
ɛ r ʊ m p ɛ r ɛ	eː r ʊ m p ɛ r ɛ
s k ɔ l ʊ m	s k ɔ p ʊ l ʊ m
f ɪ k t j oː n ɛ m	f ɪ k t j oː n ɛ m
ɪ ʊ k a m	ɛ kʷ a m
k ʊ k uː lː a m	k ʊ k ʊ lː a m
a b l aː k t aː r ɛ	a b l a k t aː r ɛ
s k ɛ n ɪ k ʊ m	s k eː n ɪ k ʊ m
eː k s aʊ r ɪ r ɛ	ɛ k s h aʊ r iː r ɛ
t r eː m eː r ɛ m	t r ɛ m ɛ r ɛ
ɪ l aː t ɪ w ʊ m	ɪ lː aː t iː w ʊ m
l ɪ b aː r ɛ	l iː b aː r ɛ
k ɔ lː k aː r ɛ	k ɔ lː ɔ k aː r ɛ
k ɔ n ɛ k s j oː n ɛ m	k ɔ nː ɛ k s j oː n ɛ m
k ɔ n t r n aː w ɛ n ɪ r ɛ	k ɔ n t r aː w ɛ n iː r ɛ
s p aː r g ɛ r ɛ	s p a r g ɛ r ɛ
l ɪ n ɪ ʊ m	l iː n ɛu m
eː w ɛ j oː n aː r ɛ	eː w ɪ g ɪ l aː r ɛ
a ʊ ɛ ɪ w j j aː k ʊ m	aɪ g y p t j a k ʊ m
eː fː aɪ k t aː ɛ r ɛ	ɛ fː ɪ k ɛ r ɛ
l ɪ g aː t j oː n ɛ m	l ɪ g aː t j oː n ɛ m
w ɛ t ɪ m aː r ɛ	w ɪ k t ɪ m aː r ɛ
s a r k ɪ n a m	s a r k ɪ n a m
ɪ m p r ɔ b aː r ɛ	ɪ m p r ɔ b aː r ɛ
l a k r ɪ m aː t j oː n ɛ	l a k r ɪ m aː t j oː n ɛ m
n a t r ɪ k ɛ m	n aː t r iː k ɛ m
k ɔ n s ɪ ŋ n aː r ɛ	k oː n s ɪ ŋ n aː r ɛ
p ɛ r p ɛ t aː t j ʊ n ɛ m	p ɛ r p ɛ t w aː t oː n ɛ m
k ɔ l uː b r ɪ n ʊ m	k ɔ l ʊ b r iː n ʊ m
ɪ b iː s	iː b ɛ m iː b ɪ n
ɪ ŋ n aː r ʊ m	ɪ ŋ n aː r ʊ m
h ɔ r b ʊ m	ɔ r b ʊ m
aɪ g r ɛu m	aɪ g r ʊ m
t r aː n k m oː n t aː n ʊ m	t r aː n s m ɔ n t aː n ʊ m
s a g ɪ t aː r j ʊ m	s a g ɪ tː aː r j ʊ m
g l ɔ t oː n ɛ m	g l ʊ tː oː n ɛ m
ɪ m p aː r ɛ	ɪ m p a r ɛ m
a k t oː r ɛ	aː k t oː r ɛ m
w ɛ n t r ɛ m	w ɛ n t r ɛ m
p r ɔ l ɔ kʷ j ʊ m	p r oː l ɔ kʷ j ʊ m
p r ɔ p ɪ n kʷ ʊ m	p r ɔ p ɪ ŋ kʷ ʊ m
ɛ k s p ʊ l s aː r ɛ	ɛ k s p ʊ l s aː r ɛ
p eː n d ɛ r ɛ m	p ɛ n d eː r ɛ
ɔ r p ɪ m ɛ n t ʊ m	aʊ r ɪ p ɪ g m ɛ n t ʊ m
p ɔ lː aː r j ʊ m	p ʊ lː aː r j ʊ m
a pː aː r aː r ɛ	a pː aː r eː r ɛ
w ɪ p ɛ r iː n ʊ m	w ɪ p ɛ r iː n ʊ m
a t w ɛ r t ɪ r ɛ	a d w ɛ r t ɛ r ɛ
ʊ n k ɪ a m	ʊ ŋ k j a m
d ɪ g ɛ s t ɪ w ʊ m	d iː g ɛ s t iː w ʊ m
a ŋ g ɛ l ɪ k ʊ m	a ŋ g ɛ l ɪ k ʊ m
ɪ r k ɪ n ʊ m	h ɪ r k iː n ʊ m
r ɛ g ʊ l aː r ɪ t aː t ɛ m	r eː g ʊ l aː r ɪ t aː t ɛ m
k ɪ t ɪ s ʊ m	k y t ɪ s ʊ m
a tː r aː r ɛ m	a tː r a h ɛ r ɛ
m a t r ɔ n aː l ɛ m	m aː t r oː n aː l ɛ m
l ɪ n aɪ m ɛ n t ʊ m	l iː n ɛ aː m ɛ n t ʊ m
s ʊ mː ɪ n ɪ s t r aː r ɛ	s ʊ b m ɪ n ɪ s t r aː r ɛ
b a l ɛ n a m	b a lː aɪ n a m
k r aɪ m aː r ɛ	k r ɛ m aː r ɛ
t ɛ n s j oː n ɛ	t eː n s j oː n ɛ m
f r j ɪ k ʊ m	f r iː g ɪ d ʊ m
g r aː n ʊ m	g r aː n ʊ m
s t ɪ s ʊ eː t ʊ m	s t a t ɪ k ʊ m
r ɛ t r aː ɛ r ɛ	r ɛ t r a h ɛ r ɛ
ɪ n f ɛ r ɛ r ɛ	iː n f ɛ rː ɛ
r ɛ t ɪ n aː k ʊ l ʊ m	r ɛ t ɪ n aː k ʊ l ʊ m
s aʊ l t ʊ m	s a l t ʊ m
ɛ k r b ɛ m z ʊ m	a r b ʊ t ʊ m
f ɛ r uː l ʊ m	f ɛ r ʊ l a m
s ɔ l ɪ l oː kʷ j ʊ m	s oː l ɪ l ɔ kʷ j ʊ m
t ɛ m ɛ r ɛ	t ɪ m eː r ɛ
w ɪ p ɛ r a m	w iː p ɛ r a m
a b s t ɛ n ɛ r ɛ	a b s t ɪ n eː r ɛ
aɪ r ɔ iː	h eː r oː ɛ m
eː r ɔ g aː r ɛ m	eː r ɔ g aː r ɛ
r ɛ p ɛ r k uː s j oː n ɛ m	r ɛ p ɛ r k ʊ t ɛ r ɛ
b ɪ s k a m	b eː s t j a m
ɛ k s aʊ t iː r ɛ	ɛ k s aʊ d iː r ɛ
g ɪ r m aː n ʊ m	g ɛ r m aː n ʊ m
l ɛ d aː r r a m	l ɛ p r a m
a p aː r ɛ t iː r ɛ	a pː aː r eː s k ɛ r ɛ
eː l ɛ n k ʊ m	ɛ l ɛ ŋ kʰ ʊ m
r ɛ j m ʊ sː k aː r ɛ	m ʊ sː aː r ɛ
f ɔ r m oː s ʊ m	f oː r m oː s ʊ m
l ɔ ŋ g ɛ w ʊ m	l ɔ ŋ g aɪ w ʊ m
k a l ɛ f aː t eː r ɛ	k a l ɛ f a k ɛ r ɛ
k ʊ k ʊ r k b ɪ t a m	k ʊ k ʊ r b ɪ t a m
l ɛ ɛ t ʊ m	l aɪ t ʊ m
oː r ɪ ʊ m	h ɔ rː ɛu m
m ɪ s k ɛ l aː n ɛ ʊ m	m ɪ s k ɛ lː aː n ɛu m
t ɪ t ʊ l aː r ɛ	t ɪ t ʊ l aː r ɛ m
g ʊ w ɛ r n aː t oː r ɛ	g ʊ b ɛ r n aː t oː r ɛ m
a b s k ɪ s a m	a b s k ɪ n d ɛ r ɛ
ɔ k ɪ d ɛ n t aː l ɛ	ɔ kː ɪ d ɛ n t aː l ɛ m
ʊ r ʊ m	uː r ʊ m
h k ɛ m	kʷ ɛ m
b a l t ɛu m ʊ m	b a l t ɛu m
g ɛ ɔ g r aː f j ɪ a m	g eː ɔ g r a pʰ j a m
ɔ b t ɛ m p ɛ r aː r ɛ	ɔ b t ɛ m p ɛ r aː r ɛ
l eː d aː t ɔ r ɛ	l aʊ d aː t oː r ɛ m
r ɛ m uː n ɛ r aː r ɛ	r ɛ m uː n ɛ r aː r ɛ
t ɛ t r ʊ m	t aɪ t r ʊ m
ɪ nː ɔ w aː t j oː n ɛ m	ɪ nː ɔ w aː t j oː n ɛ m
ɔ rː iː f ɪ k ʊ m	h ɔ rː ɪ f ɪ k ʊ m
k a r ɪ k k ɛ m	k aː r ɪ k ɛ m
ʊ n iː k ʊ m	uː n ɪ k ʊ m
b uː b ɔ n ɪ k ʊ m	b uː b oː n ɪ k ʊ m
m ɪ t ɪ g aː t j oː n ɛ m	m iː t ɪ g aː t j oː n ɛ m
a k aɪ r b iː t aː t ɛ m	a k ɛ r b ɪ t aː t ɛ m
d eː p r ɛ d aː r ɛ	d eː p r aɪ d aː r iː
k r iː w l aː r ɛ	k r iː b r aː r ɛ
p a s a k r ʊ m	p a sː ɛ r ɛ m
p r ɔ m ɪ t ɛ r ɛ	p r oː m ɪ tː ɛ r ɛ
p ʊ t r ɛ m	p ʊ t r ɛ m
p a w ɪ m ɛ n t ʊ m	p a w iː m ɛ n t ʊ m
ɪ n t ɛ rː ʊ p t j oː n ɛ m	ɪ n t ɛ rː ʊ p t j oː n ɛ m
w ɔ l iː eː r ɛ	w ɛ lː ɛ
s ʊ b m ɛ r g ɛ r ɛ	s ʊ mː ɛ r g ɛ r ɛ
l ɔ n j ɪ t uː d ɪ n ɛ m	l ɔ ŋ g ɪ t uː d ɪ n ɛ m
l ɪ t aː r ɛ	l ɪ t aː r ɛ
a d uː l t ɛ r aː r ɛ	a d ʊ l t ɛ r aː r ɛ
d ɪ m ɛ n s j oː n ɛ m	d iː m ɛ n s j oː n ɛ m
d ɛ h t aː t ɛ m	d ɛ ɪ t aː t ɛ m
d ɪ s t iː n k t ʊ m	d ɪ s t ɪ ŋ k t ʊ m
