r a d ɪ k ɪ ɛ m	r aː d iː k ɛ m
ɪ n ɛ k t j ʊ n ɛ m	ɪ n ɪ ɛ k t j oː n ɛ m
s ʊ p ɛ r eː s ɛ eː r ɛ	s ʊ p ɛ r s ɛ d eː r ɛ
k ɔ n k ʊ s j oː n ɛ m	k ɔ ŋ k ʊ sː j oː n ɛ m
s k a r aː b ɛ m ʊ m	s k a r a b aɪ ʊ m
ɔ kː l uː ɪ k r ɛ	ɔ kː l uː d ɛ r ɛ
k ɔ p ʊ l aː r ɛ	k oː p ʊ l aː r ɛ
fː aː ɛ aː s	f ɔ r j a m
n ɔ k ɪ t ʊ m	n ʊ k eː t ʊ m
d ɛ n t aː l ɛ	d ɛ n t aː l ɛ m
s a b l oː n ɛ m	s a b ʊ l oː n ɛ m
a k k ɛ p t j oː n ɛ m	a kː ɛ p t j oː n ɛ m
ɪ m p r oː b iː t aː t ɛ m	ɪ m p r ɔ b ɪ t aː t ɛ m
a b ɛ s ʊ m	aː w ɛ r s ʊ m
p r aɪ t ɛ r n aː t uː r a l ɛ m	p r aɪ t ɛ r n aː t uː r aː l ɛ m
a b r ɔ k aː t j oː n ɛ m	a b r ɔ g aː t j oː n ɛ m
d eː p r ɪ m ɛ r ɛ	d eː p r ɪ m ɛ r ɛ
d eː f ɛ r ɪ r ɛ	d eː f ɛ rː ɛ
l a s p ɛ d ɛ m	l a p ɪ d ɛ m
a r aː t r ʊ m	a r aː t r ʊ m
b ɛ n ɛ d ɪ k ɛ r ɛ	b ɛ n ɛ d iː k ɛ r ɛ
s y s ʊ m	s ɛ sː ʊ m
d ɪ s t ɔ r kʷ ɛ r ɛ m	d ɪ s t ɔ r kʷ eː r ɛ
k ɔ n s oː l ɪ d aː t j oː n ɛ m	k oː n s ɔ l ɪ d aː t j oː n ɛ m
eː b r ɪ ɛ t aː t ɛ m	eː b r ɪ ɛ t aː t ɛ m
a r k a n ʊ m	a r k aː n ʊ m
ɔ b ɪ ɛ k t ɪ w ʊ m	ɔ b j ɛ k t iː w ʊ m
ɪ n f ɔ r m ɛ m	iː n f oː r m ɛ m
d eː t r ɛ ɛ r ɛ	d eː t r a h ɛ r ɛ
m a l f aː t oː r ɛ	m a l ɛ f a k t oː r ɛ m
s p ɔ l aː r ɛ	s p ɔ l j aː r ɛ
f a k ɪ l ɪ t aː t ɛ m	f a k ɪ l ɪ t aː t ɛ m
t r ɪ n ɪ t aː t ɛ m	t r iː n ɪ t aː t ɛ m
eː l uː d ɛ r ɛ	eː l uː d ɛ r ɛ
s ɔ m n ɪ f ɛ r ʊ m	s ɔ m n ɪ f ɛ r ʊ m
p ɛ r n ɪ k j oː s ʊ m	p ɛ r n ɪ k j oː s ʊ m
k r uː ɛ n t aː r ɛ	k r ʊ ɛ n t aː r ɛ
r uː m ɪ n aː r ɛ	r uː m ɪ n aː r iː
s a t ɪ r ʊ m	s a t y r ʊ m
ɛ ʊ m	ɛu m
t r k ʊ f aː m ʊ m	t uː b ɛ r
p ɔ s ɛ d eː r ɛ	p ɔ sː ɪ d eː r ɛ
a r ʊ k ɛ t ɛ m	a r ɪ ɛ t ɛ m
l ɪ m ɪ t r ɔ pʰ ʊ m	l iː m ɪ t r ɔ pʰ ʊ m
a n w ʊ m	a nː ʊː m
d ɪ g ɛ s t ɪ w ʊ m	d iː g ɛ s t iː w ʊ m
a g aː t a m	a kʰ aː t eː n
p ʊ t r ɪ r ɛ	p ʊ t r ɛ r ɛ
k a w aː r ɛ	k a w aː r ɛ
s a p j ɛ n t a m	s a p ɪ ɛ n t j a m
k ɔ n t aː m ɪ n aː t j oː n ɛ m	k ɔ n t aː m ɪ n aː t j oː n ɛ m
k eː l w n t ɛ m	k a l ɛ n t ɛ m
f aː k t oː r ɛ	f a k t oː r ɛ m
m ɔ r b ʊ m	m ɔ r b ʊ m
ɔ b s ɛ k j oː s ʊ m	ɔ b s ɛ kʷ j oː s ʊ m
t r aː n s aː k t j oː n ɛ m	t r aː n s aː k t j oː n ɛ m
p a k a n ɪ s m ʊ m	p aː g aː n ɪ s m ʊ m
eː l ɪ m ɪ n aː r ɛ	eː l iː m ɪ n aː r ɛ
m ɔ lː ʊ j ɛ m	m ɔ lː ɪ t ɪ ɛ m
k a m b j aː r ɛ	k a m b iː r ɛ
ɛ k s t aː s iː m	ɛ k s t a s ɛ m
m a n ɪ f ɪ ɛ s t ʊ m	m a n ɪ f ɛ s t ʊ m
ɪ m p ɛ r ɪ t j a m	ɪ m p ɛ r iː t j a m
p aɪ ŋ m r ɛ s ɪ l ɛ m	p ɛ t r ɔ s ɛ l iː n ʊ m
ɪ n f ɪ g ɛ r ɛ	iː n f iː g ɛ r ɛ
k ʊ l t ɛ lː ʊ m	k ʊ l t ɛ lː ʊ m
f a k ɛ t ʊ m	f a k eː t ʊ m
g r a t ʊ m	g r aː t ʊ m
a d ɪ s ɪ l j ʊ m	aʊ k s ɪ l j ʊ m
g uː m ɛ n t ʊ m	j uː m ɛ n t ʊ m
d ɔ l k oː aː r ɛ	d ʊ l k oː r ɛ m
p uː n ɪ r ɛ	p uː n iː r ɛ
a l g oː r ɛ	a l g oː r ɛ m
uː m b r aː t ɪ k ʊ m	ʊ m b r aː t ɪ k ʊ m
a r m ɛ n t ʊ m	a r m ɛ n t ʊ m
a w ɛ n a m	a w eː n a m
f uː r t ʊ m	f uː r t ʊ m
s uː b ɪ t aː n ɛ ʊ m	s ʊ b ɪ t aː n ɛu m
eː k s k ɛ l s ʊ m	ɛ k s k ɛ l s ʊ m
s k oː r j a m	s k oː r j a m
p r aɪ p oː s y t ɛ m	p r aɪ p ɔ s ɪ t ʊ m
a b ɪ t ʊ aː l ɛ	h a b ɪ t w aː l ɛ m
t a k s aː r ɛ	t a k s aː r ɛ
k a l ɪ f ʊ m	k a l iː pʰ a m
p ʊ k l ɪ r ɛ	p ɔ l iː r ɛ
s k oː p a m	s k oː p a m
a n ɪ m aː l ɛ	a n ɪ m a l
d ɔ t aː r ɛ	d oː t aː r ɛ
ɔ r t ɔ g r aː f j ʊ m	ɔ r tʰ ɔ g r a pʰ j a m
w ɛ r t ɪ g ɪ n oː s ʊ m	w ɛ r t iː g ɪ n oː s ʊ m
ɪ n s ɪ m n j aː r ɛ	iː n s ɪ ŋ n aː r ɛ
k ɔ r t ɛ m	k oː r t ɛ m
p ɔ n t ɪ f ɪ k ɛ m	p ɔ n t ɪ f ɪ k ɛ m
ɛ k s kʰ r ɛ t aː r ɛ	ɛ k s k ɛ r n ɛ r ɛ
kʷ aɪ r ɛ l a m	kʷ ɛ r eː l a m
r ɛ k aː r ɛ	r ɪ g aː r ɛ
r ɛ t ɪ n aː k l ʊ m	r ɛ t ɪ n aː k ʊ l ʊ m
d eː p r ɛ d aː r ɛ	d eː p r aɪ d aː r iː
k r aɪ d iː t aː r oː r ɛ	k r eː d ɪ t oː r ɛ m
ɪ n aː l aː r ɛ	ɪ n h aː l aː r ɛ
aʊ g uː r ɛ m	aʊ g ʊ r ɛ m
kʷ ɪ n t ʊ m	kʷ iː n t ʊ m
s ɛ p aː r aː r ɛ	s eː p a r aː r ɛ
w ɛ k s aː t j oː n ɛ m	w ɛ k s aː t j oː n ɛ m
r eː n	r ɛ m
k ɛ d r ʊ m	k ɛ d r ʊ m
b a k ʊ l ʊ m	b a k ʊ l ʊ m
ɪ mː ɛ r g ɛ r ɛ	ɪ mː ɛ r g ɛ r ɛ
a l m	aː l ɛ a m
s k aː l p ɛ lː ʊ m	s k a l p ɛ lː ʊ m
s a t aː r ɛ	s a t j aː r ɛ
m a k ɛ lː ʊ m	m a k ɛ lː ʊ m
ɪ n k ʊ rː ɛ r ɛ	ɪ ŋ k ʊ rː ɛ r ɛ
k ɪ r k ʊ n l oː k uː t j oː n ɛ	k ɪ r k ʊ m l ɔ k uː t j oː n ɛ m
ɪ n uː m aː n ɪ t aː t ɛ m	ɪ n h uː m aː n ɪ t aː t ɛ m
a b g uː r aː r ɛ	a b ɪ uː r aː r ɛ
k ɔ n ɛ k s j oː n ɛ m	k ɔ nː ɛ k s j oː n ɛ m
oː	ʊ m
j ʊ b ɛ n k a m	j ʊ w ɛ ŋ k a m
w ɛ s t ɪ t ʊ m	w ɛ s t iː t ʊ m
ɪ n g l ɛ s k ɛ m	a ŋ g l eː n s ɛ m
s uː b r ɛ w eː n ɪ r	s ʊ p ɛ r w ɛ n iː r ɛ
k l aː r ɪ t aː t ɛ m	k l aː r ɪ t aː t ɛ m
p r a w ʊ m	p r aː w ʊ m
g a l a l g ɪ n ɛ m	g a lː ɛ t a m
t r a m a m	t r aː m a m
k r uː d ɛ l ɛ	k r uː d eː l ɛ m
a l uː k iː r nː ʊ m	a l ʊ m n ʊ m
f ɔ t ɪ r ɛ	f ɔ d ɛ r ɛ
k ɔ r t a m	s k ɔ r t ɛ a m
m a g ɛ s t aː t ɛ m	m a j ɛ s t aː t ɛ m
uː l k ɛ r a m	ʊ l k ʊ s
w ɛ l aː r ɛ	w ɛ l a m
s p uː m oː s ʊ m	s p uː m oː s ʊ m
m ɔ d uː l aː r ɛ	m ɔ d ʊ l aː r iː
k ɔ k ɪ n ɪ l a m	k ɔ kː ɪ n a m
m ɪ s k ɛ l aː n ɛ ʊ m	m ɪ s k ɛ lː aː n ɛu m
t ɛ s uː r a m	t eː n s uː r a m
k r a t ɪ k ʊ l a m	k r aː t ɪ k ʊ l a m
p ɔ p ɛ r t aː t ɛ m	p aʊ p ɛ r t aː t ɛ m
a k k ɛ s ʊ m	a kː ɛ sː ʊ m
l a k r ɪ m aː t j oː n ɛ	l a k r ɪ m aː t j oː n ɛ m
p ɛ n aː t eː s	p ɛ n aː t ɛ m
s ɔ l ɪ d aː r ɛ	s ɔ l ɪ d aː r ɛ
f ɔ k a m	pʰ oː k a m
a t ɪ n eː r ɛ	a tː ɪ n eː r ɛ
w ɪ b r aː r ɛ	w ɪ b r aː r ɛ
m uː k ɔ r ɛ m	m uː k oː r ɛ m
l ɔ k a m	l uː t ɛu m
w ɛ s k ɪ m	w eː s k ʊ m
d ɪ k aː k ɛ	d ɪ k aː k ɛ m
a m b a pʰ eː s	a m b aː g ɛ m
w eː t ɛ ɛ	w ɛ t ɛ r ɛ m
l ɔ d aː r aː r ɛ	l ɔ k aː r ɛ
k r ɔ n ɪ k ʊ m	kʰ r ɔ n ɪ k ʊ m
ɔ r k ɛ s t r a m	ɔ r kʰ eː s t r a m
m ɔ r d aː k ɛ	m ɔ r d aː k ɛ m
r ɛ l a t ɪ w ʊ m	r ɛ l aː t iː w ʊ m
l ɛ w ɪ g aː r ɛ	l ɛ w ɪ g aː r ɛ
t r ɪ b a k l aː r ɛ	t r ɪ b ʊ l aː r ɛ
d ɪ w uː l g aː t j oː n ɛ m	d iː w ʊ l g aː t j oː n ɛ m
k ʊ r s ʊ m	k ʊ r s ʊ m
l ɪ b aː r ɛ	l iː b aː r ɛ
p ɔ s t ʊ l aː r ɛ	p ɔ s t ʊ l aː r ɛ
a w oː s ʊ m	a w ʊ m
a k ɛ r b ʊ m	a k ɛ r b ʊ m
r ɛ b ɛ l aː r ɛ	r ɛ b ɛ lː aː r ɛ
k ɔ n s ɪ l j aː r ɛ	k ɔ ŋ k ɪ l j aː r ɛ
k ʊ p r ɪ ʊ m	k uː p r ʊ m
r ɛ d ɪ t ʊ m	r ɛ d ɪ t ʊ m
ɔ rː ɪ f ɪ k ʊ m	h ɔ rː ɪ f ɪ k ʊ m
ɛ k s p ʊ r g aː t j oː n ɛ m	ɛ k s p ʊ r g aː t j oː n ɛ m
a b r ɛ w j aː t j oː n ɛ m	a bː r ɛ w j aː t j oː n ɛ m
k a n ɔ r ʊ m	k a n oː r ʊ m
f a s t iː d aː r ɛ	f a s t iː d iː r ɛ
f ɔ r n aː t ɛ m	f ɔ r n aː k ɛ m
r ɛ k ɔ n k ɪ l j aː t j oː n ɛ m	r ɛ k ɔ ŋ k ɪ l j aː t j oː n ɛ m
k a l k ɛ m	k a l k ɛ m
s m ɛ r a l d ʊ m	s m a r a g d ʊ m
k aː r m ɪ n aː r ɛ	k a r m ɪ n aː r ɛ
m uː n ɪ f ɪ k ɛ n t j a m	m uː n ɪ f ɪ k ɛ n t j a m
p a l uː d oː s ʊ m	p a l uː d oː s ʊ m
p ɛ r k ʊ t ɛ r ɛ	p ɛ r k ʊ t ɛ r ɛ
a fː l ɪ g ɛ r ɛ	a fː l iː g ɛ r ɛ
k k aɪ t aː r ɛ	oː s k ɪ t aː r ɛ
p ɔ r k r ɛ	p ɔ r t j oː n ɛ m
k uː rː ɪ k ʊ l ʊ m	k ʊ rː ɪ k ʊ l ʊ m
f l uː ɪ r ɛ	f l ʊ ɛ r ɛ
h w ɛ r ʊ m	w eː r ʊ m
p ɔ m ɛ k ɛ m	p uː m ɪ k ɛ m
k ɔ n d ɔ l eː r ɔ ɛ	k ɔ n d ɔ l eː r ɛ
k ɔ n s ɛ r w aː t j oː n ɛ m	k oː n s ɛ r w aː t j oː n ɛ m
ɛ t ʊ m	eː t ʊ m
s ɔ l ɛ w aː r ɛ	s ʊ b l ɛ w aː r ɛ
n a f t a m	n a pʰ tʰ a m
p r aɪ s ʊ m ɛ r ɛ	p r aɪ s uː m ɛ r ɛ
p ɔ s ɛ s oː r ɛ	p ɔ sː ɛ sː oː r ɛ m
r ɛ n ʊ ɪ r ɛ	r ɛ n ʊ ɛ r ɛ
b ʊ rː a m	b ʊ rː a m
n ʊ m ɛ r ɔ s ʊ m	n ʊ m ɛ r oː s ʊ m
p r a n d ɛ r ɛ	p r a n d eː r ɛ
k ɔ r j a n d ʊ r ʊ m	k ɔ r j a n d r ʊ m
t r a k j ʊ m	tʰ r aː k j ʊ m
n ɛ g l ɪ g ɛ r ɛ	n ɛ g l ɛ g ɛ r ɛ
g r aː l ʊ m	g r aː k ʊ l ʊ m
k ɪ k ɪ ʊ m	k ɪ kː ʊ m
uː l t ɛ r j oː r ɛ	ʊ l t ɛ r j oː r ɛ m
a tː r ɪ b ʊ ɛ r ɛ	a tː r ɪ b ʊ ɛ r ɛ
ɪ m p r ɔ b ʊ m	ɪ m p r ɔ b ʊ m
g r aː t j oː s ʊ m	g r aː t j oː s ʊ m
t ɪ t ɪ lː aː r ɛ	t iː t ɪ lː aː r ɛ
r eː p uː d j aː r ɛ	r ɛ p ʊ d j aː r ɛ
p ɛ d ɛ s t r ɛ m	p ɛ d ɛ s t r ɛ m
p a g uː r ʊ m	p a g uː r ʊ m
k ɔ n s oː l ɪ d aː r ɛ	k oː n s ɔ l ɪ d aː r ɛ
s uː s k j n aː r ɛ	s uː g ɛ r ɛ
n ɔ n ʊ m	n ɔ nː ʊ m
f ɛ rː uː g t aː r n ɛ m	f ɛ rː uː g ɪ n ɛ m
s ɔ m ɪ aː r ʊ m	s a g m aː r j ʊ m
w ɛ n t ɪ l aː t j oː n ɛ	w ɛ n t ɪ l aː t j oː n ɛ m
d ɛ k s p ɛ r aː t j oː n ɛ m	d eː s p eː r aː t j oː n ɛ m
d ɛ k ɔ lː aː r ɛ	d eː k ɔ lː aː r ɛ
b ɛ n ɪ ŋ n ʊ m	b ɛ n ɪ ŋ n ʊ m
s t ɔ r aː k ɛ m	s t y r a k ɛ m
ɔ b lː w ɪ t aː r ɛ	ɔ b l iː w ɪ s k iː
p l ɔ b j oː s ʊ m	p l ʊ w j oː s ʊ m
l a k s ʊ m	l a k s ʊ m
r ɛ k ɛ n s ɪ r ɛ	r ɛ k eː n s eː r ɛ
h ɔ l ʊ m	ʊ l ʊ m
k ɛ t eː l	k a t ɛ lː a m
n ɔ s ɔ k oː m j ʊ m	n ɔ s ɔ k ɔ m iː ʊ m
w ɪ g ɔ r aː r ɛ	w ɪ g oː r aː r ɛ
aʊ r ɪ r ɛ	h aʊ r iː r ɛ
n ɪ n f a m	n y m pʰ a m
ɪ n d ɪ ŋ n ɪ t aː t ɛ m	ɪ n d ɪ ŋ n ɪ t aː t ɛ m
k uː m ʊ l aː r ɛ	k ʊ m ʊ l aː r ɛ
d ɛ n t ɪ f r ɪ k ʊ m	d ɛ n t ɪ f r ɪ k j ʊ m
s ʊ r t ɪ r ɛ	s ɔ r t iː r iː
ɔ l ɪ g aː r k a m	ɔ l ɪ g a r kʰ a m
p r aɪ t ɛ r iː r ɛ	p r aɪ t ɛ r iː r ɛ
k ɔ m ɛ r ɛ	k ɔ m ɛ d ɛ r ɛ
s p ʊ r k ʊ m	s p ʊ r k ʊ m
a dː ɪ t j oː n ɛ	a dː ɪ t j oː n ɛ m
d ɪ s ɪ m ɪ l ɛ	d ɪ sː ɪ m ɪ l ɛ m
p a d ɛ r ɛ m	p a t r ɛ m
m ɪ k a m	m iː k a m
k a p aː k ɛ	k a p aː k ɛ m
m a r ɪ s k a m	m a r ɪ s k a m
p r aɪ ɔ k ʊ p aː r ɛ	p r aɪ ɔ kː ʊ p aː r ɛ
p uː p a m	p uː p a m
a sː ɔ l aː r ɛ	a sː ɔ l aː r ɛ
s ɛ r p ɛ n t ɪ n ʊ m	s ɛ r p ɛ n t iː n ʊ m
k a r m ɛ m	k a r m ɛ n
a l t ɪ s ɪ m ʊ m	a l t ɪ sː ɪ m ʊ m
k ɔ n k aː t ɛ n aː r ɛ	k ɔ ŋ k a t eː n aː r ɛ
k r j ɛ aː t ʊ r a m	k r ɛ aː t uː r a m
ɪ n kʷ ɪ n aː r ɛ	ɪ ŋ kʷ ɪ n aː r ɛ
l ɪ t aː r ɛ	l ɪ t aː r ɛ
t r a m ɪ t ɛ r ɛ	t r aː m ɪ tː ɛ r ɛ
a p l ʊ m	a m p l ʊ m
t ɔ r ɛ m	t oː r ɛ m
s ɔ r t ɛ m	s ɔ r t ɛ m
ɪ n t ɛ r w ɛ n t j oː ɛ	ɪ n t ɛ r w ɛ n t j oː n ɛ m
f ɪ n ɪ t j oː n ɛ m	f iː n iː t j oː n ɛ m
b l aː n d ɪ r ɛ	b l a n d iː r iː
f r j iː k ʊ m	f r iː g ɪ d ʊ m
f r ɛ m ɪ r ɛ	f r ɛ m ɛ r ɛ
p ɪ s ʊ p aː d ʊ m	ɛ p ɪ s k ɔ p aː t ʊ m
k ɔ s t ʊ m ɛ ɛ m	k oː n s ʊ eː t uː d ɪ n ɛ m
s aː ŋ gʷ ɪ n oː s ʊ m	s a ŋ gʷ ɪ n oː s ʊ m
ɔ s p ɪ t j ʊ m	h ɔ s p ɪ t j ʊ m
r ʊ k rː ɪ s k a m	r oː r ɛ m
a n aɪ t ʊ m	a n eː tʰ ʊ m
t r eː m eː r ɛ	t r ɛ m ɛ r ɛ
ɛ k s uː l k ɛ r aː t j oː n ɛ m	ɛ k s ʊ l k ɛ r aː t j oː n ɛ m
eː d ɪ f ɪ k aː t j oː n ɛ m	aɪ d ɪ f ɪ k aː t j oː n ɛ m
ɛ s t r ɪ k aː r ɛ	ɛ k s t r iː k aː r ɛ
p ɛ k ɔ r a m	p ɛ k ʊ s
p ɔ n d ɛ r oː s ʊ m	p ɔ n d ɛ r oː s ʊ m
m ɪ n ʊ ɪ r ɛ	m ɪ n ʊ ɛ r ɛ
k ɔ n f ʊ t aː r ɛ	k oː n f uː t aː r ɛ
k ɪ k ɛ r	k ɪ k ɛ r
p a l j aː r iː	p a lː j aː r ɛ
a l t ɪ t ʊ d ɪ n ɛ m	a l t ɪ t uː d ɪ n ɛ m
k ɔ r n j ɛ ʊ m	k ɔ r n ɛu m
l uː b r ɪ k ʊ m	l uː b r ɪ k ʊ m
ɪ n t ɛ rː ʊ p t j oː n ɛ m	ɪ n t ɛ rː ʊ p t j oː n ɛ m
a n aː l ɛ	aː n aː l ɛ m
a s	a sː ɛ m
d ɪ f l ʊ ɛ r ɛ	d ɪ fː l ʊ ɛ r ɛ
p a r t ɪ r ɛ	p a r t iː r ɛ
m eː d j ʊ m	m ɛ d j ʊ m
s ɔ n rː ɪ d ɛ r ɛ	s ʊ b r iː d eː r ɛ
a s p ɛ r g eː r ɛ	a s p ɛ r g ɛ r ɛ
l ɪ k ɛ ɛ	l iː kʰ eː n a
a n ɪ h ɪ l aː r ɛ	a nː ɪ h ɪ l aː r ɛ
p l aː sː ʊ m aː r ɛ	p l a s m aː r ɛ
m ɪ eː n t ʊ m	m ɛ n t ʊ m
s ɛ n s aː t j oː n ɛ m	s eː n s aː t j oː n ɛ m
s ɔ t w ʊ s ʊ m	s ʊ m p t ʊ oː s ʊ m
s ɔ n ɛ m	s ɔ n ʊ m
eː m uː l a k t oː r ɛ	aɪ m ʊ l aː t oː r ɛ m
k a p ɛ ɪ t ɛ lː ʊ m	k a p ɪ t ɛ lː ʊ m
ɔ fː ɪ k ɪ n a m	ɔ fː ɪ k iː n a m
g eː r ɪ r ɛ	g ɛ r ɛ r ɛ
s ɛ l w aː t ɪ k	s ɪ l w aː t ɪ k ʊ m
eː k s p l aː n aː r ɛ	ɛ k s p l aː n aː r ɛ
k ɛ r w w ɛ s j a m	k ɛ r w ɪ s j a m
k ɔ n k ʊ rː ɛ r ɛ	k ɔ ŋ k ʊ rː ɛ r ɛ
a m p l ɪ f iː k aː t j oː ɛ	a m p l ɪ f ɪ k aː t j oː n ɛ m
n ɔ t aː r ɛ	n ɔ t aː r ɛ
ɪ n w ɪ t aː r ɛ	ɪ n w iː t aː r ɛ
k ɛ s a t j oː n ɛ m	k ɛ sː aː t j oː n ɛ m
p r oː w a m	p r oː r a m
p r ɔ w ɛ n ɪ r ɛ	p r oː w ɛ n iː r ɛ
k uː l ɛ r a m	kʰ ɔ l ɛ r a m
k a w a l j oː n ɛ r ʊ m	k a b a lː aː r j ʊ m
k a r ɔ t a m	k a r oː t a m
s aʊ l t ʊ m	s a l t ʊ m
f l uː w j aː l ɛ	f l ʊ w j aː l ɛ m
eː r g aː s t ʊ l ʊ m	ɛ r g a s t ʊ l ʊ m
s a kː uː l ʊ m	s a kː ʊ l ʊ m
k ɔ r uː s k aː r ɛ	k ɔ r ʊ s k aː r ɛ
s uː b uː r b aː n ʊ m	s ʊ b ʊ r b aː n ʊ m
w eː n aː r ɛ	w eː n aː r iː
p r ɔ d ɪ g ʊ m	p r oː d ɪ g j ʊ m
oː r ɪ f ɪ k ɛ m	aʊ r ɪ f ɪ k ɛ m
t ɔ p s ɛ k aː r ɛ	t ɔ k s ɪ k aː r ɛ
f ɔ k aː r j aː	f ɔ k aː r j ʊ m
d eː s ɪ d ɛ aː r ɛ	d eː s iː d ɛ r aː r ɛ
h ɔ s t j a m	h ɔ s t j a m
b uː f a l ʊ m	b uː b a l ʊ m
p r aɪ d aː t oː r ɛ	p r aɪ d aː t oː r ɛ m
a t r aː b ɪ l j aː r j ʊ m	aː t r a b iː l aː r j ʊ m
g ɔ k ʊ n d ʊ m	j uː k ʊ n d ʊ m
b a s j aː r ɛ	b aː s j aː r ɛ
l a m b r uː s k a m	l aː b r ʊ s k a m
s ɔ l ʊ m	s ɔ l j ʊ m
n ɪ w ɛ lː ʊ m	l iː b ɛ lː a m
d j aː l ɛ k t ʊ m	d j a l ɛ k t ɔ n
l ɪ m a m	l iː m a m
ɛ r ɛ d ɛ m	h eː r eː d ɛ m
s ɛ rː aː r ɛ	s ɛ r ɛ r ɛ
p l a g j ʊ m	p l a g j ʊ m
a r t j ɪ k ɛ m	a gː ɛ r ɛ m
r ɛ s t r ʊ m	r ɛ s t ɛ m
l aː k ʊ r ɛ	l ɪ k eː r ɛ
r ɛ s k iː n d ɛ r ɛ	r ɛ s k ɪ n d ɛ r ɛ
r ɛ s ɛ r w aː t j oː n ɛ m	r ɛ s ɛ r w aː t j oː n ɛ m
h ɔ s p eː t ɛ m	h ɔ s p ɪ t ɛ m
b r aː k ɛ m	b r aː k aː s
r uː g iː r ɛ	r uː g iː r ɛ
l a s ʊ m	l a sː ʊ m
w ɛ r aː k ɛ	w eː r aː k ɛ m
l uː s t r aː r ɛ	l ʊ s t r aː r ɛ
b ɛ lː ɪ k ʊ m	b ɛ lː ɪ k ʊ m
n uː m ɛ r aː t oː r ɛ	n ʊ m ɛ r aː t oː r ɛ m
p r oː n ʊ m	p r oː n ʊ m
k ɔ n s ʊ l t aː t j oː n ɛ m	k oː n s ʊ l t aː t j oː n ɛ m
l ɪ b ɛ r ʊ m	l iː b ɛ r ʊ m
k a r n ɪ r ʊ m	k a r n aː r j ʊ m
j uː r aː m ɛ n t ʊ m	j uː r aː m ɛ n t ʊ m
k ɔ m a n d aː r ɛ	k ɔ mː ɛ n d aː r ɛ
d ɪ w uː l g aː r ɛ	d iː w ʊ l g aː r ɛ
w a g a b ʊ n d ʊ m	w a g aː b ʊ n d ʊ m
s p oː ŋ g a m	s p ɔ ŋ g j a m
ɔ kː uː l t aː r ɛ	ɔ kː ʊ l t aː r ɛ
t r aː s b s k ɛ n d ɛ r ɛ	t r aː n s k ɛ n d ɛ r ɛ
w ɛ n d ɪ t oː r ɛ	w eː n d ɪ t oː r ɛ m
w ɛ g ɛ t ʊ m	w ɛ g ɛ t ʊ m
w ɪ t uː p ɛ r aː b ɪ l ɛ m	w ɪ t ʊ p ɛ r a b ɪ l ɛ m
d ɛ p l oː r aː r ɛ	d eː p l oː r aː r ɛ
t ɛ k ʊ m	tʰ eː k a m
k ɪ b oː n d ɛ r ʊ m	k l aʊ d ɛ r ɛ
d ɛ w j aː t j oː n ɛ m	d eː w j aː t j oː n ɛ m
s kʷ ʊ m	ɪ s k ʊ m
aɪ r uː g ɪ n oː s ʊ m	aɪ r uː g ɪ n oː s ʊ m
k ɔ m p l ɛ t ɪ w ʊ m	k ɔ m p l eː t iː w ʊ m
d ɪ s kʷ ɪ s iː t j oː n ɛ m	d ɪ s kʷ iː s iː t j oː n ɛ m
l ɛ k t oː r ɛ	l eː k t oː r ɛ m
kʷ aː s t aː r ɛ	kʷ a sː aː r ɛ
m ɛ d ɪ r ɛ	m eː t iː r iː
r ɛ j m sː k aː r ɛ	m ʊ sː aː r ɛ
s ɛ r j oː s ʊ m	s eː r j oː s ʊ m
a b aː j a m	a bː aː t j a m
a n ɔ t aː t j oː n ɛ m	a nː ɔ t aː t j oː n ɛ m
k ɛ r w aː r ɛ	k ɪ r k ɪ n aː r ɛ
f ɔ l r ɪ r ɛ	f ʊ l g ʊ r
k ɔ r t ɛ m	k ɔ h ɔ r t ɛ m
p uː r n ʊ m	p uː r ɛ m
k r aɪ m aː r ɛ	k r ɛ m aː r ɛ
p r j ɔ r ɛ	p r j oː r ɛ m
p uː l k r ɪ t ʊ t ɛ m	p ʊ l kʰ r ɪ t uː d ɪ n ɛ m
a sː a r ɛ	a sː aː r ɛ
k ɔ n f iː n ɛ	k ɔ n f iː n ɛ m
tʰ j a m	tʰ iː a m
p r a k t ɪ k ʊ m	p r a k t ɪ k ʊ m
s a l uː t aː r ɛ	s a l uː t aː r ɛ
p uː bː l ɪ k ʊ m	p uː b l ɪ k ʊ m
ɔ sː a r j ʊ m	ɔ sː aː r j ʊ m
s ɔ l aː r ɪ ʊ r ɛ	s oː l aː r j ʊ m
ɔ n ɔ m aː t ɔ p eː j a m	ɔ n ɔ m a t ɔ p ɔ ɪ j a m
z aː n k a m	z a ŋ kʰ a m
k ɛ s aː r ɛ	k ɛ sː aː r ɛ
s aɪ kʰ r ɛ t ɛ m	s k r iː p t ʊ m
l a b ʊ r aː r ɛ	l a b oː r aː r ɛ
ɪ n s t r ʊ iː r ɛ	iː n s t r ʊ ɛ r ɛ
d ɔ r mː ɪ t aː r ɛ	d ɔ r m iː t aː r ɛ
n ɛ m ɔ r aː l ɛ	n ɛ m ɔ r aː l ɛ m
w ɔ l t aː r ɛ	w ɔ l uː t aː r ɛ
ɪ rː ɔ g aː r ɛ	ɪ rː ɔ g aː r ɛ
a sː ɪ k iː r n aː r ɛ	a sː ɪ ŋ n aː r ɛ
d ɪ s w aː n d ɛ r ɛ	d ɪ sː w aː d eː r ɛ
a t r ʊ m	aː t r ʊ m
a d k uː d ɪ k aː t j oː n ɛ m	a d ɪ uː d ɪ k aː t j oː n ɛ m
