k l ʊ k aː r ɛ	g l oː k iː r ɛ
f eː t ɛ r ɛ	f eː t eː r ɛ
s t r iː g ɪ l ɛ	s t r ɪ g ɪ l ɛ m
b a l n ɛ aː r j ʊ m	b a l n ɛ aː r j ʊ m
eː fː aɪ m ɪ n aː r ɛ	ɛ fː eː m ɪ n aː r ɛ
a m s k ʊ m s ʊ m	a b s k ɔ n s ʊ m
k a n ɪ n ʊ m	k a n iː n ʊ m
k ɔ n f oː r m ɛ m	k oː n f oː r m ɛ m
m ɔ d ɛ r aː t oː r ɛ	m ɔ d ɛ r aː t oː r ɛ m
s ʊ s p ɛ n d ɛ r ɛ	s ʊ s p ɛ n d ɛ r ɛ
k ɔ l ɔ r aː r ɛ	k ɔ l oː r aː r ɛ
m a ŋ g aː r ɛ	m a n d uː k aː r ɛ
ʊ k l	a w ʊ ŋ k ʊ l ʊ m
k ɔ nː ʊ m	k ʊ nː ʊ m
k r ɛ s t aː r	k r ʊ s t aː r ɛ
kʷ ɔ l k a m	k ʊ l k ɪ t a m
a k t oː r ɛ	aː k t oː r ɛ m
s eː n ɛ t uː t ɛ	s ɛ n ɛ k t ʊ m
k ɔ n s ɛ r w aː r ɛ m	k oː n s ɛ r w aː r ɛ
ɛ n s ɛ m	eː n s ɛ m
n uː ʊ ɪ r ɛ	n ɔ k eː r ɛ
d ɪ l uː ɪ r ɛ	d iː l ʊ ɛ r ɛ
l a r g ʊ m	l a r g ʊ m
ɪ n s uː l aː r ɛ	iː n s ʊ l aː r ɛ m
ɛ l ɪ p sː ɪ	ɛ lː iː p s ɪ n
a w ʊ m	a w ʊ m
p oː n t j oː n ɛ	p oː t j oː n ɛ m
m ɛ d ɪ t aː b ɔ n t ʊ m	m ɛ d ɪ t aː b ʊ n d ʊ m
r ɛ k uː s aː r ɛ	r ɛ k uː s aː r ɛ
f ɛ n k ɛ ʊ m	ɛ k s a g j ʊ m
s ɛ p t ɛ n t r j oː n ɛ m	s ɛ p t ɛ n t r j oː n ɛ m
uː s ɪ t aː t ʊ m	uː s ɪ t aː t ʊ m
w ɪ t uː l ɛ m	w ɪ t ʊ l ʊ m
f a s ɔ l a m	f a s k ɪ ɔ l a m
ɔ r ɪ g ɪ n aː r j ʊ m	ɔ r iː g ɪ n aː r j ʊ m
n a d a t oː r ɛ	n a t aː t oː r ɛ m
n uː t aː r	n uː t aː r ɛ
p ɔ pː a m	p ʊ pː ɛ m
p uː n aː r ɛ	p ʊ ŋ n aː r ɛ
f ʊ l ɛ m k aː r	f ɔ lː ɪ k aː r ɛ
a l aː k r ɪ t aː t ɛ m	a l a k r ɪ t aː t ɛ m
k ɔ n t ɛ n d ɛ r ɛ	k ɔ n t ɛ n d ɛ r ɛ
p a l j ʊ m	p a lː j ʊ m
l eː k l ɛ	l eː g aː l ɛ m
k uː w ɪ l	k ʊ b iː l ɛ
k ɛ s p eː t ɛ m	k aɪ s p ɪ t ɛ m
ɔ s m uː aː r ʊ m	ɔ sː w aː r j ʊ m
m uː k oː s ʊ m	m uː k oː s ʊ m
f lː oː	f l ʊ k t ʊ m
ɪ n s ɪ n w a m r ɛ	iː n s ɪ n w aː r ɛ
w ɪ n aː r ɛ	w eː n aː r iː
s a p j ʊ m ɛ	s a p ɪ d ʊ m
s uː p ɛ r b j r ɛ	s ʊ p ɛ r b j a m
r ɛ m ɛ k ɛ r ɛ	r ɛ m ɪ s k eː r ɛ
m oː r ɛ	m oː r ɛ m
a fː ɪ r m aː t j oː n ɛ m	a fː ɪ r m aː t j oː n ɛ m
b ʊ lː ɪ r ɛ	b ʊ lː iː r ɛ
ɪ r a t ʊ m	iː r aː t ʊ m
l ɪ m ʊ m	l iː m ʊ m
a kː uː s aː b iː l ɛ m	a kː uː s aː b ɪ l ɛ m
s ʊ b iː t aː n ɛ ʊ m	s ʊ b ɪ t aː n ɛu m
t r ɪ m ɪ t ɛ r ɛ	t r aː m ɪ tː ɛ r ɛ
l uː k r aː r ɛ	l ʊ k r aː r iː
a k k ɛ s ʊ m	a kː ɛ sː ʊ m
a k t aː r j ʊ m	aː k t w aː r j ʊ m
aʊ s p ɪ k oː	aʊ s p ɪ k j ʊ m
p r ɔ p aː g aː t j oː n ɛ m	p r oː p aː g aː t j oː n ɛ m
f r uː ɛ k t ʊ m	f r uː k t ʊ m
f a s ɪ ɛ m	f a s k ɛ m
s ɛ rː ɛ d ɪ n	s ɛ rː aː g ɪ n ɛ m
ɪ m b ɛ r b ɛ m	ɪ m b ɛ r b ɛ m
r a b uː l a m	r a b ʊ l a m
k a p r ʊ m n	k a p r ʊ m
f uː l m ɪ n aː r ɛ	f ʊ l m ɪ n aː r ɛ
k ɔ l t r ʊ m	k ʊ l t r ʊ m
r eː t ɪ n aː k t l ʊ m	r ɛ t ɪ n aː k ʊ l ʊ m
p r ɔ f ʊ n d ɪ t aː t ɛ m	p r ɔ f ʊ n d ɪ t aː t ɛ m
l ɛ ɛ t ʊ m	l aɪ t ʊ m
t r ɛ m oː r ɛ	t r ɛ m oː r ɛ m
uː r t ɪ k aː r j a m	ʊ r t iː k aː r j a m
s ɔ n aː t oː r ɛ	s ɔ m n j aː t oː r ɛ m
aʊ d j ɛ n t j a m	aʊ d ɪ ɛ n t j a m
n uː m ɛ r ʊ m	n ʊ m ɛ r ʊ m
d ɪ s ɛ r t ʊ m	d ɪ s ɛ r t ʊ m
d uː k ɪ r ɛ	d uː k ɛ r ɛ
k ʊ p r ɛ m ɛ ʊ m	k uː p r ʊ m
l ɔ ŋ g aː n iː m ɪ t aː t ɛ m	l ɔ ŋ g a n ɪ m ɪ t aː t ɛ m
a ŋ g ʊ s t aː r ɛ	a ŋ g ʊ s t aː r ɛ
d eː ɪ ɛ n ɛ r aː r	d eː g ɛ n ɛ r aː r ɛ
t a b ɛ r n a m	t a b ɛ r n a m
p ɛ r m ɪ t ɛ r ɛ	p ɛ r m ɪ tː ɛ r ɛ
ɔ r ɪ ɛ n t ɛ	ɔ r ɪ ɛ n t ɛ m
g r a m a m ɛ	g r aː m ɛ n
a b d uː k t j oː n ɛ m	a b d ʊ k t j oː n ɛ m
k ɪ r k ʊ n l oː k uː t j oː n ɛ m	k ɪ r k ʊ m l ɔ k uː t j oː n ɛ m
n ɛ f aː r j ʊ m	n ɛ f aː r j ʊ m
ɛ k s a m ɪ n aː r ɛ	ɛ k s aː m ɪ n aː r ɛ
ɔ bː l ɪ g aː t j oː n ɛ m	ɔ b l ɪ g aː t j oː n ɛ m
p ɔ m iː k ɛ m	p uː m ɪ k ɛ m
a p r ɪ k ʊ m	a p r iː k ʊ m
ɛ k s uː l t aː t j oː n ɛ m	ɛ k s ʊ l t a t j oː n ɛ m
f ɪ g uː r a m	f ɪ g uː r a m
k ɔ n t r aː d ɪ k t oː r ɛ m	k ɔ n t r aː d ɪ k t oː r ɛ m
f ɔ r ʊ m	f ɔ r ʊ m
k ɔ m p ɛ t ɛ n t j a m	k ɔ m p ɛ t ɛ n t j a m
s a l t aː t j ʊ m n ɛ m	s a l t aː t j oː n ɛ m
f uː r ɪ b ʊ n d ʊ	f ʊ r ɪ b ʊ n d ʊ m
p a t ɛ r n ʊ m	p a t ɛ r n ʊ m
j ɪ r aː r ɛ	g y r aː r ɛ
l a b ʊ r aː t oː r ɛ	l a b oː r aː t oː r ɛ m
p l a n t ʊ m	p l a ŋ k t ʊ m
d uː l k ɪ s ɔ n ʊ m	d ʊ l k ɪ s ɔ n ʊ m
t r aɪ p ɪ d aː t j oː n ɛ m	t r ɛ p ɪ d aː t j oː n ɛ m
a m ɪ k a m	a m iː k a m
t a r d ɪ m oː	t a r d ʊ m
r ɛ p ɛ n t ɛ r ɛ ɛ	p aɪ n ɪ t eː r ɛ
p r ɛ s aː g j aː r ɛ	p r aɪ s aː g iː r ɛ
ɪ n k ɔ l a m	ɪ ŋ k ɔ l a m
d ɪ s p aː r aː r ɛ	d ɪ s p a r eː r ɛ
r ɛ t r ɪ b k ʊ ɪ r ɛ m	r ɛ t r ɪ b ʊ ɛ r ɛ
p ɛ r ʊ r ʊ m	p ɛ r ɪ uː r ʊ m
s ɪ m j ʊ m	s iː m j ʊ m
d eː s ɔ l aː r ɛ	d eː s oː l aː r ɛ
p r ɔ f ɛ t j a m	p r ɔ pʰ eː t iː a m
m a t r ɪ m oː n j ʊ m	m aː t r ɪ m oː n j ʊ m
p a r a t ʊ m	p a r d ʊ m
s p ɛ k ɪ pʰ ɪ k ʊ m	s p ɛ k ɪ f ɪ k ʊ m
s ɔ r t ɪ r ɛ	s ɔ r t iː r iː
f a r m aː k ʊ m	pʰ a r m a k ʊ m
p ɪ n t oː r ɛ	p ɪ k t oː r ɛ m
h t a ŋ g ɛ r ɛ	t a ŋ g ɛ r ɛ
ɛ r aɪ d ɪ r ɛ	h eː r eː d ɪ t aː r ɛ
r ɛ g ʊ l aː r ɛ	r eː g ʊ l aː r ɛ m
ɛ n k oː m j ʊ m	ɛ ŋ k oː m j ʊ m
t r aː d ɪ r ɛ	t r aː d ɛ r ɛ
t a l ʊ t ɛ m	t aː l ʊ m
l ɔ t oː s ʊ m	l ʊ t oː s ʊ m
s ʊ b t ɪ l ɛ m	s ʊ b t iː l ɛ m
f ɛ r ɛ t r ʊ m	f ɛ r ɛ t r ʊ m
ɪ n kʷ j ɛ t aː r ɛ	ɪ ŋ kʷ ɪ eː t aː r ɛ
ɔ r t ɛ n aː t oː r	ɔ r d ɪ n aː t oː r ɛ m
ɔ b s t eː t r ɪ k	ɔ b s t ɛ t r iː k ɛ m
d ɔ r m iː t aː r	d ɔ r m iː t aː r ɛ
s a l w aː r ɛ	s a l w aː r ɛ
s a l a k ɛ	s a l aː k ɛ m
p eː r s k r uː t aː r ɛ m	p ɛ r s k r uː t aː r iː
ɪ n d ɪ n aː t j oː n ɛ m	ɪ n d ɪ ŋ n aː t j oː n ɛ m
p ɛ r p ɛ t r aː r ɛ	p ɛ r p ɛ t r aː r ɛ
ɪ n w ɛ r t ɛ r ɛ	ɪ n w ɛ r t ɛ r ɛ
n ɪ m b ʊ m	n ɪ m b ʊ m
f ɪ m ʊ m	f ɪ m ʊ m
ɪ m p l ɪ k aː r ɛ	ɪ m p l ɪ k aː r ɛ
w iː d ʊ m	w ɔ k ɪ t ʊ m
k ɔ m ɔ d ʊ m	k ɔ mː ɔ d ʊ m
k r eː s p aː r ɛ	k r ɪ s p aː r ɛ
ɛ s k ɔ p r ʊ m	s k a l p r ʊ m
t ɛ r s ʊ m	t ɛ r s ʊ m
s ʊ p r ɛ p oː n ɛ r	s ʊ p ɛ r p oː n ɛ r ɛ
s ɔ m aː r oː	s ʊ mː aː r j ʊ m
k ɔ m p l ɛ m ɛ n n ɛ m ʊ m	k ɔ m p l eː m ɛ n t ʊ m
p ɛ n s ʊ m	p eː n s ʊ m
b a l b ʊ t j aː r ɛ	b a l b uː t iː r ɛ
s m ɛ r a l d ʊ m	s m a r a g d ʊ m
b ɛ l r ɛ aː r j a m	b eː l w a m
l a k uː s t r ɛ m	l a k ʊ s t r ɛ m
m a kː j aː r ɛ	m a k ʊ l aː r ɛ
k a n d ɛ l aː b r ʊ m	k a n d eː l aː b r ʊ m
m ɔ d ɪ r ɛ m	m ɔ l ɛ r ɛ
d eː t ɛ r g eː r ɛ	d eː t ɛ r g eː r ɛ
k ɪ r k ʊ m n aː w iː g aː r ɛ	k ɪ r k ʊ m n aː w ɪ g aː r ɛ
ɪ l uː t ɪ r ɛ	ɪ lː uː d ɛ r ɛ
oː r ɪ ʊ m	h ɔ rː ɛu m
j uː d iː k aː t oː r ɛ	j uː d ɪ k aː t oː r ɛ m
a k t a m	aː k t a
ɪ mː ɛ r g ɛ r ɛ	ɪ mː ɛ r g ɛ r ɛ
f ɛ n d ɛ r ɛ	f ɪ n d ɛ r ɛ
l a m ɛ n t aː r ɛ	l aː m ɛ n t aː r ɛ
ɔ r b ʊ m	ɔ r b ʊ m
j ɛ m ɪ n aː r ɛ	g ɛ m ɪ n aː r ɛ
a s ɪ m ɪ l aː r ɛ	a sː ɪ m ʊ l aː r ɛ
p a l ɛ s t r a m	p a l aɪ s t r a m
t ɛ n ɛ r n ʊ m	t ɛ n ɛ r ʊ m
ɪ n k ɛ n s ʊ m	ɪ ŋ k eː n s ʊ m
s p ɛ k t aː k ʊ l ʊ m	s p ɛ k t aː k ʊ l ʊ m
r ɛ p l ɪ k aː t j oː n ɛ	r ɛ p l ɪ k aː t j oː n ɛ m
k r ɪ t ɪ k ʊ m	k r ɪ t ɪ k ʊ m
f l oː w ɛ m	f l ʊ w j ʊ m
g r uː n ɪ r ɛ	g r ʊ nː iː r ɛ
ɪ n w ɛ s t iː r ɛ	ɪ n w ɛ s t iː r ɛ
a n ɔ s ʊ m	a nː oː s ʊ m
p a t r j a m	p a t r j a m
a b ɪ g ɪ ʊ m	a b ɪ g ɛu m
p ɔ ŋ d aɪ r aː t j ʊ m n ɛ m	p ɔ n d ɛ r aː t j oː n ɛ m
r ɛ d ɪ t ʊ m	r ɛ d ɪ t ʊ m
a n ɔ r m aː l ɛ m	a n oː r m a l ʊ m
m ɛ m b r aː n ʊ m m ʊ m	m ɛ m b r aː n ɛu m
ɛ s k ɪ ɔ t ɛ r ɛ	ɛ k s k ʊ t ɛ r ɛ
eː r aɪ t iː k ɛ m	h aɪ r ɛ t ɪ k ʊ m
l ɪ n aː r ʊ m	l iː n aː r j ʊ m
r ɛ m ɛ m b r aː r ɛ	r ɛ m ɛ m ɔ r aː r iː
ɔ bː l ɪ g aː r ɛ	ɔ b l ɪ g aː r ɛ
r ɛ k t ɪ t uː d	r ɛ k t ɪ t uː d ɪ n ɛ m
k ɔ n k ɪ n iː t a m t ɛ m	k ɔ ŋ k ɪ nː ɪ t aː t ɛ m
ɪ mː aː t ʊ r iː t t ɛ m t ɛ m	ɪ mː aː t uː r ɪ t aː t ɛ m
t r uː k ɪ d aː r ɛ	t r ʊ k iː d aː r ɛ
p a l ʊ m b aː r j ʊ m	p a l ʊ m b aː r j ʊ m
d eː n uː d aː r ɛ	d eː n uː d aː r ɛ
w ɛ lː ʊ m	w ɪ lː ʊ m
w uː l n ɛ r aː r ɛ	w ʊ l n ɛ r aː r ɛ
oː k ɪ t aː r ɛ	oː s k ɪ t aː r ɛ
r ɛ s ɛ m k aː r ɛ	r ɛ s ɛ k aː r ɛ
ɪ n t ɛ r w ɛ n t j oː n	ɪ n t ɛ r w ɛ n t j oː n ɛ m
k r uː k ɪ f eː r ʊ m	k r ʊ k ɪ f ɛ r ʊ m
a r t ɛ m aː s j a m	a r t ɛ m ɪ s j a m
a gː r aː r oː	aː g r aː r j ʊ m
f ɔ l oː s ʊ m	f ɔ l j oː s ʊ m
f a s t ɪ g j ʊ m	f a s t iː g j ʊ m
aʊ k m ɛ n t aː t j oː n ɛ m	aʊ g m ɛ n t aː t j oː n ɛ m
w ɛ r ɪ f ɪ k aː t j oː n ɛ m	w ɛ r ɪ f ɪ k aː t j oː n ɛ m
a g ɪ r ɛ	a g ɛ r ɛ
p a l m aː r ɪ m	p a l m aː r ɛ m
s t r ɪ d ɛ r ɛ	s t r iː d ɛ r ɛ
g ɛ r uː n d j ʊ m	g ɛ r ʊ n d j ʊ m
r ɔ ɛ k ʊ m	r aʊ k ʊ m
r eː s uː t ɪ t aː t j oː n ɛ m	r ɛ s ʊ s k ɪ t aː t j oː n ɛ m
l a r ɪ ʊ m	l a r d ʊ m
d ɪ s p oː r ɛ n	d ɪ s p oː n ɛ r ɛ
s p uː r j ʊ m	s p ʊ r j ʊ m
d eː m ɔ s t r aː t j oː n ɛ m	d eː m oː n s t r aː t j oː n ɛ m
d ɪ s p ɛ r g ɛ r ɛ	d ɪ s p ɛ r g ɛ r ɛ
m ɔ s t r r ɛ ʊ r ɛ ʊ m	m oː n s t r ʊ oː s ʊ m
l ɛ d ɛ m	l eː g ɛ m
r a k ɪ m oː s ʊ m	r a k eː m oː s ʊ m
a ɪ t oː r ɛ	a s t ʊ r ɛ m
j a n t aː r ɛ	j ɛ n t aː r ɛ
ɪ r s uː t ʊ m	h ɪ r s uː t ʊ m
s ɔ l ɪ k ɪ t uː d ɪ n ɛ m	s ɔ lː ɪ k ɪ t uː d ɪ n ɛ m
r ɛ s t aʊ r aː r ɛ	r ɛ s t aʊ r aː r ɛ
k ɔ n k aː t ɛ n aː r ɛ m	k ɔ ŋ k a t eː n aː r ɛ
ɪ n uː n d aː t j oː n	ɪ n ʊ n d aː t j oː n ɛ m
l a k r ɪ m a m	l a k r ɪ m a m
s a b j oː n ɛ m	s a b ʊ l oː n ɛ m
r ɛ l ɛ g aː t j oː n ɛ m	r ɛ l eː g aː t j oː n ɛ m
s ʊ s t r aː k t j oː n ɛ m	s ʊ b t r a k t j oː n ɛ m
d eː k ɔ rː ɛ r m ɛ	d eː k ʊ rː ɛ r ɛ
a sː ɛ r ɪ r ɛ	a sː ɛ r ɛ r ɛ
p ɪ p aː r ɛ	p iː p aː r ɛ
ɪ l ʊ m	h iː l ʊ m
t r aː n s aː k t j oː n ɛ m	t r aː n s aː k t j oː n ɛ m
kʷ ɪ n kʷ ɛ n aː l ɛ	kʷ iː ŋ kʷ ɛ nː aː l ɛ m
m a n k ʊ m	m a ŋ k ʊ m
ɔ t r ɛ m	ʊ t r ʊ m
w ɛ r g ɛ l ɛ m ɛ	w ɪ r ɪ d aː r j ʊ m
s ɪ l w ɛ s t r ɛ m	s ɪ l w ɛ s t r ɛ m
ɛ fː l uː ɪ r ɛ	ɛ fː l ʊ ɛ r ɛ
p r ɔ d ʊ k t j oː n ɛ m	p r oː d ʊ k t j oː n ɛ m
a k ʊ n	ɛ kː ʊ m
a sː ɛ t aː r ɛ	a sː ɛ k t aː r iː
r ɛ k l aː m aː r ɛ	r ɛ k l aː m aː r ɛ
s a k r aː r j ʊ m	s a k r aː r j ʊ m
r ɛ s t ɪ t ʊ ɛ r ɛ m	r ɛ s t ɪ t ʊ ɛ r ɛ
ɪ n f ɛ k t aː r	iː n f ɪ k ɛ r ɛ
ɪ n s ɛ r t j oː n ɛ m	iː n s ɛ r t j oː n ɛ m
r ɛ w ɔ k aː t j oː n ɛ m	r ɛ w ɔ k aː t j oː n ɛ m
p a r t ɪ k ʊ l aː r ɛ	p a r t ɪ k ʊ l aː r ɛ m
k ɛ w a m r ɛ	k ʊ b aː r ɛ
m ɔ w iː m ɛ n t ʊ m	m oː w ɪ m ɛ n t ʊ m
m a t ɛ r n iː t ɛ t ɛ m	m aː t ɛ r n ɪ t aː t ɛ m
ɛ n k a n ɪ t eː r	ɪ ŋ k aː n eː s k ɛ r ɛ
ɛ k s ɔ r t aː r ɛ	ɛ k s h ɔ r t aː r iː
p r oː w ɛ d eː r ɛ	p r oː w ɪ d eː r ɛ
b ʊ k iː n a m	b uː k ɪ n a m
k ɪ s t ɛ r n a m	k ɪ s t ɛ r n a m
k ɔ n s ɛ r w aː t j oː n ɛ m	k oː n s ɛ r w aː t j oː n ɛ m
p r ɛ w ɛ r ɛ	p r aɪ w ɪ d eː r ɛ
p iː g r ɪ t j a m	p ɪ g r ɪ t j a m
s a lː ɪ n a m	s a l iː n a m
ɪ m p ɛ lː ɛ r ɛ	ɪ m p ɛ lː ɛ r ɛ
m uː nː ɪ r	m ɔ n eː r ɛ
f ʊ n t ɛ m	f ɔ n t ɛ m
d ɛ k s t eː r ɪ t aː t ɛ m	d ɛ k s t ɛ r ɪ t aː t ɛ m
m eː t a lː ɪ pʰ a r ʊ m	m ɛ t a lː ɪ f ɛ r ʊ m
k ɔ n w ɪ k t j oː n ɛ m	k ɔ n w iː k t j oː n ɛ m
b a r b aː t ʊ m	b a r b aː t ʊ m
iː m p ɛ t ɪ k j ɪ k ɛ m	ɪ m p ɛ t iː g ɪ n ɛ m
g eː m ɪ t ʊ m	g ɛ m ɪ t ʊ m
t oː n ɛ	t j oː n ɛ m
m ʊ w ɛ r ɛ	m ɔ w eː r ɛ
j uː ŋ g ɛ r ɛ	j ʊ ŋ g ɛ r ɛ
b a r a t r ʊ m	b a r a tʰ r ʊ m
b a s ɪ l ɪ k a m	b a s ɪ l ɪ k a m
ɔ s p ɪ t j ʊ m	h ɔ s p ɪ t j ʊ m
t r aː b aː l	t r a b aː l ɛ m
l a ŋ gʷ ɪ d ʊ m	l a ŋ gʷ ɪ d ʊ m
a d uː l t ɛ r aː r ɛ	a d ʊ l t ɛ r aː r ɛ
k r ɛ d iː t oː r ɛ	k r eː d ɪ t oː r ɛ m
m a l w a m	m a l w a m
s p ɛ s ʊ m	s p ɪ sː ʊ m
b ɛ r ʊ b ɪ n ɛ m ɛ m	w ɛ r w eː k s
l a t ɪ t ʊ d ɪ n ɛ m	l aː t ɪ t uː d ɪ n ɛ m
f ʊ n d ɪ b uː l ʊ m	f ʊ n d ɪ b ʊ l ʊ m
ɛ k s p ʊ ŋ n aː r ɛ	ɛ k s p ʊ ŋ n aː r ɛ
aɪ r ɔ ɛ m	h eː r oː ɛ m
k ɔ m p aː s iː b l ɛ m	k ɔ m p a sː ɪ b ɪ l ɛ m
s p ɛ k ʊ l aː t ɪ w ʊ m	s p ɛ k ʊ l aː t iː w ʊ m
s ɔ l t ʊ m	s ɔ l uː t ʊ m
s aɪ l w a m	s ɪ l w a m
ɪ m p r ɔ b ʊ m	ɪ m p r ɔ b ʊ m
l uː s t r ʊ m	l ʊ s t r ʊ m
k a r a n ɛ r ʊ m	k a r n aː r j ʊ m
b ɛ l aː r ɛ	b aː l aː r ɛ
l a m a m	l aː m a m
t ɔ r t ɪ l ɛ	t ɔ r t ɪ l ɛ m
p a s t oː r ɛ	p aː s t oː r ɛ m
s k oː t j a m	s k ɔ t j a m
p r ɔ r ʊ m p ɛ r ɛ	p r oː r ʊ m p ɛ r ɛ
ɪ n t ɛ n t j oː n ɛ m	ɪ n t ɛ n t j oː n ɛ m
p ʊ t r ɛ m	p ʊ t r ɛ m
s a kː uː l ʊ	s a kː ʊ l ʊ m
ɪ n ɛ b r j a m r ɛ	ɪ n eː b r j aː r ɛ
k r ɛ aː t r ɪ k ɛ	k r ɛ aː t r iː k ɛ m
l a n k m aː r ɛ	l a ŋ k ɛ aː r ɛ
k a p ɪ t ʊ l aː t j oː n ɛ m	k a p ɪ t ʊ l aː t j oː n ɛ m
t aɪ t ʊ m	t eː k t ʊ m
p ɛ l aː k ʊ m	p ɛ l a g ʊ s
k ɔ k t ʊ r a m	k ɔ k t uː r a m
k ɔ n w oː k aː r ɛ	k ɔ n w ɔ k aː r ɛ
k ɔ lː ʊ m	k ɔ lː ʊ m
ɛ k s k ʊ r s j oː n ɛ m	ɛ k s k ʊ r s j oː n ɛ m
d ɔ w l ʊ m	d ɔ l ʊ m
ɛ n k r ɛ n ɛ	ɪ ŋ k uː d ɛ m
k ɔ n t ɪ n w ʊ m	k ɔ n t ɪ n ʊː m
a k ɛ f aː l ʊ m	a k ɛ pʰ a l ʊ m
d ɪ k t aː m ɛ n	d ɪ k t aː m ɛ n
k ɔ n t ɔ r k ɛ r ɛ m	k ɔ n t ɔ r kʷ eː r ɛ
g ɔ d ɛ r ɛ	g aʊ d eː r ɛ
s t r j a m	s t r j a m
s t aː t ɛ r a m	s t a t eː r a m
k ɔ n d ɛ n aː t j oː n ɛ m	k ɔ n d ɛ m n aː t j oː n ɛ m
f a k ʊ d j ɛ m	f aː k ʊ n d j a m
l ɪ n aː m ɛ n t ʊ m	l iː n ɛ aː m ɛ n t ʊ m
l ɪ b ɛ r aː l ɪ t aː t ɛ m	l iː b ɛ r aː l ɪ t aː t ɛ m
g ɔ r t ʊ m	g ʊ r d ʊ m
eː kʷ ɪ l ɪ b r j ʊ m	aɪ kʷ ɪ l iː b r j ʊ m
ɪ ŋ d ɪ t j ʊ m	ɪ n d ɪ k j ʊ m
p r aɪ m oː n iː t oː r ɛ m	p r aɪ m ɔ n ɪ t oː r ɛ m
a m ɛ t ɪ s t aː	a m ɛ tʰ y s t a m
g ʊ w ɛ r n aː t oː r ɛ m	g ʊ b ɛ r n aː t oː r ɛ m
p a ɪ s ɛ	p aː g eː n s ɛ m
a s t r ʊ m	a s t r ʊ m
a pː aː r ɛ n t ɛ	a pː a r ɛ n t ɛ m
ɔ r m ɪ ɪ d ʊ m	h ɔ rː ɪ d ʊ m
ɔ b s k ʊ r ʊ m	ɔ b s k uː r ʊ m
p uː d oː r ɛ m	p ʊ d oː r ɛ m
t r aː n s m iː s j oː n ɛ m	t r aː n s m ɪ sː j oː n ɛ m
ɪ n w iː d j a m	ɪ n w ɪ d j a m
s p ɛ r aː r ɛ	s p eː r aː r ɛ
s ɛ p t ɛ n t r j ɔ n aː l ɛ m	s ɛ p t ɛ n t r j oː n aː l ɛ m
r ɛ g j ʊ m	r eː g j ʊ m
a gː l uː t ɪ n r ɛ r ɛ	a gː l uː t ɪ n aː r ɛ
m a k ɪ n aː r	m aː kʰ ɪ n aː r iː
j ɛu m ɛu r ɛ ɛ m	g ɛ m ɛ lː ʊ m
b a kː a l oː r aː t ʊ m	b a kː a l aʊ r ɛ a t ʊ m
f ɪ d ɛ l ɛ	f ɪ d eː l ɛ m
ɪ n f ɛ r m iː t aː t ɛ m	iː n f ɪ r m ɪ t aː t ɛ m
a d m ɪ n ɪ s t r aː r ɛ	a d m ɪ n ɪ s t r aː r ɛ
a k ʊ m	a k ʊ m
a r g ɛ n t ʊ m	a r g ɛ n t ʊ m
k ɔ k s aː l ɛ	k ɔ k s aː l ɛ m
ɪ ŋ g uː s t ʊ m	ɪ n ɪ uː s t ʊ m
m ɛ ŋ d aː t j ʊ m	m ɛ n d aː k j ʊ m
k l aː j oː l ʊ m	g l a d ɪ ɔ l ʊ m
k ɪ d j ʊ m	k iː d j ʊ m
d ɪ k aː k ɛ	d ɪ k aː k ɛ m
p ɔ p ɛ r t aː t ɛ m	p aʊ p ɛ r t aː t ɛ m
k l aː r ɪ t aː t ɛ m	k l aː r ɪ t aː t ɛ m
w ɛ l ɛ r ɛ m	w ɛ lː ɛ r ɛ
a m b oː s	a m b oː s
a r ɪ ɪ l ʊ m	h a r ɪ ɔ l ʊ m
ɔ r aː t j ʊ m n ɛ m	oː r aː t j oː n ɛ m
s ʊ b ɔ r n aː r ɛ	s ʊ b oː r n aː r ɛ
f ɛ r m ɛ m n t ʊ m	f ɛ r m ɛ n t ʊ m
d eː t ɛ r m ɪ n aː r ɛ	d eː t ɛ r m ɪ n aː r ɛ
ɔ pː oː n ɛ r ɛ	ɔ pː oː n ɛ r ɛ
s ʊ s t ɛ k n t aː k oː n l ʊ m	s ʊ s t ɛ n t aː k ʊ l ʊ m
k oː b n aː t ʊ m	k ɔ ŋ n aː t ʊ m
ɪ s ɔ l aː t ʊ m	iː n s ʊ l aː t ʊ m
r ɛ k ɔ rː ɛ r ɛ	r ɛ k ʊ rː ɛ r ɛ
t r aɪ p ɪ d aː r ɛ	t r ɛ p ɪ d aː r ɛ
a n aː r k j a m	a n a r kʰ j a m
p r ɔ d ɪ g j oː s j ʊ m	p r oː d ɪ g j oː s ʊ m
g l ɔ t oː n ɛ	g l ʊ tː oː n ɛ m
f ɔ r m a m	f oː r m a m
b ŋ l aː t a m	b l a tː a m
ɔ pː ɔ r t uː n ɪ t aː t ɛ m	ɔ pː ɔ r t uː n ɪ t aː t ɛ m
a b ɛ s ʊ m	aː w ɛ r s ʊ m
l ɪ k aː t j oː n ɛ m	l ɪ g aː t j oː n ɛ m
ɛ k s t ɪ r p aː t j oː n ɛ m	ɛ k sː t ɪ r p aː t j oː n ɛ m
d ɪ fː a m aː t oː r j ʊ m	d ɪ fː aː m aː t oː r j ʊ m
s eː m ɪ l ɛ	s ɪ m ɪ l ɛ m
t ɛ m ɛ r ɛ	t ɪ m eː r ɛ
w ɪ b r aː t j oː n ɛ m	w ɪ b r aː t j oː n ɛ m
k r ɪ m ɪ n oː s ʊ m	k r iː m ɪ n oː s ʊ m
h ɛ r b oː s ʊ m	h ɛ r b oː s ʊ m
p a n a k a m	p a n a k eːa m
g ɛ l ʊ m	g ɛ l uː
p a t r j aː r k a m	p a t r j a r kʰ a m
s p ʊ r k aː r ɛ	s p ʊ r k aː r ɛ
ɔ fː ɪ k ɪ n a m	ɔ fː ɪ k iː n a m
r ɛ fː r m ɛ n ɛ n	r ɛ f r eː n aː r ɛ
r ɔ s t r ʊ m	r oː s t r ʊ m
s ɔ d aː l ɪ t aː t ɛ m	s ɔ d aː l ɪ t aː t ɛ m
t ɛ m ɛ r ɪ t aː t ɛ m	t ɛ m ɛ r ɪ t aː t ɛ m
l ɪ b ɛ lː ʊ l a m	l iː b ɛ lː ʊ l a m
f ɔ r m ɪ k aː r ɛ	f ɔ r m iː k aː r ɛ
