l a p ɪ d a m r ɛ	l a p ɪ d aː r ɛ
f aː t ʊ m	f aː t ʊ m
m a t r ɪ t ɪ d a m	m aː t r ɪ k iː d a m
a l t ɛ r k a t j ʊ m n ɛ m	a l t ɛ r k aː t j oː n ɛ m
d ɛ t ɛ r j ɪ ɔ r a t j ʊ m n ɛ m	d eː t ɛ r j oː r aː t j oː n ɛ m
s a l t a t j ʊ m n ɛ m	s a l t aː t j oː n ɛ m
a k r ɛ t a t ɛ	aː k r ɪ t aː t ɛ m
t r ɛ m ʊ l aː r ɛ	t r ɛ m ʊ l aː r ɛ
p ɛ s t ɛ	p ɛ s t ɛ m
w ɔ r a m r ɛ	w ɔ r aː r ɛ
t r a n s uː b s t a n t j aː r ɛ	t r aː n s ʊ b s t a n t j aː r ɛ
ɛ m s p a n d ɛ r ɛ	ɛ k s p a n d ɛ r ɛ
ɪ m p r ɔ b ʊ m	ɪ m p r ɔ b ʊ m
d ɪ s k r ɛ p a m n t j a m	d ɪ s k r ɛ p a n t j a m
k ɔ n f ɛ d ɛ r a t j ʊ m n ɛ m	k oː n f ɔ ɪ d ɛ r aː t j oː n ɛ m
s ʊ m p ʊ m r ɛ	s ɔ p oː r ɛ m
k r ɛ m a m	k r aː m ʊ m
l a m k uː s t r ɛ	l a k ʊ s t r ɛ m
k ɔ d ɪ k ɪ lː ʊ m	k oː d ɪ k ɪ lː ʊ m
aː lː ʊ ŋ g aː r ɛ	eː l ɔ ŋ g aː r ɛ
s t a b ɪ l k ɛ r ɛ	s t a b ɪ l iː r ɛ
a w ɪ n a m	a w eː n a m
ɛ w oː r ɛ ʊ m	ɛ b ɔ r ɛu m
p aː p a m	p aː p a m
ɪ n s oː n t ɛ	iː n s ɔ n t ɛ m
ɔ r ɪ f ɪ k ʊ m	h ɔ rː ɪ f ɪ k ʊ m
k ɔ ŋ g r ɛ g aː r ɛ	k ɔ ŋ g r ɛ g aː r ɛ
r aː n k oː r ɛ	r a ŋ k oː r ɛ m
k ɔ lː ɛ m	k ɔ lː ɛ m
oː t j oː s ʊ m	oː t j oː s ʊ m
p r ɔ w ɔ k a t oː r ɛ	p r oː w ɔ k aː t oː r ɛ m
ɔ r j ɪ ʊ n d ʊ m	ɔ r j ʊ n d ʊ m
d eː s ɛ r t j ʊ m n ɛ m	d eː s ɛ r t j oː n ɛ m
s t r ɪ g ɪ l ɛ	s t r ɪ g ɪ l ɛ m
d uː b ɪ t a t j ʊ m n ɛ m	d ʊ b ɪ t aː t j oː n ɛ m
p ɛ m s ʊ m	p eː n s ʊ m
p a m l uː d a m m ɛ n t ʊ m	p a l uː d aː m ɛ n t ʊ m
m ɛ m b r a n ʊ m s ʊ m	m ɛ m b r aː n ɛu m
ɔ w a m	uː w a m
d ɛ n uː d a t j ʊ m n ɛ m	d eː n uː d aː t j oː n ɛ m
w ɛ ɛ r ɔ s ɔ l ɛu m ɪ t aː nː ʊ m	h ɪ ɛ r ɔ s ɔ l y m iː t aː n ʊ m
t ɛ d j oː s ʊ m	t aɪ d j oː s ʊ m
aː s t r ʊ m	a s t r ʊ m
s t ʊ r n ɪ k ʊ m	s t ʊ r n ʊ m
a n s a m	aː n s a m
b ʊ lː ɪ r ɛ	b ʊ lː iː r ɛ
a m l b uː m m a	a l b uː m ɛ n
m ʊ s t r ʊ ʊ m s ʊ m	m oː n s t r ʊ oː s ʊ m
f ɪ g uː r a m	f ɪ g uː r a m
s ʊ b ɪ t aː n ɛ ʊ m	s ʊ b ɪ t aː n ɛu m
p eː r w ɛ n ɪ r ɛ	p ɛ r w ɛ n iː r ɛ
aː t ʊ m	aː t ʊ m
d uː r a m t j ʊ m n ɛ m	d uː r aː t j oː n ɛ m
d ɪ s k r ɛ p a m r ɛ	d ɪ s k r ɛ p aː r ɛ
d ɛ s t ɪ n a t j ɔ n	d eː s t ɪ n aː t j oː n ɛ m
k ɛ r ɛ m ɔ n j a l ɛ	k aɪ r ɪ m oː n j aː l ɛ m
f ɔ r n ɪ k s ɛ m	f ɔ r n ɪ k ɛ m
kʷ a d ɛ r n ʊ m	kʷ a t ɛ r n oː s
aʊ g uː r j ʊ m	aʊ g ʊ r j ʊ m
p r ɔ m ɛ s a m	p r oː m ɪ sː ʊ m
ɔ s k uː l a m t j ʊ m n ɛ m	ɔ s k ʊ l aː t j oː n ɛ m
d ɪ s t r ɛ ɛ r ɛ	d ɪ s t r a h ɛ r ɛ
ɔ r b ʊ m	ɔ r b ʊ m
k j ɛ n kʷ ɛ m k	kʷ ɛ m k ʊ m kʷ ɛ
a b l a k t a s w ɛ m	a b l a k t aː t j oː n ɛ m
w ɛ lː ʊ m	w ɪ lː ʊ m
p a r j ɪ ɛ t a l ɛ	p a r ɪ ɛ t aː l ɛ m
f j ɛ r ɪ t aː	f ɛ r ɪ t aː t ɛ m
l ɔ n g ɪ t uː d n ɛ	l ɔ ŋ g ɪ t uː d ɪ n ɛ m
uː b ɛ r ɛ m	uː b ɛ r
ɔ k uː l aː r ɛ	ɔ k ʊ l aː r ɛ m
s ʊ m b r a m	ʊ m b r a m
t oː r n ʊ m	t ɔ r n ʊ m
ɔ b s ɛ r w aː r	ɔ b s ɛ r w aː r ɛ
t ɪ d a m	t aɪ d a m
n ɔ t ɪ t j a m	n oː t ɪ t j a m
k oː ŋ g j ʊ m	k ɔ ŋ g j ʊ m
s uː p l ɪ t j ʊ m	s ʊ pː l ɪ k j ʊ m
s p oː s ʊ	s p oː n s ʊ m
l uː k j ʊ m	l uː k j ʊ m
s k r uː p uː l oː s ʊ m	s k r uː p ʊ l oː s ʊ m
k ɔ n k ʊ rː ɛ r ɛ	k ɔ ŋ k ʊ rː ɛ r ɛ
r ɛ w ɛ r ɛ n t ɛ	r ɛ w ɛ r ɛ n t ɛ m
k ɔ m m ɔ t j oː n ɛ	k ɔ mː oː t j oː n ɛ m
p l uː m a m	p l uː m a m
s t aː t ʊ m	s t a t ʊ m
ɪ n k ɔ m ɔ d aː r	ɪ ŋ k ɔ mː ɔ d aː r ɛ
t ʊ r m ɛ n t ʊ m	t ɔ r m ɛ n t ʊ m
iː n d ɪ g ɛ n t a m	ɪ n d ɪ g ɛ n t j a m
ɪ ŋ n ɛ ʊ m	ɪ ŋ n ɛu m
l ʊ t r d ʊ m	l uː r ɪ d ʊ m
uː s w aː r j ʊ m	uː s w aː r j ʊ m
t a r d aː r ɛ	t a r d aː r ɛ
g r a w ɪ t a t j oː n ɛ	g r a w ɪ t aː t j oː n ɛ m
d ɪ s p aː r ɛ r r ɛ	d ɪ s p a r eː r ɛ
n a w j ɪ r ʊ m ʊ m	n aː w ɪ g j ʊ m
k ɔ n t r ɪ s t aː r ɛ	k ɔ n t r iː s t aː r ɛ
r ɛ p ɛ t ɛ r ɛ	r ɛ p ɛ t ɛ r ɛ
b ʊ m b aː r d a m	b ɔ m b a r d a m
ɪ n f a n d ʊ m	iː n f a n d ʊ m
iː n t ɛ m p ɛ s t ɪ w ʊ m	ɪ n t ɛ m p ɛ s t iː w ʊ m
s a m r aː r ɛ	s aː n aː r ɛ
f uː n j ɛ	f uː n ɛ m
g l ɛ m r j a m	g l aː r ɛ a m
f r uː ɛ k t ʊ m	f r uː k t ʊ m
ɔ s t ɪ l ɛ	h ɔ s t iː l ɛ m
p ɛ r m ɪ s j oː n ɛ m	p ɛ r m ɪ sː j oː n ɛ m
p uː r y n ʊ m	p uː r ɛ m
p a t r j a r k a m	p a t r j a r kʰ a m
n ɪ d ʊ m	n iː d ʊ m
kʷ r ɪ b l aː r ɛ	k r iː b r aː r ɛ
d eː w ɔ r a t j ʊ m n ɛ m	d eː w ɔ r aː t j oː n ɛ m
s k a n d ʊ l a m	s k a n d ʊ l a m
w ʊ m l p ɛ	w ʊ l p ɛ m
p r ɔ m uː l g a t j ʊ m n ɛ m	p r oː m ʊ l g aː t j oː n ɛ m
f ɛ m ɪ n ɪ n ʊ m	f eː m ɪ n iː n ʊ m
p ɛ k uː l ʊ m	p ɛ k uː l j ʊ m
d uː b j ʊ m	d ʊ b j ʊ m
m ɪ s t uː r a m	m ɪ s t uː r a m
s ʊ b m ɛ r g ɛ r ɛ	s ʊ mː ɛ r g ɛ r ɛ
k a t ɛ d r a l ɛ	k a tʰ ɛ d r aː l ɛ m
s k ʊ rː ɛ r ɛ	ɛ k s k ʊ rː ɛ r ɛ
ɔ fː ɪ k ɪ n a m	ɔ fː ɪ k iː n a m
p r ɛ ʊ s t ɪ b ʊ l ʊ m	p r oː s t ɪ b ʊ l ʊ m
ɪ n w ɪ t a t j ʊ m n ɛ m	ɪ n w ɪ t aː t j oː n ɛ m
k ɔ m p l ɛ t ʊ m	k ɔ m p l eː t ʊ m
k ɔ n s ɔ r t ɛ	k oː n s ɔ r t ɛ m
t ɛ r t j a m r ɛ	t ɛ r t j aː r ɛ
k uː r w aː r ɛ	k ʊ r w aː r ɛ
f l uː w j ɪ a l ɛ	f l ʊ w j aː l ɛ m
p a m r ɪ r	p a r ɛ r ɛ
k ɔ n s ɛ r w a t j ʊ m n ɛ m	k oː n s ɛ r w aː t j oː n ɛ m
d ɛ r ɪ s oː r j ʊ m	d eː r iː s oː r j ʊ m
p m ɛ ɪ k t ɪ n aː r ɛ	p ɛ k t ɪ n aː r ɛ
k a m l k aː n ʊ m	k a l k aː n ɛu m
b aː r a m t r ʊ m	b a r a tʰ r ʊ m
k uː r a m	k uː r a m
t r ɪ g ɛ s ɪ m ʊ m	t r iː g eː s ɪ m ʊ m
ɔ lː a m	ɔ lː a m
n ʊ m ɪ n m a r ɛ	n oː m ɪ n aː r ɛ
s a k ɛ r d ɔ t j ʊ m	s a k ɛ r d oː t j ʊ m
t aː s ʊ m	t a k s ʊ m
a s k ɛ n d ɛ r ɛ	a s k ɛ n d ɛ r ɛ
a p j aː r j ʊ m	a p j aː r j ʊ m
ɪ n f r ɪ ŋ g ɛ r ɛ	iː n f r ɪ ŋ g ɛ r ɛ
s ɛ r ɛ n aː r ɛ	s ɛ r eː n aː r ɛ
h ɪ s p a n ɪ k ʊ m	h ɪ s p aː n ɪ k ʊ m
f ɔ s a m	f ɔ sː a m
d ɪ w ɛ r t ɪ r ɛ	d iː w ɛ r t ɛ r ɛ
m ʊ l t ɪ p l ɪ k a t j oː n ɛ	m ʊ l t ɪ p l ɪ k aː t j oː n ɛ m
d ɛ k l a m aː r ɛ	d eː k l aː m aː r ɛ
k a m r ɛ k ɛ r	k a r eː r ɛ
m a m k ɛ lː ʊ m	m a k ɛ lː ʊ m
k ɔ n t r a d ɪ k t oː r ɛ	k ɔ n t r aː d ɪ k t oː r ɛ m
d ɛ l a t j ʊ m n ɛ m	d eː l aː t j oː n ɛ m
p ɔ s aː r ɛ	p aʊ s aː r ɛ
p j ɛ aː n aː	p aɪ aː n ɛ m
s oː l ʊ m	s oː l ʊ m
m a m r s uː p j ʊ m	m a r s uː p j ʊ m
g r a t ɪ f ɛ aː r	g r aː t ɪ f ɪ k aː r iː
w ɛ r m ɪ l ɛ ʊ m	w ɛ r m ɪ k ʊ l ʊ m
iː n f ɛ r ɛ r ɛ	iː n f ɛ rː ɛ
ɔ p ɛ r aː r ɛ	ɔ p ɛ r aː r iː
m uː nː ɪ r	m ɔ n eː r ɛ
g uː d ɪ t j aː r j ʊ m	j uː d ɪ k j aː r j ʊ m
k ɔ n d ɪ s k ɛ n d ɛ r ɛ	k ɔ n d eː s k ɛ n d ɛ r ɛ
r ɛ l ɛ g aː r ɛ	r ɛ l ɛ g ɛ r ɛ
a m n ɛ g aː r	eː n ɛ k aː r ɛ
k ɔ n s ɔ l ɪ d aː r ɛ	k oː n s ɔ l ɪ d aː r ɛ
ɛ k s a m ɪ n aː r ɛ	ɛ k s aː m ɪ n aː r ɛ
ɔ s t ɛ n s ɪ w ʊ m	ɔ s t eː n s iː w ʊ m
k ɪ r k uː lː aː r	k ɪ r k ʊ l aː r ɛ
ɛ kʷ ɪ l ɪ b r j ʊ m	aɪ kʷ ɪ l iː b r j ʊ m
f ɔ r aː r ɛ	f ɔ r aː r ɛ
p a l ʊ m	p aː l ʊ m
ɪ k s uː l t ɛ	ɛ k s ʊ l t aː r ɛ
t ɪ d a m	k iː d a m
g r a m a n	g r aː m ɛ n
k a p ɪ r ʊ m ʊ m	k a p ɪ t ʊ l ʊ m
b uː b ɔ n ɪ k ʊ m	b uː b oː n ɪ k ʊ m
f a r m a k eː ʊ t ɪ k ʊ m	pʰ a r m a k ɛu t ɪ k ʊ m
g l uː t ɪ n ɛ	g l uː t ɛ n
a b ɔ rː ɪ r ɛ	a b h ɔ rː eː r ɛ
t ɛ n a k ʊ l ʊ m	k eː n aː k ʊ l ʊ m
l iː m p j ɪ d ɛ m	l ɪ m p ɪ d ʊ m
ʊ m l w ɪ t aː r ɛ	ɔ b l iː w ɪ s k iː
b a s ɪ l ɪ s k ʊ m	b a s ɪ l ɪ s k ʊ m
k ɪ b aː r ɛ	k ɪ b aː r ɛ
ʊ r ɪ n a m	uː r iː n a m
f ɔ k ɛ	f aʊ k ɛ m
r ɛ k ɔ n k ɪ l j a t j ʊ m n ɛ m	r ɛ k ɔ ŋ k ɪ l j aː t j oː n ɛ m
p a t r j a r k aː t ʊ m	p a t r j a r kʰ a t ʊ m
l ɪ t uː r g j a m	l iː t uː r g j a m
iː n s a n ʊ m	iː n s aː n ʊ m
d ɛ s ɪ s t ɛ r	d eː s ɪ s t ɛ r ɛ
uː n ɪ f ɔ r m ɛ m	uː n ɪ f oː r m ɛ m
m a k s ɛ lː aː r ɛ	m a k s ɪ lː a r ɛ m
aʊ g uː r aː r ɛ	aʊ g ʊ r aː r ɛ
g ɛ m ɪ n a m t j ʊ m n ɛ m	g ɛ m ɪ n aː t j oː n ɛ m
a pː ɔ r t a m r ɛ	a pː ɔ r t aː r ɛ
f ɔ r t ɪ t uː d ɪ n ɛ	f ɔ r t ɪ t uː d ɪ n ɛ m
ɪ rː ɪ t aː r	ɪ rː iː t aː r ɛ
ʊ r r	h ɔ rː eː r ɛ
r a m ʊ m	r aː m ʊ m
p r ɛ t ɛ r ɪ r	p r aɪ t ɛ r iː r ɛ
k a l l ɛ m	k aʊ l ɛ m
ɔ r n aː t ʊ m	oː r n aː t ʊ m
k r ɛ d uː l ʊ m	k r eː d ʊ l ʊ m
w ? ʊ m	b uː b oː n ɛ m
t ɛ l a m m	t eː g ʊ l a m
k ɔ ɛ r t a m m j ɔ n	k ɔ ɪ r k ɪ t j oː n ɛ m
f r ɛ kʷ ɛ n t ɛ m	f r ɛ kʷ ɛ n t ɛ m
ɛ r ʊ t ʊ m	r uː k t ʊ m
g r a m m ʊ m	g r aː n ʊ m
kʷ aː d r ʊ m	kʷ aː d r ʊ m
k ɔ k ʊ m ɛ r ʊ m	k ʊ k ʊ m ɛ r ɛ m
ɪ k ʊ m	ɪ k ʊ m
r uː s t ɪ k a n ʊ m	r uː s t ɪ k aː n ʊ m
p r ɛ k aː r ɛ	p r ɛ k aː r iː
f a l a ŋ g ɛ	pʰ a l a ŋ g ɛ m
ɔ s t ɛ n t aː r ɛ	ɔ s t ɛ n t aː r ɛ
t r uː k uː l ɛ n t ʊ m	t r ʊ k ʊ l ɛ n t ʊ m
aː b ɪ l ɛ	h a b ɪ l ɛ m
ɛ s k uː r a m	s k ʊ rː a m
p l aː n ʊ m	p l aː n ʊ m
p r ɔ f uː g ʊ m	p r ɔ f ʊ g ʊ m
aʊ t ɔ r ɪ t aː t ɛ m	aʊ k t oː r ɪ t aː t ɛ m
ɛ r ɔ r ɛ m	ɛ rː oː r ɛ m
k l ɪ m a m t ɛ r ɪ k ʊ m	k l iː m a k t eː r ɪ k ʊ m
m a l ɛ	m a l ʊ m
s t ɔ r aː k ɛ	s t y r a k ɛ m
t m ɛ s oː r ʊ m	tʰ eː s aʊ r ʊ m
a b ɪ m ʊ m	a b y sː ʊ m
l a m k t ɪ k ɪ n j ʊ m	l a k t ɪ k iː n j ʊ m
n a w ɪ k ɛ lː a m	n aː w ɪ k ɛ lː a m
p ɛ r m a m n ɛ r ɛ	p ɛ r m a n eː r ɛ
n ʊ m ɛ r aː r ɛ	n ʊ m ɛ r aː r ɛ
p a m g a n a t iː t a m	p aː g aː n ɪ t aː t ɛ m
iː n t ɛ r w ɛ r t ɪ r	ɪ n t ɛ r w ɛ r t ɛ r ɛ
k ɔ d ɪ k ɛ	k oː d ɪ k ɛ m
d ɛ aː m b uː l a t j ʊ m n ɛ m	d ɛ a m b ʊ l aː t j oː n ɛ m
b ɛ n ɛ d ɛ t oː	b ɛ n ɛ d ɪ k t ʊ m
r eː m ʊ m	r eː m ʊ m
t a m ɪ s ʊ m	t a m ɪ s j ʊ m
l ɪ m ʊ m	l iː m ʊ m
ɪ n t ɛ lː ɛ s ʊ eː t k j ʊ n ɛ m	ɪ n t ɛ lː ɛ k t j oː n ɛ m
p r ʊ p ɪ n kʷ ʊ m	p r ɔ p ɪ ŋ kʷ ʊ m
uː l k ɛ r a m	ʊ l k ʊ s
p aː b ʊ lː ʊ	p aː b ʊ l ʊ m
p r ɪ w aː t ʊ m	p r iː w aː t ʊ m
f ɪ l ɔ s ɔ f j a m	pʰ ɪ l ɔ s ɔ pʰ j a m
p ɛ r k ɪ r ɪ r	p ɛ r kʷ iː r ɛ r ɛ
d aː t a m	d a t a
p ɔ s t ɛ r ʊ m	p ɔ s t ɛ r ʊ m
f ɪ l j aː s t r ʊ m	f iː l j a s t r ʊ m
p r ɔ r ɔ g a t j ʊ m n ɛ m	p r oː r ɔ g aː t j oː n ɛ m
k aː lː ʊ m	k a lː ʊ m
k a m l ɛ n d a m s	k a l ɛ n d aː s
ɛ m ɛ r ɪ d ɪ aː r ɛ	m ɛ r iː d j aː r ɛ
s ʊ l ɛ r t ɛ	s ɔ lː ɛ r t ɛ m
d ɪ l uː ɪ r ɛ	d iː l ʊ ɛ r ɛ
d ɛ s w j a m r ɛ	d eː w j aː r ɛ
w ɛ n j a m	w ɛ n j a m
p a s aː r ɛ	p a n d ɛ r ɛ
w ɪ w aː k ɛ	w iː w aː k ɛ m
ɛ n d uː r ɛ t ɪ r	ɪ n d uː r eː s k ɛ r ɛ
ɪ m m a m t uː r ʊ m	ɪ mː aː t uː r ʊ m
s p ɛ k ʊ j ʊ m	s p ɛ k l ʊ m
w ɛ k s a t j ʊ m n ɛ m	w ɛ k s aː t j oː n ɛ m
d uː r ʊ m	d uː r ʊ m
k ɔ m p l ɛ m ɛ n t ʊ m	k ɔ m p l eː m ɛ n t ʊ m
k a p ɛ lː ʊ m	k a p ɪ lː ʊ m
p r ɛ p oː s ɪ t ʊ m	p r aɪ p ɔ s ɪ t ʊ m
ɛ ʊ m	ɛu m
ɪ m p ɛ r j ʊ m	ɪ m p ɛ r j ʊ m
m ɛ n uː l a m n	m ɪ n uː t j a m
ɔ pː ɔ r t uː n ɪ t aː t ɛ m	ɔ pː ɔ r t uː n ɪ t aː t ɛ m
g ʊ n f j a m r ɛ	k oː n f l aː r ɛ
p r ɛ t ɛ n d ɛ r ɛ	p r aɪ t ɛ n d ɛ r ɛ
ɔ n oː r ɛ	h ɔ n oː r ɛ m
k ɔ n w ɛ n ɪ r ɛ	k ɔ n w ɛ n iː r ɛ
aː m aː r ɛ	a m aː r ɛ
a t r ʊ m	aː t r ʊ m
aː g r ʊ m	a g r ʊ m
n ʊ m w ɪ l uː n j ʊ m	n ɔ w ɪ l uː n j ʊ m
ɛ p a m r k ɛ r ʊ m	p a r t j aː r j ʊ m
k ɔ ɔ k ʊ m	k ɔ kʷ ʊ m
d ɛ p r ɪ m ɛ r ɛ	d eː p r ɪ m ɛ r ɛ
k r w ʊ a r	k r ʊ oː r ɛ m
p r ɛ d a t ʊ n ɛ m	p r aɪ d aː t j oː n ɛ m
r ɪ g ʊ r oː s ʊ m	r ɪ g ɔ r ɔ s ʊ m
k ɔ n t r a k t ɛ r ɛ	k ɔ n t r a h ɛ r ɛ
s a l w aː r ɛ	s a l w aː r ɛ
r aː d ɪ k ɪ n ɛ	r aː d iː k ɛ m
w ɔ m l ɔ n t ɛ m m	w ɔ l ʊ n t aː t ɛ m
d ɛ r uː ɛ r	d iː r ʊ ɛ r ɛ
ɪ m aː g ɪ n ɛ	ɪ m aː g ɪ n ɛ m
w ɔ l uː b ɪ l ɛ	w ɔ l uː b ɪ l ɛ m
l a s ɪ r	l ɪ k eː r ɛ
ɪ n k eː n d ɛ r ɛ	ɪ ŋ k ɛ n d ɛ r ɛ
j eː p s ʊ m	g y p s ʊ m
r ɛ s ɛ r w a t j ʊ m n ɛ m	r ɛ s ɛ r w aː t j oː n ɛ m
iː n w ɛ r t iː r ɛ	ɪ n w ɛ r t ɛ r ɛ
g l a m k a m	g l a k ɪ ɛ m
d ɛ t ɛ k t a r m ɛ ɪ	d eː t ɛ g ɛ r ɛ
p r ɔ f ɛ t j a m	p r ɔ pʰ eː t iː a m
d ɛ p r ɛ d a t j ʊ m n ɛ m	d eː p r aɪ d aː t j oː n ɛ m
a fː a s k ɪ n aː r ɛ	f a s k ɪ n aː r ɛ
l ɛ k ʊ m	l aː ɪ k ʊ m
s iː n s ɪ p uː t	s ɪ ŋ k ɪ p ʊ t
r ɛ n ʊ ɪ r	r ɛ n ʊ ɛ r ɛ
ɛ k s p ɪ r a t j ʊ m n ɛ m	ɛ k sː p iː r aː t j oː n ɛ m
s ʊ b m ɛ r s j oː n ɛ	s ʊ mː ɛ r s j oː n ɛ m
g ɔ d ɛ r ɛ	g aʊ d eː r ɛ
ɛ s ɛ k j ɛ s	ɛ k sː ɛ kʷ j a m
f l ɔ k oː s ʊ m	f l ɔ kː oː s ʊ m
ɛ b ɛ t ɛ	h ɛ b ɛ t ɛ m
p r ɛ m w ɛ r ɛ n ʊ m	w eː r
ɔ r ɪ g ɪ n aː r j ʊ m	ɔ r iː g ɪ n aː r j ʊ m
t r ɔ n ʊ m	tʰ r ɔ n ʊ m
ɛ k s t a s ɪ s	ɛ k s t a s ɛ m
d ɛ f r aʊ d a m t j ʊ m n ɛ m	d eː f r aʊ d aː t j oː n ɛ m
ɛ s t ɪ m uː l a m k j oː n	s t ɪ m ʊ l aː t j oː n ɛ m
w ɪ k t ʊ m	w iː k t ʊ m
s ʊ p r s ɛ eː r ɛ	s ʊ p ɛ r s ɛ d eː r ɛ
ɛ k s a k ɛ r b a t j ʊ m n ɛ m	ɛ k s a k ɛ r b aː t j oː n ɛ m
ɛ k s t ɛ r m ɪ n a t j oː n	ɛ k s t ɛ r m ɪ n aː t j oː n ɛ m
s p ɪ n a l ɛ	s p iː n aː l ɛ m
a m b l a m k t aː r	a b l a k t aː r ɛ
f ɛ r m ɛ n t a t j ʊ m n ɛ m	f ɛ r m ɛ n t aː t j oː n ɛ m
g uː m ɛ n t ʊ m	j uː m ɛ n t ʊ m
f a m s t ɪ g j ʊ m	f a s t iː g j ʊ m
g a m b a m	g a m b a m
s ʊ p ɛ r ɛ m pː ɔ n ɛ r ɛ	s ʊ p ɛ r p oː n ɛ r ɛ
m ɔ t ʊ m	m ʊ tː ʊ m
ɛ k s t ɛ r j oː r	ɛ k s t ɛ r j oː r ɛ m
k ɔ n s ɪ s t ɛ r ɛ	k oː n s ɪ s t ɛ r ɛ
k r ɪ m ɪ n ɛ	k r iː m ɛ n
ɛ s k uː l eː n t ʊ m	eː s k ʊ l ɛ n t ʊ m
a m ɛ n ʊ m	a m ɔ ɪ n ʊ m
m a n t ɪ p m j ʊ	m a ŋ k ɪ p j ʊ m
k ʊ n s oː b r ɪ n ʊ m	k oː n s oː b r iː n ʊ m
k ɔ t ɔ r n ɪ k ɛ	k oː t ʊ r n iː k ɛ m
m aː pː a m	m a pː a m
f oː k aː r j aː	f ɔ k aː r j ʊ m
w ɛ r n a l ɛ	w ɛ r n aː l ɛ m
f uː l w ʊ m	f ʊ l w ʊ m
g r a l ʊ m	g r aː k ʊ l ʊ m
t ʊ m s ʊ m	t oː n s ʊ m
t ɛ m p ɔ r aː l ɛ	t ɛ m p ɔ r aː l ɛ m
iː ŋ g ɛ r ɪ r ɛ	ɪ ŋ g ɛ r ɛ r ɛ
a s ɪ d w ʊ m	a sː ɪ d ʊː m
a r g uː t j a m	a r g uː t j a m
r ɪ j ʊ m	r iː w ʊ m
l uː k r aː r ɛ	l ʊ k r aː r iː
s a r k ɪ n a m	s a r k ɪ n a m
d ʊ m m ɪ n ɪ k a m l ɛ	d ɔ m ɪ n ɪ k aː l ɛ m
d ɛ g ɔ lː aː r	d eː k ɔ lː aː r ɛ
k ʊ k ɪ n a m	k ɔ kʷ iː n a m
ɔ s p ɪ t a l ɛ	h ɔ s p ɪ t aː l ɛ
s a t uː r aː r ɛ	s a t ʊ r aː r ɛ
ɔ r ɪ zː oː n t ɛ m	h ɔ r ɪ zː ɔ n t a
ɪ n k ɪ d ɪ r ɛ	ɪ ŋ k ɪ d ɛ r ɛ
k uː r aː r ɛ	k uː r aː r ɛ
k ɔ n w ɛ k s ʊ m	k ɔ n w ɛ k s ʊ m
kʷ r ɪ b ʊ m	k r iː b r ʊ m
p eː r a m	p eː r a m
p r ɛ p ɔ s t ɛ r ʊ m	p r aɪ p ɔ s t ɛ r ʊ m
p ɛ n d ɛ r ɛ	p ɛ n d eː r ɛ
p r ɔ t ɔ k ɔ l aː r j ʊ m	p r oː t ɔ k ɔ lː aː r j ʊ m
k ɔ ŋ g uː r aː r ɛ	k ɔ n ɪ uː r aː r ɛ
k a t ɛ n t ɛ m a m r ɛ	k a t eː n aː r ɛ
p aː n uː r a m	p aɪ n ʊ l a m
ɪ n w ɔ l w ɛ r ɛ	ɪ n w ɔ l w ɛ r ɛ
f ɛ d ɛ l ɛ	f ɪ d eː l ɛ m
s ʊ s p ɪ r ʊ m	s ʊ s p ɪ r j ʊ m
kʷ aː s a m r ɛ	kʷ a sː aː r ɛ
t r a b ɛ k ʊ l a m	t r a b eː k ʊ l a m
s ɛ r p ɛ n t ɪ n ʊ m	s ɛ r p ɛ n t iː n ʊ m
p r ɛ s ɛ n t j a m	p r aɪ s k ɪ ɛ n t j a m
ɪ t j a m	ɪ t j a m
a s t uː t j a m	a s t uː t j a m
ʊ n ʊ r aː b ɪ l ɛ	h ɔ n oː r aː b ɪ l ɛ m
ɪ n ɪ t j a l ɛ	ɪ n ɪ t j aː l ɛ m
a s t r ɪ ŋ g ɛ r ɛ	a s t r ɪ ŋ g ɛ r ɛ
ʊ ŋ g uː l aː t ʊ m	ʊ ŋ g ʊ l aː t ʊ m
g ɛ ʊ m m ɛ t r j a m	g ɛ oː m ɛ t r j a m
r ɪ t ʊ m	r iː t ʊ m
k ɔ rː ɔ s j oː n ɛ	k ɔ rː oː s j oː n ɛ m
a m s ɛ t aː r	a sː ɛ k t aː r iː
w ɛ s k	w ɪ k ɛ m
t r a m m s f ʊ n d ɪ r ɛ	t r aː n s f ʊ n d ɛ r ɛ
f eː m ɪ l a m	f eː m ɛ lː a m
a m l t ɪ s ɪ m ʊ m	a l t ɪ sː ɪ m ʊ m
s ɔ d a l ɪ t aː t ɛ m	s ɔ d aː l ɪ t aː t ɛ m
k ʊ rː ɛ aː	k ɔ rː ɪ g j a m
s ɛ w ɛ r ʊ m	s ɛ w eː r ʊ m
s a m l ɪ w a m r ɛ	s a l iː w aː r ɛ
a d ʊ n aː r ɛ	a d uː n aː r ɛ
ʊ m l ɪ r ɛ	ɔ l eː r ɛ
s t uː p ɪ r ɛ	s t ʊ p eː r ɛ
k ɔ n s ɪ d ɛ r a t j ʊ m n ɛ m	k oː n s iː d ɛ r aː t j oː n ɛ m
k a d uː k ʊ m	k a d uː k ʊ m
r ɛ p r ɛ ɛ n s ɪ b ɪ l ɛ	r ɛ p r ɛ h ɛ n s ɪ b ɪ l ɛ m
s ʊ s p ɪ r aː r ɛ	s ʊ s p iː r aː r ɛ
iː n f ɛ s t a m r ɛ	iː n f ɛ s t aː r ɛ
n ʊ s ʊ k ɔ m j ʊ m	n ɔ s ɔ k ɔ m iː ʊ m
f r ɛ n a m r ɛ	f r eː n aː r ɛ
t ɔ l ɛ r ɛ	t ɔ lː ɛ r ɛ
k ɛ s aː r ɛ	k ɛ sː aː r ɛ
iː n t ɪ m a t j ʊ m n ɛ m	ɪ n t ɪ m aː t j oː n ɛ m
ɪ ŋ kʷ ɪ n ɛ	ɪ ŋ gʷ ɛ n
w ɛ r s aː t ɪ l	w ɛ r s aː t ɪ l ɛ m
iː n s t aʊ r aː r ɛ	iː n s t aʊ r aː r ɛ
uː m ɪ d ʊ m	h uː m ɪ d ʊ m
