k l a pː oː n ɛ	k aː p oː n ɛ m
s ɛ r aː r	s ɛ rː aː r ɛ
p r ɔ w ɔ k a m t iː w ʊ m	p r oː w ɔ k aː t iː w ʊ m
k r ɛ d ɪ t oː r ɛ	k r eː d ɪ t oː r ɛ m
iː n k ɔ l a m	ɪ ŋ k ɔ l a m
k a l iː k ɛ n	k a l ɪ k ɛ m
p r ɔ d iː j ʊ m m j ʊ m	p r oː d ɪ g j oː s ʊ m
k ɔ n ʊ n g ɛ r ɛ	k ɔ n j ʊ ŋ g ɛ r ɛ
t ɛ d aː r ʊ m	t eː k t ʊ m
t ɛ ɔ s ɔ f j a m	tʰ ɛ ɔ s ɔ pʰ j a m
p ɛ m s ʊ m	p eː n s ʊ m
m ɔ r iː b ʊ n d ʊ m	m ɔ r ɪ b ʊ n d ʊ m
t r ɛ p iː d ʊ m	t r ɛ p ɪ d ʊ m
r ɛ f r iː g ɛ r j ʊ m	r eː f r iː g ɛ r j ʊ m
ɔ m n iː s ɛ n t ɛ	ɔ m n ɪ s k ɪ ɛ n t ɛ m
a n j j ɛ lː ʊ m	a ŋ n ɛ lː ʊ m
p ɔ n d ɛ r oː s ʊ m	p ɔ n d ɛ r oː s ʊ m
k ʊ n k iː t a t j ʊ m n ɛ m	k ɔ ŋ k ɪ t aː t j oː n ɛ m
iː n d a m g a m r ɛ	ɪ n d aː g aː r ɛ
l a m m b ɛ r ɛ	l a m b ɛ r ɛ
aː rː a m s	a rː h a m
ɔ p r ɔ b r j ʊ m	ɔ pː r ɔ b r j ʊ m
d ɛ t ɛ k t a r m ɛ ɛ m	d eː t ɛ g ɛ r ɛ
d iː k t a m ɛ n	d ɪ k t aː m ɛ n
a k ɛ r b ʊ m	a k ɛ r b ʊ m
k ɛ r t a m m ɛ m	k ɛ r t aː m ɛ n
iː ŋ g r aː t ʊ m	ɪ ŋ g r aː t ʊ m
w ɛ t a m	w ɪ tː a m
iː n t ɪ m p ɛ s t iː w iː t aː t ɛ	ɪ n t ɛ m p ɛ s t iː w ɪ t aː t ɛ m
w iː s p ɛ r a m	w ɛ s p ɛ r a m
w a n ɪ	w a nː ʊ m
uː r n a m	uː r n a m
a kʷ iː l ɪ n ʊ m	a kʷ ɪ l iː n ʊ m
p r ʊ p iː n kʷ iː t a t ɛ m	p r ɔ p ɪ ŋ kʷ ɪ t aː t ɛ m
s ɛ r j ɔ s ʊ m	s eː r j oː s ʊ m
s ɛ r ɛ m n aː r ɛ	s ɛ r eː n aː r ɛ
k aː b l ʊ m	k a p ʊ l ʊ m
k ɔ n s ʊ p t j ʊ m n ɛ m	k oː n s uː m p t j oː n ɛ m
a m w j ɛ s ʊ m	aː w ɛ r s ʊ m
w a g aː r ɛ	w a g aː r iː
d j a b oː l iː k ʊ m	d j a b ɔ l ɪ k ʊ m
ɔ p uː s k ʊ l ʊ m	ɔ p ʊ s k ʊ l ʊ m
k ɔ l ʊ b a m	k ɔ l ʊ m b a m
s t ɔ l iː d ʊ m	s t ɔ l ɪ d ʊ m
a b n ɔ r m ɛ m	a b n oː r m ɛ m
s p ʊ s aː r ɛ	s p oː n s aː r ɛ
r a p iː d iː t aː	r a p ɪ d ɪ t aː t ɛ m
r ɔ s m a r iː n ʊ m	r oː r ɛ mː a r iː n ʊ m
ɛ ? ɛ t ʊ m	f ɪ l ɪ k t ʊ m
n ʊ t r iː k ɛ	n uː t r iː k ɛ m
p ɛ r f iː d ʊ m	p ɛ r f ɪ d ʊ m
m j ɛ d ʊ m	m ɛ t ʊ m
f ɛ rː uː g ɪ n ɛ	f ɛ rː uː g ɪ n ɛ m
ɪ m p ɛ d ɛ r ɛ	ɪ m p ɛ d iː r ɛ
w eː n ɛ t m oː m ʊ m	w ɛ n ɛ t ʊ m
s ɔ	s ʊ ɛ m
m ɛ s uː r aː r ɛ	m eː n s uː r aː r ɛ
p r ɛ t ɛ k s t aː r	p r aɪ t ɛ k s ɛ r ɛ
s uː m ɪ r ɛ	s uː m ɛ r ɛ
iː m p r ɛ k aː r ɛ	ɪ m p r ɛ k aː r iː
s ʊ s p iː r ʊ m	s ʊ s p ɪ r j ʊ m
p ɛ r s w a d ɛ r ɛ	p ɛ r s w aː d eː r ɛ
p r ɔ d uː k t iː w ʊ m	p r oː d ʊ k t iː w ʊ m
aʊ l a m	aʊ l a m
k ɔ n t aː r	k ɔ m p ʊ t aː r ɛ
ɪ n s ɛ m n aː r ɛ	iː n s ɪ ŋ n aː r ɛ
g ʊ ŋ g ɛu m r ɛ	j ʊ ŋ g ɛ r ɛ
a d ɔ r aː r ɛ	a d oː r aː r ɛ
s ɛ k s t ʊ m	s ɛ k s t ʊ m
ɛ m iː k r a n j a m	h eː m ɪ k r aː n j a m
t r a n s iː g ɛ r	t r aː n s ɪ g ɛ r ɛ
g r a t j oː s ʊ m	g r aː t j oː s ʊ m
k ʊ w a m r ɛ	k ʊ b aː r ɛ
s kʷ aː l ʊ m	s kʷ aː l ʊ m
k a m p r ʊ m m	k a p r ʊ m
r ɛ t a r d a m r ɛ	r ɛ t a r d aː r ɛ
s uː fː iː k j ɛ n t j a m	s ʊ fː ɪ k ɪ ɛ n t j a m
r ɛ d uː k t j oː n ɛ m	r ɛ d ʊ k t j oː n ɛ m
ɛ k s p iː r a t j ʊ m n ɛ m	ɛ k sː p iː r aː t j oː n ɛ m
m iː r t ʊ m	m y r t ʊ m
ɔ m iː t iː d a m	h ɔ m ɪ k iː d a m
b ʊ k ɪ n ɛ	b uː k ɪ n ʊ m
t uː m ɛ f a m g ɪ l ɛ	t ʊ m ɛ f a k ɛ r ɛ
w a m r oː n	w aː r oː n ɛ m
a m f l uː ɛ n k j a m	a fː l ʊ ɛ n t j a m
s ɛ m ɛ m	s eː m ɛ n
s t r j a m	s t r j a m
w ɔ m iː t aː r ɛ	w ɔ m ɪ t aː r ɛ
ɛ k s k l uː ɛ r ɛ	ɛ k s k l uː d ɛ r ɛ
p aː d ɛ r ɛ m	p a t r ɛ m
f iː k t j oː n ɛ m	f ɪ k t j oː n ɛ m
ʊ m l ɪ r ɛ	ɔ l eː r ɛ
s ɛ p ʊ l t uː r a m	s ɛ p ʊ l t uː r a m
d ɛ f ʊ r m iː t a t ɛ m	d eː f oː r m ɪ t aː t ɛ m
b aː s j aː r ɛ	b aː s j aː r ɛ
d iː s ɛ n s ʊ m	d ɪ sː eː n s ʊ m
s aʊ l ʊ t ʊ m	s ɔ l uː t ʊ m
ɛ r ɛ d iː r	h eː r eː d ɪ t aː r ɛ
a g iː t aː r ɛ	a g ɪ t aː r ɛ
iː n b ɛ r n a l ɛ	h iː b ɛ r n aː l ɛ m
f aː r t ʊ m	f a r t ʊ m
k ʊ n t uː m aː k ɛ	k ɔ n t ʊ m aː k ɛ m
g uː b iː l aː r ɛ	j uː b ɪ l aː r ɛ
w ɛ t uː s t ʊ m	w ɛ t ʊ s t ʊ m
iː n t r ɔ d uː k t j oː n ɛ m	ɪ n t r oː d ʊ k t j oː n ɛ m
m a l w a m	m a l w a m
iː l uː d iː r	ɪ lː uː d ɛ r ɛ
d ɛ aː m b uː l a t j ʊ m n ɛ m	d ɛ a m b ʊ l aː t j oː n ɛ m
p l aː g j ʊ m	p l a g j ʊ m
k ɔ n ɛ k s j ɔ n	k oː n ɛ k s j oː n ɛ m
b a k ʊ m l ʊ m	b a k ʊ l ʊ m
f r a ŋ g ɛ r ɛ	f r a ŋ g ɛ r ɛ
a m ɛ n t ʊ m	aː m ɛ n t ʊ m
d ɛ s w j a m r ɛ	d eː w j aː r ɛ
p r ɔ s p ɛ r aː r ɛ	p r ɔ s p ɛ r aː r ɛ
ɛ r b aː k ɛ ʊ m	h ɛ r b aː k ɛu m
w ɛ r iː f iː k a t j oː n ɛ	w ɛ r ɪ f ɪ k aː t j oː n ɛ m
k iː n ɛ m	k y ŋ n ʊ m
ʊ kʷ r	a w ʊ ŋ k ʊ l ʊ m
s ɪ r k ʊ m	s eː r ɪ k ʊ m
f ɪ d aː r ɛ	f iː d ɛ r ɛ
m uː r ɛ m	m uː r ɛ m
m ɔ r d aː k ɛ	m ɔ r d aː k ɛ m
t ʊ m r t ʊ m r ɛ	t ɔ r t oː r ɛ m
l ɔ kʷ aː k ɛ	l ɔ kʷ aː k ɛ m
iː n uː m a n iː t aː t ɛ m	ɪ n h uː m aː n ɪ t aː t ɛ m
f r ɛ kʷ ɛ n t a m r ɛ	f r ɛ kʷ ɛ n t aː r ɛ
ɛ k k ɛ lː ɛ r ɛ	ɛ k s k ɛ lː ɛ r ɛ
s ɛ p ʊ l m aː r ɛ	s ɛ p ɛ l iː r ɛ
p ɛ r s iː s t ɛ r	p ɛ r s ɪ s t ɛ r ɛ
s a m l iː w a m r ɛ	s a l iː w aː r ɛ
ɛ m a r iː d ɪ aː r ɛ	m ɛ r iː d j aː r ɛ
t ɔ r d ʊ m	t ʊ r d ʊ m
s ɔ l ʊ m	s ɔ l ʊ m
k a s t r aː t ʊ m	k a s t r aː t ʊ m
r ɛ f ɔ r m aː r ɛ	r ɛ f oː r m aː r ɛ
l iː b r aː r ʊ m	l ɪ b r aː r j ʊ m
p j ɛ m ɪ g a m	p ɛ d ɪ k a m
iː n a l aː r ɛ	ɪ n h aː l aː r ɛ
s p iː n a l ɛ	s p iː n aː l ɛ m
s t uː p r ʊ m	s t ʊ p r ʊ m
s ɔ l ɛ t uː d ɪ n ɛ	s oː l ɪ t uː d ɪ n ɛ m
k ɔ n t ɛ n t ʊ m	k ɔ n t ɛ n t ʊ m
p ɛ lː iː k ʊ l a m	p ɛ lː ɪ k ʊ l a m
b ɛ n ɛ d ɛ d aː r oː	b ɛ n ɛ d ɪ k t ʊ m
n ɔ k ɛ m t ʊ m	n ʊ k eː t ʊ m
n ɛ f a m s	n ɛ f aː s
r ɛ k ɛ p t a t ɔ r ɛ	r ɛ k ɛ p t aː t oː r ɛ m
d ɛ t ɛ s t a t j ʊ m n ɛ m	d eː t ɛ s t aː t j oː n ɛ m
k ɔ n f uː t a m r ɛ	k oː n f uː t aː r ɛ
k a m l ɛ n d a m s	k a l ɛ n d aː s
r a d ɪ k ɪ n ɛ	r aː d iː k ɛ m
w j ɛ t ɛ m r ɛ m	w ɛ t ɛ r ɛ m
s a ŋ t j oː n	s aː ŋ k t j oː n ɛ m
f a k iː l iː t aː t ɛ m	f a k ɪ l ɪ t aː t ɛ m
ɛ k s ɛ k r a m r ɛ	ɛ k sː ɛ k r aː r iː
k ɔ ɔ k ʊ m	k ɔ kʷ ʊ m
r aː p iː d ʊ m	r a p ɪ d ʊ m
t ɛ j ʊ m	t ʊː m
m ɛ t iː k ʊ l oː s ʊ m	m ɛ t ɪ k ʊ l oː s ʊ m
s ɛ m r b aː r ɛ	s ɛ r w aː r ɛ
f ɛ ʊ d ʊ m	f ɛu d ʊ m
ɔ pː oː m r ɛ	ɔ pː oː n ɛ r ɛ
aː ɪ k j aː k ʊ m	aɪ g y p t j a k ʊ m
r a s oː n a b ɪ l ɛ	r a t j oː n aː b ɪ l ɛ m
p ɛ r s p iː k w ʊ m	p ɛ r s p ɪ k ʊː m
w iː k iː s iː t uː d ɪ n ɛ	w ɪ k ɪ sː ɪ t uː d ɪ n ɛ m
f ɛ m ɔ r a l ɛ	f ɛ m ɔ r aː l ɛ m
k ɪ m ɛ n t ʊ m	k aɪ m ɛ n t ʊ m
k ɔ r t ɛ m	k oː r t ɛ m
m a m n uː b r j ʊ m	m a n uː b r j ʊ m
k ɔ n f ɪ r m a t j ʊ m n ɛ m	k oː n f ɪ r m aː t j oː n ɛ m
f iː n a l iː t a t ɛ m	f iː n aː l ɪ t aː t ɛ m
s a ŋ gʷ ɪ n oː s ʊ m	s a ŋ gʷ ɪ n oː s ʊ m
n ʊ n ʊ m t j a m s	n uː p t j aː s
t uː b ɛ r ʊ m s ʊ m	t uː b ɛ r oː s ʊ m
ɪ n f r ɪ ŋ g ɛ r ɛ	iː n f r ɪ ŋ g ɛ r ɛ
p uː b l iː k ʊ m	p uː b l ɪ k ʊ m
ɪ m p ɛ m t r aː r ɛ	ɪ m p ɛ t r aː r ɛ
b oː aː r j ʊ m	b ɔ aː r j ʊ m
m ʊ n t oː s ʊ m	m ɔ n t ʊ oː s ʊ m
r ɛ k ɛ p t aː r ɛ	r ɛ k ɛ p t aː r ɛ
ɛ t ɛ r ɛ	aɪ tʰ ɛ r ɛ m
g ɔ n f j a m r ɛ	k oː n f l aː r ɛ
d ɛ t ɛ r m iː n a m t j ʊ m n ɛ	d eː t ɛ r m ɪ n aː t j oː n ɛ m
f uː r ɛ m n ɛ	f uː r ɛ m
t ɛ s t uː d ɪ n ʊ m	t ɛ s t uː d ɪ n ɛ m
iː m p ɛ r t ɛ p t iː b l ɛ m	ɪ m p ɛ r k ɛ p t ɪ b ɪ l ɛ m
d j aː b ʊ l ʊ m	d j a b ɔ l ʊ m
ɛ l ɛ n k ʊ m	ɛ l ɛ ŋ kʰ ʊ m
r uː p ɛ	r uː p ɛ m
l uː k s ʊ m	l uː k s ʊ m
g ʊ s t ʊ m	g ʊ s t ʊ m
p r ɔ b l ɛ m aː t iː k ʊ m	p r ɔ b l eː m a t ɪ k ʊ m
s ʊ g ɛ lː ʊ m	s ɪ g ɪ lː ʊ m
k ɔ n s iː k n a t j oː n	k oː n s ɪ ŋ n aː t j oː n ɛ m
t r a m s g r ɛ d ɪ r ɛ	t r aː n s g r ɛ d iː
d ɔ t aː r ɛ	d oː t aː r ɛ
b a s ʊ m	b a sː ʊ m
p uː n iː t j oː n ɛ m	p uː n iː t j oː n ɛ m
ɔ s aː r ɛ	aʊ d eː r ɛ
g ɛ r a r k a m	h ɪ ɛ r a r kʰ a m
g ɛ n j a l ɛ	g ɛ n j aː l ɛ m
l a k t a m r ɛ	l a k t aː r ɛ
g ɛ l ʊ m	g ɛ l uː
uː s iː t aː r ɛ	uː s ɪ t aː r iː
w ɪ ɛ m r ɔ s ɔ l ɔ m iː t ɛ n ʊ m	h ɪ ɛ r ɔ s ɔ l y m iː t aː n ʊ m
p a l oː m b ʊ m	p a l ʊ m b ʊ m
ɛ kʷ iː w a l ɪ r ɛ	aɪ kʷ ɪ w a l eː r ɛ
p ɪ s k ʊ p aː d ʊ m	ɛ p ɪ s k ɔ p aː t ʊ m
t ɛ l oː s ʊ m	z eː l oː s ʊ m
d iː s t uː r b aː r ɛ	d ɪ s t ʊ r b aː r ɛ
w ɛ s p r ʊ m	w ɛ s p ɛ r ʊ m
iː lː ɛ g a l ɛ	ɪ lː eː g aː l ɛ m
ɛ k s p uː ŋ n aː r ɛ	ɛ k s p ʊ ŋ n aː r ɛ
iː m mː ɛ d j aː t ʊ m	ɪ mː ɛ d j aː t ʊ m
f l ɔ r iː l ɛ g ʊ m	f l oː r ɪ l ɛ g j ʊ m
aː r k a	a r k a m
s t r ɪ g a m	s t r iː g a m
ɔ s t ɛ n s iː w ʊ m	ɔ s t eː n s iː w ʊ m
m ɔ r d ɛ r ɛ	m ɔ r d eː r ɛ
f r ɛ n a m r ɛ	f r eː n aː r ɛ
w ʊ l p ɪ n ʊ m	w ʊ l p iː n ʊ m
ɛ k s aʊ r iː r ɛ	ɛ k s h aʊ r iː r ɛ
p uː s t ʊ l a m	p ʊ s t ʊ l a m
f ɔ r t iː f ɪ k aː r ɛ	f ɔ r t ɪ f ɪ k aː r ɛ
r iː k s a m	r ɪ k s a m
t ɛ k s t iː l	t ɛ k s t ɪ l ɛ
s ɔ l w ɛ r ɛ	s ɔ l w ɛ r ɛ
a k r ɛ s ɛ r ɛ	a kː r eː s k ɛ r ɛ
s uː b r ʊ m g a m r ɛ	s ʊ b r ɔ g aː r ɛ
d ɛ s k r iː p t j ʊ m n ɛ m	d eː s k r iː p t j oː n ɛ m
m a t r iː k ʊ l a m	m aː t r iː k ʊ l a m
b ɛ n ɪ ŋ n ʊ m	b ɛ n ɪ ŋ n ʊ m
aʊ d iː t oː r j ʊ m	aʊ d iː t oː r j ʊ m
k ɔ n w iː k t j oː n ɛ	k ɔ n w iː k t j oː n ɛ m
d ɛ r iː s j ʊ m n ɛ m	d eː r iː s j oː n ɛ m
g ʊ n t uː r a m	j uː ŋ k t uː r a m
k ɛ r oː s ʊ m	k eː r oː s ʊ m
k ɔ n t r iː b ʊ ɛ r ɛ	k ɔ n t r ɪ b ʊ ɛ r ɛ
a k uː s a t j oː n ɛ	a kː uː s aː t j oː n ɛ m
k ɔ m p ʊ ŋ g ɛ r ɛ	k ɔ m p ʊ ŋ g ɛ r ɛ
k ɔ m s t r iː k t oː r ɛ	k oː n s t r ɪ k t oː r ɛ m
kʷ aː r t ʊ m	kʷ aː r t ʊ m
d iː s k ʊ r s iː w ʊ m	d ɪ s k ʊ r s iː w ʊ m
k ɔ m m ɛ m ɔ r a t j ʊ m n ɛ m	k ɔ mː ɛ m ɔ r aː t j oː n ɛ m
k ɔ n s k ɛ ʊ m	k oː n s k j ʊ m
f uː n iː k ʊ l ʊ m	f uː n ɪ k ʊ l ʊ m
f aː h m a m	f aː m a m
d iː s p aː r ɪ r r ɛ	d ɪ s p a r eː r ɛ
f a b ɛ lː a	f aː b ɛ lː a m
d ɛ k r ɛ t ʊ m	d eː k r eː t ʊ m
s ɔ m n ɔ l j ɛ n t ʊ m	s ɔ m n ɔ l ɛ n t ʊ m
a m k oː n iː t ʊ m	a k ɔ n iː t ʊ m
w iː s aː r ɛ	w iː s ɛ r ɛ
m a t r iː m oː n j ʊ m	m aː t r ɪ m oː n j ʊ m
k ɔ m s t iː t uː t j ʊ m n ɛ m	k oː n s t ɪ t uː t j oː n ɛ m
ɔ t r ɛ m	ʊ t r ʊ m
p a r ɔ n ɔ m aː s j a m	p a r ɔ n ɔ m a s j a m
p ɔ m ɪ k ɛ	p uː m ɪ k ɛ m
d ɛ p ɛ r d iː t j ʊ m n ɛ m	d eː p ɛ r d ɪ t j oː n ɛ m
a lː ɛ g r ɛ m	a l a k r ɛ m
p ɛ s t r ɪ n ʊ m	p ɪ s t r iː n ʊ m
a gː r ɛ g aː r ɛ	a gː r ɛ g aː r ɛ
p r ɔ m ɔ n t oː r j ʊ m	p r oː m ʊ n t ʊ r j ʊ m
k ʊ p l a m	k oː p ʊ l a m
k oː r s ʊ m	k ɔ r s ʊ m
a l a b aː s t r ʊ m	a l a b a s t r ʊ m
iː m p ɛ m d iː m ɛ n t ʊ m	ɪ m p ɛ d iː m ɛ n t ʊ m
p l a m n a m r ɛ	p l aː n aː r j ʊ m
iː n mː uː t aː r	ɪ mː uː t aː r ɛ
rː ɛ t iː n a k ʊ l ʊ m	r ɛ t ɪ n aː k ʊ l ʊ m
ɪ ŋ gʷ ɪ n ɛ	ɪ ŋ gʷ ɛ n
ɔ l ɔ r	ɔ l oː r ɛ m
k ɔ p l ɛ m ɛ m n t ʊ m	k ɔ m p l eː m ɛ n t ʊ m
d ɛ f l uː iː r ɛ	d eː f l ʊ ɛ r ɛ
t ɔ r t iː l ɛ	t ɔ r t ɪ l ɛ m
s ɔ l a m	s ɔ l ɛ a m
ɪ n f a n t j a m	iː n f a n t j a m
m ɛ m b r a n ʊ m s ʊ m	m ɛ m b r aː n ɛu m
ʊ ʊ m k a r iː s t j a m	ɛu kʰ a r ɪ s t j a m
d iː s k r iː m iː n a t j ʊ m n ɛ m	d ɪ s k r iː m ɪ n aː t j oː n ɛ m
p r ɔ f uː g ʊ m	p r ɔ f ʊ g ʊ m
ɔ s ɪ aː r j ʊ m	ɔ sː w aː r j ʊ m
t ɔ g a m	t ɔ g a m
fː a s k iː n aː r ɛ	f a s k ɪ n aː r ɛ
r ɛ t ɛ	r eː t ɛ
iː n k ɛ n d j aː r j ʊ m	ɪ ŋ k ɛ n d j aː r j ʊ m
a m m b iː t ʊ m	a m b iː t ʊ m
ʊ ŋ g ɛ r ɛ	ʊ ŋ g ɛ r ɛ
p ɛ m t iː r ɛ	p ɛ t ɛ r ɛ
aː b ɔ g a m k j oː n	a b r ɔ g aː t j oː n ɛ m
r ɛ s t aː r ɛ	r ɛ s t aː r ɛ
k ɔ n ɛ k s j ʊ m n ɛ m	k ɔ nː ɛ k s j oː n ɛ m
l a m p ɪ d ɛ	l a p ɪ d ɛ m
w ɛ d aː r ɛ	w ɪ k ɛ m
k ɛ r b a m	k ɛ r w a m
s aː r iː g ʊ m	s a r g ʊ m
f ɔ lː ɛ k ʊ l ʊ m	f ɔ lː ɪ k ʊ l ʊ m
l iː m ʊ m	l iː m ʊ m
ɔ k t a w ʊ m	ɔ k t aː w ʊ m
k a p t aː r ɛ	k a p t aː r ɛ
ɛ b d ɔ m a d a m r j ʊ m	h ɛ b d ɔ m a d aː r j ʊ m
g uː n j ɔ r ɛ	j uː n j oː r ɛ m
ɛ d iː f iː k a m k j oː n	aɪ d ɪ f ɪ k aː t j oː n ɛ m
s ʊ m m ɛ t ɛ r ɛ	s ʊ mː ɪ tː ɛ r ɛ
p ɛ r iː m ɛ r	p ɛ r ɪ m ɛ r ɛ
ɛ n d uː r ɛ m t eː r	ɪ n d uː r eː s k ɛ r ɛ
p a s t ɪ n aː k a m	p a s t ɪ n aː k a m
r ɪ m a n ɛ r ɛ	m a n eː r ɛ
f uː r iː b ʊ n d ʊ m	f ʊ r ɪ b ʊ n d ʊ m
d ɛ d uː k t j oː n ɛ m	d eː d ʊ k t j oː n ɛ m
iː r aː t ʊ m	iː r aː t ʊ m
k a p iː t a t j ʊ m n ɛ m	k a p ɪ t aː t j oː n ɛ m
p a m g a n a t iː t a m	p aː g aː n ɪ t aː t ɛ m
uː m ɪ d ʊ m	uː m ɪ d ʊ m
k ɛ l iː b eː	k aɪ l ɪ b ɛ m
k ɔ n s uː l t a t j ʊ m n ɛ m	k oː n s ʊ l t aː t j oː n ɛ m
d ɛ k s t ɛ r iː t aː t ɛ m	d ɛ k s t ɛ r ɪ t aː t ɛ m
m a r t ɛ lː ʊ m	m a r t ɛ lː ʊ m
k a n ʊ m n ɛ	k a n ɔ n ɛ m
k ɛ r w iː n ʊ m	k ɛ r w iː n ʊ m
l uː n uː l a m	l uː n ʊ l a m
a r m aː r ɛ	a r m aː r ɛ
aː p ɪ k k ɛ m	a p ɪ k ɛ m
l ɛ p r a	l ɛ p r a m
d uː l k iː s ɔ n ʊ m	d ʊ l k ɪ s ɔ n ʊ m
a fː ɛ k t j ʊ m n ɛ m	a fː ɛ k t j oː n ɛ m
a m ɛ t iː s t aː	a m ɛ tʰ y s t a m
aː d iː t ʊ m	a d ɪ t ʊ m
g ɛ ɔ g r a f j ɪ a m	g eː ɔ g r a pʰ j a m
m ɔ d ɛ r aː r ɛ	m ɔ d ɛ r aː r iː
m uː n iː k iː p j ʊ m	m uː n ɪ k ɪ p j ʊ m
ɔ l iː g aː r k iː k ʊ m	ɔ l ɪ g a r kʰ ɪ k ʊ m
k s k uː s a m t j ʊ m n ɛ	ɛ k s k uː s aː t j oː n ɛ m
s aː l m a m	s a g m a m
f ɛ t ɛ r ɛ	f eː t eː r ɛ
m ɔ r j a m	m ʊ r j a m
k ɔ n s uː m ɛ r ɛ	k oː n s uː m ɛ r ɛ
l iː k ɛ n	l iː kʰ eː n a
s k aː p ʊ l a m	s k a p ʊ l a m
a m b iː g ɛ ʊ m	a b ɪ g ɛu m
m a rː a m	m a rː a m
p l a t ɛ m aː	p l a t eːa m
j ʊ m ɛ n k a m	j ʊ w ɛ ŋ k a m
iː n d iː g ɛ n t a m	ɪ n d ɪ g ɛ n t j a m
w oː l a	w ɪ ɔ l a m
r eː k ɔ r d aː r ɛ	r ɛ k ɔ r d aː r iː
ɔ m d oː r ɛ	ɔ d oː r ɛ m
b uː b ɔ n iː k ʊ m	b uː b oː n ɪ k ʊ m
ɪ ŋ g ɛ n ɛ d r aː r ɛ	ɪ ŋ g ɛ n ɛ r aː r ɛ
g l uː t ɪ n ɛ m	g l uː t ɛ n
s uː p iː n ʊ m	s ʊ p iː n ʊ m
k ɔ n d uː k t j oː n ɛ m	k ɔ n d ʊ k t j oː n ɛ m
d ɪ s p ʊ s aː r ɛ	d eː s p oː n s aː r ɛ
f ɪ d ɛ l ɛ	f ɪ d eː l ɛ m
ɛ d iː l iː d aː d ɛ m	aɪ d iː l ɪ t aː t ɛ m
ɔ s p ɪ t a l ɛ	h ɔ s p ɪ t aː l ɛ
iː n k a m p aː s k	ɪ ŋ k a p aː k ɛ m
t iː t uː b a m r	t ɪ t ʊ b aː r ɛ
k ɔ r t ɛ m	k ɔ h ɔ r t ɛ m
k ɔ t iː d j aː n ʊ m	k ɔ t iː d j aː n ʊ m
m ɔ d ɛ r a t oː r ɛ	m ɔ d ɛ r aː t oː r ɛ m
s ɛ r p ɛ n t ɪ n ʊ m	s ɛ r p ɛ n t iː n ʊ m
l a w a m t oː r j ʊ m	l a w aː t oː r j ʊ m
n aː s ʊ m	n aː s ʊ m
k r ɛ t a m	k r eː t a m
aː k t ʊ m	aː k t ʊ m
a m m ɛ n t ɛ	aː m ɛ n t ɛ m
k r ɛ m a m r ɛ	k r ɛ m aː r ɛ
ɛ k s iː g ɛ r ɛ	ɛ k s ɪ g ɛ r ɛ
k ɔ n s ɛ r w a t j ʊ m n ɛ m	k oː n s ɛ r w aː t j oː n ɛ m
r uː g iː n ɛ	aɪ r uː g ɪ n ɛ m
ɔ d j ʊ m	ɔ d j ʊ m
s aː t iː r ʊ m	s a t y r ʊ m
ɛ k s p ɛ d j ɛ r ɛ	ɛ k s p ɛ d iː r ɛ
s ɔ m b r a m	ʊ m b r a m
p ɛ k ʊ r a	p ɛ k ʊ s
s a p oː n ɛ	s aː p oː n ɛ m
b r a k aː t ʊ m	b r aː k aː t ʊ m
b ɛ n ɛ f iː k j ʊ m	b ɛ n ɛ f ɪ k j ʊ m
m uː l ʊ m	m uː l ʊ m
a t ɛ n d ɛ r ɛ	a tː ɛ n d ɛ r ɛ
ɛ r ɛ p ɛ m t ɛ r	p aɪ n ɪ t eː r ɛ
p ɛ n ɛ t r ɛ r	p ɛ n ɛ t r aː r ɛ
n uː t r iː k aː r ɛ	n uː t r iː k aː r ɛ
a fː ɪ r m a t j ʊ m n ɛ m	a fː ɪ r m aː t j oː n ɛ m
uː s ɪ n ɔ r ɛu m ʊ	l ʊ s k ɪ n j a m
p ɔ m iː f ɛ r ʊ m	p oː m ɪ f ɛ r ʊ m
a b iː m ʊ m	a b y sː ʊ m
iː m m iː n ɛ n t ɛ	ɪ mː ɪ n eː r ɛ
m a n iː p ʊ l ʊ m	m a n ɪ p ʊ l ʊ m
m aː k l aː r ɛ	m a k ʊ l aː r ɛ
k ɔ lː ɛ k t j oː n ɛ m	k ɔ lː eː k t j oː n ɛ m
d iː w uː l g a m r ɛ	d iː w ʊ l g aː r ɛ
a ? s iː l j ʊ m	aʊ k s ɪ l j ʊ m
f r ɛ kʷ ɛ n t ɛ m	f r ɛ kʷ ɛ n t ɛ m
ɛ n s ɛ m	eː n s ɛ m
b r aː k ɛ s	b r aː k aː s
ɛ s ɛ kʷ j ɪ s	ɛ k sː ɛ kʷ j a m
m iː r aː k oː l ʊ m	m iː r aː k ʊ l ʊ m
g ʊ r d ʊ m	g ʊ r d ʊ m
f aː t ʊ m	f aː t ʊ m
f ɔ r m aː r ɛ	f ɔ r aː r ɛ
d ɛ w ɔ r a t j ʊ m n ɛ m	d eː w ɔ r aː t j oː n ɛ m
t ɛ n ɔ r ɛ	t ɛ n oː r ɛ m
p r uː d ɛ n t j a m	p r uː d ɛ n t j a m
l iː t aː r	l ɪ t aː r ɛ
s p ɔ l a m r ɛ	s p ɔ l j aː r ɛ
l iː t uː r g j a m	l iː t uː r g j a m
k ɔ l ɔ s t r ʊ m	k ɔ l ɔ s t r a m
m uː r iː k ɛ	m uː r ɪ k ɛ m
n iː w ɛ lː ɔ	l iː b ɛ lː a m
d ɛ p r iː m ɛ r ɛ	d eː p r ɪ m ɛ r ɛ
iː n k uː b ʊ m	ɪ ŋ k ʊ b ʊ m
