k a l ɪ d ʊ m	k a lː ɪ d ʊ m
p ɔ p ɛ r ʊ m	p aʊ p ɛ r ɛ m
r a k eː m oː s ʊ m	r a k eː m oː s ʊ m
a l uː n n ʊ m	a l ʊ m n ʊ m
oː n ɛ r ɛ	ɔ n ʊ s
n a d a d oː r ɛ	n a t aː t oː r ɛ m
k lː aː l oː l ʊ m	g l a d ɪ ɔ l ʊ m
k ɔ ŋ g ʊ r aː r ɛ	k ɔ n ɪ uː r aː r ɛ
ɪ n uː l t ʊ m	ɪ n ʊ l t ʊ m
l a k uː s t r ɛ m	l a k ʊ s t r ɛ m
a w ɪ ʊ m	a w ɛ m
ɪ n t ɛ rː ɔ m p eː r ɛ m	ɪ n t ɛ rː ʊ m p ɛ r ɛ
g r aː w aː r ɛ	g r a w aː r ɛ
p ɛ r ɪ k ʊ l oː s ʊ m	p ɛ r iː k ʊ l oː s ʊ m
k ɔ m ɪ t j ʊ m	k ɔ m ɪ t j ʊ m
t ɪ n a m	t iː n a m
l ʊ ŋ t r a m	l ʊ t r a m
p ɛ r s p ɪ k uː ɪ t ɛ m	p ɛ r s p ɪ k ʊ ɪ t aː t ɛ m
s ɛ r w ɪ t ʊ t ɛ m	s ɛ r w ɪ t uː t ɛ m
s ɛ w ɛ r ɪ t aː t ɛ m	s ɛ w eː r ɪ t aː t ɛ m
k ʊ l w r ʊ m	k ɔ l ʊ b r a m
k a s ʊ m	k aː s ʊ m
ɪ n s uː l t ʊ m	iː n s ʊ l t ʊ m
f a r ɪ n oː s ʊ m	f a r iː n oː s ʊ m
ɛ k s t ɔ r k ɛ r ɛ	ɛ k s t ɔ r kʷ eː r ɛ
j uː s t ɪ f ɪ k aː t j oː n ɛ m	j uː s t ɪ f ɪ k aː t j oː n ɛ m
r uː g iː r ɛ	r uː g iː r ɛ
j a d ɛ m	iː l ɛ
m uː r ɪ k ɛ m	m uː r ɪ k ɛ m
s ɛ l w aː t iː k ʊ m	s ɪ l w aː t ɪ k ʊ m
k a t eː lː ʊ m	k a t ɛ lː ʊ m
ɔ s p ɪ t j ʊ m	h ɔ s p ɪ t j ʊ m
t ɛ m ɛ r ɪ t aː t ɛ m	t ɛ m ɛ r ɪ t aː t ɛ m
l ɛ w ɪ g aː r ɛ	l ɛ w ɪ g aː r ɛ
ɛ b aɪ t ɛ m	h ɛ b ɛ t ɛ m
s ɛ n ɛ k t uː t ɛ	s ɛ n ɛ k t ʊ m
t r ʊ n ʊ m	tʰ r ɔ n ʊ m
k ɛ sː aː r ɛ	k ɛ sː aː r ɛ
g r aː l ʊ m	g r aː k ʊ l ʊ m
g aʊ d ʊ m	g aʊ d j ʊ m
r ɛ k ɪ t aː t j oː n ɛ m	r ɛ k ɪ t aː t j oː n ɛ m
ɪ mː ɪ s s ɛ r s ɛ m	ɪ mː ɪ s k eː r ɛ
k ʊ m p l ɛ r ɛ	k ɔ m p l eː r ɛ
d ɪ s k ʊ r ʊ m	d ɪ s k ʊ r s ʊ m
a kː ʊ s aː b iː l ɛ m	a kː uː s aː b ɪ l ɛ m
t r a n s aː k t j oː n ɛ m	t r aː n s aː k t j oː n ɛ m
f j ɛ r ʊ m	f ɛ r ʊ m
d eː s p ɛ t aː r ɛ	d eː s p ɛ k t aː r ɛ
s t r ɪ g ɪ l ɛ	s t r ɪ g ɪ l ɛ m
ɔ r ɪ s ɔ n t ɛ m	h ɔ r ɪ zː ɔ n t a
s a p oː n ɛ	s aː p oː n ɛ m
ɪ n uː s ɪ t aː t ʊ m	ɪ n uː s ɪ t aː t ʊ m
m a t uː t ɪ n ʊ m	m aː t uː t iː n ʊ m
p ɪ l a m	p iː l a m
a b ɛ t ʊ m	a b ɪ eː t ɛ m
s t r ɛ p iː t ʊ m	s t r ɛ p ɪ t ʊ m
r ɛ s t ɪ t uː ɪ r ɛ m	r ɛ s t ɪ t ʊ ɛ r ɛ
r ɪ g ʊ r oː s ʊ m	r ɪ g ɔ r ɔ s ʊ m
f ɛ ʊ d ʊ m	f ɛu d ʊ m
k ɔ n t r ɪ t ʊ m	k ɔ n t r iː t ʊ m
k ɪ k r ɛ m	k ɪ k ɛ r
a r k j a m	a r kʰ j a m
g a l ɛ t a m	g a lː ɛ t a m
k ɔ n w oː k aː r ɛ	k ɔ n w ɔ k aː r ɛ
m a sː a m	m a sː a m
a k ɪ n ʊ m	a k ɪ n ʊ m
w ɛ r s ɪ pʰ iː k aː r ɛ	w ɛ r s ɪ f ɪ k aː r ɛ
t r aː n s ʊ b s t a n t j aː r ɛ	t r aː n s ʊ b s t a n t j aː r ɛ
w a k ɪ ʊ m	w a k iː w ʊ m
n a b ɛ g aː r ɛ	n aː w ɪ g aː r ɛ
f kː iː m b r j aː t ʊ m	f ɪ m b r j aː t ʊ m
p r a k t ɪ k ʊ m	p r a k t ɪ k ʊ m
t r ɛ m ʊ l ʊ m	t r ɛ m ʊ l ʊ m
ɪ n uː m aː n ɪ t aː t ɛ m	ɪ n h uː m aː n ɪ t aː t ɛ m
ɔ l ʊ m	ʊ l ʊ m
s t aː n ʊ m	s t a nː ʊ m
d ɪ t ʊ m	d ɪ k t ʊ m
m a r g ɛ r iː t a m	m a r g a r iː t a m
b a r k a m	b a r k a m
s uː p ɛ r j oː r ɛ	s ʊ p ɛ r j oː r ɛ m
h ɛ ɛ s iː r	ɛ k s iː r ɛ
t ɪ t uː b aː r ɛ	t ɪ t ʊ b aː r ɛ
s ɔ n t ɛ m	s ɔ n t ɛ m
t r aː b aː l j ʊ m	t r ɪ p aː l ɛ m
a g ɪ t aː r ɛ m	a g ɪ t aː r ɛ
m ɛ r ɛ t r iː k ɛ	m ɛ r ɛ t r iː k ɛ m
s k r ɪ b a m	s k r iː b a m
d ɪ s k ɔ rː eː r ɛ	d ɪ s k ʊ rː ɛ r ɛ
w a n ʊ m	w a nː ʊ m
t r a n s k r ɪ w eː r ɛ	t r aː n s k r iː b ɛ r ɛ
k ɛ l ɛ b r ɛ m	k ɛ l ɛ b r ɛ m
k a r ɔ t a m	k a r oː t a m
k aɪ p a m	k eː p a m
n a t aː t ɪ r j ʊ m	n a t aː t oː r j ʊ m
w ɛ lː ʊ s ʊ m	w ɪ lː oː s ʊ m
g ɔ d ɛ r ɛ	g aʊ d eː r ɛ
eː l ɪ d ɛ r ɛ	eː l iː d ɛ r ɛ
a d oː r m ɛ t ɛ r ɛ	a dː ɔ r m iː s k ɛ r ɛ
f ɔ k aː r j a m	f ɔ k aː r j ʊ m
uː ɪ t ʊ m	aʊ d iː t ʊ m
p l a g j ʊ m	p l a g j ʊ m
m ɛ d ɪ t ɪ rː a n ɛ ʊ m	m ɛ d ɪ t ɛ rː aː n ɛu m
s aː b ɔ rː a m	s a b ʊ rː a m
f ɛ t oː r ɛ	f eː t oː r ɛ m
a kː r ɪ t ʊ d ɛ m	aː k r ɪ t uː d ɪ n ɛ m
ɪ r aː s ɪ b ɪ l ɛ m	iː r aː s k ɪ b ɪ l ɛ m
l ɪ b ɛ lː ʊ l a m	l iː b ɛ lː ʊ l a m
a b aː l iː ɛ n aː t j oː n ɛ m	a b a l ɪ eː n aː t j oː n ɛ m
s ɪ t uː l a m	s ɪ t ʊ l a m
s p uː m oː s ʊ m	s p uː m oː s ʊ m
p r oː t ɛ l a m	p r ɔ k ɛ lː a m
d eː m ɛ t ɪ r	d eː m ɪ tː ɛ r ɛ
k ɔ n t r aː d ɪ k t oː r ɛ m	k ɔ n t r aː d ɪ k t oː r ɛ m
m a ŋ n ɪ t uː d ʊ m	m a ŋ n ɪ t uː d ɪ n ɛ m
l a aː r	l a sː aː r ɛ
ɔ r aː t j oː n ɛ m	oː r aː t j oː n ɛ m
k a pː l ʊ m	k a p ʊ l ʊ m
eː k s t ɛ n d ɛ r ɛ	ɛ k s t ɛ n d ɛ r ɛ
p ɔ lː aː r ɛ m	p ʊ lː aː r ɛ
a t l a n t iː k ʊ m	aː t l a n t ɪ k ʊ m
p ɛ k ɔ r a m	p ɛ k ʊ s
a l j oː n	a l k y ɔ n ɛ m
eː r ʊ ʊ p ɛ r ɛ	eː r ʊ m p ɛ r ɛ
f ʊ l g ɪ ɛ m	f ʊ l g ʊ r
p ɛ k uː n j a m m	p ɛ k uː n j a m
s a n ʊ r j ɛ t ɛ m	s a t ʊ r eː j a m
m ʊ r j a m	m ʊ r j a m
l ɔ ŋ g ɪ n k ɪ t aː t ɛ m	l ɔ ŋ g ɪ ŋ kʷ ɪ t aː t ɛ m
f ɔ n t aː n a m	f ɔ n t aː n a m
f l aː m a m	f l a mː a m
s ɔ l j ʊ m	s ɔ l j ʊ m
ɪ n p ɛ r t ɛ p t ɪ b lː ɛ m	ɪ m p ɛ r k ɛ p t ɪ b ɪ l ɛ m
s k r ɪ t uː r a m	s k r iː p t uː r a m
k a p aː k ɛ	k a p aː k ɛ m
p ɔ s t ʊ l aː r ɛ	p ɔ s t ʊ l aː r ɛ
k ɔ ŋ g ʊ r aː t j oː n ɛ m	k ɔ n ɪ uː r aː t j oː n ɛ m
r ɛ p uː b l ɪ k a m	r ɛ m p uː b l ɪ k a m
f ɔ r ʊ m	f ɔ r ʊ m
ɪ s t a m	ɪ s t a m
t ɪ t ɪ lː aː r ɛ	t iː t ɪ lː aː r ɛ
k ɔ ŋ s t ɪ t ʊ ɪ r ɛ	k oː n s t ɪ t ʊ ɛ r ɛ
t ɛ n ɪ b r aː m	t ɛ n ɛ b r aː s
b r a n k a m	b r a ŋ k a m
s a l s a m	s a l s a m
k ɔ n f ʊ t aː r ɛ	k oː n f uː t aː r ɛ
ɪ n d ɔ l ɛ m	ɪ n d ɔ l ɛ m
f ɛ r a m	f ɛ r a m
a lː ʊ ŋ g aː r ɛ	eː l ɔ ŋ g aː r ɛ
f ɛ rː aː t ʊ m	f ɛ rː aː t ʊ m
s ɛ d ɛ m	s eː d ɛ m
n ɛ k s ʊ m	n ɛ k s ʊ m
a n ɪ k ɪ l aː t j oː n ɛ m	a nː ɪ h ɪ l aː t j oː n ɛ m
m uː l ʊ m	m uː l ʊ m
f uː r ʊ n ʊ m	f uː r ɛ m
m ɛ n d aː k ɛ m	m ɛ n d aː k ɛ m
p ɔ n t ɪ f iː k ɛ m	p ɔ n t ɪ f ɪ k ɛ m
a s ɪ m ɪ l aː r ɛ	a sː ɪ m ʊ l aː r ɛ
b a s ɪ l ɪ k ʊ m	b a s ɪ l ɪ k ʊ m
f a rː ʊ m	f a rː ɛu m
t a k s aː r ɛ	t a k s aː r ɛ
ɔ rː n ɪ d ɛ m	h ɔ rː ɪ d ʊ m
a n t ɛ n a m	a n t ɛ nː a m
ɛ fː l uː ɪ r ɛ	ɛ fː l ʊ ɛ r ɛ
w ɛ r m ɪ l j ʊ m	w ɛ r m ɪ k ʊ l ʊ m
t r a n sː f ɛ r ɛ r ɛ	t r aː n s f ɛ rː ɛ
p a w ɪ lː oː n ɛ m	p aː p ɪ l j oː n ɛ m
r uː m oː r ɛ	r uː m oː r ɛ m
s ɔ l ʊ m	s ɔ l ʊ m
p r oː d ʊ k t j oː n ɛ m	p r oː d ʊ k t j oː n ɛ m
k ɪ n ɛ n t ʊ s	kʷ iː ŋ g ɛ n t oː s
r eː w ɔ l w ɛ r ɛ	r ɛ w ɔ l w ɛ r ɛ
r iː ʊ m	r iː w ʊ m
a n aɪ m ɔ n ɛ m	a n ɛ m oː n eː n
p r ʊ n ʊ m	p r uː n ʊ m
ɛ m ɪ k r aː n j a m	h eː m ɪ k r aː n j a m
k ɔ n k ʊ rː eː r ɛ	k ɔ ŋ k ʊ rː ɛ r ɛ
eː g r ɛ g ʊ m	eː g r ɛ g j ʊ m
ɛ k s a s p ɛ r aː t j oː n ɛ m	ɛ k s a s p ɛ r aː t j oː n ɛ m
g ɛ oː m ɛ t r j a m	g ɛ oː m ɛ t r j a m
a rː a s	a rː h a m
ɔ b t ɛ n ɛ r ɛ	ɔ b t ɪ n eː r ɛ
d eː s ɛ m n aː r ɛ	d eː s ɪ ŋ n aː r ɛ
k ɔ n d ɛ k ɛ r ɛ	k ɔ n d iː k ɛ r ɛ
f r aː t ɛ r n ʊ m	f r aː t ɛ r n ʊ m
b a l t ɛ ʊ m	b a l t ɛu m
d ɛ s t ɛ ŋ d ɛ r ɛ	d eː s k ɛ n d ɛ r ɛ
ɪ m p j ʊ m	ɪ m p j ʊ m
p a l m ʊ m	p a l m ʊ m
ɪ n f ʊ n d ɛ r ɛ	iː n f ʊ n d ɛ r ɛ
t ɛ t r ɪ k ʊ m	t aɪ t r ɪ k ʊ m
ɔ k ɪ d ɛ r ɛ m	ɔ kː ɪ d ɛ r ɛ
m a ŋ t ʊ m	m aː n s ʊ eː t ʊ m
ɪ m p ɛ lː ɛ r ɛ	ɪ m p ɛ lː ɛ r ɛ
w ɪ s ɪ b ɪ l ɛ t aː t ɛ m	w iː s ɪ b ɪ l ɪ t aː t ɛ m
k ɔ l oː n j a m m	k ɔ l oː n j a m
j ʊ w ɛ n k a m	j ʊ w ɛ ŋ k a m
l a k t ɪ k iː n j ʊ m	l a k t ɪ k iː n j ʊ m
m ʊ r ɛ n a m	m ʊ r eː n a m
s ʊ l k aː r ɛ m	s ʊ l k aː r ɛ
p a g a n t aː t a m	p aː g aː n ɪ t aː t ɛ m
f ʊ n d aː m ɛ n t ʊ m	f ʊ n d aː m ɛ n t ʊ m
n ɔ w ʊ m	n ɔ w ʊ m
s ɔ l t ʊ m	s ɔ l uː t ʊ m
k a n t ʊ m	k a n t ʊ m
k ɔ t ʊ m	k ɔ mː ɛ aː t ʊ m
a pː l aʊ s ʊ m	a pː l aʊ s ʊ m
j uː g ɛ r ʊ m	j uː g ɛ r ʊ m
ɔ l aː t ʊ m	ɔ l ɛ aː t ʊ m
k ɪ b ʊ lː a m	k eː p ʊ lː a m
f a w a m	f a b a m
w eː n ɛ t d ɪ n ʊ ɛ	w ɛ n ɛ t ʊ m
a r oː m aː t iː k ʊ m	a r oː m a t ɪ k ʊ m
m uː l t ɪ t uː d ɪ n ɛ m	m ʊ l t ɪ t uː d ɪ n ɛ m
ɛ k s t ɛ n s ɪ w ʊ m	ɛ k s t eː n s iː w ʊ m
b ɔ rː aː g ɪ j ɛ	b ɔ r aː g ɪ n ɛ m
d ɪ s t r ɛ r ɛ	d ɪ s t r a h ɛ r ɛ
w a g a b ʊ n d ʊ m	w a g aː b ʊ n d ʊ m
ɛ k s t ɪ r p aː r ɛ m	ɛ k sː t ɪ r p aː r ɛ
a k s k ʊ n d ɛ r ɛ	a b s k ɔ n d ɛ r ɛ
m eː s a m	m eː s a m
k ɔ n s t ɪ t ʊ t ɪ f ʊ m	k ɔ n s t ɪ t uː t ɪ w ʊ m
d ɛ l ɪ t ʊ m	d eː l ɪ k t ʊ m
t r a t ɪ d oː r ɛ	t r aː d ɪ t oː r ɛ m
s a n j ɛ ʊ m	s a n ɪ ɛ m
k r aɪ d ɪ b ɪ l ɛ m	k r eː d ɪ b ɪ l ɛ m
k ɔ s t aː t ʊ m	k ɔ s t aː t ʊ m
p r aɪ d oː m ɪ n aː r ɛ	p r aɪ d ɔ m ɪ n aː r iː
k ɔ m p aː s iː b l ɛ m	k ɔ m p a sː ɪ b ɪ l ɛ m
r a p ɪ n a m	r a p iː n a m
g ɔ s k ʊ m	g ɛu s j aː s
p r ɪ m oː g eː n ɪ t ʊ m	p r iː m oː g ɛ n ɪ t ʊ m
s p eː l j ʊ m	s p ɛ k l ʊ m
p l aː t ɛ a m	p l a t eːa m
k ɔ d ɪ k ɛ m	k oː d ɪ k ɛ m
s aː ŋ gʷ ɪ n oː s ʊ m	s a ŋ gʷ ɪ n oː s ʊ m
p l a n t aː r ɛ	p l a n t aː r ɛ
p r ɛ s aː r ɛ	p r ɛ t j aː r ɛ
a t kː ɛ r ɪ r ɛ	a kː w iː r ɛ r ɛ
f aɪ b ʊ l ɛ m	f l eː b ɪ l ɛ m
s ɔ n ɛ kː ʊ l oː s ʊ m	s ɔ m n ɪ k ʊ l oː s ʊ m
ɛ rː ɛ r ɛ	ɛ rː aː r ɛ
f r aː t ɛ r n aː l	f r aː t ɛ r n aː l ɛ m
s ɛ kʷ aː k ɛ	s ɛ kʷ aː k ɛ m
d ɛ p ɔ r t aː r ɛ	d eː p ɔ r t aː r ɛ
k ɔ n s ɪ l ʊ m	k oː n s ɪ l j ʊ m
ɔ n oː r aː r j ʊ m	h ɔ n oː r aː r j ʊ m
s a p ɪ ɛ n t a m	s a p ɪ ɛ n t j a m
t k ɛ r t j ʊ m	t ɛ r t j ʊ m
b aː ʊ m	b a d j ʊ m
s uː b j aː lː a m	s uː b ʊ l a m
w ɪ k a m	b iː g a m
l ɔ t oː s ʊ m	l ʊ t oː s ʊ m
w iː d ʊ m	w ɔ k ɪ t ʊ m
s aː n t ɪ t aː t ɛ m	s aː ŋ k t ɪ t aː t ɛ m
w ɪ n aː t oː r ɛ	w eː n aː t oː r ɛ m
w a r j ʊ m	w a r j ʊ m
s k uː t ɪ eː r ʊ m	s k uː t aː r j ʊ m
k a l k aː r eː ʊ m	k a l k aː r j ʊ m
ɪ b ɪ s k ʊ m	iː b ɪ k ɛ m
k r ɔ t aː l ʊ m	k r ɔ t a l ʊ m
ɛ k s t ɪ r p aː t j oː n ɛ m	ɛ k sː t ɪ r p aː t j oː n ɛ m
s uː k aː r ɛ	s uː g ɛ r ɛ
k ɔ n k ʊ l k aː r ɛ m	k ɔ ŋ k ʊ l k aː r ɛ
a l aː	aː l ɛ a m
s a p eː r ɛ m	s a p ɛ r ɛ
ɪ n s ɪ n ɛ m	iː n s ɪ ŋ n ɛ m
g a l ɛ r ʊ m	g a l eː r ʊ m
n ɛ k t aː r ɛ m	n ɛ k t a r
d ɛ l ɛ t j oː n ɛ m	d eː l eː t j oː n ɛ m
s ɛ m ɛ n ɛ m	s eː m ɛ n
w ɪ t ɛ r ɛ m	w ɛ t ɛ r ɛ m
p uː l p ɪ t ʊ m	p ʊ l p ɪ t ʊ m
a k a m	a k j a m
t r eː f ɔ l ʊ m	t r ɪ f ɔ l j ʊ m
s ɔ l ɛ r ɛ	s ɔ l eː r ɛ
k ɔ n d ɪ s k ɛ n d ɛ r ɛ m	k ɔ n d eː s k ɛ n d ɛ r ɛ
r a n ʊ k j aː l ʊ m	r aː n ʊ ŋ k ʊ l ʊ m
a d w ɛ k t j oː n ɛ m	a d w ɛ k t j oː n ɛ m
a n ɔ m aː l ʊ m	a n oː m a l ɔ n
p r oː p ʊ ŋ n aː r ɛ m	p r oː p ʊ ŋ n aː r ɛ
ɔ n oː r ɛ m	h ɔ n oː r ɛ m
a b sː oː l b eː r ɛ	a b s ɔ l w ɛ r ɛ
g a lː ɛ g ʊ m	g a lː aɪ k ʊ m
s ɔ r ɪ k	s oː r ɪ k ɛ m
a sː uː m ɛ r ɛ	a sː uː m ɛ r ɛ
w a l ɛ t ʊ d ɪ n aː r j ʊ m	w a l eː t uː d ɪ n aː r j ʊ m
p l a n t ʊ m	p l a ŋ k t ʊ m
m ɔ r a l ɪ t aː d ɛ m	m oː r aː l ɪ t aː t ɛ m
ɪ n k ɔ m ɔ d aː r ɛ	ɪ ŋ k ɔ mː ɔ d aː r ɛ
n ɔ k ɪ t ʊ m	n ʊ k eː t ʊ m
n uː m ɛ n ɛ m	n uː m ɛ n
d eː f ɛ n s oː r ɛ	d eː f eː n s oː r ɛ m
t r ɪ b uː t ʊ m	t r ɪ b uː t ʊ m
k ɔ n t ʊ r b aː t j oː n ɛ m	k ɔ n t ʊ r b aː t j oː n ɛ m
w ɛ r g ɪ ɛ l ɛ	w ɪ r ɪ d aː r j ʊ m
ɔ b s t aː r ɛ	ɔ b s t aː r ɛ
r ɛ t r ɪ b uː ɪ r ɛ m	r ɛ t r ɪ b ʊ ɛ r ɛ
l ʊ p a m	l ʊ p a m
p uː t r ɛ	p ʊ t eː r ɛ
r a p ɪ d ɪ t ɛ m	r a p ɪ d ɪ t aː t ɛ m
ɪ n d ɪ g n ɪ t aː t ɛ m	ɪ n d ɪ ŋ n ɪ t aː t ɛ m
l ɪ b aː r ɛ	l iː b aː r ɛ
d ɛ l ɪ b ɛ r aː t j oː n ɛ m	d eː l iː b ɛ r aː t j oː n ɛ m
a b l a k t aː r ɛ	a b l a k t aː r ɛ
ɔ r ɪ g ɪ n aː r j ʊ m	ɔ r iː g ɪ n aː r j ʊ m
t uː r g ɪ d ʊ m	t ʊ r g ɪ d ʊ m
ɪ n d ɛ f ɪ n ɪ t ʊ m	ɪ n d eː f iː n iː t ʊ m
n a r ɪ k a m	n a t ɛ m
s t ɪ m ʊ l aː t j oː n ɛ m	s t ɪ m ʊ l aː t j oː n ɛ m
ɪ n t ɪ m aː t j oː n ɛ m	ɪ n t ɪ m aː t j oː n ɛ m
k ɔ n t ʊ r b aː r ɛ m	k ɔ n t ʊ r b aː r ɛ
t r a n s f oː r m aː t j oː n ɛ m	t r aː n s f oː r m aː t j oː n ɛ m
f ɛ m ʊ r ɛ	f ɛ m ʊ r
a m a r ɛ m	a m aː r ɛ
s p ɛ l ʊ n k a m	s p eː l ʊ ŋ k a m
kʷ a d r ʊ p l oː r ɛ	kʷ a d r ʊ p l aː r ɛ
uː sː ʊ m	uː s ʊ m
ɔ b n uː b ɪ l aː r ɛ	ɔ b n uː b ɪ l aː r ɛ
p r aɪ g oː m	p r aɪ k oː n ɛ m
p a g uː r ʊ m	p a g uː r ʊ m
ɪ n k ɔ m p ɛ t ɛ n t ɛ m	ɪ ŋ k ɔ m p ɛ t ɛ n t ɛ m
k l aː r j a m	g l aː r ɛ a m
w ɛ r ɛ r ɛ	w ɛ rː ɛ r ɛ
l aʊ r ʊ t ʊ m	l aʊ r ɛ aː t ʊ m
ɪ n w ɪ t aː r ɛ	ɪ n w iː t aː r ɛ
p r aɪ g ʊ d ɪ t j ʊ m	p r aɪ j uː d ɪ k j ʊ m
p ɔ r t aː b ɪ l ɛ	p ɔ r t aː b ɪ l ɛ m
s k oː lː ʊ m	s k ɔ p ʊ l ʊ m
ɔ kː ʊ rː ɛ r ɛ m	ɔ kː ʊ rː ɛ r ɛ
s ʊ b g ʊ g aː r ɛ	s ʊ b j ʊ g aː r ɛ
p r oː m ɪ s j oː n ɛ	p r ɔ m ɪ sː j oː n ɛ m
t r a n s p oː r ɛ m	t r aː n s p oː n ɛ r ɛ
w a r ɪ eː t aː t ɛ m	w a r ɪ ɛ t aː t ɛ m
p r aɪ s j ɛ d ɛ r ɛ	p r aɪ s ɪ d eː r ɛ
m ɛ s ɛ m	m ɛ sː ɛ m
ɪ n sː oː n t ɛ m	iː n s ɔ n t ɛ m
eː l ɛ w aː r ɛ	eː l ɛ w aː r ɛ
k a r ʊ m	k aː r ʊ m
a k ɛ f aː l ʊ m	a k ɛ pʰ a l ʊ m
k ʊ k ɪ n aː r ɛ	k ɔ kʷ iː n aː r ɛ
l uː d ɪ b r j ʊ m	l uː d iː b r j ʊ m
w a r j eː g aː t j oː n ɛ m	w a r ɪ ɛ g aː t j oː n ɛ m
d ɛ s k r ɪ w eː r ɛ	d eː s k r iː b ɛ r ɛ
ɪ m p ɛ t ʊ m	ɪ m p ɛ t ʊ m
p r aɪ s aː g j ʊ m	p r aɪ s aː g j ʊ m
a gː l uː t ɪ n oː r ɛ	a gː l uː t ɪ n aː r ɛ
b ɛ n ɪ n ʊ m	b ɛ n ɪ ŋ n ʊ m
w ɔ ŋ l ʊ n t aː t ɛ m	w ɔ l ʊ n t aː t ɛ m
aɪ kʷ ʊ m	aɪ kʷ ʊ m
g ɛ n t ɪ l ɛ m	g ɛ n t iː l ɛ m
m ɪ n ʊ ɪ r ɛ	m ɪ n ʊ ɛ r ɛ
a w ɛ sː ʊ m	aː w ɛ r s ʊ m
a s p aː r aː g ʊ m	a s p a r a g ʊ m
f ɪ sː j ɔ n ɛ m	f ɪ sː j oː n ɛ m
p ɛ l ɪ k ʊ l a m	p ɛ lː ɪ k ʊ l a m
k ɔ n s ʊ m aː t j oː n ɛ m	k oː n s ʊ mː aː t j oː n ɛ m
d r a p ɪ d ʊ m	d r a pː ʊ m
d eː n s p ɛ r aː t ʊ m	d eː s p eː r aː t ʊ m
t r a n s p oː r t aː r ɛ	t r aː n s p ɔ r t aː r ɛ
ɛ k s p ɛ n d ɛ r ɛ	ɛ k s p ɛ n d ɛ r ɛ
t r aː d ɪ r ɛ	t r aː d ɛ r ɛ
t ɛ n ɛ b r oː s ʊ m	t ɛ n ɛ b r oː s ʊ m
p a t r ɪ t j ʊ m	p aː t r ɪ k j ʊ m
ʊ ɔ p oː m	ɔ p ʊ s
l ɛ g aː t ʊ m	l eː g aː t ʊ m
s ɔ n rː ɪ d ɪ r ɛ	s ʊ b r iː d eː r ɛ
p uː p a m	p uː p a m
r ɛ f r ɪ g ɛ r aː t j oː n ɛ m	r ɛ f r iː g ɛ r aː t j oː n ɛ m
ɔ b sː ɛ r w aː r ɛ	ɔ b s ɛ r w aː r ɛ
s a k r aː ɛ	s a k r aː r ɛ
p eː r a m	p eː r a m
b l aː t ɛ r aː r ɛ	b l a t ɛ r aː r ɛ
t r ɪ g ɛ s iː m ʊ m	t r iː g eː s ɪ m ʊ m
r ɛ g ʊ l aː r ɛ	r eː g ʊ l aː r ɛ
p ɛ r s p ɪ k j ʊ m	p ɛ r s p ɪ k ʊː m
k ɔ n s ɪ k n aː t j oː n ɛ m	k oː n s ɪ ŋ n aː t j oː n ɛ m
f ʊ r ʊ n k ʊ l ʊ m	f uː r ʊ ŋ k ʊ l ʊ m
k ɔ n t r ɪ t j oː n ɛ m	k ɔ n t r iː t j oː n ɛ m
ɛ k s t r ɪ k t ɛ k ʊ m	ɛ k s t r iː n s ɛ k ʊ m
ɪ n f ɪ m ʊ m	iː n f ɪ m ʊ m
g a t a m	k a tː a m
oː	ʊ m
k ɔ n k ɪ t aː t j oː n ɛ m	k ɔ ŋ k ɪ t aː t j oː n ɛ m
s ʊ mː ʊ m	s ʊ mː ʊ m
m ɛ s ɛ m	m eː n s ɛ m
d ɛ n t aː l ɛ m	d ɛ n t aː l ɛ m
m ɪ l ɪ t ɛ m	m iː l ɪ t ɛ m
d a n oː s ʊ m	d a m n oː s ʊ m
r eː s p l a n d ɛ ɛ r ɛ m	r ɛ s p l ɛ n d eː r ɛ
ɪ n w ɪ t aː t j oː n ɛ m	ɪ n w ɪ t aː t j oː n ɛ m
a fː l d ɛ n t j ʊ m	a fː l ʊ ɛ n t j a m
ɪ l aː r ɛ m	h ɪ l a r ɛ m
ɪ n d ɛ m n ɛ	ɪ n d ɛ m n ɛ m
a l b uː m ɪ a m	a l b uː m ɛ n
aɪ s k ʊ l ʊ m	aɪ s k ʊ l ʊ m
r ɛ k aː l k ɪ t r aː r ɛ	r ɛ k a l k ɪ t r aː r ɛ
m ɛ r ɪ t ɛ r ɛ	m ɛ r eː r ɛ
f uː r t ɪ w ʊ m	f uː r t iː w ʊ m
k ɪ t ɛ r j oː r ɛ	k ɪ t ɛ r j oː r ɛ m
k ɔ k ʊ m	s ɔ kː ʊ m
p l a t aː n ʊ m	p l a t a n ʊ m
k ʊ l oː n ʊ m	k ɔ l oː n ʊ m
t r ɪ p l ʊ m	t r ɪ p l ʊ m
s p ɛ k t aː k ʊ l ʊ m	s p ɛ k t aː k ʊ l ʊ m
k a p r ʊ m	k a p r ʊ m
ɪ n w ɪ d j a m	ɪ n w ɪ d j a m
l ɛ g uː l eː j ʊ m	l eː g ʊ l eː j ʊ m
k ɪ m iː kʷ ɛ m	k iː m ɪ k ɛ m
d ɛ k ɛ p t iː w ʊ m	d ɛ k ɛ p t iː w ʊ m
s ɛ rː ɛ g ɪ n	s ɛ rː aː g ɪ n ɛ m
p ɛ r n a m	p ɛ r n a m
n a rː aː r ɛ	n a rː aː r ɛ
f a b ʊ r ɪ k aː t j oː n ɛ m	f aː b r ɪ k aː t j oː n ɛ m
ɪ p oː t ɛ k a m	h y p ɔ tʰ eː k a m
p ɛ d ɪ k ɛ lː ʊ m	p ɛ d iː k ɛ lː ʊ m
