d ɪ w ɪ n aː t j ʊ m n ɛ m	d iː w iː n aː t j oː n ɛ m
iː l ɛ	ɪ l ɛ m
n k ɛ n d ɛ r ɛ	ɪ ŋ k ɛ n d ɛ r ɛ
m p ɪ l aː r ɛ	p ɪ l aː r ɛ
m ɛ r ɛ n d aː	m ɛ r ɛ n d a m
s t ʊ d j aː r ɛ	s t ʊ d eː r ɛ
l ɛ m n aː r ʊ m	l ɪ ŋ n aː r j ʊ m
k ɔ lː ʊ m	k ɔ lː ʊ m
p a l ʊ m b ʊ m	p a l ʊ m b ʊ m
ɪ m f ɛ k t aː r	iː n f ɪ k ɛ r ɛ
ʊ w a	uː w a m
k a p ɛ r ʊ m n	k a p r ʊ m
s ɛ n s ʊ aː l ɪ t aː t ɛ m	s ɛ n s w aː l ɪ t aː t ɛ m
g l aʊ k ʊ m	g l aʊ k ʊ m
a g ɪ l ɪ t aː t ɛ m	a g ɪ l ɪ t aː t ɛ m
s aː b l ʊ m	s a b ʊ l ʊ m
r ɛ t r aː k t aː r ɛ	r ɛ t r a k t aː r ɛ
p ɛ g oː r ɛ	p ɛ j oː r ɛ m
k ɔ n ʊ m	k oː n ʊ m
f ɔ r t iː t ʊ m	f ɔ r t ʊ iː t ʊ m
m eː d j aː r ɛ	m ɛ d j aː r ɛ
s uː pː l ɪ r ɛ m	s ʊ pː l eː r ɛ
w ɛ r ɪ t aː t ɛ m	w eː r ɪ t aː t ɛ m
ɪ n k ɛ n s ʊ m	ɪ ŋ k eː n s ʊ m
a m ɪ k a m	a m iː k a m
p l a n ɪ t j ɛ m	p l aː n ɪ t ɪ ɛ m
p r ɔ l ɔ k j ʊ m	p r oː l ɔ kʷ j ʊ m
g a n ɪ r	g a nː iː r ɛ
k ɔ m p ʊ n k t j oː n ɛ m	k ɔ m p ʊ ŋ k t j oː n ɛ m
ɪ r a s k ɪ b ɪ l ɛ	iː r aː s k ɪ b ɪ l ɛ m
k ɔ n s ɪ l ʊ m	k oː n s ɪ l j ʊ m
f ɔ l oː s ʊ m	f ɔ l j oː s ʊ m
f r aː s ɪ n ʊ m	f r a k s ɪ n ʊ m
w ɪ r g ʊ l a m	w ɪ r g ʊ l a m
b w aː aː t ʊ m	b ɔ aː t ʊ m
k ɔ kʷ ɛ	k ɔ kː ʊ m
a r b oː r ɛ t ʊ m	a r b ɔ r eː t ʊ m
r eː k aː l t ɪ t r aː r ɛ	r ɛ k a l k ɪ t r aː r ɛ
r ɛ p r ɛ ɛ n s j oː n ɛ m	r ɛ p r ɛ h ɛ n s j oː n ɛ m
l ɪ b ɛ l ʊ m	l ɪ b ɛ lː ʊ m
ɔ s p ɪ t aː l ɛ	h ɔ s p ɪ t aː l ɛ
k s t ɔ r k ɛ r ɛ	ɛ k s t ɔ r kʷ eː r ɛ
eː m a k t aː	ɛ m aː k ɪ t aː t ɛ m
aʊ r ɪ g a m	aʊ r iː g a m
k ɔ n k ʊ rː ɛ r ɛ	k ɔ ŋ k ʊ rː ɛ r ɛ
p r ɛ s ɛ n t ɪ r ɛ	p r aɪ s ɛ n t iː r ɛ
t a r d ʊ m m	t a r d ʊ m
eː r ɔ g a m r ɛ	eː r ɔ g aː r ɛ
ɛ k s kʷ r ɛ t aː r	ɛ k s k ɛ r n ɛ r ɛ
f ɔ r t ɛ m	f ɔ r t ɛ m
p ɔ t r ɪ r ɛ	p ʊ t r ɛ r ɛ
k r ʊ k ɪ f eː r ʊ m	k r ʊ k ɪ f ɛ r ʊ m
a lː ɪ	ɪ lː ʊ ŋ k
oː r ɪ ʊ m	h ɔ rː ɛu m
ɛ n t ɛ	ɛ n s
p ɔ r t ʊ g ɛ s ɛ	p ɔ r t ʊ k eː n s ɛ m
eː r ɛ d ɪ m aː t ɛ m	h eː r eː d ɪ t aː t ɛ m
ɔ n ɛ ɛ	ɔ n ʊ s
d ɛ ɪ f ɪ k aː r ɛ	d ɛ ɪ f ɪ k aː r ɛ
ɪ n d ɪ s k r ɛ t j oː n ɛ m	ɪ n d ɪ s k r eː t j oː n ɛ m
t ɔ r k ɛ r ɛ	t ɔ r kʷ eː r ɛ
ɪ n k oː n w ɛ n ɛ j ɛ n t ɛ	ɪ ŋ k ɔ n w ɛ n ɪ ɛ n t ɛ m
b aː l aː t a m	b l a tː a m
t w ʊ m	t ʊː m
ʊ n ɪ w oː k ʊ m	uː n ɪ w ɔ k ʊ m
p a s t oː r ɛ	p aː s t oː r ɛ m
b a r b aː r ɪ s m ʊ m	b a r b a r ɪ s m ʊ m
f ɛ m ʊ r ɛ	f ɛ m ʊ r
g oː l a m	g ʊ l a m
a n ɔ t aː t j oː n ɛ m	a nː ɔ t aː t j oː n ɛ m
k ɔ m j a m t ʊ m	k ɔ mː ɛ aː t ʊ m
ɔ s p ɪ t j ʊ m	h ɔ s p ɪ t j ʊ m
k a l ɪ d ʊ m	k a lː ɪ d ʊ m
w ɪ l a m r ɛ	w eː l aː r ɛ
k ɔ p ʊ l a m t j oː n ɛ m	k oː p ʊ l aː t j oː n ɛ m
ɪ m f l ɪ j ɛ r	iː n f l iː g ɛ r ɛ
n a t ʊ r a m	n aː t uː r a m
m ɛ n t ʊ m	m ɛ n t ʊ m
a b s ɪ s a m	a b s k ɪ n d ɛ r ɛ
k r ɪ m ɪ n a m t j oː n	k r iː m ɪ n aː t j oː n ɛ m
p r ɔ r oː g aː r ɛ	p r oː r ɔ g aː r ɛ
p ɛ r m a m n ɛ ɛ r ɛ	p ɛ r m a n eː r ɛ
ɛ s ʊ m	ɪ p s ʊ m
p ɛ r s ɛ k uː t oː r ɛ	p ɛ r s ɛ k uː t oː r ɛ m
f uː l g iː r ɛ	f ʊ l g eː r ɛ
ɔ fː ɪ k ʊ m s j ʊ m	ɔ fː ɪ k j oː s ʊ m
ɪ n t ɛ r k ɛ d ɛ r ɛ	ɪ n t ɛ r k eː d ɛ r ɛ
a fː l ɪ g ɛ r ɛ	a fː l iː g ɛ r ɛ
w ɪ p t ʊ m	w iː k t ʊ m
ɛ ŋ s ʊ g aː r ɛ	ɛ k sː uː k aː r ɛ
w ɪ s aː r	w iː s ɛ r ɛ
a s p ɛ r s j oː n ɛ m	a s p ɛ r s j oː n ɛ m
r ɛ t r ɪ b ʊ ɛ r ɛ	r ɛ t r ɪ b ʊ ɛ r ɛ
t ɔ r t ɪ l ɛ	t ɔ r t ɪ l ɛ m
k ɔ t ʊ r n ɪ k ɛ	k oː t ʊ r n iː k ɛ m
f a r ɛ l ʊ m	f a r
m a r t ɪ r ɛ	m a r t y r ɛ m
k ɛ l ɛ b r ɛ m	k ɛ l ɛ b r ɛ m
ɔ p ɛ r aː r ɛ	ɔ p ɛ r aː r iː
d eː t ɛ n t j oː n ɛ m	d eː t ɛ n t j oː n ɛ m
ɪ mː a t ʊ r ɪ t aː t ɛ m	ɪ mː aː t uː r ɪ t aː t ɛ m
d j a b ʊ m l ʊ m	d j a b ɔ l ʊ m
m ɔ l aː r ɛ	m ɔ l aː r ɛ m
ɪ n t ɛ rː ʊ p t j oː n ɛ m	ɪ n t ɛ rː ʊ p t j oː n ɛ m
d j ʊ m k	tʰ iː ʊ m
w ɛ r ɪ f ɪ k aː t j oː n ɛ m	w ɛ r ɪ f ɪ k aː t j oː n ɛ m
p r ɛ s aː r ɛ	p r ɛ t j aː r ɛ
r aː s ɛ k aː r ɛ	r ɛ s ɛ k aː r ɛ
l a t ʊ m	l aː t ʊ m
d eː s k ɪ n g ɛ r ɛ m	d ɪ s k ɪ ŋ g ɛ r ɛ
r ʊ b ɛ r eː	r oː b ʊ r
m a n ɪ k a m	m a n ɪ k a m
ɔ s t ɛ n s iː w ʊ m	ɔ s t eː n s iː w ʊ m
ɪ n t ɛ n t ʊ m	ɪ n t ɛ n t ʊ m
s uː b ɛ r m ʊ m	s uː b ɛ r ɛ m
k ɔ m p r a m t oː r ɛ	k ɔ m p a r aː t oː r ɛ m
ɔ r t ʊ m	h ɔ r t ʊ m
s ɔ m a m	s ʊ mː a m
r eː m ʊ n ɛ r aː r ɛ	r ɛ m uː n ɛ r aː r ɛ
a p j aː r j ʊ m	a p j aː r j ʊ m
l ɪ m a m	l iː m a m
m a n k ɪ p a m j oː	m a ŋ k ɪ p j ʊ m
p r ɛ w j ʊ m	p r aɪ w j ʊ m
ɪ d aɪ n t ɪ t aː t ɛ m	iː d ɛ n t ɪ t aː t ɛ m
s ʊ r t ɪ r ɛ	s ɔ r t iː r iː
p uː d oː r ɛ m	p ʊ d oː r ɛ m
a k s k ɛ s a r j ʊ m	a kː ɛ sː oː r j ʊ m
l a r w a m	l aː r w a m
r t ʊ m	r uː k t ʊ m
m ɛ r ɪ t ɛ r ɛ	m ɛ r eː r ɛ
a k aɪ r w ʊ m	a k ɛ r w ʊ m
a t a r	a p t aː r ɛ
l ɔ t oː s ʊ m	l ʊ t oː s ʊ m
g ɪ l oː s ʊ m	z eː l oː s ʊ m
d eː k ɛ d eː r ɛ	d eː k eː d ɛ r ɛ
k a pː ɛ lː a m	k a pː ɛ lː a m
k ɔ n s a m	k ɔ ŋ kʰ a m
f l uː w j aː l ɛ	f l ʊ w j aː l ɛ m
w ɪ t r ʊ m	w ɪ t r ʊ m
k ɔ n s ɪ s t ɛ r ɛ	k oː n s ɪ s t ɛ r ɛ
ɪ s t ɪ t uː ɪ r ɛ	iː n s t ɪ t ʊ ɛ r ɛ
k a s t r ʊ m	k a s t r ʊ m
k a lː ʊ m	k a lː ʊ m
k ɔ m ɪ s j oː n ɛ m	k ɔ mː ɪ sː j oː n ɛ m
k ɛ r kʰ aː r ɛ	k ɪ r k aː r ɛ
a b ɔ l ɪ t j oː n ɛ m	a b ɔ l ɪ t j oː n ɛ m
ɔ t r ɛ	ʊ t r ʊ m
s t r ɛ n w ʊ m	s t r eː n ʊː m
a l j eː n aː r ɛ	a l ɪ eː n aː r ɛ
k r iː b m ʊ m	k r iː b r ʊ m
aʊ r ɪ r	h aʊ r iː r ɛ
p a w ɪ d ʊ m	p a w ɪ d ʊ m
s ɔ l ɪ k ɪ t aː r ɛ	s ɔ lː ɪ k ɪ t aː r ɛ
k ɪ k ɛ r	k ɪ k ɛ r
s ɔ m n ɪ f ɛ m r ʊ m	s ɔ m n ɪ f ɛ r ʊ m
d ɪ g ɪ t aː l ɛ	d ɪ g ɪ t aː l ɛ m
p r oː b ʊ m	p r ɔ b ʊ m
s ɛ p ʊ l t uː r a m	s ɛ p ʊ l t uː r a m
a n t ɛ n a m	a n t ɛ nː a m
n a t j oː n ɛ m	n aː t j oː n ɛ m
a pː ɔ r t a m r ɛ	a pː ɔ r t aː r ɛ
p a t r j aː r k aː t ʊ m	p a t r j a r kʰ a t ʊ m
aɪ s t ɪ ɪ ʊ m	aɪ s t aː t ɛ m
k ɔ l ʊ b r ɪ n ʊ m	k ɔ l ʊ b r iː n ʊ m
r a s oː n aː b ɪ l ɛ m	r a t j oː n aː b ɪ l ɛ m
t r ɪ n f a m t oː r ɛ	t r j ʊ m pʰ aː t oː r ɛ m
m ɛ d ɪ r	m eː t iː r iː
p ɛ k oː r a m	p ɛ k ʊ s
b ɛ n ɛ d ɪ k t j oː n ɛ m	b ɛ n ɛ d ɪ k t j oː n ɛ m
b a k aː l ɛ m	b a kː a l aʊ r ɛu m
l a p ɪ d aː t j ʊ m n ɛ m	l a p ɪ d aː t j oː n ɛ m
f ʊ l ɪ m g ɪ n ɛ	f uː l iː g ɪ n ɛ m
s ɪ g ɛ lː ʊ m	s ɪ g ɪ lː ʊ m
ɛ k s p r iː m ɛ r ɛ	ɛ k s p r ɪ m ɛ r ɛ
ʊ d ɪ t ʊ m	aʊ d iː t ʊ m
s t ʊ p r ʊ m	s t ʊ p r ʊ m
m ɪ ŋ g ɛ r ɛ	m ɪ ŋ g ɛ r ɛ
g eː m ɪ t ʊ m	g ɛ m ɪ t ʊ m
p r ɛ s k r iː w ɛ r ɛ	p r aɪ s k r iː b ɛ r ɛ
a d s k r ɪ w ɛ r ɛ	aː s k r iː b ɛ r ɛ
s ɪ b l w aː r ɛ	s iː b ɪ l aː r ɛ
p ɔ l aː r ɛ m	p ʊ lː aː r ɛ
k ɔ m p l eː t ɪ w ʊ m	k ɔ m p l eː t iː w ʊ m
d eː p l oː r aː r ɛ	d eː p l oː r aː r ɛ
t ɛ m p oː r aː r j ʊ m	t ɛ m p ɔ r aː r j ʊ m
k ɔ n t ʊ r b a m t j oː n ɛ m	k ɔ n t ʊ r b aː t j oː n ɛ m
ɔ n ɛ s t ɛ	h ɔ n ɛ s t aː t ɛ m
m ɪ n oː r aː r ɛ	m ɪ n oː r aː r ɛ
t uː b ɛ r ʊ m s ʊ m	t uː b ɛ r oː s ʊ m
t r a d ɪ m oː r ɛ	t r aː d ɪ t oː r ɛ m
k a s t aː n aː	k a s t a n ɛ a m
d eː s p ɛ t aː r ɛ	d eː s p ɛ k t aː r ɛ
a l ɔ s a m	a l aʊ s a m
d eː p r ɪ m ɛ r ɛ	d eː p r ɪ m ɛ r ɛ
ɔ kː ʊ rː ɛ r ɛ	ɔ kː ʊ rː ɛ r ɛ
j uː d ɪ k a m t oː r ɛ	j uː d ɪ k aː t oː r ɛ m
k ɔ m ʊ n j ʊ m n ɛ m	k ɔ mː uː n iː r ɛ
f uː m oː s ʊ m	f uː m oː s ʊ m
a m ɪ k t ʊ m	a m ɪ k t ʊ m
b ɛ n ɛ	b ɪ ɛ nː ɛ m
d eː n oː m ɪ n aː t oː r ɛ	d eː n oː m ɪ n aː t oː r ɛ m
ɪ b ɪ l ɛ	ɪ b ɪ l ɛ m
m ɛ n d ɪ k aː r ɛ	m ɛ n d iː k aː r ɛ
a b a l iː ɛ n aː t j oː n ɛ m	a b a l ɪ eː n aː t j oː n ɛ m
p ɔ s t r iː b ʊ l ʊ m	p r oː s t ɪ b ʊ l ʊ m
ʊ l t r ɪ k ɛ	ʊ l t r iː k ɛ m
ɪ m p r ɔ b ʊ m	ɪ m p r ɔ b ʊ m
d eː f ɛ r iː r ɛ	d eː f ɛ rː ɛ
ʊ ŋ g ʊ l aː t ʊ m	ʊ ŋ g ʊ l aː t ʊ m
a m ɪ k ɪ t j a m	a m iː k ɪ t j a m
r a p aː k ɛ	r a p aː k ɛ m
a b s t ɛ n ɛ m r ɛ	a b s t ɪ n eː r ɛ
d ɪ s w aː d ɛ r ɛ	d ɪ sː w aː d eː r ɛ
k ɛ n t ʊ r j a m	k ɛ n t ʊ r j a m
t eː n ɛ b r ʊ m s ʊ m	t ɛ n ɛ b r oː s ʊ m
a l k j oː n	a l k y ɔ n ɛ m
p ɛ k ʊ n j aː r j ʊ m	p ɛ k uː n j aː r j ʊ m
r eː w ɛ n ɪ r ɛ	r ɛ w ɛ n iː r ɛ
k a n ɪ n ʊ m	k a n iː n ʊ m
ɔ r d j ʊ m	h ɔ r d ɛu m
f ɪ n a l ɪ t aː t ɛ m	f iː n aː l ɪ t aː t ɛ m
k l aː w ʊ m	k l aː w ʊ m
k ʊ p l a m	k oː p ʊ l a m
l eː t ʊ m	l eː k t ʊ m
t r ɪ k ɛ n aː r j ʊ m	t r iː k eː n aː r j ʊ m
w ʊ m eː r ɛ	w ɔ m ɛ r ɛ
r eː t ɛ m n eː r ɛ	r ɛ t ɪ n eː r ɛ
p ɛ l ɪ k a n ʊ m	p ɛ l ɛ k aː n ʊ m
ɔ s p eː t ɛ m	h ɔ s p ɪ t ɛ m
d eː n ɔ m iː n aː r ɛ	d eː n oː m ɪ n aː r ɛ
ɪ m p ɛ t ɪ m g ɪ n ɛ m	ɪ m p ɛ t iː g ɪ n ɛ m
s a sː ʊ m	s a k s ʊ m
eː s ɛ k aː r ɛ	ɛ k sː ɪ kː aː r ɛ
k ɔ l ɛ	k aʊ l ɛ m
s a l a k eː	s a l aː k ɛ m
ɔ l ɛ aː t ʊ m	ɔ l ɛ aː t ʊ m
m iː aː r	m eː j ɛ r ɛ
ɛ k s ɪ t aː r	ɛ k s k ɪ t aː r ɛ
s t r aː d a m	s t r aː t a m
d ɔ n ɪ s j aː k ʊ m	d ɪ ɔ n y s j a k ʊ m
ɔ k ɔ s ʊ m	oː t j oː s ʊ m
ɪ m p ɛ d ɪ m ɛ n t ʊ m	ɪ m p ɛ d iː m ɛ n t ʊ m
a p r ʊ n ʊ m	p r uː n ʊ m
w ɛ k s aː t j oː n ɛ m	w ɛ k s aː t j oː n ɛ m
a kː r ɛ k ɛ r ɛ	a kː r eː s k ɛ r ɛ
f ɔ r t ɪ t uː d ɪ n ɛ	f ɔ r t ɪ t uː d ɪ n ɛ m
a r g ʊ ɛ r	a r gʷ ɛ r ɛ
n ɔ t ɪ k aː	n oː t ɪ t j a m
a sː uː m ɛ r ɛ	a sː uː m ɛ r ɛ
m ɪ l ɪ t eː	m iː l ɪ t ɛ m
a r m ɛ n t ʊ m	a r m ɛ n t ʊ m
d ɪ s p aː r eː r ɛ	d ɪ s p a r eː r ɛ
k ɔ n f ɛ r ɛ r ɛ	k oː n f ɛ rː ɛ
d ɪ f l ʊ ɛ r	d ɪ fː l ʊ ɛ r ɛ
k a n ɪ k ʊ l a m	k a n iː k ʊ l a m
m ɛ r g eː r ɛ m	m ɛ r g ɛ r ɛ
ɔ r n aː t ʊ m	oː r n aː t ʊ m
m uː n ɪ r	m ɔ n eː r ɛ
k ɪ n ɛ n t ʊ m m	kʷ iː ŋ g ɛ n t oː s
s eː w ɛ r ʊ m	s ɛ w eː r ʊ m
g uː s t ɪ f iː k a m t ʊ m r ɛ m	j uː s t ɪ f ɪ k aː t oː r ɛ m
a fː ɛ k t ʊ m	a fː ɛ k t ʊ m
k ʊ k ɪ n aː r ɛ	k ɔ kʷ iː n aː r ɛ
ɪ n s ɪ m n aː r ɛ	iː n s ɪ ŋ n aː r ɛ
m eː t aː lː ʊ m	m ɛ t a lː ʊ m
ɔ w ɪ g a m	ɔ w ɪ k ʊ l a m
w ɪ t ʊ p ɛ r aː b ɪ l ɛ m	w ɪ t ʊ p ɛ r a b ɪ l ɛ m
kʷ ɪ t a n t a m	kʷ ɪ eː t a n t j a m
k ɔ n g j ʊ m	k ɔ ŋ g j ʊ m
m ɔ d ʊ l aː r ɛ	m ɔ d ʊ l aː r iː
s k a b l aː	s k a b ɪ ɛ m
ɪ rː ɪ g a m r ɛ	ɪ rː ɪ g aː r ɛ
k a n t oː r ɛ	k a n t oː r ɛ m
d eː m ɔ n s t r aː r ɛ	d eː m oː n s t r aː r ɛ
n a t ɪ k a m	n a t ɛ m
ɔ rː d ɪ t ʊ m	h ɔ rː ɪ d ʊ m
g l ɔ t oː n ɛ	g l ʊ tː oː n ɛ m
ɔ b s ɛ k j ʊ m m ʊ m	ɔ b s ɛ kʷ j oː s ʊ m
g a n j ʊ n	g a l b ɪ n ʊ m
s ɛ k oː l aː r ɛ m	s kʰ ɔ l aː r ɛ m
m uː r aː lː a m	m uː r aː l ɛ m
d eː k ɛ r n ɛ r ɛ	d eː k ɛ r n ɛ r ɛ
k ɔ n s ʊ m aː r	k oː n s ʊ mː aː r ɛ
ɛ k s ɪ s t ɛ r ɛ	ɛ k s ɪ s t ɛ r ɛ
k ɔ rː oː d ɛ r ɛ	k ɔ rː oː d ɛ r ɛ
k ɪ r k uː m n aː w ɪ g aː r ɛ	k ɪ r k ʊ m n aː w ɪ g aː r ɛ
ɪ n s ɪ ŋ n ɛ m	iː n s ɪ ŋ n ɛ m
aʊ k s ɪ l j aː r ɛ	aʊ k s ɪ l j aː r ɛ m
p ʊ ɛ r ɪ l iː t aː t ɛ m	p ʊ ɛ r iː l ɪ t a t ɛ m
a m a r kʷ aː r ɛ	a m aː r ɪ k aː r ɛ
t ɛ rː ɛ ʊ m	t ɛ rː ɛu m
s uː d aː r j ʊ m	s uː d aː r j ʊ m
a d uː l aː t oː r ɛ	a d uː l aː t oː r ɛ m
s a g ɪ t aː r j ʊ m	s a g ɪ tː aː r j ʊ m
t r ʊ n k aː r ɛ	t r ʊ ŋ k aː r ɛ
w eː r n aː l ɛ	w ɛ r n aː l ɛ m
d a t a m	d a t a
k ɔ n f ɛ d ɛ r aː t j oː n ɛ m	k oː n f ɔ ɪ d ɛ r aː t j oː n ɛ m
a kː uː s aː t oː r ɛ	a kː uː s aː t oː r ɛ m
t r ɪ b ʊ l ʊ m	t r ɪ b ʊ l ʊ m
n a s a m	n a sː a m
s t ɔ r a m	s t ɔ r ɛ a m
p ɔ r t j ɛ r ʊ m	p ɔ r t aː r j ʊ m
ɪ n t ɛ l ɛ g ɪ r ɛ	ɪ n t ɛ lː ɛ g ɛ r ɛ
ɪ n d ɪ ŋ n aː t j oː n ɛ m	ɪ n d ɪ ŋ n aː t j oː n ɛ m
k ɔ n s ɪ ŋ n aː r ɛ	k oː n s ɪ ŋ n aː r ɛ
p eː kʰ aː r ɛ	p ɛ kː aː r ɛ
a b s t ɛ r g ɛ r ɛ	a b s t ɛ r g eː r ɛ
p r ɛ g oː n	p r aɪ k oː n ɛ m
k ɔ l ɪ r j ʊ m	k ɔ lː y r j ʊ m
h ʊ n g ɛ r ɛ m	ʊ ŋ g ɛ r ɛ
p r ɔ k ɛ d ɛ r ɛ	p r oː k eː d ɛ r ɛ
f ɔ t ɪ r	f ɔ d ɛ r ɛ
m ʊ s k a m	m ʊ s k a m
k ɔ l ʊ m b ʊ m	k ɔ l ʊ m b ʊ m
a d ɪ w ɪ n aː r ɛ	d iː w iː n aː r ɛ
r ɛ p oː r eː ɛ	r ɛ p oː n ɛ r ɛ
ɪ mː ɛ r g ɛ r ɛ	ɪ mː ɛ r g ɛ r ɛ
r ɔ ɪ r ɛ aː	r oː r ɛ m
g ʊ w ɛ r n aː t oː r ɛ	g ʊ b ɛ r n aː t oː r ɛ m
m ɔ r t w aː r j ʊ m	m ɔ r t w aː r j ʊ m
f l a m a m	f l a mː a m
p r aɪ d aː t j ʊ n ɛ m	p r aɪ d aː t j oː n ɛ m
kʷ ɔ t ɪ d j a n ʊ m	k ɔ t iː d j aː n ʊ m
d ɔ m ɛ s t iː k ʊ m	d ɔ m ɛ s t ɪ k ʊ m
ɪ t a t ɛ m	ɪ t aː t ɛ m
t ɛ s t ɪ m oː n j ʊ m	t ɛ s t ɪ m oː n j ʊ m
s ʊ m ʊ m	s ʊ mː ʊ m
s t a t uː ɛ r ɛ	s t a t ʊ ɛ r ɛ
a l g oː r ɛ m	a l g oː r ɛ m
n uː m ɛ n ɛ m	n uː m ɛ n
s p ʊ r k ʊ m	s p ʊ r k ʊ m
s t ʊ p a m	s t ʊ pː a m
p r ɔ t ɛ s t aː t j oː n ɛ m	p r oː t ɛ s t aː t j oː n ɛ m
k ɛ d r ʊ m	k ɛ d r ʊ m
a r a b ɪ l ɛ m	a r aː b ɪ l ɛ m
a n g oː s aː	a ŋ g ʊ s t j a m
r eː m ʊ m	r eː m ʊ m
r a d j aː t j oː n ɛ	r a d j aː t j oː n ɛ m
a n ɪ m oː	a n ɪ m ʊ m
k ɪ r k ʊ n d aː r ɛ	k ɪ r k ʊ m d a r ɛ
s a l ʊ b r iː t aː t ɛ m	s a l uː b r ɪ t aː t ɛ m
r ɛ s k iː n d ɛ r ɛ	r ɛ s k ɪ n d ɛ r ɛ
ɪ n f r eː n aː r ɛ	iː n f r eː n aː r ɛ
k ɔ n d ɛ n s aː r ɛ	k ɔ n d eː n s aː r ɛ
g t aː ŋ g ɛ r ɛ	t a ŋ g ɛ r ɛ
a w a l aː n k ɛ m	l aː b iː n a m
p r ɔ t r aː m r ɛ	p r oː t r a h ɛ r ɛ
w a s ɛ lː ʊ m	w aː s k ɛ lː ʊ m
ʊ m uː s	h ʊ m ʊ m
ɔ pː r oː b r j ʊ m	ɔ pː r ɔ b r j ʊ m
n ɪ b ɛ ʊ m	n ɪ w ɛu m
l uː m ɪ n oː s ʊ m	l uː m ɪ n oː s ʊ m
ɛ k s f oː lː j aː r ɛ	ɛ k s f oː l j aː r ɛ
a r ɛ m t aː r	ɪ m ɪ t aː r iː
eː w ɛ lː aː r ɛ	eː w ɪ g ɪ l aː r ɛ
d ɪ l a k eː r aː r	d iː l a k ɛ r aː r ɛ
ɪ ŋ g ɛ n j ʊ m m ʊ m	ɪ ŋ g ɛ n j oː s ʊ m
m eː t a lː ɪ f a r ʊ m	m ɛ t a lː ɪ f ɛ r ʊ m
a m a n ʊ ɛ n s ɛ m	aː m a n ʊ eː n s ɛ m
k ɔ n k a m t ɛ n a m r ɛ	k ɔ ŋ k a t eː n aː r ɛ
d eː s ʊ m ɛ r ɛ	d eː s uː m ɛ r ɛ
a b a l iː ɛ n aː r ɛ	a b a l ɪ eː n aː r ɛ
ʊ s t j ʊ m	oː s t j ʊ m
w ɛ r g a m	w ɪ r g a m
m ɔ w ɪ m ɛ n t ʊ m	m oː w ɪ m ɛ n t ʊ m
p oː n t j oː n ɛ m	p oː t j oː n ɛ m
k ɔ n f oː r m ɛ m	k oː n f oː r m ɛ m
p ɛ r k ʊ t ɛ r	p ɛ r k ʊ t ɛ r ɛ
s k ʊ rː a m	s k ʊ rː a m
ɪ m p ɛ r	ɪ m p a r ɛ m
s p ɛ s ʊ m	s p ɪ sː ʊ m
m ʊ r aː	m ʊ r j a m
m a pː a	m a pː a m
b ɛ t aː b a m	b eː t a m
l uː k s ʊ m	l uː k s ʊ m
f ɛ rː oː pʰ ʊ m	w ɛ r ɪ k ʊ l ʊ m
d eː m ɔ n j ʊ	d aɪ m ɔ n j ʊ m
h eː k ʊ r t aː r ɛ	k ʊ r t aː r ɛ
a p a r ɪ t j oː n	a pː aː r ɪ t j oː n ɛ m
w ɛ n ɛ r aː r ɛ	w ɛ n ɛ r aː r iː
p r ɔ f ʊ n d ɪ t aː t ɛ m	p r ɔ f ʊ n d ɪ t aː t ɛ m
t ɛ t r ʊ m	t aɪ t r ʊ m
r uː b iː g ɪ n oː s ʊ m	r oː b iː g ɪ n oː s ʊ m
m ɪ l j aː r ɛ m	m iː lː j aː r j ʊ m
ɪ n uː m aː n iː t aː t ɛ m	ɪ n h uː m aː n ɪ t aː t ɛ m
t a b ʊ l a m	t a b l a m
m a r ɪ s k aː	m a r ɪ s k a m
ɪ ɪ r oː s ʊ l iː m ɪ t aː m ʊ m	h ɪ ɛ r ɔ s ɔ l y m iː t aː n ʊ m
s ɔ k ɛ r a m	s ɔ k r ʊ m
p a k t ʊ m	p a k t ʊ m
f l ɔ w ʊ m	f l ʊ w j ʊ m
eː m ɛ n d aː r ɛ	eː m ɛ n d aː r ɛ
ʊ s ɪ t aː r ɛ	uː s ɪ t aː r iː
k ɔ l t r ʊ m	k ʊ l t r ʊ m
p ɛ n ʊ r aː	p eː n uː r j a m
t r ɛ m oː r ɛ	t r ɛ m oː r ɛ m
s ʊ s t ɛ n t aː r ɛ	s ʊ s t ɛ n t aː r ɛ
s a l a k ɪ t aː t ɛ m	s a l aː k ɪ t aː t ɛ m
m uː s k ʊ l oː s ʊ m	m uː s k ʊ l oː s ʊ m
a b a j a m	a bː aː t j a m
ɛ k s p ʊ lː s aː r ɛ	ɛ k s p ʊ l s aː r ɛ
p l ɛ n ɪ t ɛ m	p l eː n ɪ t aː t ɛ m
p eː n d ɛ r ɛ	p ɛ n d eː r ɛ
d ɛ s ɪ k aː t j oː n ɛ m	d eː s ɪ kː aː t j oː n ɛ m
s a k r ʊ m	s a k r ʊ m
a pː a r t ɛ r ʊ m	p a r t j aː r j ʊ m
d eː s p oː s aː r ɛ	d eː s p oː n s aː r ɛ
b ɛ n ɛ pʰ ɪ k ʊ m	b ɛ n ɛ f ɪ k ʊ m
m eː n d aː t j ʊ m	m ɛ n d aː k j ʊ m
p a r k r aː f ʊ m	p a r a g r a pʰ ʊ m
d ɪ s ɛ k aː r ɛ	d ɪ sː ɛ k aː r ɛ
p a r ʊ k ʊ m	p a r ɔ kʰ ʊ m
k ʊ k ɪ n a m	k ɔ kʷ iː n a m
k r ɔ s t oː s ʊ m	k r ʊ s t oː s ʊ m
