r uː g ɪ n ɛ m	aɪ r uː g ɪ n ɛ m
a k k ɛ s j oː n ɛ m	a kː ɛ sː j oː n ɛ m
d ɪ s ɪ m n aː r ɛ	d eː s ɪ ŋ n aː r ɛ
m ɔ r t aː r j ʊ m	m ɔ r t aː r j ʊ m
k r ʊ k ɪ f ɛ r ʊ m	k r ʊ k ɪ f ɛ r ʊ m
a r b uː s t ɪ w ʊ m	a r b ʊ s t iː w ʊ m
l a m ɛ n t aː r ɛ	l aː m ɛ n t aː r ɛ
s ɛ r ʊ m	s ɛ r ʊ m
ɪ n d ɪ ŋ n a t j oː n ɛ m	ɪ n d ɪ ŋ n aː t j oː n ɛ m
ɪ n d ɪ g ɛ n t a m	ɪ n d ɪ g ɛ n t j a m
s ɛ w ɛ r ɪ t aː t ɛ m	s ɛ w eː r ɪ t aː t ɛ m
a n ɛ g aː r ɛ	eː n ɛ k aː r ɛ
aʊ k s ɪ l j aː r ɛ	aʊ k s ɪ l j aː r ɛ m
p ʊ l ɪ r ɛ	p ɔ l iː r ɛ
w ɔ r t ɪ k k ɛ m	w ɔ r t ɪ k ɛ m
p r ɛ k ɛ d ɛ r ɛ	p r aɪ k eː d ɛ r ɛ
w ɛ ɛ r ɛ	w ɛ lː ɛ r ɛ
n ɔ w ɪ l uː n j ʊ m	n ɔ w ɪ l uː n j ʊ m
a l ɔ s a m	a l aʊ s a m
s uː b ɪ t ʊ m	s ʊ b ɪ t ʊ m
t uː m ɪ d ʊ m	t ʊ m ɪ d ʊ m
d r aː pː ɛ l ʊ m	d r a pː ʊ m
t a k ɛ r ɛ	t a k eː r ɛ
d ɛ n ʊ n k t j aː t j ɛ m	d eː n ʊ n t j aː t j oː n ɛ m
ɪ n d aː m n ɛ m	ɪ n d ɛ m n ɛ m
s ɛ n ɛ k t uː t ɛ	s ɛ n ɛ k t ʊ m
a pː r ɔ k aː r ɛ	a pː r ɔ p j aː r ɛ
m ɛ n t ʊ m	m ɛ n t ʊ m
k l ʊ k aː r ɛ	g l oː k iː r ɛ
ɪ s ʊ l aː t ʊ m	iː n s ʊ l aː t ʊ m
d ɛ p r ɪ m ɛ r ɛ	d eː p r ɪ m ɛ r ɛ
s ʊ r t ɪ r ɛ	s ɔ r t iː r iː
t r ɪ f ɔ l j aː t ʊ m	t r ɪ f ɔ l j aː t ʊ m
b a r b ʊ l ʊ m	b a r b ʊ l a m
a r uː s p ɪ k ɛ m	h a r ʊ s p ɪ k ɛ m
a g a t a m	a kʰ aː t eː n
p r ɛ k ɛ p t ʊ m	p r aɪ k ɛ p t ʊ m
ɛ n k a n ɛ t ɛ r ɛ	ɪ ŋ k aː n eː s k ɛ r ɛ
b ʊ k ɪ n ɛ	b uː k ɪ n ʊ m
a lː uː t ɪ n aː r ɛ	aː l uː k ɪ n aː r iː
k ɛ n a k ʊ lː ʊ m	k eː n aː k ʊ l ʊ m
k a n d oː r ɛ	k a n d oː r ɛ m
w a k a t j oː n ɛ m	w a k aː t j oː n ɛ m
g ɔ k ʊ n d ʊ m	j uː k ʊ n d ʊ m
h oː r k ʊ m	ɔ r k ʊ m
k a r d ɪ n ɛ m	k a r d ɪ n ɛ m
ɪ n t ɛ r g ɛ k t j ɔ m	ɪ n t ɛ r j ɛ k t j oː n ɛ m
s a t ɪ r ɪ k ʊ m	s a t ɪ r ɪ k ʊ m
k a n t ʊ m	k a n t ʊ m
p a r t ɪ t j oː n ɛ m	p a r t iː t j oː n ɛ m
d ɪ m a n aː r ɛ	d iː m aː n aː r ɛ
k a p a k ɪ t aː t ɛ m	k a p aː k ɪ t aː t ɛ m
r ɛ t ɛ t a m	r ɛ k ɛ p t a m
f r aː s k ʊ m	f l a s k oː n ɛ m
k aː l ɪ g a m	k a l ɪ g a m
s uː pː l ɪ r ɛ	s ʊ pː l eː r ɛ
w ɪ r aː g ɛ	w ɪ r aː g ɪ n ɛ m
p a lː j uː m	p a l ɪ uː r ʊ m
l uː d ɪ b r j ʊ m	l uː d iː b r j ʊ m
l uː k j ʊ m	l uː k j ʊ m
t r ɪ b uː t ʊ m	t r ɪ b uː t ʊ m
s a l ɪ k ɛ t ʊ m	s a l ɪ k eː t ʊ m
r ɛ g ʊ l aː r ɛ	r eː g ʊ l aː r ɛ
f uː r ɛ n ɛ m	f uː r ɛ m
a p j aː r j ʊ m	a p j aː r j ʊ m
k a n ɔ r ʊ m	k a n oː r ʊ m
w ɛ s k ʊ m	w eː s k ʊ m
k ɔ n k ɛ r n ɛ r ɛ	k ɔ ŋ k ɛ r n ɛ r ɛ
d ɪ w ɪ n a t j ʊ n ɛ m	d iː w iː n aː t j oː n ɛ m
s ɛ t a m	s aɪ t a m
f ɛ rː a m j ɛ n t a m	f ɛ rː aː m ɛ n t ʊ m
m a l ɛ d ɪ k ɛ r ɛ	m a l ɛ d iː k ɛ r ɛ
ɪ n t ɛ m p ɛ k t ɪ w ɪ t aː t ɛ m	ɪ n t ɛ m p ɛ s t iː w ɪ t aː t ɛ m
l ɛ g ɛ	l eː g ɛ m
f ɔ r n aː k j a m	f ɔ r n aː k ʊ l a m
d ɪ s t ɪ lː a t j ʊ n ɛ m	d ɪ s t ɪ lː a t j oː n ɛ m
d ɛ s t ɪ t ʊ ɪ r ɛ	d eː s t ɪ t ʊ ɛ r ɛ
m ɛ r ɪ t ɛ r ɛ	m ɛ r eː r ɛ
l ɪ n aː r ʊ m	l iː n aː r j ʊ m
k ɔ lː ɛ k t a m	k ɔ lː eː k t a m
b aː lː n ɛ aː r j ʊ m	b a l n ɛ aː r j ʊ m
k oː n b ɛ n iː r ɛ	k ɔ n w ɛ n iː r ɛ
t aː k t ɪ l ɛ	t aː k t ɪ l ɛ m
s uː pː ɔ r eː m	s ʊ pː oː n ɛ r ɛ
p r ɔ d uː k t ɪ w ʊ m	p r oː d ʊ k t iː w ʊ m
ɔ t j ʊ m	oː t j ʊ m
uː r b ɛ m	ʊ r b ɛ m
t uː r p ɪ t uː d ɪ n ɛ	t ʊ r p ɪ t uː d ɪ n ɛ m
ɪ n k ɛ n d j aː r j ʊ m	ɪ ŋ k ɛ n d j aː r j ʊ m
oː w ɛ l j a m	ɔ w ɪ k ʊ l a m
p uː lː uː l aː r ɛ	p ʊ lː ʊ l aː r ɛ
m uː t aː r ɛ	m uː t w aː r iː
p r ɔ w ɔ k aː r ɛ	p r oː w ɔ k aː r ɛ
s p ɪ n aː l ɛ	s p iː n aː l ɛ m
a k r ɛ s k ɛ r ɛ	a kː r eː s k ɛ r ɛ
s a n t ʊ m	s aː ŋ k t ʊ m
p ʊ l s aː r ɛ	p ʊ l s aː r ɛ
p aː l ʊ m b a r ʊ m	p a l ʊ m b aː r j ʊ m
g ʊ ʊ r n aː l ɛ	d j ʊ r n aː l ɛ m
p r ɔ w ɔ k a t ɪ w ʊ m	p r oː w ɔ k aː t iː w ʊ m
ɪ n s ɛ r ɪ r ɛ	iː n s ɛ r ɛ r ɛ
f ɛ n d ɛ r ɛ	f ɪ n d ɛ r ɛ
ɔ k uː l t aː r ɛ	ɔ kː ʊ l t aː r ɛ
k ʊ t r ɪ ʊ l aː r ɛ	k ɔ n t r ɪ b ʊ l aː r ɛ
f ʊ n d a t oː r ɛ	f ʊ n d aː t oː r ɛ m
a p l ʊ m	a m p l ʊ m
m ɛ r ɪ d j ɪ ɔ n aː l ɛ	m ɛ r iː d j oː n aː l ɛ m
ɪ m p r ɛ k aː r ɛ	ɪ m p r ɛ k aː r iː
ɪ m n ʊ m	h y m n ʊ m
p a k aː r ɛ	p aː k aː r ɛ
s a l uː t a t j oː n ɛ	s a l uː t aː t j oː n ɛ m
s a n t ʊ r j ɛ t a m	s a t ʊ r eː j a m
l ɪ m oː s ʊ m	l iː m oː s ʊ m
ɛ n k ʊ ɪ n ɛ	ɪ ŋ k uː d ɛ m
f uː s t ɛ m	f uː s t ɛ m
a r ɔ m a t ɪ k ʊ m	a r oː m a t ɪ k ʊ m
w ɪ t uː p ɛ r a t j ʊ n ɛ	w ɪ t ʊ p ɛ r aː t j oː n ɛ m
a d uː l aː r ɛ	a d uː l aː r iː
ɪ t ʊ m	ɛ tː ʊ m
eː f ɪ k a t ɪ t aː t ɛ m	ɛ fː ɪ k aː k ɪ t aː t ɛ m
d ɪ s p ɔ s ɪ t j ʊ n ɛ	d ɪ s p ɔ s ɪ t j oː n ɛ m
d uː l k a m a r a m	d uː l k a m aː r a m
p aː l p ɪ t aː r ɛ	p a l p ɪ t aː r ɛ
g ɛ m a m	g ɛ mː a m
t r a l uː k ɪ r ɛ	t r aː n s l uː k eː r ɛ
s j ɛ p ɛ m	s aɪ p ɛ m
ɛ k s ɛ kʷ ʊ r ɛ r ɛ	ɛ k sː ɛ kʷ iː
w ɪ g ɔ r aː r ɛ	w ɪ g oː r aː r ɛ
a b r ɛ w j a t j oː n ɛ m	a bː r ɛ w j aː t j oː n ɛ m
g oː n z ɛ m	g ɔ m pʰ ʊ m
ɪ	ʊ m
a l w ɛ ʊ m	a l w ɛu m
b ɛ n ɛ d ɛ t ʊ m	b ɛ n ɛ d ɪ k t ʊ m
k ɔ lː ɛ r a m	kʰ ɔ l ɛ r a m
b l a n d ɪ r ɛ	b l a n d iː r iː
ɔ fː ɛ r ɛ k ɛ r ɛ	ɔ fː ɛ rː ɛ
a b s t r uː s ʊ m	a b s t r uː s ʊ m
a g r ɛ g a t j oː n ɛ m	a gː r ɛ g a t j oː n ɛ m
s t r aː d a m	s t r aː t a m
ɛ k s t r a ɔ r d ɪ n aː r j ʊ m	ɛ k s t r aː ɔ r d ɪ n aː r j ʊ m
kʷ r ɪ b r aː r ɛ	k r iː b r aː r ɛ
r uː p ɛ m	r uː p ɛ m
t r a n s p oː r eː m	t r aː n s p oː n ɛ r ɛ
ɪ t ɛ r aː r ɛ	ɪ t ɛ r aː r ɛ
p a g a n ɪ s m ʊ m	p aː g aː n ɪ s m ʊ m
f ɔ r t ɪ f ɪ k aː r ɛ	f ɔ r t ɪ f ɪ k aː r ɛ
ɛ s t ɛ r n ʊ m	h ɛ s t ɛ r n ʊ m
a r ɛ p aː t ɛ r ɛ	p aɪ n ɪ t eː r ɛ
p r ɔ w ɛ n ɪ r ɛ	p r oː w ɛ n iː r ɛ
m a r ɪ t aː l ɛ	m a r iː t aː l ɛ m
m ɔ d ɛ r a t oː r ɛ	m ɔ d ɛ r aː t oː r ɛ m
k a p s g ʊ k ʊ m	k a p t j oː s ʊ m
d ɛ k ɪ m aː l ɛ	d ɛ k ɪ m a l ɛ m
ɪ n f ɛ r ɛ r ɛ	iː n f ɛ rː ɛ
k ɔ n s ɛ r w a t j oː n ɛ m	k oː n s ɛ r w aː t j oː n ɛ m
ɛ k s t ɛ r j oː r ɛ	ɛ k s t ɛ r j oː r ɛ m
n ɪ m b ʊ m	n ɪ m b ʊ m
w ɛ n uː s t ʊ m	w ɛ n ʊ s t ʊ m
k a t ɛ k ɪ s m ʊ m	k a t eː kʰ ɪ s m ʊ m
k a b ɛ ʊ m	k a p ɪ t j ʊ m
a gː r ɛ d ɛ r ɛ	a gː r ɛ d iː
f r ɛ kʷ ɛ n t aː r ɛ	f r ɛ kʷ ɛ n t aː r ɛ
w ɪ k a m	b iː g a m
ɔ n ɔ r aː b ɪ l ɛ m	h ɔ n oː r aː b ɪ l ɛ m
s a l uː t aː r ɛ	s a l uː t aː r ɛ
a m b ɪ kʷ ɪ t aː t ɛ m	a m b ɪ gʷ ɪ t aː t ɛ m
f ɛ m ɪ n a m	f eː m ɪ n a m
k ɔ ŋ j uː g aː r ɛ	k ɔ n j ʊ g aː r ɛ
k aʊ d aː l ɛ	k aʊ d aː l ɛ m
s ɪ t a s w ɛ m	k ɪ t aː t j oː n ɛ m
d ɔ r aː r ɛ	d ɛ aʊ r aː r ɛ
a w ɛ r s j oː n ɛ	aː w ɛ r s j oː n ɛ m
r ɛ p l ɪ k a t j oː n ɛ	r ɛ p l ɪ k aː t j oː n ɛ m
ɪ n f l ɪ k t j oː n ɛ m	ɪ n f l ɪ k t j oː n ɛ m
j ɛ l aː r ɛ	g ɛ l aː r ɛ
s a g ɛ t aː r ɛ	s a g ɪ tː aː r ɛ
k r ɛ p a t uː r a m	k r ɛ p aː t uː r a m
ɪ n k a r n aː r ɛ	ɪ ŋ k a r n aː r ɛ
w a k ɪ lː a t j oː n ɛ m	w a k ɪ lː aː t j oː n ɛ m
ɪ ŋ g ɛ n ɛ d r aː r ɛ	ɪ ŋ g ɛ n ɛ r aː r ɛ
r ɛ k ɔ rː ɛ r ɛ	r ɛ k ʊ rː ɛ r ɛ
a ŋ g uː s t ʊ m	a ŋ g ʊ s t ʊ m
k ɔ lː ɛ m	k ɔ lː ɛ m
m uː n ɪ t j ɔ m	m uː n iː t j oː n ɛ m
s ɛ r j ʊ s ʊ m	s eː r j oː s ʊ m
g ɛ m ɛ lː ʊ m	g ɛ m ɛ lː ʊ m
t ɛ t ʊ m	t eː k t ʊ m
k ɔ s t aː t ʊ m	k ɔ s t aː t ʊ m
w ɪ k ɪ n ɪ t aː t ɛ m	w iː k iː n ɪ t aː t ɛ m
f ɛ s t ɪ n a r ɛ	f ɛ s t iː n aː r ɛ
ɔ r b ɪ t ɛ	ɔ r b ɛ m
w ɔ m ɪ t aː r ɛ	w ɔ m ɪ t aː r ɛ
ɪ n k lː ʊ ɪ r ɛ	ɪ ŋ k l uː d ɛ r ɛ
a b ɛ rː aː r ɛ	a b ɛ rː aː r ɛ
k ɛ n s oː r ɛ	k eː n s oː r ɛ m
k ɛ l ɛ b r a t j ʊ n ɛ	k ɛ l ɛ b r aː t j oː n ɛ m
ɛ k s p lː a n a t j oː n ɛ m	ɛ k s p l aː n aː t j oː n ɛ m
t a m ɪ s ʊ m	t a m ɪ s j ʊ m
ɔ b ɪ t ʊ m	ɔ b ɪ t ʊ m
a pː j ʊ m	a p j ʊ m
w ɪ k ʊ m	w iː k ʊ m
ɛ l ɛ n k ʊ m	ɛ l ɛ ŋ kʰ ʊ m
f uː n j ɛ	f uː n ɛ m
f ɛ r m ɛ n t ʊ m	f ɛ r m ɛ n t ʊ m
w ɪ w aː k ɛ	w iː w aː k ɛ m
s k ɔ l aː r ɛ	s kʰ ɔ l aː r ɛ m
g oː s j ʊ m	g ɛu s j aː s
b oː b ʊ m	b a l b ʊ m
h ɪ l ʊ m	ʊ l ʊ m
w ɪ g oː r ɛ	w ɪ g oː r ɛ m
a p ɛ g l j a m	a p ɪ k ʊ l a m
ɛ k s ɛ k r aː r ɛ	ɛ k sː ɛ k r aː r iː
s p uː t aː r ɛ	s p uː t aː r ɛ
p a nː ʊ m	p a nː ʊ m
f ɔ l k a m	f ʊ l ɪ k a m
b aː j a m	b aː k a m
l uː b r ɪ k ʊ m	l uː b r ɪ k ʊ m
r uː m ɪ n aː r ɛ	r uː m ɪ n aː r iː
s t a b ɪ l ɛ k ɛ r ɛ	s t a b ɪ l iː r ɛ
f a m uː l ʊ m	f a m ʊ l ʊ m
k aː ɪ l a r ɛ	k ɔ aː g ʊ l aː r ɛ
k r ʊ s t oː s ʊ m	k r ʊ s t oː s ʊ m
k r ɪ s t aː r ɛ	k r ʊ s t aː r ɛ
w ɔ t ɪ f ɛ r aː r ɛ	w oː k ɪ f ɛ r aː r iː
f l uː m ɛ m	f l uː m ɛ n
ɪ m p ɔ s ɪ t j oː n ɛ m	ɪ m p ɔ s ɪ t j oː n ɛ m
ʊ s aː r j ʊ m	uː s w aː r j ʊ m
k ɔ lː ɛ g j ʊ m	k ɔ lː eː g j ʊ m
a r k ɛ t ɪ p ʊ m	a r kʰ ɛ t y p ʊ m
s ɔ r ɔ r ɪ t aː t ɛ m	s ɔ r oː r ɪ t aː t ɛ m
s p ɔ l j ʊ m	s p ɔ l j ʊ m
p r ɛ n ʊ m	p r aɪ ŋ n aː t ɛ m
g l ɔ r j ɔ s ɪ s ɪ m ʊ m	g l oː r j oː s ɪ sː ɪ m ʊ m
m a ŋ n ɪ t uː d ʊ m	m a ŋ n ɪ t uː d ɪ n ɛ m
k ʊ k uː l ʊ m	k ʊ k uː l ʊ m
a rː aː s	a rː h a m
t ʊ s ʊ m	t oː n s ʊ m
a n t ɪ s t ɛ t ɛ m	a n t ɪ s t ɪ t ɛ m
k r ɔ k ʊ m	k r ɔ k ʊ m
m aː pː a m	m a pː a m
b a p t ɪ s t ɛ r j ʊ m	b a p t ɪ s t eː r j ʊ m
p ɛ r p ɛ t w aː t j ɪ n ɛ m	p ɛ r p ɛ t w aː t oː n ɛ m
s j ɛ rː a m	s ɛ rː a m
l aː k aː l ɛ	l eː g aː l ɛ m
d ʊ l k ɛ t uː m d ɪ r ɛ m	d ʊ l k ɪ t uː d ɪ n ɛ m
t ɛ ɔ s ɔ f j a m	tʰ ɛ ɔ s ɔ pʰ j a m
r a s k aː r ɛ	r aː d ɛ r ɛ
m ɛ s t ʊ m	m aɪ s t ʊ m
ɪ p n ɔ t ɪ k ʊ m	h y p n oː t ɪ k ʊ m
p ɛ n ɛ t r aː r ɛ	p ɛ n ɛ t r aː r ɛ
k ɪ p a m	k eː p a m
w a k j ɪ ʊ m	w a k iː w ʊ m
a k t a m	aː k t a
t r a m ɪ t ɛ m	t r aː m ɪ t ɛ m
g eː r m aː n ʊ m	g ɛ r m aː n ʊ m
k ɔ sː ʊ m	k ɔ sː ʊ m
w ɛ ŋ d ɪ ŋ aː t oː r ɛ	w ɪ n d ɪ k aː t oː r ɛ m
ɛ k s f ɔ lː j aː r ɛ	ɛ k s f oː l j aː r ɛ
f l ɛ b ʊ l ɛ m	f l eː b ɪ l ɛ m
t ɛ n ɛ b r a m	t ɛ n ɛ b r a m
p ʊ n t ʊ m	p uː ŋ k t ʊ m
ɪ n ɔ s ɛ r ɛ	ɪ ŋ n oː s k ɛ r ɛ
s t r ɪ g ɪ l ɛ	s t r ɪ g ɪ l ɛ m
a k eː f ɪ lː ʊ m	a kʷ ɪ f ɔ l j ʊ m
ɛ k s p uː ŋ g ɪ r ɛ	ɛ k s p ʊ ŋ g ɛ r ɛ
ɛ k r b ɪ t ʊ m	a r b ʊ t ʊ m
aɪ s t j ʊ m	aɪ s t aː t ɛ m
m ɔ g ɛ r ɛ	m ɔ l ɛ r ɛ
s uː s k iː t aː r ɛ	s ʊ s k ɪ t aː r ɛ
w ɔ l uː p t ɛ m	w ɔ l ʊ p t aː t ɛ m
ɛ k s t ɛ n d ɛ r ɛ	ɛ k s t ɛ n d ɛ r ɛ
s a ŋ gʷ ɪ n aː r j ʊ m	s a ŋ gʷ ɪ n aː r j ʊ m
m aː lː ɛ d ɪ k t j oː n ɛ m	m a l ɛ d ɪ k t j oː n ɛ m
w ɪ r k ʊ l a m	w ɪ r g ʊ l a m
w ɪ t uː p ɛ r a b ɪ l ɛ m	w ɪ t ʊ p ɛ r a b ɪ l ɛ m
gʷ a r d aː r ɛ	w a r d aː r ɛ
ɛ b d ɔ m a d aː r j ʊ m	h ɛ b d ɔ m a d aː r j ʊ m
d ɛ s ɪ s t ɛ r ɛ	d eː s ɪ s t ɛ r ɛ
aʊ k k j ɔ n ɛ	aʊ k t j oː n ɛ m
k ɔ lː ʊ m	k ɔ lː ʊ m
n a t a t oː r ɛ	n a t aː t oː r ɛ m
eː w ɔ k a t j oː n ɛ m	eː w ɔ k aː t j oː n ɛ m
p ɛ r m ɪ t ɛ r ɛ	p ɛ r m ɪ tː ɛ r ɛ
ɪ n m ɪ n ɛ n t ɛ m	ɪ mː ɪ n eː r ɛ
w ɛ rː k ʊ m	w ɛ rː ɛ m
s kʷ aː l ʊ m	s kʷ aː l ʊ m
a m b aː g ɛ s	a m b aː g ɛ m
g ɛ ɔ g r a f ɪ k ʊ m	g ɛ oː g r a pʰ ɪ k ʊ m
f a s t ɪ d j ʊ m	f a s t iː d j ʊ m
f l aː t ʊ m	f l aː t ʊ m
m uː n ɪ k ɪ p j ʊ m	m uː n ɪ k ɪ p j ʊ m
ɪ m p ɛ t r aː r ɛ	ɪ m p ɛ t r aː r ɛ
s ɛ s ʊ m	s ɛ sː ʊ m
a s t a m	h a s t a m
k ɔ m ɪ s j oː n ɛ m	k ɔ mː ɪ sː j oː n ɛ m
a d ɔ r aː r ɛ	a d oː r aː r ɛ
n ɛ k t a r ɛ	n ɛ k t a r
k aː n ʊ m	k aː n ʊ m
ɪ n t ɛ rː ʊ m p ɛ r ɛ	ɪ n t ɛ rː ʊ m p ɛ r ɛ
a pː ɔ r eː m	a pː oː n ɛ r ɛ
p r oː ɪ b ɪ r ɛ	p r ɔ h ɪ b eː r ɛ
m ɛ m b r a n ɔ s ʊ m	m ɛ m b r aː n ɛu m
f aː w a m	f a b a m
p aː k t ʊ m	p a k t ʊ m
w oː l a r ɛ	w ɔ l aː r ɛ
w ʊ l ɛ r ɛ	w ɛ lː ɛ
l a m p aː r a m	l a m p a d ɛ m
w ɪ s ɪ t a t j ɔ n ɛ	w iː s ɪ t aː t j oː n ɛ m
p l ʊ m b oː s ʊ m	p l ʊ m b oː s ʊ m
m ɪ ŋ g ɛ r ɛ	m ɪ ŋ g ɛ r ɛ
t ɛ m p ɔ r aː l ɛ	t ɛ m p ɔ r aː l ɛ m
k r ɛ t a m	k r eː t a m
s k a b j a m	s k a b ɪ ɛ m
g r a n aː t ʊ m	g r aː n aː t ʊ m
n ɪ d oː r ɛ	n iː d oː r ɛ m
d ɔ m ɪ n j ʊ m	d ɔ m ɪ n j ʊ m
a r ɔ t ʊ m	r uː k t ʊ m
t r ɛ p ɪ d a t j oː n ɛ m	t r ɛ p ɪ d aː t j oː n ɛ m
a r d ʊ m	a r d ʊː m
r ɛ n aː r ɛ	r eː ŋ n aː r ɛ
f ɪ g uː r a m	f ɪ g uː r a m
p a k ɪ f ɪ k ʊ m	p aː k ɪ f ɪ k ʊ m
ɪ n d ɔ l ɛ m	ɪ n d ɔ l ɛ m
p r ɛ k aː r ɛ	p r ɛ t j aː r ɛ
w ɪ s k ʊ m	w ɪ s k ʊ m
a s ɛ p ʊ lː aː r ɛ	s ɛ p ɛ l iː r ɛ
w ɛ g ɛ t ʊ m	w ɛ g ɛ t ʊ m
k ɔ n s ʊ p t j oː n ɛ m	k oː n s uː m p t j oː n ɛ m
eː b uː r n ɛ ʊ m	ɛ b ʊ r n ɛu m
k ɔ m p l ɛ t ɪ w ʊ m	k ɔ m p l eː t iː w ʊ m
p r ɛ w j ʊ m	p r aɪ w j ʊ m
aʊ lː a m	aʊ l a m
s t aː n ʊ m	s t a nː ʊ m
t r ɪ k ɛ	t r iː k ɛ m
d ɛ t ɛ s t a t j oː n ɛ m	d eː t ɛ s t aː t j oː n ɛ m
a k uː s aː r ɛ	a kː uː s aː r ɛ
b ɛ l aː r ɛ	b aː l aː r ɛ
g ɔ k ʊ n d ɪ t a t ɛ m	j uː k ʊ n d ɪ t aː t ɛ m
a rː ɔ g aː r ɛ	a rː ɔ g aː r ɛ
d aː t a m	d a t a
s k a l j aː r ɛ m	s k aː l aː r ɛ m
k ɔ n k ɪ n ɪ t a t ɛ m	k ɔ ŋ k ɪ nː ɪ t aː t ɛ m
ɪ m p ɛ r a t ɔ r j ʊ m	ɪ m p ɛ r aː t oː r j ʊ m
s t r ɪ g a m	s t r iː g a m
uː s t ʊ l aː r ɛ	ʊ s t ʊ l aː r ɛ
aɪ r ɔ ɛ m	h eː r oː ɛ m
r aː p t ʊ m	r a p t ʊ m
ɪ t a l j aː n ʊ m	iː t a l j aː n ʊ m
d ɪ f lː uː ɛ r ɛ	d ɪ fː l ʊ ɛ r ɛ
a m a l g a m a m	a m a l g a m a
k ɔ n t uː m aː k ɛ	k ɔ n t ʊ m aː k ɛ m
ɛ k s aʊ ɪ r ɛ	ɛ k s aʊ d iː r ɛ
k ɛ g aː r ɛ	k aɪ k aː r ɛ
ɛ k s ɪ g ɛ r ɛ	ɛ k s ɪ g ɛ r ɛ
r ɛ kʰ a t aː r ɛ	r ɛ k a p t j aː r ɛ
d ɪ g ɪ t aː l ɛ	d ɪ g ɪ t aː l ɛ m
eː m ɛ n d aː r ɛ	eː m ɛ n d aː r ɛ
p ɛ r k uː t ɛ r ɛ	p ɛ r k ʊ t ɛ r ɛ
t r a b ɛ k ʊ l a m	t r a b eː k ʊ l a m
d ɪ s p a r aː r ɛ	d ɪ s p a r aː r ɛ
ɛ n a rː a t j oː n ɛ m	eː n aː rː aː t j oː n ɛ m
m aː r t ɛ r ɛ	m a r t y r ɛ m
p a p j eː l ʊ m	p a p y r ʊ m
aʊ t ɔ n aː l ɛ	aʊ t ʊ m n aː l ɛ m
a l b uː m n ɛ	a l b uː m ɛ n
f ɪ n k aː r ɛ	f iː g ɛ r ɛ
s ɛ p t ɛ n t r j ɪ ɔ n aː l ɛ	s ɛ p t ɛ n t r j oː n aː l ɛ m
s ɪ t j ʊ m	s ɪ t ʊ m
k ɔ n m ʊ ɪ w ɛ r ɛ	k ɔ mː ɔ w eː r ɛ
p r oː n ʊ m	p r oː n ʊ m
b a s ʊ m	b a sː ʊ m
k ɛ r w ɪ s j a m	k ɛ r w ɛ s j a m
ɔ m ɛ n t ʊ m	oː m ɛ n t ʊ m
k r ɛ d ɪ t oː r ɛ	k r eː d ɪ t oː r ɛ m
t r a n s f ɔ r m a t j oː n ɛ m	t r aː n s f oː r m aː t j oː n ɛ m
p l uː m a m	p l uː m a m
s uː p uː t aː r ɛ	s ʊ pː ʊ t aː r ɛ
f r a t ɛ r n ʊ m	f r aː t ɛ r n ʊ m
d ɪ s p ɔ r eː m	d ɪ s p oː n ɛ r ɛ
a n ɔ r m aː l ɛ m	a n oː r m a l ʊ m
t uː m ɛ f aː r ɛ r ɛ	t ʊ m ɛ f a k ɛ r ɛ
ɛ k s ɪ s t ɛ n t j a m	ɛ k s ɪ s t ɛ n t j a m
d ɛ s k r ɪ w ɛ r ɛ	d eː s k r iː b ɛ r ɛ
k a n t j oː n ɛ m	k a n t j oː n ɛ m
b a kʰ r j ɛ r ɛ	b a kː a l aʊ r ɛu m
m ɛ m b r a n a k ɛ ʊ m	m ɛ m b r aː n aː k ɛu m
g r aː n ʊ m	g r aː n ʊ m
s kʷ aː lː ɪ d ʊ m	s kʷ aː l ɪ d ʊ m
k ɪ r k ʊ l aː r ɛ	k ɪ r k ʊ l aː r ɛ m
f uː l k r ʊ m	f ʊ l k r ʊ m
t r ɛ t ʊ m	t r a k t ʊ m
p oː k ʊ m	p aʊ k ʊ m
k r ʊ s t r a m	k r ʊ s t a m
ɛ s p ɪ r aː r ɛ	s p iː r aː r ɛ
m ɪ ɛ	m eː n s ɛ m
n ɔ s ɔ k ɔ m j ʊ m	n ɔ s ɔ k ɔ m iː ʊ m
g ɛ n t ɪ l ɛ m	g ɛ n t iː l ɛ m
s iː n s ɪ p uː t ɛ m	s ɪ ŋ k ɪ p ʊ t
f aː m a m	f aː m a m
s ɔ n aː t oː r ɛ	s ɔ m n j aː t oː r ɛ m
ɔ r p ɪ m ɛ n t ʊ m	aʊ r ɪ p ɪ g m ɛ n t ʊ m
ɪ n s ɪ ŋ n j a m	iː n s ɪ ŋ n ɛ
l ɪ b ɛ lː ʊ m	l ɪ b ɛ lː ʊ m
s ʊ b m ɛ r g ɛ r ɛ	s ʊ mː ɛ r g ɛ r ɛ
s uː p ɛ r w a k a n ɛ ʊ m	s ʊ p ɛ r w a k aː n ɛu m
k l aː w ʊ m	k l aː w ʊ m
a b n ɛ g aː r ɛ	a b n ɛ g aː r ɛ
k ɔ s t uː m ɛ m	k oː n s ʊ eː t uː d ɪ n ɛ m
a s p aː r aː g ʊ m	a s p a r a g ʊ m
m uː n ɪ f ɪ k ɛ n t j a m	m uː n ɪ f ɪ k ɛ n t j a m
g ɛ l ʊ m	g ɛ l uː
t ɔ r n j ʊ m	t ɔ r n ʊ m
k ɔ n s ɛ r w aː r ɛ	k oː n s ɛ r w aː r ɛ
g r a n d ɛ m	g r a n d ɛ m
p r ɔ s p ɛ r aː r ɛ	p r ɔ s p ɛ r aː r ɛ
