l a p ɪ d aː r ɛ	l a p ɪ d aː r ɛ
f a t ʊ m	f aː t ʊ m
m a t r ɪ t ɪ d a m	m aː t r ɪ k iː d a m
a l t ɛ r k aː t j oː n ɛ m	a l t ɛ r k aː t j oː n ɛ m
d eː t ɛ r j oː r aː t j oː n ɛ m	d eː t ɛ r j oː r aː t j oː n ɛ m
s a l t aː t j oː n ɛ m	s a l t aː t j oː n ɛ m
a kː r ɪ d aː t ɛ	aː k r ɪ t aː t ɛ m
t r aɪ m ʊ l aː r ɛ	t r ɛ m ʊ l aː r ɛ
p ɛ s t ɛ m	p ɛ s t ɛ m
w ɔ r aː r ɛ	w ɔ r aː r ɛ
t r aː n k ʊ b s t ʊː n t j aː r ɛ	t r aː n s ʊ b s t a n t j aː r ɛ
k s p a n d ɛ r ɛ	ɛ k s p a n d ɛ r ɛ
ɪ m p r ɔ b ʊ m	ɪ m p r ɔ b ʊ m
d iː s k r ɛ p a n t j a m	d ɪ s k r ɛ p a n t j a m
k ɔ n f ɛ d eː r aː t j oː n ɛ m	k oː n f ɔ ɪ d ɛ r aː t j oː n ɛ m
s ɔ p ɔ r ɛ	s ɔ p oː r ɛ m
k r ɛ m a m	k r aː m ʊ m
l a k uː s t r ɛ m	l a k ʊ s t r ɛ m
k ɔ d ɪ k ɪ lː ʊ m	k oː d ɪ k ɪ lː ʊ m
a l ʊ ŋ g aː r ɛ	eː l ɔ ŋ g aː r ɛ
s t aː b ɪ l ɛ ɛ r ɛ	s t a b ɪ l iː r ɛ
a w aː n a m	a w eː n a m
ɛ w ʊ r ʊ m	ɛ b ɔ r ɛu m
p a p a m	p aː p a m
ɪ n s oː n t ɛ m	iː n s ɔ n t ɛ m
ɔ rː ɪ f ɪ k ʊ m	h ɔ rː ɪ f ɪ k ʊ m
k ɔ ŋ g r eː g aː r ɛ	k ɔ ŋ g r ɛ g aː r ɛ
r a n k oː r ɛ m	r a ŋ k oː r ɛ m
k oː lː k iː r ɛ n	k ɔ lː ɛ m
ɔ t j oː s ʊ m	oː t j oː s ʊ m
p r ɔ w oː k aː t oː r ɛ	p r oː w ɔ k aː t oː r ɛ m
ɔ r ɪ ʊ n d ʊ m	ɔ r j ʊ n d ʊ m
d eː s ɛ r t j oː n ɛ m	d eː s ɛ r t j oː n ɛ m
s t r iː l j ɪ j oː n ɛ	s t r ɪ g ɪ l ɛ m
d uː b ɪ t aː t j oː n ɛ m	d ʊ b ɪ t aː t j oː n ɛ m
p aɪ ŋ n s ʊ m	p eː n s ʊ m
p a l uː d aː m ɛ n t m	p a l uː d aː m ɛ n t ʊ m
m ɛ m b r aː n ʊ s ʊ m	m ɛ m b r aː n ɛu m
ʊ w a m	uː w a m
d eː n uː d aː t j oː n ɛ m	d eː n uː d aː t j oː n ɛ m
ɛ ɛ r oː s ɔ l iː m ɪ ɛ n ʊ m	h ɪ ɛ r ɔ s ɔ l y m iː t aː n ʊ m
t ɛ d j oː s ʊ m	t aɪ d j oː s ʊ m
a s t r ʊ m	a s t r ʊ m
s h t ɔ r n iː n m	s t ʊ r n ʊ m
a s a m	aː n s a m
b ʊ lː ɪ r ɛ	b ʊ lː iː r ɛ
a l b uː m ɪ m a m	a l b uː m ɛ n
m ɔ s t r ʊ s ʊ m	m oː n s t r ʊ oː s ʊ m
f iː g uː r a m	f ɪ g uː r a m
s ʊ b ɪ t aː n ɛu ʊ m	s ʊ b ɪ t aː n ɛu m
p ɛ r w ɛ ɪ n ɪ r ɛ	p ɛ r w ɛ n iː r ɛ
a t ʊ m	aː t ʊ m
d uː r aː t j oː n ɛ m	d uː r aː t j oː n ɛ m
d iː s k r ɛ p aː r ɛ	d ɪ s k r ɛ p aː r ɛ
d ɛ s t ɪ n aː t j oː n ɛ m	d eː s t ɪ n aː t j oː n ɛ m
k ɛ r ɛ m oː n j aː l ɛ	k aɪ r ɪ m oː n j aː l ɛ m
f uː r n ɪ k s ɛ m	f ɔ r n ɪ k ɛ m
kʷ a d ɛ r n ʊ m	kʷ a t ɛ r n oː s
aʊ g uː r j ʊ m	aʊ g ʊ r j ʊ m
p r ɔ m ɛ s a m	p r oː m ɪ sː ʊ m
ɔ s k uː l aː t j oː n ɛ m	ɔ s k ʊ l aː t j oː n ɛ m
d iː s t r a h ɛ r ɛ	d ɪ s t r a h ɛ r ɛ
h ɔ r b ʊ m	ɔ r b ʊ m
k ɪ ɔ n kʷ ɛ k ɛ m	kʷ ɛ m k ʊ m kʷ ɛ
a b l aː k t a t j oː n ɛ m	a b l a k t aː t j oː n ɛ m
w ɛ lː ʊ m	w ɪ lː ʊ m
p a r ɪ eː t aː l ɛ	p a r ɪ ɛ t aː l ɛ m
f ɛ r ɪ t ɛ m	f ɛ r ɪ t aː t ɛ m
l ɔ n j ɪ t ʊ d ɪ n ɛ m	l ɔ ŋ g ɪ t uː d ɪ n ɛ m
ʊ b r ʊ m	uː b ɛ r
ɔ k uː l aː r ɛ	ɔ k ʊ l aː r ɛ m
h ɔ m b r a m	ʊ m b r a m
t ʊ r n ʊ m	t ɔ r n ʊ m
ɔ b s ɛ r j w aː r ɛ	ɔ b s ɛ r w aː r ɛ
uː ŋ ɛ d a m	t aɪ d a m
n ɔ t ɪ k j ʊ m	n oː t ɪ t j a m
k ɔ n g j ʊ m	k ɔ ŋ g j ʊ m
s uː p l ɪ t j ʊ m	s ʊ pː l ɪ k j ʊ m
s p oː s ʊ m	s p oː n s ʊ m
l uː k j ʊ m	l uː k j ʊ m
s k r ʊ p uː l oː s ʊ m	s k r uː p ʊ l oː s ʊ m
k ɔ n k ʊ rː ɛ r ɛ	k ɔ ŋ k ʊ rː ɛ r ɛ
r ɛ w ɛ r ɛ n t ɛ m	r ɛ w ɛ r ɛ n t ɛ m
k ɔ m oː t j oː n ɛ	k ɔ mː oː t j oː n ɛ m
p l uː m a m	p l uː m a m
s t aː t ʊ m	s t a t ʊ m
ɪ n k ɔ m ɔ d aː r ɛ	ɪ ŋ k ɔ mː ɔ d aː r ɛ
t ɔ r m ɛ n t ʊ m	t ɔ r m ɛ n t ʊ m
ɪ n d ɪ g ɛ n t a m	ɪ n d ɪ g ɛ n t j a m
ɪ ŋ n ɛ ʊ m	ɪ ŋ n ɛu m
l ɔ t r d ʊ m	l uː r ɪ d ʊ m
ʊ s aː r j ʊ m	uː s w aː r j ʊ m
t a r d aː r ɛ	t a r d aː r ɛ
g r aː w ɪ t aː t j oː n ɛ	g r a w ɪ t aː t j oː n ɛ m
d iː s p aː r ɛ r ɛ m	d ɪ s p a r eː r ɛ
n a w ɪ	n aː w ɪ g j ʊ m
k ɔ n t r ɪ s t aː r ɛ	k ɔ n t r iː s t aː r ɛ
r ɛ p ɛ t ɛ r ɛ	r ɛ p ɛ t ɛ r ɛ
b ɔ m b aː r d a m	b ɔ m b a r d a m
ɪ n f a n d ʊ m	iː n f a n d ʊ m
ɪ n t ɛ m p ɛ s t ɪ w ʊ m	ɪ n t ɛ m p ɛ s t iː w ʊ m
s a k aː r ɛ	s aː n aː r ɛ
f uː n ɛ m	f uː n ɛ m
g l aː l a m	g l aː r ɛ a m
f r uː ɪ k t ʊ m	f r uː k t ʊ m
ɔ s t ɪ l ɛ	h ɔ s t iː l ɛ m
p ɛ r m ɪ sː j oː n ɛ m	p ɛ r m ɪ sː j oː n ɛ m
p uː r ɛ n ʊ m	p uː r ɛ m
p a t r j aː r kʰ a m	p a t r j a r kʰ a m
n iː d ʊ m	n iː d ʊ m
kʷ r ɪ w l aː r ɛ	k r iː b r aː r ɛ
d eː w ɔ r aː t j oː n ɛ m	d eː w ɔ r aː t j oː n ɛ m
s k a n d a m	s k a n d ʊ l a m
w ʊ l p ɛ m	w ʊ l p ɛ m
p r ɔ m ʊ l g aː t j oː n ɛ m	p r oː m ʊ l g aː t j oː n ɛ m
f ɛ m ɪ n ɪ n ʊ m	f eː m ɪ n iː n ʊ m
p ɛ k uː l j ʊ m	p ɛ k uː l j ʊ m
d uː bː j ʊ m	d ʊ b j ʊ m
m ɪ s t ʊ r a m	m ɪ s t uː r a m
s ʊ b m ɛ r g ɛ r ɛ	s ʊ mː ɛ r g ɛ r ɛ
k a t ɛ d r aː l ɛ	k a tʰ ɛ d r aː l ɛ m
s k uː rː ɛ r ɛ	ɛ k s k ʊ rː ɛ r ɛ
ɔ fː ɪ k ɪ n a m	ɔ fː ɪ k iː n a m
p ɔ s t r ɪ b ʊ l ʊ m	p r oː s t ɪ b ʊ l ʊ m
ɪ n w ɪ t aː t j oː n ɛ m	ɪ n w ɪ t aː t j oː n ɛ m
k ɔ m p l ɛ t ʊ m	k ɔ m p l eː t ʊ m
k ɔ n s ɔ r t ɛ m	k oː n s ɔ r t ɛ m
t ɛ r t j aː r ɛ	t ɛ r t j aː r ɛ
k uː r w aː r ɛ	k ʊ r w aː r ɛ
f l uː w j aː l ɛ	f l ʊ w j aː l ɛ m
p a r ɪ r ɛ	p a r ɛ r ɛ
k ɔ n s ɛ r w aː t j oː n ɛ m	k oː n s ɛ r w aː t j oː n ɛ m
d ɛ r ɪ s oː r j ʊ m	d eː r iː s oː r j ʊ m
p eː ɪ n t ɪ n aː r ɛ	p ɛ k t ɪ n aː r ɛ
k a l k ɛ n ʊ m	k a l k aː n ɛu m
b a r aː t r ʊ m	b a r a tʰ r ʊ m
k uː r a m	k uː r a m
t r ɪ g ɛ s ɪ m ʊ m	t r iː g eː s ɪ m ʊ m
ɔ k lː a m	ɔ lː a m
n ɔ m ɪ n aː r ɛ	n oː m ɪ n aː r ɛ
s a k ɛ r d ɔ t j ʊ m	s a k ɛ r d oː t j ʊ m
t aː s oː m	t a k s ʊ m
a s k ɛ n d ɛ r ɛ	a s k ɛ n d ɛ r ɛ
a p ɪ aː r j ʊ m	a p j aː r j ʊ m
ɪ n f r ɪ ŋ g ɛ r ɛ	iː n f r ɪ ŋ g ɛ r ɛ
s ɛ r ɛ n aː r ɛ	s ɛ r eː n aː r ɛ
h iː s p aː n ɪ k ʊ m	h ɪ s p aː n ɪ k ʊ m
f ɔ s a m	f ɔ sː a m
d iː w ɛ r t ɪ r ɛ	d iː w ɛ r t ɛ r ɛ
m ʊ l t ɪ p l ɪ k aː t j oː n ɛ m	m ʊ l t ɪ p l ɪ k aː t j oː n ɛ m
d eː k l aː m aː r ɛ	d eː k l aː m aː r ɛ
k a r ɛ t ɛ r ɛ	k a r eː r ɛ
m a k ɛ lː ʊ m	m a k ɛ lː ʊ m
k ɔ n t r aː dː ɪ m t oː r ɛ	k ɔ n t r aː d ɪ k t oː r ɛ m
d eː l aː t j oː n ɛ m	d eː l aː t j oː n ɛ m
p ɔ s aː r ɛ	p aʊ s aː r ɛ
p a n ɛ	p aɪ aː n ɛ m
s oː l ʊ m	s oː l ʊ m
m a r s ʊ p j ʊ m	m a r s uː p j ʊ m
g r aː t ɪ f iː k aː r ɛ	g r aː t ɪ f ɪ k aː r iː
w ɛ r m ɛ l ʊ m	w ɛ r m ɪ k ʊ l ʊ m
ɪ n f ɛ r ɛ r ɛ	iː n f ɛ rː ɛ
ɔ p ɛ r aː r ɛ	ɔ p ɛ r aː r iː
m uː nː ɪ r ɛ	m ɔ n eː r ɛ
j uː d ɪ t j aː r j ʊ m	j uː d ɪ k j aː r j ʊ m
k ɔ n d ɪ s k ɛ n d ɛ r ɛ	k ɔ n d eː s k ɛ n d ɛ r ɛ
r ɛ l ɛ g aː r ɛ	r ɛ l ɛ g ɛ r ɛ
a n ɛ g aː	eː n ɛ k aː r ɛ
k ɔ n s oː l ɪ d aː r ɛ	k oː n s ɔ l ɪ d aː r ɛ
ɛ k s aː m ɪ n aː r ɛ	ɛ k s aː m ɪ n aː r ɛ
ɔ s t ɛ n s ɪ w ʊ m	ɔ s t eː n s iː w ʊ m
k iː r k ʊ l aː r ɛ	k ɪ r k ʊ l aː r ɛ
eː kʷ ɪ l ɪ b r j ʊ m	aɪ kʷ ɪ l iː b r j ʊ m
f ɔ r k iː r ɪ aː r ɛ	f ɔ r aː r ɛ
p a l ʊ m	p aː l ʊ m
ɛ k s ʊ lː t ɛ	ɛ k s ʊ l t aː r ɛ
k iː d a m	k iː d a m
g r aː m aː ɛ	g r aː m ɛ n
k a p ɪ t r ʊ m	k a p ɪ t ʊ l ʊ m
b uː b ɔ n ɪ k ʊ m	b uː b oː n ɪ k ʊ m
f a r m aː k ɛ ʊ t ɪ k ʊ m	pʰ a r m a k ɛu t ɪ k ʊ m
k l uː t ɪ n ɛ	g l uː t ɛ n
a b ɔ rː iː r ɛ	a b h ɔ rː eː r ɛ
k ɛ n aː k ʊ l ʊ m	k eː n aː k ʊ l ʊ m
l iː m p ɪ d ɛ	l ɪ m p ɪ d ʊ m
ɔ b lː w ɪ t aː r ɛ	ɔ b l iː w ɪ s k iː
b a s ɪ l ɪ s k ʊ m	b a s ɪ l ɪ s k ʊ m
k eː b aː r ɛ	k ɪ b aː r ɛ
ʊ r ɪ n a m	uː r iː n a m
f oː d aː r ɛ m	f aʊ k ɛ m
r ɛ k ɔ n k ɪ l j aː t j oː n ɛ m	r ɛ k ɔ ŋ k ɪ l j aː t j oː n ɛ m
p a t r j aː r k aː m ʊ m	p a t r j a r kʰ a t ʊ m
l iː t uː r g j a m	l iː t uː r g j a m
ɪ n s a n ʊ m	iː n s aː n ʊ m
d eː s ɪ s t ɛ r ɛ	d eː s ɪ s t ɛ r ɛ
ʊ n ɪ f oː r m ɛ m	uː n ɪ f oː r m ɛ m
m a k s k eː aː r ɛ	m a k s ɪ lː a r ɛ m
aʊ g uː r aː r ɛ	aʊ g ʊ r aː r ɛ
g ɛ m ɪ n aː t j oː n ɛ m	g ɛ m ɪ n aː t j oː n ɛ m
a pː oː r t aː r ɛ	a pː ɔ r t aː r ɛ
f ɔ r t ɪ t uː d ɪ n ɛ	f ɔ r t ɪ t uː d ɪ n ɛ m
ɪ rː ɪ t aː	ɪ rː iː t aː r ɛ
ɔ rː ɛ iː	h ɔ rː eː r ɛ
r a m ʊ m	r aː m ʊ m
p r aɪ t ɛ r ɪ r ɛ	p r aɪ t ɛ r iː r ɛ
k ɔ l ɛ m	k aʊ l ɛ m
ɔ r n aː t ʊ m	oː r n aː t ʊ m
k r ɛ d ʊ l ʊ m	k r eː d ʊ l ʊ m
w ʊ w ʊ m	b uː b oː n ɛ m
t ɪ l j aː m	t eː g ʊ l a m
k ɔ aɪ r t ɛ t j oː n ɛ m	k ɔ ɪ r k ɪ t j oː n ɛ m
f r aɪ kʷ ɛ n t ɛ m	f r ɛ kʷ ɛ n t ɛ m
r ɔ t ʊ m	r uː k t ʊ m
g r a n ʊ m	g r aː n ʊ m
kʷ a d r ʊ m	kʷ aː d r ʊ m
k ɔ k ʊ m ɛ r ʊ m	k ʊ k ʊ m ɛ r ɛ m
ɪ k ʊ m	ɪ k ʊ m
r uː s t ɪ k aː n ʊ m	r uː s t ɪ k aː n ʊ m
p r ɛ k ɛ aː r ɛ m	p r ɛ k aː r iː
f a l a ŋ g ɛ m	pʰ a l a ŋ g ɛ m
ɔ s t ɛ n t aː r ɛ	ɔ s t ɛ n t aː r ɛ
t r uː k ʊ l ɛ n t ʊ m	t r ʊ k ʊ l ɛ n t ʊ m
a b ɪ l ɛ m	h a b ɪ l ɛ m
s k uː rː a m	s k ʊ rː a m
p l a n ʊ m	p l aː n ʊ m
p r ɔ f ʊ g ʊ m	p r ɔ f ʊ g ʊ m
aʊ t ɔ r ɪ t aː t ɛ m	aʊ k t oː r ɪ t aː t ɛ m
ɛ rː b aː r ɛ m	ɛ rː oː r ɛ m
k l ɪ m aː t eː r ɪ k ʊ m	k l iː m a k t eː r ɪ k ʊ m
m a l ɛ m	m a l ʊ m
s t ɔ r aː k ɛ m	s t y r a k ɛ m
t aɪ s ɔ r ʊ m	tʰ eː s aʊ r ʊ m
a b ɪ s m ʊ m	a b y sː ʊ m
l a k t ɪ k ɪ n j ʊ m	l a k t ɪ k iː n j ʊ m
n a w ɪ k ɛ lː a m	n aː w ɪ k ɛ lː a m
p ɛ r m aː n ɛ ɛ r ɛ	p ɛ r m a n eː r ɛ
n uː m ɛ r aː r ɛ	n ʊ m ɛ r aː r ɛ
p a g a n k t aː t a m	p aː g aː n ɪ t aː t ɛ m
ɪ n t ɛ r w ɛ r t ɪ r ɛ	ɪ n t ɛ r w ɛ r t ɛ r ɛ
k ɔ d ɪ k ɛ m	k oː d ɪ k ɛ m
d aɪ m ɛ b uː l aː t j oː n ɛ m	d ɛ a m b ʊ l aː t j oː n ɛ m
b ɛ n ɛ d ɛ t ʊ m	b ɛ n ɛ d ɪ k t ʊ m
r eː m ʊ m	r eː m ʊ m
t a m ɪ s ʊ m	t a m ɪ s j ʊ m
l iː m ʊ m	l iː m ʊ m
ɪ n t ɛ lː eː t k j oː n ɛ m	ɪ n t ɛ lː ɛ k t j oː n ɛ m
p r ɔ p ɪ n m aː r ʊ m	p r ɔ p ɪ ŋ kʷ ʊ m
ʊ l k ɛ r a m	ʊ l k ʊ s
p iː b ʊ lː ɔ m	p aː b ʊ l ʊ m
p r ɪ w aː t ʊ m	p r iː w aː t ʊ m
f iː l ɔ s oː f j a m	pʰ ɪ l ɔ s ɔ pʰ j a m
p ɛ r k ɪ r ɪ r ɛ	p ɛ r kʷ iː r ɛ r ɛ
d a t a m	d a t a
p ɔ s t eː r ʊ m	p ɔ s t ɛ r ʊ m
f iː l j aː s t r ʊ m	f iː l j a s t r ʊ m
p r ɔ r oː g aː t j oː n ɛ m	p r oː r ɔ g aː t j oː n ɛ m
k a lː ʊ m	k a lː ʊ m
k a l ɪ n d aː m	k a l ɛ n d aː s
a m ɛ r ɪ t aː r ɛ	m ɛ r iː d j aː r ɛ
s ɔ l ɛ r t ɛ m	s ɔ lː ɛ r t ɛ m
d iː l uː ɪ r ɛ	d iː l ʊ ɛ r ɛ
d ɛ w j aː r ɛ	d eː w j aː r ɛ
w ɛ n j a m	w ɛ n j a m
p a s aː r ɛ	p a n d ɛ r ɛ
w iː w aː k ɛ m	w iː w aː k ɛ m
ɪ n d uː r ɛ t ɛ r ɛ	ɪ n d uː r eː s k ɛ r ɛ
ɪ m aː t ʊ r ʊ m	ɪ mː aː t uː r ʊ m
s p eː kː j ʊ m	s p ɛ k l ʊ m
w ɛ k s aː t j oː n ɛ m	w ɛ k s aː t j oː n ɛ m
d uː r ʊ m	d uː r ʊ m
k ɔ m p l ɛ m ɛ n t ʊ m	k ɔ m p l eː m ɛ n t ʊ m
k a p ɛ lː ʊ m	k a p ɪ lː ʊ m
p r aɪ p oː s y t ɛ m	p r aɪ p ɔ s ɪ t ʊ m
ɛ ʊ m	ɛu m
ɪ m p ɛ r j ʊ m	ɪ m p ɛ r j ʊ m
m ɛ n uː t j j aː m	m ɪ n uː t j a m
ɔ pː oː r t uː n ɪ t t ɛ m	ɔ pː ɔ r t uː n ɪ t aː t ɛ m
k ɔ n f j aː l j ɛ	k oː n f l aː r ɛ
p r aɪ t ɛ n d ɛ r ɛ	p r aɪ t ɛ n d ɛ r ɛ
ɔ n oː r ɛ m	h ɔ n oː r ɛ m
k ɔ n w ɛ n ɪ r ɛ	k ɔ n w ɛ n iː r ɛ
a m eː r ɛ m	a m aː r ɛ
a t r ʊ m	aː t r ʊ m
a g r ʊ m	a g r ʊ m
n ɔ b ɪ l ʊ n j ʊ m	n ɔ w ɪ l uː n j ʊ m
a pː aː r t ɛ r ʊ m	p a r t j aː r j ʊ m
k ʊ k ʊ m	k ɔ kʷ ʊ m
d eː p r ɪ m ɛ r ɛ	d eː p r ɪ m ɛ r ɛ
k r w ʊ m ɔ r ɛ	k r ʊ oː r ɛ m
p r aɪ d aː t j uː n ɛ m	p r aɪ d aː t j oː n ɛ m
r iː g ʊ r oː s ʊ m	r ɪ g ɔ r ɔ s ʊ m
k ɔ n t r aː k t w ɛ r ɛ	k ɔ n t r a h ɛ r ɛ
s a l w aː r ɛ	s a l w aː r ɛ
r a d ɪ k ɪ ɛ m	r aː d iː k ɛ m
w ɔ ŋ l ʊ n t aː t ɛ m	w ɔ l ʊ n t aː t ɛ m
d eː rː uː iː	d iː r ʊ ɛ r ɛ
ɪ m a g ɛ n ɛ m	ɪ m aː g ɪ n ɛ m
w ɔ l uː b ɪ l ɛ m	w ɔ l uː b ɪ l ɛ m
l aː s ɪ r ɛ	l ɪ k eː r ɛ
ɪ n k ɛ n d ɛ r ɛ	ɪ ŋ k ɛ n d ɛ r ɛ
j aɪ ʊ s ʊ m	g y p s ʊ m
r ɛ s ɛ r w aː t j oː n ɛ m	r ɛ s ɛ r w aː t j oː n ɛ m
ɪ n w ɛ r t ɛ r ɛ	ɪ n w ɛ r t ɛ r ɛ
g l aː t j ʊ m	g l a k ɪ ɛ m
d eː t ɛ k t aː r j ɛ m	d eː t ɛ g ɛ r ɛ
p r ɔ f ɛ t j a m	p r ɔ pʰ eː t iː a m
d ɛ p r ɛ d aː t j oː n ɛ m	d eː p r aɪ d aː t j oː n ɛ m
a fː aː s k ɪ n aː r ɛ	f a s k ɪ n aː r ɛ
l ɛ k ʊ m	l aː ɪ k ʊ m
s iː n k ɪ p ʊ m	s ɪ ŋ k ɪ p ʊ t
r ɛ n ʊ ɪ r ɛ	r ɛ n ʊ ɛ r ɛ
ɛ k s p ɪ r aː t j oː n ɛ m	ɛ k sː p iː r aː t j oː n ɛ m
s ʊ b m ɛ r s j oː n ɛ	s ʊ mː ɛ r s j oː n ɛ m
g ɔ d ɛ r ɛ	g aʊ d eː r ɛ
eː s ɛ kʷ j aː s	ɛ k sː ɛ kʷ j a m
f l ʊ kː oː s ʊ m	f l ɔ kː oː s ʊ m
ɛ b aɪ t ɛ m	h ɛ b ɛ t ɛ m
p g uː k w ɛ r j n ʊ m	w eː r
ɔ r ɪ g ɪ n aː r j ʊ m	ɔ r iː g ɪ n aː r j ʊ m
t r ɔ n ʊ m	tʰ r ɔ n ʊ m
ɛ k s t aː s iː m	ɛ k s t a s ɛ m
d eː f r aʊ d aː t j oː n ɛ m	d eː f r aʊ d aː t j oː n ɛ m
s t ɪ m ʊ l aː t j oː n ɛ m	s t ɪ m ʊ l aː t j oː n ɛ m
w iː kː t ʊ m	w iː k t ʊ m
s ʊ p ɛ r ɛ s ɛ eː r ɛ	s ʊ p ɛ r s ɛ d eː r ɛ
ɛ k s aː k eː n r b aː t j oː n ɛ m	ɛ k s a k ɛ r b aː t j oː n ɛ m
ɛ k s t ɛ r m ɪ n aː t j oː n ɛ m	ɛ k s t ɛ r m ɪ n aː t j oː n ɛ m
s p ɪ n aː l ɛ	s p iː n aː l ɛ m
a b l aː k t aː r ɛ	a b l a k t aː r ɛ
f ɛ r m ɛ n t aː t j oː n ɛ m	f ɛ r m ɛ n t aː t j oː n ɛ m
g uː m ɛ n t ʊ m	j uː m ɛ n t ʊ m
f a s t ɪ g j ʊ m	f a s t iː g j ʊ m
g a m b a m	g a m b a m
s ʊ p ʊ ɛ r ɛ p ɔ n ɛ r ɛ m	s ʊ p ɛ r p oː n ɛ r ɛ
m ɔ t ʊ m	m ʊ tː ʊ m
eː k s t ɛ r j oː r ɛ	ɛ k s t ɛ r j oː r ɛ m
k ɔ n s ɪ s t ɛ r ɛ	k oː n s ɪ s t ɛ r ɛ
k r ɪ m ɪ n ɛ	k r iː m ɛ n
eː s k uː l eː n t ʊ m	eː s k ʊ l ɛ n t ʊ m
a m ɛ n ʊ m	a m ɔ ɪ n ʊ m
m a n k ɪ p g j ʊ m	m a ŋ k ɪ p j ʊ m
k ɔ n s ʊ b r ɪ n ʊ m	k oː n s oː b r iː n ʊ m
k ɔ t aʊ r n ɪ k ɛ	k oː t ʊ r n iː k ɛ m
m a p a m	m a pː a m
f ɔ k aː r j aː	f ɔ k aː r j ʊ m
w eː r n aː l ɛ	w ɛ r n aː l ɛ m
f uː l w ʊ m	f ʊ l w ʊ m
g r aː l ʊ m	g r aː k ʊ l ʊ m
t ʊ s ʊ m	t oː n s ʊ m
t ɛ m p oː r aː l ɛ	t ɛ m p ɔ r aː l ɛ m
ɪ n g ɛ r iː r ɛ	ɪ ŋ g ɛ r ɛ r ɛ
a sː ɪ d ʊː m	a sː ɪ d ʊː m
a r g ʊ t j a m	a r g uː t j a m
r iː ʊ m	r iː w ʊ m
l uː k r aː r ɛ	l ʊ k r aː r iː
s a r k ɪ n a m	s a r k ɪ n a m
d ɔ m ɪ n ɪ k aː l ɛ	d ɔ m ɪ n ɪ k aː l ɛ m
d ɛ g ʊ lː aː r ɛ	d eː k ɔ lː aː r ɛ
k uː k ɪ n a m	k ɔ kʷ iː n a m
aʊ s p ɪ t aː l ɛ	h ɔ s p ɪ t aː l ɛ
s a t uː r aː r ɛ	s a t ʊ r aː r ɛ
aʊ r ɪ ɛ zː oː n t ɛ m	h ɔ r ɪ zː ɔ n t a
ɪ n k ɪ d ɛ r ɛ	ɪ ŋ k ɪ d ɛ r ɛ
k uː r aː r ɛ	k uː r aː r ɛ
k ɔ n w ɛ k sː ʊ m	k ɔ n w ɛ k s ʊ m
kʷ r ɪ w ʊ m	k r iː b r ʊ m
p eː r a m	p eː r a m
p r aɪ p oː s t eː l ʊ m	p r aɪ p ɔ s t ɛ r ʊ m
p eː n d ɛ r ɛ m	p ɛ n d eː r ɛ
p r ɔ t oː k oː l aː r j ʊ m	p r oː t ɔ k ɔ lː aː r j ʊ m
k ɔ n g ʊ r aː r ɛ	k ɔ n ɪ uː r aː r ɛ
k a s ɛ n aː r ɛ	k a t eː n aː r ɛ
p eː n ʊ l a m	p aɪ n ʊ l a m
ɪ n w ɔ l w ɛ r ɛ	ɪ n w ɔ l w ɛ r ɛ
f ɪ d ɛ l ɛ	f ɪ d eː l ɛ m
s ʊ s p ɪ r ʊ m	s ʊ s p ɪ r j ʊ m
kʷ aː s aː r ɛ	kʷ a sː aː r ɛ
t r aː b ɛ k ʊ l a m	t r a b eː k ʊ l a m
s ɛ r p ɛ n t ɪ n ʊ m	s ɛ r p ɛ n t iː n ʊ m
p r aɪ s k j ɛ n t j a m	p r aɪ s k ɪ ɛ n t j a m
aɪ t j a	ɪ t j a m
a s t uː t j a m	a s t uː t j a m
aʊ n ɔ r aː b ɪ l ɛ	h ɔ n oː r aː b ɪ l ɛ m
ɪ n ɪ t j ɛ h aː l ɛ	ɪ n ɪ t j aː l ɛ m
a s t r ɪ n g ɛ r ɛ	a s t r ɪ ŋ g ɛ r ɛ
ʊ ŋ g uː l aː t ʊ m	ʊ ŋ g ʊ l aː t ʊ m
g ɛ ɔ m ɛ t r j a m	g ɛ oː m ɛ t r j a m
r iː t ʊ m	r iː t ʊ m
k ɔ rː ɔ s j oː n ɛ	k ɔ rː oː s j oː n ɛ m
a sː ɛ t aː	a sː ɛ k t aː r iː
w ɛ d aː r iː	w ɪ k ɛ m
t r aː n s f ʊ n d ɛ r ɛ	t r aː n s f ʊ n d ɛ r ɛ
f eː m ɛ lː a m	f eː m ɛ lː a m
a l t ɪ s ɪ m ʊ m	a l t ɪ sː ɪ m ʊ m
s ɔ d aː l ɪ t aː t ɛ m	s ɔ d aː l ɪ t aː t ɛ m
k ɔ rː ɛ a m	k ɔ rː ɪ g j a m
s ɛ w ɛ r ʊ m	s ɛ w eː r ʊ m
s a l ɪ p aː r ɛ	s a l iː w aː r ɛ
aʊ f ʊ n aː r ɛ	a d uː n aː r ɛ
ɔ l ɪ r ɛ m	ɔ l eː r ɛ
s t uː p ɪ r ɛ	s t ʊ p eː r ɛ
k ɔ n s ɪ d eː r aː t j oː n ɛ m	k oː n s iː d ɛ r aː t j oː n ɛ m
k a d uː k ʊ m	k a d uː k ʊ m
r ɛ p r ɛ h ɛ n s ɪ b ɪ l ɛ m	r ɛ p r ɛ h ɛ n s ɪ b ɪ l ɛ m
s ʊ s p ɪ r aː r ɛ	s ʊ s p iː r aː r ɛ
ɪ n f ɛ s t aː r ɛ	iː n f ɛ s t aː r ɛ
n ɔ s ɔ k oː m j ʊ m	n ɔ s ɔ k ɔ m iː ʊ m
f r aɪ n aː r ɛ	f r eː n aː r ɛ
t ɔ d aː r ɛ r ɛ	t ɔ lː ɛ r ɛ
k ɛ s aː r ɛ	k ɛ sː aː r ɛ
ɪ n t ɪ m aː t j oː n ɛ m	ɪ n t ɪ m aː t j oː n ɛ m
ɪ ŋ gʷ ɪ n	ɪ ŋ gʷ ɛ n
w ɛ r s aː t ɪ l ɛ m	w ɛ r s aː t ɪ l ɛ m
ɪ n s t aʊ r aː r ɛ	iː n s t aʊ r aː r ɛ
uː m ɪ d ʊ m	h uː m ɪ d ʊ m
