p l ʊ m b aː t ɪ k ɛ n ɛ ʊ m	p l ʊ m b aː g ɪ n ɛ m
d eː p ɛ n d ɛ r ɛ	d eː p ɛ n d eː r ɛ
k a p k j ʊ k ʊ m	k a p t j oː s ʊ m
a r k aː r ʊ m	a r k w aː r j ʊ m
k ɔ aː b ɪ t aː r ɛ	k ɔ h a b ɪ t aː r ɛ
d ɔ r m iː t oː r j ʊ m	d ɔ r m iː t oː r j ʊ m
k r ɔ k oː m	k r ɔ k ʊ m
ɪ n f ɛ r oː r ɛ m	iː n f ɛ r ʊ m
a eː r ɔ m a n t j a m	aː ɛ r ɔ m a n t iː a m
p ɔ s k iː r p oː n ɛ r ɛ	p ɔ s t p oː n ɛ r ɛ
a k ɛ r b ʊ m	a k ɛ r b ʊ m
t ɛ t r ɪ k ʊ m	t aɪ t r ɪ k ʊ m
k ɔ m p ɔ r t aː r ɛ m	k ɔ m p ɔ r t aː r ɛ
ɛ s t r ɛ n a m	s t r eː n a m
b ɛ t ŋ aː r a m	b eː t a m
a t r aː b ɪ l aː r j ʊ m	aː t r a b iː l aː r j ʊ m
b ɛ aː t ʊ m	b ɛ aː t ʊ m
a r k ɪ b ɛ s k oː p ʊ m	a r kʰ ɪ ɛ p ɪ s k ɔ p ʊ m
m ɛ r ɛ t r iː k ɛ	m ɛ r ɛ t r iː k ɛ m
ɪ ŋ g r aː t ʊ m	ɪ ŋ g r aː t ʊ m
s uː p ɛ r w aː k a m ʊ m	s ʊ p ɛ r w a k aː n ɛu m
k ɔ n k aː t ɛ n aː r ɛ	k ɔ ŋ k a t eː n aː r ɛ
s ʊ p ɛu r n aː t uː r aː l ɛ m	s ʊ p ɛ r n aː t uː r aː l ɛ m
t r uː k ɛ	t r ʊ k ɛ m
a m b ɪ gʷ ɪ t aː t ɛ m	a m b ɪ gʷ ɪ t aː t ɛ m
b ɔ lː ɪ r ɛ	b ʊ lː iː r ɛ
m iː n ʊ ɪ r ɛ	m ɪ n ʊ ɛ r ɛ
d eː f ɛ n s j oː n ɛ m	d eː f eː n s j oː n ɛ m
g a l a l g ɪ n ɛ m	g a lː ɛ t a m
ɪ rː ɪ g aː r ɛ	ɪ rː ɪ g aː r ɛ
n ɛ k r ɪ t ɪ a m	n ɪ g r ɪ t j a m
w ɪ g r n iː k s	w ɛ r n iː k ɛ m
d eː k ɔ k t j oː n ɛ m	d ɛ k ɔ k t j oː n ɛ m
k a r b ʊ n k ʊ l ʊ m	k a r b ʊ ŋ k ʊ l ʊ m
m ɔ d ɪ r ɛ m	m ɔ l ɛ r ɛ
s a b oː r ɛ	s a p oː r ɛ m
d ɛ p r ɛ d aː t j oː n ɛ m	d eː p r aɪ d aː t j oː n ɛ m
m ɔ n aː s t ɛ r j ʊ m	m ɔ n a s t eː r j ʊ m
a k uː m ɪ n aː r ɛ	a k uː m ɪ n aː r ɛ
a ŋ g oː l a m	a ŋ g ʊ s t j a m
f a r m aː k ɛ ʊ t ɪ k ʊ m	pʰ a r m a k ɛu t ɪ k ʊ m
ɔ fː ɪ k j ʊ m	ɔ fː ɪ k j ʊ m
ɪ r s ʊ t ʊ m	h ɪ r s uː t ʊ m
k a r d ɪ n ɛ m	k a r d ɪ n ɛ m
w ɛ s t r uː k j ʊ m	s t r uː tʰ j oː n ɛ m
ɪ b ɪ t r ɛ	iː b ɪ k ɛ m
d ɛ p l ɔ r aː r ɛ	d eː p l oː r aː r ɛ
r ɛ t oː r ɛ m	r h eː t ɔ r ɛ m
a k t ʊ aː l ɛ	a k t w aː l ɛ m
t r aː n s ɪ t ʊ m	t r aː n s ɪ t ʊ m
w ɛ r ɛ k ʊ n d j a m	w ɛ r eː k ʊ n d j a m
w ɔ r t ɪ h k ɛ m	w ɔ r t ɪ k ɛ m
aʊ d aː k ɛ m	aʊ d aː k ɛ m
p r aɪ p ɔ s t eː l ʊ m	p r aɪ p ɔ s t ɛ r ʊ m
n uː m ɛ r aː t oː r ɛ m	n ʊ m ɛ r aː t oː r ɛ m
ɪ n t ɛ r k eː d ɛ r ɛ	ɪ n t ɛ r k eː d ɛ r ɛ
m ɛ n oː r ɛ	m ɪ n oː r ɛ m
ɔ r aː t ɪ oː n ɛ m	oː r aː t j oː n ɛ m
r a s b aː r ɛ	r aː d ɛ r ɛ
ɛ k s ɛ m p l aː r ɛ	ɛ k s ɛ m p l aː r ɛ m
d eː s ʊ m ɛ r ɛ	d eː s uː m ɛ r ɛ
m a t ɛ r n ʊ m	m aː t ɛ r n ʊ m
t r ɪ t ʊ r a m	t r iː t uː r a m
k ʊ k ɪ n aː r j oː n ʊ m	k ɔ kʷ iː n aː r j ʊ m
s k ʊ t ɪ ɛ r ʊ m	s k uː t aː r j ʊ m
p l aː n ʊ m	p l aː n ʊ m
d ɛ r ɪ s ɪ oː r j ʊ m	d eː r iː s oː r j ʊ m
a tː ɛ s t aː r ɛ	a tː ɛ s t aː r iː
b a r k a m	b a r k a m
ɔ b s ɛ d ɛ r ɛ	ɔ b s ɪ d eː r ɛ
l a k ɛ r aː r ɛ	l a k ɛ r aː r ɛ
t ɛ k s t ɪ l ɛ m	t ɛ k s t ɪ l ɛ
f iː s k ʊ m	f ɪ s k ʊ m
ɛ k s p r iː m ɛ r ɛ	ɛ k s p r ɪ m ɛ r ɛ
k r ɪ m ɪ n ɛ	k r iː m ɛ n
t ɔ s ɪ n ɛ m	t oː n s j oː n ɛ m
p ɪ s t r iː n ʊ m	p ɪ s t r iː n ʊ m
d iː s p ɔ s iː t j oː n ɛ m	d ɪ s p ɔ s ɪ t j oː n ɛ m
k ɔ n f ɛ s oː r ɛ	k oː n f ɛ sː oː r ɛ m
g ɔ n ʊ m	g ɔ m pʰ ʊ m
ɪ n ɪ t j ʊ m	ɪ n ɪ t j ʊ m
t ɔ r t ɔ r ɛ	t ɔ r t oː r ɛ m
a b a k ʊ l ʊ m	a b a k ʊ l ʊ m
ɛ fː ʊ n d ɛ r ɛ	ɛ fː ʊ n d ɛ r ɛ
ɪ m p r ɔ b aː r ɛ	ɪ m p r ɔ b aː r ɛ
k ɔ l ʊ m b ʊ m	k ɔ l ʊ m b ʊ m
m oː l eː n aː r j ʊ m	m ɔ l iː n aː r j ʊ m
s ʊ b t ɪ l ɛ	s ʊ b t iː l ɛ m
k r ɪ m ɪ n aː t j oː n ɛ m	k r iː m ɪ n aː t j oː n ɛ m
m uː n ɪ f ɪ k ɛ n t j a m	m uː n ɪ f ɪ k ɛ n t j a m
p ɛ r ɛ g r iː n aː r ɛ m	p ɛ r ɛ g r iː n aː r iː
ɪ r aː s k ɪ b ɪ l a	iː r aː s k ɪ b ɪ l ɛ m
p ɔ s t eː r ʊ m	p ɔ s t ɛ r ʊ m
ɛ k s t r ɪ n t ɛu k ʊ m	ɛ k s t r iː n s ɛ k ʊ m
ɪ m b ɛ r b ɛ m	ɪ m b ɛ r b ɛ m
k ɔ k ʊ m	s ɔ kː ʊ m
n k ɛ w l ɔ l a m	n ɛ b ʊ l a m
n ɛ g aː r ɛ	n ɛ g aː r ɛ
s a l uː t aː t j oː n ɛ m	s a l uː t aː t j oː n ɛ m
k a n d eː l a m	k a n d eː l a m
b a r a t r ʊ m	b a r a tʰ r ʊ m
m uː n ɪ t j ʊ n ɛ m	m uː n iː t j oː n ɛ m
k r ɪ n ɛ	k r iː n ɛ m
s t ʊ p r ʊ m	s t ʊ p r ʊ m
k ɔ l aʊ d aː r ɛ	k ɔ lː aʊ d aː r ɛ
ʊ r g ɛ r ɛ	ʊ r g eː r ɛ
f iː n ɪ t j oː n ɛ m	f iː n iː t j oː n ɛ m
d ɛ w j aː t j oː n ɛ m	d eː w j aː t j oː n ɛ m
ɔ r n aː t ʊ m	oː r n aː t ʊ m
p a r ɪ r ɛ m	p a r ɛ r ɛ
d iː f l ʊ ɛ r ɛ	d ɪ fː l ʊ ɛ r ɛ
d aɪ k iː m aː r ɛ	d ɛ k ɪ m aː r ɛ
p iː k t oː r ɛ	p ɪ k t oː r ɛ m
d iː w ɪ n aː t j oː n ɛ m	d iː w iː n aː t j oː n ɛ m
k a m b r oː n ɛ m	k r aː b r oː n ɛ m
k a d aː r l ʊ m	k a p ʊ l ʊ m
k a l ɛ r ɛ	k a l eː r ɛ
g r aː t ɪ f ɛ k aː	g r aː t ɪ f ɪ k aː r iː
n ʊ k j a	n uː p t j aː s
k a kʰ ɛ n ɔ aː r ɛ	k a t eː n aː r ɛ
h iː m a n ɪ r	m a n eː r ɛ
r ɛ k l ɪ n aː r ɛ	r ɛ k l iː n aː r ɛ
p a t ɪ ɛ r ɛ	p a t iː
s ɛ p ʊ l t uː r a m	s ɛ p ʊ l t uː r a m
d iː l a k eː r aː r ɛ	d iː l a k ɛ r aː r ɛ
g uː d aɪ ʊ m	j uː d aɪ ʊ m
k ɔ k s aː l ɛ	k ɔ k s aː l ɛ m
k l ɛ r ɪ k ʊ m	k l eː r ɪ k ʊ m
eː k s t ɛ n d ɛ r ɛ	ɛ k s t ɛ n d ɛ r ɛ
s p oː s a m	s p oː n s a m
ʊ z uː r a m	uː s uː r a m
k ɔ n k ɪ s ʊ m	k ɔ ŋ k ɪ d ɛ r ɛ
f r aː s k ʊ m	f l a s k oː n ɛ m
eː l uː d ɛ r ɛ	eː l uː d ɛ r ɛ
k ɔ r ɛ m	k ɔ r
p ɔ lː aː r ɛ m	p ʊ lː aː r ɛ
a n ɪ m aː l ɛ	a n ɪ m a l
ɔ r aː r ɛ m	oː r aː r ɛ
s ɪ n k ɪ p uː r ɛ	s ɪ ŋ k ɪ p ʊ t
b ɔ m b ʊ m	b ɔ m b ʊ m
a k aɪ t ʊ m	a k eː t ʊ m
ʊ r ɪ n a m	uː r iː n a m
s uː s n iː t aː r ɛ	s ʊ s k ɪ t aː r ɛ
a b uː s aː r ɛ	a b uː t iː
a tː ɛ n d ɛ r ɛ	a tː ɛ n d ɛ r ɛ
l a n k ɛ r ʊ m	l a ŋ k j aː r j ʊ m
ʊ s ɪ t aː t ʊ m	uː s ɪ t aː t ʊ m
k r aɪ ŋ p s aː t uː r a m	k r ɛ p aː t uː r a m
k l aɪ m ɛ n t ɪ sː ɪ m ʊ m	k l eː m eː n t ɪ sː ɪ m ʊ m
p r ɪ s j oː n ɛ m	p r ɛ h ɛ n s j oː n ɛ m
s ɔ l ɪ k ɪ t aː t j oː n ɛ m	s ɔ lː ɪ k ɪ t aː t j oː n ɛ m
a s k ɛ l a m	a sː ʊ l a m
k ɛ n t ʊ r j a m	k ɛ n t ʊ r j a m
k ɔ n t r ɪ b ʊ ɛ r ɛ	k ɔ n t r ɪ b ʊ ɛ r ɛ
s ʊ s p ɪ r ʊ m	s ʊ s p ɪ r j ʊ m
w ɪ t ɛ lː ʊ m	w ɪ t ɛ lː ʊ m
r ɛ k ɛ n s iː r ɛ	r ɛ k eː n s eː r ɛ
ɪ n g ʊ r j a m	ɪ n ɪ uː r j a m
d iː s kʷ ɪ s iː t j oː n ɛ m	d ɪ s kʷ iː s iː t j oː n ɛ m
k a m p ɛ s t r ɛ m	k a m p ɛ s t r ɛ m
j d ɪ ɪ n d ɪ aː r ʊ m	z ɪ n z a l a m
s uː g ʊ g ɛ r ɛ r ɛ	s ʊ gː ɛ r ɛ r ɛ
t r ɛ t ʊ m	t r a k t ʊ m
t r j ʊ ʊ m f aː t oː r ɛ	t r j ʊ m pʰ aː t oː r ɛ m
z ɛ iː r n aː l ɛ	d j ʊ r n aː l ɛ m
r ɛ l ɛ g aː t j oː n ɛ m	r ɛ l eː g aː t j oː n ɛ m
s ɛ n aː r ɛ	s ɪ ŋ n aː r ɛ
ɛ r b aː k ɛu m ʊ m	h ɛ r b aː k ɛu m
ɪ n f ɪ m ʊ m	iː n f ɪ m ʊ m
p r aɪ w ɛ n ɪ r ɛ	p r aɪ w ɛ n iː r ɛ
d eː s p ɛ t aː r ɛ	d eː s p ɛ k t aː r ɛ
ɪ w ʊ m	iː w ʊ m
m iː r t ʊ m	m y r t ʊ m
b a l ɛ n a m	b a lː aɪ n a m
a n aɪ l aː r ɛ	a n h eː l aː r ɛ
a pː ɛ l aː r ɛ	a pː ɛ lː aː r ɛ
f ɛ l ɪ k ɪ t a t ɛ m	f eː l iː k ɪ t aː t ɛ m
d eː s t r ʊ g eː r ɛ	d eː s t r ʊ ɛ r ɛ
w ɛ r ɪ f ɪ k aː t j oː n ɛ m	w ɛ r ɪ f ɪ k aː t j oː n ɛ m
ɪ t ʊ ɪ t ɛ	ɪ n t ʊ eː r iː
d ɛ k r ɛ m ɛ n t ʊ m	d eː k r eː m ɛ n t ʊ m
m uː n ɪ r ɛ m	m uː n iː r ɛ
s s kʷ ʊ m	ɪ s k ʊ m
a b d ʊ k ɛ r ɛ	a b d uː k ɛ r ɛ
k ɔ aː g ʊ l aː t j oː n ɛ m	k ɔ aː g ʊ l aː t j oː n ɛ m
k ɔ n d ɪ m n ʊ m	k ɔ n d ɪ ŋ n ʊ m
ɔ fː ɪ k ɪ n a m	ɔ fː ɪ k iː n a m
p l aː n ɪ t j ɛ m	p l aː n ɪ t ɪ ɛ m
s y s ʊ m	s ɛ sː ʊ m
r ɔ g ʊ m	r ɔ g ʊ m
s ɔ ɛ w ɪ n iː r ɛ	s ʊ b w ɛ n iː r ɛ
r ɛ k t a ŋ g ʊ l ʊ m	r ɛ k t a ŋ g ʊ l ʊ m
s ʊ s t ɛ n t aː r ɛ	s ʊ s t ɛ n t aː r ɛ
s ʊ g j ɛ t ʊ m	s ʊ b ɪ ɛ k t ʊ m
r iː g ɪ d ʊ m	r ɪ g ɪ d ʊ m
s p a r g ɛ r ɛ	s p a r g ɛ r ɛ
k ɪ n t ʊ r a m	k ɪ ŋ k t uː r a m
p r aɪ m ɔ n iː t oː r ɛ m	p r aɪ m ɔ n ɪ t oː r ɛ m
m ɔ d ʊ m	m ɔ d j ʊ m
w uː l n ɛ r aː r ɛ	w ʊ l n ɛ r aː r ɛ
t r aː l a m	t r aː g ʊ l a m
h w ɛ r ʊ m	w eː r ʊ m
r ɛ s ɪ n aː r ɛ	r ɛ s ɪ ŋ n aː r ɛ
k a t ɛ r a m	k a t ɛ lː a m
ɪ l aː t ɪ w ʊ m	ɪ lː aː t iː w ʊ m
p l aː k ɪ d ʊ m	p l a k ɪ d ʊ m
a p n ɛ g aː r ɛ	a b n ɛ g aː r ɛ
t a r d ɪ m	t a r d ʊ m
k aː p iː r ɛ	k a p ɛ r ɛ
ɪ s t r ʊ iː r ɛ	iː n s t r ʊ ɛ r ɛ
s t ʊ pː a m	s t ʊ pː a m
d eː f ɔ r m aː t j oː n ɛ m	d eː f oː r m aː t j oː n ɛ m
d eː k l aː m aː r ɛ	d eː k l aː m aː r ɛ
m aː d r ɛ m	m aː t r ɛ m
s uː s ʊ rː ʊ m	s ʊ s ʊ rː ʊ m
n a w ɪ k eː lː a m	n aː w ɪ k ɛ lː a m
l ɔ t ʊ m	l ʊ t ʊ m
aʊ ʊ n aː r ɛ	a d uː n aː r ɛ
s uː d aː r ɛ	s uː d aː r ɛ
m ɔ d ɛ r aː t oː r ɛ	m ɔ d ɛ r aː t oː r ɛ m
d ɛ k s t r ʊ m	d ɛ k s t r ʊ m
b ɛ n ɛ f aː k ɛ r ɛ m	b ɛ n ɛ f a k ɛ r ɛ
w a g a b ʊ n d ʊ m	w a g aː b ʊ n d ʊ m
b ɛ n ɛ d ɪ k t j oː n ɛ m	b ɛ n ɛ d ɪ k t j oː n ɛ m
w aɪ t ɛ r ɛ m	w ɛ t ɛ r ɛ m
aʊ d ɪ k j ɔ n ɛ	aʊ k t j oː n ɛ m
k ɛ r t w aː r ɛ	k ɪ r k ɪ n aː r ɛ
m ɔ l ɛ k ʊ l a m	m oː l ɛ k ʊ l a m
k iː b ʊ m	k ɪ b ʊ m
f ɛ r a m	f ɛ r a m
m uː s a r aː n	m uː s a r aː n ɛu m
n uː t ʊ m	n uː t ʊ m
k a s t r ʊ m	k a s t r ʊ m
k ɔ ŋ n oː m ɛ n	k oː ŋ n oː m ɛ n
j uː s t ɪ f ɪ k aː t j oː n ɛ m	j uː s t ɪ f ɪ k aː t j oː n ɛ m
s a l ʊ b r ɛ m	s a l uː b r ɛ m
g uː r ʊ m	ɪ uː s
l iː n aɪ m ɛ n aː ʊ m	l iː n ɛ aː m ɛ n t ʊ m
f ʊ l ɪ ŋ g ɪ n ɛ	f uː l iː g ɪ n ɛ m
p aɪ l aː r j ʊ m	p ɛ lː aː r j ʊ m
b uː ɛ ɪ r ʊ m	b uː t y r ʊ m
t uː m ɪ d ʊ m	t ʊ m ɪ d ʊ m
p r ɔ s k r iː b ɛ r ɛ m	p r oː s k r iː b ɛ r ɛ
eː m uː l a k t oː r ɛ	aɪ m ʊ l aː t oː r ɛ m
m ɔ n t oː s ʊ m	m ɔ n t ʊ oː s ʊ m
m ɛ t aː lː ɪ f a r ʊ m	m ɛ t a lː ɪ f ɛ r ʊ m
ʊ n s k w ɛ	uː ŋ k t j oː n ɛ m
s uː p ɛ r b j a m	s ʊ p ɛ r b j a m
l uː k j ɪ d	l uː k ɪ d ʊ m
r a b ʊ l a m	r a b ʊ l a m
m ʊ l t ɪ p l ɪ k aː t j oː n ɛ	m ʊ l t ɪ p l ɪ k aː t j oː n ɛ m
ɪ m p r ɔ b ʊ m	ɪ m p r ɔ b ʊ m
r ɛ l ɪ k j ɛ	r ɛ l ɪ kʷ ʊ m
d eː n ɔ m ɪ n aː t oː r ɛ	d eː n oː m ɪ n aː t oː r ɛ m
l ɛ j t ʊ m	l aɪ t ʊ m
m ɛ r k ɛ m	m ɛ r k ɛ m
ɛ rː ɛ pʰ ɛ	ɛ rː aː r ɛ
ɪ fː ɛ k aː r ɛ	ɪ f ɪ k aː r ɛ
ɔ b s t aː r ɛ	ɔ b s t aː r ɛ
d eː k aː l w aː t j oː n ɛ m	d eː k a l w aː t j oː n ɛ m
h m ɪ k r aː n j a m	h eː m ɪ k r aː n j a m
ɛ w oː r j ʊ m	ɛ b ʊ r
s uː d aː r j ʊ m	s uː d aː r j ʊ m
k ɔ m p ɪ l aː t j oː n ɛ m	k ɔ m p iː l aː t j oː n ɛ m
ɪ n k ɪ t aː t j oː n ɛ m	ɪ ŋ k ɪ t aː t j oː n ɛ m
d ʊ k t ʊ m	d ʊ k t ʊ m
d j aː b l ʊ m	d j a b ɔ l ʊ m
s k ʊ rː ɛ r ɛ	ɛ k s k ʊ rː ɛ r ɛ
s k iː m j ʊ m	s iː m j ʊ m
r ɛ p ɛ r k uː s j oː n ɛ m	r ɛ p ɛ r k ʊ t ɛ r ɛ
k ɔ l t r ʊ m	k ʊ l t r ʊ m
f r ɪ k t j oː n ɛ	f r ɪ k t j oː n ɛ m
a r g ɪ n t oː s ʊ m	a r g ɛ n t oː s ʊ m
ɛ r ɛ d ɛ m	h eː r eː d ɛ m
a k ɛ t aː r ɛ	oː s k ɪ t aː r ɛ
a k aɪ r b iː t aː t ɛ m	a k ɛ r b ɪ t aː t ɛ m
l iː b r aː t j oː n ɛ m	l iː b r aː t j oː n ɛ m
k ɔ n d ɔ n aː r ɛ	k ɔ n d oː n aː r ɛ
k ɔ m ɛ r ɛ m	k ɔ m ɛ d ɛ r ɛ
k ɔ n s ɛ r w aː t j oː n ɛ m	k oː n s ɛ r w aː t j oː n ɛ m
w ɛ r ɛ k ʊ n d ʊ m	w ɛ r eː k ʊ n d ʊ m
n a b eː g aː r ɛ	n aː w ɪ g aː r ɛ
r ɛ t r ɔ k ɛ d eː r ɛ m	r ɛ t r oː k eː d ɛ r ɛ
d eː k ʊ rː ɛ r j ɛ	d eː k ʊ rː ɛ r ɛ
d eː m ɔ n s t r aː t j oː n ɛ m	d eː m oː n s t r aː t j oː n ɛ m
b aː aː t ʊ m	b ɔ aː t ʊ m
p r uː d ɛ r ɛ	p r uː r iː r ɛ
ɪ n ʊ n d aː r ɛ	ɪ n ʊ n d aː r ɛ
k ɔ n g ʊ r aː r ɛ	k ɔ n ɪ uː r aː r ɛ
k ɔ n k ʊ a m	k ɔ ŋ kʰ a m
t ɛ m p ɛ r j iː ɛ	t ɛ m p ɛ r ɪ ɛ m
s ʊ n ɪ t ʊ m	s ɔ n ɪ t ʊ m
ɪ d ɔ n ʊ m t aː m ɛ m	ɪ d oː n ɛ ɪ t aː t ɛ m
aʊ s p ɛ d aː r ɛ m	h ɔ s p ɪ t aː r iː
a l ɛ n t ʊ m	a n h eː l ɪ t ʊ m
k ɛ d r ʊ m	k ɛ d r ʊ m
m a n ɪ p ʊ l ʊ m	m a n ɪ p ʊ l ʊ m
a n aː r k j a m	a n a r kʰ j a m
s ɛ r aː f ɪ k ʊ m	s ɛ r a pʰ ɪ k ʊ m
ɔ r d ɪ n aː r j ʊ m	oː r d ɪ n aː r j ʊ m
w a k ɪ lː aː r ɛ	w a k ɪ lː aː r ɛ
d eː ŋ ɪ f ɪ k aː r ɛ	d ɛ ɪ f ɪ k aː r ɛ
ɛ k s ɛ m p l aː r ɛ	ɛ k s ɛ m p l a r
f ɛ s t ɪ w ɪ t aː t ɛ m	f eː s t iː w ɪ t aː t ɛ m
ɪ n kʷ ɪ l iː n ʊ m	ɪ ŋ kʷ ɪ l iː n ʊ m
p a ɪ n ɪ t ʊ m	p aː n ɪ k j ʊ m
t ɛ n ɪ ʊ ɛ	t ɛ n ʊ ɛ m
w a k a t j oː n ɛ m	w a k aː t j oː n ɛ m
eː pː ɪ s t oː l a m	ɛ p ɪ s t ɔ l a m
eː k s t r ʊ t ɪ r ɛ	ɛ k s t r uː d ɛ r ɛ
ɪ n s ʊ l t ʊ m	iː n s ʊ l t ʊ m
ɪ n w ɪ t aː t j oː n ɛ m	ɪ n w ɪ t aː t j oː n ɛ m
k ɔ n w ɛ k sː ʊ m	k ɔ n w ɛ k s ʊ m
p r ɔ s p eː r aː r ɛ	p r ɔ s p ɛ r aː r ɛ
a n uː l aː r ɛ	a nː uː lː aː r ɛ
s t aː b ɪ l ɛ m	s t a b ɪ l ɛ m
r ɛ d a r gʷ ʊ ɛ	r ɛ d a r gʷ ɛ r ɛ
ɪ mː ɔ r t aː l ɛ m	ɪ mː ɔ r t aː l ɛ m
a k a m	a k j a m
k ɔ sː ʊ m	k ɔ k s ʊ m
eː d ɪ f ɪ k aː r ɛ	aɪ d ɪ f ɪ k aː r ɛ
a b n ʊ ɪ r ɛ m	a b n ʊ ɛ r ɛ
a b ɪ t aː t j oː n ɛ m	h a b ɪ t aː t j oː n ɛ m
d uː r aː r ɛ	d uː r aː r ɛ
k ɔ r t ɛ m	k oː r t ɛ m
g ɛ n ɛ s t a m	g ɛ n ɛ s t a m
r ɛ p r ɛ h ɛ n s ɪ b ɪ l ɛ m	r ɛ p r ɛ h ɛ n s ɪ b ɪ l ɛ m
ɪ mː ʊ t aː r ɛ	ɪ mː uː t aː r ɛ
l a p ɪ t ɛ m	l a p ɪ d ɛ m
r eː w ɛ n ɪ r ɛ	r ɛ w ɛ n iː r ɛ
k ɔ w j aː t ʊ m	k ɔ mː ɛ aː t ʊ m
a s p ɛ r s j oː n ɛ m	a s p ɛ r s j oː n ɛ m
g ɛ r m ɛ n	g ɛ r m ɛ n
a pː ɛ n d ɛ r ɛ	a pː ɛ n d ɛ r ɛ
k ɔ n s ɪ s t ɛ r ɛ	k oː n s ɪ s t ɛ r ɛ
w ɛ r m ɛ m	w ɛ r m ɛ m
s a l a t ɪ t aː t ɛ m	s a l aː k ɪ t aː t ɛ m
s a l ɪ k ɛ t ʊ m	s a l ɪ k eː t ʊ m
t ɔ r t ʊ m	t ɔ r t ʊ m
eː l aɪ f a n t ɪ n ʊ m	ɛ l ɛ pʰ a n t ɪ n ʊ m
s k aː p ʊ l a m	s k a p ʊ l a m
g r aː w aː r ɛ	g r a w aː r ɛ
a d s k r ɪ w ɛ r ɛ m	aː s k r iː b ɛ r ɛ
ʊ r n a m	uː r n a m
ɪ n t ɛ rː ɔ m p ɛ r ɛ	ɪ n t ɛ rː ʊ m p ɛ r ɛ
l iː t ɛ m	l iː t ɛ m
r a d j aː t j oː n ɛ	r a d j aː t j oː n ɛ m
a nː ɪ k ɔ s ʊ m	a nː oː s ʊ m
b ɛ s t j aː r j ʊ m	b eː s t j aː r j ʊ m
r uː m oː r ɛ	r uː m oː r ɛ m
k ɔ m p ɛ t ɛ r ɛ	k ɔ m p ɛ t ɛ r ɛ
s ʊ s t ɛ n t aː k ʊ l ʊ m	s ʊ s t ɛ n t aː k ʊ l ʊ m
p r aː n r ɛ r ɛ m	p r a n d eː r ɛ
ɔ s t ɛ n t aː r ɛ	ɔ s t ɛ n t aː r ɛ
aʊ k m ɛ n t aː t j oː n ɛ m	aʊ g m ɛ n t aː t j oː n ɛ m
r ɛ k ɔ n k ɪ l j aː r ɛ	r ɛ k ɔ ŋ k ɪ l j aː r ɛ
b a s ɪ l ɪ k a m	b a s ɪ l ɪ k a m
p r oː n ʊ m	p r oː n ʊ m
s ɛ g r ɛ g aː r ɛ	s eː g r ɛ g aː r ɛ
f r aː t ɛ r n ʊ m	f r aː t ɛ r n ʊ m
ɪ m p ʊ l s ʊ m	ɪ m p ʊ l s ʊ m
p l aː t aː n ʊ m	p l a t a n ʊ m
n ɪ m b ʊ m	n ɪ m b ʊ m
l uː m ɪ n oː s ʊ m	l uː m ɪ n oː s ʊ m
p r ɪ m oː n g ɛ n ɪ t ʊ m	p r iː m oː g ɛ n ɪ t ʊ m
a r aː t ʊ m	a r aː t r ʊ m
a n ɪ m	a n iː s ʊ m
l ɔ ŋ g ɛ w ʊ m	l ɔ ŋ g aɪ w ʊ m
k ɛ r ʊ l ɛu m	k aɪ r ʊ l ɛu m
m ɔ r t aː r j ʊ m	m ɔ r t w aː r j ʊ m
k ɔ n s ɪ d ɛ r aː t j oː n ɛ m	k oː n s iː d ɛ r aː t j oː n ɛ m
k ɔ n k ʊ r s ʊ m	k ɔ ŋ k ʊ r s ʊ m
k ɔ n s ɛ t aː r iː r ɛ	k oː n s ɛ kʷ iː
ɔ l s ʊ m	ʊ r s ʊ m
r ɔ k ʊ m	r aʊ k ʊ m
l ɔ kː aː k ɛ	l ɔ kʷ aː k ɛ m
p ɛ k ʊ n j ʊ	p ɛ k uː n j a m
f ɛ n ɪ k j ʊ m	pʰ ɔ ɪ n iː k ɛu m
ʊ n k ɪ n ʊ m	ʊ ŋ k iː n ʊ m
k ɛ r k ɪ n ɛ	k ɪ r k ɪ n ʊ m
s t r iː l j ɛ l ɛ	s t r ɪ g ɪ l ɛ m
l uː n aː t oː n ɛ m	l uː n aː t j oː n ɛ m
l ɪ r ɪ m	g l iː r ɛ m
k a r a m ɛ lː ʊ m	k a l a m ɛ lː ʊ m
eː r ɔ g aː r ɛ	eː r ɔ g aː r ɛ
aɪ d ɪ l	aɪ d iː l ɛ m
k ɔ m ɔ t j oː n ɛ	k ɔ mː oː t j oː n ɛ m
p a r s ɪ m oː n j a m	p a r s ɪ m oː n j a m
a n ɛ lː ʊ m	a ŋ n ɛ lː ʊ m
a r aː b ɪ l ɛ m	a r aː b ɪ l ɛ m
l a k r ɪ m aː r ɛ	l a k r ɪ m aː r ɛ
s uː m	s ʊ ɛ m
p r aɪ k oː n ʊ t ɛ r ɛ m	p r aɪ k ɔ ŋ n ɔ s k ɛ r ɛ
aɪ r k ɛ r ɛ	eː r ɪ g ɛ r ɛ
r iː g ʊ r oː s ʊ m	r ɪ g ɔ r ɔ s ʊ m
ɪ t ɛ ɪ p ɛ t t ɪ m t aː t ɛ m	ɪ n t ɛ m p ɛ s t iː w ɪ t aː t ɛ m
s ɛ r oː t ɪ n ʊ m	s eː r oː t ɪ n ʊ m
k ɔ l ʊ m b iː n ʊ m	k ɔ l ʊ m b iː n ʊ m
d iː s k r eː p a n t j a m	d ɪ s k r ɛ p a n t j a m
l ɔ r ɪ k a m	l oː r iː k a m
p r uː d ɛ n t j a m	p r uː d ɛ n t j a m
k ɔ n s ɛ ŋ n aː r ɛ	k oː n s ɪ ŋ n aː r ɛ
k ɔ r ʊ m	kʰ ɔ r ʊ m
r ɛ k ʊ n ɔ a t eː r ɛ	r ɛ k ɔ ŋ n oː s k ɛ r ɛ
r ɛ m ʊ n ɛ r aː r ɛ	r ɛ m uː n ɛ r aː r ɛ
f a b ɛ lː a m	f aː b ɛ lː a m
l a n gʷ ɪ d ʊ m	l a ŋ gʷ ɪ d ʊ m
m ɔ r d aː k ɛ	m ɔ r d aː k ɛ m
h k ɪ	kʷ ɛ m
s ɛ r ʊ m	s ɛ r ʊ m
d eː l ɪ kʷ aː r ɛ	d eː l ɪ kʷ aː r ɛ
m uː r a m	m ʊ r j a m
aʊ s k ʊ l ʊ m	oː s k ʊ l ʊ m
ɪ n f ɛ s t aː r ɛ	iː n f ɛ s t aː r ɛ
a l t ɛ r k aː t j oː n ɛ m	a l t ɛ r k aː t j oː n ɛ m
