r ɛ p l iː k a t j oː n ɛ	r ɛ p l ɪ k aː t j oː n ɛ m
g iː r aː r ɛ	g y r aː r ɛ
p ɛ d ɛ s t r ɛ m	p ɛ d ɛ s t r ɛ m
ɛ r uː g iː n oː s ʊ m	aɪ r uː g ɪ n oː s ʊ m
a b ɔ l iː t j ʊ m n ɛ m	a b ɔ l ɪ t j oː n ɛ m
p ɛ r s ɛ k uː t oː r ɛ	p ɛ r s ɛ k uː t oː r ɛ m
d ɔ t aː r ɛ	d oː t aː r ɛ
s k a n d ʊ l a m	s k a n d ʊ l a m
a m l b uː m m a	a l b uː m ɛ n
r ɛ s t r ɪ ŋ g ɛ r ɛ	r ɛ s t r ɪ ŋ g ɛ r ɛ
b ɛ s t j aː r j ʊ m	b eː s t j aː r j ʊ m
k ʊ n t a m iː n a t j ʊ m n ɛ m	k ɔ n t aː m ɪ n aː t j oː n ɛ m
f a r m a m k ʊ m	pʰ a r m a k ʊ m
a m p ɔ s t ʊ m	a pː ɔ s ɪ t ʊ m
ɔ b g ɛ k t ʊ m	ɔ b ɪ ɛ k t ʊ m
f a s t ɪ ɪ r ɛ	f a s t iː d iː r ɛ
m ʊ l t iː p l iː k a t j oː n ɛ	m ʊ l t ɪ p l ɪ k aː t j oː n ɛ m
p ɛ r iː k l iː t aː r ɛ	p ɛ r iː k l ɪ t aː r iː
s uː p l iː t j ʊ m	s ʊ pː l ɪ k j ʊ m
m a l ɛ	m a l ʊ m
a f ɛ r ɛ r	aʊ f ɛ rː ɛ
d ɛ n ɔ m ɪ n aː r ɛ	d eː n oː m ɪ n aː r ɛ
k ɔ rː ɛ k t oː r ɛ	k ɔ rː ɛ k t oː r ɛ m
p iː n t ʊ m	p ɪ k t ʊ m
n ɛ f aː r j ʊ m	n ɛ f aː r j ʊ m
k ɔ n s ɛ n t iː r ɛ	k oː n s ɛ n t iː r ɛ
l iː m oː s ʊ m	l iː m oː s ʊ m
p m ɛ r d ɛ r ɛ	p ɛ r d ɛ r ɛ
b l a n d ʊ m	b l a n d ʊ m
p ɛ r t uː r b aː r ɛ	p ɛ r t ʊ r b aː r ɛ
t uː r g iː d ʊ m	t ʊ r g ɪ d ʊ m
a b l uː ɛ r ɛ	a b l ʊ ɛ r ɛ
s uː k k j m aː r ɛ	s uː g ɛ r ɛ
s p ɔ s a m	s p oː n s a m
s p ɛ k iː f iː k ʊ m	s p ɛ k ɪ f ɪ k ʊ m
f aː k ɛ m	f a k ɪ ɛ m
r aː p iː d ʊ m	r a p ɪ d ʊ m
k a t ʊ m	k aʊ t ʊ m
m ɔ r t a l iː t aː t ɛ m	m ɔ r t aː l ɪ t aː t ɛ m
f uː s t a m	f ʊ s t a m
a k k ɛ s oː r j ʊ m	a kː ɛ sː oː r j ʊ m
ɛ k s iː s t ɛ n t j a m	ɛ k s ɪ s t ɛ n t j a m
f ɔ r n iː k a t oː r ɛ	f ɔ r n ɪ k aː t oː r ɛ m
k r uː d ɛ l ɛ	k r uː d eː l ɛ m
k uː l t ʊ m	k ʊ l t ʊ m
r ɛ f ɔ r m aː r ɛ	r ɛ f oː r m aː r ɛ
f ɔ r m aː r ɛ	f ɔ r aː r ɛ
ɪ m b ɪ b ɛ r ɛ	ɪ m b ɪ b ɛ r ɛ
w ɛ r s iː k ʊ l ʊ m	w ɛ r s ɪ k ʊ l ʊ m
fː ɛ m ɛ l a m	f eː m ɛ lː a m
a m m a m n ʊ ɛ n s ɛ	aː m a n ʊ eː n s ɛ m
r ɛ w ɛ r ɛ n t ɛ	r ɛ w ɛ r ɛ n t ɛ m
ɪ n t m ɛ rː ʊ m p ɛ r ɛ	ɪ n t ɛ rː ʊ m p ɛ r ɛ
ɛ l a t j oː n	eː l aː t j oː n ɛ m
p a m r t ʊ r j ɛ m ɛ	p a r t ʊ r iː r ɛ
aː kʷ w a	a kʷ a m
a w ɛ n iː r ɛ	a d w ɛ n iː r ɛ
s ɛ r aː f iː k ʊ m	s ɛ r a pʰ ɪ k ʊ m
r ɛu w ɛ r s aː r	r ɛ w ɛ r s aː r ɛ
a w ɛ r s j oː n ɛ	aː w ɛ r s j oː n ɛ m
d ɛ n t iː f r iː k ʊ m	d ɛ n t ɪ f r ɪ k j ʊ m
ɛ k s p ɛ k t a m t j ʊ m n ɛ	ɛ k sː p ɛ k t aː t j oː n ɛ m
b r aː k ɛ m	b r aː k aː s
a l t aː r ɛ	a l t a r ɛ m
t ɛ n ɛ r ɛ	t ɛ n eː r ɛ
d ɛ m oː r aː r ɛ	d eː m ɔ r aː r iː
f ɪ n a m	f aː g ɪ n ʊ m
k aʊ d a l ɛ	k aʊ d aː l ɛ m
g r a n r j ʊ m	g r aː n aː r j ʊ m
iː m mː ɛ d j aː t ʊ m	ɪ mː ɛ d j aː t ʊ m
iː n f l uː ɛ r ɛ	iː n f l ʊ ɛ r ɛ
s ɛ t r ɪ g iː l ɛ	s t r ɪ g ɪ l ɛ m
s a b l	s a b ʊ l ʊ m
w ʊ l ɛ r ɛ	w ɛ lː ɛ
iː m m a k ɔ l a t ʊ m	ɪ mː a k ʊ l aː t ʊ m
t aː b ʊ l a m	t a b l a m
s uː p ɛ r b j a m	s ʊ p ɛ r b j a m
n a m t a m l iː t j ʊ m	n aː t aː l iː k j ʊ m
d m aː m b uː l a t j ʊ m n ɛ m	d ɛ a m b ʊ l aː t j oː n ɛ m
k ʊ m p a r eː t r ɛ	k ɔ m p aː r eː r ɛ
w a m lː ɛ t ʊ m	w a lː ɛ tː ʊ m
k ɔ n d ɛ n s aː r ɛ	k ɔ n d eː n s aː r ɛ
g ɛ g ɛ m l a m	z iː z y pʰ ʊ m
ɛ s t r iː k aː r ɛ	ɛ k s t r iː k aː r ɛ
ɛ g s ɛ m p l aː r	ɛ k s ɛ m p l a r
w ɪ t ɛ lː ʊ m	w ɪ t ɛ lː ʊ m
k ɔ n ʊ m	k ʊ nː ʊ m
ɛ s ʊ m	ɪ p s ʊ m
s ɛ k aː l ɛ	s ɛ k aː l ɛ
ɔ p uː l ɛ n t ʊ m	ɔ p ʊ l ɛ n t ʊ m
k ɔ l ɔ s t r ʊ m	k ɔ l ɔ s t r a m
iː rː iː t aː r	ɪ rː iː t aː r ɛ
p aː b ʊ lː r	p aː b ʊ l ʊ m
m ʊ r t aː r j ʊ m	m ɔ r t w aː r j ʊ m
m w ɪ ŋ k ɛ r ɛ	w ɪ ŋ k ɛ r ɛ
p r ʊ p iː n kʷ iː t a t ɛ m	p r ɔ p ɪ ŋ kʷ ɪ t aː t ɛ m
a b iː l iː t aː t ɛ m	h a b ɪ l ɪ t aː t ɛ m
k r ɛ aː t r iː k ɛ	k r ɛ aː t r iː k ɛ m
l iː m a t aː	l iː m aː k ɛ m
t uː n d ɛ r	t ʊ n d ɛ r ɛ
k a n t ɪ k ʊ m	k a n t ɪ k ʊ m
g uː d j ɛ ʊ m	j uː d aɪ ʊ m
a d j uː r a s j ɛ m	a d ɪ uː r aː t j oː n ɛ m
f r ʊ n d ɔ s ʊ m	f r ɔ n d oː s ʊ m
r ɛ s p ɔ n s ʊ m	r ɛ s p oː n s ʊ m
m a l ɪ ŋ n ʊ m	m a l ɪ ŋ n ʊ m
f ɔ n t ɛ	f ɔ n t ɛ m
m a m t uː r aː r ɛ	m aː t uː r aː r ɛ
k ɛ n t a m r ɛ	kʷ ɪ eː t aː r ɛ
iː n s t r uː k s j ɛ m	iː n s t r ʊ k t j oː n ɛ m
ɔ t j ʊ m	oː t j ʊ m
rː uː g ʊ m s ʊ m	r uː g oː s ʊ m
ɛ f ʊ n d ɪ r ɛ	ɛ fː ʊ n d ɛ r ɛ
t aː k t iː l ɛ	t aː k t ɪ l ɛ m
ɪ n f iː r m a m r ɛ	iː n f ɪ r m aː r ɛ
l ʊ ŋ g a n iː m iː t aː t ɛ m	l ɔ ŋ g a n ɪ m ɪ t aː t ɛ m
n ʊ m w iː l uː n j ʊ m	n ɔ w ɪ l uː n j ʊ m
ɔ r d iː n aː r j ʊ m	oː r d ɪ n aː r j ʊ m
d iː m m iː n uː ɛ r ɛ	d iː m ɪ n ʊ ɛ r ɛ
rː ɛ g aː r	r ɪ g aː r ɛ
k ʊ n s uː l t a t j ʊ m n ɛ m	k oː n s ʊ l t aː t j oː n ɛ m
l a m k aː r ɛ a	l a sː aː r ɛ
n j ɛ b ʊ l ʊ m a m	n ɛ b ʊ l a m
g ɛ r a r k a m	h ɪ ɛ r a r kʰ a m
r uː f ʊ m	r uː f ʊ m
d uː b iː t a t j ʊ m n ɛ m	d ʊ b ɪ t aː t j oː n ɛ m
s uː p ɔ n ɛ m	s ʊ pː oː n ɛ r ɛ
m ɪ n aː k aː	m ɪ n aː k ɛ m
p a l ɛ s t r a m	p a l aɪ s t r a m
b aː t ʊ m	b ɛ aː t ʊ m
k ɔ d iː k iː lː ʊ m	k oː d ɪ k ɪ lː ʊ m
m ɛ s t ʊ m	m aɪ s t ʊ m
a m k l a m r aː r	a kː l aː r aː r ɛ
a g r iː m ɛ n s oː r ɛ	a g r iː m eː n s oː r ɛ m
iː m p l iː k aː r ɛ	ɪ m p l ɪ k aː r ɛ
k ʊ m n k a m t ɛ n a m r ɛ	k ɔ ŋ k a t eː n aː r ɛ
uː b ɛ r ɛ m	uː b ɛ r
ɛ f l uː ɪ r ɛ	ɛ fː l ʊ ɛ r ɛ
r ɛ f ɔ r m a t j oː n ɛ	r ɛ f ɔ r m aː t j oː n ɛ m
k a l iː g a m	k a l ɪ g a m
oː lː a m	ɔ lː a m
aː s t a m	h a s t a m
a m l t ɛ r n a m t j ʊ m n ɛ	a l t ɛ r n aː t j oː n ɛ m
a m n ɔ s ʊ m	a nː oː s ʊ m
f ɛ r ɛ t r ʊ m	f ɛ r ɛ t r ʊ m
a m f ɛ k t ʊ m	a fː ɛ k t ʊ m
s p iː n a l ɛ	s p iː n aː l ɛ m
p uː d oː r ɛ	p ʊ d oː r ɛ m
k ɔ r s ʊ m	k ɔ r s ʊ m
s uː p l ɪ r ɛ	s ʊ pː l eː r ɛ
p a r ɔ n ɔ m aː s j a m	p a r ɔ n ɔ m a s j a m
t ʊ r p ɛ d ʊ m	t ɔ r p eː d ɪ n ɛ m
d ɪ s p a m r t iː r ɛ	d ɪ s p a r t iː r ɛ
p a l ʊ m b ʊ m	p a l ʊ m b ʊ m
l ʊ t r d ʊ m	l uː r ɪ d ʊ m
l iː b ɛ lː uː l a m	l iː b ɛ lː ʊ l a m
s ɔ n aː t ʊ m	s ɔ m n j ʊ m
ɛ r a m	aɪ r a m
p ʊ r p ʊ r a m	p ʊ r p ʊ r a m
s ʊ b ɪ t aː n ɛ ʊ m	s ʊ b ɪ t aː n ɛu m
n ɛ p eː t ɛ m a m	n ɛ p ɛ t a m
s a l s a m	s a l s a m
w oː t ʊ m	w oː t ʊ m
k ʊ n s ɛ r w a t j ʊ m n ɛ m	k oː n s ɛ r w aː t j oː n ɛ m
g aː d	iː l ɛ
l iː m iː t r ʊ f ɛ m	l iː m ɪ t r ɔ pʰ ʊ m
ɪ n t ɛ g r ʊ m	ɪ n t ɛ g r ʊ m
s eː l w a m	s ɪ l w a m
iː n ɔ b ɪ l ɛ	ɪ ŋ n oː b ɪ l ɛ m
p a r s iː m ɔ n j a m	p a r s ɪ m oː n j a m
ɛ kʷ iː l iː b r j ʊ m	aɪ kʷ ɪ l iː b r j ʊ m
m ʊ n d ʊ m	m ʊ n d ʊ m
p uː p iː lː a m	p uː p ɪ lː a m
iː m p ɛ r t ɛ p t iː b l ɛ	ɪ m p ɛ r k ɛ p t ɪ b ɪ l ɛ m
t ʊ r p ɔ r	t ɔ r p oː r ɛ m
k r a m t ɪ k ʊ l a m	k r aː t ɪ k ʊ l a m
ɛ g s ɛ r k ɛ r ɛ	ɛ k s ɛ r k eː r ɛ
s ɛ p t ɛ n t r j ɪ ɔ n a l ɛ	s ɛ p t ɛ n t r j oː n aː l ɛ m
f uː r t iː w ʊ m	f uː r t iː w ʊ m
ɔ b s t ɛ t r iː k a m	ɔ b s t ɛ t r iː k ɛ m
f ɛ s t ʊ m	f eː s t ʊ m
k ʊ m p ɛ t ɛ r ɛ	k ɔ m p ɛ t ɛ r ɛ
k aː s t r	k a s t r ʊ m
p l aː g j ʊ m	p l a g j ʊ m
t r iː g ɛ s iː m ʊ m	t r iː g eː s ɪ m ʊ m
r ɛ k ʊ n k iː l j aː r ɛ	r ɛ k ɔ ŋ k ɪ l j aː r ɛ
k eː r oː s ʊ m	k eː r oː s ʊ m
ɛ n ɛ r w aː r	eː n ɛ r w aː r ɛ
p r ɛ d ɪ k ɪ r ɛ	p r aɪ d ɪ k aː r ɛ
k ɔ n s ɛ r w aː r ɛ	k oː n s ɛ r w aː r ɛ
w aː t ɛ	w aː t ɛ m
p r ɔ iː b iː t j ʊ n	p r ɔ h ɪ b ɪ t j oː n ɛ m
ɪ s iː m ʊ m	ɪ sː ɪ m ʊ m
w ɛ n uː s t ʊ m	w ɛ n ʊ s t ʊ m
p r ɔ k ɛ d ɛ r ɛ	p r oː k eː d ɛ r ɛ
k a t ɛ k iː s m ʊ m	k a t eː kʰ ɪ s m ʊ m
a m k ɛ f a m l ʊ m	a k ɛ pʰ a l ʊ m
a b s ɔ l w ɛ r ɛ	a b s ɔ l w ɛ r ɛ
f a m b ɛ lː a m	f aː b ɛ lː a m
f l ɔ s k uː l ʊ m	f l ɔ s k ʊ l ʊ m
s k ɔ l aː r ɛ m	s kʰ ɔ l aː r ɛ m
f r ɛ kʷ ɛ n t ɛ	f r ɛ kʷ ɛ n t ɛ m
p a l p iː t aː r ɛ	p a l p ɪ t aː r ɛ
l uː k iː f ɛ r ʊ m	l uː k ɪ f ɛ r ʊ m
p ɛ r t ɛ n ɛ r ɛ	p ɛ r t ɪ n eː r ɛ
p ɔ lː iː k ɛ	p ɔ lː ɪ k ɛ m
b ɔ t uː l ɪ n ʊ m	b ɔ t ʊ l ʊ m
n a rː aː r ɛ	n a rː aː r ɛ
w eː n ɛ t r oː m a	w ɛ n ɛ t ʊ m
s t iː w a m r ɛ	s t iː p aː r ɛ
p r ɛ d j a l ɛ	p r aɪ d j aː l ɛ m
ɪ n k eː n d ɛ r ɛ	ɪ ŋ k ɛ n d ɛ r ɛ
p r ɛ s ɛ p m ɛ	p r aɪ s aɪ p ɛ
f a b r ʊ m	f a b r ʊ m
f ʊ l a k a m	f ʊ l ɪ k a m
t ɛ k s t ʊ m	t ɛ k s t ʊ m
k a s t a n ɛ a	k a s t a n ɛ a m
a b s t ɛ r g ɛ r ɛ	a b s t ɛ r g eː r ɛ
a m s p ʊ m r t a m r ɛ	a s p ɔ r t aː r ɛ
a m r t ɪ ɛ	a gː ɛ r ɛ m
s a l uː t ɛ m	s a l uː t ɛ m
r aː b uː l a m	r a b ʊ l a m
p a l a t ɛ r ɛ	p a l aː t ʊ m
s a l k ʊ m ɪ k ɛ m	s a l ɪ k ɛ m
s a ŋ t j oː n	s aː ŋ k t j oː n ɛ m
k ɔ n t r a k t aː r ɛ r ɛ	k ɔ n t r a h ɛ r ɛ
s uː b g uː g aː r	s ʊ b j ʊ g aː r ɛ
k r uː ɛ l d a l t ɛ m	k r uː d eː l ɪ t aː t ɛ m
ɔ r a t j ʊ m n ɛ m	oː r aː t j oː n ɛ m
l a k t ɛ ʊ m	l a k t ɛu m
p ʊ lː ɛ r j ʊ m	p ʊ lː aː r j ʊ m
r ɛ t r a k t aː r ɛ	r ɛ t r a k t aː r ɛ
a m ɛ t iː s t aː	a m ɛ tʰ y s t a m
iː n s t r uː m ɛ n t a l	iː n s t r uː m ɛ n t aː l ɛ m
s ɔ lː ɪ k iː t aː r ɛ	s ɔ lː ɪ k ɪ t aː r ɛ
g r uː m ʊ m	g r uː m ʊ m
t a m l a m m ʊ m	tʰ a l a m ʊ m
k a w aː r ɛ	k a w aː r ɛ
m ɔ t ʊ ɛ m	m uː t ʊ l ʊ m
s p ɔ l a m r ɛ	s p ɔ l j aː r ɛ
aː s t r ʊ m	a s t r ʊ m
f ɛ d ɛ m l ɪ t t ɛ m	f ɪ d eː l ɪ t aː t ɛ m
n aː f t a m	n a pʰ tʰ a m
r ɔ t aː r ɛ	r ɔ t aː r ɛ
j aː s p ɪ d ɛ	j a s p ɪ d ɛ m
fː l uː w	f l ʊ w j ʊ m
k ɔ n f ɪ j aː r ɛ	k oː n f iː d ɛ r ɛ
p r ɔ d iː g j ʊ m s j ʊ m	p r oː d ɪ g j oː s ʊ m
aː b ʊ g a m k j oː n	a b r ɔ g aː t j oː n ɛ m
t ɪ l j ʊ m	t ɪ l j a m
m a m ŋ n ɛ s j ʊ m	m a ŋ n eː s j ʊ m
s uː b ʊ j ɛ l a m	s uː b ʊ l a m
b ɛ n ɛ d ɪ n ɛ m ɪ k t j ʊ m n ɛ m	b ɛ n ɛ d ɪ k t j oː n ɛ m
r ʊ ɛ iː n oː s ʊ m	r ʊ iː n oː s ʊ m
k ɔ m ɛ n t aː r j ʊ m	k ɔ mː ɛ n t aː r j ʊ m
a m iː k a l ɛ	a m iː k aː l ɛ m
f a m uː l ʊ m	f a m ʊ l ʊ m
iː m b ɛ k iː lː ɛ	ɪ m b eː k ɪ lː ʊ m
d ɛ rː uː ɛ r	d iː r ʊ ɛ r ɛ
l oː t ʊ m	l ʊ t ʊ m
p iː s aː r	p iː n s ɛ r ɛ
g ɛ m a m	g ɛ mː a m
ɛ g s ɛ kʷ ɪ ɛ r	ɛ k sː ɛ kʷ iː
f j eː r a m	f ɛ r a m
r iː k s a m	r ɪ k s a m
a m r ɪ j ʊ m l ʊ m	h a r ɪ ɔ l ʊ m
a m s k ʊ n d ɛ r ɛ	a b s k ɔ n d ɛ r ɛ
m m ɛ d j ʊ m	m ɛ d j ʊ m
p a n iː k j ʊ ɛ l a m	p aː n ɪ k ʊ l a m
a n t ɛ p oː n ɛ r ɛ	a n t ɛ p oː n ɛ r ɛ
k ʊ m p r a m t ɔ r ɛ	k ɔ m p a r aː t oː r ɛ m
k aː p l ʊ m	k a p ʊ l ʊ m
t ʊ r t ʊ r ɪ ʊ aː	t ʊ r t ʊ r ɛ m
t r ɛ t ʊ m	t r a k t ʊ m
p r ɛ s t aː r ɛ	p r aɪ s t aː r ɛ
g ɛ n t iː l ɛ m	g ɛ n t iː l ɛ m
r uː s t iː k a n ʊ m	r uː s t ɪ k aː n ʊ m
k uː r aː r ɛ	k uː r aː r ɛ
a m r m iː l a m	a r m ɪ lː a m
iː n s uː l aː r ɛ	iː n s ʊ l aː r ɛ m
g ɛ ʊ m m ɛ t r j a m	g ɛ oː m ɛ t r j a m
s ʊ s p iː r ʊ m	s ʊ s p ɪ r j ʊ m
f uː r iː b ʊ n d ʊ m	f ʊ r ɪ b ʊ n d ʊ m
aː j ɪ k j aː k ʊ m	aɪ g y p t j a k ʊ m
p r ɔ t ɛ s t a t j ʊ m n ɛ m	p r oː t ɛ s t aː t j oː n ɛ m
s uː k uː l ɛ n t ʊ m	s ʊ kː ʊ l ɛ n t ʊ m
iː ŋ g uː r j oː s ʊ m	ɪ n ɪ uː r j oː s ʊ m
m uː s a r ɛ n ɛ m	m uː s a r aː n ɛu m
r ɪ m a n ɛ r ɛ	m a n eː r ɛ
k ɔ n k ɔ r d j a m	k ɔ ŋ k ɔ r d j a m
f a r ɛ t r a m	pʰ a r ɛ t r a m
a p r ɔ b a t j ʊ m n ɛ m	a pː r ɔ b aː t j oː n ɛ m
m ʊ w ɪ m j ɛ n t ʊ m	m oː w ɪ m ɛ n t ʊ m
a n t ɛ k ɛ s oː r ɛ	a n t ɛ k ɛ sː oː r ɛ m
k a n t oː r ɛ	k a n t oː r ɛ m
d ɛ k iː m a l ɛ	d ɛ k ɪ m a l ɛ m
s t iː r p ɛ	s t ɪ r p ɛ m
ɔ r p iː m ɛ n t ʊ m	aʊ r ɪ p ɪ g m ɛ n t ʊ m
k a m l aː r ɛ	kʰ a l aː r ɛ
n uː t aː r	n uː t aː r ɛ
t ɔ r ʊ m	t aʊ r ʊ m
ɪ n f a n t j a m	iː n f a n t j a m
h ɛ r eː m ʊ m	ɛ r eː m ʊ m
n ʊ m ɛ r aː r ɛ	n ʊ m ɛ r aː r ɛ
f ɛ lː ʊ m n ɛ m	f ɛ lː aː r ɛ
w iː p t ʊ m	w iː k t ʊ m
k ɔ t iː d j a n ʊ m	k ɔ t iː d j aː n ʊ m
rː ɪ ɪ s	r ɛ m
k ɪ n t ʊ m	k ɪ ŋ k t ʊ m
k r iː t iː k ʊ m	k r ɪ t ɪ k ʊ m
t r a b aː l j ʊ m	t r ɪ p aː l ɛ m
p r ɔ d iː g j ʊ m	p r oː d ɪ g j ʊ m
k ʊ n k iː l j aː b ʊ l ʊ m	k ɔ ŋ k ɪ l j aː b ʊ l ʊ m
k ɪ t a r a m	k ɪ tʰ a r a m
ɪ t aː t ɛ m	ɪ t aː t ɛ m
a p a r ɛ n t ɛ	a pː a r ɛ n t ɛ m
a m n iː m ʊ m	a n ɪ m ʊ m
k aː lː ʊ m	k a lː ʊ m
l iː ŋ g uː l a m	l ɪ ŋ g ʊ l a m
k ʊ n s ʊ p t j ʊ m n ɛ m	k oː n s uː m p t j oː n ɛ m
f aʊ k eː	f aʊ k eː s
s ɛ m d aː r ɛ r ɛ	s ɛ d eː r ɛ
iː m p r ɔ b iː t aː	ɪ m p r ɔ b ɪ t aː t ɛ m
p ɛ r d iː k	p ɛ r d iː k ɛ m
r ɛ t iː k ɛ r ɛ	r ɛ t ɪ k eː r ɛ
oː l ʊ m	ʊ l ʊ m
g lː a n d uː lː oː s ʊ m	g l a n d ʊ l oː s ʊ m
p ɛ s t r ɪ n ʊ m	p ɪ s t r iː n ʊ m
m a m t uː r ʊ m	m aː t uː r ʊ m
k a l uː m n j a m	k a l ʊ m n j a m
ʊ n d aː r ɛ	ʊ n d aː r ɛ
k ɔ n ɛ k s j ʊ n	k oː n ɛ k s j oː n ɛ m
n aː w ɛ	n aː w ɛ m
m a l ɛ d ɪ k ɛ r ɛ	m a l ɛ d iː k ɛ r ɛ
t r ɪ f oː l ʊ	t r ɪ f ɔ l j ʊ m
l aʊ r ʊ m k ɛ r a m s ʊ m	l aʊ r ɔ k ɛ r a s ʊ m
ɔ s t ɛ n t aː r ɛ	ɔ s t ɛ n t aː r ɛ
k aː t a m	k a tː a m
f a l a ŋ g ɛ	pʰ a l a ŋ g ɛ m
a s ɛ r t j ʊ n	a sː ɛ r t j oː n ɛ m
k oː n ɔ p ɛ ʊ m	k oː n oː p eː ʊ m
a r b iː t r j ʊ m	a r b ɪ t r j ʊ m
a p ɛ lː aː r ɛ	a pː ɛ lː aː r ɛ
f ɛ l iː k iː t aː t ɛ m	f eː l iː k ɪ t aː t ɛ m
k ʊ m s t iː t uː t j ʊ m n ɛ m	k oː n s t ɪ t uː t j oː n ɛ m
k ʊ n s ɔ r t ɛ	k oː n s ɔ r t ɛ m
ɔ b ɛ d ɛ k ɛ r	ɔ b ɔ ɪ d iː r ɛ
ɛ m s ɛ t iː ŋ gʷ ɛ r ɛ	ɛ k s t ɪ ŋ gʷ ɛ r ɛ
s ɛ m p iː t ɛ r n ʊ m	s ɛ m p ɪ t ɛ r n ʊ m
d ɪ ŋ n a m t j ʊ m n ɛ m	d ɪ ŋ n aː t j oː n ɛ m
p ɛ n ɛ t r ɛ r	p ɛ n ɛ t r aː r ɛ
b a t ʊ m	b ɔ aː t ʊ m
f ɪ b uː l a m	f iː b ʊ l a m
d iː s ɔ n aː r ɛ	d ɪ sː ɔ n aː r ɛ
t ɪ t iː d aː t ɛ m	a k ɪ d ɪ t aː t ɛ m
n iː w ɛ lː ɔ	l iː b ɛ lː a m
r ɛ s eː n a m r ɛ	r ɛ s ɪ ŋ n aː r ɛ
a s k ɛ n s j ʊ m n ɛ m	a s k eː n s j oː n ɛ m
a d m a m a n t ɛ	a d a m a n t ɛ m
a p j aː r j ʊ m	a p j aː r j ʊ m
iː n t ɛ iː ɛ	ɪ n t ʊ eː r iː
g ɛ r m a n iː k ʊ m	g ɛ r m aː n ɪ k ʊ m
s ɛ d ɛ	s eː d ɛ m
k ɔ n d iː t j oː n ɛ	k ɔ n d ɪ k j oː n ɛ m
ʊ m l eː r ɛ	ɔ l eː r ɛ
d eː k iː r s p ɛ r aː t ʊ m	d eː s p eː r aː t ʊ m
r ɪ j ʊ m	r iː w ʊ m
iː n t ɛ r g ɛ k t j ʊ n	ɪ n t ɛ r j ɛ k t j oː n ɛ m
d ʊ b l ʊ m	d ʊ p l ʊ m
t ɛ rː ɪ ʊ m	t ɛ rː ɛu m
t r ɛ m uː l ʊ m	t r ɛ m ʊ l ʊ m
k iː d j ʊ m	k iː d j ʊ m
r ɛ m a n ɛ r ɛ	r ɛ m a n eː r ɛ
n ʊ m t ɔ r j ʊ m	n oː t oː r j ʊ m
p r ɛ g ʊ s t a m r ɛ	p r aɪ g ʊ s t aː r ɛ
ɪ n t r oː ʊ t ʊ m	ɪ n t r ɔ ɪ t ʊ m
k ʊ n t aː r	k ɔ m p ʊ t aː r ɛ
k uː l p aː r	k ʊ l p aː r ɛ
k r ɪ w r aː r ɛ	k r iː b r aː r ɛ
k ʊ n t uː m aː k ɛ	k ɔ n t ʊ m aː k ɛ m
k ɛ f a l ɛ m aː	k ɛ pʰ a l aɪ a m
r ɛ w ɛ d ɛ r ɛ	r ɛ w ɪ d eː r ɛ
ɪ n k a n t aː r ɛ	ɪ ŋ k a n t aː r ɛ
s k aː p ʊ l a m	s k a p ʊ l a m
k a l iː f a	k a l iː pʰ a m
p a l p ɛ b r a l	p a l p ɛ b r aː l ɛ m
w ɔ m iː t aː r ɛ	w ɔ m ɪ t aː r ɛ
l uː p a n aː r ɛ	l ʊ p aː n a r
r iː g iː d ʊ m	r ɪ g ɪ d ʊ m
k ɔ n s ɪ l ɛ ʊ m	k oː n s ɪ l j ʊ m
rː ɛ d a r kʷ ɛ r	r ɛ d a r gʷ ɛ r ɛ
s ɔ m n ɔ l j ɛ n t ʊ m	s ɔ m n ɔ l ɛ n t ʊ m
iː n f l iː k t j oː n ɛ m	ɪ n f l ɪ k t j oː n ɛ m
a d iː k t j oː n ɛ	a dː ɪ k t j oː n ɛ m
s uː p ɛ r aː r ɛ	s ʊ p ɛ r aː r ɛ
d a n a m t ʊ m	d a m n aː t ʊ m
k ʊ lː ɛ g j ʊ m	k ɔ lː eː g j ʊ m
m a m t aː r ɛ	m a k t aː r ɛ
ɪ n d iː g ɛ n t a m	ɪ n d ɪ g ɛ n t j a m
g l a m k ʊ m	g l a k ɪ ɛ m
k ʊ n t r iː t ʊ m	k ɔ n t r iː t ʊ m
k ʊ m p a s iː b l ɛ	k ɔ m p a sː ɪ b ɪ l ɛ m
a k t ɔ r ɛ	a s t ʊ r ɛ m
t r a m m s f ʊ n d ɪ r ɛ	t r aː n s f ʊ n d ɛ r ɛ
a d k uː d ɪ k aː r ɛ	a d ɪ uː d ɪ k aː r ɛ
iː t iː n ɛ r aː r j ʊ m	ɪ t ɪ n ɛ r aː r j ʊ m
p iː k t uː r a m	p ɪ k t uː r a m
k ɛ m a r a m	k a m a r a m
k ɛ l ɛ s t j a l ɛ	k aɪ l ɛ s t j aː l ɛ m
d ɛ n uː d a t j ʊ m n ɛ m	d eː n uː d aː t j oː n ɛ m
k r ɛ t a m	k r eː t a m
l iː m eː n ɛ	l iː m ɛ n
h ɔ s t j a m	h ɔ s t j a m
a s t uː t j a m	a s t uː t j a m
a s ʊ p t j oː n ɛ m	a sː uː m p t j oː n ɛ m
