p r ɔ s ɛ g ɪ eː r ɛ	p r oː s ɛ kʷ iː
t r ɪ p l ʊ m	t r ɪ p l ʊ m
p r ɔ s t ɪ t uː ɪ r ɛ	p r oː s t ɪ t ʊ ɛ r ɛ
l eː k t ɪ k a m	l ɛ k t iː k a m
ɪ n ɛ b r j ɛ r ɛ	ɪ n eː b r j aː r ɛ
r ʊ ʊ m	r ʊ b ʊ m
m aː n ʊ m	m a ŋ n ʊ m
d eː w j a t j ʊ n ɛ m	d eː w j aː t j oː n ɛ m
ɪ n ʊ s t eː r ɛ	ɪ ŋ n oː s k ɛ r ɛ
f ʊ n d ɪ b uː lː ʊ m	f ʊ n d ɪ b ʊ l ʊ m
k ɔ n s ɪ l ʊ m	k ɔ ŋ k ɪ l j ʊ m
s ɔ m n ɪ f ɛ r ʊ m	s ɔ m n ɪ f ɛ r ʊ m
w ɪ b r a t j oː n ɛ m	w ɪ b r aː t j oː n ɛ m
r uː p ɛ m	r uː p ɛ m
s uː b l ɪ m a t j oː n ɛ m	s ʊ b l iː m aː t j oː n ɛ m
p ʊ l w eː r ɪ zː aː r ɛ	p ʊ l w ɛ r iː zː aː r ɛ
r eː m uː n eː r aː r ɛ	r ɛ m uː n ɛ r aː r ɛ
a s t w r ɪ ŋ g ɛ r ɛ m	a s t r ɪ ŋ g ɛ r ɛ
l a d r ɪ l ʊ m	l a t ɛ r k ʊ l ʊ m
r ɛ p r ɪ ɛ n d ɛ r ɛ	r ɛ p r ɛ h ɛ n d ɛ r ɛ
m ɛ r ɪ t ɛ r ɛ	m ɛ r eː r ɛ
b ɛ n ɛ d ɪ k ɛ r ɛ	b ɛ n ɛ d iː k ɛ r ɛ
k a n iː n ʊ m	k a n iː n ʊ m
s ɪ t j ʊ m	s ɪ t ʊ m
f ɪ l ɔ s ɔ f j a m	pʰ ɪ l ɔ s ɔ pʰ j a m
m ɪ r t ɪ lː ʊ m	m y r t ɪ lː ʊ m
p ɔ r t j oː n ɛ m	p ɔ r t j oː n ɛ m
m uː n ɪ k ɪ p j ʊ m	m uː n ɪ k ɪ p j ʊ m
a g a t a m	a kʰ aː t eː n
ɔ r ɪ g ɪ n aː r j ʊ m	ɔ r iː g ɪ n aː r j ʊ m
k eː m ɛ n t ʊ m	k aɪ m ɛ n t ʊ m
s ʊ b m ɛ r s j oː n ɛ	s ʊ mː ɛ r s j oː n ɛ m
d eː f ɛ n s j oː n ɛ m	d eː f eː n s j oː n ɛ m
j uː r ɪ s p r uː d ɛ n t j ɛ m	j uː r ɪ s p r uː d ɛ n t j a m
k ɔ m ɪ sː j oː n ɛ m	k ɔ mː ɪ sː j oː n ɛ m
b ɛ lː ʊ m	b ɛ lː ʊ m
a m s k ɔ n d ɛ r ɛ	a b s k ɔ n d ɛ r ɛ
w ɛ r t ɛ r ɛ	w ɛ r t ɛ r ɛ
b a l t ɪ k ʊ m	b a l t ɪ k ʊ m
l ɪ t w ɛ r ɛ m	l ɛ k t w aː r j ʊ m
eː n eː r w aː r ɛ	eː n ɛ r w aː r ɛ
t a r d ɪ m	t a r d ʊ m
a m s k ʊ n s ʊ m	a b s k ɔ n s ʊ m
b ɔ r sː a m	b ʊ r s a m
a d ʊ ŋ k t j oː n ɛ m	a d j ʊ ŋ k t j oː n ɛ m
ɔ rː d ʊ m	h ɔ rː ɪ d ʊ m
r ɛ p ɛ lː ɛ r ɛ	r ɛ p ɛ lː ɛ r ɛ
p r ɪ s j oː n ɛ m	p r ɛ h ɛ n s j oː n ɛ m
a fː ɛ k t j oː n ɛ m	a fː ɛ k t j oː n ɛ m
k ʊ k ʊ m	k ɔ kʷ ʊ m
d j ɛ k ɪ m aː r ɛ	d ɛ k ɪ m aː r ɛ
a r k ɪ b ɪ s k ʊ p ʊ ʊ m	a r kʰ ɪ ɛ p ɪ s k ɔ p ʊ m
d ɪ sː w aː ɪ d ɛ r ɛ	d ɪ sː w aː d eː r ɛ
p a lː uː s t r ʊ m	p a l uː s t r ɛ m
ɛ k s p uː l sː aː r ɛ	ɛ k s p ʊ l s aː r ɛ
p ʊ r p ʊ r a m	p ʊ r p ʊ r a m
ɪ n s uː l aː r ɛ	iː n s ʊ l aː r ɛ m
ɪ n f ɪ m ʊ m	iː n f ɪ m ʊ m
t ɔ p sː ɪ k aː r ɛ	t ɔ k s ɪ k aː r ɛ
l ɪ m ɪ t r ʊ f ʊ m	l iː m ɪ t r ɔ pʰ ʊ m
ɪ n g ʊ k t j ʊ n ɛ m	ɪ n j ʊ ŋ k t j oː n ɛ m
p r eː t ɛ k s t aː r ɛ	p r aɪ t ɛ k s ɛ r ɛ
b ʊ t ɪ k a m	a p ɔ tʰ eː k a m
ɔ fː ɪ k ɪ n a m	ɔ fː ɪ k iː n a m
p a n a k a m	p a n a k eːa m
m a k n aː t ɛ m	m a ŋ n aː t ɛ m
p r eː p ɔ r ɛ m	p r aɪ p oː n ɛ r ɛ
k ʊ p l a m	k oː p ʊ l a m
r a s uː r a m	r aː s uː r a m
s p uː r j ʊ m	s p ʊ r j ʊ m
d ʊ l ɔ s ʊ m	d ɔ l oː s ʊ m
k aː ɪ t aː r ɛ m	k ɔ a k t aː r ɛ
k ʊ k ɪ n a m	k ɔ kʷ iː n a m
s t ʊ r n ɛ k ʊ m	s t ʊ r n ʊ m
p aː s t ʊ m	p aː s t ʊ m
ɪ n w ɛ s t iː r ɛ	ɪ n w ɛ s t iː r ɛ
ɪ m aː g ɪ n ɛ	ɪ m aː g ɪ n ɛ m
a w ɛ lː ɪ n a m	a b ɛ lː a n a m
k r uː d ɛ l ɛ	k r uː d eː l ɛ m
t a b ɛ r n a m	t a b ɛ r n a m
ɪ k ʊ m	ɪ k ʊ m
f oː k a m	pʰ oː k a m
a m ɛ n t ʊ m	aː m ɛ n t ʊ m
k ɔ n s ɔ r t ɛ m	k oː n s ɔ r t ɛ m
a b j uː r aː r ɛ	a b ɪ uː r aː r ɛ
n eː g l ɪ g ɛ r ɛ	n ɛ g l ɛ g ɛ r ɛ
aɪ t j a m	ɪ t j a m
ɪ n t ɛ r k eː d ɛ r ɛ	ɪ n t ɛ r k eː d ɛ r ɛ
p r eː k eː d ɛ r ɛ	p r aɪ k eː d ɛ r ɛ
s a l uː t aː r ɛ	s a l uː t aː r ɛ m
k a m b j ʊ m	k a m b j ʊ m
p r ɔ t ɛ s t aː r ɛ	p r oː t ɛ s t aː r iː
k ɔ k ʊ m ɛ r ʊ m	k ʊ k ʊ m ɛ r ɛ m
k uː t aː r a m	k uː n a m
a gː r ɛ d ɛ r ɛ	a gː r ɛ d iː
p ɛ r k ɔ l a t j ʊ n ɛ m	p ɛ r k oː l aː t j oː n ɛ m
w ɛ s t ɪ t ʊ m	w ɛ s t iː t ʊ m
d eː t ɛ s t aː r ɛ	d eː t ɛ s t aː r iː
l a p ɪ d aː r ɛ	l a p ɪ d aː r ɛ
r ɛ b ɛ lː aː r ɛ	r ɛ b ɛ lː aː r ɛ
ɪ b eː r iː w eː t ɛ r ɛ	ɛ fː ɛ r w eː s k ɛ r ɛ
ɛ k s t ɛ r m ɪ n a t j oː n ɛ m	ɛ k s t ɛ r m ɪ n aː t j oː n ɛ m
m ɛ d j ʊ m	m ɛ d j ʊ m
ɛ k s eː k r aː r ɛ	ɛ k sː ɛ k r aː r iː
p a t r ʊ k ɪ n j ʊ m	p a t r oː k ɪ n j ʊ m
g ɪ b ɛu m	g ɪ bː ʊ m
a m ɛ n ɪ t aː t ɛ m	a m ɔ ɪ n ɪ t aː t ɛ m
p uː d ɪ k ʊ m	p ʊ d iː k ʊ m
w ɪ d uː ɪ t ɛ m	w ɪ d ʊ ɪ t aː t ɛ m
t ɛ r g ɪ w ɛ r s aː r ɛ	t ɛ r g ɪ w ɛ r s aː r iː
p l a g j aː r ɛ	p l a g j aː r ɛ
l a s ʊ m	l a sː ʊ m
g r aː t ɛ m	k r aː t ɛ m
l ɪ t uː r g j a m	l iː t uː r g j a m
s a k r a m ɛ n t a l ɛ	s a k r aː m ɛ n t aː l ɛ m
aʊ d ɪ t ʊ m	aʊ d iː t ʊ m
a lː eː g aː r ɛ	a lː ɛ g ɛ r ɛ
p aː w ɪ d ʊ m	p a w ɪ d ʊ m
s aː ŋ ŋ ɪ r aː r ɛ	s a ŋ gʷ ɪ n aː r ɛ
m a t r ɪ k ʊ l a m	m aː t r iː k ʊ l a m
r ɛ s t aː r ɛ	r ɛ s t aː r ɛ
h ɛ lː ʊ m	ɛ lː ʊ m
a s t uː t j a m	a s t uː t j a m
f eː t ɔ r ɛ	f eː t oː r ɛ m
r ɛ t r a k t j oː n ɛ m	r ɛ t r a k t j oː n ɛ m
n aː t ʊ m	n aː t ʊ m
l ɛ n t ʊ m	l ɛ n t ʊ m
k ɛ r w ɛ s a m	k ɛ r w ɪ s j a m
t ʊ r p ɪ d ʊ m	t ʊ r p ɛ m
ɔ n aː g r ʊ m	ɔ n a g r ʊ m
k aː n a m	k a nː a m
k r ɛ p r a t uː r a m	k r ɛ p aː t uː r a m
ɛ k s ɪ g ʊ m	ɛ k s ɪ gʷ ʊ m
p ɛ k ʊ r a m	p ɛ k ʊ s
t ɛ m p ɛ r j eː ɛ	t ɛ m p ɛ r ɪ ɛ m
ɛ k s eː k r a t j ʊ n ɛ m	ɛ k sː eː k r aː t j oː n ɛ m
a m a l g a m a m	a m a l g a m a
m a ŋ n ɛ s j ʊ m	m a ŋ n eː s j ʊ m
r ɛ t r ɔ k eː d ɛ r ɛ	r ɛ t r oː k eː d ɛ r ɛ
g eː n t ɪ l ɪ t aː t ɛ m	g ɛ n t iː l ɪ t aː t ɛ m
m eː s a m	m eː s a m
s uː b r ɛ r s b ʊ m	s uː b ɛ r ɛ m
eː w ɔ l k j w ɛ r ɛ	eː w ɔ l w ɛ r ɛ
g r a n aː t ʊ m	g r aː n aː t ʊ m
k ɪ t eː r j oː r ɛ	k ɪ t ɛ r j oː r ɛ m
n ɔ k ɪ w ʊ m	n ɔ k iː w ʊ m
p r iː n k ɪ p a l ɪ t aː t ɛ m	p r ɪ ŋ k ɪ p aː l ɪ t aː t ɛ m
k ʊ l p a m	k ʊ l p a m
d eː l iː n kʷ ɛ r ɛ	d eː l ɪ ŋ kʷ ɛ r ɛ
t ɔ r kʷ ɛ r ɛ	t ɔ r kʷ eː r ɛ
d ɪ ŋ n aː r ɛ	d ɪ ŋ n aː r ɛ
a s p ʊ r t a r ɛ	a s p ɔ r t aː r ɛ
k ɔ n t a m ɪ n a t j oː n ɛ m	k ɔ n t aː m ɪ n aː t j oː n ɛ m
ɪ n f l a m a t j oː n ɛ m	iː n f l a mː aː t j oː n ɛ m
ɪ n k a p aː kʷ ɛ	ɪ ŋ k a p aː k ɛ m
p ʊ l sː aː r ɛ	p ʊ l s aː r ɛ
l ɛ p ʊ r a m	l ɛ p r a m
ɪ n t ɛ m p ɛ s t ɪ p ɪ t aː t ɛ m	ɪ n t ɛ m p ɛ s t iː w ɪ t aː t ɛ m
k ɛ r iː t ɪ n aː r ɛ	k ɪ r k ɪ n aː r ɛ
ɪ mː a t uː r ɪ t aː t ɛ m	ɪ mː aː t uː r ɪ t aː t ɛ m
ʊ l ʊ m	ʊ l ʊ m
p r ɔ b ʊ m	p r ɔ b ʊ m
d aː r ɔ r ɛ m	f ɔ r j a m
p ɛ s aː r ɛ	p eː n s aː r ɛ
m ɔ s t r aː r ɛ	m oː n s t r aː r ɛ
f ɛ a b r ɪ k aː r ɛ	f a b r ɪ k aː r ɛ
w a lː eː t ʊ m	w a lː ɛ tː ʊ m
t eː m ɔ r ɛ m	t ɪ m oː r ɛ m
t r aː m eː t ɛ r ɛ m	t r aː m ɪ tː ɛ r ɛ
d eː l ɛ k t a t j oː n ɛ m	d eː l ɛ k t aː t j oː n ɛ m
t r a n s g r ɛ d ɪ r ɛ	t r aː n s g r ɛ d iː
k ɔ n t ɛ s t aː r ɛ	k ɔ n t ɛ s t aː r iː
p uː b l ɪ k ʊ m	p uː b l ɪ k ʊ m
k ɔ n t r ɪ s t aː r ɛ	k ɔ n t r iː s t aː r ɛ
p r oː k s ɪ m ʊ m	p r ɔ k s ɪ m ʊ m
l uː k ɪ f ɛ r ʊ m	l uː k ɪ f ɛ r ʊ m
f a j a m	f aː g ɛ a m
w ɔ l uː b ɪ l ɛ m	w ɔ l uː b ɪ l ɛ m
w ʊ l p ɛ m	w ʊ l p ɛ m
p l aː g j ʊ m	p l a g j ʊ m
f ɔ r ʊ m	f ɔ r ʊ m
k ɛ l eː s t j a l ɛ	k aɪ l ɛ s t j aː l ɛ m
k ɔ n s ɔ l a t j oː n ɛ m	k oː n s oː l aː t j oː n ɛ m
eː m a n k ɪ p a t j oː n ɛ m	eː m a ŋ k ɪ p aː t j oː n ɛ m
ɔ r k ɛ s t r a m	ɔ r kʰ eː s t r a m
k j ɛ r t ʊ m	k ɛ r t ʊ m
k ʊ r t ɛ m	k ɔ h ɔ r t ɛ m
m a s k ʊ l iː n ʊ m	m a s k ʊ l iː n ʊ m
d a n t ʊ m	d a m n aː t ʊ m
k a r n ɪ f ɪ k ɛ m	k a r n ɪ f ɪ k ɛ m
n a rː aː r ɛ	n a rː aː r ɛ
ɪ m p r ɔ b ɪ t aː t ɛ m	ɪ m p r ɔ b ɪ t aː t ɛ m
ɔ t r ɛ m	ʊ t r ʊ m
g r a t aː g ɪ t ʊ m	g r aː t ʊ iː t ʊ m
ɔ b sː eː r w aː r ɛ	ɔ b s ɛ r w aː r ɛ
d ɪ s t ɪ lː a t j ʊ n ɛ m	d ɪ s t ɪ lː a t j oː n ɛ m
m ɪ ŋ ŋ t aː r aː m	m ɛ n t ʊ l a m
p a r t ɪ t j oː n ɛ m	p a r t iː t j oː n ɛ m
l ɔ k uː t oː r ɛ	l ɔ k uː t oː r ɛ m
s ɛ r aː f ɪ k ʊ m	s ɛ r a pʰ ɪ k ʊ m
ɔ m ɪ k ɪ d j ʊ m	h ɔ m ɪ k iː d j ʊ m
k r ɪ t ɪ k ʊ m	k r ɪ t ɪ k ʊ m
s a k ɛ r d ɔ t j ʊ m	s a k ɛ r d oː t j ʊ m
p a l j ʊ r ʊ m	p a l ɪ uː r ʊ m
ɪ n mː ɔ l aː r ɛ	ɪ mː ɔ l aː r ɛ
f ɛ b ʊ l ɛ m	f l eː b ɪ l ɛ m
s t ʊ l t ʊ m	s t ʊ l t ʊ m
k a l a m ɪ t ɔ s ʊ m	k a l a m ɪ t oː s ʊ m
a s ɛ t aː t ɛ m	a s eː ɪ t aː t ɛ m
a sː ɪ d eː r ɪ ɛ	a sː ɪ d eː r ɛ
m uː k oː s ʊ m	m uː k oː s ʊ m
p ɛ d ɪ k ɛ lː ʊ m	p ɛ d iː k ɛ lː ʊ m
s k ɪ r n ʊ m	s k ɪ r p ʊ m
r uː ɛ r ɛ	r ʊ ɛ r ɛ
ɪ m b eː k ɪ lː ɛ	ɪ m b eː k ɪ lː ʊ m
k ɔ lː ɛ k t j oː n ɛ m	k ɔ lː eː k t j oː n ɛ m
f a k ɛ t j ʊ m	f a k eː t ʊ m
k a r m ɪ n aː r ɛ	k a r m ɪ n aː r ɛ
ɪ n mː a r k ɛ s ɪ b ɪ l ɛ m	ɪ mː a r k ɛ s k ɪ b ɪ l ɛ m
p a t ɛ r iː n ʊ m	p a t ɛ r n ʊ m
a b d uː k ɛ r ɛ	a b d uː k ɛ r ɛ
l ɪ k ɛ n	l iː kʰ eː n a
r ɛ k ɔ n k ɪ l j aː r ɛ	r ɛ k ɔ ŋ k ɪ l j aː r ɛ
l ɪ b ɛ r a t oː r ɛ	l iː b ɛ r aː t oː r ɛ m
ɪ n t ɛ m p ɛ s t ɪ w ʊ m	ɪ n t ɛ m p ɛ s t iː w ʊ m
k ɔ n d eː n s a t j oː n ɛ m	k ɔ n d eː n s aː t j oː n ɛ m
k r ɛ s p ʊ m	k r ɪ s p ʊ m
k a r b ʊ n k ʊ l ʊ m	k a r b ʊ ŋ k ʊ l ʊ m
b ʊ k sː ʊ m	b ʊ k s ʊ m
a l t ɪ sː ɪ m ʊ m	a l t ɪ sː ɪ m ʊ m
ɪ t aː t ɛ m	ɪ t aː t ɛ m
m eː s t ɪ k ʊ m	m ɪ k s t iː k j ʊ m
f ɛ l j aː s t r ʊ m	f iː l j a s t r ʊ m
ɪ n d ʊ l ɛ m	ɪ n d ɔ l ɛ m
ɪ t uː d ɪ n ɛ m	t uː d ɪ n ɛ m
k a r ʊ t w a m	k a r oː t a m
k j uː pʰ b oː n ɛ m	k l aʊ d ɛ r ɛ
r a s ɛ n aː r ɛ	r ɛ s ɪ ŋ n aː r ɛ
k iː n d ɛ l ɛ m	k a n d eː l a m
a m p ɔ lː a m	a m p ʊ lː a m
p a g uː r ʊ m	p a g uː r ʊ m
l uː k j ʊ m	l uː k j ʊ m
s eː n ɛ m	s ɛ n ɛ m
aʊ s p eː d aː r ɛ	h ɔ s p ɪ t aː r iː
s ɪ m p l ɪ k ɛ m	s ɪ m p l ɪ k ɛ m
s uː b ɪ t ʊ m	s ʊ b ɪ t ʊ m
p a w oː r	p a w oː r ɛ m
p ɛ d ɛ s t r ɛ m	p ɛ d ɛ s t r ɛ m
k r eː w ɛ n t j a m	k r eː d ɛ n t j a m
p l ɔ b k ɔ s ʊ m	p l ʊ w j oː s ʊ m
a n a l ʊ m	a nː aː l ɛ m
r eː t ɪ n a k ʊ lː ʊ m	r ɛ t ɪ n aː k ʊ l ʊ m
w ɛ ŋ d ɪ ŋ a t oː r ɛ	w ɪ n d ɪ k aː t oː r ɛ m
aʊ r ɪ k ʊ l a m	aʊ r ɪ k ʊ l a m
ɪ n t r ɔ ɪ t ʊ m	ɪ n t r ɔ ɪ t ʊ m
d eː s t ɛ ŋ d eː r ɛ	d eː s k ɛ n d ɛ r ɛ
r ɛ l ɪ kʷ j a m	r eː l ɪ kʷ j aː s
r ɛ s t ɪ t uː ɪ r ɛ	r ɛ s t ɪ t ʊ ɛ r ɛ
a pː ɛ n d ɛ r ɛ	a pː ɛ n d ɛ r ɛ
ɪ m p ɛ r j ʊ m	ɪ m p ɛ r j ʊ m
a k t ʊ w a l ɛ	a k t w aː l ɛ m
l a k t ɪ k ɪ n j ʊ m	l a k t ɪ k iː n j ʊ m
a pː a r aː r ɛ	a pː a r aː r ɛ
ɪ n t eː g r aː r ɛ	ɪ n t ɛ g r aː r ɛ
d eː t ɛ s t a t j oː n ɛ m	d eː t ɛ s t aː t j oː n ɛ m
s uː sː uː rː ʊ m	s ʊ s ʊ rː ʊ m
ɛ k ɪ k a r ɪ s t j a m	ɛu kʰ a r ɪ s t j a m
k r eː s p aː r ɛ	k r ɪ s p aː r ɛ
k ɔ n s ɪ s t ɛ r ɛ	k oː n s ɪ s t ɛ r ɛ
m ɛ n d aː k ɛ m	m ɛ n d aː k ɛ m
l a r w a m	l aː r w a m
ɛ l ɛ n k ʊ m	ɛ l ɛ ŋ kʰ ʊ m
t ɛ m eː r ɪ t aː t ɛ m	t ɛ m ɛ r ɪ t aː t ɛ m
s eː kʷ aː k ɛ	s ɛ kʷ aː k ɛ m
f ɪ l ʊ m	f l ʊ k t ʊ m
ɪ p n oː t ɪ k ʊ m	h y p n oː t ɪ k ʊ m
s ɪ r w ɛ n t ɛ m	s ɛ r w ɪ ɛ n t ɛ m
p ɛ r ɪ k ʊ l oː s ʊ m	p ɛ r iː k ʊ l oː s ʊ m
a lː uː k k ɛ	h a lː ʊ m
eː n uː m eː r aː r ɛ	eː n ʊ m ɛ r aː r ɛ
d ɔ r aː r ɛ	d ɛ aʊ r aː r ɛ
s p ɛ t ɪ m ɛ n	s p ɛ k ɪ m ɛ n
a w ɔ l ʊ m	a w ʊ l ʊ m
ɛ k s ɪ g ɛ r ɛ	ɛ k s ɪ g ɛ r ɛ
p r ʊ k aː k ɛ	p r ɔ k aː k ɛ m
k a r d ɪ n ɛ m	k a r d ɪ n ɛ m
s eː r w aː r ɛ	s ɛ r w aː r ɛ
s kʷ aː l ʊ m	s kʷ aː l ʊ m
uː r b ɛ m	ʊ r b ɛ m
d j ɛ f ɪ r ʊ m	z ɛ pʰ y r ʊ m
k ɔ r n ɛ ʊ m	k ɔ r n ɛu m
k a t eː k ɪ d zː aː r ɛ	k a t eː kʰ iː zː aː r ɛ
k ɪ p r ɛ ɛ k ɛ m	k ʊ p r ɛ sː ʊ m
a k t aː r ɛ	aː k t w aː r ɛ
f a l s aː r ɛ	f a l s aː r ɛ
t ʊ r p ɛ d ʊ m	t ɔ r p eː d ɪ n ɛ m
s ɔ l aː r ɛ	s oː l aː r ɛ m
s ɛ p t ɛ n t r j oː n ɛ m	s ɛ p t ɛ n t r j oː n ɛ m
n a rː a t j oː n ɛ m	n aː rː aː t ʊ m
a sː ɪ ŋ n aː r ɛ	a sː ɪ ŋ n aː r ɛ
h ɔ s t j a m	h ɔ s t j a m
m ɔ t j oː n ɛ m	m oː t j oː n ɛ m
k r ʊ lː r ɛ	k ɔ rː ʊ ɛ r ɛ
k ɔ rː ɔ d ɛ r ɛ	k ɔ rː oː d ɛ r ɛ
a gː l ʊ m eː r aː r ɛ	a gː l ɔ m ɛ r aː r ɛ
w ɛ r t ɪ g ɛ n ɛ	w ɛ r t iː g ɪ n ɛ m
r ɛ n oː s ʊ m	a r eː n oː s ʊ m
g eː ɔ g r a f ɪ k ʊ m	g ɛ oː g r a pʰ ɪ k ʊ m
r eː s uː s k ɪ t a t j oː n ɛ m	r ɛ s ʊ s k ɪ t aː t j oː n ɛ m
aʊ k s ɪ l j aː r ɛ	aʊ k s ɪ l j aː r ɛ m
l uː d ɪ b r j ʊ m	l uː d iː b r j ʊ m
p r ɔ m uː l g a t j oː n ɛ m	p r oː m ʊ l g aː t j oː n ɛ m
a k t ɪ w ʊ m	aː k t iː w ʊ m
ɔ p uː l ɛ n t ʊ m	ɔ p ʊ l ɛ n t ʊ m
g r a t ɪ t ɛ m	g r aː t ɪ t uː d ɪ n ɛ m
s ʊ b ɪ t aː n ɛ ʊ m	s ʊ b ɪ t aː n ɛu m
s ɪ r iː k ʊ m	s eː r ɪ k ʊ m
ɔ b eː d eː t ɛ r ɛ	ɔ b ɔ ɪ d iː r ɛ
p r ɛ t eː r ɪ r ɛ	p r aɪ t ɛ r iː r ɛ
d ɛ s k r ɪ p t j oː n ɛ m	d eː s k r iː p t j oː n ɛ m
s t r ɔ p ʊ m	s t r ɔ pː ʊ m
a l ɔ s ɛ m	a l aʊ s a m
w ʊ l t aː r ɛ	w ɔ l uː t aː r ɛ
ɪ n f l ɪ k t j oː n ɛ m	ɪ n f l ɪ k t j oː n ɛ m
r ɛ f r ɪ g ɛ r j ʊ m	r eː f r iː g ɛ r j ʊ m
k ɔ n k ɪ s ʊ m	k ɔ ŋ k ɪ d ɛ r ɛ
a n eː g aː r ɛ	eː n ɛ k aː r ɛ
b a s ɪ l ɪ k ʊ m	b a s ɪ l ɪ k ʊ m
ɔ l ɛ aː t ʊ m	ɔ l ɛ aː t ʊ m
kʷ iː n t ʊ m	kʷ iː n t ʊ m
m ɛ t r ɛ k ʊ m	m ɛ t r ʊ m
k ɔ n t r a d ɪ k t oː r ɛ	k ɔ n t r aː d ɪ k t oː r ɛ m
s uː b uː g aː r ɛ	s ʊ b j ʊ g aː r ɛ
p a t ɪ k ɛ r ɛ	p a t iː
w ɔ r t ɪ k k ɛ m	w ɔ r t ɪ k ɛ m
a d ɔ r m ɛ r ɛ	a dː ɔ r m iː r ɛ
n uː k ɪ r ɛ	n ɔ k eː r ɛ
ɪ n w ɪ t a t j oː n ɛ m	ɪ n w ɪ t aː t j oː n ɛ m
a b ɪ g ɪ ʊ m	a b ɪ g ɛu m
n uː m eː r ʊ s ɪ t aː t ɛ m	n ʊ m ɛ r oː s ɪ t aː t ɛ m
r ɛ d a r gʷ ɛ r ɛ	r ɛ d a r gʷ ɛ r ɛ
a t r ɪ b uː t j ɔ n ɛ	a tː r ɪ b uː t j oː n ɛ m
d eː s p eː r ɛ k ɪ r ɛ	d ɪ s p ɛ r iː r ɛ
k ɔ ŋ g uː r aː r ɛ	k ɔ n ɪ uː r aː r ɛ
kʷ a d r a g ɛ s ɪ m ʊ m	kʷ aː d r aː g eː s ɪ m ʊ m
n ɛ f aː n d ʊ m	n ɛ f a n d ʊ m
t r aː t aː t ʊ m	t r a k t aː t ʊ m
k aː s ʊ m	k aː s ʊ m
s ʊ ɪ m ɛ t ɛ r ɛ	s ʊ mː ɪ tː ɛ r ɛ
a k t ʊ m	aː k t ʊ m
a b n ʊ ɪ r ɛ	a b n ʊ ɛ r ɛ
s ɔ l ʊ m	s ɔ l ʊ m
k a m n ɛ k t ʊ m	k aː n uː t ʊ m
b aː r a t r ʊ m	b a r a tʰ r ʊ m
t j ɛ r t j ʊ m	t ɛ r t j ʊ m
ɛ k s p l ɪ k a t j oː n ɛ m	ɛ k s p l ɪ k aː t j oː n ɛ m
d ɪ s k ʊ r s ɪ w ʊ m	d ɪ s k ʊ r s iː w ʊ m
r ɛ k uː s aː r ɛ	r ɛ k uː s aː r ɛ
k aː n kʷ ɛ r ʊ m	k a ŋ k r ʊ m
a w j ɛ sː ʊ m	aː w ɛ r s ʊ m
a m ɪ k a m	a m iː k a m
l uː k uː b r a t j oː n ɛ m	l uː k ʊ b r aː t j oː n ɛ m
w ɛ n d ɛ m j aː r ɛ	w iː n d eː m j aː r ɛ
p ɛ r p eː t r aː r ɛ	p ɛ r p ɛ t r aː r ɛ
a m a t ɔ r j ʊ m	a m aː t oː r j ʊ m
s ʊ r d ʊ m	s ʊ r d ʊ m
t ɪ t ʊ l aː r ɛ	t ɪ t ʊ l aː r ɛ m
w oː l eː r ɛ	w ɛ lː ɛ
ɔ r b ɪ t ɛ m	ɔ r b ɛ m
h ɔ r t ʊ m	h ɔ r t ʊ m
k a l ɔ s t r ʊ m	k ɔ l ɔ s t r a m
s k ʊ rː ɛ r ɛ	ɛ k s k ʊ rː ɛ r ɛ
w ɛ r t ɪ g ɪ n oː s ʊ m	w ɛ r t iː g ɪ n oː s ʊ m
n aʊ f r a g aː r ɛ	n aʊ f r a g aː r ɛ
uː b ɪ k a t j oː n ɛ m	ʊ b ɪ k aː t j oː n ɛ m
a k t r ɪ k ɛ	aː k t r iː k ɛ m
r ɛ w eː r ɛ n t ɛ m	r ɛ w ɛ r ɛ n t ɛ m
w ɪ n aː k j a m	w iː n aː k ɛu m
ɪ f ɪ k r ɛ	ɪ f ɪ k aː r ɛ
k a t ʊ m	k aʊ t ʊ m
s t iː n d ɛ r ɛ	s k ɪ n d ɛ r ɛ
a b r ɔ t a n ʊ m	a b r ɔ t ɔ n ʊ m
ɛ k s ɪ s t ɛ r ɛ	ɛ k s ɪ s t ɛ r ɛ
f r ɔ n t a l ɛ	f r ɔ n t aː l ɛ m
m ʊ r ɛ n a m	m ʊ r eː n a m
m ɛ d ɪ k ɪ n a l ɛ	m ɛ d ɪ k iː n aː l ɛ m
p a r s ɪ m oː n j a m	p a r s ɪ m oː n j a m
p r ɔ l ɛ m	p r oː l ɛ m
p r ɔ m ɛ sː a m	p r oː m ɪ sː ʊ m
k a l k ʊ l ʊ m	k a l k ʊ l ʊ m
b l aː n d ɪ t j a m	b l a n d ɪ t j a m
k r ɛ t ɪ k ʊ l a m	k r aː t ɪ k ʊ l a m
ɛ k s aʊ r ɪ r ɛ	ɛ k s h aʊ r iː r ɛ
t r a n s p oː r ɛ m	t r aː n s p oː n ɛ r ɛ
k ʊ k ʊ lː a m	k ʊ k ʊ lː a m
n aʊ s ɪ aː b ʊ n d ʊ m	n aʊ s ɛ aː b ʊ n d ʊ m
t r a n s ɪ t ʊ m	t r aː n s ɪ t ʊ m
s p eː r aː r ɛ	s p eː r aː r ɛ
a n ɪ k ɪ l a t j oː n ɛ m	a nː ɪ h ɪ l aː t j oː n ɛ m
l ɛ n ɛ m	l eː n ɛ m
sː kː ɔ aː k ɛ r ɛ	ɛ k s k ɔ kʷ ɛ r ɛ
a b sː ɔ l uː t j oː n ɛ m	a b s ɔ l uː t j oː n ɛ m
s uː t uː r a m	s uː t uː r a m
w ɪ t ɛ lː ʊ m	w ɪ t ɛ lː ʊ m
ɪ n t ɛ n t j oː n ɛ m	ɪ n t ɛ n t j oː n ɛ m
w aː l ɛ aː r ɛ	w ɪ g ɪ l aː r ɛ
s a l uː t a t j oː n ɛ	s a l uː t aː t j oː n ɛ m
kʷ a l ɪ t aː t ɛ m	kʷ aː l ɪ t aː t ɛ m
ɪ m p a r t ɪ r ɛ	ɪ m p a r t iː r ɛ
ɪ n k uː l k aː r ɛ	ɪ ŋ k ʊ l k aː r ɛ
p ɪ s k ʊ p ʊ aː d ʊ m	ɛ p ɪ s k ɔ p aː t ʊ m
j ɛ ɛ m a l ɛ	h ɪ ɛ m aː l ɛ m
a d ɔ n k ʊ m	a d ʊ ŋ k ʊ m
a g r ɛ s t ɛ m	a g r ɛ s t ɛ m
a d ɪ r ɛ	a d iː r ɛ
