g l aʊ k ʊ m	g l aʊ k ʊ m
b ɔ w aː r ʊ m	b ɔ w aː r j ʊ m
a oː s a m	aː n s a m
k ɪ ŋ t ʊ m	k ɪ ŋ k t ʊ m
k r eː s p aː r ɛ	k r ɪ s p aː r ɛ
k eː d ɛ r ɛ	k eː d ɛ r ɛ
p ɔ n d ɛ r aː r ɛ	p ɔ n d ɛ r aː r ɛ
t ɛ rː ɛ ʊ m	t ɛ rː ɛu m
k a r aː k t ɛ r ɛ	kʰ a r a k t eː r ɛ m
a g aː r ɪ k ʊ m	a g a r ɪ k ʊ m
s ɛ k s t ʊ m	s ɛ k s t ʊ m
s k ɔ p aː r ɛ	s k ɔ p ɛ r ɛ
r ɛ k l aː m aː r ɛ	r ɛ k l aː m aː r ɛ
l ɪ n t ɪ r n a m	l a n t ɛ r n a m
d ɛ w oː w ʊ r ɛ	d eː w ɔ w eː r ɛ
m a n ʊ m	m a ŋ n ʊ m
k a m b r oː n ɛ m	k r aː b r oː n ɛ m
a b aɪ ɛ ɪ a m	a p ɪ k ʊ l a m
a l ɔ k aː r ɛ	a lː ɔ k aː r ɛ
g r a n aː t ʊ m	g r aː n aː t ʊ m
k eː k ʊ m	k aɪ k ʊ m
s p oː s ʊ m	s p oː n s ʊ m
r ɛ w ɔ k aː r ɛ	r ɛ w ɔ k aː r ɛ
s ʊ n s b t ʊ m	s uː m p t ʊ m
ɪ m p r ɔ b ʊ m	ɪ m p r ɔ b ʊ m
kʷ ɛ s t j oː n ɛ m	kʷ aɪ s t j oː n ɛ m
k a kʰ ɛ n ɔ aː r ɛ	k a t eː n aː r ɛ
k ɔ s k ʊ m	k ɔ k s ʊ m
a b g uː r aː t j oː n ɛ m	a b ɪ uː r aː t j oː n ɛ m
ɪ n t ɛ r p iː n m ɛ r ɛ m	ɪ n t ɛ r p ʊ ŋ g ɛ r ɛ
k ɔ p t ʊ r a m	k ɔ k t uː r a m
ɪ n w ɛ n t r ɪ t ɛ	ɪ n w ɛ n t r iː k ɛ m
h eː m uː k ɛ k p l j eː r ɛ	eː m ɔ w eː r ɛ
ɔ pː r ɔ b j ʊ m	ɔ pː r ɔ b r j ʊ m
w ɪ n aː t a m	w iː n aː k ɛu m
d ɔ k t oː r ɛ	d ɔ k t oː r ɛ m
p ʊ t r ɛ m	p ʊ t r ɛ m
ɛ k s ɪ t ʊ m	ɛ k s ɪ t ʊ m
w ɪ t uː p eː r aː t j oː n ɛ m	w ɪ t ʊ p ɛ r aː t j oː n ɛ m
k a r p ɛ n t ʊ m	k a r p ɛ n t ʊ m
p r ɛ s aː g j aː r ɛ	p r aɪ s aː g iː r ɛ
f a k ɪ l ɪ t aː t ɛ m	f a k ɪ l ɪ t aː t ɛ m
ɔ m ɛ n t ʊ m	oː m ɛ n t ʊ m
b uː b ɔ n ɪ k ʊ m	b uː b oː n ɪ k ʊ m
ɔ r t ʊ g r aː f j ʊ m	ɔ r tʰ ɔ g r a pʰ j a m
f ɔ k ɛ m	f aʊ k ɛ m
ɪ n d ɔ l ɛ m	ɪ n d ɔ l ɛ m
s y s ʊ m	s ɛ sː ʊ m
s p ɔ l j ʊ m	s p ɔ l j ʊ m
k aʊ h t j oː n ɛ m	k aʊ t j oː n ɛ m
f ɛ n ɛ s t r a m	f ɛ n ɛ s t r a m
k ʊ lː ɛ r a m	kʰ ɔ l ɛ r a m
n a w ʊ m	n aː w ɛ m
m a s k l ʊ m	m a s k ʊ l ʊ m
ɪ n s ɪ n w r ɛ	iː n s ɪ n w aː r ɛ
f r uː ɪ r ɛ m	f r ʊ iː
s ɛ n ɛ m	s ɛ n ɛ m
k l ɔ s ʊ l a m	k l aʊ s ʊ l a m
k ɔ r j aː k ɛu ʊ m	k ɔ r j a k ɛu m
l uː k j ɪ d	l uː k ɪ d ʊ m
a k k ɛ d ɛ r ɛ	a kː eː d ɛ r ɛ
a r k j a m	a r kʰ j a m
f ɪ r m ɛ m	f ɪ r m ʊ m
m uː s k ʊ l aː r ɛ	m uː s k ʊ l aː r ɛ m
ɔ fː aɪ r t oː r j ʊ m	ɔ fː ɛ r t oː r j ʊ m
s aɪ l w a m	s ɪ l w a m
p l aː sː ʊ m aː r ɛ	p l a s m aː r ɛ
b ɔ r s a m	b ʊ r s a m
ɪ n k ɔ l a m	ɪ ŋ k ɔ l a m
k ɔ n s oː n aː r ɛ	k oː n s ɔ n aː r ɛ
l a r t ʊ m	l a r d ʊ m
j uː m ɛ n t ʊ m	j uː m ɛ n t ʊ m
a l n oː m	a l n ʊ m
m ɛ d ɪ oː k r ɛ m	m ɛ d ɪ ɔ k r ɛ m
s t r j a m	s t r j a m
p l aː k ɪ d ʊ m	p l a k ɪ d ʊ m
j ʊ w ɛ n k a m	j ʊ w ɛ ŋ k a m
n a t aː l ɛ m	n aː t aː l ɛ m
s uː p uː t aː r ɛ	s ʊ pː ʊ t aː r ɛ
p r ɔ l ɔ kʷ j ʊ m	p r oː l ɔ kʷ j ʊ m
f ɛ rː oː k ʊ ʊ m	w ɛ r ɪ k ʊ l ʊ m
m s t r ɪ k aː r ɛ	ɛ k s t r iː k aː r ɛ
f r uː k t w oː s ʊ m	f r ʊ k t ʊ oː s ʊ m
f ʊ n d aː m ɛ n t ʊ m	f ʊ n d aː m ɛ n t ʊ m
ɪ m b ɛ k ɪ lː ɪ t aː t ɛ m	ɪ m b eː k ɪ lː ɪ t aː t ɛ m
h ʊ m ɛ r ʊ g ʊ l ɛ m	m ɛ r g ʊ m
d ɛ s ɛ k aː r ɛ	d eː s ɪ kː aː r ɛ
ɪ n k r eː d ɪ b ɪ ɪ l ɛ	ɪ ŋ k r eː d ɪ b ɪ l ɛ m
ɪ t ɪ n ɛ r aː r j ʊ m	ɪ t ɪ n ɛ r aː r j ʊ m
w ʊ l p ɪ n ʊ m	w ʊ l p iː n ʊ m
eː m uː ŋ g eː r ɛ	eː m ʊ ŋ g ɛ r ɛ
d ɛ b ɛ lː aː r ɛ	d eː b ɛ lː aː r ɛ
s a k r ɪ l ɛ g ʊ m	s a k r ɪ l ɛ g ʊ m
k ɔ m ɛ ŋ t aː rː j ʊ m	k ɔ mː ɛ n t aː r j ʊ m
a k k ɛ n t ʊ m	a kː ɛ n t ʊ m
ɪ n f ʊ n d ɛ r ɛ	iː n f ʊ n d ɛ r ɛ
f r aː n k ɛ s ɛ m	f r a ŋ k eː n s ɛ m
b a r b aː t ʊ m	b a r b aː t ʊ m
k ɪ n t ʊ r a m	k ɪ ŋ k t uː r a m
a b j ɛ k t aː r ɛ	a b ɪ k ɛ r ɛ
k ɔ n j ʊ g aː t j oː n ɛ m	k ɔ n j ʊ g aː t j oː n ɛ m
ɛ k s a g ɛ r aː t j oː n ɛ m	ɛ k s a gː ɛ r aː t j oː n ɛ m
s a r k ɪ n a m	s a r k ɪ n a m
ɔ k k ɪ d ɛ n t ɛ m	ɔ kː ɪ d ɛ n t ɛ m
k ɔ m uː n ɛ m	k ɔ mː uː n ɛ m
r ɛ t r aː k t j oː n ɛ m	r ɛ t r a k t j oː n ɛ m
s a b l ʊ m	s a b ʊ l ʊ m
k r iː w ʊ m	k r iː b r ʊ m
s a n j ɛ n ʊ m	s a n ɪ ɛ m
k ɔ ɔ t ʊ m	k ɔ ɪ t ʊ m
a w a l ʊ m	a w ʊ l ʊ m
r a d j aː t j oː n ɛ	r a d j aː t j oː n ɛ m
m a n ɪ j aː r ʊ m	m a n w aː r j ʊ m
ɪ n s t aʊ r aː r ɛ	iː n s t aʊ r aː r ɛ
k l aʊ s k ʊ r a m	k l aʊ s uː r a m
s k r ʊ t aː r ɛ	s k r uː t aː r iː
ɔ s p ɪ t j ʊ m	h ɔ s p ɪ t j ʊ m
g l ɪ l a m	g l aː r ɛ a m
a d j n uː d ɪ k aː r ɛ	a d ɪ uː d ɪ k aː r ɛ
k ɔ n f ɛ r ɛ r ɛ	k oː n f ɛ rː ɛ
ɔ l ɪ g aː r k a m	ɔ l ɪ g a r kʰ a m
uː s p ɛ d aː r ɛ	h ɔ s p ɪ t aː r iː
s kʰ ɪ k uː t a m	k ɪ k uː t a m
p eː kʰ aː r ɛ	p ɛ kː aː r ɛ
s k a n d ʊ m a m	s k a n d ʊ l a m
r ɛ k ɛ sː ʊ m	r ɛ k ɛ sː ʊ m
ɪ l ɛ g aː l ɛ	ɪ lː eː g aː l ɛ m
k a t ɛ k ɪ ʊ zː aː r ɛ	k a t eː kʰ iː zː aː r ɛ
l a m b r ʊ s k a m	l aː b r ʊ s k a m
s ɛ g aː r ɛ m	s ɛ k aː r ɛ
k ɔ n t ɪ n w ɛ aː t j oː n ɛ m	k ɔ n t ɪ n w aː t j oː n ɛ m
w ɔ l aː r ɛ	w ɔ l aː r ɛ
s ɔ b m ɛ t ɛ r ɛ	s ʊ mː ɪ tː ɛ r ɛ
f a k s t j j ɛ m	f a s k ɛ m
p a l m aː r ɪ m	p a l m aː r ɛ m
k ɪ p r ɛ oː ʊ m	k ʊ p r ɛ sː ʊ m
k a pː ɛ lː a m	k a pː ɛ lː a m
t a l ʊ pʰ n ʊ m	t aː l ʊ m
d ɪ s k r ɪ m ɪ n aː t j oː n ɛ m	d ɪ s k r iː m ɪ n aː t j oː n ɛ m
r ɛ t j aː r j ʊ m	r eː t j aː r j ʊ m
a r k a m	a r kʰ a m
n uː b ɛ m	n uː b ɛ m
m a t ʊ t ʊ m	m aː t uː t iː n ʊ m
b a s t ɪ r n a m	b a s t ɛ r n a m
ʊ r k ɛ m	ʊ l iː k ɛ m
p r ɔ m ʊ l g aː t j oː n ɛ m	p r oː m ʊ l g aː t j oː n ɛ m
p ɛ t aː t ʊ m	p ɪ tː a k j ʊ m
a b r oː t aː n ʊ m	a b r ɔ t ɔ n ʊ m
kʷ a l ɪ f ɪ k aː r ɛ	kʷ aː l ɪ f ɪ k aː r ɛ
p ɛ r p ɛ t r aː r ɛ	p ɛ r p ɛ t r aː r ɛ
j uː d ɪ t j aː l ɛ	j uː d ɪ k j aː l ɛ m
a d ɪ t ʊ m	a d ɪ t ʊ m
l aʊ r ɔ k eː r aː s ʊ m	l aʊ r ɔ k ɛ r a s ʊ m
d ɪ m ɪ t ɛ r ɛ	d iː m ɪ tː ɛ r ɛ
k ɔ rː ɔ ɛ r ɛ	k ɔ rː oː d ɛ r ɛ
l uː b r ɪ k ʊ m	l uː b r ɪ k ʊ m
l ɔ t r ʊ m	l uː r ɪ d ʊ m
eː t ɛ r ɛ ʊ m	aɪ tʰ ɛ r j ʊ m
g r aː n d ɛ m	g r a n d ɛ m
k ɔ n t r aː k t ɛ	k ɔ n t r a h ɛ r ɛ
eː n t ɛ m	ɛ n s
l a k r ɪ m aː r ɛ	l a k r ɪ m aː r ɛ
a b ɛ rː aː r ɛ	a b ɛ rː aː r ɛ
s k oː p r ʊ m	s k a l p r ʊ m
g eː m ɪ t ʊ m	g ɛ m ɪ t ʊ m
s a l m a m	s a g m a m
m a a m	m a rː a m
ɪ mː ɔ l aː t j oː n ɛ m	ɪ mː ɔ l aː t j oː n ɛ m
d ʊ b l ʊ m	d ʊ p l ʊ m
d ɛ r aː t uː rː a m	d iː r ɛ k t uː r a m
a t r ʊ m	aː t r ʊ m
uː s aː r ɛ m	uː t iː
m uː k ɔ r ɛ	m uː k oː r ɛ m
aɪ g r ɛu m	aɪ g r ʊ m
ɪ n g uː r j a m	ɪ n ɪ uː r j a m
s ɛ k ɪ r m ɛ r ɛ	s eː k ɛ r n ɛ r ɛ
a d k uː d ɪ k aː t j oː n ɛ m	a d ɪ uː d ɪ k aː t j oː n ɛ m
k aʊ t ɛ l a m	k aʊ t eː l a m
k ɔ m p aː t r ɛ m	k ɔ m p a t r ɛ m
f ɛ k ʊ n d ʊ m	f eː k ʊ n d ʊ m
ɪ m aː g ɛ n ɛ	ɪ m aː g ɪ n ɛ m
w a r j ɛ g aː t j oː n ɛ m	w a r ɪ ɛ g aː t j oː n ɛ m
j ʊ w ɛ n t uː t ɛ m	j ʊ w ɛ n t uː t ɛ m
p ɛ lː ɪ k ʊ l a m	p ɛ lː ɪ k ʊ l a m
p uː l k r ɪ t ʊ t ɛ m	p ʊ l kʰ r ɪ t uː d ɪ n ɛ m
m ɪ t ɪ g aː t j oː n ɛ m	m iː t ɪ g aː t j oː n ɛ m
d ɪ g ɪ t aː r ɛ	d ɪ g ɪ t aː r ɛ
t r aː n s ʊ b s t ʊː n t j aː r ɛ	t r aː n s ʊ b s t a n t j aː r ɛ
k a n s aː r ɛ	k a m p s aː r ɛ
b a s j ʊ m	b aː s j ʊ m
p aː r ɛ g ʊ d ɪ n ɛ k aː r ɛ	p r aɪ j uː d ɪ k aː r ɛ
p uː bː l ɪ k ʊ m	p uː b l ɪ k ʊ m
j uː r ʊ m	ɪ uː s
j ɔ d aː r ʊ m	l ɔ l j ʊ m
ɔ n ɪ r ɛ m	ɔ n ʊ s
m a n ɪ f j ɛ s t ʊ m	m a n ɪ f ɛ s t ʊ m
f ɛ d ʊ m	f ɔ ɪ d ʊ s
l ɛ n ɛ m	l eː n ɛ m
p r ɔ l ɔ ŋ g aː r ɛ	p r oː l ɔ ŋ g aː r ɛ
s s k ʊ m	ɪ s k ʊ m
a s k aː l a m	a sː ʊ l a m
a k ɛ b r ʊ m	aː k r ɛ m
a l aː k r ɪ t a t ɛ m	a l a k r ɪ t aː t ɛ m
b ɪ l ʊ m	b iː l ɛ m
p r ɔ f eː t j a m	p r ɔ pʰ eː t iː a m
p ɛ n ɪ t ɛ n t j aː l ɛ m	p aɪ n ɪ t ɛ n t j aː l ɛ m
d eː s uː l t oː r j ʊ m	d eː s ʊ l t oː r j ʊ m
w ɛ r ɪ t a t ɪ n ɛ m	w eː r ɪ t aː t ɛ m
f r ɔ n t aː l ɛ	f r ɔ n t aː l ɛ m
s a d aː r aː r ɛ m	s aː n aː r ɛ
f ɪ n ɔ k ʊ j ʊ m	f eː n ʊ k ʊ l ʊ m
k ɔ n t aː r ɛ	k ɔ m p ʊ t aː r ɛ
k ɔ n f iː n ɛ	k ɔ n f iː n ɛ m
b a r b ɛ aː t ʊ m	b a r b ʊ l a m
r ɛ f l ʊ ɪ r ɛ	r ɛ f l ʊ ɛ r ɛ
f l aː g r aː r ɛ	f l a g r aː r ɛ
p ɪ n t aː r ɛ	p ɪ ŋ g ɛ r ɛ
ɛ k s ɪ g ɪ n ʊ m	ɛ k s ɪ gʷ ʊ m
w a g ɪ r ɛ m	w aː g iː r ɛ
w ɪ s ɪ b ɪ l ɛ t aː t ɛ m	w iː s ɪ b ɪ l ɪ t aː t ɛ m
eː w ɔ l uː j oː n ɛ r ɛ	eː w ɔ l w ɛ r ɛ
r ɛ g j ʊ m	r eː g j ʊ m
k ɪ r k ʊ n d aː r ɛ	k ɪ r k ʊ m d a r ɛ
ɔ l ɛ aː t ʊ m	ɔ l ɛ aː t ʊ m
k ɔ p uː l aː t j oː n ɛ m	k oː p ʊ l aː t j oː n ɛ m
m a n kʷ ʊ m	m a ŋ k ʊ m
d eː s p oː s aː r ɛ	d eː s p oː n s aː r ɛ
s k ɪ r p ʊ m	s k ɪ r p ʊ m
uː r g iː r ɛ	ʊ r g eː r ɛ
k r aː n d ɪ k ʊ m	g r a n d ɪ n ɛ m
eː l uː d ɛ r ɛ	eː l uː d ɛ r ɛ
a s k ɛ n s j oː n ɛ m	a s k eː n s j oː n ɛ m
a d w ɛ k t j oː n ɛ m	a d w ɛ k t j oː n ɛ m
l eː d aː t oː r ɛ m	l aʊ d aː t oː r ɛ m
k a n d eː l a m	k a n d eː l a m
l ɔ m b ʊ m	l ʊ m b ʊ m
j ɛ n j ɪ aː l ɛ	g ɛ n j aː l ɛ m
g uː s t aː t j oː n ɛ m	g ʊ s t aː t j oː n ɛ m
ɪ m p aː w ɪ d ʊ m	ɪ m p a w ɪ d ʊ m
m ɪ r aː k ʊ l ʊ m	m iː r aː k ʊ l ʊ m
b ʊ k iː n a m	b uː k ɪ n a m
k ɔ n ʊ m	k oː n ʊ m
l ɔ k uː t oː r ɛ	l ɔ k uː t oː r ɛ m
eː n uː m ɛ r aː r ɛ	eː n ʊ m ɛ r aː r ɛ
n ɔ t ɔ r j ʊ m	n oː t oː r j ʊ m
s t a t ʊ ɛ r ɛ	s t a t ʊ ɛ r ɛ
p l aː n ɪ t j ɛ m	p l aː n ɪ t ɪ ɛ m
a n aː l ɪ	a nː aː l ɛ m
s kː a m a m	s kʷ aː m a m
l a w aː t oː r j ʊ m	l a w aː t oː r j ʊ m
s ɔ lː ɪ k ɪ t aː r ɛ	s ɔ lː ɪ k ɪ t aː r ɛ
t r aː n kʷ ɪ lː ʊ m	t r a ŋ kʷ ɪ lː ʊ m
ɪ n w ɪ d j a m	ɪ n w ɪ d j a m
n uː m ɛ r aː r ɛ	n ʊ m ɛ r aː r ɛ
d eː h k iː r s p ɛ r aː t ʊ m	d eː s p eː r aː t ʊ m
p ɔ s ɛ sː oː r ɛ	p ɔ sː ɛ sː oː r ɛ m
aʊ t ɔ r ɪ t aː t ɛ m	aʊ k t oː r ɪ t aː t ɛ m
w ɪ g ɔ r aː r ɛ	w ɪ g oː r aː r ɛ
f ɔ r n aː l j j	f ɔ r n aː k ʊ l a m
d ɪ l ɪ g ɛ n t j a m	d iː l ɪ g ɛ n t j a m
r ɔ s m aː r iː n ʊ m	r oː r ɛ mː a r iː n ʊ m
b a r b aː r ɪ zː aː r ɛ	b a r b a r iː zː aː r ɛ
ɪ m p aː r t ɪ r ɛ	ɪ m p a r t iː r ɛ
k a l w ɪ r ɛ	k a l w iː
f a k t oː r ɛ	f a k t oː r ɛ m
w ɛ s h ʊ m	w eː s k ʊ m
k ɔ d ɪ k ɛ m	k oː d ɪ k ɛ m
ɪ n ɪ t j ʊ m	ɪ n ɪ t j ʊ m
l aɪ t ɛ r a m	l ɪ tː ɛ r a m
d eː k ɔ rː ɛ r ɛ m	d eː k ʊ rː ɛ r ɛ
p a r s ɪ m oː n j a m	p a r s ɪ m oː n j a m
t ɪ t uː b ɛ r ɛ	t ɪ t ʊ b aː r ɛ
k ɔ r oː n iː d ɛ m	k ɔ r oː n ɪ d ɛ m
s k ɪ m j a m	s iː m j a m
l ɛ d aː r r a m	l ɛ p r a m
b a r ɪ t ɔ n ʊ m	b a r y t ɔ n ʊ m
ɔ n uː s t ʊ m	ɔ n ʊ s t ʊ m
t ɛ t r ɪ k ʊ m	t aɪ t r ɪ k ʊ m
l ɛ n a d oː r ɛ	l ɪ ŋ n aː t oː r ɛ m
m ɔ r s ʊ m	m ɔ r s ʊ m
w r ɪ n k ʊ ʊ ʊ m	w ɪ ŋ k ʊ l ʊ m
p a t r j aː r tʰ j oː n a m	p a t r j a r kʰ a m
k ɔ n t r ɪ b ʊ ɛ r ɛ	k ɔ n t r ɪ b ʊ ɛ r ɛ
l a ŋ gʷ ɪ d ʊ m	l a ŋ gʷ ɪ d ʊ m
m ɔ n t oː s ʊ m	m ɔ n t ʊ oː s ʊ m
ɛ k s p ʊ l s aː r ɛ	ɛ k s p ʊ l s aː r ɛ
k ɔ n k ʊ a m	k ɔ ŋ kʰ a m
b r ɪ t aː n ɪ k ʊ m	b r ɪ t a nː ɪ k ʊ m
n ɛ r w j oː s ʊ m	n ɛ r w oː s ʊ m
k a lː ʊ m	k a lː ʊ m
k r uː d ɛ l ɛ	k r uː d eː l ɛ m
k aʊ t ɛ n	k oː t ɛ m
f ʊ l k aː r ɛ	f ɔ lː ɪ k aː r ɛ
ɪ r aː k ʊ n d ʊ m	iː r aː k ʊ n d ʊ m
n aʊ f r aː g aː r ɛ	n aʊ f r a g aː r ɛ
ɔ l a k r ʊ m	ɔ lː aː r j ʊ m
s ɛ r m oː n ɛ m	s ɛ r m oː n ɛ m
f r ɔ n d oː s ʊ m	f r ɔ n d oː s ʊ m
p ɛ r f ɪ d ʊ m	p ɛ r f ɪ d ʊ m
ɛ t ʊ m	eː t ʊ m
n uː m ɛ r aː r ʊ m	n ʊ m ɛ r aː r j ʊ m
r uː p ɛ m	r uː p ɛ m
r a d ɪ k ɪ a ɛ m	r aː d iː k ɛ m
t r aː t aː t ʊ m	t r a k t aː t ʊ m
d ɪ k aː k ɛ m	d ɪ k aː k ɛ m
a g ɪ r ɛ	a g ɛ r ɛ
t r aː n s aː k t j oː n ɛ m	t r aː n s aː k t j oː n ɛ m
n ɔ s ɔ k ɔ m j ʊ m	n ɔ s ɔ k ɔ m iː ʊ m
p r ɔ b l eː m aː t ɪ k ʊ m	p r ɔ b l eː m a t ɪ k ʊ m
g r aː m aː t iː k aː l ɛ m	g r a mː a t ɪ k aː l ɛ m
n w a t aː r ɛ	n a t aː r ɛ
p uː l k r ʊ m	p ʊ l kʰ r ʊ m
aɪ t ɛ r ɛ	aɪ tʰ ɛ r ɛ m
m uː l ʊ m	m uː l ʊ m
l ɪ n k t ɛ m	l y ŋ k ɛ m
eː m uː l a k t oː r ɛ	aɪ m ʊ l aː t oː r ɛ m
a r k ɛ a ŋ g ɛ l ʊ m	a r kʰ a ŋ g ɛ l ʊ m
g r aː t ʊ m	g r aː t ʊ m
p ɛ r ɪ m ɛ r ɛ	p ɛ r ɪ m ɛ r ɛ
m ɛ m b r aː n oː m ʊ m	m ɛ m b r aː n ɛu m
r ɛ f l ɛ tː ɛ r ɛ	r ɛ f l ɛ k t ɛ r ɛ
j uː d aɪ m ʊ m	j uː d aɪ ʊ m
r a s uː r a m	r aː s uː r a m
r ʊ g ʊ m	r ɔ g ʊ m
t r aː n s k r ɪ w ɛ r ɛ	t r aː n s k r iː b ɛ r ɛ
m a r ɪ t aː r ɛ	m a r iː t aː r ɛ
p ɛu r eː k ʊ n t aː r ɛ	p ɛ r k ɔ n t aː r iː
p r aɪ g ʊ oː t aː r ɛ	p r aɪ g ʊ s t aː r ɛ
a b r ɔ k aː t j oː n ɛ m	a b r ɔ g aː t j oː n ɛ m
p a s t ʊ m	p aː s t ʊ m
l ɪ m ʊ m	l iː m ʊ m
p ʊ ɛ r ɪ l ɛ	p ʊ ɛ r iː l ɛ m
d j aː l ɛ k t ʊ m	d j a l ɛ k t ɔ n
d ɪ s t ɪ lː aː t j oː n ɛ m	d ɪ s t ɪ lː a t j oː n ɛ m
ɪ t ɛ r g ɛ k t j oː n ɛ m	ɪ n t ɛ r j ɛ k t j oː n ɛ m
s k uː rː ɪ l ɛ	s k ʊ rː iː l ɛ m
s uː w r oː g aː r ɛ	s ʊ b r ɔ g aː r ɛ
ɪ m iː j oː n ɛ m	k iː m ɪ k ɛ m
p ɔ s k iː r p oː n ɛ r ɛ	p ɔ s t p oː n ɛ r ɛ
a l aː lː a m	a fː l aː r ɛ
s t n ʊ m n ʊ t ʊ m	t ɔ n ɪ t r ʊ m
a n aɪ t ʊ m	a n eː tʰ ʊ m
g r aː t ɪ t oː n	g r aː t ɪ t uː d ɪ n ɛ m
k ɔ n k ɪ n iː t aː t ɛ m	k ɔ ŋ k ɪ nː ɪ t aː t ɛ m
l ɪ m ɪ t r ɔ f ʊ m	l iː m ɪ t r ɔ pʰ ʊ m
p ɛ r m aː n ɛ ɛ r ɛ	p ɛ r m a n eː r ɛ
d eː s ɪ d ɛ t aː r ɛ	d eː s iː d ɛ r aː r ɛ
r ɛ k ʊ n oː a s k ɛ r ɛ m	r ɛ k ɔ ŋ n oː s k ɛ r ɛ
p ɔ lː aː r ɛ m	p ʊ lː aː r ɛ
p ɔ aɪ ŋ ɛ r ɛ j s ɪ l ɛ	p ɛ t r ɔ s ɛ l iː n ʊ m
k ɔ m p ɪ aː k ɛ r ɛ	k ɔ m p l a k eː r ɛ
ɔ fː ɪ k j ʊ m	ɔ fː ɪ k j ʊ m
d ɪ m ɪ n ʊ ɛ r ɛ	d iː m ɪ n ʊ ɛ r ɛ
p ɛ l aː k ʊ m	p ɛ l a g ʊ s
a r g ʊ t j a m	a r g uː t j a m
p a n ɪ k uː l a m	p aː n ɪ k ʊ l a m
a n uː m n k j aː r ɛ	a nː uː n t j aː r ɛ
ɪ m b ɛ r b ɛ m	ɪ m b ɛ r b ɛ m
g a rː uː l ʊ m	g a rː ʊ l ʊ m
j ɛ m uː l a m	g ɛ mː ʊ l a m
l a k t aː r ɛ	l a k t aː r ɛ
r ɛ m ɛ m b r a r ɛ	r ɛ m ɛ m ɔ r aː r iː
s ɛ r w aː r ɛ	s ɛ r w aː r ɛ
a k ɪ ɛ t ɛ r ɛ	a kː w ɪ eː s k ɛ r ɛ
h uː n g ɛ r ɛ	ʊ ŋ g ɛ r ɛ
f uː r j oː s ʊ m	f ʊ r j oː s ʊ m
k ɔ n f ɛ d ɛ r aː t j oː n ɛ m	k oː n f ɔ ɪ d ɛ r aː t j oː n ɛ m
ɔ b lː w ɪ t aː r ɛ	ɔ b l iː w ɪ s k iː
s ʊ p r ɛ p oː n ɛ r ɛ	s ʊ p ɛ r p oː n ɛ r ɛ
a b l ɛ g aː t j oː n ɛ m	a b l eː g aː t j oː n ɛ m
t r ɪ b ʊ l ʊ m	t r ɪ b ʊ l ʊ m
s ɪ d ɛ r ɛ ʊ m	s iː d ɛ r ɛu m
s ʊ s p ɪ r j aː r ɛ	s ʊ s p iː r aː r ɛ
g ɛ l oː s ʊ m	z eː l oː s ʊ m
r ɛ l ɛ g aː t j oː n ɛ m	r ɛ l eː g aː t j oː n ɛ m
r ɛ l ɪ k j ɛ	r ɛ l ɪ kʷ ʊ m
ɪ w ʊ m	iː w ʊ m
m ɛ d ɪ t ɪ rː a n ɛ ʊ m	m ɛ d ɪ t ɛ rː aː n ɛu m
a fː l ɪ g ɛ r ɛ	a fː l iː g ɛ r ɛ
a b s ɔ l ʊ t j oː n ɛ m	a b s ɔ l uː t j oː n ɛ m
f a b ɛ lː a m	f aː b ɛ lː a m
ɪ n t ɛ g r aː r ɛ	ɪ n t ɛ g r aː r ɛ
a g r ʊ m	a g r ʊ m
w ɪ d ʊ w a m	w ɪ d w a m
w ɪ w ɪ d ʊ m	w iː w ɪ d ʊ m
k ɔ ŋ s ɛ k oː d a m	k oː n s ɔ l ɪ d a m
p r aɪ d ɪ k ɪ r ɛ	p r aɪ d ɪ k aː r ɛ
d eː m oː n ɪ k ʊ m	d aɪ m ɔ n ɪ k ʊ m
r uː b r ɪ k a m	r ʊ b r iː k a m
b ɔ m b ʊ m	b ɔ m b ʊ m
a d ɪ t aː m ɛ n t ʊ m	a dː ɪ t aː m ɛ n t ʊ m
s l ɛ p ɛ m	s aɪ p ɛ m
ɔ b s t aː r ɛ	ɔ b s t aː r ɛ
k s k ʊ s aː t j oː n ɛ m	ɛ k s k uː s aː t j oː n ɛ m
p ʊ pː a m	p ʊ pː ɛ m
k ɔ l ʊ m b a m	k ɔ l ʊ m b a m
s t r aʊ p ʊ m	s t r ɔ pː ʊ m
k a n a m	k a nː a m
ɪ n d uː r ɛ t ɛ r ɛ	ɪ n d uː r eː s k ɛ r ɛ
b a r b aː r ɪ m ʊ m	b a r b a r ɪ s m ʊ m
s ɔ r t ɪ r ɛ	s ɔ r t iː r iː
eː k s k ɛ t aː r aː r ɛ	ɛ k s k ɪ p ɛ r ɛ
ɪ k g ɛ n j oː s ʊ m	ɪ ŋ g ɛ n j oː s ʊ m
t a pː ɛ t ɛ m	t a p eː t ɛ m
ɪ n g ʊ m t j oː n ɛ m	ɪ n j ʊ ŋ k t j oː n ɛ m
m ɛ l ɔ d j a m	m ɛ l oː d j a m
g a rː ɪ r ɛ m	g a rː iː r ɛ
n uː t ʊ m	n uː t ʊ m
a s p ɛ n t aː r ɛ	a s p ɛ k t aː r ɛ
t k ɔ r p ɛ r ɛ	k oː n s p ʊ ɛ r ɛ
d ɔ n ɪ s j aː k ʊ m	d ɪ ɔ n y s j a k ʊ m
a sː ɛ t aː r ɛ	a sː ɛ k t aː r iː
p r aɪ g ʊ d ɪ t j ʊ m	p r aɪ j uː d ɪ k j ʊ m
k ɔ n s uː d mː aː r ɛ	k oː n s ʊ mː aː r ɛ
a r m a r j ʊ m	a r m aː r j ʊ m
