s p ɔ r k ʊ m	s p ʊ r k ʊ m
w ɛ r n iː k ɛ	w ɛ r n iː k ɛ m
s k a l p ɛ lː ʊ m	s k a l p ɛ lː ʊ m
aː g a t a m	a kʰ aː t eː n
t ɛ d j oː s ʊ m	t aɪ d j oː s ʊ m
p r ɔ b ʊ m	p r ɔ b ʊ m
p ɛ l a m	p iː l a m
t ɛ n d ɛ r ɛ	t ɛ n d ɛ r ɛ
m ɛ r b oː s ʊ m	h ɛ r b oː s ʊ m
g ɛ n j ɪ a l ɛ	g ɛ n j aː l ɛ m
ɛ n t r ʊ m ɛ t ɛ r m ɛ	ɪ n t r oː m ɪ tː ɛ r ɛ
p l uː m a m	p l uː m a m
k ʊ m n t uː m ɛ l j a m	k ɔ n t ʊ m eː l j a m
ɪ s ʊ g aː r ɛ	ɛ k sː uː k aː r ɛ
a k uː s aː b eː l ɛ	a kː uː s aː b ɪ l ɛ m
r ɛ w ɔ k aː r ɛ	r ɛ w ɔ k aː r ɛ
p aː k t ʊ m	p a k t ʊ m
m ɪ ɛ	m eː n s ɛ m
w ɛ lː oː s ʊ m	w ɪ lː oː s ʊ m
t r a m l uː k ɪ r ɛ	t r aː n s l uː k eː r ɛ
s t a b ɪ l k ɛ r ɛ	s t a b ɪ l iː r ɛ
ɪ m f ʊ lː ɪ k aː r	f ɔ lː ɪ k aː r ɛ
w aː lː ʊ m	w a lː ʊ m
s a n t ʊ m r j ɛ t a m	s a t ʊ r eː j a m
uː l k ɛ r a m	ʊ l k ʊ s
a k r iː m ɔ n j a m	aː k r ɪ m oː n j a m
w a l ɛ t uː d iː n aː r j ʊ m	w a l eː t uː d ɪ n aː r j ʊ m
b oː aː r j ʊ m	b ɔ aː r j ʊ m
p a l p ɛ b r a l	p a l p ɛ b r aː l ɛ m
iː m p ɛ r aː r ɛ	ɪ m p ɛ r aː r ɛ
k ɔ n f l uː ɛ r ɛ	k oː n f l ʊ ɛ r ɛ
ɔ rː iː f iː k ʊ m	h ɔ rː ɪ f ɪ k ʊ m
d iː s w a d ɛ r ɛ	d ɪ sː w aː d eː r ɛ
p l aː k iː d ʊ m	p l a k ɪ d ʊ m
s t aː t ʊ m	s t a t ʊ m
a f l iː g ɛ r ɛ	a fː l iː g ɛ r ɛ
w a n ɪ	w a nː ʊ m
g uː b iː l aː r ɛ	j uː b ɪ l aː r ɛ
iː lː a t j ʊ m n ɛ m	ɪ lː aː t j oː n ɛ m
s ʊ lː aː s ʊ m	s oː l aː k j ʊ m
ɛ r m a n d aː d ɛ m	g ɛ r m aː n ɪ t aː t ɛ m
k ɔ lː ʊ m	k ɔ lː ʊ m
p r ɔ w ɔ k aː r ɛ	p r oː w ɔ k aː r ɛ
f ɔ l oː s ʊ m	f ɔ l j oː s ʊ m
s a k r iː f iː k j ʊ m	s a k r ɪ f ɪ k j ʊ m
ɔ b s ɛ k j ʊ m s ʊ m	ɔ b s ɛ kʷ j oː s ʊ m
j uː g ɛ r ʊ m	j uː g ɛ r ʊ m
ɔ s k uː l a m t j ʊ m n ɛ m	ɔ s k ʊ l aː t j oː n ɛ m
ɔ pː ɔ m r ɛ	ɔ pː oː n ɛ r ɛ
m uː s a r aː n ɛ m	m uː s a r aː n ɛu m
p r ɛ s j ɪ d ɛ r ɛ	p r aɪ s ɪ d eː r ɛ
iː ŋ n a r ʊ m	ɪ ŋ n aː r ʊ m
m a m t aː r ɛ	m a k t aː r ɛ
t uː r a m	t uː r a m
g ɛ t aː r ɛ	j a k t aː r ɛ
w iː w iː d ʊ m	w iː w ɪ d ʊ m
k ɔ ŋ j uː g aː r ɛ	k ɔ n j ʊ g aː r ɛ
b uː r ʊ m	b ʊ rː ɪ k ʊ m
p r ɛ b a l eː r ɛ	p r aɪ w a l eː r ɛ
k ʊ n t ɔ r k ɛ r ɛ	k ɔ n t ɔ r kʷ eː r ɛ
h aː b ʊ m l aː r ɛ	f aː b ʊ l aː r iː
h ɪ k ɛ	kʷ ɛ m
d iː k t j oː n ɛ m	d ɪ k t j oː n ɛ m
p ɛ r p ɛ t ʊ ɪ t aː t ɛ m	p ɛ r p ɛ t ʊ ɪ t aː t ɛ m
d j aː b ʊ m l ʊ m	d j a b ɔ l ʊ m
k l aʊ d iː k a m r ɛ	k l aʊ d ɪ k aː r ɛ
p uː p a m	p uː p a m
k a l iː k ɛ n	k a l ɪ k ɛ m
b ɔ t uː l iː n ʊ m	b ɔ t ʊ l ʊ m
ɔ n aː g r ʊ m	ɔ n a g r ʊ m
r ɛ f ɔ r m aː r ɛ	r ɛ f oː r m aː r ɛ
ɛ b ɛ t ʊ lː a	b ɛ t ʊ l a m
k iː n ɛ m	k y ŋ n ʊ m
s m a r a ŋ g ʊ k ʊ m	m ɛ r g ʊ m
ɔ n ɔ m a t ɔ p ɛ j a m	ɔ n ɔ m a t ɔ p ɔ ɪ j a m
f a l s aː r ɛ	f a l s aː r ɛ
? aː t aː r	f eː t aː r ɛ
a t r a m ɛ n t ʊ m m	aː t r aː m ɛ n t ʊ m
p r uː ɛ r ɛ	p r uː r iː r ɛ
m a m ŋ n ɛ s j ʊ m	m a ŋ n eː s j ʊ m
f a rː aː j ɪ n ɛ	f a rː aː g ɪ n ɛ m
d ɛ r iː s ɔ r j ʊ m	d eː r iː s oː r j ʊ m
s p ɛ k ʊ j ʊ m	s p ɛ k ʊ l ʊ m
m ɛ d ɪ j ɔ k r ɛ	m ɛ d ɪ ɔ k r ɛ m
kʷ ɛ s t j ɪ ɔ n aː r j ʊ m	kʷ aɪ s t j oː n aː r j ʊ m
r ɛ f r iː g ɛ r j ʊ m	r eː f r iː g ɛ r j ʊ m
s p ɔ l a m r ɛ	s p ɔ l j aː r ɛ
m a r iː s k a m	m a r ɪ s k a m
a k ʊ m	a k ʊ m
s a m l iː n a m	s a l iː n a m
a k t oː r ɛ	aː k t oː r ɛ m
m a n k ɛ b ʊ m	m a ŋ k ɪ p ɛ m
d eː s t r uː g ɪ r ɛ	d eː s t r ʊ ɛ r ɛ
d iː w ɛ r t iː r ɛ	d iː w ɛ r t ɛ r ɛ
ɔ r iː zː ɔ n t ɛ m	h ɔ r ɪ zː ɔ n t a
p a p j eː l ʊ m	p a p y r ʊ m
a b iː t aː r ɛ	h a b ɪ t aː r ɛ
aː n t a m	a n t aː s
p ɛ r m iː s j oː n ɛ m	p ɛ r m ɪ sː j oː n ɛ m
k ɔ lː ɛ r a m	kʰ ɔ l ɛ r a m
a g r ɛ s t ɛ m	a g r ɛ s t ɛ m
a b ɛ rː aː r ɛ	a b ɛ rː aː r ɛ
a m k ɛ r w ʊ m	a k ɛ r w ʊ m
p r ɛ d a t oː r ɛ	p r aɪ d aː t oː r ɛ m
t ɛ k s t ʊ m	t ɛ k s t ʊ m
f aː m m a	f aː m a m
n a m t a m l iː t j ʊ m	n aː t aː l iː k j ʊ m
k l aʊ s uː r a m	k l aʊ s uː r a m
b l a n d ʊ m	b l a n d ʊ m
s uː k k j m aː r ɛ	s uː g ɛ r ɛ
l uː d iː b r j ʊ m	l uː d iː b r j ʊ m
k ɔ m p ʊ ŋ g ɛ r ɛ	k ɔ m p ʊ ŋ g ɛ r ɛ
m ɛ lː ʊ m	ɛ lː ʊ m
w ɛ m r aː k ɛ	w eː r aː k ɛ m
s uː f iː k j ɛ n t j a m	s ʊ fː ɪ k ɪ ɛ n t j a m
a s t uː t j a m	a s t uː t j a m
ɛ k s t ɛ r j ɔ r	ɛ k s t ɛ r j oː r ɛ m
s ɛ rː aː r ɛ	s ɛ r ɛ r ɛ
s ʊ n ɪ t ʊ m	s ɔ n ɪ t ʊ m
l uː t ʊ m	l uː k t ʊ m
k ɛ s a t j oː n ɛ m	k ɛ sː aː t j oː n ɛ m
a m b l a m kʷ aɪ t j oː n ɛ m	a b l a kʷ ɛ aː t j oː n ɛ m
s p ɛ k t aː k ʊ l ʊ m	s p ɛ k t aː k ʊ l ʊ m
a n a r k j a m	a n a r kʰ j a m
s oː l ʊ m	s oː l ʊ m
d iː g ɛ s t iː w ʊ m	d iː g ɛ s t iː w ʊ m
uː s iː t aː r ɛ	uː s ɪ t aː r iː
s k r uː t a m r ɛ	s k r uː t aː r ɛ
p r ɛ d j a l ɛ	p r aɪ d j aː l ɛ m
kʷ j ʊ ɛ s ɛ m	k l aʊ d ɛ r ɛ
ɛ k s k r ɛ m ɛ n t ʊ m	ɛ k s k r eː m ɛ n t ʊ m
ɪ n t ɛ r p ɔ n ɛ r ɛ	ɪ n t ɛ r p oː n ɛ r ɛ
k ɔ n d eː s k ɛ n d ɛ r ɛ	k ɔ n d eː s k ɛ n d ɛ r ɛ
d ɛ p r ɛ k a m r ɛ	d eː p r ɛ k aː r iː
d ɛ t ɛ s t a t j ʊ m n ɛ m	d eː t ɛ s t aː t j oː n ɛ m
k a n t j ʊ m n ɛ m	k a n t j oː n ɛ m
t aː b ʊ l a m	t a b l a m
d ʊ l k eː t uː m d ɪ n ɛ	d ʊ l k ɪ t uː d ɪ n ɛ m
k ɔ d iː k ɛ m	k oː d ɪ k ɛ m
n a t aː l ɛ	n aː t aː l ɛ m
ɛ l iː d ɛ r ɛ	eː l iː d ɛ r ɛ
k ɔ n s k ɛ ʊ m	k oː n s k j ʊ m
l iː n aː r ʊ m	l iː n aː r j ʊ m
t ɛ k l a m	tʰ eː k a m
s ɛ p ʊ l t uː r a m	s ɛ p ʊ l t uː r a m
k r ɔ t a m l ʊ m	k r ɔ t a l ʊ m
r ɛ d uː k t j oː n ɛ m	r ɛ d ʊ k t j oː n ɛ m
k ʊ p uː l a m t j ʊ m n ɛ m	k oː p ʊ l aː t j oː n ɛ m
p ɔ ɛ r iː l ɛ	p ʊ ɛ r iː l ɛ m
t ɔ r t ʊ m	t ɔ r t ʊ m
s t ɔ r aː k ɛ	s t y r a k ɛ m
t r a m s p ɔ r ɛ m	t r aː n s p oː n ɛ r ɛ
m ɛ t a lː ʊ m	m ɛ t a lː ʊ m
p l a m n a m r ɛ	p l aː n aː r j ʊ m
m aː s a m	m a sː a m
p ɔ r t ɛ r ʊ m	p ɔ r t aː r j ʊ m
t uː b ɛ r ʊ m s ʊ m	t uː b ɛ r oː s ʊ m
k ɔ n ɛ k s j ʊ m n ɛ m	k ɔ nː ɛ k s j oː n ɛ m
ɛ r ɛ t ɪ k ɛ m	h aɪ r ɛ t ɪ k ʊ m
s a k r iː l ɛ g ʊ m	s a k r ɪ l ɛ g ʊ m
s ɔ n aː r ɛ	s ɔ m n j aː r ɛ
l a k t ɛ ʊ m	l a k t ɛu m
n ʊ m ɪ n m a r ɛ	n oː m ɪ n aː r ɛ
m aː pː a m	m a pː a m
t a m t ɔ f ɪ t ʊ m	t uː b ɛ r
s ʊ l iː d aː r ɛ	s ɔ l ɪ d aː r ɛ
w uː l n ɛ m r aː r ɛ	w ʊ l n ɛ r aː r ɛ
k iː r k ʊ n f l uː iː r ɛ	k ɪ r k ʊ m f l ʊ ɛ r ɛ
m ɔ r t a l iː t aː t ɛ m	m ɔ r t aː l ɪ t aː t ɛ m
m ɛ d iː k iː n a l ɛ	m ɛ d ɪ k iː n aː l ɛ m
iː n d a m g a m r ɛ	ɪ n d aː g aː r ɛ
k ʊ m lː aʊ d a m r ɛ	k ɔ lː aʊ d aː r ɛ
s t r ɪ g a m	s t r iː g a m
ɛ k s a k t j ɔ n	ɛ k s aː k t j oː n ɛ m
n ɔ t a m	n ɔ t a m
f iː s j oː n ɛ m	f ɪ sː j oː n ɛ m
ʊ n d aː r ɛ	ʊ n d aː r ɛ
a d ʊ n aː r ɛ	a d uː n aː r ɛ
p ɔ n d ɛ r oː s ʊ m	p ɔ n d ɛ r oː s ʊ m
d iː s t r a k t j oː n ɛ m	d ɪ s t r a k t j oː n ɛ m
l uː n aː k j ʊ m n ɛ m	l uː n aː t j oː n ɛ m
f a k ɛ t j a m	f a k eː t j a m
k iː g ʊ ɔ n ɛ a m	k ɪ k oː n j a m
ɛ k s a l t a m r ɛ	ɛ k s a l t aː r ɛ
w ɛ n j a m	w ɛ n j a m
m ʊ d ɪ n ɛ m ʊ m	m ɔ d j ʊ m
t r a m s m iː g r a m r ɛ	t r aː n s m ɪ g r aː r ɛ
l a m k t iː k iː n j ʊ m	l a k t ɪ k iː n j ʊ m
p ɛ r iː t j a m	p ɛ r iː t j a m
m uː n ɔ m	m uː n ʊ s
n ɛ m g aː r ɛ	n ɛ g aː r ɛ
t r iː f ɔ l j a m t ʊ m	t r ɪ f ɔ l j aː t ʊ m
n ɔ d ɛ	n oː d aː r ɛ
ɛ ? ɛ t ʊ m	f ɪ l ɪ k t ʊ m
ɛ k s k ɔ r j aː r ɛ	ɛ k s k ɔ r j aː r ɛ
k a p t uː r a m	k a p t uː r a m
ɛ m s p a n d ɛ r ɛ	ɛ k s p a n d ɛ r ɛ
iː n s t aʊ r aː r ɛ	iː n s t aʊ r aː r ɛ
p aː d ɛ r ɛ m	p a t r ɛ m
p r ɔ r ɔ g aː r ɛ	p r oː r ɔ g aː r ɛ
k iː b iː k ʊ m	k iː w ɪ k ʊ m
b r a n k a m	b r a ŋ k a m
t r ʊ n k aː r ɛ	t r ʊ ŋ k aː r ɛ
b ɛ r iː lː ʊ m	b eː r y lː ʊ m
kʷ a m d r uː p l iː k aː r ɛ	kʷ a d r ʊ p l ɪ k aː r ɛ
s a k ɛ m r d ɔ t ɛ m	s a k ɛ r d oː t ɛ m
t ɛ l oː s ʊ m	z eː l oː s ʊ m
k a r ɪ k k ɛ m	k aː r ɪ k ɛ m
a k ɛ t ʊ m	a k eː t ʊ m
g ɛ n t iː l ɛ m	g ɛ n t iː l ɛ m
s p ɛ l ʊ n k a m	s p eː l ʊ ŋ k a m
d ɛ l iː t j a m	d eː l ɪ k j aː s
a m ɛ n iː t aː t ɛ m	a m ɔ ɪ n ɪ t aː t ɛ m
s p ʊ s aː r ɛ	s p oː n s aː r ɛ
a b d ɔ m ɛ n	a b d oː m ɛ n
a n s a m	aː n s a m
g ʊ k ʊ n d iː t aː t ɛ	j uː k ʊ n d ɪ t aː t ɛ m
m ɛ r b j aː r j ʊ m	h ɛ r b aː r j ʊ m
s k r ɔ f a m	s k r oː f a m
k ɔ rː ɛ k t oː r ɛ	k ɔ rː ɛ k t oː r ɛ m
r uː k j ʊ m	r oː s k ɪ d ʊ m
tʰ j a m	tʰ iː a m
m ɛ d iː k aː r ɛ	m ɛ d ɪ k aː r ɛ
f r ʊ n d oː s ʊ m	f r ɔ n d oː s ʊ m
n a r a t j ɔ n	n aː rː aː t ʊ m
ɔ s k ʊ l ʊ m	oː s k ʊ l ʊ m
ɛ k s a s p ɛ r a t j oː n ɛ m	ɛ k s a s p ɛ r aː t j oː n ɛ m
s k ɪ n t ɪ m l aː r ɛ	s k ɪ n t ɪ lː aː r ɛ
k uː r w aː r ɛ	k ʊ r w aː r ɛ
p a m p eː n ʊ m	p a m p ɪ n ʊ m
a s iː s ʊ m	a sː ɛ sː ʊ m
a t r iː b ʊ ɛ r ɛ	a tː r ɪ b ʊ ɛ r ɛ
a m b iː g ɛ ʊ m	a b ɪ g ɛu m
s ɪ t uː l a m	s ɪ t ʊ l a m
p uː l w iː n a m r ɛ	p ʊ l w iː n a r
k ɔ n f ɛ s aː r	k oː n f ɪ t eː r iː
g ɛ r m aː n ʊ m	g ɛ r m aː n ʊ m
t r a n s iː t ʊ m	t r aː n s ɪ t ʊ m
a s p ɛ r g ɛ n ɛ	a s p ɛ r g ɛ r ɛ
p ɔ m ɛ m t ʊ m	p ɔ m eː t ʊ m
a b a t j a m	a bː aː t j a m
ɛ r g aː s t ʊ l ʊ m	ɛ r g a s t ʊ l ʊ m
a w ɛ m lː a m n a m	a b ɛ lː a n a m
k ɔ k ʊ lː ʊ m	k ʊ k ʊ lː ʊ m
k j iː n kʷ ɛ m k	kʷ ɛ m k ʊ m kʷ ɛ
s uː s uː rː ʊ m	s ʊ s ʊ rː ʊ m
f ɛ k ʊ n d ɔ	f eː k ʊ n d ʊ m
m iː l aː r j ʊ m	m iː lː j aː r j ʊ m
ʊ m b s ɛ kʷ j ʊ m	ɔ b s ɛ kʷ j ʊ m
k ɔ m ɔ n j ʊ m n ɛ m	k ɔ mː uː n iː r ɛ
a l t ɛ r k a t j ʊ m n ɛ m	a l t ɛ r k aː t j oː n ɛ m
rː d r iː k n	r ɪ d ɪ k a m
s t iː s f kʷ ɛ r ɛ	s a t ɪ s f a k ɛ r ɛ
s p uː t aː r ɛ	s p uː t aː r ɛ
r ʊ ʊ	r uː k t ʊ m
s ʊ s p iː r j aː r ɛ	s ʊ s p iː r aː r ɛ
p r ɔ s k r ɪ w ɛ r ɛ	p r oː s k r iː b ɛ r ɛ
t ʊ n d ɛ r ɛ	t ɔ n d eː r ɛ
k ɔ k s a l ɛ	k ɔ k s aː l ɛ m
ɪ n t ɛ m lː ɛ k k j ʊ n ɛ m	ɪ n t ɛ lː ɛ k t j oː n ɛ m
d ɛ n t iː f r iː k ʊ m	d ɛ n t ɪ f r ɪ k j ʊ m
k ɔ n d ɛ n s a t j ʊ m n ɛ m	k ɔ n d eː n s aː t j oː n ɛ m
g a m lː ɛ g ʊ m	g a lː aɪ k ʊ m
ʊ m l eː r ɛ	ɔ l eː r ɛ
iː m p ɛ r j oː s ʊ m	ɪ m p ɛ r j oː s ʊ m
a m n ɔ m a m l ʊ m	a n oː m a l ɔ n
f a r t aː r ɛ	f a r k iː r ɛ
ɛ k iː k ɔ r j aː	k ɪ kʰ ɔ r j ʊ m
k ɔ ŋ g j ʊ m	k ɔ ŋ g j ʊ m
k ɛ m r t aː r ɛ	k ɛ r t aː r ɛ
ɛ k s p l ɔ r a m d ɔ r	ɛ k s p l oː r aː t oː r ɛ m
kʷ ɛ r ɛ l a m	kʷ ɛ r eː l a m
a m f j a n k aː r	a fː ɪ d ɛ n t j aː r ɛ
a m l uː m n ʊ m	a l ʊ m n ʊ m
r ɛ k ɛ s iː w ʊ m	r ɛ k ɛ sː iː w ʊ m
s ɔ l iː d ʊ m	s ɔ l ɪ d ʊ m
d ɛ s t iː n aː r ɛ	d eː s t ɪ n aː r ɛ
m ɔ lː ɛ k ɛ m	m ɔ lː ɪ t ɪ ɛ m
ɔ b ʊ m h	ɔ b w j ʊ m
s t uː p eː r ɛ	s t ʊ p eː r ɛ
g r aː w iː d ʊ m	g r a w ɪ d ʊ m
a w ɛ n a m	a w eː n a m
p r a ŋ d d ʊ m	p r a n d j ʊ m
iː n s uː l s ʊ m	iː n s ʊ l s ʊ m
k a m n ɔ r ʊ m	k a n oː r ʊ m
p r ɔ w ɛ n iː r ɛ	p r oː w ɛ n iː r ɛ
t r iː t uː r a m	t r iː t uː r a m
r aː j a m	r a j a m
kʷ a d r uː p l a m r ɛ	kʷ a d r ʊ p l aː r ɛ
ɛ k s t ɛ r m iː n a t j oː n	ɛ k s t ɛ r m ɪ n aː t j oː n ɛ m
p r ɔ s ɛ n j ɔ m	p r ɔ s k eː n j ʊ m
ɪ n k eː n d ɛ m r ɛ	ɪ ŋ k ɛ n d ɛ r ɛ
p uː b ɛ	p uː b ɛ r ɛ m
a w ɛ r s j oː n ɛ	aː w ɛ r s j oː n ɛ m
w ɛ aː r ɛ	w eː n aː r iː
r eː w ʊ l w ɛ r ɛ	r ɛ w ɔ l w ɛ r ɛ
m k ʊ r t aː r ɛ	k ʊ r t aː r ɛ
a m k uː m ɛ m	a k uː m ɛ n
p j ɛ r n a m	p ɛ r n a m
t ɛ s uː r a m	t eː n s uː r a m
w ɛ r t iː g ɪ n ɛ	w ɛ r t iː g ɪ n ɛ m
l iː b ɛ r a t oː r ɛ	l iː b ɛ r aː t oː r ɛ m
a f ɪ r m a t j ʊ m n ɛ m	a fː ɪ r m aː t j oː n ɛ m
iː n s ɛ r iː r ɛ	iː n s ɛ r ɛ r ɛ
r iː g ʊ r oː s ʊ m	r ɪ g ɔ r ɔ s ʊ m
r ɛ p ɛ r k uː s j ʊ m n ɛ m	r ɛ p ɛ r k ʊ t ɛ r ɛ
r uː b ɪ g iː n oː s ʊ m	r oː b iː g ɪ n oː s ʊ m
a lː ɔ k aː ɛ	a lː ɔ k aː r ɛ
l ɛ m t iː t j aː m	l aɪ t ɪ t j a m
m a l t a m	m a l tʰ a m
aː k t ʊ m	aː k t ʊ m
k aː l k eː	k a l k ɛ m
s ɛ k s w ʊ a l iː t aː t ɛ m	s ɛ k s w aː l ɪ t aː t ɛ m
iː n f l iː k t j oː n ɛ m	ɪ n f l ɪ k t j oː n ɛ m
f ɛ k ʊ l ɛ n t ʊ m	f aɪ k ʊ l ɛ n t ʊ m
r ɛ t a r d a m r ɛ	r ɛ t a r d aː r ɛ
ɛ w ʊ m	aɪ w ʊ m
k ɛ l ɛ s t j a l ɛ	k aɪ l ɛ s t j aː l ɛ m
f ʊ l iː g ɪ n ɛ	f uː l iː g ɪ n ɛ m
ɛ m uː l ʊ m	aɪ m ʊ l ʊ m
f ɪ m b r j aː t ʊ m	f ɪ m b r j aː t ʊ m
a lː ɛ g aː r ɛ	a lː ɛ g ɛ r ɛ
s aː t iː s f a k t j oː n ɛ m	s a t ɪ s f a k t j oː n ɛ m
m aː g iː k ʊ m	m a g ɪ k ʊ m
k r oː ŋ g r ɛ j ʊ m	k ɔ ŋ g r ʊ m
p uː p iː lː ʊ m	p uː p ɪ lː ʊ m
r ɛ f l ɛ t ɛ r ɛ	r ɛ f l ɛ k t ɛ r ɛ
ɪ ŋ g l ɛ m s ɛ	a ŋ g l eː n s ɛ m
p ɛ r k uː s ɔ r	p ɛ r k ʊ sː oː r ɛ m
aː r k a m	a r kʰ a m
a b aː k uː l ʊ m	a b a k ʊ l ʊ m
iː m p ɔ s iː t j ʊ m n ɛ m	ɪ m p ɔ s ɪ t j oː n ɛ m
k uː p iː d iː t aː	k ʊ p ɪ d ɪ t aː t ɛ m
s a k r a m ɛ n t a l ɛ m	s a k r aː m ɛ n t aː l ɛ m
ɔ r ɛ ʊ m	h ɔ rː ɛu m
d iː f l uː ɛ r	d ɪ fː l ʊ ɛ r ɛ
ɛ k s k r ɛ t aː r	ɛ k s k ɛ r n ɛ r ɛ
m ɛ r ɛ t r iː k j ʊ m	m ɛ r ɛ t r iː k j ʊ m
d ɔ l aː r ɛ	d ɔ l aː r ɛ
k uː w iː l	k ʊ b iː l ɛ
r ɛ k ɔ n k iː l j a t j ʊ m n ɛ m	r ɛ k ɔ ŋ k ɪ l j aː t j oː n ɛ m
a r m aː r ɛ	a r m aː r ɛ
f iː r ɛ m	f ɪ ɛ r iː
k ɔ l ɔ n j aː ɛ	k ɔ l oː n j a m
a m s ɔ l aː r	a sː ɔ l aː r ɛ
d ɛ f ɔ r m ɛ	d eː f oː r m ɛ m
ɛ m a k t aː	ɛ m aː k ɪ t aː t ɛ m
a k k ɛ s ɔ r j ʊ m	a kː ɛ sː oː r j ʊ m
k ɔ n s iː k n a t j oː n	k oː n s ɪ ŋ n aː t j oː n ɛ m
a m m a m n ʊ ɛ n s ɛ	aː m a n ʊ eː n s ɛ m
a b s t r uː s ʊ	a b s t r uː s ʊ m
ɔ r k ʊ m	ɔ r k ʊ m
b j ɛ n ɛ	b ɪ ɛ nː ɛ m
p ɔ n t ɪ f iː k ɛ m	p ɔ n t ɪ f ɪ k ɛ m
k ɔ n t ɛ m p l a m r ɛ	k ɔ n t ɛ m p l aː r iː
s t r iː g ɛ	s t r ɪ g ɛ m
l a m k uː s t r ɛ	l a k ʊ s t r ɛ m
t ɔ r p ɛ	t ʊ r p ɛ m
f r a n k ɛ s ɛ	f r a ŋ k eː n s ɛ m
r ɛ t r a k t j ʊ m n ɛ m	r ɛ t r a k t j oː n ɛ m
f uː l w ʊ m	f ʊ l w ʊ m
g ɛ ɔ g r a f j ɪ a m	g eː ɔ g r a pʰ j a m
n ɔ r m a m	n oː r m a m
iː t iː n ɛ r aː r j ʊ m	ɪ t ɪ n ɛ r aː r j ʊ m
kʷ ɛ s iː t ʊ m	kʷ aɪ s iː t ʊ m
p iː p aː r ɛ	p iː p aː r ɛ
b a s t ɛ r n a m	b a s t ɛ r n a m
n ɔ m iː n a t j oː n ɛ	n oː m ɪ n aː t j oː n ɛ m
g a l ɛ n a m	g a l eː n a m
d ɛ m w j a m r ɛ	d eː w j aː r ɛ
f l a m m ɛ n ?	f a m eː l ɪ k ʊ m
f ʊ l g ʊ m r ɛ	f ʊ l g oː r ɛ m
iː m p ɔ r t uː n iː t aː t ɛ m	ɪ m p ɔ r t uː n ɪ t aː t ɛ m
p r j ɔ r ɛ m	p r j oː r ɛ m
ɔ s t ɛ n s iː w ʊ m	ɔ s t eː n s iː w ʊ m
ɔ b t ɛ n ɛ r ɛ	ɔ b t ɪ n eː r ɛ
k ɔ n k ɔ r d j a m	k ɔ ŋ k ɔ r d j a m
m ɛ d iː r	m eː t iː r iː
n ɛ r w j oː s ʊ m	n ɛ r w oː s ʊ m
s uː b s iː d j ʊ m	s ʊ b s ɪ d j ʊ m
p a l ʊ m	p aː l ʊ m
r aː k ɛ m ʊ m	r a k eː m ʊ m
a m l iː t ʊ m	h aː l ɪ t ʊ m
k a l iː g a m	k a l ɪ g a m
k ɔ n s uː l t a t j ʊ m n ɛ m	k oː n s ʊ l t aː t j oː n ɛ m
f uː r t ʊ m	f uː r t ʊ m
m uː n iː k iː p a l ɛ	m uː n ɪ k ɪ p aː l ɛ m
t r iː k ɛ	t r iː k ɛ m
s p ɛ l t a m	s p ɛ l t a m
p uː l k r iː t uː d ɛ m	p ʊ l kʰ r ɪ t uː d ɪ n ɛ m
w ɛ r ɛ k ʊ n d j a m	w ɛ r eː k ʊ n d j a m
ɛ s t ɛ l aː r	s t eː lː aː r ɛ m
b lː ɛ t ɛ m m ɛ	b l a s pʰ eː m aː r ɛ
k r ɛ d ɪ t oː r ɛ	k r eː d ɪ t oː r ɛ m
d iː s p ɔ r ɛ m	d ɪ s p oː n ɛ r ɛ
t iː d a m	k iː d a m
w iː t uː p ɛ r a t j ʊ m n ɛ	w ɪ t ʊ p ɛ r aː t j oː n ɛ m
a s k ɛ n s j ʊ m n ɛ m	a s k eː n s j oː n ɛ m
g aʊ d j ʊ m	g aʊ d j ʊ m
d ɛ s ɪ d ɛ r aː r ɛ	d eː s iː d ɛ r aː r ɛ
r ɛ k ɔ n k iː l j aː r ɛ	r ɛ k ɔ ŋ k ɪ l j aː r ɛ
p a l uː d ɛ	p a l uː d ɛ m
iː n a l aː r ɛ	ɪ n h aː l aː r ɛ
a s t r ɪ n g ɛ r ɛ m	a s t r ɪ ŋ g ɛ r ɛ
a m ɛ n ʊ m	a m ɔ ɪ n ʊ m
f a b r iː k a t j ʊ m n ɛ m	f aː b r ɪ k aː t j oː n ɛ m
m ʊ n d ʊ m	m ʊ n d ʊ m
a r g iː lː a m	a r g ɪ lː a m
m uː n iː k iː p j ʊ m	m uː n ɪ k ɪ p j ʊ m
p r ɔ l ɛ	p r oː l ɛ m
r ɪ g ʊ m	r iː w ʊ m
a b s uː r d ɪ t aː t ɛ m	a b s ʊ r d ɪ t aː t ɛ m
m ɛ n t ʊ m	m ɛ n t ʊ m
a m iː k iː t j a m	a m iː k ɪ t j a m
p ɛ s t a r ɛ	p ɪ s t aː r ɛ
