eː d ɪ k ʊ l a m	aɪ d ɪ k ʊ l a m
s p ɛ k ʊ ʊ m	s p ɛ k ʊ l ʊ m
s t ɪ m uː lː a t j oː n ɛ m	s t ɪ m ʊ l aː t j oː n ɛ m
b ɪ b l j ɛ ɔ t ɛ k aː r j ʊ m	b ɪ b l ɪ ɔ tʰ eː k aː r j ʊ m
k aː r m ɛ m	k a r m ɛ n
k ɔ s t ɪ t ʊ ɪ r ɛ	k oː n s t ɪ t ʊ ɛ r ɛ
a s k ɛ n s j ʊ n ɛ m	a s k eː n s j oː n ɛ m
p a r t ɪ t j ʊ n ɛ m	p a r t iː t j oː n ɛ m
b r aː k a m	b r aː k a m
ɪ lː uː d ɪ r ɛ	ɪ lː uː d ɛ r ɛ
h ʊ ŋ g ɛ r ɛ m	ʊ ŋ g ɛ r ɛ
k ɔ d a m	k aʊ d a m
a d ɪ t ʊ m	a d ɪ t ʊ m
k ɪ t aː r a m	k ɪ tʰ a r a m
ɔ l eː r ɛ	ɔ l eː r ɛ
f uː l g ɛ r ɛ	f ʊ l g eː r ɛ
ɛ k s ɛ k r a t j ʊ n ɛ m	ɛ k sː eː k r aː t j oː n ɛ m
p r ɛ k ɛ d ɛ r ɛ	p r aɪ k eː d ɛ r ɛ
r ɪ t ɔ r k ɛ r ɛ	r ɛ t ɔ r kʷ eː r ɛ
k a m b j ʊ m	k a m b j ʊ m
t r uː k uː l ɛ n t ʊ m	t r ʊ k ʊ l ɛ n t ʊ m
k ɪ r k ʊ n w ɛ n ɪ r ɛ	k ɪ r k ʊ m w ɛ n iː r ɛ
f a r m a k ɪ ʊ t ɪ k ʊ m	pʰ a r m a k ɛu t ɪ k ʊ m
ɪ n k ʊ rː ɛ r ɛ	ɪ ŋ k ʊ rː ɛ r ɛ
a pː ɔ s t ʊ m	a pː ɔ s ɪ t ʊ m
r aː k ɛ m ʊ m	r a k eː m ʊ m
d ɛ l ɪ b ɛ r a t j ʊ n ɛ m	d eː l iː b ɛ r aː t j oː n ɛ m
n ɛ k r ɪ t a m	n ɪ g r ɪ t j a m
g uː s t ɪ f ɪ k a t ʊ r ɛ	j uː s t ɪ f ɪ k aː t oː r ɛ m
k ɔ n t ɛ n t ʊ m	k ɔ n t ɛ n t ʊ m
d ɪ m ɛ n s j ʊ n ɛ m	d iː m ɛ n s j oː n ɛ m
p ɔ lː ɪ k ɛ m	p ɔ lː ɪ k ɛ m
m ɛ d ɪ t a b ʊ n d ʊ m	m ɛ d ɪ t aː b ʊ n d ʊ m
p r ɛ t r ɛ ŋ s ɪ l ʊ m	p ɛ t r ɔ s ɛ l iː n ʊ m
f uː r oː r ɛ	f uː r aː r iː
p ɔ m ɛ t ʊ m	p ɔ m eː t ʊ m
p ɔ r t j ʊ m	p ɔ r t j oː n ɛ m
p a r t ɪ r ɛ	p a r t iː r ɛ
r ɛ f ɔ r m aː r ɛ	r ɛ f oː r m aː r ɛ
d ɪ s t ɪ lː a t j ʊ n ɛ m	d ɪ s t ɪ lː a t j oː n ɛ m
k a r a m ɛ lː ʊ m	k a l a m ɛ lː ʊ m
ɪ d ʊ n ɛ ɛ m ʊ m	ɪ d oː n ɛ ɪ t aː t ɛ m
a k j a m	a k j a m
p r ɪ w aː t ʊ m	p r iː w aː t ʊ m
k ɔ m ɛ r k j a l ɛ	k ɔ mː ɛ r k j aː l ɛ m
m uː t w aː r ɛ	m uː t w aː r iː
a k t oː r ɛ	aː k t oː r ɛ m
ɛ r a m a n d aː d ɛ m	g ɛ r m aː n ɪ t aː t ɛ m
w oː m ɪ k ʊ m	w ɔ m ɪ k ʊ m
d uː r ʊ m	d uː r ʊ m
ɪ s k ʊ m	ɪ s k ʊ m
ʊ k s w ɛ m	uː ŋ k t j oː n ɛ m
a d k uː d ɪ k aː r ɛ	a d ɪ uː d ɪ k aː r ɛ
k ʊ lː ʊ k aː r ɛ	k ɔ lː ɔ k aː r ɛ
p r ɛ w j ʊ m	p r aɪ w j ʊ m
w ɔ t ɪ f ɛ r aː r ɛ	w oː k ɪ f ɛ r aː r iː
ɪ n t ɛ r k ɛ d ɛ r ɛ	ɪ n t ɛ r k eː d ɛ r ɛ
w a r oː n ɛ m	w aː r oː n ɛ m
n ɪ d ɪ f ɔ r m ɛ	n iː d ɪ f oː r m ɛ m
ɪ l a r ɛ	h ɪ l a r ɛ m
a k uː m ɛ m	a k uː m ɛ n
k aː n ʊ m	k aː n ʊ m
k a p ɪ t l ʊ m	k a p ɪ t ʊ l ʊ m
k ɔ m p ɛ t ɪ t oː r ɛ	k ɔ m p ɛ t iː t oː r ɛ m
s k r ɪ n j ʊ m	s k r iː n j ʊ m
k ʊ l ɛ m	k aʊ l ɛ m
ɛ k s a k ɛ r b a t j ʊ n ɛ m	ɛ k s a k ɛ r b aː t j oː n ɛ m
r ɪ g ʊ r ɔ s ʊ m	r ɪ g ɔ r ɔ s ʊ m
w ɪ w aː r j ʊ m	w iː w aː r j ʊ m
f ɔ k ɛ	f aʊ k ɛ m
r ɛ p l ɪ k a t j oː n ɛ	r ɛ p l ɪ k aː t j oː n ɛ m
p j ɔ m	p j ʊ m
a b ɪ t w aː l ɛ	h a b ɪ t w aː l ɛ m
l ɛ m n aː r j ʊ m	l ɪ ŋ n aː r j ʊ m
w ɛ ɛ r ɛ m	w ɛ lː ɛ r ɛ
uː l t ʊ r ɛ	ʊ l t oː r ɛ m
kʷ a d r uː p l ɪ k aː r ɛ	kʷ a d r ʊ p l ɪ k aː r ɛ
k a p t uː r a m	k a p t uː r a m
ɪ n t ɛ r ɛ m ɛ t ɛ r s ɛ m	ɪ n t ɛ r m ɪ tː ɛ r ɛ
ɪ n k l ɪ t ʊ m	ɪ ŋ k l ɪ t ʊ m
h ɛ k s iː r	ɛ k s iː r ɛ
f ɛ r j a m	f eː r j aː s
w ɛ n d ɛ m j a m	w iː n d eː m j a m
p a l p ɪ t a t j oː n ɛ m	p a l p ɪ t aː t j oː n ɛ m
g ʊ n t uː r a m	j uː ŋ k t uː r a m
j ɛ t aː r ɛ	j a k t aː r ɛ
s t ɔ r a m	s t ɔ r ɛ a m
ɪ n kʷ j ɛ t uː d ɪ n ɛ m	ɪ ŋ kʷ ɪ eː t uː d ɪ n ɛ m
ɔ b s ɛ kʷ j ʊ m	ɔ b s ɛ kʷ j ʊ m
ɪ n t ɛ r d ɪ k ɛ r ɛ	ɪ n t ɛ r d iː k ɛ r ɛ
s aː k r ʊ m	s a k r ʊ m
s a g ɪ t aː r j ʊ m	s a g ɪ tː aː r j ʊ m
p a r s ɪ m ɔ n j a m	p a r k ɪ m oː n j a m
s aː r g ʊ m	s a r g ʊ m
eː m ɛ t ɛ r ɛ	eː m ɪ tː ɛ r ɛ
d ɛ t eː n ɛ r ɛ	d eː t ɪ n eː r ɛ
p r a n r ɛ r ɛ m	p r a n d eː r ɛ
b a l b ʊ t a r ɛ	b a l b uː t iː r ɛ
b ɛ lː ɪ k ʊ m	b ɛ lː ɪ k ʊ m
d ɛ s uː m ɪ r ɛ	d eː s uː m ɛ r ɛ
g r ɔ n ɪ r ɛ	g r ʊ nː iː r ɛ
s uː pː l ɪ k a t j ʊ n ɛ m	s ʊ pː l ɪ k aː t j oː n ɛ m
s a k ɛ r d ɔ t ɛ m	s a k ɛ r d oː t ɛ m
w eː l a r ɛ	w ɛ l a m
k ɪ r k ʊ n l ʊ k uː t j ʊ n ɛ	k ɪ r k ʊ m l ɔ k uː t j oː n ɛ m
aː b ʊ l aː r ɛ	f aː b ʊ l aː r iː
a d uː l t ɛ r ɪ n ʊ m	a d ʊ l t ɛ r iː n ʊ m
k a l a m ɪ t ɔ s ʊ m	k a l a m ɪ t oː s ʊ m
k r ɛ m a m	k r aː m ʊ m
t r a s g r ɛ d ɪ r ɛ	t r aː n s g r ɛ d iː
s a j ɪ t aː r ɛ	s a g ɪ tː aː r ɛ
a l ɔ s	a l aʊ s a m
p a l p ɪ t aː r ɛ	p a l p ɪ t aː r ɛ
n uː m ɛ r a t ʊ r ɛ	n ʊ m ɛ r aː t oː r ɛ m
w a lː a r ɛ	w a lː aː r ɛ
m ɛ r ɛ n d a m	m ɛ r ɛ n d a m
w ɛ n ɛ r aː r ɛ	w ɛ n ɛ r aː r iː
r uː t ɪ lː aː r ɛ	r ʊ t ɪ l aː r ɛ
s k r uː t a r ɛ	s k r uː t aː r ɛ
f ɪ n a l ɪ t eː t ɛ m	f iː n aː l ɪ t aː t ɛ m
f a s t ɪ d j ʊ m	f a s t iː d j ʊ m
k a r ɪ k k ɛ m	k aː r ɪ k ɛ m
p iː n t uː r a m	p ɪ k t uː r a m
p uː p ɪ lː ʊ m	p uː p ɪ lː ʊ m
a l w ɛ ʊ m	a l w ɛu m
f r ɔ n d	f ʊ n d a m
ɪ rː ɪ g aː r ɛ	ɪ rː ɪ g aː r ɛ
a gː l ʊ m ɛ r aː r ɛ	a gː l ɔ m ɛ r aː r ɛ
w ɪ k ɪ n ɪ t aː t ɛ m	w iː k iː n ɪ t aː t ɛ m
ɪ n s uː l s ʊ m	iː n s ʊ l s ʊ m
l aʊ r ɛ ʊ m	l aʊ r ʊ m
ɛ k s p uː l s aː r ɛ	ɛ k s p ʊ l s aː r ɛ
eː s ɛ k j ɛ m	ɛ k sː ɛ kʷ j a m
d ɪ s t r ɪ k t ʊ m	d ɪ s t r ɪ k t ʊ m
g a l ɛ r ʊ m	g a l eː r ʊ m
k ɛ ŋ t aː r ɛ	kʷ ɪ eː t aː r ɛ
t r ɪ p l ʊ m	t r ɪ p l ʊ m
a s ɪ s ʊ m	a sː ɛ sː ʊ m
a r b ɪ t r aː r ɛ	a r b ɪ t r aː r iː
w ɛ r g a m	w ɪ r g a m
m a t uː r aː r ɛ	m aː t uː r aː r ɛ
k ʊ m p ɛ lː ɪ r ɛ	k ɔ m p ɛ lː ɛ r ɛ
d ʊ l k ɪ f ɪ k aː r ɛ	d ʊ l k ɪ f ɪ k aː r ɛ
s t r ɛ p ɪ t ʊ m	s t r ɛ p ɪ t ʊ m
g ʊ w ɛ r n a t ɔ r ɛ m	g ʊ b ɛ r n aː t oː r ɛ m
d eː l ɛ k t a t j oː n ɛ m	d eː l ɛ k t aː t j oː n ɛ m
p r ʊ l ɔ kʷ j ʊ m	p r oː l ɔ kʷ j ʊ m
d ɛ p uː r aː r ɛ	d eː p uː r aː r ɛ
s aː t ɪ s f a k t j oː n ɛ m	s a t ɪ s f a k t j oː n ɛ m
p r oː ɛ w a m	p r ɔ b a m
ɛ fː ʊ n d ɪ r ɛ	ɛ fː ʊ n d ɛ r ɛ
n a w ɪ g aː r ɛ	n aː w ɪ g aː r ɛ
p aː r ʊ m	p a r ɛ m
g l aʊ k ʊ m	g l aʊ k ʊ m
r ɛ kː a t aː r ɛ	r ɛ k a p t j aː r ɛ
k a n s aː r ɛ	k a m p s aː r ɛ
m ɛ r g ɛ r ɛ	m ɛ r g ɛ r ɛ
p r ɔ m ɛ s a m	p r oː m ɪ sː ʊ m
uː b ɪ k a t j oː n ɛ m	ʊ b ɪ k aː t j oː n ɛ m
b l eː t ɪ m ɛ	b l a s pʰ eː m aː r ɛ
ɪ n t ɛ lː ɛ k t ʊ m	ɪ n t ɛ lː eː k t ʊ m
k ɔ r ɔ n ɪ d ʊ m	k ɔ r oː n ɪ d ɛ m
s oː r ɛ ʊ a m	s ɔ r oː r ɛ m
r ɛ g ʊ l a r ɪ t aː t ɛ m	r eː g ʊ l aː r ɪ t aː t ɛ m
s ʊ b g ʊ k g aː r ɛ	s ʊ b j ʊ g aː r ɛ
r d r ɛ k m	r ɪ d ɪ k a m
t ɛ m ɛ r ɪ t aː t ɛ m	t ɛ m ɛ r ɪ t aː t ɛ m
k l a m oː r ɛ	k l aː m oː r ɛ m
p a lː oː r ɛ	p a lː oː r ɛ m
a k ʊ m	a k ʊ m
m ʊ l aː r ɛ	m ɔ l aː r ɛ m
d ɪ s t r ɛ ɛ r ɛ	d ɪ s t r a h ɛ r ɛ
a b ɔ rː ɪ r ɛ	a b h ɔ rː eː r ɛ
p l a n t aː r ɛ	p l a n t aː r ɛ
s a k r ɪ l ɛ g ʊ m	s a k r ɪ l ɛ g ʊ m
s ʊ p ɛ r b j ʊ m	s ʊ p ɛ r b ʊ m
a r b uː s t ɪ w ʊ m	a r b ʊ s t iː w ʊ m
a r k ɛ t ɪ p ʊ m	a r kʰ ɛ t y p ʊ m
f ɪ l j a l ɛ	f iː l j aː l ɛ m
a n ɔ n a m	a nː oː n a m
n ɔ ɪ s	n oː s
p r ɔ w ɛ n ɪ r ɛ	p r oː w ɛ n iː r ɛ
s t r ɛ n w ʊ m	s t r eː n ʊː m
a d uː r a s w ɛ m	a d ɪ uː r aː t j oː n ɛ m
f aː r a t ʊ m	f a r t ʊ m
s k r uː t ɪ n j ʊ r ɛ	s k r uː t ɪ n j ʊ m
ɪ n f ɛ l ɪ k ɛ	iː n f eː l iː k ɛ m
d eː ŋ w a n ɛ ɪ r ɛ	eː w aː n eː s k ɛ r ɛ
p l a t ɛ ɛ a m	p l a t eːa m
k ɔ n s a k r a t j ʊ n ɛ m	k oː n s ɛ k r aː t j oː n ɛ m
k ɪ t ɛ r j oː r ɛ	k ɪ t ɛ r j oː r ɛ m
a r gʷ ɛ r ɛ	a r gʷ ɛ r ɛ
t ɛ r g ɪ w ɛ r s aː r ɛ	t ɛ r g ɪ w ɛ r s aː r iː
s ʊ b m ɛ r s j oː n ɛ m	s ʊ mː ɛ r s j oː n ɛ m
r a p aː k ɛ	r a p aː k ɛ m
p ɪ t aː r ɛ	p ɪ ŋ g ɛ r ɛ
f l ɛ k t ɛ r ɛ	f l ɛ k t ɛ r ɛ
k uː r w aː r ɛ	k ʊ r w aː r ɛ
aʊ r ɪ k ʊ l a m	aʊ r ɪ k ʊ l a m
b l a n d ɪ r ɛ	b l a n d iː r iː
a s t r ɪ ŋ g ɛ r ɛ m	a s t r ɪ ŋ g ɛ r ɛ
k ɛ n s uː r ʊ m	k eː n s uː r a m
l ʊ n t r j a m	l ʊ t r a m
s ɪ l ɪ k ɛ m	s ɪ l ɪ k ɛ m
p r ɔ t ɛ s t aː r ɛ	p r oː t ɛ s t aː r iː
d s ɛ f ɪ r ʊ m	z ɛ pʰ y r ʊ m
l g ɪ r ʊ m	g l iː r ɛ m
a fː ɛ k t ʊ m	a fː ɛ k t ʊ m
ɪ n k ɪ t a t j ʊ n ɛ m	ɪ ŋ k ɪ t aː t j oː n ɛ m
m a n uː b r j ʊ m	m a n uː b r j ʊ m
k ɔ n d ɛ n s a t j ʊ n ɛ m	k ɔ n d eː n s aː t j oː n ɛ m
r ɛ t j aː r j ʊ m	r eː t j aː r j ʊ m
ɔ b s t aː r ɛ	ɔ b s t aː r ɛ
s a p j ɛ n t j a m	s a p ɪ ɛ n t j a m
ʊ s uː r	uː s uː r a m
p ɛ k ʊ r a m	p ɛ k ʊ s
h ɛ lː ʊ m	ɛ lː ʊ m
a g ɪ l ɪ t aː t ɛ m	a g ɪ l ɪ t aː t ɛ m
d ɛ n uː d aː r ɛ	d eː n uː d aː r ɛ
r ɪ d ɛ r ɛ	r iː d eː r ɛ
d ɪ s ɛ m ɪ n aː r ɛ	d ɪ sː eː m ɪ n aː r ɛ
w iː d ʊ m	w ɔ k ɪ t ʊ m
s a k r aː r ɛ	s a k r aː r ɛ
a k r ɛ s ɛ r ɛ	a kː r eː s k ɛ r ɛ
ɪ t r iː s ɛ k ʊ m	ɪ n t r iː n s ɛ k ʊ m
m ɛ t ɛ r ɛ	m ɪ tː ɛ r ɛ
eː m a n k ɪ p a t j ʊ n ɛ m	eː m a ŋ k ɪ p aː t j oː n ɛ m
s ʊ l aː r ɪ j ʊ m	s oː l aː r j ʊ m
l uː b r ɪ k ʊ m	l uː b r ɪ k ʊ m
k r ɔ n ɪ k ʊ m	kʰ r ɔ n ɪ k ʊ m
k a r ɛ n a m	k a r iː n a m
p ɔ pː a m	p ʊ pː ɛ m
k ɔ n s a n gʷ ɪ n ɪ t aː t ɛ m	k oː n s a ŋ gʷ ɪ n ɪ t aː t ɛ m
r ɛ g j ʊ m	r eː g j ʊ m
l ʊ p a m	l ʊ p a m
m ɛ m b r a n a k ɛ ʊ m	m ɛ m b r aː n aː k ɛu m
a l t ɛ r n a t j ʊ n ɛ	a l t ɛ r n aː t j oː n ɛ m
p ɔ r n ɔ g r a f j a m	p ɔ r n ɔ g r a pʰ j a m
s ɛ n s ʊ m	s eː n s ʊ m
ɪ n w ɪ k t ʊ m	ɪ n w ɪ k t ʊ m
k aʊ d a l ɛ	k aʊ d aː l ɛ m
b ɛ n ɪ ŋ n ʊ m	b ɛ n ɪ ŋ n ʊ m
uː r l aː r ɛ	ʊ l ʊ l aː r ɛ
k ɔ k ʊ m	s ɔ kː ʊ m
ɪ n g ɛ n ʊ m	ɪ ŋ g ɛ n j ʊ m
s uː p ɛ r b	s ʊ p ɛ r b j a m
t ɛ n ʊ ɛ	t ɛ n ʊ ɛ m
k ɔ n k uː s j ʊ m	k ɔ ŋ k ʊ sː j oː n ɛ m
m ɔ r t a l ɪ t aː t ɛ m	m ɔ r t aː l ɪ t aː t ɛ m
k ɔ n s uː l t a t j ʊ n ɛ m	k oː n s ʊ l t aː t j oː n ɛ m
p r ɛ w a l eː r ɛ	p r aɪ w a l eː r ɛ
p r ɛ g ʊ d ɪ t j ʊ m	p r aɪ j uː d ɪ k j ʊ m
w oː t ʊ m	w oː t ʊ m
s k ɔ t j a m	s k ɔ t j a m
p ɛ t iː r ɛ	p ɛ t ɛ r ɛ
m ɪ n uː l a s	m ɪ n uː t j a m
ɪ n kʷ j ɛ t aː r ɛ	ɪ ŋ kʷ ɪ eː t aː r ɛ
ɔ pː ɔ r t uː n ɪ t aː t ɛ m	ɔ pː ɔ r t uː n ɪ t aː t ɛ m
g a rː uː l ʊ m	g a rː ʊ l ʊ m
t r ɛ p ɪ d aː r ɛ	t r ɛ p ɪ d aː r ɛ
d ɛ w ʊ l w ɛ r ɛ	d eː w ɔ l w ɛ r ɛ
ɪ n t ɛ g r aː r ɛ	ɪ n t ɛ g r aː r ɛ
s p ɛ k uː l a t ɪ w ʊ m	s p ɛ k ʊ l aː t iː w ʊ m
f a w oː r ɛ m	f a w oː r ɛ m
b aː s aː r ɛ	b aː s j aː r ɛ
s t r ɪ g ɪ l ɛ	s t r ɪ g ɪ l ɛ m
m ɛ t ɪ k ʊ l oː s ʊ m	m ɛ t ɪ k ʊ l oː s ʊ m
ɪ n uː l t ʊ m	ɪ n ʊ l t ʊ m
a s ʊ lː aː r ɛ	a sː ɔ l aː r ɛ
a l t ɛ r k aː r ɛ	a l t ɛ r k aː r iː
r ɛ t oː r ɛ	r h eː t ɔ r ɛ m
uː s ɪ t aː t ʊ m	uː s ɪ t aː t ʊ m
ɔ n uː s t ʊ m	ɔ n ʊ s t ʊ m
f a s k ɪ n j ʊ m	f a s k ɪ n ʊ m
ŋ p ɪ l aː r ɛ	p ɪ l aː r ɛ
a w ɛ k n a m	a w eː n a m
t ɛ n ɛ r n ʊ m	t ɛ n ɛ r ʊ m
s p uː r j ʊ m	s p ʊ r j ʊ m
m a k ɛ lː ʊ m	m a k ɛ lː ʊ m
uː s w aː l ɛ	uː s w aː l ɛ m
s uː p lː ɛ m ɛ n t ɛ m	s ʊ pː l eː m ɛ n t ʊ m
r ɪ p a m	r iː p a m
g aː t a m	k a tː a m
k a pː ɛ lː a m	k a pː ɛ lː a m
k a m b j aː r ɛ	k a m b iː r ɛ
n ɔ d oː s ʊ m	n oː d oː s ʊ m
l uː k uː b r a t j oː n ɛ m	l uː k ʊ b r aː t j oː n ɛ m
a g r ɛ s t ɛ m	a g r ɛ s t ɛ m
n a rː a t j ʊ m	n aː rː aː t j oː n ɛ m
ɪ n k uː b ʊ m	ɪ ŋ k ʊ b ʊ m
a p a r ɛ t ɛ r ɛ	a pː aː r eː s k ɛ r ɛ
k ɔ n k l a m r ɛ	k ɔ ŋ k l aː m aː r ɛ
k l ʊ k r ɛ	g l oː k iː r ɛ
oː s k ʊ l ʊ m	oː s k ʊ l ʊ m
k r ɪ m ɪ n ɔ s ʊ m	k r iː m ɪ n oː s ʊ m
m a j ɛ s t aː t ɛ m	m a j ɛ s t aː t ɛ m
w ɪ s ɪ t a t j ʊ n ɛ	w iː s ɪ t aː t j oː n ɛ m
w aɪ r a m	w ɪ r ɪ d ɛ m
b a j ʊ aː r ɛ	b aː j ʊ l aː r ɛ
b a l t ɪ k ʊ m	b a l t ɪ k ʊ m
p r oː n ʊ m	p r oː n ʊ m
ɔ r a t oː r ɛ	oː r aː t oː r ɛ m
ɛ rː aː r ɛ	ɛ rː aː r ɛ
d ɛ s t ɪ n a t j ʊ m	d eː s t ɪ n aː t j oː n ɛ m
a d uː l a t oː r ɛ	a d uː l aː t oː r ɛ m
d j a m	tʰ iː a m
w ɛ l a m	w eː l ʊ m
p r ɛ s t aː r ɛ	p r aɪ s t aː r ɛ
g r a w ɪ t a t j oː n ɛ	g r a w ɪ t aː t j oː n ɛ m
ɪ m p r ʊ b aː r ɛ	ɪ m p r ɔ b aː r ɛ
k aː lː ʊ m	k a lː ʊ m
s ɛ g aː r ɛ	s ɛ k aː r ɛ
ɛ n k ɔ m j ʊ m	ɛ ŋ k oː m j ʊ m
eː w ɪ ŋ ɛ r ɛ	eː w ɪ ŋ k ɛ r ɛ
l ɔ kʷ k aː k ɛ m	l ɔ kʷ aː k ɛ m
s aː l m	s a g m a m
t ɪ m ɪ d ʊ m	t ɪ m ɪ d ʊ m
k r ɛ d ɪ b ɪ l ɪ t aː t ɛ m	k r eː d ɪ b ɪ l ɪ t aː t ɛ m
l ɪ t ɪ g aː r ɛ	l iː t ɪ g aː r ɛ
l ɛ m a m	l ɛ mː a
a lː ɔ k aː ɛ	a lː ɔ k aː r ɛ
n aː t ʊ m	n aː t ʊ m
n ɛ p eː t ɛ m a m	n ɛ p ɛ t a m
k ʊ m p l ɛ t ɪ w ʊ m	k ɔ m p l eː t iː w ʊ m
ɔ r ɪ f ɪ k ɛ m	aʊ r ɪ f ɪ k ɛ m
uː s uː r aː r j ʊ m	uː s uː r aː r j ʊ m
a s t uː t ʊ m	a s t uː t ʊ m
j ɛ ɛ m a l ɛ	h ɪ ɛ m aː l ɛ m
s k ɔ r t a m	s k ɔ r t ɛ a m
g uː d ɪ t j aː l ɛ	j uː d ɪ k j aː l ɛ m
k ʊ k ʊ r b ɪ t a m	k ʊ k ʊ r b ɪ t a m
s ɛ r aː f ɪ k ʊ m	s ɛ r a pʰ ɪ k ʊ m
ʊ d j ɛ ɛ r n ʊ m	h ɔ d ɪ ɛ r n ʊ m
a k ɛ t ʊ m	a k eː t ʊ m
g ɔ ʊ r n a l ɛ	d j ʊ r n aː l ɛ m
ɔ k uː l t aː r ɛ	ɔ kː ʊ l t aː r ɛ
k ɛ r w ɛ s a m	k ɛ r w ɪ s j a m
w ɛ t a m	w ɪ tː a m
d ɛ k ɛ p t ɔ r j ʊ m	d ɛ k ɛ p t oː r j ʊ m
r a p ɪ d ɪ t ɛ m	r a p ɪ d ɪ t aː t ɛ m
l uː k s uː r j a m	l ʊ k s ʊ r j a m
ɪ n k r ɛ m ɛ n t ʊ m	ɪ ŋ k r eː m ɛ n t ʊ m
f ʊ l d ʊ r ɛ	f ʊ l g ʊ r
ʊ ŋ t w oː ʊ s ʊ m	uː ŋ k t ʊ oː s ʊ m
s ʊ b r ɛ w aː n ɪ r ɛ	s ʊ p ɛ r w ɛ n iː r ɛ
m uː n ɪ t j ʊ m	m uː n iː t j oː n ɛ m
k uː r a m	k uː r a m
k ɔ n k r ɛ t j ɔ n ɛ	k ɔ ŋ k r eː t j oː n ɛ m
s kʷ a lː ɪ d ʊ m	s kʷ aː l ɪ d ʊ m
p uː r y n ʊ m	p uː r ɛ m
s ʊ p j t ʊ m	s uː m p t ʊ m
k ʊ k ɪ n aː r j ʊ m	k ɔ kʷ iː n aː r j ʊ m
p aː d r ɛ m	p a t r ɛ m
k l ɪ m a t a r ɪ k ʊ m	k l iː m a k t eː r ɪ k ʊ m
a n ɪ m	a n iː s ʊ m
k oː lː ʊ m	k ɔ lː ʊ m
ɔ r p ɪ m ɛ n t ʊ m	aʊ r ɪ p ɪ g m ɛ n t ʊ m
m a r s uː p j ʊ m	m a r s uː p j ʊ m
k ɔ s ʊ m	k ɔ k s ʊ m
m ʊ l k ɛ r ɛ	m ʊ l k eː r ɛ
g aː t ʊ r ɛ	g a n aː r ɛ
p ɛ k uː n j a m	p ɛ k uː n j a m
g ɛ s t j ʊ m	g ɛ s t iː r ɛ
d uː b ɪ t a t j ʊ n ɛ m	d ʊ b ɪ t aː t j oː n ɛ m
p a l ʊ m b ʊ m	p a l ʊ m b ʊ m
t r a n s ɪ g ɛ r ɛ	t r aː n s ɪ g ɛ r ɛ
s t uː p eː r ɛ	s t ʊ p eː r ɛ
g ɪ r m a n ʊ m	g ɛ r m aː n ʊ m
p ɛ r s w a d ɛ r ɛ	p ɛ r s w aː d eː r ɛ
eː m ɛ n d aː r ɛ	eː m ɛ n d aː r ɛ
j uː r a t oː r ɛ	j uː r aː t oː r ɛ m
k a l a m ɛu m	k a l a m ʊ m
w ɛ ɛ r ɛ	w ɪ g ɪ l aː r ɛ
p l a g j aː r ɛ	p l a g j aː r ɛ
p eː p ɛ r r ɛ	p ɪ p ɛ r
k uː w ɪ l ɛ m	k ʊ b iː l ɛ
p r ɛ d j a l ɛ	p r aɪ d j aː l ɛ m
k ɔ r b ɛ lː ʊ m	k ɔ r b ɛ m
s ɪ k aː r j ʊ m	s iː k aː r j ʊ m
m ɪ r aː k ʊ l ʊ m	m iː r aː k ʊ l ʊ m
a d ʊ ŋ t j ʊ n ɛ m	a d j ʊ ŋ k t j oː n ɛ m
s j ɛ rː a m	s ɛ rː a m
a s k ɛ n d ɛ r ɛ	a s k ɛ n d ɛ r ɛ
aɪ s t j ʊ m	aɪ s t aː t ɛ m
r a d j a t j oː n ɛ	r a d j aː t j oː n ɛ m
s ʊ r d ʊ m	s ʊ r d ʊ m
ɪ n k a n t aː r ɛ	ɪ ŋ k a n t aː r ɛ
j uː n j ɔ r ɛ	j uː n j oː r ɛ m
ɛ k s t ɪ r p a t j oː n ɛ	ɛ k sː t ɪ r p aː t j oː n ɛ m
ɔ s p ɛ t aː r ɛ	h ɔ s p ɪ t aː r ɛ
b a l ɛ n a m	b a lː aɪ n a m
d ɛ k ɛ p t ɪ w ʊ m	d ɛ k ɛ p t iː w ʊ m
l ɛ k t ɪ k a m	l ɛ k t iː k a m
oː l ʊ m	ʊ l ʊ m
r ɛ p ɔ n ɛ r ɛ	r ɛ p oː n ɛ r ɛ
b a r ɪ t n ʊ m	b a r y t ɔ n ʊ m
s aː k uː l ʊ m	s a kː ʊ l ʊ m
k ɔ kʷ ʊ m	k ɔ kː ʊ m
p ɔ s t uː l aː r ɛ	p ɔ s t ʊ l aː r ɛ
k uː rː ɪ k ʊ l ʊ m	k ʊ rː ɪ k ʊ l ʊ m
ɔ s aː r ɛ	aʊ d eː r ɛ
a w ʊ t ɛ m	a w ʊ m
l ʊ k t aː r ɛ	l ʊ k t aː r iː
k ɔ n d eː s k ɛ n d ɛ r ɛ	k ɔ n d eː s k ɛ n d ɛ r ɛ
p r ɔ d ɪ g aː r ɛ	p r oː d ɪ g ɛ r ɛ
s k r uː p uː l oː s ʊ m	s k r uː p ʊ l oː s ʊ m
p lː a s m aː r ɛ	p l a s m aː r ɛ
w ɔ m ɪ t aː r ɛ	w ɔ m ɪ t aː r ɛ
w a g a b ʊ n d ʊ m	w a g aː b ʊ n d ʊ m
p r ɛ s ɛ n t a t j ʊ n ɛ m	p r aɪ s ɛ n t aː t j oː n ɛ m
s ɔ n a t oː r ɛ	s ɔ m n j aː t oː r ɛ m
l ɔ k uː t j ʊ n ɛ m	l ɔ k uː t j oː n ɛ m
uː w a m	uː w a m
k ɔ n s ɔ l ɪ d a t j ʊ n ɛ m	k oː n s ɔ l ɪ d aː t j oː n ɛ m
ɪ n k a p aː k	ɪ ŋ k a p aː k ɛ m
