m ɪ r aː k oː l ʊ m	m iː r aː k ʊ l ʊ m
k ɔ n k ʊ r s ʊ m	k ɔ ŋ k ʊ r s ʊ m
m a ŋ ɪ k a m	m a n ɪ k a m
z a n k a m	z a ŋ kʰ a m
m ɔ r j a m	m ʊ r j a m
k ɔ a g uː l a t j oː n ɛ m	k ɔ aː g ʊ l aː t j oː n ɛ m
k ɔ n s ɔ l ɪ d aː r ɛ	k oː n s ɔ l ɪ d aː r ɛ
s aː l k ɪ ɛ m	s a l ɪ k ɛ m
t ɛ n s j oː n ɛ	t eː n s j oː n ɛ m
p r ɔ w ɔ k aː r ɛ	p r oː w ɔ k aː r ɛ
b aː l b ʊ t j a r ɛ	b a l b uː t iː r ɛ
m a l w a m	m a l w a m
p a t r ɔ k ɪ n j ʊ m	p a t r oː k ɪ n j ʊ m
n a t ɪ w ɪ t aː t ɛ m	n aː t iː w ɪ t aː t ɛ m
ɪ n t ɛ r p r eː t a b ɪ l ɛ	ɪ n t ɛ r p r ɛ t aː b ɪ l ɛ m
a n eː g aː r ɛ	eː n ɛ k aː r ɛ
m eː r k aː r ɛ	m ɛ r k aː r iː
k ɛ r w ɪ s l a m	k ɛ r w ɛ s j a m
w ɪ s ʊ m	w iː s ʊ m
s a l uː t ɛ m	s a l uː t ɛ m
ɛ k s p eː k t a t j ɔ n ɛ	ɛ k sː p ɛ k t aː t j oː n ɛ m
k a w ʊ m	k a w ʊ m
p r eː s ɛ n t a t j ʊ n ɛ m	p r aɪ s ɛ n t aː t j oː n ɛ m
s a k r aː r ɛ	s a k r aː r ɛ
ɔ r aː r ɛ	oː r aː r ɛ
r ɛ s t aʊ r a t j oː n ɛ m	r eː s t aʊ r aː t j oː n ɛ m
l uː n aː k j ʊ n ɛ m	l uː n aː t j oː n ɛ m
r a p ɪ d ɪ t ɛ m	r a p ɪ d ɪ t aː t ɛ m
a pː r ɔ kː aː r ɛ	a pː r ɔ p j aː r ɛ
s eː w ɛ r ʊ m	s ɛ w eː r ʊ m
ɔ k a s j oː n ɛ m	ɔ kː aː s j oː n ɛ m
a l eː k t aː r ɛ	a lː ɛ k t aː r ɛ
n ɛ s k j ʊ m	n ɛ s k j ʊ m
w ʊ l p ɪ n ʊ m	w ʊ l p iː n ʊ m
f ɪ d ʊ m	f iː d ʊ m
f uː s t ɛ m	f uː s t ɛ m
k eː r t aː r ɛ	k ɛ r t aː r ɛ
k ɔ d ɪ k ɛ m	k oː d ɪ k ɛ m
f oː k a m	pʰ oː k a m
t a r d aː r ɛ	t a r d aː r ɛ
k a n ɔ r ʊ m	k a n oː r ʊ m
k ɔ n w ɛ r t ɪ r ɛ	k ɔ n w ɛ r t ɛ r ɛ
r ɛ n aː r ɛ	r eː ŋ n aː r ɛ
l uː k s ʊ m	l uː k s ʊ m
l ɪ n k ɛ m	l y ŋ k ɛ m
p eː t iː r ɛ	p ɛ t ɛ r ɛ
g ɛ n ɛ s t a m	g ɛ n ɛ s t a m
k l ʊ k aː r ɛ	g l oː k iː r ɛ
t ʊ n d ɛ r ɛ	t ɔ n d eː r ɛ
ɪ n uː l t ʊ m	ɪ n ʊ l t ʊ m
p r oː sː ɪ m ʊ m	p r ɔ k s ɪ m ʊ m
k a l aː r ɛ	kʰ a l aː r ɛ
g oː r d ʊ m	g ʊ r d ʊ m
k aː n s aː r ɛ	k a m p s aː r ɛ
d ɛ m ɔ n s t r aː r ɛ	d eː m oː n s t r aː r ɛ
k aː n a m	k a nː a m
a r m aː eː n t ʊ m	a r m aː m ɛ n t ʊ m
a k uː s a t oː r ɛ	a kː uː s aː t oː r ɛ m
k aː n d ɛ l ɛ m	k a n d eː l a m
f lː ɔ w ɛ m	f l ʊ w j ʊ m
s p ɪ n aː l ɛ	s p iː n aː l ɛ m
j ʊ n ʊ m	j eː j uː n j ʊ m
s ɔ m ʊ m	s ɔ m n ʊ m
ɔ r n aː t ʊ m	oː r n aː t ʊ m
t r ɛ m uː l ʊ m	t r ɛ m ʊ l ʊ m
ɔ r d ɪ n aː r j ʊ m	oː r d ɪ n aː r j ʊ m
p uː t aː r ɛ	p ʊ t eː r ɛ
f ɔ l oː s ʊ m	f ɔ l j oː s ʊ m
uː r b ɛ m	ʊ r b ɛ m
t r a n s m ɪ s j oː n ɛ m	t r aː n s m ɪ sː j oː n ɛ m
ɛ k s p l ɪ k a t j oː n ɛ m	ɛ k s p l ɪ k aː t j oː n ɛ m
f ɛ s t ɪ w ʊ m	f ɛ s t iː w ʊ m
ɔ p r ɔ b r j ʊ m	ɔ pː r ɔ b r j ʊ m
a t r a b ɪ lː j aː r j ʊ m	aː t r a b iː l aː r j ʊ m
p a r t ɪ k ʊ l a m	p a r t ɪ k ʊ l a m
r ɛ p r ɛ h ɛ n s ɪ b ɪ l ɛ m	r ɛ p r ɛ h ɛ n s ɪ b ɪ l ɛ m
d ɛ f ɛ n s a m	d eː f ɛ n s a m
ɪ b ɪ l ɛ m	ɪ b ɪ l ɛ m
j ɛ n ɪ t ɪ w ʊ m	g ɛ n ɪ t iː w ʊ m
a m ɪ k a m	a m iː k a m
k a t a r a k t a m	k a t a r a k t a m
s ɪ k ɔ f a n t a m	s yː k ɔ pʰ a n t a m
ɪ m p eː r a t r ɪ k ɛ	ɪ m p ɛ r aː t r iː k ɛ m
b ɛ n ɪ ŋ n ʊ m	b ɛ n ɪ ŋ n ʊ m
d ɪ fː a m a t oː r j ʊ m	d ɪ fː aː m aː t oː r j ʊ m
p r ɔ t ɛ s t a t j oː n ɛ m	p r oː t ɛ s t aː t j oː n ɛ m
a s t r ʊ m	a s t r ʊ m
r eː k ɔ rː ɛ r ɛ	r ɛ k ʊ rː ɛ r ɛ
n ɪ w ɛ lː ʊ m	l iː b ɛ lː a m
k ɔ nː ʊ m	k ʊ nː ʊ m
t r aː m eː t ɛ r ɛ	t r aː m ɪ tː ɛ r ɛ
s m ɪ r a l d ʊ m	s m a r a g d ʊ m
m ɔ d eː r a t oː r ɛ	m ɔ d ɛ r aː t oː r ɛ m
s ɛ r aː f ɪ k ʊ m	s ɛ r a pʰ ɪ k ʊ m
k ɔ r w ɪ n ʊ m	k ɔ r w iː n ʊ m
ɪ k l ɛ s j a m	ɛ kː l eː s j a m
ɪ n ʊ m	iː n ʊ m
ɛ k s p lː ɔ r a t ɔ r ɛ	ɛ k s p l oː r aː t oː r ɛ m
m a ŋ g aː r ɛ	m a n d uː k aː r ɛ
a p ɔ k a l ɪ p s ɛ m	a p ɔ k a l y p s ɛ m
f l ɛ k s j oː n ɛ m	f l ɛ k s j oː n ɛ m
a b l a kʷ aɪ t j oː n ɛ m	a b l a kʷ ɛ aː t j oː n ɛ m
eː ŋ w a n ɛ ɪ r ɛ	eː w aː n eː s k ɛ r ɛ
uː s t ʊ l aː r ɛ	ʊ s t ʊ l aː r ɛ
g ɔ s j ʊ m	g ɛu s j aː s
p ʊ r t ʊ g ɛ s ɛ	p ɔ r t ʊ k eː n s ɛ m
s a k r ɪ f ɪ k j ʊ m	s a k r ɪ f ɪ k j ʊ m
n uː m eː r ʊ s ɪ t aː t ɛ m	n ʊ m ɛ r oː s ɪ t aː t ɛ m
ɛ k s uː l k ɛ r a t j oː n ɛ m	ɛ k s ʊ l k ɛ r aː t j oː n ɛ m
s ɔ l ʊ t ʊ m	s ɔ l uː t ʊ m
k aː n d ɪ d ʊ m	k a n d ɪ d ʊ m
ɪ m p ɪ n g ɛ r ɛ	ɪ m p ɪ ŋ g ɛ r ɛ
ɪ n k ɪ t a t j oː n ɛ m	ɪ ŋ k ɪ t aː t j oː n ɛ m
ɛ n t ɛ m	ɛ n s
a p ɔ s t oː l ʊ m	a p ɔ s t ɔ l ʊ m
s uː b iː r ɛ	s ʊ b iː r ɛ
f iː l aː s t r ʊ m	f iː l j a s t r ʊ m
b j ɛ t eː r aː b a m	b eː t a m
d ɛ p ɛ n d ɛ r ɛ	d eː p ɛ n d eː r ɛ
s ɛ n s w ʊ a l ɪ t aː t ɛ m	s ɛ n s w aː l ɪ t aː t ɛ m
a p ɪ k k ɛ m	a p ɪ k ɛ m
k ɔ l ʊ m b a m	k ɔ l ʊ m b a m
m a n t ɪ p t j ʊ m	m a ŋ k ɪ p j ʊ m
r ɛ p l ɪ k a t j oː n ɛ	r ɛ p l ɪ k aː t j oː n ɛ m
ɔ l ɛ aː t ʊ m	ɔ l ɛ aː t ʊ m
ɔ r d j ʊ m	h ɔ r d ɛu m
uː s w aː l ɛ	uː s w aː l ɛ m
d ɪ l ɛ kʷ aː r ɛ	d eː l ɪ kʷ aː r ɛ
a l t ɛ a m	a l tʰ aɪ a m
k ɔ n s l ɔ d a m	k oː n s ɔ l ɪ d a m
g a rː uː l ʊ m	g a rː ʊ l ʊ m
p aː l m ʊ m	p a l m ʊ m
a w j ɛ s ʊ m	aː w ɛ r s ʊ m
s uː p uː t aː r ɛ	s ʊ pː ʊ t aː r ɛ
a d uː l t eː r aː r ɛ	a d ʊ l t ɛ r aː r ɛ
k ɔ n s ɪ d eː r a t j oː n ɛ m	k oː n s iː d ɛ r aː t j oː n ɛ m
w ɪ k ʊ m	w iː k ʊ m
d j ɪ k ɪ m ʊ m	d ɛ k ɪ m ʊ m
m uː n ɪ f ɪ k ɛ n t j a m	m uː n ɪ f ɪ k ɛ n t j a m
p ɛ r ɪ t ʊ m	p ɛ r iː t ʊ m
l ɪ b eː r a t j oː n ɛ m	l iː b ɛ r aː t j oː n ɛ m
k ɔ n w ɔ k a t j oː n ɛ m	k ɔ n w ɔ k aː t j oː n ɛ m
a k a d ɛ m j a m	a k a d eː m iː a m
m ɪ g r aː r ɛ	m ɪ g r aː r ɛ
s ʊ s k r ɪ w ɛ r ɛ	s ʊ b s k r iː b ɛ r ɛ
a r k ɛ t ɪ p ʊ m	a r kʰ ɛ t y p ʊ m
d ɛ s t r uː k k j oː n ɛ m	d eː s t r ʊ k t j oː n ɛ m
n iː n f a m	n y m pʰ a m
w ɛ n eː r aː r ɛ	w ɛ n ɛ r aː r iː
n ɔ n a m	n ɔ nː a m
p a l ʊ m	p aː l ʊ m
ɪ n s t aʊ r aː r ɛ	iː n s t aʊ r aː r ɛ
t ʊ r m a m	t ʊ r m a m
aɪ t ɛ r ɛ	aɪ tʰ ɛ r ɛ m
a r m ɪ lː a m	a r m ɪ lː a m
t ɛ n ɛ r n ʊ m	t ɛ n ɛ r ʊ m
d ɪ s k ʊ rː ɛ r ɛ	d ɪ s k ʊ rː ɛ r ɛ
m a n uː b r j ʊ m	m a n uː b r j ʊ m
s ʊ b t r a k t j oː n ɛ m	s ʊ b t r a k t j oː n ɛ m
b ʊ t ɪ k a m	a p ɔ tʰ eː k a m
s ɛ k uː r ɛ m	s ɛ k uː r ɛ m
k a m n ʊ t ʊ m	k aː n uː t ʊ m
k ɔ n t r ɪ b ʊ ɛ r ɛ	k ɔ n t r ɪ b ʊ ɛ r ɛ
n a s uː t ʊ m	n aː s uː t ʊ m
r ɛ p l ɪ k aː r ɛ	r ɛ p l ɪ k aː r ɛ
a s ɛ lː a m	a s k ɛ lː a m
p r ɛ t ɪ p ɪ t j ʊ m	p r aɪ k ɪ p ɪ t j ʊ m
d ɛ s t ɪ n aː r ɛ	d eː s t ɪ n aː r ɛ
p ɔ p ɛ r ɛ m	p aʊ p ɛ r ɛ m
a b s ɔ l b eː r ɛ	a b s ɔ l w ɛ r ɛ
s uː p ɛ r b j a m	s ʊ p ɛ r b j a m
k ɪ t ɪ s ʊ m	k y t ɪ s ʊ m
f r ɛ kʷ t ɛ n t ɛ m	f r ɛ kʷ ɛ n t ɛ m
a m ɪ k ɪ t j a m	a m iː k ɪ t j a m
t w ɛ r ʊ m	w eː r ʊ m
p ɔ s p oː n eː r ɛ	p ɔ s t p oː n ɛ r ɛ
g ɛ l oː s ʊ m	z eː l oː s ʊ m
a d ɪ k a r ɛ	a dː iː k ɛ r ɛ
m a n d aː r ɛ	m a n d aː r ɛ
s k r uː t ɪ n j aː r ɛ	s k r uː t ɪ n j ʊ m
b eː n eː f ɪ k j ʊ m	b ɛ n ɛ f ɪ k j ʊ m
a k ɔ n s eː l aː r ɛ	a kː ɔ ŋ k ɪ l j aː r ɛ
a k uː m uː l a t j oː n ɛ m	a kː ʊ m ʊ l aː t j oː n ɛ m
ʊ n k a m	ʊ ŋ k j a m
b a s ɪ l ɪ s k ʊ m	b a s ɪ l ɪ s k ʊ m
k ʊ n l aː r ɛ	k ʊ n ɛ aː r ɛ
k ʊ l ʊ m ɛ lː a m	k ɔ l ʊ m ɛ lː a m
p a r j ɪ eː t aː l ɛ	p a r ɪ ɛ t aː l ɛ m
a t ɪ r ɛ	a dː ɛ r ɛ
k ɛ r t ɪ t uː d ɪ n ɛ m	k ɛ r t ɪ t uː d ɪ n ɛ m
a p ɛ g l a m	a p ɪ k ʊ l a m
k l uː t ɪ n ɛ	g l uː t ɛ n
d ɪ s t r ɛ ɛ r ɛ	d ɪ s t r a h ɛ r ɛ
f ɪ d aː r ɛ	f iː d ɛ r ɛ
ɪ m a g ɪ n a t ɪ w ʊ m	ɪ m aː g ɪ n aː t ɪ w ʊ m
ɪ ɛ r ɔ s ɔ l m ɪ t aː n ʊ m	h ɪ ɛ r ɔ s ɔ l y m iː t aː n ʊ m
k ɔ m ɛ n t aː r j ʊ m	k ɔ mː ɛ n t aː r j ʊ m
p r aː n d ɛ r ɛ	p r a n d eː r ɛ
s a g ɪ t aː r j ʊ m	s a g ɪ tː aː r j ʊ m
a w ɔ lː ʊ m	a w ʊ l ʊ m
p a lː j uː m	p a l ɪ uː r ʊ m
ɛ l ɪ m ɪ n a t j oː n ɛ m	eː l ɪ m ɪ n aː t j oː n ɛ m
d ɪ s k r eː t j oː n ɛ	d ɪ s k r eː t j oː n ɛ m
n ɔ b ɛ l oː s ʊ m	n uː b ɪ l oː s ʊ m
k ʊ p ʊ l aː r ɛ	k oː p ʊ l aː r ɛ
eː n uː m eː r aː r ɛ	eː n ʊ m ɛ r aː r ɛ
n ɛ p ɛ t ɛ g a m	n ɛ p ɛ t a m
s ɛ f ɪ r ʊ m	z ɛ pʰ y r ʊ m
d eː f l uː ɪ r ɛ	d eː f l ʊ ɛ r ɛ
p r ɔ k ɛ lː a m	p r ɔ k ɛ lː a m
s uː b ɛ ɛ r n ʊ m	s uː b ɛ r ɛ m
p r ɔ m uː l g a t j oː n ɛ m	p r oː m ʊ l g aː t j oː n ɛ m
ɪ t ɪ n eː r aː r j ʊ m	ɪ t ɪ n ɛ r aː r j ʊ m
t ɪ m ɪ d ʊ m	t ɪ m ɪ d ʊ m
l uː k s	l uː k ɛ m
ɪ m p eː r j oː s ʊ m	ɪ m p ɛ r j oː s ʊ m
r ʊ g aː k a m	r oː r ɛ m
ɪ n s ɪ ŋ n ɛ m	iː n s ɪ ŋ n ɛ m
b ɛ n ɛ d ɪ k ɛ r ɛ	b ɛ n ɛ d iː k ɛ r ɛ
b ɛ b ɪ t oː r ɛ	b ɪ b ɪ t oː r ɛ m
g ʊ g ʊ g a m	z iː z y pʰ ʊ m
a d m ɪ r a b ɪ l ɛ m	a d m iː r aː b ɪ l ɛ m
g uː s t ɪ f ɪ k a t ɔ r ɛ	j uː s t ɪ f ɪ k aː t oː r ɛ m
ɪ n f eː r k ɪ oː r ɛ m	iː n f ɛ r ʊ m
k ɛ n s uː r a m	k eː n s uː r a m
ɪ m p r ɔ b aː r ɛ	ɪ m p r ɔ b aː r ɛ
s k r uː t aː r ɛ	s k r uː t aː r iː
k ɛ l j eː n t ɛ m	k a l ɛ n t ɛ m
f uː r d oː s ʊ m	f ʊ r j oː s ʊ m
s ɪ m p l ɪ k ɛ m	s ɪ m p l ɪ k ɛ m
t a pː ɛ t ɛ m	t a p eː t ɛ m
h k ʊ r t aː r ɛ	k ʊ r t aː r ɛ
d ɔ ɪ ʊ m	d ɔ l ʊ m
a n ɔ m a l ʊ m	a n oː m a l ɔ n
p a l aː t aː r ɛ	p a l aː t ʊ m
ɪ n d ɪ ŋ n ɪ t aː t ɛ m	ɪ n d ɪ ŋ n ɪ t aː t ɛ m
k r uː ɛ n t ʊ m	k r ʊ ɛ n t ʊ m
s ɪ g uː m	s eː k uː r ʊ m
r ɛ lː a k s a t j oː n ɛ m	r ɛ l a k s aː t j oː n ɛ m
f lː ɔ s k uː lː ʊ m	f l ɔ s k ʊ l ʊ m
r uː p ɛ m	r uː p ɛ m
gʷ a r d aː r ɛ	w a r d aː r ɛ
p ɛ r s w a d ɛ r ɛ	p ɛ r s w aː d eː r ɛ
m ɛ n t ʊ m	m ɛ n t ʊ m
a b ɔ m aː s ʊ m	a b ɔ m aː s ʊ m
g r a l ʊ m	g r aː k ʊ l ʊ m
p r eː g oː n ɛ m	p r aɪ k oː n ɛ m
ɔ r t ʊ g r a f j a m	ɔ r tʰ ɔ g r a pʰ j a m
k ɔ n t r ɪ s t aː r ɛ	k ɔ n t r iː s t aː r ɛ
k ɔ sː ʊ m	k ɔ sː ʊ m
a m ɪ k a l ɛ	a m iː k aː l ɛ m
f ɛ m ɪ n ɪ n ʊ m	f eː m ɪ n iː n ʊ m
uː s aː r j ʊ m	uː s w aː r j ʊ m
d ɛ f ɛ n s oː r ɛ	d eː f eː n s oː r ɛ m
j aː d ɛ m	iː l ɛ
l ɪ t ɪ g aː r ɛ	l iː t ɪ g aː r ɛ
b a k t ɪ s ɪ m ʊ m	b a p t ɪ s m ʊ m
b ɔ b ʊ m	b a l b ʊ m
r ɛ l eː g a t j oː n ɛ m	r ɛ l eː g aː t j oː n ɛ m
k ɛ r w a m	k ɛ r w a m
w ɪ d ɔ w a m	w ɪ d w a m
d eː t ɛ n ɛ r ɛ	d eː t ɪ n eː r ɛ
d ɪ s t r uː g ɪ r ɛ	d eː s t r ʊ ɛ r ɛ
ɔ k ʊ rː ɛ r ɛ	ɔ kː ʊ rː ɛ r ɛ
f a w oː r ɛ	f a w oː r ɛ m
s ɔ n aː r ɛ	s ɔ m n j aː r ɛ
l ɔ r ɪ k a m	l oː r iː k a m
ɔ fː eː r t ɔ r j ʊ m	ɔ fː ɛ r t oː r j ʊ m
kʷ ɛ r ɛ l a m	kʷ ɛ r eː l a m
l ɛ g aː t ʊ m	l eː g aː t ʊ m
f r ɛ m ɪ r ɛ	f r ɛ m ɛ r ɛ
ɛ k s t ɛ n s ɪ w ʊ m	ɛ k s t eː n s iː w ʊ m
d ɪ k aː k ɛ	d ɪ k aː k ɛ m
a r k j a m	a r kʰ j a m
a g ɪ t a t ɔ r ɛ	a g ɪ t aː t oː r ɛ m
s w aː d ɪ r ɛ	s w aː d eː r ɛ
ɪ n t eː g r aː r ɛ	ɪ n t ɛ g r aː r ɛ
m ɛ r eː t r ɪ k ɛ	m ɛ r ɛ t r iː k ɛ m
ɛ kʷ ɪ p a r aː r ɛ	aɪ kʷ ɪ p ɛ r aː r ɛ
ɛ m uː ŋ g eː r ɛ	eː m ʊ ŋ g ɛ r ɛ
k eː n aː r ɛ	k eː n aː r ɛ
k ɔ n f l ɪ k t ʊ m	k oː n f l ɪ k t ʊ m
d eː s ɪ s t ɛ r ɛ	d eː s ɪ s t ɛ r ɛ
f eː n ʊ m	f aɪ n ʊ m
a k ɛ b r ɛ m	aː k r ɛ m
l a k r ɪ m a t j ɔ n ɛ	l a k r ɪ m aː t j oː n ɛ m
a b r ɔ g aː r ɛ	a b r ɔ g aː r ɛ
eː d ɪ k ɔ l a m	aɪ d ɪ k ʊ l a m
p r eː w ɛ r ɛ	p r aɪ w ɪ d eː r ɛ
s t r ɪ g ɛ m	s t r ɪ g ɛ m
r j ɛ aː ɪ r ɛ	r ɛ a g eː r ɛ
l a b ɔ r a t oː r j ʊ m	l a b oː r aː t oː r j ʊ m
aʊ d aː k j	aʊ d aː k ɛ m
f uː l w ʊ m	f ʊ l w ʊ m
ɪ n ɔ s k eː r ɛ	ɪ ŋ n oː s k ɛ r ɛ
d ɛ n t aː l ɛ	d ɛ n t aː l ɛ m
s k ʊ d ɛ lː a m	s k ʊ t ɛ lː a m
a w oː k aː r ɛ	a d w ɔ k aː r ɛ
m ɪ l ɔ r ɛ	m ɛ l j oː r ɛ m
a d m ɔ n ɪ t j oː n ɛ m	a d m ɔ n ɪ t j oː n ɛ m
k j ɛ k ʊ m	k aɪ k ʊ m
h ɔ r t ʊ m	h ɔ r t ʊ m
a f ɔ g aː r ɛ	ɔ fː oː k aː r ɛ
m ɔ d ɪ k ʊ m	m ɔ d ɪ k ʊ m
k ɔ n s ɛ r w a t j oː n ɛ m	k oː n s ɛ r w aː t j oː n ɛ m
ɪ t a l j aː n ʊ m	iː t a l j aː n ʊ m
a l ɪ	ɪ lː ʊ ŋ k
k ɔ n f uː t aː r ɛ	k oː n f uː t aː r ɛ
k r ɔ t a l ʊ m	k r ɔ t a l ʊ m
s ɪ r w ɛ n t ɛ m	s ɛ r w ɪ ɛ n t ɛ m
f ɛ m ɔ r aː l ɛ	f ɛ m ɔ r aː l ɛ m
w ɛ r ɪ t aː t ɛ m	w eː r ɪ t aː t ɛ m
k ɔ l oː n j aː m	k ɔ l oː n j a m
r ʊ g ʊ m	r ɔ g ʊ m
a d w ɛ r b j ɪ aː l ɛ	a d w ɛ r b j aː l ɛ m
k r ʊ k ɪ f ɛ r ʊ m	k r ʊ k ɪ f ɛ r ʊ m
k l ɛ r ɪ k ʊ m	k l eː r ɪ k ʊ m
kʰ a k aː r ɛ	k a p t j aː r ɛ
r ɔ m iː k ɛ	r ʊ m ɪ k ɛ m
t r aː r l a m	t r aː g ʊ l a m
b aː n ʊ m	b a l n ɛu m
a r aː n ʊ m	a r aː n ɛ a m
ɛ k s p r ɪ m ɛ r ɛ	ɛ k s p r ɪ m ɛ r ɛ
a l t j ɔ n	a l k y ɔ n ɛ m
k r ɪ t ɛ r j ʊ m	k r ɪ t ɛ r ɪ ɔ n
s t r aː t ʊ m	s t r aː t ʊ m
a b j uː r aː r ɛ	a b ɪ uː r aː r ɛ
ɛ k s t ɛ n d ɛ r ɛ	ɛ k s t ɛ n d ɛ r ɛ
k uː l t ʊ m	k ʊ l t ʊ m
ɪ r a k ʊ n d ʊ m	iː r aː k ʊ n d ʊ m
k ɔ k ʊ m	k ɔ kʷ ʊ m
a s k ɛ n s j oː n ɛ m	a s k eː n s j oː n ɛ m
ɪ ŋ g uː r j oː s ʊ m	ɪ n ɪ uː r j oː s ʊ m
ɪ m p uː l s j oː n ɛ m	ɪ m p ʊ l s j oː n ɛ m
k uː r a m	k uː r a m
s k ɔ l ɔ p ɛ n d r a m	s k ɔ l ɔ p ɛ n d r a m
d ɔ k t oː r ɛ	d ɔ k t oː r ɛ m
t ɪ k ʊ ɛ r a m	t oː n s oː r j ʊ m
l a k r ɪ m oː s ʊ m	l a k r ɪ m oː s ʊ m
w a l eː r ɛ	w a l eː r ɛ
p ɛ s t r ɪ n ʊ m	p ɪ s t r iː n ʊ m
t aʊ r ɪ f ɔ r m ɛ	t aʊ r ɪ f oː r m ɛ m
s t r aː d a m	s t r aː t a m
m ɛ r ʊ m	m ɛ r ʊ m
g r uː m ʊ m	g r uː m ʊ m
s p ɔ r k ʊ m	s p ʊ r k ʊ m
k a s t r aː t ʊ m	k a s t r aː t ʊ m
w ɪ t r j ʊ m	w ɪ t r ʊ m
m ɛ r ɪ d j ɪ ɔ n aː l ɛ	m ɛ r iː d j oː n aː l ɛ m
r eː w ɛ r b eː r aː r ɛ	r ɛ w ɛ r b ɛ r aː r ɛ
r a s uː r a m	r aː s uː r a m
s k r ɪ n j ʊ m	s k r iː n j ʊ m
w ɪ n oː s ʊ m	w iː n oː s ʊ m
b a p t ɪ s t a m	b a p t ɪ s t a m
t a k s a t j ʊ n ɛ m	t a k s aː t j oː n ɛ m
t uː	t uː
a b ɛ t ʊ m	a b ɪ eː t ɛ m
p r ɔ p r j ʊ m	p r oː p r j ʊ m
m a g ɛ s t aː t ɛ m	m a j ɛ s t aː t ɛ m
b aː s ʊ m	b aː s j ʊ m
a n t eː p oː n eː r ɛ	a n t ɛ p oː n ɛ r ɛ
k a p aː k ɛ	k a p aː k ɛ m
w ɪ k a m	b iː g a m
r uː b iː g ɪ n oː s ʊ m	r oː b iː g ɪ n oː s ʊ m
k a m b j ʊ m	k a m b j ʊ m
n j ɛ b l m a m	n ɛ b ʊ l a m
a d uː l t eː r ɪ n ʊ m	a d ʊ l t ɛ r iː n ʊ m
a b s k ɪ s a m	a b s k ɪ n d ɛ r ɛ
uː m uː m	h ʊ m ʊ m
p a r t ɪ t j oː n ɛ m	p a r t iː t j oː n ɛ m
r ɛ w ɛ r s aː r ɛ	r ɛ w ɛ r s aː r ɛ
f l aː m a m	f l a mː a m
t ɔ rː aː r ɛ	t ɔ rː eː r ɛ
f aʊ s t ʊ m	f aʊ s t ʊ m
a b a l j ɪ eː n aː r ɛ	a b a l ɪ eː n aː r ɛ
r a n ʊ m	a r aː n ɛu m
p a n a k a m	p a n a k eːa m
w ɔ l w ɛ r ɛ	w ɔ l w ɛ r ɛ
f a l s aː r ɛ	f a l s aː r ɛ
ɛ r eː m ʊ m	h ɛ r eː m ʊ m
k ɪ p ɔ lː a m	k eː p ʊ lː a m
k uː k p r ɛ	k oː n s p ʊ ɛ r ɛ
s ɔ r ɪ k ɛ m	s oː r ɪ k ɛ m
l a k uː s t r ɛ m	l a k ʊ s t r ɛ m
k ɛ n t aʊ r j a m	k ɛ n t aʊ r eːa m
k ɔ n ɛ k s j oː n ɛ m	k ɔ nː ɛ k s j oː n ɛ m
ɔ s p ɪ t j ʊ m	h ɔ s p ɪ t j ʊ m
t ɛ rː eː m ɔ t ʊ m	t ɛ rː aɪ m ɔ t ʊ m
m ɛ l ʊ d j a m	m ɛ l oː d j a m
k ʊ n t r ɪ b ʊ l aː r ɛ	k ɔ n t r ɪ b ʊ l aː r ɛ
n ɔ t ɪ t j a m	n oː t ɪ t j a m
n ɛ k s ʊ m	n ɛ k s ʊ m
a g r ɪ m ɛ n s oː r ɛ	a g r iː m eː n s oː r ɛ m
ɪ m p r eː k aː r ɛ	ɪ m p r ɛ k aː r iː
ɛ k s ɪ k a t j ʊ n ɛ m	ɛ k sː ɪ kː aː t j oː n ɛ m
k ɔ n s ɪ ŋ n aː r ɛ	k oː n s ɪ ŋ n aː r ɛ
r ɛ g ʊ l aː r ɛ	r eː g ʊ l aː r ɛ m
m a r k ɛ d ʊ m	m a r k ɪ d ʊ m
s k a r aː b ɪ l ʊ m	s k a r a b aɪ ʊ m
s ʊ m a r ŋ g ʊ ʊ m	m ɛ r g ʊ m
s a n a t j ʊ n ɛ	s aː n aː t j oː n ɛ m
ɛ m ɛ t aː r ɛ	ɪ m ɪ t aː r iː
t a n t ʊ m	t a n t ʊ m
j ʊ k ʊ n d ɪ t aː t ɛ m	j uː k ʊ n d ɪ t aː t ɛ m
p uː n ɪ r ɛ	p uː n iː r ɛ
eː f ɛ k t aː ɛ r ɛ	ɛ fː ɪ k ɛ r ɛ
f aː s t ʊ m	f aː s t ʊ m
a r ɛ p ɛ t ɛ r ɛ	p aɪ n ɪ t eː r ɛ
r uː g a m	r uː g a m
g r a t ɪ f ɪ aː r ɛ	g r aː t ɪ f ɪ k aː r iː
eː t ɛ r ɛ ʊ m	aɪ tʰ ɛ r j ʊ m
ɪ n d a g a r ɛ	ɪ n d aː g aː r ɛ
a fː uː m ɪ g aː r ɛ	f uː m ɪ g aː r ɛ
aː m aː r ɛ	a m aː r ɛ
r ɪ s ʊ m	r iː s ʊ m
