a k r eː s ɛ r ɛ	a kː r eː s k ɛ r ɛ
f a k ʊ m d ɪ n ɛ m j a m	f aː k ʊ n d j a m
n aː f t a m	n a pʰ tʰ a m
t ɛ n ɛ m ɛ	t ɛ n ʊ ɛ m
s ɛ p t ɛ n t r j oː n ɛ m	s ɛ p t ɛ n t r j oː n ɛ m
t uː r g iː d ʊ m	t ʊ r g ɪ d ʊ m
p r ʊ p uː ŋ n a r ɛ	p r oː p ʊ ŋ n aː r ɛ
j eː l aː r ɛ	g ɛ l aː r ɛ
r eː g aː r	r ɪ g aː r ɛ
k l a r iː t aː t ɛ m	k l aː r ɪ t aː t ɛ m
n aʊ f r a g aː r ɛ	n aʊ f r a g aː r ɛ
k ɔ k iː n a m	k ɔ kʷ iː n a m
aʊ d iː t j oː n ɛ	aʊ d iː t j oː n ɛ m
s k a n d iː r ɛ	s k a n d ɛ r ɛ
d eː s t r uː g ɪ r ɛ	d eː s t r ʊ ɛ r ɛ
a l uː m n ʊ m	a l ʊ m n ʊ m
t r a n s a k t j ɔ n ɛ	t r aː n s aː k t j oː n ɛ m
ɔ k k iː d ɛ n t ɛ m	ɔ kː ɪ d ɛ n t ɛ m
l ɪ d a t ɔ r ɛ m	l aʊ d aː t oː r ɛ m
ɔ n uː s t ʊ m	ɔ n ʊ s t ʊ m
ɔ p uː l ɛ n t j a m	ɔ p ʊ l ɛ n t j a m
s eː k uː r ɛ m	s ɛ k uː r ɛ m
k r ɔ ŋ g r j ʊ m	k ɔ ŋ g r ʊ m
n ɔ ɪ s	n oː s
a l iː t ʊ m	h aː l ɪ t ʊ m
k a n a m	k a nː a m
k ɔ n t r iː b ʊ ɛ r ɛ	k ɔ n t r ɪ b ʊ ɛ r ɛ
iː t a l j a n ʊ m	iː t a l j aː n ʊ m
k a p iː t ʊ l a t j ʊ m n ɛ m	k a p ɪ t ʊ l aː t j oː n ɛ m
ɪ n t r m eː t eː r m ɛ m	ɪ n t ɛ r m ɪ tː ɛ r ɛ
ɛ r a m	aɪ r a m
p a l a t ʊ m	p a l aː t ʊ m
a b iː g ɛ ʊ m	a b ɪ g ɛu m
ɛ n ɛ r w aː r	eː n ɛ r w aː r ɛ
s a k uː l ʊ m	s a kː ʊ l ʊ m
w ɛ d ʊ w a m	w ɪ d w a m
p ɛ n uː r j a m	p eː n uː r j a m
g eː n t iː l iː t a m	g ɛ n t iː l ɪ t aː t ɛ m
s p a t j j aː r ɛ	s p a t j aː r iː
a n t eː k eː d ɛ r ɛ	a n t ɛ k eː d ɛ r ɛ
p ɔ r t a b ɪ l ɛ	p ɔ r t aː b ɪ l ɛ m
k a p ɪ t l ʊ m	k a p ɪ t ʊ l ʊ m
ɛ w ɪ ŋ t ɛ r ɛ	eː w ɪ ŋ k ɛ r ɛ
p ɛ r iː t j a m	p ɛ r iː t j a m
k a p aː k ɛ	k a p aː k ɛ m
g ɛ m uː l a m	g ɛ mː ʊ l a m
s uː t uː r a m	s uː t uː r a m
t ʊ m s ʊ m	t oː n s ʊ m
p r ɛ g ʊ s t r ɛ	p r aɪ g ʊ s t aː r ɛ
b ʊ rː aː g ɪ n ɛ	b ɔ r aː g ɪ n ɛ m
a r b ɔ r ɛ t ʊ m	a r b ɔ r eː t ʊ m
d ɪ s p ʊ s aː r ɛ	d eː s p oː n s aː r ɛ
p ʊ l s aː r ɛ	p ʊ l s aː r ɛ
s iː m j ʊ m	s iː m j ʊ m
p r ɔ d iː g j ɔ s k j ʊ m	p r oː d ɪ g j oː s ʊ m
lː uː m b r ɪ k aː r ɛ	l uː k ʊ b r aː r ɛ
t ɛ l a m m	t eː g ʊ l a m
aː r k a m	a r kʰ a m
ɛ s k ʊ m	ɪ s k ʊ m
p m ɛ ɪ t ɪ n aː r ɛ	p ɛ k t ɪ n aː r ɛ
p j ɛ r ɪ n a m	p ɛ r n a m
f ɔ s t iː g aː r ɛ	f uː s t iː g aː r ɛ
a pː ɔ s t ʊ m	a pː ɔ s ɪ t ʊ m
iː n t eː g r aː r ɛ	ɪ n t ɛ g r aː r ɛ
g eː r a r k a m	h ɪ ɛ r a r kʰ a m
k ɔ m p l ɛ t ʊ m	k ɔ m p l eː t ʊ m
n ʊ n ʊ m k j j a m	n uː p t j aː s
a r aː t ʊ m	a r aː t r ʊ m
s uː m ɪ r ɛ	s uː m ɛ r ɛ
lː a n t aː r ʊ m	l a ŋ k j aː r j ʊ m
k eː d ɛ r ɛ	k eː d ɛ r ɛ
a l t eː r n a t j ʊ n ɛ	a l t ɛ r n aː t j oː n ɛ m
iː n d eː f iː n iː t ʊ m	ɪ n d eː f iː n iː t ʊ m
d eː n ʊ n k t j a t j ɛ m m	d eː n ʊ n t j aː t j oː n ɛ m
s iː m s iː p a m t	s ɪ ŋ k ɪ p ʊ t
s ɔ b ɔ r n aː r ɛ	s ʊ b oː r n aː r ɛ
w j ɛ n t r ɛ m	w ɛ n t r ɛ m
g eː r ɛ r	g ɛ r ɛ r ɛ
f ʊ ɛ b r ɪ k aː r ɛ	f a b r ɪ k aː r ɛ
t ɛ r s ʊ m	t ɛ r s ʊ m
m a r a d ʊ m g ʊ k ʊ m	m ɛ r g ʊ m
b eː n eː f a t r ɛ	b ɛ n ɛ f a k ɛ r ɛ
s k a l j aː r ɛ	s k aː l aː r ɛ m
k ɔ n w iː k t j oː n ɛ m	k ɔ n w iː k t j oː n ɛ m
iː d oː n ɛ ʊ m	ɪ d oː n ɛu m
ɛ r ɔ d ɛ r	eː r oː d ɛ r ɛ
ʊ ŋ ŋ gʷ ɛ n t ʊ m	ʊ ŋ gʷ ɛ n t ʊ m
l ɛ m n aː r ʊ m	l ɪ ŋ n aː r j ʊ m
s t ʊ pː a m	s t ʊ pː a m
m uː n iː k iː p aː l ɛ	m uː n ɪ k ɪ p aː l ɛ m
w ɔ l uː b ɪ l ɛ	w ɔ l uː b ɪ l ɛ m
n a n ʊ m	n aː n ʊ m
w a d oː s ʊ m	w a d oː s ʊ m
p ɛ r k a m	p ɛ r k a m
t ɔ r kʷ ɛ r ɛ m	t ɔ r kʷ eː r ɛ
k a t ɛ l a m	k a t ɛ lː a m
k ɔ kʷ ɛ	k ɔ kː ʊ m
b l a t eː r aː r ɛ	b l a t ɛ r aː r ɛ
uː r n a m	uː r n a m
j aː ɪ r ʊ m	aː r j ʊ m
iː m mː iː m r s ɛ	ɪ mː ɪ s k eː r ɛ
d oː n oː s t aː r	d ɛ h ɔ n ɛ s t aː r ɛ
a b d uː k t j ʊ m n ɛ m	a b d ʊ k t j oː n ɛ m
a s ʊ lː aː r	a sː ɔ l aː r ɛ
f ɛ m ɔ r aː l ɛ	f ɛ m ɔ r aː l ɛ m
f l aː g r aː r ɛ	f l a g r aː r ɛ
iː m p l iː k aː r ɛ	ɪ m p l ɪ k aː r ɛ
d ɔ m iː k iː l j ʊ m	d ɔ m ɪ k ɪ l j ʊ m
d ɪ s p ɛ t aː r ɛ	d eː s p ɛ k t aː r ɛ
g a l ɛ n a m	g a l eː n a m
s a d ɪ r ɛ	s w aː d eː r ɛ
s iː m j a m	s iː m j a m
p r ɔ l ɛ m	p r oː l ɛ m
d eː t ɛ r g ɛ r ɛ	d eː t ɛ r g eː r ɛ
rː j ɛ aː g iː r	r ɛ a g eː r ɛ
k ɔ l t r ʊ m	k ʊ l t r ʊ m
r ɛ f ɔ r m aː r ɛ	r ɛ f oː r m aː r ɛ
a m b iː kʷ ʊ ɛ ɪ t aː t ɛ m	a m b ɪ gʷ ɪ t aː t ɛ m
t m j a	tʰ iː a m
t ɔ r ʊ m	t ɔ r ʊ m
k r iː m iː n a k j oː n	k r iː m ɪ n aː t j oː n ɛ m
p l aː n ʊ m	p l aː n ʊ m
k ɔ r n ɛ ʊ m	k ɔ r n ɛu m
ɛ kʷ iː p a r aː r ɛ	aɪ kʷ ɪ p ɛ r aː r ɛ
p uː n iː t j ʊ m n ɛ m	p uː n iː t j oː n ɛ m
k ɔ n s iː s t ɛ r ɛ	k oː n s ɪ s t ɛ r ɛ
h ɔ s t j a m	h ɔ s t j a m
w ɛ s p ɛ r ʊ m	w ɛ s p ɛ r ʊ m
m k ʊ r t aː r ɛ	k ʊ r t aː r ɛ
ɔ rː m iː d ʊ m	h ɔ rː ɪ d ʊ m
p r ɔ f ɛ t ʊ m	p r oː f ɛ k t ʊ m
p l a n ɛ t a m	p l a n eː t a m
p l ʊ m ʊ s ʊ m	p l ʊ m b oː s ʊ m
s a ŋ gʷ iː n ɔ l ɛ n t ʊ m	s a ŋ gʷ ɪ n ɔ l ɛ n t ʊ m
m ʊ s t ʊ m	m ʊ s t ʊ m
t r a n s f ɔ r m a t j ʊ m n ɛ m	t r aː n s f oː r m aː t j oː n ɛ m
b uː b ɔ n iː k ʊ m	b uː b oː n ɪ k ʊ m
ɪ ŋ g ɛ n j ʊ m	ɪ ŋ g ɛ n j ʊ m
w m ɛ r m ɛ m	w ɛ r m ɛ m
n ɛ kʷ ɛ t a r ɛ	n ɛ k t a r
m aː g iː k ʊ m	m a g ɪ k ʊ m
ɛ n t ɛ m	ɛ n s
p l uː m b ɛ ʊ m	p l ʊ m b ɛu m
n iː m j ʊ m	n ɪ m j ʊ m
p j ɛ lː aː r ʊ m	p ɛ lː aː r j ʊ m
uː d a m	uː d ʊ m
p ʊ r k ɛ lː ʊ	p ɔ r k ɛ lː ʊ m
a n ʊ iː r ɛ	a d n ʊ ɛ r ɛ
m p ɪ l aː r ɛ	p ɪ l aː r ɛ
uː r ʊ m	uː r ʊ m
f aː w a m	f a b a m
s oː l ʊ m	s oː l ʊ m
iː ŋ n ɔ m iː n j a m	ɪ ŋ n oː m ɪ n j a m
d iː w uː l g aː r ɛ	d iː w ʊ l g aː r ɛ
r ɛ s t a m	r ɛ s t ɛ m
ɛ k s uː lː t ɛ	ɛ k s ʊ l t aː r ɛ
s oː n a m	z oː n a m
s ɛ rː aː r ɛ	s ɛ r ɛ r ɛ
t a pː ɛ t ɛ m	t a p eː t ɛ m
a l j ɪ ɛ n a t j oː n ɛ m	a l ɪ eː n aː t j oː n ɛ m
m ʊ r ɛ n a m	m ʊ r eː n a m
k ɔ m s t r iː k t oː r ɛ	k oː n s t r ɪ k t oː r ɛ m
a s iː s t ɛ r ɛ	a sː ɪ s t ɛ r ɛ
k ʊ n d ɪ n a t j oː n ɛ m	k ɔ n d ɛ m n aː t j oː n ɛ m
ɪ t iː d aː t ɛ m	a k ɪ d ɪ t aː t ɛ m
w ɔ l uː p t ɛ m	w ɔ l ʊ p t aː t ɛ m
d ʊ m ɪ n iː k a l ɛ	d ɔ m ɪ n ɪ k aː l ɛ m
m a n k ʊ m	m a ŋ k ʊ m
f uː s t ɛ m	f uː s t ɛ m
s a l uː b r iː t aː t ɛ m	s a l uː b r ɪ t aː t ɛ m
ɔ b s t r uː ɛ r	ɔ b s t r ʊ ɛ r ɛ
s ɛ p ʊ l t uː r a m	s ɛ p ʊ l t uː r a m
s aː l g ɪ ɛ m	s a l ɪ k ɛ m
l a s ʊ m	l a sː ʊ m
aː l t iː t uː d ɪ n ɛ m	a l t ɪ t uː d ɪ n ɛ m
k uː r aː r ɛ	k uː r aː r ɛ
m a n aː t ɛ m	m a ŋ n aː t ɛ m
uː l k ɛ r a m	ʊ l k ʊ s
t ɔ m ʊ m	t ɔ m ʊ m
a k t ʊ ʊ a l ɛ	a k t w aː l ɛ m
t r iː k ɛ	t r iː k ɛ m
ɔ s t ɛ n s iː w ʊ m	ɔ s t eː n s iː w ʊ m
s t r ɔ p ʊ m	s t r ɔ pː ʊ m
m ɪ s t uː r a m	m ɪ s t uː r a m
b ɛ b ɪ t oː r ɛ	b ɪ b ɪ t oː r ɛ m
n ʊ t ɔ r j ʊ m	n oː t oː r j ʊ m
f uː n ɛ b r ɛ m	f uː n ɛ b r ɛ m
w a g a b ʊ n d ʊ m	w a g aː b ʊ n d ʊ m
s p ɛ k ʊ j ʊ m	s p ɛ k l ʊ m
p ɛ r p eː t a w j ɪ s ɛ m	p ɛ r p ɛ t w aː t oː n ɛ m
iː n k ɔ m s t a n t ɛ m	ɪ ŋ k oː n s t a n t ɛ m
k iː s t ɛ r n a m	k ɪ s t ɛ r n a m
f uː l k r ʊ m	f ʊ l k r ʊ m
ɔ r j ɪ uː n d ʊ m	ɔ r j ʊ n d ʊ m
ɔ k uː l aː r ɛ	ɔ k ʊ l aː r ɛ m
t oː r j ʊ m	t oː r j ʊ m
a k ɛ n d ɛ r ɛ	a kː ɛ n d ɛ r ɛ
a r uː s p iː k ɛ m	h a r ʊ s p ɪ k ɛ m
k a n kʷ ɛ m r ʊ m	k a ŋ k r ʊ m
r a s ɛ k aː r ɛ	r ɛ s ɛ k aː r ɛ
eː l ɛ k t j ɔ n ɛ	eː l eː k t j oː n ɛ m
r ʊ r aː r	r oː r aː r ɛ
l uː k s	l uː k ɛ m
t uː m eː f a g ɪ l ɛ	t ʊ m ɛ f a k ɛ r ɛ
k aʊ t ɛ l a m	k aʊ t eː l a m
a k t aː r j ʊ m	aː k t w aː r j ʊ m
w ɛ l a r	w ɛ l a m
ɪ m p ɛ r j ʊ m	ɪ m p ɛ r j ʊ m
d uː l k a m a r a m	d uː l k a m aː r a m
f j ɛ b ʊ m l ɛ m	f l eː b ɪ l ɛ m
f aː k ɛ m	f a k ɪ ɛ m
p r ɛ ɔ k uː p a t j ʊ m n ɛ m	p r aɪ ɔ kː ʊ p aː t j oː n ɛ m
g r a l ʊ m	g r aː k ʊ l ʊ m
k ɛ l eː s t j aː l ɛ	k aɪ l ɛ s t j aː l ɛ m
k ɔ m p ʊ ŋ g ɛ r ɛ	k ɔ m p ʊ ŋ g ɛ r ɛ
a ŋ g uː s t ʊ m	a ŋ g ʊ s t ʊ m
iː n f ɛ s t aː r ɛ	iː n f ɛ s t aː r ɛ
a t r ʊ m	aː t r ʊ m
iː n d iː ŋ n aː r ɛ	ɪ n d ɪ ŋ n aː r iː
b aː r a t r ʊ m	b a r a tʰ r ʊ m
p ʊ r t ʊ g ɛ s ɛ	p ɔ r t ʊ k eː n s ɛ m
s k ɔ r t a m	s k ɔ r t ɛ a m
ɛ k s p iː r aː r ɛ	ɛ k sː p iː r aː r ɛ
d eː m w j aː r ɛ	d eː w j aː r ɛ
ɛ r k ɛ r ɛ	eː r ɪ g ɛ r ɛ
a k a d ɛ m j a m	a k a d eː m iː a m
r ʊ ʊ m	r ʊ b ʊ m
lː iː b ɛ lː ʊ m	l ɪ b ɛ lː ʊ m
p a k aː r	p aː k aː r ɛ
r ɛ k eː p t aː r ɛ	r ɛ k ɛ p t aː r ɛ
w ɛ s t iː r ɛ	w ɛ s t iː r ɛ
p j ɛ l a g ʊ m	p ɛ l a g ʊ s
ɛ l uː k uː b r aː r ɛ	eː l uː k ʊ b r aː r ɛ
ɔ r a t oː r ɛ	oː r aː t oː r ɛ m
m iː l a m	m iː lː j a
a lː ɔ k uː t j ʊ m n ɛ m	a lː ɔ k uː t j oː n ɛ m
d r aː pː ɪ m ʊ m	d r a pː ʊ m
w a nː ɪ	w a nː ʊ m
f ʊ l g ʊ r aː r ɛ	f ʊ l g ʊ r aː r ɛ
m uː n iː t j ʊ m m	m uː n iː t j oː n ɛ m
iː n f l ɛ k s j ʊ m n ɛ m	iː n f l ɛ k t j oː n ɛ m
m a r a w ɪ l a m	m iː r aː b ɪ l ɛ m
t r iː t uː r a m	t r iː t uː r a m
m ɔ t j oː n ɛ m	m oː t j oː n ɛ m
ɔ r n aː t ʊ m	oː r n aː t ʊ m
t j ɪ p ɛ ɪ d ʊ m	t ɛ p ɪ d ʊ m
m ʊ n t oː s ʊ m	m ɔ n t ʊ oː s ʊ m
s ʊ s p ɛ n s j oː n ɛ m	s ʊ s p eː n s j oː n ɛ m
ɛ f ɛ k t aː a m r	ɛ fː ɪ k ɛ r ɛ
t oː r w j ʊ m	t ɔ r w ʊ m
iː m f ɔ r t uː n j ʊ m	iː n f ɔ r t uː n j ʊ m
k ɔ m s t iː t uː t j ʊ m n ɛ m	k oː n s t ɪ t uː t j oː n ɛ m
a sː ɪ eː r ɪ	a sː ɪ d eː r ɛ
iː m t iː r a m	ɪ n t ʊ eː r iː
ɪ n f a n t j a m	iː n f a n t j a m
k ɛ l ɛ r ɛ m	k ɛ l ɛ r ɛ m
w a s ɛ lː ʊ m	w aː s k ɛ lː ʊ m
m aː pː a m	m a pː a m
p uː b ɛ m	p uː b ɛ r ɛ m
s k a b j a m	s k a b ɪ ɛ m
d ɛ n t aː t ʊ m	d ɛ n t aː t ʊ m
g ʊ l a m	g ʊ l a m
m a n t iː p m j ʊ m	m a ŋ k ɪ p j ʊ m
iː n f l iː k t j oː n ɛ m	ɪ n f l ɪ k t j oː n ɛ m
k ɔ n s ɪ ŋ n aː r ɛ	k oː n s ɪ ŋ n aː r ɛ
k aː l iː k ɛ m	k a l ɪ k ɛ m
d ɔ ʊ r n aː l ɛ	d j ʊ r n aː l ɛ m
a d iː r ɛ	a d iː r ɛ
t r iː n ɪ t aː t ɛ m	t r iː n ɪ t aː t ɛ m
ɛ lː a t j oː n	eː l aː t j oː n ɛ m
k ɔ n f ɔ r m ɛ m	k oː n f oː r m ɛ m
p r eː w ɛ r	p r aɪ w ɪ d eː r ɛ
a r aː n ʊ m	a r aː n ɛ a m
g ɛ n iː t iː w ʊ m	g ɛ n ɪ t iː w ʊ m
m ɔ n a s t ɛ r j ʊ m	m ɔ n a s t eː r j ʊ m
s ɛ r p ɛ n t iː n ʊ m	s ɛ r p ɛ n t iː n ʊ m
k ɪ r k eː n	k ɪ r k ɪ n ʊ m
p ɛ lː iː k ʊ l a m	p ɛ lː ɪ k ʊ l a m
n w ɔ t aː r ɛ	n a t aː r ɛ
ɪ n ʊ m	iː n ʊ m
b aː s j ʊ m	b aː s j ʊ m
n ɔ d oː s ʊ m	n oː d oː s ʊ m
k ɔ m ɔ n j ʊ m n ɛ m	k ɔ mː uː n iː r ɛ
iː r a s iː b ɪ l ɛ m	iː r aː s k ɪ b ɪ l ɛ m
k eː r t aː r ɛ	k ɛ r t aː r ɛ
ɪ n w iː d j a m	ɪ n w ɪ d j a m
fː uː m iː k h r ɛ	f uː m ɪ g aː r ɛ
d eː t ɛ k t aː r m ʊ ɪ	d eː t ɛ g ɛ r ɛ
s a l a k ɛ	s a l aː k ɛ m
a d uː n t ʊ m	a d j ʊ ŋ k t ʊ m
w ɪ t r j ʊ m	w ɪ t r ʊ m
w aɪ t a m	w ɪ tː a m
ɛ r ɔ m p ɛ r ɛ	eː r ʊ m p ɛ r ɛ
w ʊ l t ʊ m	w ʊ l t ʊ m
b a j ɛ l ɛ m	b aː j ʊ l ʊ m
f a r m aː k ʊ m	pʰ a r m a k ʊ m
w iː n k ʊ l aː r ɛ	w ɪ ŋ k ʊ l aː r ɛ
w ɛ r n aː k ʊ l ʊ m m	w ɛ r n aː k ʊ l ʊ m
k ɔ n s ɔ r t ɛ m	k oː n s ɔ r t ɛ m
g ɛ r uː n d j ʊ m	g ɛ r ʊ n d j ʊ m
iː rː eː g ʊ l aː r ɛ	ɪ rː eː g ʊ l aː r ɛ m
s iː l iː k j ʊ m	s ɪ l ɪ k j ʊ m
k ɔ d iː k ɛ m	k oː d ɪ k ɛ m
k eː m ɛ n t ʊ m	k aɪ m ɛ n t ʊ m
s uː b m ɛ ɛ r m ʊ m	s uː b ɛ r ɛ m
p a r t iː k ʊ l a m	p a r t ɪ k ʊ l a m
w iː lː a n ʊ m	w iː lː aː n ʊ m
p r ɔ s ɛ k iː r ɛ	p r oː s ɛ kʷ iː
ɛ m s p lː a n aː r	ɛ k s p l aː n aː r ɛ
p r eː m ʊ n iː t ʊ r ɛ m	p r aɪ m ɔ n ɪ t oː r ɛ m
l aː t ʊ m	l aː t ʊ m
k eː r t a m ɛ m m	k ɛ r t aː m ɛ n
ɛ r uː g iː n ɛ m	aɪ r uː g ɪ n ɛ m
iː m p r ɔ b iː t aː	ɪ m p r ɔ b ɪ t aː t ɛ m
p aː l p eː b r aː l	p a l p ɛ b r aː l ɛ m
s ɛ n aː r ɛ	s ɪ ŋ n aː r ɛ
w ɛ n d ɛ m j aː r ɛ	w iː n d eː m j aː r ɛ
k a n iː k ʊ l a m	k a n iː k ʊ l a m
aː s	a sː ɛ m
k ɔ n f ɛ s oː r ɛ	k oː n f ɛ sː oː r ɛ m
k r ɔ t a l ʊ m	k r ɔ t a l ʊ m
a s k ɛ n d ɛ r ɛ	a s k ɛ n d ɛ r ɛ
a b l uː ɛ r	a b l ʊ ɛ r ɛ
k a l oː r ɛ	k a l oː r ɛ m
n ʊ d ɛ	n oː d aː r ɛ
w ʊ l g ʊ m	w ʊ l g ʊ s
g uː s t ʊ m	j uː s t ʊ m
s uː s k iː t aː r ɛ	s ʊ s k ɪ t aː r ɛ
w ɛ r g ɪ ɛ l ɛ	w ɪ r ɪ d aː r j ʊ m
a s iː ʊ m	a sː ɛ sː ʊ m
r ɛ f ɛ k t j ʊ m n ɛ m	r ɛ f ɛ k t j oː n ɛ m
h aː j ʊ n aː ɛ	j eː j uː n aː r ɛ
ɛ s p ɛ t ɛ m	h ɔ s p ɪ t ɛ m
f uː n ɛ r ɪ ʊ m	f uː n ɛ r ɛu m
k ɔ n t r a k t ɛ	k ɔ n t r a h ɛ r ɛ
p a r t iː t j ʊ m n ɛ m	p a r t iː t j oː n ɛ m
r ɛ m a n ɛ r ɛ	r ɛ m a n eː r ɛ
m a n iː f eː s t aː r ɛ	m a n ɪ f ɛ s t aː r ɛ
b ɪ s pʰ m a m	b eː s t j a m
p aʊ s a m	p aʊ s a m
ɔ n ɔ r iː f iː k ʊ m	h ɔ n oː r ɪ f ɪ k ʊ m
p ɪ k a m	p iː k a m
aː s t ɪ l a m	a sː ʊ l a m
m iː l aː r j ʊ m	m iː lː j aː r j ʊ m
w iː w iː d ʊ m	w iː w ɪ d ʊ m
n a rː aː r ɛ	n a rː aː r ɛ
ɛ f l uː iː r ɛ	ɛ fː l ʊ ɛ r ɛ
w ɛ lː ʊ m	w ɛ lː ʊ s
d eː t eː r j ɪ ɔ r a t j ʊ m n ɛ m	d eː t ɛ r j oː r aː t j oː n ɛ m
t r uː k uː l ɛ n t ʊ m	t r ʊ k ʊ l ɛ n t ʊ m
d aɪ m b uː l a t j ʊ m n ɛ m	d ɛ a m b ʊ l aː t j oː n ɛ m
n ʊ m ɛ r oː s ʊ m	n ʊ m ɛ r oː s ʊ m
ɛ k s t r iː m s ɛ k ʊ m	ɛ k s t r iː n s ɛ k ʊ m
ɪ n w ɪ g iː l aː r ɛ	ɪ n w ɪ g ɪ l aː r ɛ
d a ʊ nː oː s ʊ m	d a m n oː s ʊ m
p r ɛ p ɔ s ɪ t ɛ m	p r aɪ p ɔ s ɪ t ʊ m
s a k ɛ r d ɔ t j ʊ m	s a k ɛ r d oː t j ʊ m
ɔ r iː f iː k ʊ m	h ɔ rː ɪ f ɪ k ʊ m
d ɛ k ɛ d ɛ r ɛ	d eː k eː d ɛ r ɛ
s a lː a t iː t aː t ɛ m	s a l aː k ɪ t aː t ɛ m
g ɛ m ɛu h ʊ m	g ɛ m ɛ lː ʊ m
t m j ʊ	tʰ iː ʊ m
g ʊ w ɛ n k ʊ m	j ʊ w ɛ ŋ k ʊ m
d eː s j ɛ r t ʊ m	d eː s ɛ r t ʊ m
a d ʊ m b r aː r ʊ m	a d ʊ m b r aː r ɛ
s a k r iː f iː k a t oː r ɛ	s a k r ɪ f ɪ k aː t oː r ɛ m
m oː r ɛ m	m oː r ɛ m
a pː a r ɛ n t ɛ m	a pː a r ɛ n t ɛ m
k a r ɪ k k ɛ m	k aː r ɪ k ɛ m
w ɔ m ɛ r ɛ	w oː m ɛ r ɛ m
eː ŋ w a n ɛ ɪ r ɛ	eː w aː n eː s k ɛ r ɛ
k uː l p aː r	k ʊ l p aː r ɛ
k l a g ɔ l ʊ m	g l a d ɪ ɔ l ʊ m
d eː m ɔ n j ʊ m	d aɪ m ɔ n j ʊ m
f r uː iː r ɛ	f r ʊ iː
ɛ m s p uː ŋ n aː r ɛ	ɛ k s p ʊ ŋ n aː r ɛ
a f j a n k aː r	a fː ɪ d ɛ n t j aː r ɛ
r ʊ b iː m	r oː b iː g ɪ n ɛ m
iː n uː l t ʊ m	ɪ n ʊ l t ʊ m
uː s uː r aː r j ʊ m	uː s uː r aː r j ʊ m
s ʊ l k aː r ɛ	s ʊ l k aː r ɛ
g aː lː a m	g a lː a m
r eː k ɔ r d aː r ɛ	r ɛ k ɔ r d aː r iː
eː m ɛ t ɛ r ɛ	eː m ɪ tː ɛ r ɛ
k a m iː n ʊ m	k a mː iː n ʊ m
l iː t uː r g j a m	l iː t uː r g j a m
ɛ m ɔ l uː m ɛ n t ʊ m	eː m ɔ l ʊ m ɛ n t ʊ m
p aʊ n t ʊ m	p uː ŋ k t ʊ m
a g r eː g a t j oː n	a gː r ɛ g a t j oː n ɛ m
a k r iː m oː n j a m	aː k r ɪ m oː n j a m
a t r a m ɛ n t ʊ m m	aː t r aː m ɛ n t ʊ m
m iː r t ʊ m	m y r t ʊ m
r ɛ m ʊ w eː r ɛ	r ɛ m ɔ w eː r ɛ
k a p ʊ t aː r ɛ	k a p t aː r ɛ
iː p ɔ t ɛ k a m	h y p ɔ tʰ eː k a m
f a y aː l ɛ	f a k j aː l ɛ m
ɛ r oː k ʊ ʊ m	w ɛ r ɪ k ʊ l ʊ m
a k r eː t j oː n ɛ	a kː r eː t j oː n ɛ m
d eː p uː r aː r ɛ	d eː p uː r aː r ɛ
m ɛ n aː k j a	m ɪ n aː k ɛ m
aʊ d iː t oː r j ʊ m	aʊ d iː t oː r j ʊ m
g uː d j eː ʊ m	j uː d aɪ ʊ m
k a n t ɪ k ʊ m	k a n t ɪ k ʊ m
p oː m t oː n ɛ m	p oː t j oː n ɛ m
t ɛ m ɛ r ɛ	t ɪ m eː r ɛ
g eː n j ɪ p ɪ r ʊ m	j uː n ɪ p ɛ r ʊ m
p ɛ r iː k ʊ l oː s ʊ m	p ɛ r iː k ʊ l oː s ʊ m
p ɔ s ɛ s j ʊ m n ɛ m	p ɔ sː ɛ sː j oː n ɛ m
m aː r t ɛ r ɛ	m a r t y r ɛ m
ɛ l iː m iː n aː r ɛ	eː l iː m ɪ n aː r ɛ
a w ɛ lː iː n a	a b ɛ lː a n a m
a s iː l ʊ m	a s y l ʊ m
a d iː m ʊ m r ɛ	a dː iː k ɛ r ɛ
a g iː l iː t aː t ɛ m	a g ɪ l ɪ t aː t ɛ m
s t r ɛ p iː t ʊ m	s t r ɛ p ɪ t ʊ m
