s t uː d j aː r ɛ	s t ʊ d eː r ɛ
k aʊ t ɛ l a m	k aʊ t eː l a m
n ɛ r w ʊ m	n ɛ r w ʊ m
k eː p a m	k aɪ p a m
l uː b oː n ɪ n ʊ m l oː	ɛ lː y kʰ n j ʊ m
m uː s k ʊ l aː r ɛ	m uː s k ʊ l aː r ɛ m
f r ɔ n t aː l ɛ	f r ɔ n t aː l ɛ m
t r aː m l ʊ k ɛ r ɛ	t r aː n s l uː k eː r ɛ
p r ɔ d ʊ k t ɪ w ʊ m	p r oː d ʊ k t iː w ʊ m
s ɛ w ɛ r ʊ m	s ɛ w eː r ʊ m
a r g ɪ lː a m	a r g ɪ lː a m
k ɔ m p r ɔ m ɛ t eː r ɛ	k ɔ m p r oː m ɪ tː ɛ r ɛ
p r ɛ w j ʊ m	p r aɪ w j ʊ m
p l aː t ɛ a m	p l a t eːa m
d eː n s aː r n ɛ	d eː n s aː r ɛ
a r m ɛ n t ʊ m	a r m ɛ n t ʊ m
s ɛ n ɛ m	s ɛ n ɛ m
fː ɪ aː t s	f ɔ r j a m
m a t r ɪ t iː t j ʊ m	m aː t r ɪ k iː d j ʊ m
a s iː m ɪ l aː r ɛ	a sː ɪ m ʊ l aː r ɛ
k ʊ p r ɛ m ɛ m ʊ m	k uː p r ʊ m
f r a ŋ g ɛ r ɛ	f r a ŋ g ɛ r ɛ
a b ɔ m aː s ʊ m	a b ɔ m aː s ʊ m
eː d iː f ɪ k aː r ɛ	aɪ d ɪ f ɪ k aː r ɛ
k ɔ l aː r ɛ	k ɔ l ɛ r ɛ
m a t uː r ʊ m	m aː t uː r ʊ m
g r a t a m	k r aː t ɛ m
s a p ɔ n ɛ	s aː p oː n ɛ m
s ɔ l ɪ k ɪ t uː d ɪ n ɛ m	s ɔ lː ɪ k ɪ t uː d ɪ n ɛ m
b ɔ l ɛ t ʊ m	b oː l eː t ʊ m
ɔ n ɔ r ɪ f iː k oː	h ɔ n oː r ɪ f ɪ k ʊ m
d ʊ l k ɪ f iː k aː r ɛ	d ʊ l k ɪ f ɪ k aː r ɛ
d ɪ ŋ n aː r ɛ	d ɪ ŋ n aː r ɛ
s t aː b ɪ l ɛ	s t a b ɪ l ɛ m
t r ʊ n k aː r ɛ	t r ʊ ŋ k aː r ɛ
a rː ɔ g aː r ɛ m	a rː ɔ g aː r ɛ
k ɔ n s t ɪ t uː t ɪ w ʊ m	k ɔ n s t ɪ t uː t ɪ w ʊ m
aʊ s p ɪ k j ʊ m	aʊ s p ɪ k j ʊ m
t ɛ n ɪ ɛ ɛ	t ɛ n ʊ ɛ m
ɪ mː aː r k ɛ ɪ b ɪ l ɛ m	ɪ mː a r k ɛ s k ɪ b ɪ l ɛ m
ɔ s aː r	aʊ d eː r ɛ
a t ʊ m	aː t ʊ m
a s p ɛ r g eː r ɛ	a s p ɛ r g ɛ r ɛ
p uː l uː l aː r ɛ	p ʊ lː ʊ l aː r ɛ
s k r ʊ t aː r	s k r uː t aː r iː
k a t ɛ d r aː l ɛ	k a tʰ ɛ d r aː l ɛ m
ɪ n t r ɔ aː t ʊ m	ɪ n t r ɔ ɪ t ʊ m
k ɔ rː ɛ g t oː r ɛ	k ɔ rː ɛ k t oː r ɛ m
m eː t a lː ʊ m	m ɛ t a lː ʊ m
p r aɪ w ɛ n iː r ɛ	p r aɪ w ɛ n iː r ɛ
s ɪ k ɔ f a n t a m	s yː k ɔ pʰ a n t a m
ɔ sː a r j ʊ m	ɔ sː aː r j ʊ m
n ɔ d oː s ʊ m	n oː d oː s ʊ m
p uː p a m	p uː p a m
b aː aː a t ʊ m	b ɔ aː t ʊ m
ɪ n k ɔ m s t aː n t ɛ m	ɪ ŋ k oː n s t a n t ɛ m
ɔ k d oː r ɛ m	ɔ d oː r ɛ m
f a l a ŋ g ɛ m	pʰ a l a ŋ g ɛ m
w ɪ t uː lː ʊ m	w ɪ t ʊ l ʊ m
r ɛ m ɔ b eː r ɛ	r ɛ m ɔ w eː r ɛ
ɪ m p ɛ lː ɛ r ɛ	ɪ m p ɛ lː ɛ r ɛ
p r ɛ a ɛ m b ʊ l ʊ m	p r aɪ a m b ʊ l ʊ m
w ɪ g ɔ r aː r ɛ	w ɪ g oː r aː r ɛ
k uː ŋ a m	k uː n a m
m ɔ s t r ʊ ʊ m	m oː n s t r ʊ oː s ʊ m
g uː g a l	j ʊ g aː l ɛ m
g r a m a m ɛ	g r aː m ɛ n
ɪ r aː k ʊ n d j a m	iː r aː k ʊ n d j a m
ɛ l iː m ɪ n aː t j oː n ɛ m	eː l ɪ m ɪ n aː t j oː n ɛ m
g r aː n ʊ m	g r aː n ʊ m
aʊ d iː t ɔ r j ʊ m	aʊ d iː t oː r j ʊ m
g ɛ m uː l a m	g ɛ mː ʊ l a m
w a k ɪ ʊ m	w a k iː w ʊ m
ɔ pː r ɪ mː ɛ r	ɔ pː r ɪ m ɛ r ɛ
l a w aː t ɔ r j j ʊ m	l a w aː t oː r j ʊ m
f aɪ rː aː r j ʊ m	f ɛ rː aː r j ʊ m
a l k ɛ m	a l k ɛ m
p ɛ r k ɔ l aː r ɛ	p ɛ r k oː l aː r ɛ
k a rː ʊ t j a m	k a rː uː k a m
p r ɔ k ʊ r aː r ɛ	p r oː k uː r aː r ɛ
f ɔ k aː r j a m	f ɔ k aː r j ʊ m
ɪ n s t aʊ r aː r ɛ	iː n s t aʊ r aː r ɛ
p l aː n aː r ɛ	p l aː n aː r j ʊ m
n aʊ s b	n aʊ s j a m
p uː b ɛ m	p uː b ɛ r ɛ m
a pː ʊ m	a p j ʊ m
s a k k j oː n ɛ m	s aː ŋ k t j oː n ɛ m
w ɔ l t aː r ɛ	w ɔ l uː t aː r ɛ
s kʰ ɪ k uː t a m	k ɪ k uː t a m
ɔ p uː l ɛ n t ʊ m	ɔ p ʊ l ɛ n t ʊ m
ɔ n k ɛ a m	ʊ ŋ k j a m
k ɔ n k aː t ɛ n aː r ɛ	k ɔ ŋ k a t eː n aː r ɛ
g ɛ n j ɛ p ʊ eː r ʊ m	j uː n ɪ p ɛ r ʊ m
m ʊ w ɛ r ɛ	m ɔ w eː r ɛ
l ɪ iː m aː t ɛ m	l iː m aː k ɛ m
d ɛ k r ɛ m ɛ n t ʊ m	d eː k r eː m ɛ n t ʊ m
s p uː m aː r ɛ	s p uː m aː r ɛ
p r a t d ɪ ʊ m	p r a n d j ʊ m
kʷ ɪ t a n r ɛ a m	kʷ ɪ eː t a n t j a m
a k sː ɛ m	a k s ɛ m
ɪ m p ɛ t j eː r ɛ	ɪ m p ɛ d iː r ɛ
p r iː w aː t ʊ m	p r iː w aː t ʊ m
m a t ɛ r n iː t aː t ɛ m	m aː t ɛ r n ɪ t aː t ɛ m
k oː l uː b r iː n ʊ m	k ɔ l ʊ b r iː n ʊ m
ɪ n w ɪ t aː r ɛ	ɪ n w iː t aː r ɛ
s t r ɪ m ɛ t ɛ r	t r ɛ m eː s k ɛ r ɛ
a l w ɛ ʊ m	a l w ɛu m
p ɛ r ɛ g r iː n aː r ɛ	p ɛ r ɛ g r iː n aː r iː
m a t r ɔ n aː l	m aː t r oː n aː l ɛ m
k eː n t aː r n ɛ	kʷ ɪ eː t aː r ɛ
a r g ʊ t j a m	a r g uː t j a m
oː s k uː l ʊ m	oː s k ʊ l ʊ m
k ɔ m p aː r eː t r ɛ	k ɔ m p aː r eː r ɛ
a b s t r a h ɛ r ɛ m ɛ	a b s t r a h ɛ r ɛ
aʊ d iː t oː r ɛ m	aʊ d iː t oː r ɛ m
s a kʰ ʊ m	s a r k ʊ l ʊ m
t ɔ rː aː r	t ɔ rː eː r ɛ
p ɔ r k iː n ʊ m	p ɔ r k iː n ʊ m
p ɔ r eː k ʊ n t aː r	p ɛ r k ɔ n t aː r iː
t a k t ɪ l ɛ m	t aː k t ɪ l ɛ m
ʊ n ɔ r aː b ɪ l ɛ	h ɔ n oː r aː b ɪ l ɛ m
a pː aː r ɛ n t ɛ m	a pː a r ɛ n t ɛ m
w ɔ m iː r ɛ m	w ɔ m ɛ r ɛ
p ɔ ŋ d aɪ r aː t j oː n ɛ m	p ɔ n d ɛ r aː t j oː n ɛ m
r ɛ l ɪ kʷ j a m	r eː l ɪ kʷ j aː s
k ɛ n aː k ɪ l ʊ m	k eː n aː k ʊ l ʊ m
w aɪ t ɛ r ɛ m	w ɛ t ɛ r ɛ m
f ɪ g uː r a m	f ɪ g uː r a m
w aː r ɛ r ɛ	w ɛ rː ɛ r ɛ
p r aː n t ɛ r ʊ m	p r a n d eː r ɛ
p uː s t ʊ l a m	p ʊ s t ʊ l a m
s t r iː l j ɪ l ɛ	s t r ɪ g ɪ l ɛ m
k ɔ l aʊ d aː r ɛ	k ɔ lː aʊ d aː r ɛ
p ɛ r s k iː k a m	p ɛ r s ɪ k a m
aʊ k k j ɔ n ɛ	aʊ k t j oː n ɛ m
w a lː ʊ m	w a lː ʊ m
kʷ ɛ s t j ɔ n aː r j ʊ m	kʷ aɪ s t j oː n aː r j ʊ m
m uː l t a m	m ʊ l t a m
k ɔ n w ɔ k aː r ɛ	k ɔ n w ɔ k aː r ɛ
ɛ k ɪ g k aː r ɪ s t j a m	ɛu kʰ a r ɪ s t j a m
r ɛ k t ɪ t uː d	r ɛ k t ɪ t uː d ɪ n ɛ m
ɛ k s aː k eː n r b aː t j ʊ m n ɛ m	ɛ k s a k ɛ r b aː t j oː n ɛ m
p ɔ s t ɪ iː b ʊ l ʊ m	p r oː s t ɪ b ʊ l ʊ m
t r aː s b s k ɛ n d ɛ r ɛ	t r aː n s k ɛ n d ɛ r ɛ
k ɛ r n ɛ r ɛ	k ɛ r n ɛ r ɛ
f aʊ k ɪ pʰ	f aʊ k eː s
w aɪ r a m	w ɪ r ɪ d ɛ m
l a m ɛ n t ʊ m	l aː m ɛ n t ʊ m
d eː l uː b r ʊ m	d eː l uː b r ʊ m
w a t ɛ m	w aː t ɛ m
r ɔ n k aː r ɛ	r h ɔ ŋ kʰ aː r ɛ
r ɔ s m aː r iː n ʊ m	r oː r ɛ mː a r iː n ʊ m
f a k ɪ l ɪ t aː t ɛ m	f a k ɪ l ɪ t aː t ɛ m
k ɔ p t ʊ r a m	k ɔ k t uː r a m
a k aː ŋ t ɛ r ɛ	a kː ɛ n d ɛ r ɛ
g r ɛ g ʊ ɛ m	g r ɛ g ɛ m
k a n ɪ n ʊ m	k a n iː n ʊ m
p r ɛ s t aː r ɛ	p r aɪ s t aː r ɛ
f ʊ n d aː m ɛ n t ʊ m	f ʊ n d aː m ɛ n t ʊ m
ɪ m p l ɔ r aː r ɛ	ɪ m p l oː r aː r ɛ
ʊ n iː f oː r m ɛ m	uː n ɪ f oː r m ɛ m
b ɛ t ʊ lː a m	b ɛ t ʊ l a m
ʊ ŋ g ɪ ɛ n t ʊ m	ʊ ŋ gʷ ɛ n t ʊ m
ɛ k s t ɛ n s ɪ w ʊ m	ɛ k s t eː n s iː w ʊ m
p ɛ s t aː ɛ	p ɪ s t aː r ɛ
r oː m ɛ k aː	r ʊ m ɪ k ɛ m
a k t ʊ aː r j ʊ m	aː k t w aː r j ʊ m
k ɛ r d ɪ n ɛ m	k ɪ r k ɪ n ʊ m
a m p ʊ lː a m	a m p ʊ lː a m
f r uː k t w oː s ʊ m	f r ʊ k t ʊ oː s ʊ m
s uː g ʊ g ɛ r ɛ r ɛ	s ʊ gː ɛ r ɛ r ɛ
ʊ k l	a w ʊ ŋ k ʊ l ʊ m
p r ɔ t ɛ s t aː r ɛ	p r oː t ɛ s t aː r iː
b ɛ n ɛ f ɪ k j ʊ m	b ɛ n ɛ f ɪ k j ʊ m
f uː r t ɪ w ʊ m	f uː r t iː w ʊ m
p ɛ r s ɪ r t ɛ r ɛ	p ɛ r s ɪ s t ɛ r ɛ
a aː y a m	a s k j a m
p r aɪ k l aː r ʊ m	p r aɪ k l aː r ʊ m
m ɔ w ɪ m ɛ n t ʊ m	m oː w ɪ m ɛ n t ʊ m
l ɪ k aː t j ʊ m n ɛ m	l ɪ g aː t j oː n ɛ m
ɪ mː ɛ r g ɛ r ɛ	ɪ mː ɛ r g ɛ r ɛ
n ɔ m ɪ n aː r ɛ	n oː m ɪ n aː r ɛ
a m ɛ n t ɛ m	aː m ɛ n t ɛ m
f ɔ r n aː l j j	f ɔ r n aː k ʊ l a m
l ɪ b ɛ lː ʊ l a m	l iː b ɛ lː ʊ l a m
g l aʊ k ʊ m	g l aʊ k ʊ m
h j w ɛ r a m n ʊ m	w eː r
m uː n ɪ r ɛ m	m uː n iː r ɛ
f l ɔ r ɪ l ɛ g oː	f l oː r ɪ l ɛ g j ʊ m
p r ɛ s aː r ɛ	p r ɛ t j aː r ɛ
a l t ɪ s ɪ m ʊ m	a l t ɪ sː ɪ m ʊ m
ɔ n ɔ r aː r j ʊ m	h ɔ n oː r aː r j ʊ m
m a k ɛ lː aː j ʊ m	m a k ɛ lː aː r j ʊ m
s ʊ b mː ɛ r g ɛ r ɛ	s ʊ mː ɛ r g ɛ r ɛ
l ɔ n g ɪ t ʊ d ɪ n ɛ m	l ɔ ŋ g ɪ t uː d ɪ n ɛ m
n uː m ɛ r oː s ɪ t aː t ɛ m	n ʊ m ɛ r oː s ɪ t aː t ɛ m
w ɛ r ɛ k ʊ m d ʊ m	w ɛ r eː k ʊ n d ʊ m
ɔ l ɛ aː t ʊ m	ɔ l ɛ aː t ʊ m
d eː l ɪ b ɛ r aː t j ɛ n ɛ	d eː l iː b ɛ r aː t j oː n ɛ m
a d uː ŋ t j ʊ m n ɛ m	a d j ʊ ŋ k t j oː n ɛ m
f l aː g r aː r ɛ	f l a g r aː r ɛ
r ɛ p r ɛ n d ɛ r ɛ	r ɛ p r ɛ h ɛ n d ɛ r ɛ
m a n ɛ k a m	m a n ɪ k a m
f a b r ʊ m	f a b r ʊ m
s ɔ d aː l ɪ t aː t ɛ m	s ɔ d aː l ɪ t aː t ɛ m
s ʊ n aː t ʊ m	s ɔ m n j ʊ m
s ɛ p aː r aː r ɛ	s eː p a r aː r ɛ
b aː ʊ m	b a d j ʊ m
r ɛ s t aː r ɛ	r ɛ s t aː r ɛ
w a l eː r ɛ m	w a l eː r ɛ
ɔ b s ɛ d ɛ r ɛ	ɔ b s ɪ d eː r ɛ
b ɔ r s a m	b ʊ r s a m
t ʊ r n j ʊ m	t ɔ r n ʊ m
m ɔ l aː r ɛ	m ɔ l aː r ɛ m
k ɔ n g ʊ r aː t j oː n ɛ m	k ɔ n ɪ uː r aː t j oː n ɛ m
s ʊ g ɛ ɛ k t ʊ m	s ʊ b ɪ ɛ k t ʊ m
k ɔ n k aː w ʊ m	k ɔ ŋ k a w ʊ m
a n n ɛ lː a m	a ŋ n ɛ lː a m
p ɛ t aː t ʊ m	p ɪ tː a k j ʊ m
ʊ r k ɛ m	ʊ l iː k ɛ m
l ɪ n k t ɛ m	l y ŋ k ɛ m
a r m aː t ʊ m	a r m aː t ʊ m
f uː r ɔ n ʊ m	f uː r ɛ m
p ʊ ɛ r ɪ l ɪ t aː t ɛ m	p ʊ ɛ r iː l ɪ t a t ɛ m
r a p ɪ n a m	r a p iː n a m
k a w aː r ɛ	k a w aː r ɛ
a r m a r j ʊ m	a r m aː r j ʊ m
w ɔ m ɪ t aː r ɛ	w ɔ m ɪ t aː r ɛ
r ʊ ɛ ɪ w j a m	r ʊ b j a m
ɪ n ɪ ʊ m t j ʊ m n ɛ m	ɪ n j ʊ ŋ k t j oː n ɛ m
a s t r ʊ m	a s t r ʊ m
d ɪ g ɪ t aː l ɛ	d ɪ g ɪ t aː l ɛ m
k ɔ n s ɪ ŋ n aː r ɛ	k oː n s ɪ ŋ n aː r ɛ
w ɪ t ɪ m a r ɛ	w ɪ k t ɪ m aː r ɛ
k ɔ l ɛ g j ʊ m	k ɔ lː eː g j ʊ m
m eː n s a m	m eː n s a m
a s p ɛ r s j oː n ɛ m	a s p ɛ r s j oː n ɛ m
ɔ rː iː f ɪ k ʊ m	h ɔ rː ɪ f ɪ k ʊ m
d eː h ɛ s p ɛ r aː t ʊ m	d eː s p eː r aː t ʊ m
p ɛ r s ɛ k uː t oː r ɛ	p ɛ r s ɛ k uː t oː r ɛ m
s ɛ r oː t ɪ n ʊ m	s eː r oː t ɪ n ʊ m
m a r g ɛ r iː t a m	m a r g a r iː t a m
r ɛ l ɪ k j ɛ	r ɛ l ɪ kʷ ʊ m
kʷ a d ɛ r n ʊ m	kʷ a t ɛ r n oː s
t r aɪ p ɪ d aː r ɛ	t r ɛ p ɪ d aː r ɛ
r uː k ʊ m	r oː s k ɪ d ʊ m
s t ɪ w aː r ɛ	s t iː p aː r ɛ
k ɪ t ɪ s ʊ m	k y t ɪ s ʊ m
ɔ b l ɪ t eː r aː r ɛ	ɔ b l ɪ tː ɛ r aː r ɛ
r ɛ k l aː m aː r ɛ	r ɛ k l aː m aː r ɛ
a r k j a m	a r kʰ j a m
a l uː t ɪ n aː r	aː l uː k ɪ n aː r iː
ʊ l t ɛ r j oː r ɛ	ʊ l t ɛ r j oː r ɛ m
f r aː t ɛ r n aː l	f r aː t ɛ r n aː l ɛ m
n aʊ f r aː g ʊ m	n aʊ f r a g ʊ m
k ɔ k ʊ m	s ɔ kː ʊ m
ɔ b l ɪ w j oː n ʊ m	ɔ b l iː w j oː n ɛ m
s t ʊ l t ʊ m	s t ʊ l t ʊ m
k ɔ l t r ʊ m	k ʊ l t r ʊ m
p ɛ n ɪ t ɛ n t j aː l	p aɪ n ɪ t ɛ n t j aː l ɛ m
d ɪ fː aː m aː t oː r j ʊ m	d ɪ fː aː m aː t oː r j ʊ m
r eː t ɔ r k ɛ r ɛ	r ɛ t ɔ r kʷ eː r ɛ
l ɛ p r ɔ s ʊ m	l ɛ p r oː s ʊ m
d eː l ɪ b eː r aː r ɛ	d eː l iː b ɛ r aː r ɛ
ɪ n k aː r n aː t j ɛ n ɛ	ɪ ŋ k a r n aː t j oː n ɛ m
s k uː rː a m	s k ʊ rː a m
s a k r ɪ l ɛ g ʊ m	s a k r ɪ l ɛ g ʊ m
s uː b r ɔ k aː r ɛ	s ʊ b r ɔ g aː r ɛ
a s t uː t j a m	a s t uː t j a m
k oː m n aː t ʊ m	k ɔ ŋ n aː t ʊ m
k ɔ m uː n j ʊ m n ɛ m	k ɔ mː uː n iː r ɛ
a l ɛ	ɪ lː ʊ ŋ k
eː fː iː k aː t iː t ɛ t ɛ m	ɛ fː ɪ k aː k ɪ t aː t ɛ m
w ɔ m ɛ r ɛ	w oː m ɛ r ɛ m
ɪ m aː t ʊ r ʊ m	ɪ mː aː t uː r ʊ m
a d uː r aː t j oː	a d ɪ uː r aː t j oː n ɛ m
p ɔ n t ɪ f iː k ɛ m	p ɔ n t ɪ f ɪ k ɛ m
r ɛ l aː t ɪ w ʊ m	r ɛ l aː t iː w ʊ m
t ʊ r p ɛ m	t ʊ r p ɛ m
s ɔ n aː r ɛ	s ɔ m n j aː r ɛ
k ɔ r t ɛ m	k ɔ h ɔ r t ɛ m
d a t a m	d a t a
p a t r j aː r k aː m ʊ m	p a t r j a r kʰ a t ʊ m
p uː p ɪ lː ʊ m	p uː p ɪ lː ʊ m
w ɛ s p pʰ r ʊ m	w ɛ s p ɛ r ʊ m
m ɔ d ɛ r aː t oː r ɛ	m ɔ d ɛ r aː t oː r ɛ m
ɪ m p aː w ɪ d ʊ m	ɪ m p a w ɪ d ʊ m
l ɪ n t ɪ r n a m	l a n t ɛ r n a m
w iː s k ʊ m	w ɪ s k ʊ m
t ɔ p s ɪ k aː r ɛ	t ɔ k s ɪ k aː r ɛ
r ɛ k ɛ t a m	r ɛ k ɛ p t a m
ɪ n t r ɪ a m t ɛ m ʊ m	ɪ n t r iː n s ɛ k ʊ m
p aː ɪ s ɛ	p aː g eː n s ɛ m
f r aɪ kʷ ŋ ɛ n t ɛ m	f r ɛ kʷ ɛ n t ɛ m
k a n s aː r ɛ m	k a m p s aː r ɛ
ɔ s ɛ k j ʊ m	ɔ b s ɛ kʷ j ʊ m
ɪ m p j ʊ m	ɪ m p j ʊ m
a g aː p ɛ m	a g a p eː n
d ɛ s ɛ k aː t j oː n ɛ m	d eː s ɪ kː aː t j oː n ɛ m
ɪ k ɪ ɛ n j ʊ m s ʊ m	ɪ ŋ g ɛ n j oː s ʊ m
s a l aː r j ʊ m	s a l aː r j ʊ m
a n t r ʊ m	a n t r ʊ m
a fː ɪ l d ɪ ɛ n t j ʊ m	a fː l ʊ ɛ n t j a m
l a r g ʊ m	l a r g ʊ m
kʰ aː k ɪ aː r ɛ m	k a p t j aː r ɛ
m ɛ n uː t j j a m d ɪ n ɛ m	m ɪ n uː t j a m
s t ɔ l ɪ d ʊ m	s t ɔ l ɪ d ʊ m
ɪ n t ɛ s p ɛ s t ɪ m t ɛ m n ɛ m ɛ m	ɪ n t ɛ m p ɛ s t iː w ɪ t aː t ɛ m
ɪ n k ʊ rː ɪ r ɛ	ɪ ŋ k ʊ rː ɛ r ɛ
k ɪ g ʊ oː n a m	k ɪ k oː n j a m
ɪ r aː k ʊ n d ʊ m	iː r aː k ʊ n d ʊ m
eː fː aɪ k t aː ɛ r ɛ	ɛ fː ɪ k ɛ r ɛ
r ɛ l a k s aː r ɛ	r ɛ l a k s aː r ɛ
g r ʊ n ɪ r ɛ	g r ʊ nː iː r ɛ
b ɛ r ɪ lː ʊ m	b eː r y lː ʊ m
a k ɛ f aː l ʊ m	a k ɛ pʰ a l ʊ m
s t uː ɔ r j a m	s t ɔ r ɛ a m
g uː b aː s	j ʊ b a m
t r aː n s m oː n t aː n ʊ m	t r aː n s m ɔ n t aː n ʊ m
s t uː d j ʊ m	s t ʊ d j ʊ m
f ɛ l ʊ n ɛ m	f ɛ lː aː r ɛ
m ɛ r ɪ t oː r j ʊ m	m ɛ r ɪ t oː r j ʊ m
ɪ oː b r j aː sː ʊ m	eː b r j aː k ʊ m
m eː l oː r aː r ɛ	m ɛ l j oː r aː r ɛ
k ɛ r ɛ m ɔ n j aː l ɛ	k aɪ r ɪ m oː n j aː l ɛ m
b uː rː ʊ m	b ʊ rː ɪ k ʊ m
p l a n t ʊ m	p l a ŋ k t ʊ m
k ɔ n t r ɪ s t aː r ɛ	k ɔ n t r iː s t aː r ɛ
ɪ ŋ g uː s t ʊ m	ɪ n ɪ uː s t ʊ m
d ɛ n t aː l ɛ m	d ɛ n t aː l ɛ m
a l ɪ w j aː r ɛ	a lː ɛ w j aː r ɛ
a pː r ɔ p r j aː t j ʊ m n ɛ m	a pː r ɔ p r j aː t j oː n ɛ m
f ɛ n ɪ k j ʊ m	pʰ ɔ ɪ n iː k ɛu m
w a r ɪ ɛ g aː r ɛ	w a r ɪ ɛ g aː r ɛ
a l ɔ ŋ g aː r ɛ	eː l ɔ ŋ g aː r ɛ
w ɛ s t ɪ t ʊ m	w ɛ s t iː t ʊ m
a l t aː r ɛ	a l t a r ɛ m
p ɛ r m ɪ s j oː n ɛ m	p ɛ r m ɪ sː j oː n ɛ m
p ɛ r k ʊ t ɛ r	p ɛ r k ʊ t ɛ r ɛ
s eː m ɪ l ɛ ɛ	s ɪ m ɪ l ɛ m
k ɪ r k ʊ m ʊ m	k eː r ɛu m
a b r ɔ k aː t j oː n ɛ m	a b r ɔ g aː t j oː n ɛ m
s k r ɔ f a m	s k r oː f a m
m uː n ɪ f ɪ k ʊ m	m uː n ɪ f ɪ k ʊ m
k eː n t aʊ r j	k ɛ n t aʊ r eːa m
m ɪ n ɔ r aː r	m ɪ n oː r aː r ɛ
s ʊ b t ɪ l ɛ m ɛ m	s ʊ b t iː l ɛ m
a r b oː r ɛ ʊ m	a r b ɔ r ɛu m
a d ɪ uː n t ʊ m	a d j ʊ ŋ k t ʊ m
p ɛ r s p ɪ k uː ɪ t ɛ m	p ɛ r s p ɪ k ʊ ɪ t aː t ɛ m
ɪ n w oː l w ɛ r ɛ m	ɪ n w ɔ l w ɛ r ɛ
w ɛ r m ɪ n oː s ʊ m	w ɛ r m ɪ n oː s ʊ m
ɪ n f l aː mː aː t j oː n ɛ m	iː n f l a mː aː t j oː n ɛ m
w ɛ s t iː m ɛ n t oː	w ɛ s t iː m ɛ n t ʊ m
m ɔ n t a n oː s ʊ m	m ɔ n t aː n j oː s ʊ m
p a r t ɪ t j oː n ɛ m	p a r t iː t j oː n ɛ m
r ɛ d ɪ t ʊ m	r ɛ d ɪ t ʊ m
ɪ n k ɔ r w aː r ɛ	ɪ ŋ k ʊ r w aː r ɛ
k ɔ n s ɔ l iː d aː t j ʊ m n oː	k oː n s ɔ l ɪ d aː t j oː n ɛ m
m ɛ d j aː l ɛ	m ɛ d j aː l ɛ m
d eː ɪ ɛ n ɛ r aː r	d eː g ɛ n ɛ r aː r ɛ
aɪ k s p oː r	ɛ k s p oː n ɛ r ɛ
ɛ k s t ɛ r j oː r	ɛ k s t ɛ r j oː r ɛ m
k ɔ n j ʊ g aː r ɛ	k ɔ n j ʊ g aː r ɛ
p a nː ʊ m	p a nː ʊ m
t r aː n s m uː t aː t j oː n ɛ m	t r aː n s m uː t aː t j oː n ɛ m
p r uː d ɛ n t j a m	p r uː d ɛ n t j a m
ɪ r k ɪ n ʊ m	h ɪ r k iː n ʊ m
ɪ n f a n t j a m	iː n f a n t j a m
g r a d ʊ m	g r a d ʊ m
ɔ t j oː s ʊ m	oː t j oː s ʊ m
a l y p ɛ n ʊ m	a l ɪ eː n ʊ m
t a k s aː r ɛ	t a k s aː r ɛ
a d ɔ l ɛ s k ɛ n t j a m	a d ʊ l eː s k ɛ n t j a m
k ɪ d j ʊ m	k iː d j ʊ m
f uː l k r ʊ m	f ʊ l k r ʊ m
a b s t ɛ r ɪ ɛ r ɛ	a b s t ɛ r g eː r ɛ
p a s t ɪ ŋ n aː k	p a s t ɪ n aː k a m
s ɪ m p l ɪ ɛ m ɛ m	s ɪ m p l ɪ k ɛ m
ɔ l ɪ r ɛ m	ɔ l eː r ɛ
k eː d ɛ r ɛ	k eː d ɛ r ɛ
s k ɔ l ʊ m	s k ɔ p ʊ l ʊ m
r ɛ w ɔ k aː r ɛ	r ɛ w ɔ k aː r ɛ
ɔ b l ɪ g aː r ɛ	ɔ b l ɪ g aː r ɛ
k ʊ n j aː r n ɛ	k ʊ n ɛ aː r ɛ
r uː m oː r ɛ	r uː m oː r ɛ m
r ɪ n ɛ m	r eː n ɛ m
a k aɪ t ʊ m	a k eː t ʊ m
z aː n k a m	z a ŋ kʰ a m
p r ɔ p ɛ l ɛ r ɛ	p r oː p ɛ lː ɛ r ɛ
m a l d ɪ k t j oː n	m a l ɛ d ɪ k t j oː n ɛ m
k ɔ rː ɛ m a m	k ɔ rː ɪ g j a m
a b l uː ɛ r ɛ	a b l ʊ ɛ r ɛ
a sː ɪ b n aː r ɛ	a sː ɪ ŋ n aː r ɛ
ɛ k s aː l aː r ɛ	ɛ k s h aː l aː r ɛ
aʊ a ɪ ʊ ʊ n aː r ɛ	j eː j uː n aː r ɛ
a pː ɛ lː aː r ɛ m	a pː ɛ lː aː r ɛ
t r aɪ t ʊ m	t r a k t ʊ m
t ɔ r s ʊ m	tʰ y r s ʊ m
ɪ n t ɛ g r aː r ɛ	ɪ n t ɛ g r aː r ɛ
l ɪ t ɛ	l iː t ɛ m
f s aː m ɪ n ɛ kʷ ʊ m	f a m eː l ɪ k ʊ m
p r ɔ f ʊ k ʊ m	p r ɔ f ʊ g ʊ m
ɛ k s p ʊ r g aː t j oː n ɛ m	ɛ k s p ʊ r g aː t j oː n ɛ m
k ɔ n k r ɛ t j oː n ɛ m	k ɔ ŋ k r eː t j oː n ɛ m
ɪ n f l aː t j ʊ m n ɛ m	iː n f l aː t j oː n ɛ m
ɛ k r b ɛ m k ʊ ʊ m	a r b ʊ t ʊ m
m a ɪ ɛ s t aː t ɛ m	m a j ɛ s t aː t ɛ m
k ɔ p j oː s ʊ m	k oː p j oː s ʊ m
r a n ʊ k ʊ	r aː n ʊ ŋ k ʊ l ʊ m
k ɪ kː a m	ɛ kʷ a m
ɛ b d ɔ m aː d aː r j ʊ m	h ɛ b d ɔ m a d aː r j ʊ m
ɪ n w ɛ n t r iː t ɛ	ɪ n w ɛ n t r iː k ɛ m
aɪ s k oː aː t ɛ m r ɛ	ɛ k s k ɔ kʷ ɛ r ɛ
l uː k ɪ f eː r ʊ m	l uː k ɪ f ɛ r ʊ m
