a r gʷ ɛ r ɛ	a r gʷ ɛ r ɛ
ɪ n k uː b ʊ m	ɪ ŋ k ʊ b ʊ m
t r aː m a m	t r aː m a m
f aː s k k ɛ m	f a s k ɛ m
s a ŋ gʷ ɪ n oː s ʊ m	s a ŋ gʷ ɪ n oː s ʊ m
n w oː t aː r ɛ	n a t aː r ɛ
k ɔ n t r a k t ɛ r ɛ	k ɔ n t r a h ɛ r ɛ
t eː n ɛ r ɛ	t ɛ n eː r ɛ
ɪ n ʊ n d aː r ɛ	ɪ n ʊ n d aː r ɛ
l a w a t j oː n ɛ m	l a w aː t j oː n ɛ m
s ɔ l ʊ m	s ɔ l j ʊ m
a p a r eː t ɛ r ɛ	a pː aː r eː s k ɛ r ɛ
a b n eː g aː r ɛ	a b n ɛ g aː r ɛ
d ɔ t aː r ɛ	d oː t aː r ɛ
f uː n ɛ s t ʊ m	f uː n ɛ s t ʊ m
ɪ m p r eː k aː r ɛ	ɪ m p r ɛ k aː r iː
aʊ d aː k j a m	aʊ d aː k j a m
s ɔ r ɪ k ɛ m	s oː r ɪ k ɛ m
k ʊ t ɛ lː ʊ m	k ʊ l t ɛ lː ʊ m
a l j ɪ ɛ n a t j oː n ɛ m	a l ɪ eː n aː t j oː n ɛ m
d ɛ s t ɪ n a t j ʊ m	d eː s t ɪ n aː t j oː n ɛ m
s ɛ rː ɛ j ɪ m	s ɛ rː aː g ɪ n ɛ m
ɪ m p eː r j a l ɛ	ɪ m p ɛ r j aː l ɛ m
r ɛ n ɔ w a t j oː n ɛ	r ɛ n ɔ w aː t j oː n ɛ m
ɔ m ɪ t ɪ d ʊ m	h ɔ m ɪ k iː d a m
ɪ n k aʊ t ʊ m	ɪ ŋ k aʊ t ʊ m
k eː l eː b r aː r ɛ	k ɛ l ɛ b r aː r ɛ
s ʊ g j a k ɛ r ɛ	s ʊ b j a k eː r ɛ
ɔ n d aː r ɛ	ʊ n d aː r ɛ
ɛ n k a n eː t ɛ r ɛ	ɪ ŋ k aː n eː s k ɛ r ɛ
m ɛ n d aː k ɛ m	m ɛ n d aː k ɛ m
f ɛ s t ʊ m	f eː s t ʊ m
k ʊ lː uː d ɪ r ɛ	k ɔ lː uː d ɛ r ɛ
ɪ n t eː lː ɛ k k j oː n ɛ m	ɪ n t ɛ lː ɛ k t j oː n ɛ m
g ʊ k ʊ n d ɪ t eː t ɛ m	j uː k ʊ n d ɪ t aː t ɛ m
a s t uː t ʊ m	a s t uː t ʊ m
l a t r aː r ɛ	l a t r oː n ɛ m
kʷ a t ɛ r n ʊ m	kʷ a t ɛ r n oː s
h ɪ s p aː n ɪ k ʊ m	h ɪ s p aː n ɪ k ʊ m
k r uː ɛ n t aː r ɛ	k r ʊ ɛ n t aː r ɛ
t ɛ m ɔ r ɛ m	t ɪ m oː r ɛ m
d a ʊ nː oː s ʊ m	d a m n oː s ʊ m
f r ɔ n t a l ɛ	f r ɔ n t aː l ɛ m
kʷ r ɪ b r aː r ɛ	k r iː b r aː r ɛ
l ɪ n a m	l iː n ɛ a m
p ʊ r t ʊ g ɛ s ɛ	p ɔ r t ʊ k eː n s ɛ m
s ʊ l aː r ɪ ʊ n	s oː l aː r j ʊ m
t r ɪ b ʊ t ʊ m	t r ɪ b uː t ʊ m
d ɪ t ʊ m	d ɪ k t ʊ m
d eː g r a d a t j ʊ n ɛ m	d eː g r a d aː t j oː n ɛ m
d ɪ s t r ɛ ɛ r ɛ	d ɪ s t r a h ɛ r ɛ
f ɪ d ʊ m	f iː d ʊ m
r a n ʊ m	a r aː n ɛu m
p uː p a m	p uː p a m
s ɛ n t iː r ɛ	s ɛ n t iː r ɛ
n uː m eː r a t ʊ r ɛ	n ʊ m ɛ r aː t oː r ɛ m
m ʊ l ɪ n ʊ m	m ɔ l iː n ʊ m
p l aː k ɪ d ʊ m	p l a k ɪ d ʊ m
k ɪ t a r a m	k ɪ tʰ a r a m
t ʊ r ɪ t oː n ɛ m	t ɔ r t j oː n ɛ m
f aː m a m	f aː m a m
a g r aː r j ʊ m	aː g r aː r j ʊ m
k uː w ɪ l ɛ m	k ʊ b iː l ɛ
d ɪ l ɛ kʷ aː r ɛ	d eː l ɪ kʷ aː r ɛ
p r ɔ s k r ɪ w ɛ r ɛ	p r oː s k r iː b ɛ r ɛ
r ɔ m iː k a m	r ʊ m ɪ k ɛ m
m eː m b r a n a k eː ʊ m	m ɛ m b r aː n aː k ɛu m
m ɛ r k ɛ m	m ɛ r k ɛ m
uː s p eː d aː r ɛ	h ɔ s p ɪ t aː r iː
m ʊ ɪ w eː r ɛ	m ɔ w eː r ɛ
s ɔ m ɪ ɛ r ʊ m	s a g m aː r j ʊ m
d ʊ ɛ k j ɛ n t oː s	d ʊ k ɛ n t oː s
s t ɛ lː aː r ɛ	s t eː lː aː r ɛ m
s ɔ m ʊ	s ɔ m n ʊ m
t ɛ t r ɪ k ʊ m	t aɪ t r ɪ k ʊ m
k ɔ kʷ ʊ m	k ɔ kː ʊ m
k eː r uː l ɛ ʊ m	k aɪ r ʊ l ɛu m
l ɪ n ɛ aː n ɛ n t ʊ m	l iː n ɛ aː m ɛ n t ʊ m
l ɪ m ɪ t aː r ɛ	l iː m ɪ t aː r ɛ
ɪ n f eː l ɪ k ɛ	iː n f eː l iː k ɛ m
d eː p ɔ r t aː r ɛ	d eː p ɔ r t aː r ɛ
w ɪ s ɪ t a t j ʊ n ɛ	w iː s ɪ t aː t j oː n ɛ m
d uː l k a m a r a m	d uː l k a m aː r a m
k a l ʊ k ɛ m	k a l k ɛ m
f r ɔ n d ɛ m	f ʊ n d a m
ʊ ŋ t oː s ʊ m	uː ŋ k t ʊ oː s ʊ m
l uː k s uː r j a m	l ʊ k s ʊ r j a m
d ɪ s p eː r ɛ k ɪ r ɛ	d ɪ s p ɛ r iː r ɛ
ɛ k s p ɪ r a t j ʊ n ɛ m	ɛ k sː p iː r aː t j oː n ɛ m
f l aː t ʊ m	f l aː t ʊ m
a ŋ g uː s t ʊ m	a ŋ g ʊ s t ʊ m
p r oː h ɪ b ɪ r ɛ	p r ɔ h ɪ b eː r ɛ
k ɔ k p ɛ r a t j ʊ n ɛ m	k ɔː p ɛ r aː t j oː n ɛ m
p a l p ɪ t a t j oː n ɛ m	p a l p ɪ t aː t j oː n ɛ m
ɛ ʊ m	ɛu m
b a r b aː t ʊ m	b a r b aː t ʊ m
k aː s ʊ m	k aː s ʊ m
k ɔ d a m	k aʊ d a m
s a l a k ɛ	s a l aː k ɛ m
eː m a n k ɪ p a t j ʊ n ɛ m	eː m a ŋ k ɪ p aː t j oː n ɛ m
b a s ɪ l ɪ k a m	b a s ɪ l ɪ k a m
l ɛ g ɛ r ɛ	l ɛ g ɛ r ɛ
n a w ɪ g aː r ɛ	n aː w ɪ g aː r ɛ
r ɛ t r a k t aː r ɛ	r ɛ t r a k t aː r ɛ
g eː ʊ m eː t r j a m	g ɛ oː m ɛ t r j a m
t ʊ r p ɛ d ʊ m	t ɔ r p eː d ɪ n ɛ m
d a n t ʊ m	d a m n aː t ʊ m
b oː s k ɛ m	b ɔ s k ʊ m
uː l t r ɪ k ɛ	ʊ l t r iː k ɛ m
d eː f r aʊ d a t j oː n ɛ m	d eː f r aʊ d aː t j oː n ɛ m
k ɔ n k uː s j ʊ m	k ɔ ŋ k ʊ sː j oː n ɛ m
k ɔ n f eː d eː r a t j ʊ n ɛ m	k oː n f ɔ ɪ d ɛ r aː t j oː n ɛ m
s ɛ r m ʊ n ɛ m	s ɛ r m oː n ɛ m
s ɛ r aː f ɪ k ʊ m	s ɛ r a pʰ ɪ k ʊ m
m ʊ n d ʊ m	m ʊ n d ʊ m
ɛ k s p ɔ n ɛ m	ɛ k s p oː n ɛ r ɛ
ʊ d ɪ t ʊ m	aʊ d iː t ʊ m
t r a n s m ɪ s j ʊ n ɛ m	t r aː n s m ɪ sː j oː n ɛ m
l aː ŋ g oː r ɛ	l a ŋ gʷ oː r ɛ m
ɛ k s ɪ s t ɛ n k j ʊ m	ɛ k s ɪ s t ɛ n t j a m
ɔ fː r ɛ k ɛ r ɛ	ɔ fː ɛ rː ɛ
s oː gː l ɔ k j ʊ m	s ɪ ŋ g ʊ l t ʊ m
t ɛ n t aː r ɛ	t ɛ m p t aː r ɛ
ɪ n f l ɛ k s j ʊ n ɛ m	iː n f l ɛ k t j oː n ɛ m
l ɛ k t oː r ɛ	l eː k t oː r ɛ m
ɪ m b eː b aɪ r ɛ	ɪ m b ɪ b ɛ r ɛ
ɪ ŋ g uː s t ʊ m	ɪ n ɪ uː s t ʊ m
m ɪ g r aː r ɛ	m ɪ g r aː r ɛ
k ɔ s t uː m ɛ m	k oː n s ʊ eː t uː d ɪ n ɛ m
k ɔ ŋ j uː g aː t j ʊ n ɛ m	k ɔ n j ʊ g aː t j oː n ɛ m
ɪ n w ɛ n t r ɪ k ɛ	ɪ n w ɛ n t r iː k ɛ m
l uː k s ʊ m	l uː k s ʊ m
s p ɛ l t a m	s p ɛ l t a m
k j ɛ ɪ t uː d ɛ m	kʷ ɪ eː t uː d ɪ n ɛ m
f ɔ lː ɪ k ɪ l ʊ m	f ɔ lː ɪ k ʊ l ʊ m
ɪ s t ʊ m	ɪ s t ʊ m
m uː t ʊ ʊ m	m uː t ʊː m
n aː f t a m	n a pʰ tʰ a m
ɔ m ɪ k ɪ d j ʊ m	h ɔ m ɪ k iː d j ʊ m
a n a l ɪ	a nː aː l ɛ m
a b j uː r aː r ɛ	a b ɪ uː r aː r ɛ
k ɔ n s ɔ l a t j ʊ n ɛ m	k oː n s oː l aː t j oː n ɛ m
k ɛ s p ɛ t ɛ m	k aɪ s p ɪ t ɛ m
r ɛ f ɔ r m aː r ɛ	r ɛ f oː r m aː r ɛ
n ɔ n ɛ m	n ɔ nː a m
p r ɔ l ɛ t a r j aː t ʊ m	p r oː l eː t aː r j ʊ m
m ɛ d ɛ h j ʊ k r ɛ m	m ɛ d ɪ ɔ k r ɛ m
k ɛ r t aː r ɛ	k ɛ r t aː r ɛ
p ɔ m ɪ f ɛ r ʊ m	p oː m ɪ f ɛ r ʊ m
p uː s t ʊ l a m	p ʊ s t ʊ l a m
k a p ɛ r ɛ	k a p ɛ r ɛ
p l a n a r ɛ	p l aː n aː r j ʊ m
s a n t ʊ r j ɛ t ɛ m	s a t ʊ r eː j a m
d ɪ s p ɛ r t ɛ r ɛ	d ɪ s p ɛ r g ɛ r ɛ
f eː l ɪ k ɛ m	f eː l iː k ɛ m
a w ɔ l ʊ m	a w ʊ l ʊ m
p r ɔ k r a s t ɪ n aː r ɛ	p r oː k r aː s t ɪ n aː r ɛ
aɪ r oː ɛ m	h eː r oː ɛ m
s eː rː aː r ɛ	s ɛ rː aː r ɛ
a m ɔ w ɪ b ɪ l ɛ	aː m ɔ w eː r ɛ
d ɪ s ɪ m ɪ l ɛ	d ɪ sː ɪ m ɪ l ɛ m
w a k a t j ʊ n ɛ m	w a k aː t j oː n ɛ m
s ɪ k aː r j ʊ m	s iː k aː r j ʊ m
z ɔ r a m	f ɔ r j a m
w ʊ r a g ɪ n ɛ m	w ɔ r aː g ɪ n ɛ m
ɛ lː ɪ p s ʊ m	ɛ lː iː p s ɪ n
r ɛ d k ɛ r ɛ	r ɛ d ɪ g ɛ r ɛ
w ɛ t uː s t ʊ m	w ɛ t ʊ s t ʊ m
b ɔ b a l ʊ m	b uː b a l ʊ m
s a n aː r ɛ	s aː n aː r ɛ
a k t r ɪ k ɛ	aː k t r iː k ɛ m
s uː k k j n aː r ɛ	s uː g ɛ r ɛ
w ɪ k a m	b iː g a m
d eː f ɔ r m ɛ m	d eː f oː r m ɛ m
k ɔ ŋ g ʊ m	k ɔ ŋ g j ʊ m
m oː r ɛ m	m oː r ɛ m
t ɛ n d ɛ r ɛ	t ɛ n d ɛ r ɛ
p ɛ r k uː t ɛ r ɛ	p ɛ r k ʊ t ɛ r ɛ
ɪ t ɪ n eː r aː r j ʊ m	ɪ t ɪ n ɛ r aː r j ʊ m
l ʊ t ʊ m	l ʊ t ʊ m
m a t aː s a m	m a t a k s a m
ɛ k s aʊ r ɪ r ɛ	ɛ k s h aʊ r iː r ɛ
p r ʊ p uː ŋ n a r ɛ	p r oː p ʊ ŋ n aː r ɛ
a f lː ɛ n t j a m	a fː l ʊ ɛ n t j a m
k r ɪ m ɪ n aː l ɛ	k r iː m ɪ n aː l ɛ m
w ɛ s t r uː k ʊ m	s t r uː tʰ j oː n ɛ m
t r a b aː l j ʊ m	t r ɪ p aː l ɛ m
g eː r a r k a m	h ɪ ɛ r a r kʰ a m
s ʊ r ɪ k ɪ r ɛ	s a r k iː r ɛ
r ɛ f l oː r r ɛ	r ɛ f l oː r eː r ɛ
l ɔ t a m	l uː t ɛu m
k ʊ p ʊ l aː r ɛ	k oː p ʊ l aː r ɛ
s ɪ l w ɛ s t r ɛ m	s ɪ l w ɛ s t r ɛ m
m a l ɛ	m a l ʊ m
m oː n n aː r ʊ m	m ɔ l iː n aː r j ʊ m
p r ɛ s ɪ d ɛ r ɛ	p r aɪ s ɪ d eː r ɛ
m eː ɪ s t ɪ ɛ r ɛ	m ɪ n ɪ s t ɛ r j ʊ m
l a d r ɪ l ʊ m	l a t ɛ r k ʊ l ʊ m
l uː n aː t ʊ n ɛ m	l uː n aː t j oː n ɛ m
g aː d ʊ m	g a n aː r ɛ
k uː rː ɪ k ʊ l ʊ m	k ʊ rː ɪ k ʊ l ʊ m
ɪ sː ɪ m ʊ m	ɪ sː ɪ m ʊ m
m ɛ d ɪ k a m ɛ n t ʊ m	m ɛ d ɪ k aː m ɛ n t ʊ m
p ɛ k a t oː r ɛ	p ɛ kː aː t oː r ɛ m
a n ɪ m ʊ m	a n ɪ m ʊ m
w ɛ k sː aː r ɛ	w eː k s aː r ɛ
ɛ k k eː p t aː r ɛ	ɛ k s k ɪ p ɛ r ɛ
a s t r ʊ m	a s t r ʊ m
s eː n eː k t uː t ɛ	s ɛ n ɛ k t ʊ m
w aː n aː r ɛ	w eː n aː r iː
r ɔ s m a r ɪ n ʊ m	r oː s m a r iː n ʊ m
a k t w aː r j ʊ m	aː k t w aː r j ʊ m
ɪ n t eː g r aː r ɛ	ɪ n t ɛ g r aː r ɛ
ɛ s k ɔ t ɛ r ɛ m	ɛ k s k ʊ t ɛ r ɛ
d ɛ l ɪ t ʊ m	d eː l ɪ k t ʊ m
p ɛ r m a n eː ɛ r ɛ	p ɛ r m a n eː r ɛ
k ɔ n s ɪ s t ɛ r ɛ	k oː n s ɪ s t ɛ r ɛ
b aː s ʊ m	b aː s j ʊ m
ɛ s k oː p l ʊ m	s k a l p r ʊ m
a n ʊ m	aː n ʊ m
r eː w ɛ d r ɛ	r ɛ w ɪ d eː r ɛ
j a n t aː r ɛ	j ɛ n t aː r ɛ
ɛu l ʊ m	ʊ l ʊ m
k a l ɛ f aː k eː r ɛ	k a l ɛ f a k ɛ r ɛ
p ʊ t r ɛ m	p ʊ t r ɛ m
m eː l a m	m aː l ʊ m
a m b ɪ t ʊ m	a m b iː t ʊ m
g aː lː ʊ m	g a lː ʊ m
s ɔ n a t oː r ɛ	s ɔ m n j aː t oː r ɛ m
s p ɔ l ʊ m	s p ɔ l j ʊ m
a n ɪ k ɪ l a t j ʊ n ɛ m	a nː ɪ h ɪ l aː t j oː n ɛ m
ɔ k l uː d ɛ r ɛ	ɔ kː l uː d ɛ r ɛ
ɪ m b ʊ ɪ r ɛ	ɪ m b ʊ ɛ r ɛ
a b s t r s ʊ m	a b s t r uː s ʊ m
k eː r t a m ɛ m	k ɛ r t aː m ɛ n
d eː t ɛ s t a t j ʊ n ɛ m	d eː t ɛ s t aː t j oː n ɛ m
f ɛ m ʊ r ɛ	f ɛ m ʊ r
p a d r a s t r ʊ m	p a t r a s t r ʊ m
p r eː g ʊ s t r ɛ	p r aɪ g ʊ s t aː r ɛ
t ɛ k s t ɪ l ɛ m	t ɛ k s t ɪ l ɛ
a r b uː s t ɪ w ʊ m	a r b ʊ s t iː w ʊ m
t r ɛ m ɔ l aː r ɛ	t r ɛ m ʊ l aː r ɛ
r ɛ f r ɪ g ɛ r j ʊ m	r eː f r iː g ɛ r j ʊ m
p ɔ s ʊ d ɛ r ɛ	p ɔ sː ɪ d eː r ɛ
r ɛ t r aː ɛ r ɛ	r ɛ t r a h ɛ r ɛ
t oː r d ʊ m	t ʊ r d ʊ m
t r a n s a k t j ɔ n ɛ	t r aː n s aː k t j oː n ɛ m
eː w ɪ ŋ t ɛ r ɛ	eː w ɪ ŋ k ɛ r ɛ
ɛ k s t r ɪ n s ɛ k ʊ m	ɛ k s t r iː n s ɛ k ʊ m
k a p l ʊ m	k a p ʊ l ʊ m
d ʊ s a m	d ʊ k t j oː n ɛ m
r ɔ t aː r ɛ	r ɔ t aː r ɛ
ʊ ŋ gʷ ɛ n t ʊ m	ʊ ŋ gʷ ɛ n t ʊ m
f ɛ d ʊ m	f ɔ ɪ d ʊ s
a w k aː r ɛ	a d w ɔ k aː r ɛ
ɪ lː uː s t r ɛ m	ɪ lː uː s t r ɛ m
uː r ʊ m	uː r ʊ m
k l ʊ k r ɛ	g l oː k iː r ɛ
k ɔ n f ɛ s oː r ɛ	k oː n f ɛ sː oː r ɛ m
n ɔ b ɪ l oː s ʊ m	n uː b ɪ l oː s ʊ m
m a r t ɛ lː ʊ m	m a r t ɛ lː ʊ m
a pː a r aː r ɛ	a pː a r aː r ɛ
ɪ lː eː g a l ɛ	ɪ lː eː g aː l ɛ m
r eː m uː n eː r aː r ɛ	r ɛ m uː n ɛ r aː r ɛ
w ɛ r n aː k ʊ l ʊ m	w ɛ r n aː k ʊ l ʊ m
d ɪ m a n aː r ɛ	d iː m aː n aː r ɛ
ɔ n aː g r ʊ m	ɔ n a g r ʊ m
s eː l w aː t ɪ ʊ m	s ɪ l w aː t ɪ k ʊ m
a b s t ɛ r g ɛ r ɛ	a b s t ɛ r g eː r ɛ
l a k t ɪ k ɪ n j ʊ m	l a k t ɪ k iː n j ʊ m
a m ɛ n t ɛ m	aː m ɛ n t ɛ m
p a r ɪ t ɛ r ʊ m	p a r t j aː r j ʊ m
ɔ r aː t j ʊ n ɛ m	oː r aː t j oː n ɛ m
a g r ɛ s t ɛ m	a g r ɛ s t ɛ m
m ʊ w ɪ m j ɛ n t ʊ m	m oː w ɪ m ɛ n t ʊ m
a s eː r ɪ r ɛ	a sː ɛ r ɛ r ɛ
f a k ɪ l ɪ t aː t ɛ m	f a k ɪ l ɪ t aː t ɛ m
t r a d ɪ r ɛ	t r aː d ɛ r ɛ
a m ʊ r k a m	a m ʊ r k a m
p ɛ r t ɪ k a m	p ɛ r t ɪ k a m
ɪ n s eː r ɪ r ɛ	iː n s ɛ r ɛ r ɛ
p r ʊ l ɔ kʷ j ʊ m	p r oː l ɔ kʷ j ʊ m
f r ɪ g ɪ m	f r iː g ɪ d ʊ m
m oː d ʊ m	m ɔ d j ʊ m
ɔ s t r ʊ m	aʊ s t r ʊ m
b ʊ t ɪ k a m	a p ɔ tʰ eː k a m
n ʊ w ɪ l uː n j ʊ m	n ɔ w ɪ l uː n j ʊ m
j ɔ ʊ r n a l ɛ	d j ʊ r n aː l ɛ m
k ɔ m p r ɪ m ɛ r ɛ	k ɔ m p r ɪ m ɛ r ɛ
ʊ r ɪ s ʊ m	ʊ r s ʊ m
r ɛ t ɛ t a m	r ɛ k ɛ p t a m
kʷ a d r aː r ɛ	kʷ aː d r aː r ɛ
a lː uː d ɪ r ɛ	a lː uː d ɛ r ɛ
aʊ d j ɛ n t j a m	aʊ d ɪ ɛ n t j a m
a d uː d ɪ k a t j ʊ n ɛ m	a d ɪ uː d ɪ k aː t j oː n ɛ m
w ɛ s t ɪ t ʊ m	w ɛ s t iː t ʊ m
ɛ k s k ɔ g ɪ t r ɛ	ɛ k s k oː g ɪ t aː r ɛ
w j ɛ n t r ɛ m	w ɛ n t r ɛ m
k eː d ɛ r ɛ	k eː d ɛ r ɛ
oː	ʊ m
k a n s aː r ɛ	k a m p s aː r ɛ
s k ʊ d ʊ m	s k uː t ʊ m
p j ɛ r ɪ n a m	p ɛ r n a m
f a b ʊ l oː s ʊ m	f aː b ʊ l oː s ʊ m
l ɪ t aː r ɛ	l ɪ t aː r ɛ
ɛ kʷ ɪ w ʊ k a r ɛ	aɪ kʷ ɪ w ɔ k aː r ɛ
p uː j aː r ɛ m	p ʊ t eː r ɛ
s a k t j oː n ɛ m	s aː ŋ k t j oː n ɛ m
ɪ m p ɔ s ɪ t j ʊ n ɛ m	ɪ m p ɔ s ɪ t j oː n ɛ m
a s	a sː ɛ m
ɪ n k ɔ m p eː t ɛ n t ɛ m	ɪ ŋ k ɔ m p ɛ t ɛ n t ɛ m
f a rː a ɪ n ɛ	f a rː aː g ɪ n ɛ m
l ɪ n k ɛ m	l y ŋ k ɛ m
ɛ fː l uː ɪ r ɛ	ɛ fː l ʊ ɛ r ɛ
m ʊ lː ɛ t ɛ m	m ɔ lː ɪ t ɪ ɛ m
s uː p ɛ r j oː r ɛ	s ʊ p ɛ r j oː r ɛ m
b ɛ t ʊ m	f ɪ l ɪ k t ʊ m
a n t a m	a n t aː s
b r aː k a m	b r aː k a m
s ɛ n t ɛ r ɛ	s ɛ d eː r ɛ
d eː d uː k t j oː n ɛ m	d eː d ʊ k t j oː n ɛ m
s t ɪ p uː l aː r ɛ	s t ɪ p ʊ l aː r iː
k ɛ l aː r ɛ	k eː l aː r ɛ
p r ɛ ɔ k uː p a t j ʊ n ɛ m	p r aɪ ɔ kː ʊ p aː t j oː n ɛ m
d ɪ s t ɛ n d ɛ r ɛ	d ɪ s t ɛ n d ɛ r ɛ
r ɛ k uː s a t j ʊ n ɛ m	r ɛ k uː s aː t j oː n ɛ m
ɪ m n ʊ m	h y m n ʊ m
ɔ pː ɔ r t uː n ɪ t aː t ɛ m	ɔ pː ɔ r t uː n ɪ t aː t ɛ m
b a k ɪ r j ɛ r ɛ	b a kː a l aʊ r ɛu m
a pː ɛ lː aː r ɛ	a pː ɛ lː aː r ɛ
m aː n t eː n ɛ r ɛ	m a n ʊ t ɛ n eː r ɛ
a r aː b ɪ l ɛ m	a r aː b ɪ l ɛ m
ɛ s ɛ r k ɪ t ʊ m	ɛ k s ɛ r k ɪ t ʊ m
k ɔ n k ɪ l j aː b ʊ l ʊ m	k ɔ ŋ k ɪ l j aː b ʊ l ʊ m
p ɔ m ɪ k ɛ	p uː m ɪ k ɛ m
s eː m ɛ m	s eː m ɛ n
d eː f ʊ r m ɪ t eː t ɛ m	d eː f oː r m ɪ t aː t ɛ m
eː w ɔ k a t j ʊ n ɛ m	eː w ɔ k aː t j oː n ɛ m
ɛ n a rː a t j oː n ɛ m	eː n aː rː aː t j oː n ɛ m
s ɪ n ɔ p s ɛ m	s y n ɔ p s ɛ m
d j ɛ k ɪ m aː r ɛ	d ɛ k ɪ m aː r ɛ
t r ɪ b ʊ l ʊ m	t r ɪ b ʊ l ʊ m
t ɪ m ʊ n ɛ m	t eː m oː n ɛ m
ɪ m p eː r a t oː r j ʊ m	ɪ m p ɛ r aː t oː r j ʊ m
l a r a m	g l aː r ɛ a m
s uː b l ɪ m a t j ʊ n ɛ m	s ʊ b l iː m aː t j oː n ɛ m
n ɪ m b ʊ m	n ɪ m b ʊ m
ɪ n t ɛ rː ʊ m p ɛ r ɛ	ɪ n t ɛ rː ʊ m p ɛ r ɛ
m a l w a m	m a l w a m
w ɛ r b a l ɛ	w ɛ r b aː l ɛ m
k a p s g k k ʊ m	k a p t j oː s ʊ m
k a p ɪ t ɛ lː ʊ m	k a p ɪ t ɛ lː ʊ m
n uː m eː r aː r j ʊ m	n ʊ m ɛ r aː r j ʊ m
ɪ ŋ n a r ʊ m	ɪ ŋ n aː r ʊ m
p r j ɔ r ɛ	p r j oː r ɛ m
r a p ɪ d ɪ t ɛ m	r a p ɪ d ɪ t aː t ɛ m
k ɔ n s t r ɪ k t oː r ɛ	k oː n s t r ɪ k t oː r ɛ m
f eː k ʊ n d ʊ m	f eː k ʊ n d ʊ m
a rː ɔ g aː r ɛ	a rː ɔ g aː r ɛ
k ɔ n t ɪ n w ʊ m	k ɔ n t ɪ n ʊː m
k uː r a m	k uː r a m
a n ɛ t ʊ m	a n eː tʰ ʊ m
p ɛ r s w a d ɛ r ɛ	p ɛ r s w aː d eː r ɛ
m eː d ɪ r ɛ	m eː t iː r iː
m ʊ s k a m	m ʊ s k a m
w ɛ k sː a t j ʊ n ɛ m	w ɛ k s aː t j oː n ɛ m
ɪ n k ʊ lː a m	ɪ ŋ k ɔ l a m
p ɛ r ɪ k l ɪ t aː r ɛ	p ɛ r iː k l ɪ t aː r iː
k ɔ n w ɪ k t j oː n ɛ	k ɔ n w iː k t j oː n ɛ m
k ʊ w r ɛ	k ʊ b aː r ɛ
k aː r m ɛ m	k a r m ɛ n
s j ɛ rː a m	s ɛ rː a m
ɪ d oː n ɛ ʊ m	ɪ d oː n ɛu m
s ɛ r p ɛ n t ɪ n ʊ m	s ɛ r p ɛ n t iː n ʊ m
ɪ n t ɛ r p r eː t a b ɪ l ɛ	ɪ n t ɛ r p r ɛ t aː b ɪ l ɛ m
p ɛ r m ɪ s j oː n ɛ m	p ɛ r m ɪ sː j oː n ɛ m
m a t r ɪ t ɪ d j ʊ m	m aː t r ɪ k iː d j ʊ m
f ɔ r k m a g ʊ m	f oː r m aː t ɪ k ʊ m
l uː b r ɪ k aː r ɛ	l uː b r ɪ k aː r ɛ
kʷ ɛ s t j ɔ n aː r j ʊ m	kʷ aɪ s t j oː n aː r j ʊ m
d ɛ eː s p ɛ r a t j oː n ɛ m	d eː s p eː r aː t j oː n ɛ m
g r aː d ʊ m	g r a d ʊ m
h ɪ k ɛ	kʷ ɛ m
p ɛ r ɪ k ɪ r ɪ r ɛ	p ɛ r kʷ iː r ɛ r ɛ
d ɪ s t uː r b aː r ɛ	d ɪ s t ʊ r b aː r ɛ
ɔ k uː l t aː r ɛ	ɔ kː ʊ l t aː r ɛ
aɪ b r ɛ ʊ m	h ɛ b r aɪ ʊ m
uː s ɪ t aː r ɛ	uː s ɪ t aː r iː
a l a m	aː l ɛ m
f aɪ d	f ɪ d ɛ m
a r ɛ h j oː lː ʊ m	h a r ɪ ɔ l ʊ m
k ɔ m a n d aː r ɛ	k ɔ mː ɛ n d aː r ɛ
f r aː s k ʊ m	f l a s k oː n ɛ m
eː r ɔ m p ɛ r ɛ	eː r ʊ m p ɛ r ɛ
ʊ d j ɛ ɛ r n ʊ m	h ɔ d ɪ ɛ r n ʊ m
ɔ r t ɔ g r a f j ɛ m	ɔ r tʰ ɔ g r a pʰ j a m
w ɛ n eː r a t j ʊ n ɛ m	w ɛ n ɛ r aː t j oː n ɛ m
ɪ n s uː l t ʊ m	iː n s ʊ l t ʊ m
s ʊ b t ɪ l ɪ t ɛ m	s ʊ b t iː l ɪ t aː t ɛ m
k ɪ r k ʊ n w ɛ n ɪ r ɛ	k ɪ r k ʊ m w ɛ n iː r ɛ
m j ɛ s ɛ m	m ɛ sː ɛ m
f uː r oː r ɛ	f uː r aː r iː
p ɪ s k ʊ p aː d ʊ m	ɛ p ɪ s k ɔ p aː t ʊ m
m ɔ l ɛ k ʊ l a m	m oː l ɛ k ʊ l a m
a n ʊ ɪ r ɛ	a d n ʊ ɛ r ɛ
k ʊ r s ʊ m	k ʊ r s ʊ m
p a n aː k ʊ l ʊ m	p ɪ nː aː k ʊ l ʊ m
k a l aː r ɛ	kʰ a l aː r ɛ
eː lː a t j oː n ɛ m	eː l aː t j oː n ɛ m
r ɔ t aː r ɛ	r ʊ k t aː r ɛ
ɔ b ɪ t ʊ m	ɔ b ɪ t ʊ m
ɪ n mː ɛ r g ɛ r ɛ	ɪ mː ɛ r g ɛ r ɛ
r ɛ s uː s k ɪ t a t j ʊ n ɛ m	r ɛ s ʊ s k ɪ t aː t j oː n ɛ m
d eː p l ɔ r aː r ɛ	d eː p l oː r aː r ɛ
t ʊ r t ʊ r ɛ	t ɔ r t oː r ɛ m
