f uː l w ʊ m	f ʊ l w ʊ m
a w ɛ l ɪ n a m	a b ɛ lː a n a m
p ɔ s t eː r ʊ m	p ɔ s t ɛ r ʊ m
w a r ʊ m n	w aː r oː n ɛ m
t ʊ d aː r ɛ m	t ɔ n d eː r ɛ
k a r p ɛ n t ʊ m	k a r p ɛ n t ʊ m
n ɛ g l ɪ g ɛ r ɛ	n ɛ g l ɛ g ɛ r ɛ
g l aː d j ʊ m m	g l a d j ʊ m
s ɔ n rː ɪ d ɪ r ɛ	s ʊ b r iː d eː r ɛ
ɪ n k oː l ʊ m ɛ m	ɪ ŋ k ɔ l ʊ m ɛ m
w a d oː s ʊ m	w a d oː s ʊ m
ɪ n aː l aː r ɛ	ɪ n h aː l aː r ɛ
eː r aɪ d m aː t ɛ m	h eː r eː d ɪ t aː t ɛ m
ɪ m p ɛ r aː t r ɪ k ɛ	ɪ m p ɛ r aː t r iː k ɛ m
a n d aː r ɛ	a m b ʊ l aː r ɛ
b r ɛ w ɛ m	b r ɛ w ɛ m
b ɛ lː ʊ m	b ɛ lː ʊ m
ɪ ŋ g uː r j oː s ʊ m	ɪ n ɪ uː r j oː s ʊ m
a nː ɪ k ɪ l aː t j oː n ɛ m	a nː ɪ h ɪ l aː t j oː n ɛ m
l a b ɔ r ʊ m	l a b oː r ɛ m
t ɛ k ʊ a m	tʰ eː k a m
p ɛ r t ɛ n ɛ t ɛ r ɛ	p ɛ r t ɪ n eː r ɛ
k ɔ n s ɪ l ʊ m	k ɔ ŋ k ɪ l j ʊ m
ɔ b s ɛ k j ʊ m	ɔ b s ɛ kʷ j ʊ m
a l g oː r ɛ	a l g oː r ɛ m
t ɪ t ɪ lː a m r ɛ	t iː t ɪ lː aː r ɛ
s ɛ n s aː t j oː n ɛ m	s eː n s aː t j oː n ɛ m
m a t aː r ɛ	m a k t aː r ɛ
a n ɛ m ʊ m	a ŋ n ɛ lː ʊ m
r a d ɪ k j oː	r aː d iː k ʊ l a m
t r aː n s l aː t j oː n ɛ m	t r aː n s l aː t j oː n ɛ m
k ɔ lː ʊ m b a m	k ɔ l ʊ m b a m
l ɛ w ɪ g aː r ɛ	l ɛ w ɪ g aː r ɛ
m uː n ɪ k ɪ p j ʊ m	m uː n ɪ k ɪ p j ʊ m
ɛ k s k ɛ s iː w ʊ m	ɛ k s k ɛ sː ɪ w ʊ m
m ɛ d j aː l ɛ	m ɛ d j aː l ɛ m
n ɪ d oː r ɛ	n iː d oː r ɛ m
n ʊ n k ʊ m	n uː n t j ʊ m
j ɛ s ʊ m	g y p s ʊ m
w a g aː r ɛ	w a g aː r iː
k a l ɛ r ɛ	k a l eː r ɛ
r a n k oː r ɛ	r a ŋ k oː r ɛ m
p r ɔ t oː k ɔ l aː r j oː	p r oː t ɔ k ɔ lː aː r j ʊ m
j uː s t ɪ f iː k aː t j oː n ɛ m	j uː s t ɪ f ɪ k aː t j oː n ɛ m
d eː t ɛ r j oː r aː t j oː n ɛ m	d eː t ɛ r j oː r aː t j oː n ɛ m
a r m aː r ɛ	a r m aː r ɛ
p ɔ s ʊ d ɛ r ɛ	p ɔ sː ɪ d eː r ɛ
j uː d eː m ʊ m	j uː d aɪ ʊ m
k eː r t aː r ɛ	k ɛ r t aː r ɛ
a w ɛ k aː r ɛ	a d w ɔ k aː r ɛ
eː s ɛ kʷ j ɛ k	ɛ k sː ɛ kʷ j a m
w ɪ d uː ɪ t ɛ m	w ɪ d ʊ ɪ t aː t ɛ m
t r uː k ɛ	t r ʊ k ɛ m
ɪ m p r ɛ k aː r ɛ	ɪ m p r ɛ k aː r iː
g ɔ d ɛ r ɛ	g aʊ d eː r ɛ
k a n ɪ n ʊ m	k a n iː n ʊ m
m ɔ n ɛ d a m	m ɔ n eː t a m
r ɛ aː ɪ r ɛ	r ɛ a g eː r ɛ
p r ɔ s t r aː r ɛ	p r oː s t ɛ r n ɛ r ɛ
t ɛ m p oː r aː l ɛ	t ɛ m p ɔ r aː l ɛ m
d ɛ s t ɪ n aː t j oː n	d eː s t ɪ n aː t j oː n ɛ m
a n ɪ m aː l ɛ	a n ɪ m a l
m ɪ t ɪ g aː t j oː n ɛ m	m iː t ɪ g aː t j oː n ɛ m
f a k ɛ t ʊ m	f a k eː t ʊ m
k ɪ r k uː m n aː w eː g aː r ɛ	k ɪ r k ʊ m n aː w ɪ g aː r ɛ
g l ɔ r j aː r ɛ	g l oː r j aː r iː
r ɔ g ʊ m	r ɔ g ʊ m
r ɔ ɪ r ɛ aː	r oː r ɛ m
g r a n aː t ʊ m	g r aː n aː t ʊ m
m a n uː b r j ʊ m	m a n uː b r j ʊ m
d ɛ p r ɛ k aː r ɛ	d eː p r ɛ k aː r iː
m ɔ l j aː r ɛ	m ɔ lː iː r ɛ
p ɪ n t ʊ r a m	p ɪ k t uː r a m
b ɛ n ɛ d ɪ k aː r ɛ	b ɛ n ɛ d iː k ɛ r ɛ
l aʊ d ɛ m	l aʊ d ɛ m
w ɔ m ɪ t aː r ɛ	w ɔ m ɪ t aː r ɛ
k ɔ n ɛ k s j oː n	k oː n ɛ k s j oː n ɛ m
a b aː l iː ɛ n aː t j oː n ɛ m	a b a l ɪ eː n aː t j oː n ɛ m
ɔ n ɔ m aː t ɔ p aɪ j a m	ɔ n ɔ m a t ɔ p ɔ ɪ j a m
n uː t aː r ɛ	n uː t aː r ɛ
p ɔ r k ɛ lː ʊ m	p ɔ r k ɛ lː ʊ m
j a t ɛ m	iː l ɛ
ɛ k s t r ɛ n t ɛ k ʊ m	ɛ k s t r iː n s ɛ k ʊ m
a k k ɛ d ɛ r ɛ	a kː eː d ɛ r ɛ
r ɛ p ɛ lː ɛ r ɛ	r ɛ p ɛ lː ɛ r ɛ
aʊ lː a m	aʊ l a m
ɛ k s t ɔ r k ɛ r ɛ	ɛ k s t ɔ r kʷ eː r ɛ
ɪ n t ɛ l ɛ g ɛ r ɛ	ɪ n t ɛ lː ɛ g ɛ r ɛ
t ɛ d j oː s ʊ m	t aɪ d j oː s ʊ m
l uː k s	l uː k ɛ m
p ɪ g oː r ɛ	p ɛ j oː r ɛ m
k ɔ n k ɔ r d j a m	k ɔ ŋ k ɔ r d j a m
n a t ɪ w ɪ t aː t ɛ m	n aː t iː w ɪ t aː t ɛ m
m a ŋ g aː r ɛ	m a n d uː k aː r ɛ
ɪ mː aː t ʊ r iː t t ɛ m t ɛ m	ɪ mː aː t uː r ɪ t aː t ɛ m
ɪ n w ɛ r t ɛ r ɛ	ɪ n w ɛ r t ɛ r ɛ
l ɪ n eː m ɛ n t ʊ m	l iː n ɛ aː m ɛ n t ʊ m
s ʊ mː ɪ t aː t ɛ m	s ʊ mː ɪ t aː t ɛ m
ɔ sː a r j ʊ m	ɔ sː aː r j ʊ m
ɔ r ɪ ɛ n t aː l ɛ	ɔ r ɪ ɛ n t aː l ɛ m
f ɛ l ɪ k ɪ t aː t ɛ m	f eː l iː k ɪ t aː t ɛ m
g a l ɛ r ʊ m	g a l eː r ʊ m
k ɔ n s ʊ p t j oː n ɛ m	k oː n s uː m p t j oː n ɛ m
s a r k ɪ n a m	s a r k ɪ n a m
p ɔ l ɪ r ɛ	p ɔ l iː r ɛ
h ɛ lː ʊ m	ɛ lː ʊ m
k aː n ʊ m	k aː n ʊ m
k uː l a m	k uː n a m
s a t j aː r	s a t j aː r ɛ
a d ɪ p ɛ m	a d ɪ p ɛ m
l ɔ t oː s ʊ m	l ʊ t oː s ʊ m
s p oː s ʊ m	s p oː n s ʊ m
ɛ k s ɪ k aː t j oː n ɛ m	ɛ k sː ɪ kː aː t j oː n ɛ m
s t r ɪ m ɛ t ɛ r	t r ɛ m eː s k ɛ r ɛ
m oː d ʊ m	m ɔ d j ʊ m
a r t ɛ m aː s j a m	a r t ɛ m ɪ s j a m
k l ʊ s ʊ r a m	k l aʊ s uː r a m
a nː aɪ l ʊ m	a nː ɪ k ʊ l ʊ m
k ɔ aɪ r k ɪ k j oː n ɛ m	k ɔ ɪ r k ɪ t j oː n ɛ m
p a l oː r ɛ	p a lː oː r ɛ m
k ɔ n t r ɪ b ʊ ɪ r ɛ	k ɔ n t r ɪ b ʊ ɛ r ɛ
p ɛ k uː l ʊ m	p ɛ k uː l j ʊ m
a b ɪ t ʊ aː l ɛ	h a b ɪ t w aː l ɛ m
t ɛ n ɔ r ɛ	t ɛ n oː r ɛ m
d eː m ɛ t ɪ r	d eː m ɪ tː ɛ r ɛ
w ɪ n aː r ɛ	w eː n aː r iː
b a r b ʊ l ʊ m	b a r b ʊ l a m
k aː r a m	k a r a m
l ɪ m ɛ n ɛ	l iː m ɛ n
p aː ɪ s ɛ	p aː g eː n s ɛ m
k ɔ r t ɛ m	k ɔ h ɔ r t ɛ m
b a r d ʊ m	b a r d ʊ m
n ʊ m ɛ r ʊ m	n ʊ m ɛ r ʊ m
ɛ n s ɪ k aː r ɛ	ɛ k sː ɪ kː aː r ɛ
ɛ k s p ʊ r g aː r ɛ	ɛ k s p ʊ r g aː r ɛ
s ɔ k ɛ r ʊ m	s ɔ k ɛ r ʊ m
d ɪ fː ɛ r iː r ɛ	d ɪ fː ɛ rː ɛ
p ɛ s k aː r ʊ m	p ɪ s k aː r j ʊ m
ɛ k s t r ʊ t ɪ r ɛ	ɛ k s t r uː d ɛ r ɛ
w ɔ l uː b ɪ l ɛ	w ɔ l uː b ɪ l ɛ m
f lː ɔ s k ʊ l ʊ m	f l ɔ s k ʊ l ʊ m
r ɔ m aː k a m	r ʊ m ɪ k ɛ m
d j a	tʰ iː a m
k a t ɪ n ʊ m	k a t iː n ʊ m
t ɛ t r ɪ k ʊ m	t aɪ t r ɪ k ʊ m
t ɔ g a m	t ɔ g a m
d ɔ m aː r ɛ	d ɔ m aː r ɛ
ɪ m p ɛ r aː r ɛ	ɪ m p ɛ r aː r ɛ
m ɪ r t ɪ lː ʊ m	m y r t ɪ lː ʊ m
l ɪ b ɛ r aː t oː r ɛ	l iː b ɛ r aː t oː r ɛ m
f ɪ j aː r ɛ	f iː d ɛ r ɛ
p ɔ pː a m	p ʊ pː ɛ m
t ɛ rː ɛ m ɔ t ʊ m	t ɛ rː aɪ m ɔ t ʊ m
s k a n d iː r ɛ	s k a n d ɛ r ɛ
t a n t ʊ m	t a n t ʊ m
d ɪ s k ʊ r s ɪ w ʊ m	d ɪ s k ʊ r s iː w ʊ m
a l k j oː n	a l k y ɔ n ɛ m
aɪ w ʊ m	aɪ w ʊ m
l aː m b r ʊ s k a m	l aː b r ʊ s k a m
f l ɔ r ɪ r ɛ	f l oː r eː r ɛ
a w aː l a n k ɛ m	l aː b iː n a m
ɪ n s ʊ r ɛ ɪ w r ɛ	iː n s ɛ kʷ iː
m a t uː r aː r ɛ	m aː t uː r aː r ɛ
a k k ɛ p t aː r ɛ	a kː ɪ p ɛ r ɛ
k l ɪ r j a m	g l aː r ɛ a m
ɪ m p aː r ɛ	ɪ m p a r ɛ m
t ɔ p s ɪ k aː r ɛ	t ɔ k s ɪ k aː r ɛ
a sː a r ɛ	a sː aː r ɛ
l ɪ n j a m	l iː n ɛ a m
g a t a m	k a tː a m
aʊ d ɪ t oː r ɛ	aʊ d iː t oː r ɛ m
l ɪ t aː r ɛ	l ɪ t aː r ɛ
d ɛ l t ɛ t ɛ m	d ɛ ɪ t aː t ɛ m
a k a m	a k j a m
ɛ fː l uː ɪ r ɛ	ɛ fː l ʊ ɛ r ɛ
d eː n ɔ m ɪ n aː t oː r ɛ	d eː n oː m ɪ n aː t oː r ɛ m
a nː oː s ʊ m	a nː oː s ʊ m
f ɛ n aɪ s t r a m	f ɛ n ɛ s t r a m
g a r f ʊ m	g r a pʰ j ʊ m
ɔ kː l uː ɛ r ɛ	ɔ kː l uː d ɛ r ɛ
s t ɔ r a m	s t ɔ r ɛ a m
p ʊ l s aː r ɛ	p ʊ l s aː r ɛ
j uː r a m ɛ n t ʊ m	j uː r aː m ɛ n t ʊ m
r ɛ s k iː n d ɛ r ɛ	r ɛ s k ɪ n d ɛ r ɛ
s t r aː t ʊ m	s t r aː t ʊ m
f ɔ l g ɪ ɛ	f ʊ l g ʊ r
ɪ n k uː b ʊ m	ɪ ŋ k ʊ b ʊ m
p uː r ɛ n ʊ m	p uː r ɛ m
g r aː m b ʊ m	g r ɛ m j ʊ m
k ɛ r b a m	k ɛ r w a m
m a g ɛ s t aː t ɛ m	m a j ɛ s t aː t ɛ m
p r ɔ r ʊ m p ɛ r ɛ	p r oː r ʊ m p ɛ r ɛ
f ɔ r m a m	f oː r m a m
kʷ ɛ r ɪ m ɔ n j a m	kʷ ɛ r ɪ m oː n j a m
r ɔ b ɛ l ɛ m	r oː b ʊ r
k ɛ l ɛ r ɛ	k ɛ l ɛ r ɛ m
b ʊ lː a m	b ʊ lː a m
k a r aː k t ɛ r ɛ	kʰ a r a k t eː r ɛ m
r ɛ t r oː k ɛ d eː r ɛ	r ɛ t r oː k eː d ɛ r ɛ
eː fː aɪ k t aː ɛ r ɛ	ɛ fː ɪ k ɛ r ɛ
ɪ n s t aʊ r aː r ɛ	iː n s t aʊ r aː r ɛ
b a r b aː r ɪ s m ʊ m	b a r b a r ɪ s m ʊ m
ɛ g r ɛ g ʊ m	eː g r ɛ g j ʊ m
eː kʷ aː n ɪ m iː t aː t ɛ m	aɪ kʷ a n ɪ m ɪ t aː t ɛ m
m oː r ɛ	m oː r ɛ m
k oː n g r ʊ m	k ɔ ŋ g r ʊ m
d ɪ fː a m aː t oː r j ʊ m	d ɪ fː aː m aː t oː r j ʊ m
k eː b aː r ɛ	k ɪ b aː r ɛ
ɛ r a m	aɪ r a m
aʊ d ʊ n aː r ɛ	a d uː n aː r ɛ
p r aɪ g ʊ r ɛ t a m r ɛ	p r aɪ g ʊ s t aː r ɛ
k ɔ l ɛ k t a m	k ɔ lː eː k t a m
k ɪ b ʊ m	k ɪ b ʊ m
ɪ n b ɛ n ɪ n aː r	w ɛ n eː n aː r ɛ
a k t a m	aː k t a
ɛ k s ɔ r t aː t j oː n ɛ m	ɛ k s h ɔ r t aː t j oː n ɛ m
a n uː l aː r ɛ	aː n ʊ l aː r ɛ m
a gː r ɛ g aː r ɛ	a gː r ɛ g aː r ɛ
ɔ b lː b ɪ t aː r	ɔ b l iː w ɪ s k iː
n ɛ m ɔ r aː l ɛ	n ɛ m ɔ r aː l ɛ m
p l uː m b ɛ ʊ m	p l ʊ m b ɛu m
ɪ n f r ɪ n aː r ɛ	iː n f r eː n aː r ɛ
k r uː d ɛ l ɛ	k r uː d eː l ɛ m
ɛ s t ɪ w ʊ m m	aɪ s t iː w ʊ m
ɔ l aː t ʊ m	ɔ l ɛ aː t ʊ m
l a r ʊ m	l a r d ʊ m
t r ɔ n ʊ m	tʰ r ɔ n ʊ m
w ɛ l ɛ r ɛ m	w ɛ lː ɛ r ɛ
h ɛ r eː m ʊ m	ɛ r eː m ʊ m
s a l aː r j ʊ m	s a l aː r j ʊ m
f r a ŋ g ɛ r ɛ	f r a ŋ g ɛ r ɛ
s ɔ k l ɔ t j ʊ m	s ɪ ŋ g ʊ l t ʊ m
m ɪ s t ɪ k ʊ m	m y s t ɪ k ʊ m
k s p a n d ɛ r ɛ	ɛ k s p a n d ɛ r ɛ
n ɛ f aː r j ʊ m	n ɛ f aː r j ʊ m
f eː r j a m	f eː r j aː s
ɪ n f ɪ r m aː r ɛ	iː n f ɪ r m aː r ɛ
f ʊ n d aː m ɛ n t ʊ m	f ʊ n d aː m ɛ n t ʊ m
d ɪ m ɪ n ʊ ɪ r ɛ	d iː m ɪ n ʊ ɛ r ɛ
k a l ɪ d ʊ m	k a lː ɪ d ʊ m
uː r ɪ k ɛ m	ʊ l iː k ɛ m
s ɛ s ɛ n aː r ɛ	s ɛ r eː n aː r ɛ
f l ɔ r ɪ d ʊ m	f l oː r ɪ d ʊ m
k ʊ l w r ʊ m	k ɔ l ʊ b r a m
s p uː t aː r ɛ	s p uː t aː r ɛ
r a s k aː r ɛ	r aː d ɛ r ɛ
k l aː r ɪ t aː t ɛ m	k l aː r ɪ t aː t ɛ m
r ɛ m k ɛ r ɛ	r ɛ m ɪ s k eː r ɛ
m a k ɪ n aː r	m aː kʰ ɪ n aː r iː
f a r ɛ t r a m	pʰ a r ɛ t r a m
w ʊ l p ɛ m	w ʊ l p ɛ m
k ɔ l aː r ɛ	k ɔ l ɛ r ɛ
p a r ɪ ɛ t aː l ɛ	p a r ɪ ɛ t aː l ɛ m
r ɛ p r ɛ n d ɛ r ɛ	r ɛ p r ɛ h ɛ n d ɛ r ɛ
l ɪ t uː r g j a m	l iː t uː r g j a m
k ɔ k ʊ m	s ɔ kː ʊ m
w ɛ k s aː r ɛ	w eː k s aː r ɛ
d ɛ w j aː t j ʊ m n ɛ m	d eː w j aː t j oː n ɛ m
s ɔ l w ɛ r ɛ	s ɔ l w ɛ r ɛ
m ɔ s t r r ɛ ʊ r ʊ m	m oː n s t r ʊ oː s ʊ m
t eː m ɛ r ɛ	t ɪ m eː r ɛ
k a l k ɛ m	k a l k ɛ m
a s t oː r ɛ	a s t ʊ r ɛ m
p a w ɪ lː ʊ m n ɛ m	p aː p ɪ l j oː n ɛ m
f a ɛ m	f a k ɪ ɛ m
m ɛ n d ɪ k aː r ɛ	m ɛ n d iː k aː r ɛ
k a p ɪ t l ʊ m	k a p ɪ t ʊ l ʊ m
f a k m oː s ʊ m	f aː m oː s ʊ m
n w a t aː r ɛ	n a t aː r ɛ
d ɛ k ɛ t ɔ r j ʊ m	d ɛ k ɛ p t oː r j ʊ m
t aʊ r ʊ m	t aʊ r ʊ m
s ɪ l w ɛ s t r ɛ m	s ɪ l w ɛ s t r ɛ m
m a k s k eː r aː r ɛ	m a k s ɪ lː a r ɛ m
uː r ʊ m	uː r ʊ m
p ɛ r k oː l aː r ɛ	p ɛ r k oː l aː r ɛ
s ɛ r w ɪ l ɛ	s ɛ r w iː l ɛ m
s ʊ w r aː s ɛ d ɛ r ɛ	s ʊ p ɛ r s ɛ d eː r ɛ
d ɛ k ɪ m ʊ m	d ɛ k ɪ m ʊ m
d ɪ s p aː r t ɪ r ɛ	d ɪ s p a r t iː r ɛ
d ɔ l aː r ɛ	d ɔ l aː r ɛ
b ɪ k a m	b iː g a m
s ʊ g j aː k eː r ɛ	s ʊ b j a k eː r ɛ
a t l a n t iː k ʊ m	aː t l a n t ɪ k ʊ m
d ɔ m ɪ k ɪ l j ʊ m	d ɔ m ɪ k ɪ l j ʊ m
m uː n ɪ f ɪ k ɛ n t j a m	m uː n ɪ f ɪ k ɛ n t j a m
m a s a m	m a sː a m
ɪ n d ɪ n ʊ m	ɪ n d iː ŋ n ʊ m
a lː ɛ g r ɛ m	a l a k r ɛ m
k a t ɛ k ɪ s m ʊ m	k a t eː kʰ ɪ s m ʊ m
aʊ r ɪ r ɛ	h aʊ r iː r ɛ
p ɛ r s k r uː t aː r ɛ m	p ɛ r s k r uː t aː r iː
k ɔ m ɔ d ʊ m	k ɔ mː ɔ d ʊ m
p ɔ s t ɪ iː b ʊ l ʊ m	p r oː s t ɪ b ʊ l ʊ m
k ɔ n t ɛ n t j oː s ʊ m	k ɔ n t ɛ n t j oː s ʊ m
n d ɪ r ɛ t ɪ r ɛ	n ɪ g r eː s k ɛ r ɛ
a m aː l g aː m a m	a m a l g a m a
k uː rː ɪ k ʊ l ʊ m	k ʊ rː ɪ k ʊ l ʊ m
ɔ b s t eː t r ɪ k	ɔ b s t ɛ t r iː k ɛ m
d ɛ b ɛ lː aː r ɛ	d eː b ɛ lː aː r ɛ
p r oː n ʊ m	p r oː n ʊ m
s ʊ p ɛ r b j ʊ m	s ʊ p ɛ r b ʊ m
ɔ t ɔ n aː l ɛ	aʊ t ʊ m n aː l ɛ m
d ɪ m ɪ t ɛ r ɛ	d iː m ɪ tː ɛ r ɛ
a k r ɪ ʊ aː t ɛ	aː k r ɪ t aː t ɛ m
a l t ɛ a m	a l tʰ aɪ a m
a kː uː s aː t oː r j ʊ m	a kː uː s aː t oː r j ʊ m
f ɪ l j aː l ɛ	f iː l j aː l ɛ m
n uː m ɛ r oː s ɪ t aː t ɛ m	n ʊ m ɛ r oː s ɪ t aː t ɛ m
d ɪ l a k ɛ r aː r	d iː l a k ɛ r aː r ɛ
k ɪ m b aː l ʊ m	k y m b a l ʊ m
r ɛ s t r ɪ ŋ g ɛ r ɛ m	r ɛ s t r ɪ ŋ g ɛ r ɛ
m ɔ k ʊ lː ɛ m	m uː t ʊ l ʊ m
p r ɔ f ɪ t ʊ m	p r oː f ɛ k t ʊ m
ɪ n s ɪ n aː r ɛ	iː n s ɪ ŋ n aː r ɛ
r ɛ k ɛ p t aː r ɛ	r ɛ k ɛ p t aː r ɛ
ɔ t j oː s ʊ m	oː t j oː s ʊ m
b l aː n d ɪ t j a m	b l a n d ɪ t j a m
k ɔ ŋ n oː m ɛ m m	k oː ŋ n oː m ɛ n
ɪ m p ɛ t ʊ m	ɪ m p ɛ t ʊ m
s ʊ b ɔ r n aː r ɛ	s ʊ b oː r n aː r ɛ
eː nː ɛ r w aː r	eː n ɛ r w aː r ɛ
t j ɛ r t j ʊ m	t ɛ r t j ʊ m
j ɪ k a m	ɛ kʷ a m
t ɔ r k ɛ r ɛ m	t ɔ r kʷ eː r ɛ
ɔ r t ʊ g r aː f j a m	ɔ r tʰ ɔ g r a pʰ j a m
f a m uː l ʊ m	f a m ʊ l ʊ m
a s ɪ l ʊ m	a s y l ʊ m
ɛ k s ɛ k r aː r ɛ	ɛ k sː ɛ k r aː r iː
ɛ k s ɛ m p l aː r ɛ	ɛ k s ɛ m p l a r
s a b oː r ɛ m	s a p oː r ɛ m
a k oː n ɪ t ʊ m	a k ɔ n iː t ʊ m
k ɔ l ɪ r j ʊ m	k ɔ lː y r j ʊ m
k a n d oː r ɛ	k a n d oː r ɛ m
eː n uː m ɛ r ɛ r	eː n ʊ m ɛ r aː r ɛ
a lː aɪ g aː t j oː n ɛ m	a lː eː g aː t j oː n ɛ m
f ɪ r m ɛ m	f ɪ r m ʊ m
s a r w ɛ ɛ n t ɛ m	s ɛ r w ɪ ɛ n t ɛ m
ʊ k l	a w ʊ ŋ k ʊ l ʊ m
r a k ɪ m oː s ʊ m	r a k eː m oː s ʊ m
r ɛ k t ɪ t uː d	r ɛ k t ɪ t uː d ɪ n ɛ m
k ʊ r s ʊ m	k ʊ r s ʊ m
ɪ n t ɛ n t ʊ m	ɪ n t ɛ n t ʊ m
p ɛ r m ɪ s j oː n ɛ m	p ɛ r m ɪ sː j oː n ɛ m
a b j k t j oː n ɛ m	a b ɪ ɛ k t j oː n ɛ m
b a kː a l ɪ r aː t ʊ m	b a kː a l aʊ r ɛ a t ʊ m
ɛ k s t iː ŋ gʷ ɛ r ɛ m	ɛ k s t ɪ ŋ gʷ ɛ r ɛ
l ɪ n aː r ɛ	l iː n ɛ aː r ɛ
ɔ s t r ʊ m	aʊ s t r ʊ m
p ʊ ɛ r ɪ l ɛ	p ʊ ɛ r iː l ɛ m
f ɪ s k ʊ m	f ɪ s k ʊ m
k ɪ m iː kʷ ɛ m	k iː m ɪ k ɛ m
w ɛ t ɛ r ɛ m	w ɛ t ɛ r ɛ m
g r a n aː r ʊ m	g r aː n aː r j ʊ m
r uː g a m	r uː g a m
p r aɪ p ɔ s ɪ t ɛ m	p r aɪ p ɔ s ɪ t ʊ m
j uː s t ʊ m	j uː s t ʊ m
w ɛ n d eː m j aː r ɛ	w iː n d eː m j aː r ɛ
k ɪ p r aː m ɛ m	k ʊ p r ɛ sː ʊ m
ɛ k r iː t ʊ m	s k r iː p t ʊ m
k r ɔ n ɪ k ʊ m	kʰ r ɔ n ɪ k ʊ m
w a t ɛ m	w aː t ɛ m
s ɛ k s aː l ɪ t aː t ɛ m	s ɛ k s w aː l ɪ t aː t ɛ m
ɔ n a g r ʊ m	ɔ n a g r ʊ m
r a n ʊ k j aː l ɛ m	r aː n ʊ ŋ k ʊ l ʊ m
s ɪ t a t j ɛ m	k ɪ t aː t j oː n ɛ m
k ɔ l ɛ g ʊ m	k ɔ lː eː g j ʊ m
s ʊ mː ɪ n ɪ s t r aː r ɛ m	s ʊ b m ɪ n ɪ s t r aː r ɛ
d ɛ s ɪ n ɛ n t a m	d eː s ɪ n ɛ n t j a m
d ɪ s k r ɛ p aː r ɛ m	d ɪ s k r ɛ p aː r ɛ
a t r a m ɛ n t ʊ m	aː t r aː m ɛ n t ʊ m
r uː ʊ m	r oː s k ɪ d ʊ m
j uː d ɪ k j aː r j ʊ m	j uː d ɪ k j aː r j ʊ m
d eː f oː r m ɛ m	d eː f oː r m ɛ m
r ɛ g eː r ɛ	r ɛ g ɛ r ɛ
ɪ b ɪ s	iː b ɛ m iː b ɪ n
a t ɪ n eː r ɛ	a tː ɪ n eː r ɛ
l a k s ʊ m	l a k s ʊ m
p a l ɛ s t r a m	p a l aɪ s t r a m
k aɪ p a m	k eː p a m
a k ɪ ɛ t ʊ m r	a kː w ɪ eː s k ɛ r ɛ
sː t aː p ɛ d ɛ	s t a p ɛ d ɛ m
f aʊ k ɛ	f aʊ k eː s
p r ɔ l eː t aː r j aː t ʊ m	p r oː l eː t aː r j ʊ m
s ɔ l j ʊ m	s ɔ l j ʊ m
p uː b ɛ m	p uː b ɛ r ɛ m
r ɛ d ɛ n t j oː n ɛ m	r ɛ d ɛ m p t j oː n ɛ m
fː uː m ɪ g aː r ɛ	f uː m ɪ g aː r ɛ
a r a l ɛ	aː r ɛ a l ɛ m
f r aː k sː ɪ n ɪ ʊ m	f r a k s ɪ n ɛu m
s ɛ p t ɛ n t r j oː n ɛ m	s ɛ p t ɛ n t r j oː n ɛ m
ɪ n k ɔ s t a n t ɛ m	ɪ ŋ k oː n s t a n t ɛ m
d eː p r ɪ m ɛ r ɛ	d eː p r ɪ m ɛ r ɛ
k uː l t ʊ m	k ʊ l t ʊ m
a l g aː n	a l ɪ kʷ ɛ m
n ɛ g ɔ k j aː t j oː n ɛ m	n ɛ g oː t j aː t j oː n ɛ m
eː kʷ ɪ l ɪ b r j ʊ m	aɪ kʷ ɪ l iː b r j ʊ m
uː r b ɛ m	ʊ r b ɛ m
b ɪ r ʊ b ɪ n ɛ m ɛ m	w ɛ r w eː k s
m uː t ʊ m m	m uː t ʊː m
ʊ ŋ g ɛ n t ʊ m	ʊ ŋ gʷ ɛ n t ʊ m
k l aː w ʊ m	k l aː w ʊ m
w ɛ r b aː l ɛ	w ɛ r b aː l ɛ m
ɪ sː ɪ m ʊ m	ɪ sː ɪ m ʊ m
k ɔ n k ɛ r iː r	k ɔ ŋ kʷ iː r ɛ r ɛ
uː m ɪ d ʊ m	uː m ɪ d ʊ m
a d w ɔ k aː t j oː n ɛ m	a d w ɔ k aː t j oː n ɛ m
ɪ n f r ɪ ŋ g ɛ r ɛ	iː n f r ɪ ŋ g ɛ r ɛ
a lː uː j k ɛ	h a lː ʊ m
s aː ŋ gʷ ɪ r aː r ɛ	s a ŋ gʷ ɪ n aː r ɛ
d ɪ g ɪ t aː r ɛ	d ɪ g ɪ t aː r ɛ
w ɔ l t aː r ɛ	w ɔ l uː t aː r ɛ
a b s t ɛ r j eː r ɛ	a b s t ɛ r g eː r ɛ
a n ɔ r m aː l ɛ m	a n oː r m a l ʊ m
ɛ k s p ɪ r aː t j oː n ɛ m	ɛ k sː p iː r aː t j oː n ɛ m
r ɛ b ɛ l aː r	r ɛ b ɛ lː aː r ɛ
