s a l uː t aː r ɛ	s a l uː t aː r ɛ
d eː s ɪ n ɛ n t j a m	d eː s ɪ n ɛ n t j a m
r a w j ɪ k aː r ɛ	r ɛ s ɛ k aː r ɛ
k ɔ m p l ɪ k a t j oː n ɛ	k ɔ m p l ɪ k aː t j oː n ɛ m
s ʊ d ɪ j a k ɛ r ɛ	s ʊ b j a k eː r ɛ
a d ɪ t ʊ m	a d ɪ t ʊ m
uː s aː r ɛ	uː t iː
k r ɛ d ɪ t oː r ɛ	k r eː d ɪ t oː r ɛ m
f l ɔ kː oː s ʊ m	f l ɔ kː oː s ʊ m
m uː sː ɪ t aː r ɛ	m ʊ sː ɪ t aː r ɛ
ɪ l j ʊ m	h iː l ʊ m
d j ɛ k ɪ m aː r ɛ	d ɛ k ɪ m aː r ɛ
s ʊ lː ɛ k ɪ t ʊ m	s ɔ lː ɪ k ɪ t ʊ m
s ɛ r w ɪ l ɛ	s ɛ r w iː l ɛ m
s ɔ n aː r ɛ	s ɔ m n j aː r ɛ
k ɛ r w ɛ s a m	k ɛ r w ɪ s j a m
g aː t a m	k a tː a m
s oː l ʊ m	s oː l ʊ m
s a kʷ uː d ɛ r ɛ	s ʊ kː ʊ t ɛ r ɛ
ɪ n k a n t aː r ɛ	ɪ ŋ k a n t aː r ɛ
aɪ r a m	aɪ r a m
ɪ sː ɪ m ʊ m	ɪ sː ɪ m ʊ m
d ɛ ɪ t aː t ɛ m	d ɛ ɪ t aː t ɛ m
s k ʊ p aː r ɛ	s k ɔ p ɛ r ɛ
h sː aː n t a sː ʊ m	z ɪ n z a l a m
eː kʷ ɪ w a l ɛ r ɛ	aɪ kʷ ɪ w a l eː r ɛ
t ɛ rː eː m ɔ t ʊ m	t ɛ rː aɪ m ɔ t ʊ m
m ɛ t r ɛ k ʊ m	m ɛ t r ʊ m
a d uː lː a t j oː n ɛ m	a d uː l aː t j oː n ɛ m
m aː n s j ʊ n ɛ m	m aː n s j oː n ɛ m
k r uː ɛ l d a l t ɛ m	k r uː d eː l ɪ t aː t ɛ m
g r a t ɪ f ɪ k aː r ɛ	g r aː t ɪ f ɪ k aː r iː
kʷ aː r t ʊ m	kʷ aː r t ʊ m
d eː g ʊ lː aː r ɛ	d eː k ɔ lː aː r ɛ
p l aː n ʊ m	p l aː n ʊ m
k a n ɛ s t ɛ r ʊ m	k a n ɪ s t r ʊ m
l ɪ b eː r a l ɪ t aː t ɛ m	l iː b ɛ r aː l ɪ t aː t ɛ m
h s ɛ p ɛ l aː r ɛ	s ɛ p ɛ l iː r ɛ
ɪ n s ɪ ŋ n j a m	iː n s ɪ ŋ n ɛ
ʊ n k ɪ n ʊ m	ʊ ŋ k iː n ʊ m
s ʊ lː ɛ w aː r ɛ	s ʊ b l ɛ w aː r ɛ
l uː b r ɪ k ʊ m	l uː b r ɪ k ʊ m
aʊ r ɪ g a m	aʊ r iː g a m
b ɛ lː ʊ m	b ɛ lː ʊ m
uː m ɪ d ʊ m	uː m ɪ d ʊ m
d ɪ t ʊ m	d ɪ k t ʊ m
l ɛ g y ɪ	l ɪ g aː m ɛ n
m ɪ s t uː r a m	m ɪ s t uː r a m
a fː ɛ k t j ʊ n ɛ m	a fː ɛ k t j oː n ɛ m
a b ɪ t aː r ɛ	h a b ɪ t aː r ɛ
r ɛ p r ɛ h ɛ n s j ʊ n ɛ m	r ɛ p r ɛ h ɛ n s j oː n ɛ m
ʊ rː ɛ ʊ m	h ɔ rː ɛu m
s ɛ r w ɪ t ʊ t ɛ m	s ɛ r w ɪ t uː t ɛ m
s k ʊ r s ʊ m	ɛ k s k ʊ r s ʊ m
r ɛ m eː k ɛ r ɛ	r ɛ m ɪ s k eː r ɛ
uː s w aː l ɛ	uː s w aː l ɛ m
f ɔ n t ɛ m	f ɔ n t ɛ m
s ɛ p ʊ l t uː r a m	s ɛ p ʊ l t uː r a m
n ɪ d ɪ f ɔ r m ɛ	n iː d ɪ f oː r m ɛ m
k ɛ n sː uː r ʊ m	k eː n s uː r a m
l a k aː r ɛ m	l a sː aː r ɛ
a d uː l a t oː r ɛ	a d uː l aː t oː r ɛ m
k a r ɪ n ɛ r ʊ m	k a r n aː r j ʊ m
t a k sː a t j ʊ n ɛ m	t a k s aː t j oː n ɛ m
a r b uː s t ɪ w ʊ m	a r b ʊ s t iː w ʊ m
uː k s ɔ r ɪ k ɪ d j ʊ m	ʊ k s oː r ɪ k iː d j ʊ m
n ɪ m ʊ s	n eː m ɪ n ɛ m
aɪ s ɛ kʷ j aː m	ɛ k sː ɛ kʷ j a m
s ɛ n aː r ɛ	s ɪ ŋ n aː r ɛ
a k t ɛ sː ʊ m	a kː ɛ sː ʊ m
k aː t ɛ d r a m	k a tʰ ɛ d r a m
aɪ m uː l ʊ m	aɪ m ʊ l ʊ m
p r a n t ɛ r ɛ m	p r a n d eː r ɛ
a t r a m ɛ n t ʊ m	aː t r aː m ɛ n t ʊ m
t uː	t uː
k a p ɪ t a t j ʊ n ɛ m	k a p ɪ t aː t j oː n ɛ m
t ɪ n j a m	t ɪ n ɛ a m
l ɪ m ɪ t r ʊ f ʊ m	l iː m ɪ t r ɔ pʰ ʊ m
f ɔ r ɛ aː r ɛ	f ɔ r aː r ɛ
k ɔ m p eː t ɛ r ɛ	k ɔ m p ɛ t ɛ r ɛ
a d m ɔ n ɪ t j ʊ n ɛ m	a d m ɔ n ɪ t j oː n ɛ m
p r oː sː ɪ m ʊ m	p r ɔ k s ɪ m ʊ m
k ɔ n s ɛ r w aː r ɛ	k oː n s ɛ r w aː r ɛ
m a l ɛ d ɪ k ɛ r ɛ	m a l ɛ d iː k ɛ r ɛ
eː m uː ŋ g eː r ɛ	eː m ʊ ŋ g ɛ r ɛ
d ɪ sː ɪ m uː l a t j ʊ n ɛ m	d ɪ sː ɪ m ʊ l aː t j oː n ɛ m
f ʊ l g ɔ r ɛ	f ʊ l g oː r ɛ m
a p eː lː ɪ d aː r ɛ	a pː ɛ lː ɪ t aː r ɛ
d ɪ s p a r ɪ t r ɛ	d ɪ s p a r eː r ɛ
m aː g ʊ m	m a g ʊ m
k ɪ r k ʊ n s k r iː w ɛ r ɛ	k ɪ r k ʊ m s k r iː b ɛ r ɛ
kʷ a l ɪ t aː t ɛ m	kʷ aː l ɪ t aː t ɛ m
b r ɛ w ɛ m	b r ɛ w ɛ m
ɔ l ɛ a t ʊ m	ɔ l ɛ aː t ʊ m
m eː d ɪ r ɛ	m eː t iː r iː
t ɛ n ɔ r ɛ	t ɛ n oː r ɛ m
m a t ɛ r n ʊ m	m aː t ɛ r n ʊ m
f l ɔ r ɪ r ɛ	f l oː r eː r ɛ
f ɔ r t uː k ɪ t ʊ m	f ɔ r t ʊ iː t ʊ m
m ɛ n d aː k ɛ m	m ɛ n d aː k ɛ m
p a m p aː n ʊ m	p a m p ɪ n ʊ m
m uː n ɪ r ɛ	m uː n iː r ɛ
t r a n s f ʊ n d ɪ r ɛ	t r aː n s f ʊ n d ɛ r ɛ
p ʊ ɛ r ɪ l ɛ	p ʊ ɛ r iː l ɛ m
ɛ k s ɪ s t ɛ r ɛ	ɛ k s ɪ s t ɛ r ɛ
w ɛ k sː a t j ʊ n ɛ m	w ɛ k s aː t j oː n ɛ m
ɔ k uː l aː r ɛ	ɔ k ʊ l aː r ɛ m
d eː t ɛ p t j j ɔ d aː r aː r ɛ	d eː k ɪ p ɛ r ɛ
f a b ɛ lː a m	f aː b ɛ lː a m
l uː m ɪ n oː s ʊ m	l uː m ɪ n oː s ʊ m
r ɛ p l ɪ k a t j oː n ɛ	r ɛ p l ɪ k aː t j oː n ɛ m
h ɛ r b oː s ʊ m	h ɛ r b oː s ʊ m
l ɔ n g ɪ t uː d n ɛ m	l ɔ ŋ g ɪ t uː d ɪ n ɛ m
l ɪ n ɛ a m	l iː n ɛ a m
s t r aː t ʊ m	s t r aː t ʊ m
ɪ m b eː k ɪ lː ɪ t aː t ɛ m	ɪ m b eː k ɪ lː ɪ t aː t ɛ m
k a l w ʊ m	k a l w ʊ m
k aʊ t j oː n ɛ m	k aʊ t j oː n ɛ m
l a m ɛ n t ʊ m	l aː m ɛ n t ʊ m
kʷ ɔ l pʰ r ɪ t aː r	k ʊ l k ɪ t a m
eː n ɛ r w aː r ɛ	eː n ɛ r w aː r ɛ
m eː d j a l ɛ	m ɛ d j aː l ɛ m
ɪ n s eː r ɪ r ɛ	iː n s ɛ r ɛ r ɛ
a j kː w ɪ s ɪ t j oː n ɛ	a kː w ɪ s iː t j oː n ɛ m
s t aː b ɪ l ɛ m	s t a b ɪ l ɛ m
s k ʊ d ɛ lː a m	s k ʊ t ɛ lː a m
k ɔ k ɪ r ɪ r ɛ	k ɔ ŋ kʷ iː r ɛ r ɛ
f ʊ l ɪ k g ɪ n ɛ m	f uː l iː g ɪ n ɛ m
s a ŋ gʷ ɪ n ɔ l ɛ n t ʊ m	s a ŋ gʷ ɪ n ɔ l ɛ n t ʊ m
f ɪ g uː r a m	f ɪ g uː r a m
p ɛ r d ɪ k ɛ m	p ɛ r d iː k ɛ m
p ɪ ɔ n a m	p aɪ oː n j a m
p r ɔ ɪ b ɪ t j ʊ m	p r ɔ h ɪ b ɪ t j oː n ɛ m
b r ɛ ɪ w j ɛ t aː t ɛ m	b r ɛ w ɪ t aː t ɛ m
ɛ w ɔ r ɪ ʊ m	ɛ b ɔ r ɛu m
a n ɛ k sː ʊ m	a nː ɛ k s ʊ m
k ɛ n ʊ m	k ɪ nː ʊ m
m ɔ r b ʊ m	m ɔ r b ʊ m
b a l b ʊ t j ɛ r ɛ	b a l b uː t iː r ɛ
ɔ fː ɪ k ɪ n a m	ɔ fː ɪ k iː n a m
a m a n ʊ ɛ n s ɛ m	aː m a n ʊ eː n s ɛ m
t uː m eː f a y ɛ r ɛ	t ʊ m ɛ f a k ɛ r ɛ
d ɛ k s t eː r ɪ t aː t ɛ m	d ɛ k s t ɛ r ɪ t aː t ɛ m
a s t r ʊ m	aʊ s t r ʊ m
f r a ŋ g ɪ r ɛ	f r a ŋ g ɛ r ɛ
f ɔ k ɛ	f aʊ k ɛ m
ɪ n k ɔ lː uː m ɛ m	ɪ ŋ k ɔ l ʊ m ɛ m
f l ɛ k t ɪ r ɛ	f l ɛ k t ɛ r ɛ
a t ɛ n d ɛ r ɛ	a tː ɛ n d ɛ r ɛ
f ɛ s t ɪ w ɪ t aː t ɛ m	f eː s t iː w ɪ t aː t ɛ m
f uː n ɛ s t ʊ m	f uː n ɛ s t ʊ m
d ɪ sː eː k aː r ɛ	d ɪ sː ɛ k aː r ɛ
eː kʷ a n ɪ m ɪ t aː t ɛ m	aɪ kʷ a n ɪ m ɪ t aː t ɛ m
p ʊ l w eː r ɪ zː aː r ɛ	p ʊ l w ɛ r iː zː aː r ɛ
r ɛ p ɛ lː ɛ r ɛ	r ɛ p ɛ lː ɛ r ɛ
n ɛ f a s	n ɛ f aː s
a d ɪ r ɛ	a dː ɛ r ɛ
k aː s t r ʊ m	k a s t r ʊ m
d eː l ɪ t j a m	d eː l ɪ k j aː s
a b sː ɔ l w eː r ɛ	a b s ɔ l w ɛ r ɛ
s p ɛ sː ʊ m	s p ɪ sː ʊ m
r ɛ k eː p t a t ɔ r ɛ	r ɛ k ɛ p t aː t oː r ɛ m
m uː k oː s ʊ m	m uː k oː s ʊ m
g ɛ n j ɪ a l ɛ	g ɛ n j aː l ɛ m
m ɪ l aː r j ʊ m	m iː lː j aː r j ʊ m
a m a t ɔ r j ʊ m	a m aː t oː r j ʊ m
s a l uː t ɛ m	s a l uː t ɛ m
d ɪ k t j oː n ɛ m	d ɪ k t j oː n ɛ m
p a r t ɪ k ʊ l a m	p a r t ɪ k ʊ l a m
h s ɔ n a m	z oː n a m
k ɪ s b m ɪ w ɛ m	k iː m ɪ k ɛ m
p aː b ʊ lː ɪ m	p aː b ʊ l ʊ m
p ɔ n d eː r aː r ɛ	p ɔ n d ɛ r aː r ɛ
s k oː ʊ t ɛ r ɛ	ɛ k s k ɔ kʷ ɛ r ɛ
m ɛ r eː t r ɪ k ɛ	m ɛ r ɛ t r iː k ɛ m
d ɪ s p a r aː r ɛ	d ɪ s p a r aː r ɛ
a r g ɪ lː a m	a r g ɪ lː a m
m a s k ʊ l iː n ʊ m	m a s k ʊ l iː n ʊ m
a n aː t aː n ʊ m	a n a t ɛ m
a sː ʊ lː aː r ɛ	a sː ɔ l aː r ɛ
t a l a m ʊ m	tʰ a l a m ʊ m
k ʊ n m ʊ ɪ w ɛ r ɛ	k ɔ mː ɔ w eː r ɛ
p ʊ lː aː r ɛ	p ʊ lː aː r ɛ
r uː ɛ r ɛ	r ʊ ɛ r ɛ
p ɔ lː ɪ k ɛ m	p ɔ lː ɪ k ɛ m
k ɔ n g uː r aː r ɛ	k ɔ n ɪ uː r aː r ɛ
w ɪ p ɪ r a m	w iː p ɛ r a m
f ɪ d ʊ m	f iː d ʊ m
ɛ lː ɪ p sː ʊ m	ɛ lː iː p s ɪ n
w ɪ l a r ɛ	w ɛ l a m
k a l ɪ d ɪ t ɛ m	k a l ɪ d ɪ t aː t ɛ m
n ʊ m ɪ n aː r ɛ	n oː m ɪ n aː r ɛ
p r ɛ d ɔ m ɪ n aː r ɛ	p r aɪ d ɔ m ɪ n aː r iː
n a sː a m	n a sː a m
m ʊ r a lː ɪ d aː d ɛ m	m oː r aː l ɪ t aː t ɛ m
k ɔ m ɛ t ɛ r ɛ	k ɔ mː ɪ tː ɛ r ɛ
a s k j aː l ɛ	a fː l aː r ɛ
ɪ n f l a t j ɛu n ɛ m	iː n f l aː t j oː n ɛ m
ɪ n f lː ɪ g ɛ r ɛ	iː n f l iː g ɛ r ɛ
ɛ n k uː l ɪ m ɛ	ɪ ŋ k uː d ɛ m
ɔ b l ɪ g a t j oː n ɛ	ɔ b l ɪ g aː t j oː n ɛ m
n ɔ nː a m	n ɔ nː a m
d eː r ɪ s ɔ r ʊ m	d eː r iː s oː r j ʊ m
a l t ɛ r k aː r ɛ	a l t ɛ r k aː r iː
ɪ n s t r uː k sː w ɛ m	iː n s t r ʊ k t j oː n ɛ m
d ɔ m ɛ s t ɪ k ʊ m	d ɔ m ɛ s t ɪ k ʊ m
f eː m ɪ n a m	f eː m ɪ n a m
s k iː m j ʊ m	s iː m j ʊ m
oː y ʊ m	l ɔ l j ʊ m
k a t ɛ lː ʊ m	k a t ɛ lː ʊ m
t eː r t j a r ɛ	t ɛ r t j aː r ɛ
eː l ɪ d ɛ r ɛ	eː l iː d ɛ r ɛ
ɪ l a r ɛ	h ɪ l a r ɛ m
p ɛ ɪ k t ɪ n aː r ɛ	p ɛ k t ɪ n aː r ɛ
t a m ɛ s ʊ m	t a m ɪ s j ʊ m
d ʊ l ɔ s ʊ m	d ɔ l oː s ʊ m
r ʊ ʊ m	r ʊ b ʊ m
b aː r d ʊ m	b a r d ʊ m
t r a n s ɪ t ʊ m	t r aː n s ɪ t ʊ m
r eː w ɛ d r ɛ	r ɛ w ɪ d eː r ɛ
k aː r m ɛ m	k a r m ɛ n
d eː s ɔ l aː r ɛ	d eː s oː l aː r ɛ
a r aː t r ʊ m	a r aː t r ʊ m
a d uː r a sː w ɛ m	a d ɪ uː r aː t j oː n ɛ m
p r ɔ d ɪ g j ʊ m	p r oː d ɪ g j ʊ m
p ɔ sː ʊ d ɛ r ɛ	p ɔ sː ɪ d eː r ɛ
r ɔ m iː k	r ʊ m ɪ k ɛ m
d ʊ b ɪ t aː r ɛ	d ʊ b ɪ t aː r ɛ
k a n t ʊ m	k a n t ʊ m
s aː k ʊ m	s a r k ʊ l ʊ m
m a n ɪ j ɛ r ʊ m	m a n w aː r j ʊ m
d eː l ɪ b ɛ r a t j ʊ n ɛ m	d eː l iː b ɛ r aː t j oː n ɛ m
k a pː ɛ lː a m	k a pː ɛ lː a m
w a lː a r ɛ	w a lː aː r ɛ
p r eː k l a r ʊ m	p r aɪ k l aː r ʊ m
r ɛ w ɛ r s aː r ɛ	r ɛ w ɛ r s aː r ɛ
f l oː r ɪ d ʊ m	f l oː r ɪ d ʊ m
ɪ m p aː w ɪ d ʊ m	ɪ m p a w ɪ d ʊ m
sː t a pː ɛ d ɛ m	s t a p ɛ d ɛ m
k ʊ r t ɛ m	k ɔ h ɔ r t ɛ m
k ɔ lː ɛ ɛ m	k ɔ lː ɛ m
k ɔ ŋ n ɔ m ɛ n	k oː ŋ n oː m ɛ n
p j ɛ r r ɪ k a m	p ɛ r s ɪ k a m
b a l aː r ɛ	b aː l aː r ɛ
a r ɪ j oː lː ʊ m	h a r ɪ ɔ l ʊ m
g oː n z ʊ m	g ɔ m pʰ ʊ m
m ɔ d uː l aː r ɛ	m ɔ d ʊ l aː r iː
d ɪ s p ɔ n ɛ m	d ɪ s p oː n ɛ r ɛ
s ɔ n aː t ʊ m	s ɔ m n j ʊ m
a b ɪ t w aː l ɛ	h a b ɪ t w aː l ɛ m
h aː g uː n aː ɛ	j eː j uː n aː r ɛ
r a s ɛ n aː r ɛ	r ɛ s ɪ ŋ n aː r ɛ
w a l eː r ɛ	w a l eː r ɛ
s aː ŋ kʷ ɪ r aː r ɛ	s a ŋ gʷ ɪ n aː r ɛ
a ŋ g uː lː aː r ɛ	a ŋ g ʊ l aː r ɛ m
p r eː m ɔ n ɪ t ɔ r ɛ m	p r aɪ m ɔ n ɪ t oː r ɛ m
p r ɛ k ɛ g p ɛ t ʊ m	p r aɪ k ɛ p t ʊ m
ɔ b s t r uː ɛ r ɛ	ɔ b s t r ʊ ɛ r ɛ
d a ʊ nː oː s ʊ m	d a m n oː s ʊ m
aʊ r ɪ r ɛ	h aʊ r iː r ɛ
ɪ n t ɛ r p r eː t a b ɪ l ɛ	ɪ n t ɛ r p r ɛ t aː b ɪ l ɛ m
s ʊ n ɪ kː ʊ l ɔ s ʊ m	s ɔ m n ɪ k ʊ l oː s ʊ m
f uː l w ʊ m	f ʊ l w ʊ m
p r ɔ d uː k t j oː n ɛ m	p r oː d ʊ k t j oː n ɛ m
eː l eː f a n t ɪ n ʊ m	ɛ l ɛ pʰ a n t ɪ n ʊ m
s t a t ɛ r a m	s t a t eː r a m
m j ɛ sː ɛ m	m ɛ sː ɛ m
a s ɛ aː t ɛ m	a s eː ɪ t aː t ɛ m
k aː k t ɪ w ʊ m	k a p t iː w ʊ m
ɪ r a m	iː r a m
p r ɔ b ʊ m	p r ɔ b ʊ m
p iː n t ʊ m	p ɪ k t ʊ m
ɔ r ɪ g ɪ n ɛ m	ɔ r iː g ɪ n ɛ m
k uː l t ʊ m	k ʊ l t ʊ m
n ɔ w ɪ t j ʊ m	n ɔ w iː k j ʊ m
l ɛ t ɪ t j a m	l aɪ t ɪ t j a m
eː kʷ ɪ l ɪ b r j ʊ m	aɪ kʷ ɪ l iː b r j ʊ m
n ɔ m ɪ n a t j oː n ɛ	n oː m ɪ n aː t j oː n ɛ m
p r ɔ f ɪ t ʊ m	p r oː f ɛ k t ʊ m
m ʊ l aː r ɛ	m ɔ l aː r ɛ m
f l ɛ k sː j ʊ n ɛ m	f l ɛ k s j oː n ɛ m
a d m ɪ r a b ɪ l ɛ m	a d m iː r aː b ɪ l ɛ m
p aʊ p ɛ r t aː t ɛ m	p aʊ p ɛ r t aː t ɛ m
k ʊ k l ʊ m	k ʊ k uː l ʊ m
b a k t ɪ s ɪ m ʊ m	b a p t ɪ s m ʊ m
k a lː ɛ m	k a lː ɛ m
k ɔ n s t r ɪ k t oː r ɛ	k oː n s t r ɪ k t oː r ɛ m
ɔ p uː l ɛ n t ʊ m	ɔ p ʊ l ɛ n t ʊ m
ɔ r ɪ d ɛ r ɛ	ɔ kː ɪ d ɛ r ɛ
eː d ɪ k t ʊ m	eː d ɪ k t ʊ m
n eː g l ɪ g ɛ r ɛ	n ɛ g l ɛ g ɛ r ɛ
a kː uː s a t oː r j ʊ m	a kː uː s aː t oː r j ʊ m
d eː f ɔ r m ɛ m	d eː f oː r m ɛ m
ŋ p ɪ l aː r ɛ	p ɪ l aː r ɛ
k ɔ l ɔ r aː r ɛ	k ɔ l oː r aː r ɛ
ɪ r k ɪ n ʊ m	h ɪ r k iː n ʊ m
uː s uː r aː r j ʊ m	uː s uː r aː r j ʊ m
p r ɔ d ɪ g aː r ɛ	p r oː d ɪ g ɛ r ɛ
p lː a s m aː r ɛ	p l a s m aː r ɛ
p ɛ r p eː t w aː w j ɪ n ɛ m	p ɛ r p ɛ t w aː t oː n ɛ m
f eː lː ɔ n ɛ	f ɛ lː aː r ɛ
p r oː n ɔ s t ɪ k	p r ɔ ŋ n oː s ɛ m
eː s ɛ r k ɪ t ʊ m	ɛ k s ɛ r k ɪ t ʊ m
n ɛ p eː t ɛ m a m	n ɛ p ɛ t a m
s p ɔ ŋ g a m	s p ɔ ŋ g j a m
ɪ n g ʊ k t j ʊ n ɛ m	ɪ n j ʊ ŋ k t j oː n ɛ m
s p ɔ r t a m	s p ɔ r t a m
p r ɔ m ɔ n t oː r j ʊ m	p r oː m ʊ n t ʊ r j ʊ m
d ɪ s t ɛ n d ɛ r ɛ	d ɪ s t ɛ n d ɛ r ɛ
l ʊ t ʊ m	l ʊ t ʊ m
p r oː n ʊ m	p r oː n ʊ m
w ɪ d uː ɪ t ɛ m	w ɪ d ʊ ɪ t aː t ɛ m
b ɛ l ʊ w ɛ r j	b eː l w a m
l ɪ n ɛ a r ɛ	l iː n ɛ aː r ɛ
p ɛ r eː g r ɪ n aː r ɛ	p ɛ r ɛ g r iː n aː r iː
d eː f ɛ k t j ʊ n ɛ m	d eː f ɛ k t j oː n ɛ m
d eː l a t oː r ɛ	d eː l aː t oː r ɛ m
s ɔ l ɛ r ɛ	s ɔ l eː r ɛ
w a g a b ʊ n d ʊ m	w a g aː b ʊ n d ʊ m
ɔ r n aː t ʊ m	oː r n aː t ʊ m
s ɔ l aː r ɛ	s oː l aː r ɛ m
t ɛ n t aː r ɛ	t ɛ m p t aː r ɛ
a l t ɪ t uː d ɪ n ɛ m	a l t ɪ t uː d ɪ n ɛ m
m ɔ s k ʊ m	m ʊ s t ɛu m
b a r b a r ɪ d zː aː r ɛ	b a r b a r iː zː aː r ɛ
k ɔ n s k ɪ j ɛ n t j a m	k oː n s k ɪ ɛ n t j a m
d j a b oː l ɪ k ʊ m	d j a b ɔ l ɪ k ʊ m
l uː t ʊ m	l uː k t ʊ m
s k r uː p uː l oː s ʊ m	s k r uː p ʊ l oː s ʊ m
g a l ɛ n a m	g a l eː n a m
ɛ rː oː r ɛ m	ɛ rː oː r ɛ m
k a n t j ʊ n ɛ m	k a n t j oː n ɛ m
p r ɛ ɔ kː uː p a t j ʊ n ɛ m	p r aɪ ɔ kː ʊ p aː t j oː n ɛ m
t ɛ s uː r a m	t eː n s uː r a m
f uː r ɔ r ɛ	f uː r aː r iː
k ʊ n t ɔ r k ɛ r ɛ	k ɔ n t ɔ r kʷ eː r ɛ
g uː s t ɪ f ɪ k a t ɔ r ɛ	j uː s t ɪ f ɪ k aː t oː r ɛ m
d eː k ɛ r n ɛ r ɛ	d eː k ɛ r n ɛ r ɛ
g l aː d j ʊ m	g l a d j ʊ m
k ɔ s t aː t ʊ m	k ɔ s t aː t ʊ m
s t uː d j ʊ m	s t ʊ d j ʊ m
l ɪ m oː s ʊ m	l iː m oː s ʊ m
t ɔ r s ʊ m	tʰ y r s ʊ m
d eː k r ɛ t ʊ m	d eː k r eː t ʊ m
l aʊ r pʰ t ʊ m	l aʊ r ɛ aː t ʊ m
j uː s t ɪ f ɪ k a t j oː n ɛ	j uː s t ɪ f ɪ k aː t j oː n ɛ m
p ɔ r t j ʊ m	p ɔ r t j oː n ɛ m
f ɔ r ʊ m	f ɔ r ʊ m
uː l t ɔ r ɛ	ʊ l t oː r ɛ m
a lː ɛ g r ʊ m	a l a k r ɛ m
k r uː ɛ n t aː r ɛ	k r ʊ ɛ n t aː r ɛ
p r ʊ g r eː sː ɪ r ɛ	p r oː g r ɛ d iː
b ʊ lː a m	b ʊ lː a m
w eː r d z a m	w ɪ r ɪ d ɛ m
f ɪ b ʊ l a m	f iː b ʊ l a m
d uː l t ɪ sː ʊ n ʊ m	d ʊ l k ɪ s ɔ n ʊ m
p eː t iː r ɛ	p ɛ t ɛ r ɛ
ɪ t eː r a t j ʊ n ɛ m	ɪ t ɛ r aː t j oː n ɛ m
n ɛ g ɔ t j a t j ʊ n ɛ m	n ɛ g oː t j aː t j oː n ɛ m
ɪ m p eː t ɪ w ɪ g ɛ m	ɪ m p ɛ t iː g ɪ n ɛ m
k ʊ m p eː lː ɛ r ɛ	k ɔ m p ɛ lː ɛ r ɛ
aɪ t j a m	ɪ t j a m
t r ɛ m ɔ l aː r ɛ	t r ɛ m ʊ l aː r ɛ
k ʊ n aː r ɛ	k ʊ n ɛ aː r ɛ
f ɔ l oː s ʊ m	f ɔ l j oː s ʊ m
s a n j ʊ m	s a n ɪ ɛ m
d eː r k ɪ ŋ g ɛ r ɛ	d ɪ s k ɪ ŋ g ɛ r ɛ
p uː lː uː l aː r ɛ	p ʊ lː ʊ l aː r ɛ
g ʊ k ʊ n d ɪ t eː t ɛ m	j uː k ʊ n d ɪ t aː t ɛ m
l ʊ k ɛ lː ʊ m	l ɔ k ɛ lː ʊ m
m ɛ s t ʊ m	m aɪ s t ʊ m
ɛ g s ɛ m p lː aː r ɛ	ɛ k s ɛ m p l a r
p l uː m b ɛ ʊ m	p l ʊ m b ɛu m
s ɔ n t ɛ m	s ɔ n t ɛ m
t ɛ m p ɔ r aː l ɛ	t ɛ m p ɔ r aː l ɛ m
t uː b eː r ɔ s ʊ m	t uː b ɛ r oː s ʊ m
g l a l a m	g l aː r ɛ a m
r ɪ t ɔ r k ɛ r ɛ	r ɛ t ɔ r kʷ eː r ɛ
l ʊ k t aː r ɛ	l ʊ k t aː r iː
d eː b ɪ lː ɪ t aː r ɛ	d eː b ɪ l ɪ t aː r ɛ
a b a t j ɪ a l ɛ m	a bː aː t j aː l ɛ m
s t ʊ l t ʊ m	s t ʊ l t ʊ m
k ɛ r kʰ aː r ɛ	k ɪ r k aː r ɛ
k oː m b a m	k ʊ m b a m
a k k eː d ɛ r ɛ	a kː eː d ɛ r ɛ
n aʊ s ɪ aː b ʊ n d ʊ m	n aʊ s ɛ aː b ʊ n d ʊ m
b a p t ɪ s t ɛ r j ʊ m	b a p t ɪ s t eː r j ʊ m
l ʊ s k ʊ m	l ʊ s k ʊ m
w ɛ s t r uː k ʊ m	s t r uː tʰ j oː n ɛ m
s ɪ l ɪ k ɛ m	s ɪ l ɪ k ɛ m
l uː m ɪ n aː r ɛ	l uː m ɪ n aː r ɛ
b l a t eː r aː r ɛ	b l a t ɛ r aː r ɛ
uː ŋ m b r oː s ʊ m	ʊ m b r oː s ʊ m
p ɛ r ɪ k uː sː ɔ r ɛ	p ɛ r k ʊ sː oː r ɛ m
m ɛ r ɪ d j ɪ ɔ n a l ɛ	m ɛ r iː d j oː n aː l ɛ m
d j aː b ʊ l ʊ m	d j a b ɔ l ʊ m
k ɛ r oː s ʊ m	k eː r oː s ʊ m
w ɪ r t ʊ m	w iː k t ʊ m
r ɛ s k iː n d ɛ r ɛ	r ɛ s k ɪ n d ɛ r ɛ
f ɪ r ɛ m	f ɪ ɛ r iː
d ʊ ɪ k j ɛ n t oː s	d ʊ k ɛ n t oː s
s a l ɪ k ɛ t ʊ m	s a l ɪ k eː t ʊ m
p r ʊ p eː lː ɪ r ɛ	p r oː p ɛ lː ɛ r ɛ
w eː n ɛ t ʊ ŋ a a m	w ɛ n ɛ t ʊ m
s t r j a m	s t r j a m
g ɛ r uː n d j ʊ m	g ɛ r ʊ n d j ʊ m
r ɪ l uː k ɪ r ɛ	r ɛ l uː k eː r ɛ
h ɛ r eː m ʊ m	ɛ r eː m ʊ m
d eː f ʊ r m ɪ t eː t ɛ m	d eː f oː r m ɪ t aː t ɛ m
w ʊ g aː r ɛ	w ɔ k aː r ɛ
ɪ w ʊ m	iː w ʊ m
m a g ɛ s t aː t ɛ m	m a j ɛ s t aː t ɛ m
k ɔ n s ɔ r t ɛ m	k oː n s ɔ r t ɛ m
h t aː t ɛ m	t a t ɛ m
w ɛ r eː k ʊ n d j a m	w ɛ r eː k ʊ n d j a m
