p ɪ s t aː r ɛ	p ɪ s t aː r ɛ
ɪ m b ɛ k ɪ lː ɪ t aː t ɛ m	ɪ m b eː k ɪ lː ɪ t aː t ɛ m
p ɛ r s ɛ k uː t oː r ɛ m	p ɛ r s ɛ k uː t oː r ɛ m
t ɔ s ɛ r ɛ m	t ʊ sː iː r ɛ
t r g ʊ w j pʰ t aː r f a t oː r ɛ	t r j ʊ m pʰ aː t oː r ɛ m
d eː p aː r t ɪ r ɛ m	d eː p a r t iː r ɛ
b a r d ʊ m	b a r d ʊ m
ɪ n d ɛ f ɪ n ɪ t ʊ m	ɪ n d eː f iː n iː t ʊ m
s t iː r p ɛ m	s t ɪ r p ɛ m
s a t iː r ʊ m	s a t y r ʊ m
a fː eː ɪ k t j oː n ɛ m	a fː ɛ k t j oː n ɛ m
g ɛ n ɛ r ʊ m	g ɛ n ʊ s
r ɛ f r ɪ g ɛ r aː t j oː n ɛ m	r ɛ f r iː g ɛ r aː t j oː n ɛ m
f r ɪ ɪ g ɪ d aː t ɛ m	f r iː g ɪ d ɪ t aː t ɛ m
ɛ k s ɛ m p l aː r ɛ	ɛ k s ɛ m p l aː r ɛ m
s ɛ r ɛ n aː ɛ	s ɛ r eː n aː r ɛ
p r ɔ p r ɪ eː t aː t ɛ m	p r oː p r ɪ ɛ t aː t ɛ m
d eː s ɛ k aː t j oː n ɛ m	d eː s ɪ kː aː t j oː n ɛ m
r ɛ p r ɛ h ɛ n s j oː n ɛ m	r ɛ p r ɛ h ɛ n s j oː n ɛ m
p a l ʊ m	p aː l ʊ m
p ɔ s aː r ɛ	p aʊ s aː r ɛ
a r kː aː r ʊ m	a r k w aː r j ʊ m
s ʊ b ɛ w eː n ɪ r ɛ m	s ʊ p ɛ r w ɛ n iː r ɛ
m uː s k ʊ l oː s ʊ m	m uː s k ʊ l oː s ʊ m
ɔ rː ɪ iː	h ɔ rː eː r ɛ
b a r b aː t ʊ m	b a r b aː t ʊ m
ɪ s t ɪ t uː ɪ r ɛ	iː n s t ɪ t ʊ ɛ r ɛ
k eː d ɛ r ɛ	k eː d ɛ r ɛ
m ɛ r ʊ m	m ɛ r ʊ m
l ɪ b r aː t j oː n ɛ m	l iː b r aː t j oː n ɛ m
k l aː r ɪ t aː t ɛ m	k l aː r ɪ t aː t ɛ m
w ɪ s ɛ r a m	w ɪ s k ʊ s
t r aː n s f ɔ r m aː t j oː n ɛ m	t r aː n s f oː r m aː t j oː n ɛ m
a r b iː t r aː r ɛ	a r b ɪ t r aː r iː
t a l p y a m	t a l p a m
l ɪ m oː s ʊ m	l iː m oː s ʊ m
ɔ m ɛ n t ʊ m	oː m ɛ n t ʊ m
a lː uː k k ɛ m	h a lː ʊ m
b ɛ n ɛ d ɪ k t j oː n ɛ m	b ɛ n ɛ d ɪ k t j oː n ɛ m
s uː p ɛ r aː r ɛ	s ʊ p ɛ r aː r ɛ
s k aː n d a m	s k a n d ʊ l a m
tʰ j a m	tʰ iː a m
m a n iː f ɔ s t aː r ɛ m	m a n ɪ f ɛ s t aː r ɛ
t ɔ s oː n ɛ m	t oː n s j oː n ɛ m
r ɛ d iː t ʊ m	r ɛ d ɪ t ʊ m
n uː b ɪ l oː s ʊ m	n uː b ɪ l oː s ʊ m
p ɛ n ʊ r j a m	p eː n uː r j a m
s eː p ʊ l k r ʊ m	s ɛ p ʊ l k r ʊ m
s aː ŋ gʷ ɪ n oː s ʊ m	s a ŋ gʷ ɪ n oː s ʊ m
w eː k iː n ɪ t aː t ɛ m	w iː k iː n ɪ t aː t ɛ m
ɛ k s iː t ʊ m	ɛ k s ɪ t ʊ m
p r oː n ʊ m	p r oː n ʊ m
k r uː ɛ n t ʊ m	k r ʊ ɛ n t ʊ m
k a l iː g ɪ n oː s ʊ m	k aː l iː g ɪ n oː s ʊ m
k aː k t ɪ w ʊ m	k a p t iː w ʊ m
a lː k oː n ʊ m	a l k y ɔ n ɛ m
ʊ m uː s ʊ m	h ʊ m ʊ m
r ɪ t ʊ m	r iː t ʊ m
r ɔ b ɪ g ɪ n ɛ m	r oː b iː g ɪ n ɛ m
r eː w ɛ d aː r ɛ	r ɛ w ɪ d eː r ɛ
eː k s p ɛ k t aː t j oː n ɛ m	ɛ k sː p ɛ k t aː t j oː n ɛ m
ɛ k t j ɛ lː ɛ n t j a m	ɛ k s k ɛ lː ɛ n t j a m
kʷ ɛ s t j ɔ n aː r j ʊ m	kʷ aɪ s t j oː n aː r j ʊ m
a lː ɔ k uː t j oː n ɛ m	a lː ɔ k uː t j oː n ɛ m
r ɛ k iː t aː t j oː n ɛ m	r ɛ k ɪ t aː t j oː n ɛ m
ɛ rː aː pʰ ɛ m	ɛ rː aː r ɛ
s t aː t ʊ m	s t a t ɪ k ʊ m
a ŋ ŋ ʊ s t aː r ɛ	a ŋ g ʊ s t aː r ɛ
s ɔ kː ɔ rː eː r ɛ	s ʊ kː ʊ rː ɛ r ɛ
d uː r aː k ɪ n ɛu m	d uː r a k ɪ n ʊ m
a b d oː m ɛ n	a b d oː m ɛ n
k ɔ l ʊ b r ɪ n ʊ m	k ɔ l ʊ b r iː n ʊ m
a pː ʊ m	a p j ʊ m
s uː b ɔ r n aː r ɛ	s ʊ b oː r n aː r ɛ
s t oː p a m	s t ʊ pː a m
a n t iː s t ɛ r ɛ m	a n t ɪ s t ɪ t ɛ m
k ɪ k ɪ d aː t ɛ m	a k ɪ d ɪ t aː t ɛ m
m ɔ r d ɛ r ɛ	m ɔ r d eː r ɛ
k ɛ h ɔ n ɔ p eː ʊ m	k oː n oː p eː ʊ m
d ɔ t aː t j ʊ n ɛ m	d oː t aː t j oː n ɛ m
k ɔ l uː m ɛ lː a m	k ɔ l ʊ m ɛ lː a m
g a n iː r ɛ	g a nː iː r ɛ
k a n d ɪ d ʊ m	k a n d ɪ d ʊ m
ɛ k s p uː r g aː r ɛ	ɛ k s p ʊ r g aː r ɛ
ɪ m p ɛ r j ʊ m	ɪ m p ɛ r j ʊ m
a b ɪ ʊ r aː r ɛ	a b ɪ uː r aː r ɛ
d ɛ s t r uː t j oː n j oː n ɛ m	d eː s t r ʊ k t j oː n ɛ m
l ɪ ɛ ŋ g uː l a m	l ɪ ŋ g ʊ l a m
eː fː ɛ k t aː ɛ r ɛ	ɛ fː ɪ k ɛ r ɛ
p ɔ r t aː b ɪ r ɛ	p ɔ r t aː b ɪ l ɛ m
f r a ŋ g ɛ r ɛ	f r a ŋ g ɛ r ɛ
j s ɛ f ɪ r ʊ m	z ɛ pʰ y r ʊ m
ɪ n ɪ kʷ ʊ m	ɪ n iː kʷ ʊ m
ʊ n k iː n ʊ m	ʊ ŋ k iː n ʊ m
ɔ b l iː w j oː n ɛ	ɔ b l iː w j oː n ɛ m
m ɛ r d a m	m ɛ r d a m
d eː f l uː ɪ r ɛ	d eː f l ʊ ɛ r ɛ
p r ɛ s eː n t ɪ r ɛ	p r aɪ s ɛ n t iː r ɛ
p ʊ pː a m	p ʊ pː ɛ m
ɪ n b ɛ r n aː l ɛ	h iː b ɛ r n aː l ɛ m
k ɔ n k a m	k ɔ ŋ kʰ a m
l ɔ n r d ʊ m	l uː r ɪ d ʊ m
b ʊ rː a m	b ʊ rː a m
a s t ɔ r ɛ m	a s t ʊ r ɛ m
n ɪ b ɛ ʊ m	n ɪ w ɛu m
m ɛ m b r aː n oː s ʊ m	m ɛ m b r aː n ɛu m
ɪ n f aː n d ʊ m	iː n f a n d ʊ m
p lː aː sː ʊ m aː r ɛ	p l a s m aː r ɛ
ɛ k s k l ʊ ɛ r ɛ	ɛ k s k l uː d ɛ r ɛ
m a kʰ iː n aː r ɛ	m aː kʰ ɪ n aː r iː
s a p j ɛ	s a p ɪ d ʊ m
d ɪ w ɪ n aː r ɛ	d iː w iː n aː r ɛ
k a n t aː r ɛ	k a n t aː r ɛ
s uː d aː r j ʊ m	s uː d aː r j ʊ m
a r g uː t j a m	a r g uː t j a m
k ɔ r j a n d ʊ r ʊ m	k ɔ r j a n d r ʊ m
l ɔ k a m	l uː t ɛu m
a k ɛ sː j oː m	a kː ɛ sː j oː n ɛ m
s k aː b j a m	s k a b ɪ ɛ m
t iː s uː k ɪ r a m	t oː n s oː r j ʊ m
s t ʊ p r ʊ m	s t ʊ p r ʊ m
f uː r iː b ʊ n d ʊ m	f ʊ r ɪ b ʊ n d ʊ m
m uː n iː r ɛ	m ɔ n eː r ɛ
s k a r aː b ɛ j ʊ m	s k a r a b aɪ ʊ m
m ɛ t ɛ r ɛ m	m ɪ tː ɛ r ɛ
a t r a m ɛ n t ʊ m	aː t r aː m ɛ n t ʊ m
f ɪ b ʊ l a m	f iː b ʊ l a m
s eː w ɛ r ʊ m	s ɛ w eː r ʊ m
ʊ s ɪ t aː r ɛ	uː s ɪ t aː r iː
w ɛ t a m	w ɪ tː a m
aʊ g ʊ r aː r ɛ	aʊ g ʊ r aː r ɛ
s ɛ n s aː t j oː n ɛ m	s eː n s aː t j oː n ɛ m
a m ɛ r ɪ t aː r ɛ	m ɛ r iː d j aː r ɛ
g r aː b aː t ʊ m	g r a b aː t ʊ m
k a t ɛ l a m	k a t ɛ lː a m
a n g ɛ l ɪ k ʊ m	a ŋ g ɛ l ɪ k ʊ m
p eː r a m	p eː r a m
k ɔ n t ɛ s t aː r ɛ	k ɔ n t ɛ s t aː r iː
d ɔ l oː s ʊ m	d ɔ l oː s ʊ m
t uː	t uː
f ɛ d ʊ m	f ɔ ɪ d ʊ s
ɔ p uː l ɛ n t j a m	ɔ p ʊ l ɛ n t j a m
k ɪ n t uː r a m	k ɪ ŋ k t uː r a m
f r aɪ kʷ ɛ n t ɛ m	f r ɛ kʷ ɛ n t ɛ m
g ɛ n t ɪ l ʊ m	g ɛ n t iː l ɛ m
b ʊ k s ʊ m	b ʊ k s ʊ m
s a t ʊ r aː r ɛ	s a t ʊ r aː r ɛ
l uː k r ʊ m	l ʊ k r ʊ m
m a ŋ n ɪ t uː d ɛ m	m a ŋ n ɪ t uː d ɪ n ɛ m
k ɔ m p r aː t oː r ɛ	k ɔ m p a r aː t oː r ɛ m
a n aː l	aː n aː l ɛ m
a d w ɛ r t ɪ r ɛ	a d w ɛ r t ɛ r ɛ
ɔ b s ɛ k j oː s ʊ m	ɔ b s ɛ kʷ j oː s ʊ m
k ɪ s t ɛ r n a m	k ɪ s t ɛ r n a m
a d ʊ m b r aː r ɛ	a d ʊ m b r aː r ɛ
kʷ ɔ t iː d j aː n ʊ m	kʷ ɔ t iː d j aː n ʊ m
t ɔ r s ʊ m	tʰ y r s ʊ m
k ɔ n t ɛ n t j oː n ɛ m	k ɔ n t ɛ n t j oː n ɛ m
ɪ n t ɛ l ɛ g ɪ r ɛ	ɪ n t ɛ lː ɛ g ɛ r ɛ
m ɛ n oː r ɛ	m ɪ n oː r ɛ m
p r ɛ s t aː r ɛ	p r aɪ s t aː r ɛ
a n uː m n k aː r ɛ	a nː uː n t j aː r ɛ
d eː t r a h ɛ r ɛ	d eː t r a h ɛ r ɛ
ɪ m p aː r t ɪ r ɛ	ɪ m p a r t iː r ɛ
ɛ kː s k oː r j aː r ɛ	ɛ k s k ɔ r j aː r ɛ
a k t ʊ aː l ɛ	a k t w aː l ɛ m
p r ɛ w ɛ r ɛ	p r aɪ w ɪ d eː r ɛ
f aɪ rː aː r ʊ m	f ɛ rː aː r j ʊ m
p a w ʊ m r ɛ	p a w oː r ɛ m
r uː gː s ɪ n ɔ r ɛ m	l ʊ s k ɪ n j a m
g a l ɛ n a m	g a l eː n a m
k ɔ n j uː g aː t j oː n ɛ m	k ɔ n j ʊ g aː t j oː n ɛ m
w a j iː r ɛ m	w aː g iː r ɛ
l a t r aː r ɛ	l a t r oː n ɛ m
k a p ɛ lː ʊ m	k a p ɪ lː ʊ m
m ɪ l a m	m iː lː j a
eː k s p l aː n aː r ɛ	ɛ k s p l aː n aː r ɛ
ʊ n ɪ f oː r m ɛ m	uː n ɪ f oː r m ɛ m
n ɪ m b ʊ m	n ɪ m b ʊ m
a r aː n aː t aː	a r aː n ɛ a m
m ɔ n t a n oː s ʊ m	m ɔ n t aː n j oː s ʊ m
t uː n d eː r ɛ	t ʊ n d ɛ r ɛ
k a n s aː r ɛ	k a m p s aː r ɛ
a m aː n ʊ ɛ n ɛ m	aː m a n ʊ eː n s ɛ m
t r aː n s ɪ r ɛ	t r aː n s iː r ɛ
a r b oː r ɛ t ʊ m	a r b ɔ r eː t ʊ m
k a n d ɛ l aː b r ʊ m	k a n d eː l aː b r ʊ m
r uː g ɔ s ʊ m	r uː g oː s ʊ m
ɔ b w j oː m	ɔ b w j ʊ m
f ɪ m ʊ m	f ɪ m ʊ m
ɔ r ɪ ɛ n t ɛ m	ɔ r ɪ ɛ n t ɛ m
m a k ɛ lː aː j ʊ m	m a k ɛ lː aː r j ʊ m
k r ɛ aː t ʊ r a m	k r ɛ aː t uː r a m
k uː k ɪ n aː r ɛ	k ɔ kʷ iː n aː r ɛ
j uː s t ɪ f ɪ k aː t j oː n ɛ m	j uː s t ɪ f ɪ k aː t j oː n ɛ m
s a l ʊ t aː r ɛ	s a l uː t aː r ɛ m
r a d iː k j ʊ m	r aː d iː k ʊ l a m
k ɔ n w ɪ t j ʊ m	k ɔ n w iː k j ʊ m
a sː ɪ s ʊ m	a sː ɛ sː ʊ m
aː n t ɛ m	ɛ n s
k ɪ r k ʊ n d aː r ɛ m	k ɪ r k ʊ m d a r ɛ
d ʊ l k ɛ t uː pʰ ɪ d ɪ n ɛ m	d ʊ l k ɪ t uː d ɪ n ɛ m
k ɔ n s ʊ m aː t j oː n ɛ m	k oː n s ʊ mː aː t j oː n ɛ m
r uː b r ɪ k a m	r ʊ b r iː k a m
p ʊ l p m ʊ m	p ɔ l y p ʊ m
l uː k ɛ r n a m	l ʊ k ɛ r n a m
r ɪ g ʊ r oː s ʊ m	r ɪ g ɔ r ɔ s ʊ m
k ɔ k ɪ n ɪ l a m	k ɔ kː ɪ n a m
s a l s a m	s a l s a m
l a b ɔ r aː t oː r j ʊ m	l a b oː r aː t oː r j ʊ m
t ɪ t ʊ l aː r ɛ	t ɪ t ʊ l aː r ɛ m
a nː aɪ l ʊ m	a nː ɪ k ʊ l ʊ m
ɛ k s ɔ r t aː t j oː n ɛ m	ɛ k s h ɔ r t aː t j oː n ɛ m
r ɔ n k aː r ɛ	r h ɔ ŋ kʰ aː r ɛ
n ɪ ɛ m iː n	n eː m ɪ n ɛ m
eː l uː k uː b r aː r ɛ	eː l uː k ʊ b r aː r ɛ
g lː aː n d ʊ l oː s ʊ m	g l a n d ʊ l oː s ʊ m
k ɔ r b ɛ l j m	k ɔ r b ɛ m
l uː t ʊ m	l uː k t ʊ m
s a t iː r ɪ k ʊ m	s a t ɪ r ɪ k ʊ m
t r ɛ m oː r ɛ	t r ɛ m oː r ɛ m
p a r s ɪ m oː n j a m	p a r k ɪ m oː n j a m
kʷ a d r uː p l aː r ɛ	kʷ a d r ʊ p l aː r ɛ
k ɔ n d ɪ ŋ n ʊ m	k ɔ n d ɪ ŋ n ʊ m
m ɛ t iː k ʊ l oː s ʊ m	m ɛ t ɪ k ʊ l oː s ʊ m
s ʊ l k aː r ɛ	s ʊ l k aː r ɛ
s ʊ p ɛ r ɛ p ʊ n ɛ r ɛ m	s ʊ p ɛ r p oː n ɛ r ɛ
d eː r iː s oː r j ʊ m	d eː r iː s oː r j ʊ m
s ɪ l w ɛ s t r ɛ m	s ɪ l w ɛ s t r ɛ m
l ɛ b p ɪ d ɛ m	l a p ɪ d ɛ m
a d uː l aː t oː r ɛ	a d uː l aː t oː r ɛ m
r ɛ w ɛ r ɛ n t ɛ m	r ɛ w ɛ r ɛ n t ɛ m
r ɛ m aː n ɛ r ɛ	r ɛ m a n eː r ɛ
k ɔ l iː r j ʊ m	k ɔ lː y r j ʊ m
aɪ k s p oː r ɛ r ɛ	ɛ k s p oː n ɛ r ɛ
p a k t ʊ m	p a k t ʊ m
p r ɔ w oː k aː r ɛ	p r oː w ɔ k aː r ɛ
a sː ɪ s t ɛ r ɛ	a sː ɪ s t ɛ r ɛ
s ʊ m iː n ɪ s t r aː r ɛ	s ʊ b m ɪ n ɪ s t r aː r ɛ
t ɛ m p ɛ r j iː ɛ	t ɛ m p ɛ r ɪ ɛ m
f ɔ k aː r j aː	f ɔ k aː r j ʊ m
k ɔ l oː n j aː ɛ	k ɔ l oː n j a m
h uː n g ɛ r ɛ	ʊ ŋ g ɛ r ɛ
d eː k iː m aː t j ʊ n ɛ m	d ɛ k ɪ m aː t j oː n ɛ m
eː k s aʊ r ɪ r ɛ	ɛ k s h aʊ r iː r ɛ
d eː t ɪ n eː r ɛ	d eː t ɪ n eː r ɛ
l a k t aː r ɛ	l a k t aː r ɛ
d ɪ s t iː n k t ʊ m	d ɪ s t ɪ ŋ k t ʊ m
k ɪ d a m	k iː d a m
a d uː l t eː r ɪ n ʊ m	a d ʊ l t ɛ r iː n ʊ m
g ɛ m iː n aː t j oː n ɛ m	g ɛ m ɪ n aː t j oː n ɛ m
ɪ m p j ʊ m	ɪ m p j ʊ m
p ɔ p ɛ r ʊ m	p aʊ p ɛ r ɛ m
k a n iː k ʊ l a m	k a n iː k ʊ l a m
n aː k r ɛ t ɛ r ɛ	n ɪ g r eː s k ɛ r ɛ
d a ŋ n aː r ɛ	d a m n aː r ɛ
a t iː ŋ g ɛ r ɛ	a tː ɪ ŋ g ɛ r ɛ
t ɛ rː ɛ m oː t ʊ m	t ɛ rː aɪ m ɔ t ʊ m
k eː k ʊ m	k aɪ k ʊ m
a k t ʊ m	aː k t ʊ m
s k r uː t aː r ɛ	s k r uː t aː r iː
s ɛ k ɪ r m ɛ r ɛ	s eː k ɛ r n ɛ r ɛ
k a l eː r ɛ	k a l eː r ɛ
m a pː a m	m a pː a m
d ɛ k s t r ʊ m	d ɛ k s t r ʊ m
j ɛ l aː r ɛ m	g ɛ l aː r ɛ
w ɔ k iː f eː r aː r ɛ	w oː k ɪ f ɛ r aː r iː
m ɔ w ɪ m ɛ n t ʊ m	m oː w ɪ m ɛ n t ʊ m
k a n d ɔ r ɛ	k a n d oː r ɛ m
ɪ n f r ɛ n aː r ɛ	iː n f r eː n aː r ɛ
l ʊ n t r a m	l ʊ t r a m
p r ɪ m ʊ g eː n ɪ t ʊ m	p r iː m oː g ɛ n ɪ t ʊ m
k ɔ aː b ɪ t aː r ɛ	k ɔ h a b ɪ t aː r ɛ
k ɔ n t aː m ɪ n aː t j oː n ɛ m	k ɔ n t aː m ɪ n aː t j oː n ɛ m
b ɔ m b aː r d a m	b ɔ m b a r d a m
a r k ɛ t ɪ p ʊ m	a r kʰ ɛ t y p ʊ m
m ɛ r ɛ t r ɪ kʷ j ʊ m	m ɛ r ɛ t r iː k j ʊ m
k ʊ l oː n ʊ m	k ɔ l oː n ʊ m
j a s p ɪ d ɛ m	j a s p ɪ d ɛ m
p a t ɪ k r ɛ	p a t iː
ɪ n k ɛ n d j a r j ʊ m	ɪ ŋ k ɛ n d j aː r j ʊ m
f r aː s k ʊ m	f l a s k oː n ɛ m
f ɛ t ʊ m	f ɪ l ɪ k t ʊ m
ʊ m ɪ w j aː t j oː n ɛ m	h ʊ m ɪ l j aː t j oː n ɛ m
w ɪ ʊ m	w ɔ k ɪ t ʊ m
t ɪ p ʊ l a m	t ɪ pː ʊ l a m
d eː n ʊ n ʊ t j aː t j oː n	d eː n ʊ n t j aː t j oː n ɛ m
s p ɛ t j ɛ m	s p ɛ k ɪ ɛ m
a g r ʊ m	a g r ʊ m
j ɛ t ʊ m	j a k t ʊ m
w ɪ l aː r ɛ	w ɛ l a m
k ʊ r s ʊ m	k ʊ r s ʊ m
a kː ɛ n t ʊ m	a kː ɛ n t ʊ m
s uː k ʊ l ɛ n t ʊ m	s ʊ kː ʊ l ɛ n t ʊ m
k ɔ r w ɪ n ʊ m	k ɔ r w iː n ʊ m
s a kʷ uː d ɛ r ɛ	s ʊ kː ʊ t ɛ r ɛ
m ɛ d iː t aː b t w n t ʊ m	m ɛ d ɪ t aː b ʊ n d ʊ m
s ʊ ɛ a m	s ʊ ɛ m
f ɔ l ɪ r ɛ	f ʊ l g ʊ r
ɪ n t ɛ ɪ t ɛ	ɪ n t ʊ eː r iː
t r aː n s ɪ t ʊ m	t r aː n s ɪ t ʊ m
p r ɛ s k r iː b ɛ r ɛ m	p r aɪ s k r iː b ɛ r ɛ
l a b ʊ r aː r ɛ	l a b oː r aː r ɛ
b ʊ k iː n	b uː k ɪ n a m
a d uː l t eː r aː r ɛ	a d ʊ l t ɛ r aː r ɛ
l ɛ ɔ p aː d ʊ m	l ɛ ɔ p a r d ʊ m
ɔ p uː l ɛ n t ʊ m	ɔ p ʊ l ɛ n t ʊ m
k ɔ n f ɛ s aː r ɛ	k oː n f ɪ t eː r iː
k ɔ s t uː m r ɛ m	k oː n s ʊ eː t uː d ɪ n ɛ m
m ɔ r s ʊ m	m ɔ r s ʊ m
k a n t oː r ɛ	k a n t oː r ɛ m
z ɪ d iː w aː n j a m	z iː zː a n j a
aɪ ʊ m	ɛu m
d a n oː s ʊ m	d a m n oː s ʊ m
k aʊ t ɛ l a m	k aʊ t eː l a m
m ɪ r t ʊ m	m y r t ʊ m
s k r uː t ɪ n j ʊ r ɛ	s k r uː t ɪ n j ʊ m
d ɪ s t ɛ n d ɛ r ɛ	d ɪ s t ɛ n d ɛ r ɛ
s p ɛ k t aː k ʊ l ʊ m	s p ɛ k t aː k ʊ l ʊ m
t r ʊ n k aː r ɛ	t r ʊ ŋ k aː r ɛ
k ɔ h p eː r aː t j oː n ɛ m	k ɔː p ɛ r aː t j oː n ɛ m
a sː ɪ k iː r n aː r ɛ	a sː ɪ ŋ n aː r ɛ
ɪ t uː ʊ ɪ n ɛ m	t uː d ɪ n ɛ m
r ɪ ɛ f k ɛ r ɛ	r ɛ f ɪ k ɛ r ɛ
a t ɛ n t ʊ m	a tː ɛ n t ʊ m
g l aː d j ʊ m	g l a d j ʊ m
p eː n s ɪ l ɛ	p eː n s ɪ l ɛ m
a n uː l aː r ɛ	aː n ʊ l aː r ɛ m
ɪ n k ɛ t aː r ɛ	ɪ ŋ k ɛ p t aː r ɛ
d ɪ s ɛ m ɪ n aː r ɛ	d ɪ sː eː m ɪ n aː r ɛ
w ɪ ɛ ɛ m ɛ k n t ɛ m	w ɛ h ɛ m ɛ n t ɛ m
ɪ n t ɛ r p ʊ n d ɪ n ɛu r ɛ m	ɪ n t ɛ r p ʊ ŋ g ɛ r ɛ
m oː l ɪ n aː r ʊ m	m ɔ l iː n aː r j ʊ m
a lː g ɪ m	a l ɪ kʷ ɛ m
ʊ r ʊ m	uː r ʊ m
kʷ a l iː f iː k aː r ɛ	kʷ aː l ɪ f ɪ k aː r ɛ
g ɪ ɛ a ʊ l a m	z iː z y pʰ ʊ m
k ɔ n t r n aː w ɛ n ɪ r ɛ	k ɔ n t r aː w ɛ n iː r ɛ
a r b oː r ɛ ʊ m	a r b ɔ r ɛu m
n a t iː w ɪ t aː t ɛ m	n aː t iː w ɪ t aː t ɛ m
ɔ r n aː t ʊ m	oː r n aː t ʊ m
s p iː n aː l ɛ	s p iː n aː l ɛ m
k uː r aː r ɛ	k uː r aː r ɛ
ɪ lː ɛ g aː l ɛ	ɪ lː eː g aː l ɛ m
ɛ rː eː ɪ aː r ɛ m	ɛ rː oː r ɛ m
k a s t r aː t ʊ m	k a s t r aː t ʊ m
g r aː w ɪ d ʊ m	g r a w ɪ d ʊ m
s ɛ p t ɛ n t r j oː n ɛ m	s ɛ p t ɛ n t r j oː n ɛ m
k uː r ɛ t ʊ r a m	k uː r aː t uː r a m
p r uː d ɛ n t j a m	p r uː d ɛ n t j a m
l ɔ t ʊ m	l ʊ t ʊ m
m ɛ r g ɛ r ɛ	m ɛ r g ɛ r ɛ
h t aː t ɛ m	t a t ɛ m
s a n j ɛ m	s a n ɪ ɛ m
m ɔ n t oː s ʊ m	m ɔ n t ʊ oː s ʊ m
f ɪ s k ʊ m	f ɪ s k ʊ m
r ɛ l iː kʷ j a m	r eː l ɪ kʷ j aː s
a lː ɛ t aː r r a m	a l aʊ d a m
f ɛ l iː k ɪ t ɛ t ɛ m	f eː l iː k ɪ t aː t ɛ m
ɔ b ɪ ɛ k t ɪ w ʊ m	ɔ b j ɛ k t iː w ʊ m
aʊ k s iː l j aː r ɛ	aʊ k s ɪ l j aː r ɛ m
t oː r j ʊ m	t oː r j ʊ m
ɪ n w iː t aː t j oː n ɛ m	ɪ n w ɪ t aː t j oː n ɛ m
k s t ɔ r k ɛ r ɛ	ɛ k s t ɔ r kʷ eː r ɛ
k r eː s p aː r ɛ	k r ɪ s p aː r ɛ
m ɪ l iː t aː r ɛ	m iː l ɪ t aː r ɛ
k ʊ n aː r ɛ	k ʊ n ɛ aː r ɛ
k ɔ l ɛ m	k aʊ l ɛ m
uː ŋ m b r oː s ʊ m	ʊ m b r oː s ʊ m
t r aː n s f uː g a m	t r aː n s f ʊ g a m
a n t ɛ p oː n ɛ r ɛ	a n t ɛ p oː n ɛ r ɛ
ɪ n t l ɛ rː ʊ m p ɛ r ɛ	ɪ n t ɛ rː ʊ m p ɛ r ɛ
f ɪ m b r j aː t ʊ m	f ɪ m b r j aː t ʊ m
m ɔ s t r ʊ s ʊ m	m oː n s t r ʊ oː s ʊ m
b r aː k aː	b r aː k a m
m ɛ t a m	m eː t a m
r ɛ l ɛ g aː r ɛ	r ɛ l ɛ g ɛ r ɛ
k ɛ s p eː t ɛ m	k aɪ s p ɪ t ɛ m
aɪ n s ɛ m	eː n s ɛ m
d ɔ n ɪ s j aː k ʊ m	d ɪ ɔ n y s j a k ʊ m
d ɛ rː ʊ iː	d iː r ʊ ɛ r ɛ
k ɔ n t r ɪ t ʊ m	k ɔ n t r iː t ʊ m
t r aː n s m ɪ g r aː r ɛ	t r aː n s m ɪ g r aː r ɛ
w a s t ɛ lː ʊ m	w aː s k ɛ lː ʊ m
aʊ d ɪ t ʊ m	aʊ d iː t ʊ m
g uː b aː s	j ʊ b a m
p ɛ s k aː r ʊ m	p ɪ s k aː r j ʊ m
eː k s p l aː n aː t j oː n ɛ m	ɛ k s p l aː n aː t j oː n ɛ m
a dː ɔ r m iː r ɛ	a dː ɔ r m iː r ɛ
a g ɪ t aː r ɛ	a g ɪ t aː r ɛ
s ɔ m aː r j ʊ m	s ʊ mː aː r j ʊ m
k r ɪ t ɛ r j ʊ m	k r ɪ t ɛ r ɪ ɔ n
b ɛ nː j ʊ m	b ɪ ɛ nː j ʊ m
k r iː b ʊ m	k r iː b r ʊ m
t r aː d ɛ r ɛ	t r aː d ɛ r ɛ
s t aː p ɛ t ɛ m	s t a p ɛ d ɛ m
k s k uː s aː t j oː n ɛ	ɛ k s k uː s aː t j oː n ɛ m
l a b oː r ʊ m	l a b oː r ɛ m
a k j l j aː s	a k ɪ ɛ m
s p ɛ k ʊ l aː t oː r ɛ	s p ɛ k ʊ l aː t oː r ɛ m
kʷ a d r aː r ɛ	kʷ aː d r aː r ɛ
d eː w ɔ l w ɛ r ɛ	d eː w ɔ l w ɛ r ɛ
a ɪ ɛ ɔ l t ɛ r ʊ m	a d ʊ l t ɛ r ʊ m
l a p iː d aː t j ʊ n ɛ m	l a p ɪ d aː t j oː n ɛ m
ɔ fː ɪ k ɪ n a m	ɔ fː ɪ k iː n a m
p r ɛ m ɪ k j a m	p r iː m ɪ t j a m
m uː r a m	m ʊ r j a m
a r m ɪ g iː r ʊ m	a r m ɪ g ɛ r ʊ m
l eː w iː g aː r ɛ	l ɛ w ɪ g aː r ɛ
p r ɛ ɔ k ʊ p aː r ɛ	p r aɪ ɔ kː ʊ p aː r ɛ
l uː j ʊ m	l uː k j ʊ m
r eː t oː r ɛ	r h eː t ɔ r ɛ m
d eː l iː b eː r aː r ɛ	d eː l iː b ɛ r aː r ɛ
g r aː t j oː s ʊ m	g r aː t j oː s ʊ m
p r aɪ g ʊ s t aː r ɛ	p r aɪ g ʊ s t aː r ɛ
