l ɪ b ɪ d ʊ m	l ɪ b iː d ɪ n ɛ m
s t r ɛ n w ʊ m	s t r eː n ʊː m
p r ɛ s ɛ n t a t j ʊ n ɛ m	p r aɪ s ɛ n t aː t j oː n ɛ m
m ɪ k a m	m iː k a m
eː l uː k uː b r aː r ɛ	eː l uː k ʊ b r aː r ɛ
g ʊ n j ɪ p r ʊ m	j uː n ɪ p ɛ r ʊ m
a m a t ɔ r j ʊ m	a m aː t oː r j ʊ m
s ɪ d ɛ r ɛ ʊ m	s iː d ɛ r ɛu m
m a ŋ n ɛ s j ʊ m	m a ŋ n eː s j ʊ m
kʷ aː s a r ɛ	kʷ a sː aː r ɛ
w oː m ɪ k ʊ m	w ɔ m ɪ k ʊ m
s k ɔ r j a m	s k oː r j a m
s t ɪ w a r ɛ	s t iː p aː r ɛ
j uː d ɪ t j aː r j ʊ m	j uː d ɪ k j aː r j ʊ m
s a l t a t j ɛu n ɛ m	s a l t aː t j oː n ɛ m
k r ɛ d ɪ b ɪ l ɛ m	k r eː d ɪ b ɪ l ɛ m
n a d a d ɔ r ɛ	n a t aː t oː r ɛ m
k ɔ ŋ g uː r a t j ʊ n ɛ m	k ɔ n ɪ uː r aː t j oː n ɛ m
k ɔ n k a w ʊ m	k ɔ ŋ k a w ʊ m
b a k ʊ l ʊ m	b a k ʊ l ʊ m
m uː r aː l a m	m uː r aː l ɛ m
s a n t s a r ʊ m	z ɪ n z a l a m
p r oː k ɪ b ɪ r ɛ	p r ɔ h ɪ b eː r ɛ
k a r b ʊ n k ʊ l ʊ m	k a r b ʊ ŋ k ʊ l ʊ m
ɪ n k a n t aː r ɛ	ɪ ŋ k a n t aː r ɛ
t r ɛ t ʊ m	t r a k t ʊ m
p r ɛ t ɛ r ɪ r ɛ	p r aɪ t ɛ r iː r ɛ
ɪ n s ɛ r ɪ r ɛ	iː n s ɛ r ɛ r ɛ
a k k ɛ n t ʊ m	a kː ɛ n t ʊ m
uː s t ɔ l aː r ɛ	ʊ s t ʊ l aː r ɛ
n a l ɪ k a m	n a t ɛ m
m uː n ɪ k ɪ p j ʊ m	m uː n ɪ k ɪ p j ʊ m
d ɛ w ʊ l w ɛ r ɛ	d eː w ɔ l w ɛ r ɛ
a s ɪ s t ɛ r ɛ	a sː ɪ s t ɛ r ɛ
d ɛ s p l eː g aː r ɛ	d ɪ s p l ɪ k aː r ɛ
ɔ l eː r ɛ	ɔ l eː r ɛ
t r a n s ɪ t ʊ m	t r aː n s ɪ t ʊ m
k ɛ n ʊ m	k ɪ nː ʊ m
k a m n ʊ t ʊ m	k aː n uː t ʊ m
eː t ɔ l ɔ g j a m	eː tʰ ɔ l ɔ g j a m
ɪ m p r ɔ b ɪ t aː t ɛ m	ɪ m p r ɔ b ɪ t aː t ɛ m
s ʊ s p ɛ n s j oː n ɛ m	s ʊ s p eː n s j oː n ɛ m
n ʊ m ɛ r ʊ m	n ʊ m ɛ r ʊ m
r ɛ t a r d aː r ɛ	r ɛ t a r d aː r ɛ
ɪ m p ɛ t ʊ m	ɪ m p ɛ t ʊ m
p ɪ s t a r ɛ	p ɪ s t aː r ɛ
m a ŋ ɪ k a m	m a n ɪ k a m
s uː fː ɪ k j ɛ n t j a m	s ʊ fː ɪ k ɪ ɛ n t j a m
n a t a l ɪ t j ʊ m	n aː t aː l iː k j ʊ m
s uː b ɪ t ʊ m	s ʊ b ɪ t ʊ m
ɪ n k ʊ n k uː s ʊ m	ɪ ŋ k ɔ ŋ k ʊ sː ʊ m
w a k ɪ ʊ m	w a k iː w ʊ m
a b a l j ɪ ɛ n a t j ʊ n ɛ m	a b a l ɪ eː n aː t j oː n ɛ m
f ɔ r t ɪ t uː d ɪ n ɛ	f ɔ r t ɪ t uː d ɪ n ɛ m
n ɔ m ɪ n a t j oː n ɛ	n oː m ɪ n aː t j oː n ɛ m
w ɛ t iː m ɛ n t ʊ m	w ɛ s t iː m ɛ n t ʊ m
a n ɪ m ʊ m	a n ɪ m ʊ m
k ɛ r uː l ɛ ʊ m	k aɪ r ʊ l ɛu m
ɛ k s t ɔ r k ɛ r ɛ	ɛ k s t ɔ r kʷ eː r ɛ
s k r uː t aː r ɛ	s k r uː t aː r iː
s uː p ɛ r j oː r ɛ	s ʊ p ɛ r j oː r ɛ m
k ɔ r s ʊ m	k ɔ r s ʊ m
d ɪ s ɛ r t ʊ m	d ɪ s ɛ r t ʊ m
s w aː ɪ d ɪ r ɛ	s w aː d eː r ɛ
t r a n kʷ ɪ lː ʊ m	t r a ŋ kʷ ɪ lː ʊ m
l iː n k ɛ m	l y ŋ k ɛ m
k ɔ lː ɪ r j ʊ m	k ɔ lː y r j ʊ m
p ɔ r t aː r ɛ	p ɔ r t aː r ɛ
a s ɪ d w ʊ m	a sː ɪ d ʊː m
a s ɛ r ɪ r ɛ	a sː ɛ r ɛ r ɛ
k a r ɛ t ɛ r ɛ	k a r eː r ɛ
d ɪ s p a r t ɪ r ɛ	d ɪ s p a r t iː r ɛ
k ɔ m ɛ r k j ɪ a l ɛ	k ɔ mː ɛ r k j aː l ɛ m
r uː b ɪ ɪ m	r oː b iː g ɪ n ɛ m
f a s t ɪ d ɪ r ɛ	f a s t iː d iː r ɛ
p r ɛ ɔ kː uː p a t j ʊ n ɛ m	p r aɪ ɔ kː ʊ p aː t j oː n ɛ m
d ɛ f ɛ r ɪ r ɛ	d eː f ɛ rː ɛ
l ɪ b eː r a t j ʊ n ɛ m	l iː b ɛ r aː t j oː n ɛ m
k a n t ʊ n ɛ m	k a n t j oː n ɛ m
m a s k l ʊ m	m a s k ʊ l ʊ m
d ɔ r m ɪ t oː r j ʊ m	d ɔ r m iː t oː r j ʊ m
s t r ɛ m ɛ t ɛ r ɛ	t r ɛ m eː s k ɛ r ɛ
p uː d oː r ɛ	p ʊ d oː r ɛ m
t a m ɛ s ʊ m	t a m ɪ s j ʊ m
m a k ɪ lː a r ʊ m	m a k ɛ lː aː r j ʊ m
a m b ɪ kʷ ʊ ɪ t aː t ɛ m	a m b ɪ gʷ ɪ t aː t ɛ m
w ɪ t uː p ɛ r a b ɪ l ɛ m	w ɪ t ʊ p ɛ r a b ɪ l ɛ m
b aː j ʊ m	b a d j ʊ m
f ɛ r j a m	f eː r j aː s
eː f ɛ k t ʊ ɛ r ɛ	ɛ fː ɪ k ɛ r ɛ
ɪ n ɪ kʷ ʊ m	ɪ n iː kʷ ʊ m
ɛ k s t ɪ r p aː r ɛ	ɛ k sː t ɪ r p aː r ɛ
p r ɛ ʊ t ɛ m	p r ɛ s b y t ɛ r ʊ m
kʷ ɛ s t j ɪ ɔ n aː r j ʊ m	kʷ aɪ s t j oː n aː r j ʊ m
s a l ɪ w a r ɛ	s a l iː w aː r ɛ
p ɛ r k ɔ l a t j ʊ n ɛ m	p ɛ r k oː l aː t j oː n ɛ m
s ʊ m ɪ n ɪ s t r a r ɛ	s ʊ b m ɪ n ɪ s t r aː r ɛ
ɪ n mː uː n ɛ m	ɪ mː uː n ɛ m
s a g ɪ t aː r j ʊ m	s a g ɪ tː aː r j ʊ m
ɪ n t ɛ lː ɛ k t ʊ m	ɪ n t ɛ lː eː k t ʊ m
l ɪ t ɪ g aː r ɛ	l iː t ɪ g aː r ɛ
k uː a m	k uː n a m
a n s ɛu ʊ ɪ r ɛ	iː n s ɛ kʷ iː
k ɔ n t r a k t ɛ r ɛ	k ɔ n t r a h ɛ r ɛ
g aː r eː f ʊ m	g r a pʰ j ʊ m
ɪ n f ɪ r m r ɛ	iː n f ɪ r m aː r ɛ
ɪ lː a t j ʊ n ɛ m	ɪ lː aː t j oː n ɛ m
a l w ɛ r ʊ m	a l b aː r j ʊ m
r ɛ l a t ɪ w ʊ m	r ɛ l aː t iː w ʊ m
s ʊ m ʊ m	s ʊ mː ʊ m
ɪ m b ɛ k ɪ lː ɛ	ɪ m b eː k ɪ lː ʊ m
p a l ɛ s t r a m	p a l aɪ s t r a m
m ɛ d j ʊ m	m ɛ d j ʊ m
ɪ n k ɔ lː uː m ɛ m	ɪ ŋ k ɔ l ʊ m ɛ m
p a r t ɪ t j ʊ n ɛ m	p a r t iː t j oː n ɛ m
ʊ m b r oː s ʊ m	ʊ m b r oː s ʊ m
k a m p j ɛ ɔ n ɛ m	k a m p j oː n ɛ m
n a s uː t ʊ m	n aː s uː t ʊ m
t oː s ʊ n ɛ m	t oː n s j oː n ɛ m
a n ʊ m	aː n ʊ m
d ɛ t ɛ r m ɪ n a t j ʊ n ɛ	d eː t ɛ r m ɪ n aː t j oː n ɛ m
r ɛ f r ɪ g ɛ r a t j ʊ n ɛ m	r ɛ f r iː g ɛ r aː t j oː n ɛ m
s ɛ k ɪ r n ɛ r ɛ r ɛ	s eː k ɛ r n ɛ r ɛ
a s ɪ l ʊ m	a s y l ʊ m
k ɔ n w ɛ k s ʊ m	k ɔ n w ɛ k s ʊ m
k ɔ n t ɛ s t aː r ɛ	k ɔ n t ɛ s t aː r iː
t r ɪ k ɛ	t r iː k ɛ m
d ɛ r ɔ m p ɛ r ɛ	d iː r ʊ m p ɛ r ɛ
eː l ɛ f a n t ɪ n ʊ m	ɛ l ɛ pʰ a n t ɪ n ʊ m
p ʊ ɛ r ɪ l ɪ t aː t ɛ m	p ʊ ɛ r iː l ɪ t a t ɛ m
s k a l p ɛ lː ʊ m	s k a l p ɛ lː ʊ m
m ɪ l ɪ t aː r ɛ	m iː l ɪ t aː r ɛ
m ɛ n d ɪ k ʊ m	m ɛ n d iː k ʊ m
m a r ɪ t ʊ m	m a r iː t ʊ m
uː m ɪ l a t j oː n ɛ m	h ʊ m ɪ l j aː t j oː n ɛ m
f iː l j aː s t r ʊ m	f iː l j a s t r ʊ m
m ɛ r g ɛ r ɛ	m ɛ r g ɛ r ɛ
w ɛ l a m	w eː l ʊ m
p r ɔ p a g a t j ʊ n ɛ m	p r oː p aː g aː t j oː n ɛ m
w ɔ m ɪ t aː r ɛ	w ɔ m ɪ t aː r ɛ
a l ɪ t ʊ m	h aː l ɪ t ʊ m
aɪ t ɛ r ɛ	aɪ tʰ ɛ r ɛ m
ɛ n t r ʊ m ɛ t ɛ r ɛ m	ɪ n t r oː m ɪ tː ɛ r ɛ
ɔ n ɛ s t ɛ m	h ɔ n ɛ s t aː t ɛ m
p aː t r j a m	p a t r j a m
r ɛ f r m aː n aː m	r ɛ f r eː n aː r ɛ
t ɪ n a m	t iː n a m
w a g aː r ɛ	w a g aː r iː
s ʊ b t ɪ l ɪ t ɛ m	s ʊ b t iː l ɪ t aː t ɛ m
n ɛ b l m a m	n ɛ b ʊ l a m
g uː s t a t j ʊ n ɛ m	g ʊ s t aː t j oː n ɛ m
d ɛ k ɛ p t ɔ r j ʊ m	d ɛ k ɛ p t oː r j ʊ m
r ʊ g ʊ m	r ɔ g ʊ m
ɛ k s aʊ d ɪ r ɛ	ɛ k s aʊ d iː r ɛ
n ʊ m ɛ r ɔ s ʊ m	n ʊ m ɛ r oː s ʊ m
b ɛ b ɪ t oː r ɛ	b ɪ b ɪ t oː r ɛ m
w ɪ s aː r ɛ	w iː s ɛ r ɛ
g a m b a m	g a m b a m
s ɔ lː ɪ t uː d ɛ m	s oː l ɪ t uː d ɪ n ɛ m
s a l ɪ n a m	s a l iː n a m
iː m p ɛ t ɪ g ɪ k ɛ m	ɪ m p ɛ t iː g ɪ n ɛ m
s ɔ r t ɛ m	s ɔ r t ɛ m
l uː k a n ɪ k a m	l uː k aː n ɪ k a m
a s r ɛ k t aː r ɛ	a s p ɛ k t aː r ɛ
w ɛ r m ɛ m	w ɛ r m ɛ m
r uː f ʊ m	r uː f ʊ m
k ɔ lː ɛ k t a m	k ɔ lː eː k t a m
t aː s ʊ m	t a k s ʊ m
n ɛ f a s	n ɛ f aː s
d ɔ k t oː r ɛ	d ɔ k t oː r ɛ m
s p ɔ s a m	s p oː n s a m
s t uː p r ʊ m	s t ʊ p r ʊ m
s p ɔ l r ɛ	s p ɔ l j aː r ɛ
k ɔ n k ɪ s ʊ m	k ɔ ŋ k ɪ d ɛ r ɛ
t r a b a l ɛ m	t r a b aː l ɛ m
m a ŋ g aː r ɛ	m a n d uː k aː r ɛ
w a k ɪ lː aː r ɛ	w a k ɪ lː aː r ɛ
h t aː ŋ g ɛ r ɛ	t a ŋ g ɛ r ɛ
w ɛ d ʊ m	w ɔ k ɪ t ʊ m
k a n eː s t ɛ r ʊ m	k a n ɪ s t r ʊ m
f uː r j oː s ʊ m	f ʊ r j oː s ʊ m
r ɛ k ɛ p t aː r ɛ	r ɛ k ɛ p t aː r ɛ
r uː m ɪ n aː r ɛ	r uː m ɪ n aː r iː
r ɛ k t a ŋ g ʊ l ʊ m	r ɛ k t a ŋ g ʊ l ʊ m
a kː uː m uː l a t j ʊ n ɛ m	a kː ʊ m ʊ l aː t j oː n ɛ m
f ɪ d ʊ m	f iː d ʊ m
p ɛ l a g ʊ m	p ɛ l a g ʊ s
k a l aː r ɛ	kʰ a l aː r ɛ
p ɔ s t uː l a t j ʊ n ɛ m	p ɔ s t ʊ l aː t j oː n ɛ m
b l a n d ɪ t j a m	b l a n d ɪ t j a m
a r ɪ n oː s ʊ m	a r eː n oː s ʊ m
a k ʊ n s ɛ l aː r ɛ	a kː ɔ ŋ k ɪ l j aː r ɛ
t eː n ɛ r ɛ	t ɛ n eː r ɛ
ɪ n kʷ ɪ n aː r ɛ	ɪ ŋ kʷ ɪ n aː r ɛ
a ŋ g ɔ s k a m	a ŋ g ʊ s t j a m
r ɛ k aː n t ɛ m	r ɛ k ɛ n t ɛ m
aʊ t ɔ r ɪ t aː t ɛ m	aʊ k t oː r ɪ t aː t ɛ m
ɪ n k ʊ rː ɛ r ɛ	ɪ ŋ k ʊ rː ɛ r ɛ
kʷ iː n t ʊ m	kʷ iː n t ʊ m
k ʊ l m ʊ m	k ʊ l m ʊ m
a s p ʊ r t a r ɛ	a s p ɔ r t aː r ɛ
l ɛ ɔ p a r d ʊ m	l ɛ ɔ p a r d ʊ m
k ɔ r j aː k ɛ ʊ m	k ɔ r j a k ɛu m
s ɛ kʷ aː k ɛ	s ɛ kʷ aː k ɛ m
w ɛ n ɛ r aː r ɛ	w ɛ n ɛ r aː r iː
m ɛ r ɪ t ɛ r ɛ	m ɛ r eː r ɛ
d ɪ s k ʊ rː ɛ r ɛ	d ɪ s k ʊ rː ɛ r ɛ
a pː r ɔ p r j a t j ʊ n ɛ m	a pː r ɔ p r j aː t j oː n ɛ m
a pː a r aː r ɛ	a pː a r aː r ɛ
ʊ r t ɪ k aː r j a m	ʊ r t iː k aː r j a m
s ʊ l k aː r ɛ	s ʊ l k aː r ɛ
eː t ɛ r ɛ ʊ m	aɪ tʰ ɛ r j ʊ m
ɪ n t ɛ r w ɛ n t j oː n ɛ m	ɪ n t ɛ r w ɛ n t j oː n ɛ m
k ɛ l aː r ɛ	k eː l aː r ɛ
k ɔ n d ɛ n s aː r ɛ	k ɔ n d eː n s aː r ɛ
s aː l m a m	s a g m a m
k ɪ t ɛ r j oː r ɛ	k ɪ t ɛ r j oː r ɛ m
a b s uː r t ɪ t aː t ɛ m	a b s ʊ r d ɪ t aː t ɛ m
m ɛ r d a m	m ɛ r d a m
a n t ɛ r aː p w ʊ n g ɛ r ɛ	ɪ n t ɛ r p ʊ ŋ g ɛ r ɛ
r eː s uː s k ɪ t a t j ʊ n ɛ m	r ɛ s ʊ s k ɪ t aː t j oː n ɛ m
w ɛ n d ɪ t oː r ɛ	w eː n d ɪ t oː r ɛ m
k ʊ l p a m	k ʊ l p a m
s t a b ɪ l ɛ k ɛ r ɛ	s t a b ɪ l iː r ɛ
p l ʊ m b aː r j ʊ m	p l ʊ m b aː r j ʊ m
s a n a b ɪ l ɛ m	s aː n aː b ɪ l ɛ m
uː s uː r a m	uː s uː r a m
s ʊ p ɛ r b ʊ m	s ʊ p ɛ r b ʊ m
ɪ n f l a t j ɛu n ɛ m	iː n f l aː t j oː n ɛ m
k aː k t ɪ w ʊ m	k a p t iː w ʊ m
p ɔ s ʊ d ɛ r ɛ	p ɔ sː ɪ d eː r ɛ
d j aː b ʊ l ʊ m	d j a b ɔ l ʊ m
r ɪ g ʊ r ɔ s ʊ m	r ɪ g ɔ r ɔ s ʊ m
s p ɛ t j ɛ m	s p ɛ k ɪ ɛ m
k ɪ r k uː lː aː r ɛ	k ɪ r k ʊ l aː r ɛ
s ʊ s t r a h ɛ r ɛ	s ʊ b t r a h ɛ r ɛ
g uː r ʊ m	ɪ uː s
s t r ɪ g a m	s t r iː g a m
p a t r j a r kʰ a m	p a t r j a r kʰ a m
t ɛ r g ɪ w ɛ r s aː r ɛ	t ɛ r g ɪ w ɛ r s aː r iː
s p ɛ k uː l a t ɪ w ʊ m	s p ɛ k ʊ l aː t iː w ʊ m
p a l ʊ m	p aː l ʊ m
r ɛ n ʊ ɪ r ɛ	r ɛ n ʊ ɛ r ɛ
k ɔ l ɔ r aː r ɛ	k ɔ l oː r aː r ɛ
d aː t ʊ m	d a t ʊ m
r a p iː r ɛ	r a p ɛ r ɛ
h ɔ s t j a m	h ɔ s t j a m
k ɔ r w ɪ n ʊ m	k ɔ r w iː n ʊ m
ɪ m a k ɔ l a t ʊ m	ɪ mː a k ʊ l aː t ʊ m
aʊ r ɪ g ɛ r ʊ m	aʊ r ɪ g ɛ r ʊ m
s ɪ k t ɪ m a n a m	s ɛ p t ɪ m aː n a m
k ɔ m p l ɪ k a t j oː n ɛ	k ɔ m p l ɪ k aː t j oː n ɛ m
w ɪ t ɛ r ɛ	w ɛ t ɛ r ɛ m
k ɛ l ɛ b r a t j ɔ n ɛ m	k ɛ l ɛ b r aː t j oː n ɛ m
p aː d eː r ɛ m	p a t r ɛ m
ɛ s p ɪ r aː r ɛ	s p iː r aː r ɛ
d ɛ s p ɛ r ɛ k ɪ r ɛ	d ɪ s p ɛ r iː r ɛ
g ɪ t aː r ɛ	f eː t aː r ɛ
r uː t ɪ lː aː r ɛ	r ʊ t ɪ l aː r ɛ
l iː m p ɪ d ɛ m	l ɪ m p ɪ d ʊ m
uː s ʊ m	uː s ʊ m
s p ɛ l ʊ n k a m	s p eː l ʊ ŋ k a m
p ɛ l ʊ a m	p iː l a m
ɔ s t r ʊ m	aʊ s t r ʊ m
a s ɛ r t j ʊ m	a sː ɛ r t j oː n ɛ m
t ɪ p uː l a m	t ɪ pː ʊ l a m
s p ɛ t ɪ m ɛ n	s p ɛ k ɪ m ɛ n
k r ʊ s t aː r ɛ	k r ʊ s t aː r ɛ
eː w ɔ l k w a r ɛ	eː w ɔ l w ɛ r ɛ
k a n d ɪ d ʊ m	k a n d ɪ d ʊ m
a k k ɛ p t j ʊ n ɛ m	a kː ɛ p t j oː n ɛ m
a n t a m	a n t aː s
t r a n s m uː t a t j ʊ n ɛ m	t r aː n s m uː t aː t j oː n ɛ m
k ɔ a b ɪ t aː r ɛ	k ɔ h a b ɪ t aː r ɛ
s ɛ w ɛ r ɪ t aː t ɛ m	s ɛ w eː r ɪ t aː t ɛ m
k r eː d ɛ n t a m	k r eː d ɛ n t j a m
f ɛ lː ɔ n ɛ m	f ɛ lː aː r ɛ
s ʊ b ɪ t aː n ɛ ʊ m	s ʊ b ɪ t aː n ɛu m
p r ɛ d a t oː r ɛ	p r aɪ d aː t oː r ɛ m
a d ɪ t j oː n ɛ	a dː ɪ t j oː n ɛ m
ɪ d oː n ɛ ʊ m	ɪ d oː n ɛu m
w ɪ k a m	b iː g a m
s ɔ l ɪ l ɔ k ʊ m	s oː l ɪ l ɔ kʷ j ʊ m
g r a w aː r ɛ	g r a w aː r ɛ
ɪ d ɛ n t ɪ d aː d ɛ m	iː d ɛ n t ɪ t aː t ɛ m
w ɔ m eː r ɛ	w oː m ɛ r ɛ m
a p ɔ s t ɔ l ʊ m	a p ɔ s t ɔ l ʊ m
t ɛ m ɛ r ɛ	t ɪ m eː r ɛ
k ɔ m p l ɛ m ɛ n t ʊ m	k ɔ m p l eː m ɛ n t ʊ m
k ɔ n k r ɛ t j ɔ n ɛ m	k ɔ ŋ k r eː t j oː n ɛ m
a kː a d ɛ m j a m	a k a d eː m iː a m
p ɛ r n ɪ k j ɔ s ʊ m	p ɛ r n ɪ k j oː s ʊ m
p ɔ l ʊ m	p ɔ l ʊ m
p a w ɪ l ʊ n ɛ m	p aː p ɪ l j oː n ɛ m
k aː r m ɛ m	k a r m ɛ n
f uː ŋ g ɪ r ɛ	f ʊ ŋ g iː
s ʊ m g t ʊ m	s uː m p t ʊ m
a b s k ɪ s ʊ m	a b s k ɪ n d ɛ r ɛ
n ɪ s ɛ t ɛ m	n ɛ s k iː r ɛ
s eː k uː r ɛ m	s ɛ k uː r ɛ m
ɛ k s p ɛ k t a t j ʊ n ɛ	ɛ k sː p ɛ k t aː t j oː n ɛ m
d ɛ j ɛ n ɛ r aː r ɛ	d eː g ɛ n ɛ r aː r ɛ
ɪ n k r eː d ɪ b ɪ l ɛ m	ɪ ŋ k r eː d ɪ b ɪ l ɛ m
d a nː oː s ʊ m	d a m n oː s ʊ m
k a r n ɪ f ɪ k ɛ m	k a r n ɪ f ɪ k ɛ m
a lː uː k ɛ	h a lː ʊ m
s iː n ʊ m	s ʊ iː n ʊ m
uː n ɪ w ɔ k ʊ m	uː n ɪ w ɔ k ʊ m
k ʊ n t uː r b aː r ɛ	k ɔ n t ʊ r b aː r ɛ
eː l ɪ d ɛ r ɛ	eː l iː d ɛ r ɛ
n aː t aː l ɛ	n aː t aː l ɛ m
k ɛ l ɛ r ɛ m	k ɛ l ɛ r ɛ m
k ʊ l aː r ɛ	k ɔ l ɛ r ɛ
k ɔ n t r a d ɪ k t oː r ɛ	k ɔ n t r aː d ɪ k t oː r ɛ m
t ɔ r w ʊ m	t ɔ r w ʊ m
ɪ n s ɛ r t j oː n ɛ m	iː n s ɛ r t j oː n ɛ m
k r ɛ s p ʊ m	k r ɪ s p ʊ m
k uː p ɪ d ɪ t ɛ m	k ʊ p ɪ d ɪ t aː t ɛ m
a n a l ɪ s ɛ m	a n a l y s ɛ m
k ɔ d ɪ k ɪ lː ʊ m	k oː d ɪ k ɪ lː ʊ m
a d uː l t ɛ r ɪ n ʊ m	a d ʊ l t ɛ r iː n ʊ m
r ɛ m uː w ɛ r ɛ	r ɛ m ɔ w eː r ɛ
n ɛ s p eː l a m	m ɛ s p ɪ l ʊ m
d a ŋ n aː r ɛ	d a m n aː r ɛ
s ʊ b m ɛ r g ɛ r ɛ	s ʊ mː ɛ r g ɛ r ɛ
k a rː ʊ k a m	k a rː uː k a m
n aː f t a m	n a pʰ tʰ a m
t ɔ r n ʊ m	t ɔ r n ʊ m
p ɔ m ɪ t ʊ m	p ɔ m eː t ʊ m
a k t w aː r j ʊ m	aː k t w aː r j ʊ m
g a rː uː l ʊ m	g a rː ʊ l ʊ m
r eː w ʊ l w ɛ r ɛ	r ɛ w ɔ l w ɛ r ɛ
a ŋ g ɔ s t aː r ɛ	a ŋ g ʊ s t aː r ɛ
k a m b j ʊ m	k a m b j ʊ m
p ɛ r t uː r b aː r ɛ	p ɛ r t ʊ r b aː r ɛ
a r g ɪ k ɛ m	a gː ɛ r ɛ m
w ɔ n l ɔ n t ɛ m m	w ɔ l ʊ n t aː t ɛ m
p r aː k t ɪ k ʊ m	p r a k t ɪ k ʊ m
k a l w ʊ m	k a l w ʊ m
l ʊ k r ʊ m	l ʊ k r ʊ m
d ɛ k l a m aː r ɛ	d eː k l aː m aː r ɛ
b a kː a l eː r aː t ʊ m	b a kː a l aʊ r ɛ a t ʊ m
k a n t ʊ m	k a n t ʊ m
l a b ʊ r aː r ɛ	l a b oː r aː r ɛ
ɔ s t ɛ n t aː r ɛ	ɔ s t ɛ n t aː r ɛ
k a p ɛ lː ʊ m	k a p ɪ lː ʊ m
r ɛ p l ɪ k a t j oː n ɛ	r ɛ p l ɪ k aː t j oː n ɛ m
k a l k aː n ʊ m	k a l k aː n ɛu m
ɛ k s t r a ɔ r d ɪ n aː r j ʊ m	ɛ k s t r aː ɔ r d ɪ n aː r j ʊ m
aː r oː d ɔ l ɪ k a m	h ɪ r ʊ n d ɪ n ɛ m
f uː r oː r ɛ	f uː r aː r iː
ɔ r ɪ uː n d ʊ m	ɔ r j ʊ n d ʊ m
f ɪ m ʊ m	f ɪ m ʊ m
k a p r ʊ n	k a p r ʊ m
r ɪ s ʊ m	r iː s ʊ m
ɛ m uː l ʊ m	aɪ m ʊ l ʊ m
p r ɛ f ɛ r ɪ r ɛ	p r aɪ f ɛ rː ɛ
p ʊ t r ɪ r ɛ	p ʊ t r ɛ r ɛ
k lː aʊ s uː lː a m	k l aʊ s ʊ l a m
l a t ɪ t uː d ɪ n ɛ m	l aː t ɪ t uː d ɪ n ɛ m
g ɛ r a r k a m	h ɪ ɛ r a r kʰ a m
k a r ɔ t a m	k a r oː t a m
ɪ n mː ɔ l a t j ʊ n ɛ m	ɪ mː ɔ l aː t j oː n ɛ m
s a k ɛ r d ɔ t j ʊ m	s a k ɛ r d oː t j ʊ m
f j eː r a m	f ɛ r a m
l a p ɪ d aː r ɛ	l a p ɪ d aː r ɛ
d ɛ p a r t ɪ r ɛ	d eː p a r t iː r ɛ
k ɪ n t uː r a m	k ɪ ŋ k t uː r a m
k r ɛ m aː r ɛ	k r ɛ m aː r ɛ
s ɔ m ʊ	s ɔ m n ʊ m
d ɛ g ʊ lː aː r ɛ	d eː k ɔ lː aː r ɛ
m ɛ d ɪ k a m ɛ n t ʊ m	m ɛ d ɪ k aː m ɛ n t ʊ m
k ɔ m uː n a l ɛ m	k ɔ mː uː n aː l ɛ m
k ɪ t aː r a m	k ɪ tʰ a r a m
h ɪ k ɛ	kʷ ɛ m
k a l ɪ fː ʊ m	k a l iː pʰ a m
p r ɛ t ɪ p ɪ t j ʊ m	p r aɪ k ɪ p ɪ t j ʊ m
g ɔ s j ʊ m	g ɛu s j aː s
f ɛ n d ɛ r ɛ	f ɪ n d ɛ r ɛ
r ʊ t aː r ɛ	r ʊ k t aː r ɛ
k a b ɛ ʊ m	k a p ɪ t j ʊ m
k ɔ n s uː m ɛ r ɛ	k oː n s uː m ɛ r ɛ
p r ɔ t ɛ s t a t j ʊ n ɛ m	p r oː t ɛ s t aː t j oː n ɛ m
k ɔ k ɔ l ʊ m	k ʊ k ʊ lː ʊ m
g r a b aː k ʊ m	g r a b aː t ʊ m
f l ɔ r eː r ɛ	f l oː r eː r ɛ
h ɛ r b j aː r j ʊ m	h ɛ r b aː r j ʊ m
t uː r p ɪ t uː d ɪ n ɛ	t ʊ r p ɪ t uː d ɪ n ɛ m
aɪ d ɪ l ɛ m	aɪ d iː l ɛ m
a k t ɪ w ʊ m	aː k t iː w ʊ m
a g a t a m	a kʰ aː t eː n
d ɛ s ɛ m n aː r ɛ	d eː s ɪ ŋ n aː r ɛ
p a r t ɪ r ɛ	p a r t iː r ɛ
s ʊ kː ʊ m b ɛ r ɛ	s ʊ kː ʊ m b ɛ r ɛ
k ʊ m p l ɛ t ɪ w ʊ m	k ɔ m p l eː t iː w ʊ m
r a d ɪ k ɪ n ɛ m	r aː d iː k ɛ m
k ɔ m p ɛ t ɪ t oː r ɛ	k ɔ m p ɛ t iː t oː r ɛ m
a fː l uː ɛ r ɛ	a fː l ʊ ɛ r ɛ
l ɔ m b ʊ m	l ʊ m b ʊ m
ɔ rː m d ʊ m	h ɔ rː ɪ d ʊ m
a n t ɛ p oː n ɛ r ɛ	a n t ɛ p oː n ɛ r ɛ
p r ɪ m w aɪ r ɛ n ɛ m	w eː r
ɪ ŋ g uː r j a m	ɪ n ɪ uː r j a m
t r a l uː k ɪ r ɛ	t r aː n s l uː k eː r ɛ
t r a n s m ɪ s j ʊ n ɛ m	t r aː n s m ɪ sː j oː n ɛ m
s ɔ j k ɛ r ʊ m	s ɔ k ɛ r ʊ m
n ɛ k l ɪ g ɛ r ɛ	n ɛ g l ɛ g ɛ r ɛ
t uː r a m	t uː r a m
ɔ b s t aː r ɛ	ɔ b s t aː r ɛ
ɪ m b ɛ r b ɛ m	ɪ m b ɛ r b ɛ m
ɪ t ɛ r a t j ʊ n ɛ m	ɪ t ɛ r aː t j oː n ɛ m
s k uː d ɪ ɛ r ʊ m	s k uː t aː r j ʊ m
p uː b l ɪ k ʊ m	p uː b l ɪ k ʊ m
n uː t aː r ɛ	n uː t aː r ɛ
f a k ʊ n d j ʊ m	f aː k ʊ n d j a m
