t ɛ d a m	t aɪ d a m
s uː p iː n ʊ m	s ʊ p iː n ʊ m
n uː m ɛ r aː r ɛ	n ʊ m ɛ r aː r ɛ
p r aɪ s ʊ m ɛ r ɛ	p r aɪ s uː m ɛ r ɛ
r ɛ l a k s aː r ɛ	r ɛ l a k s aː r ɛ
s ʊ s p ɛ n s j oː n ɛ m	s ʊ s p eː n s j oː n ɛ m
ɛ r ɔ g aː r ɛ	eː r ɔ g aː r ɛ
p l aː n ʊ m	p l aː n ʊ m
iː n k d ɪ n ɛ	ɪ ŋ k uː d ɛ m
s ʊ g lː ɔ t ʊ m	s ɪ ŋ g ʊ l t ʊ m
a w ɛ l ɪ n ɛ m	a b ɛ lː a n a m
f r uː iː r ɛ	f r ʊ iː
k ɔ r j a n d ʊ m r ʊ m	k ɔ r j a n d r ʊ m
a l ʊ ŋ g aː r ɛ	eː l ɔ ŋ g aː r ɛ
k a p aː k ɛ	k a p aː k ɛ m
d ɛ m a n d aː r ɛ	d eː m a n d aː r ɛ
p l aː t aː n ʊ m	p l a t a n ʊ m
m ɪ lː a m	m iː lː j a
f uː n iː k ʊ l ʊ m	f uː n ɪ k ʊ l ʊ m
p a l uː d aː m ɛ n t ʊ m	p a l uː d aː m ɛ n t ʊ m
a m b ʊ m s	a m b oː s
a s	a sː ɛ m
a s p ɛ k t ʊ m	a s p ɛ k t ʊ m
b r aː k a m	b r aː k a m
s ʊ kː ʊ m b ɛ r ɛ	s ʊ kː ʊ m b ɛ r ɛ
s p ɔ l j ʊ m	s p ɔ l j ʊ m
r eː l ɛ w aː r ɛ	r ɛ l ɛ w aː r ɛ
m ɛ r iː d j oː n aː l ɛ	m ɛ r iː d j oː n aː l ɛ m
d eː t ɛ r g eː r ɛ	d eː t ɛ r g eː r ɛ
p r aɪ d oː m iː n aː r ɛ	p r aɪ d ɔ m ɪ n aː r iː
f r aː n k ɛ s ɛ m	f r a ŋ k eː n s ɛ m
m ɪ l iː t ɛ m	m iː l ɪ t ɛ m
k l aː m oː r ɛ	k l aː m oː r ɛ m
d ɔ m ɪ n j ʊ m	d ɔ m ɪ n j ʊ m
p ʊ l w m ʊ m	p ɔ l y p ʊ m
r aː k eː m ʊ m	r a k eː m ʊ m
f r ɪ k ʊ m m	f r iː g ɪ d ʊ m
a m s k ʊ m s ʊ m	a b s k ɔ n s ʊ m
p r ɔ m ɛ s a m	p r oː m ɪ sː ʊ m
ɪ m b ɛ b ɛ r ɛ	ɪ m b ɪ b ɛ r ɛ
n ɛ k t aː r ɛ	n ɛ k t a r
f r uː k t w oː s ʊ m	f r ʊ k t ʊ oː s ʊ m
k ɔ m p aː t r ɛ m	k ɔ m p a t r ɛ m
t r uː k ɪ d aː r ɛ	t r ʊ k iː d aː r ɛ
r ɛ k l ɪ n aː r ɛ	r ɛ k l iː n aː r ɛ
ɪ d ɛ n t ɪ k ʊ m	iː d ɛ n t ɪ k ʊ m
l eː p r oː s ʊ m	l ɛ p r oː s ʊ m
p r ɔ l ɔ k j ʊ m	p r oː l ɔ kʷ j ʊ m
s a kː uː l ʊ m	s a kː ʊ l ʊ m
r ɛ p r ɔ w aː r ɛ	r ɛ p r ɔ b aː r ɛ
n a w iː k ɛ l a m	n aː w ɪ k ɛ lː a m
k a t aː r aː k t a m	k a t a r a k t a m
k a t ʊ m	k aʊ t ʊ m
w ɔ r aː g ɪ n ɛ m	w ɔ r aː g ɪ n ɛ m
t ɔ r ɛ	t oː r ɛ m
l a r g ʊ m	l a r g ʊ m
ɛ k s ɛ m p l aː r	ɛ k s ɛ m p l a r
p ɛ k uː n j aː r j ʊ m	p ɛ k uː n j aː r j ʊ m
p l ʊ m b aː ɪ ɪ n ɛ m ʊ	p l ʊ m b aː g ɪ n ɛ m
ɔ l ɪ g aː r k ɪ k ʊ m	ɔ l ɪ g a r kʰ ɪ k ʊ m
k ʊ m p l ɛ r ɛ m ɛ	k ɔ m p l eː r ɛ
n ɔ t ʊ	n ɔ t a m
a n ɛ g aː r ɛ	eː n ɛ k aː r ɛ
s aː w ɪ t aː t ɛ m	s w aː w ɪ t aː t ɛ m
k ʊ r s ʊ m	k ʊ r s ʊ m
w ɪ k a m	b iː g a m
t ɛ r ɛ b r a m	t ɛ r ɛ b r a m
ɛ r iː m aː n d aː t ɛ m	g ɛ r m aː n ɪ t aː t ɛ m
d ɛ ɪ f ɪ k aː r ɛ	d ɛ ɪ f ɪ k aː r ɛ
f r ɛ j ɪ g ɪ d aː t ɛ m	f r iː g ɪ d ɪ t aː t ɛ m
a sː ɪ s t ɛ r ɛ	a sː ɪ s t ɛ r ɛ
p r oː s ɛ n j ɔ m	p r ɔ s k eː n j ʊ m
l ɪ ɛ m aː t aː	l iː m aː k ɛ m
a w ɛ t aː r ɛ	a d w ɔ k aː r ɛ
a s p ɛ r s j oː n ɛ m	a s p ɛ r s j oː n ɛ m
a pː r ɔ p r j aː t j oː n ɛ m	a pː r ɔ p r j aː t j oː n ɛ m
m ɛ d iː t aː b ʊ n d ʊ m	m ɛ d ɪ t aː b ʊ n d ʊ m
s a n aː t j oː n ɛ m	s aː n aː t j oː n ɛ m
p a p a m	p aː p a m
w ɛ lː ʊ m	w ɪ lː ʊ m
a l aː r ɛ	a fː l aː r ɛ
l ʊ s k ʊ m	l ʊ s k ʊ m
uː w a m	uː w a m
p r ɔ d ɪ g j oː s ʊ m	p r oː d ɪ g j oː s ʊ m
r ɛ p a r aː r ɛ	r ɛ p a r aː r ɛ
k uː m ʊ l aː r ɛ	k ʊ m ʊ l aː r ɛ
a kː ɪ d j a m	a k eː d j a m
a d w ɛ k t j oː n ɛ m	a d w ɛ k t j oː n ɛ m
a b ɪ t ʊ m	h a b ɪ t ʊ m
k a p r ɪ n ʊ m	k a p r iː n ʊ m
t ɪ l j ʊ m	t ɪ l j a m
s ʊ m iː n ɪ s t r aː r ɛ m	s ʊ b m ɪ n ɪ s t r aː r ɛ
w ɛ r m ɪ n oː s ʊ m	w ɛ r m ɪ n oː s ʊ m
f l ɛ k sː j ʊ m n ɛ m	f l ɛ k s j oː n ɛ m
kʷ ɛ s t j oː n ɛ m	kʷ aɪ s t j oː n ɛ m
d eː l uː b r ʊ m	d eː l uː b r ʊ m
ɪ w ʊ m	iː w ʊ m
f iː l j aː s t r ʊ m	f iː l j a s t r ʊ m
ɛ k s aː k ɛ r b aː t j oː n ɛ m	ɛ k s a k ɛ r b aː t j oː n ɛ m
l ɛ g uː l eː r j ʊ m	l eː g ʊ l eː j ʊ m
ɪ n w ɪ d j oː s ʊ m	ɪ n w ɪ d j oː s ʊ m
ɔ t j ʊ m	oː t j ʊ m
r ɛ d ɪ k g ɛ r ɛ	r ɛ d ɪ g ɛ r ɛ
j uː d iː k aː t oː r ɛ	j uː d ɪ k aː t oː r ɛ m
l ɪ b iː d ʊ m	l ɪ b iː d ɪ n ɛ m
ɪ n d iː s k r ɛ t j oː n ɛ m	ɪ n d ɪ s k r eː t j oː n ɛ m
a m aː n ʊ ɛ n s ɛ m	aː m a n ʊ eː n s ɛ m
r eː g ʊ m l aː r ɛ	r eː g ʊ l aː r ɛ
d eː n ɔ m iː n aː r ɛ	d eː n oː m ɪ n aː r ɛ
s a k r ɪ l ɛ g ʊ m	s a k r ɪ l ɛ g ʊ m
k ɪ b iː k ʊ m	k iː w ɪ k ʊ m
k a m p ɛ s t r ɛ m	k a m p ɛ s t r ɛ m
ɪ ŋ n ɔ r aː r ɛ	ɪ ŋ n oː r aː r ɛ
s t ɛ r k ʊ m ɛ	s t ɛ r k ʊ s
w ɛ l a m	w eː l ʊ m
d ɪ w uː l g aː t j oː n ɛ m	d iː w ʊ l g aː t j oː n ɛ m
p l ʊ m b aː r ʊ m	p l ʊ m b aː r j ʊ m
k a t ɪ n ʊ m	k a t iː n ʊ m
a r uː t a m	r uː t a m
k ɔ n d ɛ n s aː r ɛ	k ɔ n d eː n s aː r ɛ
ɔ p uː s k ʊ l ʊ m	ɔ p ʊ s k ʊ l ʊ m
m eː t aː lː ɪ pʰ a r ʊ m	m ɛ t a lː ɪ f ɛ r ʊ m
ɪ t ɛ r aː r ɛ	ɪ t ɛ r aː r ɛ
p a l m aː r ɪ m	p a l m aː r ɛ m
s eː n t ɪ lː a m m	s k ɪ n t ɪ lː a m
m a t uː r ʊ m	m aː t uː r ʊ m
m ɛ s uː r a m	m eː n s uː r a m
s ɪ k aː r j ʊ m	s iː k aː r j ʊ m
g ʊ s t ʊ m	g ʊ s t ʊ m
d ʊ ɛ k ɛ n t oː s	d ʊ k ɛ n t oː s
d ɪ w iː n aː t j oː n ɛ m	d iː w iː n aː t j oː n ɛ m
ɪ m p ɛ t ʊ m	ɪ m p ɛ t ʊ m
m ɛ t ɛ r ɛ	m ɪ tː ɛ r ɛ
d ɛ m ɛ n t ɪ k aː r ɛ m	d eː m ɛ n t aː r ɛ
p ɛ k uː l ʊ m	p ɛ k uː l j ʊ m
s ʊ ɛ s k r iː b eː r ɛ	s ʊ b s k r iː b ɛ r ɛ
ɔ s t ɛ n s iː w oː	ɔ s t eː n s iː w ʊ m
s a p j ɛ n t a m	s a p ɪ ɛ n t j a m
w a n iː	w a nː ʊ m
n ɛ g l ɪ g ɛ r ɛ	n ɛ g l ɛ g ɛ r ɛ
g uː m ɛ n t ʊ m	j uː m ɛ n t ʊ m
w ɪ k ɛ r a m	w ɪ s k ʊ s
k ɪ b ʊ oː lː a m	k eː p ʊ lː a m
l ɛ n t ʊ m	l ɛ n t ʊ m
ɔ r ɪ ɛ n t aː l ɛ	ɔ r ɪ ɛ n t aː l ɛ m
p r uː d eː r ɛ	p r uː r iː r ɛ
a f l d ɪ n t j ʊ m	a fː l ʊ ɛ n t j a m
g a t a m	k a tː a m
ɪ n f ɛ s t aː r ɛ	iː n f ɛ s t aː r ɛ
l uː k aː n iː k a m	l uː k aː n ɪ k a m
w ɛ r g ɪ ɛ l ɛ m ɛ	w ɪ r ɪ d aː r j ʊ m
s ɔ m n oː l j ɛ n t ʊ m	s ɔ m n ɔ l ɛ n t ʊ m
p r oː b ʊ m	p r ɔ b ʊ m
ɔ kː aː s j oː n ɛ	ɔ kː aː s j oː n ɛ m
r ɛ p r ɛ ɛ n s ɪ b ɛ l ɛ m	r ɛ p r ɛ h ɛ n s ɪ b ɪ l ɛ m
m ɔ lː ɛu k j ɛ m	m ɔ lː ɪ t ɪ ɛ m
s a p oː n ɛ	s aː p oː n ɛ m
k ɔ l uː b r iː n ʊ m	k ɔ l ʊ b r iː n ʊ m
r ɛ p uː b l iː k a m	r ɛ m p uː b l ɪ k a m
k ɔ l uː f a m s ɛ r ɛ	k a l ɛ f a k ɛ r ɛ
m ɛ s uː r aː r ɛ	m eː n s uː r aː r ɛ
p a r s ɪ m oː n j a m	p a r s ɪ m oː n j a m
ʊ d ɪ t ʊ m	aʊ d iː t ʊ m
d ɔ m aː r ɛ	d ɔ m aː r ɛ
k ɔ r n j ɛ ʊ m	k ɔ r n ɛu m
s ɪ k t ɪ m aː n a m	s ɛ p t ɪ m aː n a m
a tː r iː b ʊ ɪ r ɛ	a tː r ɪ b ʊ ɛ r ɛ
n ɔ k ɪ t ʊ m	n ʊ k eː t ʊ m
ɛ k s t ɛ n s ɪ w ʊ m	ɛ k s t eː n s iː w ʊ m
m uː n ɔ m	m uː n ʊ s
l ɔ n g ɪ t ʊ d ɪ n ɛ m	l ɔ ŋ g ɪ t uː d ɪ n ɛ m
t a k t ɪ l ɛ	t aː k t ɪ l ɛ m
a b j ɛ k t aː r ɛ	a b ɪ k ɛ r ɛ
r ɛ s t aː r ɛ	r ɛ s t aː r ɛ
m a n uː b r j ʊ m	m a n uː b r j ʊ m
b ʊ ʊ m	b uː b oː n ɛ m
l eː k l ɛ	l eː g aː l ɛ m
ɛ k k ɛ lː ɛ r ɛ	ɛ k s k ɛ lː ɛ r ɛ
s t r aː t ʊ m	s t r aː t ʊ m
ɪ m b ɛ k ɪ lː ɪ t aː t ɛ m	ɪ m b eː k ɪ lː ɪ t aː t ɛ m
ɛ k s t aː s ɛ	ɛ k s t a s ɛ m
g eː r aː r k ɛ m	h ɪ ɛ r a r kʰ a m
h ɔ s t j a m	h ɔ s t j a m
s uː p ɛ r aː r ɛ	s ʊ p ɛ r aː r ɛ
d ɛ w eː r ɛ	d eː b eː r ɛ
r ɛ t r aː r ɛ m	r ɛ t r a h ɛ r ɛ
aʊ d a k j a m	aʊ d aː k j a m
n ɛ f aː r j ʊ m	n ɛ f aː r j ʊ m
r ɛ k ɛ p t aː r ɛ	r ɛ k ɛ p t aː r ɛ
ɪ n s iː n ɛ m	iː n s ɪ ŋ n ɛ m
k ɔ m p ʊ n k t j oː n ɛ m	k ɔ m p ʊ ŋ k t j oː n ɛ m
k ɔ r t ɛ m	k oː r t ɛ m
ɛ s k ɔ p r ʊ m	s k a l p r ʊ m
k ɔ r ʊ m	kʰ ɔ r ʊ m
t a r d aː r ɛ	t a r d aː r ɛ
p ɪ kː ʊ m	p iː k ʊ m
a d uː l aː t oː r ɛ	a d uː l aː t oː r ɛ m
ɔ d j aː r ɛ	oː d ɪ sː ɛ
m ɛ r ɛ t r iː k j ʊ m	m ɛ r ɛ t r iː k j ʊ m
k eː m ɛ n t ʊ m	k aɪ m ɛ n t ʊ m
ɛ n s ɛ m	eː n s ɛ m
uː r n a m	uː r n a m
a pː ɔ r ɛ	a pː oː n ɛ r ɛ
r ɔ r ɛ r ɛ	r oː r aː r ɛ
p ɪ l n a m	p iː l a m
g ɛ m a m	g ɛ mː a m
b a r d ʊ m	b a r d ʊ m
ɪ ŋ n aː r ʊ m	ɪ ŋ n aː r ʊ m
ɪ n s oː n t ɛ m	iː n s ɔ n t ɛ m
aː k aː	a kʷ a m
r ɛ g j ʊ m	r eː g j ʊ m
a pː j ʊ m	a p j ʊ m
a s t uː t ʊ m	a s t uː t ʊ m
m ɛ ŋ k t ɛ m m	m ɛ n t ʊ l a m
ɪ t ɛ m p ɛ s t ɪ w ɪ t aː t ɛ m	ɪ n t ɛ m p ɛ s t iː w ɪ t aː t ɛ m
w a l ɛ t ʊ d ɪ n aː r j ʊ m	w a l eː t uː d ɪ n aː r j ʊ m
a l t aː l ɛ	a l t a r ɛ m
f ʊ n t ɛ m	f ɔ n t ɛ m
a n ʊ d ɪ n ʊ m	a n oː d y n ɔ n
d uː b j ʊ m	d ʊ b j ʊ m
s a l uː b r ɛ m	s a l uː b r ɛ m
w ɛ n t ʊ m	w ɛ n t ʊ m
p ɛ r p ɛ t r aː r ɛ	p ɛ r p ɛ t r aː r ɛ
p r ɛ p oː r ɛ n	p r aɪ p oː n ɛ r ɛ
l uː n uː l a m	l uː n ʊ l a m
t eː n ɛ b r oː s ʊ m	t ɛ n ɛ b r oː s ʊ m
s p ɛ k ɪ pʰ ɪ k ʊ m	s p ɛ k ɪ f ɪ k ʊ m
a fː ɛ k t j ʊ m n ɛ m	a fː ɛ k t j oː n ɛ m
a k ɛ t aː b ʊ l ʊ m	a k eː t aː b ʊ l ʊ m
p a s aː r ɛ	p a n d ɛ r ɛ
m ɛ n d aː k ɛ m	m ɛ n d aː k ɛ m
r a m ʊ m	r aː m ʊ m
j uː d iː t j aː r j ʊ m	j uː d ɪ k j aː r j ʊ m
p a l aː t aː r	p a l aː t ʊ m
w kː n aː r ɛ	w eː n aː r iː
k ɔ r oː n ɪ d ɛ m	k ɔ r oː n ɪ d ɛ m
p eː d ɪ k ɛ lː ʊ m	p ɛ d iː k ɛ lː ʊ m
d ɪ ŋ n aː t j oː n ɛ m	d ɪ ŋ n aː t j oː n ɛ m
k ɔ n s ɛ kʷ iː r ɛ	k oː n s ɛ kʷ iː
k ɔ l ʊ m b ɛ m	k ɔ l ʊ m b a m
a s t a m	h a s t a m
w ɛ r ɪ t aː t ɛ m	w eː r ɪ t aː t ɛ m
ɪ m p r ʊ n t ʊ m r ɛ	p r oː m uː t w aː r iː
k a t ɛ ɪ s m ʊ m	k a t eː kʰ ɪ s m ʊ m
ɛ d ɪ f ɪ k aː t j oː n ɛ m	aɪ d ɪ f ɪ k aː t j oː n ɛ m
ɪ n ɪ kʷ ʊ m	ɪ n iː kʷ ʊ m
kʷ a d r ʊ p l ɪ k aː r ɛ	kʷ a d r ʊ p l ɪ k aː r ɛ
p r aɪ m oː n iː t oː r ɛ m	p r aɪ m ɔ n ɪ t oː r ɛ m
f a b ʊ r ɪ k aː t j oː n ɛ m	f aː b r ɪ k aː t j oː n ɛ m
a eː r ɔ m a n t j a m	aː ɛ r ɔ m a n t iː a m
eː kʷ aː n ɪ m iː t aː t ɛ m	aɪ kʷ a n ɪ m ɪ t aː t ɛ m
ɛ r b aː k ɛ ʊ m	h ɛ r b aː k ɛu m
f ɔ k aː r j aː	f ɔ k aː r j ʊ m
r ɔ g aː r ɛ	r ɔ g aː r ɛ
s uː s n iː t aː r ɛ	s ʊ s k ɪ t aː r ɛ
b ɛ n ɛ d ɪ k aː r ɛ	b ɛ n ɛ d iː k ɛ r ɛ
a gː l uː t ɪ n a m r ɛ	a gː l uː t ɪ n aː r ɛ
t ɛ m p oː r aː l ɛ	t ɛ m p ɔ r aː l ɛ m
k ʊ n k aː r ɛ	k ʊ n ɛ aː r ɛ
k ɔ n s ʊ p t j oː n ɛ m	k oː n s uː m p t j oː n ɛ m
ɪ n f ɛ r oː r	iː n f ɛ r ʊ m
d ɛ n t aː t ʊ m	d ɛ n t aː t ʊ m
m ʊ k ɔ lː ɛ m	m uː t ʊ l ʊ m
s ɔ n ʊ m	s ɔ m n ʊ m
m a s k ʊ l iː n ʊ m	m a s k ʊ l iː n ʊ m
f ɛ t iː d ʊ m	f eː t ɪ d ʊ m
s p oː s a m	s p oː n s a m
n a f t a m	n a pʰ tʰ a m
k uː p iː d ɪ t ɛ m	k ʊ p ɪ d ɪ t aː t ɛ m
a b aː l iː ɛ n aː t j oː n ɛ m	a b a l ɪ eː n aː t j oː n ɛ m
n ɛ m ɔ r aː l ɛ	n ɛ m ɔ r aː l ɛ m
ɛ k s iː g ʊ m	ɛ k s ɪ gʷ ʊ m
a g r ʊ m	a g r ʊ m
m ɛ r ɛ t r iː k ɛ	m ɛ r ɛ t r iː k ɛ m
eː w ɔ l ʊ n j n n aː r ɛ	eː w ɔ l w ɛ r ɛ
ɪ n t ɛ l ɛ g ɪ r	ɪ n t ɛ lː ɛ g ɛ r ɛ
p a l oː r ɛ	p a lː oː r ɛ m
a s aː r ʊ m	a s a r ʊ m
a sː ɔ k j aː r ɛ	a sː ɔ k j aː r ɛ
r ɛ aː ɪ r ɛ	r ɛ a g eː r ɛ
ʊ z k w oː	uː ŋ k t j oː n ɛ m
k a r m ɛ m m	k a r m ɛ n
t r ɪ m ɪ t ɛ r ɛ	t r aː m ɪ tː ɛ r ɛ
s ɪ n k ɛ r ʊ m	s ɪ ŋ k eː r ʊ m
w ɛ k a m	w ɪ k j a m
t r aː n s m uː t aː t j oː n ɛ m	t r aː n s m uː t aː t j oː n ɛ m
ɛ ʊ m	ɛu m
ɪ n uː m aː n iː t aː t ɛ m	ɪ n h uː m aː n ɪ t aː t ɛ m
d eː k p k j ɔ n aː r	d eː k ɪ p ɛ r ɛ
f uː s t a m	f ʊ s t a m
b ɛ r iː lː ʊ m	b eː r y lː ʊ m
a tː r iː b ʊ t j oː n ɛ m	a tː r ɪ b uː t j oː n ɛ m
p a r ʊ m	p a r ɛ m
ɔ r ɪ ʊ n d ʊ m	ɔ r j ʊ n d ʊ m
s ʊ m a m	s ʊ mː a m
t r aː t ɪ m oː r ɛ	t r aː d ɪ t oː r ɛ m
s a l uː t aː r ɛ	s a l uː t aː r ɛ
s a k r ʊ m	s a k r ʊ m
k r ɔ lː aː r ɛ	k ɔ rː ʊ ɛ r ɛ
k r ʊ k ɪ f eː r ʊ m	k r ʊ k ɪ f ɛ r ʊ m
k ɔ n f ɛ d ɛ r aː t j oː n ɛ m	k oː n f ɔ ɪ d ɛ r aː t j oː n ɛ m
w r ɪ n k ʊ m l ʊ m	w ɪ ŋ k ʊ l ʊ m
k a l k aː r ɛ ʊ m	k a l k aː r j ʊ m
s t uː d j ʊ m	s t ʊ d j ʊ m
l a k r ɪ m a m	l a k r ɪ m a m
f ɪ s k ʊ m	f ɪ s k ʊ m
r ɛ t ɛ m	r eː t ɛ
s ɔ ɛ m ɛ t ɛ r ɛ m	s ʊ mː ɪ tː ɛ r ɛ
b eː n ɛ f aː r ɛ m	b ɛ n ɛ f a k ɛ r ɛ
a b ɪ s m ʊ m	a b y sː ʊ m
a m b r oː s j a m	a m b r ɔ s j a m
p r oː w a m	p r oː r a m
b a l t ɪ k ʊ m	b a l t ɪ k ʊ m
s a p j ʊ m ɛ	s a p ɪ d ʊ m
k ɔ l t r ʊ m	k ʊ l t r ʊ m
m a r t j ɛ t ʊ m	m a r k ɪ d ʊ m
h k ɛ	kʷ ɛ m
s kʷ aː l ʊ m	s kʷ aː l ʊ m
s ɛ rː aː r ɛ	s ɛ r ɛ r ɛ
j uː g ɛ r ʊ m	j uː g ɛ r ʊ m
d eː f ɔ r m ɪ t aː t ɛ m	d eː f oː r m ɪ t aː t ɛ m
b a s ɛ m	b a s ɛ m
s eː k uː r ɛ m	s ɛ k uː r ɛ m
a t r aː m ɛ n t ʊ m m	aː t r aː m ɛ n t ʊ m
d eː w ʊ t ɛ m r	d eː w ɔ w eː r ɛ
s k oː t j a m	s k ɔ t j a m
a sː ɪ ŋ ʊ m	a sː ɛ sː ʊ m
ɔ r aː t j ʊ m n ɛ m	oː r aː t j oː n ɛ m
a nː ɛ k aː r ɛ	n ɛ k aː r ɛ
k l aʊ s ʊ l a m	k l aʊ s ʊ l a m
l uː k s	l uː k ɛ m
s ɪ m j a m	s iː m j a m
r ɔ s m aː r iː n ʊ m	r oː r ɛ mː a r iː n ʊ m
a n aː r k j a m	a n a r kʰ j a m
oː b l iː w j oː n ʊ m	ɔ b l iː w j oː n ɛ m
ɔ b l iː t eː r aː r ɛ	ɔ b l ɪ tː ɛ r aː r ɛ
p eː n d ɛ r ɛ	p ɛ n d eː r ɛ
p uː s t ʊ l a m	p ʊ s t ʊ l a m
ɪ s t ɪ t ʊ ɪ r ɛ	iː n s t ɪ t ʊ ɛ r ɛ
k ɛ n t ʊ r j a m	k ɛ n t ʊ r j a m
a s k ɛ n s j oː n ɛ m	a s k eː n s j oː n ɛ m
ɔ fː ɪ k ʊ m s j ʊ m	ɔ fː ɪ k j oː s ʊ m
l aʊ r ɛ r ʊ m	l aʊ r ʊ m
w ɔ k iː f ɛ r aː r ɛ	w oː k ɪ f ɛ r aː r iː
ɪ n t ɛ r m ɛ t eː r ɛ m ɛ	ɪ n t ɛ r m ɪ tː ɛ r ɛ
eː l ɪ d ɛ r ɛ	eː l iː d ɛ r ɛ
w a k iː ʊ m	w a k iː w ʊ m
k l uː ɪ n ɛ	g l uː t ɛ n
ɛ r aɪ d ɪ r ɛ	h eː r eː d ɪ t aː r ɛ
k ɔ n d ɛ k ɛ r	k ɔ n d iː k ɛ r ɛ
d ɪ k k j oː n ɛ m	d ɪ k t j oː n ɛ m
g r uː m ʊ m	g r uː m ʊ m
a ŋ s a m	a s k j a m
d ɪ k aː k ɛ	d ɪ k aː k ɛ m
s a l w aː r ɛ	s a l w aː r ɛ
f ɔ r m a m	f oː r m a m
m ɔ d iː k ʊ m	m ɔ d ɪ k ʊ m
h m m w eː r a m n ʊ m	w eː r
w ɛ r aː k ɛ	w eː r aː k ɛ m
k a n t oː r ɛ	k a n t oː r ɛ m
f a r a t ʊ m	f a r t ʊ m
p a n	p aɪ aː n ɛ m
g ɔ k ʊ n d iː t aː t ɛ m	j uː k ʊ n d ɪ t aː t ɛ m
a r k eː t iː p ʊ m	a r kʰ ɛ t y p ʊ m
r ɛ t j aː r j ʊ m	r eː t j aː r j ʊ m
a n t iː s t ɛ r ɛ m	a n t ɪ s t ɪ t ɛ m
p ɔ p l ɪ t ʊ m	p ɔ p l ɪ t ɛ m
r uː m iː n aː r ɛ	r uː m ɪ n aː r iː
ɛ k s p ɔ r t aː t j oː n ɛ m	ɛ k s p ɔ r t aː t j oː n ɛ m
w a s ɛ lː a m	w aː s k ɛ lː ʊ m
ɪ lː uː s t r ɛ m	ɪ lː uː s t r ɛ m
d j aː	tʰ iː a m
k ɔ m p ɛ l ɪ r	k ɔ m p ɛ lː ɛ r ɛ
p r ɔ l ɔ ŋ g aː t j oː n ɛ m	p r oː l ɔ ŋ g aː t oː n ɛ m
w ɛ t uː s t ʊ m	w ɛ t ʊ s t ʊ m
l ɪ b aː r ɛ	l iː b aː r ɛ
k ɔ n s ɪ l ʊ m	k ɔ ŋ k ɪ l j ʊ m
f ɛ s t ɪ w iː t aː t ɛ m	f eː s t iː w ɪ t aː t ɛ m
a tː iː ŋ g ɛ r ɛ	a tː ɪ ŋ g ɛ r ɛ
m uː k oː s ʊ m	m uː k oː s ʊ m
f ɛ rː oː k ʊ ʊ m	w ɛ r ɪ k ʊ l ʊ m
s ɪ l iː k ʊ m	s ɪ l ɪ k j ʊ m
j uː r iː s p r ʊ d ɛ n t ɛ m	j uː r ɪ s p r uː d ɛ n t j a m
k ɔ m p r ɪ m ɛ r ɛ	k ɔ m p r ɪ m ɛ r ɛ
k ɪ l ʊ m	k ɪ l j ʊ m
ɔ b ɛ d ɛ t ɛ r	ɔ b ɔ ɪ d iː r ɛ
s a t ɪ s f aː k eː r ɛ	s a t ɪ s f a k ɛ r ɛ
m ɔ l ɛ k ʊ l a m	m oː l ɛ k ʊ l a m
p r aɪ k ɛ d eː r ɛ	p r aɪ k eː d ɛ r ɛ
s eː m ɪ l ɛ	s ɪ m ɪ l ɛ m
f kː iː m b r j aː t ʊ m	f ɪ m b r j aː t ʊ m
d eː k ɛ r n ɛ r ɛ	d eː k ɛ r n ɛ r ɛ
f a k ɛ j a m	f a k eː t j a m
k ɛ r k ɪ n ɛ m	k ɪ r k ɪ n ʊ m
k ɔ n t r aː w ɛ n ɪ r	k ɔ n t r aː w ɛ n iː r ɛ
m ɔ r d aː k ɛ	m ɔ r d aː k ɛ m
k r ʊ m t aː r	k r ʊ s t aː r ɛ
k ɔ n k ʊ rː ɛ r ɛ	k ɔ ŋ k ʊ rː ɛ r ɛ
k ɔ rː ɔ s j oː n ɛ m	k ɔ rː oː s j oː n ɛ m
k ɔ n f ɪ aː r ɛ	k oː n f iː d ɛ r ɛ
ɛ fː l uː ɪ r ɛ	ɛ fː l ʊ ɛ r ɛ
a t oː r ɛ	a s t ʊ r ɛ m
ɔ b t ɛ m p ɛ r ɛ r ɛ	ɔ b t ɛ m p ɛ r aː r ɛ
f ɪ kː aː r ɛ	f iː g ɛ r ɛ
ɪ n f ɛ r m iː t aː t ɛ m	iː n f ɪ r m ɪ t aː t ɛ m
n ɛ r w oː s ʊ m	n ɛ r w oː s ʊ m
n a t aː l ɪ t j ʊ m	n aː t aː l iː k j ʊ m
k ɔ m p ɛ t ɛ r ɛ	k ɔ m p ɛ t ɛ r ɛ
k ɛ l a n t ɛ m	k a l ɛ n t ɛ m
a ʊ l s	a w j a m
a g r iː m ɛ n s oː r ɛ	a g r iː m eː n s oː r ɛ m
uː s aː l ɛ	uː s w aː l ɛ m
s ɛ rː a m	s ɛ rː a m
w ɪ d uː ɪ t ɛ m	w ɪ d ʊ ɪ t aː t ɛ m
l ɪ t iː g aː r ɛ	l iː t ɪ g aː r ɛ
