aɪ k j a	ɪ t j a m
l eː k ʊ m	l aː ɪ k ʊ m
ɛ s k ɔ p r ʊ m ʊ	s k a l p r ʊ m
r a p iː r ɛ	r a p ɛ r ɛ
l ɪ m ʊ m	l iː m ʊ m
k ɔ n s ɪ ʊ m	k oː n s k j ʊ m
d eː p ɔ r t aː r ɛ	d eː p ɔ r t aː r ɛ
ɛ k s k oː g iː t aː t j oː n ɛ m	ɛ k s k oː g ɪ t aː t j oː n ɛ m
t aː r k ʊ f aː m ʊ m	t uː b ɛ r
p ɔ r k r ɛ n	p ɔ r t j oː n ɛ m
n ɔ m ɪ n aː r ɛ	n oː m ɪ n aː r ɛ
s ɔ m aː r j ʊ m	s ʊ mː aː r j ʊ m
ɔ l iː g aː r kʰ ɪ k ʊ m	ɔ l ɪ g a r kʰ ɪ k ʊ m
a n iː m aː l ɛ	a n ɪ m a l
d eː k r ɛ t ʊ m	d eː k r eː t ʊ m
p r ɔ k ɛ l a m	p r ɔ k ɛ lː a m
b ʊ j aː r ɛ ʊ m	b ɔ aː r j ʊ m
r a p ɪ d ʊ m	r a p ɪ d ʊ m
s k aː l j aː r ɛ	s k aː l aː r ɛ m
d ɔ l oː s ʊ m	d ɔ l oː s ʊ m
d ɪ s k r eː p a n t j a m	d ɪ s k r ɛ p a n t j a m
ɪ n f ɛ r oː r ɛ m	iː n f ɛ r ʊ m
k ɪ r k ʊ m w ɛ m n ɪ r ɛ m	k ɪ r k ʊ m w ɛ n iː r ɛ
r ɛ k l ɪ n aː r ɛ	r ɛ k l iː n aː r ɛ
a d iː r	a dː ɛ r ɛ
k ɔ d ɪ k ɪ lː ʊ m	k oː d ɪ k ɪ lː ʊ m
k ɪ n aː r ɛ	k eː n aː r ɛ
b r uː k ʊ m	b r uː kʰ ʊ m
uː gː s ɪ n oː r ɛu m ɛ m	l ʊ s k ɪ n j a m
k r uː d ɛ l ɛ	k r uː d eː l ɛ m
s ɛ r aː f ɪ k ʊ m	s ɛ r a pʰ ɪ k ʊ m
a b s oː l w ɛ r ɛ	a b s ɔ l w ɛ r ɛ
a n uː l aː r ɛ	aː n ʊ l aː r ɛ m
s eː d aː r ɛ	s eː d aː r ɛ
a ŋ g ɛ l ɪ k ʊ m	a ŋ g ɛ l ɪ k ʊ m
ɛ s ɛ r k iː t ʊ m	ɛ k s ɛ r k ɪ t ʊ m
p ɛ r g ʊ r j ʊ m	p ɛ r ɪ uː r j ʊ m
l a k aː r ɛ	l a sː aː r ɛ
ɛ k s t ɔ r k ɛ r ɛ	ɛ k s t ɔ r kʷ eː r ɛ
r ɪ eː n ɛ	r eː n ɛ m
d eː k ɪ m aː l ɛ	d ɛ k ɪ m a l ɛ m
eː l iː d ɛ r ɛ	eː l iː d ɛ r ɛ
p r a k t ɪ k ʊ m	p r a k t ɪ k ʊ m
k ɔ n f ɛ s oː r ɛ	k oː n f ɛ sː oː r ɛ m
a r aː n aː t aː	a r aː n ɛ a m
ɔ b s ɛ r j w aː r	ɔ b s ɛ r w aː r ɛ
s ɔ l aː r ɛ	s oː l aː r ɛ m
p ɛ r k oː l aː t j ʊ m n ɛ m	p ɛ r k oː l aː t j oː n ɛ m
d eː d uː k t j ʊ m n ɛ m	d eː d ʊ k t j oː n ɛ m
ɪ n w ɔ l w ɛ r ɛ	ɪ n w ɔ l w ɛ r ɛ
s t uː d j ʊ m	s t ʊ d j ʊ m
k ɔ m ɔ d ʊ m	k ɔ mː ɔ d ʊ m
d ɪ s t iː n k t ʊ m	d ɪ s t ɪ ŋ k t ʊ m
r ɛ t aː r d a m r ɛ	r ɛ t a r d aː r ɛ
p eː kʰ aː r ɛ	p ɛ kː aː r ɛ
p a r t ɪ k ʊ l a m	p a r t ɪ k ʊ l a m
w ɪ s ɛ r j a m	w ɪ s k ʊ s
k a p t ʊ r a m	k a p t uː r a m
d oː n ɛ m s t aː r	d ɛ h ɔ n ɛ s t aː r ɛ
k ɛ r t ɪ t uː m d ɪ n ɛ m	k ɛ r t ɪ t uː d ɪ n ɛ m
k ɔ n k r ɛ t j ʊ m n ɛ m	k ɔ ŋ k r eː t j oː n ɛ m
eː m aː k ɪ t aː	ɛ m aː k ɪ t aː t ɛ m
ɛ k s p ɛ k t aː t j ʊ m n ɛ m	ɛ k sː p ɛ k t aː t j oː n ɛ m
l ɛ p r aː	l ɛ p r a m
r ɔ t a m r ɛ	r ʊ k t aː r ɛ
k ɔ n t ɪ n w ʊ aː t j oː n ɛ m	k ɔ n t ɪ n w aː t j oː n ɛ m
t r a m ɪ t ɛ m	t r aː m ɪ t ɛ m
p r ɔ t ɛ s t aː r ɛ	p r oː t ɛ s t aː r iː
p uː d oː r ɛ m	p ʊ d oː r ɛ m
a l t ɛ a m	a l tʰ aɪ a m
t r iː k ɛ m	t r iː k ɛ m
a n iː m oː ɔ	a n ɪ m ʊ m
k uː ʊ m	k uː j ʊ m
n ɛ k r ɪ t ɪ a m	n ɪ g r ɪ t j a m
f ɛ rː a m m j ɛ n t a m	f ɛ rː aː m ɛ n t ʊ m
n uː m ɛ r aː r ʊ m	n ʊ m ɛ r aː r j ʊ m
p ɛ r t iː sː a m	p ɛ r t ɪ k a m
k l aɪ m ɛ n t ɪ sː ɪ m ʊ m	k l eː m eː n t ɪ sː ɪ m ʊ m
m ɛ l n ɛ m	m eː l oː n ɛ m
d eː l ɪ t j a m	d eː l ɪ k j aː s
kʷ ɪ r ɛ l a m	kʷ ɛ r eː l a m
b uː f aː l ʊ m	b uː b a l ʊ m
k ɔ n t r aː d ɪ m t oː r ɛ	k ɔ n t r aː d ɪ k t oː r ɛ m
d uː r a m t j oː n ɛ m	d uː r aː t j oː n ɛ m
k ɪ k ɛ r	k ɪ k ɛ r
w a n ɪ	w a nː ʊ m
f ɛ m ɔ r aː l ɛ	f ɛ m ɔ r aː l ɛ m
a b iː l ɛ m	h a b ɪ l ɛ m
m ɔ n t a n oː s ʊ m	m ɔ n t aː n j oː s ʊ m
ɛ r ɔ g a m r ɛ	eː r ɔ g aː r ɛ
k ɪ k aː l ɛ m a m	k ɪ k aː d a m
ɪ n d ɪ ŋ n iː t aː t ɛ m	ɪ n d ɪ ŋ n ɪ t aː t ɛ m
m eː l oː r aː r ɛ	m ɛ l j oː r aː r ɛ
d eː g r aː d aː t j oː n ɛ m	d eː g r a d aː t j oː n ɛ m
eː w ɔ k aː t j oː n ɛ m	eː w ɔ k aː t j oː n ɛ m
l ɪ b ɛ lː ʊ l a m	l iː b ɛ lː ʊ l a m
p ɛ r k ʊ s oː r ɛ	p ɛ r k ʊ sː oː r ɛ m
ɪ m p ɛ r	ɪ m p a r ɛ m
ɛ pː iː s t oː l a m	ɛ p ɪ s t ɔ l a m
k r eː s p aː r ɛ	k r ɪ s p aː r ɛ
f l aː m eː n ʊ m kʷ oː	f a m eː l ɪ k ʊ m
d a n oː s ʊ m	d a m n oː s ʊ m
ɪ n k ɛ t aː r ɛ	ɪ ŋ k ɛ p t aː r ɛ
aɪ r uː g ɪ n oː s ʊ m	aɪ r uː g ɪ n oː s ʊ m
g r aː k ɪ l ɛ	g r a k ɪ l ɛ m
aː n k oː m j ʊ m	ɛ ŋ k oː m j ʊ m
a n t r ʊ m	a n t r ʊ m
r ɛ t ɛ	r eː t ɛ
r ɛ t ɪ k ɛ r ɛ	r ɛ t ɪ k eː r ɛ
s uː b uː r b a m n ʊ m	s ʊ b ʊ r b aː n ʊ m
p l a g j ʊ m	p l a g j ʊ m
k ɪ n k ʊ n t ɛ m	kʷ iː ŋ k ʊ ŋ k ɛ m
t ʊ m	t ʊː m
k a n t j oː n ɛ m	k a n t j oː n ɛ m
a iː s a m	aː n s a m
p ɪ s t aː ɛ m	p ɪ s t aː r ɛ
f ɔ r n ɪ k aː t oː r ɛ	f ɔ r n ɪ k aː t oː r ɛ m
k ɔ l ɛ g j ʊ m	k ɔ lː eː g j ʊ m
p r ɛ w j ʊ m	p r aɪ w j ʊ m
p ɔ p ɪ r t aː t ɛ m	p aʊ p ɛ r t aː t ɛ m
ɔ pː ɔ r t uː n ɪ t t ɛ m	ɔ pː ɔ r t uː n ɪ t aː t ɛ m
p r aɪ s t aː t j oː n ɛ m	p r aɪ s t aː t j oː n ɛ m
l a b ɔ r aː t oː r j ʊ m	l a b oː r aː t oː r j ʊ m
f r aː n k ɛ s ɛ	f r a ŋ k eː n s ɛ m
g a d aː	iː l ɛ
ɪ r h d oː l ɪ n a m	h ɪ r ʊ n d ɪ n ɛ m
t r aː n s ʊ b s t ʊː n t j aː r ɛ	t r aː n s ʊ b s t a n t j aː r ɛ
t ɔ r s ʊ m	tʰ y r s ʊ m
k ɔ n s oː b r ɪ r ɛ ʊ m	k oː n s oː b r iː n ʊ m
ɪ rː ɔ m p ɛ r ɛ	ɪ rː ʊ m p ɛ r ɛ
ɪ m p uː l s ʊ m	ɪ m p ʊ l s ʊ m
t ɛ rː ɛ m oː t ʊ m	t ɛ rː aɪ m ɔ t ʊ m
ɔ b t ɪ n ɛ r ɛ	ɔ b t ɪ n eː r ɛ
m a ŋ n ɪ t uː d ɛ m	m a ŋ n ɪ t uː d ɪ n ɛ m
k l aː w ɪ k ɔ r d j ʊ m	k l aː w iː kʰ ɔ r d j ʊ m
p ɪ k t oː r ɛ	p ɪ k t oː r ɛ m
p r ɛ t ɛ k s t aː r ɛ	p r aɪ t ɛ k s ɛ r ɛ
ɔ b s ɛ k j ʊ m s ʊ m	ɔ b s ɛ kʷ j oː s ʊ m
p r ɔ l oː kʷ j ʊ m	p r oː l ɔ kʷ j ʊ m
f a l a ŋ g ɛ m	pʰ a l a ŋ g ɛ m
m uː n ɪ t j oː n	m uː n iː t j oː n ɛ m
kʷ ɛ s ɪ t ʊ m	kʷ aɪ s iː t ʊ m
p r ʊ t r a m r ɛ	p r oː t r a h ɛ r ɛ
a s p ɛ r s j oː n ɛ m	a s p ɛ r s j oː n ɛ m
f a r ɛ l ɪ ʊ m	f a r
w a r oː n	w aː r oː n ɛ m
l a t ɪ t ʊ d ɪ n ɛ m	l aː t ɪ t uː d ɪ n ɛ m
ɪ n k aː r n aː t j ɛ n ɛ	ɪ ŋ k a r n aː t j oː n ɛ m
a kː uː s aː b ɪ l ɛ	a kː uː s aː b ɪ l ɛ m
d ɪ s t r aː k t j oː n ɛ m	d ɪ s t r a k t j oː n ɛ m
tʰ r a p ɪ ʊ m	d r a pː ʊ m
k ɔ m p ɛ t ɛ r ɛ	k ɔ m p ɛ t ɛ r ɛ
f aʊ s t ʊ m	f aʊ s t ʊ m
ɪ m p aː w ɪ d ʊ m	ɪ m p a w ɪ d ʊ m
p r ɛ s aː ɛ	p r ɛ t j aː r ɛ
k a r aː k t ɛ r ɛ	kʰ a r a k t eː r ɛ m
tʰ j oː	tʰ iː ʊ m
ɪ n g ʊ g t j ʊ m n ɛ m	ɪ n j ʊ ŋ k t j oː n ɛ m
g uː r ɪ s p r ʊ d a n t a m	j uː r ɪ s p r uː d ɛ n t j a m
k ɔ n w ɛ k sː ʊ m	k ɔ n w ɛ k s ʊ m
gʷ a r d aː r ɛ	w a r d aː r ɛ
l ɪ k ɛ n	l iː kʰ eː n a
s t aː s ʊ eː t oː m	s t a t ɪ k ʊ m
ɔ m iː k ɪ t j ʊ m	h ɔ m ɪ k iː d j ʊ m
s ʊ s p ɛ n s j oː n ɛ m	s ʊ s p eː n s j oː n ɛ m
s uː k p t ʊ m	s uː m p t ʊ m
f ɛ l ʊ m n ɛ m	f ɛ lː aː r ɛ
p r ɔ g r eː d ɛ r ɛ	p r oː g r ɛ d iː
p r aɪ s eː p ɛ m	p r aɪ s aɪ p ɛ
a d j k uː d ɪ k aː r ɛ	a d ɪ uː d ɪ k aː r ɛ
p ɔ r t aː r ɛ	p ɔ r t aː r ɛ
ɪ n s ɪ ŋ n j a m	iː n s ɪ ŋ n ɛ
m ɔ n aː s t ɛ r j ʊ m	m ɔ n a s t eː r j ʊ m
eː r ɛ t ɪ g	h aɪ r ɛ t ɪ k ʊ m
a k ɛ r b ʊ m	a k ɛ r b ʊ m
a b ɛ t ɪ	a b ɪ eː t ɛ m
aʊ s p ɪ t j ʊ m	aʊ s p ɪ k j ʊ m
ɛ k s k l ʊ ɛ r ɛ	ɛ k s k l uː d ɛ r ɛ
a n a t r aː t	a n a t ɛ m
d ɛ b ɛ lː a m r ɛ	d eː b ɛ lː aː r ɛ
p r iː w aː t ʊ m	p r iː w aː t ʊ m
eː t ɔ l oː g j a m	eː tʰ ɔ l ɔ g j a m
eː r ɔ d ɛ r ɛ	eː r oː d ɛ r ɛ
r uː ɛ r	r ʊ ɛ r ɛ
s ɛ r ʊ m m	s ɛ r ʊ m
d eː n ʊ n ʊ m ʊ t j aː t ɛ m m	d eː n ʊ n t j aː t j oː n ɛ m
p a l m aː r ɛ m m	p a l m aː r ɛ m
a d iː p ɛ	a d ɪ p ɛ m
ɪ mː ɔ l aː r ɛ	ɪ mː ɔ l aː r ɛ
w ɔ m ɪ t aː r ɛ	w ɔ m ɪ t aː r ɛ
p r ɔ f eː t j a m	p r ɔ pʰ eː t iː a m
w ɪ s ɪ t a m t j ʊ m n ɛ	w iː s ɪ t aː t j oː n ɛ m
s t r aː t ʊ m	s t r aː t ʊ m
a k k ɛ s j oː n	a kː ɛ sː j oː n ɛ m
s ʊ p ɛ r ʊ m s ɛ d eː r ɛ	s ʊ p ɛ r s ɛ d eː r ɛ
m uː nː ɪ r	m uː n iː r ɛ
ɪ n d ɪ ŋ n ʊ m	ɪ n d iː ŋ n ʊ m
ɛ r a	aɪ r a m
f ɪ k ʊ m	f iː k ʊ m
b ɛ nː ɛ	b ɪ ɛ nː ɛ m
s ʊ m ɪ t n ʊ m d ɪ n ɛ m	s ʊ mː ɪ t aː t ɛ m
p uː l uː l aː r ɛ	p ʊ lː ʊ l aː r ɛ
l aʊ r ɔ k ɛ r aː s ʊ m	l aʊ r ɔ k ɛ r a s ʊ m
d ɪ l a m k eː r aː r	d iː l a k ɛ r aː r ɛ
f ɪ b uː l a m	f iː b ʊ l a m
d eː p uː r aː r ɛ	d eː p uː r aː r ɛ
d ɪ s k ʊ rː ɛ r ɛ	d ɪ s k ʊ rː ɛ r ɛ
ɪ n f ɪ g ɛ r ɛ	iː n f iː g ɛ r ɛ
f a w a m	f a b a m
w ɛ r ɪ t n ʊ m t ɛ m	w eː r ɪ t aː t ɛ m
w ɛ t ɛ r ɛ	w ɛ t ɛ r ɛ m
d uː r aː r ɛ	d uː r aː r ɛ
k ɔ n k ɪ l j aː b ʊ l ʊ m	k ɔ ŋ k ɪ l j aː b ʊ l ʊ m
s ɔ j oː n k ɛ r ʊ m	s ɔ k ɛ r ʊ m
r ɛ a m b ɪ t aː t ɛ m	r ɛ aː l ɪ t aː t ɛ m
g r aː m aː t iː k aː l	g r a mː a t ɪ k aː l ɛ m
s ʊ g j a m k eː r ɛ	s ʊ b j a k eː r ɛ
a s k ɛ l a m	a sː ʊ l a m
r eː l uː k ɛ r ɛ	r ɛ l uː k eː r ɛ
a b n ʊ ɪ r	a b n ʊ ɛ r ɛ
k a l ɪ k ɛ n	k a l ɪ k ɛ m
l ɪ t ɛ	l iː t ɛ m
b ɔ m b aː r d a m	b ɔ m b a r d a m
p r ɔ d ɪ g a m r ɛ	p r oː d ɪ g ɛ r ɛ
a sː iː s ʊ m	a sː ɛ sː ʊ m
k ɛ d r ʊ m	k ɛ d r ʊ m
k ɔ n s ɪ l j a m r ɛ	k ɔ ŋ k ɪ l j aː r ɛ
p a t r ʊ m iː n j ʊ m	p a t r oː k ɪ n j ʊ m
ʊ w ɪ k ɪ t ʊ m	aʊ d iː t ʊ m
r eː t ɪ n eː r ɛ	r ɛ t ɪ n eː r ɛ
a b ɔ m aː s ʊ m	a b ɔ m aː s ʊ m
p eː l ʊ s a m	p iː l a m
j eː j ʊ n ʊ m	j eː j uː n j ʊ m
s iː uː k l iː ɛ r ɛ	s iː b ɪ l aː r ɛ
k ʊ p r iː m ʊ m	k uː p r ʊ m
n ɔ b ɪ l uː n j ʊ m	n ɔ w ɪ l uː n j ʊ m
s ɔ l ɛ r ɛ	s ɔ l eː r ɛ
p ɛ r ɛ g r iː n aː r ɛ	p ɛ r ɛ g r iː n aː r iː
p ɛ r m a m n ɛ ɛ r ɛ	p ɛ r m a n eː r ɛ
ʊ r t ɪ k aː r j a m	ʊ r t iː k aː r j a m
z ɛ b r n aː l ɛ	d j ʊ r n aː l ɛ m
ɪ ŋ g ɛ n ɛ d r aː r ɛ	ɪ ŋ g ɛ n ɛ r aː r ɛ
r ɔ g ʊ m	r ɔ g ʊ m
s ɛ r m oː n ɛ m	s ɛ r m oː n ɛ m
d ɪ l ɪ g ɛ n t j a m	d iː l ɪ g ɛ n t j a m
g ɛ n t ɪ l ʊ m	g ɛ n t iː l ɛ m
d eː n uː d aː r ɛ	d eː n uː d aː r ɛ
s a sː ʊ m	s a k s ʊ m
ɪ mː uː n eː	ɪ mː uː n ɛ m
l a m a m	l aː m a m
f ɪ ɛ r ʊ m	f ɛ r ʊ m
d ɔ n ɛ m	d oː n ʊ m
a l iː	ɪ lː ʊ ŋ k
k ɔ nː ʊ m	k ʊ nː ʊ m
k a r ɔ t a m	k a r oː t a m
f ɛ n ɛu m s t r a m	f ɛ n ɛ s t r a m
ɪ n kʷ ɪ l iː n ʊ m	ɪ ŋ kʷ ɪ l iː n ʊ m
eː r a r j ʊ m	aɪ r aː r j ʊ m
t r aː n s l aː t j oː n ɛ m	t r aː n s l aː t j oː n ɛ m
a t a r	a p t aː r ɛ
k ɔ m ʊ n j oː n ɛ m	k ɔ mː uː n iː r ɛ
ɪ n f l ɪ k t j oː n ɛ m	ɪ n f l ɪ k t j oː n ɛ m
m ɛ d j ʊ m	m ɛ d j ʊ m
w ɛ k sː aː t j oː n ɛ m	w ɛ k s aː t j oː n ɛ m
d ɔ n ɪ s j aː k ʊ m	d ɪ ɔ n y s j a k ʊ m
d eː p ɛ r iː t r ɛ	d eː p ɛ r iː r ɛ
l uː k s ʊ r j a m	l ʊ k s ʊ r j a m
ɔ fː aɪ r t ɔ r j ʊ m	ɔ fː ɛ r t oː r j ʊ m
k ɔ n s ʊ m aː t j oː n ɛ m	k oː n s ʊ mː aː t j oː n ɛ m
m aɪ d ʊ m	m ɛ t ʊ m
m eː aː r	m eː j ɛ r ɛ
a d iː r ɛ m	a d iː r ɛ
l ɛ k t ɪ k a m	l ɛ k t iː k a m
w a k aː r ɛ	w a k aː r ɛ
ɪ n s ʊ m r ɛ ɪ a r ɛ	iː n s ɛ kʷ iː
m ɛ n d aː m ɛ m	m ɛ n d aː k ɛ m
g r aː w ɪ t aː t j oː n ɛ	g r a w ɪ t aː t j oː n ɛ m
p ʊ l w ɛ r iː zː aː r ɛ	p ʊ l w ɛ r iː zː aː r ɛ
s uː p ɪ n ʊ m	s ʊ p iː n ʊ m
a k k ɛ s ʊ m	a kː ɛ sː ʊ m
ɪ ɛ r oː s ʊ l iː m ɪ t aː ɛ m ʊ m	h ɪ ɛ r ɔ s ɔ l y m iː t aː n ʊ m
m ʊ l ɛ ʊ l ɛ m ɛ m	m uː t ʊ l ʊ m
t aː sː ʊ m n	t a k s ʊ m
r ɛ l ɪ g aː r ɛ	r ɛ l ɪ g aː r ɛ
ɪ t ʊ ɪ n ɛ m	t uː d ɪ n ɛ m
ɪ n k ɔ r w aː r ɛ	ɪ ŋ k ʊ r w aː r ɛ
k a n ɛ s t aː r ʊ m	k a n ɪ s t r ʊ m
k a p ɪ t ʊ l aː t j ɛ n ɛ	k a p ɪ t ʊ l aː t j oː n ɛ m
d ɪ t ʊ m	d ɪ k t ʊ m
f ɪ r ɛ	f ɪ ɛ r iː
f l ɔ r ɪ d ʊ m	f l oː r ɪ d ʊ m
r eː p oː n ɛ m	r ɛ p oː n ɛ r ɛ
ɪ mː ɛ r g ɛ r ɛ	ɪ mː ɛ r g ɛ r ɛ
m ɪ k sː t j oː n	m ɪ k s t j oː n ɛ m
a pː ɛ lː aː r ɛ	a pː ɛ lː aː r ɛ
j uː r a m m ɛ n t ʊ m	j uː r aː m ɛ n t ʊ m
f ɛ s t ɪ w iː t aː t ɛ m	f eː s t iː w ɪ t aː t ɛ m
eː l uː ɛ r	eː l ʊ ɛ r ɛ
ɪ m p ɛ t ɪ l g j ɪ n	ɪ m p ɛ t iː g ɪ n ɛ m
p ɛ r n ɪ k j oː s ʊ m	p ɛ r n ɪ k j oː s ʊ m
p a r t ɪ t j oː n ɛ m	p a r t iː t j oː n ɛ m
ɪ m p aː r t iː r ɛ	ɪ m p a r t iː r ɛ
aʊ d iː t oː r ɛ	aʊ d iː t oː r ɛ m
a s ɛ a m	a s k ɛ lː a m
ɪ n w ɛ n t r ɪ k ɛ	ɪ n w ɛ n t r iː k ɛ m
ɔ r eː g a n ʊ m	ɔ r iː g a n ʊ m
k ɪ ɔ n kʷ ɛ k	kʷ ɛ m k ʊ m kʷ ɛ
n aʊ f r aː g ʊ m	n aʊ f r a g ʊ m
ɛ k s ɪ s t ɛ r ɛ	ɛ k s ɪ s t ɛ r ɛ
b ɛ aː t ʊ m	b ɛ aː t ʊ m
ɛ k s p r iː m ɛ r ɛ	ɛ k s p r ɪ m ɛ r ɛ
k eː p a m	k aɪ p a m
d ɪ s t ɔ r s j oː n ɛ m	d ɪ s t ɔ r t j oː n ɛ m
a kː ɔ rː ɛ r ɛ	a kː ʊ rː ɛ r ɛ
ʊ s ʊ m r ɛ	uː t iː
w ɪ d uː ɪ t ɛ m	w ɪ d ʊ ɪ t aː t ɛ m
f ɛ r m ɛ n t ʊ m	f ɛ r m ɛ n t ʊ m
l uː p aː n aː r ɛ	l ʊ p aː n a r
r uː f ɔ	r uː f ʊ m
d eː n uː d aː t j oː n ɛ m	d eː n uː d aː t j oː n ɛ m
f r aː t ɛ r n ʊ m	f r aː t ɛ r n ʊ m
ɪ mː uː t aː r	ɪ mː uː t aː r ɛ
k ɔ m b ʊ m	k ʊ m b a m
ɔ b s ɛ d ɛ r ɛ	ɔ b s ɪ d eː r ɛ
k ɔ n s ɛ r w aː r ɛ	k oː n s ɛ r w aː r ɛ
s p aː t aː r ɛ	s p a t j aː r iː
l ɪ t j oː n ɛ r a m	l ɛ k t w aː r j ʊ m
s ɔ l ɪ k ɪ t uː d ɪ n ɛ m	s ɔ lː ɪ k ɪ t uː d ɪ n ɛ m
p eː r ʊ m	p eː r a m
s a m b ʊ k ʊ m	s a m b uː k ʊ m
d ɪ fː ʊ n d ɛ r ɛ	d ɪ fː ʊ n d ɛ r ɛ
r ɛ n ɔ w aː t j oː n ɛ	r ɛ n ɔ w aː t j oː n ɛ m
a r k ɪ b ɛ s k ʊ m p ʊ m	a r kʰ ɪ ɛ p ɪ s k ɔ p ʊ m
n ɛ gː l ɪ g ɛ r ɛ	n ɛ g l ɛ g ɛ r ɛ
f l ɛ k t ɛ r ɛ	f l ɛ k t ɛ r ɛ
k ɛ n ʊ m	k ɪ nː ʊ m
g r a n aː t ʊ m	g r aː n aː t ʊ m
s uː pː l ɪ k aː t j ʊ m n ɛ m	s ʊ pː l ɪ k aː t j oː n ɛ m
g r a t aː	k r aː t ɛ m
ɔ b n uː b ɪ l a m r ɛ	ɔ b n uː b ɪ l aː r ɛ
k a b ʊ m	k a w ʊ m
r ɛ f k ɛ r ɛ	r ɛ f ɪ k ɛ r ɛ
kʷ a t r aː t ʊ m	kʷ a d r aː t ʊ m
f uː m oː s ʊ m	f uː m oː s ʊ m
m uː l ʊ m	m uː l ʊ m
s k oː l ʊ m	s k ɔ p ʊ l ʊ m
r eː p uː d j a m r ɛ	r ɛ p ʊ d j aː r ɛ
p ɔ n t ɪ f iː k aː t ʊ m	p ɔ n t ɪ f ɪ k aː t ʊ m
s ʊ ɛ w j ɪ n iː r ɛ	s ʊ b w ɛ n iː r ɛ
g ʊ n t ʊ r a m	j uː ŋ k t uː r a m
k a pː ɛ lː a m	k a pː ɛ lː a m
kʷ a d r ʊ p l ɪ k aː r ɛ	kʷ a d r ʊ p l ɪ k aː r ɛ
p ɛ r g ʊ r ʊ m	p ɛ r ɪ uː r ʊ m
k ɔ n s ʊ p t j oː n ɛ m	k oː n s uː m p t j oː n ɛ m
s eː k d aː r aː	s aɪ t a m
z aː n k a m	z a ŋ kʰ a m
p uː t ʊ m	p ʊ t ʊ m
f ɔ r t ɪ t uː d ɪ n ɛ	f ɔ r t ɪ t uː d ɪ n ɛ m
k ɔ n s ɪ l j ʊ m	k ɔ ŋ k ɪ l j ʊ m
t r a k j ʊ m	tʰ r aː k j ʊ m
aʊ r iː g ɛ r ʊ m	aʊ r ɪ g ɛ r ʊ m
a lː ɛ n t aː r ʊ m r a m	a l aʊ d a m
a r b ʊ s t ɪ w ʊ m	a r b ʊ s t iː w ʊ m
ɛ ŋ s k ʊ g aː r ɛ	ɛ k sː uː k aː r ɛ
w ɛ r n aː k ʊ l ʊ m m	w ɛ r n aː k ʊ l ʊ m
w iː d ʊ m	w ɔ k ɪ t ʊ m
p r aɪ ŋ ɛ m r ʊ m ɛ m m s ɪ l ʊ m	p ɛ t r ɔ s ɛ l iː n ʊ m
s ɪ n ɔ p s iː m	s y n ɔ p s ɛ m
d eː p r ɪ m ɛ r ɛ	d eː p r ɪ m ɛ r ɛ
k a r m eː m	k a r m ɛ n
w ɛ l a m r ɛ	w eː l aː r ɛ
a r kː aː r ʊ m	a r k w aː r j ʊ m
a r g ʊ t j a m	a r g uː t j a m
ʊ n ɔ r aː b ɪ l ɛ	h ɔ n oː r aː b ɪ l ɛ m
ɛ k ɔ n d ɛ n ɛ r	k ɔ n d iː k ɛ r ɛ
r a s ɔ n aː b ɪ l ɛ m	r a t j oː n aː b ɪ l ɛ m
w ɛ s p r ʊ m	w ɛ s p ɛ r ʊ m
l a r w a m	l aː r w a m
l uː n uː l a m	l uː n ʊ l a m
b a k ʊ a m l ɛ m r aː t ʊ m	b a kː a l aʊ r ɛ a t ʊ m
t ɛ m p oː r aː r j ʊ m	t ɛ m p ɔ r aː r j ʊ m
d ɪ aː b oː l iː k ʊ m	d j a b ɔ l ɪ k ʊ m
l uː m ɪ n ʊ m l oː	ɛ lː y kʰ n j ʊ m
ɪ n k uː l k aː r ɛ	ɪ ŋ k ʊ l k aː r ɛ
k aː k t ɪ w ʊ m	k a p t iː w ʊ m
d eː k ɛ s p ɛ r a m t j oː n ɛ m	d eː s p eː r aː t j oː n ɛ m
k ɔ rː ɔ s j oː n ɛ	k ɔ rː oː s j oː n ɛ m
ɪ s iː m ʊ m	ɪ sː ɪ m ʊ m
g ɛ m ɪ n aː r ɛ	g ɛ m ɪ n aː r ɛ
d ɪ m ɪ n ʊ ɛ r ɛ	d iː m ɪ n ʊ ɛ r ɛ
ɔ l ɛ a m t ʊ m	ɔ l ɛ aː t ʊ m
k uː k ʊ m	k ɔ kʷ ʊ m
m ɛ r g ɛ r ɛ m	m ɛ r g ɛ r ɛ
a tː r aː n ɛ m r ɛ	a tː r a h ɛ r ɛ
t ɛ n k iː r ʊ ɛ	t ɛ n ʊ ɛ m
p r ɔ w ɛ eː r ɛ	p r oː w ɪ d eː r ɛ
p a n j oː n ɛ r ɛ m	p aː n aː r j ʊ m
k ɔ n s ʊ l t aː t j ɛ n ɛ	k oː n s ʊ l t aː t j oː n ɛ m
ɪ m p uː ŋ n a m r ɛ	ɪ m p ʊ ŋ n aː r ɛ
k ɔ r b eː l j n	k ɔ r b ɛ m
ɪ n k ʊ l a m	ɪ ŋ k ɔ l a m
k r a p ʊ l m a m	k r aː p ʊ l a m
eː fː iː k aː t iː t aː t ɛ m	ɛ fː ɪ k aː k ɪ t aː t ɛ m
d ɪ k t j oː n ɛ m	d ɪ k t j oː n ɛ m
t a b ɛ r n a m	t a b ɛ r n a m
k ʊ ɛ r ʊ m	k ɔ r j ʊ m
k ɔ m ɪ s j oː n ɛ m	k ɔ mː ɪ sː j oː n ɛ m
g ɛ m uː l a m	g ɛ mː ʊ l a m
w ɛ r s aː t ɪ l ɛ m	w ɛ r s aː t ɪ l ɛ m
p r ɔ w oː k aː t oː r ɛ	p r oː w ɔ k aː t oː r ɛ m
s a k r aː r ɛ	s a k r aː r ɛ
t uː r j ɪ d ʊ m	t ʊ r g ɪ d ʊ m
ɪ n f l ɛ k sː j oː n ɛ m	iː n f l ɛ k t j oː n ɛ m
s t r ɪ ŋ g ɛ r ɛ	s t r ɪ ŋ g ɛ r ɛ
s ɪ k aː r j ʊ m	s iː k aː r j ʊ m
