b j ɛ n j ʊ m	b ɪ ɛ nː j ʊ m
m a t r ɪ m oː n j ʊ m	m aː t r ɪ m oː n j ʊ m
d ɔ r aː r ɛ	d ɛ aʊ r aː r ɛ
ɪ t aː t ɛ m	t a t ɛ m
ɔ k t a w ʊ m	ɔ k t aː w ʊ m
s ɛ d aː r ɛ	s eː d aː r ɛ
ɔ b l ɪ w j oː n ɛ m	ɔ b l iː w j oː n ɛ m
s a k t ɪ m aː n a m	s ɛ p t ɪ m aː n a m
w ɛ r n ɪ k ɛ	w ɛ r n iː k ɛ m
ɔ s t ɛ n s ɪ w ʊ m	ɔ s t eː n s iː w ʊ m
s a l ɪ k ɛ t ʊ m	s a l ɪ k eː t ʊ m
ɛ n t ɛ	ɛ n s
ɪ m p ɛ lː ɛ r ɛ	ɪ m p ɛ lː ɛ r ɛ
s a ɪ b l w aː r ɛ	s iː b ɪ l aː r ɛ
r ɛ k ɛ s ɪ w ʊ m	r ɛ k ɛ sː iː w ʊ m
k ɔ t ɛ m	k oː t ɛ m
aː b r ɔ g aː r ɛ	a b r ɔ g aː r ɛ
g uː r ɛ m	ɪ uː s
k j iː n kʷ ɛ m k	kʷ ɛ m k ʊ m kʷ ɛ
m ɪ g r a r ɛ	m ɪ g r aː r ɛ
m uː l t aː r ɛ	m ʊ l t aː r ɛ
iː n k uː b ʊ m	ɪ ŋ k ʊ b ʊ m
ɛ n l j aː r ɛ	ɪ lː ɪ g aː r ɛ
s ɔ r ɔ r ɪ t aː t ɛ	s ɔ r oː r ɪ t aː t ɛ m
p r ɔ w a m	p r ɔ b a m
a k r ɛ t j oː n ɛ	a kː r eː t j oː n ɛ m
k ɪ b ʊ m	k ɪ b ʊ m
m ɛ d j a m l ɛ	m ɛ d j aː l ɛ m
ɪ s ʊ l aː t ʊ m	iː n s ʊ l aː t ʊ m
s p ɛ k ʊ j ʊ m	s p ɛ k ʊ l ʊ m
t r ɪ f ɔ l j a m t ʊ m	t r ɪ f ɔ l j aː t ʊ m
g uː d ɪ t j ɪ aː l ɛ	j uː d ɪ k j aː l ɛ m
g ʊ l a m	g ʊ l a m
m eː s t m ɪ t j ʊ m	m ɪ k s t iː k j ʊ m
p ɛ r k ɔ l a t j ʊ m n ɛ m	p ɛ r k oː l aː t j oː n ɛ m
k r ɔ t a m l ʊ m	k r ɔ t a l ʊ m
k j ɪ r j ʊ m	k eː r ɛu m
d ɛ s ɪ n ɛ n t a m	d eː s ɪ n ɛ n t j a m
a k t ʊ ʊ a l ɛ	a k t w aː l ɛ m
r a p iː r ɛ	r a p ɛ r ɛ
aʊ r ɪ k ʊ l a m	aʊ r ɪ k ʊ l a m
k a l ɪ d ɪ t aː	k a l ɪ d ɪ t aː t ɛ m
a d ɛ t aː t ɛ m	a s eː ɪ t aː t ɛ m
ɔ m ɪ t ɪ d a m	h ɔ m ɪ k iː d a m
iː n f l a t j oː n ɛ	iː n f l aː t j oː n ɛ m
a m s p ʊ m r t a m r ɛ	a s p ɔ r t aː r ɛ
ɔ b w j aː r ɛ	ɔ b w j aː r ɛ
n ʊ m w ɪ l uː n j ʊ m	n ɔ w ɪ l uː n j ʊ m
ɛ n s ɛ m	eː n s ɛ m
r ɛ p ɛ lː ɛ r ɛ	r ɛ p ɛ lː ɛ r ɛ
uː s ɪ t aː r ɛ	uː s ɪ t aː r iː
b a p t ɪ s t ɛ r j ʊ m	b a p t ɪ s t eː r j ʊ m
b r ɛ w ɛ t aː	b r ɛ w ɪ t aː t ɛ m
g r a l ʊ m	g r aː k ʊ l ʊ m
m ɪ l ɪ t aː r ɛ	m iː l ɪ t aː r ɛ
l ɛ m n aː r j ʊ m	l ɪ ŋ n aː r j ʊ m
t ʊ r p ɛ d ʊ m	t ɔ r p eː d ɪ n ɛ m
r ɛ k ɛ p t aː r ɛ	r ɛ k ɛ p t aː r ɛ
d ɔ m ɪ k ɪ l j ʊ m	d ɔ m ɪ k ɪ l j ʊ m
iː n t ɛ r d ɪ k ɛ r ɛ	ɪ n t ɛ r d iː k ɛ r ɛ
s a l t ɪ ʊ	s a l ɪ k ɛ m
a k uː m uː l a t j ʊ m n ɛ m	a kː ʊ m ʊ l aː t j oː n ɛ m
k a lː ɛ f a m k ɛ r	k a l ɛ f a k ɛ r ɛ
a p ɔ r t a m r ɛ	a pː ɔ r t aː r ɛ
ɔ s t ɪ l ɛ	h ɔ s t iː l ɛ m
a p a r a t ʊ m	a pː a r aː t ʊ m
n a w j ɪ l ʊ m	n aː w ɪ g j ʊ m
n ɔ d ɛ	n oː d aː r ɛ
p l a n t a m r ɛ	p l a n t aː r ɛ
a m l ɛ n ʊ m	a l ɪ eː n ʊ m
t ʊ r t ʊ r ɪ aː	t ʊ r t ʊ r ɛ m
s a l t ʊ m	s a l t ʊ m
l ɪ m t aː r ɛ	l iː m ɪ t aː r ɛ
p ɔ r n ɔ g r a f j aː m	p ɔ r n ɔ g r a pʰ j a m
p ɔ s ɛ s oː r ɛ	p ɔ sː ɛ sː oː r ɛ m
d ɛ g r a d a t j ʊ m n ɛ m	d eː g r a d aː t j oː n ɛ m
p r ɛ g ʊ s t a m r ɛ	p r aɪ g ʊ s t aː r ɛ
d ɛ r ɪ s oː r j ʊ m	d eː r iː s oː r j ʊ m
a lː ɛ g a t j ʊ m n ɛ m	a lː eː g aː t j oː n ɛ m
a r ɛ d ɛ	h eː r eː d ɛ m
s ʊ t r ɛ r ɛ	s ʊ b t r a h ɛ r ɛ
m ɪ l j aː r j ɛ m	m iː lː j aː r j ʊ m
aʊ d ɪ t j oː n ɛ	aʊ d iː t j oː n ɛ m
s ɛ r w ɪ t ʊ t ʊ	s ɛ r w ɪ t uː t ɛ m
s ɛ p ʊ lː m aː r ɛ	s ɛ p ɛ l iː r ɛ
j ɛ ɛ m m a l ɛ	h ɪ ɛ m aː l ɛ m
kʷ r ɪ b ʊ m	k r iː b r ʊ m
t r a d ɪ t oː r ɛ	t r aː d ɪ t oː r ɛ m
w a m k ɪ lː a m t j ʊ m n ɛ m	w a k ɪ lː aː t j oː n ɛ m
p r ɛ s ɛ n t j a m	p r aɪ s k ɪ ɛ n t j a m
kʷ a t r aː t ʊ m	kʷ a d r aː t ʊ m
d ɪ t ʊ m	aʊ d iː t ʊ m
t r ɛ m oː r ɛ	t r ɛ m oː r ɛ m
ɔ r t ʊ g r a f j a m	ɔ r tʰ ɔ g r a pʰ j a m
s ɛ n s w ʊ a l ɪ t aː t ɛ m	s ɛ n s w aː l ɪ t aː t ɛ m
r ɛ k j ɛ n ɛ	r ɛ k ɛ n t ɛ m
aː k ɪ n ʊ m	a k ɪ n ʊ m
r ɔ t aː r ɛ	r ɔ t aː r ɛ
a r m aː m eː n t ʊ m	a r m aː m ɛ n t ʊ m
n ʊ t r ɪ t	n uː t r iː k j ʊ m
b j ɛ t ɛ m r a b a	b eː t a m
a m b n ʊ ɪ r	a b n ʊ ɛ r ɛ
ɛ n a m rː a m t j ʊ m n ɛ m	eː n aː rː aː t j oː n ɛ m
d ɪ s p ɛ r s ɛ r ɛ	d ɪ s p ɛ r g ɛ r ɛ
d ɛ s ɪ d j a m	d eː s ɪ d j a m
k ɛ n t aʊ r j a m	k ɛ n t aʊ r eːa m
l uː b r ɪ k aː r ɛ	l uː b r ɪ k aː r ɛ
f ɛ n ʊ m	f aɪ n ʊ m
t ɪ p uː l a m	t ɪ pː ʊ l a m
ɛ b a n ʊ m	h ɛ b ɛ n ʊ m
a n ɪ m a l ɛ	a n ɪ m a l
m ɛ t ɛ r ɛ	m ɪ tː ɛ r ɛ
a d ɔ n k ʊ m	a d ʊ ŋ k ʊ m
ɛ m s aː j ʊ m	ɛ k s a g j ʊ m
b r uː k ʊ m	b r uː kʰ ʊ m
kʷ r ɪ b r aː r ɛ	k r iː b r aː r ɛ
w ɪ n aː t j a m	w iː n aː k ɛu m
d ɛ f ɔ r m ɛ	d eː f oː r m ɛ m
t ɛ n t aː r	t ɛ n t aː r ɛ
ɪ n k ʊ rː ɛ r ɛ	ɪ ŋ k ʊ rː ɛ r ɛ
n ʊ s ʊ k ɔ m j ʊ m	n ɔ s ɔ k ɔ m iː ʊ m
iː n s ɛ r ɪ r ɛ	iː n s ɛ r ɛ r ɛ
k oː n ɔ p ɛ ʊ m	k oː n oː p eː ʊ m
g ɛ n ɛ m r ɛ m	g ɛ n ʊ s
d ɪ s p ʊ s aː r ɛ	d eː s p oː n s aː r ɛ
k a m n ʊ t ʊ	k aː n uː t ʊ m
d ɪ w ɪ n aː r ɛ	d iː w iː n aː r ɛ
k ɔ l uː b r ɪ n ʊ m	k ɔ l ʊ b r iː n ʊ m
r ɪ m a n ɛ r ɛ	r ɛ m a n eː r ɛ
r ɪ p uː d j a m r ɛ	r ɛ p ʊ d j aː r ɛ
p aː b ʊ lː ʊ m	p aː b ʊ l ʊ m
iː n d ɪ ŋ n ʊ m	ɪ n d iː ŋ n ʊ m
a m r k a m n ʊ m	a r k aː n ʊ m
iː m s t ɪ t ʊ ɪ r ɛ	iː n s t ɪ t ʊ ɛ r ɛ
ɪ n ɔ w a t j ʊ m n ɛ m	ɪ nː ɔ w aː t j oː n ɛ m
r a p ɪ d ɪ t aː	r a p ɪ d ɪ t aː t ɛ m
lː ɛ n a m d ɔ r	l ɪ ŋ n aː t oː r ɛ m
p ɪ s aː r	p iː n s ɛ r ɛ
d uː b j ʊ m	d ʊ b j ʊ m
ɪ m mː ɔ l aː r ɛ	ɪ mː ɔ l aː r ɛ
n ʊ n t j ʊ m	n uː n t j ʊ m
k a m p j aː n ɛ	k a m p j oː n ɛ m
d ɛ n t aː t ʊ m	d ɛ n t aː t ʊ m
a b d ɔ m ɛ n	a b d oː m ɛ n
k aː p l ʊ m	k a p ʊ l ʊ m
ɛ k s uː lː t ɛ	ɛ k s ʊ l t aː r ɛ
iː m p uː d ɛ n t ɛ	ɪ m p ʊ d ɛ n t ɛ m
m aː s a m	m a sː a m
ɔ n ɔ m a t ɔ p ɛ j a m	ɔ n ɔ m a t ɔ p ɔ ɪ j a m
k a l ɪ g ɪ n oː s ʊ m	k aː l iː g ɪ n oː s ʊ m
n ɛ b oː s ʊ m	n ɪ w oː s ʊ m
k lː aʊ s uː lː a m	k l aʊ s ʊ l a m
a k k ɛ s oː r j ʊ m	a kː ɛ sː oː r j ʊ m
p a l uː d ɛ	p a l uː d ɛ m
k uː j	k uː j ʊ m
r ɛ t a r d a m r ɛ	r ɛ t a r d aː r ɛ
d j aː b ʊ m l ʊ m	d j a b ɔ l ʊ m
d ɛ f r aʊ d a m t j ʊ m n ɛ m	d eː f r aʊ d aː t j oː n ɛ m
p l a t ɛ ɛ a m	p l a t eːa m
uː m uː s	h ʊ m ʊ m
ʊ m b r oː s ʊ m	ʊ m b r oː s ʊ m
ɪ m p ɛ r a t r ɪ k ɛ	ɪ m p ɛ r aː t r iː k ɛ m
ɪ r a s ɪ b ɪ l ɛ	iː r aː s k ɪ b ɪ l ɛ m
m ɔ s ʊ m	m ɔ r s ʊ m
m a lː ɛ d ɪ k t j oː n	m a l ɛ d ɪ k t j oː n ɛ m
d uː b ɪ t a t j ʊ m n ɛ m	d ʊ b ɪ t aː t j oː n ɛ m
p uː p a m	p uː p a m
a m t aː r	a p t aː r ɛ
a m n aː t ɪ n ʊ m	a nː oː t ɪ n ʊ m
g r ɛ g ɛ m	g r ɛ g ɛ m
a t ɛ n ɛ r ɛ	a tː ɪ n eː r ɛ
a lː oː k aː ɛ	a lː ɔ k aː r ɛ
d ɪ s ɔ n aː r ɛ	d ɪ sː ɔ n aː r ɛ
w ɪ t ɛ m	w iː t ɛ m
g r a t j oː s ʊ m	g r aː t j oː s ʊ m
p r ʊ m p uː ŋ n a m r ɛ	p r oː p ʊ ŋ n aː r ɛ
t ɔ m ʊ m	t ɔ m ʊ m
s p uː r j ʊ m	s p ʊ r j ʊ m
ɔ l ɪ g aː r k ɪ k ʊ m	ɔ l ɪ g a r kʰ ɪ k ʊ m
t ɪ n g a r ɛ	t ɪ ŋ g ɛ r ɛ
m ʊ m s k ʊ m	m ʊ s t ɛu m
s eː n ʊ m	s ɪ n ʊ m
r a n ɔ k l ʊ m l	r aː n ʊ ŋ k ʊ l ʊ m
t ɪ d a m	k iː d a m
aː r s a	a s k j a m
b ʊ ɛ r ʊ m	b uː t y r ʊ m
d ɪ l uː ɪ r ɛ	d iː l ʊ ɛ r ɛ
s ʊ r t ɪ r ɛ	s ɔ r t iː r iː
k ɔ n f l ɪ k t ʊ m	k oː n f l ɪ k t ʊ m
ɪ lː uː s t r ɛ	ɪ lː uː s t r ɛ m
g r uː m ʊ m	g r uː m ʊ m
b ɛ n ɛ d ɪ n ɛ m ɪ k t j ʊ m n ɛ m	b ɛ n ɛ d ɪ k t j oː n ɛ m
a gː l uː t ɪ n a m r ɛ	a gː l uː t ɪ n aː r ɛ
p ɛ r f ɪ d ʊ m	p ɛ r f ɪ d ʊ m
w ɪ k ɪ n ɪ t aː t ɛ m	w iː k iː n ɪ t aː t ɛ m
f uː g aː k ɛ	f ʊ g aː k ɛ m
k ʊ k ʊ r m b ɪ t a m	k ʊ k ʊ r b ɪ t a m
n ɛ s j	n ɛ s k iː r ɛ
p a r t ɪ k ʊ l a m	p a r t ɪ k ʊ l a m
oː l ʊ m	ʊ l ʊ m
ɪ n s k r iː w ɛ r ɛ	iː n s k r iː b ɛ r ɛ
a n ɛ k s	a nː ɛ k s ʊ m
d eː m ɔ n s t r a t j ʊ m n ɛ m	d eː m oː n s t r aː t j oː n ɛ m
r ɛ t r a k t j ʊ m n ɛ m	r ɛ t r a k t j oː n ɛ m
ɛ s t r ɪ k aː r ɛ	ɛ k s t r iː k aː r ɛ
ɔ b l ɪ t ɛ r aː r ɛ	ɔ b l ɪ tː ɛ r aː r ɛ
m ɛ t a lː ʊ m	m ɛ t a lː ʊ m
m ɔ r t a l ɪ t aː t ɛ m	m ɔ r t aː l ɪ t aː t ɛ m
k a r b ʊ n k ʊ l ʊ m	k a r b ʊ ŋ k ʊ l ʊ m
iː n s a n ʊ m	iː n s aː n ʊ m
s ɛ r ɔ t ɪ n ʊ m	s eː r oː t ɪ n ʊ m
a n t ɪ s t ɛ t ɛ	a n t ɪ s t ɪ t ɛ m
p uː s t ʊ l a m	p ʊ s t ʊ l a m
k ʊ p ɛ r t uː r a m	k ɔː p ɛ r t uː r a m
ɪ b ɪ l ɛ	ɪ b ɪ l ɛ m
s ʊ l ɛ r t ɛ	s ɔ lː ɛ r t ɛ m
k ɪ r k uː lː aː r	k ɪ r k ʊ l aː r ɛ
s ɔ lː ɪ t uː ɛ	s oː l ɪ t uː d ɪ n ɛ m
n a t uː r a m	n aː t uː r a m
d ɪ s p ɛ r ɪ r ɛ	d ɪ s p ɛ r iː r ɛ
a f ɪ r m aː r ɛ	a fː ɪ r m aː r ɛ
ɛ m s p a n d ɛ r ɛ	ɛ k s p a n d ɛ r ɛ
k ɔ n s ɪ ŋ n a t j oː n	k oː n s ɪ ŋ n aː t j oː n ɛ m
l s a s j aː r	s a t j aː r ɛ
w ɛ r t ɪ g ɪ n oː s ʊ m	w ɛ r t iː g ɪ n oː s ʊ m
ʊ ŋ t oː ɛ m s ʊ m	uː ŋ k t ʊ oː s ʊ m
w ɔ l w ɛ r ɛ	w ɔ l w ɛ r ɛ
k a w aː r ɛ	k a w aː r ɛ
rː ɛ lː a k s a t j oː n	r ɛ l a k s aː t j oː n ɛ m
s ʊ ? j a m k ɛ r ɛ	s ʊ b j a k eː r ɛ
n ɔ m ɪ n a t j oː n ɛ	n oː m ɪ n aː t j oː n ɛ m
iː n k lː ʊ iː r	ɪ ŋ k l uː d ɛ r ɛ
ɪ n k aʊ t ʊ m	ɪ ŋ k aʊ t ʊ m
m ɔ r b ʊ m	m ɔ r b ʊ m
p j ɛ r s ɪ k a m	p ɛ r s ɪ k a m
d ɛ k ɪ m a t j ʊ m n ɛ m	d ɛ k ɪ m aː t j oː n ɛ m
w ɛ lː ʊ m	w ɪ lː ʊ m
m ɔ t ɪ w ʊ m	m oː t ɪ w ʊ m
d j ɛ k ɪ m aː r ɛ	d ɛ k ɪ m aː r ɛ
ɛ t ɛ r ɛ ʊ m	aɪ tʰ ɛ r j ʊ m
ɛ k s t a s ɪ	ɛ k s t a s ɛ m
f ɛ t ɛ r ɛ	f eː t eː r ɛ
ɛ r uː g ɪ n oː s ʊ m	aɪ r uː g ɪ n oː s ʊ m
w ɔ r a m r ɛ	w ɔ r aː r ɛ
m ɔ d ɛ r a t oː r ɛ	m ɔ d ɛ r aː t oː r ɛ m
p r ɛ d ɪ k ɪ r ɛ	p r aɪ d ɪ k aː r ɛ
d ɪ s k ʊ r s ɪ w ʊ m	d ɪ s k ʊ r s iː w ʊ m
f r ɪ k t j oː n ɛ	f r ɪ k t j oː n ɛ m
s p ɔ l j ʊ m	s p ɔ l j ʊ m
r ɔ s m a r ɪ n ʊ m	r oː s m a r iː n ʊ m
t j ʊ	t ʊː m
m a k ɪ n aː r	m aː kʰ ɪ n aː r iː
a m p s t ɛ m j ʊ m	a b s t eː m j ʊ m
r a s ɛ k aː r ɛ	r ɛ s ɛ k aː r ɛ
k ɔ n f ɛ d ɛ r a t j ʊ m n ɛ m	k oː n f ɔ ɪ d ɛ r aː t j oː n ɛ m
kʷ ɔ t ɪ d j aː n ʊ m	k ɔ t iː d j aː n ʊ m
s ɛ k ɔ l aː r ɛ m	s kʰ ɔ l aː r ɛ m
k ɪ k aː l a m	k ɪ k aː d a m
a m k ɛ r b ɪ t t eː	a k ɛ r b ɪ t aː t ɛ m
p ɛ r m ɪ t ɛ r ɛ	p ɛ r m ɪ tː ɛ r ɛ
uː m ɪ d ʊ m	h uː m ɪ d ʊ m
k r ɔ ŋ g r ɛ j ʊ m	k ɔ ŋ g r ʊ m
m a r k ɛ d ʊ m	m a r k ɪ d ʊ m
g ɛ r a r k a m	h ɪ ɛ r a r kʰ a m
p aː r ʊ m	p a r ɛ m
p ɔ m ɪ f ɛ r ʊ m	p oː m ɪ f ɛ r ʊ m
a k ɛ t ʊ m	a k eː t ʊ m
d ɛ ɪ t aː t ɛ m	d ɛ ɪ t aː t ɛ m
ɛ b r ɛ ʊ m	h ɛ b r aɪ ʊ m
l a t r aː r ɛ	l a t r oː n ɛ m
b ɛ s t j aː r j ʊ m	b eː s t j aː r j ʊ m
a f l ɪ g ɛ r ɛ	a fː l iː g ɛ r ɛ
s ɪ t j ʊ m	s ɪ t ʊ m
k ɛ l ɛ r ɛ	k ɛ l ɛ r ɛ m
m ɛ l ʊ m n ɛ m	m eː l oː n ɛ m
uː l t ʊ m r ɛ	ʊ l t oː r ɛ m
b a l t ɪ k ʊ m	b a l t ɪ k ʊ m
w ? ʊ m	b uː b oː n ɛ m
ɛ j ʊ n aː ɛ	j eː j uː n aː r ɛ
f ɪ g uː r a m	f ɪ g uː r a m
w ɛ r n aː k ʊ l ʊ m m	w ɛ r n aː k ʊ l ʊ m
p ʊ ɛ r ɪ l ɛ	p ʊ ɛ r iː l ɛ m
k a p ɪ t ɛ lː ʊ m	k a p ɪ t ɛ lː ʊ m
r eː t ɛ n ɛ r ɛ	r ɛ t ɪ n eː r ɛ
f a r ɛ l ʊ m	f a r
l uː m ɪ n ʊ m l ɔ	ɛ lː y kʰ n j ʊ m
s p ɔ r t a m	s p ɔ r t a m
k ɔ m p r ɔ m ɛ t ɛ r ɛ	k ɔ m p r oː m ɪ tː ɛ r ɛ
d ɪ s k ɛ ŋ d ɪ n ɛ m ɛ m r ɛ	d eː s k ɛ n d ɛ r ɛ
r ɛ l ɪ kʷ j a m	r eː l ɪ kʷ j aː s
n a m t a m t ɔ r j ʊ m	n a t aː t oː r j ʊ m
m ɪ r aː k oː l ʊ m	m iː r aː k ʊ l ʊ m
p r ɔ m ɛ s a m	p r oː m ɪ sː ʊ m
ɛ r ɛ d ɪ m aː t ɛ m	h eː r eː d ɪ t aː t ɛ m
t ɪ t ɪ lː a m r ɛ	t iː t ɪ lː aː r ɛ
r ɛ s k iː n d ɛ r ɛ	r ɛ s k ɪ n d ɛ r ɛ
ɛ b ɛ t ɛ	h ɛ b ɛ t ɛ m
d ɪ m ɪ n uː ɛ r ɛ	d iː m ɪ n ʊ ɛ r ɛ
s iː m j a m	s iː m j a m
iː ŋ g uː r j a m	ɪ n ɪ uː r j a m
r ɛ g ʊ l aː r ɛ	r eː g ʊ l aː r ɛ
ʊ ŋ g ɛ r ɛ	ʊ ŋ g ɛ r ɛ
iː n w ɛ r t iː r ɛ	ɪ n w ɛ r t ɛ r ɛ
m ɪ n ɔ r aː r	m ɪ n oː r aː r ɛ
j a b l ʊ m	ɛ b ʊ l ʊ m
t a k s aː r ɛ	t a k s aː r ɛ
s uː p ɛ r b j a m	s ʊ p ɛ r b j a m
ɪ lː uː d ɪ r	ɪ lː uː d ɛ r ɛ
rː j ʊ m g ɪ r	r ɛ a g eː r ɛ
k ɛ r uː l ɛ ʊ m	k aɪ r ʊ l ɛu m
l ɪ n m ɛ aː	l iː n ɛ a m
k ɛ l ɪ b eː	k aɪ l ɪ b ɛ m
k ɔ m m uː t aː r ɛ	k ɔ mː uː t aː r ɛ
a n aː t r aː ŋ	a n a t ɛ m
b ɪ k a m	b iː g a m
t ʊ r m ɛ n t ʊ m	t ɔ r m ɛ n t ʊ m
p r ɛ w ɛ r	p r aɪ w ɪ d eː r ɛ
a m a t oː r ɛ	a m aː t oː r ɛ m
kʷ ɛ sː ɪ t ʊ m	kʷ aɪ s iː t ʊ m
k ɔ m m ɔ t j oː n ɛ	k ɔ mː oː t j oː n ɛ m
k ɪ r k ɪ n	k ɪ r k ɪ n ʊ m
p ɛ s t a r ɛ	p ɪ s t aː r ɛ
b r aː k ɛ m	b r aː k aː s
m ɛ r ɪ t ʊ m	m ɛ r ɪ t ʊ m
d j ɛ k s t r ʊ m	d ɛ k s t r ʊ m
d ɪ s ɛ k aː r ɛ	d eː s ɪ kː aː r ɛ
gʷ a r d aː r ɛ	w a r d aː r ɛ
k r ʊ lː a m r ɛ	k ɔ rː ʊ ɛ r ɛ
l ɪ t j ɛ r a m	l ɛ k t w aː r j ʊ m
d ɛ t ɛ n ɛ r ɛ	d eː t ɪ n eː r ɛ
ɛ n s a m	aː n s a m
k ɔ ŋ g r ʊ	k ɔ ŋ g r ʊː m
m a r a m w ɪ l a m	m iː r aː b ɪ l ɛ m
iː n t ɛ rː uː p t j ʊ m n ɛ m	ɪ n t ɛ rː ʊ p t j oː n ɛ m
f l ɔ r ɪ l ɛ g ʊ m	f l oː r ɪ l ɛ g j ʊ m
p l ɛ n n iː t aː	p l eː n ɪ t aː t ɛ m
m ɛ m b r a n ʊ m s ʊ m	m ɛ m b r aː n ɛu m
g a m lː ɛ g ʊ m	g a lː aɪ k ʊ m
ɔ r a t r ɪ k ɛ	ɔ r aː t r iː k ɛ m
ɛ k s p ʊ ŋ g ɛ r ɛ	ɛ k s p ʊ ŋ g ɛ r ɛ
r ʊ m ʊ m	r ʊ b ʊ m
rː ɛ d a r kʷ ɛ r	r ɛ d a r gʷ ɛ r ɛ
ɛ s t ɛ r n ʊ m	h ɛ s t ɛ r n ʊ m
k a lː w ɪ r	k a l w iː
l a ŋ gʷ ɪ d ʊ m	l a ŋ gʷ ɪ d ʊ m
b a s ɪ l ɪ k a m	b a s ɪ l ɪ k a m
a b ɔ m ɪ n aː r ɛ	a b oː m ɪ n aː r iː
p ɛ r s w a d ɛ r ɛ	p ɛ r s w aː d eː r ɛ
a p a r ɪ r ɛ	a pː aː r eː r ɛ
s ɪ l ɪ k j ʊ m	s ɪ l ɪ k j ʊ m
k ɔ a g uː l a t j ʊ m n ɛ m	k ɔ aː g ʊ l aː t j oː n ɛ m
m ʊ l t ɪ p l ɪ k a t j oː n ɛ	m ʊ l t ɪ p l ɪ k aː t j oː n ɛ m
s ɔ k ɛ r ʊ m	s ɔ k ɛ r ʊ m
r ɛ n oː s ʊ m	a r eː n oː s ʊ m
d ɪ f ʊ n d ɛ r ɛ	d ɪ fː ʊ n d ɛ r ɛ
d ɪ s k uː r s ʊ m	d ɪ s k ʊ r s ʊ m
k ɔ n s ʊ m a t j ʊ m n ɛ m	k oː n s ʊ mː aː t j oː n ɛ m
ɪ m p uː l s ʊ m	ɪ m p ʊ l s ʊ m
m a k s ɛ lː aː r ɛ	m a k s ɪ lː a r ɛ m
ɪ t aː t ɛ m	ɪ t aː t ɛ m
k ɔ n s l d a m	k oː n s ɔ l ɪ d a m
t r ɪ b ʊ l aː r ɛ	t r ɪ b ʊ l aː r ɛ
ɪ n uː s ɪ t aː t ʊ m	ɪ n uː s ɪ t aː t ʊ m
d ɪ f ɛ n s j ʊ m n ɛ m	d eː f eː n s j oː n ɛ m
p ɔ n t ɪ f ɪ k ɛ	p ɔ n t ɪ f ɪ k ɛ m
p ʊ t r ɛ	p ʊ t r ɛ m
p aː t r j a m	p a t r j a m
r ɛ p ɛ r k uː s j ʊ m n ɛ m	r ɛ p ɛ r k ʊ t ɛ r ɛ
p a l j ʊ m	p a lː j ʊ m
ɪ d oː n ɛ ʊ m	ɪ d oː n ɛu m
ɛ k s p lː a m n aː r	ɛ k s p l aː n aː r ɛ
p r ɔ l ɛ t a r j aː t ʊ m	p r oː l eː t aː r j ʊ m
f aʊ k ɪ	f aʊ k eː s
t ɛ m p ɛ r j ɪ ɛ	t ɛ m p ɛ r ɪ ɛ m
k ɔ n t ɛ s t aː r ɛ	k ɔ n t ɛ s t aː r iː
a b r ɛ w j a t j ʊ m n ɛ m	a bː r ɛ w j aː t j oː n ɛ m
ɛ k s p lː a m n a m k j oː n	ɛ k s p l aː n aː t j oː n ɛ m
t r a m s k r iː w ɛ r ɛ	t r aː n s k r iː b ɛ r ɛ
p r uː ɛ r ɛ	p r uː r iː r ɛ
m ɪ n ʊ m r ɛ	m ɪ n oː r ɛ m
l ɪ k a t j ʊ m n ɛ m	l ɪ g aː t j oː n ɛ m
ɛ k s a k t j ɔ n	ɛ k s aː k t j oː n ɛ m
ɛ b r j ʊ m	eː b r j ʊ m
s ʊ m rː ɪ d ɪ r ɛ	s ʊ b r iː d eː r ɛ
s ɛ p t ɛ n t r j oː n ɛ	s ɛ p t ɛ n t r j oː n ɛ m
t aː ŋ g ɛ r ɛ	t a ŋ g ɛ r ɛ
ɪ s t a m	ɪ s t a m
aʊ r ɪ g ɛ r ʊ m	aʊ r ɪ g ɛ r ʊ m
d ɪ w ɪ n a t j ʊ m n ɛ m	d iː w iː n aː t j oː n ɛ m
g uː r a m t oː r ɛ	j uː r aː t oː r ɛ m
p ɛ r s p ɪ k uː ɪ t aː	p ɛ r s p ɪ k ʊ ɪ t aː t ɛ m
p r aː n ɛ r ɛ	p r a n d eː r ɛ
w ɛ s t r uː k ʊ m	s t r uː tʰ j oː n ɛ m
m ɛ r k ɛ	m ɛ r k ɛ m
r ɛ m ɛ k ɛ r	r ɛ m ɪ s k eː r ɛ
w m ɛ r m ɛ	w ɛ r m ɛ m
t r ɔ n ʊ m	tʰ r ɔ n ʊ m
b a r b ʊ l aː	b a r b ʊ l a m
iː n f ʊ n d ɛ r ɛ	iː n f ʊ n d ɛ r ɛ
w a l eː r ɛ	w a l eː r ɛ
ɛ k s f ɔ lː j aː r	ɛ k s f oː l j aː r ɛ
r ɪ p a m	r iː p a m
p r ɛ t ɛ k s t aː r	p r aɪ t ɛ k s ɛ r ɛ
ɔ b l ɪ g aː r ɛ	ɔ b l ɪ g aː r ɛ
t a k s a t j ʊ m n ɛ m	t a k s aː t j oː n ɛ m
t ɪ t ɪ s ʊ m	k y t ɪ s ʊ m
r ɔ g aː r ɛ	r ɔ g aː r ɛ
ɛ n ɛ r w aː r	eː n ɛ r w aː r ɛ
a d ɔ r m iː r ɛ	a dː ɔ r m iː r ɛ
ɪ j uː n ʊ m	j eː j uː n j ʊ m
g ʊ b j ʊ m n ɛ m	g oː b j ʊ m
a n ɪ s	a n iː s ʊ m
uː s t ʊ l aː r ɛ	ʊ s t ʊ l aː r ɛ
ɛ m uː l a t ɔ r ɛ	aɪ m ʊ l aː t oː r ɛ m
r uː t ɪ lː aː r	r ʊ t ɪ l aː r ɛ
