r ɛ s a s j aː r	s a t j aː r ɛ
p a k aː r	p aː k aː r ɛ
g ʊ w ɛ n t ʊ t ʊ	j ʊ w ɛ n t uː t ɛ m
a d uː l aː r ɛ	a d uː l aː r iː
k a l iː t aː t ɛ m	kʷ aː l ɪ t aː t ɛ m
s eː l w aː t ɪ k ʊ m	s ɪ l w aː t ɪ k ʊ m
p uː l p iː t m ʊ m	p ʊ l p ɪ t ʊ m
r ʊ g ɪ k aː	r oː r ɛ m
s ɪ t ʊ l a m	s ɪ t ʊ l a m
aː k iː n ʊ m	a k ɪ n ʊ m
ɪ n k ʊ rː ɛ r ɛ	ɪ ŋ k ʊ rː ɛ r ɛ
f ɛ d ɛ	f ɪ d ɛ m
m a m n uː b r j ʊ m	m a n uː b r j ʊ m
m a s k l ʊ m l	m a s k ʊ l ʊ m
a k a d ɛ m j a m	a k a d eː m iː a m
a m k ɛ r w ʊ m	a k ɛ r w ʊ m
ɛ k s iː t ʊ m	ɛ k s ɪ t ʊ m
uː l t eː r j ʊ m r ɛ	ʊ l t ɛ r j oː r ɛ m
t uː r b a m	t ʊ r b a m
k ɔ n s ɛ n t iː r ɛ	k oː n s ɛ n t iː r ɛ
s ʊ n ɪ t ʊ m	s ɔ n ɪ t ʊ m
p ɛ r t uː r b a m t j oː n ɛ m	p ɛ r t ʊ r b aː t j oː n ɛ m
b ɔ b ʊ m	b a l b ʊ m
b a l ɛ n a m	b a lː aɪ n a m
k ɪ n t uː r a m	k ɪ ŋ k t uː r a m
d oː n oː s t aː r	d ɛ h ɔ n ɛ s t aː r ɛ
f a b r ʊ m	f a b r ʊ m
s aː t iː r ʊ m	s a t y r ʊ m
p r eː s ɛ n t a t j ʊ m n ɛ m	p r aɪ s ɛ n t aː t j oː n ɛ m
j eː l aː r ɛ	g ɛ l aː r ɛ
s ʊ l k aː r ɛ	s ʊ l k aː r ɛ
kʷ iː n t ʊ m	kʷ iː n t ʊ m
m ɪ s t uː r a m	m ɪ s t uː r a m
g r a m m iː n ɛ ʊ m	g r aː m ɪ n ɛu m
aʊ h g uː r aː r ɛ	aʊ g ʊ r aː r ɛ
a m l j ɛ n t ʊ m	a n h eː l ɪ t ʊ m
iː d ʊ m n ɛ aː m a	ɪ d oː n ɛ ɪ t aː t ɛ m
k ɔ t ɔ r n iː k ɛ	k oː t ʊ r n iː k ɛ m
ɪ n k a r n a t j ʊ m n ɛ m	ɪ ŋ k a r n aː t j oː n ɛ m
w j ɛ n t r ɛ	w ɛ n t r ɛ m
k a m p ɛ r ɛ	k a p ɛ r ɛ
f ɛ r j a m	f eː r j aː s
r uː g ʊ m s ʊ m	r uː g oː s ʊ m
p r ɔ d uː k t iː w ʊ m	p r oː d ʊ k t iː w ʊ m
ɛ k s t ɔ r k ɛ r ɛ	ɛ k s t ɔ r kʷ eː r ɛ
k j ɛ n ʊ m	k aɪ n ʊ m
kʷ aː d r uː p l ʊ m	kʷ a d r ʊ p l ʊ m
s ɔ n t eː	s ɔ n t ɛ m
p ɛ r k ɔ l a t j ʊ m n ɛ m	p ɛ r k oː l aː t j oː n ɛ m
ɛ r m a n d aː d ɛ m	g ɛ r m aː n ɪ t aː t ɛ m
ɛ k s f ɔ l j aː r	ɛ k s f oː l j aː r ɛ
s ɛ k s t ʊ m	s ɛ k s t ʊ m
k ɔ t iː d j a n ʊ m	k ɔ t iː d j aː n ʊ m
m ɔ r d aː k ɛ	m ɔ r d aː k ɛ m
s uː p ɛ r w a m k a m n ɛ ʊ m	s ʊ p ɛ r w a k aː n ɛu m
ɛ k ɔ n d ʊ k iː r	k ɔ n d iː k ɛ r ɛ
k a n t ʊ m	k a n t ʊ m
f ɛ s t ʊ m	f eː s t ʊ m
f iː r ɛ m	f ɪ ɛ r iː
iː m p ɛ lː ɛ r ɛ	ɪ m p ɛ lː ɛ r ɛ
d eː t ɛ r m iː n aː r ɛ	d eː t ɛ r m ɪ n aː r ɛ
k a t eː k iː d zː aː r ɛ	k a t eː kʰ iː zː aː r ɛ
g r ɛ m ? ʊ m	g r ɛ m j ʊ m
ʊ m l ɪ t aː r ɛ	ɔ b l iː w ɪ s k iː
k a p a k iː t aː t ɛ m	k a p aː k ɪ t aː t ɛ m
s r k iː r	s a r k iː r ɛ
aː b iː l ɛ	h a b ɪ l ɛ m
t r iː n ɪ t aː t ɛ m	t r iː n ɪ t aː t ɛ m
iː d ɛ n t iː d aː d ɛ m	iː d ɛ n t ɪ t aː t ɛ m
a s iː m iː l aː r	a sː ɪ m ʊ l aː r ɛ
b aː s aː r ɛ	b aː s j aː r ɛ
kʷ iː n kʷ ɛ n aː l ɛ	kʷ iː ŋ kʷ ɛ nː aː l ɛ m
k j ɛ m	kʷ ɪ s
m ʊ s t r aː r ɛ	m oː n s t r aː r ɛ
r ɪ n ɛ	r eː n ɛ m
d eː w j a t j ʊ m n ɛ m	d eː w j aː t j oː n ɛ m
ʊ ŋ g ɛ r ɛ	ʊ ŋ g ɛ r ɛ
ɔ b l iː g a t j oː n ɛ	ɔ b l ɪ g aː t j oː n ɛ m
p ɛ r k uː s ɔ r	p ɛ r k ʊ sː oː r ɛ m
f a l s aː r ɛ	f a l s aː r ɛ
m ʊ s t ʊ m	m ʊ s t ʊ m
aː ɪ k j aː k ʊ m	aɪ g y p t j a k ʊ m
k ɔ r w iː n ʊ m	k ɔ r w iː n ʊ m
ʊ m	ʊ m
t r iː s eː n aː r j ʊ m	t r iː k eː n aː r j ʊ m
k ɔ n t ɛ m p l a m r ɛ	k ɔ n t ɛ m p l aː r iː
g ʊ k ʊ n d ʊ m	j uː k ʊ n d ʊ m
b ʊ ? ʊ m	b uː b oː n ɛ m
t aː k t iː l ɛ	t aː k t ɪ l ɛ m
p r iː m ʊ g ɛ n iː t ʊ m	p r iː m oː g ɛ n ɪ t ʊ m
aː l t ɛ r k a t j ʊ m n ɛ m	a l t ɛ r k aː t j oː n ɛ m
k a m r n ɪ f iː k eː	k a r n ɪ f ɪ k ɛ m
k iː n j ɛ n t ʊ m s	kʷ iː ŋ g ɛ n t oː s
ɛ k s p l a m n a m k j oː n	ɛ k s p l aː n aː t j oː n ɛ m
k ɔ n t ɛ n t ʊ m	k ɔ n t ɛ n t ʊ m
r ɛ f k ɪ r ɛ	r ɛ f ɪ k ɛ r ɛ
l uː n uː l a m	l uː n ʊ l a m
ɪ n k a n t aː r ɛ	ɪ ŋ k a n t aː r ɛ
g r aː k iː l ɛ	g r a k ɪ l ɛ m
s p ʊ m r k aː r ɛ	s p ʊ r k aː r ɛ
s p ʊ s aː r ɛ	s p oː n s aː r ɛ
ɔ b s t ɛ t r iː k a m	ɔ b s t ɛ t r iː k ɛ m
l iː m ɪ t aː r ɛ	l iː m ɪ t aː r ɛ
p a l a t aː r ɛ	p a l aː t ʊ m
j ɛ l ʊ m	g ɛ l uː
a t k ʊ ɛ r iː r ɛ	a kː w iː r ɛ r ɛ
aː r k a	a r k a m
s oː l ʊ m	s oː l ʊ m
p a l uː d ɛ	p a l uː d ɛ m
ɛ s k ʊ l ʊ m	aɪ s k ʊ l ʊ m
ɛ s k r uː t aː r	s k r uː t aː r iː
k ɔ n s ɪ l ʊ m	k oː n s ɪ l j ʊ m
aː t r aː b iː l j aː r j ʊ m	aː t r a b iː l aː r j ʊ m
g uː m ɛ n t ʊ m	j uː m ɛ n t ʊ m
ɛ f l uː ɪ r ɛ	ɛ fː l ʊ ɛ r ɛ
k ɔ n s k ɛ ʊ m	k oː n s k j ʊ m
aː n ɔ n a m	a nː oː n a m
k ɔ m ɛ r k ɪ aː l ɛ	k ɔ mː ɛ r k j aː l ɛ m
ɪ n t ɛ lː ɛ g ɛ r	ɪ n t ɛ lː ɛ g ɛ r ɛ
f ʊ m ɛ n t ʊ m	f oː m ɛ n t ʊ m
t iː t iː s ʊ m	k y t ɪ s ʊ m
r ɛ k l a m a t j ɛ m n	r eː k l aː m aː t j oː n ɛ m
d iː s k ʊ r s iː w ʊ m	d ɪ s k ʊ r s iː w ʊ m
iː rː ʊ m g a m r ɛ	ɪ rː ɔ g aː r ɛ
m uː nː iː r	m ɔ n eː r ɛ
a m m ɛ n t eː	aː m ɛ n t ɛ m
p l ʊ m b aː r j ʊ m	p l ʊ m b aː r j ʊ m
iː d ɛ n t iː k ʊ m	iː d ɛ n t ɪ k ʊ m
f ɛ b ʊ m l ɛ	f l eː b ɪ l ɛ m
ʊ p ɛ r ɛ r ʊ m	ɔ p ɛ r aː r j ʊ m
p ɛ n ɛ t r aː r	p ɛ n ɛ t r aː r ɛ
d iː m ɛ n s j ʊ m n ɛ m	d iː m ɛ n s j oː n ɛ m
k ɔ m p eː t iː t oː r ɛ	k ɔ m p ɛ t iː t oː r ɛ m
s t r ɪ g a m	s t r iː g a m
p r eː m ʊ m n iː t ʊ m r eː	p r aɪ m ɔ n ɪ t oː r ɛ m
a b s ɔ l b ɛ r ɛ	a b s ɔ l w ɛ r ɛ
w iː s p eː r a m	w ɛ s p ɛ r a m
b ɪ s m h a m	b eː s t j a m
p r oː s ɛ m kʷ iː p r ɛ	p r oː s ɛ kʷ iː
m a n s ʊ eː t uː d ɪ n ɛ m	m aː n s ʊ eː t uː d ɪ n ɛ m
p r oː w a m	p r ɔ b a m
s ɛ k aː l ɛ m	s ɛ k aː l ɛ
a l ɪ ɛ n aː r ɛ	a l ɪ eː n aː r ɛ
a s iː d ʊ m	a sː ɪ d ʊː m
n ɛ p eː t ɛ m a m	n ɛ p ɛ t a m
r aː n ɔ k ʊ m	r aː n ʊ ŋ k ʊ l ʊ m
s ʊ n aː r ɛ	s ɔ m n j aː r ɛ
a d ɔ r m iː r ɛ	a dː ɔ r m iː r ɛ
p ɛ n d ɛ r ɛ	p ɛ n d eː r ɛ
d eː s j ɛ r t ʊ m	d eː s ɛ r t ʊ m
p r ɔ w ɛ n iː r ɛ	p r oː w ɛ n iː r ɛ
w ɛ r s iː f ɪ k aː r ɛ	w ɛ r s ɪ f ɪ k aː r ɛ
f l a k ʊ m	f l a kː ʊ m
k aː r ɪ k k ɛ m	k aː r ɪ k ɛ m
a gː r a w aː r ɛ	a gː r a w aː r ɛ
k ɛ n t aʊ r j aː	k ɛ n t aʊ r eːa m
w ɛ r n aː k ʊ l ʊ m m	w ɛ r n aː k ʊ l ʊ m
l ɛ n t ʊ m	l ɛ n t ʊ m
k ɔ k ʊ m	s ɔ kː ʊ m
b oː r s a m	b ʊ r s a m
b l a m n d iː t j a m	b l a n d ɪ t j a m
p l aː n ʊ m	p l aː n ʊ m
p ɛ l a m b ʊ l aː r ɛ	p ɛ r a m b ʊ l aː r ɛ
w ɪ r g ɪ n ɛ	w ɪ r g ɪ n ɛ m
iː n t iː m a t j ʊ m n ɛ m	ɪ n t ɪ m aː t j oː n ɛ m
k r iː t iː k ʊ m	k r ɪ t ɪ k ʊ m
a k t ʊ ʊ aː l ɛ	a k t w aː l ɛ m
d eː f ʊ r m iː t a t ɛ m	d eː f oː r m ɪ t aː t ɛ m
t r a m s l a t j ʊ m n ɛ m	t r aː n s l aː t j oː n ɛ m
a t iː ŋ g ɛ r ɛ	a tː ɪ ŋ g ɛ r ɛ
iː n k ʊ m b ɛ r ɛ	ɪ ŋ k ʊ m b ɛ r ɛ
ɛ r aː r j ʊ m	aɪ r aː r j ʊ m
s a m aː r ɛ	s aː n aː r ɛ
p r ɛ k ɔ n ʊ m t ɛ r ɛ	p r aɪ k ɔ ŋ n ɔ s k ɛ r ɛ
j uː g ɛ m r ʊ m	j uː g ɛ r ʊ m
p ɛ r iː m ɛ r	p ɛ r ɪ m ɛ r ɛ
d iː k t j oː n ɛ m	d ɪ k t j oː n ɛ m
s t r j a m	s t r j a m
g l a m k ʊ m	g l a k ɪ ɛ m
m uː k oː s ʊ m	m uː k oː s ʊ m
m uː l t a m	m ʊ l t a m
aː b ɪ l ɛ	aː b ɪ l ɛ m
l a m k aː r ɛ aː	l a sː aː r ɛ
w ɛ s k ʊ d	w eː s k ʊ m
p a r ɪ eː t aː l ɛ	p a r ɪ ɛ t aː l ɛ m
p ɛ r s eː k ɪ r ɛ	p ɛ r s ɛ kʷ iː
iː m p l ɔ r aː r ɛ	ɪ m p l oː r aː r ɛ
w ɛ n d ɛ m j aː r ɛ	w iː n d eː m j aː r ɛ
k a r aː k t ɛ r ɛ	kʰ a r a k t eː r ɛ m
f aː s h h ɛ m	f a s k ɛ m
s a k r iː f iː k a t oː r ɛ	s a k r ɪ f ɪ k aː t oː r ɛ m
d eː p r eː d a t j ʊ m n ɛ m	d eː p r aɪ d aː t j oː n ɛ m
f iː l j a m l ɛ	f iː l j aː l ɛ m
s ɪ m p l ɪ m ɛ m	s ɪ m p l ɪ k ɛ m
m iː s t iː k ʊ m	m y s t ɪ k ʊ m
k ɔ m m ɔ t j oː n ɛ	k ɔ mː oː t j oː n ɛ m
a n aː l ɛ	aː n aː l ɛ m
s t uː p r ʊ m	s t ʊ p r ʊ m
t uː g uː r j ʊ m	t ʊ g ʊ r j ʊ m
k aː l eː r ɛ	k a l eː r ɛ
ɛ k s p l ʊ r a m d ɔ r	ɛ k s p l oː r aː t oː r ɛ m
iː n t r ɔ d uː k t j oː n ɛ m	ɪ n t r oː d ʊ k t j oː n ɛ m
ɔ b eː d eː k ɛ r	ɔ b ɔ ɪ d iː r ɛ
a r k ɪ b ɪ s k ʊ p ʊ m	a r kʰ ɪ ɛ p ɪ s k ɔ p ʊ m
d ɔ r m iː t aː r	d ɔ r m iː t aː r ɛ
s uː f iː k j ɛ n t j a m	s ʊ fː ɪ k ɪ ɛ n t j a m
r ɪ w ʊ l w ɛ r ɛ	r ɛ w ɔ l w ɛ r ɛ
f iː l ɔ s ɔ f j a m	pʰ ɪ l ɔ s ɔ pʰ j a m
m ɛ t r ɛ ʊ m	m ɛ t r ʊ m
s aː r k iː n a m	s a r k ɪ n a m
k ʊ m p r ɔ m ɛ t ɛ r ɛ	k ɔ m p r oː m ɪ tː ɛ r ɛ
w a m r oː n	w aː r oː n ɛ m
d uː l k iː s ʊ n ʊ m	d ʊ l k ɪ s ɔ n ʊ m
s p a t j aː r ɛ	s p a t j aː r iː
d eː k aː l w a m t j ʊ m n ɛ m	d eː k a l w aː t j oː n ɛ m
w aː r j ʊ m	w a r j ʊ m
ɛ r ɛ d ɛ	h eː r eː d ɛ m
lː uː k ʊ b r ɛ k aː r ɛ	l uː k ʊ b r aː r ɛ
ɔ t j ʊ m	oː t j ʊ m
a d uː n k ʊ m	a d ʊ ŋ k ʊ m
d iː k aː k ɛ	d ɪ k aː k ɛ m
d eː w ɛ n iː r ɛ	d eː w ɛ n iː r ɛ
p ɛ l h a m	p iː l a m
r aː s ɛ k aː r ɛ	r ɛ s ɛ k aː r ɛ
d ɪ t ʊ m	d ɪ k t ʊ m
p ɔ s aː r ɛ	p aʊ s aː r ɛ
k r uː ɛ n t aː r ɛ	k r ʊ ɛ n t aː r ɛ
w a r j ɛ g a t j oː n	w a r ɪ ɛ g aː t j oː n ɛ m
k r iː m iː n ɔ s ʊ m	k r iː m ɪ n oː s ʊ m
w ɛ n eː r a t j ʊ m n ɛ m	w ɛ n ɛ r aː t j oː n ɛ m
k ɔ r ɛ a m	kʰ ɔ r eːa m
w h ɛ rː ɛ k ʊ m	w ɛ rː ɛ m
w ɔ m ɛ m r ɛ	w oː m ɛ r ɛ m
iː n uː n d a k j ɛ m m	ɪ n ʊ n d aː t j oː n ɛ m
a m b j eː k t aː r ɛ	a b ɪ k ɛ r ɛ
l ʊ s k ʊ m	l ʊ s k ʊ m
k ʊ n s ɛ r w a t j ʊ m n ɛ m	k oː n s ɛ r w aː t j oː n ɛ m
k ʊ n s ɔ l a t j ʊ m n ɛ m	k oː n s oː l aː t j oː n ɛ m
iː n mː uː t aː r	ɪ mː uː t aː r ɛ
t r a n s m ɪ t ɛ r ɛ	t r aː n s m ɪ tː ɛ r ɛ
j ɛu l k n a m a m	iː l ɪ k ɛ m
iː n g ʊ k t j ʊ m n ɛ m	ɪ n j ʊ ŋ k t j oː n ɛ m
a b g uː r a t j oː n	a b ɪ uː r aː t j oː n ɛ m
aː k ʊ ŋ	ɛ kː ʊ m
k ɔ l ɔ r aː r ɛ	k ɔ l oː r aː r ɛ
aː w ʊ m k aː r	a d w ɔ k aː r ɛ
a b a t j ɪ aː l	a bː aː t j aː l ɛ m
t ɛ n oː r ɛ	t ɛ n oː r ɛ m
s ɛ m d ɛ r ɛ	s ɛ d eː r ɛ
f ʊ r m oː s ʊ m	f oː r m oː s ʊ m
k r ɛ p r ɛ a m t uː r a m	k r ɛ p aː t uː r a m
ɪ m p a r t iː r ɛ	ɪ m p a r t iː r ɛ
a m iː k iː t j a m	a m iː k ɪ t j a m
iː n f eː l iː k ɛ	iː n f eː l iː k ɛ m
p r ɛ p ʊ m s ɪ t ʊ m	p r aɪ p ɔ s ɪ t ʊ m
p aː l p eː b r aː l	p a l p ɛ b r aː l ɛ m
f ʊ ɪ n a m	f aː g ɪ n ʊ m
k aː t aː r aː k t a m	k a t a r a k t a m
eː r ʊ m g a m r ɛ	eː r ɔ g aː r ɛ
p ʊ lː aː r ɛ	p ʊ lː aː r ɛ
kʷ ɛ s t j oː n ɛ	kʷ aɪ s t j oː n ɛ m
ɛ k s aː k t j ʊ n	ɛ k s aː k t j oː n ɛ m
k ʊ m t r ɪ b ʊ r aː r	k ɔ n t r ɪ b ʊ l aː r ɛ
ɛ k s p l a m n aː r	ɛ k s p l aː n aː r ɛ
a m nː ɛ l j ʊ m	a nː ɪ k ʊ l ʊ m
a m s ɛ t aː r	a sː ɛ k t aː r iː
k aː r a m	k a r a m
ɪ t aː t ɛ m	t a t ɛ m
ɛ b uː r n ɛ ʊ m	ɛ b ʊ r n ɛu m
ɛ m s k ɔ ɛ t ɛ r	ɛ k s k ɔ kʷ ɛ r ɛ
p r ɛ w aː l eː r ɛ	p r aɪ w a l eː r ɛ
n aː f t a m	n a pʰ tʰ a m
ɔ b s k uː r ʊ m	ɔ b s k uː r ʊ m
b aː r b ʊ l ɛ m	b a r b ʊ l a m
iː n t ɪ m p ɛ m t iː w iː t aː t eː	ɪ n t ɛ m p ɛ s t iː w ɪ t aː t ɛ m
p a r t iː t j ʊ m n ɛ m	p a r t iː t j oː n ɛ m
b ɛu l ɛ t ʊ	b oː l eː t ʊ m
s t aː n ʊ m	s t a nː ʊ m
p uː p iː lː ʊ m	p uː p ɪ lː ʊ m
ɛ kʷ iː l iː b r j ʊ m	aɪ kʷ ɪ l iː b r j ʊ m
g aː d ɛ m	iː l ɛ
f ɛ t iː d ʊ m	f eː t ɪ d ʊ m
w ɔ l uː b ɪ l ɛ	w ɔ l uː b ɪ l ɛ m
uː l t ʊ m r ɛ	ʊ l t oː r ɛ m
s ʊ b s t a n t j a m	s ʊ b s t a n t j a m
k l a pː oː n ɛ	k aː p oː n ɛ m
m ɪ l ɔ r ɛ	m ɛ l j oː r ɛ m
ɛ l iː d ɛ r ɛ	eː l iː d ɛ r ɛ
m aː l ɛ d iː k t j oː n	m a l ɛ d ɪ k t j oː n ɛ m
p l aː g j ʊ m	p l a g j ʊ m
z a m n k a m	z a ŋ kʰ a m
iː n s eː r ɪ r ɛ	iː n s ɛ r ɛ r ɛ
p r ɔ f uː g ʊ m	p r ɔ f ʊ g ʊ m
a m b eː k k j oː n	a b ɪ ɛ k t j oː n ɛ m
t m ɛ s ɔ ʊ r ʊ m	tʰ eː s aʊ r ʊ m
t ɛ d j oː s ʊ m	t aɪ d j oː s ʊ m
a pː a r ɛ n t ɛ m	a pː a r ɛ n t ɛ m
b ʊ k j ɪ n ɛ	b uː k ɪ n ʊ m
g ɪ b ɛu m	g ɪ bː ʊ m
d ʊ b l ʊ m	d ʊ p l ʊ m
aː k a m	a k j a m
m eː s k ɛ r ɛ	m ɪ s k eː r ɛ
uː l k ɛ r a m	ʊ l k ʊ s
l uː m ɪ n aː r j a m	l uː m ɪ n aː r ɛ
uː s ɪ n ɔ l ʊ	l ʊ s k ɪ n j a m
b oː rː m ɔ	b ʊ rː a m
a m nː ɔ s ʊ m	a nː oː s ʊ m
d eː w ɔ r a t j ʊ m n ɛ m	d eː w ɔ r aː t j oː n ɛ m
iː ŋ g r aː t ʊ m	ɪ ŋ g r aː t ʊ m
w iː n k ʊ l aː r ɛ	w ɪ ŋ k ʊ l aː r ɛ
w a m lː a m r ɛ	w a lː aː r ɛ
s ɛ n s a t j ʊ m n ɛ m	s eː n s aː t j oː n ɛ m
a m k uː m eː m	a k uː m ɛ n
s ʊ r g ɪ r ɛ	s ʊ r g ɛ r ɛ
n a m d a m d ɔ r	n a t aː t oː r ɛ m
t ʊ r p ɔ r	t ɔ r p oː r ɛ m
iː rː iː g a m r ɛ	ɪ rː ɪ g aː r ɛ
t ʊ r t ʊ r ɪ aː	t ʊ r t ʊ r ɛ m
r ɛ t r a k t j ʊ m n ɛ m	r ɛ t r a k t j oː n ɛ m
s p oː s a m	s p oː n s a m
kʷ ɛ s t j ɪ ɔ n aː r j ʊ m	kʷ aɪ s t j oː n aː r j ʊ m
ɛ s ɛ r k iː t ʊ m	ɛ k s ɛ r k ɪ t ʊ m
m a n s j ʊ m n ɛ m	m aː n s j oː n ɛ m
p r ɔ t ɔ k ɔ l aː r j ʊ m	p r oː t ɔ k ɔ lː aː r j ʊ m
k aː l ʊ k eː	k a l k ɛ m
d ʊ ɛ k ɛ n t ʊ m m	d ʊ k ɛ n t oː s
f ɛ s t iː w iː t aː t ɛ m	f eː s t iː w ɪ t aː t ɛ m
ɛ k s a g ɛ r a t j oː n ɛ m	ɛ k s a gː ɛ r aː t j oː n ɛ m
g ɛ n j ɪ aː l ɛ	g ɛ n j aː l ɛ m
oː s k uː l ʊ m	oː s k ʊ l ʊ m
k uː m a m	k uː n a m
a b l a k t a s j ɛ m	a b l a k t aː t j oː n ɛ m
d ɔ k t oː r ɛ	d ɔ k t oː r ɛ m
s ʊ l ɪ d aː r ɛ	s ɔ l ɪ d aː r ɛ
s k a l j aː r ɛ	s k aː l aː r ɛ m
p ɛ r k ɔ rː ɛ r ɛ	p ɛ r k ʊ rː ɛ r ɛ
d ɪ w iː n aː r ɛ	d iː w iː n aː r ɛ
a pː ɔ n ɛ m	a pː oː n ɛ r ɛ
f a m s t ɪ j ʊ m	f a s t iː d j ʊ m
a t w ɛ r t iː r ɛ	a d w ɛ r t ɛ r ɛ
aː s p aː r g ʊ m	a s p a r a g ʊ m
k r iː m iː n aː l ɛ	k r iː m ɪ n aː l ɛ m
a m k l a m r aː r	a kː l aː r aː r ɛ
a f ɪ r m a t j ʊ m n ɛ m	a fː ɪ r m aː t j oː n ɛ m
r aɪ s t aʊ r aː r ɛ	r ɛ s t aʊ r aː r ɛ
ɛ k s uː l k ɛ r a t j ʊ m n ɛ m	ɛ k s ʊ l k ɛ r aː t j oː n ɛ m
m a m t aː r ɛ	m a k t aː r ɛ
n a t aː l ɛ	n aː t aː l ɛ m
p r ɛ t eː r iː r	p r aɪ t ɛ r iː r ɛ
s eː m eː m	s eː m ɛ n
d eː s uː l t ɔ r j ʊ m	d eː s ʊ l t oː r j ʊ m
f ɔ r n iː k a t oː r ɛ	f ɔ r n ɪ k aː t oː r ɛ m
k ɔ n s t iː t uː t iː w ʊ m	k ɔ n s t ɪ t uː t ɪ w ʊ m
a r g iː lː a m	a r g ɪ lː a m
ʊ r t iː k aː r j a m	ʊ r t iː k aː r j a m
p r ɔ s t iː t ʊ ɛ r ɛ	p r oː s t ɪ t ʊ ɛ r ɛ
s a l uː t a t j oː n ɛ	s a l uː t aː t j oː n ɛ m
d aː t a m	d a t a
a m d uː n t ʊ m	a d j ʊ ŋ k t ʊ m
l aː r g ʊ m	l a r g ʊ m
r ɪ l uː k ɛ r ɛ	r ɛ l uː k eː r ɛ
d eː r iː s ɔ r j ʊ m	d eː r iː s oː r j ʊ m
t r a m m m m ɔ n t a m n ʊ m	t r aː n s m ɔ n t aː n ʊ m
p ɛ ɔ n j a m	p aɪ oː n j a m
t iː t ɛ r j oː r	k ɪ t ɛ r j oː r ɛ m
eː s t ɪ ʊ m	aɪ s t aː t ɛ m
n uː m eː m	n uː m ɛ n
kʷ a m d r uː p l iː k aː r ɛ	kʷ a d r ʊ p l ɪ k aː r ɛ
iː n w iː t aː r ɛ	ɪ n w iː t aː r ɛ
l a b ɛ r a m t oː r ɛ	l a b oː r aː t oː r ɛ m
a b uː s aː r ɛ	a b uː t iː
p r ɛ t ɛ k s t aː r	p r aɪ t ɛ k s ɛ r ɛ
k ɛ l ɛ b r ɛ m	k ɛ l ɛ b r ɛ m
r uː b iː g iː n oː s ʊ m	r oː b iː g ɪ n oː s ʊ m
k aʊ h t j oː n ɛ	k aʊ t j oː n ɛ m
s ʊ m p r a m k r ɛ ? ɛ r ɛ	s ʊ p ɛ r k r eː s k ɛ r ɛ
p r ɔ l ʊ ŋ g a t j ʊ m n ɛ m	p r oː l ɔ ŋ g aː t oː n ɛ m
iː n f ɛ k t j oː n ɛ m	ɪ n f ɛ k t j oː n ɛ m
d eː m ɔ m s t r aː r ɛ	d eː m oː n s t r aː r ɛ
k a b ɛ ʊ m	k a p ɪ t j ʊ m
s t ɛ m m ʊ m m	s t a t ɪ k ʊ m
m a s k ʊ l iː n ʊ m	m a s k ʊ l iː n ʊ m
s aː l s a m	s a l s a m
h ɛ r b oː s ʊ m	h ɛ r b oː s ʊ m
m aː l ɛ f aː r ɛ	m a l ɛ f a k ɛ r ɛ
iː r iː t aː r	ɪ rː iː t aː r ɛ
w ɛ r s aː t iː l	w ɛ r s aː t ɪ l ɛ m
a k ɛ t ʊ m	a k eː t ʊ m
k ʊ n k iː t a m t j ʊ m n ɛ m	k ɔ ŋ k ɪ t aː t j oː n ɛ m
a d ɔ r aː r ɛ	a d oː r aː r ɛ
d ɪ s p a m r t iː r ɛ	d ɪ s p a r t iː r ɛ
k r ɛ m a m r ɛ	k r ɛ m aː r ɛ
k ɛ r t iː t uː d ɪ n ɛ	k ɛ r t ɪ t uː d ɪ n ɛ m
k ɛ s aː r ɛ	k ɛ sː aː r ɛ
ɛ n ɛ r w aː r	eː n ɛ r w aː r ɛ
ɪ b r j ʊ m	eː b r j ʊ m
m eː d j a m l ɛ	m ɛ d j aː l ɛ m
t r a m s m uː t a t j ʊ m n ɛ m	t r aː n s m uː t aː t j oː n ɛ m
m a m t uː r aː r ɛ	m aː t uː r aː r ɛ
t ɛ n ɛ b r ʊ m s ʊ m	t ɛ n ɛ b r oː s ʊ m
s a m l iː w a m r ɛ	s a l iː w aː r ɛ
l iː b eː r a l iː t aː t ɛ m	l iː b ɛ r aː l ɪ t aː t ɛ m
s a k ɛ r d ɔ t j ʊ m	s a k ɛ r d oː t j ʊ m
s uː b s iː d j ʊ m	s ʊ b s ɪ d j ʊ m
k ʊ n s ɔ r t ɛ m	k oː n s ɔ r t ɛ m
g ɛ r m a n iː k ʊ m	g ɛ r m aː n ɪ k ʊ m
p r uː d ɛ r ɛ	p r uː r iː r ɛ
w iː t ɛ	w iː t ɛ m
k ɔ n k r ɛ t j ʊ m n ɛ	k ɔ ŋ k r eː t j oː n ɛ m
iː n f iː m ʊ m	iː n f ɪ m ʊ m
a m l iː t ʊ m	h aː l ɪ t ʊ m
t r iː b ʊ t ʊ m	t r ɪ b uː t ʊ m
d ɛ s p ɛ n s a m r ɛ	d ɪ s p eː n s aː r ɛ
ɛ t ɛ r ɛ ʊ m	aɪ tʰ ɛ r j ʊ m
a m b n ʊ iː r	a b n ʊ ɛ r ɛ
