p l ʊ m b a t ɪ k ɪ n ɛ ʊ m	p l ʊ m b aː g ɪ n ɛ m
d ɛ p ɛ n d ɛ r ɛ	d eː p ɛ n d eː r ɛ
k a p s g ʊ s ʊ m	k a p t j oː s ʊ m
a r k aː r ʊ m	a r k w aː r j ʊ m
k ɔ a b ɪ t aː r ɛ	k ɔ h a b ɪ t aː r ɛ
d ɔ r m ɪ t oː r j ʊ m	d ɔ r m iː t oː r j ʊ m
k r ɔ k ʊ m	k r ɔ k ʊ m
ɪ n f ɛ r k ɪ ʊ r ɛ	iː n f ɛ r ʊ m
a ɛ r ɔ m a n t j a m	aː ɛ r ɔ m a n t iː a m
p ɔ s m p oː n ɛ r ɛ	p ɔ s t p oː n ɛ r ɛ
a k ɛ r b ʊ m	a k ɛ r b ʊ m
t ɛ t r ɪ k ʊ m	t aɪ t r ɪ k ʊ m
k ʊ m p ɔ r t aː r ɛ	k ɔ m p ɔ r t aː r ɛ
ɛ s t r ɛ n a m	s t r eː n a m
b j ɛ t r eː b a m	b eː t a m
a t r a b ɪ lː j aː r j ʊ m	aː t r a b iː l aː r j ʊ m
b aː t ʊ m	b ɛ aː t ʊ m
a r k ɛ b ɪ s k ʊ p ʊ ʊ m	a r kʰ ɪ ɛ p ɪ s k ɔ p ʊ m
m ɛ r ɛ t r ɪ k ɛ	m ɛ r ɛ t r iː k ɛ m
ɪ ŋ g r aː t ʊ m	ɪ ŋ g r aː t ʊ m
s uː p ɛ r w a k aː n ɛ ʊ m	s ʊ p ɛ r w a k aː n ɛu m
k ɔ n k a t ɛ n a r ɛ	k ɔ ŋ k a t eː n aː r ɛ
s ʊ p r n a t uː r aː l ɛ	s ʊ p ɛ r n aː t uː r aː l ɛ m
t r uː k ɛ	t r ʊ k ɛ m
a m b ɪ kʷ ɪ t aː t ɛ m	a m b ɪ gʷ ɪ t aː t ɛ m
b ʊ lː ɪ r ɛ	b ʊ lː iː r ɛ
m ɪ n ʊ ɪ r ɛ	m ɪ n ʊ ɛ r ɛ
d ɪ f ɛ n s j oː n ɛ m	d eː f eː n s j oː n ɛ m
g a lː ɪ t a m	g a lː ɛ t a m
ɪ rː ɪ g aː r ɛ	ɪ rː ɪ g aː r ɛ
n ɛ k r ɪ t ɪ a m	n ɪ g r ɪ t j a m
w ɛ r n ɪ k ɛ m	w ɛ r n iː k ɛ m
d ɛ k ɔ k t j oː n ɛ m	d ɛ k ɔ k t j oː n ɛ m
k a r b ʊ n k ʊ l ʊ m	k a r b ʊ ŋ k ʊ l ʊ m
m ɔ l ɪ r ɛ	m ɔ l ɛ r ɛ
s a p oː r ɛ	s a p oː r ɛ m
d ɛ p r ɛ d a t j ʊ n ɛ m	d eː p r aɪ d aː t j oː n ɛ m
m ɔ n aː s t ɛ r j ʊ m	m ɔ n a s t eː r j ʊ m
a k uː m ɪ n aː r ɛ	a k uː m ɪ n aː r ɛ
a ŋ g ɔ s a m	a ŋ g ʊ s t j a m
f a r m a k ɪ ʊ t ɪ k ʊ m	pʰ a r m a k ɛu t ɪ k ʊ m
ɔ fː ɪ k j ʊ m	ɔ fː ɪ k j ʊ m
ɪ r s uː t ʊ m	h ɪ r s uː t ʊ m
k a r d ɪ n ɛ m	k a r d ɪ n ɛ m
a w ɛ s t r uː t ɪ ʊ m	s t r uː tʰ j oː n ɛ m
ɪ w ɪ s ɛ m	iː b ɪ k ɛ m
d ɛ p l ɔ r aː r ɛ	d eː p l oː r aː r ɛ
r ɛ t oː r ɛ	r h eː t ɔ r ɛ m
a k t ʊ ʊ aː l ɛ	a k t w aː l ɛ m
t r a n s ɪ t ʊ m	t r aː n s ɪ t ʊ m
w ɛ r ɛ k ʊ n d j a m	w ɛ r eː k ʊ n d j a m
w ɔ r t ɪ k k ɛ m	w ɔ r t ɪ k ɛ m
aʊ d aː k j	aʊ d aː k ɛ m
p r ɛ p ɔ s t ɛ r ʊ m	p r aɪ p ɔ s t ɛ r ʊ m
n uː m ɛ r a t ɔ r ɛ	n ʊ m ɛ r aː t oː r ɛ m
ɪ n t ɛ r k ɛ d ɛ r ɛ	ɪ n t ɛ r k eː d ɛ r ɛ
m ɪ n oː r ɛ	m ɪ n oː r ɛ m
ɔ r aː t j oː n ɛ m	oː r aː t j oː n ɛ m
r a s k aː r ɛ	r aː d ɛ r ɛ
ɛ k z ɛ m p l aː r ɛ	ɛ k s ɛ m p l aː r ɛ m
d ɛ s uː m ɛ r ɛ	d eː s uː m ɛ r ɛ
m a t ɛ r n ʊ m	m aː t ɛ r n ʊ m
t r ɪ t uː r a m	t r iː t uː r a m
k ʊ k ɪ n aː r j ʊ m	k ɔ kʷ iː n aː r j ʊ m
s k uː d ɪ ɛ r ʊ m	s k uː t aː r j ʊ m
p l aː n ʊ m	p l aː n ʊ m
d ɛ r ɪ s oː r j ʊ m	d eː r iː s oː r j ʊ m
a t ɛ s t aː r ɛ	a tː ɛ s t aː r iː
b aː r k a m	b a r k a m
ɔ b s ɛ d ɛ r ɛ	ɔ b s ɪ d eː r ɛ
l a k ɛ r aː r ɛ	l a k ɛ r aː r ɛ
t ɛ k s t ɪ l ɛ m	t ɛ k s t ɪ l ɛ
f ɪ s k ʊ m	f ɪ s k ʊ m
ɛ k s p r ɪ m ɛ r ɛ	ɛ k s p r ɪ m ɛ r ɛ
k r ɪ m ɪ n ɛ	k r iː m ɛ n
t oː s oː n ɛ m	t oː n s j oː n ɛ m
p ɛ s t r ɪ n ʊ m	p ɪ s t r iː n ʊ m
d ɪ s p ɔ s ɪ t j ʊ n ɛ	d ɪ s p ɔ s ɪ t j oː n ɛ m
k ʊ n f ɛ s oː r ɛ	k oː n f ɛ sː oː r ɛ m
g ʊ n s ɛ m	g ɔ m pʰ ʊ m
ɪ n ɪ t j ʊ m	ɪ n ɪ t j ʊ m
t ɔ r t ɔ r ɛ	t ɔ r t oː r ɛ m
a b aː k uː l ʊ m	a b a k ʊ l ʊ m
ɛ fː ʊ n d ɪ r ɛ	ɛ fː ʊ n d ɛ r ɛ
ɪ m pː r ɔ b aː r ɛ	ɪ m p r ɔ b aː r ɛ
k ɔ l ʊ m b ʊ m	k ɔ l ʊ m b ʊ m
m oː l n ɛ k r ɛ m	m ɔ l iː n aː r j ʊ m
s ʊ b t ɪ l ɛ	s ʊ b t iː l ɛ m
k r ɪ m ɪ n a t j oː n ɛ m	k r iː m ɪ n aː t j oː n ɛ m
m uː n ɪ f ɪ k ɛ n t j a m	m uː n ɪ f ɪ k ɛ n t j a m
p ɛ r ɛ g r ɪ n aː r ɛ	p ɛ r ɛ g r iː n aː r iː
ɪ r a s ɪ b ɪ l ɛ m	iː r aː s k ɪ b ɪ l ɛ m
p ɔ s t ɛ r ʊ m	p ɔ s t ɛ r ʊ m
ɛ k s t r iː n s ɛ k ʊ m	ɛ k s t r iː n s ɛ k ʊ m
ɪ m b ɛ r b ɛ m	ɪ m b ɛ r b ɛ m
k ʊ k ʊ m	s ɔ kː ʊ m
n j ɛ w ɪ k l m a m	n ɛ b ʊ l a m
n ɛ g aː r ɛ	n ɛ g aː r ɛ
s a l uː t a t j oː n ɛ	s a l uː t aː t j oː n ɛ m
k aː n d ɛ l ɛ m	k a n d eː l a m
b aː r a t r ʊ m	b a r a tʰ r ʊ m
m uː n ɪ t j ʊ m	m uː n iː t j oː n ɛ m
k r ɪ n ɛ m	k r iː n ɛ m
s t uː p r ʊ m	s t ʊ p r ʊ m
k ɔ lː aʊ d a r ɛ	k ɔ lː aʊ d aː r ɛ
ʊ r g ɛ r ɛ	ʊ r g eː r ɛ
f ɪ n ɪ t j oː n ɛ m	f iː n iː t j oː n ɛ m
d ɛ w j a t j ʊ n ɛ m	d eː w j aː t j oː n ɛ m
ɔ r n aː t ʊ m	oː r n aː t ʊ m
p a r ɪ r ɛ	p a r ɛ r ɛ
d ɪ f lː uː ɛ r ɛ	d ɪ fː l ʊ ɛ r ɛ
d j ɛ k ɪ m aː r ɛ	d ɛ k ɪ m aː r ɛ
p ɪ k t oː r ɛ	p ɪ k t oː r ɛ m
d ɪ w ɪ n a t j ʊ n ɛ m	d iː w iː n aː t j oː n ɛ m
k aː m b r oː n ɛ m	k r aː b r oː n ɛ m
k aː pː l ʊ m	k a p ʊ l ʊ m
k a l ɛ r ɛ	k a l eː r ɛ
g r a t ɪ f ɪ aː r ɛ	g r aː t ɪ f ɪ k aː r iː
n ʊ p j ɛ m	n uː p t j aː s
k a ɪ ɛ n t aː r ɛ	k a t eː n aː r ɛ
ɪ m a n ɛ r ɛ	m a n eː r ɛ
r ɛ k l ɪ n aː r ɛ	r ɛ k l iː n aː r ɛ
p a t ɪ ɛ r ɛ	p a t iː
s ɛ p ʊ l t uː r a m	s ɛ p ʊ l t uː r a m
d ɪ l a k ɛ r aː r ɛ	d iː l a k ɛ r aː r ɛ
j uː d j ɛ ʊ m	j uː d aɪ ʊ m
k ɔ k s a l ɛ	k ɔ k s aː l ɛ m
k l ɛ r ɪ k ʊ m	k l eː r ɪ k ʊ m
ɛ k s t ɛ n d ɛ r ɛ	ɛ k s t ɛ n d ɛ r ɛ
s p ɔ s a m	s p oː n s a m
ʊ s uː r a m	uː s uː r a m
k ʊ n k ɪ s ʊ m	k ɔ ŋ k ɪ d ɛ r ɛ
f r aː s k ʊ m	f l a s k oː n ɛ m
eː l uː d ɛ r ɛ	eː l uː d ɛ r ɛ
k ɔ r ɛ	k ɔ r
p ɔ lː aː r ɛ	p ʊ lː aː r ɛ
a n ɪ m aː l ɛ	a n ɪ m a l
ɔ r aː r ɛ	oː r aː r ɛ
s iː n s ɪ p uː t ɛ m	s ɪ ŋ k ɪ p ʊ t
b ɔ m b ʊ m	b ɔ m b ʊ m
a k ɛ t ʊ m	a k eː t ʊ m
ʊ r ɪ n a m	uː r iː n a m
s uː s k iː t aː r ɛ	s ʊ s k ɪ t aː r ɛ
a b uː z aː r ɛ	a b uː t iː
a t ɛ n d ɛ r ɛ	a tː ɛ n d ɛ r ɛ
l a n t ɛ k r ɛ m	l a ŋ k j aː r j ʊ m
ʊ s ɪ t aː t ɛ m	uː s ɪ t aː t ʊ m
k r ɛ p a t uː r a m	k r ɛ p aː t uː r a m
k l ɛ m ɛ n t ɪ s ɪ m ʊ m	k l eː m eː n t ɪ sː ɪ m ʊ m
p r ɪ s j oː n ɛ m	p r ɛ h ɛ n s j oː n ɛ m
s ɔ lː ɪ k ɪ t a t j oː n ɛ m	s ɔ lː ɪ k ɪ t aː t j oː n ɛ m
a s t ɪ l a m	a sː ʊ l a m
k ɛ n t uː r j a m	k ɛ n t ʊ r j a m
k ʊ n t r ɪ b uː ɛ r ɛ	k ɔ n t r ɪ b ʊ ɛ r ɛ
s ʊ s p ɪ r ʊ m	s ʊ s p ɪ r j ʊ m
w ɪ t ɛ lː ʊ m	w ɪ t ɛ lː ʊ m
r ɛ k ɛ n s ɪ r ɛ	r ɛ k eː n s eː r ɛ
ɪ ŋ g uː r j a m	ɪ n ɪ uː r j a m
d ɪ s kʷ ɪ s ɪ t j ʊ n ɛ	d ɪ s kʷ iː s iː t j oː n ɛ m
k a m p ɛ s t r ɛ m	k a m p ɛ s t r ɛ m
s a n a r ʊ m	z ɪ n z a l a m
s uː k g ɛ r ɛ r ɛ	s ʊ gː ɛ r ɛ r ɛ
t r ɛ t ʊ m	t r a k t ʊ m
t r l ʊ k iː r n f a t ɔ r ɛ	t r j ʊ m pʰ aː t oː r ɛ m
z ʊ ʊ r n aː l ɛ	d j ʊ r n aː l ɛ m
r ɛ l ɛ g a t j oː n ɛ m	r ɛ l eː g aː t j oː n ɛ m
s ɛ n aː r ɛ	s ɪ ŋ n aː r ɛ
ɛ r b aː k ɛ ʊ m	h ɛ r b aː k ɛu m
ɪ n f ɪ m ʊ m	iː n f ɪ m ʊ m
p r ɛ w ɛ n ɪ r ɛ	p r aɪ w ɛ n iː r ɛ
d ɪ s p ɛ t aː r ɛ	d eː s p ɛ k t aː r ɛ
ɪ w ʊ m	iː w ʊ m
m ɪ r t ʊ m	m y r t ʊ m
b a l ɛ n a m	b a lː aɪ n a m
a n ɛ l aː r ɛ	a n h eː l aː r ɛ
a pː ɛ lː aː r ɛ	a pː ɛ lː aː r ɛ
f ɛ l ɪ k ɪ t aː t ɛ m	f eː l iː k ɪ t aː t ɛ m
d eː s t r uː g ɪ r ɛ	d eː s t r ʊ ɛ r ɛ
w ɛ r ɪ f ɪ k a t j oː n ɛ	w ɛ r ɪ f ɪ k aː t j oː n ɛ m
ɪ n t ʊ ɪ ɛ	ɪ n t ʊ eː r iː
d ɛ k r ɛ m ɛ n t ʊ m	d eː k r eː m ɛ n t ʊ m
m uː n ɪ r ɛ	m uː n iː r ɛ
ɪ s k ʊ m	ɪ s k ʊ m
a b d uː k ɛ r ɛ	a b d uː k ɛ r ɛ
k ɔ a g uː l a t j oː n ɛ m	k ɔ aː g ʊ l aː t j oː n ɛ m
k ʊ n d ɪ n ʊ m	k ɔ n d ɪ ŋ n ʊ m
ɔ fː ɪ k ɪ n a m	ɔ fː ɪ k iː n a m
p lː a n ɪ t j ɛ m	p l aː n ɪ t ɪ ɛ m
s ɛ s ʊ m	s ɛ sː ʊ m
r ɔ g ʊ m	r ɔ g ʊ m
s ʊ w ɛ n ɪ r ɛ	s ʊ b w ɛ n iː r ɛ
r ɛ k t a ŋ g ʊ l ʊ m	r ɛ k t a ŋ g ʊ l ʊ m
s ʊ s t ɛ n t aː r ɛ	s ʊ s t ɛ n t aː r ɛ
s ʊ t ɪ k ɛ k t ʊ m	s ʊ b ɪ ɛ k t ʊ m
r ɪ g ɪ d ʊ m	r ɪ g ɪ d ʊ m
s p a r g ɛ r ɛ	s p a r g ɛ r ɛ
k ɪ n t uː r a m	k ɪ ŋ k t uː r a m
p r ɛ m ɔ n ɪ t ɔ r ɛ m	p r aɪ m ɔ n ɪ t oː r ɛ m
m ʊ t ɪ ʊ m	m ɔ d j ʊ m
w uː l n ɛ r aː r ɛ	w ʊ l n ɛ r aː r ɛ
t r aː w l a m	t r aː g ʊ l a m
eː w ɛ r ʊ m	w eː r ʊ m
r a s ɛ n aː r ɛ	r ɛ s ɪ ŋ n aː r ɛ
k a t ʊ l a m	k a t ɛ lː a m
ɪ lː a t ɪ w ʊ m	ɪ lː aː t iː w ʊ m
p l aː k ɪ d ʊ m	p l a k ɪ d ʊ m
a b n ɛ g aː r ɛ	a b n ɛ g aː r ɛ
t a r d ɪ m	t a r d ʊ m
k a p ɛ r ɛ	k a p ɛ r ɛ
ɪ n s t r uː ɪ r ɛ	iː n s t r ʊ ɛ r ɛ
s t ʊ pː a m	s t ʊ pː a m
d ɛ f ɔ r m a t j oː n ɛ	d eː f oː r m aː t j oː n ɛ m
d ɛ k l a m aː r ɛ	d eː k l aː m aː r ɛ
m aː d r ɛ m	m aː t r ɛ m
s uː s uː rː ʊ m	s ʊ s ʊ rː ʊ m
n a w ɪ k ɛ lː a m	n aː w ɪ k ɛ lː a m
l ɔ t ʊ m	l ʊ t ʊ m
aʊ d uː n aː r ɛ	a d uː n aː r ɛ
s uː d aː r ɛ	s uː d aː r ɛ
m ɔ d ɛ r a t oː r ɛ	m ɔ d ɛ r aː t oː r ɛ m
d j ɛ k s t r ʊ m	d ɛ k s t r ʊ m
b ɛ n ɛ f a k r ɛ	b ɛ n ɛ f a k ɛ r ɛ
w a g a b ʊ n d ʊ m	w a g aː b ʊ n d ʊ m
b ɛ n ɛ d ɪ k t j oː n ɛ m	b ɛ n ɛ d ɪ k t j oː n ɛ m
w j ɛ t ɛ r ɛ	w ɛ t ɛ r ɛ m
aʊ k k j ɔ n ɛ	aʊ k t j oː n ɛ m
k ɛ r t ɪ aː r ɛ	k ɪ r k ɪ n aː r ɛ
m ɔ l ɛ k ʊ l a m	m oː l ɛ k ʊ l a m
k ɪ b ʊ m	k ɪ b ʊ m
f j eː r a m	f ɛ r a m
m uː s a r aː n ɛ ɛ m	m uː s a r aː n ɛu m
n uː t ʊ m	n uː t ʊ m
k aː s t r ʊ m	k a s t r ʊ m
k ɔ ŋ n ɔ m ɛ n	k oː ŋ n oː m ɛ n
j uː s t ɪ f ɪ k a t j oː n ɛ	j uː s t ɪ f ɪ k aː t j oː n ɛ m
s a l uː b r ɛ m	s a l uː b r ɛ m
j uː r ʊ m	ɪ uː s
l ɪ n ɛ aː m ɛ n t ʊ m	l iː n ɛ aː m ɛ n t ʊ m
f ʊ l ɪ g ɪ n ɛ	f uː l iː g ɪ n ɛ m
p j ɛ lː aː r ʊ m	p ɛ lː aː r j ʊ m
b uː ɛ r ʊ m	b uː t y r ʊ m
t uː m ɪ d ʊ m	t ʊ m ɪ d ʊ m
p r ɔ s k r ɪ w ɛ r ɛ	p r oː s k r iː b ɛ r ɛ
eː m uː l a t ɔ r ɛ	aɪ m ʊ l aː t oː r ɛ m
m ʊ n t w oː s ʊ m	m ɔ n t ʊ oː s ʊ m
m ɛ t a lː ɪ f ɛ r ʊ m	m ɛ t a lː ɪ f ɛ r ʊ m
ʊ ŋ s w ɛ m	uː ŋ k t j oː n ɛ m
s uː p ɛ r b j a m	s ʊ p ɛ r b j a m
l uː k j ɪ d ʊ m	l uː k ɪ d ʊ m
r aː b uː l a m	r a b ʊ l a m
m ʊ l t ɪ p l ɪ k a t j oː n ɛ	m ʊ l t ɪ p l ɪ k aː t j oː n ɛ m
ɪ m pː r ɔ b ʊ m	ɪ m p r ɔ b ʊ m
r ɛ lː ɪ k j a m	r ɛ l ɪ kʷ ʊ m
d ɛ n ɔ m ɪ n a t oː r ɛ	d eː n oː m ɪ n aː t oː r ɛ m
l ɛ ɛ t ʊ m	l aɪ t ʊ m
m ɛ r k ɛ m	m ɛ r k ɛ m
ɛ rː a r ɛ	ɛ rː aː r ɛ
ɪ f ɪ k aː r ɛ	ɪ f ɪ k aː r ɛ
ɔ b s t aː r ɛ	ɔ b s t aː r ɛ
d ɛ k aː l w a t j oː n ɛ m	d eː k a l w aː t j oː n ɛ m
ɛ m ɪ g r aː n j a m	h eː m ɪ k r aː n j a m
ɛ w ɔ r l ʊ m	ɛ b ʊ r
s uː d aː r j ʊ m	s uː d aː r j ʊ m
k ʊ m p ɪ l a t j oː n ɛ m	k ɔ m p iː l aː t j oː n ɛ m
ɪ n k ɪ t a t j oː n ɛ m	ɪ ŋ k ɪ t aː t j oː n ɛ m
d ʊ k t ʊ m	d ʊ k t ʊ m
d j aː b ʊ l ʊ m	d j a b ɔ l ʊ m
s k ʊ rː ɛ r ɛ	ɛ k s k ʊ rː ɛ r ɛ
s k iː m j ʊ m	s iː m j ʊ m
r ɛ p ɛ r k uː s j oː n ɛ m	r ɛ p ɛ r k ʊ t ɛ r ɛ
k ɔ l t r ʊ m	k ʊ l t r ʊ m
f r ɪ k t j oː n ɛ	f r ɪ k t j oː n ɛ m
a r g eː n t oː s ʊ m	a r g ɛ n t oː s ʊ m
ɛ r ɛ d ɛ	h eː r eː d ɛ m
a t ɛ t aː r ɛ	oː s k ɪ t aː r ɛ
a k ɛ r b ɪ t eː t ɛ m	a k ɛ r b ɪ t aː t ɛ m
l ɪ b r a t j ʊ m	l iː b r aː t j oː n ɛ m
k ɔ n d ɔ n a r ɛ	k ɔ n d oː n aː r ɛ
k ɔ m ɛ r ɛ	k ɔ m ɛ d ɛ r ɛ
k ʊ n s ɛ r w a t j oː n ɛ m	k oː n s ɛ r w aː t j oː n ɛ m
w ɛ r ɛ k ʊ n d ʊ m	w ɛ r eː k ʊ n d ʊ m
n a w ɪ g aː r ɛ	n aː w ɪ g aː r ɛ
r ɛ t r ɔ k ɛ d ɛ r ɛ	r ɛ t r oː k eː d ɛ r ɛ
d ɛ k ɔ rː ɛ r ɛ m	d eː k ʊ rː ɛ r ɛ
d ɛ m ʊ n s t r a t j oː n ɛ m	d eː m oː n s t r aː t j oː n ɛ m
b ʊ aː t ʊ m	b ɔ aː t ʊ m
p r uː d ɛ r ɛ	p r uː r iː r ɛ
ɪ n ʊ n d aː r ɛ	ɪ n ʊ n d aː r ɛ
k ʊ ŋ g uː r aː r ɛ	k ɔ n ɪ uː r aː r ɛ
k ɔ n k a m	k ɔ ŋ kʰ a m
t ɛ m p ɛ r j ɪ ɛ	t ɛ m p ɛ r ɪ ɛ m
s ʊ n ɪ t ʊ m	s ɔ n ɪ t ʊ m
ɪ d ɔ n eː ŋ ɛ m ʊ m	ɪ d oː n ɛ ɪ t aː t ɛ m
aʊ s pː ɛ d aː r ɛ	h ɔ s p ɪ t aː r iː
a lː j ɛ n t ʊ m	a n h eː l ɪ t ʊ m
k ɛ d r ʊ m	k ɛ d r ʊ m
m a n ɪ p ʊ l ʊ m	m a n ɪ p ʊ l ʊ m
a n a r k j a m	a n a r kʰ j a m
s ɛ r aː f ɪ k ʊ m	s ɛ r a pʰ ɪ k ʊ m
ɔ r d ɪ n aː r j ʊ m	oː r d ɪ n aː r j ʊ m
w a k ɪ lː aː r ɛ	w a k ɪ lː aː r ɛ
d eː ŋ ɪ f ɪ k aː r ɛ	d ɛ ɪ f ɪ k aː r ɛ
ɛ k s ɛ m pː lː aː r ɛ	ɛ k s ɛ m p l a r
f ɛ s t ɪ w ɪ t aː t ɛ m	f eː s t iː w ɪ t aː t ɛ m
ɪ n kʷ ɪ l ɪ n ʊ m	ɪ ŋ kʷ ɪ l iː n ʊ m
p a n ɪ k ʊ m	p aː n ɪ k j ʊ m
t ɛ n ʊ ɛ	t ɛ n ʊ ɛ m
w a k a t j oː n ɛ m	w a k aː t j oː n ɛ m
ɛ pː ɪ s t ɔ l ɛ m	ɛ p ɪ s t ɔ l a m
eː k s t r uː d ɪ r ɛ	ɛ k s t r uː d ɛ r ɛ
ɪ n s uː l t ʊ m	iː n s ʊ l t ʊ m
ɪ n w ɪ t a t j oː n ɛ m	ɪ n w ɪ t aː t j oː n ɛ m
k ɔ n w ɛ k s ʊ m	k ɔ n w ɛ k s ʊ m
p r ɔ s p ɛ r aː r ɛ	p r ɔ s p ɛ r aː r ɛ
a n uː lː aː r ɛ	a nː uː lː aː r ɛ
s t aː b ɪ l ɛ m	s t a b ɪ l ɛ m
r ɛ d a r kʷ ɛ r ɛ	r ɛ d a r gʷ ɛ r ɛ
ɪ n mː ɔ r t aː l ɛ m	ɪ mː ɔ r t aː l ɛ m
a k a m	a k j a m
k ɔ s ʊ m	k ɔ k s ʊ m
eː d ɪ f ɪ k aː r ɛ	aɪ d ɪ f ɪ k aː r ɛ
a b n ʊ ɪ r ɛ	a b n ʊ ɛ r ɛ
a b ɪ t a t j oː n ɛ m	h a b ɪ t aː t j oː n ɛ m
d uː r aː r ɛ	d uː r aː r ɛ
k ɔ r t ɛ m	k oː r t ɛ m
g ɛ n ɛ s t a m	g ɛ n ɛ s t a m
r ɛ p r ɛ n s ɪ b ɪ l ɛ m	r ɛ p r ɛ h ɛ n s ɪ b ɪ l ɛ m
ɪ n mː uː t aː r ɛ	ɪ mː uː t aː r ɛ
l aː p ɪ d ɛ	l a p ɪ d ɛ m
r eː w ɛ n ɪ r ɛ	r ɛ w ɛ n iː r ɛ
k ʊ m j aː t ʊ m	k ɔ mː ɛ aː t ʊ m
a s p ɛ r s j oː n ɛ m	a s p ɛ r s j oː n ɛ m
g ɛ r m ɛ m	g ɛ r m ɛ n
a pː ɛ n d ɛ r ɛ	a pː ɛ n d ɛ r ɛ
k ɔ n s ɪ s t ɛ r ɛ	k oː n s ɪ s t ɛ r ɛ
w ɛ r m ɛ m	w ɛ r m ɛ m
s a lː a t ɪ t aː t ɛ m	s a l aː k ɪ t aː t ɛ m
s a l ɪ k ɛ t ʊ m	s a l ɪ k eː t ʊ m
t ɔ r t ʊ m	t ɔ r t ʊ m
eː l ɛ f a n t ɪ n ʊ m	ɛ l ɛ pʰ a n t ɪ n ʊ m
s k aː p ʊ l a m	s k a p ʊ l a m
g r a w aː r ɛ	g r a w aː r ɛ
a s k r ɪ w ɪ r ɛ	aː s k r iː b ɛ r ɛ
ʊ r n a m	uː r n a m
ɪ n t ɛ rː ʊ m p ɛ r ɛ	ɪ n t ɛ rː ʊ m p ɛ r ɛ
l ɪ t ɛ m	l iː t ɛ m
r a d j a t j oː n ɛ	r a d j aː t j oː n ɛ m
a n ɔ s ʊ m	a nː oː s ʊ m
b ɛ s t j aː r j ʊ m	b eː s t j aː r j ʊ m
r uː m oː r ɛ	r uː m oː r ɛ m
k ʊ m p ɛ t ɛ r ɛ	k ɔ m p ɛ t ɛ r ɛ
s ʊ s t ɛ n t aː k ʊ l ʊ m	s ʊ s t ɛ n t aː k ʊ l ʊ m
p r a n d ɛ r ɛ	p r a n d eː r ɛ
ɔ s t ɛ n t aː r ɛ	ɔ s t ɛ n t aː r ɛ
aʊ k m ɛ n t a t j oː n ɛ m	aʊ g m ɛ n t aː t j oː n ɛ m
r ɛ k ʊ n k ɪ l j aː r ɛ	r ɛ k ɔ ŋ k ɪ l j aː r ɛ
b a s ɪ l ɪ k a m	b a s ɪ l ɪ k a m
p r oː n ʊ m	p r oː n ʊ m
s ɛ g r ɛ g aː r ɛ	s eː g r ɛ g aː r ɛ
f r a t ɛ r n ʊ m	f r aː t ɛ r n ʊ m
ɪ m p uː l s ʊ m	ɪ m p ʊ l s ʊ m
p l a t a n ʊ m	p l a t a n ʊ m
n ɪ m b ʊ m	n ɪ m b ʊ m
l uː m ɪ n oː s ʊ m	l uː m ɪ n oː s ʊ m
p r ɪ m ʊ g ɛ n ɪ t ʊ m	p r iː m oː g ɛ n ɪ t ʊ m
a r aː t r ʊ m	a r aː t r ʊ m
a n ɪ m	a n iː s ʊ m
l ʊ ŋ g ɛ w ʊ m	l ɔ ŋ g aɪ w ʊ m
k ɛ r uː l ɛ ʊ m	k aɪ r ʊ l ɛu m
m ɔ r t aː r j ʊ m	m ɔ r t w aː r j ʊ m
k ʊ n s ɪ d ɛ r a t j oː n ɛ m	k oː n s iː d ɛ r aː t j oː n ɛ m
k ɔ n k ʊ r s ʊ m	k ɔ ŋ k ʊ r s ʊ m
k ʊ n s ɛ gʷ ɪ r ɛ	k oː n s ɛ kʷ iː
ʊ s ʊ m	ʊ r s ʊ m
r ɔ k ʊ m	r aʊ k ʊ m
l ɔ kʷ aː k ɛ	l ɔ kʷ aː k ɛ m
p ɛ k uː n j aː m	p ɛ k uː n j a m
f ɛ n ɪ k j ʊ m	pʰ ɔ ɪ n iː k ɛu m
ʊ n k ɪ n ʊ m	ʊ ŋ k iː n ʊ m
k ɪ r k ɪ n ɛu ʊ m	k ɪ r k ɪ n ʊ m
s eː t r ɪ g ɪ l ɛ	s t r ɪ g ɪ l ɛ m
l uː n aː t j ʊ n ɛ m	l uː n aː t j oː n ɛ m
l d aː r ɪ r ʊ m	g l iː r ɛ m
k a r a m ɛ lː ʊ m	k a l a m ɛ lː ʊ m
eː r ɔ g a r ɛ	eː r ɔ g aː r ɛ
aɪ d ɪ l ɛ m	aɪ d iː l ɛ m
k ɔ n m ɔ t j oː n ɛ	k ɔ mː oː t j oː n ɛ m
p a r s ɪ m oː n j a m	p a r s ɪ m oː n j a m
a nː j ɛ lː ʊ m	a ŋ n ɛ lː ʊ m
a r aː b ɪ l ɛ m	a r aː b ɪ l ɛ m
l a k r ɪ m aː r ɛ	l a k r ɪ m aː r ɛ
s uː m	s ʊ ɛ m
p r ɛ k ɔ n ʊ s k ɛ r ɛ	p r aɪ k ɔ ŋ n ɔ s k ɛ r ɛ
aɪ r g ɛ r ɛ	eː r ɪ g ɛ r ɛ
r ɪ g ʊ r ɔ s ʊ m	r ɪ g ɔ r ɔ s ʊ m
ɪ n t ɛ m p ɛ s t ɪ w ɪ t aː t ɛ m	ɪ n t ɛ m p ɛ s t iː w ɪ t aː t ɛ m
s ɛ r ɔ t ɪ n ʊ m	s eː r oː t ɪ n ʊ m
k ɔ l ʊ m b ɪ n ʊ m	k ɔ l ʊ m b iː n ʊ m
d ɪ s k r ɛ p aː n t j a m	d ɪ s k r ɛ p a n t j a m
l ɔ r ɪ k a m	l oː r iː k a m
p r uː d ɛ n t j a m	p r uː d ɛ n t j a m
k ʊ n s ɪ ŋ n aː r ɛ	k oː n s ɪ ŋ n aː r ɛ
k oː r ʊ m	kʰ ɔ r ʊ m
r ɛ k ʊ n ʊ s ɛ r ɛ	r ɛ k ɔ ŋ n oː s k ɛ r ɛ
r ɛ m uː n ɛ r aː r ɛ	r ɛ m uː n ɛ r aː r ɛ
f a b ɛ lː a m	f aː b ɛ lː a m
l a ŋ gʷ ɪ d ʊ m	l a ŋ gʷ ɪ d ʊ m
m ɔ r d aː k ɛ	m ɔ r d aː k ɛ m
ɪ k ɛ	kʷ ɛ m
s ɛ r ʊ m	s ɛ r ʊ m
d ɪ l ɛ kʷ aː r ɛ	d eː l ɪ kʷ aː r ɛ
m ɔ r j a m	m ʊ r j a m
aʊ s k ʊ l ʊ m	oː s k ʊ l ʊ m
ɪ n f ɛ s t aː r ɛ	iː n f ɛ s t aː r ɛ
a l t ɛ r k a t j oː n ɛ m	a l t ɛ r k aː t j oː n ɛ m
