t r aː k j ʊ m	tʰ r aː k j ʊ m
s k aː b j aː	s k a b ɪ ɛ m
f ɔ l ɛ m k aː r ɛ	f ɔ lː ɪ k aː r ɛ
a m b ʊ m s	a m b oː s
a m ɛ n t ʊ m	aː m ɛ n t ʊ m
b a p t ɪ s t ɛ r j ʊ m	b a p t ɪ s t eː r j ʊ m
w ɪ t uː p eː r aː b ɪ l ɛ	w ɪ t ʊ p ɛ r a b ɪ l ɛ m
k a l ʊ k ɛ	k a l k ɛ m
m ɔ s t r w ʊ m s ʊ m	m oː n s t r ʊ oː s ʊ m
n ɪ d ʊ m	n iː d ʊ m
t a m ɪ s ʊ m	t a m ɪ s j ʊ m
k l uː t ɪ n ɛ	g l uː t ɛ n
p a r oː k ʊ m	p a r ɔ kʰ ʊ m
m uː k oː s ʊ m	m uː k oː s ʊ m
k ɔ m oː d ʊ m	k ɔ mː ɔ d ʊ m
s ɛ m p ɪ t ɛ r n ʊ m	s ɛ m p ɪ t ɛ r n ʊ m
d ɪ m aː n aː r	d iː m aː n aː r ɛ
r ɛ t ɛ	r eː t ɛ
k a l k aː r ɛ m ʊ m	k a l k aː r j ʊ m
w ɪ ŋ k ɛ r ɛ	w ɪ ŋ k ɛ r ɛ
a n aː l ɪ s ɪ	a n a l y s ɛ m
a dː ɪ k t ʊ m	a dː ɪ k t ʊ m
a d b oː k a m t j oː n ɛ m	a d w ɔ k aː t j oː n ɛ m
a m ɛ n ʊ m	a m ɔ ɪ n ʊ m
d ɪ s k ʊ rː ɛ r ɛ	d ɪ s k ʊ rː ɛ r ɛ
f ɪ k t j oː n ɛ m	f ɪ k t j oː n ɛ m
w ɛ n t r ɛ m	w ɛ n t r ɛ m
b ɛ t ʊ lː a m	b ɛ t ʊ l a m
t ɛ m p ɔ r aː l ɛ	t ɛ m p ɔ r aː l ɛ m
k eː d ɛ r ɛ	k eː d ɛ r ɛ
f a l d ɪ s t oː r j ʊ m	f a l d ɪ s t oː l j ʊ m
a n w ʊ m	a nː ʊː m
t ɛ r m iː t ɛ	t a r m ɪ t ɛ m
k ɔ lː ʊ m k aː r ɛ	k ɔ lː ɔ k aː r ɛ
p ɔ m ʊ m k ɛ m	p uː m ɪ k ɛ m
l a k r ɪ m aː r ɛ	l a k r ɪ m aː r ɛ
d ɪ s ɛ n s ʊ m	d ɪ sː eː n s ʊ m
m a n s ʊ eː t uː m d ɛ n ɛ m	m aː n s ʊ eː t uː d ɪ n ɛ m
t r a t ɪ m oː r ɛ	t r aː d ɪ t oː r ɛ m
k ɪ m b aː l ʊ m	k y m b a l ʊ m
a b s oː l uː t j oː n ɛ m	a b s ɔ l uː t j oː n ɛ m
d ɪ l a m k ɛ r aː r	d iː l a k ɛ r aː r ɛ
h t aː ŋ g ɛ r ɛ	t a ŋ g ɛ r ɛ
ʊ m b r oː s ʊ m	ʊ m b r oː s ʊ m
g a s t aː r ɛ	w a s t aː r ɛ
ɔ fː ɪ d ʊ m s j ʊ m	ɔ fː ɪ k j oː s ʊ m
ɪ n s ɪ k n aː r ɛ	iː n s ɪ ŋ n aː r ɛ
a l ɪ w j aː r ɛ	a lː ɛ w j aː r ɛ
ɔ b n uː b ɪ l a m r ɛ	ɔ b n uː b ɪ l aː r ɛ
s eː r k ɪ r	s a r k iː r ɛ
ɪ ŋ n aː r ʊ m	ɪ ŋ n aː r ʊ m
s ɔ l ɪ t uː n j ɛ	s oː l ɪ t uː d ɪ n ɛ m
s ɪ m l w aː r ɛ	s iː b ɪ l aː r ɛ
ɪ mː oː l aː t j oː n ɛ m	ɪ mː ɔ l aː t j oː n ɛ m
l ʊ k t aː r ɛ	l ʊ k t aː r iː
a pː ɛ lː aː r ɛ	a pː ɛ lː aː r ɛ
a kʷ ɪ l ɪ n ʊ m	a kʷ ɪ l iː n ʊ m
m ɪ r aː k ʊ m l ʊ m	m iː r aː k ʊ l ʊ m
ɛ s t r ɛ n aː	s t r eː n a m
n ɛ f aː s t ʊ m	n ɛ f aː s t ʊ m
n ɛ m oː r aː l ɛ	n ɛ m ɔ r aː l ɛ m
f uː ŋ g ɛ r ɛ	f ʊ ŋ g iː
a kː aː ɪ s ɪ t j oː n ɛ	a kː w ɪ s iː t j oː n ɛ m
ɔ r ɪ g ɪ n aː r j ʊ m	ɔ r iː g ɪ n aː r j ʊ m
eː n uː m ɛ r aː r	eː n ʊ m ɛ r aː r ɛ
k oː r ʊ m	kʰ ɔ r ʊ m
k a l ɪ t aː t ɛ m	kʷ aː l ɪ t aː t ɛ m
r ɛ p uː ŋ n aː r ɛ	r ɛ p ʊ ŋ n aː r ɛ
k a r p ɛ n t ʊ m	k a r p ɛ n t ʊ m
ɪ n mː ɔ r t ɛ lː	ɪ mː ɔ r t aː l ɛ m
ɪ n b ɛ r n aː l ɛ	h iː b ɛ r n aː l ɛ m
p a r t ʊ m	p a r t ʊ m
k ɔ m p l ɛ t ɪ w ʊ m	k ɔ m p l eː t iː w ʊ m
s ɔ m ɛ ɛ r ʊ m	s a g m aː r j ʊ m
d ɔ r m iː t ʊ r j ʊ m	d ɔ r m iː t oː r j ʊ m
t r aː n s f ʊ n d ɛ r ɛ	t r aː n s f ʊ n d ɛ r ɛ
r uː s t ɪ k aː n ʊ m	r uː s t ɪ k aː n ʊ m
b ɛ l aː r ɛ	b aː l aː r ɛ
s ʊ s p ɛ n d ɛ r ɛ	s ʊ s p ɛ n d ɛ r ɛ
s t ɪ w a m r ɛ	s t iː p aː r ɛ
w a r ɪ ɛ g aː r ɛ	w a r ɪ ɛ g aː r ɛ
t ɛ r ɛ b r aː	t ɛ r ɛ b r a m
ɪ m w ɛ t ɛ r aː r ɛ	ɪ n w ɛ t ɛ r aː r ɛ
n ɪ d ɪ f oː r m ɛ	n iː d ɪ f oː r m ɛ m
g r a n aː r ʊ m	g r aː n aː r j ʊ m
p ɛ r k a m	p ɛ r k a m
a d b ɛ k t j oː n ɛ m	a d w ɛ k t j oː n ɛ m
a m p ʊ lː a m	a m p ʊ lː a m
m uː t w aː r ɛ	m uː t w aː r iː
d eː k ɛ r n ɛ r ɛ	d eː k ɛ r n ɛ r ɛ
a b s k ʊ n d ɛ r ɛ	a b s k ɔ n d ɛ r ɛ
ɪ n d oː l ɛ	ɪ n d ɔ l ɛ m
ʊ m ɪ lː a m t j oː n ɛ m	h ʊ m ɪ l j aː t j oː n ɛ m
p ɛ r s eː k ɪ r ɛ	p ɛ r s ɛ kʷ iː
f ɛ r ɛ t r ʊ m	f ɛ r ɛ t r ʊ m
m ɛ n t ʊ m	m ɛ n t ʊ m
f a l a ŋ g ɛ m	pʰ a l a ŋ g ɛ m
f a b r ʊ m	f a b r ʊ m
f uː r j oː s ʊ m	f ʊ r j oː s ʊ m
ɪ n w ɛ s t ɪ r ɛ	ɪ n w ɛ s t iː r ɛ
n ɛ p ɛ t m a m	n ɛ p ɛ t a m
t ɛ rː ɛ m oː t ʊ m	t ɛ rː aɪ m ɔ t ʊ m
p ɔ n t ɪ f ɪ k aː t ʊ m	p ɔ n t ɪ f ɪ k aː t ʊ m
t r aː n s m uː t aː t j oː n ɛ m	t r aː n s m uː t aː t j oː n ɛ m
p a l ʊ m b aː r j ʊ m	p a l ʊ m b aː r j ʊ m
r uː d ɛ	r ʊ d ɛ m
ɛ kʷ ɪ p aː r aː r ɛ	aɪ kʷ ɪ p ɛ r aː r ɛ
s ɛ g aː r ɛ	s ɛ k aː r ɛ
aʊ r ɪ g aː	aʊ r iː g a m
l ɪ r ɪ k ʊ m	l y r ɪ k ʊ m
l ɛ g a m j	l ɪ g aː m ɛ n
eː l aː k j oː n ɛ m	eː l aː t j oː n ɛ m
d ɛ s t r uː t t j oː n ɛ m	d eː s t r ʊ k t j oː n ɛ m
n ɔ n a m	n ɔ nː a m
ɛ n k ʊ r eː m ɛ	ɪ ŋ k uː d ɛ m
ɔ rː ɪ f ɪ k ʊ m	h ɔ rː ɪ f ɪ k ʊ m
aɪ s t ɪ j ʊ m	aɪ s t aː t ɛ m
d uː ɛ k j ɛ n t ʊ m s	d ʊ k ɛ n t oː s
s ɔ l w ɛ r ɛ	s ɔ l w ɛ r ɛ
s t ɛ l aː r	s t eː lː aː r ɛ m
d eː l ɛ k t aː t j oː n ɛ m	d eː l ɛ k t aː t j oː n ɛ m
ɛ r ɛ d ɪ r ɛ	h eː r eː d ɪ t aː r ɛ
ɪ ŋ n eː ʊ m	ɪ ŋ n ɛu m
p l a n ɪ t j ɛ m	p l aː n ɪ t ɪ ɛ m
k a p aː k ɛ	k a p aː k ɛ m
p r uː d ɛ n t j a m	p r uː d ɛ n t j a m
ɪ mː a t ʊ r ɪ t aː t ɛ m	ɪ mː aː t uː r ɪ t aː t ɛ m
k a t ɛ k ɪ s m ʊ m	k a t eː kʰ ɪ s m ʊ m
aɪ w ʊ m	aɪ w ʊ m
b ʊ rː aː	b ʊ rː a m
ɪ n k a n t aː r ɛ	ɪ ŋ k a n t aː r ɛ
ɪ m b ʊ ɪ r	ɪ m b ʊ ɛ r ɛ
k ɔ m p r a m t oː r ɛ	k ɔ m p a r aː t oː r ɛ m
f ɔ r n ɪ k aː t oː r ɛ	f ɔ r n ɪ k aː t oː r ɛ m
w eː r n aː l ɛ	w ɛ r n aː l ɛ m
ɔ r t ɔ g r ɛ aː f j a m	ɔ r tʰ ɔ g r a pʰ j a m
p r aɪ d ɔ m ɪ n aː r ɛ	p r aɪ d ɔ m ɪ n aː r iː
ɪ n t r ɪ k ɛ k ʊ m	ɪ n t r iː n s ɛ k ʊ m
w ɪ w ɪ d ʊ m	w iː w ɪ d ʊ m
w ɛ lː ʊ m	w ɛ lː ʊ s
f ɛ rː aː t ʊ m	f ɛ rː aː t ʊ m
ɛ f eː k t ɪ w ʊ m	ɛ fː ɛ k t iː w ʊ m
d aː b ɔ l ɪ k ʊ m	d j a b ɔ l ɪ k ʊ m
k ɔ m a n d aː r ɛ	k ɔ mː ɛ n d aː r ɛ
ɛ k s k ɛ p t aː r ɛ	ɛ k s k ɪ p ɛ r ɛ
f ɛ d ɪ	f ɛu d ʊ m
s p ɪ n ʊ lː a m	s p iː n ʊ l a m
s ɪ r p ʊ m	s k ɪ r p ʊ m
s ɔ k ɛ r ʊ m	s ɔ k ɛ r ʊ m
k ɔ n f ɛ r m aː t j oː n ɛ m	k oː n f ɪ r m aː t j oː n ɛ m
a kː uː s aː t j oː n ɛ	a kː uː s aː t j oː n ɛ m
r ɛ k ɛ d ɛ r ɛ	r ɛ k eː d ɛ r ɛ
s ɛ k aː r m ɛ r ɛ	s eː k ɛ r n ɛ r ɛ
s a r t ʊ m	s a r k ʊ l ʊ m
p r ɔ f ɪ t ʊ m	p r oː f ɛ k t ʊ m
m ɔ r ɪ b ʊ n d ʊ m	m ɔ r ɪ b ʊ n d ʊ m
ɪ r aː s k ɪ b ɪ l ɛ	iː r aː s k ɪ b ɪ l ɛ m
l ɔ k aː	l uː t ɛu m
l a p ɪ d aː t j ʊ m n ɛ m	l a p ɪ d aː t j oː n ɛ m
r ɛ l uː k ɪ r ɛ	r ɛ l uː k eː r ɛ
d ɪ m ɪ n ʊ ɛ r ɛ	d iː m ɪ n ʊ ɛ r ɛ
k ɔ n w ɛ r t ɪ r ɛ	k ɔ n w ɛ r t ɛ r ɛ
a m b ɪ t ʊ m	a m b iː t ʊ m
t r ɪ n ɪ t aː t ɛ m	t r iː n ɪ t aː t ɛ m
ɔ r p ɪ m ɛ n t ʊ m	aʊ r ɪ p ɪ g m ɛ n t ʊ m
k ɔ n s t a n t j a m	k oː n s t a n t j a m
ɪ n k ɔ m p ɛ t ɛ n t ɛ m	ɪ ŋ k ɔ m p ɛ t ɛ n t ɛ m
ɔ r a t oː r ɛ	oː r aː t oː r ɛ m
r uː k ʊ m	r oː s k ɪ d ʊ m
eː w ɔ l ʊ t j oː n ɛ	eː w ɔ l uː t j oː n ɛ m
r ɛ fː r m ɛ n aː ɛ	r ɛ f r eː n aː r ɛ
t r aː n s m ɪ s j oː n ɛ m	t r aː n s m ɪ sː j oː n ɛ m
w ɔ l w ɛ r ɛ	w ɔ l w ɛ r ɛ
ɛ k s p ʊ ŋ n aː r ɛ	ɛ k s p ʊ ŋ n aː r ɛ
a m ɛ r ɪ t aː r ɛ	m ɛ r iː d j aː r ɛ
m oː rː ɛ	m oː r ɛ m
ɪ w ʊ m	iː w ʊ m
s ɛ t aː	s aɪ t a m
ɪ n uː l t ʊ m	ɪ n ʊ l t ʊ m
k ɔ n t ɛ n t j oː n ɛ m	k ɔ n t ɛ n t j oː n ɛ m
d eː t ɛ r m ɪ n aː r ɛ	d eː t ɛ r m ɪ n aː r ɛ
b a l t eː ʊ m	b a l t ɛu m
g ɛ r m aː n ɪ k ʊ m	g ɛ r m aː n ɪ k ʊ m
kʷ a t ɛ r n ʊ m	kʷ a t ɛ r n oː s
ɛ k k s ɛ t iː ŋ gʷ ɛ r ɛ	ɛ k s t ɪ ŋ gʷ ɛ r ɛ
r ɔ s m aː r iː n ʊ m	r oː r ɛ mː a r iː n ʊ m
n ɪ m b ʊ m	n ɪ m b ʊ m
f eː t oː r ɛ	f eː t oː r ɛ m
l ɛ g ɛ	l eː g ɛ m
m ɪ l ɪ t ɛ	m iː l ɪ t ɛ m
z aː n k a m	z a ŋ kʰ a m
f uː d ʊ k a m	f iː d uː k j a m
l ɪ n k k ɛ	l y ŋ k ɛ m
ɪ n t ɪ m aː t j oː n ɛ m	ɪ n t ɪ m aː t j oː n ɛ m
k a d uː k ʊ m	k a d uː k ʊ m
w ɛ r g ɪ ɛ l ɛ	w ɪ r ɪ d aː r j ʊ m
s ɔ k lː ɔ t ʊ m	s ɪ ŋ g ʊ l t ʊ m
k ɔ n t ɛ n d ɛ r ɛ	k ɔ n t ɛ n d ɛ r ɛ
m ɛ d ɪ k aː m ɛ n t ʊ m	m ɛ d ɪ k aː m ɛ n t ʊ m
a n ɔ t aː t j oː n ɛ m	a nː ɔ t aː t j oː n ɛ m
t ɛ m ɛ r ɛ ɛ	t ɪ m eː r ɛ
ɪ n s aː n ʊ m	iː n s aː n ʊ m
l a w a m t j ʊ m n ɛ m	l a w aː t j oː n ɛ m
k a w ʊ m	k a w ʊ m
l uː m ɪ n ʊ m l ʊ m	ɛ lː y kʰ n j ʊ m
t ɛ ʊ m	t ʊː m
k a r n ɛ pʰ ɪ k ɛ m	k a r n ɪ f ɪ k ɛ m
k a p aː k ɪ t aː t ɛ m	k a p aː k ɪ t aː t ɛ m
a k l aː r aː r	a kː l aː r aː r ɛ
k a r aː k t ɛ m r ɛ	kʰ a r a k t eː r ɛ m
ɔ s p ɪ t aː l ɛ	h ɔ s p ɪ t aː l ɛ
p uː p ɪ lː a m	p uː p ɪ lː a m
w iː d ʊ	w ɔ k ɪ t ʊ m
d ɪ s ɛ k aː r ɛ	d ɪ sː ɛ k aː r ɛ
d eː r ɪ s j ʊ m n ɛ m	d eː r iː s j oː n ɛ m
w ɪ w aː r j ʊ m	w iː w aː r j ʊ m
k ɛ r n ɛ r ɛ	k ɛ r n ɛ r ɛ
d eː s ɪ n ɛ n t a m	d eː s ɪ n ɛ n t j a m
s ɔ r t ɪ r ɛ	s ɔ r t iː r iː
a pː ʊ m	a p j ʊ m
s t r ɪ ŋ g ɛ r ɛ	s t r ɪ ŋ g ɛ r ɛ
r ʊ b ʊ m	r ʊ b ʊ m
ɪ n t ɛ r d ɪ k ɛ r	ɪ n t ɛ r d iː k ɛ r ɛ
a tː ɛ m p ɛ r a r ɛ	a tː ɛ m p ɛ r aː r ɛ
w ɪ b r aː t j oː n ɛ m	w ɪ b r aː t j oː n ɛ m
a kː ɔ m ɔ d aː t j oː n ɛ m	a kː ɔ mː ɔ d aː t j oː n ɛ m
a l aː k r ɪ t a t ɛ m	a l a k r ɪ t aː t ɛ m
s ɔ n t ɛ	s ɔ n t ɛ m
b uː b aː l ʊ m	b uː b a l ʊ m
k ʊ l ɛ r a m	kʰ ɔ l ɛ r a m
l aʊ d ɪ	l aʊ d ɛ m
k ɛ r k aː r ɛ	k ɪ r k aː r ɛ
s t aː t uː ɛ r ɛ	s t a t ʊ ɛ r ɛ
n uː d ɪ r ɛ	n ɔ k eː r ɛ
r ɛ m ɛ k ɛ r	r ɛ m ɪ s k eː r ɛ
ɪ t ɛ r aː t j oː n ɛ m	ɪ t ɛ r aː t j oː n ɛ m
k ɪ d a m	k iː d a m
t ɔ m ʊ m	t ɔ m ʊ m
k ɔ m ʊ n j ʊ m n ɛ m	k ɔ mː uː n iː r ɛ
w a k uː ɪ t aː t ɛ m	w a k ʊ ɪ t aː t ɛ m
p eː r ɪ g ʊ n t aː r	p ɛ r k ɔ n t aː r iː
b ɛ l ɪ k ʊ m	b ɛ lː ɪ k ʊ m
t ɛ t ʊ m	t eː k t ʊ m
l a m a m	l aː m a m
s uː b s ɪ d j ʊ m	s ʊ b s ɪ d j ʊ m
ɛ k s aː l t aː r ɛ	ɛ k s a l t aː r ɛ
k ʊ k ʊ r m b ɪ t a m	k ʊ k ʊ r b ɪ t a m
a p ɪ k k ɛ	a p ɪ k ɛ m
g a n ʊ m m	g a l b ɪ n ʊ m
k a m p j ɛ oː n ɛ m	k a m p j oː n ɛ m
p ɔ r k iː n ʊ m	p ɔ r k iː n ʊ m
s ɔ l ɪ d aː r ɛ	s ɔ l ɪ d aː r ɛ
a b g uː r aː r ɛ	a b ɪ uː r aː r ɛ
a s aː r ʊ m	a s a r ʊ m
f a aː	f aː g ɛ a m
p a l p ɛ b r a m	p a l p ɛ b r a m
k ɛ r b a m	k ɛ r w a m
f r uː k t w ʊ m s ʊ m	f r ʊ k t ʊ oː s ʊ m
t r aː n s uː b s t a n t j aː r ɛ	t r aː n s ʊ b s t a n t j aː r ɛ
p ɔ s t ʊ l aː t j oː n ɛ m	p ɔ s t ʊ l aː t j oː n ɛ m
p ɪ s k ʊ m p aː d ʊ m	ɛ p ɪ s k ɔ p aː t ʊ m
b ʊ k j ɪ n ɛ	b uː k ɪ n ʊ m
ɔ k k ɪ d ɛ n t ɛ m	ɔ kː ɪ d ɛ n t ɛ m
h kʰ a t aː r ɛ	k a p t j aː r ɛ
m ʊ r k j a m	a m ʊ r k a m
t ɛ n ɪ b r a m s	t ɛ n ɛ b r aː s
s k oː p a m	s k oː p a m
a d ɪ k t j oː n ɛ	a dː ɪ k t j oː n ɛ m
ɪ d ʊ m n ɛ ʊ m	ɪ d oː n ɛu m
p r ɛ s k r iː w ɛ r ɛ	p r aɪ s k r iː b ɛ r ɛ
a l b uː m ɪ n ɛ	a l b uː m ɛ n
m uː n g ɛ r ɛ	m ʊ l g eː r ɛ
k ʊ g t ɛ lː ʊ m	k ʊ l t ɛ lː ʊ m
k a p ɪ t ɛ lː ʊ m	k a p ɪ t ɛ lː ʊ m
l ʊ t ʊ m	l ʊ t ʊ m
a pː a r aː r ɛ	a pː aː r eː r ɛ
k ɔ r oː n iː d ɛ	k ɔ r oː n ɪ d ɛ m
ɛ k s aː l a m r ɛ	ɛ k s h aː l aː r ɛ
a n aɪ t ʊ m	a n eː tʰ ʊ m
a fː uː m ɪ k aː r ɛ	f uː m ɪ g aː r ɛ
s p uː m aː r ɛ	s p uː m aː r ɛ
ɪ n f ɛ s t aː r ɛ	iː n f ɛ s t aː r ɛ
ɪ m p ɛ lː ɛ r ɛ	ɪ m p ɛ lː ɛ r ɛ
s ɛ rː aː	s ɛ rː a m
a eː l ʊ m	a w ʊ l ʊ m
p uː t aː r ɛ	p ʊ t eː r ɛ
ɪ m p ɛ r j aː l ɛ	ɪ m p ɛ r j aː l ɛ m
ɪ m p uː l s j oː n ɛ m	ɪ m p ʊ l s j oː n ɛ m
ɪ n t ɛ l ɛ g ɛ r ɛ	ɪ n t ɛ lː ɛ g ɛ r ɛ
w ɛ n t ʊ m	w ɛ n t ʊ m
k ɔ n s ɪ ʊ m	k oː n s k j ʊ m
f ɪ d ɛ l ɪ t aː t ɛ m	f ɪ d eː l ɪ t aː t ɛ m
r ɛ m ɔ w eː r ɛ	r ɛ m ɔ w eː r ɛ
m a n ʊ m	m a ŋ n ʊ m
k r ɛ m aː	k r aː m ʊ m
p r ɔ p ɪ n kʷ ɪ t aː t ɛ m	p r ɔ p ɪ ŋ kʷ ɪ t aː t ɛ m
s k aː p ʊ l a m	s k a p ʊ l a m
b ɛ r ɪ lː ʊ m	b eː r y lː ʊ m
m ɛ d ɪ k aː r ɛ	m ɛ d ɪ k aː r ɛ
a kː r ɛ t j oː n ɛ	a kː r eː t j oː n ɛ m
f eː r j a m	f eː r j aː s
p a r t ɪ r ɛ	p a r t iː r ɛ
r ɛ f ɔ r m aː r ɛ	r ɛ f oː r m aː r ɛ
ɪ m w ɛ s t ɪ g aː r ɛ	ɪ n w ɛ s t iː g aː r ɛ
ɪ ŋ g uː r j oː s ʊ m	ɪ n ɪ uː r j oː s ʊ m
l eː p r ʊ m s ʊ m	l ɛ p r oː s ʊ m
ɔ b ɛ d ɛ t ɛ r	ɔ b ɔ ɪ d iː r ɛ
ɪ m p r ɔ b ɪ t aː t ɛ m	ɪ m p r ɔ b ɪ t aː t ɛ m
p l a m aː r	p l a s m aː r ɛ
f ɪ d ɛ l ɛ	f ɪ d eː l ɛ m
m a t r ɪ t ɪ d a m	m aː t r ɪ k iː d a m
m a s k ʊ l iː n ʊ m	m a s k ʊ l iː n ʊ m
a w s ɪ l j ʊ m	aʊ k s ɪ l j ʊ m
a pː a r t ɛ r ʊ m	p a r t j aː r j ʊ m
r eː s uː t ɪ t aː t j oː n ɛ m	r ɛ s ʊ s k ɪ t aː t j oː n ɛ m
l uː p aː n aː r ɛ	l ʊ p aː n a r
f a b ʊ r ɪ k aː t j oː n ɛ m	f aː b r ɪ k aː t j oː n ɛ m
l ɛ t ɪ t j j aː m	l aɪ t ɪ t j a m
l ɪ m ɛ t aː r ɛ	l iː m ɪ t aː r ɛ
k l ɪ m a m t ɛ r ɪ k ʊ m	k l iː m a k t eː r ɪ k ʊ m
m ɪ l ɛ r j ʊ m	m iː lː j aː r j ʊ m
p a s t iː n aː k	p a s t ɪ n aː k a m
k ʊ k ʊ lː a m	k ʊ k ʊ lː a m
l eː d aː t oː r	l aʊ d aː t oː r ɛ m
g uː b ɪ l aː r ɛ	j uː b ɪ l aː r ɛ
w iː ɛ m ɛ k n t ɛ m	w ɛ h ɛ m ɛ n t ɛ m
ɪ n d uː r ɛ t ɛ r	ɪ n d uː r eː s k ɛ r ɛ
r a s t r ɛ ɛ lː ʊ m	r aː s t ɛ lː ʊ m
t ɔ r p ɛ d ʊ m	t ɔ r p eː d ɪ n ɛ m
a ŋ g ʊ s t ʊ m	a ŋ g ʊ s t ʊ m
t uː r g ɪ d ʊ m	t ʊ r g ɪ d ʊ m
f ɔ r n ɪ k s ɛ m	f ɔ r n ɪ k ɛ m
a l ɔ k aː ɛ	a lː ɔ k aː r ɛ
s ɛ r p ɛ n t ɪ n ʊ m	s ɛ r p ɛ n t iː n ʊ m
j eː p s ʊ m	g y p s ʊ m
k ɔ l ɛ	k aʊ l ɛ m
d ɪ s k r eː t j oː n ɛ	d ɪ s k r eː t j oː n ɛ m
ɛ k s uː l t aː t j oː n ɛ m	ɛ k s ʊ l t a t j oː n ɛ m
ɛ p ɪ s t oː lː a m	ɛ p ɪ s t ɔ l a m
a d ʊ n k ʊ m	a d ʊ ŋ k ʊ m
p l a ŋ g ɛ r ɛ	p l a ŋ g ɛ r ɛ
ɪ r s uː t ʊ m	h ɪ r s uː t ʊ m
a w ɛ aː ʊ m	a w ɛ m
b a s ɪ l ɪ s k ʊ m	b a s ɪ l ɪ s k ʊ m
g a w ɛ t a m	g a b a t a m
m a r t ɪ r ɛ	m a r t y r ɛ m
k ɔ n k ɛ d ɛ m r ɛ	k ɔ ŋ k eː d ɛ r ɛ
k a n ɔ r ʊ m	k a n oː r ʊ m
s p ɛ k uː l aː t ɪ w ʊ m	s p ɛ k ʊ l aː t iː w ʊ m
a kː ɔ rː eː r ɛ	a kː ʊ rː ɛ r ɛ
a b d oː m ɛ n	a b d oː m ɛ n
f ɔ r ɛ k aː r ɛ	f ɔ r aː r ɛ
f aː rː aː g iː n ɛ	f a rː aː g ɪ n ɛ m
d eː s ɪ d j aː	d eː s ɪ d j a m
g ɛ l ʊ m	g ɛ l uː
a d uː l t eː r aː r ɛ	a d ʊ l t ɛ r aː r ɛ
w ɛ n t ɪ l aː t j oː n ɛ	w ɛ n t ɪ l aː t j oː n ɛ m
s ɛ r m oː n ɛ m	s ɛ r m oː n ɛ m
r ɛ k t a ŋ g ʊ l ʊ m	r ɛ k t a ŋ g ʊ l ʊ m
s p ɛ t ɪ m ɛ n	s p ɛ k ɪ m ɛ n
t ɔ r b ʊ m	t ɔ r w ʊ m
k r aɪ d ɪ b ɪ l ɛ	k r eː d ɪ b ɪ l ɛ m
a d ɪ ʊ n t ʊ m	a d j ʊ ŋ k t ʊ m
d ɔ m ɛ s t ɪ k ʊ m	d ɔ m ɛ s t ɪ k ʊ m
s a l uː t aː r ɛ	s a l uː t aː r ɛ
m a t r ɔ n aː l	m aː t r oː n aː l ɛ m
ɪ m p ɛ r t ɛ p t ɪ b lː ɛ m	ɪ m p ɛ r k ɛ p t ɪ b ɪ l ɛ m
r ɛ l ɪ g aː r ɛ	r ɛ l ɪ g aː r ɛ
a m ɪ k ɪ t j a	a m iː k ɪ t j a m
ɔ kː l uː d ɛ r ɛ	ɔ kː l uː d ɛ r ɛ
a n ɪ m aː l ɛ	a n ɪ m a l
a m aː t oː r ɛ	a m aː t oː r ɛ m
k a t ɛ k ɪ m k aː r ɛ	k a t eː kʰ iː zː aː r ɛ
p r eː t ɛ k s t aː r ɛ	p r aɪ t ɛ k s ɛ r ɛ
m uː n ɪ f ɪ k ʊ m	m uː n ɪ f ɪ k ʊ m
p r aɪ d aː t oː r ɛ	p r aɪ d aː t oː r ɛ m
m ɛ r iː t ɛ r ɛ	m ɛ r eː r ɛ
g r aː b aː t ʊ m	g r a b aː t ʊ m
ɪ n f ɛ k t j oː n ɛ m	ɪ n f ɛ k t j oː n ɛ m
m uː r	m uː r ɛ m
t ɛ t r ʊ m	t aɪ t r ʊ m
d eː n uː d aː t j oː n ɛ m	d eː n uː d aː t j oː n ɛ m
ɪ s ɪ m ʊ m	ɪ sː ɪ m ʊ m
d eː n s aː r ɛ	d eː n s aː r ɛ
a t r ʊ m	aː t r ʊ m
k ɔ n s ɔ r t ɛ m	k oː n s ɔ r t ɛ m
ɛ d ɪ f ɪ k aː t j oː n ɛ m	aɪ d ɪ f ɪ k aː t j oː n ɛ m
a n s a m	aː n s a m
l aː k eː r ɛ	l ɪ k eː r ɛ
m ʊ s t ʊ m	m ʊ s t ʊ m
t r ɪ b ʊ l ʊ m	t r ɪ b ʊ l ʊ m
s uː b ɔ r n aː r ɛ	s ʊ b oː r n aː r ɛ
b a s ɪ l ɪ k a m	b a s ɪ l ɪ k a m
a n aː r k j a m	a n a r kʰ j a m
ɪ m p uː l s ʊ m	ɪ m p ʊ l s ʊ m
s uː k oː s ʊ m	s uː k oː s ʊ m
d ɔ ʊ m	d ɔ l ʊ m
ɔ l aɪ oː s ʊ m	ɔ l ɛ oː s ʊ m
p r ɔ f ʊ n d ɪ t aː t ɛ m	p r ɔ f ʊ n d ɪ t aː t ɛ m
d ɔ m ɪ n j ʊ m	d ɔ m ɪ n j ʊ m
m ɛ m ɔ b r aː r ɛ	m ɛ m ɔ r aː r ɛ
a k ɪ n ʊ m	a k ɪ n ʊ m
m uː r ɛ n a m	m ʊ r eː n a m
a n ɔ n a m	a nː oː n a m
k a l ɪ f iː k aː r ɛ	kʷ aː l ɪ f ɪ k aː r ɛ
s ɔ l ɛ k ɪ t ʊ m	s ɔ lː ɪ k ɪ t ʊ m
n a t a m l ɪ t j ʊ m	n aː t aː l iː k j ʊ m
j uː s t ɪ f ɪ k aː t j oː n ɛ m	j uː s t ɪ f ɪ k aː t j oː n ɛ m
k ɔ n f oː r m ɛ m	k oː n f oː r m ɛ m
s ɔ n ɪ t ʊ m	s ɔ n ɪ t ʊ m
ɔ n ɛ s t aː	h ɔ n ɛ s t aː t ɛ m
t oː r j ʊ m	t oː r j ʊ m
s uː kː uː l eː n t ʊ m	s ʊ kː ʊ l ɛ n t ʊ m
k a k l ʊ m	k a p ʊ l ʊ m
n a s ʊ m	n aː s ʊ m
