ɪ n w ɪ g iː l aː r ɛ m	ɪ n w ɪ g ɪ l aː r ɛ
b r oː g ɛ m	b r ɔ kː ʊ m
r ɛ w ɔ k aː r ɛ	r ɛ w ɔ k aː r ɛ
a gː r ɛ g aː r ɛ	a gː r ɛ g aː r ɛ
ɪ b ɛ k t j r ɛ	iː b ɪ k ɛ m
p r ɛ s aː g j aː r ɛ	p r aɪ s aː g iː r ɛ
s p ɛ k ʊ l aː t oː r ɛ	s p ɛ k ʊ l aː t oː r ɛ m
s ɪ t a s j ɛ m	k ɪ t aː t j oː n ɛ m
g ɔ r t ʊ m	g ʊ r d ʊ m
k ɔ ŋ t r ɪ t ʊ m	k ɔ n t r iː t ʊ m
a tː r aː pʰ r ɛ	a tː r a h ɛ r ɛ
fː ɪ aː r s	f ɔ r j a m
w a k uː ɪ t aː t ɛ m	w a k ʊ ɪ t aː t ɛ m
t ɛ n d ɛ r ɛ	t ɛ n d ɛ r ɛ
a s ɛ t ɛ t ɛ m	a s eː ɪ t aː t ɛ m
a kʷ iː l ɪ n ʊ m	a kʷ ɪ l iː n ʊ m
f fː j aː r ɛ	f iː d ɛ r ɛ
t r aː b eː k ʊ l a m	t r a b eː k ʊ l a m
f ɛ t ɪ d ʊ m	f eː t ɪ d ʊ m
m a g ɪ k ʊ m	m a g ɪ k ʊ m
m ɛ l ɔ d j a m	m ɛ l oː d j a m
a b l ʊ ɛ r ɛ	a b l ʊ ɛ r ɛ
k ɔ l ɛ g j ʊ m	k ɔ lː eː g j ʊ m
g r aː w ɪ t aː t j oː n ɛ	g r a w ɪ t aː t j oː n ɛ m
p a l j ɛ	p a lː j aː r ɛ
w ɪ t ɛ m	w iː t ɛ m
k a m b j ʊ m	k a m b j ʊ m
k ɛ n ʊ m	k ɪ nː ʊ m
j ɛ t ʊ m	j a k t ʊ m
k ɔ n k ʊ rː ɛ r ɛ	k ɔ ŋ k ʊ rː ɛ r ɛ
t r ɪ b ʊ l ʊ m	t r ɪ b ʊ l ʊ m
s ɪ s ʊ r ɛ	s eː k uː r ʊ m
ɔ l ɪ r ɛ m	ɔ l eː r ɛ
d ɛ t t aː t ɛ m	d ɛ ɪ t aː t ɛ m
b ɛ t ɔ aː r a m	b eː t a m
kʷ a l ɪ f iː k aː r ɛ	kʷ aː l ɪ f ɪ k aː r ɛ
j w uː w aː t j ʊ m	j uː d ɪ k j ʊ m
r ɛ k uː s aː r ɛ	r ɛ k uː s aː r ɛ
p ɛ n aː t eː s	p ɛ n aː t ɛ m
p ɛ r k oː l aː t j oː n ɛ m	p ɛ r k oː l aː t j oː n ɛ m
k ɔ p uː l aː t j oː n ɛ m	k oː p ʊ l aː t j oː n ɛ m
ɪ n f ɪ r m ʊ m	iː n f ɪ r m ʊ m
s ɔ m aː r ʊ m	s ʊ mː aː r j ʊ m
a k aː n t ʊ m	a k a n tʰ ʊ m
t aː sː ʊ n	t a k s ʊ m
k ɪ n kʷ ɛ n aː l ɛ	kʷ iː ŋ kʷ ɛ nː aː l ɛ m
a b r ɛ w j aː t j oː n ɛ m	a bː r ɛ w j aː t j oː n ɛ m
ɛ k s t ɛ r m ɪ n aː t j oː n ɛ m	ɛ k s t ɛ r m ɪ n aː t j oː n ɛ m
p r oː f ɛ t j a m	p r ɔ pʰ eː t iː a m
f a a m	f aː g ɛ a m
k ɔ l ɛ m	k aʊ l ɛ m
t aɪ d aː r ʊ m	t eː k t ʊ m
ɛ k s aː k t j oː n ɛ m	ɛ k s aː k t j oː n ɛ m
t ɔ r a t oː m	t ɔ r t j oː n ɛ m
m ɪ n ɔ r aː r ɛ	m ɪ n oː r aː r ɛ
w ɛ n t ʊ m	w ɛ n t ʊ m
k a m b r oː n ɛ m	k r aː b r oː n ɛ m
l aː ŋ g oː r ɛ m	l a ŋ gʷ oː r ɛ m
l uː k r aː r ɛ	l ʊ k r aː r iː
s ɪ l w ɛ s t r ɛ m	s ɪ l w ɛ s t r ɛ m
k ɔ n s ɪ d eː r aː t j oː n ɛ m	k oː n s iː d ɛ r aː t j oː n ɛ m
l ɪ b ɛ r aː t oː r ɛ	l iː b ɛ r aː t oː r ɛ m
m ɛ d ɪ oː k r ɛ m	m ɛ d ɪ ɔ k r ɛ m
s uː b s ɪ d j ʊ m	s ʊ b s ɪ d j ʊ m
d ɔ l ʊ r oː s ʊ m	d ɔ l oː r oː s ʊ m
k a w aː r ɛ	k a w aː r ɛ
a r k eː t iː p ʊ m	a r kʰ ɛ t y p ʊ m
a r k ɪ b ɛ s k oː p ʊ m	a r kʰ ɪ ɛ p ɪ s k ɔ p ʊ m
m a k ɛ lː aː r ʊ m	m a k ɛ lː aː r j ʊ m
r eː s a r k ɪ r ɛ	r ɛ s a r k iː r ɛ
m a t r ɪ k ʊ l a m	m aː t r iː k ʊ l a m
k a d aː w ɛ r ɛ	k a d aː w ɛ r
p l ɔ b j ɔ s ʊ m	p l ʊ w j oː s ʊ m
m a r ɪ s a m	m a r ɪ s k a m
f r ɔ n t oː n ɛ m	f r ɔ n t oː n ɛ m
k r ɪ n ɛ m	k r iː n ɛ m
g a lː a m	g a lː a m
s k ɪ m j a m	s iː m j a m
g ɛ n t ɪ l iː t ɛ m	g ɛ n t iː l ɪ t aː t ɛ m
k a kʰ ɛ n ɔ aː r ɛ	k a t eː n aː r ɛ
f ɪ r m ɛ m	f ɪ r m ʊ m
f l ɛ k t ɛ r ɛ	f l ɛ k t ɛ r ɛ
r ɛ s t r ɪ ŋ g ɛ r ɛ m	r ɛ s t r ɪ ŋ g ɛ r ɛ
m ɪ ɛ n k ɪ aː m	m ɛ n t ʊ l a m
k ɔ n t ɛ n t j oː n ɛ m	k ɔ n t ɛ n t j oː n ɛ m
f r ɪ ɪ g ɪ d aː t ɛ m	f r iː g ɪ d ɪ t aː t ɛ m
k a d uː k ʊ m	k a d uː k ʊ m
t ɛ n ɛ b r a m	t ɛ n ɛ b r a m
f uː l w ʊ m	f ʊ l w ʊ m
p ɔ m ɛ t ʊ m	p ɔ m eː t ʊ m
ɔ kː ʊ rː ɛ r ɛ	ɔ kː ʊ rː ɛ r ɛ
k ɔ n t r ɪ b ʊ ɛ r ɛ	k ɔ n t r ɪ b ʊ ɛ r ɛ
a w ɪ ŋ ʊ m	a w ɛ m
k ɔ n k ɪ n iː t ɛ m	k ɔ ŋ k ɪ nː ɪ t aː t ɛ m
l ɛ k t oː r ɛ	l eː k t oː r ɛ m
t r ʊ w ɪ s k ʊ m	t ʊ r b ɪ s k ʊ m
ɛ k s a k ɛ r b aː t j oː n ɛ m	ɛ k s a k ɛ r b aː t j oː n ɛ m
f a r eː t r a m	pʰ a r ɛ t r a m
a s p ɛ r g eː r ɛ	a s p ɛ r g ɛ r ɛ
r ɛ aː t ʊ m	r ɛ aː t ʊ m
ɛ k k s ɛ t iː ŋ gʷ ɛ r ɛ m	ɛ k s t ɪ ŋ gʷ ɛ r ɛ
a l a m	aː l ɛ a m
a pː ʊ m	a p j ʊ m
a m ɛ n t ɛ m	aː m ɛ n t ɛ m
f ɛ k ʊ l ɛ n t ʊ m	f aɪ k ʊ l ɛ n t ʊ m
a sː aɪ r t j oː m	a sː ɛ r t j oː n ɛ m
d eː f ɛ k t j oː n ɛ m	d eː f ɛ k t j oː n ɛ m
t a r d ɪ n ɪ m oː	t a r d ʊ m
f ɛ uː d ʊ m	f ɛu d ʊ m
p l aː n t aː r ɛ	p l a n t aː r ɛ
t r iː lː ʊ m	t r iː b ʊ l ʊ m
s p uː m oː s ʊ m	s p uː m oː s ʊ m
p uː l k r ʊ m	p ʊ l kʰ r ʊ m
m uː s a r aː n	m uː s a r aː n ɛu m
t ɪ s ɪ k ʊ m	p eː h tʰ ɪ s ɪ k ʊ m
a l g ɛ n ɛ m	a l ɪ kʷ ɛ m
a tː r ɪ b ʊ t j oː n ɛ m	a tː r ɪ b uː t j oː n ɛ m
n a t aː t ɔ r j ʊ m	n a t aː t oː r j ʊ m
aɪ l ʊ m	aɪ w ʊ m
d uː k ɪ r ɛ	d uː k ɛ r ɛ
m ɔ l ɛ aʊ ɪ ɛ m	m uː t ʊ l ʊ m
a b aɪ ŋ ɪ a m	a p ɪ k ʊ l a m
w ɛ r ɛ k ʊ n d ʊ m	w ɛ r eː k ʊ n d ʊ m
l ɪ t aː r ɛ	l ɪ t aː r ɛ
m ɛ s ɛ m	m ɛ sː ɛ m
s ɛ	s eː
ɪ n d ɛ f ɪ n ɪ t ʊ m	ɪ n d eː f iː n iː t ʊ m
ɪ ŋ oː s k j ɛ r ɛ	ɪ ŋ n oː s k ɛ r ɛ
a b r ɔ k aː t j oː n ɛ m	a b r ɔ g aː t j oː n ɛ m
f uː m oː s ʊ m	f uː m oː s ʊ m
ɪ r a m	iː r a m
k r iː m ɪ n ɛ	k r iː m ɛ n
s ɛ r ʊ m	s ɛ r ʊ m
ɪ n w ɛ r t ɛ r ɛ	ɪ n w ɛ r t ɛ r ɛ
k ɔ ŋ s d a m	k oː n s ɔ l ɪ d a m
w ɛ r s ɪ pʰ iː k aː r ɛ	w ɛ r s ɪ f ɪ k aː r ɛ
s ɔ n ɪ k l oː s ʊ m	s ɔ m n ɪ k ʊ l oː s ʊ m
a s iː m ɪ l aː r ɛ	a sː ɪ m ʊ l aː r ɛ
ɪ n k ɔ m oː d aː r ɛ	ɪ ŋ k ɔ mː ɔ d aː r ɛ
f ɔ r n ɪ k aː t oː r ɛ	f ɔ r n ɪ k aː t oː r ɛ m
k ɔ t ɛ m n	k oː t ɛ m
r ɔ b ɪ ɪ ɪ ɛ	r oː b iː g ɪ n ɛ m
f uː r ɪ b ʊ n d ʊ m	f ʊ r ɪ b ʊ n d ʊ m
k uː r aː r ɛ	k uː r aː r ɛ
a sː ʊ p t j oː n ɛ m	a sː uː m p t j oː n ɛ m
k ɔ r t ɛ m	k ɔ h ɔ r t ɛ m
a dː ɪ k t ʊ m	a dː ɪ k t ʊ m
p a d ɛ lː a m	p a t ɛ lː a m
k ɔ n s ɪ ʊ m	k oː n s k j ʊ m
ɪ n ɪ ʊ m t j oː n ɛ m	ɪ n j ʊ ŋ k t j oː n ɛ m
p ʊ pː a m	p ʊ pː ɛ m
eː l ɛ w aː r ɛ	eː l ɛ w aː r ɛ
b ɛ lː ʊ m	b ɛ lː ʊ m
k r ɛ m a m	k r aː m ʊ m
b ʊ rː a m	b ʊ rː a m
r ɪ ɛ f pʰ ɛ r ɛ	r ɛ f ɪ k ɛ r ɛ
w iː tʰ ʊ m	w ɔ k ɪ t ʊ m
p r ɛ ɔ k ʊ p aː t j oː n ɛ m	p r aɪ ɔ kː ʊ p aː t j oː n ɛ m
k ɪ n ɛ n t oː m	kʷ iː ŋ g ɛ n t oː s
s ɛ n s ʊ m	s eː n s ʊ m
p r oː p ɪ n m aː r ɪ t aː t ɛ m	p r ɔ p ɪ ŋ kʷ ɪ t aː t ɛ m
a k t ʊ aː r j ʊ m	aː k t w aː r j ʊ m
d eː k ɔ k t j oː n ɛ m	d ɛ k ɔ k t j oː n ɛ m
ɔ r iː g ɪ n aː r j ʊ m	ɔ r iː g ɪ n aː r j ʊ m
a fː aː s k ɪ n aː r ɛ	f a s k ɪ n aː r ɛ
ɪ ɛ n k pʰ r eː n ɛ	ɪ ŋ k uː d ɛ m
k ɔ n s ɪ ŋ n aː r ɛ	k oː n s ɪ ŋ n aː r ɛ
a n t ɛ k ɛ t oː r ɛ	a n t ɛ k ɛ sː oː r ɛ m
p r aɪ k ɛ d eː r ɛ	p r aɪ k eː d ɛ r ɛ
k ɔ n d ɪ s n ʊ m	k ɔ n d ɪ ŋ n ʊ m
d eː m ɔ n s t r aː r ɛ	d eː m oː n s t r aː r ɛ
l ɪ g m aː k j ɛ m	l iː m aː k ɛ m
m ɔ r ɪ b ʊ n d ʊ m	m ɔ r ɪ b ʊ n d ʊ m
f ɔ r t ɛ m	f ɔ r t ɛ m
p r oː w oː k aː t oː r ɛ	p r oː w ɔ k aː t oː r ɛ m
a sː ɪ b n aː r ɛ	a sː ɪ ŋ n aː r ɛ
k ɛ n s ʊ r ʊ m	k eː n s uː r a m
w a k ɪ lː aː r ɛ	w a k ɪ lː aː r ɛ
aʊ k m ɛ n t aː t j oː n ɛ m	aʊ g m ɛ n t aː t j oː n ɛ m
w a lː ɛ t ʊ m	w a lː ɛ tː ʊ m
k ɛ s p ɪ t ɛ m	k aɪ s p ɪ t ɛ m
a r b ɪ t r j ʊ m	a r b ɪ t r j ʊ m
ɪ n k ɛ n d j a r j ʊ m	ɪ ŋ k ɛ n d j aː r j ʊ m
t r aː n s m iː sː j oː n ɛ m	t r aː n s m ɪ sː j oː n ɛ m
a d m ɔ n ɪ s t aː r ɛ	a d m ɔ n eː r ɛ
s ʊ b r ɪ w aː n ɪ r ɛ	s ʊ p ɛ r w ɛ n iː r ɛ
p ɛ r ɛ g r iː n aː r ɛ	p ɛ r ɛ g r iː n aː r iː
d ɛ w j aː r ɛ	d eː w j aː r ɛ
a l ɛ g aː r ɛ	a lː ɛ g ɛ r ɛ
r ɛ p ɛ t ɛ r ɛ	r ɛ p ɛ t ɛ r ɛ
k ʊ k ʊ r k b ɪ t a m	k ʊ k ʊ r b ɪ t a m
eː k s k ɛ t y r ɛ	ɛ k s k ɪ p ɛ r ɛ
k ɔ m p ɛ t ɛ r ɛ	k ɔ m p ɛ t ɛ r ɛ
d ɪ s ɛ n s ʊ m	d ɪ sː eː n s ʊ m
m ɛ n d ɪ k ʊ m	m ɛ n d iː k ʊ m
a fː ɪ l r ɛ n t j ʊ m	a fː l ʊ ɛ n t j a m
s t r aː t ʊ m	s t r aː t ʊ m
w a d ɪ ʊ m	w a k iː w ʊ m
d ɛ s ɪ n ɛ n t j a m	d eː s ɪ n ɛ n t j a m
a p r ɪ k ʊ m	a p r iː k ʊ m
g ɛu m ɛu pʰ ɛ m	g ɛ m ɛ lː ʊ m
p a r t ʊ r j y n r ɛ m	p a r t ʊ r iː r ɛ
k ɔ n f oː r m ɛ m	k oː n f oː r m ɛ m
ɪ n f ɛ r m iː t aː t ɛ m	iː n f ɪ r m ɪ t aː t ɛ m
d eː n ɛ g aː r iː	d eː n ɛ g aː r ɛ
g ɛ r uː n d j ʊ m	g ɛ r ʊ n d j ʊ m
d eː m ɔ y s t r aː t j oː n ɛ m	d eː m oː n s t r aː t j oː n ɛ m
g a n ɪ r ɛ	g a nː iː r ɛ
a d aː m a n t ɛ m	a d a m a n t ɛ m
f l ɛ mː a m	pʰ l ɛ g m a
j a s p ɪ d ɛ m	j a s p ɪ d ɛ m
p ɛ r s w aː d ɛ r ɛ	p ɛ r s w aː d eː r ɛ
l uː m ɪ n aː r j	l uː m ɪ n aː r ɛ
b l aː t ɛ r aː r ɛ	b l a t ɛ r aː r ɛ
f ɔ r t ɪ pʰ iː k aː r ɛ	f ɔ r t ɪ f ɪ k aː r ɛ
a k ɛ r b ʊ m	a k ɛ r b ʊ m
n a t ɪ w ɪ t aː t ɛ m	n aː t iː w ɪ t aː t ɛ m
d ɛ r ɪ s j oː n ɛ m	d eː r iː s j oː n ɛ m
ɛ l ʊ m	ʊ l ʊ m
a pː r ɛ h ɛ n s j oː n ɛ m	a pː r ɛ h ɛ n s j oː n ɛ m
a b l a kʷ aː t ɛ j oː n ɛ m	a b l a kʷ ɛ aː t j oː n ɛ m
k ɔ n ɛ k sː j oː n ɛ m	k ɔ nː ɛ k s j oː n ɛ m
k ɔ k ɔ m ɛ r ʊ m	k ʊ k ʊ m ɛ r ɛ m
p ɛ t ɪ k a m	p ɛ d ɪ k a m
k ɔ m uː n aː l ɛ	k ɔ mː uː n aː l ɛ m
r ɛ d ɪ k g ɛ r ɛ	r ɛ d ɪ g ɛ r ɛ
k a n d ɛu l a m	k a n d eː l a m
d eː n uː d aː t j oː n ɛ m	d eː n uː d aː t j oː n ɛ m
s a t ɪ r a m	s a t ɪ r a m
g l oː r j aː r ɛ	g l oː r j aː r iː
d eː t ɛ s t aː r ɛ	d eː t ɛ s t aː r iː
t r aː n s f ɔ r m aː t j oː n ɛ m	t r aː n s f oː r m aː t j oː n ɛ m
w ɛ t r ɪ k ɛ m	w iː t ɪ k ɛ m
b a s ɛ m	b a s ɛ m
k ɔ n k aː t ɛ n aː r ɛ	k ɔ ŋ k a t eː n aː r ɛ
d eː l ɪ b ɛ r aː r ɛ	d eː l iː b ɛ r aː r ɛ
a lː iː	ɪ lː ʊ ŋ k
a d ʊ m b r aː r ɛ	a d ʊ m b r aː r ɛ
k a l w ʊ m	k a l w ʊ m
f ʊ n t ɛ m	f ɔ n t ɛ m
d eː l a t oː r ɛ	d eː l aː t oː r ɛ m
n a t a l ɪ t j ʊ m	n aː t aː l iː k j ʊ m
d eː f ɔ r m ɪ t aː t ɛ m	d eː f oː r m ɪ t aː t ɛ m
l a r w a m	l aː r w a m
w ɛ r ɛ k ʊ n d j a m	w ɛ r eː k ʊ n d j a m
f ɛ m ʊ r ɛ	f ɛ m ʊ r
d ɛ s p ɛ r eː t ɪ r ɛ	d ɪ s p ɛ r iː r ɛ
w ɪ w ɪ d ʊ m	w iː w ɪ d ʊ m
t uː m ɛ f aː r ɛ	t ʊ m ɛ f a k ɛ r ɛ
a eː r ɔ m a n t j a m	aː ɛ r ɔ m a n t iː a m
k ɔ n f l ɪ k t ʊ m	k oː n f l ɪ k t ʊ m
ɪ n s uː l aː r ɛ	iː n s ʊ l aː r ɛ m
k ɪ m iː kʷ ɛ m	k iː m ɪ k ɛ m
l ɪ b r ʊ m	l iː b ɛ r ʊ m
w ɪ g ɔ r aː r ɛ	w ɪ g oː r aː r ɛ
d ɪ w uː l g aː t j oː n ɛ m	d iː w ʊ l g aː t j oː n ɛ m
ɔ s aː r	aʊ d eː r ɛ
w ɛ r g ɪ ɛ l ɛ	w ɪ r ɪ d aː r j ʊ m
ɪ m b ɪ ŋ w aɪ r ɛ	ɪ m b ɪ b ɛ r ɛ
r ɛ f ɛ r iː r ɛ	r ɛ f ɛ rː ɛ
s ɔ ɛ k r ʊː m	s ɔ k ɛ r ʊ m
r ɛ ɪ j ʊ m	r eː g j ʊ m
k ɔ m p r aː t oː r ɛ	k ɔ m p a r aː t oː r ɛ m
k ɔ k ɔ ŋ lː ʊ m	k ʊ k ʊ lː ʊ m
k ɔ n f ɛ d eː r aː t j oː n ɛ m	k oː n f ɔ ɪ d ɛ r aː t j oː n ɛ m
r ɛ l ɛ g aː t j oː n ɛ m	r ɛ l eː g aː t j oː n ɛ m
ɪ n k ʊ m b ɛ r ɛ	ɪ ŋ k ʊ m b ɛ r ɛ
a p n ɛ g aː r ɛ	a b n ɛ g aː r ɛ
m a n t ɪ n eː r ɛ	m a n ʊ t ɛ n eː r ɛ
ɪ n k ʊ rː ɛ r ɛ	ɪ ŋ k ʊ rː ɛ r ɛ
k a p a k ɪ t aː t ɛ m	k a p aː k ɪ t aː t ɛ m
ɛ k s k r ɛ m ɛ n t ʊ m	ɛ k s k r eː m ɛ n t ʊ m
ɪ n l j aː r ɛ	ɪ lː ɪ g aː r ɛ
l uː p a n aː r ɛ	l ʊ p aː n a r
f ɔ k ɛ m	f aʊ k ɛ m
m ɔ t j oː n ɛ m	m oː t j oː n ɛ m
eː r g aː s t ʊ l ʊ m	ɛ r g a s t ʊ l ʊ m
ɔ b s ɛ d ɪ n ɛ r ɛ	ɔ b s ɪ d eː r ɛ
f oː r a n ɪ d s ɛ m	f ɔ r n ɪ k ɛ m
g ɛ m ɪ n aː r ɛ	g ɛ m ɪ n aː r ɛ
k j ɛ t ʊ m	f ɪ l ɪ k t ʊ m
p ɛ n s ɪ l ɛ	p eː n s ɪ l ɛ m
b ɛ aː t ʊ m	b ɛ aː t ʊ m
ɛ k s p ʊ l s aː r ɛ	ɛ k s p ʊ l s aː r ɛ
a s p ɔ r t aː r ɛ	a s p ɔ r t aː r ɛ
k ʊ n j aː r n ɛ	k ʊ n ɛ aː r ɛ
ʊ s aː r ɛ m	uː t iː
l aʊ d ɛ m	l aʊ d ɛ m
p r oː p r ʊ m	p r oː p r j ʊ m
d eː s uː l t oː r j ʊ m	d eː s ʊ l t oː r j ʊ m
k ɔ n t ɛ s t aː r ɛ	k ɔ n t ɛ s t aː r iː
r ɛ p l ɪ k aː t j oː n ɛ	r ɛ p l ɪ k aː t j oː n ɛ m
t ɛ m ɛ r ɪ t a t ɛ m	t ɛ m ɛ r ɪ t aː t ɛ m
s a l uː t aː r ɛ	s a l uː t aː r ɛ
a kː aː d ɛ m j a m	a k a d eː m iː a m
m ɛ n oː r ɛ	m ɪ n oː r ɛ m
ɪ n t r ɪ s t ɛ k ʊ m	ɪ n t r iː n s ɛ k ʊ m
ɛ k s uː lː t ɛ	ɛ k s ʊ l t aː r ɛ
p r ɛ m ɪ j a m	p r iː m ɪ t j a m
d eː m uː t aː r ɛ	d eː m uː t aː r ɛ
oː rː ɪ ʊ m	h ɔ rː ɛu m
d ɪ ŋ n aː t j oː n ɛ m	d ɪ ŋ n aː t j oː n ɛ m
s k r ɪ t uː r a m	s k r iː p t uː r a m
a r g ɪ lː a m	a r g ɪ lː a m
a d ɪ ɪ k ʊ m	aː t ɪ k ʊ m
f r aː n k ɛ s ɛ m	f r a ŋ k eː n s ɛ m
d iː m a n d aː r ɛ	d eː m a n d aː r ɛ
a k k ɛ sː j oː m	a kː ɛ sː j oː n ɛ m
t ɛ n ɛ b r oː s ʊ m	t ɛ n ɛ b r oː s ʊ m
a k t a m	aː k t a
k ɛ l ɪ b ʊ m	k aɪ l ɪ b ɛ m
l ɪ ɛ ŋ g ʊ l a m	l ɪ ŋ g ʊ l a m
m eː s a m	m eː s a m
n uː t r ɪ k aː r ɛ	n uː t r iː k aː r ɛ
k ɔ k ɪ n ɪ l a m	k ɔ kː ɪ n a m
k ɔ n s ɛ r w aː r ɛ	k oː n s ɛ r w aː r ɛ
r aː s k aː r ɛ	r ɛ s ɛ k aː r ɛ
w ɛ r a t ɪ t ɛ m	w ɛ r t ɪ k ɛ m
m ɛ r k ɛ m	m ɛ r k ɛ m
w ɪ t ɛ lː ʊ m	w ɪ t ɛ lː ʊ m
m ʊ s k a m	m ʊ s k a m
t ɛ oː s oː f j a m	tʰ ɛ ɔ s ɔ pʰ j a m
k a t ɛ k ɪ ʊ zː aː r ɛ	k a t eː kʰ iː zː aː r ɛ
p ɔ s k iː r p oː n ɛ	p ɔ s t p oː n ɛ r ɛ
m ɔ s t r aː r ɛ	m oː n s t r aː r ɛ
ɪ n aː l aː r ɛ	ɪ n h aː l aː r ɛ
p r ɔ s p ɛ r aː r ɛ	p r ɔ s p ɛ r aː r ɛ
sː t aː p eː s ɛ m	s t a p ɛ d ɛ m
k ɔ r j aː k ɛu ʊ m	k ɔ r j a k ɛu m
a sː iː oː ʊ m	a sː ɛ sː ʊ m
g uː s t aː t j oː n ɛ m	g ʊ s t aː t j oː n ɛ m
g uː s t ɪ f iː k aː t oː r ɛ m	j uː s t ɪ f ɪ k aː t oː r ɛ m
a b d oː m ɪ n ɛ m	a b d oː m ɛ n
k ɔ ŋ g ʊ r aː r ɛ	k ɔ n ɪ uː r aː r ɛ
f a l d ɪ s t oː r j ʊ m	f a l d ɪ s t oː l j ʊ m
k oː ŋ g r j ʊ m	k ɔ ŋ g r ʊ m
s a p j ɛ n t a m	s a p ɪ ɛ n t j a m
t ɪ m ɪ d ɪ n ʊ m	t ɪ m ɪ d ʊ m
a b j ɛ k t j oː n ɛ m	a b ɪ ɛ k t j oː n ɛ m
n ɪ d ɪ f oː r m ɛ	n iː d ɪ f oː r m ɛ m
kʷ a t r aː t ʊ m	kʷ a d r aː t ʊ m
k r aɪ s p ʊ m	k r ɪ s p ʊ m
m a n kʷ ʊ m	m a ŋ k ʊ m
w ɪ k ʊ m	w iː k ʊ m
d eː g uː s t aː r ɛ	d eː g ʊ s t aː r ɛ
z iː g g ɪ n aː n j a m	z iː zː a n j a
m a r ɪ t ʊ m	m a r iː t ʊ m
n ɛ r w oː s ʊ m	n ɛ r w oː s ʊ m
l a m b r ʊ s k a m	l aː b r ʊ s k a m
r eː k ɔ r d aː r ɛ	r ɛ k ɔ r d aː r iː
a l t ɪ s ɪ m ʊ m	a l t ɪ sː ɪ m ʊ m
s t r ɔ p ʊ m	s t r ɔ pː ʊ m
ɪ n k uː l k aː r ɛ	ɪ ŋ k ʊ l k aː r ɛ
r ɛ fː r m ɛu n aː r ɛ	r ɛ f r eː n aː r ɛ
ɔ r aː t r ɪ k ɛ	ɔ r aː t r iː k ɛ m
n ɔ s ʊ m	n ɔ t a m
a l uː t ɪ n aː r ɛ	aː l uː k ɪ n aː r iː
d ɪ m a n aː r ɛ	d iː m aː n aː r ɛ
s ʊ r g ɪ r ɛ	s ʊ r g ɛ r ɛ
p ɛ r w ɛ ɪ n iː r ɛ	p ɛ r w ɛ n iː r ɛ
k ɔ l ɛ k t a m	k ɔ lː eː k t a m
b ɛ s t j aː r j ʊ m	b eː s t j aː r j ʊ m
f uː n ɛ s t ʊ m	f uː n ɛ s t ʊ m
p r oː t ɛ r b ʊ m	p r ɔ t ɛ r w ʊ m
a n uː l aː r ɛ	aː n ʊ l aː r ɛ m
k a pː ɛ lː a m	k a pː ɛ lː a m
a l oː k aː r n ɛ	a lː ɔ k aː r ɛ
s ɔ l ɪ k ɪ t aː t j oː n ɛ m	s ɔ lː ɪ k ɪ t aː t j oː n ɛ m
ɪ n f ɔ r m ɛ m	iː n f oː r m ɛ m
j uː n j ɔ r ɛ	j uː n j oː r ɛ m
r ɛ g ʊ l a m	r eː g ʊ l a m
l eː d aː t ɔ r ɛ m	l aʊ d aː t oː r ɛ m
k a l ɪ k ɛ	k a l ɪ k ɛ m
ɪ m p r ɔ b ʊ m	ɪ m p r ɔ b ʊ m
a s t r ʊ m	a s t r ʊ m
ɛ k s t ɪ r p aː r ɛ	ɛ k sː t ɪ r p aː r ɛ
s t ʊ p a m	s t ʊ pː a m
eː k l ɪ p sː ɛ m	ɛ k l iː p s ɛ m
w ɪ lː ŋ n ʊ m	w iː lː aː n ʊ m
s p uː t aː r ɛ	s p uː t aː r ɛ
m ɔ ɔ ʊ m	m ʊ tː ʊ m
p r oː t ɛ l a m	p r ɔ k ɛ lː a m
ɛ kː s k oː r j aː r ɛ	ɛ k s k ɔ r j aː r ɛ
a m p l ɪ t oː d ɪ n ɛ m	a m p l ɪ t uː d ɪ n ɛ m
p ɛ l ɪ k ʊ l a m	p ɛ lː ɪ k ʊ l a m
ɔ p uː l ɛ n t j a m	ɔ p ʊ l ɛ n t j a m
p l aː g j aː r ɛ	p l a g j aː r ɛ
p oː l ɪ r ɛ	p ɔ l iː r ɛ
l ɪ m ɪ t aː r ɛ	l iː m ɪ t aː r ɛ
a kː r ɛ t j oː n ɛ	a kː r eː t j oː n ɛ m
h ɔ m b r a m	ʊ m b r a m
n ɪ ɛ m oː n	n eː m ɪ n ɛ m
p ɔ s ɛ sː j oː n ɛ m	p ɔ sː ɛ sː j oː n ɛ m
b r k b ɪ k ɛ m	w ɛ r w eː k s
ɔ b s k ʊ r ʊ m	ɔ b s k uː r ʊ m
s ɛ l w aː t iː k	s ɪ l w aː t ɪ k ʊ m
l ɪ b ɛ lː ʊ l a m	l iː b ɛ lː ʊ l a m
r ɛ w ɛ r ɛ n t ɛ m	r ɛ w ɛ r ɛ n t ɛ m
w ɛ b aː r ɛ	w ɪ g ɪ l aː r ɛ
a kː r ɪ t ʊ d ɛ m	aː k r ɪ t uː d ɪ n ɛ m
ɪ mː ɪ s s ɛ r s ɛ m	ɪ mː ɪ s k eː r ɛ
p aː r ɛ g ʊ d ɪ n ɛ k aː r ɛ	p r aɪ j uː d ɪ k aː r ɛ
eː k uː l ɛ k j ʊ m	a k ʊ l ɛu m
a kː ɪ d j a m	a k eː d j a m
k ɪ l ʊ m	k ɪ l j ʊ m
a b l a k t aː r ɛ	a b l a k t aː r ɛ
a p oː k aː l ɪ p t ɛ m	a p ɔ k a l y p s ɛ m
k a n t oː r ɛ	k a n t oː r ɛ m
t uː r p ɪ t uː d ɪ n ɛ	t ʊ r p ɪ t uː d ɪ n ɛ m
p r aɪ s ʊ m ɛ r ɛ	p r aɪ s uː m ɛ r ɛ
d a ŋ n aː r ɛ	d a m n aː r ɛ
a r k j a m	a r kʰ j a m
ɪ rː oː m p ɛ r ɛ	ɪ rː ʊ m p ɛ r ɛ
w ɔ t ʊ m	w oː t ʊ m
ɪ n k ɔ m p eː t ɛ n t ɛ m	ɪ ŋ k ɔ m p ɛ t ɛ n t ɛ m
