ɪ k s p eː d j ɛ r ɛ	ɛ k s p ɛ d iː r ɛ
b r iː t a n iː k ʊ m	b r ɪ t a nː ɪ k ʊ m
a p a r iː t j ʊ n	a pː aː r ɪ t j oː n ɛ m
kʷ a l iː f ɪ k aː r ɛ	kʷ aː l ɪ f ɪ k aː r ɛ
w iː w iː d ʊ m	w iː w ɪ d ʊ m
s ɪ k ɔ r	s eː k uː r ʊ m
t ɔ m ʊ m	t ɔ m ʊ m
ɛ ? ɛ t ʊ m	f ɪ l ɪ k t ʊ m
k eː r oː s ʊ m	k eː r oː s ʊ m
r ɔ r a m d aː	r oː r ɛ m
p r ɛ t ɛ r n a t uː r a l ɛ	p r aɪ t ɛ r n aː t uː r aː l ɛ m
a k t ʊ w aː r j ʊ m	aː k t w aː r j ʊ m
n ɔ w iː t j ʊ m	n ɔ w iː k j ʊ m
f ɛ r m ɛ n t ɪ	f ɛ r m ɛ n t ʊ m
a r ɔ m a t iː k ʊ m	a r oː m a t ɪ k ʊ m
m uː r iː k eː	m uː r ɪ k ɛ m
r aː n k oː r ɛ	r a ŋ k oː r ɛ m
l iː t ɛ m	l iː t ɛ m
g ɛ r m ɛ n	g ɛ r m ɛ n
k ʊ n k ʊ rː ɛ r ɛ	k ɔ ŋ k ʊ rː ɛ r ɛ
iː p ɔ t ɛ k a m	h y p ɔ tʰ eː k a m
k ɔ lː iː r j ʊ m	k ɔ lː y r j ʊ m
ʊ r t iː k aː r j a m	ʊ r t iː k aː r j a m
s ɔ l iː l ɔ kʷ j ʊ m	s oː l ɪ l ɔ kʷ j ʊ m
k a s t aː n a m	k a s t a n ɛ a m
r ɔ t aː r ɛ	r ɔ t aː r ɛ
p aː r t ʊ m	p a r t ʊ m
ɔ s p iː t j ʊ m	h ɔ s p ɪ t j ʊ m
iː n f ʊ n d ɛ r ɛ	iː n f ʊ n d ɛ r ɛ
d eː f ʊ r m iː t a t ɛ m	d eː f oː r m ɪ t aː t ɛ m
t r uː k ɛ	t r ʊ k ɛ m
n ɛ f aː s t ʊ m	n ɛ f aː s t ʊ m
iː m p a r	ɪ m p a r ɛ m
ɛ k s t r iː n s ɛ k ʊ m	ɛ k s t r iː n s ɛ k ʊ m
eː s k uː l eː n t ʊ m	eː s k ʊ l ɛ n t ʊ m
k ɔ n k a w ʊ m	k ɔ ŋ k a w ʊ m
s ʊ b t iː l ɛ	s ʊ b t iː l ɛ m
p r ɛ s t a t j ʊ m n ɛ m	p r aɪ s t aː t j oː n ɛ m
m ɛ r ʊ m	m ɛ r ʊ m
m ɔ d eː r aː r ɛ	m ɔ d ɛ r aː r iː
s ʊ b m ɛ r g ɛ r ɛ	s ʊ mː ɛ r g ɛ r ɛ
ɛ s t r ɛ n a m	s t r eː n a m
n aː f t a m	n a pʰ tʰ a m
iː n k ɔ l uː m eː	ɪ ŋ k ɔ l ʊ m ɛ m
m ʊ r iː r ɛ	m ɔ r iː
t r a m b a l	t r a b aː l ɛ m
t r uː k iː d aː r ɛ	t r ʊ k iː d aː r ɛ
s k ɔ r j a m	s k oː r j a m
f r iː k t j oː n ɛ	f r ɪ k t j oː n ɛ m
r ɔ b ɛ r ɛ	r oː b ʊ r
d eː w ɔ r a t j ʊ m n ɛ m	d eː w ɔ r aː t j oː n ɛ m
w ɛ r b a l ɛ	w ɛ r b aː l ɛ m
p uː n iː r ɛ	p uː n iː r ɛ
k ɔ n t iː n w ʊ	k ɔ n t ɪ n ʊː m
p a m p aː r ɛ	p a pː aː r ɛ
g ʊ n f j a m r ɛ	k oː n f l aː r ɛ
s ɛ r w aː r ɛ	s ɛ r w aː r ɛ
r ɛ s t a m	r ɛ s t ɛ m
uː n iː f ɔ r m ɛ	uː n ɪ f oː r m ɛ m
p ʊ t r eː	p ʊ t r ɛ m
uː s aː r j ʊ m	uː s w aː r j ʊ m
iː n w ɛ n t oː r ɛ	ɪ n w ɛ n t oː r ɛ m
p ɛ n iː t ɛ n t j aː l	p aɪ n ɪ t ɛ n t j aː l ɛ m
ʊ rː ɛ n d ʊ m	h ɔ rː ɛ n d ʊ m
r uː b iː g iː n oː s ʊ m	r oː b iː g ɪ n oː s ʊ m
l ɔ n g iː t uː d n ɛ	l ɔ ŋ g ɪ t uː d ɪ n ɛ m
s ʊ ɛ n ʊ	s ɔ n ʊ m
ɪ t aː t ɛ m	ɪ t aː t ɛ m
a d ɔ r a t j ʊ m n ɛ m	a d oː r aː t j oː n ɛ m
k l a r ɪ t aː t ɛ m	k l aː r ɪ t aː t ɛ m
rː a p iː n a m	r a p iː n a m
l a w a m t oː r j ʊ m	l a w aː t oː r j ʊ m
l ɔ k aː l ɛ	l ɔ k aː l ɛ m
k ʊ k iː n aː r ɛ	k ɔ kʷ iː n aː r ɛ
aʊ d iː t j oː n ɛ	aʊ d iː t j oː n ɛ m
p a m d ɛ lː a m	p a t ɛ lː a m
t ɛ l oː s ʊ m	z eː l oː s ʊ m
t ɛ n t aː r ɛ	t ɛ m p t aː r ɛ
ɔ b j ɛ k t iː w ʊ m	ɔ b j ɛ k t iː w ʊ m
p ɛ r g ʊ n t aː r	p ɛ r k ɔ n t aː r iː
a m w j ɛ s ʊ m	aː w ɛ r s ʊ m
k ɔ ɛ l a	k aʊ d a m
a g iː l iː t aː t ɛ m	a g ɪ l ɪ t aː t ɛ m
k ɔ m p l iː k a t j oː n ɛ	k ɔ m p l ɪ k aː t j oː n ɛ m
s a ŋ gʷ iː n aː r j ʊ m	s a ŋ gʷ ɪ n aː r j ʊ m
f a h m oː s ʊ m	f aː m oː s ʊ m
d eː m ɔ n j ʊ	d aɪ m ɔ n j ʊ m
p a lː a m ɛ m	p a l ɛ aː r j ʊ m
f uː r ɔ r ɛ	f uː r aː r iː
iː n f iː m ʊ m	iː n f ɪ m ʊ m
p a m r iː r	p a r ɛ r ɛ
k a l iː g iː n oː s ʊ m	k aː l iː g ɪ n oː s ʊ m
p r ɔ d uː k t j oː n ɛ m	p r oː d ʊ k t j oː n ɛ m
p r eː g oː n	p r aɪ k oː n ɛ m
d iː k aː k ɛ	d ɪ k aː k ɛ m
b ʊ ? ɛ	b uː b oː n ɛ m
a m k uː m eː m	a k uː m ɛ n
r ɛ k l iː n aː r ɛ	r ɛ k l iː n aː r ɛ
b a r b a r iː d zː aː r ɛ	b a r b a r iː zː aː r ɛ
ɛ l ʊ m	ʊ l ʊ m
d ɛ s w j a m r ɛ	d eː w j aː r ɛ
s t a b ɪ l k ɛ r ɛ	s t a b ɪ l iː r ɛ
a s ɔ k j aː r ɛ	a sː ɔ k j aː r ɛ
t iː s ʊ ɛ r a m	t oː n s oː r j ʊ m
k ɔ ɛ r t ɛ m j ʊ n	k ɔ ɪ r k ɪ t j oː n ɛ m
l a n t ɛ ʊ m	l a ŋ k j aː r j ʊ m
d uː r ʊ m	d uː r ʊ m
d eː n uː d a t j ʊ m n ɛ m	d eː n uː d aː t j oː n ɛ m
s a n t ʊ m	s aː ŋ k t ʊ m
b a j ɔ lː aː r ɛ	b aː j ʊ l aː r ɛ
a b d uː k ɛ r	a b d uː k ɛ r ɛ
s kʷ aː l ʊ m	s kʷ aː l ʊ m
p r iː s ʊ m n ɛ m	p r ɛ h ɛ n s j oː n ɛ m
k a m p ɛ s t r ɛ	k a m p ɛ s t r ɛ m
g ʊ m w ɛ n k a m	j ʊ w ɛ ŋ k a m
ɔ k l uː ɛ r ɛ	ɔ kː l uː d ɛ r ɛ
n eː k r ɪ t a m	n ɪ g r ɪ t j a m
a m n a m l iː s iː s	a n a l y s ɛ m
b eː t ʊ lː a	b ɛ t ʊ l a m
k ʊ n k iː l j aː b ʊ l ʊ m	k ɔ ŋ k ɪ l j aː b ʊ l ʊ m
d eː p ɔ r t aː r ɛ	d eː p ɔ r t aː r ɛ
ɛ k s uː l t a t j oː n ɛ m	ɛ k s ʊ l t a t j oː n ɛ m
r ɛ s ɔ n aː r ɛ	r ɛ s ɔ n aː r ɛ
iː t eː r aː r ɛ	ɪ t ɛ r aː r ɛ
k ɛ r t ʊ m	k ɛ r t ʊ m
ɛ s k h t ɛ r ɛ	ɛ k s k ʊ t ɛ r ɛ
s aː l m a m	s a g m a m
k a p aː k ɛ	k a p aː k ɛ m
w h ɛ rː m ʊ m	w ɛ rː ɛ m
ɛ m uː l a m t ɔ r ɛ	aɪ m ʊ l aː t oː r ɛ m
m uː t ʊ ʊ m m	m uː t ʊː m
s k ʊ j a ʊ l ʊ m j	s k ɪ uː r ʊ m
ɔ b n uː b iː l a m r ɛ	ɔ b n uː b ɪ l aː r ɛ
a d m ɔ n iː t j ʊ m n ɛ m	a d m ɔ n ɪ t j oː n ɛ m
p r ʊ m p uː ŋ n a m r ɛ	p r oː p ʊ ŋ n aː r ɛ
p r ɛ t eː r iː r	p r aɪ t ɛ r iː r ɛ
ɛ k s a l t a m r ɛ	ɛ k s a l t aː r ɛ
ɛ r m a n d aː d ɛ m	g ɛ r m aː n ɪ t aː t ɛ m
r ɛ p ɔ n ɛ m	r ɛ p oː n ɛ r ɛ
w ɛ r t iː g iː n oː s ʊ m	w ɛ r t iː g ɪ n oː s ʊ m
ɪ t j aː	ɪ t j a m
a b ɔ l iː t j ʊ m n ɛ m	a b ɔ l ɪ t j oː n ɛ m
r ɛ k ɛ n s ɪ r ɛ	r ɛ k eː n s eː r ɛ
l iː b ɛ r a t oː r ɛ	l iː b ɛ r aː t oː r ɛ m
s ʊ b ɔ r n aː r ɛ	s ʊ b oː r n aː r ɛ
iː n k uː b ʊ m	ɪ ŋ k ʊ b ʊ m
b r a m k aː t ʊ m	b r aː k aː t ʊ m
k ʊ n d iː g n ʊ m	k ɔ n d ɪ ŋ n ʊ m
p j ʊ l p m ʊ m	p ɔ l y p ʊ m
kʰ a r p ɛ n t ʊ m	k a r p ɛ n t ʊ m
iː n k iː t a t j ʊ m n ɛ m	ɪ ŋ k ɪ t aː t j oː n ɛ m
s k ɔ l a s t iː k ʊ m	s kʰ ɔ l a s t ɪ k ʊ m
d ɛ p ɛ r d iː t j ʊ m n ɛ m	d eː p ɛ r d ɪ t j oː n ɛ m
a m n aː t ɪ n ʊ m	a nː oː t ɪ n ʊ m
k ʊ k ʊ r m b ɪ t a m	k ʊ k ʊ r b ɪ t a m
l iː m a m	l iː m a m
ɔ m d oː r ɛ	ɔ d oː r ɛ m
t ɛ j ʊ	t ʊː m
k ɔ m uː n a l	k ɔ mː uː n aː l ɛ m
z a m n k a m	z a ŋ kʰ a m
m a n a j ɛ r ʊ m	m a n w aː r j ʊ m
p a m t r ʊ k iː n j ʊ m	p a t r oː k ɪ n j ʊ m
k a m l k aː n ʊ m	k a l k aː n ɛu m
r uː d ɛ	r ʊ d ɛ m
d iː f l uː ɛ r	d ɪ fː l ʊ ɛ r ɛ
p ɛ r p ɛ t r a m r ɛ	p ɛ r p ɛ t r aː r ɛ
f ɪ d eː l ɛ	f ɪ d eː l ɛ m
k a l eː f a k t j ʊ n ɛ	k a l ɛ f a k t j oː n ɛ m
t aː b ʊ l a m	t a b l a m
f uː r ɛ m n ɛ	f uː r ɛ m
d j oː s	d ɛu m
r ɛ w ɔ k a t j ʊ m n ɛ m	r ɛ w ɔ k aː t j oː n ɛ m
iː p n ɔ t iː k ʊ m	h y p n oː t ɪ k ʊ m
f r a t ɛ r n iː t aː t ɛ	f r aː t ɛ r n ɪ t aː t ɛ m
ɛ k s ɔ r t a t j oː n ɛ m	ɛ k s h ɔ r t aː t j oː n ɛ m
p l ɔ w k ɔ s ʊ m	p l ʊ w j oː s ʊ m
w ɛ r m ɪ l ʊ m	w ɛ r m ɪ k ʊ l ʊ m
r ɛ s p ɔ n s ʊ m	r ɛ s p oː n s ʊ m
k a m m ɛ b r ʊ m n ɛ m	k r aː b r oː n ɛ m
ɔ b s k uː r ʊ m	ɔ b s k uː r ʊ m
iː m mː ɔ l a t j ʊ m n ɛ m	ɪ mː ɔ l aː t j oː n ɛ m
b ʊ t ɪ k a m	a p ɔ tʰ eː k a m
k ʊ n s ʊ m a t j ʊ m n ɛ m	k oː n s ʊ mː aː t j oː n ɛ m
k ʊ n t iː n w a t j ʊ m n ɛ m	k ɔ n t ɪ n w aː t j oː n ɛ m
k ɛ n ʊ m	k ɪ nː ʊ m
t r ɛ m ʊ l aː r ɛ	t r ɛ m ʊ l aː r ɛ
p r ɔ m ɛ t ɛ r ɛ	p r oː m ɪ tː ɛ r ɛ
p l aː k iː d ʊ m	p l a k ɪ d ʊ m
t r aː k j ʊ m	tʰ r aː k j ʊ m
k ʊ k iː n a m	k ɔ kʷ iː n a m
ɛ k s p ɔ n ɛ m	ɛ k s p oː n ɛ r ɛ
s uː p l ɛ m ɛ n t ɛ	s ʊ pː l eː m ɛ n t ʊ m
f a l a ŋ g ɛ	pʰ a l a ŋ g ɛ m
g l ʊ t oː n ɛ	g l ʊ tː oː n ɛ m
iː rː iː g a m r ɛ	ɪ rː ɪ g aː r ɛ
ɛ d iː k t ʊ m	eː d ɪ k t ʊ m
k a m l a m m iː t ɔ s ʊ m	k a l a m ɪ t oː s ʊ m
ɔ b t ɛ n eː r ɛ	ɔ b t ɪ n eː r ɛ
t aʊ r iː f ɔ r m ɛ	t aʊ r ɪ f oː r m ɛ m
p r eː p ɔ n ɛ m	p r aɪ p oː n ɛ r ɛ
k ɔ r n ɛ ʊ m	k ɔ r n ɛu m
l iː m iː t r ʊ f ɛ m	l iː m ɪ t r ɔ pʰ ʊ m
m uː n iː f iː k ʊ m	m uː n ɪ f ɪ k ʊ m
d ɔ m ɛ s t iː k ʊ m	d ɔ m ɛ s t ɪ k ʊ m
w n a ɔ r	w eː n aː t oː r ɛ m
a k ɔ m ɔ d a t j ʊ m n ɛ m	a kː ɔ mː ɔ d aː t j oː n ɛ m
s p ɛ k ʊ j ʊ m	s p ɛ k l ʊ m
b ɛ s t j aː r j ʊ m	b eː s t j aː r j ʊ m
a m p l ʊ m	a m p l ʊ m
r ɛ t j aː r j ʊ m	r eː t j aː r j ʊ m
d ʊ k t ʊ m	d ʊ k t ʊ m
k iː s t ɛ r n a m	k ɪ s t ɛ r n a m
aː w ɪ ʊ	a w ɛ m
l r j ɔ l	aʊ r ɛ ɔ l ʊ m
k iː r k ʊ n l ʊ m k uː t j ʊ m n ɛ	k ɪ r k ʊ m l ɔ k uː t j oː n ɛ m
t ʊ r p ɛ	t ʊ r p ɛ m
f r a n k ɛ s ɛ	f r a ŋ k eː n s ɛ m
d uː r a m t j ʊ m n ɛ m	d uː r aː t j oː n ɛ m
g ɛ n ɛ s t ɛ	g ɛ n ɛ s t a m
p ɪ g r ɛ ŋ ɪ t j a m	p ɪ g r ɪ t j a m
f ɛ m ɛ l a m	f eː m ɛ lː a m
a n ɛ t ʊ m	a n eː tʰ ʊ m
ɛ f iː k a t iː t aː	ɛ fː ɪ k aː k ɪ t aː t ɛ m
l iː r iː k ʊ m	l y r ɪ k ʊ m
p ɛ r iː k ʊ l oː s ʊ m	p ɛ r iː k ʊ l oː s ʊ m
ɪ m p eː r a t oː r j ʊ m	ɪ m p ɛ r aː t oː r j ʊ m
s ɛ r w iː l ɛ	s ɛ r w iː l ɛ m
m iː t iː g a m r ɛ	m iː t ɪ g aː r ɛ
s eː n eː	s ɛ n ɛ m
p r ɔ p a g a t j ʊ m n ɛ m	p r oː p aː g aː t j oː n ɛ m
k a r ɔ t a m	k a r oː t a m
s p iː n a l ɛ	s p iː n aː l ɛ m
ɔ b j ɛ k t ʊ m	ɔ b ɪ ɛ k t ʊ m
d ɛ n s a m s ɛ	d eː n s aː r ɛ
iː m f l iː g ɛ r	iː n f l iː g ɛ r ɛ
a m b j eː k k j oː n	a b ɪ ɛ k t j oː n ɛ m
r oː ɪ b j a m	r ʊ b j a m
k uː j	k uː j ʊ m
s a ŋ t j oː	s aː ŋ k t j oː n ɛ m
s uː p ɛ r b j a m	s ʊ p ɛ r b j a m
s ʊ s p ɛ n s j oː n ɛ m	s ʊ s p eː n s j oː n ɛ m
ɪ n f eː r m ɪ t a t ɛ m	iː n f ɪ r m ɪ t aː t ɛ m
m a m t r iː k iː d j ʊ m	m aː t r ɪ k iː d j ʊ m
m a s k ʊ l iː n ʊ m	m a s k ʊ l iː n ʊ m
s ʊ m iː n iː s t r a m r ɛ	s ʊ b m ɪ n ɪ s t r aː r ɛ
aɪ ɛ r uː g iː n oː s ʊ m	aɪ r uː g ɪ n oː s ʊ m
p uː l p iː t m ʊ m	p ʊ l p ɪ t ʊ m
b a l aː t a m	b l a tː a m
k ɔ d ɪ k ɛ	k oː d ɪ k ɛ m
iː n d aː m n ɛ	ɪ n d ɛ m n ɛ m
k ʊ n f eː d eː r a t j ʊ m n ɛ m	k oː n f ɔ ɪ d ɛ r aː t j oː n ɛ m
k ʊ n s aː k r a t j ʊ m n ɛ m	k oː n s ɛ k r aː t j oː n ɛ m
a r aː t r ʊ m	a r aː t r ʊ m
g aː r f j ʊ m	g r a pʰ j ʊ m
iː n iː kʷ ʊ m	ɪ n iː kʷ ʊ m
t ɔ r n ʊ m	t ɔ r n ʊ m
ɪ n d uː r aː r ɛ	ɪ n d uː r aː r ɛ
l a m b r uː s k a m	l aː b r ʊ s k a m
iː n ɛ b r j a m r ɛ	ɪ n eː b r j aː r ɛ
p aː l a m	p aː l a m
m uː l t aː r ɛ	m ʊ l t aː r ɛ
k ɛ m lː ʊ m	k ɔ lː ʊ m
t ɛ rː ɛ ʊ m	t ɛ rː ɛu m
s j ɛ r a m	s ɛ rː a m
s ʊ n ɪ kː ʊ l ɔ s ʊ m	s ɔ m n ɪ k ʊ l oː s ʊ m
iː n t r ɔ d uː k t j oː n ɛ m	ɪ n t r oː d ʊ k t j oː n ɛ m
w aː t eː	w aː t ɛ m
a n t ɛ n a m	a n t ɛ nː a m
k a m p r ʊ m m	k a p r ʊ m
a n ɛ m ɔ n ɛ	a n ɛ m oː n eː n
ɛ rː oː l ʊ	w ɛ r ɪ k ʊ l ʊ m
p a l p eː b r a l	p a l p ɛ b r aː l ɛ m
w ɪ k iː n a m	w iː k iː n a m
s ʊ m iː t a t ɛ m	s ʊ mː ɪ t aː t ɛ m
n iː d iː f ɔ r m ɛ	n iː d ɪ f oː r m ɛ m
p r ɛ s a g j ʊ m	p r aɪ s aː g j ʊ m
iː n d ɪ ŋ n iː t aː t ɛ m	ɪ n d ɪ ŋ n ɪ t aː t ɛ m
m ʊ g ɛ r ɛ	m ʊ l g eː r ɛ
r ɛ g ʊ l a m	r eː g ʊ l a m
d eː t ɛ n t j oː n ɛ m	d eː t ɛ n t j oː n ɛ m
n aː w ɛ	n aː w ɛ m
s t uː d j aː r ɛ	s t ʊ d eː r ɛ
kʷ iː n kʷ ɛ n a l ɛ	kʷ iː ŋ kʷ ɛ nː aː l ɛ m
s ɛ p a m r aː r ɛ	s eː p a r aː r ɛ
r ɛ k ɛ s iː w ʊ m	r ɛ k ɛ sː iː w ʊ m
aʊ l a m	aʊ l a m
ɛ m iː k r a n j a m	h eː m ɪ k r aː n j a m
p r ɛ ɔ k uː p a t j ʊ m n ɛ m	p r aɪ ɔ kː ʊ p aː t j oː n ɛ m
m aː p a m	m a pː a m
p a l uː d ɛ	p a l uː d ɛ m
iː n s t r uː m ɛ n t a l	iː n s t r uː m ɛ n t aː l ɛ m
k ɔ n d iː t j oː n ɛ	k ɔ n d ɪ k j oː n ɛ m
k r ɛ d uː l ʊ m	k r eː d ʊ l ʊ m
r oː k ʊ m	r aʊ k ʊ m
w ɛ n d ɛ m j a m	w iː n d eː m j a m
r uː p eː	r uː p ɛ m
t a m l a m m ʊ m	tʰ a l a m ʊ m
aʊ k m ɛ n t a t j ʊ m n ɛ m	aʊ g m ɛ n t aː t j oː n ɛ m
w ɔ r a m r ɛ	w ɔ r aː r ɛ
k ɛ m	kʷ ɪ s
m ɔ d uː l aː r ɛ	m ɔ d ʊ l aː r iː
t ɛ k s t iː l	t ɛ k s t ɪ l ɛ
d ɛ w ʊ m w ɛ r	d eː w ɔ w eː r ɛ
k l ɛ r a m	g l aː r ɛ a m
ɛ k s p l a m n aː r	ɛ k s p l aː n aː r ɛ
s uː b r ʊ m g a m r ɛ	s ʊ b r ɔ g aː r ɛ
w ɔ l w ɛ r ɛ	w ɔ l w ɛ r ɛ
m ɛ d iː k aː r ɛ	m ɛ d ɪ k aː r ɛ
d eː d uː k t j oː n ɛ m	d eː d ʊ k t j oː n ɛ m
d iː s t iː lː a t j ʊ m n ɛ m	d ɪ s t ɪ lː a t j oː n ɛ m
d eː k l a m aː r ɛ	d eː k l aː m aː r ɛ
k iː r k ʊ n s k r iː w ɛ r ɛ	k ɪ r k ʊ m s k r iː b ɛ r ɛ
w ɛ r g ɪ ɛ l ɛ	w ɪ r ɪ d aː r j ʊ m
ɛ r eː m ʊ m	h ɛ r eː m ʊ m
ɔ r ɛ ʊ m	h ɔ rː ɛu m
g ʊ ŋ g ɛ r ɛ	j ʊ ŋ g ɛ r ɛ
t r ɪ f oː l ʊ	t r ɪ f ɔ l j ʊ m
p r ɛ a m b ʊ l ʊ m	p r aɪ a m b ʊ l ʊ m
k ʊ n s oː b r ɪ n ʊ m	k oː n s oː b r iː n ʊ m
uː ŋ gʷ ɛ n t ʊ m	ʊ ŋ gʷ ɛ n t ʊ m
b a p t iː s t a m	b a p t ɪ s t a m
d iː s k r iː m iː n a t j ʊ m n ɛ m	d ɪ s k r iː m ɪ n aː t j oː n ɛ m
f ʊ n d a t oː r ɛ	f ʊ n d aː t oː r ɛ m
aː k s ɛ	a k s ɛ m
t ʊ r k oː n	t ɔ r t j oː n ɛ m
m iː r t ʊ m	m y r t ʊ m
s ɔ l ɪ d ʊ m	s ɔ l ɪ d ʊ m
p ɛ k uː n j aː r j ʊ m	p ɛ k uː n j aː r j ʊ m
t r ɛ m uː l ʊ m	t r ɛ m ʊ l ʊ m
f ɪ ɔ ? ʊ	f l ʊ k t ʊ m
d eː t ɛ n ɛ r ɛ	d eː t ɪ n eː r ɛ
s ɛ r w iː t t ʊ	s ɛ r w ɪ t uː t ɛ m
p ɛ s aː r ɛ	p eː n s aː r ɛ
d eː f eː r ɪ r ɛ	d eː f ɛ rː ɛ
k ɔ l uː b r ɪ n ʊ m	k ɔ l ʊ b r iː n ʊ m
p r ɔ f ɛ r ɪ r ɛ	p r oː f ɛ rː ɛ
ʊ lː aː r ɛ	ʊ l ʊ l aː r ɛ
a r k ɛ r ʊ m	a r k w aː r j ʊ m
d iː s eː k aː r ɛ	d ɪ sː ɛ k aː r ɛ
t uː g uː r j ʊ m	t ʊ g ʊ r j ʊ m
p r ɔ f ʊ n d iː t aː t ɛ m	p r ɔ f ʊ n d ɪ t aː t ɛ m
r uː t iː l aː r	r ʊ t ɪ l aː r ɛ
s oː n a m	z oː n a m
f a m rː ɛ l ʊ m	f a r
k a p s g oː k ʊ m	k a p t j oː s ʊ m
k uː p iː d iː t aː	k ʊ p ɪ d ɪ t aː t ɛ m
p a n iː k uː l a m	p aː n ɪ k ʊ l a m
g r a t ɪ t ʊ m	g r aː t ʊ iː t ʊ m
d eː s iː d j a m	d eː s ɪ d j a m
iː m p r ʊ b aː r	ɪ m p r ɔ b aː r ɛ
s ʊ b t iː l iː t aː	s ʊ b t iː l ɪ t aː t ɛ m
r ɛ l ɛ w aː r ɛ	r ɛ l ɛ w aː r ɛ
g a m lː ɪ t a m	g a lː ɛ t a m
k ʊ n w iː k j ʊ m	k ɔ n w iː k j ʊ m
ɛ n d uː r ɛ t ɛ r	ɪ n d uː r eː s k ɛ r ɛ
k uː l t ɔ r ɛ	k ʊ l t oː r ɛ m
p ɛ lː iː k a n ʊ m	p ɛ l ɛ k aː n ʊ m
f ɛ r j a m	f eː r j aː s
t iː n a m	t iː n a m
m ɛ r k eː	m ɛ r k ɛ m
k a n ʊ m n ɛ	k a n ɔ n ɛ m
aʊ d iː t oː r ɛ	aʊ d iː t oː r ɛ m
r ɛ d iː t ʊ m	r ɛ d ɪ t ʊ m
s k ʊ rː ɛ r ɛ	ɛ k s k ʊ rː ɛ r ɛ
t r ɪ b l ʊ m	t r ɪ b ʊ l ʊ m
g r a n aː t ʊ m	g r aː n aː t ʊ m
a m k t aː r ɛ	aː k t w aː r ɛ
k a lː ɛ	k a lː ɛ m
p a m r ɛ m k r a m f ʊ m	p a r a g r a pʰ ʊ m
d ɛ r iː s oː r j ʊ m	d eː r iː s oː r j ʊ m
m a l ɪ ŋ n ʊ m	m a l ɪ ŋ n ʊ m
s a t uː r aː r ɛ	s a t ʊ r aː r ɛ
aʊ r iː g eː r ʊ m	aʊ r ɪ g ɛ r ʊ m
k ɔ lː ɛ	k ɔ lː ɛ m
g r a m m a m t iː k a l	g r a mː a t ɪ k aː l ɛ m
r ɛ n aː r ɛ	r eː ŋ n aː r ɛ
d eː m uː t aː r	d eː m uː t aː r ɛ
d a m ʊ n oː s ʊ m	d a m n oː s ʊ m
ɛ l a t j oː	eː l aː t j oː n ɛ m
s t r iː d ɛ r ɛ	s t r iː d ɛ r ɛ
iː n s ɛ r t j oː n ɛ m	iː n s ɛ r t j oː n ɛ m
m ʊ l ɪ ɛ ʊ m	m ɔ l iː n aː r j ʊ m
g ɛ r a r k a m	h ɪ ɛ r a r kʰ a m
k ʊ lː ɛ g j ʊ m	k ɔ lː eː g j ʊ m
k a m r eː k ɛ r	k a r eː r ɛ
iː m f ɔ r t uː n j ʊ m	iː n f ɔ r t uː n j ʊ m
p r ɛ p ɔ s t ɛ r ʊ m	p r aɪ p ɔ s t ɛ r ʊ m
k uː a m	k uː n a m
b a r b a r iː s m ʊ m	b a r b a r ɪ s m ʊ m
ɔ b l a m t j ʊ m n ɛ m	ɔ b l aː t j oː n ɛ m
ʊ ŋ g uː l aː t ʊ m	ʊ ŋ g ʊ l aː t ʊ m
d eː p ɛ n d ɛ r ɛ	d eː p ɛ n d eː r ɛ
p ɔ p a m	p ʊ pː ɛ m
t iː m ʊ m n ɛ m	t eː m oː n ɛ m
m w ɪ ŋ k ɛ r ɛ	w ɪ ŋ k ɛ r ɛ
g ɛ s t j ʊ n	g ɛ s t iː r ɛ
aː l a m	aː l ɛ m
r ɪ p a m	r iː p a m
s ɔ lː ɪ k iː t a t j ʊ m n ɛ m	s ɔ lː ɪ k ɪ t aː t j oː n ɛ m
g eː r ɛ r	g ɛ r ɛ r ɛ
m a l w a m	m a l w a m
ɛ k s a l a m r ɛ	ɛ k s h aː l aː r ɛ
a t k ɛ r iː r ɛ	a kː w iː r ɛ r ɛ
a m gː l ʊ m eː r aː r ɛ	a gː l ɔ m ɛ r aː r ɛ
g r a n d ɛ	g r a n d ɛ m
l a m k ʊ m l ɛ	l eː g aː l ɛ m
a k uː s a t oː r j ʊ m	a kː uː s aː t oː r j ʊ m
s uː d aː r ɛ	s uː d aː r ɛ
d ʊ b ɪ t aː r ɛ	d ʊ b ɪ t aː r ɛ
r uː g a m	r uː g a m
w a l eː t uː d iː n aː r j ʊ m	w a l eː t uː d ɪ n aː r j ʊ m
p ɛ r g uː r ʊ m	p ɛ r ɪ uː r ʊ m
k a p iː t a t j ʊ m n ɛ m	k a p ɪ t aː t j oː n ɛ m
b ɔ s k ɛ m m	b ɔ s k ʊ m
iː n g ʊ ŋ t j ʊ m n ɛ m	ɪ n j ʊ ŋ k t j oː n ɛ m
