f l a m a m	f l a mː a m
m a n k ɛ b ʊ m	m a ŋ k ɪ p ɛ m
n ɛ m ɔ r a l ɛ	n ɛ m ɔ r aː l ɛ m
k ɔ r n ɛ ʊ m	k ɔ r n ɛu m
r uː s t ɪ k aː n ʊ m	r uː s t ɪ k aː n ʊ m
d ɪ s t r a k t j oː n ɛ m	d ɪ s t r a k t j oː n ɛ m
a l t ɪ t uː d ɪ n ɛ m	a l t ɪ t uː d ɪ n ɛ m
j ʊ k ʊ n d ɪ t eː t ɛ m	j uː k ʊ n d ɪ t aː t ɛ m
r ɔ s m a r iː n ʊ m	r oː s m a r iː n ʊ m
a b ɔ l ɪ t j oː n ɛ m	a b ɔ l ɪ t j oː n ɛ m
k ʊ k ɪ n aː r j ʊ m	k ɔ kʷ iː n aː r j ʊ m
s ɔ l ɪ d ʊ m	s ɔ l ɪ d ʊ m
a m ɪ k ɪ t j a m	a m iː k ɪ t j a m
ɪ n k ɔ s t a n t ɛ m	ɪ ŋ k oː n s t a n t ɛ m
n ɪ m b ʊ m	n ɪ m b ʊ m
a k k ɛ s j oː n ɛ m	a kː ɛ sː j oː n ɛ m
w ɛ t uː s t ɛ m	w ɛ t ʊ s t aː t ɛ m
eː t ʊ m	ɛ tː ʊ m
s uː p ɪ n ʊ m	s ʊ p iː n ʊ m
ʊ d ɪ t ʊ m	aʊ d iː t ʊ m
ɪ m p ɔ r t uː n ɪ t aː t ɛ m	ɪ m p ɔ r t uː n ɪ t aː t ɛ m
m a d r ɛ m	m aː t r ɛ m
ɪ n f r ɪ ŋ g ɛ r ɛ	iː n f r ɪ ŋ g ɛ r ɛ
f ɔ r a n ɪ k s ɛ m	f ɔ r n ɪ k ɛ m
a pː a r a t ʊ m	a pː a r aː t ʊ m
a pː a r aː r ɛ	a pː a r aː r ɛ
f uː r t ɪ w ʊ m	f uː r t iː w ʊ m
f a r m aː k ʊ m	pʰ a r m a k ʊ m
j ɔ ʊ r n a l ɛ	d j ʊ r n aː l ɛ m
t r ɪ k ɛ	t r iː k ɛ m
a b s t ɛ r g ɛ r ɛ	a b s t ɛ r g eː r ɛ
b ɛ r k b ɪ k ɛ m	w ɛ r w eː k s
s k ʊ d ʊ m	s k uː t ʊ m
m a s k ʊ l iː n ʊ m	m a s k ʊ l iː n ʊ m
a b ɔ m aː s ʊ m	a b ɔ m aː s ʊ m
s ɔ lː ɪ k ɪ t aː r ɛ	s ɔ lː ɪ k ɪ t aː r ɛ
p ɛ r t ɛ n ɛ ɛ r ɛ	p ɛ r t ɪ n eː r ɛ
b ɔ s k ɛ m	b ɔ s k ʊ m
l eː k l ɛ	l eː g aː l ɛ m
m uː l t t ʊ d n ɛ m	m ʊ l t ɪ t uː d ɪ n ɛ m
s a l t a t j ɛu n ɛ m	s a l t aː t j oː n ɛ m
t ʊ r a k oː n ɛ m	t ɔ r t j oː n ɛ m
n uː t aː r ɛ	n uː t aː r ɛ
k l a pː oː n ɛ	k aː p oː n ɛ m
h ɪ s p a n ɪ k ʊ m	h ɪ s p aː n ɪ k ʊ m
l a m a m	l aː m a m
f a w oː r ɛ m	f a w oː r ɛ m
f ɛ l ɪ k ɪ t aː t ɛ m	f eː l iː k ɪ t aː t ɛ m
p ɛ r ɪ t j a m	p ɛ r iː t j a m
ɪ m p r ʊ b aː r ɛ	ɪ m p r ɔ b aː r ɛ
f ʊ r ʊ m ɪ k aː r ɛ	f ɔ r m iː k aː r ɛ
p r ɔ w ɛ n ɪ r ɛ	p r oː w ɛ n iː r ɛ
t r aː k j ʊ m	tʰ r aː k j ʊ m
b ɛ s t j ɪ ɔ l a m	b eː s t ɪ ɔ l a m
kʷ a d r uː p l r ɛ	kʷ a d r ʊ p l aː r ɛ
k ʊ p ʊ l aː r ɛ	k oː p ʊ l aː r ɛ
m a t r ɪ k ɪ d a m	m aː t r ɪ k iː d a m
m a n d aː r ɛ	m a n d aː r ɛ
t r a n s m ɔ n t a n ʊ m	t r aː n s m ɔ n t aː n ʊ m
m ɛ d ɪ k aː r ɛ	m ɛ d ɪ k aː r ɛ
n ɔ r m a m	n oː r m a m
r ɛ l ɛ g a t j oː n ɛ m	r ɛ l eː g aː t j oː n ɛ m
f ɪ g ʊ m	f iː k ʊ m
k r ɛ aː t r ɪ k ɛ	k r ɛ aː t r iː k ɛ m
n ɔ w ɪ t j ʊ m	n ɔ w iː k j ʊ m
s p ɛ k uː l a t oː r ɛ	s p ɛ k ʊ l aː t oː r ɛ m
a n ɛ l j ʊ m	a nː ɪ k ʊ l ʊ m
w a k ɪ lː a t j oː n ɛ m	w a k ɪ lː aː t j oː n ɛ m
g oː s j ʊ m	g ɛu s j aː s
w ɛ n j a m	w ɛ n j a m
s a k ɛ r d ɔ t j ʊ m	s a k ɛ r d oː t j ʊ m
k a p ɛ r ɛ	k a p ɛ r ɛ
f aʊ k ɪ m	f aʊ k eː s
m a l ɪ ŋ n ʊ m	m a l ɪ ŋ n ʊ m
k a n t aː r ɛ	k a n t aː r ɛ
d uː k ɪ r ɛ	d uː k ɛ r ɛ
b l ɪ k ɛ m ɛ	b l a s pʰ eː m aː r ɛ
k ɛ s p ɛ t ɛ m	k aɪ s p ɪ t ɛ m
ɛ k s p uː r g aː r ɛ	ɛ k s p ʊ r g aː r ɛ
w a k aː r ɛ	w a k aː r ɛ
k a rː ʊ t j a m	k a rː uː k a m
k a l k ɛ m	k a l k ɛ m
g a lː ɪ m	g a l b ɪ n ʊ m
m ʊ ɪ w eː r ɛ	m ɔ w eː r ɛ
ɔ b t ʊ s ʊ m	ɔ b t uː s ʊ m
aʊ r ɪ r ɛ	h aʊ r iː r ɛ
a k ɛ r b ʊ m	a k ɛ r b ʊ m
ɛu k ɛ n ŋ a m	iː l ɪ k ɛ m
k r ʊ s t r a m	k r ʊ s t a m
k ɔ n t r a k t ɛ r ɛ	k ɔ n t r a h ɛ r ɛ
k ɛ b aː r ɛ	k ɪ b aː r ɛ
a b ɪ t a t j oː n ɛ m	h a b ɪ t aː t j oː n ɛ m
f iː d eː l ɪ t t ɛ m	f ɪ d eː l ɪ t aː t ɛ m
aɪ w ʊ m	aɪ w ʊ m
k a t ɛ lː ʊ m	k a t ɛ lː ʊ m
g a l ɛ r ʊ m	g a l eː r ʊ m
ɪ n w ɛ n t r ɪ k ɛ	ɪ n w ɛ n t r iː k ɛ m
ɪ n g ɛ n ʊ m	ɪ ŋ g ɛ n j ʊ m
a p r ɪ k ʊ m	a p r iː k ʊ m
b ɛ n ɛ w ɔ l ʊ m	b ɛ n ɛ w ɔ l ʊ m
m a t r ɪ k ɪ d j ʊ m	m aː t r ɪ k iː d j ʊ m
s t ɪ m uː lː a k j oː n ɛ m	s t ɪ m ʊ l aː t j oː n ɛ m
t r ɛ m ɔ l aː r ɛ	t r ɛ m ʊ l aː r ɛ
s a l s a m	s a l s a m
a r k aː r ʊ m	a r k w aː r j ʊ m
k ɔ n k ɪ s ʊ m	k ɔ ŋ k ɪ d ɛ r ɛ
k a t ɪ n ʊ m	k a t iː n ʊ m
a d uː l t ɛ r aː r ɛ	a d ʊ l t ɛ r aː r ɛ
p a lː oː r ɛ	p a lː oː r ɛ m
f a k ɪ l ɪ t aː t ɛ m	f a k ɪ l ɪ t aː t ɛ m
m ɛ d ɪ r ɛ	m eː t iː r iː
r eː s p ɔ n s ʊ m	r ɛ s p oː n s ʊ m
r ɛ l ɛ g aː r ɛ	r ɛ l ɛ g ɛ r ɛ
p eː r k ʊ rː ɛ r ɛ	p ɛ r k ʊ rː ɛ r ɛ
k aː r m ɛ m	k a r m ɛ n
f ɪ n a l ɪ t eː t ɛ m	f iː n aː l ɪ t aː t ɛ m
d ɪ s t iː n k t ʊ m	d ɪ s t ɪ ŋ k t ʊ m
l aʊ r ʊ k ɛ r a s ʊ m	l aʊ r ɔ k ɛ r a s ʊ m
m ɔ r s ʊ m	m ɔ r s ʊ m
m ʊ l t ɪ p l ɪ k a t j oː n ɛ	m ʊ l t ɪ p l ɪ k aː t j oː n ɛ m
a s k ɪ l a m	a sː ʊ l a m
ɪ m p ɔ s ɪ t j oː n ɛ m	ɪ m p ɔ s ɪ t j oː n ɛ m
ɔ fː ɛ r ɛ k ɛ r ɛ	ɔ fː ɛ rː ɛ
k uː m p ɪ r ɛ	k oː n s p ʊ ɛ r ɛ
g r a t ɪ t uː m	g r aː t ɪ t uː d ɪ n ɛ m
t ɔ r t ɪ l ɛ	t ɔ r t ɪ l ɛ m
r a s k aː r ɛ	r ɛ s ɛ k aː r ɛ
f ɔ r t ɛ m	f ɔ r t ɛ m
eː kʷ ɪ l ɪ b r j ʊ m	aɪ kʷ ɪ l iː b r j ʊ m
m uː t ʊ m	m uː t ʊː m
r ɛ f l uː ɪ r ɛ	r ɛ f l ʊ ɛ r ɛ
d ɛ w ɔ r a t j oː n ɛ m	d eː w ɔ r aː t j oː n ɛ m
k ɔ n d ɪ t j oː n ɛ	k ɔ n d ɪ k j oː n ɛ m
ɪ m p ɛ d ɪ m ɛ n t ʊ m	ɪ m p ɛ d iː m ɛ n t ʊ m
a l w ɛ ʊ m	a l w ɛu m
p oː k ʊ m	p aʊ k ʊ m
ʊ d j ɛ ɛ r n ʊ m	h ɔ d ɪ ɛ r n ʊ m
d ɛ k r ɛ m ɛ n t ʊ m	d eː k r eː m ɛ n t ʊ m
r a s ɛ n aː r ɛ	r ɛ s ɪ ŋ n aː r ɛ
f r uː ɪ k t ʊ m	f r uː k t ʊ m
k ɔ lː ɪ r j ʊ m	k ɔ lː y r j ʊ m
n ɛ f aː s t ʊ m	n ɛ f aː s t ʊ m
d ɔ t aː r ɛ	d oː t aː r ɛ
k ɔ n s t a n k j ʊ m	k oː n s t a n t j a m
a fː l ɪ k t j oː n ɛ m	a fː l ɪ k t j oː n ɛ m
ɪ n k ɛ t aː r ɛ	ɪ ŋ k ɛ p t aː r ɛ
k ɪ t aː r a m	k ɪ tʰ a r a m
t a b ʊ l a m	t a b ʊ l a m
f ɛ rː oː m ʊ m	w ɛ r ɪ k ʊ l ʊ m
k a t ʊ m	k aʊ t ʊ m
a n aː t r aː m	a n a t ɛ m
l uː k a n ɪ k a m	l uː k aː n ɪ k a m
p a r t ɪ t j oː n ɛ m	p a r t iː t j oː n ɛ m
ɛ k s ɔ r t aː r ɛ	ɛ k s h ɔ r t aː r iː
m a l t	m a l tʰ a m
ɛ r uː g ɪ n ɛ m	aɪ r uː g ɪ n ɛ m
b a s ɛ m	b a s ɛ m
a s t uː t ʊ m	a s t uː t ʊ m
s aː t ɪ s f a k t j oː n ɛ m	s a t ɪ s f a k t j oː n ɛ m
k a n ɛ s t ɛ r ʊ m	k a n ɪ s t r ʊ m
d uː l k a m a r a m	d uː l k a m aː r a m
s ʊ b g ʊ k g aː r ɛ	s ʊ b j ʊ g aː r ɛ
s a n a t j ɔ n ɛ	s aː n aː t j oː n ɛ m
j ʊ n t uː r a m	j uː ŋ k t uː r a m
p l ʊ m b aː r j ʊ m	p l ʊ m b aː r j ʊ m
t ɛ n t aː r ɛ	t ɛ m p t aː r ɛ
ɪ ŋ n ɛ ʊ m	ɪ ŋ n ɛu m
a p ɪ k k ɛ m	a p ɪ k ɛ m
a g a t a m	a kʰ aː t eː n
s k r uː t a r ɛ	s k r uː t aː r ɛ
ɛ k s t ɪ r p aː r ɛ	ɛ k sː t ɪ r p aː r ɛ
l uː n aː r ɛ	l uː n aː r ɛ m
m a r t ɛ lː ʊ m	m a r t ɛ lː ʊ m
p r ɛ k l a r ʊ m	p r aɪ k l aː r ʊ m
ɛ k s k l uː d ɛ r ɛ	ɛ k s k l uː d ɛ r ɛ
a p ɛ lː ɪ d aː r ɛ	a pː ɛ lː ɪ t aː r ɛ
p ɛ r s k r uː t a r ɛ	p ɛ r s k r uː t aː r iː
ɪ n mː ɪ s uː ʊ r s ɛ	ɪ mː ɪ s k eː r ɛ
d ɛ t ɛ r m ɪ n aː r ɛ	d eː t ɛ r m ɪ n aː r ɛ
a r g ɪ lː a m	a r g ɪ lː a m
k ɔ r j ɛ n d ʊ r ʊ m	k ɔ r j a n d r ʊ m
f ɔ r n ɪ k a t oː r ɛ	f ɔ r n ɪ k aː t oː r ɛ m
d ɔ r aː r ɛ	d ɛ aʊ r aː r ɛ
p ɛ r d ɪ s	p ɛ r d iː k ɛ m
k a n ɔ n ɛ	k a n ɔ n ɛ m
n ʊ m ɛ r aː r ɛ	n ʊ m ɛ r aː r ɛ
ɪ n mː ɔ l a t j oː n ɛ m	ɪ mː ɔ l aː t j oː n ɛ m
k ɔ m p ʊ n k t j ʊ n ɛ m	k ɔ m p ʊ ŋ k t j oː n ɛ m
k ɛ d r ʊ m	k ɛ d r ʊ m
g a n t aː r ɛ	j ɛ n t aː r ɛ
s ɔ lː ɪ t uː d ɛ m	s oː l ɪ t uː d ɪ n ɛ m
d ɛ s k r ɪ p t j oː n ɛ m	d eː s k r iː p t j oː n ɛ m
n t ɪ r ɛ m ɛ t ɛ r s ɛ m	ɪ n t ɛ r m ɪ tː ɛ r ɛ
r uː g iː r ɛ	r uː g iː r ɛ
d ʊ l ʊ r oː s ʊ m	d ɔ l oː r oː s ʊ m
n ɪ m ʊ	n eː m ɪ n ɛ m
k a p s g uː k	k a p t j oː s ʊ m
ɔ b l ɪ g aː r ɛ	ɔ b l ɪ g aː r ɛ
d eː s ɪ ŋ kː a t j oː n ɛ m	d eː s ɪ kː aː t j oː n ɛ m
w ɛ n ɛ r a t j oː n ɛ m	w ɛ n ɛ r aː t j oː n ɛ m
s ʊ l k aː r ɛ	s ʊ l k aː r ɛ
r a d ɪ k ɪ n ɛ m	r aː d iː k ɛ m
f uː n ɛ r ɪ ʊ m	f uː n ɛ r ɛu m
d ɛ m ɔ r aː r ɛ	d eː m ɔ r aː r iː
k ɔ d ɪ k ɛ m	k oː d ɪ k ɛ m
p ɛ k uː l ʊ m	p ɛ k uː l j ʊ m
t ʊ r a p ɔ r ɛ	t ɔ r p oː r ɛ m
d ɪ lː ɪ g ɛ n k j ʊ m	d iː l ɪ g ɛ n t j a m
p ɛ t iː r ɛ	p ɛ t ɛ r ɛ
ɔ p uː l ɛ n t ʊ m	ɔ p ʊ l ɛ n t ʊ m
k ɔ m p ɔ r t aː r ɛ	k ɔ m p ɔ r t aː r ɛ
ɛ n k uː d ɪ ɛ	ɪ ŋ k uː d ɛ m
p a g uː r ʊ m	p a g uː r ʊ m
m ɔ n ɛ t a m	m ɔ n eː t a m
t ɪ l a m	t eː l a m
s uː b iː r ɛ	s ʊ b iː r ɛ
k aʊ d a l ɛ	k aʊ d aː l ɛ m
r ɛ w ɛ r s ɪ r ɛ	r ɛ w ɛ r t iː
f r aː s k ʊ m	f l a s k oː n ɛ m
k ɔ n ʊ m	k oː n ʊ m
k ɔ n t ɪ n w ʊ m	k ɔ n t ɪ n ʊː m
f ɛ r j a m	f eː r j aː s
g a n ɪ r ɛ	g a nː iː r ɛ
eː l ɪ m ɪ n a t j oː n ɛ m	eː l ɪ m ɪ n aː t j oː n ɛ m
n ʊ n ʊ m	n ɔ nː ʊ m
p a t r j a r k aː t ʊ m	p a t r j a r kʰ a t ʊ m
r ɔ t aː r ɛ	r ɔ t aː r ɛ
r ɛ k ɪ t a t j oː n ɛ m	r ɛ k ɪ t aː t j oː n ɛ m
r ɛ l a t ɪ w ʊ m	r ɛ l aː t iː w ʊ m
t a r ʊ m	t aʊ r ʊ m
a n ɪ k ɪ l a t j oː n ɛ m	a nː ɪ h ɪ l aː t j oː n ɛ m
r ɛ k ɛ sː ʊ m	r ɛ k ɛ sː ʊ m
m a n ɪ j aː r ʊ m	m a n w aː r j ʊ m
h ɛ k s iː r ʊ m	ɛ k s iː r ɛ
f ɛ n aɪ s t r a m	f ɛ n ɛ s t r a m
d ɛ p r ɛ d a t j oː n ɛ m	d eː p r aɪ d aː t j oː n ɛ m
m ɔ r t aː r j ʊ m	m ɔ r t aː r j ʊ m
p ʊ lː aː r ʊ m	p ʊ lː aː r j ʊ m
p uː l p ɪ t ʊ m	p ʊ l p ɪ t ʊ m
a s t r ʊ m	a s t r ʊ m
s t ʊ r n ɛ n ʊ m	s t ʊ r n ʊ m
a kː uː s a t oː r ɛ	a kː uː s aː t oː r ɛ m
p ɛ r p ɛ t w aː t j ɔ n ɛ m	p ɛ r p ɛ t w aː t oː n ɛ m
ɔ fː ɪ k j ʊ m	ɔ fː ɪ k j ʊ m
s ɪ l ɪ k ɛ m	s ɪ l ɪ k ɛ m
m ɛ n d ɪ k ʊ m	m ɛ n d iː k ʊ m
d ɛ n ʊ n k t j aː s j ɛ m m	d eː n ʊ n t j aː t j oː n ɛ m
ɪ n w ɔ l w ɛ r ɛ m	ɪ n w ɔ l w ɛ r ɛ
g a lː ɪ t ɛ m	g a lː ɛ t a m
l uː n aː k oː n ɛ m	l uː n aː t j oː n ɛ m
b a r b aː t ʊ m	b a r b aː t ʊ m
p r j ɔ r ɛ	p r j oː r ɛ m
eː l uː d ɛ r ɛ	eː l uː d ɛ r ɛ
k a l w ɪ r ɛ	k a l w iː
d uː r a t j oː n ɛ m	d uː r aː t j oː n ɛ m
m ɪ n oː r ɛ	m ɪ n oː r ɛ m
k ɔ t ʊ r n ɪ k ɛ m	k oː t ʊ r n iː k ɛ m
p ɛ r s w a d ɛ r ɛ	p ɛ r s w aː d eː r ɛ
b a j ʊ m	b a d j ʊ m
p ʊ t r ɪ r ɛ	p ʊ t r ɛ r ɛ
n j ɛ b l m a m	n ɛ b ʊ l a m
k ɔ m p aː t r ɛ m	k ɔ m p a t r ɛ m
s t r ʊ ɛ n t ʊ	t ɔ n ɪ t r ʊ m
k ɔ n s ɔ l ɪ d aː r ɛ	k oː n s ɔ l ɪ d aː r ɛ
s ʊ lː aː k ʊ m	s oː l aː k j ʊ m
k ɔ m p l ɪ k a t j oː n ɛ	k ɔ m p l ɪ k aː t j oː n ɛ m
ɪ n s ɛ r ɪ r ɛ	iː n s ɛ r ɛ r ɛ
d ɪ fː ɛ r ɪ r ɛ	d ɪ fː ɛ rː ɛ
eː k s aʊ r ɪ r ɛ	ɛ k s h aʊ r iː r ɛ
w j ɛ n t r ɛ m	w ɛ n t r ɛ m
j uː d j ɛ eː ʊ m	j uː d aɪ ʊ m
s ɛ r j ʊ s ʊ m	s eː r j oː s ʊ m
d ɛ s ɪ d j a m	d eː s ɪ d j a m
d ɛ s ɛ r t j oː n ɛ m	d eː s ɛ r t j oː n ɛ m
k a l a m ɪ t ɔ s ʊ m	k a l a m ɪ t oː s ʊ m
s k r uː t aː r ɛ	s k r uː t aː r iː
k r ɪ m ɪ n a k j oː n ɛ m	k r iː m ɪ n aː t j oː n ɛ m
ɪ t uː d ɪ n ɛ m	t uː d ɪ n ɛ m
s t r ɛ n w ʊ m	s t r eː n ʊː m
m a n s j oː n ɛ m	m aː n s j oː n ɛ m
t ɪ m oː n ɛ m	t eː m oː n ɛ m
s ʊ m ʊ m	s ʊ mː ʊ m
w ɪ n ɛ t ʊ m	w iː n eː t ʊ m
k ʊ t ɛ lː ʊ m	k ʊ l t ɛ lː ʊ m
s a l ɪ w a r ɛ	s a l iː w aː r ɛ
aʊ r ɪ g ɛ r ʊ m	aʊ r ɪ g ɛ r ʊ m
f ɛ rː uː g ɪ n	f ɛ rː uː g ɪ n ɛ m
m ʊ r a lː ɪ d aː d ɛ m	m oː r aː l ɪ t aː t ɛ m
a n a l ɪ s ɪ m	a n a l y s ɛ m
s ʊ b r ɪ ŋ ʊ m	s oː b r iː n ʊ m
ɪ n s ɛ r t j oː n ɛ m	iː n s ɛ r t j oː n ɛ m
k ɔ n d ɛ n s a t j oː n ɛ m	k ɔ n d eː n s aː t j oː n ɛ m
n uː b ɛ m	n uː b ɛ m
k a r a n ɛ r ʊ m	k a r n aː r j ʊ m
m ɔ r b ʊ m	m ɔ r b ʊ m
r d r ɪ k n ɛ m	r ɪ d ɪ k a m
g ɛ r a r k a m	h ɪ ɛ r a r kʰ a m
ɔ r ɪ zː ɔ n t ɛ m	h ɔ r ɪ zː ɔ n t a
f ɔ r ʊ m	f ɔ r ʊ m
w ɪ b r aː r ɛ	w ɪ b r aː r ɛ
a r b ɔ r ɛ t ʊ m	a r b ɔ r eː t ʊ m
n ɪ d ʊ m	n iː d ʊ m
p ɛ r kʰ a m	p ɛ r k a m
a k ɪ n ʊ m	a k ɪ n ʊ m
d ɛ k r ɛ t a l ɛ	d eː k r eː t aː l ɛ m
p r ɛ p oː s ɪ t ɛ m	p r aɪ p ɔ s ɪ t ʊ m
p ɛ r p ɛ t ʊ ɪ t aː t ɛ m	p ɛ r p ɛ t ʊ ɪ t aː t ɛ m
eː r aː r j ʊ m	aɪ r aː r j ʊ m
ɔ r ɪ g ɪ n aː r j ʊ m	ɔ r iː g ɪ n aː r j ʊ m
r ʊ n k aː r ɛ	r h ɔ ŋ kʰ aː r ɛ
l ʊ p a m	l ʊ p a m
ɪ n k a n t aː r ɛ	ɪ ŋ k a n t aː r ɛ
p a r s ɪ m ɔ n j a m	p a r s ɪ m oː n j a m
n ɔ k ɛ t ʊ m	n ʊ k eː t ʊ m
a m a t oː r ɛ	a m aː t oː r ɛ m
w ɪ r g iː n ɛ m	w ɪ r g ɪ n ɛ m
k ʊ k ʊ m	k ɔ kʷ ʊ m
s ʊ kː ʊ rː ɛ r ɛ	s ʊ kː ʊ rː ɛ r ɛ
s a lː a k ɪ t aː t ɛ m	s a l aː k ɪ t aː t ɛ m
ɪ m w ɛ t ɛ r aː r ɛ	ɪ n w ɛ t ɛ r aː r ɛ
p ɛ s t a r ɛ	p ɪ s t aː r ɛ
ɛ k s t a s ɪ m	ɛ k s t a s ɛ m
eː g r ɛ g ɛ ʊ m	eː g r ɛ g j ʊ m
ɪ n t ɪ ɪ r ɛ	ɪ n t ʊ eː r iː
b ʊ m b aː r d a m	b ɔ m b a r d a m
k ʊ n t ɔ r k ɛ r ɛ	k ɔ n t ɔ r kʷ eː r ɛ
r ɛ f l ɛ t ɛ r ɛ	r ɛ f l ɛ k t ɛ r ɛ
ɪ rː ʊ g a r ɛ	ɪ rː ɔ g aː r ɛ
ɪ n mː ɛ r g ɛ r ɛ	ɪ mː ɛ r g ɛ r ɛ
m ɪ n ɔ r aː r ɛ	m ɪ n oː r aː r ɛ
s a l aː r j ʊ m	s a l aː r j ʊ m
k ɪ t ɛ r j oː r ɛ	k ɪ t ɛ r j oː r ɛ m
p r ɛ t ɛ m	p r ɛ s b y t ɛ r ʊ m
j ʊ w ɛ n t ʊ t ɛ m	j ʊ w ɛ n t uː t ɛ m
k ɔ m uː n ɛ	k ɔ mː uː n ɛ m
ɪ s t r uː k s w ɛ m	iː n s t r ʊ k t j oː n ɛ m
k a l ɪ fː ʊ m	k a l iː pʰ a m
k a n t j oː n ɛ m	k a n t j oː n ɛ m
d ɛ p ɛ r ɪ k r ɛ	d eː p ɛ r iː r ɛ
ʊ ɔ p ʊ m	ɔ p ʊ s
a s ɪ s ʊ m	a sː ɛ sː ʊ m
n a s uː t ʊ m	n aː s uː t ʊ m
r ɛ l ɛ g aː r ɛ	r ɛ l ɪ g aː r ɛ
l ɪ b ɪ d ʊ m	l ɪ b iː d ɪ n ɛ m
s ɔ eː n ɔ l j ɛ n t ʊ m	s ɔ m n ɔ l ɛ n t ʊ m
k a r p ɛ n t ʊ m	k a r p ɛ n t ʊ m
aʊ d aː k j a m	aʊ d aː k j a m
s ɔ r ɔ r ɪ t aː t ɛ m	s ɔ r oː r ɪ t aː t ɛ m
n a rː a k j oː n ɛ m	n aː rː aː t ʊ m
s t a p ɛ d ɛ m	s t a p ɛ d ɛ m
f r ɛ m ɪ r ɛ	f r ɛ m ɛ r ɛ
p ɔ s aː r ɛ	p aʊ s aː r ɛ
m a l aː f a r ɛ	m a l ɛ f a k ɛ r ɛ
ɪ n d ɪ ŋ n aː r ɛ	ɪ n d ɪ ŋ n aː r iː
p ɛ r ɪ k ʊ l oː s ʊ m	p ɛ r iː k ʊ l oː s ʊ m
b j ɛ t ɛ g aː b a m	b eː t a m
ɪ t ɪ n ɛ r aː r j ʊ m	ɪ t ɪ n ɛ r aː r j ʊ m
n ɛ g ɔ t j ʊ m	n ɛ g oː t j ʊ m
l k ɪ r oː m	g l iː r ɛ m
w ɛ r b a l ɛ	w ɛ r b aː l ɛ m
ɔ r j ɪ ɛ n t ɛ m	ɔ r ɪ ɛ n t ɛ m
p eː d ɪ k ɛ lː ʊ m	p ɛ d iː k ɛ lː ʊ m
a w ɛ lː ɪ n a m	a b ɛ lː a n a m
ɪ n d ɛ f ɪ n ɪ t ʊ m	ɪ n d eː f iː n iː t ʊ m
s ʊ p r pː ɔ n ɛ r ɛ	s ʊ p ɛ r p oː n ɛ r ɛ
k ɔ lː ɛ k t j oː n ɛ m	k ɔ lː eː k t j oː n ɛ m
l ɛ g j ɪ	l ɪ g aː m ɛ n
k ʊ k ɪ n a m	k ɔ kʷ iː n a m
a d w ɛ r b j a l ɛ	a d w ɛ r b j aː l ɛ m
ɪ m p ɛ r ɪ d j a m	ɪ m p ɛ r iː t j a m
w ɛ ɛ r ɛ m	w ɛ lː ɛ r ɛ
r ɛ n ɔ w a t j oː n ɛ	r ɛ n ɔ w aː t j oː n ɛ m
m a l w a m	m a l w a m
d ɛ m ɔ n s t r a t j oː n ɛ m	d eː m oː n s t r aː t j oː n ɛ m
p ɛ lː ɪ k a n ʊ m	p ɛ l ɛ k aː n ʊ m
b l a n d ʊ m	b l a n d ʊ m
d ɛ s ɛ ŋ n aː r ɛ	d eː s ɪ ŋ n aː r ɛ
a k t r ɪ k ɛ	aː k t r iː k ɛ m
s t r ɪ g ɪ l ɛ	s t r ɪ g ɪ l ɛ m
a n ɔ m a l ʊ m	a n oː m a l ɔ n
k oː ŋ n a t ʊ m	k ɔ ŋ n aː t ʊ m
k a m ɪ b r oː n ɛ m	k r aː b r oː n ɛ m
b ʊ m b ʊ m	b ɔ m b ʊ m
p ɔ s t uː l aː r ɛ	p ɔ s t ʊ l aː r ɛ
p r ɔ ɛ w a m	p r ɔ b a m
a w j ɛ s ʊ m	aː w ɛ r s ʊ m
a n ɔ n a m	a nː oː n a m
k ɔ r t ɛ m	k ɔ h ɔ r t ɛ m
s t ɪ w a r ɛ	s t iː p aː r ɛ
w ɛ n d ɪ t oː r ɛ	w eː n d ɪ t oː r ɛ m
k oː lː ʊ m	k ɔ lː ʊ m
s ɛ k s w ʊ a l ɪ t aː t ɛ m	s ɛ k s w aː l ɪ t aː t ɛ m
s ɔ l ɪ l ɔ kʷ ʊ m	s oː l ɪ l ɔ kʷ j ʊ m
k ʊ w r ɛ	k ʊ b aː r ɛ
r ɛ f r ɛ aː n aː m	r ɛ f r eː n aː r ɛ
f uː s t a m	f ʊ s t a m
m aː d ʊ m	m aː n s ʊ eː t ʊ m
p ɔ s t ɛ r ʊ m	p ɔ s t ɛ r ʊ m
p ɔ m ʊ m	p oː m ʊ m
t r a b aː l j ʊ m	t r ɪ p aː l ɛ m
d ɛ n uː d aː r ɛ	d eː n uː d aː r ɛ
d ɛ s k r ɪ w ɛ r ɛ	d eː s k r iː b ɛ r ɛ
s a k ɛ r d ɔ t ɛ m	s a k ɛ r d oː t ɛ m
l ʊ ŋ g ɛ w ʊ m	l ɔ ŋ g aɪ w ʊ m
a b s ɔ r p k j oː n ɛ m	a b s ɔ r p t j oː n ɛ m
ɔ r ɪ r ɛ	h ɔ rː eː r ɛ
ɪ n f ɛ k t j oː n ɛ m	ɪ n f ɛ k t j oː n ɛ m
w aː r j ʊ m	w a r j ʊ m
a r k ɛ t ɪ p ʊ m	a r kʰ ɛ t y p ʊ m
ɪ m p ɛ t ɪ g ɪ k ɛ m	ɪ m p ɛ t iː g ɪ n ɛ m
s iː m j a m	s iː m j a m
a pː ɔ n ɛ m	a pː oː n ɛ r ɛ
s uː k g ɛ r ɛ r ɛ	s ʊ gː ɛ r ɛ r ɛ
k ɛ n ʊ m	k ɪ nː ʊ m
s ɔ l ʊ m	s ɔ l ʊ m
