k ɔ l ɔ n j aː	k ɔ l oː n j a m
m ɛ n aː k ʊ m	m ɪ n aː k ɛ m
d eː s w j aː r ɛ	d eː w j aː r ɛ
p a k iː f iː k ʊ m	p aː k ɪ f ɪ k ʊ m
p j ɛ lː aː r ʊ m	p ɛ lː aː r j ʊ m
k ɔ kʷ ʊ m	k ɔ kː ʊ m
k ɔ l ʊ m b a m	k ɔ l ʊ m b a m
w ɛ n t iː l a t j oː n ɛ	w ɛ n t ɪ l aː t j oː n ɛ m
s ɔ n a m	z oː n a m
s ɔ lː ɪ k iː t uː d ɪ n ɛ m	s ɔ lː ɪ k ɪ t uː d ɪ n ɛ m
m uː l t a m	m ʊ l t a m
t ɔ r ʊ m	t ɔ r ʊ m
ɪ n g l ɛ s ʊ m	a ŋ g l eː n s ɛ m
d iː s t ɛ n d ɛ r ɛ	d ɪ s t ɛ n d ɛ r ɛ
l ɔ t a m	l uː t ɛu m
s ʊ b t r a k t j oː n ɛ m	s ʊ b t r a k t j oː n ɛ m
w ʊ l g ʊ m	w ʊ l g ʊ s
aː k ʊ m	ɛ kː ʊ m
s t a p ɛ d ɛ m	s t a p ɛ d ɛ m
a l t j ɔ n	a l k y ɔ n ɛ m
ɪ n f ɛ s t aː r ɛ	iː n f ɛ s t aː r ɛ
k iː k aː rː a m	k ɪ k aː d a m
m iː n uː l aː s	m ɪ n uː t j a m
ɔ b l iː g a t j oː n ɛ	ɔ b l ɪ g aː t j oː n ɛ m
d ʊ n ɛ m	d oː n ʊ m
n ɛ r w j oː s ʊ m	n ɛ r w oː s ʊ m
ɪ n k r eː m ɛ n t	ɪ ŋ k r eː m ɛ n t ʊ m
p ʊ t aː r ɪ m	p ʊ t aː r ɛ
ɪ d ɛ n t iː k ʊ m	iː d ɛ n t ɪ k ʊ m
h ʊ ŋ g ɛ r ɛ	ʊ ŋ g ɛ r ɛ
p ɔ r k a d ʊ m	p ɔ r k a m
k iː d a m	k iː d a m
ɔ l w ɛ r ɛ	w ɔ l w ɛ r ɛ
a d aː m a n t ɛ m	a d a m a n t ɛ m
g r aː t ɛ m	k r aː t ɛ m
g l aː k ɛ m	g l a k ɪ ɛ m
s p uː t ʊ m	s p uː t ʊ m
j uː s t ʊ m	j uː s t ʊ m
ɛ p iː s t ɔ l a m	ɛ p ɪ s t ɔ l a m
k ɛ ŋ t a r ɛ	kʷ ɪ eː t aː r ɛ
p r ɛ m iː k j a m	p r iː m ɪ t j a m
k ɛ l iː b ɛ m	k aɪ l ɪ b ɛ m
d eː n ʊ n k aː t j a s j ʊ m m	d eː n ʊ n t j aː t j oː n ɛ m
l d aː r ɪ r ʊ m	g l iː r ɛ m
a r m aː t ʊ m	a r m aː t ʊ m
n ɛ kʷ iː t j a m	n eː kʷ ɪ t j a m
m ɛ t a m	m eː t a m
r ɛ s ɔ n aː r ɛ	r ɛ s ɔ n aː r ɛ
s ɛ n aː r ɛ	s ɪ ŋ n aː r ɛ
f ʊ a m	f iː d uː k j a m
d eː k r eː m ɛ n t ʊ m	d eː k r eː m ɛ n t ʊ m
t a n t ʊ m	t a n t ʊ m
k s p a n d ɛ r ɛ	ɛ k s p a n d ɛ r ɛ
k ɔ m p ʊ ŋ g ɛ r ɛ	k ɔ m p ʊ ŋ g ɛ r ɛ
k aː s ʊ m	k aː s ʊ m
a s t r ʊ m	a s t r ʊ m
j uː r a m ɛ n t ʊ m	j uː r aː m ɛ n t ʊ m
s iː t j ʊ m	s ɪ t ʊ m
f a b ʊ l oː s ʊ m	f aː b ʊ l oː s ʊ m
k ʊ p ɛ r t uː r a m	k ɔː p ɛ r t uː r a m
kʷ iː n t ʊ m	kʷ iː n t ʊ m
aʊ t ɔ n aː l ɛ	aʊ t ʊ m n aː l ɛ m
d iː l a k eː r aː r ɛ	d iː l a k ɛ r aː r ɛ
m uː s iː t aː r ɛ	m ʊ sː ɪ t aː r ɛ
r ɛ n ɔ w a t j oː n ɛ	r ɛ n ɔ w aː t j oː n ɛ m
s ɪ n ʊ m	s ʊ iː n ʊ m
t ɔ p s ɪ k aː r ɛ	t ɔ k s ɪ k aː r ɛ
ɛ r b aː k ɛ ʊ m	h ɛ r b aː k ɛu m
t a l ʊ t ɛ m	t aː l ʊ m
k r ɛ m a m	k r aː m ʊ m
r iː k s a m	r ɪ k s a m
s uː m s eː kʷ iː r ɛ	s ʊ b s ɛ kʷ iː
m a g ɛ s t aː t ɛ m	m a j ɛ s t aː t ɛ m
s k uː rː iː l ɛ	s k ʊ rː iː l ɛ m
s ʊ l ɪ d aː r ɛ	s ɔ l ɪ d aː r ɛ
s ɛ r ɔ t iː n ʊ m	s eː r oː t ɪ n ʊ m
b ʊ m b ʊ m	b ɔ m b ʊ m
ɔ l eː ʊ s ʊ m	ɔ l ɛ oː s ʊ m
m ʊ k ɔ r ɛ m	m uː k oː r ɛ m
ɪ n mː uː t aː r ɛ	ɪ mː uː t aː r ɛ
s k ɔ p a m	s k oː p a m
l a s ɪ r ɛ	l ɪ k eː r ɛ
r ɔ s t r ʊ m	r oː s t r ʊ m
m iː l iː t aː r ɛ	m iː l ɪ t aː r ɛ
l a k g	l a k s ʊ m
r ɛ l iː kʷ j a m	r eː l ɪ kʷ j aː s
f ɛ r m ɛ n t ɛ m	f ɛ r m ɛ n t ʊ m
oː	ʊ m
k ɔ ŋ j uː g aː r ɛ	k ɔ n j ʊ g aː r ɛ
s p eː r aː r ɛ	s p eː r aː r ɛ
p a g a n eː t aː t a m	p aː g aː n ɪ t aː t ɛ m
kʷ ɛ s t j ɪ ɔ n aː r j ʊ m	kʷ aɪ s t j oː n aː r j ʊ m
w iː t uː p eː r a t j ʊ n ɛ	w ɪ t ʊ p ɛ r aː t j oː n ɛ m
p ɪ g r ʊ ŋ ɪ t j a m	p ɪ g r ɪ t j a m
r j ɛ aː iː r ɛ	r ɛ a g eː r ɛ
ʊ s w aː l ɛ	uː s w aː l ɛ m
k ɔ n s uː d m aː r ɛ	k oː n s ʊ mː aː r ɛ
s ʊ mː iː t aː t ɛ m	s ʊ mː ɪ t aː t ɛ m
k eː l eː b r aː r ɛ	k ɛ l ɛ b r aː r ɛ
w a s ɛ lː ʊ m	w aː s k ɛ lː ʊ m
b ɛ lː ʊ m	b ɛ lː ʊ m
p a g uː r ʊ m	p a g uː r ʊ m
p a l uː d a m ɛ n t ʊ m	p a l uː d aː m ɛ n t ʊ m
m ɛ l oː n ɛ m	m eː l oː n ɛ m
k a l a m ɛu m	k a l a m ʊ m
m a t r iː t iː d j ʊ m	m aː t r ɪ k iː d j ʊ m
m ʊ ɔ w eː r ɛ	eː m ɔ w eː r ɛ
s a l w aː r ɛ	s a l w aː r ɛ
f ɛ m ɪ l a m	f eː m ɛ lː a m
p a s aː r ɛ	p a n d ɛ r ɛ
f r eː n a r ɛ	f r eː n aː r ɛ
s uː b s iː d j ʊ m	s ʊ b s ɪ d j ʊ m
t uː m eː f aː ɛ r ɛ	t ʊ m ɛ f a k ɛ r ɛ
a b aː k uː l ʊ m	a b a k ʊ l ʊ m
t ɔ r t iː l ɛ	t ɔ r t ɪ l ɛ m
f l ɔ r iː l ɛ g ʊ m	f l oː r ɪ l ɛ g j ʊ m
k ɔ n w ɔ k aː r ɛ	k ɔ n w ɔ k aː r ɛ
a r g ɪ n t oː s ʊ m	a r g ɛ n t oː s ʊ m
f iː d ɛ l ɪ t aː t ɛ m	f ɪ d eː l ɪ t aː t ɛ m
ɪ ŋ n ɔ b ɪ l ɛ m	ɪ ŋ n oː b ɪ l ɛ m
k ɛ n s oː r ɛ	k eː n s oː r ɛ m
k r ɪ s t aː r ɛ	k r ʊ s t aː r ɛ
k r aː t ɪ k ʊ l a m	k r aː t ɪ k ʊ l a m
r uː g a m	r uː g a m
m uː n iː k iː p j ʊ m	m uː n ɪ k ɪ p j ʊ m
t ɛ t r iː k ʊ m	t aɪ t r ɪ k ʊ m
s k ʊ rː ɛ r ɛ	ɛ k s k ʊ rː ɛ r ɛ
h ɛ s p ɛ t ɛ m	h ɔ s p ɪ t ɛ m
m a ŋ g aː r ɛ	m a n d uː k aː r ɛ
f ɔ r t ʊ iː t ʊ m	f ɔ r t ʊ iː t ʊ m
ɔ n ɔ r iː f iː k ʊ m	h ɔ n oː r ɪ f ɪ k ʊ m
ʊ n iː f ɔ r m ɛ m	uː n ɪ f oː r m ɛ m
a k uː s a b ɪ l ɛ	a kː uː s aː b ɪ l ɛ m
ɛ k s k ɔ g iː t aː r ɛ	ɛ k s k oː g ɪ t aː r ɛ
m ʊ s t ʊ m	m ʊ s t ʊ m
f uː r j oː s ʊ m	f ʊ r j oː s ʊ m
w a g a b ʊ n d ʊ m	w a g aː b ʊ n d ʊ m
l ʊ t ʊ m	l ʊ t ʊ m
uː m b r aː t ɪ k ʊ m	ʊ m b r aː t ɪ k ʊ m
s eː s kʷ iː p eː d a l ɛ	s eː s kʷ ɪ p ɛ d aː l ɛ m
a d k ʊ n t ʊ m	a d j ʊ ŋ k t ʊ m
ɔ b l a t j oː n ɛ m	ɔ b l aː t j oː n ɛ m
a t r iː b uː t j ʊ n ɛ	a tː r ɪ b uː t j oː n ɛ m
l ʊ t r d ʊ m	l uː r ɪ d ʊ m
a b s uː r d ɪ t aː t ɛ m	a b s ʊ r d ɪ t aː t ɛ m
p r ɔ ɛ w a m	p r ɔ b a m
ɔ k ʊ rː ɛ r ɛ	ɔ kː ʊ rː ɛ r ɛ
p r ɔ w ɔ k a t oː r ɛ	p r oː w ɔ k aː t oː r ɛ m
eː kʷ iː w ʊ k a r ɛ	aɪ kʷ ɪ w ɔ k aː r ɛ
m iː r t iː lː ʊ m	m y r t ɪ lː ʊ m
ʊ l t eː r j ʊ r ɛ	ʊ l t ɛ r j oː r ɛ m
ɪ lː uː s j ɛu n ɛ	ɪ lː uː s j oː n ɛ m
f a b r ʊ m	f a b r ʊ m
ɛ t ʊ m	eː t ʊ m
t r aː w ɛ	t r a b ɛ m
p ɔ r n ɔ g r a f j aː	p ɔ r n ɔ g r a pʰ j a m
k a n t ɪ k ʊ m	k a n t ɪ k ʊ m
ɪ n t ɛ r w ɛ n t j oː n ɛ m	ɪ n t ɛ r w ɛ n t j oː n ɛ m
p j ɛ l a g ʊ m	p ɛ l a g ʊ s
d uː r ʊ m	d uː r ʊ m
m j ɛ s ɛ m	m ɛ sː ɛ m
a p eː lː iː d aː r ɛ	a pː ɛ lː ɪ t aː r ɛ
ɪ m p eː r a t oː r j ʊ m	ɪ m p ɛ r aː t oː r j ʊ m
ɪ m f ɔ r t uː n j ʊ m	iː n f ɔ r t uː n j ʊ m
r ɛ w ɔ k aː r ɛ	r ɛ w ɔ k aː r ɛ
ɪ m b eː k iː lː iː t aː t ɛ m	ɪ m b eː k ɪ lː ɪ t aː t ɛ m
m ɔ s t r ʊ ʊ s ʊ m	m oː n s t r ʊ oː s ʊ m
m ʊ r ɪ r ɛ	m ɔ r iː
s ʊ l aː r ɪ j ʊ r ɛ	s oː l aː r j ʊ m
f r a t ɛ r n aː l ɛ m	f r aː t ɛ r n aː l ɛ m
r ɛ k uː s a t j oː n ɛ m	r ɛ k uː s aː t j oː n ɛ m
p r oː w ɛ d eː r ɛ	p r oː w ɪ d eː r ɛ
p aː ɪ s ɛ	p aː g eː n s ɛ m
k ɔ t j oː n ɪ n iː l a m	k ɔ kː ɪ n a m
s aː ŋ kʷ ɪ r aː r ɛ	s a ŋ gʷ ɪ n aː r ɛ
p a n w ɛ r ʊ m	p aː n aː r j ʊ m
ɪ n iː kʷ ʊ m	ɪ n iː kʷ ʊ m
w ɛ k s aː r ɛ	w eː k s aː r ɛ
s ɔ lː ɪ k iː t a t j oː n ɛ m	s ɔ lː ɪ k ɪ t aː t j oː n ɛ m
s ɪ p t ɪ m a n a m	s ɛ p t ɪ m aː n a m
s a b l ʊ m	s a b ʊ l ʊ m
m uː r ɛ	m uː r ɛ m
m ɛ ŋ k t aː r aː m	m ɛ n t ʊ l a m
b ɛ s t j aː r j ʊ m	b eː s t j aː r j ʊ m
f ɪ r m ɛ m	f ɪ r m ʊ m
s k uː d ʊ m	s k uː t ʊ m
s ɛ r w iː l ɛ	s ɛ r w iː l ɛ m
l uː k ɛ r n a m	l ʊ k ɛ r n a m
kʷ a l iː f ɪ k aː r ɛ	kʷ aː l ɪ f ɪ k aː r ɛ
p a s t ɪ n aː k a m	p a s t ɪ n aː k a m
n iː d ʊ m	n iː d ʊ m
ɛ n s ɛ m	eː n s ɛ m
s t j ɛ r k ʊ kʷ ɛ	s t ɛ r k ʊ s
k ʊ n t ɛ n d ɛ r ɛ	k ɔ n t ɛ n d ɛ r ɛ
w a g aː r ɛ	w a g aː r iː
p iː s aː r ɛ	p iː n s ɛ r ɛ
k a w aː r ɛ	k a w aː r ɛ
ɪ n k a r n aː r ɛ	ɪ ŋ k a r n aː r ɛ
n iː m ɪ kʷ ɛ	n eː m ɪ n ɛ m
d ɛ k s t eː r iː t aː t ɛ m	d ɛ k s t ɛ r ɪ t aː t ɛ m
w ʊ l t ʊ m	w ʊ l t ʊ m
p r ɔ t ɛ s t aː r ɛ	p r oː t ɛ s t aː r iː
ʊ s j ɛ r ɛ m	ɔ s t j aː r j ʊ m
r uː b ɪ g iː n oː s ʊ m	r oː b iː g ɪ n oː s ʊ m
s uː pː l iː k a t j ʊ r ɛ	s ʊ pː l ɪ k aː t j oː n ɛ m
d j a b oː l iː k ʊ m	d j a b ɔ l ɪ k ʊ m
s uː pː ɔ r ɛ m	s ʊ pː oː n ɛ r ɛ
f a s t ɪ d j ʊ m	f a s t iː d j ʊ m
ɔ l f a t ɔ r j ʊ m	ɔ l f a k t oː r j ʊ m
d aː t ʊ m	d a t ʊ m
k ɔ n f eː r ɛ r ɛ	k oː n f ɛ rː ɛ
f iː m ʊ m	f ɪ m ʊ m
a w j ɛ s ʊ m	aː w ɛ r s ʊ m
s oː n ʊ	s ɔ m n ʊ m
h aː b a l aː r ɛ	f aː b ʊ l aː r iː
d iː s k ʊ rː ɛ r ɛ	d ɪ s k ʊ rː ɛ r ɛ
d eː l a t oː r ɛ	d eː l aː t oː r ɛ m
l ɛ mː a m	l ɛ mː a
k ɔ m p eː t iː t j oː n ɛ	k ɔ m p ɛ t iː t j oː n ɛ m
a l iː t ʊ m	h aː l ɪ t ʊ m
k ɔ r j aː k ɛ ʊ m	k ɔ r j a k ɛu m
kʷ a d r iː l a t ɛ r ʊ m	kʷ a d r ɪ l a t ɛ r ʊ m
s p ɛ sː ʊ m	s p ɪ sː ʊ m
f ɔ r n iː k aː r ɛ	f ɔ r n ɪ k aː r iː
j iː r aː r ɛ	g y r aː r ɛ
l aʊ d ɛ m	l aʊ d ɛ m
s eː kʷ aː k ɛ	s ɛ kʷ aː k ɛ m
ɪ n k j ɛ n s ʊ m	ɪ ŋ k eː n s ʊ m
s a ŋ gʷ iː n ɔ l ɛ n t ʊ m	s a ŋ gʷ ɪ n ɔ l ɛ n t ʊ m
a d uː r a s w ɛ m	a d ɪ uː r aː t j oː n ɛ m
t r iː s eː n aː r j ʊ m	t r iː k eː n aː r j ʊ m
w iː w iː d ʊ m	w iː w ɪ d ʊ m
b l eː s t aː m ɛ	b l a s pʰ eː m aː r ɛ
p r aː w ʊ m	p r aː w ʊ m
a gː r ɛ d ɛ r ɛ	a gː r ɛ d iː
k oː k ʊ m	s ɔ kː ʊ m
w iː k ʊ m	w iː k ʊ m
d eː f ɔ r m a t j oː n ɛ	d eː f oː r m aː t j oː n ɛ m
f a j aː l ɛ	f a k j aː l ɛ m
k l aː w ʊ m	k l aː w ʊ m
ɔ r j ɪ ɛ n t ɛ m	ɔ r ɪ ɛ n t ɛ m
w ɛ r iː f iː k a t j oː n ɛ	w ɛ r ɪ f ɪ k aː t j oː n ɛ m
k ʊ rː ɛ a m	k ɔ rː ɪ g j a m
s eː m eː m	s eː m ɛ n
t ɔ l ɛ r ɛ	t ɔ lː ɛ r ɛ
p r eː m ʊ n iː t ʊ r ɛ m	p r aɪ m ɔ n ɪ t oː r ɛ m
ɪ n mː iː s k ɪ r s ɛ m	ɪ mː ɪ s k eː r ɛ
f eː r ɪ r ɛ	f ɛ r iː r ɛ
a g r ɛ s t ɛ m	a g r ɛ s t ɛ m
ɪ lː uː d iː r ɛ	ɪ lː uː d ɛ r ɛ
t r ɛ t ʊ m	t r a k t ʊ m
r ɛ f ɛ k t j oː n ɛ m	r ɛ f ɛ k t j oː n ɛ m
m a n s ʊ eː t uː m d ɪ ɛ m	m aː n s ʊ eː t uː d ɪ n ɛ m
a b n ɔ r m ɛ	a b n oː r m ɛ m
f iː g ʊ m	f iː k ʊ m
a r g iː lː a m	a r g ɪ lː a m
f eː k ʊ n d ʊ m	f eː k ʊ n d ʊ m
s a p oː r ɛ	s a p oː r ɛ m
a w ɛ k n a m	a w eː n a m
r ɛ k l a m aː r ɛ	r ɛ k l aː m aː r ɛ
d eː k ɔ r aː r ɛ	d ɛ k ɔ r aː r ɛ
r a n ʊ m	a r aː n ɛu m
d eː k iː m a t j ʊ n ɛ m	d ɛ k ɪ m aː t j oː n ɛ m
w ɛ n j a m	w ɛ n j a m
w ɛ n eː r aː r ɛ	w ɛ n ɛ r aː r iː
n a t j oː n ɛ m	n aː t j oː n ɛ m
a k a m	a k j a m
a r k a m	a r kʰ a m
a b ɪ l ɛ m	aː b ɪ l ɛ m
kʷ a d r uː p l aː r ɛ	kʷ a d r ʊ p l aː r ɛ
d j a l ɛ k t ʊ m	d j a l ɛ k t ɔ n
p r ɔ m ɛ s a m	p r oː m ɪ sː ʊ m
r ɛ k iː t a t j oː n ɛ m	r ɛ k ɪ t aː t j oː n ɛ m
s ɪ l w a m	s ɪ l w a m
ɪ r a k ʊ n d ʊ m	iː r aː k ʊ n d ʊ m
s ɛ k aː r ɛ	s ɛ k aː r ɛ
ɛ k s p ɛ n d ɛ r ɛ	ɛ k s p ɛ n d ɛ r ɛ
p ɛ t aː t j ʊ m	p ɪ tː a k j ʊ m
a k uː s a t j oː n ɛ	a kː uː s aː t j oː n ɛ m
t r a n s p ɔ r ɛ m	t r aː n s p oː n ɛ r ɛ
ɔ pː ɔ r ɛ	ɔ pː oː n ɛ r ɛ
d eː s k ɪ ŋ g ɛ r ɛ	d ɪ s k ɪ ŋ g ɛ r ɛ
n iː n f a m	n y m pʰ a m
p r ɔ n ʊ m	p r oː n ʊ m
a s ɔ k j aː r ɛ	a sː ɔ k j aː r ɛ
k ɛ l eː s t j aː l ɛ	k aɪ l ɛ s t j aː l ɛ m
a b r ʊ g a t j oː n ɛ m	a b r ɔ g aː t j oː n ɛ m
k r uː ɛ n t ʊ m	k r ʊ ɛ n t ʊ m
t ʊ r p ɛ d ʊ m	t ɔ r p eː d ɪ n ɛ m
aɪ ɛ r uː g iː n oː s ʊ m	aɪ r uː g ɪ n oː s ʊ m
ɪ n t ɪ lː ɛ g ɛ r ɛ	ɪ n t ɛ lː ɛ g ɛ r ɛ
ɛ r ɔ m p ɛ r ɛ	eː r ʊ m p ɛ r ɛ
s k oː l ʊ m	s k ɔ p ʊ l ʊ m
f iː k t j oː n ɛ m	f ɪ k t j oː n ɛ m
ɪ gʷ w a m	ɛ kʷ a m
k ʊ k ʊ lː a m	k ʊ k ʊ lː a m
a b lː a k t aː r ɛ	a b l a k t aː r ɛ
s k ɛ n iː k ʊ m	s k eː n ɪ k ʊ m
eː k s aʊ r iː r ɛ	ɛ k s h aʊ r iː r ɛ
t r eː m iː r ɛ	t r ɛ m ɛ r ɛ
ɪ lː a t iː w ʊ m	ɪ lː aː t iː w ʊ m
l iː b a r ɛ	l iː b aː r ɛ
k ʊ lː ʊ k aː r ɛ	k ɔ lː ɔ k aː r ɛ
k ɔ n ɛ k s j oː n ɛ m	k ɔ nː ɛ k s j oː n ɛ m
k ɔ n t r a w n iː r ɛ	k ɔ n t r aː w ɛ n iː r ɛ
s p a r g ɛ r ɛ	s p a r g ɛ r ɛ
l iː n ʊ m	l iː n ɛu m
s w ɛ l aː r ɛ	eː w ɪ g ɪ l aː r ɛ
a ɪ k j aː k ʊ m	aɪ g y p t j a k ʊ m
eː f ɛ k t w ʊ r ɛ	ɛ fː ɪ k ɛ r ɛ
l ɪ k aː t j oː n ɛ m	l ɪ g aː t j oː n ɛ m
w ɪ t ɪ m aː r ɛ	w ɪ k t ɪ m aː r ɛ
s a r k iː n a m	s a r k ɪ n a m
ɪ m p r ʊ b aː r ɛ	ɪ m p r ɔ b aː r ɛ
l a k r iː m a t j ʊ n ɛ	l a k r ɪ m aː t j oː n ɛ m
n a t r iː k ɛ	n aː t r iː k ɛ m
k ɔ n s ɪ ŋ n aː r ɛ	k oː n s ɪ ŋ n aː r ɛ
p ɛ r p eː t w aː w j ɔ n ɛ m	p ɛ r p ɛ t w aː t oː n ɛ m
k ɔ l uː b r ɪ n ʊ m	k ɔ l ʊ b r iː n ʊ m
ɪ b iː s	iː b ɛ m iː b ɪ n
ɪ ŋ n a r ʊ m	ɪ ŋ n aː r ʊ m
h ɔ r b ʊ m	ɔ r b ʊ m
aɪ g r ʊ m	aɪ g r ʊ m
t r a n s m ɔ n t a n ʊ m	t r aː n s m ɔ n t aː n ʊ m
s a g ɪ t aː r j ʊ m	s a g ɪ tː aː r j ʊ m
g l ʊ t oː n ɛ	g l ʊ tː oː n ɛ m
ɪ m p aː r ɛ	ɪ m p a r ɛ m
a k t oː r ɛ	aː k t oː r ɛ m
w j ɛ n t r ɛ m	w ɛ n t r ɛ m
p r ʊ l ɔ kʷ j ʊ m	p r oː l ɔ kʷ j ʊ m
p r ʊ p iː n kʷ ʊ m	p r ɔ p ɪ ŋ kʷ ʊ m
ɛ k s p uː lː s aː r ɛ	ɛ k s p ʊ l s aː r ɛ
p ɛ n d ɛ r ɛ	p ɛ n d eː r ɛ
ɔ r p iː m ɛ n t ʊ m	aʊ r ɪ p ɪ g m ɛ n t ʊ m
p ʊ lː ɛ r l ʊ m	p ʊ lː aː r j ʊ m
a pː a r ɪ r ɛ	a pː aː r eː r ɛ
w iː p eː r ɪ n ʊ m	w ɪ p ɛ r iː n ʊ m
a t w ɛ r t iː r ɛ	a d w ɛ r t ɛ r ɛ
ʊ n k a m	ʊ ŋ k j a m
d iː g ɛ s t iː w ʊ m	d iː g ɛ s t iː w ʊ m
a ŋ g ɛ l iː k ʊ m	a ŋ g ɛ l ɪ k ʊ m
ɪ r k ɪ n ʊ m	h ɪ r k iː n ʊ m
r ɛ g ʊ l a r iː t aː t ɛ m	r eː g ʊ l aː r ɪ t aː t ɛ m
k iː t iː s ʊ m	k y t ɪ s ʊ m
a t r aː r ɛ	a tː r a h ɛ r ɛ
m a t r ʊ n aː l ɛ m	m aː t r oː n aː l ɛ m
l iː n ɛ aː m ɛ n t ʊ m	l iː n ɛ aː m ɛ n t ʊ m
s ʊ mː iː n iː s t r a r ɛ	s ʊ b m ɪ n ɪ s t r aː r ɛ
b a l ɛ n a m	b a lː aɪ n a m
k r eː m aː r ɛ	k r ɛ m aː r ɛ
t ɛ n s j oː n ɛ	t eː n s j oː n ɛ m
f r ɪ g ʊ m	f r iː g ɪ d ʊ m
g r aː n ʊ m	g r aː n ʊ m
s t ɛ m oː m	s t a t ɪ k ʊ m
r ɛ t r aː ɛ r ɛ	r ɛ t r a h ɛ r ɛ
ɪ n f eː r ɛ r ɛ	iː n f ɛ rː ɛ
r eː t iː n a k ʊ lː ʊ m	r ɛ t ɪ n aː k ʊ l ʊ m
s a l t ʊ m	s a l t ʊ m
ɛ k r b ɪ t ʊ m	a r b ʊ t ʊ m
f eː r uː lː a m	f ɛ r ʊ l a m
s ɔ l iː l ɔ kʷ j ʊ m	s oː l ɪ l ɔ kʷ j ʊ m
t ɛ m ɛ r ɛ	t ɪ m eː r ɛ
w iː p ɪ r a m	w iː p ɛ r a m
a b s t ɛ n ɛ r ɛ	a b s t ɪ n eː r ɛ
aɪ r oː ɛ m	h eː r oː ɛ m
eː r ʊ g a r ɛ	eː r ɔ g aː r ɛ
r ɛ p ɛ r k uː s j oː n ɛ m	r ɛ p ɛ r k ʊ t ɛ r ɛ
b ɪ s k j t a m	b eː s t j a m
ɛ k s aʊ t ɪ r ɛ	ɛ k s aʊ d iː r ɛ
g ɛ r m aː n ʊ m	g ɛ r m aː n ʊ m
l ɛ p ʊ r a m	l ɛ p r a m
a p a r eː t ɛ r ɛ	a pː aː r eː s k ɛ r ɛ
eː l ɛ n k ʊ m	ɛ l ɛ ŋ kʰ ʊ m
r eː g m ʊ m g aː r ɛ	m ʊ sː aː r ɛ
f ʊ r m oː s ʊ m	f oː r m oː s ʊ m
l ʊ ŋ g ɛ w ʊ m	l ɔ ŋ g aɪ w ʊ m
k a l ɛ ɛ f a k eː r ɛ	k a l ɛ f a k ɛ r ɛ
k ʊ k ʊ r b ɪ t a m	k ʊ k ʊ r b ɪ t a m
l ɛ ɛ t ʊ m	l aɪ t ʊ m
oː rː ɛ ʊ m	h ɔ rː ɛu m
m iː s t eː lː a n eː ʊ m	m ɪ s k ɛ lː aː n ɛu m
t iː t ʊ l aː r ɛ	t ɪ t ʊ l aː r ɛ m
g ʊ w eː r n a t ɔ r ɛ	g ʊ b ɛ r n aː t oː r ɛ m
a b s k iː s a m	a b s k ɪ n d ɛ r ɛ
ɔ k iː d ɛ n t aː l ɛ	ɔ kː ɪ d ɛ n t aː l ɛ m
ʊ r ʊ m	uː r ʊ m
h ɪ k ɛ	kʷ ɛ m
b a l t ɛ ʊ m	b a l t ɛu m
g ɛ ɔ g r a f j ɪ a m	g eː ɔ g r a pʰ j a m
ɔ b t ɛ m p eː r aː r ɛ	ɔ b t ɛ m p ɛ r aː r ɛ
l eː ʊ d a t ɔ r ɛ	l aʊ d aː t oː r ɛ m
r eː m uː n eː r aː r ɛ	r ɛ m uː n ɛ r aː r ɛ
t ɛ t r ʊ m	t aɪ t r ʊ m
ɪ nː ɔ w a t j oː n ɛ m	ɪ nː ɔ w aː t j oː n ɛ m
ɔ r iː f iː k ʊ m	h ɔ rː ɪ f ɪ k ʊ m
k a r ɪ k k ɛ m	k aː r ɪ k ɛ m
ʊ n iː k ʊ m	uː n ɪ k ʊ m
b uː b ɔ n iː k ʊ m	b uː b oː n ɪ k ʊ m
m iː t iː g a t j oː n ɛ m	m iː t ɪ g aː t j oː n ɛ m
a k eː r b iː t aː t ɛ m	a k ɛ r b ɪ t aː t ɛ m
d eː p r eː d aː r ɛ	d eː p r aɪ d aː r iː
k r ɪ b r aː r ɛ	k r iː b r aː r ɛ
p aː s a r ʊ m	p a sː ɛ r ɛ m
p r ɔ m eː t ɛ r ɛ	p r oː m ɪ tː ɛ r ɛ
p ʊ t r ɛ m	p ʊ t r ɛ m
p a b ɪ m ɛ n t ʊ m	p a w iː m ɛ n t ʊ m
ɪ n t ɛ rː uː p t j oː n ɛ m	ɪ n t ɛ rː ʊ p t j oː n ɛ m
w ʊ l ɛ r ɛ	w ɛ lː ɛ
s ʊ b mː ɛ r g ɛ r ɛ	s ʊ mː ɛ r g ɛ r ɛ
l ɔ n g iː t uː d n ɛ	l ɔ ŋ g ɪ t uː d ɪ n ɛ m
l iː t aː r ɛ	l ɪ t aː r ɛ
a d uː l t eː r aː r ɛ	a d ʊ l t ɛ r aː r ɛ
d iː m ɛ n s j oː n ɛ m	d iː m ɛ n s j oː n ɛ m
d ɛ ɪ t aː t ɛ m	d ɛ ɪ t aː t ɛ m
d iː s t iː n k t ʊ m	d ɪ s t ɪ ŋ k t ʊ m
