k ɔ n k a t ɛ n a r ɛ	k ɔ ŋ k a t eː n aː r ɛ
ɛ n t ɛ m	ɛ n s
m oː t j ʊ m	m ɔ d j ʊ m
d eː f ɛ n s j oː n ɛ m	d eː f eː n s j oː n ɛ m
p uː t r ɪ d ʊ m	p ʊ t r ɪ d ʊ m
n uː t r iː k aː r ɛ	n uː t r iː k aː r ɛ
p a l uː d ɛ m	p a l uː d ɛ m
ɔ k uː l t aː r ɛ	ɔ kː ʊ l t aː r ɛ
p r ɔ r ɔ g aː r ɛ	p r oː r ɔ g aː r ɛ
p ɛ m s ʊ m	p eː n s ʊ m
s ɛ p ʊ l t uː r a m	s ɛ p ʊ l t uː r a m
a d ɪ k t ʊ m	a dː ɪ k t ʊ m
iː m p aː w iː d ʊ m	ɪ m p a w ɪ d ʊ m
k ɔ t ɔ r n iː k ɛ m	k oː t ʊ r n iː k ɛ m
k ɔ l p ɛ m	k ɔ l a pʰ ʊ m
ɔ d j aː r ɛ	oː d ɪ sː ɛ
k uː r a t uː r a m	k uː r aː t uː r a m
s t ɛ t aː r a	s t a t ɪ k ʊ m
a p a r iː t j ʊ m m	a pː aː r ɪ t j oː n ɛ m
m k ɔ t ɔ n ɛ m	m aː l ʊ m k ɔ t oː n j ʊ m
f ʊ m t ɛ r	f ɔ d ɛ r ɛ
k a l iː k ʊ m	k a l ɪ k ɛ m
eː d iː l	aɪ d iː l ɛ m
m ɔ r t aː r j ʊ m	m ɔ r t aː r j ʊ m
d iː m ɛ n s j ʊ m n ɛ m	d iː m ɛ n s j oː n ɛ m
w iː p t ʊ m	w iː k t ʊ m
d eː t ɛ s t aː r ɛ	d eː t ɛ s t aː r iː
ɔ s p iː t j ʊ m	h ɔ s p ɪ t j ʊ m
p ɔ m ʊ m	p oː m ʊ m
r ʊ d ɪ iː n ʊ m p	r oː b iː g ɪ n ɛ m
a m ɛ n t ʊ m	aː m ɛ n t ʊ m
ɔ r t ʊ m	h ɔ r t ʊ m
r eː s uː s k iː t a t j ʊ m n ɛ m	r ɛ s ʊ s k ɪ t aː t j oː n ɛ m
s ɛ p ʊ l aː r ɛ	s ɛ p ɛ l iː r ɛ
k ɛ r w iː n ʊ m	k ɛ r w iː n ʊ m
r uː t iː lː aː r	r ʊ t ɪ l aː r ɛ
s ʊ l k aː r ɛ	s ʊ l k aː r ɛ
d ɛ s t iː t uː ɛ r ɛ	d eː s t ɪ t ʊ ɛ r ɛ
g ɛ t aː r ɛ	j a k t aː r ɛ
l aː b r ʊ m	l a b r ʊ m
d eː g ɔ lː aː r	d eː k ɔ lː aː r ɛ
k a m n h t ʊ m	k aː n uː t ʊ m
r oː ɪ b j a m	r ʊ b j a m
d iː s w aː d ɛ r ɛ	d ɪ sː w aː d eː r ɛ
k r eː d ɪ t oː r ɛ	k r eː d ɪ t oː r ɛ m
ɛ l iː m iː n aː r ɛ	eː l iː m ɪ n aː r ɛ
m a r iː s k	m a r ɪ s k a m
w a k uː ɪ t aː t ɛ m	w a k ʊ ɪ t aː t ɛ m
w ɔ l uː p t ɛ m	w ɔ l ʊ p t aː t ɛ m
t ɛ n ɛ r ɪ ɛ	t ɛ n eː r ɛ
d uː r ʊ m	d uː r ʊ m
s ɛ r w iː t ʊ t ɛ m	s ɛ r w ɪ t uː t ɛ m
ɔ l ɛ aː t ʊ m	ɔ l ɛ aː t ʊ m
eː b r ɛ ʊ m	h ɛ b r aɪ ʊ m
s a l s a m	s a l s a m
uː r ʊ m	uː r ʊ m
a m ʊ r k j a m	a m ʊ r k a m
p a p j eː r j ʊ	p a p y r ʊ m
k ɔ n t ɛ n t j oː n ɛ m	k ɔ n t ɛ n t j oː n ɛ m
k ʊ l p a m	k ʊ l p a m
iː n k aʊ t ʊ m	ɪ ŋ k aʊ t ʊ m
d eː s p ɔ s aː r ɛ	d eː s p oː n s aː r ɛ
n aː t ʊ m	n aː t ʊ m
r ɔ r aː r	r oː r aː r ɛ
ɪ n w iː d j a m	ɪ n w ɪ d j a m
w ɔ r r ɛ	w ɔ r aː r ɛ
m ɔ r d ɛ r ɛ	m ɔ r d eː r ɛ
b ɛ n ɛ d ɪ k ɛ r ɛ	b ɛ n ɛ d iː k ɛ r ɛ
a b ɛ rː aː r ɛ	a b ɛ rː aː r ɛ
a b iː g ɛ ʊ m	a b ɪ g ɛu m
d eː k a l w a t j oː n ɛ m	d eː k a l w aː t j oː n ɛ m
k a n s aː r ɛ	k a m p s aː r ɛ
d j a b ɔ l iː k ʊ m	d j a b ɔ l ɪ k ʊ m
k ɔ n s l a l d	k oː n s ɔ l ɪ d a m
uː s uː r	uː s uː r a m
f a s j ɔ l a m	f a s k ɪ ɔ l a m
t ʊ n d r ɛ m	t ɔ n d eː r ɛ
iː n a l aː r ɛ	ɪ n h aː l aː r ɛ
ɛ t ʊ m	eː t ʊ m
k a s t aː n a	k a s t a n ɛ a m
kʷ iː n kʷ ɛ n a l ɛ	kʷ iː ŋ kʷ ɛ nː aː l ɛ m
ɛ l ɛ f a n t ɪ n ʊ m	ɛ l ɛ pʰ a n t ɪ n ʊ m
iː n f eː r ɛ r ɛ	iː n f ɛ rː ɛ
r uː f ʊ m	r uː f ʊ m
aː r k a m	a r k a m
t r ɛ t ʊ m	t r a k t ʊ m
k a k aː r ɛ	k a p t j aː r ɛ
g a n iː r	g a nː iː r ɛ
f ɛ n d ɛ r ɛ	f ɪ n d ɛ r ɛ
b l aː t a m	b l a tː a m
m a l ɛ	m a l ʊ m
a n ɔ t a t j ʊ m n ɛ m	a nː ɔ t aː t j oː n ɛ m
l a m t iː k iː n j ʊ m	l a k t ɪ k iː n j ʊ m
l iː t uː r g j a m	l iː t uː r g j a m
d ɔ k t oː r ɛ	d ɔ k t oː r ɛ m
d eː ŋ ɪ f iː k aː r ɛ	d ɛ ɪ f ɪ k aː r ɛ
f ʊ n d a m ɛ n t ʊ m	f ʊ n d aː m ɛ n t ʊ m
iː n f l a m a t j ʊ m n ɛ m	iː n f l a mː aː t j oː n ɛ m
t r a m s p oː r ɛ	t r aː n s p oː n ɛ r ɛ
p ɛ r iː k ʊ l oː s ʊ m	p ɛ r iː k ʊ l oː s ʊ m
m ɔ s t r ʊ ʊ s ʊ m	m oː n s t r ʊ oː s ʊ m
d ɛ p a r t iː r	d eː p a r t iː r ɛ
f a s iː n ʊ m	f a s k ɪ n ʊ m
iː m t ɪ m p ɛ s t iː w iː t aː t ɛ m	ɪ n t ɛ m p ɛ s t iː w ɪ t aː t ɛ m
ɔ t r ɛ m	ʊ t r ʊ m
f ɛ r m ɛ m	f ɪ r m ʊ m
t r a n s m ɪ t ɛ r ɛ m	t r aː n s m ɪ tː ɛ r ɛ
p a t ɛ r ɪ n ʊ m	p a t ɛ r n ʊ m
d eː k l a m aː r ɛ	d eː k l aː m aː r ɛ
d ɛ m w j aː r ɛ	d eː w j aː r ɛ
g r a t aː g ɪ t ʊ m	g r aː t ʊ iː t ʊ m
g ɛ l ʊ m	g ɛ l uː
f ɛ r m ɛ n t ʊ m	f ɛ r m ɛ n t ʊ m
b r ɔ k ʊ m	b r ɔ kː ʊ m
n ʊ m k ʊ m	n uː n t j ʊ m
t ɛ t r ʊ m	t aɪ t r ʊ m
g ɛ ɔ m ɛ t r j a m	g ɛ oː m ɛ t r j a m
w eː r n a l ɛ	w ɛ r n aː l ɛ m
t ɛ rː eː n ʊ m	t ɛ rː eː n ʊ m
b l a n d iː r ɛ	b l a n d iː r iː
ɛ f l uː iː r ɛ	ɛ fː l ʊ ɛ r ɛ
w uː l n eː r aː r ɛ	w ʊ l n ɛ r aː r ɛ
p r ɔ f ɛ t ʊ m	p r oː f ɛ k t ʊ m
d ɛ k ɛ r n ɛ r ɛ	d eː k ɛ r n ɛ r ɛ
k ɔ l ɛ k j ʊ m	k aʊ l ɪ k ʊ l ʊ m
k ɔ n w ɔ k aː r ɛ	k ɔ n w ɔ k aː r ɛ
t ɛ n ɛ b r a m	t ɛ n ɛ b r a m
m uː k ɔ r ɛ m	m uː k oː r ɛ m
r aː d iː k j ɪ	r aː d iː k ʊ l a m
m ɛ m b r a n ʊ m m ʊ m	m ɛ m b r aː n ɛu m
f iː d ʊ m	f iː d ʊ m
a b d uː k t j ʊ m n ɛ m	a b d ʊ k t j oː n ɛ m
f aɪ d	f ɪ d ɛ m
ɪ t iː d aː t ɛ m	a k ɪ d ɪ t aː t ɛ m
l ɛ n t ʊ m	l ɛ n t ʊ m
s ɔ m m ɛ t ɛ r ɛ m	s ʊ mː ɪ tː ɛ r ɛ
a k uː s a t j oː n ɛ	a kː uː s aː t j oː n ɛ m
r a p iː d iː t ɛ m	r a p ɪ d ɪ t aː t ɛ m
k a t ɪ n ʊ m	k a t iː n ʊ m
ɛ p r ʊ n ʊ m	p r uː n ʊ m
g ɛ r ɪ m aː n ʊ m	g ɛ r m aː n ʊ m
m a n d aː r ɛ	m a n d aː r ɛ
r m ɛ aː l ɪ t aː t ɛ m	r ɛ aː l ɪ t aː t ɛ m
w ɛ ɛ m r ɔ s ɔ l ɛu m iː t m ʊ m	h ɪ ɛ r ɔ s ɔ l y m iː t aː n ʊ m
n ɔ t ɛ	n ɔ t a m
r ɛ s t r ɪ ŋ g ɛ r ɛ m	r ɛ s t r ɪ ŋ g ɛ r ɛ
l uː n uː l	l uː n ʊ l a m
t oː r ɛ	t oː r ɛ m
b ɛ r iː lː ʊ m	b eː r y lː ʊ m
s k a n d iː r ɛ	s k a n d ɛ r ɛ
l iː t ɛ m	l iː t ɛ m
j a n t aː r	j ɛ n t aː r ɛ
t r uː k uː l ɛ n t ʊ m	t r ʊ k ʊ l ɛ n t ʊ m
k ɔ n t r ɛ t ʊ	k ɔ n t r iː t ʊ m
ɪ t aː t ɛ m	ɪ t aː t ɛ m
p ɛ r eː g r iː n aː r ɛ	p ɛ r ɛ g r iː n aː r iː
d eː s iː s t ɛ r	d eː s ɪ s t ɛ r ɛ
p ɛ r f iː d ʊ m	p ɛ r f ɪ d ʊ m
w ɪ t uː l ʊ	w ɪ t ʊ l ʊ m
k a l a m iː t aː t ɛ m	k a l a m ɪ t aː t ɛ m
k a n d ɛ l a	k a n d eː l a m
t iː t ɛ r j oː r	k ɪ t ɛ r j oː r ɛ m
ɪ m p ɛ r ʊ m	ɪ m p ɛ r j ʊ m
m ɛ r iː d j ɛ ɔ n a l ɛ	m ɛ r iː d j oː n aː l ɛ m
ɔ	ʊ m
w a r j ɛ g a t j oː n	w a r ɪ ɛ g aː t j oː n ɛ m
rː ɛ m uː n ɛ r aː r ɛ	r ɛ m uː n ɛ r aː r ɛ
g ʊ b ɛ n k a m	j ʊ w ɛ ŋ k a m
s t r ɛ p iː t ʊ m	s t r ɛ p ɪ t ʊ m
t r ɛ m uː l ʊ m	t r ɛ m ʊ l ʊ m
s ɛ k aː l ɛ m	s ɛ k aː l ɛ
p lː ɛ n iː t uː d ɛ m	p l eː n ɪ t uː d ɪ n ɛ m
w iː d uː iː t ɛ m	w ɪ d ʊ ɪ t aː t ɛ m
k lː aʊ s uː lː a m	k l aʊ s ʊ l a m
k ɔ r w iː n ʊ m	k ɔ r w iː n ʊ m
s p a r g ɛ r ɛ	s p a r g ɛ r ɛ
k ɔ d iː k ɛ m	k oː d ɪ k ɛ m
p ɛ r s p iː k ʊ m	p ɛ r s p ɪ k ʊː m
t ɔ r t ʊ m	t ɔ r t ʊ m
m oː l n aː r ʊ m	m ɔ l iː n aː r j ʊ m
ɛ g ɪ l ɛ t ʊ m	f ɪ l ɪ k t ʊ m
l iː n k ɛ m	l y ŋ k ɛ m
p a r ɔ n ɔ m aː s j a m	p a r ɔ n ɔ m a s j a m
t iː n t aː r ɛ	t ɪ ŋ g ɛ r ɛ
a r k a n ʊ m	a r k a n ʊ m
a b a l j iː eː n aː r ɛ	a b a l ɪ eː n aː r ɛ
p iː k t oː r ɛ	p ɪ k t oː r ɛ m
w oː m iː k ʊ m	w ɔ m ɪ k ʊ m
rː a p iː n a m	r a p iː n a m
iː m p r eː k aː r ɛ	ɪ m p r ɛ k aː r iː
k ɔ l ɔ m b ʊ	k ɔ l ʊ m b ʊ m
iː n uː m a n iː t aː t ɛ m	ɪ n h uː m aː n ɪ t aː t ɛ m
n ɔ d oː s ʊ m	n oː d oː s ʊ m
s iː m s iː p ʊ m t	s ɪ ŋ k ɪ p ʊ t
f a r iː n oː s ʊ m	f a r iː n oː s ʊ m
k ɔ n s t iː t uː t iː w ʊ m	k ɔ n s t ɪ t uː t ɪ w ʊ m
l ɛ k t oː r ɛ	l eː k t oː r ɛ m
s ʊ b t iː l ɛ m	s ʊ b t iː l ɛ m
b ɪ s pʰ h a m	b eː s t j a m
t r iː lː ʊ m	t r iː b ʊ l ʊ m
d eː n eː g aː r ɛ	d eː n ɛ g aː r ɛ
f uː s t ɛ m	f uː s t ɛ m
a r m aː r ɛ	a r m aː r ɛ
g uː d iː t j aː r j ʊ m	j uː d ɪ k j aː r j ʊ m
uː l t ɛ r j ɔ r ɛ	ʊ l t ɛ r j oː r ɛ m
l a t iː f ʊ n d ʊ m	l aː t ɪ f ʊ n d j ʊ m
uː d a m	uː d ʊ m
p r a n d ʊ m	p r a n d j ʊ m
b a r b aː t ʊ m	b a r b aː t ʊ m
t ɛ l a m m	t eː g ʊ l a m
r ɛ l uː k ɪ r ɛ	r ɛ l uː k eː r ɛ
f l oː r eː r ɛ	f l oː r eː r ɛ
ɛ r ɔ g a r ɛ	eː r ɔ g aː r ɛ
k r uː ɛ d a l t ɛ m	k r uː d eː l ɪ t aː t ɛ m
n w ɔ t aː r ɛ	n a t aː r ɛ
p aː s t ʊ m	p aː s t ʊ m
p j ɛ lː ɪ k a m	p ɛ d ɪ k a m
kʷ a l iː t aː t ɛ m	kʷ aː l ɪ t aː t ɛ m
f oː s a t ʊ m	f ɔ sː aː t ʊ m
p uː p iː lː ʊ m	p uː p ɪ lː ʊ m
d iː w uː l g a t j ʊ m n ɛ m	d iː w ʊ l g aː t j oː n ɛ m
a g iː t aː r ɛ m	a g ɪ t aː r ɛ
ɛ p iː s t uː l ɛ m	ɛ p ɪ s t ɔ l a m
b uː f a l ʊ m	b uː b a l ʊ m
l a ŋ gʷ oː r ɛ m	l a ŋ gʷ oː r ɛ m
oː w ɪ l j a m	ɔ w ɪ k ʊ l a m
ɛ t aː t ɛ m	aɪ t aː t ɛ m
k ɔ n t ɛ n d ɛ r ɛ	k ɔ n t ɛ n d ɛ r ɛ
k a p r ʊ m m	k a p r ʊ m
b a r iː t ɔ n ʊ m	b a r y t ɔ n ʊ m
f a w oː r ɛ m	f a w oː r ɛ m
ɛ m b r j aː k ʊ m	eː b r j aː k ʊ m
ɪ t aː t ɛ m	t a t ɛ m
d eː m ɔ m s t r a t j ʊ m n ɛ m	d eː m oː n s t r aː t j oː n ɛ m
s ʊ m iː n iː s t r a r ɛ	s ʊ b m ɪ n ɪ s t r aː r ɛ
w iː k ʊ m	w iː k ʊ m
k ɔ m p r iː m ɛ r ɛ	k ɔ m p r ɪ m ɛ r ɛ
l iː b eː r a l iː t aː t ɛ m	l iː b ɛ r aː l ɪ t aː t ɛ m
ɛ w ɔ l uː t j oː n ɛ	eː w ɔ l uː t j oː n ɛ m
k ɔ rː oː d ɛ r ɛ	k ɔ rː oː d ɛ r ɛ
m ɛ n aː k j a	m ɪ n aː k ɛ m
p aː r ɪ w ʊ m	p a r w ʊ m
iː b r iː d ʊ m	h y b r ɪ d a m
n ɪ w ɛ ʊ m	n ɪ w ɛu m
p ɛ r ɪ k uː s ɔ r	p ɛ r k ʊ sː oː r ɛ m
n ʊ t r iː k ɛ m	n uː t r iː k ɛ m
ɛ m s p lː ɔ r a d ɔ r	ɛ k s p l oː r aː t oː r ɛ m
k oː ɪ t ʊ m	k ɔ ɪ t ʊ m
l iː n ʊ m	l iː n ɛu m
t ɛ s uː r a m	t eː n s uː r a m
p r ɔ f ɛ t j a m	p r ɔ pʰ eː t iː a m
ɪ n f r ɛ n aː r ɛ	iː n f r eː n aː r ɛ
a k ɔ rː ɛ r ɛ	a kː ʊ rː ɛ r ɛ
r a p t aː r	r a p t aː r ɛ
a b a t j a l	a bː aː t j aː l ɛ m
k ɔ r t aː r ɛ	k ʊ r t aː r ɛ
l iː y m a k ɪ a	l iː m aː k ɛ m
k ɪ p a m	k aɪ p a m
iː ŋ g uː s t ʊ m	ɪ n ɪ uː s t ʊ m
p iː n t ʊ m	p ɪ k t ʊ m
m ɔ d eː r a t oː r ɛ	m ɔ d ɛ r aː t oː r ɛ m
d ɛ n t aː t ʊ m	d ɛ n t aː t ʊ m
lː iː b r a t j ʊ m m	l iː b r aː t j oː n ɛ m
s ʊ s t ɛ n t aː r ɛ	s ʊ s t ɛ n t aː r ɛ
f ʊ l k a m	f ʊ l ɪ k a m
s t iː p uː l aː r ɛ	s t ɪ p ʊ l aː r iː
ɪ n t ɛ ŋ r ʊ m	ɪ n t ɛ g r ʊ m
p uː p iː lː a m	p uː p ɪ lː a m
w iː n oː s ʊ m	w iː n oː s ʊ m
k r iː n ɛ m	k r iː n ɛ m
p ɛ n d ɛ r ɛ	p ɛ n d eː r ɛ
m eː s k ɛ r ɛ m	m ɪ s k eː r ɛ
aʊ lː a m	aʊ l a m
p ɔ r t ʊ g ɛ s ɛ	p ɔ r t ʊ k eː n s ɛ m
s ɛ p ʊ l k r ʊ m	s ɛ p ʊ l k r ʊ m
r a k ɪ m ɔ s ʊ m	r a k eː m oː s ʊ m
k ʊ n j a r ɛ	k ʊ n ɛ aː r ɛ
a n ɛ t ʊ m	a n eː tʰ ʊ m
g ɛ m uː l a m	g ɛ mː ʊ l a m
s ʊ b t r ɛ ɛ r ɛ m	s ʊ b t r a h ɛ r ɛ
ɛ k z ɪ m p l aː r ɛ	ɛ k s ɛ m p l aː r ɛ m
t ʊ rː m ɛ m	t ʊ rː ɛ m
r ɛ k eː p t a t ɔ r ɛ	r ɛ k ɛ p t aː t oː r ɛ m
k a l eː f a k t j ʊ m n ɛ m	k a l ɛ f a k t j oː n ɛ m
ɔ b s t r uː ɛ r ɛ	ɔ b s t r ʊ ɛ r ɛ
l uː b r iː k iː t ɛ m	l uː b r ɪ k ɪ t aː t ɛ m
ɔ n oː r ɛ m	h ɔ n oː r ɛ m
k ɔ m iː t j ʊ m	k ɔ m ɪ t j ʊ m
b ʊ lː iː r ɛ	b ʊ lː iː r ɛ
k r ɛ s p aː r ɛ	k r ɪ s p aː r ɛ
b aː s j ʊ m	b aː s j ʊ m
p a ɪ s ɛ	p aː g eː n s ɛ m
d ɪ k ɪ m ʊ m	d ɛ k ɪ m ʊ m
k ɛ m	kʷ ɪ s
l uː n aː r ɛ	l uː n aː r ɛ m
k ɔ l ʊ m b iː n ʊ m	k ɔ l ʊ m b iː n ʊ m
a gː l uː t iː n r ɛ	a gː l uː t ɪ n aː r ɛ
p r ɛ ɔ k uː p a t j ʊ m n ɛ m	p r aɪ ɔ kː ʊ p aː t j oː n ɛ m
p a l j ʊ m	p a lː j ʊ m
a d w ɛ m k oː n	a d w ɛ k t j oː n ɛ m
p ɔ s ɛ s oː r ɛ	p ɔ sː ɛ sː oː r ɛ m
p ɛ k a t oː r ɛ	p ɛ kː aː t oː r ɛ m
f ɛ t iː d ʊ m	f eː t ɪ d ʊ m
s uː k ɔ s ʊ m	s uː k oː s ʊ m
m a ŋ n ɛ s j ʊ m	m a ŋ n eː s j ʊ m
p a l p iː t a t j oː n	p a l p ɪ t aː t j oː n ɛ m
d eː l iː b eː r aː r ɛ	d eː l iː b ɛ r aː r ɛ
ɛ s kʷ a lː iː d ʊ m	s kʷ aː l ɪ d ʊ m
ɪ w ɔ r j ɛ m	ɛ b ʊ r
p ɛ r s eː kʷ ɪ r ɛ	p ɛ r s ɛ kʷ iː
s ɛ m ʊ w eː r ɛ	eː m ɔ w eː r ɛ
b ɛ l aː r ɛ	b aː l aː r ɛ
a l ɛ n aː r ɛ	a l ɪ eː n aː r ɛ
ɛ k s k ɔ g iː t r ɛ	ɛ k s k oː g ɪ t aː r ɛ
p eː r k ɔ rː ɛ r ɛ	p ɛ r k ʊ rː ɛ r ɛ
f h ɛ r w ɛ r ɛ	f ɛ r w eː r ɛ
s p ɔ l ʊ m	s p ɔ l j ʊ m
t uː n d a r	t ʊ n d ɛ r ɛ
r ɛ t j aː r j ʊ m	r eː t j aː r j ʊ m
a n w ʊ m	a nː ʊː m
f uː l w ʊ m	f ʊ l w ʊ m
t ɛ n ɛ b l ɛ m	t ɛ n ɛ b r aː s
ɛ w ɔ l k w ɛ r ɛ	eː w ɔ l w ɛ r ɛ
m a l iː ŋ n ʊ m	m a l ɪ ŋ n ʊ m
k r ɛ p r ɛ a t uː r a m	k r ɛ p aː t uː r a m
a k ɛ t ʊ m	a k eː t ʊ m
k ɔ lː ɛ k t a m	k ɔ lː eː k t a m
m a l f a r ɛ	m a l ɛ f a k ɛ r ɛ
t iː n a m	t iː n a m
w iː d ɪ n ʊ m	w ɔ k ɪ t ʊ m
b r aː k a m	b r aː k a m
p r ɔ iː b iː t j ʊ m m	p r ɔ h ɪ b ɪ t j oː n ɛ m
g aː lː a m	g a lː a m
s a n t ʊ r j ɛ t	s a t ʊ r eː j a m
s ɛ k s w ʊ a l iː t aː t ɛ m	s ɛ k s w aː l ɪ t aː t ɛ m
d iː w ɛ r t iː r ɛ	d iː w ɛ r t ɛ r ɛ
s oː r ɛ h a m	s ɔ r oː r ɛ m
n ɛ k s ʊ m	n ɛ k s ʊ m
g ɛ m ɪ t ʊ m	g ɛ m ɪ t ʊ m
gʷ a r d aː r ɛ	w a r d aː r ɛ
k ɔ n s ɛ ʊ m	k oː n s k j ʊ m
w iː g ɔ r aː r ɛ	w ɪ g oː r aː r ɛ
d ɔ l ɔ s ʊ m	d ɔ l oː s ʊ m
ɛ d iː k ɔ l a m	aɪ d ɪ k ʊ l a m
p r ɛ s ɛ n t a m	p r aɪ s k ɪ ɛ n t j a m
a ŋ g ɔ s t aː r ɛ	a ŋ g ʊ s t aː r ɛ
s ɔ r t ɛ m	s ɔ r t ɛ m
m iː k a m	m iː k a m
n ɛ p eː t ɛ m a m	n ɛ p ɛ t a m
p uː t ʊ m	p ʊ t ʊ m
ɛ k s p iː r aː r ɛ	ɛ k sː p iː r aː r ɛ
p r ɔ t ɛ s t a t j ʊ m n ɛ m	p r oː t ɛ s t aː t j oː n ɛ m
a k a n t ʊ m	a k a n tʰ ʊ m
ɔ b g ɛ k t ʊ m	ɔ b ɪ ɛ k t ʊ m
k ɔ n s uː d m aː r	k oː n s ʊ mː aː r ɛ
k ɔ m p l iː k a t j oː n ɛ	k ɔ m p l ɪ k aː t j oː n ɛ m
a f j a n k aː r	a fː ɪ d ɛ n t j aː r ɛ
uː l t r iː k ɛ	ʊ l t r iː k ɛ m
m uː t ʊ m m	m uː t ʊː m
m ɛ r ʊ m	m ɛ r ʊ m
t r eː m oː r ɛ	t r ɛ m oː r ɛ m
a k k ɛ s oː r j ʊ m	a kː ɛ sː oː r j ʊ m
ɪ n k a r n aː r ɛ	ɪ ŋ k a r n aː r ɛ
a m ɛ n ʊ m	a m ɔ ɪ n ʊ m
r ɛ l a t iː w ʊ m	r ɛ l aː t iː w ʊ m
n ɛ f a s	n ɛ f aː s
k ɛ l t a m	k ɛ l t a m
p ɔ s t ɛ r ʊ m	p ɔ s t ɛ r ʊ m
w eː l ɔ k ɛ	w eː l oː k ɛ m
w iː w iː d ʊ m	w iː w ɪ d ʊ m
r ʊ t aː r ɛ	r ʊ k t aː r ɛ
ɔ d j ʊ m	ɔ d j ʊ m
k a t eː k iː d zː aː r ɛ	k a t eː kʰ iː zː aː r ɛ
ɛ l ɛ w aː r ɛ	eː l ɛ w aː r ɛ
p a l p eː b r a l	p a l p ɛ b r aː l ɛ m
m ʊ l k ɛ r ɛ	m ʊ l k eː r ɛ
s ɔ p ɔ r ɛ	s ɔ p oː r ɛ m
r ɛ s t iː t uː ɪ r ɛ	r ɛ s t ɪ t ʊ ɛ r ɛ
t r iː f ɔ l aː t ʊ m	t r ɪ f ɔ l j aː t ʊ m
d iː s p a r ɪ t r ɛ	d ɪ s p a r eː r ɛ
s uː b m ɛ ɛ r m ʊ m	s uː b ɛ r ɛ m
p ʊ ɛ r iː l ɛ	p ʊ ɛ r iː l ɛ m
k ɔ n s ɛ r w a t j ʊ m n ɛ m	k oː n s ɛ r w aː t j oː n ɛ m
iː n f eː l iː k ɛ	iː n f eː l iː k ɛ m
s ɔ lː ɪ k iː t a t j ʊ m n ɛ m	s ɔ lː ɪ k ɪ t aː t j oː n ɛ m
a m a n t ɛ m	a m a n t ɛ m
m iː n ʊ iː r ɛ	m ɪ n ʊ ɛ r ɛ
a n uː l aː r ɛ	aː n ʊ l aː r ɛ m
b j ɛ n j ʊ m	b ɪ ɛ nː j ʊ m
ɛ n ɛ r w aː r ɛ	eː n ɛ r w aː r ɛ
oː l ʊ m	ɔ l ʊ m
f ɔ k a m	pʰ oː k a m
r ɛ w ɔ k a t j ʊ m n ɛ m	r ɛ w ɔ k aː t j oː n ɛ m
ɛ lː eː g a n t ɛ m	eː l ɛ g a n t ɛ m
a r m a r j ʊ m	a r m aː r j ʊ m
ɛ b r ʊ m	eː b r j ʊ m
iː r a k ʊ n d j a m	iː r aː k ʊ n d j a m
k a l iː g iː n oː s ʊ m	k aː l iː g ɪ n oː s ʊ m
n ɔ k ɛ t ʊ m	n ʊ k eː t ʊ m
w ɛ r g a m	w ɪ r g a m
d iː f lː uː ɛ r	d ɪ fː l ʊ ɛ r ɛ
s ɛu l t ʊ m	s ɔ l uː t ʊ m
t ɔ r aː r	t ɔ rː eː r ɛ
f aː rː ʊ m	f a rː ɛu m
k oː l oː n ʊ m	k ɔ l oː n ʊ m
s t ɔ r n ɪ k ʊ m	s t ʊ r n ʊ m
k a p aː k ɛ	k a p aː k ɛ m
iː m p uː d ɛ m t ɛ m	ɪ m p ʊ d ɛ n t ɛ m
b aː r k a m	b a r k a m
p ɛ r t uː r b a t j oː n ɛ m	p ɛ r t ʊ r b aː t j oː n ɛ m
j ɛ ɛ m m a l ɛ	h ɪ ɛ m aː l ɛ m
ɛu oː k a r iː s t j a m	ɛu kʰ a r ɪ s t j a m
h iː s p a n iː k ʊ m	h ɪ s p aː n ɪ k ʊ m
iː m m a t uː r ʊ m	ɪ mː aː t uː r ʊ m
s ʊ b s t a n t a m	s ʊ b s t a n t j a m
