k ɔ n s uː m ɛ r ɛ	k oː n s uː m ɛ r ɛ
d eː s uː l t oː r j ʊ m	d eː s ʊ l t oː r j ʊ m
k ɔ n s eː kʷ h ɛ n t j a m	k oː n s ɛ kʷ ɛ n t j a m
ɪ n s ɛ m n aː r ɛ	iː n s ɪ ŋ n aː r ɛ
p iː s aː r	p iː n s ɛ r ɛ
ɛ g s eː k r a t j ʊ n ɛ m	ɛ k sː eː k r aː t j oː n ɛ m
g eː r a r k a m	h ɪ ɛ r a r kʰ a m
p uː p iː lː a m	p uː p ɪ lː a m
k ɔ n f eː r ɛ r ɛ	k oː n f ɛ rː ɛ
m a r t ɛ lː ʊ m	m a r t ɛ lː ʊ m
a s t uː t j a m	a s t uː t j a m
r ɛ p r ʊ w aː r ɛ	r ɛ p r ɔ b aː r ɛ
a n ɔ d iː n ʊ m	a n oː d y n ɔ n
k ɔ m p l ɛ t ʊ m	k ɔ m p l eː t ʊ m
k ɔ n ʊ n g ɪ r ɛ	k ɔ n j ʊ ŋ g ɛ r ɛ
k ɔ n t r a w ɛ n iː r	k ɔ n t r aː w ɛ n iː r ɛ
k ɔ n s ɪ l ʊ m	k ɔ ŋ k ɪ l j ʊ m
m a t ɛ r n iː t aː	m aː t ɛ r n ɪ t aː t ɛ m
k ʊ l p a m	k ʊ l p a m
r aː lː ʊ m	r a lː ʊ m
a t r ʊ m	aː t r ʊ m
m eː r eː t r iː k ɛ	m ɛ r ɛ t r iː k ɛ m
iː n g ʊ k t j ʊ n ɛ m	ɪ n j ʊ ŋ k t j oː n ɛ m
f ʊ r n aː k ɛ m	f ɔ r n aː k ɛ m
s p eː k uː l a t oː r ɛ	s p ɛ k ʊ l aː t oː r ɛ m
s aʊ l t ʊ m	s ɔ l uː t ʊ m
s uː p ɛ r ɪ w a k a n ɛ ʊ m	s ʊ p ɛ r w a k ʊː m
r ɛ f l oː r ɪ r ɛ	r ɛ f l oː r eː r ɛ
k ɔ r w iː n ʊ m	k ɔ r w iː n ʊ m
rː eː t oː r	r h eː t ɔ r ɛ m
p r eː m ʊ n iː t ʊ r ɛ m	p r aɪ m ɔ n ɪ t oː r ɛ m
n uː m eː r aː r ʊ	n ʊ m ɛ r aː r j ʊ m
k r ɔ s t m a m	k r ʊ s t a m
t r eː m ʊ l aː r ɛ	t r ɛ m ʊ l aː r ɛ
s t iː w a r ɛ	s t iː p aː r ɛ
rː ɛ lː a k s a t j oː n	r ɛ l a k s aː t j oː n ɛ m
p uː s t ʊ l a m	p ʊ s t ʊ l a m
kʷ ɛ r ɛ l a m	kʷ ɛ r eː l a m
a b ɔ m aː s ʊ m	a b ɔ m aː s ʊ m
r iː k s a m	r ɪ k s a m
r eː k uː r s j ʊ n ɛ m	r ɛ k ʊ r s j oː n ɛ m
aː m iː g d a l a m	a m y g d a l ʊ m
k ɔ n k r eː t j ɔ n ɛ	k ɔ ŋ k r eː t j oː n ɛ m
ɪ n k ʊ r w aː r ɛ	ɪ ŋ k ʊ r w aː r ɛ
ɛ n t eː l ɛ g ɛ r	ɪ n t ɛ lː ɛ g ɛ r ɛ
p r iː m ʊ g ɛ n iː t ʊ m	p r iː m oː g ɛ n ɪ t ʊ m
f l a s ʊ	f l a kː ʊ m
s a k r iː f iː k a t oː r ɛ	s a k r ɪ f ɪ k aː t oː r ɛ m
f aː rː ʊ m	f a rː ɛu m
iː m p eː r j ɪ aː l ɛ	ɪ m p ɛ r j aː l ɛ m
f ɛ s t ʊ m	f eː s t ʊ m
g uː s t iː f iː k a t ʊ r ɛ	j uː s t ɪ f ɪ k aː t oː r ɛ m
ʊ oː k a r iː s t j a m	ɛu kʰ a r ɪ s t j a m
w a k uː ɪ t aː t ɛ m	w a k ʊ ɪ t aː t ɛ m
r ʊ t ʊ m	r uː k t ʊ m
m oː r ɛ m	m oː r ɛ m
a t r iː b uː t j ɔ n ɛ	a tː r ɪ b uː t j oː n ɛ m
p r ɔ k ɛ lː a m	p r ɔ k ɛ lː a m
s t uː d j ʊ m	s t ʊ d j ʊ m
s ʊ b s t iː t uː t j ʊ n ɛ m	s ʊ b s t ɪ t uː t j oː n ɛ m
a gː l uː t iː n r ɛ	a gː l uː t ɪ n aː r ɛ
d uː b	d ʊ b j ʊ m
k r eː d iː b ɪ l ɛ	k r eː d ɪ b ɪ l ɛ m
k aː lː iː d ʊ m	k a lː ɪ d ʊ m
iː n mː uː t aː r	ɪ mː uː t aː r ɛ
k a l n t ɛ m	k a l ɛ n t ɛ m
l aʊ d ɛ m	l aʊ d ɛ m
a m iː k iː t j a m	a m iː k ɪ t j a m
p ɔ l ʊ m	p ɔ l ʊ m
oː lː aː r j ʊ m	ɔ lː aː r j ʊ m
p r eː t ɛ r n a t uː r a l ɛ	p r aɪ t ɛ r n aː t uː r aː l ɛ m
b a s iː l iː k a m	b a s ɪ l ɪ k a m
r ɛ s ɔ n aː r ɛ	r ɛ s ɔ n aː r ɛ
w ʊ l ɛ r ɛ	w ɛ lː ɛ
r ɛ n ɔ w a t j oː n ɛ	r ɛ n ɔ w aː t j oː n ɛ m
k eː d ɛ r ɛ	k eː d ɛ r ɛ
ɔ t j ʊ m	oː t j ʊ m
p ʊ lː aː r ɛ	p ʊ lː aː r ɛ
t a m ɛ ʊ	t a m ɪ s j ʊ m
k ʊ ɪ r ʊ m	k ɔ r j ʊ m
d eː m eː n t ɪ k a r ɛ	d eː m ɛ n t aː r ɛ
t r a m s f ʊ n d ɪ r ɛ	t r aː n s f ʊ n d ɛ r ɛ
a m iː k a m	a m iː k a m
k j eː g ʊ m	k aɪ k ʊ m
t j ɪ p ɛ ɪ d ʊ m	t ɛ p ɪ d ʊ m
p ɔ r t j ʊ m m	p ɔ r t j oː n ɛ m
s ɔ lː ɪ k iː t a t j ʊ n ɛ m	s ɔ lː ɪ k ɪ t aː t j oː n ɛ m
d ɛ s t r uː k j oː n ɛ m	d eː s t r ʊ k t j oː n ɛ m
a fː l iː g ɛ r ɛ	a fː l iː g ɛ r ɛ
k ɔ n t ɛ n t j oː n ɛ m	k ɔ n t ɛ n t j oː n ɛ m
f uː l w ʊ m	f ʊ l w ʊ m
eː kʷ iː l iː b r j ʊ m	aɪ kʷ ɪ l iː b r j ʊ m
k r ɛ p r ɛ a t uː r a m	k r ɛ p aː t uː r a m
eː m s p lː a n a k oː n	ɛ k s p l aː n aː t j oː n ɛ m
m ɛ r a m	m ʊ r j a m
b a k ʊ l ʊ	b a k ʊ l ʊ m
d uː r ʊ m	d uː r ʊ m
k ɔ n s k ɛ ʊ m	k oː n s k j ʊ m
iː n k iː d ɪ r ɛ	ɪ ŋ k ɪ d ɛ r ɛ
p uː g iː l ɛ	p ʊ g ɪ l ɛ m
s k ɔ p l ʊ m	s k a l p r ʊ m
d iː s t r ɛ ɛ r ɛ	d ɪ s t r a h ɛ r ɛ
uː s aː r j ʊ m	uː s w aː r j ʊ m
n ʊ s ʊ k ɔ m j ʊ m	n ɔ s ɔ k ɔ m iː ʊ m
a m ɔ w ɪ b ɪ l ɛ	aː m ɔ w eː r ɛ
d ŋ w a n ɛ ɪ r ɛ	eː w aː n eː s k ɛ r ɛ
f ɪ m b r j aː t ʊ m	f ɪ m b r j aː t ʊ m
ɛ r kʷ ɛ r ɛ	eː r ɪ g ɛ r ɛ
iː rː eː g ʊ l aː r ɛ	ɪ rː eː g ʊ l aː r ɛ m
s aː t iː r a m	s a t ɪ r a m
m a t r iː k ʊ l a m	m aː t r iː k ʊ l a m
a l uː n ʊ m	a l ʊ m n ʊ m
p r a n d s ʊ m	p r a n d j ʊ m
l iː t ɛ m	l iː t ɛ m
iː n k r ɛ d iː b ɪ l ɛ	ɪ ŋ k r eː d ɪ b ɪ l ɛ m
ɛ k s t r iː s ɛ k ʊ m	ɛ k s t r iː n s ɛ k ʊ m
k a m b j aː r ɛ	k a m b iː r ɛ
t ɛ r m iː t ɛ m	t a r m ɪ t ɛ m
k ɔ n s oː n aː r ɛ	k oː n s ɔ n aː r ɛ
p r eː g ʊ s t r ɛ	p r aɪ g ʊ s t aː r ɛ
p uː l k r iː t uː d ɛ m	p ʊ l kʰ r ɪ t uː d ɪ n ɛ m
f ʊ ŋ g oː s ʊ m	f ʊ ŋ g oː s ʊ m
aː t ʊ m	aː t ʊ m
a k r eː t j oː n ɛ	a kː r eː t j oː n ɛ m
f a s t ɪ d j oː s ʊ m	f a s t iː d j oː s ʊ m
iː m t ɛ m p ɛ s t iː w ʊ	ɪ n t ɛ m p ɛ s t iː w ʊ m
r ɛ s ɛ n aː r ɛ	r ɛ s ɪ ŋ n aː r ɛ
k a t eː k iː t j aː r ɛ	k a t eː kʰ iː zː aː r ɛ
l iː m a m	l iː m a m
w eː r eː k ʊ n d ʊ m	w ɛ r eː k ʊ n d ʊ m
a f lː ɛ n k j a m	a fː l ʊ ɛ n t j a m
a b s ɔ r p t j oː n	a b s ɔ r p t j oː n ɛ m
f eː rː uː g ɛ n ɛ m	f ɛ rː uː g ɪ n ɛ m
rː ɛ kː a t aː r	r ɛ k a p t j aː r ɛ
p ɛ r w ɛ r t iː r ɛ	p ɛ r w ɛ r t ɛ r ɛ
p r eː f eː r iː r ɛ	p r aɪ f ɛ rː ɛ
a lː ɪ w j aː r ɛ	a lː ɛ w j aː r ɛ
p r eː s ɪ d ɛ r ɛ	p r aɪ s ɪ d eː r ɛ
g uː n j ɪ ɔ r ɛ	j uː n j oː r ɛ m
k ɔ p eː r a t j ʊ n ɛ m	k ɔː p ɛ r aː t j oː n ɛ m
l aʊ r ʊ k eː r a s ʊ m	l aʊ r ɔ k ɛ r a s ʊ m
k ʊ r uː s k a r ɛ	k ɔ r ʊ s k aː r ɛ
ɔ b l iː g aː r ɛ	ɔ b l ɪ g aː r ɛ
f aː w a m	f a b a m
g uː r iː s p r uː d ɛ n s	j uː r ɪ s p r uː d ɛ n t j a m
a r b iː t r j ʊ m	a r b ɪ t r j ʊ m
d ɔ r aː r ɛ	d ɛ aʊ r aː r ɛ
ʊ l eː r ɛ	ɔ l eː r ɛ
ʊ ŋ g uː l aː t ʊ m	ʊ ŋ g ʊ l aː t ʊ m
f oː r m oː s ʊ m	f oː r m oː s ʊ m
n a t j oː n ɛ m	n aː t j oː n ɛ m
aː r d ʊ m	a r d ʊː m
s t ɛ a	s t a t ɪ k ʊ m
r eː k ɛ s iː w ʊ m	r ɛ k ɛ sː iː w ʊ m
ɛ k s p eː d j ɛ r ɛ	ɛ k s p ɛ d iː r ɛ
ɛ k s t iː r p aː r ɛ	ɛ k sː t ɪ r p aː r ɛ
ɛ k s k l uː ɪ r ɛ	ɛ k s k l uː d ɛ r ɛ
k ɔ n f ɛ s aː r	k oː n f ɪ t eː r iː
tʰ j ɔ	tʰ iː ʊ m
a n eː l aː r ɛ	a n h eː l aː r ɛ
s eː k uː r ɛ m	s ɛ k uː r ɛ m
k a lː ɛ n d a s	k a l ɛ n d aː s
l uː n aː t ʊ n ɛ m	l uː n aː t j oː n ɛ m
eː lː uː ɛ r ɛ	eː l ʊ ɛ r ɛ
n uː t ʊ m	n uː t ʊ m
k r iː m iː n a k oː n	k r iː m ɪ n aː t j oː n ɛ m
ʊ m l j ɪ t ɛ r ɛ	ɔ b l iː w ɪ s k iː
p r eː p ɔ s ɪ t ɛ m	p r aɪ p ɔ s ɪ t ʊ m
r eː p uː d j a r ɛ	r ɛ p ʊ d j aː r ɛ
a r k ɪ b ɪ s k ʊ p ʊ m	a r kʰ ɪ ɛ p ɪ s k ɔ p ʊ m
k ɛ n t aʊ r j a m	k ɛ n t aʊ r eːa m
p ɛ r s w a d ɛ r ɛ	p ɛ r s w aː d eː r ɛ
b ʊ lː iː r ɛ	b ʊ lː iː r ɛ
f ʊ l g ʊ r aː r ɛ	f ʊ l g ʊ r aː r ɛ
eː lː eː g a n t ɛ m	eː l ɛ g a n t ɛ m
s t a t ʊ ɛ r ɛ	s t a t ʊ ɛ r ɛ
l iː n ɪ ʊ m	l iː n ɛu m
n iː n f a m	n y m pʰ a m
a m b ɔ s	a m b oː s
d iː s eː m iː n aː r ɛ	d ɪ sː eː m ɪ n aː r ɛ
f r aː s k ʊ m	f l a s k oː n ɛ m
k a l eː r ɛ	k a l eː r ɛ
n ʊ w iː l uː n j ʊ m	n ɔ w ɪ l uː n j ʊ m
r ʊ n k aː r	r h ɔ ŋ kʰ aː r ɛ
r eː k aː l k iː t r aː r ɛ	r ɛ k a l k ɪ t r aː r ɛ
s ʊ m ʊ m	s ʊ mː ʊ m
s a ŋ gʷ ɪ n oː s ʊ m	s a ŋ gʷ ɪ n oː s ʊ m
p a l aː r j ɛ m	p a l ɛ aː r j ʊ m
m ɪ n ʊ m r ɛ	m ɪ n oː r ɛ m
m a r a w ɪ l a m	m iː r aː b ɪ l ɛ m
w ʊ g aː r ɛ	w ɔ k aː r ɛ
l uː d iː b r j ʊ m	l uː d iː b r j ʊ m
p l a n ɛ t a m	p l a n eː t a m
l ɔ k a t j oː n ɛ	l ɔ k aː t j oː n ɛ m
p ɛ k ʊ r a m	p ɛ k ʊ s
f ʊ r n aː k j a m	f ɔ r n aː k ʊ l a m
m ɛ r iː t ʊ m	m ɛ r ɪ t ʊ m
r ɛ s t aː r ɛ	r ɛ s t aː r ɛ
f l uː w j ɪ aː l ɛ	f l ʊ w j aː l ɛ m
k ɔ n s ɛ r w aː r ɛ	k oː n s ɛ r w aː r ɛ
p l aː g j ʊ m	p l a g j ʊ m
w ɛ n d ɛ m j aː r ɛ	w iː n d eː m j aː r ɛ
m ɛ m ɔ b r aː r ɛ	m ɛ m ɔ r aː r ɛ
w eː n a ɔ r	w eː n aː t oː r ɛ m
g uː r a m ɛ n t ʊ m	j uː r aː m ɛ n t ʊ m
a k uː s aː b ɛ l ɛ	a kː uː s aː b ɪ l ɛ m
p ʊ l w eː r iː zː aː r ɛ	p ʊ l w ɛ r iː zː aː r ɛ
lː iː b ɛ lː ʊ m	l ɪ b ɛ lː ʊ m
w ɛ lː ʊ m	w ɪ lː ʊ m
n ɪ m b ʊ m	n ɪ m b ʊ m
a d uː n t ʊ m	a d j ʊ ŋ k t ʊ m
a d ɔ l ɛ s k ɛ n t a m	a d ʊ l eː s k ɛ n t j a m
s k r uː t a r ɛ	s k r uː t aː r ɛ
g a rː iː r ɛ	g a rː iː r ɛ
lː a r d ʊ	l a r d ʊ m
fː a s k iː n aː r ɛ	f a s k ɪ n aː r ɛ
ɔ p uː l ɛ n t ʊ m	ɔ p ʊ l ɛ n t ʊ m
p uː l w iː n a r ɛ	p ʊ l w iː n a r
t r a m s l a t j ʊ n ɛ m	t r aː n s l aː t j oː n ɛ m
t ɛ d uː lː a m	s kʰ ɛ d ʊ l a m
ɪ l ʊ m	h iː l ʊ m
p a r t iː r ɛ	p a r t iː r ɛ
t ɔ g a m	t ɔ g a m
s k ɔ r t a m	s k ɔ r t ɛ a m
f ɛ n eː s t r a m	f ɛ n ɛ s t r a m
ɛ k ɔ n d ʊ k ɛ r	k ɔ n d iː k ɛ r ɛ
s a k r iː l ɛ g ʊ m	s a k r ɪ l ɛ g ʊ m
n iː m j ʊ m	n ɪ m j ʊ m
f l ɛ k s j ʊ n ɛ m	f l ɛ k s j oː n ɛ m
t r a m s p ɔ r t aː r ɛ	t r aː n s p ɔ r t aː r ɛ
p a p aː r ɛ	p a pː aː r ɛ
a d k uː d ɪ k aː r ɛ	a d ɪ uː d ɪ k aː r ɛ
a r t ɛ m iː s j a m	a r t ɛ m ɪ s j a m
ɪ m p ɛ t r aː r ɛ	ɪ m p ɛ t r aː r ɛ
ɔ r aː r ɛ	oː r aː r ɛ
kʷ a l iː t aː t ɛ m	kʷ aː l ɪ t aː t ɛ m
t ʊ r p ɛ m	t ʊ r p ɛ m
s t a b ɪ l ɛ ɛ r ɛ	s t a b ɪ l iː r ɛ
m a t r ʊ n aː l	m aː t r oː n aː l ɛ m
eː n a rː a t j oː n ɛ m	eː n aː rː aː t j oː n ɛ m
d iː s t r ɪ k t ʊ m	d ɪ s t r ɪ k t ʊ m
k ʊ n t uː m aː k ɛ	k ɔ n t ʊ m aː k ɛ m
l iː b a r ɛ	l iː b aː r ɛ
s a m aː r ɛ	s aː n aː r ɛ
b aː j a m	b aː k a m
p r ɔ p r ʊ m	p r oː p r j ʊ m
d eː f ɔ r m a t j oː n ɛ	d eː f oː r m aː t j oː n ɛ m
d iː s ɔ n aː r ɛ	d ɪ sː ɔ n aː r ɛ
a p ɔ k a l iː p s ɛ m	a p ɔ k a l y p s ɛ m
k ʊ k ʊ m	s ɔ kː ʊ m
d eː s ɛ r t j ʊ n ɛ m	d eː s ɛ r t j oː n ɛ m
d iː s t ɔ r s j oː n ɛ m	d ɪ s t ɔ r t j oː n ɛ m
f iː d ʊ m	f iː d ʊ m
a w ʊ l	a w j a m
k ɔ n j uː g aː r ɛ	k ɔ n j ʊ g aː r ɛ
m a r g aː r iː t a m	m a r g a r iː t a m
ɛ k s k r eː t aː r	ɛ k s k ɛ r n ɛ r ɛ
n j ɛ b l m a m	n ɛ b ʊ l a m
p l aː k iː d ʊ m	p l a k ɪ d ʊ m
t j ɛ r t j ʊ m	t ɛ r t j ʊ m
n eː kʷ iː t j a m	n eː kʷ ɪ t j a m
w eː t ɛ r ɛ m	w ɛ t ɛ r ɛ m
f ʊ k a m	f iː d uː k j a m
a r ɪ oː lː ʊ m	h a r ɪ ɔ l ʊ m
p a r g ʊ n t aː r	p ɛ r k ɔ n t aː r iː
m a n uː b r j ʊ m	m a n uː b r j ʊ m
n uː k ɪ r ɛ	n ɔ k eː r ɛ
f ɛ s aː r ɛ	f a t eː r iː
r a m ʊ m	r aː m ʊ m
k ɔ n t ɛ s t aː r ɛ	k ɔ n t ɛ s t aː r iː
eː r ɛ d ɛ m	h eː r eː d ɛ m
t ɛ t r iː k ʊ m	t aɪ t r ɪ k ʊ m
ʊ ŋ t w oː ɛ m s ʊ m	uː ŋ k t ʊ oː s ʊ m
pʰ ɛ t aː r ɛ	f eː t aː r ɛ
t uː r b a m	t ʊ r b a m
d j a b oː l iː k ʊ m	d j a b ɔ l ɪ k ʊ m
aː s t a m	h a s t a m
l uː k r aː r ɛ	l ʊ k r aː r iː
s aː k r ʊ m	s a k r ʊ m
f uː n iː k ʊ l ʊ m	f uː n ɪ k ʊ l ʊ m
ɔ r b ɪ t ɛ	ɔ r b ɛ m
n ʊ m k ʊ	n uː n t j ʊ m
m ʊ r t aː r j ʊ m	m ɔ r t w aː r j ʊ m
s f ɪ m l w aː r	s iː b ɪ l aː r ɛ
l uː m ɪ n aː r j a m	l uː m ɪ n aː r ɛ
k a d aː w ɛ r ʊ	k a d aː w ɛ r
d eː m a n d aː r ɛ	d eː m a n d aː r ɛ
r uː k ʊ m	r oː s k ɪ d ʊ m
a l ɔ s	a l aʊ s a m
t aː ŋ g ɛ r ɛ m	t a ŋ g ɛ r ɛ
s kʷ a m a m	s kʷ aː m a m
a r kʷ ɛ r	a r gʷ ɛ r ɛ
p j ɛ n a	p aɪ aː n ɛ m
ʊ m m ɛ r iː d aː r ɛ	m ɛ r iː d j aː r ɛ
p l eː n ɪ t ɛ m	p l eː n ɪ t aː t ɛ m
d eː l uː b r ʊ m	d eː l uː b r ʊ m
eː t ɔ l ɔ g j a m	eː tʰ ɔ l ɔ g j a m
a fː ɛ m t ʊ m	a fː ɛ k t ʊ m
n a rː a t j ʊ m m	n aː rː aː t j oː n ɛ m
aː p ɪ k k ɛ m	a p ɪ k ɛ m
r a d j a t j oː n ɛ	r a d j aː t j oː n ɛ m
iː n k ɔ m s t a n t ɛ m	ɪ ŋ k oː n s t a n t ɛ m
s ʊ w ɛ n iː r ɛ	s ʊ b w ɛ n iː r ɛ
m aː p a m	m a pː a m
d iː g iː t aː r ɛ	d ɪ g ɪ t aː r ɛ
p r ɔ s ɛ n j ɔ m	p r ɔ s k eː n j ʊ m
ɔ w a m	uː w a m
eː j uː n ʊ	j eː j uː n j ʊ m
l a m a m	l aː m a m
r ɛ k l iː n aː r ɛ	r ɛ k l iː n aː r ɛ
l ɔ r iː k a m	l oː r iː k a m
k r eː m ɪ r ɛ	t r ɛ m ɛ r ɛ
r eː l uː k ɪ r ɛ	r ɛ l uː k eː r ɛ
s t j ɛ r k ʊ m l	s t ɛ r k ʊ s
d ɪ k ɪ m ʊ m	d ɛ k ɪ m ʊ m
w eː ɛ m m ɪ n t ɛ m	w ɛ h ɛ m ɛ n t ɛ m
uː r ʊ m	uː r ʊ m
r ɪ s ʊ m	r iː s ʊ m
s uː p uː t aː r ɛ	s ʊ pː ʊ t aː r ɛ
f ʊ n t ɛ m	f ɔ n t ɛ m
l eː t ʊ m	l eː k t ʊ m
w iː w aː k ɛ m	w iː w aː k ɛ m
w iː lː a n ʊ m	w iː lː aː n ʊ m
r eː f r iː g eː r a t j ʊ n ɛ m	r ɛ f r iː g ɛ r aː t j oː n ɛ m
r uː b r iː k a m	r ʊ b r iː k a m
iː n d ɪ ŋ n ʊ m	ɪ n d iː ŋ n ʊ m
d eː s t ɛ ŋ d ɛ r ɛ m	d eː s k ɛ n d ɛ r ɛ
f a b r iː k a t j ʊ n ɛ m	f aː b r ɪ k aː t j oː n ɛ m
k ɔ n d uː s ɪ r ɛ m	k ɔ n d uː k ɛ r ɛ
iː n f iː m ʊ m	iː n f ɪ m ʊ m
iː sː iː m ʊ m	ɪ sː ɪ m ʊ m
a k uː s aː r ɛ	a kː uː s aː r ɛ
kʷ aː s a r ɛ	kʷ a sː aː r ɛ
eː f iː k a t iː t aː	ɛ fː ɪ k aː k ɪ t aː t ɛ m
m a t r iː m oː n j ʊ m	m aː t r ɪ m oː n j ʊ m
g r aː n ʊ	g r aː n ʊ m
l uː k j ʊ m	l uː k j ʊ m
iː n k ɔ lː uː m ɛ m	ɪ ŋ k ɔ l ʊ m ɛ m
f eː k ʊ l ɛ n t ʊ m	f aɪ k ʊ l ɛ n t ʊ m
p a n ɪ k ʊ m	p aː n ɪ k j ʊ m
f l ʊ w aː	f l ʊ w j ʊ m
a b a l j iː eː n aː r ɛ	a b a l ɪ eː n aː r ɛ
iː m p r ɔ b iː t aː	ɪ m p r ɔ b ɪ t aː t ɛ m
l aʊ r ɛ k t ʊ m	l aʊ r ɛ aː t ʊ m
w eː s t iː t ʊ m	w ɛ s t iː t ʊ m
aː lː uː k ɛ	h a lː ʊ m
k ɔ m k uː s j ʊ m m	k ɔ ŋ k ʊ sː j oː n ɛ m
f lː ɔ s k uː lː ʊ m	f l ɔ s k ʊ l ʊ m
b oː s k ɛ m t	b ɔ s k ʊ m
a k eː r ɪ w ʊ m	a k ɛ r w ʊ m
iː n t ɛ r w ɛ n t j oː n	ɪ n t ɛ r w ɛ n t j oː n ɛ m
n aː w ɛ m	n aː w ɛ m
iː n s ɛ r t j oː n ɛ m	iː n s ɛ r t j oː n ɛ m
p a t r j a r s	p a t r j a r kʰ a m
p a r t iː k ʊ l a m	p a r t ɪ k ʊ l a m
m oː t ʊ	m ʊ tː ʊ m
r ɛ k l a m a t j ɛ m n	r eː k l aː m aː t j oː n ɛ m
k a w a l ɛ r	k a b a lː aː r j ʊ m
r eː p r ɛ ɛ n s iː b ɪ l ɛ	r ɛ p r ɛ h ɛ n s ɪ b ɪ l ɛ m
a d ʊ r ɪ m eː k eː r	a dː ɔ r m iː s k ɛ r ɛ
a s iː l ʊ m	a s y l ʊ m
g ɛ m a m	g ɛ mː a m
ɔ r ɛ k ʊ j a m	ɔ r ɪ k l a m
k ʊ m p r ɪ ɛ n s iː w ɛ l	k ɔ m p r ɛ h ɛ n s ɪ b ɪ l ɛ m
l a b ʊ r a t oː r ɛ	l a b oː r aː t oː r ɛ m
l a k r iː m oː s ʊ m	l a k r ɪ m oː s ʊ m
m aː l f aː t oː r ɛ	m a l ɛ f a k t oː r ɛ m
k ʊ m t r ɪ ɛ l aː r ɛ	k ɔ n t r ɪ b ʊ l aː r ɛ
s aː r g ʊ m	s a r g ʊ m
p a r ɔ n ɔ m aː s j a m	p a r ɔ n ɔ m a s j a m
p a r t ʊ r ɛ m	p a r t ʊ r iː r ɛ
d eː r iː s w oː r ʊ	d eː r iː s oː r j ʊ m
s ɔ lː ɪ t uː r ɛ	s oː l ɪ t uː d ɪ n ɛ m
r eː d a m	t aɪ d a m
m uː n iː t j ʊ m m	m uː n iː t j oː n ɛ m
l a k uː s t r ɛ m	l a k ʊ s t r ɛ m
aː b iː l ɛ	h a b ɪ l ɛ m
t r ɪ b ʊ l ʊ m	t r ɪ b ʊ l ʊ m
s eː r ɔ t iː n ʊ m	s eː r oː t ɪ n ʊ m
ʊ k s w ɛ m	uː ŋ k t j oː n ɛ m
l ɛ ɪ t ʊ m	l aɪ t ʊ m
ɛ k s a s p eː r a t j oː n ɛ m	ɛ k s a s p ɛ r aː t j oː n ɛ m
p r eː n ʊ m	p r aɪ ŋ n aː t ɛ m
s k ʊ r s ʊ m	ɛ k s k ʊ r s ʊ m
d eː g uː s t aː r ɛ	d eː g ʊ s t aː r ɛ
k ɔ m p l a k ɛ r ɛ	k ɔ m p l a k eː r ɛ
k a n a m	k a nː a m
m ɛ r g ɛ r ɛ	m ɛ r g ɛ r ɛ
d iː k t a m ɛ n	d ɪ k t aː m ɛ n
ɔ s aː r j ʊ m	ɔ sː aː r j ʊ m
a d iː r	a dː ɛ r ɛ
a f j a n k aː r	a fː ɪ d ɛ n t j aː r ɛ
iː m p eː r a t oː r j ʊ m	ɪ m p ɛ r aː t oː r j ʊ m
m ɪ s t uː r a m	m ɪ s t uː r a m
k a k aː r ɛ	k a p t j aː r ɛ
s p uː r j ʊ m	s p ʊ r j ʊ m
t ɛ m p ɛ r j eː ɛ	t ɛ m p ɛ r ɪ ɛ m
iː m p r ʊ b aː r	ɪ m p r ɔ b aː r ɛ
iː m mː uː n ɛ m	ɪ mː uː n ɛ m
k l a m oː r ɛ	k l aː m oː r ɛ m
k a p ɛ lː ʊ m	k a p ɪ lː ʊ m
eː l uː d ɛ r ɛ	eː l uː d ɛ r ɛ
k eː n ʊ m	k ɪ nː ʊ m
m a t r iː k iː d j ʊ m	m aː t r ɪ k iː d j ʊ m
l a ŋ g oː r ɛ m	l a ŋ gʷ oː r ɛ m
w ɛ n t iː l a t j oː n ɛ	w ɛ n t ɪ l aː t j oː n ɛ m
d ɪ s t ɔ r kʷ ɛ r ɛ m	d ɪ s t ɔ r kʷ eː r ɛ
b a s ɛ m	b a s ɛ m
m ʊ l aː r ɛ	m ɔ lː iː r ɛ
g ɔ d eː r ɛ	g aʊ d eː r ɛ
l uː k s ʊ m	l uː k s ʊ m
p r eː k ɔ n ʊ s k ɛ r ɛ	p r aɪ k ɔ ŋ n ɔ s k ɛ r ɛ
f l oː r iː d ʊ m	f l oː r ɪ d ʊ m
d ɪ s p ɛ r s ɛ r ɛ	d ɪ s p ɛ r g ɛ r ɛ
r ɔ ɪ b j a m	r ʊ b j a m
