ɔ r iː g ɪ n aː r j ʊ m	ɔ r iː g ɪ n aː r j ʊ m
f eː r j a m	f eː r j aː s
g eː r m aː n ʊ m	g ɛ r m aː n ʊ m
l uː b r ɪ k aː r ɛ	l uː b r ɪ k aː r ɛ
ɪ n d ɛ f ɪ n ɪ t ʊ m	ɪ n d eː f iː n iː t ʊ m
f uː g aː k ɛ	f ʊ g aː k ɛ m
t ɪ t iː lː a m r ɛ	t iː t ɪ lː aː r ɛ
f r iː k t j oː n ɛ	f r ɪ k t j oː n ɛ m
k l aː m oː r ɛ	k l aː m oː r ɛ m
r a n ʊ k a m l ʊ m	r aː n ʊ ŋ k ʊ l ʊ m
k ɔ g ʊ l ʊ m	k ʊ k ʊ lː ʊ m
ɪ n t iː m aː t j oː n ɛ m	ɪ n t ɪ m aː t j oː n ɛ m
d uː k aː t ʊ m	d ʊ k aː t ʊ m
r ɔ rː ɪ r iː aː	r oː r ɛ m
p ɔ r t aː r ɛ	p ɔ r t aː r ɛ
p ɛ r t iː sː a m	p ɛ r t ɪ k a m
k iː n t ʊ m	k ɪ ŋ k t ʊ m
ɔ n oː r ɛ m	h ɔ n oː r ɛ m
s uː b iː r ɛ	s ʊ b iː r ɛ
p ɪ p ɔ n j a m	p aɪ oː n j a m
ɪ m p r oː b ɪ t aː t ɛ m	ɪ m p r ɔ b ɪ t aː t ɛ m
k ɪ r k ʊ n s k r ɪ b ɛ r ɛ m	k ɪ r k ʊ m s k r iː b ɛ r ɛ
d ɪ s ɛ r t ʊ m	d ɪ s ɛ r t ʊ m
f ɔ r m oː s ʊ m	f oː r m oː s ʊ m
d ʊ b l ʊ m	d ʊ p l ʊ m
p r aɪ p oː s t eː r ʊ m	p r aɪ p ɔ s t ɛ r ʊ m
j eː j uː n ʊ m	j eː j uː n j ʊ m
p a p ɛ lː ʊ m	p a p y r ʊ m
eː l iː m ɪ n aː r ɛ	eː l iː m ɪ n aː r ɛ
s ɔ m a m	s ʊ mː a m
t ɛ d a m	t aɪ d a m
r ɔ k ʊ m	r aʊ k ʊ m
p eː r k ɔ rː ɛ r ɛ	p ɛ r k ʊ rː ɛ r ɛ
d ɪ fː ɛ r iː r ɛ	d ɪ fː ɛ rː ɛ
a d j uː k n g ɛ r ɛ	a d j ʊ ŋ g ɛ r ɛ
s a l aː t ɪ t aː t ɛ m	s a l aː k ɪ t aː t ɛ m
k ɔ n s ɪ ŋ n aː t j oː n ɛ m	k oː n s ɪ ŋ n aː t j oː n ɛ m
k r iː w m ʊ m	k r iː b r ʊ m
a l t ɛ r k aː t j ɛ n ɛ	a l t ɛ r k aː t j oː n ɛ m
k aː r m ɪ n aː r ɛ	k a r m ɪ n aː r ɛ
ɪ n s iː n w a m r ɛ	iː n s ɪ n w aː r ɛ
ɔ b l a m t j oː n ɛ m	ɔ b l aː t j oː n ɛ m
a n w ʊ m	a nː ʊː m
l ʊ k ɛ lː ʊ m	l ɔ k ɛ lː ʊ m
s ɛ k s w aː l ɪ t aː t ɛ m	s ɛ k s w aː l ɪ t aː t ɛ m
p ɛ k uː n j aː r j ʊ m	p ɛ k uː n j aː r j ʊ m
r ɛ t iː n aː k ʊ l ʊ m	r ɛ t ɪ n aː k ʊ l ʊ m
k ɔ n w oː k aː t j oː n ɛ m	k ɔ n w ɔ k aː t j oː n ɛ m
l aʊ d ɛ m	l aʊ d ɛ m
a s	a sː ɛ m
f ɛ rː aː t ʊ m	f ɛ rː aː t ʊ m
a m b aː pʰ ɛ s	a m b aː g ɛ m
k ɔ t ɛ n	k oː t ɛ m
p ɛ n ɛ t r ɛ m aː r	p ɛ n ɛ t r aː r ɛ
k r a p ʊ l m a m	k r aː p ʊ l a m
b a j uː k l ʊ m	b aː j ʊ l ʊ m
p r ɛ d j aː l ɛ	p r aɪ d j aː l ɛ m
a b iː g ɪ ʊ m	a b ɪ g ɛu m
a k ʊ m p l ɛ r ɛ m ɛ	k ɔ m p l eː r ɛ
w ɛ r m ɪ n oː s ʊ m	w ɛ r m ɪ n oː s ʊ m
d ɪ s k r eː t j oː n ɛ	d ɪ s k r eː t j oː n ɛ m
k ɔ n t r ɛ aː w ɛ n ɪ r	k ɔ n t r aː w ɛ n iː r ɛ
r aː a m	r a j a m
m ɛ d iː r	m eː t iː r iː
r ɛ t ɛ t a m	r ɛ k ɛ p t a m
d ɔ r m iː t ʊ r j ʊ m	d ɔ r m iː t oː r j ʊ m
k ɛ s aː t j oː n ɛ m	k ɛ sː aː t j oː n ɛ m
d ɔ m ɪ n ɪ k aː l ɛ	d ɔ m ɪ n ɪ k aː l ɛ m
s ʊ l j ʊ m	s ɔ l j ʊ m
a n t iː s t ɛ t ɛ	a n t ɪ s t ɪ t ɛ m
w ɛ s t ɪ t ʊ m	w ɛ s t iː t ʊ m
a fː ɪ r m aː t j oː n ɛ m	a fː ɪ r m aː t j oː n ɛ m
k ɔ n s ʊ m aː t j oː n ɛ m	k oː n s ʊ mː aː t j oː n ɛ m
l ɔ k uː t j ʊ m n ɛ m	l ɔ k uː t j oː n ɛ m
d eː g r aː d aː t j oː n ɛ m	d eː g r a d aː t j oː n ɛ m
a s p ɛ r s j oː n ɛ m	a s p ɛ r s j oː n ɛ m
f k iː m b r j aː t ʊ m	f ɪ m b r j aː t ʊ m
ɔ pː r ɔ b r j ʊ m	ɔ pː r ɔ b r j ʊ m
s ɔ n ɔ r ʊ m	s ɔ n oː r ʊ m
l aʊ r j oː r	aʊ r ɛ ɔ l ʊ m
s uː t uː r a m	s uː t uː r a m
p eː n d ɛ r ɛ	p ɛ n d eː r ɛ
k a t ɪ n ʊ m	k a t iː n ʊ m
w ɪ s iː b ɪ l ɛ t aː t ɛ	w iː s ɪ b ɪ l ɪ t aː t ɛ m
a d iː r	a dː ɛ r ɛ
ɪ n s ʊ m r ɛ ɪ a r ɛ	iː n s ɛ kʷ iː
t r ɔ n ʊ m	tʰ r ɔ n ʊ m
l f ɪ r ʊ m n	g l iː r ɛ m
d ɛ r ʊ m p ɛ r ɛ	d iː r ʊ m p ɛ r ɛ
f ɛ r uː l aː	f ɛ r ʊ l a m
l a gː b r uː s k a m	l aː b r ʊ s k a m
g ɛ r m aː n ɪ k ʊ m	g ɛ r m aː n ɪ k ʊ m
n uː t aː r	n uː t aː r ɛ
p a t r j a m	p a t r j a m
s ɛ gː aː l aː	s ɛ k aː l ɛ
a g r ɛ gʷ aː t j oː n ɛ m	a gː r ɛ g a t j oː n ɛ m
ɛ k s t aː s iː s	ɛ k s t a s ɛ m
ɔ p ɛ r aː r ɛ	ɔ p ɛ r aː r iː
p r ɛ m ɛ r ɛ	p r ɛ m ɛ r ɛ
s ɛ m p ɪ t ɛ r n ʊ m	s ɛ m p ɪ t ɛ r n ʊ m
r ɔ t aː r ɛ	r ɔ t aː r ɛ
p a r t ɪ r ɛ	p a r t iː r ɛ
ʊ r lː aː r ɛ	ʊ l ʊ l aː r ɛ
a r k aː n ʊ m	a r k a n ʊ m
p ɔ pː a m	p ʊ pː ɛ m
g r aː b aː t ʊ m	g r a b aː t ʊ m
a d ɔ r m ɛ t ɛ r	a dː ɔ r m iː s k ɛ r ɛ
ɪ n w ɛ r t ɛ r ɛ	ɪ n w ɛ r t ɛ r ɛ
a b s oː l ʊ t j oː n ɛ m	a b s ɔ l uː t j oː n ɛ m
k ɔ n k l aː m a m r ɛ	k ɔ ŋ k l aː m aː r ɛ
d ɪ s w aː d ɛ r ɛ	d ɪ sː w aː d eː r ɛ
s aː k j aː r	s a t j aː r ɛ
b ɔ t uː l iː n ʊ m	b ɔ t ʊ l ʊ m
a kː uː s aː t j oː n ɛ	a kː uː s aː t j oː n ɛ m
k iː m b aː l ʊ m	k y m b a l ʊ m
ɪ m p ɛ r aː t ʊ r j ʊ m	ɪ m p ɛ r aː t oː r j ʊ m
s uː d aː r j ʊ m	s uː d aː r j ʊ m
p aː r w ɛ m n ɪ r ɛ	p ɛ r w ɛ n iː r ɛ
w ɛ r t ɪ g ɛ n ɛ	w ɛ r t iː g ɪ n ɛ m
t ɛ r t j ʊ m	t ɛ r t j ʊ m
ɛ t ʊ m	eː t ʊ m
m ɛ d iː t ɪ rː a n ɛ ʊ m	m ɛ d ɪ t ɛ rː aː n ɛu m
r ɛ k ɛ p t a m t oː r ɛ	r ɛ k ɛ p t aː t oː r ɛ m
d eː p r ɪ m ɛ r ɛ	d eː p r ɪ m ɛ r ɛ
b ɛ t ʊ l a m	b ɛ t ʊ l a m
l uː m iː n aː r j a m	l uː m ɪ n aː r ɛ
ʊ k s oː r ɪ k ɪ d j ʊ m	ʊ k s oː r ɪ k iː d j ʊ m
w iː n kʷ ɛ r ɛ	w ɪ ŋ k ɛ r ɛ
f l ɔ r ɪ r ɛ	f l oː r eː r ɛ
t r iː b uː t ʊ m	t r ɪ b uː t ʊ m
k ɔ n d ɔ l eː r iː	k ɔ n d ɔ l eː r ɛ
f ɛ t ʊ m	f ɪ l ɪ k t ʊ m
l ɛ k t ɪ k a m	l ɛ k t iː k a m
s ɔ ŋ n a m	z oː n a m
s p eː l j ʊ m	s p ɛ k l ʊ m
t ɔ r ʊ w ɪ s k ʊ m	t ʊ r b ɪ s k ʊ m
d ɪ fː ʊ n d ɛ r ɛ	d ɪ fː ʊ n d ɛ r ɛ
b ɪ s k a m	b eː s t j a m
b a l n ɛ aː r j ʊ m	b a l n ɛ aː r j ʊ m
l ɪ b ɛ l ʊ m	l ɪ b ɛ lː ʊ m
k a s t r aː t ʊ m	k a s t r aː t ʊ m
p ʊ t r ɛ m	p ʊ t r ɛ m
k a l w ɪ r	k a l w iː
d eː l aː t j ʊ m n ɛ m	d eː l aː t j oː n ɛ m
f ɛ r w ɛ r ɛ	f ɛ r w eː r ɛ
p r ɔ b ʊ m	p r ɔ b ʊ m
m iː g r aː r ɛ	m ɪ g r aː r ɛ
ɪ n f iː m ʊ m	iː n f ɪ m ʊ m
p r ɔ p aː g aː t j oː n ɛ m	p r oː p aː g aː t j oː n ɛ m
k ɔ n s oː l aː t j oː n ɛ m	k oː n s oː l aː t j oː n ɛ m
ɔ s t ɛ n t aː r ɛ	ɔ s t ɛ n t aː r ɛ
ʊ m iː l j a m t j oː n ɛ m	h ʊ m ɪ l j aː t j oː n ɛ m
s t ɛ l aː r	s t eː lː aː r ɛ m
n ʊ n k ʊ m	n uː n t j ʊ m
k aɪ ɪ t ʊ d ɛ m	kʷ ɪ eː t uː d ɪ n ɛ m
k r oː m t aː r	k r ʊ s t aː r ɛ
p ɛ r s ɛ k uː t oː r ɛ	p ɛ r s ɛ k uː t oː r ɛ m
f uː l k r ʊ m	f ʊ l k r ʊ m
f uː ɪ n a m	f aː g ɪ n ʊ m
p a k iː f ɪ k aː t j oː n ɛ m	p aː k ɪ f ɪ k aː t j oː n ɛ m
ɛ l ɛ k aː n t ɛ m	eː l ɛ g a n t ɛ m
k ʊ k ʊ m	k ɔ kʷ ʊ m
p r ɔ k aː k ɛ	p r ɔ k aː k ɛ m
ɪ n d uː r aː r ɛ	ɪ n d uː r aː r ɛ
f eː n d ɛ r ɛ	f ɪ n d ɛ r ɛ
n eː g aː r ɛ	n ɛ g aː r ɛ
l eː t ɛ r a m	l ɪ tː ɛ r a m
s ʊ g j ɛ t ʊ m	s ʊ b ɪ ɛ k t ʊ m
f uː n ɛ r ɛ ʊ m	f uː n ɛ r ɛu m
k ɔ m p l ɛ t ɪ w ʊ m	k ɔ m p l eː t iː w ʊ m
eː n ɛ r w aː r	eː n ɛ r w aː r ɛ
f aɪ d aː r aː	f ɪ d ɛ m
ɔ d oː r ɛ	ɔ d oː r ɛ m
kʷ a d r aː r ɛ	kʷ aː d r aː r ɛ
d ɪ s p oː r ɛ	d ɪ s p oː n ɛ r ɛ
l a m ɛ n t ʊ m	l aː m ɛ n t ʊ m
r ɛ p r ɛ n d ɛ r ɛ	r ɛ p r ɛ h ɛ n d ɛ r ɛ
k ɔ n ʊ	k oː n ʊ m
l uː m iː n aː r ɛ	l uː m ɪ n aː r ɛ
d ɪ f l ʊ ɛ r	d ɪ fː l ʊ ɛ r ɛ
ʊ w aː	uː w a m
k ɛ r t ʊ m	k ɛ r t ʊ m
s k oː l ʊ m	s k ɔ p ʊ l ʊ m
s ɔ l ɛ r ɛ	s ɔ l eː r ɛ
k ɪ d j ʊ m	k iː d j ʊ m
f a w oː r ɛ	f a w oː r ɛ m
g ɛ l ʊ m	g ɛ l uː
ɪ n s uː l s ʊ m	iː n s ʊ l s ʊ m
k ɔ n w ɛ m n iː r ɛ	k ɔ n w ɛ n iː r ɛ
f r ɛ n aː r ɛ	f r eː n aː r ɛ
d ɪ w ɛ r t ɪ r ɛ	d iː w ɛ r t ɛ r ɛ
w ɪ t r ʊ m	w ɪ t r ʊ m
w ɛ r s ɪ k ʊ l ʊ m	w ɛ r s ɪ k ʊ l ʊ m
a l ɛ a m	aː l ɛ m
p r oː w aː	p r oː r a m
p a l ɛ s t r a m	p a l aɪ s t r a m
h k ɪ	kʷ ɛ m
w eː g r t a m	w ɪ r ɪ d ɛ m
a w ɪ n ɪ r ɛ	a d w ɛ n iː r ɛ
k ɔ m ɛ m ɔ r aː t j oː n ɛ m	k ɔ mː ɛ m ɔ r aː t j oː n ɛ m
b ɛ l r ɛ aː r j a m	b eː l w a m
l a ŋ gʷ ɪ d ʊ m	l a ŋ gʷ ɪ d ʊ m
l a n oː s ʊ m	l aː n oː s ʊ m
p a l p ɛ b r a m	p a l p ɛ b r a m
j uː ɛ g r iː l a m r ɛ	j ʊ g ʊ l aː r ɛ
m a l s k aː r ɛ	m a l ɛ f a k ɛ r ɛ
n ɛ f aː r j ʊ m	n ɛ f aː r j ʊ m
b uː b ɪ r ɛ ʊ m	b uː t y r ʊ m
a t r ʊ m	aː t r ʊ m
d ɪ l uː ɪ r ɛ	d iː l ʊ ɛ r ɛ
k a n s aː r ɛ	k a m p s aː r ɛ
a l t aː r ɛ	a l t a r ɛ m
d ɛ r iː s oː r j ʊ m	d eː r iː s oː r j ʊ m
k ɔ m p ʊ n k t j oː n ɛ m	k ɔ m p ʊ ŋ k t j oː n ɛ m
a m ɔ w ɪ b ɪ l ɛ	aː m ɔ w eː r ɛ
l a b y r a m t oː r ɛ	l a b oː r aː t oː r ɛ m
s k oː l oː p ɛ n d r a m	s k ɔ l ɔ p ɛ n d r a m
n ɪ k r ɛ t ɛ r	n ɪ g r eː s k ɛ r ɛ
m uː s iː t aː r ɛ	m ʊ sː ɪ t aː r ɛ
t r aː n s k r ɪ b ɛ r ɛ	t r aː n s k r iː b ɛ r ɛ
a n ɛ m oː n ɛ	a n ɛ m oː n eː n
aɪ kʷ ʊ m	aɪ kʷ ʊ m
d ɔ l ʊ r oː s ʊ m	d ɔ l oː r oː s ʊ m
g l ɔ r j ʊ m s ɪ sː ɪ m oː	g l oː r j oː s ɪ sː ɪ m ʊ m
l a m a m	l aː m a m
m ɔ r t aː l ɪ t aː t ɛ m	m ɔ r t aː l ɪ t aː t ɛ m
oː b b j ʊ m	ɔ b w j ʊ m
m ɛ r iː t ɛ r ɛ	m ɛ r eː r ɛ
m ɛ r g eː r ɛ	m ɛ r g ɛ r ɛ
w ɪ t ɛ	w iː t ɛ m
t ɛ l a m	t eː l a m
t ɔ r t ʊ m	t ɔ r t ʊ m
k ɔ n t ɛ s t aː r ɛ	k ɔ n t ɛ s t aː r iː
r a s t r ɛ ɛ lː ʊ m	r aː s t ɛ lː ʊ m
l uː k s ʊ m	l uː k s ʊ m
a d uː l t eː r aː r ɛ	a d ʊ l t ɛ r aː r ɛ
aɪ r uː g ɪ n oː s ʊ m	aɪ r uː g ɪ n oː s ʊ m
k ɔ rː oː s j oː n ɛ	k ɔ rː oː s j oː n ɛ m
s kʰ ɪ j n t ɪ pʰ ɪ k ʊ m	s k ɪ ɛ n t ɪ f ɪ k ʊ m
m a ŋ n ɛ s j ʊ m	m a ŋ n eː s j ʊ m
ɪ f ɪ k a m r ɛ	ɪ f ɪ k aː r ɛ
l ʊ n t r a m	l ʊ t r a m
w ɛ n ɛ r aː r ɛ	w ɛ n ɛ r aː r iː
r ɛ k uː s aː r ɛ	r ɛ k uː s aː r ɛ
eː l iː m ɪ n a m t j oː n ɛ m	eː l ɪ m ɪ n aː t j oː n ɛ m
a r g iː iː w ɛ	a gː ɛ r ɛ m
k a l ɪ n d a m s	k a l ɛ n d aː s
ɛ k s ɛ kʷ uː r ɛ r ɛ	ɛ k sː ɛ kʷ iː
l ɪ m ʊ m	l iː m ʊ m
ɔ k t aː w ʊ m	ɔ k t aː w ʊ m
m ɛ t r ɪ m ʊ m	m ɛ t r ʊ m
p r ɛ m ɪ k j a m	p r iː m ɪ t j a m
b ɛ nː j ʊ m	b ɪ ɛ nː j ʊ m
g ɔ n f a m l ɛ ɛ	k oː n f l aː r ɛ
p r ɔ k r aː s t ɪ n aː r ɛ	p r oː k r aː s t ɪ n aː r ɛ
ɪ fː ɛ r w ɛ t ɛ r	ɛ fː ɛ r w eː s k ɛ r ɛ
aʊ l aː	aʊ l a m
a b ɔ l ɪ t j oː n ɛ m	a b ɔ l ɪ t j oː n ɛ m
w ɛ r t ɪ t ɛ m	w ɛ r t ɪ k ɛ m
d ɛ s t ɪ n aː r ɛ	d eː s t ɪ n aː r ɛ
r aː s ɛ k aː r ɛ	r ɛ s ɛ k aː r ɛ
l uː d iː b r j ʊ m	l uː d iː b r j ʊ m
t r aː n s ɪ g ɛ r	t r aː n s ɪ g ɛ r ɛ
s t r ɛ n w ʊ m	s t r eː n ʊː m
n ɛ r w oː s ʊ m	n ɛ r w oː s ʊ m
m ɔ s t r aː r ɛ	m oː n s t r aː r ɛ
a r b ʊ s t ɪ w ʊ m	a r b ʊ s t iː w ʊ m
a k ɛ f aː lː ʊ m	a k ɛ pʰ a l ʊ m
f l ɛ k t ɛ r ɛ	f l ɛ k t ɛ r ɛ
w ʊ l p ɪ n ʊ m	w ʊ l p iː n ʊ m
s y s ʊ m	s ɛ sː ʊ m
p uː k w ɛ r j n n	w eː r
k ɪ ɔ n kʷ ɛ k	kʷ ɛ m k ʊ m kʷ ɛ
f ɔ r n ɪ k s ɛ m	f ɔ r n ɪ k ɛ m
ɔ r ɪ ɛ n t ɛ m	ɔ r ɪ ɛ n t ɛ m
l a k aː r ɛ	l a sː aː r ɛ
ɪ k ʊ m	ɪ k ʊ m
ɛ k s kʰ l ʊ ɛ r ɛ	ɛ k s k l uː d ɛ r ɛ
a gː r ɛ g aː r ɛ	a gː r ɛ g aː r ɛ
p r ɔ w eː n t ʊ m	p r oː w ɛ n t ʊ m
k ɔ n t ɛ n d eː r ɛ	k ɔ n t ɛ n d ɛ r ɛ
l ɪ b r ʊ m	l iː b ɛ r ʊ m
f r uː s t a m	f r ʊ s t a m
a kʰ r ɛ s t ɛ m	a g r ɛ s t ɛ m
l ɔ m b ʊ m	l ʊ m b ʊ m
m a r ɪ t aː r ɛ	m a r iː t aː r ɛ
f ɛ r m ɛ m n t ʊ m	f ɛ r m ɛ n t ʊ m
t ʊ d ɛ r ɛ	t ɔ n d eː r ɛ
w ɪ ɪ n a m	w iː k iː n a m
m ɛ d aː r aː	m eː n s ɛ m
p ʊ ɛ l ʊ m b aː r j ʊ m	p a l ʊ m b aː r j ʊ m
k ɛ f aː l ɛ m aː	k ɛ pʰ a l aɪ a m
r a k eː m ʊ m	r a k eː m ʊ m
s a m b ʊ k ʊ m	s a m b uː k ʊ m
p uː b ɛ	p uː b ɛ r ɛ m
k l a s ʊ lː a m	k l aʊ s ʊ l a m
g ɛ t aː r ɛ	j a k t aː r ɛ
a s ɛ a m	a s k ɛ lː a m
ɪ n kʷ iː n aː r ɛ	ɪ ŋ kʷ ɪ n aː r ɛ
a d m oː n ɪ t j oː n ɛ m	a d m ɔ n ɪ t j oː n ɛ m
a l w ɛ r ʊ m	a l b aː r j ʊ m
p ɪ n t aː r ɛ	p ɪ ŋ g ɛ r ɛ
ɪ n k aː r n aː t j ɛ n ɛ	ɪ ŋ k a r n aː t j oː n ɛ m
l ɔ ŋ g ɛ w ʊ m	l ɔ ŋ g aɪ w ʊ m
d ɛ s t r ʊ t j oː n j oː n ɛ m	d eː s t r ʊ k t j oː n ɛ m
a tː r aː b ɪ l j aː r j ʊ m	aː t r a b iː l aː r j ʊ m
g uː b aː s	j ʊ b a m
ʊ k s w oː	uː ŋ k t j oː n ɛ m
a d w ɛ r b j aː l ɛ	a d w ɛ r b j aː l ɛ m
ɪ n kʷ j eː t uː d iː n ɛ	ɪ ŋ kʷ ɪ eː t uː d ɪ n ɛ m
m ɛ s uː r aː r ɛ	m eː n s uː r aː r ɛ
f ɛ s t ɪ w ʊ m	f ɛ s t iː w ʊ m
f ɛ ɛu m d ʊ m	f ɛu d ʊ m
b a p t ɪ s t ɛ r j ʊ m	b a p t ɪ s t eː r j ʊ m
k ɛ s aː r ɛ	k ɛ sː aː r ɛ
w ɛ lː ʊ r ʊ m ʊ m	w ɪ lː oː s ʊ m
k ɔ n k ʊ r s ʊ m	k ɔ ŋ k ʊ r s ʊ m
t ɔ l p y n ʊ m a m	t a l p a m
ɛ k s t ɛ n d ɛ r ɛ	ɛ k s t ɛ n d ɛ r ɛ
a tː r aː ɪ r ɛ	a tː r a h ɛ r ɛ
s ɛ n ɛ k t uː t ɛ	s ɛ n ɛ k t ʊ m
d ɪ ŋ n aː r ɛ	d ɪ ŋ n aː r ɛ
w ʊ l g ʊ m	w ʊ l g ʊ s
r a d ɪ k ɪ n ɛ m	r aː d iː k ɛ m
w a k uː ɪ t aː t ɛ m	w a k ʊ ɪ t aː t ɛ m
n ɛ g ɔ t j ʊ m	n ɛ g oː t j ʊ m
s p ʊ r k ʊ m	s p ʊ r k ʊ m
l a d r ɪ l ʊ m	l a t ɛ r k ʊ l ʊ m
m a l ɛ	m a l ʊ m
ɪ m p iː n g ɛ r ɛ	ɪ m p ɪ ŋ g ɛ r ɛ
eː kʷ iː l ɪ b r j ʊ m	aɪ kʷ ɪ l iː b r j ʊ m
l a t iː t ʊ d ɪ n ɛ m	l aː t ɪ t uː d ɪ n ɛ m
k ɔ n ɛ k s j oː n ɛ m	k ɔ nː ɛ k s j oː n ɛ m
p ɪ p aː r ɛ	p iː p aː r ɛ
k uː rː iː k ʊ l ʊ m	k ʊ rː ɪ k ʊ l ʊ m
s a g ɪ t aː r j ʊ m	s a g ɪ tː aː r j ʊ m
p r aɪ k ɪ p ɪ t j ʊ m	p r aɪ k ɪ p ɪ t j ʊ m
w ɛ l a m	w eː l ʊ m
eː m ɛ r g ɛ r ɛ	eː m ɛ r g ɛ r ɛ
r ɛ h ɔ s ɪ n a m r ɛ	r ɛ s ɪ ŋ n aː r ɛ
r a s ɔ n aː b ɪ l ɛ	r a t j oː n aː b ɪ l ɛ m
k a r ɛ t ɛ r	k a r eː r ɛ
r ɛ f ɔ r m aː r ɛ	r ɛ f oː r m aː r ɛ
p ɛ t ʊ m	p eː d ɪ t ʊ m
ɔ r iː ʊ n d ʊ m	ɔ r j ʊ n d ʊ m
r ɛ t j aː r j ʊ m	r eː t j aː r j ʊ m
l ɪ n t aː r n a m	l a n t ɛ r n a m
p ɔ r n oː g r aː f j aː m	p ɔ r n ɔ g r a pʰ j a m
a nː aɪ l ʊ m	a nː ɪ k ʊ l ʊ m
a d m oː n ɪ s t aː r ɛ	a d m ɔ n eː r ɛ
g ɔ r t ʊ m	g ʊ r d ʊ m
k ɔ r t ɛ	k ɔ h ɔ r t ɛ m
a kː r iː t ʊ t ɛ	aː k r ɪ t uː d ɪ n ɛ m
r ɛ k ɛ d ɛ r ɛ	r ɛ k eː d ɛ r ɛ
a l s a m	a s k j a m
p ɛ r n ɪ k j oː s ʊ m	p ɛ r n ɪ k j oː s ʊ m
f ɪ n k ʊ j ʊ m m	f eː n ʊ k ʊ l ʊ m
t ɔ r t ɪ l ɛ	t ɔ r t ɪ l ɛ m
a k k ɛ s ʊ m	a kː ɛ sː ʊ m
f a l d ɪ s t oː r j ʊ m	f a l d ɪ s t oː l j ʊ m
a n uː lː aː r ɛ	a nː uː lː aː r ɛ
a b r oː g aː r ɛ	a b r ɔ g aː r ɛ
t ʊ m	t ʊː m
p r a ŋ d s ʊ m	p r a n d j ʊ m
d ɛ p ɛ r d ɪ t j ʊ m n ɛ m	d eː p ɛ r d ɪ t j oː n ɛ m
w ɛ t uː s t ʊ m	w ɛ t ʊ s t ʊ m
n uː t ʊ m	n uː t ʊ m
k r ɔ t aː l ʊ m	k r ɔ t a l ʊ m
ɔ b n uː b ɪ l a m r ɛ	ɔ b n uː b ɪ l aː r ɛ
p a m p aː r ʊ m ʊ m	p a m p ɪ n ʊ m
ʊ s uː r a m	uː s uː r a m
ɪ n w ɔ l w ɛ r ɛ	ɪ n w ɔ l w ɛ r ɛ
p r ɔ w ɛ m n ɪ r ɛ	p r oː w ɛ n iː r ɛ
n a w ɛ	n aː w ɛ m
s h k oː l aː r ɛ	s kʰ ɔ l aː r ɛ m
m ɪ r aː k ʊ m l ʊ m	m iː r aː k ʊ l ʊ m
r ɛ n aː r ɛ	r eː ŋ n aː r ɛ
p r aɪ t ɛ r ɪ r	p r aɪ t ɛ r iː r ɛ
p a d r ɛ	p a t r ɛ m
t uː m iː d ʊ m	t ʊ m ɪ d ʊ m
g r aː n ʊ m	g r aː n ʊ m
s t uː d j ʊ m	s t ʊ d j ʊ m
eː ŋ w aː n ɛ t iː r ɛ	eː w aː n eː s k ɛ r ɛ
w ɛ n t ʊ m	w ɛ n t ʊ m
s aɪ d aː r aː	s aɪ t a m
t aː k ɛ r ɛ	t a k eː r ɛ
k ɔ n k ʊ l k aː r ɛ	k ɔ ŋ k ʊ l k aː r ɛ
d eː w oː l w ɛ r ɛ	d eː w ɔ l w ɛ r ɛ
ɪ r a t ʊ m	iː r aː t ʊ m
b a s iː l ɪ k a m	b a s ɪ l ɪ k a m
p r ɛ w j ʊ m	p r aɪ w j ʊ m
a k ɛ r b ʊ m	a k ɛ r b ʊ m
t ɛ r m iː t ɛ m	t a r m ɪ t ɛ m
s ʊ m iː t n ʊ m t ɛ m	s ʊ mː ɪ t aː t ɛ m
l ɛ n aː r	l ɪ ŋ n aː r iː
d ɪ s ɛ k aː r ɛ	d ɪ sː ɛ k aː r ɛ
s k r ʊ t a m r ɛ	s k r uː t aː r ɛ
eː l iː d ɛ r ɛ	eː l iː d ɛ r ɛ
f ɛ t iː d ʊ m	f eː t ɪ d ʊ m
k ʊ l p a m	k ʊ l p a m
k ɔ ŋ g r eː g aː r ɛ	k ɔ ŋ g r ɛ g aː r ɛ
p a l aː t aː r	p a l aː t ʊ m
t ɔ r j ʊ m	t oː r j ʊ m
d ɪ w uː l g a m r ɛ	d iː w ʊ l g aː r ɛ
d ɛ k ɛ p t aː t ɪ w ʊ m	d ɛ k ɛ p t iː w ʊ m
a n uː m n k aː r ɛ	a nː uː n t j aː r ɛ
t j ɪ p ɪ d ʊ m	t ɛ p ɪ d ʊ m
a kː aː d ɛ m j a m	a k a d eː m iː a m
s t ʊ l t ʊ m	s t ʊ l t ʊ m
f uː s t aː	f ʊ s t a m
k ɔ d ɪ k ɛ	k oː d ɪ k ɛ m
k ɔ n s t ɪ t uː t ɪ w ʊ m	k ɔ n s t ɪ t uː t ɪ w ʊ m
t ɛ n ɪ b r a m s	t ɛ n ɛ b r aː s
a kː ɔ rː ɛ r ɛ	a kː ʊ rː ɛ r ɛ
ɛ k s p ɛ n d eː r ɛ	ɛ k s p ɛ n d ɛ r ɛ
