m uː n ɪ f ɪ k ʊ m	m uː n ɪ f ɪ k ʊ m
k r a p ʊ l m ɛ	k r aː p ʊ l a m
aʊ d ɪ k j ɔ n ɛ	aʊ k t j oː n ɛ m
s a ŋ gʷ ɪ n aː r j ʊ m	s a ŋ gʷ ɪ n aː r j ʊ m
p r ɪ n k ɪ p aː l ɪ t aː t ɛ m	p r ɪ ŋ k ɪ p aː l ɪ t aː t ɛ m
b aː ʊ m	b a d j ʊ m
eː r oː g aː r ɛ	eː r ɔ g aː r ɛ
p ɔ n t ɪ f iː k aː t ʊ m	p ɔ n t ɪ f ɪ k aː t ʊ m
d eː f r aʊ d aː t j oː n ɛ m	d eː f r aʊ d aː t j oː n ɛ m
aɪ r ɔ iː	h eː r oː ɛ m
ɪ mː ɔ l aː r ɛ	ɪ mː ɔ l aː r ɛ
b ʊ k iː n ɛu m	b uː k ɪ n a m
k a m p ɛ s t r ɛ m	k a m p ɛ s t r ɛ m
m eː t aː lː ʊ	m ɛ t a lː ʊ m
k r ɔ n ɪ k ʊ m	kʰ r ɔ n ɪ k ʊ m
r eː s a r k ɪ r ɛ	r ɛ s a r k iː r ɛ
d ɪ s k ʊ r ʊ m	d ɪ s k ʊ r s ʊ m
w a r j ʊ	w a r j ʊ m
t r ɪ lː ʊ m	t r iː b ʊ l ʊ m
p ɛ r ɪ t j a m	p ɛ r iː t j a m
t ɛ r ɛ b r a m	t ɛ r ɛ b r a m
ɪ n g uː r j a m	ɪ n ɪ uː r j a m
ɪ m b ɛ k ɪ lː ɪ t aː t ɛ m	ɪ m b eː k ɪ lː ɪ t aː t ɛ m
ɔ b s t ɛ t r ɪ k	ɔ b s t ɛ t r iː k ɛ m
k ɪ k oː r j ɛ	k ɪ kʰ ɔ r j ʊ m
w ɪ t ɛ lː ʊ m	w ɪ t ɛ lː ʊ m
ɔ s t ɪ l ɛ	h ɔ s t iː l ɛ m
a n uː lː aː r ɛ	a nː uː lː aː r ɛ
s a t uː r aː r ɛ	s a t ʊ r aː r ɛ
uː g s ɪ n oː r ɛu m ɛ m	l ʊ s k ɪ n j a m
a d w ɛ k t j oː n ɛ m	a d w ɛ k t j oː n ɛ m
l a k r ɪ m aː r ɛ	l a k r ɪ m aː r ɛ
ɪ rː ɛ g ʊ l aː r ɛ	ɪ rː eː g ʊ l aː r ɛ m
aʊ g uː r aː r ɛ	aʊ g ʊ r aː r ɛ
d ɛ p l ɔ r aː r ɛ	d eː p l oː r aː r ɛ
ɛ k s uː l k ɛ r aː t j oː n ɛ m	ɛ k s ʊ l k ɛ r aː t j oː n ɛ m
k ɪ r k ʊ n l oː k uː t j oː n ɛ m	k ɪ r k ʊ m l ɔ k uː t j oː n ɛ m
d ɛ k ɪ m aː t j oː n ɛ m	d ɛ k ɪ m aː t j oː n ɛ m
f ɛ l ʊ n ɛ m	f ɛ lː aː r ɛ
k ɪ b ɪ k ʊ m	k iː w ɪ k ʊ m
m a t ɛ r n iː t aː t ɛ m	m aː t ɛ r n ɪ t aː t ɛ m
s uː m ɪ r ɛ	s uː m ɛ r ɛ
r ɛ k uː s aː r ɛ	r ɛ k uː s aː r ɛ
r a n ʊ m	a r aː n ɛu m
m a n s oː n ɛ m	m aː n s j oː n ɛ m
n ɔ k ɪ t ʊ m	n ʊ k eː t ʊ m
r ɪ f pʰ ɛ r ɛ	r ɛ f ɪ k ɛ r ɛ
k ɔ n k aː w ʊ m	k ɔ ŋ k a w ʊ m
p r oː l oː kʷ j ʊ m	p r oː l ɔ kʷ j ʊ m
s uː kː uː l aɪ n t oː	s ʊ kː ʊ l ɛ n t ʊ m
p uː p ɪ lː a m	p uː p ɪ lː a m
s a n t ʊ m	s aː ŋ k t ʊ m
p ɛ d ɛ s t r ɛ m	p ɛ d ɛ s t r ɛ m
s p ɛ k t aː k ʊ l ʊ m	s p ɛ k t aː k ʊ l ʊ m
n ɔ m ɪ n aː t j oː n ɛ	n oː m ɪ n aː t j oː n ɛ m
ɪ m w ɛ s t iː g ɛ r ɛ	ɪ n w ɛ s t iː g aː r ɛ
s ʊ l k ʊ m	s ʊ l k ʊ m
a s p ɪ r aː t j oː n ɛ	a s p iː r aː t j oː n ɛ m
p r ɛ g ʊ a m t a m r ɛ	p r aɪ g ʊ s t aː r ɛ
t ɛ m p ɔ r aː l ɛ	t ɛ m p ɔ r aː l ɛ m
m ʊ s t ʊ m	m ʊ s t ʊ m
p ɔ ɛ r eː ɛ s ɪ l m	p ɛ t r ɔ s ɛ l iː n ʊ m
m a n t ɪ n eː r ɛ	m a n ʊ t ɛ n eː r ɛ
l a k s ʊ m	l a k s ʊ m
n ɛ r w oː s ʊ m	n ɛ r w oː s ʊ m
p r oː k ɛ d ɛ r ɛ	p r oː k eː d ɛ r ɛ
h k r iː n ʊ m	s k r iː p t ʊ m
a m aː t oː r j ʊ m	a m aː t oː r j ʊ m
ɛ t ɔ	eː t ʊ m
ɔ r n aː r ɛ	oː r n aː r ɛ
t ɛ n r n ʊ m	t ɛ n ɛ r ʊ m
r ʊ ɪ ɪ n oː s ʊ m	r ʊ iː n oː s ʊ m
m ɔ r b ʊ m	m ɔ r b ʊ m
a l ɪ m ɔ s ɪ n a m	ɛ l ɛ eː m ɔ s y n a m
z ɪ d g ɪ n aː n j a m	z iː zː a n j a
p l ʊ m b aː t ɪ k ɛ n ɛ m m	p l ʊ m b aː g ɪ n ɛ m
s ɛ g aː r ɛ	s ɛ k aː r ɛ
r ɔ t aː r ɛ	r ɔ t aː r ɛ
aɪ ɛ r uː g ɪ n oː s ʊ m	aɪ r uː g ɪ n oː s ʊ m
ɔ b j ɛ t ʊ m	ɔ b ɪ ɛ k t ʊ m
s p oː ŋ g a m	s p ɔ ŋ g j a m
d ɛ s t r ʊ t k j oː r ɛ m	d eː s t r ʊ k t j oː n ɛ m
p uː l k r ɪ t ʊ t ɛ m	p ʊ l kʰ r ɪ t uː d ɪ n ɛ m
r ɛ k t a ŋ g ʊ l ʊ m	r ɛ k t a ŋ g ʊ l ʊ m
s a l uː t ɛ m	s a l uː t ɛ m
b uː b ɔ n ɪ k ʊ m	b uː b oː n ɪ k ʊ m
f l ɛ k t ɛ r ɛ	f l ɛ k t ɛ r ɛ
ɛ rː aɪ ŋ r ɛ	ɛ rː oː r ɛ m
a k k ɛ sː w oː r j ʊ m	a kː ɛ sː oː r j ʊ m
p a m p aː n ʊ m	p a m p ɪ n ʊ m
k ɔ l ɔ r aː r ɛ	k ɔ l oː r aː r ɛ
m a l iː n ʊ m	m a l ɪ ŋ n ʊ m
kʷ ɔ t ɪ d j a n ʊ m	k ɔ t iː d j aː n ʊ m
ɪ d ɛ m n k	ɪ n d ɛ m n ɛ m
a b s t ɛ r g ɛ r ɛ	a b s t ɛ r g eː r ɛ
k a r m ɛ m m	k a r m ɛ n
sː t aː p ɛ ɛ ɛ	s t a p ɛ d ɛ m
w ɛ n t ʊ m	w ɛ n t ʊ m
ɪ n w ɔ l w ɛ r ɛ m	ɪ n w ɔ l w ɛ r ɛ
s k ɪ m j ʊ m	s iː m j ʊ m
a k t a m	aː k t a
oː kʷ ɛ r m uː k ʊ m	kʷ ɛ r k ʊ m
p r oː s ɛ sː ɪ k r ɛ	p r oː s ɛ kʷ iː
f a k ɛ t ʊ m	f a k eː t ʊ m
ɛ k s t ɔ r k ɛ r ɛ	ɛ k s t ɔ r kʷ eː r ɛ
f ɪ d ʊ m	f iː d ʊ m
eː ŋ w aː n t iː r ɛ	eː w aː n eː s k ɛ r ɛ
s k oː p a m	s k oː p a m
g ɔ b j ʊ m m ʊ	g oː b j ʊ m
r ɛ k ɪ t aː t j oː n ɛ m	r ɛ k ɪ t aː t j oː n ɛ m
s m ɛ r a l d ʊ m	s m a r a g d ʊ m
a m p ʊ lː a m	a m p ʊ lː a m
a r k aː n ʊ m	a r k a n ʊ m
f ɛ d ʊ m	f ɔ ɪ d ʊ s
a a ɪ ʊ n aː r ɛ	j eː j uː n aː r ɛ
k a l k ʊ l aː t j oː n ɛ m	k a l k ʊ l aː t j oː n ɛ m
a p oː k aː l iː p t ɛ m	a p ɔ k a l y p s ɛ m
eː l ɪ m ɪ n aː r ɛ	eː l iː m ɪ n aː r ɛ
l ɪ k ɛ n j	l iː kʰ eː n a
d eː s ɪ d ɛ k aː r ɛ	d eː s iː d ɛ r aː r ɛ
n ɪ ŋ w oː s ʊ m	n ɪ w oː s ʊ m
ɪ n w ɪ d j oː s ʊ m	ɪ n w ɪ d j oː s ʊ m
j uː r ɪ s p r uː d eː n t n ɛ m	j uː r ɪ s p r uː d ɛ n t j a m
m uː b ɪ t ʊ m	m uː g iː t ʊ m
b ɪ b l j ɛ ɔ t ɛu k aː r j ʊ m	b ɪ b l ɪ ɔ tʰ eː k aː r j ʊ m
k ɔ r ʊ m	kʰ ɔ r ʊ m
l uː k r aː r ɛ	l ʊ k r aː r iː
f uː g aː r ɛ	f ʊ g aː r ɛ
ɪ n ɪ kʷ ʊ m	ɪ n iː kʷ ʊ m
k a t ɛ d r aː l ɛ	k a tʰ ɛ d r aː l ɛ m
s k r oː f a m	s k r oː f a m
m a r s ʊ p j ʊ m	m a r s uː p j ʊ m
k ɔ n f ʊ t aː r ɛ	k oː n f uː t aː r ɛ
ɪ m p ɛ t ʊ m	ɪ m p ɛ t ʊ m
ɪ m p ɔ r t uː n ɪ t aː t ɛ m	ɪ m p ɔ r t uː n ɪ t aː t ɛ m
p ɛ r s p ɪ k uː ɪ t ɛ m	p ɛ r s p ɪ k ʊ ɪ t aː t ɛ m
a w lː ɪ n a m	a b ɛ lː a n a m
p ɛ r n ɪ k oː s ʊ m	p ɛ r n ɪ k j oː s ʊ m
p r ɛ t ɛ n d ɛ r ɛ	p r aɪ t ɛ n d ɛ r ɛ
j uː g ɛ r ʊ	j uː g ɛ r ʊ m
r uː k ʊ m	r oː s k ɪ d ʊ m
g ɛ m ɪ n aː r ɛ	g ɛ m ɪ n aː r ɛ
ɛ k s ɪ b iː r ɛ	ɛ k s h ɪ b eː r ɛ
w ɪ t ɛ r j a m	w ɪ s k ʊ s
p uː l p ɪ t l ʊ m	p ʊ l p ɪ t ʊ m
s eː d aː r ɛ	s eː d aː r ɛ
a k j a w aː s	a k ɪ ɛ m
m ɪ d aː r j aː r ʊ m	m iː lː j aː r j ʊ m
kʷ a d ɛ r n ʊ m	kʷ a t ɛ r n oː s
m a s k l ʊ m m	m a s k ʊ l ʊ m
ɪ n ʊ m	h y m n ʊ m
g ɛ l ʊ m	g ɛ l uː
a m ɪ k aː l ɛ	a m iː k aː l ɛ m
l a b ɔ r ʊ m	l a b oː r ɛ m
p a n ɪ k ʊ l a m	p aː n ɪ k ʊ l a m
p ɔ s aː r ɛ	p aʊ s aː r ɛ
s k ɪ n t ɪ lː a m m	s k ɪ n t ɪ lː a m
f lː ʊ	f l ʊ k t ʊ m
t r ʊ n k aː r ɛ	t r ʊ ŋ k aː r ɛ
oː k lː a m	ɔ lː a m
p r ɛ s k r iː b ɛ r ɛ m	p r aɪ s k r iː b ɛ r ɛ
k ɔ m ɛ r	k ɔ m ɛ d ɛ r ɛ
k ɔ n t ɛ n t j oː s ʊ m	k ɔ n t ɛ n t j oː s ʊ m
l ʊ k t aː r ɛ	l ʊ k t aː r iː
ɪ n k ʊ r w aː r ɛ	ɪ ŋ k ʊ r w aː r ɛ
a n t ɪ k ɪ p aː r ɛ	a n t ɪ k ɪ p aː r ɛ
k ɔ m p aː r eː t r ɛ	k ɔ m p aː r eː r ɛ
l ɪ t ɪ g aː r ɛ	l iː t ɪ g aː r ɛ
d ɪ k t aː m ɛ n	d ɪ k t aː m ɛ n
a d aː m a n t ɛ m	a d a m a n t ɛ m
t r ɪ p l eː k k ɛ	t r ɪ p l ɪ k ɛ m
ɪ n k ɛ n d j ʊ m	ɪ ŋ k ɛ n d j ʊ m
f ɛ rː oː s t j ʊ m	w ɛ r ɪ k ʊ l ʊ m
k a l oː r ɛ	k a l oː r ɛ m
a b r oː t aː n ʊ m	a b r ɔ t ɔ n ʊ m
m a g ɛ s t aː t ɛ m	m a j ɛ s t aː t ɛ m
p a r t ɪ t j oː n ɛ m	p a r t iː t j oː n ɛ m
k ɪ ŋ r oː s ʊ m	k eː r oː s ʊ m
d eː l ɛ k t aː t j oː n ɛ m	d eː l ɛ k t aː t j oː n ɛ m
d eː t ɛ k t aː r ɛ m j m	d eː t ɛ g ɛ r ɛ
k ʊ n j aː r n ɛ	k ʊ n ɛ aː r ɛ
a b l ɛ g aː t l oː n ɛ m	a b l eː g aː t j oː n ɛ m
w ɛ r a t ɪ t ɛ m	w ɛ r t ɪ k ɛ m
b ɪ j uː k l eː	b aː j ʊ l ʊ m
ɪ m f ɔ r t uː n j ʊ m	iː n f ɔ r t uː n j ʊ m
w a k a t j oː n ɛ m	w a k aː t j oː n ɛ m
ʊ rː ɛ n d ʊ m	h ɔ rː ɛ n d ʊ m
p a l p ɪ t aː r ɛ	p a l p ɪ t aː r ɛ
ɛ k k ɛ lː eː r ɛ	ɛ k s k ɛ lː ɛ r ɛ
k r oː k ɪ f eː r ʊ m	k r ʊ k ɪ f ɛ r ʊ m
k ɔ r j aː k eː ʊ m	k ɔ r j a k ɛu m
k a l ɪ g a m	k a l ɪ g a m
n uː m ɛ m n ɛ m	n uː m ɛ n
s p ɛ k ʊ j ʊ m	s p ɛ k ʊ l ʊ m
p r ɛ d ɪ k ɪ r ɛ	p r aɪ d ɪ k aː r ɛ
a pː ɔ ŋ n	a pː oː n ɛ r ɛ
m uː n ɪ f ɪ k ɛ n t j a m	m uː n ɪ f ɪ k ɛ n t j a m
ɛ ʊ m	ɛu m
l ɔ r ɪ k a m	l oː r iː k a m
a g ɪ t aː t oː r	a g ɪ t aː t oː r ɛ m
b ɛ n iː n ʊ m	b ɛ n ɪ ŋ n ʊ m
s t r ɛ p iː t ʊ m	s t r ɛ p ɪ t ʊ m
m uː n ɪ k ɪ p aː l ɛ	m uː n ɪ k ɪ p aː l ɛ m
g a w ɛ t a m	g a b a t a m
ɪ n t ɪ m aː t j oː n ɛ m	ɪ n t ɪ m aː t j oː n ɛ m
s a k k j oː n ɛ m	s aː ŋ k t j oː n ɛ m
w ɪ t t ʊ m	w iː k t ʊ m
f ɛ r a m	f ɛ r a m
a r ɛ aː l ɛ	aː r ɛ a l ɛ m
a r b oː r ɛ ʊ m	a r b ɔ r ɛu m
a r k j a m	a r kʰ j a m
m eː s t ɛ r ɛ m	m ɪ s k eː r ɛ
ɪ m p ɛ r ʊ m	ɪ m p ɛ r j ʊ m
ɔ k ɪ lː ɛ r ɛ	ɔ kː ɪ d ɛ r ɛ
ɪ n s ɛ r t j oː n ɛ m	iː n s ɛ r t j oː n ɛ m
d eː k r ɛ t aː l ɛ	d eː k r eː t aː l ɛ m
d eː g r aː d aː t j oː n ɛ m	d eː g r a d aː t j oː n ɛ m
p ɛ r f ɪ d ʊ m	p ɛ r f ɪ d ʊ m
k l aː w ɪ k ɔ r d j ʊ m	k l aː w iː kʰ ɔ r d j ʊ m
s a l ɪ n a m	s a l iː n a m
s uː p oː n eː	s ʊ pː oː n ɛ r ɛ
p r ɪ n d ɛ r ʊ m	p r a n d eː r ɛ
ɛ k ɪ k a r ɪ s t j a m	ɛu kʰ a r ɪ s t j a m
b ɛ s t j aː r j ʊ m	b eː s t j aː r j ʊ m
a p ɔ s t ʊ l ʊ m	a p ɔ s t ɔ l ʊ m
aʊ r ɪ zː ɔ n t ɛ m	h ɔ r ɪ zː ɔ n t a
f ɛ b ʊ m l ɛ m	f l eː b ɪ l ɛ m
ɪ oː n ɔ b ɪ l ɛ	ɪ ŋ n oː b ɪ l ɛ m
t ɛu l j ʊ m ʊ	t eː g ʊ l a m
s ɔ b m ɛ t ɛ r ɛ m	s ʊ mː ɪ tː ɛ r ɛ
s t aː t ɛ r a m	s t a t eː r a m
s ɔ l ɪ k ɪ t aː t j oː n ɛ m	s ɔ lː ɪ k ɪ t aː t j oː n ɛ m
r ɔ t ɛ lː a m	r ɔ t ɛ lː a m
d ɪ w uː l g aː t j oː n ɛ m	d iː w ʊ l g aː t j oː n ɛ m
s a p ʊ n ɛ	s aː p oː n ɛ m
w ɪ t uː lː ʊ m	w ɪ t ʊ l ʊ m
a d ɪ r ɛ m	a d iː r ɛ
d ɪ s p ɛ r aː r ɛ	d eː s p eː r aː r ɛ
ɔ r b m ɛ m	ɔ r b ɛ m
s ʊ r g ɪ r ɛ	s ʊ r g ɛ r ɛ
m uː l ʊ m	m uː l ʊ m
w a lː ʊ m	w a lː ʊ m
k a r a m ɛ lː ʊ m	k a l a m ɛ lː ʊ m
s h t ɔ r n k ʊ m	s t ʊ r n ʊ m
s uː ɔ k ɛ r a m	s ɔ k r ʊ m
f a r ɪ n oː s ʊ m	f a r iː n oː s ʊ m
k r uː d ɛ l ɛ	k r uː d eː l ɛ m
ɔ l ɪ g aː r k a m	ɔ l ɪ g a r kʰ a m
eː l ʊ m	ʊ l ʊ m
d eː n ɛ k aː r	d eː n ɛ g aː r ɛ
l ɪ b ɛ r aː t oː r ɛ	l iː b ɛ r aː t oː r ɛ m
r ɛ d a r g ʊ ɛ	r ɛ d a r gʷ ɛ r ɛ
f ɛ m ʊ r ɛ	f ɛ m ʊ r
m ɛ d ɪ t aː b ʊ n t ʊ m	m ɛ d ɪ t aː b ʊ n d ʊ m
a d uː l aː t oː r ɛ	a d uː l aː t oː r ɛ m
w oː m iː t ʊ m	w ɔ m ɪ t ʊ m
a kː r ɪ t ɛ t ɛ m	aː k r ɪ t aː t ɛ m
k ɛ n t aʊ r	k ɛ n t aʊ r eːa m
k r eː s p aː r ɛ	k r ɪ s p aː r ɛ
g ɔ n f a m l j ɛ	k oː n f l aː r ɛ
ɔ pː ɔ r t uː n ɪ t aː t ɛ m	ɔ pː ɔ r t uː n ɪ t aː t ɛ m
b a k ʊ m l ʊ m	b a k ʊ l ʊ m
a w aː l aː n k a m	l aː b iː n a m
t ɛ n ɛ b r oː s ʊ m	t ɛ n ɛ b r oː s ʊ m
a n ɪ m aː l ɛ	a n ɪ m a l
ɪ n d uː r aː r ɛ	ɪ n d uː r aː r ɛ
m a r t ɪ r ɛ	m a r t y r ɛ m
f uː r t ɪ w ʊ m	f uː r t iː w ʊ m
ɛ k s ɪ g ɪ n n ʊ m ʊ m	ɛ k s ɪ gʷ ʊ m
w eː r n aː l ɛ	w ɛ r n aː l ɛ m
p a r ʊ k ʊ m	p a r ɔ kʰ ʊ m
ɪ s t a m	ɪ s t a m
k a rː ʊ t j a m	k a rː uː k a m
k ɔ r w ɪ n ʊ m	k ɔ r w iː n ʊ m
ɪ n k r eː d iː b ɪ ɪ l ɛ	ɪ ŋ k r eː d ɪ b ɪ l ɛ m
ɪ m p uː n aː r ɛ	ɪ m p ʊ ŋ n aː r ɛ
k ɔ n s ɪ l ʊ m	k oː n s ɪ l j ʊ m
d ɛ n s aː r ɛ	d eː n s aː r ɛ
k ɔ n w ɔ k aː r ɛ	k ɔ n w ɔ k aː r ɛ
f iː l j aː s t r ʊ m	f iː l j a s t r ʊ m
a m aː r ɪ t j a m	a m aː r ɪ t ɪ ɛ m
eː k l ɪ p sː ɛ	ɛ k l iː p s ɛ m
g a t a m	k a tː a m
m ɔ n aː s t ɛ r j ʊ m	m ɔ n a s t eː r j ʊ m
p a d r a s t l ʊ m	p a t r a s t r ʊ m
k ʊ p r ɛ a m	k oː p ʊ l a m
f r a ŋ g ɛ r ɛ	f r a ŋ g ɛ r ɛ
ɔ l ɪ r ɛ m	ɔ l eː r ɛ
b a r b iː w ɪ ʊ m	b a r b ʊ l a m
m ɪ n ʊ ɪ r ɛ	m ɪ n ʊ ɛ r ɛ
a t r a m ɛ n t ʊ m r	aː t r aː m ɛ n t ʊ m
ɪ n w ɛ r t ɛ r ɛ	ɪ n w ɛ r t ɛ r ɛ
aʊ m ɪ k ɪ d ʊ m	h ɔ m ɪ k iː d a m
d ɪ s t r ɪ kʷ ɛ t ʊ m	d ɪ s t r ɪ k t ʊ m
ʊ r ʊ m	uː r ʊ m
f ɔ r m ɛ m	f oː r m ɛ m
k ɔ n s ɪ l j aː r ɛ	k ɔ ŋ k ɪ l j aː r ɛ
d uː r ʊ m	d uː r ʊ m
s k w aː l ɪ d ʊ m	s kʷ aː l ɪ d ʊ m
ɛ k s k r ɛ t aː r	ɛ k s k ɛ r n ɛ r ɛ
p a w oː r ɛ	p a w oː r ɛ m
g l aʊ k ʊ m	g l aʊ k ʊ m
m ɔ r d aː k ɛ m ɛ	m ɔ r d aː k ɛ m
d ɛ t ɛ r m iː n aː t j oː n ɛ m	d eː t ɛ r m ɪ n aː t j oː n ɛ m
ɔ b w j aː r ɛ	ɔ b w j aː r ɛ
t ʊ rː ɛ	t ʊ rː ɛ m
m a l ɛ	m a l ʊ m
p r ɛ k ɪ p iː t j ʊ m	p r aɪ k ɪ p ɪ t j ʊ m
a b ɛ ɪ a m	a p ɪ k ʊ l a m
a pː ɛ lː aː r ɛ	a pː ɛ lː aː r ɛ
s uː p l ɪ k aː t j ʊ m n ɛ m	s ʊ pː l ɪ k aː t j oː n ɛ m
w ɛ h s aː r ɛ	w eː k s aː r ɛ
s eː k uː r ɛ m	s ɛ k uː r ɛ m
m a p a m	m a pː a m
ɪ rː oː m p ɛ r ɛ	ɪ rː ʊ m p ɛ r ɛ
ɔ m d oː r ɛ	ɔ d oː r ɛ m
p aʊ s a m	p aʊ s a m
f ʊ r ʊ n k ʊ l ʊ m	f uː r ʊ ŋ k ʊ l ʊ m
a s p aː r aː g ʊ m	a s p a r a g ʊ m
ɪ fː ɛ r w ɛ t ɛ r	ɛ fː ɛ r w eː s k ɛ r ɛ
w ɪ k ʊ m	w iː k ʊ m
ɔ b l ɪ g aː t j oː n ɛ	ɔ b l ɪ g aː t j oː n ɛ m
l uː n aː r ɛ	l uː n aː r ɛ m
p r oː k ʊ r aː r ɛ	p r oː k uː r aː r ɛ
r ɔ t aː r ɛ	r ʊ k t aː r ɛ
ɪ m p ɪ ŋ g ɛ r ɛ	ɪ m p ɪ ŋ g ɛ r ɛ
s uː p ɪ n ʊ m	s ʊ p iː n ʊ m
p uː l k r ʊ m	p ʊ l kʰ r ʊ m
g fː aː t j ʊ m	g l a k ɪ ɛ m
s ɔ l ɪ k ɪ t aː r ɛ	s ɔ lː ɪ k ɪ t aː r ɛ
s a l uː t aː r ɛ	s a l uː t aː r ɛ m
n ɔ w ɪ l ʊ n j ʊ m	n ɔ w ɪ l uː n j ʊ m
t r aː n s m oː n t aː n ʊ m	t r aː n s m ɔ n t aː n ʊ m
g uː d ɪ t j aː l ɛ	j uː d ɪ k j aː l ɛ m
a l w ɛ ʊ m	a l w ɛu m
ɪ n f ɛ r oː r ɛ	iː n f ɛ r ʊ m
a r ʊ t ʊ m	r uː k t ʊ m
t aː sː ʊ m n	t a k s ʊ m
p uː l w ɪ n aː r ɛ	p ʊ l w iː n a r
a m eː r ɛ m	a m aː r ɛ
k ɔ n g j ʊ m	k ɔ ŋ g j ʊ m
ɔ l ɔ r ɛ	ɔ l oː r ɛ m
p ɪ g oː r ɛ	p ɛ j oː r ɛ m
j ʊ w ɛ n k ʊ m	j ʊ w ɛ ŋ k ʊ m
a d uː l a k j oː n ɛ m	a d uː l aː t j oː n ɛ m
a b ɪ g ɪ ʊ m	a b ɪ g ɛu m
s p eː l j ʊ m	s p ɛ k l ʊ m
k ɛ s a t j oː n ɛ m	k ɛ sː aː t j oː n ɛ m
s uː d aː r j ʊ m	s uː d aː r j ʊ m
a b l a kʷ aː t ɛ j oː n ɛ m	a b l a kʷ ɛ aː t j oː n ɛ m
k ɛ s aː r ɛ	k ɛ sː aː r ɛ
ɪ t ɪ n ɛ r aː r j ʊ m	ɪ t ɪ n ɛ r aː r j ʊ m
p l aː t ɛ a m	p l a t eːa m
r ɛ p l ɪ k aː t j oː n ɛ	r ɛ p l ɪ k aː t j oː n ɛ m
w ɛ r m ɪ n oː s ʊ m	w ɛ r m ɪ n oː s ʊ m
n ɛ s p ɛ l a m	m ɛ s p ɪ l ʊ m
p r ɛ k oː n ʊ m t ɛ r ɛ	p r aɪ k ɔ ŋ n ɔ s k ɛ r ɛ
eː fː ɛ m ɪ n aː r ɛ	ɛ fː eː m ɪ n aː r ɛ
p l aː g j aː r ɛ	p l a g j aː r ɛ
g uː ŋ g ɛu m r ɛ	j ʊ ŋ g ɛ r ɛ
k a l uː ŋ n j a m	k a l ʊ m n j a m
f ɛ r w ɛ r ɛ	f ɛ r w eː r ɛ
f ɛ s t ɪ w iː t aː t ɛ m	f eː s t iː w ɪ t aː t ɛ m
kʷ a d r aː r ɛ	kʷ aː d r aː r ɛ
b ɔ rː aː g ɪ ɛ	b ɔ r aː g ɪ n ɛ m
a k ɔ n ɪ t ʊ m	a k ɔ n iː t ʊ m
f uː m oː s ʊ m	f uː m oː s ʊ m
s p oː l aː r ɛ	s p ɔ l j aː r ɛ
l ɛ n aː r	l ɪ ŋ n aː r iː
k ɪ b a t j oː n ɛ m	k ɪ b aː t j oː n ɛ m
n a w ʊ m k ɛ lː a m	n aː w ɪ k ɛ lː a m
s k ɪ r p ʊ m	s k ɪ r p ʊ m
ɪ w oː r j ʊ m	ɛ b ʊ r
k ɔ m ɪ t j ʊ m	k ɔ m ɪ t j ʊ m
k ɔ m p ɪ aː k ɛ r ɛ	k ɔ m p l a k eː r ɛ
m ɛ d ʊ m	m ɛ t ʊ m
ɪ r a m	iː r a m
ɪ n f ɪ r m aː r ɛ	iː n f ɪ r m aː r ɛ
a k k ɛ n t ʊ m	a kː ɛ n t ʊ m
f ɛ rː aː r j ʊ m	f ɛ rː aː r j ʊ m
g r a t ʊ m	g r aː t ʊ m
f uː n ɪ k ʊ l ʊ m	f uː n ɪ k ʊ l ʊ m
ɛ k s ɪ s t ɛ n k j m	ɛ k s ɪ s t ɛ n t j a m
ɪ r k ɪ n ʊ m	h ɪ r k iː n ʊ m
k ɛ n t ʊ r j a m	k ɛ n t ʊ r j a m
ɔ p eː r aː r ɛ	ɔ p ɛ r aː r iː
ɪ m p r ɛ k aː r ɛ	ɪ m p r ɛ k aː r iː
p a l p ɛ b r aː l ɛ m	p a l p ɛ b r aː l ɛ m
s t r ɪ g a m	s t r iː g a m
p r uː d eː r ɛ	p r uː r iː r ɛ
p r aɪ d aː t j uː n ɛ m	p r aɪ d aː t j oː n ɛ m
ɪ n aʊ d ɪ t ʊ m	ɪ n aʊ d iː t ʊ m
s ɛ r w ɪ l ɛ	s ɛ r w iː l ɛ m
ɛ k s ɔ r t aː t j oː n ɛ m	ɛ k s h ɔ r t aː t j oː n ɛ m
f ɔ r m a m	f oː r m a m
ɪ n w ɛ s t iː r ɛ	ɪ n w ɛ s t iː r ɛ
s k r ɪ n ʊ m	s k r iː n j ʊ m
s a l uː t aː r ɛ	s a l uː t aː r ɛ
a b s oː l ɛ w ɛ r ɛ	a b s ɔ l w ɛ r ɛ
k ɔ n d ɔ l eː r ɛ m	k ɔ n d ɔ l eː r ɛ
eː l ɛ f a n t ɪ n ʊ m	ɛ l ɛ pʰ a n t ɪ n ʊ m
k a n ɪ k ʊ l a m	k a n iː k ʊ l a m
ɔ k n ɪ s aɪ n t ɛ m	ɔ m n ɪ s k ɪ ɛ n t ɛ m
p r ʊ ɛ w a m	p r ɔ b a m
k ɔ n t ɛ m p l aː r ɛ	k ɔ n t ɛ m p l aː r iː
k a r n oː s ʊ m	k a r n oː s ʊ m
s ʊ s p ɪ r j aː r ɛ	s ʊ s p iː r aː r ɛ
a d ɪ t aː m ɛ n t ʊ m	a dː ɪ t aː m ɛ n t ʊ m
k r ɔ lː aː r ɛ	k ɔ rː ʊ ɛ r ɛ
ɛ rː ʊ m pʰ ɛ	ɛ rː aː r ɛ
t a k t ɪ l ɛ	t aː k t ɪ l ɛ m
a ŋ y a m	a s k j a m
g r a m a m ɛ	g r aː m ɛ n
f r uː k t w oː s ʊ m	f r ʊ k t ʊ oː s ʊ m
l ɔ k aː r ɛ	l ɔ k aː r ɛ
