s p ʊ r k ʊ m	s p ʊ r k ʊ m
w ɛ r n iː k ɛ m	w ɛ r n iː k ɛ m
s k a l p ɛ lː ʊ m	s k a l p ɛ lː ʊ m
a g aː t a m	a kʰ aː t eː n
t ɛ d j oː s ʊ m	t aɪ d j oː s ʊ m
p r oː b ʊ m	p r ɔ b ʊ m
p ɪ l a m	p iː l a m
t eː n d ɛ r ɛ m	t ɛ n d ɛ r ɛ
h ɛ r b oː s ʊ m	h ɛ r b oː s ʊ m
g ɛ n j ɪ aː l ɛ	g ɛ n j aː l ɛ m
ɛ n t r ɛ m ɛ t ɛ r ɛ m n	ɪ n t r oː m ɪ tː ɛ r ɛ
p l uː m a m	p l uː m a m
k ʊ n t ʊ m eː l j a m	k ɔ n t ʊ m eː l j a m
ɛ s ʊ g aː r ɛ	ɛ k sː uː k aː r ɛ
a kː uː s aː b aː l ɛ m	a kː uː s aː b ɪ l ɛ m
r ɛ w ɔ k aː r ɛ	r ɛ w ɔ k aː r ɛ
p a k t ʊ m	p a k t ʊ m
m ɛ s	m eː n s ɛ m
w ɛ lː ʊ s ʊ m	w ɪ lː oː s ʊ m
t r aː m l ʊ k ɛ r ɛ	t r aː n s l uː k eː r ɛ
s t a b ɪ l ɛ iː r ɛ	s t a b ɪ l iː r ɛ
f ʊ l ɛ m k aː r	f ɔ lː ɪ k aː r ɛ
w a lː ʊ m	w a lː ʊ m
s a ŋ ʊ ʊ m r j ɛ s ɛ m	s a t ʊ r eː j a m
uː l k ɛ r a m	ʊ l k ʊ s
a k r iː m oː n j a m	aː k r ɪ m oː n j a m
w a l ɛ t ʊ d ɪ n aː r j ʊ m	w a l eː t uː d ɪ n aː r j ʊ m
b ʊ aː r j ʊ m	b ɔ aː r j ʊ m
p a l p ɛ b r aː l	p a l p ɛ b r aː l ɛ m
ɪ m p ɛ r aː r ɛ	ɪ m p ɛ r aː r ɛ
k ɔ n f l ʊ eː r ɛ	k oː n f l ʊ ɛ r ɛ
ɔ rː ɪ f ɪ k ʊ m	h ɔ rː ɪ f ɪ k ʊ m
d ɪ s w aː d ɛ r ɛ	d ɪ sː w aː d eː r ɛ
p l aː k ɪ d ʊ m	p l a k ɪ d ʊ m
s t aː t ʊ m	s t a t ʊ m
a fː l iː g ɛ r ɛ	a fː l iː g ɛ r ɛ
w a n ɪ	w a nː ʊ m
g uː b iː l aː r ɛ	j uː b ɪ l aː r ɛ
ɪ l aː t j ʊ m n ɛ m	ɪ lː aː t j oː n ɛ m
s ʊ lː aː k ʊ	s oː l aː k j ʊ m
ɛ r iː m aː n d aː d ɛ m	g ɛ r m aː n ɪ t aː t ɛ m
k ɔ lː ʊ m	k ɔ lː ʊ m
p r oː w oː k aː r ɛ	p r oː w ɔ k aː r ɛ
f ɔ l oː s ʊ m	f ɔ l j oː s ʊ m
s a k r ɪ f ɪ k j ʊ m	s a k r ɪ f ɪ k j ʊ m
ɔ b s ɛ k j ʊ m s ʊ m	ɔ b s ɛ kʷ j oː s ʊ m
j uː g ɪ r ʊ m	j uː g ɛ r ʊ m
ɔ s k uː l aː t j oː n ɛ m	ɔ s k ʊ l aː t j oː n ɛ m
ɔ pː oː n r ɛ	ɔ pː oː n ɛ r ɛ
m uː s a r aː n ʊ m	m uː s a r aː n ɛu m
p r aɪ s ɪ ɛ d ɛ r ɛ	p r aɪ s ɪ d eː r ɛ
ɪ ŋ n aː r ʊ m	ɪ ŋ n aː r ʊ m
m a t aː r ɛ	m a k t aː r ɛ
t uː r a m	t uː r a m
j ɛ t aː r ɛ	j a k t aː r ɛ
w ɪ w iː d ʊ m	w iː w ɪ d ʊ m
k ɔ n g ʊ g aː r ɛ	k ɔ n j ʊ g aː r ɛ
b uː rː ʊ m	b ʊ rː ɪ k ʊ m
p r aɪ w aː l eː r ɛ	p r aɪ w a l eː r ɛ
k ʊ n t ɔ r k ɛ r ɛ	k ɔ n t ɔ r kʷ eː r ɛ
h aː b ʊ l aː r ɛ	f aː b ʊ l aː r iː
h ɪ k ɪ	kʷ ɛ m
d ɪ k t j oː n ɛ m	d ɪ k t j oː n ɛ m
p ɛ r p ɛ t ʊ m ɪ t aː t ɛ m	p ɛ r p ɛ t ʊ ɪ t aː t ɛ m
d j aː b ʊ m l ʊ m	d j a b ɔ l ʊ m
k l aʊ d ɪ k aː r ɛ	k l aʊ d ɪ k aː r ɛ
p uː p a m	p uː p a m
k a l iː k ɛ m	k a l ɪ k ɛ m
b ɔ t uː l iː n ʊ m	b ɔ t ʊ l ʊ m
ɔ n aː g r ʊ m	ɔ n a g r ʊ m
r ɛ f ɔ r m aː r ɛ	r ɛ f oː r m aː r ɛ
b ɛ t ʊ l a m	b ɛ t ʊ l a m
k ɪ n ʊ m	k y ŋ n ʊ m
m m ɛ r ɛ g ʊ l ɛ m	m ɛ r g ʊ m
ɔ n oː m aː t ɔ p ɛ j a m	ɔ n ɔ m a t ɔ p ɔ ɪ j a m
f a l s aː r ɛ	f a l s aː r ɛ
g ɛ t a m r	f eː t aː r ɛ
a t r a m ɛ n t ʊ m m	aː t r aː m ɛ n t ʊ m
p r uː d ɛ r ɛ	p r uː r iː r ɛ
m a ŋ n ɛ s j ʊ m	m a ŋ n eː s j ʊ m
f aː rː aː g ɪ n ɛ	f a rː aː g ɪ n ɛ m
d ɛ r iː s oː r j ʊ m	d eː r iː s oː r j ʊ m
s p ɛ l j ʊ m	s p ɛ k ʊ l ʊ m
m ɛ d ɪ oː k r ɛ m	m ɛ d ɪ ɔ k r ɛ m
kʷ ɛ s t j ɔ n aː r j ʊ m	kʷ aɪ s t j oː n aː r j ʊ m
r ɛ f r ɪ g eː r j ʊ m	r eː f r iː g ɛ r j ʊ m
s p oː l aː r ɛ	s p ɔ l j aː r ɛ
m a r iː s k aː	m a r ɪ s k a m
a k ʊ m	a k ʊ m
s a l iː n a m	s a l iː n a m
a k t oː r ɛ	aː k t oː r ɛ m
m a n k eː b ʊ m	m a ŋ k ɪ p ɛ m
d eː s t r ʊ g ɛ r ɛ	d eː s t r ʊ ɛ r ɛ
d ɪ w ɛ r t ɪ r ɛ	d iː w ɛ r t ɛ r ɛ
ɔ r ɪ s oː n t ɛ m	h ɔ r ɪ zː ɔ n t a
p a p eː r ʊ m	p a p y r ʊ m
a b ɪ t aː r ɛ	h a b ɪ t aː r ɛ
a n t a m	a n t aː s
p ɛ r m iː s j oː n ɛ m	p ɛ r m ɪ sː j oː n ɛ m
k ʊ lː ɛ r a m	kʰ ɔ l ɛ r a m
a g r ɛ s t ɛ m	a g r ɛ s t ɛ m
a b ɛ rː aː r ɛ	a b ɛ rː aː r ɛ
a k aɪ r w ʊ m	a k ɛ r w ʊ m
p r aɪ d aː t oː r ɛ	p r aɪ d aː t oː r ɛ m
t ɛ k s t ʊ m	t ɛ k s t ʊ m
f a m m a m	f aː m a m
n a t a l iː t j ʊ m	n aː t aː l iː k j ʊ m
k l aʊ s ʊ r a m	k l aʊ s uː r a m
b l a n d ʊ m	b l a n d ʊ m
s uː k k ɛ m aː r ɛ	s uː g ɛ r ɛ
l uː d iː b r j ʊ m	l uː d iː b r j ʊ m
k ɔ m p ʊ n g ɛ r ɛ	k ɔ m p ʊ ŋ g ɛ r ɛ
h ɛ lː ʊ m	ɛ lː ʊ m
w ɛ r aː k ɛ	w eː r aː k ɛ m
s uː fː iː k j ɛ n t j a m	s ʊ fː ɪ k ɪ ɛ n t j a m
a s t uː t j a m	a s t uː t j a m
eː k s t ɛ r j oː r	ɛ k s t ɛ r j oː r ɛ m
s ɛ rː aː r ɛ	s ɛ r ɛ r ɛ
s ʊ n ɪ t ʊ m	s ɔ n ɪ t ʊ m
l uː t ʊ m	l uː k t ʊ m
k ɛ s a t j oː n ɛ m	k ɛ sː aː t j oː n ɛ m
a b l a kʷ aː t j oː n ɛ m	a b l a kʷ ɛ aː t j oː n ɛ m
s p ɛ k t aː k ʊ l ʊ m	s p ɛ k t aː k ʊ l ʊ m
a n aː r k j a m	a n a r kʰ j a m
s ɔ l ʊ m	s oː l ʊ m
d ɪ g ɛ s t ɪ w ʊ m	d iː g ɛ s t iː w ʊ m
uː s ɪ t aː r ɛ	uː s ɪ t aː r iː
s k r ʊ t aː r ɛ	s k r uː t aː r ɛ
p r aɪ d j aː l ɛ	p r aɪ d j aː l ɛ m
k uː d ɛ m r ʊ	k l aʊ d ɛ r ɛ
ɛ k s k r ɛ m ɛ n t ʊ m	ɛ k s k r eː m ɛ n t ʊ m
ɪ n t ɛ r p oː n ɛ r ɛ	ɪ n t ɛ r p oː n ɛ r ɛ
k ɔ n d ɪ s k ɛ n d ɛ r ɛ	k ɔ n d eː s k ɛ n d ɛ r ɛ
d ɛ p r ɛ k aː r ɛ	d eː p r ɛ k aː r iː
d eː t ɛ s t aː t j oː n ɛ m	d eː t ɛ s t aː t j oː n ɛ m
k a n t j ʊ m n ɛ m	k a n t j oː n ɛ m
t a b ʊ l a m	t a b l a m
d ʊ l k eː t uː d iː n ɛ m	d ʊ l k ɪ t uː d ɪ n ɛ m
k ɔ d iː k ɛ m	k oː d ɪ k ɛ m
n a t aː l ɛ	n aː t aː l ɛ m
eː l ɪ d ɛ r ɛ	eː l iː d ɛ r ɛ
k ɔ n s ɪ ʊ m	k oː n s k j ʊ m
l ɪ n aː r ʊ m	l iː n aː r j ʊ m
t ɛ k ɪ a m	tʰ eː k a m
s ɛ p ʊ l t uː r a m	s ɛ p ʊ l t uː r a m
k r ɔ t aː l ʊ m	k r ɔ t a l ʊ m
r ɛ d uː k t j oː n ɛ m	r ɛ d ʊ k t j oː n ɛ m
k ʊ p uː l aː t j oː n ɛ m	k oː p ʊ l aː t j oː n ɛ m
p ʊ ɛ r iː l ɛ	p ʊ ɛ r iː l ɛ m
t ɔ r t ʊ m	t ɔ r t ʊ m
s t oː r aː k ɛ m	s t y r a k ɛ m
t r aː n s p oː r ɛ j	t r aː n s p oː n ɛ r ɛ
m eː t aː l ʊ	m ɛ t a lː ʊ m
p l aː n aː r ɛ	p l aː n aː r j ʊ m
m a s a m	m a sː a m
p ɔ r t ɛ r ʊ m	p ɔ r t aː r j ʊ m
t uː b ɛ r oː s ʊ m	t uː b ɛ r oː s ʊ m
k ɔ n ɛ k s j oː n ɛ m	k ɔ nː ɛ k s j oː n ɛ m
eː r ɛ t iː k ɛ m	h aɪ r ɛ t ɪ k ʊ m
s a k r ɪ l ɛ g ʊ m	s a k r ɪ l ɛ g ʊ m
s ɔ n aː r ɛ	s ɔ m n j aː r ɛ
l a k t ɛ ʊ m	l a k t ɛu m
n ʊ m ɪ n aː r ɛ	n oː m ɪ n aː r ɛ
m a pː a m	m a pː a m
t ŋ r ʊ ʊ w ɛ m ʊ m	t uː b ɛ r
s ʊ l iː d aː r ɛ	s ɔ l ɪ d aː r ɛ
w uː l n ɛ r aː r ɛ	w ʊ l n ɛ r aː r ɛ
k ɪ r k ʊ n pʰ l uː ɪ r ɛ m	k ɪ r k ʊ m f l ʊ ɛ r ɛ
m ɔ r t aː l ɪ t m t ɛ m	m ɔ r t aː l ɪ t aː t ɛ m
m ɛ d iː k iː n aː l ɛ	m ɛ d ɪ k iː n aː l ɛ m
ɪ n d aː g aː r ɛ	ɪ n d aː g aː r ɛ
k ʊ lː aʊ d aː r ɛ	k ɔ lː aʊ d aː r ɛ
s t r ɪ g a m	s t r iː g a m
ɛ k s aː k t j oː n	ɛ k s aː k t j oː n ɛ m
n ɔ t	n ɔ t a m
f ɪ s j oː n ɛ	f ɪ sː j oː n ɛ m
ɔ n d aː r ɛ	ʊ n d aː r ɛ
aʊ d ʊ n aː r ɛ	a d uː n aː r ɛ
p ɔ n d ɛ r oː s ʊ m	p ɔ n d ɛ r oː s ʊ m
d ɪ s t r aː k t j oː n ɛ m	d ɪ s t r a k t j oː n ɛ m
l uː n aː t j ʊ m n ɛ m	l uː n aː t j oː n ɛ m
f a k ɛ t j a m	f a k eː t j a m
k iː g ʊ oː n a m	k ɪ k oː n j a m
ɛ k s aː l t aː r ɛ	ɛ k s a l t aː r ɛ
w ɛ n j a m	w ɛ n j a m
m oː d ʊ m	m ɔ d j ʊ m
t r aː n s m iː g r aː r ɛ	t r aː n s m ɪ g r aː r ɛ
l a k t ɪ k iː n j ʊ m	l a k t ɪ k iː n j ʊ m
p ɛ r iː t j a m	p ɛ r iː t j a m
m uː n ʊ m	m uː n ʊ s
n ɛ g aː r ɛ	n ɛ g aː r ɛ
t r ɪ f oː l j aː t ʊ m	t r ɪ f ɔ l j aː t ʊ m
n ɪ d aː	n oː d aː r ɛ
fː ɛ t ʊ m	f ɪ l ɪ k t ʊ m
ɛ kː s k oː r j aː r ɛ	ɛ k s k ɔ r j aː r ɛ
k a p t ʊ r a m	k a p t uː r a m
k s p a n d ɛ r ɛ	ɛ k s p a n d ɛ r ɛ
ɪ n s t aʊ r aː r ɛ	iː n s t aʊ r aː r ɛ
p a d r ɛ m	p a t r ɛ m
p r oː r oː g aː r ɛ	p r oː r ɔ g aː r ɛ
k ɪ b iː k ʊ m	k iː w ɪ k ʊ m
b r a n k a m	b r a ŋ k a m
t r ʊ n k aː r ɛ	t r ʊ ŋ k aː r ɛ
b ɛ r iː lː ʊ m	b eː r y lː ʊ m
kʷ a d r ʊ p l ɪ k aː r ɛ	kʷ a d r ʊ p l ɪ k aː r ɛ
s a k ɛ r d oː t ɛ m	s a k ɛ r d oː t ɛ m
g ɛ l oː s ʊ m	z eː l oː s ʊ m
k a r ɪ k t ɛ m	k aː r ɪ k ɛ m
a k aɪ t ʊ m	a k eː t ʊ m
g ɛ n t ɪ l ɛ	g ɛ n t iː l ɛ m
s p ɛ l ʊ n k a m	s p eː l ʊ ŋ k a m
d eː l iː t j a m	d eː l ɪ k j aː s
a m aɪ n ɪ t aː t ɛ m	a m ɔ ɪ n ɪ t aː t ɛ m
s p ʊ s aː r ɛ	s p oː n s aː r ɛ
a b d oː m aː n	a b d oː m ɛ n
a ɪ s a m	aː n s a m
g ʊ k ʊ n d iː t aː t ɛ m	j uː k ʊ n d ɪ t aː t ɛ m
h ɛ r b aː r j ʊ m	h ɛ r b aː r j ʊ m
s k r ɔ f a m	s k r oː f a m
k ɔ rː ɛ k t oː r ɛ	k ɔ rː ɛ k t oː r ɛ m
r uː k ʊ m	r oː s k ɪ d ʊ m
d j a	tʰ iː a m
m ɛ d iː k aː r ɛ	m ɛ d ɪ k aː r ɛ
f r oː n d oː s ʊ m	f r ɔ n d oː s ʊ m
n a rː aː t j oː n	n aː rː aː t ʊ m
oː s k ʊ l ʊ m	oː s k ʊ l ʊ m
ɛ k s a s p ɛ r aː t j oː n ɛ m	ɛ k s a s p ɛ r aː t j oː n ɛ m
s k ɛ n t ɪ m lː aː r ɛ	s k ɪ n t ɪ lː aː r ɛ
k uː r w aː r ɛ	k ʊ r w aː r ɛ
p a m p aː n ʊ m	p a m p ɪ n ʊ m
a sː ɪ ʊ ʊ m	a sː ɛ sː ʊ m
a tː r iː b ʊ ɪ r ɛ	a tː r ɪ b ʊ ɛ r ɛ
a b ɪ g ɪ ʊ m	a b ɪ g ɛu m
s ɪ t uː l a m	s ɪ t ʊ l a m
p uː l w ɪ n aː r ɛ	p ʊ l w iː n a r
k ɔ n f ɛ s aː r	k oː n f ɪ t eː r iː
g eː r m aː n ʊ m	g ɛ r m aː n ʊ m
t r aː n s iː t ʊ m	t r aː n s ɪ t ʊ m
a s p ɛ r g ɛ r ɛ ɛ	a s p ɛ r g ɛ r ɛ
p ɔ m ɛ t ʊ m	p ɔ m eː t ʊ m
a b aː t j a m	a bː aː t j a m
eː r g aː s t ʊ l ʊ m	ɛ r g a s t ʊ l ʊ m
a w ɛ lː ɪ n a m	a b ɛ lː a n a m
k ɔ k oː l ʊ m	k ʊ k ʊ lː ʊ m
k ɪ ɔ n kʷ ɛ k	kʷ ɛ m k ʊ m kʷ ɛ
s uː s uː rː ʊ m	s ʊ s ʊ rː ʊ m
f ɛ k ʊ n d ʊ m	f eː k ʊ n d ʊ m
m ɪ l j aː r j ʊ m	m iː lː j aː r j ʊ m
ɔ b s ɛ kʷ j ʊ m	ɔ b s ɛ kʷ j ʊ m
k ɔ m ʊ n j ʊ m n ɛ m	k ɔ mː uː n iː r ɛ
a l t ɛ r k aː t j oː n ɛ m	a l t ɛ r k aː t j oː n ɛ m
r ɔ k d ɪ k ʊ n	r ɪ d ɪ k a m
s a t iː s f aː k ɛ r ɛ	s a t ɪ s f a k ɛ r ɛ
s p uː t aː r ɛ	s p uː t aː r ɛ
a rː ɔ t ʊ m	r uː k t ʊ m
s ʊ s p ɪ r j aː r ɛ	s ʊ s p iː r aː r ɛ
p r ɔ s k r iː b ɛ r ɛ	p r oː s k r iː b ɛ r ɛ
t oː d aː r ɛ m	t ɔ n d eː r ɛ
k ɔ k s aː l ɛ	k ɔ k s aː l ɛ m
ɪ n t ɛ lː eː k k j oː n ɛ m	ɪ n t ɛ lː ɛ k t j oː n ɛ m
d ɛ n t ɪ f r ɪ k ʊ m	d ɛ n t ɪ f r ɪ k j ʊ m
k ɔ n d ɛ n s aː t j oː n ɛ m	k ɔ n d eː n s aː t j oː n ɛ m
g a lː ɛ g ʊ m	g a lː aɪ k ʊ m
ɔ l ɪ r ɛ m	ɔ l eː r ɛ
ɪ m p ɛ r j oː s ʊ m	ɪ m p ɛ r j oː s ʊ m
a n ɔ m aː l ʊ m	a n oː m a l ɔ n
f a r t aː r ɛ	f a r k iː r ɛ
k ɪ k ɔ r j ɛ	k ɪ kʰ ɔ r j ʊ m
k ɔ n g j ʊ m	k ɔ ŋ g j ʊ m
k ɛ r t aː r ɛ	k ɛ r t aː r ɛ
eː k s p l oː r aː t oː r	ɛ k s p l oː r aː t oː r ɛ m
kʷ ɛ r ɛ l a m	kʷ ɛ r eː l a m
a fː d a n t aː r	a fː ɪ d ɛ n t j aː r ɛ
a l uː n ʊ m	a l ʊ m n ʊ m
r ɛ k ɛ sː iː w ʊ m	r ɛ k ɛ sː iː w ʊ m
s ɔ l iː d ʊ m	s ɔ l ɪ d ʊ m
d ɛ s t ɪ n aː r ɛ	d eː s t ɪ n aː r ɛ
m ʊ lː ɛ k j ɛ m	m ɔ lː ɪ t ɪ ɛ m
ɔ b b j ʊ m m	ɔ b w j ʊ m
s t uː p iː r ɛ	s t ʊ p eː r ɛ
g r aː w ɪ d ʊ m	g r a w ɪ d ʊ m
a w aː n a m	a w eː n a m
p r a n t d ʊ m	p r a n d j ʊ m
ɪ n s uː l s ʊ m	iː n s ʊ l s ʊ m
k a n ɔ r ʊ m	k a n oː r ʊ m
p r oː w ɛ m n ɪ r ɛ	p r oː w ɛ n iː r ɛ
t r ɪ t ʊ r a m	t r iː t uː r a m
r aː a m	r a j a m
kʷ a d r ʊ p l a m r ɛ	kʷ a d r ʊ p l aː r ɛ
ɛ k s t ɛ r m ɪ n aː k j ɛ m n	ɛ k s t ɛ r m ɪ n aː t j oː n ɛ m
p r aʊ s ɛ n j oː m	p r ɔ s k eː n j ʊ m
ɪ n k ɛ n d ɛ r ɛ	ɪ ŋ k ɛ n d ɛ r ɛ
p uː b ɛ m	p uː b ɛ r ɛ m
a w ɛ r s j oː n ɛ	aː w ɛ r s j oː n ɛ m
w ɪ n aː r ɛ	w eː n aː r iː
r eː w ɔ l w ɛ r ɛ	r ɛ w ɔ l w ɛ r ɛ
h k ʊ r t aː r ɛ	k ʊ r t aː r ɛ
a k uː m ɛ m m	a k uː m ɛ n
p ɛ r n a m	p ɛ r n a m
t ɛ s uː r a m	t eː n s uː r a m
w ɛ r t iː g ɪ n ɛ	w ɛ r t iː g ɪ n ɛ m
l ɪ b ɛ r aː t oː r ɛ	l iː b ɛ r aː t oː r ɛ m
a fː ɪ r m aː t j oː n ɛ m	a fː ɪ r m aː t j oː n ɛ m
ɪ n s ɛ r iː r ɛ	iː n s ɛ r ɛ r ɛ
r ɪ g ʊ r oː s ʊ m	r ɪ g ɔ r ɔ s ʊ m
r ɛ p ɛ r k uː s j oː n ɛ m	r ɛ p ɛ r k ʊ t ɛ r ɛ
r uː b iː g iː n oː s ʊ m	r oː b iː g ɪ n oː s ʊ m
a l ɔ k aː r ɛ	a lː ɔ k aː r ɛ
l ɛ t iː t j j a m m	l aɪ t ɪ t j a m
m a l t aː	m a l tʰ a m
a k t ʊ m	aː k t ʊ m
k a l k ɛ m	k a l k ɛ m
s ɛ k s w aː l ɪ t aː t ɛ m	s ɛ k s w aː l ɪ t aː t ɛ m
ɪ n f l ɪ k t j oː n ɛ m	ɪ n f l ɪ k t j oː n ɛ m
f ɛ k ʊ l ɛ n t ʊ m	f aɪ k ʊ l ɛ n t ʊ m
r ɛ t aː r d aː r ɛ	r ɛ t a r d aː r ɛ
aɪ w ʊ m	aɪ w ʊ m
k ɛ l ɛ s t j aː l ɛ	k aɪ l ɛ s t j aː l ɛ m
f ʊ l iː g ɪ n ɛ m	f uː l iː g ɪ n ɛ m
ɛ m uː l ʊ m	aɪ m ʊ l ʊ m
f ɪ m b r j aː t ʊ m	f ɪ m b r j aː t ʊ m
a l ɛ g aː r ɛ	a lː ɛ g ɛ r ɛ
s aː t iː s f aː k t j oː n ɛ m	s a t ɪ s f a k t j oː n ɛ m
m a g iː k ʊ m	m a g ɪ k ʊ m
k oː ŋ g r ʊ m	k ɔ ŋ g r ʊ m
p uː p iː lː ʊ m	p uː p ɪ lː ʊ m
r ɛ f l ɛ t ɛ r ɛ	r ɛ f l ɛ k t ɛ r ɛ
ɪ w g l ɛ ɛ	a ŋ g l eː n s ɛ m
p ɛ r k ʊ s oː r	p ɛ r k ʊ sː oː r ɛ m
a r k a m	a r kʰ a m
a b aː kʰ ʊ l ʊ m	a b a k ʊ l ʊ m
ɪ m p ɔ s iː t j oː n ɛ m	ɪ m p ɔ s ɪ t j oː n ɛ m
k uː p iː d iː t ɛ m	k ʊ p ɪ d ɪ t aː t ɛ m
s a k r aː m ɛ n t aː l ɛ	s a k r aː m ɛ n t aː l ɛ m
oː rː ɪ ʊ m	h ɔ rː ɛu m
d ɪ f l ʊ ɛ r	d ɪ fː l ʊ ɛ r ɛ
ɛ k s kʰ r ɛ t aː r ɛ	ɛ k s k ɛ r n ɛ r ɛ
m ɛ r ɛ t r iː k j ʊ m	m ɛ r ɛ t r iː k j ʊ m
d ɔ l aː r ɛ	d ɔ l aː r ɛ
k uː w iː l	k ʊ b iː l ɛ
r ɛ k ɔ n k ɪ l j aː t j ʊ m n ɛ m	r ɛ k ɔ ŋ k ɪ l j aː t j oː n ɛ m
a r m aː r ɛ	a r m aː r ɛ
f ɪ r ɛ m	f ɪ ɛ r iː
k ɔ l oː n j a m ɛ m	k ɔ l oː n j a m
a sː oː l aː r ɛ	a sː ɔ l aː r ɛ
d eː f ɔ r m ɛ m	d eː f oː r m ɛ m
eː m aː k ɪ t a m	ɛ m aː k ɪ t aː t ɛ m
a k s k ɛ s m oː r j ʊ m	a kː ɛ sː oː r j ʊ m
k ɔ n s ɪ k n aː t j oː n ɛ m	k oː n s ɪ ŋ n aː t j oː n ɛ m
a m aː n ʊ ɛ n s ɛ m	aː m a n ʊ eː n s ɛ m
a b s t r s ʊ	a b s t r uː s ʊ m
ɔ r k ʊ m	ɔ r k ʊ m
b ɛ n ɛ m	b ɪ ɛ nː ɛ m
p ɔ n t ɛ f iː k ɛ m	p ɔ n t ɪ f ɪ k ɛ m
k ɔ n t ɛ m p l aː r ɛ	k ɔ n t ɛ m p l aː r iː
s t r ɪ g ɛ m	s t r ɪ g ɛ m
l a k uː s t r ɛ m	l a k ʊ s t r ɛ m
t uː r p ɛ m	t ʊ r p ɛ m
f r aː n k ɛ s ɛ	f r a ŋ k eː n s ɛ m
r ɛ t r aː k t j oː n ɛ m	r ɛ t r a k t j oː n ɛ m
f uː l w ʊ m	f ʊ l w ʊ m
g ɛ ɔ g r aː f j m a m	g eː ɔ g r a pʰ j a m
n ɔ r m a m	n oː r m a m
ɪ t ɪ n ɛ r aː r j ʊ m	ɪ t ɪ n ɛ r aː r j ʊ m
kʷ ɛ s iː t ʊ m	kʷ aɪ s iː t ʊ m
p ɪ p aː r ɛ	p iː p aː r ɛ
b a s t ɛ r n a m	b a s t ɛ r n a m
n ɔ m iː n aː t j oː n ɛ	n oː m ɪ n aː t j oː n ɛ m
g a l ɛ n a m	g a l eː n a m
d ɛ w j aː r ɛ	d eː w j aː r ɛ
f l aː m ɪ n g ʊ m	f a m eː l ɪ k ʊ m
f ʊ l g oː r ɛ	f ʊ l g oː r ɛ m
ɪ m p ɔ r t uː n ɪ t aː t ɛ m	ɪ m p ɔ r t uː n ɪ t aː t ɛ m
p r j ɔ r ɛ m	p r j oː r ɛ m
ɔ s t ɛ n t iː w ʊ m	ɔ s t eː n s iː w ʊ m
ɔ b t ɪ n eː r ɛ	ɔ b t ɪ n eː r ɛ
k ɔ n k ɔ r d j a m	k ɔ ŋ k ɔ r d j a m
m ɛ d iː r	m eː t iː r iː
n ɛ r w oː s ʊ m	n ɛ r w oː s ʊ m
s uː b s ɪ d j ʊ m	s ʊ b s ɪ d j ʊ m
p a l ʊ m	p aː l ʊ m
r aː k eː m ʊ m	r a k eː m ʊ m
a l ɪ t ʊ m	h aː l ɪ t ʊ m
k a l iː g a m	k a l ɪ g a m
k ɔ n s ʊ l t aː t j oː n ɛ m	k oː n s ʊ l t aː t j oː n ɛ m
f uː r t ʊ m	f uː r t ʊ m
m uː n iː k iː p aː l ɛ	m uː n ɪ k ɪ p aː l ɛ m
t r ɪ k ɛ m	t r iː k ɛ m
s p ɛ l t a m	s p ɛ l t a m
p uː l k r iː t ʊ d ɛ m	p ʊ l kʰ r ɪ t uː d ɪ n ɛ m
w ɛ r ɛ k ʊ n d j a m	w ɛ r eː k ʊ n d j a m
s t ɛ l aː r ɛ	s t eː lː aː r ɛ m
b l ɛ ʊ t ɛ m ɛ	b l a s pʰ eː m aː r ɛ
k r ɛ d iː t oː r ɛ	k r eː d ɪ t oː r ɛ m
d ɪ s p oː r ɛ r	d ɪ s p oː n ɛ r ɛ
k ɪ d	k iː d a m
w ɪ t uː p ɛ r aː t j oː n ɛ m	w ɪ t ʊ p ɛ r aː t j oː n ɛ m
a s k ɛ n s j oː n ɛ m	a s k eː n s j oː n ɛ m
g aʊ d ʊ m	g aʊ d j ʊ m
d eː s iː d ɛ ɛ aː r ɛ	d eː s iː d ɛ r aː r ɛ
r ɛ k ɔ n k ɪ l j aː r ɛ	r ɛ k ɔ ŋ k ɪ l j aː r ɛ
p a l uː d ɛ	p a l uː d ɛ m
ɪ n aː l aː r ɛ	ɪ n h aː l aː r ɛ
a s t r ɪ n g ɛ r ɛ m	a s t r ɪ ŋ g ɛ r ɛ
a m ɛ n ʊ m	a m ɔ ɪ n ʊ m
f a b ʊ r ɪ k aː t j oː n ɛ m	f aː b r ɪ k aː t j oː n ɛ m
m ɔ n d ʊ m	m ʊ n d ʊ m
a r g ɪ lː a m	a r g ɪ lː a m
m uː n iː k iː p j ʊ m	m uː n ɪ k ɪ p j ʊ m
p r ɔ l ɛ m	p r oː l ɛ m
r iː ʊ m	r iː w ʊ m
a b s uː r d ɪ d aː t ɛ m	a b s ʊ r d ɪ t aː t ɛ m
m eː n t ʊ m	m ɛ n t ʊ m
a m ɪ k ɪ t j a m	a m iː k ɪ t j a m
p ɪ s t aː ɛ	p ɪ s t aː r ɛ
