t r ɪ n j t aː t ɛ m	t r iː n ɪ t aː t ɛ m
k a r ɛ n a m	k a r iː n a m
p ɔ n d ɛ r oː s ʊ m	p ɔ n d ɛ r oː s ʊ m
m uː r ɪ k ɛ m	m uː r ɪ k ɛ m
k ɔ n t aː m iː n aː t j oː n ɛ m	k ɔ n t aː m ɪ n aː t j oː n ɛ m
s t r ɪ ŋ g ɛ r ɛ	s t r ɪ ŋ g ɛ r ɛ
f ʊ l aː k a m	f ʊ l ɪ k a m
a m ɪ k t ʊ m	a m ɪ k t ʊ m
g r uː m ʊ m	g r uː m ʊ m
a l uː k ɛ	h a lː ʊ m
ɪ m p ɔ s ɪ t j oː n ɛ m	ɪ m p ɔ s ɪ t j oː n ɛ m
r ɛ k ɪ t aː t j oː n ɛ m	r ɛ k ɪ t aː t j oː n ɛ m
eː l uː d ɛ r ɛ	eː l uː d ɛ r ɛ
b l ɛ d ʊ m	b l ɪ t ʊ m
m uː n ɔ m	m uː n ʊ s
j eː ɔ m ɛ t r j a m	g ɛ oː m ɛ t r j a m
eː fː ɪ k aː k ɛ m	ɛ fː ɪ k aː k ɛ m
f eː t ɛ r ɛ	f eː t eː r ɛ
t r aː n s p oː r ɛ m	t r aː n s p oː n ɛ r ɛ
s ɛ r oː t ɪ n ʊ m	s eː r oː t ɪ n ʊ m
t ɛ m ɛ r ɪ t aː t ɛ m	t ɛ m ɛ r ɪ t aː t ɛ m
d ɪ s w aː d ɛ r ɛ	d ɪ sː w aː d eː r ɛ
n ɔ t ʊ	n ɔ t a m
eː m ɛ n d aː r ɛ	eː m ɛ n d aː r ɛ
f eː s t ɪ n aː r ɛ	f ɛ s t iː n aː r ɛ
eː fː ɛ k t aː ɛ r ɛ	ɛ fː ɪ k ɛ r ɛ
a kː ɔ rː eː r ɛ m	a kː ʊ rː ɛ r ɛ
s eː k uː r ɛ m	s ɛ k uː r ɛ m
s a r g ʊ m	s a r g ʊ m
k ɔ l uː b r ɪ n ʊ m	k ɔ l ʊ b r iː n ʊ m
s uː s k iː t aː r ɛ	s ʊ s k ɪ t aː r ɛ
g ɔ s ʊ aː	g ɛu s j aː s
r ɛ l ɛ g aː r ɛ	r ɛ l ɪ g aː r ɛ
s a ŋ gʷ ɪ n aː r j ʊ m	s a ŋ gʷ ɪ n aː r j ʊ m
a b ɔ l ɪ t j oː n ɛ m	a b ɔ l ɪ t j oː n ɛ m
a b ɪ t ʊ aː l ɛ	h a b ɪ t w aː l ɛ m
ɪ n f ɛ k t j oː n ɛ m	ɪ n f ɛ k t j oː n ɛ m
ɪ r aː k ʊ n d j a m	iː r aː k ʊ n d j a m
s a k ɛ r d oː t ɛ m	s a k ɛ r d oː t ɛ m
r ɔ r aː r ɛ	r oː r aː r ɛ
l ɛ mː a m	l ɛ mː a
k ɔ r t ɛ m	k oː r t ɛ m
ɔ r b ʊ m	ɔ r b ʊ m
d j a	tʰ iː a m
k ʊ p l a m	k oː p ʊ l a m
k ɔ m p aː r eː s k r ɛ	k ɔ m p aː r eː r ɛ
t a l ɔ t ɪ	t aː l ʊ m
ɪ n k uː l k aː r ɛ	ɪ ŋ k ʊ l k aː r ɛ
r eː p uː d j aː r ɛ	r ɛ p ʊ d j aː r ɛ
k a l k a n ʊ m	k a l k aː n ɛu m
w ɔ l w ɛ r ɛ	w ɔ l w ɛ r ɛ
l ɔ k aː r ɛ	l ɔ k aː r ɛ
k ɔ n t ɪ n w ʊ m	k ɔ n t ɪ n ʊː m
t ɛ d j oː s ʊ m	t aɪ d j oː s ʊ m
a b uː s aː r ɛ	a b uː t iː
t ɪ s ɪ k ʊ m	p eː h tʰ ɪ s ɪ k ʊ m
s p ɔ r t a m	s p ɔ r t a m
p a r t ɪ k ʊ l a m	p a r t ɪ k ʊ l a m
k a n d ɛ l aː b r ʊ m	k a n d eː l aː b r ʊ m
f a s ɪ ŋ ɛ m	f a s k ɛ m
p ɛ n uː r j a m	p eː n uː r j a m
p uː n aː r ɛ	p ʊ ŋ n aː r ɛ
w ɪ m ɪ n ɛ m	w iː m ɛ n
k l aː w ɪ k ɔ r d j ʊ m	k l aː w iː kʰ ɔ r d j ʊ m
k ɔ n s oː l aː t j oː n ɛ m	k oː n s oː l aː t j oː n ɛ m
f ɔ r m a m	f oː r m a m
k a n t oː r ɛ m	k a n t oː r ɛ m
w ɪ n ɛ t ʊ m	w iː n eː t ʊ m
ɛ k s p ʊ ŋ g ɛ r ɛ	ɛ k s p ʊ ŋ g ɛ r ɛ
ɪ mː aː t ʊ r ɪ t t ɛ m t ɛ m	ɪ mː aː t uː r ɪ t aː t ɛ m
p r ɔ p aː g aː t j oː n ɛ m	p r oː p aː g aː t j oː n ɛ m
s ɪ n k ɪ p ʊ m s	s ɪ ŋ k ɪ p ʊ t
p r aɪ s ʊ m ɛ r ɛ	p r aɪ s uː m ɛ r ɛ
eː fː aɪ m ɪ n aː r ɛ	ɛ fː eː m ɪ n aː r ɛ
l ɛ g aː t ʊ m	l eː g aː t ʊ m
t uː r g ɪ d ʊ m	t ʊ r g ɪ d ʊ m
k a s aː r ʊ m	k aː s ɛ aː r j ʊ m
s ɪ d ɛ r ɛ ʊ m	s iː d ɛ r ɛu m
a dː ɪ t j oː n ɛ	a dː ɪ t j oː n ɛ m
b a r ɪ t ɔ n ʊ m	b a r y t ɔ n ʊ m
r a p iː r ɛ	r a p ɛ r ɛ
p a r ʊ m	p a r ɛ m
w ɪ k ʊ m	w iː k ʊ m
ɔ rː ɪ f ɪ k ʊ m	h ɔ rː ɪ f ɪ k ʊ m
p r ɛ w ɛ r ɛ	p r aɪ w ɪ d eː r ɛ
m a l f aː t oː r ɛ	m a l ɛ f a k t oː r ɛ m
b aː n ʊ m	b a l n ɛu m
a n aː l ɪ s ɪ m	a n a l y s ɛ m
k r ɪ m ɪ n oː s ʊ m	k r iː m ɪ n oː s ʊ m
r eː k aː l t ɪ t r aː r ɛ	r ɛ k a l k ɪ t r aː r ɛ
k a lː ʊ m	k a lː ʊ m
m ɔ d ɛ r aː t oː r ɛ	m ɔ d ɛ r aː t oː r ɛ m
p ɪ s aː r ɛ	p iː n s ɛ r ɛ
r uː s t ɪ k aː n ʊ m	r uː s t ɪ k aː n ʊ m
j eː n t ɪ l iː t a m t ɛ m	g ɛ n t iː l ɪ t aː t ɛ m
s ɔ l ʊ m	s oː l ʊ m
d eː w j aː t j ʊ m n ɛ m	d eː w j aː t j oː n ɛ m
s ʊ g j ɛ m t ʊ m	s ʊ b ɪ ɛ k t ʊ m
k ɔ n s ɛ n t iː r ɛ	k oː n s ɛ n t iː r ɛ
k ɪ d	k iː d a m
f r aɪ n aː r ɛ	f r eː n aː r ɛ
eː r k ɛ r ɛ	eː r ɪ g ɛ r ɛ
aʊ g uː r j ʊ m	aʊ g ʊ r j ʊ m
a l ɪ j eː n aː r ɛ	a l ɪ eː n aː r ɛ
ɪ b ɪ l ɛ m	ɪ b ɪ l ɛ m
ɪ l ɛ g aː l ɛ m	ɪ lː eː g aː l ɛ m
k ɛ s p ɪ t ɛ m	k aɪ s p ɪ t ɛ m
l ɛ ɛ t ʊ m	l aɪ t ʊ m
d eː p r ɛ d aː r ɛ	d eː p r aɪ d aː r iː
k ɛ n ʊ m	k ɪ nː ʊ m
s ɔ kː ɔ rː eː r ɛ	s ʊ kː ʊ rː ɛ r ɛ
ɪ n k ɛ n s ʊ m	ɪ ŋ k eː n s ʊ m
s ɔ l ɪ d ʊ m	s ɔ l ɪ d ʊ m
s ʊ l k aː r ɛ m	s ʊ l k aː r ɛ
a k k j ɛ	a k ɪ ɛ m
a nː ɛ g aː r ɛ	eː n ɛ k aː r ɛ
ɪ ŋ g ɛ n ʊ m	ɪ ŋ g ɛ n j ʊ m
l a p ɪ d aː r ɛ	l a p ɪ d aː r ɛ
m ɪ lː a m	m iː lː j a
a r iː m ɪ l a m	a r m ɪ lː a m
k ɔ m p ʊ n g ɛ r ɛ	k ɔ m p ʊ ŋ g ɛ r ɛ
s ɛ n s ʊ aː l ɪ t aː t ɛ m	s ɛ n s w aː l ɪ t aː t ɛ m
a s ɛ aː	a s k ɛ lː a m
ɪ n t ɛ r ɪ m eː t eː r k ɛ	ɪ n t ɛ r m ɪ tː ɛ r ɛ
p a t r j a m	p a t r j a m
s uː d aː r j ʊ m	s uː d aː r j ʊ m
a b r ɔ t aː n ʊ m	a b r ɔ t ɔ n ʊ m
n uː m ɛ r ɔ s ɪ t aː t ɛ m	n ʊ m ɛ r oː s ɪ t aː t ɛ m
p r ɪ m ɔ g ɛ n ɪ t ʊ m	p r iː m oː g ɛ n ɪ t ʊ m
a w ɪ ʊ m	a w ɛ m
a kː iː d j a m	a k eː d j a m
r ɔ g aː r ɛ	r ɔ g aː r ɛ
m aɪ s t m ɪ t ʊ m	m ɪ k s t iː k j ʊ m
d eː g r aː d aː t j oː n ɛ m	d eː g r a d aː t j oː n ɛ m
ɛ b d ɔ m aː d aː r j ʊ m	h ɛ b d ɔ m a d aː r j ʊ m
ʊ ɪ t ʊ m	aʊ d iː t ʊ m
p a l uː s t r ɛ m	p a l uː s t r ɛ m
a pː aː r aː r ɛ	a pː a r aː r ɛ
a r k aː r ʊ m	a r k w aː r j ʊ m
m ɪ n ɔ r aː r	m ɪ n oː r aː r ɛ
d eː w ɔ l w ɛ r ɛ	d eː w ɔ l w ɛ r ɛ
a b d ɔ m ɛ n	a b d oː m ɛ n
f l ɔ r ɪ d ʊ m	f l oː r ɪ d ʊ m
w ɪ k a m	b iː g a m
ɛ t aː t ɛ m	aɪ t aː t ɛ m
p r ɔ k aː k ɛ m	p r ɔ k aː k ɛ m
k ɔ m p ɛ t iː t j oː n ɛ	k ɔ m p ɛ t iː t j oː n ɛ m
ɪ n t ɛ g r ʊ m	ɪ n t ɛ g r ʊ m
p eː n d ɛ r ɛ m	p ɛ n d eː r ɛ
k ɔ t ɛ m n	k oː t ɛ m
ɪ n f l ʊ ɛ r ɛ	iː n f l ʊ ɛ r ɛ
p eː k a m	p iː k a m
s ʊ b t ɪ l ɛ m	s ʊ b t iː l ɛ m
t r ɪ f oː l j aː t ʊ m	t r ɪ f ɔ l j aː t ʊ m
w ɛ s t r uː k ʊ m	s t r uː tʰ j oː n ɛ m
p a t r ɪ t j ʊ m	p aː t r ɪ k j ʊ m
k ɔ m p aː t r ɛ m	k ɔ m p a t r ɛ m
eː m uː l aː t oː r ɛ	aɪ m ʊ l aː t oː r ɛ m
r uː g ʊ m s ʊ m	r uː g oː s ʊ m
a fː aː s t ɪ n aː r ɛ	f a s k ɪ n aː r ɛ
a r ɔ t ʊ m	r uː k t ʊ m
k ɔ n s ʊ m	k oː n s k j ʊ m
oː s t r ʊ m	aʊ s t r ʊ m
b a g a m	b aː k a m
ɪ n s t aʊ r aː r ɛ	iː n s t aʊ r aː r ɛ
a s p ɛ k t aː r ɛ	a s p ɛ k t aː r ɛ
m ɛ r g ɛ r ɛ	m ɛ r g ɛ r ɛ
r ɛ k ɛ sː ʊ m	r ɛ k ɛ sː ʊ m
ɔ b ɛ d ɛ t ɛ r	ɔ b ɔ ɪ d iː r ɛ
a b g uː r aː t j oː n ɛ m	a b ɪ uː r aː t j oː n ɛ m
a k ɪ n ʊ m	a k ɪ n ʊ m
k l aʊ d ɪ k aː r ɛ	k l aʊ d ɪ k aː r ɛ
m uː w eː r ɛ	m ɔ w eː r ɛ
l ɪ b m r ʊ m	l iː b ɛ r ʊ m
r ɪ d ɛ r ɛ	r iː d eː r ɛ
j z aː n k a m	z a ŋ kʰ a m
b r uː k ʊ m	b r uː kʰ ʊ m
j uː r ɪ s p r ʊ d ɛ n t ɛ m	j uː r ɪ s p r uː d ɛ n t j a m
kʷ a d r ʊ p l a m r ɛ	kʷ a d r ʊ p l aː r ɛ
k r aɪ s p ʊ m	k r ɪ s p ʊ m
b l aː n d ɪ r ɛ	b l a n d iː r iː
ɛ k s k l ʊ d ɛ r ɛ	ɛ k s k l uː d ɛ r ɛ
n ɪ m b ʊ m	n ɪ m b ʊ m
a l t ɪ s ɪ m ʊ m	a l t ɪ sː ɪ m ʊ m
k ɔ n f ɛ s oː r ɛ	k oː n f ɛ sː oː r ɛ m
t r a m a m	t r aː m a m
n ɔ t ɔ r j ʊ m	n oː t oː r j ʊ m
m a r ɪ t aː l ɛ	m a r iː t aː l ɛ m
r ɛu w ɛ r s aː r	r ɛ w ɛ r s aː r ɛ
ɪ n uː l t ʊ m	ɪ n ʊ l t ʊ m
l ɪ t j ɛ r aː	l ɛ k t w aː r j ʊ m
s ɔ l ɛ w aː r ɛ	s ʊ b l ɛ w aː r ɛ
k ɔ n s k ɛ j ɛ n t j a m	k oː n s k ɪ ɛ n t j a m
r a p ɪ n a m	r a p iː n a m
w ɪ p ɛ r iː n ʊ m	w ɪ p ɛ r iː n ʊ m
n ɔ k ɪ t ʊ m	n ʊ k eː t ʊ m
p a r t ʊ m	p a r d ʊ m
a g r aː r ʊ m	aː g r aː r j ʊ m
aʊ k s ɪ l j aː r ɛ	aʊ k s ɪ l j aː r ɛ m
a kː r ɛ t j oː n ɛ	a kː r eː t j oː n ɛ m
d ɪ s k ʊ r s ɪ w ʊ m	d ɪ s k ʊ r s iː w ʊ m
a ŋ s k a m	a s k j a m
j eː k s ʊ m	g y p s ʊ m
p ɔ m ɪ k ɛ m	p uː m ɪ k ɛ m
aʊ d aː k j a m	aʊ d aː k j a m
k r aː p ʊ l m a m	k r aː p ʊ l a m
k a l ɪ g a m	k a l ɪ g a m
f ɛ b ʊ l ɛ m	f l eː b ɪ l ɛ m
m a r ɪ s k aː	m a r ɪ s k a m
eː d ɪ k t ʊ m	eː d ɪ k t ʊ m
k ɔ l ʊ m k aː r ɛ	k ɔ lː ɔ k aː r ɛ
d eː r ɪ s j ʊ m n ɛ m	d eː r iː s j oː n ɛ m
ɪ n k ʊ rː ɛ r ɛ	ɪ ŋ k ʊ rː ɛ r ɛ
k ɔ l ɔ r ɛ b ʊ m	k ɔ l ʊ m b ʊ m
a r k j a m	a r kʰ j a m
a fː ɛ k t ʊ m	a fː ɛ k t ʊ m
p a k ɪ f ɪ k ʊ m	p aː k ɪ f ɪ k ʊ m
a w ʊ m	a w ʊ m
s a l t aː t j ʊ m n ɛ m	s a l t aː t j oː n ɛ m
j z ɪ d j aː n j a m	z iː zː a n j a
k ɔ r j a n d ʊ m r ʊ m	k ɔ r j a n d r ʊ m
n a t ʊ m	n aː t ʊ m
ɪ rː ɪ t aː r	ɪ rː iː t aː r ɛ
r eː w ɛ d ɛ r ɛ	r ɛ w ɪ d eː r ɛ
h ɛ r b oː s ʊ m	h ɛ r b oː s ʊ m
s t ɪ n d ɛ r ɛ	s k ɪ n d ɛ r ɛ
a r b ɔ r ɛ t ʊ m	a r b ɔ r eː t ʊ m
f r uː k t w oː s ʊ m	f r ʊ k t ʊ oː s ʊ m
d eː w ɛ n ɪ r ɛ	d eː w ɛ n iː r ɛ
ʊ m ɪ d ʊ m	uː m ɪ d ʊ m
d eː k aː l w aː t j oː n ɛ m	d eː k a l w aː t j oː n ɛ m
eː w ɪ ŋ t eː r ɛ	eː w ɪ ŋ k ɛ r ɛ
p ɛ s aː r ɛ	p eː n s aː r ɛ
ɪ t ɛ r aː t j oː n ɛ m	ɪ t ɛ r aː t j oː n ɛ m
a l n ʊ m n	a l n ʊ m
kʷ a d r ʊ p l ɪ k aː r ɛ	kʷ a d r ʊ p l ɪ k aː r ɛ
k aː ʊ t aː r m ɛ m	k ɔ a k t aː r ɛ
l ɔ m b ʊ m	l ʊ m b ʊ m
s ɔ n rː ɪ d ɪ r ɛ	s ʊ b r iː d eː r ɛ
ɛ d ɪ f ɪ k aː t j oː n	aɪ d ɪ f ɪ k aː t j oː n ɛ m
s ʊ b t ɪ l iː t ɛ m	s ʊ b t iː l ɪ t aː t ɛ m
s eː s kʷ ɪ p eː d aː l ɛ	s eː s kʷ ɪ p ɛ d aː l ɛ m
r uː m ɪ n aː r ɛ	r uː m ɪ n aː r iː
a sː uː m ɛ r ɛ	a sː uː m ɛ r ɛ
m ɔ t ɪ w ʊ m	m oː t ɪ w ʊ m
k ɛ n s ʊ r ʊ m	k eː n s uː r a m
ɛ n s ɛ m	eː n s ɛ m
s p uː m oː s ʊ m	s p uː m oː s ʊ m
a b ɪ g ɛ ʊ m	a b ɪ g ɛu m
t r aː n s k ɛ n d ɛ r ɛ	t r aː n s k ɛ n d ɛ r ɛ
j uː b g ʊ l aː r ɛ	j ʊ g ʊ l aː r ɛ
d eː n ɔ m ɪ n aː t j oː n ɛ m	d eː n oː m ɪ n aː t j oː n ɛ m
p ʊ l w ɛ r iː n s aː r ɛ	p ʊ l w ɛ r iː zː aː r ɛ
ɛ k s k oː g iː t a m r ɛ	ɛ k s k oː g ɪ t aː r ɛ
r ɛ s ɛ n aː r ɛ	r ɛ s ɪ ŋ n aː r ɛ
d eː d uː k t j oː n ɛ m	d eː d ʊ k t j oː n ɛ m
g ɛ r uː n d j ʊ m	g ɛ r ʊ n d j ʊ m
s k aː b j a m	s k a b ɪ ɛ m
n ɔ w ɪ t j ʊ m	n ɔ w iː k j ʊ m
s t ɔ l t ʊ m	s t ʊ l t ʊ m
s ɔ r ɔ r ɪ t aː t ɛ m	s ɔ r oː r ɪ t aː t ɛ m
k ʊ p r ɛ m ɛ m ʊ m	k uː p r ʊ m
d ɪ t ʊ m	d ɪ k t ʊ m
m a r aː	m a rː a m
t ɪ p uː l a m	t ɪ pː ʊ l a m
w aː n ʊ m	w aː n ʊ m
d eː p r ɪ m ɛ r ɛ	d eː p r ɪ m ɛ r ɛ
l a sː ʊ m	l a sː ʊ m
f uː l k r ʊ m	f ʊ l k r ʊ m
k ɔ n s a ŋ gʷ ɪ n ɪ t aː t ɛ m	k oː n s a ŋ gʷ ɪ n ɪ t aː t ɛ m
r ɛ p r ɔ w aː r ɛ	r ɛ p r ɔ b aː r ɛ
m uː r aː lː a m	m uː r aː l ɛ m
ɪ r aː s j ɪ b ɪ l ɛ	iː r aː s k ɪ b ɪ l ɛ m
b ɔ b ʊ m	b a l b ʊ m
p aː r w ɪ n iː r ɛ m	p ɛ r w ɛ n iː r ɛ
ɪ n w ɪ d j oː s ʊ m	ɪ n w ɪ d j oː s ʊ m
a tː ɛ s t aː r ɛ	a tː ɛ s t aː r iː
ɪ b r ɪ d ʊ m	h y b r ɪ d a m
d ɪ s p aː r t ɪ r ɛ	d ɪ s p a r t iː r ɛ
m ɛ d ɪ t aː b ʊ n d ʊ m	m ɛ d ɪ t aː b ʊ n d ʊ m
k a n ɔ r ʊ m	k a n oː r ʊ m
s uː p uː t aː r	s ʊ pː ʊ t aː r ɛ
uː s p ɛ t aː r ɛ	h ɔ s p ɪ t aː r iː
a w aː n a m	a w eː n a m
t ɛ r s ʊ m	t ɛ r s ʊ m
d ɪ fː ɪ aː m aː r ɛ	d ɪ fː aː m aː r ɛ
w aː p r ɛ n a m	a l a p a m
b r ɪ t aː n iː k ʊ m	b r ɪ t a nː ɪ k ʊ m
s ɔ n ɛ k ɪ l oː s ʊ m	s ɔ m n ɪ k ʊ l oː s ʊ m
aɪ t ɛ r ɛ	aɪ tʰ ɛ r ɛ m
p r ɛ s ɛ n t ɪ r	p r aɪ s ɛ n t iː r ɛ
t ɛ r t j ʊ m	t ɛ r t j ʊ m
k eː r ɛ m oː n j aː l ɛ	k aɪ r ɪ m oː n j aː l ɛ m
p a d r a s t r ʊ m	p a t r a s t r ʊ m
f r aɪ kʷ ŋ ɛ n t ɛ m	f r ɛ kʷ ɛ n t ɛ m
k ɔ m p l ɛ t ɪ w ʊ m	k ɔ m p l eː t iː w ʊ m
s a p j ʊ m ɛ	s a p ɪ d ʊ m
f r aː s ɪ n ʊ m	f r a k s ɪ n ʊ m
s ɛ r j oː r ɛ ʊ m	s eː r j oː s ʊ m
p r eː s aː r ɛ	p r ɛ t j aː r ɛ
a d ɪ t aː m ɛ n t ʊ m	a dː ɪ t aː m ɛ n t ʊ m
s a k r ɪ f iː k aː t oː r ɛ	s a k r ɪ f ɪ k aː t oː r ɛ m
p r oː w ɛ d eː r ɛ	p r oː w ɪ d eː r ɛ
ɪ ŋ n aː r ʊ m	ɪ ŋ n aː r ʊ m
n ɛ f aː r j ʊ m	n ɛ f aː r j ʊ m
ɛ k s uː l t aː	ɛ k s ʊ l t aː r ɛ
d eː m ɪ t r	d eː m ɪ tː ɛ r ɛ
ɛ k s k oː g iː t aː t j oː n ɛ m	ɛ k s k oː g ɪ t aː t j oː n ɛ m
r ɛ d a r g ʊ ɛ r	r ɛ d a r gʷ ɛ r ɛ
b a p t ɪ s t a	b a p t ɪ s t a m
a dː ɪ k t ʊ m	a dː ɪ k t ʊ m
p r ɔ l ɛ m	p r oː l ɛ m
ʊ d j ɪ ɛ r n ʊ m	h ɔ d ɪ ɛ r n ʊ m
ɔ n oː r ɛ m	h ɔ n oː r ɛ m
ɛ k s k ʊ r s j oː n ɛ m	ɛ k s k ʊ r s j oː n ɛ m
ɪ n f ɛ r m ʊ m	iː n f ɪ r m ʊ m
ɪ ŋ d ɪ t j ʊ m	ɪ n d ɪ k j ʊ m
s p ɛ sː ʊ m	s p ɪ sː ʊ m
w ɛ rː n ʊ m	w ɛ rː ɛ m
p r ɔ f ʊ g ʊ m	p r ɔ f ʊ g ʊ m
k ɔ m p ɛ t iː t oː r ɛ	k ɔ m p ɛ t iː t oː r ɛ m
ɪ s p ɛ k t ʊ m n ɛ m ɛ m	iː n s p ɛ k t aː r ɛ
t a r d aː r ɛ	t a r d aː r ɛ
ɪ n k l ɪ t ʊ m	ɪ ŋ k l ɪ t ʊ m
ɪ n ɪ ɛ r iː r ɛ	ɪ ŋ g ɛ r ɛ r ɛ
a kː uː s aː b ɪ l ɛ m	a kː uː s aː b ɪ l ɛ m
ɛ k s t ɛ n d ɛ r ɛ	ɛ k s t ɛ n d ɛ r ɛ
k ɔ nː ʊ m	k ʊ nː ʊ m
b a s ʊ m	b a sː ʊ m
a m ɛ t ɪ s t a m	a m ɛ tʰ y s t a m
ɪ mː a t ʊ r ʊ m	ɪ mː aː t uː r ʊ m
ɔ fː ɛ r ɛ eː r ɛ m ɛ	ɔ fː ɛ rː ɛ
d eː s ɔ l aː t j oː n ɛ m	d eː s oː l aː t j oː n ɛ m
k ɔ n t r ɪ t ʊ m	k ɔ n t r iː t ʊ m
ɪ n t r ɔ ɪ t ʊ m	ɪ n t r ɔ ɪ t ʊ m
k ɔ l ʊ m b ɪ n ʊ m	k ɔ l ʊ m b iː n ʊ m
ɪ n f ɪ g eː r ɛ m	iː n f iː g ɛ r ɛ
b ɛ n ɛ	b ɪ ɛ nː ɛ m
k aɪ n ʊ m	k aɪ n ʊ m
r eː k ɔ r d aː r ɛ	r ɛ k ɔ r d aː r iː
s ɔ l ɪ d aː r ɛ	s ɔ l ɪ d aː r ɛ
p r ɔ k ʊ r aː r ɛ	p r oː k uː r aː r ɛ
g a l ɛ r ʊ m	g a l eː r ʊ m
k ɪ t ɪ s ʊ m	k y t ɪ s ʊ m
ɔ s p ɪ t aː l ɛ	h ɔ s p ɪ t aː l ɛ
f aɪ d ɛ	f ɪ d ɛ m
ɪ n f ɔ r m ɛ m	iː n f oː r m ɛ m
s a b w oː n ɛ m	s a b ʊ l oː n ɛ m
m ɔ r t aː l ɪ t t ɛ m t ɛ m	m ɔ r t aː l ɪ t aː t ɛ m
k ɔ rː ɔ d ɛ r ɛ	k ɔ rː oː d ɛ r ɛ
a m p ɔ lː a m	a m p ʊ lː a m
p r aɪ t ɛ r n aː t uː r aː l ɛ m	p r aɪ t ɛ r n aː t uː r aː l ɛ m
ɛ k s aː l t aː r ɛ	ɛ k s a l t aː r ɛ
k a l ɪ n d aː s	k a l ɛ n d aː s
ɛ k s aʊ r ɪ r ɛ	ɛ k s h aʊ r iː r ɛ
f ɛ r ɛ t r ʊ m	f ɛ r ɛ t r ʊ m
s ɛ r ɛ n aː r ɛ	s ɛ r eː n aː r ɛ
d eː p r ɛ d aː t j ʊ m n ɛ m	d eː p r aɪ d aː t j oː n ɛ m
s a n j ɛ m m	s a n ɪ ɛ m
k r oː n ɪ k ʊ m	kʰ r ɔ n ɪ k ʊ m
m uː k ɔ r ɛ m	m uː k oː r ɛ m
k oː lː ʊ m	k ɔ lː ʊ m
w a lː ʊ m	w a lː ʊ m
k ɔ ʊ p ɪ r	k oː n s p ʊ ɛ r ɛ
g uː s t aː t j oː n ɛ m	g ʊ s t aː t j oː n ɛ m
p r ɛ j s t m ɛ	p r ɛ s b y t ɛ r ʊ m
l ɛ pː r a m	l ɛ p r a m
s k r ʊ t aː r	s k r uː t aː r iː
d ɛ r ɔ r ɛ p ɛ m ɛ m	d iː r ʊ m p ɛ r ɛ
k ɔ k oː l ʊ m	k ʊ k ʊ lː ʊ m
eː r aɪ d ŋ m aː t ɛ m	h eː r eː d ɪ t aː t ɛ m
r ɛ m ɛ m b r aː r ɛ	r ɛ m ɛ m ɔ r aː r iː
s aː b ʊ rː a m	s a b ʊ rː a m
d eː m a n d aː r ɛ	d eː m a n d aː r ɛ
n a f t a m	n a pʰ tʰ a m
d ɪ fː ɛ r iː r ɛ	d ɪ fː ɛ rː ɛ
l eː k ʊ m	l aː ɪ k ʊ m
k ɔ ŋ n oː m ɛ m m	k oː ŋ n oː m ɛ n
r ɔ k d iː k ʊ m	r ɪ d ɪ k a m
p a r aː g r aː f ʊ m	p a r a g r a pʰ ʊ m
ɪ r aː k ʊ n d ʊ m	iː r aː k ʊ n d ʊ m
s eː p ʊ l k r ʊ m	s ɛ p ʊ l k r ʊ m
t ɔ l j ɛ r ɛ	t ɔ lː ɛ r ɛ
p ɛ kʷ aː r j ʊ m	p ɛ k w aː r j ʊ m
s n ɪ b l l aː r ɪ	s iː b ɪ l aː r ɛ
p a l p ɪ t aː t j oː n	p a l p ɪ t aː t j oː n ɛ m
p ɔ s t ɪ iː b ʊ l ʊ m	p r oː s t ɪ b ʊ l ʊ m
k ɔ n s t ɪ t uː m t j oː n ɛ m	k oː n s t ɪ t uː t j oː n ɛ m
p r ɛ s k r iː w ɛ r ɛ	p r aɪ s k r iː b ɛ r ɛ
r ɛ k t ɪ t uː d	r ɛ k t ɪ t uː d ɪ n ɛ m
l uː b r ɪ k ʊ m	l uː b r ɪ k ʊ m
ɪ n s ɛ r t j oː n ɛ m	iː n s ɛ r t j oː n ɛ m
s p uː t aː r ɛ	s p uː t aː r ɛ
r ɛ s uː m ɛ r ɛ	r ɛ s uː m ɛ r ɛ
a n d aː r ɛ	a m b ʊ l aː r ɛ
l ɪ k ɛ n	l iː kʰ eː n a
ɪ n w ɛ t ɛ r aː r ɛ	ɪ n w ɛ t ɛ r aː r ɛ
j uː d iː k aː t oː r ɛ	j uː d ɪ k aː t oː r ɛ m
a k k ɛ p t aː r ɛ	a kː ɪ p ɛ r ɛ
ɪ m n ʊ m	h y m n ʊ m
f a l s aː r ɛ	f a l s aː r ɛ
t r aː d ʊ k t j oː n ɛ	t r aː d ʊ k t j oː n ɛ m
l ɪ m a m	l iː m a m
k aʊ k t j oː n ɛ	k aʊ t j oː n ɛ m
f ɛ m ɛ l a m	f eː m ɛ lː a m
ɔ l ɪ g aː r k a m	ɔ l ɪ g a r kʰ a m
f a r m aː k ʊ m	pʰ a r m a k ʊ m
k ɔ n k ɛ d eː r ɛ	k ɔ ŋ k eː d ɛ r ɛ
k ɔ n s aː k r aː t j oː n ɛ m	k oː n s ɛ k r aː t j oː n ɛ m
p a l p ɛ b r aː l	p a l p ɛ b r aː l ɛ m
a b n ɔ r m ɛ m	a b n oː r m ɛ m
ɪ n kʷ j ɛ t uː d m n ɛ m	ɪ ŋ kʷ ɪ eː t uː d ɪ n ɛ m
k ɔ rː ɛ m a m	k ɔ rː ɪ g j a m
s a k r aː r j ʊ m	s a k r aː r j ʊ m
f eː n d ɛ r ɛ m	f ɪ n d ɛ r ɛ
