m ɔ r t aː r j ʊ m	m ɔ r t aː r j ʊ m
n a s ʊ t ʊ m	n aː s uː t ʊ m
d eː s t ɛ ŋ d ɛ r ɛ	d eː s k ɛ n d ɛ r ɛ
a k t a m	aː k t a
d eː f ɛ r iː r ɛ	d eː f ɛ rː ɛ
m a kː t ʊ s ʊ m	m a k ʊ l oː s ʊ m
r ɛu w ɛ r s aː r ɛ	r ɛ w ɛ r s aː r ɛ
s eː r ʊ m	s eː r ʊ m
r ɛ t ɪ n aː k l ʊ m	r ɛ t ɪ n aː k ʊ l ʊ m
p ɔ l ɪ k ɛ m	p ɔ lː ɪ k ɛ m
s ɪ r p ʊ m	s k ɪ r p ʊ m
ɪ m p ɪ ŋ g ɛ r ɛ	ɪ m p ɪ ŋ g ɛ r ɛ
k a l a m ʊ m	k a l a m ʊ m
k ɔ m p ɛ t iː t j oː n ɛ	k ɔ m p ɛ t iː t j oː n ɛ m
l a d r ɪ l ʊ m	l a t ɛ r k ʊ l ʊ m
f ʊ n d aː t oː r ɛ	f ʊ n d aː t oː r ɛ m
l aʊ r r ʊ m	l aʊ r ʊ m
l ɔ t ʊ m	l ʊ t ʊ m
p r ɛ w ɛ r oː n ʊ m	w eː r
f ɔ r m ɛ m	f oː r m ɛ m
d ɔ l aː r ɛ	d ɔ l aː r ɛ
ɪ t iː n ɛ r aː r j ʊ m	ɪ t ɪ n ɛ r aː r j ʊ m
n ɪ d ɪ f oː r m ɛ	n iː d ɪ f oː r m ɛ m
s k a l j aː r ɛ	s k aː l aː r ɛ m
p ʊ l w ɛ r iː oː s aː r ɛ	p ʊ l w ɛ r iː zː aː r ɛ
s ɛ g r ɛ g aː r ɛ	s eː g r ɛ g aː r ɛ
a w ɛ k n a m	a w eː n a m
a r k a ŋ g eː l ʊ m	a r kʰ a ŋ g ɛ l ʊ m
s k aː p ʊ l a m	s k a p ʊ l a m
a r ɛ aː l ɛ	aː r ɛ a l ɛ m
g uː b a m	j ʊ b a m
k ʊ l p a m	k ʊ l p a m
a s p ɛ k t ʊ m	a s p ɛ k t ʊ m
s a p j ɛ n t a m	s a p ɪ ɛ n t j a m
r uː t ɪ l aː r ɛ	r ʊ t ɪ l aː r ɛ
w ɛ n t ʊ m	w ɛ n t ʊ m
ɛ a r d aː r ɛ	w a r d aː r ɛ
ɪ n t ɛ r g ɛ k t j oː n ɛ m	ɪ n t ɛ r j ɛ k t j oː n ɛ m
a l ɪ w j aː r ɛ	a lː ɛ w j aː r ɛ
eː kʷ aː n ɪ m iː t aː t ɛ m	aɪ kʷ a n ɪ m ɪ t aː t ɛ m
a nː ɔ n a m	a nː oː n a m
p ʊ t aː r ɪ m	p ʊ t aː r ɛ
p r iː m ʊ g ɛ n ɪ t ʊ m	p r iː m oː g ɛ n ɪ t ʊ m
k a l a m ɪ t oː s ʊ m	k a l a m ɪ t oː s ʊ m
s ʊ b s t a n t j a m	s ʊ b s t a n t j a m
f ɔ s a m	f ɔ sː a m
ɪ m p ʊ n aː r ɛ	ɪ m p ʊ ŋ n aː r ɛ
d ɛ l ɛ t j oː n ɛ m	d eː l eː t j oː n ɛ m
g l ʊ k aː r ɛ	g l oː k iː r ɛ
l ɛ l n aː r ʊ m	l ɪ ŋ n aː r j ʊ m
k ɔ n ɛ k s j oː n ɛ m	k ɔ nː ɛ k s j oː n ɛ m
ɔ n ɛ s t ɛ m	h ɔ n ɛ s t aː t ɛ m
w ɛ n d eː m j aː r ɛ	w iː n d eː m j aː r ɛ
ɪ m p j ʊ m	ɪ m p j ʊ m
d ɛ p aː r t iː r ɛ	d eː p a r t iː r ɛ
k ɔ s w aː t ʊ m	k ɔ mː ɛ aː t ʊ m
f ɔ r ɔ m aː g ʊ m	f oː r m aː t ɪ k ʊ m
s k uː t ʊ m	s k uː t ʊ m
a d iː r ɛ	a dː ɛ r ɛ
eː l uː k ʊ b r aː r ɛ	eː l uː k ʊ b r aː r ɛ
p a n ɪ ʊ m	p aː n ɪ k j ʊ m
a k k ɛ d ɛ r ɛ	a kː eː d ɛ r ɛ
s aː w ɛ m	s w aː w ɛ m
ɪ t aː l j aː n ʊ m	iː t a l j aː n ʊ m
f aʊ k ɛ s	f aʊ k eː s
w eː l ɔ k ɛ	w eː l oː k ɛ m
ɔ p uː l ɛ n t j a m	ɔ p ʊ l ɛ n t j a m
d ɪ m a n aː r ɛ	d iː m aː n aː r ɛ
t r a w ɛ m	t r a b ɛ m
eː s t ɪ j ʊ m	aɪ s t aː t ɛ m
p a n ɛ	p aɪ aː n ɛ m
ɔ r aː t oː r ɛ m	oː r aː t oː r ɛ m
l ɪ g a m ɛ n t ʊ m	l ɪ g aː m ɛ n t ʊ m
a nː ʊ ɪ r ɛ m	a d n ʊ ɛ r ɛ
ɪ gː aː l t aː t ɛ m	aɪ kʷ aː l ɪ t aː t ɛ m
t ɛ r g ɪ w ɛ r k aː r ɛ	t ɛ r g ɪ w ɛ r s aː r iː
ɛ k s d ɪ t aː r ɛ	ɛ k s k ɪ t aː r ɛ
p r aɪ t ɛ r n aː t ʊ r a l ɛ m	p r aɪ t ɛ r n aː t uː r aː l ɛ m
b a s ɪ l ɪ k ʊ m	b a s ɪ l ɪ k ʊ m
p r ɔ l eː t aː r j aː t ʊ m	p r oː l eː t aː r j ʊ m
k a r ʊ m	k aː r ʊ m
d eː n ɔ m ɪ n aː t j oː n ɛ m	d eː n oː m ɪ n aː t j oː n ɛ m
eː r a r j ʊ m	aɪ r aː r j ʊ m
p a k ɪ f ɪ k ʊ m	p aː k ɪ f ɪ k ʊ m
k ɪ t ɛ r j oː r ɛ	k ɪ t ɛ r j oː r ɛ m
k ɔ n ɛ k t ɛ r ɛ	k oː n ɛ k t ɛ r ɛ
b ɛ r ɪ lː ʊ m	b eː r y lː ʊ m
d ɪ s kʷ ɪ s iː t j oː n ɛ m	d ɪ s kʷ iː s iː t j oː n ɛ m
a d w ɛ k t j oː n ɛ m	a d w ɛ k t j oː n ɛ m
eː d iː l	aɪ d iː l ɛ m
m ɪ l j aː r j ʊ m	m iː lː j aː r j ʊ m
p ɔ p ɛ r ʊ m	p aʊ p ɛ r ɛ m
d eː s ɛ m n aː r ɛ	d eː s ɪ ŋ n aː r ɛ
w ɔ t ʊ m	w oː t ʊ m
m ɛ m b r aː n aː k ɛ ʊ m	m ɛ m b r aː n aː k ɛu m
f uː r ɛ n ʊ m	f uː r ɛ m
n ɛ r b ʊ m	n ɛ r w ʊ m
d aː t ʊ m	d a t ʊ m
t r aː n s m ɛ t ɛ r ɛ	t r aː n s m ɪ tː ɛ r ɛ
p eː n d ɛ r ɛ m	p ɛ n d eː r ɛ
r ɛ k ɪ t aː t j oː n ɛ m	r ɛ k ɪ t aː t j oː n ɛ m
f a k ʊ n d ʊ m	f aː k ʊ n d ʊ m
ɪ n s t r ʊ m ɛ n t aː l ɛ m	iː n s t r uː m ɛ n t aː l ɛ m
d ʊ n ʊ s t aː r ɛ	d ɛ h ɔ n ɛ s t aː r ɛ
a k ɛ t aː b ʊ l ʊ m	a k eː t aː b ʊ l ʊ m
ɪ ŋ n ɛ ʊ m	ɪ ŋ n ɛu m
t ɛ d a m	t aɪ d a m
b ɛ l aː r j a m	b eː l w a m
w ɪ n oː s ʊ m	w iː n oː s ʊ m
w ɪ lː aː n ʊ m	w iː lː aː n ʊ m
j ɔ d ʊ m	l ɔ l j ʊ m
p r a n d ɛ r ɛ	p r a n d eː r ɛ
l aː k t aː r j ʊ m	l a k t aː r j ʊ m
ɛ k s t aː s iː m	ɛ k s t a s ɛ m
n uː b ɛ m	n uː b ɛ m
ɪ n kʷ j ɛ t aː r ɛ	ɪ ŋ kʷ ɪ eː t aː r ɛ
a r kː aː r ʊ m	a r k w aː r j ʊ m
g a n n ʊ m	g a l b ɪ n ʊ m
p ɛ r ɪ t j a m	p ɛ r iː t j a m
a g r ɛ s t ɛ m	a g r ɛ s t ɛ m
k a n t ʊ m	k a n t ʊ m
s eː k ɔ r t a m	s k ɔ r t ɛ a m
p r ɛ s t aː r ɛ	p r aɪ s t aː r ɛ
k ɔ n t eː m p l aː r ɛ	k ɔ n t ɛ m p l aː r iː
r ɔ k d r ɛ k ɔ n ɛ m	r ɪ d ɪ k a m
r ɪ s ɛ n aː r ɛ	r ɛ s ɪ ŋ n aː r ɛ
d ɪ w ʊ l g aː t j oː n ɛ m	d iː w ʊ l g aː t j oː n ɛ m
s ʊ mː ɪ n ɪ s t r aː r ɛ	s ʊ b m ɪ n ɪ s t r aː r ɛ
k ɛ f a l ɛ j aː	k ɛ pʰ a l aɪ a m
r eː s a r k ɪ r ɛ	r ɛ s a r k iː r ɛ
d ɛ p ɛ r ɪ t j oː n ɛ m	d eː p ɛ r ɪ t j oː n ɛ m
s k oː r j a m	s k oː r j a m
ɛ g r ʊ m	aɪ g r ʊ m
a m b ɪ t ʊ m	a m b iː t ʊ m
ɪ mː ɔ l aː t j oː n ɛ m	ɪ mː ɔ l aː t j oː n ɛ m
eː b uː r n eː ʊ m	ɛ b ʊ r n ɛu m
d eː l ʊ b r ʊ m	d eː l uː b r ʊ m
s uː b r ɔ g aː r ɛ	s ʊ b r ɔ g aː r ɛ
s p ʊ r k r ɛ	s p ʊ r k aː r ɛ
k r iː b m ʊ m	k r iː b r ʊ m
ɛ n k a n ɪ t ɛ r ɛ	ɪ ŋ k aː n eː s k ɛ r ɛ
k ɔ n f l ʊ ɛ r ɛ	k oː n f l ʊ ɛ r ɛ
ɛ k s t ɪ r p aː t j oː n ɛ m	ɛ k sː t ɪ r p aː t j oː n ɛ m
s ɪ l ɪ k ʊ m	s ɪ l ɪ k j ʊ m
p ɔ s t ʊ l aː r ɛ	p ɔ s t ʊ l aː r ɛ
a sː iː d ʊː m	a sː ɪ d ʊː m
a d ʊ n k ʊ m	a d ʊ ŋ k ʊ m
s eː p ɔ s aː r ɛ	s p oː n s aː r ɛ
l a k t ɛ ʊ m	l a k t ɛu m
a b ɛ rː aː r ɛ	a b ɛ rː aː r ɛ
ʊ s uː r a m	uː s uː r a m
p ʊ l p m ʊ m	p ɔ l y p ʊ m
kʷ a d r ʊ p l ɪ k aː r ɛ	kʷ a d r ʊ p l ɪ k aː r ɛ
r ɛ k ɛ sː ʊ m	r ɛ k ɛ sː ʊ m
ɛ s k ʊ l ʊ m	aɪ s k ʊ l ʊ m
t ɔ rː aː r ɛ	t ɔ rː eː r ɛ
a s iː l ʊ m	a s y l ʊ m
a f l ɛ n t j ʊ m	a fː l ʊ ɛ n t j a m
a b l a k t aː r ɛ	a b l a k t aː r ɛ
s a l uː t aː t j oː n ɛ m	s a l uː t aː t j oː n ɛ m
ɪ n f l ʊ ɛ r ɛ	iː n f l ʊ ɛ r ɛ
s aː n t ɪ t aː t ɛ m	s aː ŋ k t ɪ t aː t ɛ m
s ɪ r k ʊ m	s eː r ɪ k ʊ m
d ɛ r ɪ s ɔ r j ʊ m	d eː r iː s oː r j ʊ m
p a l ɛ s t r a m	p a l aɪ s t r a m
j eː r m aː n ʊ m	g ɛ r m aː n ʊ m
d uː k aː t ʊ m	d ʊ k aː t ʊ m
d ɪ s t r ɪ k t ʊ m	d ɪ s t r ɪ k t ʊ m
s ɔ l aː r ɪ ʊ r ɛ	s oː l aː r j ʊ m
s a sː ʊ m	s a k s ʊ m
l a n k aː r ɛ m	l a ŋ k j aː r j ʊ m
fː ɛ t ʊ m	f ɪ l ɪ k t ʊ m
t ɪ n a m	t ɪ n ɛ a m
k a pː ɛ lː a m	k a pː ɛ lː a m
g ɛ p r n aː l ɛ	d j ʊ r n aː l ɛ m
r uː g iː r ɛ	r uː g iː r ɛ
k r iː m ɪ n oː s ʊ m	k r iː m ɪ n oː s ʊ m
w ɛ n ɛ r aː t j oː n ɛ m	w ɛ n ɛ r aː t j oː n ɛ m
rː t ʊ m	r uː k t ʊ m
ɔ d j aː r ɛ	oː d ɪ sː ɛ
p uː p ɪ lː a m	p uː p ɪ lː a m
f a w oː r ɛ m	f a w oː r ɛ m
ɛ s t r ɪ k aː r ɛ	ɛ k s t r iː k aː r ɛ
t ɔ m ʊ m	t ɔ m ʊ m
p iː s t r iː n ʊ m	p ɪ s t r iː n ʊ m
d ɛ f ɛ n r a m	d eː f ɛ n s a m
a nː aɪ l j ʊ m	a nː ɪ k ʊ l ʊ m
s ɛ m p ɪ t ɛ r n ʊ m	s ɛ m p ɪ t ɛ r n ʊ m
a nː ʊ n k aː r ɛ	a nː uː n t j aː r ɛ
r ɛ t ɛ	r eː t ɛ
a r uː t a m	r uː t a m
a b uː s ɪ w ʊ m	a b uː s iː w ʊ m
p uː l ʊ l aː r ɛ	p ʊ lː ʊ l aː r ɛ
s ɔ l t ʊ m	s ɔ l uː t ʊ m
eː l aɪ f a n t aː n ʊ m	ɛ l ɛ pʰ a n t ɪ n ʊ m
b ɛ n ɛ w ɔ l ʊ m	b ɛ n ɛ w ɔ l ʊ m
n ɪ m ʊ n	n eː m ɪ n ɛ m
k ɔ l ɛ g ʊ m	k ɔ lː eː g j ʊ m
m ɪ l ɪ t ɛ m	m iː l ɪ t ɛ m
s k r ʊ p uː l oː s ʊ m	s k r uː p ʊ l oː s ʊ m
k ɔ l ɛ k t a m	k ɔ lː eː k t a m
r ɛ m ɛ m b r aː r ɛ	r ɛ m ɛ m ɔ r aː r iː
p a l p ɪ t aː t j oː n ɛ m	p a l p ɪ t aː t j oː n ɛ m
a s aː r ʊ m	a s a r ʊ m
f a k ɛ t ʊ m	f a k eː t ʊ m
a nː ɛ k aː r ɛ	n ɛ k aː r ɛ
ɪ p ɔ t ɛ k a m	h y p ɔ tʰ eː k a m
t ɛ n t aː r ɛ	t ɛ m p t aː r ɛ
f ɛ rː ʊ g ɪ n j ɛ m	f ɛ rː uː g ɪ n ɛ m
p ɔ p ɛ r t aː t ɛ m	p aʊ p ɛ r t aː t ɛ m
r ɛ f l oː r iː r ɛ	r ɛ f l oː r eː r ɛ
s ɪ k t ɪ t aː t ɛ m	s ɪ kː ɪ t aː t ɛ m
f r aː n k ɛ s ɛ m	f r a ŋ k eː n s ɛ m
eː w ɔ l ʊ j oː n ɛ r ɛ	eː w ɔ l w ɛ r ɛ
s ʊ s t ɛ k n t aː k ɔ l ʊ m	s ʊ s t ɛ n t aː k ʊ l ʊ m
k a m b r oː n ɛ m	k r aː b r oː n ɛ m
g uː l a m	g ʊ l a m
k ɔ l aː r ɛ	k ɔ l ɛ r ɛ
l a k ʊ s t r ɛ m	l a k ʊ s t r ɛ m
k a l w ʊ m	k a l w ʊ m
w ɛ k ɛ m	w ɪ k ɛ m
d ɪ l a k ɛ r aː r ɛ	d iː l a k ɛ r aː r ɛ
s eː k r iː n ʊ m	s k r iː n j ʊ m
d ɪ s t r aː k t j oː n ɛ m	d ɪ s t r a k t j oː n ɛ m
ɪ mː a t ʊ r ʊ m	ɪ mː aː t uː r ʊ m
ɪ n ʊ n d aː r ɛ	ɪ n ʊ n d aː r ɛ
w ɪ k a m	b iː g a m
b ɛ b ɪ t oː r ɛ	b ɪ b ɪ t oː r ɛ m
s k oː t j a m	s k ɔ t j a m
a nː ɔ t aː t j oː n ɛ m	a nː ɔ t aː t j oː n ɛ m
f l aː g r aː r ɛ	f l a g r aː r ɛ
k ɪ k ʊ m	k ɪ kː ʊ m
k ɛ r k ɪ n ɛ ʊ m	k ɪ r k ɪ n ʊ m
a w ɛ lː ɪ n a m	a b ɛ lː a n a m
d eː t ɛ n t j oː n ɛ m	d eː t ɛ n t j oː n ɛ m
a b oː t aː r ɛ	a d w ɔ k aː r ɛ
a w ɛ s t r uː k ɛ	s t r uː tʰ j oː n ɛ m
n uː m ɛ r oː s ʊ m	n ʊ m ɛ r oː s ʊ m
ɪ n t r iː ŋ k ɛ k ʊ m	ɪ n t r iː n s ɛ k ʊ m
w ʊ l p ɛ m	w ʊ l p ɛ m
r eː k ɔ r d aː r ɛ	r ɛ k ɔ r d aː r iː
t ɔ r ʊ m	t ɔ r ʊ m
a m b ɪ gʷ ʊ iː t aː t ɛ m	a m b ɪ gʷ ɪ t aː t ɛ m
m ɔ r t aː r j ʊ m	m ɔ r t w aː r j ʊ m
d ɛ g ʊ lː aː r ɛ	d eː k ɔ lː aː r ɛ
t ɛ n ɛ r ɛ	t ɛ n eː r ɛ
f a l a ŋ g ɛ m	pʰ a l a ŋ g ɛ m
g ɛ s t j oː n ɛ m	g ɛ s t iː r ɛ
p ɛ s aː r ɛ	p eː n s aː r ɛ
p a d ɛ lː a m	p a t ɛ lː a m
w ɛ r s ɪ k ʊ l ʊ m	w ɛ r s ɪ k ʊ l ʊ m
a pː a r aː r ɛ	a pː aː r eː r ɛ
a b r ɛ w j aː t j oː n ɛ m	a bː r ɛ w j aː t j oː n ɛ m
m uː r aː l j a m	m uː r aː l ɛ m
p ɛ n ɛ t r aː r ɛ	p ɛ n ɛ t r aː r ɛ
a d ɪ w ɪ n aː r ɛ	d iː w iː n aː r ɛ
a n d aː r ɛ	a m b ʊ l aː r ɛ
k ɔ n s ɪ s t ɛ r ɛ	k oː n s ɪ s t ɛ r ɛ
k ɔ kʷ ɛ	k ɔ kː ʊ m
p a t ɛ r n ʊ m	p a t ɛ r n ʊ m
f ɔ k aː r j a m	f ɔ k aː r j ʊ m
a b iː l	h a b ɪ l ɛ m
ʊ b r ʊ m	uː b ɛ r
m ɔ lː ɛu k ɛ m	m ɔ lː ɪ t ɪ ɛ m
d ɔ t aː t j ʊ n ɛ m	d oː t aː t j oː n ɛ m
eː r aɪ d ʊ t aː t ɛ m	h eː r eː d ɪ t aː t ɛ m
ɛ k s ɔ r t aː r ɛ	ɛ k s h ɔ r t aː r iː
m a t ɛ r n iː t aː t ɛ m	m aː t ɛ r n ɪ t aː t ɛ m
s t r ɪ g ɛ m	s t r ɪ g ɛ m
r ɛ k ʊ s aː t j oː n ɛ m	r ɛ k uː s aː t j oː n ɛ m
b aː a t ʊ m	b ɔ aː t ʊ m
b a p t ɪ s t ɛ r j ʊ m	b a p t ɪ s t eː r j ʊ m
s ɔ l aː k ʊ m	s oː l aː k j ʊ m
p a r t ɪ k ʊ l a m	p a r t ɪ k ʊ l a m
ɪ d oː n ɛ ʊ m	ɪ d oː n ɛu m
s ɛ r m oː n ɛ m	s ɛ r m oː n ɛ m
p r uː d ɛ n t ɛ m	p r uː d ɛ n t ɛ m
r ɛ k ɔ n k iː l j aː t j oː n ɛ m	r ɛ k ɔ ŋ k ɪ l j aː t j oː n ɛ m
a aː b ʊ l aː r ɛ	f aː b ʊ l aː r iː
r ɛ l ɛ g aː r ɛ	r ɛ l ɪ g aː r ɛ
m ɛ s ʊ r aː r ɛ	m eː n s uː r aː r ɛ
ɔ n ɔ r ɪ f iː k ʊ m	h ɔ n oː r ɪ f ɪ k ʊ m
j a d ɛ m	iː l ɛ
p r aɪ d j aː l ɛ	p r aɪ d j aː l ɛ m
b ɪ b l j ɔ t ɪ k aː r j ʊ m	b ɪ b l ɪ ɔ tʰ eː k aː r j ʊ m
p ɛ r p ɛ t ʊ ɪ t aː t ɛ m	p ɛ r p ɛ t ʊ ɪ t aː t ɛ m
t ɔ r w ʊ m	t ɔ r w ʊ m
w ɪ n k ʊ l aː r ɛ	w ɪ ŋ k ʊ l aː r ɛ
s ɔ b r ɪ n ʊ m	s oː b r iː n ʊ m
a pː r ɛ h ɛ n s j oː n ɛ m	a pː r ɛ h ɛ n s j oː n ɛ m
f ɔ r t ɛ m	f ɔ r t ɛ m
w ɪ t ɛ lː ʊ m	w ɪ t ɛ lː ʊ m
t r aː n s m uː t aː t j oː n ɛ m	t r aː n s m uː t aː t j oː n ɛ m
ɪ m p aː r ɛ	ɪ m p a r ɛ m
d uː r a t j oː n ɛ m	d uː r aː t j oː n ɛ m
m ɪ ŋ g ɛ r ɛ m	m ɪ ŋ g ɛ r ɛ
f a m oː s ʊ m	f aː m oː s ʊ m
p r ɔ p ɪ n kʷ ʊ m	p r ɔ p ɪ ŋ kʷ ʊ m
s uː b j aː l a m	s uː b ʊ l a m
a s p ɛ k t aː r ɛ	a s p ɛ k t aː r ɛ
f ɛ s t ʊ m	f eː s t ʊ m
k ɔ ŋ g ʊ g aː r ɛ	k ɔ n j ʊ g aː r ɛ
eː kʷ iː w aː l ɛ r ɛ	aɪ kʷ ɪ w a l eː r ɛ
l ʊ k ɪ lː ʊ m	l ɔ k ɛ lː ʊ m
b a j ʊ l a m	b aː j ʊ l ʊ m
d ɔ m ɪ n j ʊ m	d ɔ m ɪ n j ʊ m
d uː r aː k ɪ n m	d uː r a k ɪ n ʊ m
s uː p ɛ r b j a m	s ʊ p ɛ r b j a m
p ɛ s t ɛ m	p ɛ s t ɛ m
k a l oː r ɛ	k a l oː r ɛ m
l ʊ k r ʊ m	l ʊ k r ʊ m
p r ɔ p aː g aː t j oː n ɛ m	p r oː p aː g aː t j oː n ɛ m
a l t ɛ a m	a l tʰ aɪ a m
k a b n ʊ t ʊ m	k aː n uː t ʊ m
a w oː m	a w ʊ m
ɛ n k r ɛ n ɛ	ɪ ŋ k uː d ɛ m
k ɔ l ɪ r j ʊ m	k ɔ lː y r j ʊ m
d ɪ g ɪ t aː r ɛ	d ɪ g ɪ t aː r ɛ
p a t r j aː r a m	p a t r j a r kʰ a m
s ɪ n t iː pʰ ɪ k ʊ m	s k ɪ ɛ n t ɪ f ɪ k ʊ m
r ɔ s m aː r iː n ʊ m	r oː s m a r iː n ʊ m
k ɪ r k ʊ n s k r iː b ɛ r ɛ m	k ɪ r k ʊ m s k r iː b ɛ r ɛ
t r aː n kʷ ɪ lː ʊ m	t r a ŋ kʷ ɪ lː ʊ m
k ɔ l ʊ d ɛ r ɛ	k ɔ lː uː d ɛ r ɛ
j uː g ɛ r ʊ m	j uː g ɛ r ʊ m
s ɔ g ɛ lː ʊ m	s ɪ g ɪ lː ʊ m
l ɛ n t ʊ m	l ɛ n t ʊ m
f aɪ d ɛ m	f ɪ d ɛ m
k ɔ n d ɪ s k ɛ n d ɛ r ɛ	k ɔ n d eː s k ɛ n d ɛ r ɛ
b l ɛ s t eː m ɛ	b l a s pʰ eː m aː r ɛ
a b iː g ɪ ʊ m	a b ɪ g ɛu m
r ɛ s ɔ n aː r ɛ	r ɛ s ɔ n aː r ɛ
p r ɔ d ɪ g aː r ɛ	p r oː d ɪ g ɛ r ɛ
r uː g ɔ s ʊ m	r uː g oː s ʊ m
oː	ʊ m
ɪ n w ɛ n t oː r ɛ	ɪ n w ɛ n t oː r ɛ m
r ɛ k ɛ n s ɪ r ɛ	r ɛ k eː n s eː r ɛ
a k s k ɛ s ɔ r j ʊ m	a kː ɛ sː oː r j ʊ m
a l uː d iː r ɛ m	a lː uː d ɛ r ɛ
r eː w ɛ n ɪ r ɛ	r ɛ w ɛ n iː r ɛ
p ɔ s t ʊ l aː t j oː n ɛ m	p ɔ s t ʊ l aː t j oː n ɛ m
f a r ɛ r ʊ m	f a r
a l ɛ m	aː l ɛ m
p ɔ lː aː r j ʊ m	p ʊ lː aː r j ʊ m
g r a d ʊ m	g r a d ʊ m
t uː r a m	t uː r a m
ɪ n k l ʊ ɛ r ɛ m	ɪ ŋ k l uː d ɛ r ɛ
a b iː d ɪ t ɛ m	a w ɪ d ɪ t aː t ɛ m
ɛ tʰ eː r	aɪ tʰ ɛ r ɛ m
l ɛ mː a m	l ɛ mː a
f a rː ʊ m	f a rː ɛu m
a d uː l t ɛ r ʊ m	a d ʊ l t ɛ r ʊ m
r a p ɪ n a m	r a p iː n a m
n uː d ɪ r ɛ m	n ɔ k eː r ɛ
s uː m ɪ r ɛ	s uː m ɛ r ɛ
s t ɛ l aː r ɛ m	s t eː lː aː r ɛ m
p ɔ n d ɛ r aː r ɛ	p ɔ n d ɛ r aː r ɛ
r ɛ w ɔ k aː r ɛ	r ɛ w ɔ k aː r ɛ
s ɔ l ɪ t ʊ ɛ n r ɛ m	s oː l ɪ t uː d ɪ n ɛ m
g r aː m ɪ n ɛ ɛ m	g r aː m ɪ n ɛu m
p ɪ l aː r ɛ	p ɪ l aː r ɛ
eː p iː s t oː l a m	ɛ p ɪ s t ɔ l a m
w ɛ t ʊ s t ʊ m	w ɛ t ʊ s t ʊ m
m ɔ s ʊ m	m ʊ s t ɛu m
f ɔ lː ɪ k ɪ l ʊ m	f ɔ lː ɪ k ʊ l ʊ m
w ɔ m ɛ r ɛ	w oː m ɛ r ɛ m
t uː r g ɪ d ʊ m	t ʊ r g ɪ d ʊ m
d ɛ s p aː r t ɪ r ɛ m	d ɪ s p a r t iː r ɛ
k iː n k ʊ n t ɛ m	kʷ iː ŋ k ʊ ŋ k ɛ m
a l aː l ɛ	a fː l aː r ɛ
ɪ n d ɪ n aː t j oː n ɛ m	ɪ n d ɪ ŋ n aː t j oː n ɛ m
m uː r ɪ k ɛ m	m uː r ɪ k ɛ m
p a l aː t aː r ɛ	p a l aː t ʊ m
p r aɪ p oː s t ɛ m	p r aɪ p ɔ s ɪ t ʊ m
l uː k s ʊ r j a m	l ʊ k s ʊ r j a m
w ɔ r aː g ɪ n ɛ m	w ɔ r aː g ɪ n ɛ m
f uː r ɪ oː s ʊ m	f ʊ r j oː s ʊ m
s t ʊ d j aː r ɛ	s t ʊ d eː r ɛ
s ɔ n a m	z oː n a m
s ʊ k lː ɔ t ʊ m	s ɪ ŋ g ʊ l t ʊ m
ɔ rː ɛ n d ʊ m	h ɔ rː ɛ n d ʊ m
a d w ɛ r b j aː l ɛ	a d w ɛ r b j aː l ɛ m
n a t aː t ɔ r j ʊ m	n a t aː t oː r j ʊ m
ɪ n d ʊ r ɛ t ɛ r ɛ	ɪ n d uː r eː s k ɛ r ɛ
s ʊ p r n aː t ʊ r aː l ɛ m	s ʊ p ɛ r n aː t uː r aː l ɛ m
ɔ r aː t j oː n ɛ m	oː r aː t j oː n ɛ m
a rː ɛ p ɛ t ɛ r n ɛ	p aɪ n ɪ t eː r ɛ
s k r ʊ t aː r ɛ	s k r uː t aː r iː
r eː l ɛ w aː r ɛ	r ɛ l ɛ w aː r ɛ
t r iː p l ɪ k k ɛ	t r ɪ p l ɪ k ɛ m
a m aː t oː r ɛ m	a m aː t oː r ɛ m
p ɛ n s ʊ m	p eː n s ʊ m
w aː n ʊ m	w aː n ʊ m
s uː pː l ɪ r ɛ m	s ʊ pː l eː r ɛ
s ɛ r p eː n t ɪ n ʊ m	s ɛ r p ɛ n t iː n ʊ m
m a n k t aː m	m ɛ n t ʊ l a m
m a l ɛ m	m a l ʊ m
d eː d ʊ k t j oː n ɛ m	d eː d ʊ k t j oː n ɛ m
k a t ɛ s ɪ s m ʊ m	k a t eː kʰ ɪ s m ʊ m
w ɔ m ɪ t aː r ɛ	w ɔ m ɪ t aː r ɛ
eː r ɛ t ɪ k ɛ m	h aɪ r ɛ t ɪ k ʊ m
ʊ s t ɔ l aː r ɛ	ʊ s t ʊ l aː r ɛ
n ɔ m ɪ n aː t j oː n ɛ m	n oː m ɪ n aː t j oː n ɛ m
a l ʊ n t l a m	a l aʊ d a m
a n ɔ m aː l ʊ m	a n oː m a l ɔ n
d uː b j ʊ m	d ʊ b j ʊ m
d ɪ s t iː n k t ʊ m	d ɪ s t ɪ ŋ k t ʊ m
h ɔ r t ʊ m	h ɔ r t ʊ m
s uː b ɪ t aː n ɛ ʊ m	s ʊ b ɪ t aː n ɛu m
s a n aː b l ɛ m	s aː n aː b ɪ l ɛ m
a fː l ɪ k t j oː n ɛ m	a fː l ɪ k t j oː n ɛ m
k ɛ l ɛ b r aː t j oː n ɛ m	k ɛ l ɛ b r aː t j oː n ɛ m
r ɛ l ɛ g aː r ɛ	r ɛ l ɛ g ɛ r ɛ
l eː t ʊ m	l eː k t ʊ m
s ɪ n t ɪ lː aː r ɛ m	s k ɪ n t ɪ lː aː r ɛ
