r ɛ t ɪ k ɛ r ɛ	r ɛ t ɪ k eː r ɛ
k ɔ ɛ g r ʊ m	k ɔ ŋ g r ʊː m
j ɛ ɛ m aː l ɛ	h ɪ ɛ m aː l ɛ m
s a ŋ t ʊ r j ɛ t ɛ m	s a t ʊ r eː j a m
f r aː t ɛ r n aː l ɛ m	f r aː t ɛ r n aː l ɛ m
t ɛ d j oː s ʊ m	t aɪ d j oː s ʊ m
m a n ʊ m	m a ŋ n ʊ m
d ɛ m ʊ n j ʊ m	d aɪ m ɔ n j ʊ m
p ɔ s ɛ sː j oː n ɛ m	p ɔ sː ɛ sː j oː n ɛ m
l uː p aː n aː r ɛ	l ʊ p aː n a r
d ɛ n uː d aː t j oː n ɛ m	d eː n uː d aː t j oː n ɛ m
k ɔ n t r aː k t ɛ	k ɔ n t r a h ɛ r ɛ
a g r ɪ m ɛ n s oː r ɛ m	a g r iː m eː n s oː r ɛ m
p a s t oː r ɛ	p aː s t oː r ɛ m
eː s t ɛ r n ʊ m	h ɛ s t ɛ r n ʊ m
l uː k s	l uː k ɛ m
d ɪ s ɛ k aː r ɛ	d ɪ sː ɛ k aː r ɛ
b r aː k aː t ʊ m	b r aː k aː t ʊ m
a m a r ɪ t j a m	a m aː r ɪ t ɪ ɛ m
p a l uː s t r ɛ m	p a l uː s t r ɛ m
ɪ n s t aʊ r aː r ɛ	iː n s t aʊ r aː r ɛ
p r ɛ s t aː r ɛ	p r aɪ s t aː r ɛ
m ɛ m y b r aː r ɛ	m ɛ m ɔ r aː r ɛ
s k oː l oː p ɛ n d r a m	s k ɔ l ɔ p ɛ n d r a m
k aɪ n ʊ m	k aɪ n ʊ m
s ɔ l j ʊ m	s ɔ l j ʊ m
eː fː ɪ k aː t iː t aː t ɛ m	ɛ fː ɪ k aː k ɪ t aː t ɛ m
a p ɔ k aː l ɪ p t ɛ m	a p ɔ k a l y p s ɛ m
k eː p a m	k aɪ p a m
a kː uː s aː r ɛ	a kː uː s aː r ɛ
k aː n ʊ m	k aː n ʊ m
a b l ɛ g aː t l oː n ɛ m	a b l eː g aː t j oː n ɛ m
p r ɛ m ɛ r ɛ	p r ɛ m ɛ r ɛ
ɪ t ɛ r aː r ɛ	ɪ t ɛ r aː r ɛ
ɪ p n oː t ɪ k ʊ m	h y p n oː t ɪ k ʊ m
n ɔ t aː r ɛ	n ɔ t aː r ɛ
m ɪ n g ɛ r ɛ	m ɪ ŋ g ɛ r ɛ
p l a k ɪ d ʊ m	p l a k ɪ d ʊ m
k a n t ɪ k ʊ m	k a n t ɪ k ʊ m
k ɔ n s ɪ l j aː r ɛ	k ɔ ŋ k ɪ l j aː r ɛ
h a b l aː r ɛ	f aː b ʊ l aː r iː
w ɪ g oː r aː r ɛ	w ɪ g oː r aː r ɛ
k ɔ n t ɪ n w aː t j oː n ɛ m	k ɔ n t ɪ n w aː t j oː n ɛ m
t r aː n s l aː t j oː n ɛ m	t r aː n s l aː t j oː n ɛ m
a r k aː n ʊ m	a r k a n ʊ m
s ɔ n aː r ɛ	s ɔ m n j aː r ɛ
t ɛ l a m	t eː l a m
s t ɪ m ʊ l aː t j oː n ɛ m	s t ɪ m ʊ l aː t j oː n ɛ m
d ɛ k ɔ k t j oː n ɛ m	d ɛ k ɔ k t j oː n ɛ m
uː r ɪ n a m	uː r iː n a m
f uː l m ɪ n aː r ɛ	f ʊ l m ɪ n aː r ɛ
m ɔ d ʊ m	m ɔ d j ʊ m
l ɔ ŋ g ɛ w ʊ m	l ɔ ŋ g aɪ w ʊ m
t uː b ɛ r oː s ʊ m	t uː b ɛ r oː s ʊ m
k ɛ r w w ɪ s j a m	k ɛ r w ɛ s j a m
ɪ n f ɔ r t uː n j ʊ m	iː n f ɔ r t uː n j ʊ m
ɔ l ɪ g aː r k ɪ k ʊ m	ɔ l ɪ g a r kʰ ɪ k ʊ m
p uː s t ʊ l a m	p ʊ s t ʊ l a m
uː s uː r aː r j ʊ m	uː s uː r aː r j ʊ m
p ɪ p aː r ɛ	p iː p aː r ɛ
g r aː n ʊ m	g r aː n ʊ m
p r ɔ b l ɛ m aː t ɪ k ʊ m	p r ɔ b l eː m a t ɪ k ʊ m
w ɪ d ɪ t aː t j oː n ɛ m	w iː s ɪ t aː t j oː n ɛ m
f ɛ t oː r ɛ	f eː t oː r ɛ m
k a l k ʊ l ʊ m	k a l k ʊ l ʊ m
w a k uː ɪ t aː t ɛ m	w a k ʊ ɪ t aː t ɛ m
a n ɔ t aː t j oː n ɛ m	a nː ɔ t aː t j oː n ɛ m
k a r m ɛ m	k a r m ɛ n
ɪ n k l ɪ t ʊ m	ɪ ŋ k l ɪ t ʊ m
t ʊ d ɛ r ɛ	t ɔ n d eː r ɛ
l ɪ r ɪ k ʊ m	l y r ɪ k ʊ m
eː l ɔ ŋ g aː t j oː n ɛ m	eː l ɔ ŋ g aː t j oː n ɛ m
a l ɪ t ʊ m	h aː l ɪ t ʊ m
f aɪ b ʊ l ɛ m	f l eː b ɪ l ɛ m
ɪ m p uː l s j oː n ɛ m	ɪ m p ʊ l s j oː n ɛ m
k ʊ lː ɛ r a m	kʰ ɔ l ɛ r a m
w ɛ n j a m	w ɛ n j a m
d ɛ r ɪ s j oː n ɛ m	d eː r iː s j oː n ɛ m
d ɛ f ɛ n r a m	d eː f ɛ n s a m
a fː l ɪ g ɛ r ɛ	a fː l iː g ɛ r ɛ
ɛ t aː t ɛ m	aɪ t aː t ɛ m
b a k t ɪ s t a m	b a p t ɪ s t a m
h eː m a l ɔ w sː ɛ r ɛ	eː m ɔ w eː r ɛ
w ɪ k ɪ n ɛ h t aː t ɛ m	w iː k iː n ɪ t aː t ɛ m
a b ɛ t ʊ m	a b ɪ eː t ɛ m
ɔ p aɪ r aː r ɛ	ɔ p ɛ r aː r iː
ɪ n f oː r m ɛ m	iː n f oː r m ɛ m
a g ɪ t aː t oː r ɛ	a g ɪ t aː t oː r ɛ m
b ɛ nː j ʊ m	b ɪ ɛ nː j ʊ m
b a g t ɪ s t ɛ r j ʊ m	b a p t ɪ s t eː r j ʊ m
s ʊ r g ɪ r ɛ	s ʊ r g ɛ r ɛ
eː t ɛ r ɛ ʊ m	aɪ tʰ ɛ r j ʊ m
s uː w r ɔ g aː r ɛ	s ʊ b r ɔ g aː r ɛ
f ɛ r j a m	f eː r j aː s
a b ɛ j aː ɪ n	a d w ɔ k aː r ɛ
k a n d ɛ l aː b r ʊ m	k a n d eː l aː b r ʊ m
j eː j uː n ʊ m	j eː j uː n j ʊ m
s ɔ lː ɪ k ɪ t aː r ɛ	s ɔ lː ɪ k ɪ t aː r ɛ
h ɔ s t j a m	h ɔ s t j a m
p ɛ r ʊ r j ʊ m	p ɛ r ɪ uː r j ʊ m
k ɔ n s a ŋ gʷ ɪ n ɪ t aː t ɛ m	k oː n s a ŋ gʷ ɪ n ɪ t aː t ɛ m
m ɛ n aː k j a m	m ɪ n aː k ɛ m
ɔ fː ɪ k ʊ r j ʊ m	ɔ fː ɪ k j oː s ʊ m
k ɛ l ɛ b r aː t j oː n ɛ m	k ɛ l ɛ b r aː t j oː n ɛ m
d ɛ m oː n ɪ k ʊ m	d aɪ m ɔ n ɪ k ʊ m
t ɛ t r ʊ m	t aɪ t r ʊ m
w ɔ l iː ɛ r ɛ m	w ɛ lː ɛ
k ɔ n g uː r aː t j oː n ɛ m	k ɔ n ɪ uː r aː t j oː n ɛ m
a l n oː m	a l n ʊ m
g a lː ɛ g ʊ m	g a lː aɪ k ʊ m
b ɛ l d aː r t a m	b eː l w a m
n ɔ d oː s ʊ m	n oː d oː s ʊ m
ɪ ŋ g ɛ nː ʊ m	ɪ ŋ g ɛ n j ʊ m
m ɛ d ɪ r ɛ	m eː t iː r iː
k a n s aː r ɛ	k a m p s aː r ɛ
r ʊ ɛ ɪ b j a m	r ʊ b j a m
r ɛ l ɛ g aː t j oː n ɛ m	r ɛ l eː g aː t j oː n ɛ m
p ʊ t aː r ɪ m	p ʊ t aː r ɛ
k ʊ p ɛ k ʊ m	k a p ɪ t j ʊ m
ɪ n ʊ m	iː n ʊ m
k ɔ lː uː d ɛ r ɛ	k ɔ lː uː d ɛ r ɛ
s ɔ rː ɪ d ɛ r ɛ	s ʊ b r iː d eː r ɛ
ɪ m a g ɛ n ɛ	ɪ m aː g ɪ n ɛ m
eː fː ɪ k aː k ɛ	ɛ fː ɪ k aː k ɛ m
ʊ ŋ g uː l aː t ʊ m	ʊ ŋ g ʊ l aː t ʊ m
g r ʊ n ɪ r ɛ	g r ʊ nː iː r ɛ
eː b r ɪ ɛ t aː t ɛ m	eː b r ɪ ɛ t aː t ɛ m
k a l ɪ d ɪ t ɛ m	k a l ɪ d ɪ t aː t ɛ m
l ɪ m aː r ɛ	l iː m aː r ɛ
a tː ɛ s t aː r ɛ	a tː ɛ s t aː r iː
ɛ k s ɛ k r aː r ɛ	ɛ k sː ɛ k r aː r iː
k ɔ n s ɛ r w aː t j oː n ɛ m	k oː n s ɛ r w aː t j oː n ɛ m
s a l ɪ n a m	s a l iː n a m
p ɛ r k ɪ r ɪ r ɛ	p ɛ r kʷ iː r ɛ r ɛ
r ɪ t ʊ m	r iː t ʊ m
aʊ d a k ɛ m	aʊ d aː k ɛ m
l a t r aː r ɛ	l a t r oː n ɛ m
eː d ɪ f ɪ k aː r ɛ	aɪ d ɪ f ɪ k aː r ɛ
m ɛ r ɪ t ʊ m	m ɛ r ɪ t ʊ m
k ɔ ŋ t r ɪ t ʊ m	k ɔ n t r iː t ʊ m
a b ɪ l ɪ t aː t ɛ m	h a b ɪ l ɪ t aː t ɛ m
g a l ɛ n a m	g a l eː n a m
a d mː ɪ r aː b ɪ l ɛ m	a d m iː r aː b ɪ l ɛ m
k a n t ʊ m	k a n t ʊ m
w ɛ s t ɪ t ʊ m	w ɛ s t iː t ʊ m
l uː k s uː r j a m	l ʊ k s ʊ r j a m
s ɔ r ɪ m	s oː r ɪ k ɛ m
d ɛ k ɪ m aː l ɛ	d ɛ k ɪ m a l ɛ m
a d ɔ r m ɛ t ɛ r ɛ	a dː ɔ r m iː s k ɛ r ɛ
f a k ʊ n d ʊ m	f aː k ʊ n d ʊ m
j ɔ k ʊ n d iː t aː t ɛ m	j uː k ʊ n d ɪ t aː t ɛ m
k r ɛ m a m	k r aː m ʊ m
k ɔ n t ɛ n t j oː n ɛ m	k ɔ n t ɛ n t j oː n ɛ m
p ɛ r a m	p eː r a m
k aɪ ɪ t ʊ d ɛ m	kʷ ɪ eː t uː d ɪ n ɛ m
s a k r ɪ l ɛ g ʊ m	s a k r ɪ l ɛ g ʊ m
ɔ l aɪ oː s ʊ m	ɔ l ɛ oː s ʊ m
k ɔ n k aː t ɛ n aː r ɛ m	k ɔ ŋ k a t eː n aː r ɛ
a fː ɪ r m aː r ɛ	a fː ɪ r m aː r ɛ
a oː kː w ɛ r iː r ɛ	a kː w iː r ɛ r ɛ
f l a m a m	f l a mː a m
s a ŋ gʷ ɪ n aː r j ʊ m	s a ŋ gʷ ɪ n aː r j ʊ m
p r ɔ p r j ʊ m	p r oː p r j ʊ m
k ɔ r t ɛ m	k oː r t ɛ m
k l aː w ɪ k ɔ r d j ʊ m	k l aː w iː kʰ ɔ r d j ʊ m
s aː n t ɪ t aː t ɛ m	s aː ŋ k t ɪ t aː t ɛ m
d ɛ t t aː t ɛ m	d ɛ ɪ t aː t ɛ m
f ɔ l iː k a m	f ʊ l ɪ k a m
f ʊ s t ɪ g aː r ɛ	f uː s t iː g aː r ɛ
s p oː ŋ g a m	s p ɔ ŋ g j a m
ɪ n w ɛ r t ɛ r ɛ	ɪ n w ɛ r t ɛ r ɛ
k ɔ r oː n iː d ɛ m	k ɔ r oː n ɪ d ɛ m
p uː p a m	p uː p a m
p r ɛ f ɛ r iː r ɛ	p r aɪ f ɛ rː ɛ
m ɪ n oː r aː r ɛ	m ɪ n oː r aː r ɛ
k ɔ n d ɔ l ɛ r ɛ m	k ɔ n d ɔ l eː r ɛ
k ɔ n s pʰ ɪ j ɛ n t j a m	k oː n s k ɪ ɛ n t j a m
a r k ɛ a ŋ g ɛ l ʊ m	a r kʰ a ŋ g ɛ l ʊ m
aɪ t j a	ɪ t j a m
eː m eː t ɛ r ɛ	eː m ɪ tː ɛ r ɛ
ɪ s t a m	ɪ s t a m
m a n t ɪ n ɛ r ɛ	m a n ʊ t ɛ n eː r ɛ
d aɪ m b uː l aː t j oː n ɛ m	d ɛ a m b ʊ l aː t j oː n ɛ m
r ɛ p r ɛ h ɛ n s j oː n ɛ m	r ɛ p r ɛ h ɛ n s j oː n ɛ m
ɔ kː t aː w ʊ m	ɔ k t aː w ʊ m
ɛ k s k ɔ g iː t aː t j oː n ɛ m	ɛ k s k oː g ɪ t aː t j oː n ɛ m
p a m p aː n ʊ m	p a m p ɪ n ʊ m
k r a p uː l m ʊ m	k r aː p ʊ l a m
k ɔ n ɛ k s j oː n ɛ m	k oː n ɛ k s j oː n ɛ m
uː s ɪ t aː t ʊ m	uː s ɪ t aː t ʊ m
d ɪ ŋ n aː r ɛ	d ɪ ŋ n aː r ɛ
r iː s ʊ m	r iː s ʊ m
l uː s t r aː r ɛ	l ʊ s t r aː r ɛ
aʊ r ɪ g ɛ r ʊ m	aʊ r ɪ g ɛ r ʊ m
w ɛ r s ɪ pʰ iː k aː r ɛ	w ɛ r s ɪ f ɪ k aː r ɛ
f ɔ r ɛ m aː r ɛ	f ɔ r aː r ɛ
aɪ r ɛ d aː r ɛ	h eː r eː d ɪ t aː r ɛ
b a s ʊ m	b a sː ʊ m
s k ɔ r j a m	s k oː r j a m
a sː a r ɛ	a sː aː r ɛ
p r ɔ ɛ b iː r ɛ	p r ɔ h ɪ b eː r ɛ
s ʊ s p ɛ n s j oː n ɛ m	s ʊ s p eː n s j oː n ɛ m
p l aɪ n ɪ t uː d	p l eː n ɪ t uː d ɪ n ɛ m
r ɛ k ɛ n t ɛ m	r ɛ k ɛ n t ɛ m
ɪ n f l uː ɛ r ɛ	iː n f l ʊ ɛ r ɛ
s ɔ l t w ʊ s ʊ m	s ʊ m p t ʊ oː s ʊ m
m s t r ɪ k aː r ɛ	ɛ k s t r iː k aː r ɛ
r iː s ɪ d ɛ r ɛ	r ɛ s ɪ d eː r ɛ
ɪ n t ɛ r p ʊ n m ɛ m r ɛ m	ɪ n t ɛ r p ʊ ŋ g ɛ r ɛ
w ɛ t a m	w ɪ tː a m
n uː t aː r ɛ	n uː t aː r ɛ
l a n k ɛ aː r ɛ	l a ŋ k ɛ aː r ɛ
l ɪ m ɪ n ɛ	l iː m ɛ n
ɪ n t ɛ lː eː t k j oː n ɛ m	ɪ n t ɛ lː ɛ k t j oː n ɛ m
k ɛ s aː t j oː n ɛ m	k ɛ sː aː t j oː n ɛ m
s a r kʰ ʊ m	s a r k ʊ l ʊ m
s k r ɪ t uː r a m	s k r iː p t uː r a m
p a w ɪ l oː n ɛ m	p aː p ɪ l j oː n ɛ m
r ɔ m ɛ k ɛ m	r ʊ m ɪ k ɛ m
a r b uː s t ɪ w ʊ m	a r b ʊ s t iː w ʊ m
d ɛ n ɔ m iː n aː r ɛ	d eː n oː m ɪ n aː r ɛ
p a n ɛ m	p aɪ aː n ɛ m
a p ɔ s t ʊ l ʊ m	a p ɔ s t ɔ l ʊ m
ɪ m p r ɔ b aː r ɛ	ɪ m p r ɔ b aː r ɛ
t a l aː m ʊ m	tʰ a l a m ʊ m
g l aː l a m	g l aː r ɛ a m
ɔ r t j ʊ m	h ɔ r d ɛu m
p ɪ s t r iː n ʊ m	p ɪ s t r iː n ʊ m
p ɔ s t p iː b ʊ l ʊ m	p r oː s t ɪ b ʊ l ʊ m
k ɔ aɪ r t ɪ k j oː n ɛ m	k ɔ ɪ r k ɪ t j oː n ɛ m
d ʊ l k ɪ f iː k aː r ɛ m	d ʊ l k ɪ f ɪ k aː r ɛ
p ɛ r k ʊ t ɛ r ɛ	p ɛ r k ʊ t ɛ r ɛ
n a f t a m	n a pʰ tʰ a m
p ʊ ɛ r ɪ l ɛ t aː t ɛ m	p ʊ ɛ r iː l ɪ t a t ɛ m
k ɛ k ʊ m	s ɔ kː ʊ m
r uː p ɛ m	r uː p ɛ m
eː k s p ʊ ŋ g ɛ r ɛ	ɛ k s p ʊ ŋ g ɛ r ɛ
ɔ sː a r j ʊ m	ɔ sː aː r j ʊ m
ɪ n f ɛ l ɪ k ɛ	iː n f eː l iː k ɛ m
s ʊ s t ɛ k n t aː k ʊ l ʊ m	s ʊ s t ɛ n t aː k ʊ l ʊ m
w ɪ s ʊ m s	w iː s ʊ m
b ɛ t k aː t a m	b eː t a m
d ɛ s ɛ k aː t j oː n ɛ m	d eː s ɪ kː aː t j oː n ɛ m
ɪ m p ɛ r j ʊ m	ɪ m p ɛ r j ʊ m
p ɪ k t oː r ɛ	p ɪ k t oː r ɛ m
m a n kʷ ʊ m	m a ŋ k ʊ m
s aː b ʊ rː a m	s a b ʊ rː a m
a k uː m ɛ m	a k uː m ɛ n
kʷ ɔ l t t	k ʊ l k ɪ t a m
ɛ k s p uː r g aː r ɛ	ɛ k s p ʊ r g aː r ɛ
g ɛ l ʊ m	g ɛ l uː
a m aː t ɔ r j ʊ m	a m aː t oː r j ʊ m
ɛ k s p ɪ r aː r ɛ	ɛ k sː p iː r aː r ɛ
n w aː t aː r ɛ	n a t aː r ɛ
g ɪ t ʊ m	j a k t ʊ m
d ɪ s k r ɛ p aː n t a m	d ɪ s k r ɛ p a n t j a m
g ɛ r uː n d j ʊ m	g ɛ r ʊ n d j ʊ m
ɪ n s oː l ɪ t ʊ m	iː n s ɔ l ɪ t ʊ m
r eː k ɔ r d aː r ɛ	r ɛ k ɔ r d aː r iː
k a lː ʊ m	k a lː ʊ m
ɪ n t eː l ɛ g ɛ r ɛ	ɪ n t ɛ lː ɛ g ɛ r ɛ
t r aɪ p ɪ d aː r ɛ	t r ɛ p ɪ d aː r ɛ
ɪ n k aʊ t ʊ m	ɪ ŋ k aʊ t ʊ m
w eː n ɛ t ɪ ɪ n a ɛ	w ɛ n ɛ t ʊ m
s ɔ lː ɪ k ɪ t uː d ɪ n ɛ m	s ɔ lː ɪ k ɪ t uː d ɪ n ɛ m
k ɔ n s ɔ n aː r ɛ	k oː n s ɔ n aː r ɛ
m a s a m	m a sː a m
l a w aː t oː r j ʊ m	l a w aː t oː r j ʊ m
p r ɔ p ɛ lː ɛ r ɛ	p r oː p ɛ lː ɛ r ɛ
k r j ɛ aː t ʊ r a m	k r ɛ aː t uː r a m
k ɔ n k ʊ r s ʊ m	k ɔ ŋ k ʊ r s ʊ m
n a s ʊ m	n aː s ʊ m
m ɪ t ɪ g aː r ɛ	m iː t ɪ g aː r ɛ
s ɪ eː n ʊ m	s ɪ n ʊ m
p ɪ l aː r ɛ	p ɪ l aː r ɛ
a l ʊ ŋ g aː r ɛ	eː l ɔ ŋ g aː r ɛ
d ɪ s ɛ m ɪ n aː r ɛ	d ɪ sː eː m ɪ n aː r ɛ
t r aː n s f uː g j a m	t r aː n s f ʊ g a m
t r aː n s p oː r t aː r ɛ	t r aː n s p ɔ r t aː r ɛ
ɔ b t ɛ m p ɛ r aː r ɛ	ɔ b t ɛ m p ɛ r aː r ɛ
s ʊ mː ɪ t aː t ɛ m	s ʊ mː ɪ t aː t ɛ m
g l ɔ r j oː s ɪ sː ɪ m ʊ m	g l oː r j oː s ɪ sː ɪ m ʊ m
d ɛ k ɛ pʰ t ɔ r j ʊ m	d ɛ k ɛ p t oː r j ʊ m
ɪ m ʊ r k j a m	a m ʊ r k a m
n ʊ t r ɪ r ɛ	n uː t r iː r ɛ
ɪ n g ʊ m t j oː n ɛ m	ɪ n j ʊ ŋ k t j oː n ɛ m
ɔ s ʊ ɛ r j ʊ m	ɔ sː w aː r j ʊ m
w a l eː r ɛ	w a l eː r ɛ
g r aː m a ɛ	g r aː m ɛ n
ɪ m p aː r ɛ	ɪ m p a r ɛ m
f aː rː aː g ɪ n ɛ	f a rː aː g ɪ n ɛ m
a pː aː r aː r ɛ	a pː a r aː r ɛ
w ʊ l g ʊ m	w ʊ l g ʊ s
ɪ n d ɪ s k r ɛ t j oː n ɛ m	ɪ n d ɪ s k r eː t j oː n ɛ m
d ɛ k ʊ lː aː r ɛ	d eː k ɔ lː aː r ɛ
a s p aː r aː g ʊ m	a s p a r a g ʊ m
t eː ŋ t aː ɪ n	t ɛ n t aː r ɛ
p r ɛ s t l ɛ m	p r ɛ s b y t ɛ r ʊ m
r eː l ɛ w aː r ɛ	r ɛ l ɛ w aː r ɛ
ɪ fː ɛ k aː r ɛ	ɪ f ɪ k aː r ɛ
f ʊ lː k aː r ɛ	f ɔ lː ɪ k aː r ɛ
f ɔ l ɛ oː s ʊ m	f ɔ l j oː s ʊ m
d ɪ g ɛ s t iː w ʊ m	d iː g ɛ s t iː w ʊ m
d ɛ k aː l w aː t j oː n ɛ m	d eː k a l w aː t j oː n ɛ m
p eː ɪ n t iː n aː r ɛ	p ɛ k t ɪ n aː r ɛ
n ɔ w ɪ l ʊ n j ʊ m	n ɔ w ɪ l uː n j ʊ m
b ɛ t ʊ l a m	b ɛ t ʊ l a m
f uː n g ɛ r ɛ	f ʊ ŋ g iː
s k r oː f a m	s k r oː f a m
k ɔ r uː s k aː r ɛ	k ɔ r ʊ s k aː r ɛ
a b s t r a h ɛ r ɛ	a b s t r a h ɛ r ɛ
f a l s aː r ɛ	f a l s aː r ɛ
ɪ ŋ n oː m ɪ n j a m	ɪ ŋ n oː m ɪ n j a m
a oː t aː t oː r ɛ	a s t ʊ r ɛ m
ɪ s t r j oː n ɛ m	h ɪ s t r j oː n ɛ m
k ɔ lː ɪ r j ʊ m	k ɔ lː y r j ʊ m
k ɪ b ɪ k ʊ m	k iː w ɪ k ʊ m
a s ɛ d ɛ aː r j ɛ	a sː ɪ d eː r ɛ
ɪ n w ɛ t ɛ r aː r ɛ	ɪ n w ɛ t ɛ r aː r ɛ
p r ɔ h t ɔ k oː l aː r j ʊ m	p r oː t ɔ k ɔ lː aː r j ʊ m
n ʊ k j a	n uː p t j aː s
ɪ m p l ɪ k aː r ɛ	ɪ m p l ɪ k aː r ɛ
ɪ n t r ɔ ɪ t ʊ m	ɪ n t r ɔ ɪ t ʊ m
ɛ g s ɛ r k eː r ɛ	ɛ k s ɛ r k eː r ɛ
ɪ rː ɪ t aː	ɪ rː iː t aː r ɛ
a d w ʊ k aː t j oː n ɛ m	a d w ɔ k aː t j oː n ɛ m
kʷ ɛ s t j oː n ɛ m	kʷ aɪ s t j oː n ɛ m
p r uː d ɛ n t j a m	p r uː d ɛ n t j a m
m eː m b r aː n m ʊ m	m ɛ m b r aː n ɛu m
ɪ m n ʊ m	h y m n ʊ m
a m b aː pʰ ɛ s	a m b aː g ɛ m
m a r ɪ t aː l ɛ	m a r iː t aː l ɛ m
d ɛ w j aː t j oː n ɛ m	d eː w j aː t j oː n ɛ m
a kː ɔ ŋ sː ɛ m aː r ɛ	a kː ɔ ŋ k ɪ l j aː r ɛ
b ɔ r s a m	b ʊ r s a m
a kː r ɪ t ʊ t ɛ m	aː k r ɪ t uː d ɪ n ɛ m
f ɪ g ʊ m	f iː k ʊ m
b ʊ k iː n ɛu m	b uː k ɪ n a m
k ɔ k ɔ ŋ lː ʊ m	k ʊ k ʊ lː ʊ m
ɛ g s ɛ m p l aː r ɛ	ɛ k s ɛ m p l a r
l ɪ k t oː r ɛ	l iː k t oː r ɛ m
r ɛ s t ɪ t ʊ ɛ r ɛ m	r ɛ s t ɪ t ʊ ɛ r ɛ
d ɔ m aː r ɛ	d ɔ m aː r ɛ
a n ɛ k aː r ɛ	n ɛ k aː r ɛ
r ɛ k aː r ɛ	r ɪ g aː r ɛ
d ɛ mː uː t aː r ɛ	d eː m uː t aː r ɛ
ɛ k s k uː r s j oː n ɛ m	ɛ k s k ʊ r s j oː n ɛ m
p ɛ r ɪ t ʊ m	p ɛ r iː t ʊ m
k ɔ n t r ɪ t j oː n ɛ m	k ɔ n t r iː t j oː n ɛ m
k r ɪ t ɪ k ʊ m	k r ɪ t ɪ k ʊ m
ɪ n d ɪ ŋ n aː t j oː n ɛ m	ɪ n d ɪ ŋ n aː t j oː n ɛ m
f r ɪ ɪ g ɪ d aː t ɛ m	f r iː g ɪ d ɪ t aː t ɛ m
t aʊ r ɪ f oː r m ɛ	t aʊ r ɪ f oː r m ɛ m
p uː lː uː l aː r ɛ	p ʊ lː ʊ l aː r ɛ
ɛ k s aː l t aː r ɛ	ɛ k s a l t aː r ɛ
p ɛ r ɪ s k r uː t aː r ɛ m	p ɛ r s k r uː t aː r iː
w ɛ n d eː m j a m	w iː n d eː m j a m
p a d r a s t l ʊ m	p a t r a s t r ʊ m
eː d ɪ l	aɪ d iː l ɛ m
k ɔ r ɛ	kʰ ɔ r eːa m
k a r ʊ m	k aː r ʊ m
m ɛ r ɪ t ɛ r ɛ	m ɛ r eː r ɛ
b a r b aː r ɪ m ʊ m	b a r b a r ɪ s m ʊ m
s ɔ n ʊ m	s ɔ n ʊ m
k a n d oː	k a n d oː r ɛ m
ɪ n s uː l t ʊ m	iː n s ʊ l t ʊ m
s k oː l aː s t eː k ʊ m	s kʰ ɔ l a s t ɪ k ʊ m
t ɛ ɔ s ɔ f j a m	tʰ ɛ ɔ s ɔ pʰ j a m
l a n k ɛ r j ʊ m	l a ŋ k j aː r j ʊ m
m ɛ l ɛ ɔ r ɛ	m ɛ l j oː r ɛ m
d ɛ p l ɔ r aː r ɛ	d eː p l oː r aː r ɛ
k ɔ n s ɔ l aː r ɛ	k oː n s oː l aː r iː
g fː aː t j ʊ m	g l a k ɪ ɛ m
d ɛ p uː r aː r ɛ	d eː p uː r aː r ɛ
f r uː s t a m	f r ʊ s t a m
s a b uː k ʊ m	s a m b uː k ʊ m
k ɔ n k ʊ rː ɛ r ɛ	k ɔ ŋ k ʊ rː ɛ r ɛ
d ɛ m a n d aː r ɛ	d eː m a n d aː r ɛ
p r ɔ f ʊ n d ɪ t aː t ɛ m	p r ɔ f ʊ n d ɪ t aː t ɛ m
a k r ɪ m oː n j a m	aː k r ɪ m oː n j a m
a k d ɪ l j ʊ m	aʊ k s ɪ l j ʊ m
ɪ t r ɪ n s ɛ k ʊ m	ɪ n t r iː n s ɛ k ʊ m
a k uː m ɪ n aː r ɛ	a k uː m ɪ n aː r ɛ
k a l k ʊ l aː t j oː n ɛ m	k a l k ʊ l aː t j oː n ɛ m
a n t ɛ p oː n ɛ r ɛ	a n t ɛ p oː n ɛ r ɛ
p ɛ r p ɛ t r aː r ɛ	p ɛ r p ɛ t r aː r ɛ
g ɛ t aː r ɛ	j a k t aː r ɛ
d ɛ s ɛ k aː r ɛ	d eː s ɪ kː aː r ɛ
ɛ k s p l ɪ k aː t j oː n ɛ m	ɛ k s p l ɪ k aː t j oː n ɛ m
k ɛ n s oː r ɛ	k eː n s oː r ɛ m
z fː aː t s	f ɔ r j a m
d eː rː uː ɛ	d iː r ʊ ɛ r ɛ
h ɛ r b aː r j ʊ m	h ɛ r b aː r j ʊ m
k a t ɛ k ɪ s m ʊ m	k a t eː kʰ ɪ s m ʊ m
ɛ k s aː l aː r ɛ	ɛ k s h aː l aː r ɛ
p ɛ n s ɪ l ɛ	p eː n s ɪ l ɛ m
k ɛ n t uː r j a m	k ɛ n t ʊ r j a m
p l a n t ʊ m	p l a ŋ k t ʊ m
t r a m a m	t r aː m a m
s aː l m a m	s a g m a m
uː b ɪ k aː t j oː n ɛ m	ʊ b ɪ k aː t j oː n ɛ m
r ʊ g ʊ ʊ m	r ʊ b ʊ m
s p ɔ l aː r ɛ	s p ɔ l j aː r ɛ
a k ɛ ŋ d ɛ r ɛ	a kː ɛ n d ɛ r ɛ
k ʊ k ɪ n aː r j oː n ʊ m	k ɔ kʷ iː n aː r j ʊ m
s ɛ ŋ d aː r ɛ	s ɛ d eː r ɛ
k ɔ ŋ s t r iː k tː oː r ɛ	k oː n s t r ɪ k t oː r ɛ m
s a l aː r j ʊ m	s a l aː r j ʊ m
r ɛ m ʊ ɔ b ɛ r ɛ	r ɛ m ɔ w eː r ɛ
b ɪ j uː k l ʊ m	b aː j ʊ l ʊ m
k r ɔ h k ʊ m	k r ɔ k ʊ m
p ɔ p l ɪ t ɛ	p ɔ p l ɪ t ɛ m
k ɪ k aː pʰ a m	k ɪ k aː d a m
k ɔ n g j ʊ m	k ɔ ŋ g j ʊ m
a r k ɪ b ɛ s k oː p ʊ m	a r kʰ ɪ ɛ p ɪ s k ɔ p ʊ m
