m ɪ k a m	m iː k a m
p ʊ ɛ r ɪ l ɪ t aː t ɛ m	p ʊ ɛ r iː l ɪ t a t ɛ m
m a t r ɪ k ʊ l a m	m aː t r iː k ʊ l a m
w ɪ s ɪ b ɪ l ɛ t aː t ɛ m	w iː s ɪ b ɪ l ɪ t aː t ɛ m
n ɔ s ɔ k oː m j ʊ m	n ɔ s ɔ k ɔ m iː ʊ m
g r a w ɪ d ʊ m	g r a w ɪ d ʊ m
l ɪ m oː s ʊ m	l iː m oː s ʊ m
l ɛ n a d oː r	l ɪ ŋ n aː t oː r ɛ m
a n ɔ m aː l ʊ m	a n oː m a l ɔ n
l ɪ g a m ɛ n t ʊ m	l ɪ g aː m ɛ n t ʊ m
s uː b ʊ g aː r	s ʊ b j ʊ g aː r ɛ
ɪ n f ɔ r m ɛ m	iː n f oː r m ɛ m
f ɛ b ʊ l ɛ m	f l eː b ɪ l ɛ m
a gː r ɛ g aː r ɛ	a gː r ɛ g aː r ɛ
eː s w aː n ɛ m iː r ɛ	eː w aː n eː s k ɛ r ɛ
j ʊ ɪ t j ʊ m	j uː d ɪ k j ʊ m
ɪ rː ɔ g a m r ɛ	ɪ rː ɔ g aː r ɛ
t ɔ p s ɪ k aː r ɛ	t ɔ k s ɪ k aː r ɛ
uː k s ɔ r ɪ k ɪ d j ʊ m	ʊ k s oː r ɪ k iː d j ʊ m
p r ʊ ɛ w a m	p r ɔ b a m
ɛ t ʊ m	eː t ʊ m
l ɪ t ɛ m	l iː t ɛ m
d ɪ s t ɔ r kʷ ɛ r ɛ	d ɪ s t ɔ r kʷ eː r ɛ
a r b ʊ s t ɪ w ʊ m	a r b ʊ s t iː w ʊ m
r ɛ l ɪ g aː r ɛ	r ɛ l ɪ g aː r ɛ
r ʊ rː ɪ r ɛ aː	r oː r ɛ m
s aː j w ɛ	s w aː w ɛ m
p r ɔ s k r iː b ɛ r ɛ	p r oː s k r iː b ɛ r ɛ
h ɛ r eː m ʊ m	ɛ r eː m ʊ m
g a t a m	k a tː a m
eː ɔ	ɛu m
g r a t ɪ t oː m	g r aː t ɪ t uː d ɪ n ɛ m
t r aː n s ɪ t ʊ m	t r aː n s ɪ t ʊ m
p eː s aː r ɛ	p eː n s aː r ɛ
ɔ b s ɛ k j ʊ m	ɔ b s ɛ kʷ j ʊ m
uː r ʊ m	uː r ʊ m
d ɪ s ɪ m uː l aː t j oː n ɛ m	d ɪ sː ɪ m ʊ l aː t j oː n ɛ m
f ɪ s k ʊ m	f ɪ s k ʊ m
k ɔ n w oː k aː t j oː n ɛ m	k ɔ n w ɔ k aː t j oː n ɛ m
r ɛ d ɪ k g ɛ r ɛ	r ɛ d ɪ g ɛ r ɛ
ɪ rː ɔ m p ɛ r ɛ	ɪ rː ʊ m p ɛ r ɛ
ɪ m p ɛ r j ʊ m	ɪ m p ɛ r j ʊ m
p r a ŋ d s ʊ m	p r a n d j ʊ m
m iː g r aː r ɛ	m ɪ g r aː r ɛ
a b s k ʊ n d ɛ r ɛ	a b s k ɔ n d ɛ r ɛ
p ɛ r s ɛ k iː r ɛ	p ɛ r s ɛ kʷ iː
ɪ n s t r uː iː r ɛ	iː n s t r ʊ ɛ r ɛ
a b ɔ m aː s ʊ m	a b ɔ m aː s ʊ m
a tː r aː b ɪ l j aː r j ʊ m	aː t r a b iː l aː r j ʊ m
g l aʊ k ʊ m	g l aʊ k ʊ m
ɔ b s t r uː ɛ r	ɔ b s t r ʊ ɛ r ɛ
k ɛ l a	k ɛ lː a m
l ɪ b aː r ɛ	l iː b aː r ɛ
ɛ t aː t ɛ m	aɪ t aː t ɛ m
a n g ɛ l ɪ k ʊ m	a ŋ g ɛ l ɪ k ʊ m
s ɛ w ɛ r ʊ m	s ɛ w eː r ʊ m
d ɪ k aː k ɛ	d ɪ k aː k ɛ m
m ɔ k ʊ	m uː t ʊ l ʊ m
p oː n t oː n ɛ m	p oː t j oː n ɛ m
k ɔ n f ɪ aː r ɛ	k oː n f iː d ɛ r ɛ
f ɪ n ɛ m	f iː n ɛ m
s a l aː r j ʊ m	s a l aː r j ʊ m
t r ɪ b ʊ l ɛ r ɛ	t r ɪ b ʊ l aː r ɛ
ɔ b l a t j oː n ɛ m	ɔ b l aː t j oː n ɛ m
aʊ d iː t oː r ɛ	aʊ d iː t oː r ɛ m
a m aː r ɪ t r iː m ɛ	a m aː r ɪ t uː d ɪ n ɛ m
k ɪ m ɪ kʷ ɛ m	k iː m ɪ k ɛ m
p r ɛ s t aː t j oː n ɛ m	p r aɪ s t aː t j oː n ɛ m
m ɪ r aː k ʊ l ʊ m	m iː r aː k ʊ l ʊ m
g r aː w ɪ t aː t j oː n ɛ	g r a w ɪ t aː t j oː n ɛ m
a sː iː s t ɛ r ɛ	a sː ɪ s t ɛ r ɛ
ɪ n f ɪ r m a m r ɛ	iː n f ɪ r m aː r ɛ
t eː d a m	t aɪ d a m
a s t r ɪ k aː r ɛ	ɛ k s t r iː k aː r ɛ
k ɛ l ɛ b r aː r ɛ	k ɛ l ɛ b r aː r ɛ
p r ɛ s j ɛ n t j aː	p r aɪ s k ɪ ɛ n t j a m
p ɛ r k a m	p ɛ r k a m
ɪ t iː n ɛ r aː r j ʊ m	ɪ t ɪ n ɛ r aː r j ʊ m
ɛ k s aː l a m r ɛ	ɛ k s h aː l aː r ɛ
ɪ n k oː l uː m ɛ m	ɪ ŋ k ɔ l ʊ m ɛ m
p ɔ m ɪ f ɛ r ʊ m	p oː m ɪ f ɛ r ʊ m
s p aː r g ɛ r ɛ	s p a r g ɛ r ɛ
s a k ɛ r d ɔ t j ʊ m	s a k ɛ r d oː t j ʊ m
k ɔ m ʊ n j oː n ɛ m	k ɔ mː uː n iː r ɛ
m ɔ r a l ɪ t aː t ɛ m	m oː r aː l ɪ t aː t ɛ m
ɛ k s ɔ r t aː r ɛ	ɛ k s h ɔ r t aː r iː
ɪ n d ɪ ŋ n aː r ɛ	ɪ n d ɪ ŋ n aː r iː
s k ʊ r s ʊ m	ɛ k s k ʊ r s ʊ m
f ɛ m ɪ n ɪ n ʊ m	f eː m ɪ n iː n ʊ m
eː d iː kʰ oː l a m	aɪ d ɪ k ʊ l a m
s ɔ l ɛ w aː r ɛ	s ʊ b l ɛ w aː r ɛ
l a b ʊ r aː r ɛ	l a b oː r aː r ɛ
s t r iː g ɪ l ɛ	s t r ɪ g ɪ l ɛ m
m a k ɪ n aː r	m aː kʰ ɪ n aː r iː
d eː k oː rː ɛ r m ɛ	d eː k ʊ rː ɛ r ɛ
k a l ɛ n d a m s	k a l ɛ n d aː s
a l k ɛ	a l k ɛ m
p r ɛ k ɛ p t ʊ m	p r aɪ k ɛ p t ʊ m
a r b oː r ɛ t ʊ m	a r b ɔ r eː t ʊ m
w ɛ l iː r ɛ	w ɛ lː ɛ r ɛ
a m a r ɛ m	a m aː r ɛ
k ɔ n s l ɛ m d a m	k oː n s ɔ l ɪ d a m
uː s uː r a m	uː s uː r a m
g a w ɛ t a m	g a b a t a m
ɪ n kʷ j ɛ t aː r ɛ	ɪ ŋ kʷ ɪ eː t aː r ɛ
eː k s p l a m n aː r ɛ	ɛ k s p l aː n aː r ɛ
ɪ m p uː l s ʊ m	ɪ m p ʊ l s ʊ m
ɛ k s ɛ m p l aː r ɛ	ɛ k s ɛ m p l aː r ɛ m
p ɛ r k ɔ rː ɛ r ɛ	p ɛ r k ʊ rː ɛ r ɛ
eː d iː f ɪ k aː r ɛ	aɪ d ɪ f ɪ k aː r ɛ
m a t aː s a m	m a t a k s a m
p ɛ r p ɛ t ʊ ɪ t t ɛ m	p ɛ r p ɛ t ʊ ɪ t aː t ɛ m
k ɛ l t a m	k ɛ l t a m
a d j aː m a n t ɛ m	a d a m a n t ɛ m
b ʊ lː ɪ r ɛ	b ʊ lː iː r ɛ
p a l uː d a m m ɛ n t oː	p a l uː d aː m ɛ n t ʊ m
ɪ m p j ʊ m	ɪ m p j ʊ m
l a w a m t oː r j j ʊ m	l a w aː t oː r j ʊ m
s ɛ	s eː
j uː s t ɪ f iː k aː t j oː n ɛ m	j uː s t ɪ f ɪ k aː t j oː n ɛ m
ɪ n k ɪ d ɛ r ɛ	ɪ ŋ k ɪ d ɛ r ɛ
f ɛ n d ɛ r ɛ	f ɪ n d ɛ r ɛ
a d uː l aː r ɛ	a d uː l aː r iː
f aː s j j ɛ m	f a s k ɛ m
ɪ r aː k ʊ n d j a m	iː r aː k ʊ n d j a m
r ɛ t ɪ k ɛ r ɛ	r ɛ t ɪ k eː r ɛ
t r iː k ɛ m	t r iː k ɛ m
k ɪ r k ʊ n pʰ l uː ɪ r ɛ m	k ɪ r k ʊ m f l ʊ ɛ r ɛ
s t r ɛ p iː t ʊ m	s t r ɛ p ɪ t ʊ m
w oː m ɪ t ʊ m	w ɔ m ɪ t ʊ m
p a p aː r ɛ	p a pː aː r ɛ
b a l b ʊ t j aː r ɛ	b a l b uː t iː r ɛ
uː s ʊ aː l ɛ	uː s w aː l ɛ m
a fː l d ɛ n t j a m	a fː l ʊ ɛ n t j a m
ɔ r ɛ g a m n ʊ m	ɔ r iː g a n ʊ m
s k aː l j aː r ɛ	s k aː l aː r ɛ m
s ʊ l k aː r ɛ	s ʊ l k aː r ɛ
s ɛ rː ɛ g ɪ n	s ɛ rː aː g ɪ n ɛ m
s t aː b ɪ l ɛ	s t a b ɪ l ɛ m
w ɪ s ʊ m	w iː s ʊ m
a n iː m aː l ɛ	a n ɪ m a l
d ɪ p t oː ŋ g ʊ m	d ɪ pʰ tʰ ɔ ŋ g ʊ m
d uː b ʊ m	d ʊ b j ʊ m
ɪ n k l ɛ s ɛ	a ŋ g l eː n s ɛ m
k ɪ r k ʊ n s k r ɪ w ɛ r ɛ m	k ɪ r k ʊ m s k r iː b ɛ r ɛ
p r aʊ s ɛ n j oː m	p r ɔ s k eː n j ʊ m
d ɪ s p aː r aː r	d ɪ s p a r aː r ɛ
a n ɛ g aː r	eː n ɛ k aː r ɛ
a l ɛ n t ʊ m	a n h eː l ɪ t ʊ m
ɛ kː s k oː r j aː r ɛ	ɛ k s k ɔ r j aː r ɛ
g ɛ r aː r k aː	h ɪ ɛ r a r kʰ a m
r ɔ n k aː r	r h ɔ ŋ kʰ aː r ɛ
t ɛ n ɪ r ɛ ɛ	t ɛ n eː r ɛ
ɪ n f ɛ r ɛ r ɛ	iː n f ɛ rː ɛ
r a s t r ʊ m	r aː s t r ʊ m
ɛ n k a n ʊ m t ɛ r ɛ	ɪ ŋ k aː n eː s k ɛ r ɛ
a b s ɔ l b ɛ r ɛ	a b s ɔ l w ɛ r ɛ
r ɛ d aː r g ɛ ɛ	r ɛ d a r gʷ ɛ r ɛ
r aː s ɛ k aː r ɛ	r ɛ s ɛ k aː r ɛ
w ʊ l p ɛ	w ʊ l p ɛ m
ɛ k k ɛ lː ɛ r ɛ	ɛ k s k ɛ lː ɛ r ɛ
r ɔ s m aː r iː n ʊ m	r oː s m a r iː n ʊ m
j uː r a m t oː r ɛ	j uː r aː t oː r ɛ m
t ɛ s t ɪ m oː n j ʊ m	t ɛ s t ɪ m oː n j ʊ m
t uː r p eː d	t ʊ r p ɛ m
f ɪ n a l ɪ t t ɛ m	f iː n aː l ɪ t aː t ɛ m
ɛ k s p ɛ n d ɛ r ɛ	ɛ k s p ɛ n d ɛ r ɛ
r ɔ g aː r ɛ	r ɔ g aː r ɛ
a r m ɪ g ɛ m r ʊ m	a r m ɪ g ɛ r ʊ m
p a l uː d ɛ	p a l uː d ɛ m
kʷ a d r aː g ɛ s ɪ m ʊ m	kʷ aː d r aː g eː s ɪ m ʊ m
m eː l aː	m aː l ʊ m
a k uː m ɪ n aː r ɛ	a k uː m ɪ n aː r ɛ
s p ɛ k uː l aː t ɪ w ʊ m	s p ɛ k ʊ l aː t iː w ʊ m
s uː b ɛ r m ʊ m	s uː b ɛ r ɛ m
t ɔ r s ʊ m	tʰ y r s ʊ m
k ʊ l m ʊ m	k ʊ l m ʊ m
ɪ ŋ n ɛ ʊ m	ɪ ŋ n ɛu m
d ɛ t ɛ r m iː n a m t j ʊ m n ɛ m	d eː t ɛ r m ɪ n aː t j oː n ɛ m
r a p aː k ɛ	r a p aː k ɛ m
ɛ m iː k r aː n j a m	h eː m ɪ k r aː n j a m
k uː l aː	k uː n a m
b a l t ɪ k ʊ m	b a l t ɪ k ʊ m
ɪ n g ɛ n j ʊ m s ʊ m	ɪ ŋ g ɛ n j oː s ʊ m
k ɔ ɛ r t ɪ k j oː n ɛ m	k ɔ ɪ r k ɪ t j oː n ɛ m
m ɔ w ɪ m ɛ n t ʊ m	m oː w ɪ m ɛ n t ʊ m
l eː k aː l ɛ	l eː g aː l ɛ m
a r g ɪ k ɛ	a gː ɛ r ɛ m
s a k r aː r j ʊ m	s a k r aː r j ʊ m
ɔ t r ɛ	ʊ t r ʊ m
p a s t ʊ m	p aː s t ʊ m
s ɛ rː aː	s ɛ rː a m
k ɔ n s ʊ l t aː t j oː n ɛ m	k oː n s ʊ l t aː t j oː n ɛ m
l a t r aː r ɛ	l a t r oː n ɛ m
ɛ k s t aː s iː m	ɛ k s t a s ɛ m
eː b ɛ t ɛ	h ɛ b ɛ t ɛ m
f aʊ k ɪ j	f aʊ k eː s
a l g ɛ n	a l ɪ kʷ ɛ m
ɪ n ɛ b r j a m r ɛ	ɪ n eː b r j aː r ɛ
k a m b r oː n ɛ m	k r aː b r oː n ɛ m
k r ʊ k ɪ f eː r ʊ m	k r ʊ k ɪ f ɛ r ʊ m
d uː ɛ k ɛ n t ʊ m m	d ʊ k ɛ n t oː s
s uː p ɛ r b j a m	s ʊ p ɛ r b j a m
w ɛ r ɛ k ʊ n d ʊ m	w ɛ r eː k ʊ n d ʊ m
d eː t ɛ s t aː r ɛ	d eː t ɛ s t aː r iː
d ɛ r ɪ s j ʊ m n ɛ m	d eː r iː s j oː n ɛ m
aɪ k ɪ d ɪ d aː t ɛ m	a k ɪ d ɪ t aː t ɛ m
k ɔ t oː r n ɪ k ɛ	k oː t ʊ r n iː k ɛ m
p r ɔ t ɛ s t aː r ɛ	p r oː t ɛ s t aː r iː
s ʊ b s t ɪ t uː t j oː n ɛ m	s ʊ b s t ɪ t uː t j oː n ɛ m
w ɪ w ɪ d ʊ m	w iː w ɪ d ʊ m
l a k r ɪ m a m t j ʊ m n ɛ	l a k r ɪ m aː t j oː n ɛ m
a n ʊ n k aː r ɛ	a nː uː n t j aː r ɛ
ɔ fː iː k j ʊ m	ɔ fː ɪ k j ʊ m
a l j eː n aː r ɛ	a l ɪ eː n aː r ɛ
l a n k ɛ r ʊ m	l a ŋ k j aː r j ʊ m
m uː r	m uː r ɛ m
a g iː l ɪ t aː t ɛ m	a g ɪ l ɪ t aː t ɛ m
r ɛ k ɛ sː ɪ w ʊ m	r ɛ k ɛ sː iː w ʊ m
w a k aː r ɛ	w a k aː r ɛ
ɛ w ʊ r ʊ m	ɛ b ɔ r ɛu m
t ɛ t r ʊ m	t aɪ t r ʊ m
p r ɛ t aː k s t aː r ɛ	p r aɪ t ɛ k s ɛ r ɛ
k uː k uː l ʊ m	k ʊ k uː l ʊ m
ɔ m iː k ɪ d j ʊ m	h ɔ m ɪ k iː d j ʊ m
ɔ pː r ɪ mː ɛ r	ɔ pː r ɪ m ɛ r ɛ
a d m ɔ n ɪ t j oː n ɛ m	a d m ɔ n ɪ t j oː n ɛ m
k ɔ n g ʊ g aː r ɛ	k ɔ n j ʊ g aː r ɛ
m ɔ d ɛ r aː r ɛ	m ɔ d ɛ r aː r iː
d ɛ k ɛ p t ɔ r j ʊ m	d ɛ k ɛ p t oː r j ʊ m
k ɔ s t aː t ʊ m	k ɔ s t aː t ʊ m
r uː p ɛ	r uː p ɛ m
p a p a m	p aː p a m
p r ɔ f ɛ r ɪ r ɛ	p r oː f ɛ rː ɛ
ɔ b n uː b ɪ l a m r ɛ	ɔ b n uː b ɪ l aː r ɛ
a s iː m ɪ l aː r ɛ	a sː ɪ m ʊ l aː r ɛ
m ɛ n d ɪ k aː r ɛ	m ɛ n d iː k aː r ɛ
p r ɛ j r ɛ m m s ɪ l n	p ɛ t r ɔ s ɛ l iː n ʊ m
s a ŋ gʷ ɪ r aː r ɛ	s a ŋ gʷ ɪ n aː r ɛ
a w ɪ k j aː k ʊ m	aɪ g y p t j a k ʊ m
a m p l ɪ t oː l	a m p l ɪ t uː d ɪ n ɛ m
a k j ɛ	a k ɪ ɛ m
a m aː n ʊ ɛ n s ɛ m	aː m a n ʊ eː n s ɛ m
k r j aː t uː r a m	k r ɛ aː t uː r a m
ɪ n w ɪ t aː r ɛ	ɪ n w iː t aː r ɛ
a l uː t ɪ n aː r	aː l uː k ɪ n aː r iː
w a r j iː eː g aː t j oː n ɛ m	w a r ɪ ɛ g aː t j oː n ɛ m
b r iː t aː n iː k ʊ m	b r ɪ t a nː ɪ k ʊ m
g ɛ n ɛ r ʊ m	g ɛ n ʊ s
t a b ɛ r n a m	t a b ɛ r n a m
k ɔ n s ʊ p t j oː n ɛ m	k oː n s uː m p t j oː n ɛ m
k r iː t ɛ r j ʊ m	k r ɪ t ɛ r ɪ ɔ n
s ɪ k t ɪ t aː t ɛ m	s ɪ kː ɪ t aː t ɛ m
l a k t ɛ ʊ m	l a k t ɛu m
d ɛ s ɪ k aː t j oː n ɛ m	d eː s ɪ kː aː t j oː n ɛ m
s a r k ɪ n a m	s a r k ɪ n a m
p a l uː s t r ɛ m	p a l uː s t r ɛ m
g r aː m b ʊ m	g r ɛ m j ʊ m
l a t ɪ t uː d ɪ n ɛ m	l aː t ɪ t uː d ɪ n ɛ m
a kː ɔ m oː d aː t j oː n ɛ m	a kː ɔ mː ɔ d aː t j oː n ɛ m
k ɔ n t ʊ m eː l j aː	k ɔ n t ʊ m eː l j a m
ɪ d ɔ n ɛ t aː m ɛ m	ɪ d oː n ɛ ɪ t aː t ɛ m
s a kː uː l ʊ m	s a kː ʊ l ʊ m
d eː w ɛ n ɪ r ɛ	d eː w ɛ n iː r ɛ
f uː s t ʊ	f uː s t ɛ m
m a n s ʊ ɛ t uː m d ɛ n ɛ	m aː n s ʊ eː t uː d ɪ n ɛ m
t ɛ r t j a m r ɛ	t ɛ r t j aː r ɛ
f uː l g iː r ɛ	f ʊ l g eː r ɛ
t r a t ɪ m oː r ɛ	t r aː d ɪ t oː r ɛ m
a w eː n ɪ r ɛ	a d w ɛ n iː r ɛ
l eː ŋ g ʊ l a m	l ɪ ŋ g ʊ l a m
p r ɛ g ʊ d iː k j ʊ m	p r aɪ j uː d ɪ k j ʊ m
f ɔ k ɛ	f aʊ k ɛ m
r ɛ k ɔ n k iː l j aː r ɛ	r ɛ k ɔ ŋ k ɪ l j aː r ɛ
d j a b ʊ m l ʊ m	d j a b ɔ l ʊ m
a m a m r ɪ t j a m	a m aː r ɪ t ɪ ɛ m
ɛ s t r ɛ nː a m	s t r eː n a m
k r ɔ n ɪ k ʊ m	kʰ r ɔ n ɪ k ʊ m
f l uː w j aː l ɛ	f l ʊ w j aː l ɛ m
a n t ɪ k ɪ p a m r ɛ	a n t ɪ k ɪ p aː r ɛ
a l t ɪ t uː d ɪ n ɛ m	a l t ɪ t uː d ɪ n ɛ m
a b j ɛ k t j oː n ɛ m	a b ɪ ɛ k t j oː n ɛ m
aɪ r ɔ ɪ	h eː r oː ɛ m
eː l ɛ n k ʊ m	ɛ l ɛ ŋ kʰ ʊ m
t ɛ m p ɛ r aː r ɛ	t ɛ m p ɛ r aː r ɛ
d ɛ s t ɪ n aː r ɛ	d eː s t ɪ n aː r ɛ
p ʊ t r ɪ r ɛ	p ʊ t r ɛ r ɛ
p a l p ɛ b r a m	p a l p ɛ b r a m
ɪ n k ʊ m b ɛ r ɛ	ɪ ŋ k ʊ m b ɛ r ɛ
eː r ɛ d ɪ m aː t ɛ m	h eː r eː d ɪ t aː t ɛ m
m eː t aː lː ʊ m	m ɛ t a lː ʊ m
s ɛ n s ʊ m	s eː n s ʊ m
d ɛ p l oː r aː r ɛ	d eː p l oː r aː r ɛ
k ɪ b a t j oː n ɛ m	k ɪ b aː t j oː n ɛ m
w ɪ s aː r	w iː s ɛ r ɛ
a n aː r k j a m	a n a r kʰ j a m
f ɛ rː a m ɛ n t a m	f ɛ rː aː m ɛ n t ʊ m
w ɛ n d eː m j a m	w iː n d eː m j a m
s p ʊ r k ʊ m	s p ʊ r k ʊ m
n a f t a m	n a pʰ tʰ a m
p uː s t ʊ l a m	p ʊ s t ʊ l a m
p r ɔ t ɛ l a m	p r ɔ k ɛ lː a m
f ɪ d ɛ m l ɛ	f ɪ d eː l ɛ m
ɔ b ɪ ɛ k t iː w ʊ m	ɔ b j ɛ k t iː w ʊ m
f r a ŋ g ɛ r ɛ	f r a ŋ g ɛ r ɛ
a d iː t ʊ m	a d ɪ t ʊ m
w ɛ r b aː l ɛ	w ɛ r b aː l ɛ m
l aː p ɛ ɛ a m	a l a p a m
ɛ k s ɛ k r aː r ɛ	ɛ k sː ɛ k r aː r iː
s ɛ rː aː r	s ɛ rː aː r ɛ
n a t ʊ m	n aː t ʊ m
l uː s t r a m r ɛ	l ʊ s t r aː r ɛ
j eː l aː r ɛ	g ɛ l aː r ɛ
s uː p l ɪ t j ʊ m	s ʊ pː l ɪ k j ʊ m
m ɔ l ɛ k ʊ l a m	m oː l ɛ k ʊ l a m
a fː uː m ɪ g a m r ɛ	f uː m ɪ g aː r ɛ
s ɔ l ʊ m	s ɔ l ʊ m
eː s k uː l eː n t ʊ m	eː s k ʊ l ɛ n t ʊ m
a rː a m m	a rː h a m
l ɪ n ɛ aː r ɛ	l iː n ɛ aː r ɛ
w ɪ g ɔ r aː r ɛ	w ɪ g oː r aː r ɛ
m a ŋ n ɪ t uː d ɛ m	m a ŋ n ɪ t uː d ɪ n ɛ m
b r oː kː ʊ m	b r ɔ kː ʊ m
m a ŋ n ɛ s j ʊ m	m a ŋ n eː s j ʊ m
n a d a d oː r	n a t aː t oː r ɛ m
d ɪ l uː ɪ r ɛ	d iː l ʊ ɛ r ɛ
d eː l uː b r ʊ m	d eː l uː b r ʊ m
w ɪ t ɛ	w iː t ɛ m
l ɪ t aː r	l ɪ t aː r ɛ
p ɔ m ɛ t ʊ m	p ɔ m eː t ʊ m
eː n uː m ɛ r aː r	eː n ʊ m ɛ r aː r ɛ
a b l a k eː k j ʊ m n ɛ m	a b l a kʷ ɛ aː t j oː n ɛ m
ɛ n s ɛ ʊ m	ɛ k s a g j ʊ m
ɛ n t ɛ	ɛ n s
a l uː d iː r ɛ	a lː uː d ɛ r ɛ
b a r k a m	b a r k a m
f ʊ r ʊ n k ʊ l ʊ m	f uː r ʊ ŋ k ʊ l ʊ m
a w iː d ɪ t ɛ m	a w ɪ d ɪ t aː t ɛ m
d ɪ s aː d ɛ r ɛ	d ɪ sː w aː d eː r ɛ
a l ʊ ŋ g aː r ɛ	eː l ɔ ŋ g aː r ɛ
k ɔ n t r ɪ b ʊ ɛ r ɛ	k ɔ n t r ɪ b ʊ ɛ r ɛ
k ɛ r w ɪ n ʊ m	k ɛ r w iː n ʊ m
w ɪ s ɪ t a m t j ʊ m n ɛ	w iː s ɪ t aː t j oː n ɛ m
l eː k ʊ m	l aː ɪ k ʊ m
l ɪ b ɛ r aː l ɪ t aː t ɛ m	l iː b ɛ r aː l ɪ t aː t ɛ m
eː l aː k j oː n ɛ m	eː l aː t j oː n ɛ m
k ɛ n s ʊ r a m	k eː n s uː r a m
a fː ɪ r m aː t j oː n ɛ m	a fː ɪ r m aː t j oː n ɛ m
k ɔ n d ɛ n s aː t j oː n ɛ m	k ɔ n d eː n s aː t j oː n ɛ m
k a s ʊ m	k aː s ʊ m
p r ɛ w j ʊ m	p r aɪ w j ʊ m
ɔ rː aɪ	h ɔ rː eː r ɛ
f ɔ r m ɪ k aː r	f ɔ r m iː k aː r ɛ
p l aː n a m r ɛ	p l aː n aː r j ʊ m
f ɔ n t aː n a m	f ɔ n t aː n a m
a b iː g m ɛ aː t ʊ m	a b ɪ g ɛ aː t ʊ m
s t aː t ɛ m	s t a t ɪ k ʊ m
m uː nː ɪ r	m ɔ n eː r ɛ
m eː s a m	m eː s a m
f l ɛ k sː j oː n ɛ m	f l ɛ k s j oː n ɛ m
g ʊ w ɛ r n a m t oː r ɛ m	g ʊ b ɛ r n aː t oː r ɛ m
p iː n t ʊ r a m	p ɪ k t uː r a m
s uː kː uː l eː n t ʊ m	s ʊ kː ʊ l ɛ n t ʊ m
m ʊ s t ʊ m	m ʊ s t ʊ m
s iː n k ɛ r ʊ m	s ɪ ŋ k eː r ʊ m
k a m ɪ n ʊ m	k a mː iː n ʊ m
t ɛ ɔ s oː f j a m	tʰ ɛ ɔ s ɔ pʰ j a m
k a l kʰ oː l a m t j oː n ɛ m	k a l k ʊ l aː t j oː n ɛ m
a k ɔ n sː ʊ m l aː r ɛ	a kː ɔ ŋ k ɪ l j aː r ɛ
k a t ɛ k ɪ s m ʊ m	k a t eː kʰ ɪ s m ʊ m
t ɔ r t ʊ m r ɛ	t ɔ r t oː r ɛ m
ɪ n s p aː k t j ʊ m n ɛ m aː m	iː n s p ɛ k t aː r ɛ
r ɛ l a t ɪ w ʊ m	r ɛ l aː t iː w ʊ m
p r ɛ t ɛ r n aː t uː r aː l ɛ m	p r aɪ t ɛ r n aː t uː r aː l ɛ m
ɛ k s t r aː oː r d ɪ n aː r j ʊ m	ɛ k s t r aː ɔ r d ɪ n aː r j ʊ m
p l ɛ n ɪ t ɛ m	p l eː n ɪ t aː t ɛ m
w ɛ r t ɪ g ɪ n oː s ʊ m	w ɛ r t iː g ɪ n oː s ʊ m
l eː n ɛ m	l eː n ɛ m
f l uː m ɛ	f l uː m ɛ n
ɔ r n aː r ɛ	oː r n aː r ɛ
d ɛ w j a m r ɛ	d eː w j aː r ɛ
ʊ s t j ʊ m	oː s t j ʊ m
p ɛ r m ɪ s j oː n ɛ m	p ɛ r m ɪ sː j oː n ɛ m
w ɪ k ɪ n a m	w iː k iː n a m
f uː l m ɪ n aː r ɛ	f ʊ l m ɪ n aː r ɛ
eː m uː l a m t oː r ɛ	aɪ m ʊ l aː t oː r ɛ m
l aʊ d ɛ m	l aʊ d ɛ m
a ɪ ʊ n ɛ r ɛ	j eː j uː n aː r ɛ
m a n k ɪ p ɛ m j ʊ m	m a ŋ k ɪ p j ʊ m
a d ʊ ŋ g ɛ r ɛ	a d j ʊ ŋ g ɛ r ɛ
a kː r ɛ t j oː n ɛ	a kː r eː t j oː n ɛ m
f ɔ k a m	pʰ oː k a m
ɔ r t ʊ m	h ɔ r t ʊ m
a tː ɪ ŋ g ɛ r ɛ	a tː ɪ ŋ g ɛ r ɛ
d ɛ p ɛ r d iː t j ʊ m n ɛ m	d eː p ɛ r d ɪ t j oː n ɛ m
k ɔ m f ɛ s aː r	k oː n f ɪ t eː r iː
w a s ɛ lː ʊ m	w aː s k ɛ lː ʊ m
p ɛ n s ʊ m	p eː n s ʊ m
a n ɔ t aː t j oː n ɛ m	a nː ɔ t aː t j oː n ɛ m
k a m p ɛ s t r ɛ m	k a m p ɛ s t r ɛ m
uː r t ɪ k aː r j a m	ʊ r t iː k aː r j a m
p r ɛ p oː r ɛ m	p r aɪ p oː n ɛ r ɛ
s ʊ s p ɪ r j aː r ɛ	s ʊ s p iː r aː r ɛ
m ɔ n d aː r	m ʊ n d aː r ɛ
s a p oː r ɛ	s a p oː r ɛ m
b ɔ rː aː g n ɛ	b ɔ r aː g ɪ n ɛ m
ɪ l aː t ɪ w ʊ m	ɪ lː aː t iː w ʊ m
k ɔ n s ʊ m n aː r ɛ	k oː n s ɔ n aː r ɛ
n ɔ r m a m	n oː r m a m
t r a m a m	t r aː m a m
s uː b r ʊ m w eː n ɪ r	s ʊ p ɛ r w ɛ n iː r ɛ
f l ɛ mː a m	pʰ l ɛ g m a
l aʊ r ɔ k ɛ r aː s ʊ m	l aʊ r ɔ k ɛ r a s ʊ m
b ʊ aː r ɛ ʊ m	b ɔ aː r j ʊ m
k ɛ l ɛ s t j aː l ɛ	k aɪ l ɛ s t j aː l ɛ m
