k ɛ r b a m	k ɛ r w a m
p ɛ r ɪ k ʊ m l oː s ʊ m	p ɛ r iː k ʊ l oː s ʊ m
f ɛ r ɛ t r ʊ m	f ɛ r ɛ t r ʊ m
p ɛ r t ʊ r b aː t j oː k ɛ m	p ɛ r t ʊ r b aː t j oː n ɛ m
ɪ b iː s	iː b ɛ m iː b ɪ n
n uː t aː r	n uː t aː r ɛ
p ɪ n t ʊ r a m	p ɪ k t uː r a m
s ɛ r ʊ m	s ɛ r ʊ m
s k uː r ɪ l ɛ	s k ʊ rː iː l ɛ m
g ɛ s t j oː n	g ɛ s t iː r ɛ
d ɪ s ɛ n s ʊ m	d ɪ sː eː n s ʊ m
g r a m a m ɛ	g r aː m ɛ n
k a p r ʊ m n	k a p r ʊ m
b l a n d ʊ m	b l a n d ʊ m
r ʊ r aː r ɛ	r oː r aː r ɛ
s ɛ n s ʊ m	s eː n s ʊ m
w ɛ t ɛ r ɛ m	w ɛ t ɛ r ɛ m
s k r ʊ t aː r	s k r uː t aː r iː
t ɛ rː ɛ n ʊ m	t ɛ rː eː n ʊ m
t r aː n m m oː n t aː n ʊ m	t r aː n s m ɔ n t aː n ʊ m
a l t aː r ɛ ɛ m	a l t a r ɛ m
k ɔ kʷ ɛ	k ɔ kː ʊ m
f ɛ k ʊ n d ʊ m	f eː k ʊ n d ʊ m
k a l kʰ oː l aː t j oː n ɛ m	k a l k ʊ l aː t j oː n ɛ m
m ɪ s t ʊ r a m	m ɪ s t uː r a m
s ɛ p aː r aː r ɛ	s eː p a r aː r ɛ
k ʊ l t ɛ lː ʊ m	k ʊ l t ɛ lː ʊ m
s t uː p r ʊ m	s t ʊ p r ʊ m
s t aː n ʊ m	s t a nː ʊ m
m ɛ r ɛ g ʊ l ɛ m	m ɛ r g ʊ m
ɛ k s p l ɔ r aː t oː r	ɛ k s p l oː r aː t oː r ɛ m
l eː t ɛ r a m	l ɪ tː ɛ r a m
j uː n j ɔ r ɛ	j uː n j oː r ɛ m
s k ʊ rː ɛ r ɛ	ɛ k s k ʊ rː ɛ r ɛ
k ɔ m b a m	k ʊ m b a m
p r ɛ s t aː r ɛ	p r aɪ s t aː r ɛ
a d ɔ r aː r ɛ	a d oː r aː r ɛ
ɛ kʷ iː p aː r aː r ɛ	aɪ kʷ ɪ p ɛ r aː r ɛ
s t ɛ r k ʊ m ɛ	s t ɛ r k ʊ s
s aː l m aː	s a g m a m
r a p iː r ɛ m	r a p ɛ r ɛ
ɛ s t ʊ m	ɪ s t ʊ m
p ʊ t r ɛ m	p ʊ t r ɛ m
k a m p j ɛ oː n ɛ m	k a m p j oː n ɛ m
w ɛ n t ʊ m	w ɛ n t ʊ m
aː nː ɛ g aː r ɛ	n ɛ k aː r ɛ
d ɛ l ɪ t ʊ m	d eː l ɪ k t ʊ m
m ɛ r k aː r ɛ	m ɛ r k aː r iː
eː s ɛ kʷ j ɛ m	ɛ k sː ɛ kʷ j a m
a b aː l iː ɛ n aː r ɛ	a b a l ɪ eː n aː r ɛ
g ɪ r aː r ɛ m	g y r aː r ɛ
w ɛ n j a m	w ɛ n j a m
a s k aː l a m	a sː ʊ l a m
k ɔ n t r ɪ b uː iː r ɛ	k ɔ n t r ɪ b ʊ ɛ r ɛ
k a p ɪ t ɛ lː ʊ m	k a p ɪ t ɛ lː ʊ m
ɔ p uː l ɛ n t ʊ m	ɔ p ʊ l ɛ n t ʊ m
ɪ n f l aː t j ʊ m n ɛ m	iː n f l aː t j oː n ɛ m
m a l ɛ d ɪ k aː r ɛ	m a l ɛ d iː k ɛ r ɛ
f r aː s ɪ n ʊ m	f r a k s ɪ n ʊ m
n ʊ t ɔ r j ʊ m	n oː t oː r j ʊ m
d ɪ s p oː r ɛ	d ɪ s p oː n ɛ r ɛ
k ɔ n t ɪ n aː t j oː n ɛ m	k ɔ n t ɪ n w aː t j oː n ɛ m
k ɔ r j aː k ɛ ʊ m	k ɔ r j a k ɛu m
w ɛ s t r uː k ʊ m	s t r uː tʰ j oː n ɛ m
b ɔ b ʊ m	b a l b ʊ m
a g aː r ɪ k ʊ m	a g a r ɪ k ʊ m
d ɛ r ʊ m p ɛ ɛ	d iː r ʊ m p ɛ r ɛ
d ɛ m ɪ t r	d eː m ɪ tː ɛ r ɛ
l a k t ɛ ʊ m	l a k t ɛu m
oː rː ɪ	h ɔ rː eː r ɛ
a b iː g ɪ ʊ m	a b ɪ g ɛu m
ɪ n k aː r n aː r ɛ	ɪ ŋ k a r n aː r ɛ
f ʊ l ɛ m k aː r ɛ	f ɔ lː ɪ k aː r ɛ
k ɪ r k ʊ n s k r iː w ɛ r ɛ m	k ɪ r k ʊ m s k r iː b ɛ r ɛ
m a n s ʊ m n ɛ m	m aː n s j oː n ɛ m
p r iː n k ɪ p aː l ɪ t aː t ɛ m	p r ɪ ŋ k ɪ p aː l ɪ t aː t ɛ m
k a l k ɛ n ʊ m	k a l k aː n ɛu m
r iː s ʊ m	r iː s ʊ m
r eː p uː d j aː r ɛ	r ɛ p ʊ d j aː r ɛ
w ɛ r s ɪ k ʊ l ʊ m	w ɛ r s ɪ k ʊ l ʊ m
m ɔ r b ʊ m	m ɔ r b ʊ m
d ɛ l ɪ t j a m	d eː l ɪ k j aː s
kʷ a d r aː r ɛ	kʷ aː d r aː r ɛ
ɛ k s aː k ɛ r b aː t j oː n ɛ m	ɛ k s a k ɛ r b aː t j oː n ɛ m
s aː ŋ gʷ ɪ r aː r ɛ	s a ŋ gʷ ɪ n aː r ɛ
k ɔ ŋ g ʊ r aː t j oː n ɛ m	k ɔ n ɪ uː r aː t j oː n ɛ m
a l b uː m ɪ m a m	a l b uː m ɛ n
n a t uː r a m	n aː t uː r a m
f ʊ n t ɛ m	f ɔ n t ɛ m
b ɛ n ɛ d ɪ k aː r ɛ	b ɛ n ɛ d iː k ɛ r ɛ
m uː s k ʊ l aː r ɛ	m uː s k ʊ l aː r ɛ m
r ɛ f r ɪ g eː r j ʊ m	r eː f r iː g ɛ r j ʊ m
r ɛ f ɛ r iː r ɛ	r ɛ f ɛ rː ɛ
r ɛ k ɛ n s iː r ɛ	r ɛ k eː n s eː r ɛ
r ɛ t ɛ m	r eː t ɛ
k ʊ r uː s k aː r ɛ	k ɔ r ʊ s k aː r ɛ
r ɛ d uː k t j oː n ɛ m	r ɛ d ʊ k t j oː n ɛ m
uː l t ɔ r ɛ	ʊ l t oː r ɛ m
f r aɪ kʷ ɛ n t ɛ m	f r ɛ kʷ ɛ n t ɛ m
ɛ k s ɪ s t ɛ r ɛ	ɛ k s ɪ s t ɛ r ɛ
m a l f aː r ɛ	m a l ɛ f a k ɛ r ɛ
b ɔ l ɛ t ʊ m	b oː l eː t ʊ m
ɔ s p ɪ t j ʊ m	h ɔ s p ɪ t j ʊ m
a kː r ɪ ɪ aː t ɛ	aː k r ɪ t aː t ɛ m
l a m a m	l aː m a m
ɪ d aɪ n t ɪ t aː t ɛ m	iː d ɛ n t ɪ t aː t ɛ m
b ɛ lː ʊ m	b ɛ lː ʊ m
a m ɛ t ɪ s t a m	a m ɛ tʰ y s t a m
ɪ aː p a m	a l a p a m
f r aː t ɛ r n aː l	f r aː t ɛ r n aː l ɛ m
f uː l w ʊ m	f ʊ l w ʊ m
t r aɪ m ʊ l aː r ɛ	t r ɛ m ʊ l aː r ɛ
ɔ b ɛ d ɛ t ɛ r	ɔ b ɔ ɪ d iː r ɛ
b a r b aː r ɪ ɪ k aː r ɛ m	b a r b a r iː zː aː r ɛ
s t uː d j ʊ m	s t ʊ d j ʊ m
a b iː l ɪ t aː t ɛ m	h a b ɪ l ɪ t aː t ɛ m
f a l a ŋ g ɛ m	pʰ a l a ŋ g ɛ m
p r ɔ s k r iː b ɛ r ɛ	p r oː s k r iː b ɛ r ɛ
s a t ɪ r ʊ m	s a t y r ʊ m
l aʊ r j ʊ m	aʊ r ɛ ɔ l ʊ m
a k uː m ɛ m n	a k uː m ɛ n
ɪ ŋ g r aː t ʊ m	ɪ ŋ g r aː t ʊ m
f l a mː a m	f l a mː a m
ɛ k uː k aː r ɪ s t j a m	ɛu kʰ a r ɪ s t j a m
r ɛ s ɛ n aː r ɛ	r ɛ s ɪ ŋ n aː r ɛ
l ɪ b ɛ r aː t oː r ɛ	l iː b ɛ r aː t oː r ɛ m
d ɔ r m iː t oː r j ʊ m	d ɔ r m iː t oː r j ʊ m
k ɛ n t aʊ r j a m	k ɛ n t aʊ r eːa m
s t aː b ɪ l ɛ	s t a b ɪ l ɛ m
ɪ n d ɪ n aː t j oː n ɛ m	ɪ n d ɪ ŋ n aː t j oː n ɛ m
ɪ n k ɔ n s t a n t ɛ m	ɪ ŋ k oː n s t a n t ɛ m
k ɔ m p ɛ t ɛ n t j a m	k ɔ m p ɛ t ɛ n t j a m
s ɪ m j a m	s iː m j a m
ɔ b l ɪ g aː r ɛ	ɔ b l ɪ g aː r ɛ
ɔ l ʊ r ɛ	ɔ l oː r ɛ m
k a s t aː n a m	k a s t a n ɛ a m
p ɛ r p eː t aː t j oː n ɛ m	p ɛ r p ɛ t w aː t oː n ɛ m
d eː s p ɛ r g ɛ r ɛ	d ɪ s p ɛ r g ɛ r ɛ
s oː r ʊ ɪ ɛ	s ɔ r oː r ɛ m
s ɔ r t ɛ m	s ɔ r t ɛ m
f a k ɪ l ɪ t aː t ɛ m	f a k ɪ l ɪ t aː t ɛ m
a k aɪ r w ʊ m	a k ɛ r w ʊ m
p r ɛ k oː n ʊ m t ɛ r ɛ	p r aɪ k ɔ ŋ n ɔ s k ɛ r ɛ
a sː uː m ɛ r ɛ	a sː uː m ɛ r ɛ
g l ɔ s a m	g l ɔ sː a m
g ɛ b ʊ m	g ɪ bː ʊ m
k ɛ l ɛ b r ɛ m	k ɛ l ɛ b r ɛ m
n ɛ f aː s t ʊ m	n ɛ f aː s t ʊ m
k ɔ l ʊ m b a m	k ɔ l ʊ m b a m
k ʊ m ɛ r	k ɔ m ɛ d ɛ r ɛ
f a s t ɪ g j ʊ m	f a s t iː g j ʊ m
a w ɛ l ɪ n a m	a b ɛ lː a n a m
ɔ pː oː n ɛ r ɛ	ɔ pː oː n ɛ r ɛ
r ɛ k ɔ rː eː r ɛ	r ɛ k ʊ rː ɛ r ɛ
k ɔ s ʊ m	k ɔ k s ʊ m
b a k t ɛ s ɪ m ʊ m	b a p t ɪ s m ʊ m
k a l ɪ fː a m	k a l iː pʰ a m
eː d iː kʰ oː l a m	aɪ d ɪ k ʊ l a m
f a r m aː k ɛ uː t iː k ʊ m	pʰ a r m a k ɛu t ɪ k ʊ m
eː m ɛ t ɛ r ɛ	eː m ɪ tː ɛ r ɛ
s p uː t ʊ m	s p uː t ʊ m
a m ɛ n t ʊ m	aː m ɛ n t ʊ m
ɪ t ɛ r aː r ɛ	ɪ t ɛ r aː r ɛ
m a t ɛ r n iː t aː t ɛ m	m aː t ɛ r n ɪ t aː t ɛ m
f ɛ n ɪ k j ʊ m	pʰ ɔ ɪ n iː k ɛu m
k r eː p r ɛ aː t uː r a m	k r ɛ p aː t uː r a m
n ɛ n j a m	n eː n j a m
a b ɔ l ɪ t j oː n ɛ m	a b ɔ l ɪ t j oː n ɛ m
a b uː s aː r ɛ	a b uː t iː
p a l p ɪ t aː t j oː n	p a l p ɪ t aː t j oː n ɛ m
aʊ r iː g ɛ r ʊ m	aʊ r ɪ g ɛ r ʊ m
n l ɔ t ɪ n ʊ m	a nː oː t ɪ n ʊ m
a nː ɛ g aː r ɛ	eː n ɛ k aː r ɛ
s p ɛ t j ɛ m	s p ɛ k ɪ ɛ m
l ɔ k uː t j ʊ m n ɛ m	l ɔ k uː t j oː n ɛ m
w ʊ l p ɛ m	w ʊ l p ɛ m
b ɛ s t j aː r j ʊ m	b eː s t j aː r j ʊ m
m ɛ d ɪ r	m eː t iː r iː
p r ʊ ɛ w a m	p r ɔ b a m
aɪ kʷ ʊ m	aɪ kʷ ʊ m
l ɛ g uː l eː j ʊ m	l eː g ʊ l eː j ʊ m
t r aɪ p ɪ d aː t j oː n ɛ m	t r ɛ p ɪ d aː t j oː n ɛ m
s aː d ɛ r ɛ	s w aː d eː r ɛ
b a l t ɪ k ʊ m	b a l t ɪ k ʊ m
k ɔ l ɔ s t r ʊ m	k ɔ l ɔ s t r a m
a kː aː d ɛ m j a m	a k a d eː m iː a m
a k t ʊ m	aː k t ʊ m
g uː r ʊ m	ɪ uː s
p ʊ l s aː r ɛ	p ʊ l s aː r ɛ
d ɛ n uː d aː r ɛ	d eː n uː d aː r ɛ
k ɪ b ʊ m	k ɪ b ʊ m
l ɪ m aː t a m	l iː m aː k ɛ m
r ɛ g j ʊ m	r eː g j ʊ m
a r b ɪ t r ɛ r	a r b ɪ t r aː r iː
m ɛ t aː lː ɪ pʰ a r ʊ m	m ɛ t a lː ɪ f ɛ r ʊ m
uː sː ɛ r ɛ	ɔ s t j aː r j ʊ m
ɪ n k ɪ t aː t j oː n ɛ m	ɪ ŋ k ɪ t aː t j oː n ɛ m
l ɔ kʷ ɪ aː k ɛ m	l ɔ kʷ aː k ɛ m
t r iː lː ʊ m	t r iː b ʊ l ʊ m
ɪ m aː k ʊ l aː t ʊ m	ɪ mː a k ʊ l aː t ʊ m
f ɔ k ɛ	f aʊ k ɛ m
s a n aː t j oː n ɛ m	s aː n aː t j oː n ɛ m
a pː l aʊ s ʊ m	a pː l aʊ s ʊ m
f l ɛ mː a m	pʰ l ɛ g m a
p ɛ r k ʊ s oː r ɛ	p ɛ r k ʊ sː oː r ɛ m
r ɛ l ɛ g aː r ɛ	r ɛ l ɛ g ɛ r ɛ
a s t uː t j a m	a s t uː t j a m
eː r ɔ d ɛ r ɛ	eː r oː d ɛ r ɛ
k aɪ ɪ t ʊ d ɛ m	kʷ ɪ eː t uː d ɪ n ɛ m
t r aː b aː l j ʊ m	t r ɪ p aː l ɛ m
r ɛ f ɛ k t j oː n ɛ m	r ɛ f ɛ k t j oː n ɛ m
s a l k ɪ k ɛ	s a l ɪ k ɛ m
k ɔ n t ɛ s t aː r ɛ	k ɔ n t ɛ s t aː r iː
a d w ɔ k aː t j oː n ɛ m	a d w ɔ k aː t j oː n ɛ m
b ɛ t ʊ l a m	b ɛ t ʊ l a m
p oː ʊ	p j ʊ m
b ɛ r ʊ b ɪ n ɛ m ɛ m	w ɛ r w eː k s
ɪ d ɛ n t ɪ k ʊ m	iː d ɛ n t ɪ k ʊ m
s ɔ m iː ɛ r ʊ m	s a g m aː r j ʊ m
p r ɔ m ʊ l g aː t j oː n ɛ m	p r oː m ʊ l g aː t j oː n ɛ m
s uː b ɔ r n aː r ɛ	s ʊ b oː r n aː r ɛ
m ɪ k sː l j ʊ m n	m ɪ k s t j oː n ɛ m
p a t r ɪ t j ʊ m	p aː t r ɪ k j ʊ m
ɪ m p ɛ r t ɛ p t ɪ b l ɛ	ɪ m p ɛ r k ɛ p t ɪ b ɪ l ɛ m
k uː r a m	k uː r a m
a s t a m	h a s t a m
d ɛ k ɔ k t j oː n ɛ m	d ɛ k ɔ k t j oː n ɛ m
t ɪ t ɪ lː a m r ɛ	t iː t ɪ lː aː r ɛ
a t ɪ n eː r ɛ	a tː ɪ n eː r ɛ
a d ʊ m b r aː r ɛ	a d ʊ m b r aː r ɛ
l uː t ʊ m	l uː k t ʊ m
b r aː k aː t ʊ m	b r aː k aː t ʊ m
d ɛ p aː r t iː r	d eː p a r t iː r ɛ
k ɔ n s ʊ l t aː t j oː n ɛ m	k oː n s ʊ l t aː t j oː n ɛ m
k ɪ r k ʊ l aː r ɛ	k ɪ r k ʊ l aː r ɛ m
ɪ m p j ʊ m	ɪ m p j ʊ m
t ɪ t ʊ l aː r ɛ	t ɪ t ʊ l aː r ɛ m
d ɪ s p oː s iː t j oː n ɛ m	d ɪ s p ɔ s ɪ t j oː n ɛ m
m ɛ r g ɛ r ɛ	m ɛ r g ɛ r ɛ
a l aː k r ɪ t aː t ɛ m	a l a k r ɪ t aː t ɛ m
s uː p ɛ r j oː r ɛ	s ʊ p ɛ r j oː r ɛ m
uː k s ɔ r ɪ k ɪ d j ʊ m	ʊ k s oː r ɪ k iː d j ʊ m
g ʊ s t ʊ m	g ʊ s t ʊ m
d ɛ s p ɛ r ɛ t eː r ɛ	d ɪ s p ɛ r iː r ɛ
p a r t ɪ k ʊ l a m	p a r t ɪ k ʊ l a m
ɪ n t ɛ r p r ɛ t aː b n ɛ m l ɛ m	ɪ n t ɛ r p r ɛ t aː b ɪ l ɛ m
a b aː l iː ɛ n aː t j oː n ɛ m	a b a l ɪ eː n aː t j oː n ɛ m
k a m b r oː n ɛ m	k r aː b r oː n ɛ m
d ɪ l aː k eː r aː r	d iː l a k ɛ r aː r ɛ
p uː p ɪ lː ʊ m	p uː p ɪ lː ʊ m
f ʊ r n aː t ɛ m	f ɔ r n aː k ɛ m
a n eː m ʊ m	a ŋ n ɛ lː ʊ m
h ɪ k ɪ	kʷ ɛ m
k ʊ l oː n oː	k ɔ l oː n ʊ m
n ɔ n ʊ m	n ɔ nː ʊ m
s ʊ kː ʊ m b ɛ r ɛ	s ʊ kː ʊ m b ɛ r ɛ
f uː ɛ n a m	f aː g ɪ n ʊ m
l ɔ k aː t j oː n ɛ	l ɔ k aː t j oː n ɛ m
d eː p ɛ n d ɛ r ɛ	d eː p ɛ n d eː r ɛ
m ɛ t r ɪ ʊ m	m ɛ t r ʊ m
k ʊ m p l ɛ r ɛ	k ɔ m p l eː r ɛ
p ʊ t r ɪ r ɛ	p ʊ t r ɛ r ɛ
k uː l ɛ r a m	kʰ ɔ l ɛ r a m
d ɪ s p aː r t ɪ r ɛ	d ɪ s p a r t iː r ɛ
a n aɪ t ʊ m	a n eː tʰ ʊ m
t r aː d ɪ r ɛ	t r aː d ɛ r ɛ
ɪ w ʊ m	iː w ʊ m
t ɛ t r ɪ k ʊ m	t aɪ t r ɪ k ʊ m
m iː aː r	m eː j ɛ r ɛ
w ɔ r t ɪ k k ɛ m	w ɔ r t ɪ k ɛ m
d ɪ k t aː m ɛ n	d ɪ k t aː m ɛ n
p a l aː t ʊ m r	p a l aː t ʊ m
k r iː m ɪ n oː s ʊ m	k r iː m ɪ n oː s ʊ m
eː w iː ŋ t eː r ɛ	eː w ɪ ŋ k ɛ r ɛ
h ɛ r b oː s ʊ m	h ɛ r b oː s ʊ m
t r aː j l a m	t r aː g ʊ l a m
k ɛ r t aː m ɛ m m	k ɛ r t aː m ɛ n
p l ʊ m b ɛ ʊ m	p l ʊ m b ɛu m
w ɛ r s ɪ pʰ ɪ k aː r ɛ	w ɛ r s ɪ f ɪ k aː r ɛ
k iː n	kʷ ɪ s
p r ɛ k aː r ɛ	p r ɛ k aː r iː
k ʊ p ʊ l aː r ɛ	k oː p ʊ l aː r ɛ
f uː l m ɪ n aː r ɛ	f ʊ l m ɪ n aː r ɛ
ɛ k s t ɛ r j oː r ɛ	ɛ k s t ɛ r j oː r ɛ m
f r j ɪ k ʊ m t	f r iː g ɪ d ʊ m
t ʊ rː aː r	t ɔ rː eː r ɛ
g ɛ r m ɛ m n	g ɛ r m ɛ n
f r ɛ n aː r ɛ	f r eː n aː r ɛ
ɪ n f ɛ r oː r	iː n f ɛ r ʊ m
d ɛ n t aː l ɛ	d ɛ n t aː l ɛ m
ɔ k uː l aː r ɛ	ɔ k ʊ l aː r ɛ m
ɪ r aː k ʊ n d j a m	iː r aː k ʊ n d j a m
ɔ r t ɔ g r aː f j a m	ɔ r tʰ ɔ g r a pʰ j a m
m ɔ n aː s t ɛ r j ʊ	m ɔ n a s t eː r j ʊ m
s uː p l ɛ m s n aː ʊ m	s ʊ pː l eː m ɛ n t ʊ m
a r aː b ɪ l ɛ m	a r aː b ɪ l ɛ m
m ʊ l k ɛ r ɛ	m ʊ l k eː r ɛ
n ɛ g ɔ t j ʊ m	n ɛ g oː t j ʊ m
d ɪ s t r ɛ r ɛ	d ɪ s t r a h ɛ r ɛ
a m aː t oː r ɛ	a m aː t oː r ɛ m
ɪ ŋ n ɔ m ɪ n j a m	ɪ ŋ n oː m ɪ n j a m
a ɪ t oː r ɛ m	a s t ʊ r ɛ m
a g iː t aː t oː r	a g ɪ t aː t oː r ɛ m
m a r k ʊ p j ʊ m	m a r s uː p j ʊ m
l ɪ n t ɛ r n a m	l a n t ɛ r n a m
s ɪ k k ɪ t aː t ɛ m	s ɪ kː ɪ t aː t ɛ m
w ɪ b r aː r ɛ	w ɪ b r aː r ɛ
d ɪ fː ɛ r iː r ɛ	d ɪ fː ɛ rː ɛ
f ɛ r m ɛ n t aː t j oː n ɛ m	f ɛ r m ɛ n t aː t j oː n ɛ m
w ɛ r t ɛ r ɛ	w ɛ r t ɛ r ɛ
f ɔ ŋ g oː s ʊ m	f ʊ ŋ g oː s ʊ m
d ɛ k ɔ r aː r ɛ	d ɛ k ɔ r aː r ɛ
m uː l ɪ n ʊ m	m ɔ l iː n ʊ m
p a l p ɛ b r a m	p a l p ɛ b r a m
uː n k ɪ n ʊ m	ʊ ŋ k iː n ʊ m
n ɛ k r ɪ t a m	n ɪ g r ɪ t j a m
d ʊ kː aː	d ʊ k t j oː n ɛ m
m ɔ r t aː r j ʊ m	m ɔ r t aː r j ʊ m
a n ʊ m	aː n ʊ m
k r ɔ lː aː r ɛ	k ɔ rː ʊ ɛ r ɛ
p ɛ r n a m	p ɛ r n a m
ɪ lː uː s t r ɛ m	ɪ lː uː s t r ɛ m
p r ɛ w j ʊ m	p r aɪ w j ʊ m
a k aɪ t ʊ m	a k eː t ʊ m
ɪ n w ɛ s t iː g aː t j oː n ɛ m	ɪ n w ɛ s t iː g aː t j oː n ɛ m
k ɔ n s ɪ s t ɛ r ɛ	k oː n s ɪ s t ɛ r ɛ
n t ɛ r ɛ m ɛ t eː r k ɛ	ɪ n t ɛ r m ɪ tː ɛ r ɛ
ɪ mː ɔ r t aː l	ɪ mː ɔ r t aː l ɛ m
a b d oː m aː n	a b d oː m ɛ n
a r iː ɛ t ɛ m	a r ɪ ɛ t ɛ m
w ɪ r aː g ʊ m	w ɪ r aː g ɪ n ɛ m
s ɛ k t ɪ m aː n a m	s ɛ p t ɪ m aː n a m
k ɛ r w ɪ j a m	k ɛ r w ɛ s j a m
k ʊ l ɛ g j ʊ m	k ɔ lː eː g j ʊ m
ɪ m p ɛ lː ɛ r ɛ	ɪ m p ɛ lː ɛ r ɛ
l aʊ r ɔ k eː r aː s ʊ m	l aʊ r ɔ k ɛ r a s ʊ m
ɪ n ɛ b r j a m r ɛ	ɪ n eː b r j aː r ɛ
m ɔ n d ʊ m	m ʊ n d ʊ m
k ɔ m uː n ɛ m	k ɔ mː uː n ɛ m
h ɛ n k ɛ ʊ m	ɛ k s a g j ʊ m
m aɪ d ʊ m	m ɛ t ʊ m
k a p r ɪ n ʊ m	k a p r iː n ʊ m
b ɛ l aː r ɛ m	b aː l aː r ɛ
uː l t r ɪ k ɛ	ʊ l t r iː k ɛ m
l ɪ t uː r g j a m	l iː t uː r g j a m
g ɔ s ʊ aː	g ɛu s j aː s
k ɔ n t r a w ɛ n ɪ r	k ɔ n t r aː w ɛ n iː r ɛ
m uː n ɔ m	m uː n ʊ s
d ɪ k k j oː n ɛ m	d ɪ k t j oː n ɛ m
ɛ k s p ɪ r aː r ɛ	ɛ k sː p iː r aː r ɛ
a sː ɔ l aː r ɛ	a sː ɔ l aː r ɛ
l ɔ t oː s ʊ m	l ʊ t oː s ʊ m
g uː b a m	j ʊ b a m
r ɛ p r ɛ ɛ n s j oː n ɛ m	r ɛ p r ɛ h ɛ n s j oː n ɛ m
l ʊ ŋ g ɪ n kʷ ɪ t aː t ɛ m	l ɔ ŋ g ɪ ŋ kʷ ɪ t aː t ɛ m
k a r n ɛ pʰ ɪ k ɛ m	k a r n ɪ f ɪ k ɛ m
t ɛ d j oː s ʊ m	t aɪ d j oː s ʊ m
ɪ nː ɔ w aː t j oː n ɛ m	ɪ nː ɔ w aː t j oː n ɛ m
k ɛ r ɛ m oː n j aː l ɛ	k aɪ r ɪ m oː n j aː l ɛ m
m a r t ɛ lː ʊ m	m a r t ɛ lː ʊ m
a b ɔ m ɪ n aː t j oː n ɛ m	a b oː m ɪ n aː t j oː n ɛ m
k ʊ m p r aː t oː r ɛ	k ɔ m p a r aː t oː r ɛ m
a d uː l t eː r ɪ n ʊ m	a d ʊ l t ɛ r iː n ʊ m
a r iː m ɪ l a m	a r m ɪ lː a m
ɪ m p uː ɛ n t ɛ m	ɪ m p ʊ d ɛ n t ɛ m
f ɛ s aː r ɛ	f a t eː r iː
s p ɛ t ɪ m ɛ n	s p ɛ k ɪ m ɛ n
t a n t ʊ m	t a n t ʊ m
k ɔ l w r ʊ m	k ɔ l ʊ b r a m
p r aɪ d aː t j ʊ n ɛ m	p r aɪ d aː t j oː n ɛ m
f ɪ l ɔ s oː pʰ j a m	pʰ ɪ l ɔ s ɔ pʰ j a m
ɪ n mː ɔ l aː r ɛ	ɪ mː ɔ l aː r ɛ
l uː n aː t j ʊ m n ɛ m	l uː n aː t j oː n ɛ m
s ʊ n ɪ t ʊ m	s ɔ n ɪ t ʊ m
w ɛ n t r ɛ m	w ɛ n t r ɛ m
m ɪ n ɔ r aː r	m ɪ n oː r aː r ɛ
s ʊ p ɔ r ɛ	s ɔ p oː r ɛ m
p r ɛ ɛ m b ʊ l ʊ m	p r aɪ a m b ʊ l ʊ m
ɛ w ʊ r eː ʊ m	ɛ b ɔ r ɛu m
f a k ɛ t ʊ m	f a k eː t ʊ m
k ɔ n s oː n aː r ɛ	k oː n s ɔ n aː r ɛ
ɪ k ʊ m	ɪ k ʊ m
s uː b ʊ g ɛ r	s ʊ b j ʊ g aː r ɛ
l ɪ t ɛ m	l iː t ɛ m
ɪ b r ɪ d ʊ m	h y b r ɪ d a m
kʷ a d r ʊ m	kʷ aː d r ʊ m
a s p ɪ k ʊ m	aʊ s p ɪ k j ʊ m
ɛ sː ʊ m	ɪ p s ʊ m
k ɔ d a m	k aʊ d a m
d ɛ s k r ɪ p t j oː n ɛ m	d eː s k r iː p t j oː n ɛ m
a w ʊ m k	a w ʊ m
p a r ʊ m	p a r ɛ m
k a t ɪ n ʊ m	k a t iː n ʊ m
s oː l ʊ m	s oː l ʊ m
g ɛ l ʊ m	g ɛ l uː
p ʊ r k ɛ m ʊ m	p ɔ r k ɛ lː ʊ m
a b ɔ m aː s ʊ m	a b ɔ m aː s ʊ m
k ʊ n t ɛ n d ɛ r ɛ	k ɔ n t ɛ n d ɛ r ɛ
d ɛ s uː l t oː r j ʊ m	d eː s ʊ l t oː r j ʊ m
d ʊ l ʊ r oː s ʊ m	d ɔ l oː r oː s ʊ m
b a s ɛ m	b a s ɛ m
m a n uː b r j ʊ m	m a n uː b r j ʊ m
uː b iː k aː t j oː n ɛ m	ʊ b ɪ k aː t j oː n ɛ m
k aː l aː r ɛ	k ɔ aː g ʊ l aː r ɛ
k l aʊ s ʊ r a m	k l aʊ s uː r a m
p r ɛ g ʊ m n	p r aɪ k oː n ɛ m
ɪ n k ɔ m oː d aː r	ɪ ŋ k ɔ mː ɔ d aː r ɛ
p ɔ s t ʊ l aː r ɛ	p ɔ s t ʊ l aː r ɛ
k l aː l oː l ʊ m	g l a d ɪ ɔ l ʊ m
s aɪ l w a m	s ɪ l w a m
ɔ s t eː n t aː r ɛ	ɔ s t ɛ n t aː r ɛ
d ɛ p r ɛ d aː r ɛ	d eː p r aɪ d aː r iː
ɪ m p uː l s ʊ m	ɪ m p ʊ l s ʊ m
s p ɛ k ʊ l aː t ɪ w ʊ m	s p ɛ k ʊ l aː t iː w ʊ m
a b iː l ɛ	h a b ɪ l ɛ m
