a n a r k j a m	a n a r kʰ j a m
f ɪ d ɛ l ɛ	f ɪ d eː l ɛ m
p r ʊ k aː k ɛ	p r ɔ k aː k ɛ m
n ɪ w ɛ ʊ m	n ɪ w ɛu m
k a l eː r ɛ	k a l eː r ɛ
b r a n kː a m	b r a ŋ k a m
d ɪ s t r ɪ k t ʊ m	d ɪ s t r ɪ k t ʊ m
m a ŋ n ɪ t uː d ʊ m	m a ŋ n ɪ t uː d ɪ n ɛ m
h a b l ʊ m	ɛ b ʊ l ʊ m
a b ɔ m ɪ n aː r ɛ	a b oː m ɪ n aː r iː
m ɔ d ɪ r ɛ	m ɔ l ɛ r ɛ
r aː lː ʊ m	r a lː ʊ m
a s t r ʊ m	a s t r ʊ m
p uː lː uː l aː r ɛ	p ʊ lː ʊ l aː r ɛ
kʷ ɔ t ɪ d j aː n ʊ m	k ɔ t iː d j aː n ʊ m
k a n ɪ k ʊ l a m	k a n iː k ʊ l a m
a k r ɪ t a t ɛ m	aː k r ɪ t aː t ɛ m
s p ɪ n aː l ɛ	s p iː n aː l ɛ m
ɛ k s p l ɪ k a t j oː n ɛ m	ɛ k s p l ɪ k aː t j oː n ɛ m
s uː p lː ɛ m ɛ n t ʊ m	s ʊ pː l eː m ɛ n t ʊ m
s a g ɪ t aː r j ʊ m	s a g ɪ tː aː r j ʊ m
a t r aː ɛu r ɛ	a tː r a h ɛ r ɛ
p uː b ɛ m	p uː b ɛ r ɛ m
s a n t ʊ m	s aː ŋ k t ʊ m
n ɔ t a m	n ɔ t a m
ɔ b s ɛ d ɛ r ɛ	ɔ b s ɪ d eː r ɛ
p uː t r ɪ d ʊ m	p ʊ t r ɪ d ʊ m
m a s k l ʊ m	m a s k ʊ l ʊ m
d ɛ k ɛ p t ɔ r j ʊ m	d ɛ k ɛ p t oː r j ʊ m
r ɔ n k aː r ɛ	r h ɔ ŋ kʰ aː r ɛ
a p a s t oː l	a p ɔ s t ɔ l ʊ m
ɪ m p ɛ t ʊ m	ɪ m p ɛ t ʊ m
s a t uː r aː r ɛ	s a t ʊ r aː r ɛ
k ɔ m ɪ t j ʊ m	k ɔ m ɪ t j ʊ m
s iː n ʊ m	s ʊ iː n ʊ m
k ʊ n s oː b r ɪ n ʊ m	k oː n s oː b r iː n ʊ m
eː t ɛ r ɛ ʊ m	aɪ tʰ ɛ r j ʊ m
p a w ɪ l oː n ɛ m	p aː p ɪ l j oː n ɛ m
l uː k ɛ r n a m	l ʊ k ɛ r n a m
w ɛ s p eː r ʊ m	w ɛ s p ɛ r ʊ m
a r k a n ʊ m	a r k aː n ʊ m
p ɔ p ɛ r ʊ m	p aʊ p ɛ r ɛ m
l ɛ w ɪ g aː r ɛ	l ɛ w ɪ g aː r ɛ
j ɛ p s ʊ m	g y p s ʊ m
p ɔ r t j ɔ n ɛ m	p ɔ r t j oː n ɛ m
d ɪ f lː uː ɛ r ɛ	d ɪ fː l ʊ ɛ r ɛ
p ɛ r g uː r ʊ m	p ɛ r ɪ uː r ʊ m
a g ɪ t a d ɔ r ɛ	a g ɪ t aː t oː r ɛ m
a m p lː ɪ f ɪ k a t j oː n ɛ m	a m p l ɪ f ɪ k aː t j oː n ɛ m
ɛ k k ɛ lː ɛ n t j a m	ɛ k s k ɛ lː ɛ n t j a m
w ɪ t uː l ʊ m	w ɪ t ʊ l ʊ m
b r a k aː t ʊ m	b r aː k aː t ʊ m
p r ɛ t ɛ r ɪ r ɛ	p r aɪ t ɛ r iː r ɛ
r ɛ t ɛ t a m	r ɛ k ɛ p t a m
l ʊ k r ʊ m	l ʊ k r ʊ m
f ɪ k ʊ m	f iː k ʊ m
aʊ k s ɪ l j aː r ɛ	aʊ k s ɪ l j aː r ɛ m
p lː a n ɪ t j ɛ m	p l aː n ɪ t ɪ ɛ m
t ɔ g a m	t ɔ g a m
p iː n t ʊ m	p ɪ k t ʊ m
a s a r ʊ m	a s a r ʊ m
p a g a n ɪ k t a m	p aː g aː n ɪ t aː t ɛ m
l a n t aː ʊ m	l a ŋ k j aː r j ʊ m
s p ɔ r t a m	s p ɔ r t a m
ɪ n s ɔ l ɪ t ʊ m	iː n s ɔ l ɪ t ʊ m
ɛ k s ɛ r k ɛ r ɛ	ɛ k s ɛ r k eː r ɛ
w ɛ r t ɪ g ɪ n oː s ʊ m	w ɛ r t iː g ɪ n oː s ʊ m
b ɛ r b ɪ k ʊ m	w ɛ r w eː k s
p ʊ lː ɛ r l ʊ m	p ʊ lː aː r j ʊ m
b l a n d ʊ m	b l a n d ʊ m
f aʊ s t ʊ m	f aʊ s t ʊ m
ɛ k s ɪ g ɛ r ɛ	ɛ k s ɪ g ɛ r ɛ
r eː s uː s k ɪ t a t j oː n ɛ m	r ɛ s ʊ s k ɪ t aː t j oː n ɛ m
s ɔ lː ɪ k ɪ t uː d ɪ n ɛ m	s ɔ lː ɪ k ɪ t uː d ɪ n ɛ m
ɔ p ɛ r aː r ɛ	ɔ p ɛ r aː r iː
d aː t ʊ m	d a t ʊ m
r ɛ k l a m aː r ɛ	r ɛ k l aː m aː r ɛ
s a l w ʊ m	s a l w ʊ m
t eː m ɔ r ɛ	t ɪ m oː r ɛ m
f r a t ɛ r n aː l ɛ m	f r aː t ɛ r n aː l ɛ m
r ɛ s ɛ r w a t j oː n ɛ m	r ɛ s ɛ r w aː t j oː n ɛ m
g ʊ b j ɪ n ɛ m	g oː b j ʊ m
s t ɔ r a m	s t ɔ r ɛ a m
kʷ a d r uː p l aː r ɛ	kʷ a d r ʊ p l aː r ɛ
ʊ ŋ gʷ ɛ n t ʊ m	ʊ ŋ gʷ ɛ n t ʊ m
a d w ɔ k a t j oː n ɛ m	a d w ɔ k aː t j oː n ɛ m
m uː r aː l a m	m uː r aː l ɛ m
a r k a m	a r kʰ a m
p ɔ m ɛ k ɛ	p uː m ɪ k ɛ m
ɔ fː ɪ k j ʊ m	ɔ fː ɪ k j ʊ m
s t uː p eː r ɛ	s t ʊ p eː r ɛ
d ʊ b l ʊ m	d ʊ p l ʊ m
s p ɔ l j ʊ m	s p ɔ l j ʊ m
d ɛ n uː d a t j oː n ɛ m	d eː n uː d aː t j oː n ɛ m
ɛ r b aː k ɛ ʊ m	h ɛ r b aː k ɛu m
w r ɪ n k ɔ l ʊ m	w ɪ ŋ k ʊ l ʊ m
g ɪ r aː r ɛ	g y r aː r ɛ
d ɪ fː ɛ r ɪ r ɛ	d ɪ fː ɛ rː ɛ
g ɪ n ɪ s t a m	g ɛ n ɛ s t a m
f ɛ rː uː g ɛ n ɛ m	f ɛ rː uː g ɪ n ɛ m
a fː ɛ k t ʊ m	a fː ɛ k t ʊ m
a d ʊ k t j oː n ɛ m	a d j ʊ ŋ k t j oː n ɛ m
r ɛ p r ɛ n s j oː n ɛ m	r ɛ p r ɛ h ɛ n s j oː n ɛ m
r aː s t r ʊ m	r aː s t r ʊ m
r ɛ k ɛ s ɪ w ʊ m	r ɛ k ɛ sː iː w ʊ m
ɛ k s ɪ b ɛ r ɛ	ɛ k s h ɪ b eː r ɛ
p r ɔ k ɛ lː a m	p r ɔ k ɛ lː a m
k ʊ n s ɪ d ɛ r a t j oː n ɛ m	k oː n s iː d ɛ r aː t j oː n ɛ m
b ɔ t ɪ l ʊ m	b ɔ t ɛ lː ʊ m
m ɪ n ɔ r aː r ɛ	m ɪ n oː r aː r ɛ
l ɪ g a m ɛ n t ʊ m	l ɪ g aː m ɛ n t ʊ m
s p ɛ l ʊ n k a m	s p eː l ʊ ŋ k a m
a d ʊ n aː r ɛ	a d uː n aː r ɛ
r ʊ b ɪ j ɛ m	r oː b iː g ɪ n ɛ m
m ɔ lː ɛ t ɛ m	m ɔ lː ɪ t ɪ ɛ m
r ɛ p r ɛ n s ɪ b ɪ l ɛ m	r ɛ p r ɛ h ɛ n s ɪ b ɪ l ɛ m
ɪ n d ɛ f ɪ n ɪ t ʊ m	ɪ n d eː f iː n iː t ʊ m
a n ɛ t ʊ m	a n eː tʰ ʊ m
s eː m ɪ l ɛ	s ɪ m ɪ l ɛ m
s a b oː r ɛ	s a p oː r ɛ m
p a l ʊ m	p ɔ l ʊ m
p l uː m a m	p l uː m a m
s ʊ p r n a t uː r aː l ɛ	s ʊ p ɛ r n aː t uː r aː l ɛ m
p ɛ r s ɪ s t ɛ r ɛ	p ɛ r s ɪ s t ɛ r ɛ
k ɛ l ɛ b r ɛ m	k ɛ l ɛ b r ɛ m
l aʊ r ɔ k ɛ r a s ʊ m	l aʊ r ɔ k ɛ r a s ʊ m
w ɛ r s ɪ k ʊ l ʊ m	w ɛ r s ɪ k ʊ l ʊ m
f a m uː l ʊ m	f a m ʊ l ʊ m
s ɔ n t ɛ m	s ɔ n t ɛ m
s t r ɛ p ɪ t ʊ m	s t r ɛ p ɪ t ʊ m
m ɔ n t w oː s ʊ m	m ɔ n t ʊ oː s ʊ m
ɔ r ɪ zː ɔ n t ɛ m	h ɔ r ɪ zː ɔ n t a
m ɔ r t aː r j ʊ m	m ɔ r t aː r j ʊ m
k s k uː s a t j ɔ n ɛ	ɛ k s k uː s aː t j oː n ɛ m
k ɔ n k r ɛ t j ʊ n ɛ	k ɔ ŋ k r eː t j oː n ɛ m
p r a ŋ d s ʊ m	p r a n d j ʊ m
ʊ s uː r a m	uː s uː r a m
p ɔ m ʊ m	p oː m ʊ m
p ʊ n d ɛ r aː r ɛ	p ɔ n d ɛ r aː r ɛ
a b r ɔ g aː r ɛ	a b r ɔ g aː r ɛ
a r k ɛ t ɪ p ʊ m	a r kʰ ɛ t y p ʊ m
r a s k aː r ɛ	r aː d ɛ r ɛ
d ɛ k aː l w a t j oː n ɛ m	d eː k a l w aː t j oː n ɛ m
k ɔ n t ɛ m p l aː r ɛ	k ɔ n t ɛ m p l aː r iː
k a t ɛ d r aː l ɛ	k a tʰ ɛ d r aː l ɛ m
f ɛ l ɪ k ɪ t aː t ɛ m	f eː l iː k ɪ t aː t ɛ m
a gː r ɛ g aː r ɛ	a gː r ɛ g aː r ɛ
w a k ɪ lː aː r ɛ	w a k ɪ lː aː r ɛ
k a t ɛ lː ʊ m	k a t ɛ lː ʊ m
b ɛ s t j ɪ ɔ l a m	b eː s t ɪ ɔ l a m
s a l uː t a t j oː n ɛ	s a l uː t aː t j oː n ɛ m
k a r ɛ n a m	k a r iː n a m
s ʊ p t ʊ ʊ s ʊ m	s ʊ m p t ʊ oː s ʊ m
p r ɔ l ɛ t a r j aː t ʊ m	p r oː l eː t aː r j ʊ m
p r ɛ m ɪ k j a m	p r iː m ɪ t j a m
f aː r t ʊ m	f a r t ʊ m
p r ɔ b ɪ t ʊ m	p r oː f ɛ k t ʊ m
g ɛ n j aː l ɛ	g ɛ n j aː l ɛ m
d ɛ n t aː t ʊ m	d ɛ n t aː t ʊ m
a b s k ʊ n d ɛ r ɛ	a b s k ɔ n d ɛ r ɛ
r ɛ l a k s aː r ɛ	r ɛ l a k s aː r ɛ
s k r ɪ n j ʊ m	s k r iː n j ʊ m
k ʊ m p ɔ r t aː r ɛ	k ɔ m p ɔ r t aː r ɛ
p uː r y n ʊ m	p uː r ɛ m
ɪ n k a n ɛ t ɛ r ɛ	ɪ ŋ k aː n eː s k ɛ r ɛ
r ɪ g ɪ d ʊ m	r ɪ g ɪ d ʊ m
k ɛ r w ɪ s l a m	k ɛ r w ɛ s j a m
t r ɪ f ɔ l j aː t ʊ m	t r ɪ f ɔ l j aː t ʊ m
ɔ b l ɪ g aː r ɛ	ɔ b l ɪ g aː r ɛ
ɪ n f l a m a t j oː n ɛ m	iː n f l a mː aː t j oː n ɛ m
f r uː ɪ r ɛ	f r ʊ iː
m ɛ t r ɛ k ʊ m	m ɛ t r ʊ m
ʊ n k ɪ n ʊ m	ʊ ŋ k iː n ʊ m
eː kʷ a n ɪ m ɪ t aː t ɛ m	aɪ kʷ a n ɪ m ɪ t aː t ɛ m
s k ɔ k ɛ r ɛ	ɛ k s k ɔ kʷ ɛ r ɛ
a p ɪ k k ɛ m	a p ɪ k ɛ m
ɪ m aː g ɪ n ɛ	ɪ m aː g ɪ n ɛ m
r ɛ k ɛ s ʊ m	r ɛ k ɛ sː ʊ m
r uː f ʊ m	r uː f ʊ m
s ɛ k ɪ r n ɛ r ɛ	s eː k ɛ r n ɛ r ɛ
f r a t ɛ r n ʊ m	f r aː t ɛ r n ʊ m
ɛ k s p uː ŋ g ɪ r ɛ	ɛ k s p ʊ ŋ g ɛ r ɛ
a l ɪ	ɪ lː ʊ ŋ k
w ɪ t ɛ m	w iː t ɛ m
k ɔ n t ɛ n t ʊ m	k ɔ n t ɛ n t ʊ m
p ɔ s t uː l aː r ɛ	p ɔ s t ʊ l aː r ɛ
m ɔ r j a m	m ʊ r j a m
p ɛ r s p ɪ k uː ɪ t ɛ m	p ɛ r s p ɪ k ʊ ɪ t aː t ɛ m
r ɪ n ɛ	r eː n ɛ m
a k r ɛ s k ɛ r ɛ	a kː r eː s k ɛ r ɛ
m ɪ n aː k a	m ɪ n aː k ɛ m
p r ɛ d ɪ k ɪ r ɛ	p r aɪ d ɪ k aː r ɛ
k ɔ k ɪ n ɪ l a m	k ɔ kː ɪ n a m
r ɔ r aː r ɛ	r oː r aː r ɛ
d ɛ k ɪ m aː l ɛ	d ɛ k ɪ m a l ɛ m
ɔ k j ɔ s ʊ m	oː t j oː s ʊ m
k ɛ l ɛ b r a t j ʊ n ɛ	k ɛ l ɛ b r aː t j oː n ɛ m
k ʊ n f ɔ r m ɛ m	k oː n f oː r m ɛ m
k ɪ t a r a m	k ɪ tʰ a r a m
ʊ b l b ɪ t aː r ɛ	ɔ b l iː w ɪ s k iː
ɔ l eː r ɛ	ɔ l eː r ɛ
l a p ɪ d aː r ɛ	l a p ɪ d aː r ɛ
p a l ʊ m b a r j ʊ m	p a l ʊ m b aː r j ʊ m
ɔ s aː r j ʊ m	ɔ sː aː r j ʊ m
d ɪ g ɪ t aː l ɛ	d ɪ g ɪ t aː l ɛ m
l ʊ ŋ g a n ɪ m ɪ t aː t ɛ m	l ɔ ŋ g a n ɪ m ɪ t aː t ɛ m
r a k ɪ m ɔ s ʊ m	r a k eː m oː s ʊ m
t aː b ʊ l a m	t a b l a m
s k ɔ t j a m	s k ɔ t j a m
a s ɛ r ɪ r ɛ	a sː ɛ r ɛ r ɛ
a k r ɪ t uː d ɛ m	aː k r ɪ t uː d ɪ n ɛ m
s ʊ p ɛ r ɛ pː ʊ n ɛ r ɛ	s ʊ p ɛ r p oː n ɛ r ɛ
a n d aː r ɛ	a m b ʊ l aː r ɛ
d ɛ k ɔ rː ɛ r ɛ m	d eː k ʊ rː ɛ r ɛ
s t uː d j aː r ɛ	s t ʊ d eː r ɛ
l a t ɪ f ʊ n d j ʊ m	l aː t ɪ f ʊ n d j ʊ m
k ɪ k uː t a m	k ɪ k uː t a m
p r ɔ p uː ŋ n a r ɛ	p r oː p ʊ ŋ n aː r ɛ
d ɛ l iː n kʷ ɛ r ɛ	d eː l ɪ ŋ kʷ ɛ r ɛ
eː n ɛ r w aː r ɛ	eː n ɛ r w aː r ɛ
p r oː n ʊ m	p r oː n ʊ m
s ɛ n aː t ʊ m	s ɛ n aː t ʊ m
j uː g aː l ɛ m	j ʊ g aː l ɛ m
ŋ p ɪ l aː r ɛ	p ɪ l aː r ɛ
a d w ɛ r b j aː l ɛ	a d w ɛ r b j aː l ɛ m
ɪ n t ɛ r w ɛ r t ɪ r ɛ	ɪ n t ɛ r w ɛ r t ɛ r ɛ
d ɛ s ɪ d ɛ r aː r ɛ	d eː s iː d ɛ r aː r ɛ
d uː r a t j oː n ɛ m	d uː r aː t j oː n ɛ m
ʊ d j ɛ ɛ r n ʊ m	h ɔ d ɪ ɛ r n ʊ m
g uː d ɪ t j aː l ɛ	j uː d ɪ k j aː l ɛ m
p ɔ s ɛ s oː r ɛ	p ɔ sː ɛ sː oː r ɛ m
a s ɔ lː aː r ɛ	a sː ɔ l aː r ɛ
ɪ n t r ɔ d uː k t j oː n ɛ m	ɪ n t r oː d ʊ k t j oː n ɛ m
k a w a l ɛ r ɛ m	k a b a lː aː r j ʊ m
p ʊ n t ɪ f ɪ k aː t ʊ m	p ɔ n t ɪ f ɪ k aː t ʊ m
p r ɛ ɔ k uː p a t j oː n ɛ m	p r aɪ ɔ kː ʊ p aː t j oː n ɛ m
s ɛ m	s eː
k ɔ rː ɛ k t oː r ɛ	k ɔ rː ɛ k t oː r ɛ m
m a ŋ ɪ k a m	m a n ɪ k a m
k ɛ r uː l ɛ ʊ m	k aɪ r ʊ l ɛu m
s ɪ t uː l a m	s ɪ t ʊ l a m
m a r ɪ s k a m	m a r ɪ s k a m
m ʊ n t aː n oː s ʊ m	m ɔ n t aː n j oː s ʊ m
l aː k r ɪ m a m	l a k r ɪ m a m
p ɛ d ɛ s t r ɛ m	p ɛ d ɛ s t r ɛ m
l ɛ m a m	l ɛ mː a
d ɛ f ʊ r m ɪ t a t ɛ m	d eː f oː r m ɪ t aː t ɛ m
kʷ r ɪ b r aː r ɛ	k r iː b r aː r ɛ
k ɔ n m uː t aː r ɛ	k ɔ mː uː t aː r ɛ
s ʊ b s t ɪ t uː t j oː n ɛ m	s ʊ b s t ɪ t uː t j oː n ɛ m
m ʊ s k a m	m ʊ s k a m
k ʊ m p r a t ɔ r ɛ	k ɔ m p a r aː t oː r ɛ m
a lː oː k aː ɛ	a lː ɔ k aː r ɛ
l a d r ɪ lː ʊ m	l a t ɛ r k ʊ l ʊ m
eː t ɔ l ɔ g j a m	eː tʰ ɔ l ɔ g j a m
f ɪ m ʊ m	f ɪ m ʊ m
a n ɛ l aː r ɛ	a n h eː l aː r ɛ
k ʊ n f l uː ɛ r ɛ	k oː n f l ʊ ɛ r ɛ
p ɛ t iː r ɛ	p ɛ t ɛ r ɛ
ɪ p n ɔ t ɪ k ʊ m	h y p n oː t ɪ k ʊ m
s a k uː l ʊ m	s a kː ʊ l ʊ m
a k ʊ m	a k ʊ m
f ʊ l g ɔ r ɛ	f ʊ l g oː r ɛ m
a s p ɛ k t aː r ɛ	a s p ɛ k t aː r ɛ
w ʊ l p ɛ	w ʊ l p ɛ m
t ɔ r t oː n ɛ m	t ɔ r t j oː n ɛ m
s ɪ l ɪ k j ʊ m	s ɪ l ɪ k j ʊ m
k ʊ m p l ɛ t ɪ w ʊ m	k ɔ m p l eː t iː w ʊ m
k ʊ k ɪ n aː r ɛ	k ɔ kʷ iː n aː r ɛ
w ɛ n t ɪ l a t j oː n ɛ	w ɛ n t ɪ l aː t j oː n ɛ m
a ŋ ŋ uː lː aː r ɛ	a ŋ g ʊ l aː r ɛ m
d ɛ p ɔ r t aː r ɛ	d eː p ɔ r t aː r ɛ
k uː w ɪ l ɛ m	k ʊ b iː l ɛ
a m p r ɪ r ɛ	a p ɛ r iː r ɛ
r ɛ t r aː ɛ r ɛ	r ɛ t r a h ɛ r ɛ
r eː w ɛ n ɪ r ɛ	r ɛ w ɛ n iː r ɛ
f l uː w j aː l ɛ	f l ʊ w j aː l ɛ m
ɔ s t ɛ n t aː r ɛ	ɔ s t ɛ n t aː r ɛ
s ɛ n ɪ k ʊ m	s k eː n ɪ k ʊ m
k a n ɔ r ʊ m	k a n oː r ʊ m
a r iː ɛ t ɛ m	a r ɪ ɛ t ɛ m
ɔ b t ʊ s ʊ m	ɔ b t uː s ʊ m
w ɛ t a m	w ɪ tː a m
f r ʊ n d ɔ s ʊ m	f r ɔ n d oː s ʊ m
b ɪ k a m	b iː g a m
oː s ʊ m	oː s ʊ m
d ɛ r ʊ m p ɛ r ɛ	d iː r ʊ m p ɛ r ɛ
d ɛ n ɛ g aː r ɛ	d eː n ɛ g aː r ɛ
k ɔ r uː s k a r ɛ	k ɔ r ʊ s k aː r ɛ
t ɛ rː ɪ ʊ m	t ɛ rː ɛu m
kʷ aː d r uː p l ʊ m	kʷ a d r ʊ p l ʊ m
s ʊ n aː t oː r ɛ	s ɔ m n j aː t oː r ɛ m
m uː r ɛ m	m uː r ɛ m
l a k aː l ʊ m	l a sː aː r ɛ
a k k ɛ d ɛ r ɛ	a kː eː d ɛ r ɛ
ɪ n mː ɪ s k ɪ r s ɛ	ɪ mː ɪ s k eː r ɛ
w ɛ s t ɪ r ɛ	w ɛ s t iː r ɛ
s ɪ k k ɪ t aː t ɛ m	s ɪ kː ɪ t aː t ɛ m
ɪ s k ʊ m	ɪ s k ʊ m
m ɔ t ɪ w ʊ m	m oː t ɪ w ʊ m
a m a n t ɛ m	a m a n t ɛ m
r ɪ k s a m	r ɪ k s a m
w ɔ p ɔ m	ɔ p ʊ s
ɔ b ɪ ɛ k t ɪ w ʊ m	ɔ b j ɛ k t iː w ʊ m
w ɪ ŋ k ɛ r ɛ	w ɪ ŋ k ɛ r ɛ
l ɛ n t ʊ m	l ɛ n t ʊ m
a n j ɛ lː a m	a ŋ n ɛ lː a m
a k uː s a t j oː n ɛ	a kː uː s aː t j oː n ɛ m
s ɛ n s ʊ m	s eː n s ʊ m
ɪ n t ɛ lː ɛ k t ʊ m	ɪ n t ɛ lː eː k t ʊ m
a m ɛ n t ʊ m	aː m ɛ n t ʊ m
a k k ɛ p t aː r ɛ	a kː ɪ p ɛ r ɛ
f a b r ʊ m	f a b r ʊ m
ɪ n k ɛ t aː r ɛ	ɪ ŋ k ɛ p t aː r ɛ
ɛ k s k r ɛ t aː r ɛ	ɛ k s k ɛ r n ɛ r ɛ
j uː n j ɔ r ɛ	j uː n j oː r ɛ m
s ɔ m n ɔ l j ɛ n t ʊ m	s ɔ m n ɔ l ɛ n t ʊ m
m ɪ s t ɪ k ʊ m	m y s t ɪ k ʊ m
l ɪ m a k a	l iː m aː k ɛ m
p r aː k t ɪ k ʊ m	p r a k t ɪ k ʊ m
p r ɔ l ɔ kʷ j ʊ m	p r oː l ɔ kʷ j ʊ m
a r aː t r ʊ m	a r aː t r ʊ m
k ɔ n t ɪ n w ʊ m	k ɔ n t ɪ n ʊː m
p r ɔ r ʊ m p ɛ r ɛ	p r oː r ʊ m p ɛ r ɛ
ɪ n mː ɔ l a t j oː n ɛ m	ɪ mː ɔ l aː t j oː n ɛ m
k r ɛ m a m	k r aː m ʊ m
s ʊ p ɛ r b j ʊ m	s ʊ p ɛ r b ʊ m
m ɛ n d aː k ɛ m	m ɛ n d aː k ɛ m
n ʊ m ɛ r ʊ m	n ʊ m ɛ r ʊ m
n aː n ʊ m	n aː n ʊ m
m ɛ d ɪ t ɛ rː aː n ɛ ʊ m	m ɛ d ɪ t ɛ rː aː n ɛu m
b aː iː t ʊ m	b ɔ aː t ʊ m
a l t ɛ r n a t j ɔ n ɛ	a l t ɛ r n aː t j oː n ɛ m
b ʊ lː ɪ r ɛ	b ʊ lː iː r ɛ
ʊ l aː r ɛ	ʊ l ʊ l aː r ɛ
k aː l k aː r ɛ ʊ m	k a l k aː r j ʊ m
w ɛ s p ɛ r a m	w ɛ s p ɛ r a m
m ɪ m a r ŋ g ʊ k ʊ m	m ɛ r g ʊ m
a g aː r ɪ k ʊ m	a g a r ɪ k ʊ m
t r a n s ɪ t ʊ m	t r aː n s ɪ t ʊ m
f l aː t ʊ m	f l aː t ʊ m
m ɔ t j oː n ɛ m	m oː t j oː n ɛ m
k lː aʊ s uː lː a m	k l aʊ s ʊ l a m
ʊ m uː m	h ʊ m ʊ m
n a t uː r a m	n aː t uː r a m
b a l t ɪ k ʊ m	b a l t ɪ k ʊ m
m a k l ʊ s ʊ m	m a k ʊ l oː s ʊ m
w ʊ l g ʊ m	w ʊ l g ʊ s
t r uː k ɪ d aː r ɛ	t r ʊ k iː d aː r ɛ
a k ɔ m ɔ d a t j oː n ɛ m	a kː ɔ mː ɔ d aː t j oː n ɛ m
p oː k ʊ m	p aʊ k ʊ m
aʊ s p ɪ t j ʊ m	aʊ s p ɪ k j ʊ m
m uː n ɪ f ɪ k ɛ n t j a m	m uː n ɪ f ɪ k ɛ n t j a m
f ɪ n ʊ k ʊ j ʊ m	f eː n ʊ k ʊ l ʊ m
j uː s t ʊ m	j uː s t ʊ m
a n a l ɪ s ɪ m	a n a l y s ɛ m
p ɪ n t aː r ɛ	p ɪ ŋ g ɛ r ɛ
t ɛ s t uː d ɪ n ʊ m	t ɛ s t uː d ɪ n ɛ m
t ɛ m p ɛ r j eː ɛ	t ɛ m p ɛ r ɪ ɛ m
p a r j ɪ ɛ t aː l ɛ	p a r ɪ ɛ t aː l ɛ m
p r uː d ɛ n t ɛ m	p r uː d ɛ n t ɛ m
b ɛ n ɛ d ɛ t ʊ m	b ɛ n ɛ d ɪ k t ʊ m
d eː m a n d aː r ɛ	d eː m a n d aː r ɛ
n a rː a t j ɔ n ɛ m	n aː rː aː t ʊ m
ɛ pː ɪ s t oː lː ɛ m	ɛ p ɪ s t ɔ l a m
eː l ɛ f a n t ɪ n ʊ m	ɛ l ɛ pʰ a n t ɪ n ʊ m
m ɪ t ɪ g aː r ɛ	m iː t ɪ g aː r ɛ
k j ɛ n ʊ m	k aɪ n ʊ m
ɪ n uː s ɪ t aː t ʊ m	ɪ n uː s ɪ t aː t ʊ m
m uː n ɪ k ɪ p j ʊ m	m uː n ɪ k ɪ p j ʊ m
t a r d ɪ m ʊ m	t a r d ʊ m
ɛ s t r ɛ n a m	s t r eː n a m
eː kʷ ɪ l ɪ b r j ʊ m	aɪ kʷ ɪ l iː b r j ʊ m
k ɔ m ɪ s j oː n ɛ m	k ɔ mː ɪ sː j oː n ɛ m
f uː s t ɛ m	f uː s t ɛ m
b ʊ rː aː g ɪ m ɛ	b ɔ r aː g ɪ n ɛ m
n aː s ʊ m	n aː s ʊ m
r ɛ f r ɛ n ɛ m	r ɛ f r eː n aː r ɛ
ʊ s ɪ t aː r ɛ	uː s ɪ t aː r iː
n ʊ d oː s ʊ m	n oː d oː s ʊ m
n ʊ m ɛ r oː s ʊ m	n ʊ m ɛ r oː s ʊ m
k a l w ʊ m	k a l w ʊ m
s aː b l ʊ m	s a b ʊ l ʊ m
r aː n k oː r ɛ	r a ŋ k oː r ɛ m
s iː n k ɛ r ʊ m	s ɪ ŋ k eː r ʊ m
s k ɔ p a m	s k oː p a m
s k a r aː b ɛ g ʊ m	s k a r a b aɪ ʊ m
f ɔ lː ɪ k ʊ l ʊ m	f ɔ lː ɪ k ʊ l ʊ m
ɔ b t ɛ m p ɛ r aː r ɛ	ɔ b t ɛ m p ɛ r aː r ɛ
t ɪ t ʊ l aː r ɛ	t ɪ t ʊ l aː r ɛ m
l a m b ɛ r ɛ	l a m b ɛ r ɛ
r aː p ʊ m	r aː p ʊ m
t ɔ r kʷ ɛ r ɛ	t ɔ r kʷ eː r ɛ
d ɛ s k r ɪ w ɛ r ɛ	d eː s k r iː b ɛ r ɛ
r eː w ɛ d ɛ r ɛ	r ɛ w ɪ d eː r ɛ
g ɛ l ʊ m	g ɛ l uː
ɪ m p l ɪ k aː r ɛ	ɪ m p l ɪ k aː r ɛ
l uː d ɪ b r j ʊ m	l uː d iː b r j ʊ m
d eː s t r uː g ɪ r ɛ	d eː s t r ʊ ɛ r ɛ
s a l w aː r ɛ	s a l w aː r ɛ
t r a l uː k ɪ r ɛ	t r aː n s l uː k eː r ɛ
d ɪ w ɪ n a t j ʊ n ɛ m	d iː w iː n aː t j oː n ɛ m
g r a t ɪ t uː d ɪ n ɛ m	g r aː t ɪ t uː d ɪ n ɛ m
k ʊ t ɛ lː ʊ m	k ʊ l t ɛ lː ʊ m
m uː k g ɛ r ɛ	m ʊ l g eː r ɛ
a m b ɪ kʷ ɪ t aː t ɛ m	a m b ɪ gʷ ɪ t aː t ɛ m
m aː n t ɪ n ɛ r ɛ	m a n ʊ t ɛ n eː r ɛ
m ɛ t aː lː ʊ m	m ɛ t a lː ʊ m
f ɪ l ɔ s ɔ f j a m	pʰ ɪ l ɔ s ɔ pʰ j a m
p r ʊ g r ɛ d ɪ r ɛ	p r oː g r ɛ d iː
s ɪ d ɛ r ɛ ʊ m	s iː d ɛ r ɛu m
k oː n ɔ p ɛ ʊ m	k oː n oː p eː ʊ m
t aʊ r ɪ f ɔ r m ɛ	t aʊ r ɪ f oː r m ɛ m
s ɔ n ɔ r ʊ m	s ɔ n oː r ʊ m
t r aː w ɛ m	t r a b ɛ m
