f ɔ r t iː t uː d ɪ n ɛ	f ɔ r t ɪ t uː d ɪ n ɛ m
k r eː d iː b iː l iː t aː t ɛ m	k r eː d ɪ b ɪ l ɪ t aː t ɛ m
t ɛ d uː lː a m	s kʰ ɛ d ʊ l a m
ɛ l kʷ ʊ r m k ʊ m	kʷ ɛ r k ʊ m
k uː l t ɔ r ɛ	k ʊ l t oː r ɛ m
l a k r iː m a t j ɔ n ɛ	l a k r ɪ m aː t j oː n ɛ m
ɪ n f a n t j a m	iː n f a n t j a m
g r aː n d iː k ʊ m	g r a n d ɪ n ɛ m
p eː r iː k ʊ l oː s ʊ m	p ɛ r iː k ʊ l oː s ʊ m
r ɛu w eː r sː aː r	r ɛ w ɛ r s aː r ɛ
p r ɔ m ɛ s a m	p r oː m ɪ sː ʊ m
ɔ n oː r ɛ m	h ɔ n oː r ɛ m
t j oː n ɛ m	t j oː n ɛ m
s w aː d ɪ r ɛ	s w aː d eː r ɛ
g ɛ l ʊ m	g ɛ l uː
s k aː p ʊ l a m	s k a p ʊ l a m
m ɛ d iː r	m eː t iː r iː
n uː t r iː k aː r ɛ	n uː t r iː k aː r ɛ
ɛ k s ɛ k r aː r ɛ	ɛ k sː ɛ k r aː r iː
k ɔ l oː n ʊ m	k ɔ l oː n ʊ m
m ɛ n d aː k ɛ m	m ɛ n d aː k ɛ m
ɛ kʷ ʊ m	aɪ kʷ ʊ m
f a r iː n oː s ʊ m	f a r iː n oː s ʊ m
ɪ n t ɪ r m ɛ t ɛ r m ɛ m	ɪ n t ɛ r m ɪ tː ɛ r ɛ
a m p ɔ lː a m	a m p ʊ lː a m
k r iː t ɛ r j ʊ m	k r ɪ t ɛ r ɪ ɔ n
a k eː r w ʊ m	a k ɛ r w ʊ m
s ɔ lː eː k iː t ʊ m	s ɔ lː ɪ k ɪ t ʊ m
k ɔ m p l ɛ t iː w ʊ m	k ɔ m p l eː t iː w ʊ m
iː m p r ɔ b aː r	ɪ m p r ɔ b aː r ɛ
w ɛ g ɛ t ʊ m	w ɛ g ɛ t ʊ m
ɛ m m k ɛ l s ʊ m	ɛ k s k ɛ l s ʊ m
ɔ p oː m r ɛ	ɔ pː oː n ɛ r ɛ
f ɛ l iː k ɛ m	f eː l iː k ɛ m
s a l iː w a r ɛ	s a l iː w aː r ɛ
ɔ n uː s t ʊ m	ɔ n ʊ s t ʊ m
k r iː m iː n a k oː n	k r iː m ɪ n aː t j oː n ɛ m
ɛ k s t iː r p aː r ɛ	ɛ k sː t ɪ r p aː r ɛ
d ɛ t r a ɪ r ɛ	d eː t r a h ɛ r ɛ
k r uː ɛ n t ʊ m	k r ʊ ɛ n t ʊ m
t ɔ r s oː	tʰ y r s ʊ m
w a k iː lː a t j oː n ɛ m	w a k ɪ lː aː t j oː n ɛ m
p m ɛ m t ɪ n aː r ɛ	p ɛ k t ɪ n aː r ɛ
f ɛ r m ɛ n t ʊ m	f ɛ r m ɛ n t ʊ m
iː m p uː l s iː w ʊ m	ɪ m p ʊ l s iː w ʊ m
m a k ɛ lː ʊ m	m a k ɛ lː ʊ m
w ɛ lː ʊ m	w ɛ lː ʊ s
d iː s p ɔ n ɛ m	d ɪ s p oː n ɛ r ɛ
k iː m k ʊ m k ɛ	kʷ iː ŋ k ʊ ŋ k ɛ m
s ɔ ŋ a t oː r ɛ	s ɔ m n j aː t oː r ɛ m
s j ɛ p ɛ m	s aɪ p ɛ m
k uː r a t uː r a m	k uː r aː t uː r a m
k ɔ n d n a t j oː n ɛ m	k ɔ n d ɛ m n aː t j oː n ɛ m
a b ɔ m iː n aː r ɛ	a b oː m ɪ n aː r iː
g ɛ b ɛu m	g ɪ bː ʊ m
s ɔ l aː r ɪ j ɔ m	s oː l aː r j ʊ m
s a b l oː l ɛ	s a b ʊ l oː n ɛ m
a p ɛ n d ɛ r ɛ	a pː ɛ n d ɛ r ɛ
k r aː t ɪ k ʊ l a m	k r aː t ɪ k ʊ l a m
s uː p ɛ r w a k a n ɛ ʊ m	s ʊ p ɛ r w a k ʊː m
s ʊ l k ʊ m	s ʊ l k ʊ m
a d uː n t ʊ m	a d j ʊ ŋ k t ʊ m
r a k ɛ m ʊ m	r a k eː m ʊ m
eː l uː d ɛ r ɛ	eː l uː d ɛ r ɛ
p uː l k r iː t uː d ɛ m	p ʊ l kʰ r ɪ t uː d ɪ n ɛ m
f l ɔ n d	f ʊ n d a m
f eː rː uː g ɛ n ɛ m	f ɛ rː uː g ɪ n ɛ m
d eː w ɔ r a t j oː n ɛ m	d eː w ɔ r aː t j oː n ɛ m
s t iː p uː l aː r ɛ	s t ɪ p ʊ l aː r iː
g ɛ n t iː l ʊ m	g ɛ n t iː l ɛ m
ɔ r b ʊ m	ɔ r b ʊ m
s ɛ r ʊ m	s ɛ r ʊ m
w ɛ r g a m	w ɪ r g a m
r eː m ʊ m	r eː m ʊ m
eː l ɔ ŋ g a t j oː n ɛ m	eː l ɔ ŋ g aː t j oː n ɛ m
g ɛ n t iː l iː t a m	g ɛ n t iː l ɪ t aː t ɛ m
k ɛ lː a m	k ɛ lː a m
s aʊ l t ʊ m	s a l t ʊ m
k ɔ n s oː n aː r ɛ	k oː n s ɔ n aː r ɛ
aʊ g uː r j ʊ m	aʊ g ʊ r j ʊ m
a p a r ɛ k eː r	a pː aː r eː s k ɛ r ɛ
p ɔ s ɛ s j oː n ɛ m	p ɔ sː ɛ sː j oː n ɛ m
g eː ɔ g r a f iː k oː	g ɛ oː g r a pʰ ɪ k ʊ m
a r g ɪ n t oː s ʊ m	a r g ɛ n t oː s ʊ m
k ɔ r t ɛ m	k oː r t ɛ m
r eː p ɛ lː ɛ r ɛ	r ɛ p ɛ lː ɛ r ɛ
k ɪ n t uː r a m	k ɪ ŋ k t uː r a m
a n ɔ s ʊ m	a nː oː s ʊ m
t ʊ r m a m	t ʊ r m a m
ʊ ŋ g uː l aː t ʊ m	ʊ ŋ g ʊ l aː t ʊ m
ɛ s t ʊ m	aɪ s t aː t ɛ m
k iː p r ɛ ɪ	k ʊ p r ɛ sː ʊ m
b aː r d ʊ m	b a r d ʊ m
b a s ʊ m	b a sː ʊ m
iː n k r ɛ m ɛ n t ʊ	ɪ ŋ k r eː m ɛ n t ʊ m
p m ɛ r d ɛ r ɛ m	p ɛ r d ɛ r ɛ
k a p t uː r a m	k a p t uː r a m
rː iː k t uː s	r ɪ k t ʊ m
w a g a b ʊ n d ʊ m	w a g aː b ʊ n d ʊ m
p r aɪ m ɛ r ɛ	p r ɛ m ɛ r ɛ
iː ŋ g r aː t ʊ m	ɪ ŋ g r aː t ʊ m
iː m f lː iː g ɛ r ɛ	iː n f l iː g ɛ r ɛ
k r j ɛ aː t uː r a m	k r ɛ aː t uː r a m
p uː p iː lː ʊ m	p uː p ɪ lː ʊ m
a k uː s aː r ɛ	a kː uː s aː r ɛ
l a m a m	l aː m a m
w ɔ r t ɪ k k ɛ m	w ɔ r t ɪ k ɛ m
g j ʊ d ɪ t j ʊ m	j uː d ɪ k j ʊ m
s ɔ n ʊ m	s ɔ m n ʊ m
s eː n ʊ m	s ɪ n ʊ m
s t uː d j aː r ɛ	s t ʊ d eː r ɛ
iː n w ɛ n t oː r ɛ	ɪ n w ɛ n t oː r ɛ m
r ɛ f k ɪ r ɛ	r ɛ f ɪ k ɛ r ɛ
a s uː m ɛ r ɛ	a sː uː m ɛ r ɛ
tʰ j a	tʰ iː a m
d ɛ s iː d j a m	d eː s ɪ d j a m
a w oː k aː r ɛ	a d w ɔ k aː r ɛ
s p eː k uː l a t oː r ɛ	s p ɛ k ʊ l aː t oː r ɛ m
k ʊ t ɛ lː ʊ m	k ʊ l t ɛ lː ʊ m
n aː t ʊ m	n aː t ʊ m
k ɔ d iː k iː lː ʊ m	k oː d ɪ k ɪ lː ʊ m
iː n d iː ŋ n aː r ɛ	ɪ n d ɪ ŋ n aː r iː
k ɔ lː ɛ g j ʊ m	k ɔ lː eː g j ʊ m
eː n a rː a t j oː n ɛ m	eː n aː rː aː t j oː n ɛ m
f iː k ʊ m	f iː k ʊ m
ɪ b ɪ l ɛ	ɪ b ɪ l ɛ m
rː ʊ lː iː k a m	r ɛ l ɪ kʷ ʊ m
aː k ɛ oː	aː k ɛu m
n aː s ʊ m	n aː s ʊ m
k ɔ m s t iː t uː t j oː n ɛ m	k oː n s t ɪ t uː t j oː n ɛ m
a d ʊ m b r aː r ʊ m	a d ʊ m b r aː r ɛ
ɔ b ɛ d ɛ k eː r	ɔ b ɔ ɪ d iː r ɛ
iː n f a n d ʊ m	iː n f a n d ʊ m
d iː m a n aː r	d iː m aː n aː r ɛ
p aː r w ʊ m	p a r w ʊ m
w iː n k ʊ l aː r ɛ	w ɪ ŋ k ʊ l aː r ɛ
iː r a k ʊ n d ʊ m	iː r aː k ʊ n d ʊ m
l ɛ t ɛ m r a m	l ɪ tː ɛ r a m
k ɔ m p iː l a t j oː n ɛ m	k ɔ m p iː l aː t j oː n ɛ m
f aʊ s t ʊ m	f aʊ s t ʊ m
k ɔ n s ɔ l iː d aː r ɛ	k oː n s ɔ l ɪ d aː r ɛ
w a n ɪ	w a nː ʊ m
ɛ m s p a n d ɛ r ɛ	ɛ k s p a n d ɛ r ɛ
ɪ n w ɔ l w ɛ r ɛ m	ɪ n w ɔ l w ɛ r ɛ
k ɔ m p r a t ɔ r ɛ	k ɔ m p a r aː t oː r ɛ m
r uː p ɛ m	r uː p ɛ m
p aː r ʊ	p a r ɛ m
f ɛ t eː r ɛ	f eː t eː r ɛ
s uː b l iː m a t j oː n ɛ m	s ʊ b l iː m aː t j oː n ɛ m
aː b ɪ l ɛ	aː b ɪ l ɛ m
k ɔ m p r ɔ m ɛ t ɛ r ɛ	k ɔ m p r oː m ɪ tː ɛ r ɛ
aʊ d iː t oː r j ʊ m	aʊ d iː t oː r j ʊ m
p r a n d z ʊ m	p r a n d j ʊ m
a s ɛ t aː t ɛ m	a s eː ɪ t aː t ɛ m
a n t ɛ k ɛ s oː r ɛ	a n t ɛ k ɛ sː oː r ɛ m
aː j uː n oː	j eː j uː n j ʊ m
w a k uː ɪ t aː t ɛ m	w a k ʊ ɪ t aː t ɛ m
l ɛ g ɛ r ɛ	l ɛ g ɛ r ɛ
kʷ j uː ɛ r ɛ m	k l aʊ d ɛ r ɛ
f uː g aː r ɛ	f ʊ g aː r ɛ
s ɔ l ɛ r t ɛ m	s ɔ lː ɛ r t ɛ m
ɛ s t iː m uː lː a k oː n	s t ɪ m ʊ l aː t j oː n ɛ m
p ɔ n t iː f iː k aː t ʊ m	p ɔ n t ɪ f ɪ k aː t ʊ m
k ɔ n t ɛ n t ʊ m	k ɔ n t ɛ n t ʊ m
a m ʊ r k j a m	a m ʊ r k a m
ɛ k s p uː l s aː r ɛ	ɛ k s p ʊ l s aː r ɛ
ɛ k s ɛ kʷ ɪ r ɛ r	ɛ k sː ɛ kʷ iː
ɛ k s uː l k eː r a t j oː n ɛ m	ɛ k s ʊ l k ɛ r aː t j oː n ɛ m
t iː t iː s oː	k y t ɪ s ʊ m
g r a b aː t ʊ m	g r a b aː t ʊ m
a k r iː m oː n j a m	aː k r ɪ m oː n j a m
f lː ɔ s k uː lː ʊ m	f l ɔ s k ʊ l ʊ m
l ʊ k ɛ lː ʊ m	l ɔ k ɛ lː ʊ m
a s k ɛ n d ɛ r ɛ	a s k ɛ n d ɛ r ɛ
t ɛ n ʊ m ɛ	t ɛ n ʊ ɛ m
k ɔ l ɔ r aː r ɛ	k ɔ l oː r aː r ɛ
iː m mː ɛ r g ɛ r ɛ	ɪ mː ɛ r g ɛ r ɛ
a f l iː g ɛ r ɛ	a fː l iː g ɛ r ɛ
n ɛ k t a r ɛ	n ɛ k t a r
p a nː ʊ m	p a nː ʊ m
d iː s p ɔ s iː t j oː n ɛ	d ɪ s p ɔ s ɪ t j oː n ɛ m
lː iː t aː r	l ɪ t aː r ɛ
a n t iː s t ɛ r ɛ m	a n t ɪ s t ɪ t ɛ m
w eː r t iː g ɪ k ɛ	w ɛ r t iː g ɪ n ɛ m
eː r ɛ t ɪ k ʊ m	h aɪ r ɛ t ɪ k ʊ m
m ɔ r t a l iː t aː t ɛ m	m ɔ r t aː l ɪ t aː t ɛ m
a b ɛ t ɛ m	a b ɪ eː t ɛ m
n ɔ t	n ɔ t a m
r ɛ n ʊ n k j aː r ɛ	r ɛ n ʊ n t j aː r ɛ
n ʊ m ɛ r ɔ s ʊ m	n ʊ m ɛ r oː s ʊ m
p eː r g uː r j ʊ m	p ɛ r ɪ uː r j ʊ m
w ɛ k a m	w ɪ k j a m
k a r b ʊ n k ʊ l ʊ m	k a r b ʊ ŋ k ʊ l ʊ m
b l a n d iː t j a m	b l a n d ɪ t j a m
m uː r iː k ɛ m	m uː r ɪ k ɛ m
s kʷ a m a m	s kʷ aː m a m
w ɔ r oː	w ɔ r ʊ m
m ɪ s t uː r a m	m ɪ s t uː r a m
j ɛ ɛ m m aː l ɛ	h ɪ ɛ m aː l ɛ m
iː m t ɪ m p ɛ s t iː w iː t aː t ɛ m	ɪ n t ɛ m p ɛ s t iː w ɪ t aː t ɛ m
eː m s p uː ŋ n aː r ɛ	ɛ k s p ʊ ŋ n aː r ɛ
ɛ l iː d ɛ r ɛ	eː l iː d ɛ r ɛ
w iː s iː t a t j ɔ n ɛ	w iː s ɪ t aː t j oː n ɛ m
t a p ɛ t ʊ	t a p eː t ɛ m
m a t ɛ r n iː t aː	m aː t ɛ r n ɪ t aː t ɛ m
iː n t iː m a t j oː n ɛ m	ɪ n t ɪ m aː t j oː n ɛ m
t ʊ n d ɛ r ɛ m	t ɔ n d eː r ɛ
ɔ r t ʊ m	h ɔ r t ʊ m
s aː t iː r a m	s a t ɪ r a m
p ɛ r ɪ t aː r k ɛ	p ɪ g r ɪ t aː r iː
t ɛ k m a m	tʰ eː k a m
p r oː m a	p r oː r a m
g uː s t iː f iː k a t ɔ r ɛ	j uː s t ɪ f ɪ k aː t oː r ɛ m
d ɪ s t eː ŋ d ɛ r ɛ m	d eː s k ɛ n d ɛ r ɛ
k ɔ sː ʊ m	k ɔ sː ʊ m
d eː p r eː d a t j oː n ɛ m	d eː p r aɪ d aː t j oː n ɛ m
iː n f l iː k t j oː n ɛ m	ɪ n f l ɪ k t j oː n ɛ m
s a n a t j oː n ɛ	s aː n aː t j oː n ɛ m
ɛ k s eː k r a t j oː n ɛ m	ɛ k sː eː k r aː t j oː n ɛ m
ɔ t r ɛ m	ʊ t r ʊ m
a k a m	a k j a m
r eː n ʊ iː r	r ɛ n ʊ ɛ r ɛ
w a s ɛ lː ʊ m	w aː s k ɛ lː ʊ m
s uː b iː r ɛ	s ʊ b iː r ɛ
g r a n d ɛ m	g r a n d ɛ m
p a t r j a r k aː t ʊ m	p a t r j a r kʰ a t ʊ m
k ɛ r ɛ m ɔ n j a l ɛ	k aɪ r ɪ m oː n j aː l ɛ m
k ɪ p a m	k eː p a m
r eː t ɪ n ɛ r ɛ	r ɛ t ɪ n eː r ɛ
g r aː t m ɛ m	k r aː t ɛ m
f r ɛ n a r ɛ	f r eː n aː r ɛ
iː b r iː d ʊ m	h y b r ɪ d a m
m eː d ɪ ɔ k r ɛ m	m ɛ d ɪ ɔ k r ɛ m
g iː r aː r ɛ	g y r aː r ɛ
p ʊ l w ɛ r iː zː aː r ɛ	p ʊ l w ɛ r iː zː aː r ɛ
p uː l w iː n a r ɛ	p ʊ l w iː n a r
a m a t oː r ɛ	a m aː t oː r ɛ m
m a r iː t ʊ m	m a r iː t ʊ m
m a n iː p ʊ l ʊ m	m a n ɪ p ʊ l ʊ m
r ɛ k uː s a t j oː n ɛ m	r ɛ k uː s aː t j oː n ɛ m
iː n t ɛ g r aː r ɛ	ɪ n t ɛ g r aː r ɛ
lː iː b ɛ lː ʊ m	l ɪ b ɛ lː ʊ m
k ɔ rː ɛ k t oː r ɛ	k ɔ rː ɛ k t oː r ɛ m
b eː n ɛ f iː k ʊ m	b ɛ n ɛ f ɪ k ʊ m
r ɛ l ɛ g a t j oː n ɛ m	r ɛ l eː g aː t j oː n ɛ m
a n ɔ n a m	a nː oː n a m
m iː r aː k oː l ʊ m	m iː r aː k ʊ l ʊ m
d iː s ɛ m iː n aː r ɛ	d ɪ sː eː m ɪ n aː r ɛ
k ɔ n s a ŋ gʷ iː n iː t aː t ɛ m	k oː n s a ŋ gʷ ɪ n ɪ t aː t ɛ m
w a g aː r ɛ	w a g aː r iː
a d ʊ ŋ t j oː n ɛ m	a d j ʊ ŋ k t j oː n ɛ m
l ʊ k t aː r ɛ	l ʊ k t aː r iː
s k ʊ rː ɛ r ɛ	ɛ k s k ʊ rː ɛ r ɛ
p aː b ʊ lː m	p aː b ʊ l ʊ m
eː r ɛ d ɪ m aː t ɛ m	h eː r eː d ɪ t aː t ɛ m
a p a r iː t j ʊ m m	a pː aː r ɪ t j oː n ɛ m
ʊ m b r oː s ʊ m	ʊ m b r oː s ʊ m
g r a w iː t a t j oː n ɛ	g r a w ɪ t aː t j oː n ɛ m
s ɔ l ɪ d aː r ɛ	s ɔ l ɪ d aː r ɛ
s uː p m ɛ ɛ r m ʊ m	s uː b ɛ r ɛ m
k ɛ r w ɛ s j a m	k ɛ r w ɪ s j a m
uː l t ɛ r j ɔ r ɛ	ʊ l t ɛ r j oː r ɛ m
p aʊ s a m	p aʊ s a m
d aː t a m	d a t a
t r a t aː t ʊ m	t r a k t aː t ʊ m
ɛ b r ɛ ʊ m	h ɛ b r aɪ ʊ m
k ɔ n s ʊ p t j oː n ɛ m	k oː n s uː m p t j oː n ɛ m
t ɛ n ɔ r ɛ	t ɛ n oː r ɛ m
l oː k aː r ɛ	l ɔ k aː r ɛ
k a m p j ɔ n ɛ m	k a m p j oː n ɛ m
a ŋ g ɔ s a m	a ŋ g ʊ s t j a m
w ɛ s p r ʊ m	w ɛ s p ɛ r ʊ m
p aː p a m	p aː p a m
k ɔ n d iː t j oː n ɛ	k ɔ n d ɪ k j oː n ɛ m
k a r a m ɛ lː ʊ m	k a l a m ɛ lː ʊ m
m iː l a m	m iː lː j a
a r b ɔ r eː t ʊ m	a r b ɔ r eː t ʊ m
a p ɛ lː aː r ɛ	a pː ɛ lː aː r ɛ
k oː n ɔ p ɛ ʊ m	k oː n oː p eː ʊ m
t r eː p iː d aː r ɛ	t r ɛ p ɪ d aː r ɛ
d ɛ g r a d a t j oː n ɛ m	d eː g r a d aː t j oː n ɛ m
ɔ b g ɛ k t ʊ m	ɔ b ɪ ɛ k t ʊ m
w ɔ l t aː r ɛ	w ɔ l uː t aː r ɛ
s ɛ t a m	s aɪ t a m
r ɛ p ɛ t ɛ r ɛ	r ɛ p ɛ t ɛ r ɛ
p a l oː m b a r ʊ m	p a l ʊ m b aː r j ʊ m
uː r k ɛ m	ʊ l iː k ɛ m
w aː r j ʊ m	w a r j ʊ m
s k ɔ r j a m	s k oː r j a m
k iː g ʊ ɔ n a m	k ɪ k oː n j a m
l iː k t oː r ɛ	l iː k t oː r ɛ m
g r a k ʊ m	g l a k ɪ ɛ m
ɛ k s t iː t aː r ɛ	ɛ k s k ɪ t aː r ɛ
k ɔ n k iː t a t j oː n ɛ m	k ɔ ŋ k ɪ t aː t j oː n ɛ m
a l j ɪ eː n a t j oː n ɛ m	a l ɪ eː n aː t j oː n ɛ m
b r a n k a m	b r a ŋ k a m
ɛ ʊ m	ɛu m
a m a r ɪ t j a m	a m aː r ɪ t ɪ ɛ m
k ɔ n k a w ʊ m	k ɔ ŋ k a w ʊ m
t r iː lː ʊ m	t r iː b ʊ l ʊ m
a d iː t a m ɛ n t ʊ m	a dː ɪ t aː m ɛ n t ʊ m
l eː ɔ p a r d ʊ m	l ɛ ɔ p a r d ʊ m
w a r j ɪ ɛ t aː t ɛ m	w a r ɪ ɛ t aː t ɛ m
n uː b ɛ m	n uː b ɛ m
p a r aː r ɛ	p a r aː r ɛ
w a k iː lː aː r ɛ	w a k ɪ lː aː r ɛ
m a n aː t ɛ m	m a ŋ n aː t ɛ m
m ʊ n d ʊ m	m ʊ n d ʊ m
ɪ n f r ɪ ŋ g ɛ r ɛ	iː n f r ɪ ŋ g ɛ r ɛ
s p ɔ r t a m	s p ɔ r t a m
k l a r ɪ t aː t ɛ m	k l aː r ɪ t aː t ɛ m
s p ʊ r k aː r ɛ	s p ʊ r k aː r ɛ
p a l uː d oː s ʊ m	p a l uː d oː s ʊ m
a s ɔ lː aː r	a sː ɔ l aː r ɛ
a lː ɪ m d ʊ l a m	a l aʊ d a m
eː m s t r uː d iː r	ɛ k s t r uː d ɛ r ɛ
d ɛ n ɔ m iː n a t oː r ɛ	d eː n oː m ɪ n aː t oː r ɛ m
ɛ m w r j aː k ʊ m	eː b r j aː k ʊ m
l iː n aː r j ʊ m	l iː n aː r j ʊ m
p a t ɛ r n ʊ m	p a t ɛ r n ʊ m
iː rː ɔ m p ɛ r ɛ	ɪ rː ʊ m p ɛ r ɛ
b a l t iː k ʊ m	b a l t ɪ k ʊ m
f ɛ s t iː w iː t aː t ɛ m	f eː s t iː w ɪ t aː t ɛ m
s ɔ l eː r ɛ	s ɔ l eː r ɛ
m uː n iː k iː p j ʊ m	m uː n ɪ k ɪ p j ʊ m
a k uː s a t oː r ɛ	a kː uː s aː t oː r ɛ m
s a n a b ɪ l ɛ m	s aː n aː b ɪ l ɛ m
ɛ k s p ɔ n ɛ m	ɛ k s p oː n ɛ r ɛ
p ɛ r s ɛ k ɪ r ɛ	p ɛ r s ɛ kʷ iː
iː n g uː s t ʊ m	ɪ n ɪ uː s t ʊ m
a lː ɛ n t ʊ m	a n h eː l ɪ t ʊ m
aː m s k ɔ n d ɛ r ɛ m	a b s k ɔ n d ɛ r ɛ
a l a b a s t r ʊ m	a l a b a s t r ʊ m
m ɔ s k ʊ m	m ʊ s t ɛu m
b a k t ɪ s ɪ m ʊ m	b a p t ɪ s m ʊ m
ɔ k l uː ɛ r ɛ	ɔ kː l uː d ɛ r ɛ
l ɔ ŋ g iː n kʷ iː t eː t ɛ	l ɔ ŋ g ɪ ŋ kʷ ɪ t aː t ɛ m
t r iː p l ʊ m	t r ɪ p l ʊ m
p a r t iː r ɛ	p a r t iː r ɛ
k ɔ nː ʊ m	k ʊ nː ʊ m
ɔ l iː g aː r k a m	ɔ l ɪ g a r kʰ a m
a b uː s aː r ɛ	a b uː t iː
k ɛ r t iː t uː m d ɪ n ɛ m	k ɛ r t ɪ t uː d ɪ n ɛ m
r ɛ p a r aː r ɛ	r ɛ p a r aː r ɛ
m ɛ lː ʊ m	ɛ lː ʊ m
eː k l ɛ s a m	ɛ kː l eː s j a m
eː b r iː ɛ t aː t ɛ m	eː b r ɪ ɛ t aː t ɛ m
a n ɪ k iː l aː r ɛ	a nː ɪ h ɪ l aː r ɛ
m a g ɛ s t aː t ɛ m	m a j ɛ s t aː t ɛ m
m uː n iː r	m uː n iː r ɛ
w ɛ r s iː f ɪ k aː r ɛ	w ɛ r s ɪ f ɪ k aː r ɛ
n uː m eː r aː r oː	n ʊ m ɛ r aː r j ʊ m
s iː t j ʊ m	s ɪ t ʊ m
p r ɔ t ɛ r w ʊ m	p r ɔ t ɛ r w ʊ m
k a lː ɛ m	k a lː ɛ m
uː s uː r aː r j ʊ m	uː s uː r aː r j ʊ m
m ʊ r ɛ n a m	m ʊ r eː n a m
s eː l w a m	s ɪ l w a m
t uː r p iː t uː d ɪ n ɛ	t ʊ r p ɪ t uː d ɪ n ɛ m
r eː p l iː k a t j oː n ɛ	r ɛ p l ɪ k aː t j oː n ɛ m
s ɪ l ɪ k ɛ m	s ɪ l ɪ k ɛ m
d ɔ m ɛ s t iː k ʊ m	d ɔ m ɛ s t ɪ k ʊ m
d ɛ l iː t j a m	d eː l ɪ k j aː s
ɔ f iː k iː n a m	ɔ fː ɪ k iː n a m
n eː g l iː g ɛ n t j a m	n ɛ g l ɛ g ɛ n t j a m
iː n t ɛ n t j oː n ɛ m	ɪ n t ɛ n t j oː n ɛ m
n eː f aː s t ʊ m	n ɛ f aː s t ʊ m
ɪ n k ɛ n s ʊ m	ɪ ŋ k eː n s ʊ m
a k ɛ r b iː t eː t ɛ	a k ɛ r b ɪ t aː t ɛ m
ɔ r d ɛ n a t oː r	ɔ r d ɪ n aː t oː r ɛ m
m a r iː s k	m a r ɪ s k a m
a t r a b iː lː aː r oː	aː t r a b iː l aː r j ʊ m
s ʊ m ʊ m	s ʊ mː ʊ m
lː a n t aː r ʊ m	l a ŋ k j aː r j ʊ m
s k ʊ d ɛ lː a m	s k ʊ t ɛ lː a m
g uː b a m	j ʊ b a m
r ɪ p a m	r iː p a m
g ɔ k ʊ n d ʊ m	j uː k ʊ n d ʊ m
k iː m b a l ʊ m	k y m b a l ʊ m
iː m s t r uː k s w ɛ m	iː n s t r ʊ k t j oː n ɛ m
p r ɔ m uː l g a t j oː n ɛ m	p r oː m ʊ l g aː t j oː n ɛ m
m eː d iː k aː r ɛ	m ɛ d ɪ k aː r ɛ
l iː n ɛ aː r ɛ	l iː n ɛ aː r ɛ
l ɛ m a m	l ɛ mː a
n aʊ s a m	n aʊ s j a m
r a p iː r ɛ	r a p ɛ r ɛ
a b a t j ɪ aː l	a bː aː t j aː l ɛ m
n ʊ m ɛ r ʊ m	n ʊ m ɛ r ʊ m
a t r a ɛ r ɛ	a tː r a h ɛ r ɛ
s uː f iː k j ɛ n t j a m	s ʊ fː ɪ k ɪ ɛ n t j a m
s ɛ s kʷ iː p ɛ d a l ɛ	s eː s kʷ ɪ p ɛ d aː l ɛ m
ɛ f ʊ n d ɪ r ɛ	ɛ fː ʊ n d ɛ r ɛ
n eː m ɔ r aː l ɛ	n ɛ m ɔ r aː l ɛ m
eː d iː k ɔ l a m	aɪ d ɪ k ʊ l a m
p r ɔ n ɔ s t iː k	p r ɔ ŋ n oː s ɛ m
ʊ r iː n a m	uː r iː n a m
l uː m iː n oː l ʊ m	ɛ lː y kʰ n j ʊ m
m a n k ʊ m	m a ŋ k ʊ m
s ɔ p t ʊ ʊ ʊ m	s ʊ m p t ʊ oː s ʊ m
k a n t oː n ɛ m	k a n t j oː n ɛ m
ɔ k ɛ t aː r	oː s k ɪ t aː r ɛ
ɛ ɛ k r ɛ t ɪ	s k r iː p t ʊ m
eː l iː m iː n a t j oː n ɛ m	eː l ɪ m ɪ n aː t j oː n ɛ m
m ɛ r d a m	m ɛ r d a m
p a p aː r ɛ	p a pː aː r ɛ
aʊ s t r ʊ m	aʊ s t r ʊ m
k ɔ w r ɛ	k ʊ b aː r ɛ
t r ɛ p iː d ʊ m	t r ɛ p ɪ d ʊ m
d ɛ n ɔ m iː n a t j oː n ɛ m	d eː n oː m ɪ n aː t j oː n ɛ m
r ɪ k aː l k iː t r aː r ɛ	r ɛ k a l k ɪ t r aː r ɛ
f ɪ ʊ k a m	f iː d uː k j a m
aʊ r iː r	h aʊ r iː r ɛ
p ɛ k aː r ɛ	p ɛ kː aː r ɛ
k a l a m iː t aː t ɛ m	k a l a m ɪ t aː t ɛ m
ɔ b s eː k j oː m ʊ m	ɔ b s ɛ kʷ j oː s ʊ m
