p a l ʊ s t r ɛ m	p a l uː s t r ɛ m
s ɛ p ʊ l t uː r a m	s ɛ p ʊ l t uː r a m
ɪ t aː t ɛ m	ɪ t aː t ɛ m
ʊ m r ɪ f ɪ k ɛ m	aʊ r ɪ f ɪ k ɛ m
f ɔ sː a m	f ɔ sː a m
s ɛ k s t ʊ m	s ɛ k s t ʊ m
p uː b l ɪ k ʊ m	p uː b l ɪ k ʊ m
w ɪ s ʊ m m	w iː s ʊ m
m oː l n ɛ m aː r ʊ m	m ɔ l iː n aː r j ʊ m
f ɔ r t ɛ m	f ɔ r t ɛ m
k ɛ r ɛ m ɔ n j aː l ɛ	k aɪ r ɪ m oː n j aː l ɛ m
ɪ n f ʊ n d ɛ r ɛ	iː n f ʊ n d ɛ r ɛ
w ɪ b r aː r ɛ	w ɪ b r aː r ɛ
a r g uː t j a m	a r g uː t j a m
a lː ɛ g r ɛ m	a l a k r ɛ m
aː pː ɛ n d ɛ r ɛ	a pː ɛ n d ɛ r ɛ
k ɔ lː ɛ k ʊ j ʊ m	k aʊ l ɪ k ʊ l ʊ m
f a m r ɪ n oː s ʊ m	f a r iː n oː s ʊ m
d ɛ k ɪ m aː r ɛ	d ɛ k ɪ m aː r ɛ
ɪ n t ɛ m l ɪ g ɪ r ɛ	ɪ n t ɛ lː ɛ g ɛ r ɛ
w ɪ m ɪ n ɛ m	w iː m ɛ n
j uː g ɛ r ʊ m	j uː g ɛ r ʊ m
k ɪ b aː r ɛ	k ɪ b aː r ɛ
k ɛ f a l eːa aː	k ɛ pʰ a l aɪ a m
f ɪ s k ʊ m	f ɪ s k ʊ m
s ɛ p t ɛ n t r j ɔ n aː l ɛ	s ɛ p t ɛ n t r j oː n aː l ɛ m
t ɛ n ʊ ɛ	t ɛ n ʊ ɛ m
k oː l aː r ɛ	k ɔ l ɛ r ɛ
m ɛ n d aː k j ʊ m	m ɛ n d aː k j ʊ m
r ʊ ɪ n oː s ʊ m	r ʊ iː n oː s ʊ m
m ɪ s k ɛ lː aː n ɛ ʊ m	m ɪ s k ɛ lː aː n ɛu m
l ʊ t ʊ m	l uː k t ʊ m
w aː g ʊ m	w a g ʊ m
r ɛ s ɛ d ɛ r ɛ	r ɛ s ɪ d eː r ɛ
m ɛ t ɪ j ɔ k r ɛ ɛ m	m ɛ d ɪ ɔ k r ɛ m
ɛ k s k r ɛ m ɛ n t ʊ m	ɛ k s k r eː m ɛ n t ʊ m
p ɛ r k ʊ s oː r ɛ	p ɛ r k ʊ sː oː r ɛ m
aː k ʊ m ɛ	a k uː m ɛ n
p uː n ɪ r ɛ	p uː n iː r ɛ
ɛ r b aː r j ʊ m	h ɛ r b aː r j ʊ m
l ɛ p r ʊ m s ʊ m	l ɛ p r oː s ʊ m
l ʊ k b r ɛ ɛ k aː r	l uː k ʊ b r aː r ɛ
n ɛ m ɔ r aː l ɛ	n ɛ m ɔ r aː l ɛ m
t ɪ n a m	t iː n a m
t a pː ɛ t ɛ m	t a p eː t ɛ m
g aʊ d ʊ m	g aʊ d j ʊ m
j uː s t ʊ m	j uː s t ʊ m
ɪ m p r ʊ ŋ t a m r ɛ	p r oː m uː t w aː r iː
f aː m ʊ l ʊ m	f a m ʊ l ʊ m
d ʊ l k ɪ f ɪ k aː r ɛ	d ʊ l k ɪ f ɪ k aː r ɛ
s a k ɛ m r d ɔ t ɛ m	s a k ɛ r d oː t ɛ m
aː m s ʊ g aː r ɛ	ɛ k sː uː k aː r ɛ
l a k t ɪ k ɪ n j ʊ m	l a k t ɪ k iː n j ʊ m
t ɔ g a m	t ɔ g a m
r ɪ t ʊ m	r iː t ʊ m
p r ɔ p r ɪ ɛ t aː t ɛ m	p r oː p r ɪ ɛ t aː t ɛ m
ʊ n t ɔ s ʊ m	uː ŋ k t ʊ oː s ʊ m
d ɛ t ɛ s t a t j oː n ɛ m	d eː t ɛ s t aː t j oː n ɛ m
k r ɛ t a m	k r eː t a m
g ɪ r aː r ɛ	g y r aː r ɛ
p ʊ n aː r ɛ	p ʊ ŋ n aː r ɛ
s ɛ r ɛ ɪ n	s ɛ rː aː g ɪ n ɛ m
ɛ b l ʊ m	ɛ b ʊ l ʊ m
k a l aː r ɛ	kʰ a l aː r ɛ
ɪ m p ɛ r a t oː r j ʊ m	ɪ m p ɛ r aː t oː r j ʊ m
l ɛ ɛ r ɛ	l ɛ g ɛ r ɛ
b ɪ s k a m	b eː s t j a m
ɪ n t r ɛ ʊ m ɛ m t ɛ r ɛ m	ɪ n t r oː m ɪ tː ɛ r ɛ
k a r a m ɛ lː ʊ m	k a l a m ɛ lː ʊ m
aʊ d aː k j a m	aʊ d aː k j a m
a n ɔ m a l ʊ m	a n oː m a l ɔ n
d ɛ n ɛ m g aː r ɛ	d eː n ɛ g aː r ɛ
a b l a kʷ ɛ aː t j ʊ m n ɛ m	a b l a kʷ ɛ aː t j oː n ɛ m
s ʊ fː r ʊ t ɪ k ɛ	s ʊ fː r ʊ t ɪ k ɛ m
ɪ n s t r ʊ ɪ r ɛ	iː n s t r ʊ ɛ r ɛ
kʷ a d r ʊ p l ɪ k aː r ɛ	kʷ a d r ʊ p l ɪ k aː r ɛ
m a nː j aː r	m a n w aː r j ʊ m
a k t oː r ɛ	aː k t oː r ɛ m
s aː t ɪ r a	s a t ɪ r a m
w ɛ r ɪ f ɪ k aː r ɛ	w eː r ɪ f ɪ k aː r ɛ
n aː r aː t j ɔ n	n aː rː aː t j oː n ɛ m
r ɪ d ɛ r ɛ	r iː d eː r ɛ
w ɔ t ɪ f ɛ r aː r ɛ	w oː k ɪ f ɛ r aː r iː
n ʊ b ɛ	n uː b ɛ m
l uː k s uː r j a m	l ʊ k s ʊ r j a m
p r ɔ t ɛ s t aː r ɛ	p r oː t ɛ s t aː r iː
ɛ b d ɔ m aː d a m r j ʊ m	h ɛ b d ɔ m a d aː r j ʊ m
a kː ɪ s ɪ t j oː n ɛ	a kː w ɪ s iː t j oː n ɛ m
t ʊ s ʊ m	t oː n s ʊ m
kʷ aː d r uː p l ʊ m	kʷ a d r ʊ p l ʊ m
f ɛ s t ɪ w ɪ t aː t ɛ m	f eː s t iː w ɪ t aː t ɛ m
k a n t oː n ɛ m	k a n t j oː n ɛ m
g a m lː ɛ t aː	g a lː ɛ t a m
a n ɛ t ʊ m	a n eː tʰ ʊ m
k a p r ɪ n ʊ m	k a p r iː n ʊ m
ɛ k s t a s ɪ	ɛ k s t a s ɛ m
s ɪ l w a m	s ɪ l w a m
n aʊ s	n aʊ s j a m
l a ŋ gʷ oː r ɛ	l a ŋ gʷ oː r ɛ m
ɔ b b j ʊ m	ɔ b w j ʊ m
g ɛ n j aː l ɛ	g ɛ n j aː l ɛ m
a m ɛ n ʊ m	a m ɔ ɪ n ʊ m
t ɔ l ɛ r ɛ	t ɔ lː ɛ r ɛ
ɛ r b aː k ɛ ʊ m	h ɛ r b aː k ɛu m
s a n aː r ɛ	s aː n aː r ɛ
p a n ɛ r ʊ m	p aː n aː r j ʊ m
m ɔ lː ɪ t j ɛ m	m ɔ lː ɪ t ɪ ɛ m
ɪ d ɛ n t ɪ k ʊ m	iː d ɛ n t ɪ k ʊ m
s uː p ɛ r b ʊ m	s ʊ p ɛ r b ʊ m
m ɛ r ɪ d j ɔ n aː l ɛ	m ɛ r iː d j oː n aː l ɛ m
m aː n j ʊ m	m a ŋ n ʊ m
a sː ɔ k j aː r ɛ	a sː ɔ k j aː r ɛ
m a m k ɛ lː ʊ m	m a k ɛ lː ʊ m
p r uː d ɛ r ɛ	p r uː r iː r ɛ
a n ɪ m ɔ	a n ɪ m ʊ m
w a r ɪ ɛ m g aː r ɛ	w a r ɪ ɛ g aː r ɛ
s ɔ l aː r ɪ j ʊ m	s oː l aː r j ʊ m
m ɛ r aː n d a	m ɛ r ɛ n d a m
ɪ b ɪ l ɛ	ɪ b ɪ l ɛ m
a t r ʊ m	aː t r ʊ m
r ɔ n k aː r ɛ	r h ɔ ŋ kʰ aː r ɛ
s ʊ g lː oː t ʊ m	s ɪ ŋ g ʊ l t ʊ m
p ɛ r k ɔ l aː r ɛ	p ɛ r k oː l aː r ɛ
aʊ d j ɛ n t j a m	aʊ d ɪ ɛ n t j a m
a s t uː t j a m	a s t uː t j a m
aː lː ɔ n d ʊ m r a m	a l aʊ d a m
ɪ t ɛ r aː r ɛ	ɪ t ɛ r aː r ɛ
p a r t ɪ k ʊ l aː r ɛ	p a r t ɪ k ʊ l aː r ɛ m
p r ɔ d ɪ g a m r ɛ	p r oː d ɪ g ɛ r ɛ
t ɛ r t j ʊ m	t ɛ r t j ʊ m
f ɪ d ʊ m	f iː d ʊ m
ɔ rː ɪ f ɪ k ʊ m	h ɔ rː ɪ f ɪ k ʊ m
p l a g j aː r ɛ	p l a g j aː r ɛ
t ɛ rː ɛ ʊ m	t ɛ rː ɛu m
a k ɛ m r b ɪ t aː t ɛ m	a k ɛ r b ɪ t aː t ɛ m
d uː r ʊ m	d uː r ʊ m
s ɛ k r ɪ t ʊ m	s k r iː p t ʊ m
ɛ k s aː k t j ɔ n	ɛ k s aː k t j oː n ɛ m
w ɪ r aː g ʊ m	w ɪ r aː g ɪ n ɛ m
oː r ɪ ʊ m	h ɔ rː ɛu m
k ɔ n f ɪ s k aː r ɛ	k oː n f ɪ s k aː r ɛ
s uː kː uː l ɛ n t ʊ m	s ʊ kː ʊ l ɛ n t ʊ m
s ʊ b t ɪ l ɛ	s ʊ b t iː l ɛ m
p a r ɔ n ɔ m aː s j a m	p a r ɔ n ɔ m a s j a m
r ɛ p oː n ɛ	r ɛ p oː n ɛ r ɛ
m a t r ɪ m oː n j ʊ m	m aː t r ɪ m oː n j ʊ m
n ɛ s k j ʊ m	n ɛ s k j ʊ m
d ɛ m oː r aː r ɛ	d eː m ɔ r aː r iː
m aː ŋ n ɪ t ʊ d ʊ m	m a ŋ n ɪ t uː d ɪ n ɛ m
b r a k aː t ʊ m	b r aː k aː t ʊ m
ɪ k n ɔ b ɪ l ɛ	ɪ ŋ n oː b ɪ l ɛ m
a k t ʊ aː l ɛ	a k t w aː l ɛ m
ɪ n f ɪ r m a m r ɛ	iː n f ɪ r m aː r ɛ
a m a r ɪ g a r ɛ	a m aː r ɪ k aː r ɛ
aː k t aː r j ʊ m	aː k t w aː r j ʊ m
k ɔ n t r ɪ t j oː n ɛ m	k ɔ n t r iː t j oː n ɛ m
aː r m aː m ɪ n t ʊ m	a r m aː m ɛ n t ʊ m
k ɔ n t ɛ n d ɛ r ɛ	k ɔ n t ɛ n d ɛ r ɛ
k a w aː r ɛ	k a w aː r ɛ
k ɔ l oː n ʊ m	k ɔ l oː n ʊ m
p ɪ n s ʊ m	p eː n s ʊ m
d ɪ s p ɛ r k ɪ r ɛ	d ɪ s p ɛ r iː r ɛ
p a r a d ɔ k s ʊ m	p a r a d ɔ k s ʊ m
k r ɪ b l ʊ m	k r iː b r ʊ m
aː pː aː r a m t ʊ m	a pː a r aː t ʊ m
ɪ k ʊ m	ɪ k ʊ m
t oː r j j ʊ m	t oː r j ʊ m
iː l ɛ	ɪ l ɛ m
d ɛ p r ɛ d aː t j ʊ m n ɛ m	d eː p r aɪ d aː t j oː n ɛ m
a s p ɛ r g ɛ r ɛ	a s p ɛ r g ɛ r ɛ
a d ɔ r aː r ɛ	a d oː r aː r ɛ
f ɔ r n ɪ k s ɛ m	f ɔ r n ɪ k ɛ m
d ɛ w ʊ m w ɛ r ɛ	d eː w ɔ w eː r ɛ
k ɔ n k ʊ r s ʊ m	k ɔ ŋ k ʊ r s ʊ m
d ɪ f ɛ n s j oː n ɛ m	d eː f eː n s j oː n ɛ m
s k r ʊ t aː r ɛ	s k r uː t aː r iː
s ʊ p ɪ n ʊ m	s ʊ p iː n ʊ m
k ɛ l ɛ b r ɛ m	k ɛ l ɛ b r ɛ m
ɔ b n ʊ b ɪ l a m r ɛ	ɔ b n uː b ɪ l aː r ɛ
k ɔ n w ɛ n ɪ r ɛ	k ɔ n w ɛ n iː r ɛ
d ɛ s p l eː g aː r ɛ	d ɪ s p l ɪ k aː r ɛ
h ɪ s p aː n ɪ k ʊ m	h ɪ s p aː n ɪ k ʊ m
ɪ ŋ n ɔ m ɪ n j a m	ɪ ŋ n oː m ɪ n j a m
p r ɔ s p ɛ r aː r ɛ	p r ɔ s p ɛ r aː r ɛ
k ʊ l t ɛ lː ʊ m	k ʊ l t ɛ lː ʊ m
w ɛ m r aː k ɛ	w eː r aː k ɛ m
d ɔ m ɪ n j ʊ m	d ɔ m ɪ n j ʊ m
p r ɔ m ɔ n t oː r j ʊ m	p r oː m ʊ n t ʊ r j ʊ m
f ɛ r w ɛ r ɛ	f ɛ r w eː r ɛ
j ɪ n ɪ p ɛ m r ʊ m	j uː n ɪ p ɛ r ʊ m
t ɛ m p ɔ r aː r j ʊ m	t ɛ m p ɔ r aː r j ʊ m
p ɛ r n ɪ k j oː s ʊ m	p ɛ r n ɪ k j oː s ʊ m
k ɔ l uː b r ɪ n ʊ m	k ɔ l ʊ b r iː n ʊ m
w ɛ t r ɪ k ɛ	w iː t ɪ k ɛ m
s aʊ l t ʊ m	s ɔ l uː t ʊ m
s aː kː uː l ʊ	s a kː ʊ l ʊ m
k ɛ m ɛ n t ʊ m	k aɪ m ɛ n t ʊ m
l uː p a n aː r ɛ	l ʊ p aː n a r
f uː g aː k ɛ	f ʊ g aː k ɛ m
uː m aː	uː d ʊ m
ɛ k s p oː n ɛ	ɛ k s p oː n ɛ r ɛ
t aː k t ɪ l ɛ	t aː k t ɪ l ɛ m
k uː r a m t uː r a m	k uː r aː t uː r a m
t r aː m ɪ t ɛ r ɛ	t r aː m ɪ tː ɛ r ɛ
p ɛ t ʊ m	p eː d ɪ t ʊ m
l ɪ r ɪ k ʊ m	l y r ɪ k ʊ m
r ɛ l ɛ g aː r ɛ	r ɛ l ɛ g ɛ r ɛ
p ɔ p ɛ r t aː t	p aʊ p ɛ r t aː t ɛ m
f r ʊ ɪ r ɛ	f r ʊ iː
p ɛ lː aː r j ʊ m	p ɛ lː aː r j ʊ m
w ɔ r ʊ m	w ɔ r ʊ m
t r a n s m ɪ sː j oː n ɛ m	t r aː n s m ɪ sː j oː n ɛ m
t ɛ k s t ʊ m	t ɛ k s t ʊ m
t eːa n ɪ r n ʊ m	t ɛ n ɛ r ʊ m
s ɪ t uː l a m	s ɪ t ʊ l a m
ɪ m p aː r t ɪ r ɛ	ɪ m p a r t iː r ɛ
s t aː n j ʊ m	s t a nː ʊ m
ɛ k s p ɔ r t a t j oː n ɛ m	ɛ k s p ɔ r t aː t j oː n ɛ m
m ɪ n ʊ ɪ r ɛ	m ɪ n ʊ ɛ r ɛ
ɔ s p ɛ m t ɛ m	h ɔ s p ɪ t ɛ m
w ɔ s	w oː s
r ɛ l ɛ g a t j oː n ɛ m	r ɛ l eː g aː t j oː n ɛ m
d ɛ m t r a ɪ r ɛ	d eː t r a h ɛ r ɛ
a r g ɪ n t oː s ʊ m	a r g ɛ n t oː s ʊ m
p r ɔ p ɪ n kʷ ʊ m	p r ɔ p ɪ ŋ kʷ ʊ m
p ɛ r ɪ k ʊ l oː s ʊ m	p ɛ r iː k ʊ l oː s ʊ m
s ɛ n aː t ʊ m	s ɛ n aː t ʊ m
m ʊ n d ʊ m	m ʊ n d ʊ m
m ɔ r a	m ʊ r j a m
l a b oː r ɛ m	l a b oː r ɛ m
l ɛ k ʊ m	l aː ɪ k ʊ m
ɔ l ɪ g aː r k a m	ɔ l ɪ g a r kʰ a m
r ɪ g ʊ r oː s ʊ m	r ɪ g ɔ r ɔ s ʊ m
t ɛ k l a m	tʰ eː k a m
f ɛ m ɛ l a m	f eː m ɛ lː a m
r ɛ l uː k ɛ r ɛ	r ɛ l uː k eː r ɛ
aː n ʊ s	aː n ʊ m
ɛ k m k ɛ lː ɛ n t j a m	ɛ k s k ɛ lː ɛ n t j a m
a lː oː k aː r ɛ	a lː ɔ k aː r ɛ
s p ʊ s aː r ɛ	s p oː n s aː r ɛ
s k ʊ r s ʊ m	ɛ k s k ʊ r s ʊ m
f ɛ m t ɛ r ɛ	f eː t eː r ɛ
k ɔ kʷ ɛ	k ɔ kː ʊ m
f ɪ n a m	f aː g ɪ n ʊ m
d ɪ s p aː r ɪ m r ɛ	d ɪ s p a r eː r ɛ
p r ɔ s t r aː r ɛ	p r oː s t ɛ r n ɛ r ɛ
r ɛ k ɛ t a m	r ɛ k ɛ p t a m
k ɔ lː ɛ k t a m	k ɔ lː eː k t a m
s ɔ l ɪ d ʊ m	s ɔ l ɪ d ʊ m
m aː k l aː r ɛ	m a k ʊ l aː r ɛ
oː w eː l a m	ɔ w ɪ k ʊ l a m
f uː l g ɪ r ɛ	f ʊ l g eː r ɛ
d ɛ f ɛ r ɪ r ɛ	d eː f ɛ rː ɛ
ɪ mː aː k ʊ l aː t ʊ m	ɪ mː a k ʊ l aː t ʊ m
ɛ s t ɛ r n ʊ m	h ɛ s t ɛ r n ʊ m
p j ɛ a n a	p aɪ aː n ɛ m
d oː n	d oː n ʊ m
p ɛ l a g ʊ m	p ɛ l a g ʊ s
ɪ f ɪ m a m r ɛ	ɪ f ɪ k aː r ɛ
s ɔ m aː r j ʊ m	s ʊ mː aː r j ʊ m
a kː uː m uː l a t j oː n ɛ m	a kː ʊ m ʊ l aː t j oː n ɛ m
s ɪ m j ʊ m	s iː m j ʊ m
n a rː aː r ɛ	n a rː aː r ɛ
p r ɛ f ɛ r ɪ r ɛ	p r aɪ f ɛ rː ɛ
f a k ʊ n d ʊ m	f aː k ʊ n d ʊ m
ɛ k s t r ɛ ʊ t ɪ r ɛ	ɛ k s t r uː d ɛ r ɛ
ɪ s t a m	ɪ s t a m
t j a	tʰ iː a m
ɪ m p uː l s ʊ m	ɪ m p ʊ l s ʊ m
p a p ɛ r	p a p y r ʊ m
a f j aː n t aː r ɛ	a fː ɪ d ɛ n t j aː r ɛ
f a l s aː r ɛ	f a l s aː r ɛ
ɪ r aː t ʊ m	iː r aː t ʊ m
s a l w ʊ m	s a l w ʊ m
d ɛ k ɛ r n ɛ r ɛ	d eː k ɛ r n ɛ r ɛ
n a t uː r a m	n aː t uː r a m
s ʊ p ɛ r ɛ m pː oː n ɛ	s ʊ p ɛ r p oː n ɛ r ɛ
p r ɛ t ɛ k s t aː r ɛ	p r aɪ t ɛ k s ɛ r ɛ
l ʊ t ʊ m	l ʊ t ʊ m
k ɔ r t ɛ m	k ɔ h ɔ r t ɛ m
ɔ b w j aː r ɛ	ɔ b w j aː r ɛ
r ɛ l ɪ kʷ j a m	r eː l ɪ kʷ j aː s
a m p l ɪ t	a m p l ɪ t uː d ɪ n ɛ m
ɪ n w ɛ n t oː r ɛ	ɪ n w ɛ n t oː r ɛ m
p ɛ d ɪ k ɛ lː ʊ m	p ɛ d iː k ɛ lː ʊ m
ɪ n s aː n ʊ m	iː n s aː n ʊ m
k ɔ n s oː l ɪ d a m	k oː n s ɔ l ɪ d a m
f l ɛ mː a m	pʰ l ɛ g m a
ɛ k s f ɔ l j aː r ɛ	ɛ k s f oː l j aː r ɛ
d ɛ p ɔ r t aː r ɛ	d eː p ɔ r t aː r ɛ
f ɛ rː aː r j ʊ m	f ɛ rː aː r j ʊ m
s ɛ p ʊ l k r ʊ m	s ɛ p ʊ l k r ʊ m
d ɛ t ɛ r g ɛ r ɛ	d eː t ɛ r g eː r ɛ
w ɔ l uː b ɪ l ɛ	w ɔ l uː b ɪ l ɛ m
ɪ r k ɪ n ʊ m	h ɪ r k iː n ʊ m
k aʊ t j oː n ɛ	k aʊ t j oː n ɛ m
k ɪ b a t j oː n ɛ m	k ɪ b aː t j oː n ɛ m
ɪ n f ɔ r m ɛ	iː n f oː r m ɛ m
d ɪ k aː k ɛ	d ɪ k aː k ɛ m
p eː r w ɛ n ɪ r ɛ	p ɛ r w ɛ n iː r ɛ
k aː r ɛ n a m	k a r iː n a m
k ɔ n s aː k r aː t j ʊ m n ɛ m	k oː n s ɛ k r aː t j oː n ɛ m
k ɔ p ɛ r t uː r a m	k ɔː p ɛ r t uː r a m
k r j aː t uː r a m	k r ɛ aː t uː r a m
ɪ n kʷ ɪ l ɪ n ʊ m	ɪ ŋ kʷ ɪ l iː n ʊ m
k ɛ r k ɪ n ɛ	k ɪ r k ɪ n ʊ m
a d ɔ l ɛ s k ɛ n t j a m	a d ʊ l eː s k ɛ n t j a m
p ʊ t ʊ m	p ʊ t ʊ m
k aː l k ɛ m	k a l k ɛ m
f l ɔ kː oː s ʊ m	f l ɔ kː oː s ʊ m
d ʊ l k oː r ɛ	d ʊ l k oː r ɛ m
m uː s k ʊ l oː s ʊ m	m uː s k ʊ l oː s ʊ m
n ɔ t ɪ t j a m	n oː t ɪ t j a m
aː ŋ g ɔ s aː	a ŋ g ʊ s t j a m
l ʊ m k aː r ɛ	l ɔ k aː r ɛ
p r ɔ l ɛ t a r j aː t ʊ m	p r oː l eː t aː r j ʊ m
aː s t r ʊ m	a s t r ʊ m
s t r ɛ ʊ ɛ n ɛ t ʊ m m	t ɔ n ɪ t r ʊ m
p r aː k t ɪ k ʊ m	p r a k t ɪ k ʊ m
f r a t ɛ r n aː l	f r aː t ɛ r n aː l ɛ m
ɛ k s k ɔ g ɪ t a m r ɛ	ɛ k s k oː g ɪ t aː r ɛ
s ɛ	s eː
ɪ n f a n t j a m	iː n f a n t j a m
d ɛ m s uː m ɛ r ɛ	d eː s uː m ɛ r ɛ
s oː l ʊ m	s oː l ʊ m
t a r d aː r ɛ	t a r d aː r ɛ
p r ɔ k r a s t ɪ n aː r ɛ	p r oː k r aː s t ɪ n aː r ɛ
ʊ m	ʊ m
ʊ n k ɪ n ʊ m	ʊ ŋ k iː n ʊ m
ɔ r k ʊ m	ɔ r k ʊ m
g aː n t aː r ɛ	j ɛ n t aː r ɛ
s a m l ɪ n a m	s a l iː n a m
ɛ s t r ɛ nː a m	s t r eː n a m
t ɛ r s ʊ m	t ɛ r s ʊ m
p a t r ɪ t j ʊ m	p aː t r ɪ k j ʊ m
m uː r aː l a m	m uː r aː l ɛ m
ɪ n s ɛ ɪ r ɛ	iː n s ɛ kʷ iː
k ʊ t ɛ m	k oː t ɛ m
a p j aː r j ʊ m	a p j aː r j ʊ m
s t a b ɪ l ɛ m k ɛ r ɛ	s t a b ɪ l iː r ɛ
k ɪ d j ʊ m	k iː d j ʊ m
k ʊ l t r ʊ m	k ʊ l t r ʊ m
a ʊ l a	a w j a m
p ɛ s t aː r ɛ	p ɪ s t aː r ɛ
a b r ɛ w j aː r ɛ	a bː r ɛ w j aː r ɛ
k ɔ n s ɛ kʷ ɛ n t j a m	k oː n s ɛ kʷ ɛ n t j a m
w ɪ k ʊ m	w iː k ʊ m
b ɛ n ɪ ŋ n ʊ m	b ɛ n ɪ ŋ n ʊ m
f ɪ n oː k j ʊ m	f eː n ʊ k ʊ l ʊ m
d ɛ k ɔ r aː r ɛ	d ɛ k ɔ r aː r ɛ
s k ɔ t j a m	s k ɔ t j a m
j uː r a m m ɛ n t ʊ m	j uː r aː m ɛ n t ʊ m
f ɔ n t a n a m	f ɔ n t aː n a m
p ɛ kʷ aː r j ʊ m	p ɛ k w aː r j ʊ m
d ɛ m p ɛ r ɪ t r ɛ	d eː p ɛ r iː r ɛ
d ɛ k s t ɛ r ɪ t aː t ɛ m	d ɛ k s t ɛ r ɪ t aː t ɛ m
k ɔ m ʊ n j oː n ɛ m	k ɔ mː uː n iː r ɛ
p ɛ lː ɪ k ʊ l a m	p ɛ lː ɪ k ʊ l a m
p l a n t a m r ɛ	p l a n t aː r ɛ
f ɛ s t ɪ w ʊ m	f ɛ s t iː w ʊ m
g ʊ s t ʊ m	g ʊ s t ʊ m
d ɪ m ɛ n s j oː n ɛ m	d iː m ɛ n s j oː n ɛ m
ɔ n ɔ m a t ɔ p ɛ j a m	ɔ n ɔ m a t ɔ p ɔ ɪ j a m
k ɔ t ɔ r n ɪ k ɛ	k oː t ʊ r n iː k ɛ m
w ɔ m ɪ t aː r ɛ	w ɔ m ɪ t aː r ɛ
ɛ k s p ʊ ŋ n aː r ɛ	ɛ k s p ʊ ŋ n aː r ɛ
p ɛ r m ɪ sː j oː n ɛ m	p ɛ r m ɪ sː j oː n ɛ m
s ɛ k sː w a l ɪ t aː t ɛ m	s ɛ k s w aː l ɪ t aː t ɛ m
d ɪ s k ʊ r s ɪ w ʊ m	d ɪ s k ʊ r s iː w ʊ m
m ɛ d ɪ k a m ɛ n t ʊ m	m ɛ d ɪ k aː m ɛ n t ʊ m
t ɛ r m ɪ t ɛ	t a r m ɪ t ɛ m
ɪ n d ɪ ŋ n a t j oː n ɛ m	ɪ n d ɪ ŋ n aː t j oː n ɛ m
gʷ a r d aː r ɛ	w a r d aː r ɛ
k ɛ d r ʊ m	k ɛ d r ʊ m
r ɛ k uː s a t j oː n ɛ m	r ɛ k uː s aː t j oː n ɛ m
k ɛ s p ɪ t ɛ m	k aɪ s p ɪ t ɛ m
m ʊ n ɪ r ɛ	m ɔ n eː r ɛ
s ʊ r k ɪ r ɛ	s a r k iː r ɛ
l uː k r ʊ m	l ʊ k r ʊ m
m aː d r ɛ	m aː t r ɛ m
m ɪ ŋ ŋ aː m	m ɛ n t ʊ l a m
m a t uː r ʊ m	m aː t uː r ʊ m
a g ɪ l ɪ t aː t ɛ m	a g ɪ l ɪ t aː t ɛ m
d ɪ sː ɛ n s ʊ m	d ɪ sː eː n s ʊ m
ɪ n mː ɔ l aː r ɛ	ɪ mː ɔ l aː r ɛ
ɪ m p ɛ m d ɪ m ɛ n t ʊ m	ɪ m p ɛ d iː m ɛ n t ʊ m
t oː r w ʊ m	t ɔ r w ʊ m
r ʊ p ɛ	r uː p ɛ m
ɪ m p ɛ m t ɪ g ɪ k ɛ m	ɪ m p ɛ t iː g ɪ n ɛ m
d ɛ k r ɛ t aː l ɛ	d eː k r eː t aː l ɛ m
p r ɔ d uː k t ɪ w ʊ m	p r oː d ʊ k t iː w ʊ m
f uː s t ɛ m	f uː s t ɛ m
g r ɛ g ɛ m	g r ɛ g ɛ m
k ɛ n t uː r j a m	k ɛ n t ʊ r j a m
ɛ d ɪ k t ʊ m	eː d ɪ k t ʊ m
k ɔ n k r ɛ t j ʊ m n ɛ m	k ɔ ŋ k r eː t j oː n ɛ m
k a p s j s ʊ m	k a p t j oː s ʊ m
s ɪ k aː r j ʊ m	s iː k aː r j ʊ m
k ɔ n d ɛ m nː a t j oː n ɛ m	k ɔ n d ɛ m n aː t j oː n ɛ m
d ɔ l aː r ɛ	d ɔ l aː r ɛ
aʊ d aː k ɛ	aʊ d aː k ɛ m
j uː n j ɔ r ɛ	j uː n j oː r ɛ m
l ʊ d ɪ b r j ʊ m	l uː d iː b r j ʊ m
p r ɛ d j aː l ɛ	p r aɪ d j aː l ɛ m
b ʊ lː a m	b ʊ lː a m
b ʊ k s ʊ m	b ʊ k s ʊ m
g ɛ mː uː l a m	g ɛ mː ʊ l a m
a k t r ɪ k ɛ	aː k t r iː k ɛ m
d ɛ m g ɔ lː aː r ɛ	d eː k ɔ lː aː r ɛ
p aː l j uː r	p a l ɪ uː r ʊ m
s p ɛ k ɪ f ɪ k ʊ m	s p ɛ k ɪ f ɪ k ʊ m
t ɔ r p ɛ	t ʊ r p ɛ m
b r aː k a	b r aː k a m
k ɔ n s ɪ l ʊ m	k ɔ ŋ k ɪ l j ʊ m
t ɛ k s t ɪ l	t ɛ k s t ɪ l ɛ
