k ɔ m p l ɛ m t ɪ w ʊ m	k ɔ m p l eː t iː w ʊ m
ɛ k s p ʊ l s aː r ɛ	ɛ k s p ʊ l s aː r ɛ
d ɛ p r ɛ d aː t j ʊ m n ɛ m	d eː p r aɪ d aː t j oː n ɛ m
s eː n ʊ m	s ɪ n ʊ m
aː k s ɪ l j ʊ m	aʊ k s ɪ l j ʊ m
p r ɛ k l aː r ʊ m	p r aɪ k l aː r ʊ m
m ɛ r ɪ t aː r ɛ	m ɛ r iː d j aː r ɛ
f a b ʊ l oː s ʊ m	f aː b ʊ l oː s ʊ m
ɪ n kʷ ɪ l ɪ n ʊ m	ɪ ŋ kʷ ɪ l iː n ʊ m
m ɛ n d aː k ɛ m	m ɛ n d aː k ɛ m
l ɛ m n aː r ɛ	l ɪ ŋ n aː r iː
ɪ n f ʊ n d ɪ r ɛ	iː n f ʊ n d ɛ r ɛ
w a r ɪ ɛ t aː t ɛ m	w a r ɪ ɛ t aː t ɛ m
t ɪ n t ɪ p ʊ t	s ɪ ŋ k ɪ p ʊ t
r ɪ t ʊ m	r iː t ʊ m
ɪ r ɪ t aː r ɛ	ɪ rː iː t aː r ɛ
b ɔ rː m a	b ʊ rː a m
d ɛ n ɛ m g aː r ɛ	d eː n ɛ g aː r ɛ
r aː p ʊ m	r aː p ʊ m
d ɪ s t r ɪ k t ʊ m	d ɪ s t r ɪ k t ʊ m
p a lː oː r ɛ	p a lː oː r ɛ m
r ɛ d uː k t j oː n ɛ m	r ɛ d ʊ k t j oː n ɛ m
s a p oː r ɛ	s a p oː r ɛ m
t ɪ m oː n ɛ m	t eː m oː n ɛ m
d ɪ fː a m a t oː r j ʊ m	d ɪ fː aː m aː t oː r j ʊ m
m ɛ d ɪ k aː r ɛ	m ɛ d ɪ k aː r ɛ
p a n a k j aː	p a n a k eːa m
s ʊ g l oː k ʊ m	s ɪ ŋ g ʊ l t ʊ m
a pː r ɛ h ɛ n s j oː n ɛ m	a pː r ɛ h ɛ n s j oː n ɛ m
s k ʊ r s ʊ m	ɛ k s k ʊ r s ʊ m
f r a ŋ g ɛ r ɛ	f r a ŋ g ɛ r ɛ
a sː ɛ m r ɪ r ɛ	a sː ɛ r ɛ r ɛ
ɔ r n aː r ɛ	oː r n aː r ɛ
ɪ m b ɛ k ɪ lː ɪ t aː t ɛ m	ɪ m b eː k ɪ lː ɪ t aː t ɛ m
m aː l t a m	m a l tʰ a m
ɪ n f a n t j a m	iː n f a n t j a m
k aː n ʊ m n ɛ m	k a n ɔ n ɛ m
p aː w ɪ m ɛ n t ʊ m	p a w iː m ɛ n t ʊ m
ɛ s ɪ t aː r ɛ	h aɪ s ɪ t aː r ɛ
m aː r ɪ s k a m	m a r ɪ s k a m
l aː k ʊ m	l aː ɪ k ʊ m
t r ɪ f ɔ l a m t ʊ m	t r ɪ f ɔ l j aː t ʊ m
k r uː d ɛ l ɛ	k r uː d eː l ɛ m
a w ʊ	a w ʊ m
ɔ r aː t oː r ɛ	oː r aː t oː r ɛ m
a fː l ɪ g ɛ r ɛ	a fː l iː g ɛ r ɛ
k ʊ n ɛ m t r ɛ b ʊ l aː r ɛ	k ɔ n t r ɪ b ʊ l aː r ɛ
k ɪ k uː t a m	k ɪ k uː t a m
aʊ d ɪ t oː r ɛ	aʊ d iː t oː r ɛ m
n ɪ d ɪ f ɔ r m ɛ	n iː d ɪ f oː r m ɛ m
k a b l ʊ m	k a p ʊ l ʊ m
f j ɛ r a m	f ɛ r a m
g l ʊ t ɪ n ɛ	g l uː t ɛ n
k ɔ n d ɪ s k ɛ n d ɛ r ɛ	k ɔ n d eː s k ɛ n d ɛ r ɛ
w eː l a m r ɛ	w eː l aː r ɛ
k aː pː l ʊ m	k a p ʊ l ʊ m
d ɛ m f ɔ r m ɛ m	d eː f oː r m ɛ m
ɪ n s ɔ m nː ɛ	iː n s ɔ m n ɛ m
s ɔ l ɛ r t ɛ m	s ɔ lː ɛ r t ɛ m
ɛ m b r j aː k ʊ m	eː b r j aː k ʊ m
b aː s ɛ	b a s ɛ m
d ɪ r ɪ m ɪ r ɛ	d ɪ r ɪ m ɛ r ɛ
k ɛ sː aː r ɛ	k ɛ sː aː r ɛ
s p uː t ʊ m	s p uː t ʊ m
ɔ kː ʊ rː ɛ r ɛ	ɔ kː ʊ rː ɛ r ɛ
s ɔ l aː r ɪ j ʊ m	s oː l aː r j ʊ m
ɪ n w ɛ r t ɪ r ɛ	ɪ n w ɛ r t ɛ r ɛ
b aː j ʊ l ɛ m	b aː j ʊ l ʊ m
a t w ɛ r b j aː l ɛ	a d w ɛ r b j aː l ɛ m
ɔ s p ɛ m t ɛ m	h ɔ s p ɪ t ɛ m
s ɪ m j ʊ m	s iː m j ʊ m
d ɪ w ɪ n aː r ɛ	d iː w iː n aː r ɛ
aː g a t a m	a kʰ aː t eː n
k ɔ n ʊ n g ɛ r ɛ	k ɔ n j ʊ ŋ g ɛ r ɛ
n aː w ɪ k ɛ lː a m	n aː w ɪ k ɛ lː a m
k ʊ j ʊ m	k uː j ʊ m
m aː k l aː r ɛ	m a k ʊ l aː r ɛ
l a w a m t oː r j j ʊ m	l a w aː t oː r j ʊ m
w a k a t j oː n ɛ m	w a k aː t j oː n ɛ m
ʊ n k ɪ n ʊ m	ʊ ŋ k iː n ʊ m
a k l a r aː r ɛ	a kː l aː r aː r ɛ
aʊ d ɪ t j oː n ɛ	aʊ d iː t j oː n ɛ m
p r ɛ t ɛ n d ɛ r ɛ	p r aɪ t ɛ n d ɛ r ɛ
p aː s a r ʊ	p a sː ɛ r ɛ m
r ʊ ɪ b j a m	r ʊ b j a m
n ʊ m ɛ m n	n uː m ɛ n
r ʊ ɛ r ɛ	r ʊ ɛ r ɛ
a b l a k t aː r ɛ	a b l a k t aː r ɛ
k aː r ʊ m	k aː r ʊ m
s uː pː l ɪ k aː t j ʊ m n ɛ m	s ʊ pː l ɪ k aː t j oː n ɛ m
l ʊ s t r ʊ m	l ʊ s t r ʊ m
ɔ l oː r ɛ	ɔ l oː r ɛ m
t ɛ m p ɔ r aː r j ʊ m	t ɛ m p ɔ r aː r j ʊ m
w ʊ l eː r ɛ	w ɛ lː ɛ
ɪ n ʊ s ɪ t aː t ʊ m	ɪ n uː s ɪ t aː t ʊ m
k ɪ w ɪ k ʊ m	k iː w ɪ k ʊ m
p ɛ r s k r ʊ t aː r ɛ	p ɛ r s k r uː t aː r iː
k ɛ l ɛ m r ɛ	k ɛ l ɛ r ɛ m
ɪ f ɛ m r w ɛ m t ɛ r ɛ	ɛ fː ɛ r w eː s k ɛ r ɛ
a l ɪ	ɪ lː ʊ ŋ k
w ɛ g ɛ m t ʊ m	w ɛ g ɛ t ʊ m
ɛ s k l ʊ m	aɪ s k ʊ l ʊ m
n ʊ t r ɪ t aː	n uː t r iː k j ʊ m
p r ɔ r ɔ g aː r ɛ	p r oː r ɔ g aː r ɛ
a s t oː r ɛ	a s t ʊ r ɛ m
w aː r j ʊ	w a r j ʊ m
p r ɔ r ɔ g aː t j ʊ m n ɛ m	p r oː r ɔ g aː t j oː n ɛ m
k ʊ l ɛ w r a m	k ɔ l ʊ b r a m
p uː l s aː r ɛ	p ʊ l s aː r ɛ
m ɛ sː ɛ m	m ɛ sː ɛ m
t ɛ l oː s ʊ m	z eː l oː s ʊ m
l ɪ m a m	l iː m a m
ɪ n s t aʊ r aː r ɛ	iː n s t aʊ r aː r ɛ
uː k s ɔ r ɪ k ɪ d j ʊ m	ʊ k s oː r ɪ k iː d j ʊ m
a r k j a	a r kʰ j a m
s ʊ sː ʊ rː ʊ m	s ʊ s ʊ rː ʊ m
k ɛ l ɛ b r aː t j ʊ m n ɛ m	k ɛ l ɛ b r aː t j oː n ɛ m
k ɔ m ɪ n ʊ m	k ʊ m iː n ʊ m
n ʊ t aː r ɛ	n uː t aː r ɛ
r ɛ f ɔ r m aː r ɛ	r ɛ f oː r m aː r ɛ
s ɔ k ɛ r ʊ m	s ɔ k ɛ r ʊ m
a b ɪ g j ɛ aː t ʊ m	a b ɪ g ɛ aː t ʊ m
t r a b aː l ʊ m	t r ɪ p aː l ɛ m
m ɛ n d aː k ʊ m	m ɛ n d aː k j ʊ m
ɔ b t ɛ n ɛ r ɛ	ɔ b t ɪ n eː r ɛ
l a k ɛ r aː r ɛ	l a k ɛ r aː r ɛ
p a n ɪ k ʊ m	p aː n ɪ k j ʊ m
m a n ɪ f ɛ m s t aː r ɛ	m a n ɪ f ɛ s t aː r ɛ
t r a n s m uː t a t j oː n ɛ m	t r aː n s m uː t aː t j oː n ɛ m
f r ɛ kʷ ɛ n t a m r ɛ	f r ɛ kʷ ɛ n t aː r ɛ
k ɔ j a m t ʊ m	k ɔ mː ɛ aː t ʊ m
w ɛ r t ɛ r ɛ	w ɛ r t ɛ r ɛ
a b s t ɛ r g ɛ r ɛ	a b s t ɛ r g eː r ɛ
b aː g a m	b aː k a m
aː m ɛ n t ɛ	aː m ɛ n t ɛ m
ɛ k s p ɛ k t aː t j ʊ m n ɛ	ɛ k sː p ɛ k t aː t j oː n ɛ m
aː l t ɛ r n aː t j ʊ m n ɛ	a l t ɛ r n aː t j oː n ɛ m
l ʊ k ʊ m	l uː k j ʊ m
a nː oː s ʊ m	a nː oː s ʊ m
ɪ m b ɪ b ɛ r ɛ	ɪ m b ɪ b ɛ r ɛ
ɪ r aː k ʊ n d ʊ m	iː r aː k ʊ n d ʊ m
m ɛ m s ɛ r ɛ	m ɪ s k eː r ɛ
ɪ n w ɪ t a t j oː n ɛ m	ɪ n w ɪ t aː t j oː n ɛ m
aː l g j aː n	a l ɪ kʷ ɛ m
s ʊ s p ɪ r ʊ m	s ʊ s p ɪ r j ʊ m
k ɔ lː ʊ	k ɔ lː ʊ m
k ɔ m uː n aː l	k ɔ mː uː n aː l ɛ m
s a b l ʊ m	s a b ʊ l ʊ m
r ɛ m m ʊ m g aː r ɛ	m ʊ sː aː r ɛ
p ɔ p ɛ r t aː t	p aʊ p ɛ r t aː t ɛ m
ɔ sː aː r j ʊ m	ɔ sː aː r j ʊ m
ɛ r b aː k ɛ ʊ m	h ɛ r b aː k ɛu m
aː b s t r ʊ s ʊ	a b s t r uː s ʊ m
l ɪ t uː r g j a m	l iː t uː r g j a m
k ɔ n k ɪ l j aː b ʊ l ʊ m	k ɔ ŋ k ɪ l j aː b ʊ l ʊ m
l uː k s uː r j a m	l ʊ k s ʊ r j a m
r ʊ g ʊ m s ʊ m	r uː g oː s ʊ m
s p ɛ l t aː	s p ɛ l t a m
l g ɪ r ʊ m n	g l iː r ɛ m
ɪ lː uː s j ʊ m n ɛ m	ɪ lː uː s j oː n ɛ m
k ɔ n t r ɪ t j oː n ɛ m	k ɔ n t r iː t j oː n ɛ m
k r ɪ n ɛ m	k r iː n ɛ m
n ɛ g l ɪ j ɛ r ɛ	n ɛ g l ɛ g ɛ r ɛ
s ɛ p aː r aː r ɛ	s eː p a r aː r ɛ
r ɔ r aː r ɛ	r oː r aː r ɛ
d ɛ f ɛ n s a m	d eː f ɛ n s a m
b oː t ʊ m	w oː t ʊ m
s t ɪ r p ɛ m	s t ɪ r p ɛ m
m uː s k ʊ l oː s ʊ m	m uː s k ʊ l oː s ʊ m
a b sː ɔ l uː t j oː n ɛ m	a b s ɔ l uː t j oː n ɛ m
aː p ɪ k k ɛ m	a p ɪ k ɛ m
s t aː p t	s t a p ɛ d ɛ m
r ɛ ʊ m a m	r h ɛu m a
l ɛ t ʊ m	l eː k t ʊ m
k ɔ n s a ŋ gʷ ɪ n ɪ t aː d ɛ	k oː n s a ŋ gʷ ɪ n ɪ t aː t ɛ m
s aː p j ɛ n t a m	s a p ɪ ɛ n t j a m
k ɔ n s t ɪ t uː t j oː n ɛ m	k oː n s t ɪ t uː t j oː n ɛ m
r j ɛ aː t ʊ m	r ɛ aː t ʊ m
r ɛ n aː r ɛ	r eː ŋ n aː r ɛ
s ʊ p ɛ r w a k aː n ɪ ʊ m	s ʊ p ɛ r w a k ʊː m
k r uː l d a l t ɛ m	k r uː d eː l ɪ t aː t ɛ m
k ɔ n s ɔ l ɪ d a t j ʊ m n ɛ m	k oː n s ɔ l ɪ d aː t j oː n ɛ m
p ɛ n d ɛ r ɛ	p ɛ n d eː r ɛ
ɪ m b ɛ r b ɛ m	ɪ m b ɛ r b ɛ m
t r ɔ n ʊ m	tʰ r ɔ n ʊ m
k ʊ m n k ɪ nː ɪ t aː t ɛ m	k ɔ ŋ k ɪ nː ɪ t aː t ɛ m
t ɔ r p oː r ɛ	t ɔ r p oː r ɛ m
l a b oː r ɛ m	l a b oː r ɛ m
d ɛ k ɛ r n ɛ r ɛ	d eː k ɛ r n ɛ r ɛ
aː s t r ɪ ŋ g ɛ r ɛ	a s t r ɪ ŋ g ɛ r ɛ
k ɔ ŋ g r ʊ	k ɔ ŋ g r ʊː m
a k oː n ɪ t ʊ m	a k ɔ n iː t ʊ m
a pː a r iː r ɛ	a pː aː r eː r ɛ
m a n aː r ɛ	m aː n aː r ɛ
s k ɛ n t ɪ lː a m	s k ɪ n t ɪ lː a m
p a s t a m	p a s t a m
ɛ m ɪ k r a n j a m	h eː m ɪ k r aː n j a m
aː ŋ ɛ lː ɔ	a ŋ n ɛ lː ʊ m
k ɔ n t ɪ n w ʊ	k ɔ n t ɪ n ʊː m
g a lː ɛ g ʊ m	g a lː aɪ k ʊ m
z n d aː l ʊ m	z ɪ n z a l a m
k ɔ n t r a w n ɪ r	k ɔ n t r aː w ɛ n iː r ɛ
p a t ɪ k r ɛ	p a t iː
ɛ w oː r j ʊ m	ɛ b ʊ r
ɛ r b oː s ʊ m	h ɛ r b oː s ʊ m
k ɔ l ʊ m b ɪ n ʊ m	k ɔ l ʊ m b iː n ʊ m
s ʊ b aː k ɛ r ɛ	s ʊ b j a k eː r ɛ
d ɛ s t r uː g ɪ r ɛ	d eː s t r ʊ ɛ r ɛ
l a t ɪ t uː d ɪ n ɛ m	l aː t ɪ t uː d ɪ n ɛ m
ʊ m m ɛ n t ʊ m	oː m ɛ n t ʊ m
a d ɔ r a t j oː n ɛ m	a d oː r aː t j oː n ɛ m
ʊ s ʊ r a m	uː s uː r a m
d ɛ l ɪ b ɛ r a t j oː n ɛ m	d eː l iː b ɛ r aː t j oː n ɛ m
k a m t ɛ lː ʊ m	k a t ɛ lː ʊ m
d z aː n k aː	z a ŋ kʰ a m
d ɛ p aː r t ɪ r	d eː p a r t iː r ɛ
aː nː ɔ n a m	a nː oː n a m
k ɪ r k oː n f l ʊ ɪ r ɛ	k ɪ r k ʊ m f l ʊ ɛ r ɛ
aː lː ɛ k t aː r ɛ	a lː ɛ k t aː r ɛ
l ʊ k t aː r ɛ	l ʊ k t aː r iː
ɛ fː ʊ n d ɪ r ɛ	ɛ fː ʊ n d ɛ r ɛ
p aː l ɛ s t r a m	p a l aɪ s t r a m
k ɔ l ʊ m b a m	k ɔ l ʊ m b a m
p r ɔ p ɪ n kʷ ɪ t aː t ɛ m	p r ɔ p ɪ ŋ kʷ ɪ t aː t ɛ m
k ɔ mː ɛ t ɛ r ɛ	k ɔ mː ɪ tː ɛ r ɛ
b ʊ b ɔ n ɪ k ʊ m	b uː b oː n ɪ k ʊ m
aː b s k ʊ s ʊ m	a b s k ɔ n s ʊ m
aː m s a	a s k j a m
f aː r ɛ t r a m	pʰ a r ɛ t r a m
aː l a m	aː l ɛ m
k a l oː r ɛ	k a l oː r ɛ m
s ʊ mː ʊ m	s ʊ mː ʊ m
f eː r j a m	f eː r j aː s
ɪ n k ɔ l ʊ m ɛ m	ɪ ŋ k ɔ l ʊ m ɛ m
aʊ k s ɪ l j aː r ɛ	aʊ k s ɪ l j aː r ɛ m
ɪ n f ɛ m l ɪ k ɛ	iː n f eː l iː k ɛ m
w ɛ r ɛ m k oː n d ʊ m	w ɛ r eː k ʊ n d ʊ m
t ɔ r t ʊ m	t ɔ r t ʊ m
m ɪ l j aː r ʊ m	m iː lː j aː r j ʊ m
ɪ m p r ɛ ɔ b aː r ɛ	ɪ m p r ɔ b aː r ɛ
t r ɪ lː ʊ m	t r iː b ʊ l ʊ m
s uː pː oː n ɛ	s ʊ pː oː n ɛ r ɛ
ɛ n k ɔ m j ʊ m	ɛ ŋ k oː m j ʊ m
k ɔ mː ɪ sː j oː n ɛ m	k ɔ mː ɪ sː j oː n ɛ m
r ɛ p r ɔ w aː r ɛ	r ɛ p r ɔ b aː r ɛ
s t ɔ l ɪ d ʊ m	s t ɔ l ɪ d ʊ m
aː n t aː r ɛ	j ɛ n t aː r ɛ
a n s a m	aː n s a m
k s p ʊ r g a m r ɛ	ɛ k s p ʊ r g aː r ɛ
k ɔ m p r a t oː r ɛ	k ɔ m p a r aː t oː r ɛ m
aː k ʊ p a	a kʷ a m
t r a n s f ɛ r ɛ r ɛ	t r aː n s f ɛ rː ɛ
p r ɔ k r a s t ɪ n aː r ɛ	p r oː k r aː s t ɪ n aː r ɛ
k ɔ r t ɛ m	k oː r t ɛ m
d ɪ fː a m aː r ɛ	d ɪ fː aː m aː r ɛ
uː m ɪ d ʊ m	uː m ɪ d ʊ m
oː w eː l a m	ɔ w ɪ k ʊ l a m
f ɪ m ʊ m	f ɪ m ʊ m
k ɔ n s ʊ p t j oː n ɛ m	k oː n s uː m p t j oː n ɛ m
a w a l aː n k a	l aː b iː n a m
s ɛ ŋ t ɪ r ɛ	s ɛ n t iː r ɛ
a r aː t r ʊ m	a r aː t r ʊ m
ɛ n ɛ r w aː r ɛ	eː n ɛ r w aː r ɛ
k ɪ k m ʊ m	k ɪ kː ʊ m
ɪ n f l uː iː r ɛ	iː n f l ʊ ɛ r ɛ
a b j ɛ m k t j oː n ɛ m	a b ɪ ɛ k t j oː n ɛ m
d uː k ɪ r ɛ	d uː k ɛ r ɛ
a r k ɪ b ɪ s k ʊ m p ʊ m	a r kʰ ɪ ɛ p ɪ s k ɔ p ʊ m
ɪ s t a m	ɪ s t a m
d ɛ l a t j oː n ɛ m	d eː l aː t j oː n ɛ m
m ʊ n t w oː s ʊ m	m ɔ n t ʊ oː s ʊ m
ɛ w ɔ l uː t j oː n ɛ	eː w ɔ l uː t j oː n ɛ m
ɛ s k ɔ p r ʊ m	s k a l p r ʊ m
t r ɛ p ɪ d ʊ m	t r ɛ p ɪ d ʊ m
ɛ t ɛ r ɛ ʊ m	aɪ tʰ ɛ r j ʊ m
w ɛ t ʊ s t aː	w ɛ t ʊ s t aː t ɛ m
ɛ m ʊ l a t oː r ɛ	aɪ m ʊ l aː t oː r ɛ m
ɪ n ʊ l t ʊ m	ɪ n ʊ l t ʊ m
s ɪ r p ʊ m	s k ɪ r p ʊ m
f uː l k r ʊ m	f ʊ l k r ʊ m
p aː r s ɪ m ɔ n j a m	p a r s ɪ m oː n j a m
m ɪ ŋ g ɛ r ɛ	m ɪ ŋ g ɛ r ɛ
p ʊ n t ʊ m	p uː ŋ k t ʊ m
p a r ɪ ɛ t aː l ɛ	p a r ɪ ɛ t aː l ɛ m
aː r d w ʊ m	a r d ʊː m
w ɪ n oː s ʊ m	w iː n oː s ʊ m
ɛ l ɪ m ɪ n a t j oː n ɛ m	eː l ɪ m ɪ n aː t j oː n ɛ m
t ɛ m ɛ r ɪ t aː t ɛ m	t ɛ m ɛ r ɪ t aː t ɛ m
p oː pː a m	p ʊ pː ɛ m
k a l a m ɪ t aː t ɛ m	k a l a m ɪ t aː t ɛ m
p aː r t ɪ k ʊ l a m	p a r t ɪ k ʊ l a m
k ɛ rː aː r ɛ	s ɛ r ɛ r ɛ
aː r ʊ s p ɪ k ɛ	h a r ʊ s p ɪ k ɛ m
b a r ɪ t oː n ʊ	b a r y t ɔ n ʊ m
n ʊ m ɛ m r aː r ɛ	n ʊ m ɛ r aː r ɛ
ɪ n t ɛ r m ɛ t ɛ r ɛ	ɪ n t ɛ r m ɪ tː ɛ r ɛ
p ɛ r m ɪ sː j oː n ɛ m	p ɛ r m ɪ sː j oː n ɛ m
d ɛ m s ɛ m m n aː r ɛ	d eː s ɪ ŋ n aː r ɛ
k a k t ɪ w ʊ m	k a p t iː w ʊ m
k ɛ r ɛ m ɔ n j aː l ɛ	k aɪ r ɪ m oː n j aː l ɛ m
aː n k a n ɛ m t ɛ r ɛ	ɪ ŋ k aː n eː s k ɛ r ɛ
ɪ n f ɛ s t a m r ɛ	iː n f ɛ s t aː r ɛ
l ʊ n ʊ l a m	l uː n ʊ l a m
ɛ l ʊ ɛ r ɛ	eː l ʊ ɛ r ɛ
aː b s k ʊ n d ɛ r ɛ	a b s k ɔ n d ɛ r ɛ
ɛ l ɛ n k ʊ m	ɛ l ɛ ŋ kʰ ʊ m
ɔ rː ɛ n d ʊ m	h ɔ rː ɛ n d ʊ m
k ɛ r k aː r ɛ	k ɪ r k aː r ɛ
ɛ s k ɔ t ɛ r ɛ	ɛ k s k ʊ t ɛ r ɛ
r ɛ l a k s a t j oː n ɛ m	r ɛ l a k s aː t j oː n ɛ m
s a ŋ gʷ ɪ n oː s ʊ m	s a ŋ gʷ ɪ n oː s ʊ m
f uː r ɪ b ʊ n d ʊ	f ʊ r ɪ b ʊ n d ʊ m
m ɛ r ɛ m t r ɪ k j ʊ m	m ɛ r ɛ t r iː k j ʊ m
t j ʊ m	tʰ iː ʊ m
k a t ɛ d r aː l ɛ	k a tʰ ɛ d r aː l ɛ m
n ʊ n t j ʊ m	n uː n t j ʊ m
w a k ɪ lː a t j oː n ɛ m	w a k ɪ lː aː t j oː n ɛ m
s ʊ n ɪ t ʊ m	s ɔ n ɪ t ʊ m
d ʊ l k oː r ɛ m	d ʊ l k oː r ɛ m
k ɔ n s uː l t a t j oː n ɛ m	k oː n s ʊ l t aː t j oː n ɛ m
s a l uː b r ɪ t aː t ɛ m	s a l uː b r ɪ t aː t ɛ m
a b sː ɔ l b ɛ r ɛ	a b s ɔ l w ɛ r ɛ
p ɔ r t aː r ɛ	p ɔ r t aː r ɛ
k f ɪ l ʊ l oː	f iː l ɪ ɔ l ʊ m
ʊ m l ɪ r ɛ	ɔ l eː r ɛ
p aː t r j a m	p a t r j a m
t r a n s k r ɪ w ɛ r ɛ	t r aː n s k r iː b ɛ r ɛ
p j ɛ r n a	p ɛ r n a m
w ɛ r n ɪ k ɛ	w ɛ r n iː k ɛ m
ɪ mː a g ɪ n a t ɪ w ʊ m	ɪ m aː g ɪ n aː t ɪ w ʊ m
p ɛ r t ɛ n k ɛ r ɛ	p ɛ r t ɪ n eː r ɛ
ɪ m p ɛ r ɪ t j a m	ɪ m p ɛ r iː t j a m
t aː k sː aː t j ʊ m n ɛ m	t a k s aː t j oː n ɛ m
ɛ fː l uː ɪ r ɛ	ɛ fː l ʊ ɛ r ɛ
ɪ m p ɔ r t uː n ɪ t aː t ɛ m	ɪ m p ɔ r t uː n ɪ t aː t ɛ m
f ɔ r n ɪ k s ɛ m	f ɔ r n ɪ k ɛ m
p ɛ k uː n j aː r j ʊ m	p ɛ k uː n j aː r j ʊ m
b ʊ k ɪ n aː	b uː k ɪ n a m
g ɛ mː uː l a m	g ɛ mː ʊ l a m
aː s ɛ lː a m	a s k ɛ lː a m
ɪ n w ɛ n t r ɪ k ɛ	ɪ n w ɛ n t r iː k ɛ m
d ɛ s p ɛ r aː t ʊ m	d eː s p eː r aː t ʊ m
ɪ n k ɔ m ɔ d aː r ɛ	ɪ ŋ k ɔ mː ɔ d aː r ɛ
n a t a l ɪ t j ʊ m	n aː t aː l iː k j ʊ m
s ʊ b t ɪ l ɪ t aː	s ʊ b t iː l ɪ t aː t ɛ m
f ʊ n ɛ r ɪ ʊ m	f uː n ɛ r ɛu m
d uː r aː r ɛ	d uː r aː r ɛ
uː s ɛ r ɛ m	ɔ s t j aː r j ʊ m
aː s t ʊ lː a m	a sː ʊ l a m
t ɔ r t oː n ɛ m	t ɔ r t j oː n ɛ m
r ɛ g ʊ l a r ɪ t aː t ɛ m	r eː g ʊ l aː r ɪ t aː t ɛ m
r aː d ɪ kː j ʊ	r aː d iː k ʊ l a m
ɪ n s oː n t ɛ m	iː n s ɔ n t ɛ m
ɪ r m aː n d aː d ɛ m	g ɛ r m aː n ɪ t aː t ɛ m
s aː l m a m	s a g m a m
d ʊ m m ɛ n ɪ k aː l ɛ	d ɔ m ɪ n ɪ k aː l ɛ m
s k ʊ m j m ʊ l ʊ m	s k ɪ uː r ʊ m
k oː ɪ t ʊ m	k ɔ ɪ t ʊ m
f ɛ m ɔ r aː l ɛ	f ɛ m ɔ r aː l ɛ m
m w ɛ r ʊ m	w eː r ʊ m
k ɔ l ɔ m b ʊ m	k ɔ l ʊ m b ʊ m
p ɛ r ɪ m ɛ r ɛ	p ɛ r ɪ m ɛ r ɛ
t aː ŋ g ɛ r ɛ	t a ŋ g ɛ r ɛ
f j ɛ b ʊ m l ɛ	f l eː b ɪ l ɛ m
p ɪ nː aː k ʊ l ʊ m	p ɪ nː aː k ʊ l ʊ m
ɛ w oː r ʊ m	ɛ b ɔ r ɛu m
s k a l aː r ɛ	s k aː l aː r ɛ m
n ʊ m n aː r ɛ	n oː m ɪ n aː r ɛ
d ɪ sː ɛ k aː r ɛ	d ɪ sː ɛ k aː r ɛ
m a n d aː r ɛ	m a n d aː r ɛ
k ɔ n t r a dː ɪ k t oː r ɛ	k ɔ n t r aː d ɪ k t oː r ɛ m
ɪ n mː ɔ l a t j oː n ɛ m	ɪ mː ɔ l aː t j oː n ɛ m
ɔ s t ɪ l ɛ	h ɔ s t iː l ɛ m
aː l t ɪ sː ɪ m ʊ m	a l t ɪ sː ɪ m ʊ m
aʊ t ɔ nː aː l ɛ	aʊ t ʊ m n aː l ɛ m
aː gː l ʊ t ɪ n a m r ɛ	a gː l uː t ɪ n aː r ɛ
k ɔ n s ɛ m kʷ ɪ r ɛ	k oː n s ɛ kʷ iː
t r aː s f ʊ n d ɛ r ɛ	t r aː n s f ʊ n d ɛ r ɛ
t ɛ n s ʊ r a m	k eː n s uː r a m
ɪ n ɛ m mː ʊ t aː r ɛ	ɪ mː uː t aː r ɛ
ɪ n k ɔ n w ɛ n ɪ ɛ n t ɛ m	ɪ ŋ k ɔ n w ɛ n ɪ ɛ n t ɛ m
a n ɪ m aː l ɛ	a n ɪ m a l
l ɪ b ɪ d ɔ	l ɪ b iː d ɪ n ɛ m
aː l k j ɔ n	a l k y ɔ n ɛ m
ɛ n ɪ ʊ m	a eː n ɛu m
f ɪ m b r j aː t ʊ m	f ɪ m b r j aː t ʊ m
ɛ p ɪ s t ɔ l a m	ɛ p ɪ s t ɔ l a m
l ɛ k t oː r ɛ	l eː k t oː r ɛ m
p r ɛ w aː l eː r ɛ	p r aɪ w a l eː r ɛ
m uː g ɪ r ɛ	m uː g iː r ɛ
t r a n s m ɪ g r a m r ɛ	t r aː n s m ɪ g r aː r ɛ
a f j aː n t aː r ɛ	a fː ɪ d ɛ n t j aː r ɛ
k aː s ʊ m	k aː s ʊ m
l ɛ n t ɛ r n aː	l a n t ɛ r n a m
p l ʊ m b aː r ʊ m	p l ʊ m b aː r j ʊ m
k uː k ʊ r k b ɪ t a m	k ʊ k ʊ r b ɪ t a m
k ʊ m k ʊ lː a m	k ʊ k ʊ lː a m
f r a t ɛ r n aː l	f r aː t ɛ r n aː l ɛ m
a n t ɛ k ɛ d ɛ r ɛ	a n t ɛ k eː d ɛ r ɛ
k uː l t ʊ m	k ʊ l t ʊ m
ɛ l ɪ m ɪ n aː r ɛ	eː l iː m ɪ n aː r ɛ
m ɛ t r k ʊ m	m ɛ t r ʊ m
s a k r aː r j ʊ m	s a k r aː r j ʊ m
m ʊ l t aː r ɛ	m ʊ l t aː r ɛ
s ʊ m t ʊ m	s uː m p t ʊ m
r ɛ k ɛ sː ɪ w ʊ m	r ɛ k ɛ sː iː w ʊ m
w aː lː aː r ɛ	w a lː aː r ɛ
m ɛ t a	m eː t a m
s ɪ k aː r j ʊ m	s iː k aː r j ʊ m
f ɛ d ɛ l ɪ t t aː	f ɪ d eː l ɪ t aː t ɛ m
w aː r ɛ	w eː n aː r iː
k a p t uː r a m	k a p t uː r a m
a l ʊ m nː ʊ m	a l ʊ m n ʊ m
g ɛ n ɛ s t a	g ɛ n ɛ s t a m
n ɔ w ɪ t j ʊ m	n ɔ w iː k j ʊ m
