aː lː ɛ k t aː r ɛ	a lː ɛ k t aː r ɛ
f l uː w j aː l ɛ	f l ʊ w j aː l ɛ m
aː n s ʊ m	ɛ k s a g j ʊ m
k a m p ɛ s t r ɛ m	k a m p ɛ s t r ɛ m
d ɛ p r ɛ d aː t j ʊ m n ɛ m	d eː p r aɪ d aː t j oː n ɛ m
ɪ n mː ɛ d j aː t ʊ m	ɪ mː ɛ d j aː t ʊ m
r aː p ɪ r ɛ	r a p ɛ r ɛ
a sː ɪ d ʊ m	a sː ɪ d ʊː m
ɪ n k ɛ n s ʊ m	ɪ ŋ k eː n s ʊ m
r ɛ g l aː r ɛ	r eː g ʊ l aː r ɛ
w ɔ t ɪ f ɛ r aː r ɛ	w oː k ɪ f ɛ r aː r iː
p r ɔ p a g a t j oː n ɛ m	p r oː p aː g aː t j oː n ɛ m
g ʊ s t ʊ m	g ʊ s t ʊ m
p ɛ r d r ɪ k	p ɛ r d iː k ɛ m
a r gʷ ɛ r ɛ	a r gʷ ɛ r ɛ
m ʊ r ɪ r ɛ	m ɔ r iː
f m ɪ m b r j aː t ʊ m	f ɪ m b r j aː t ʊ m
s aː m ʊ w eː r ɛ	eː m ɔ w eː r ɛ
t ʊ s oː n ɛ m	t oː n s j oː n ɛ m
w ɛ t ʊ s t ʊ m	w ɛ t ʊ s t ʊ m
b a p t ɪ s t a m	b a p t ɪ s t a m
p aː r	p a r ɛ m
ɪ n s ɪ ŋ n ɛ m	iː n s ɪ ŋ n ɛ m
b a j ʊ m	b a d j ʊ m
ɪ ŋ g ɛ n ɛ d r aː r ɛ	ɪ ŋ g ɛ n ɛ r aː r ɛ
p ɔ s t ʊ l aː r ɛ	p ɔ s t ʊ l aː r ɛ
n ɛ f aː r j ʊ m	n ɛ f aː r j ʊ m
s m ɛ r a l d ʊ m	s m a r a g d ʊ m
s a l k ɛ t ʊ m	s a l ɪ k eː t ʊ m
f ɪ d ʊ j a m	f iː d uː k j a m
m ɛ r ʊ m	m ɛ r ʊ m
ɪ n t t r ʊ k t j oː n ɛ m	iː n s t r ʊ k t j oː n ɛ m
r ɛ l a t ɪ w ʊ m	r ɛ l aː t iː w ʊ m
ɪ n k ʊ rː ɛ r ɛ	ɪ ŋ k ʊ rː ɛ r ɛ
aː ŋ g ʊ s t aː r ɛ	a ŋ g ʊ s t aː r ɛ
w ɪ n aː k a m	w iː n aː k ɛu m
r ɔ m aː k ɛ	r ʊ m ɪ k ɛ m
k a t ɪ n ʊ m	k a t iː n ʊ m
p ɛ r m ɪ sː j oː n ɛ m	p ɛ r m ɪ sː j oː n ɛ m
n ɛ g l ɪ j ɛ r ɛ	n ɛ g l ɛ g ɛ r ɛ
ʊ s ɪ t aː r ɛ	uː s ɪ t aː r iː
t ɛ rː ɛ m ɔ t ʊ m	t ɛ rː aɪ m ɔ t ʊ m
p ɛ n ɛ t r aː r ɛ	p ɛ n ɛ t r aː r ɛ
k ɔ m p l ɛ t ʊ m	k ɔ m p l eː t ʊ m
w ɪ s k j ʊ m	w ɪ s k ʊ m
s ɛ n aː r ɛ	s ɪ ŋ n aː r ɛ
a b ɔ rː ɪ r ɛ	a b h ɔ rː eː r ɛ
s ɪ k k ɪ aː t ɛ m	s ɪ kː ɪ t aː t ɛ m
d uː k ɪ r ɛ	d uː k ɛ r ɛ
r ʊ t ʊ m	r uː k t ʊ m
kʷ j ɛ t a n t a m	kʷ ɪ eː t a n t j a m
k ɛ r t ɪ t uː m d ɪ n ɛ	k ɛ r t ɪ t uː d ɪ n ɛ m
ɔ s t ɪ l ɛ	h ɔ s t iː l ɛ m
m ɔ r t aː r j ʊ m	m ɔ r t w aː r j ʊ m
ɪ n t m ɛ rː ʊ m p ɛ r ɛ	ɪ n t ɛ rː ʊ m p ɛ r ɛ
d ɪ s p ɛ r k ɪ r ɛ	d ɪ s p ɛ r iː r ɛ
d ɔ m ɛ s t ɪ k ʊ m	d ɔ m ɛ s t ɪ k ʊ m
kʷ ɛ s ɪ t ʊ m	kʷ aɪ s iː t ʊ m
l a s ɪ r ɛ	l ɪ k eː r ɛ
k ɔ n k ʊ s j oː n	k ɔ ŋ k ʊ sː j oː n ɛ m
a b s t ɛ m j ʊ m	a b s t eː m j ʊ m
l ʊ n t r a m	l ʊ t r a m
l ʊ t ʊ m	l uː k t ʊ m
p a r t ɪ r ɛ	p a r t iː r ɛ
t ɔ g a m	t ɔ g a m
p ɪ s aː r ɛ	p iː n s ɛ r ɛ
n ʊ m ɛ r oː s ʊ m	n ʊ m ɛ r oː s ʊ m
s ɛ m ɛ n	s eː m ɛ n
m a t r ɪ k ʊ l a m	m aː t r iː k ʊ l a m
l ɪ n ɪ t aː r ɛ	l iː m ɪ t aː r ɛ
l ɛ n t ɛ r n a m	l a n t ɛ r n a m
ɔ r t ɔ g r a f j a m	ɔ r tʰ ɔ g r a pʰ j a m
k ɛ r oː s ʊ m	k eː r oː s ʊ m
m ʊ s t ʊ m	m ʊ s t ʊ m
r ɛ p ɛ lː ɛ r ɛ	r ɛ p ɛ lː ɛ r ɛ
ɔ l f a t ɔ r j ʊ m	ɔ l f a k t oː r j ʊ m
ʊ s t j ʊ m	oː s t j ʊ m
k ɔ n f ɛ d ɛ r a t j oː n ɛ m	k oː n f ɔ ɪ d ɛ r aː t j oː n ɛ m
a n ɛ l ʊ m	a nː ɪ k ʊ l ʊ m
w ɛ t r ɪ k ɛ	w iː t ɪ k ɛ m
b ɛ t uː lː ɛ m	b ɛ t ʊ l a m
s aː t ɪ r ʊ m	s a t y r ʊ m
k ɔ m p ɛ t ɪ t oː r ɛ	k ɔ m p ɛ t iː t oː r ɛ m
m ɛ d j aː l ɛ	m ɛ d j aː l ɛ m
l a b ʊ r a t oː r ɛ	l a b oː r aː t oː r ɛ m
ɔ l ɪ g aː r k ɪ k ʊ m	ɔ l ɪ g a r kʰ ɪ k ʊ m
m ɔ s t r w ʊ s ʊ m	m oː n s t r ʊ oː s ʊ m
g aː t a m	k a tː a m
a b ɪ t aː r ɛ	h a b ɪ t aː r ɛ
l ɪ m ʊ m	l iː m ʊ m
g ɪ b ʊ m	g ɪ bː ʊ m
f ɛ r a m j ɛ n t a m	f ɛ rː aː m ɛ n t ʊ m
g ʊ g aː l	j ʊ g aː l ɛ m
ɪ d ɛ n t ɪ d aː d ɛ m	iː d ɛ n t ɪ t aː t ɛ m
p ʊ p ɪ lː a m	p uː p ɪ lː a m
d ɛ s w ɛ l aː r ɛ	eː w ɪ g ɪ l aː r ɛ
aː g r ʊ m	a g r ʊ m
t r aː m ɪ t ɛ m	t r aː m ɪ t ɛ m
a r b uː s t ɪ w ʊ m	a r b ʊ s t iː w ʊ m
a k t aː r ɛ	aː k t w aː r ɛ
p aː l a m	p aː l a m
k ɔ t ɔ r n ɪ k ɛ	k oː t ʊ r n iː k ɛ m
k ɔ ŋ g ʊ r aː r ɛ	k ɔ n ɪ uː r aː r ɛ
a d ɔ r m ɪ r ɛ	a dː ɔ r m iː r ɛ
k a n t oː n ɛ m	k a n t j oː n ɛ m
k ɔ n k ʊ l k aː r ɛ	k ɔ ŋ k ʊ l k aː r ɛ
a n s a m	aː n s a m
kʷ ɛ r ɪ m ɔ n j a m	kʷ ɛ r ɪ m oː n j a m
a m kː ɪ s ɪ t j oː n ɛ	a kː w ɪ s iː t j oː n ɛ m
l ʊ s k ʊ m	l ʊ s k ʊ m
s ʊ s p ɛ n s j oː n ɛ m	s ʊ s p eː n s j oː n ɛ m
g r aː k ɪ l ɛ	g r a k ɪ l ɛ m
t r ɪ f oː l	t r ɪ f ɔ l j ʊ m
k aː p r ʊ m n	k a p r ʊ m
r ɛ d ɪ t ʊ m	r ɛ d ɪ t ʊ m
p uː r ɪ n ʊ m	p uː r ɛ m
k aː r ɛ n a m	k a r iː n a m
m ɔ t j oː n ɛ m	m oː t j oː n ɛ m
p aː r aː g r aː f ʊ m	p a r a g r a pʰ ʊ m
g r a n d ɪ n ʊ m	g r a n d ɪ n ɛ m
a b s t r ɛ r ɛ	a b s t r a h ɛ r ɛ
d ɛ k r ɛ t aː l ɛ	d eː k r eː t aː l ɛ m
b a l ɛ n a m	b a lː aɪ n a m
ʊ d ɪ t ʊ m	aʊ d iː t ʊ m
p ɛ r t ɛ n t ɛ r ɛ	p ɛ r t ɪ n eː r ɛ
w ɪ t r ʊ m	w ɪ t r ʊ m
w ɔ g aː r ɛ	w ɔ k aː r ɛ
d ʊ b l ʊ m	d ʊ p l ʊ m
s a ŋ ŋ ɪ r aː r ɛ	s a ŋ gʷ ɪ n aː r ɛ
a t ɛ n d ɛ r ɛ	a tː ɛ n d ɛ r ɛ
k ɔ r ɔ n ɪ d ɛ m	k ɔ r oː n ɪ d ɛ m
w ɪ lː a m n ʊ m	w iː lː aː n ʊ m
ɪ m w ɛ t r aː r ɛ	ɪ n w ɛ t ɛ r aː r ɛ
s ʊ b j aː k ɛ r ɛ	s ʊ b j a k eː r ɛ
m ɛ n t ʊ m n	m ɛ n t ʊ m
p aː w ɪ d ʊ m	p a w ɪ d ʊ m
l uː b r ɪ k aː r ɛ	l uː b r ɪ k aː r ɛ
l ɛ p r a m	l ɛ p r a m
s ʊ l k aː r ɛ	s ʊ l k aː r ɛ
w ɪ t ʊ p ɛ r aː t j oː n ɛ m	w ɪ t ʊ p ɛ r aː t j oː n ɛ m
p ʊ t aː r ɪ m	p ʊ t aː r ɛ
ɪ t ɛ r aː r ɛ	ɪ t ɛ r aː r ɛ
k ɔ n w ɪ k t j oː n ɛ	k ɔ n w iː k t j oː n ɛ m
w ɛ r ɛ k ʊ n d j a m	w ɛ r eː k ʊ n d j a m
p l ɛ n ɪ t ɛ m	p l eː n ɪ t aː t ɛ m
kʷ ɔ t ɪ d j aː n ʊ m	k ɔ t iː d j aː n ʊ m
k ɔ d ɪ k ɪ lː ʊ m	k oː d ɪ k ɪ lː ʊ m
k r ɛ m aː r ɛ	k r ɛ m aː r ɛ
p ɛ t ʊ m	p eː d ɪ t ʊ m
s t aː t ɛ r a m	s t a t eː r a m
p r ɛ m ɔ n ɪ t ɔ r ɛ	p r aɪ m ɔ n ɪ t oː r ɛ m
r ɛ s t aʊ r aː r ɛ	r ɛ s t aʊ r aː r ɛ
d ɛ k ɪ m ʊ m	d ɛ k ɪ m ʊ m
aː g a t a m	a kʰ aː t eː n
m aː n ɪ p ʊ l ʊ m	m a n ɪ p ʊ l ʊ m
m aː g ɪ k ʊ m	m a g ɪ k ʊ m
f a l a ŋ g ɛ m	pʰ a l a ŋ g ɛ m
a k ʊ m ɪ n aː r ɛ	a k uː m ɪ n aː r ɛ
k ɔ r n j ɪ ʊ m	k ɔ r n ɛu m
l aʊ r t ʊ m	l aʊ r ɛ aː t ʊ m
p aː g ʊ r ʊ m	p a g uː r ʊ m
s a k ɛ r d ɔ t ɛ m	s a k ɛ r d oː t ɛ m
p ʊ k ʊ m	p aʊ k ʊ m
a r k ɛ b ɛ s k p ʊ m	a r kʰ ɪ ɛ p ɪ s k ɔ p ʊ m
k ɔ m uː n ɛ	k ɔ mː uː n ɛ m
k aː w aː l ɛ r ʊ m	k a b a lː aː r j ʊ m
k aː nː a m	k a nː a m
k ɔ m p r ɪ aː n s ɪ w ɛ l	k ɔ m p r ɛ h ɛ n s ɪ b ɪ l ɛ m
ɪ n k r ɛ m ɛ n t ʊ m	ɪ ŋ k r eː m ɛ n t ʊ m
aː r k a m	a r k a m
r ɛ w ɔ k a t j oː n ɛ m	r ɛ w ɔ k aː t j oː n ɛ m
t r ʊ n k aː r ɛ	t r ʊ ŋ k aː r ɛ
ɪ d oː n ɛ ʊ m	ɪ d oː n ɛu m
k ɔ n f l ʊ ɪ r ɛ	k oː n f l ʊ ɛ r ɛ
d ɔ m aː r ɛ	d ɔ m aː r ɛ
s ɛ r ɛ n aː r ɛ	s ɛ r eː n aː r ɛ
p ɛ t ɪ r ɛ	p ɛ t ɛ r ɛ
k ɔ p ɛ r a t j oː n ɛ m	k ɔː p ɛ r aː t j oː n ɛ m
j aː d ɛ m	iː l ɛ
p r ɛ k l aː r ʊ m	p r aɪ k l aː r ʊ m
m ɪ l ɛ m	m iː lː j a
ɛ k s k r ɛ m ɛ n t ʊ m	ɛ k s k r eː m ɛ n t ʊ m
ɪ n t r ɪ n t ɛ k ʊ m	ɪ n t r iː n s ɛ k ʊ m
ɔ s p ɪ t j ʊ m	aʊ s p ɪ k j ʊ m
g l ɔ r j aː r ɛ	g l oː r j aː r iː
n ʊ b ɛ	n uː b ɛ m
p ʊ t r ɪ r ɛ	p ʊ t r ɛ r ɛ
ɔ r ɛ k ʊ j a m	ɔ r ɪ k l a m
ɔ b t ɛ m p ɛ r aː r ɛ	ɔ b t ɛ m p ɛ r aː r ɛ
w ɛ n ɛ t m m ʊ m	w ɛ n ɛ t ʊ m
k ɔ n d ɔ n aː r ɛ	k ɔ n d oː n aː r ɛ
p r ɛ p oː n ɛ	p r aɪ p oː n ɛ r ɛ
f ɛ r ɛ t r ʊ m	f ɛ r ɛ t r ʊ m
b a r b aː t ʊ m	b a r b aː t ʊ m
p aː s ɛ r ʊ	p a sː ɛ r ɛ m
ɪ l a t ɪ w ʊ m	ɪ lː aː t iː w ʊ m
n ɔ m ɪ n a t j oː n ɛ	n oː m ɪ n aː t j oː n ɛ m
d ɪ p r ɛ n d ɛ r ɛ	d eː p r ɛ h ɛ n d ɛ r ɛ
ɔ fː ɪ k ɪ n a m	ɔ fː ɪ k iː n a m
f ɛ t ɪ d ʊ m	f eː t ɪ d ʊ m
f r a ŋ g ɛ r ɛ	f r a ŋ g ɛ r ɛ
d ɛ k ɛ t ɔ r j ʊ m	d ɛ k ɛ p t oː r j ʊ m
t ɛ d ʊ l a m	s kʰ ɛ d ʊ l a m
s k ɪ n d ɛ r ɛ	s k ɪ n d ɛ r ɛ
ɪ m p ɛ r t ɛ p t ɪ b l	ɪ m p ɛ r k ɛ p t ɪ b ɪ l ɛ m
p r ɛ s a g j aː r ɛ	p r aɪ s aː g iː r ɛ
b l eː m t ɛ m aː	b l a s pʰ eː m aː r ɛ
p ɛ d ɛ s t r ɛ m	p ɛ d ɛ s t r ɛ m
kʷ a d r aː r ɛ	kʷ aː d r aː r ɛ
p ɔ l ʊ ɛ r ɛ	p ɔ lː ʊ ɛ r ɛ
k ʊ p r ɛ m h	k uː p r ʊ m
w ɛ r g ɪ ɛ l ɛ	w ɪ r ɪ d aː r j ʊ m
ʊ l k ɛ r a m	ʊ l k ʊ s
s ʊ b r ɔ g aː r ɛ	s ʊ b r ɔ g aː r ɛ
d ɛ r ʊ ɛ r ɛ	d iː r ʊ ɛ r ɛ
ɔ p ʊ l ɛ n t j a m	ɔ p ʊ l ɛ n t j a m
l ɪ b ɛ r a t j oː n ɛ m	l iː b ɛ r aː t j oː n ɛ m
w aː n ɪ	w a nː ʊ m
a d ɔ r m ɛ t ɛ r ɛ	a dː ɔ r m iː s k ɛ r ɛ
ɪ lː ɛ g aː l ɛ	ɪ lː eː g aː l ɛ m
a m p ɔ lː a m	a m p ʊ lː a m
ɪ n mː a r k ɛ s ɪ b ɪ l ɛ	ɪ mː a r k ɛ s k ɪ b ɪ l ɛ m
a s t ʊ r ɛ	a s t ʊ r ɛ m
t r ɛ p ɪ d a t j oː n ɛ m	t r ɛ p ɪ d aː t j oː n ɛ m
p a l oː	p aː l ʊ m
b r ɪ n k l ʊ m	w ɪ ŋ k ʊ l ʊ m
r ʊ g ʊ m s ʊ m	r uː g oː s ʊ m
g ɔ k ʊ n d ʊ m	j uː k ʊ n d ʊ m
d ɪ s t ɪ n k t ʊ m	d ɪ s t ɪ ŋ k t ʊ m
g aː n ʊ m r ɛ	g a n aː r ɛ
n uː t r ɪ k aː r ɛ	n uː t r iː k aː r ɛ
f r ʊ s t a m	f r ʊ s t a m
ɔ b j ɛ k t ʊ m	ɔ b ɪ ɛ k t ʊ m
b ɪ l ɛ m	b iː l ɛ m
a f j aː n t aː r ɛ	a fː ɪ d ɛ n t j aː r ɛ
a s aː t aː r ɛ	a sː ɛ k t aː r iː
w ɔ l t aː r ɛ	w ɔ l uː t aː r ɛ
p r ɪ w aː t ʊ m	p r iː w aː t ʊ m
k ɔ k s aː l ɛ	k ɔ k s aː l ɛ m
a b a l ɪ ɛ n aː r ɛ	a b a l ɪ eː n aː r ɛ
g a l ɛ g ʊ m	g a lː aɪ k ʊ m
p ɪ k t oː r ɛ	p ɪ k t oː r ɛ m
k aː r a m	k a r a m
l aː m b ɪ r ɛ	l a m b ɛ r ɛ
m aː ŋ n ɪ t ʊ d ʊ m	m a ŋ n ɪ t uː d ɪ n ɛ m
s ɛ g r ɛ g aː r ɛ	s eː g r ɛ g aː r ɛ
ɛ k sː ɪ kː aː t j ʊ m n ɛ m	ɛ k sː ɪ kː aː t j oː n ɛ m
d ɛ t ɛ s t aː r ɛ	d eː t ɛ s t aː r iː
d ɛ s ɛ m n aː r ɛ	d eː s ɪ ŋ n aː r ɛ
s ɪ m j a m	s iː m j a m
ɛ kʷ a n ɪ m ɪ t aː t ɛ m	aɪ kʷ a n ɪ m ɪ t aː t ɛ m
l a k r ɪ m oː s ʊ m	l a k r ɪ m oː s ʊ m
ɛ k s t ɛ n s ɪ w ʊ m	ɛ k s t eː n s iː w ʊ m
kʷ ɛ s t j ɔ n aː r j ʊ m	kʷ aɪ s t j oː n aː r j ʊ m
ɛ s ɪ t aː r ɛ	h aɪ s ɪ t aː r ɛ
s ɔ b r ɛ w ɛ n ɪ r	s ʊ p ɛ r w ɛ n iː r ɛ
p ɔ n t ɪ f ɪ k aː t ʊ m	p ɔ n t ɪ f ɪ k aː t ʊ m
s p uː m aː r ɛ	s p uː m aː r ɛ
m a mː ɛ lː a m	m a m ɪ lː a m
a l iː	ɪ lː ʊ ŋ k
a n ɔ r m aː l	a n oː r m a l ʊ m
s t ɛ r k ʊ m	s t ɛ r k ʊ s
k ɪ k m ʊ m	k ɪ kː ʊ m
r ɛ t ɛ n ɛ r ɛ	r ɛ t ɪ n eː r ɛ
p r ɛ d a t oː r ɛ	p r aɪ d aː t oː r ɛ m
s ɛ d aː r ɛ	s eː d aː r ɛ
n aː l ɪ k a m	n a t ɛ m
l ɛ n ɛ	l eː n ɛ m
l a k ʊ s t r ɛ m	l a k ʊ s t r ɛ m
b aː r d ʊ m	b a r d ʊ m
k ɛ lː a m	k ɛ lː a m
a l j ɛ n aː r ɛ	a l ɪ eː n aː r ɛ
n ʊ t aː r ɛ	n uː t aː r ɛ
p r ɔ l ʊ ŋ g aː r ɛ	p r oː l ɔ ŋ g aː r ɛ
m ɛ d ɪ k aː r ɛ	m ɛ d ɪ k aː r ɛ
ɪ n d ɪ ŋ n ʊ m	ɪ n d iː ŋ n ʊ m
p r a n d ɛ r ɛ	p r a n d eː r ɛ
s aː n j ɛ m	s a n ɪ ɛ m
d ɛ t ɛ n t j oː n ɛ m	d eː t ɛ n t j oː n ɛ m
k aː pː l ʊ m	k a p ʊ l ʊ m
ɪ n d ɪ ŋ n ɪ t aː t ɛ m	ɪ n d ɪ ŋ n ɪ t aː t ɛ m
r ɛ k ɛ sː ɪ w ʊ m	r ɛ k ɛ sː iː w ʊ m
p ɔ sː ɛ sː j oː n ɛ m	p ɔ sː ɛ sː j oː n ɛ m
w a k a t j oː n ɛ m	w a k aː t j oː n ɛ m
a pː a r iː r ɛ	a pː aː r eː r ɛ
ɪ n k ɔ l a m	ɪ ŋ k ɔ l a m
ʊ k t j oː n ɛ m	uː ŋ k t j oː n ɛ m
t ɔ r aː r ɛ	t ɔ rː eː r ɛ
r ɛ p uː b l ɪ k a m	r ɛ m p uː b l ɪ k a m
s ɛ r w ɪ t uː d ɪ n ɛ m	s ɛ r w ɪ t uː d ɪ n ɛ m
ɔ s t ɛ n t aː r ɛ	ɔ s t ɛ n t aː r ɛ
k ɔ n t r ɪ s t aː r ɛ	k ɔ n t r iː s t aː r ɛ
d ɛ s k r ɪ p t j oː n ɛ m	d eː s k r iː p t j oː n ɛ m
p a k ɪ f ɪ k ʊ m	p aː k ɪ f ɪ k ʊ m
l ɛ mː a m	l ɛ mː a
s k a l aː r ɛ m	s k aː l aː r ɛ m
r oː d r ɛ ɪ k n	r ɪ d ɪ k a m
ɛ r ɪ m ʊ m	h ɛ r eː m ʊ m
k ɔ kː ɪ n ɪ l a m	k ɔ kː ɪ n a m
s oː n t ɛ m	s ɔ n t ɛ m
p ɛ k uː l j ʊ m	p ɛ k uː l j ʊ m
ɛ g r ʊ m	aɪ g r ʊ m
ɪ m p l ɪ k aː r ɛ	ɪ m p l ɪ k aː r ɛ
a s ɪ l ʊ m	a s y l ʊ m
r ɔ s m a r ɪ n ʊ m	r oː r ɛ mː a r iː n ʊ m
t a n t ʊ m	t a n t ʊ m
b ɛ s t j aː r j ʊ m	b eː s t j aː r j ʊ m
r uː b ɪ g ɪ n oː s ʊ m	r oː b iː g ɪ n oː s ʊ m
s ʊ fː r ʊ t ɪ k ɛ	s ʊ fː r ʊ t ɪ k ɛ m
ɪ n k a r n aː r ɛ	ɪ ŋ k a r n aː r ɛ
s k ɛ n t ɪ lː aː r ɛ	s k ɪ n t ɪ lː aː r ɛ
s ʊ p r ɛ m nː aː t ʊ r aː l ɛ	s ʊ p ɛ r n aː t uː r aː l ɛ m
w ɪ b r aː r ɛ	w ɪ b r aː r ɛ
k a l ɪ g ɪ n oː s ʊ m	k aː l iː g ɪ n oː s ʊ m
k ɔ n s t ɪ t ʊ t j oː n ɛ m	k oː n s t ɪ t uː t j oː n ɛ m
ɪ n t ɛ m p ɛ s t ɪ w ʊ m	ɪ n t ɛ m p ɛ s t iː w ʊ m
ɪ n d ɪ ŋ n a t j oː n ɛ m	ɪ n d ɪ ŋ n aː t j oː n ɛ m
aː b ɪ l ɛ	h a b ɪ l ɛ m
s ʊ n	s ɔ n ʊ m
d ɪ s k r ɛ p aː r ɛ	d ɪ s k r ɛ p aː r ɛ
a ŋ n aː t ʊ m	a ŋ n aː t ʊ m
ɪ m p ɛ d ɪ m ɛ n t ʊ m	ɪ m p ɛ d iː m ɛ n t ʊ m
w ɪ t ʊ m	w ɔ k ɪ t ʊ m
f j ɛ r ʊ m	f ɛ r ʊ m
ɔ fː ɪ k ʊ m s j ʊ m	ɔ fː ɪ k j oː s ʊ m
oː r ɪ ʊ m	h ɔ rː ɛu m
aː m k eː r	aː k r ɛ m
aʊ r ɪ g ɛ r ʊ m	aʊ r ɪ g ɛ r ʊ m
d oː n	d oː n ʊ m
k ɔ k ʊ m	k ɔ kʷ ʊ m
k ɔ m p ɛ l ɪ r ɛ	k ɔ m p ɛ lː ɛ r ɛ
s ɛ p ʊ l t ʊ r a m	s ɛ p ʊ l t uː r a m
ɪ m p ɔ r t ʊ n ɪ t aː t ɛ m	ɪ m p ɔ r t uː n ɪ t aː t ɛ m
ɪ n kʷ j ɛ t ʊ d ɪ n ɛ m	ɪ ŋ kʷ ɪ eː t uː d ɪ n ɛ m
w ɪ k ɪ n a m	w iː k iː n a m
w aː lː ɛ t ʊ m	w a lː ɛ tː ʊ m
l ʊ d ɪ b r j ʊ m	l uː d iː b r j ʊ m
d ɛ k ɪ m aː r ɛ	d ɛ k ɪ m aː r ɛ
p ɛ n ʊ r j a m	p eː n uː r j a m
m ɪ k a m	m iː k a m
s ɪ d ɛ r ɛ ʊ m	s iː d ɛ r ɛu m
b ɛ s t ɪ ɔ l a m	b eː s t ɪ ɔ l a m
a r g uː t j a m	a r g uː t j a m
a fː l ɪ g ɛ r ɛ	a fː l iː g ɛ r ɛ
a m a r ɪ g aː r ɛ	a m aː r ɪ k aː r ɛ
f l ɛ k t ɪ r ɛ	f l ɛ k t ɛ r ɛ
d ɪ sː ɪ m ʊ l aː t j ʊ m n ɛ m	d ɪ sː ɪ m ʊ l aː t j oː n ɛ m
ɪ ŋ g ʊ s t ʊ m	ɪ n ɪ uː s t ʊ m
g ɛ m ɪ n aː r ɛ	g ɛ m ɪ n aː r ɛ
d ɪ l ʊ ɪ r ɛ	d iː l ʊ ɛ r ɛ
l uː m ɪ n aː r ɛ	l uː m ɪ n aː r ɛ
k aː lː ɛ	k a lː ɛ m
r ɛ l ɪ k j a m	r ɛ l ɪ kʷ ʊ m
ɪ m p ʊ ŋ n aː r ɛ	ɪ m p ʊ ŋ n aː r ɛ
k ɔ n d ɛ nː a t j oː n ɛ m	k ɔ n d ɛ m n aː t j oː n ɛ m
k r ʊ ɛ m l d ɛ l t ɛ m	k r uː d eː l ɪ t aː t ɛ m
t r aː l a m	t r aː g ʊ l a m
ɪ m f aː n d ʊ m	iː n f a n d ʊ m
k ɔ n s ɪ l ʊ m	k oː n s ɪ l j ʊ m
ɔ b l ɪ g aː r ɛ	ɔ b l ɪ g aː r ɛ
w oː m ɪ t ʊ m	w ɔ m ɪ t ʊ m
r ʊ g a m	r uː g a m
m t ʊ r d ʊ m	t ʊ r d ʊ m
r ɛ l ɛ g aː r ɛ	r ɛ l ɛ g ɛ r ɛ
f oː n t ɛ m	f ɔ n t ɛ m
l ɔ k ʊ t j ʊ m n ɛ m	l ɔ k uː t j oː n ɛ m
w ɪ t ɛ m	w iː t ɛ m
b j ɛ nː ɛ	b ɪ ɛ nː ɛ m
m ʊ n ɪ k ɪ p aː l ɛ	m uː n ɪ k ɪ p aː l ɛ m
r a s k aː r ɛ	r aː d ɛ r ɛ
r eː m ʊ m	r eː m ʊ m
t r a n s g r ɛ d ɪ r ɛ	t r aː n s g r ɛ d iː
f r ɪ ɪ g ɪ d aː t ɛ m	f r iː g ɪ d ɪ t aː t ɛ m
p ɔ lː aː r j ʊ m	p ʊ lː aː r j ʊ m
s k ɔ r t a m	s k ɔ r t ɛ a m
m aː l f aː t oː r ɛ	m a l ɛ f a k t oː r ɛ m
t j ɔ	tʰ iː ʊ m
ɛ k s k ɛ sː ɪ w ʊ m	ɛ k s k ɛ sː ɪ w ʊ m
m ɔ d ɛ r a t oː r ɛ	m ɔ d ɛ r aː t oː r ɛ m
kʷ ɛ r ɛ l a m	kʷ ɛ r eː l a m
p ɛ r ɪ k l oː s ʊ m	p ɛ r iː k ʊ l oː s ʊ m
k ɔ n f ɪ r m a t j oː n ɛ m	k oː n f ɪ r m aː t j oː n ɛ m
p ɛ r g ʊ r j ʊ m	p ɛ r ɪ uː r j ʊ m
j uː d ɪ k a t oː r ɛ	j uː d ɪ k aː t oː r ɛ m
m ɔ w ɪ m ɛ n t ʊ m	m oː w ɪ m ɛ n t ʊ m
s p ɛ k t aː k ʊ l ʊ m	s p ɛ k t aː k ʊ l ʊ m
l ɪ b aː r ɛ	l iː b aː r ɛ
g r aː w ɪ d ʊ m	g r a w ɪ d ʊ m
ɪ n s ɔ m nː ɛ	iː n s ɔ m n ɛ m
r ɛ f r j ɛ n ɛ r	r ɛ f r eː n aː r ɛ
d ɛ w j aː t j ʊ m n ɛ m	d eː w j aː t j oː n ɛ m
s aː ɛ m w ɪ t aː t ɛ m	s w aː w ɪ t aː t ɛ m
ʊ r t ɪ k aː r j a m	ʊ r t iː k aː r j a m
k r ɪ m ɪ n oː s ʊ m	k r iː m ɪ n oː s ʊ m
k ɪ b ʊ m	k ɪ b ʊ m
ɔ l ɛ ɔ s ʊ m	ɔ l ɛ oː s ʊ m
d ʊ l ʊ r oː s ʊ m	d ɔ l oː r oː s ʊ m
f ɪ l ʊ	f l ʊ k t ʊ m
k ɔ n s ɛ kʷ ɛ n t j a m	k oː n s ɛ kʷ ɛ n t j a m
ɛ k s t ɔ r k ɛ r ɛ	ɛ k s t ɔ r kʷ eː r ɛ
m a t aː r ɛ	m a k t aː r ɛ
r ɛ f ɔ r m aː r ɛ	r ɛ f oː r m aː r ɛ
p r ɛ g ʊ s t a m r ɛ	p r aɪ g ʊ s t aː r ɛ
t ɛ l ɪ k ʊ m	k aɪ l ɪ k ʊ m
k a m b j ʊ m	k a m b j ʊ m
ɛ l oː s ʊ m	z eː l oː s ʊ m
t r aː m a m	t r aː m a m
p aː r d ʊ m	p a r d ʊ m
d j a l ɛ k t ʊ m	d j a l ɛ k t ɔ n
ʊ ŋ g ʊ l aː t ʊ m	ʊ ŋ g ʊ l aː t ʊ m
p r ɔ g r ɛ d ɪ r ɛ	p r oː g r ɛ d iː
k ɔ n t a m ɪ n a t j oː n ɛ m	k ɔ n t aː m ɪ n aː t j oː n ɛ m
k a l k ʊ l ʊ m	k a l k ʊ l ʊ m
k ɔ n s ɔ m aː r ɛ	k oː n s ʊ mː aː r ɛ
p r ɛ d aː r ɛ	p r aɪ d aː r iː
