f ɔ r t ɪ t uː d ɪ n ɛ m	f ɔ r t ɪ t uː d ɪ n ɛ m
k r ɛ d ɪ b ɪ l ɪ t aː t ɛ m	k r eː d ɪ b ɪ l ɪ t aː t ɛ m
k ɛ d ʊ l a m	s kʰ ɛ d ʊ l a m
l kʷ ɛ r m k ɛ m	kʷ ɛ r k ʊ m
k ʊ l t oː r ɛ	k ʊ l t oː r ɛ m
l a k r ɪ m aː t j ʊ m n ɛ m	l a k r ɪ m aː t j oː n ɛ m
ɪ n f a n t j a m	iː n f a n t j a m
g r a n d ɪ k ʊ m	g r a n d ɪ n ɛ m
p ɛ r ɪ k l oː s ʊ m	p ɛ r iː k ʊ l oː s ʊ m
r ɛ w ɛ r s aː r ɛ	r ɛ w ɛ r s aː r ɛ
p r ɔ m ɛ sː a m	p r oː m ɪ sː ʊ m
ɔ n oː r ɛ	h ɔ n oː r ɛ m
t oː n ɛ	t j oː n ɛ m
s w aː d ɪ r ɛ	s w aː d eː r ɛ
g ɛ l ʊ m	g ɛ l uː
s k aː p ʊ l a m	s k a p ʊ l a m
m ɛ d ɪ r ɛ	m eː t iː r iː
n uː t r ɪ k aː r ɛ	n uː t r iː k aː r ɛ
ɛ k s ɛ k r a m r ɛ	ɛ k sː ɛ k r aː r iː
k ɔ l oː n ʊ m	k ɔ l oː n ʊ m
m ɛ n d aː k ɛ m	m ɛ n d aː k ɛ m
ɛ kʷ ʊ m	aɪ kʷ ʊ m
f a r ɪ n oː s ʊ m	f a r iː n oː s ʊ m
ɪ n t ɛ r m ɛ t ɛ r s ɛ m	ɪ n t ɛ r m ɪ tː ɛ r ɛ
a m p ʊ lː a m	a m p ʊ lː a m
k r ɪ t ɛ r j ʊ m	k r ɪ t ɛ r ɪ ɔ n
a k ɛ r w ʊ m	a k ɛ r w ʊ m
s ɔ lː ɛ k ɪ t ʊ m	s ɔ lː ɪ k ɪ t ʊ m
k ɔ m p l ɛ m t ɪ w ʊ m	k ɔ m p l eː t iː w ʊ m
ɪ m p r ɔ b aː r ɛ	ɪ m p r ɔ b aː r ɛ
w ɛ g ɛ t ʊ m	w ɛ g ɛ t ʊ m
ɛ k k ɛ l s ʊ m	ɛ k s k ɛ l s ʊ m
ɔ pː oː n r ɛ	ɔ pː oː n ɛ r ɛ
f ɛ l ɪ k ɛ	f eː l iː k ɛ m
s a l ɪ w aː r ɛ	s a l iː w aː r ɛ
ɔ n ʊ s t ʊ m	ɔ n ʊ s t ʊ m
k r ɪ m ɪ n a m t j oː n ɛ m	k r iː m ɪ n aː t j oː n ɛ m
ɛ k s t ɪ r p aː r ɛ m	ɛ k sː t ɪ r p aː r ɛ
d ɛ t r aː ɛ r ɛ	d eː t r a h ɛ r ɛ
k r uː ɛ n t ʊ m	k r ʊ ɛ n t ʊ m
t ɔ r s ʊ m	tʰ y r s ʊ m
w a k ɪ lː a m t j oː n ɛ m	w a k ɪ lː aː t j oː n ɛ m
p ɛ k t ɪ n aː r ɛ	p ɛ k t ɪ n aː r ɛ
f ɛ r m ɛ n t ʊ m	f ɛ r m ɛ n t ʊ m
ɪ m p uː l s ɪ w ʊ m	ɪ m p ʊ l s iː w ʊ m
m a k ɛ lː ʊ m	m a k ɛ lː ʊ m
w ɛ lː ʊ m	w ɛ lː ʊ s
d ɪ s p oː n ɛ	d ɪ s p oː n ɛ r ɛ
k ɪ n k ʊ n ɛ m t ɛ	kʷ iː ŋ k ʊ ŋ k ɛ m
s ɔ n j a m t oː r ɛ	s ɔ m n j aː t oː r ɛ m
s ɛ p ɛ m	s aɪ p ɛ m
k uː r a m t ʊ r a m	k uː r aː t uː r a m
k ɔ n d ɛ m nː a m t j oː n ɛ m	k ɔ n d ɛ m n aː t j oː n ɛ m
a b ɔ m ɪ n aː r ɛ	a b oː m ɪ n aː r iː
g ɪ b ʊ m	g ɪ bː ʊ m
s ɔ l aː r ɪ j ʊ m	s oː l aː r j ʊ m
s a b l ʊ m n ɛ m	s a b ʊ l oː n ɛ m
a pː ɛ n d ɛ r ɛ	a pː ɛ n d ɛ r ɛ
k r a m t ɪ k ʊ l a m	k r aː t ɪ k ʊ l a m
s ʊ p ɛ r w a m k aː n ɛu ʊ m	s ʊ p ɛ r w a k ʊː m
s ʊ l k ʊ m	s ʊ l k ʊ m
a d ʊ n t ʊ m	a d j ʊ ŋ k t ʊ m
r a k ɛ m ʊ m	r a k eː m ʊ m
ɛ l uː d ɪ r ɛ	eː l uː d ɛ r ɛ
p ʊ l k r ɛ ɪ t ʊ t ɛ m	p ʊ l kʰ r ɪ t uː d ɪ n ɛ m
f r ɔ n d a m	f ʊ n d a m
f ɛ rː ʊ g ɪ n ɛ m	f ɛ rː uː g ɪ n ɛ m
d ɛ w ɔ r aː t j oː n ɛ m	d eː w ɔ r aː t j oː n ɛ m
s t ɪ p ʊ l a m r ɛ	s t ɪ p ʊ l aː r iː
g ɛ n t ɪ l ɛ m	g ɛ n t iː l ɛ m
ɔ r b ʊ m	ɔ r b ʊ m
s ɛ r ʊ m	s ɛ r ʊ m
w ɛ r g a m	w ɪ r g a m
r eː m ʊ m	r eː m ʊ m
ɛ l ɔ ŋ g aː t j oː n ɛ m	eː l ɔ ŋ g aː t j oː n ɛ m
g ɛ n t ɪ l ɪ t aː t ɛ m	g ɛ n t iː l ɪ t aː t ɛ m
k ɛ lː aː	k ɛ lː a m
s a l t ʊ m	s a l t ʊ m
k ɔ n s oː n aː r ɛ	k oː n s ɔ n aː r ɛ
aʊ g uː r j ʊ m	aʊ g ʊ r j ʊ m
a p aː r ɛ m t ɛ r ɛ	a pː aː r eː s k ɛ r ɛ
p ɔ sː ɛ sː j oː n ɛ m	p ɔ sː ɛ sː j oː n ɛ m
g ɛ ɔ g r aː f iː k ʊ m	g ɛ oː g r a pʰ ɪ k ʊ m
a r g ɪ n t oː s ʊ m	a r g ɛ n t oː s ʊ m
k ɔ r t ɛ m	k oː r t ɛ m
r ɛ p ɛ lː ɛ r ɛ	r ɛ p ɛ lː ɛ r ɛ
k ɪ n t uː r a m	k ɪ ŋ k t uː r a m
a nː oː s ʊ m	a nː oː s ʊ m
t ʊ r m a m	t ʊ r m a m
ʊ ŋ g ʊ l aː t ʊ m	ʊ ŋ g ʊ l aː t ʊ m
ɛ s t ɪ ʊ m	aɪ s t aː t ɛ m
k ɪ p r ɛ sː ʊ	k ʊ p r ɛ sː ʊ m
b a r d ʊ m	b a r d ʊ m
b a s ʊ m	b a sː ʊ m
ɪ n k r ɛ m ɛ n t ʊ m	ɪ ŋ k r eː m ɛ n t ʊ m
p ɛ r d ɛ r ɛ	p ɛ r d ɛ r ɛ
k a p t uː r a m	k a p t uː r a m
r ɪ k t ʊ	r ɪ k t ʊ m
w a g aː b ʊ n d ʊ m	w a g aː b ʊ n d ʊ m
p r ɛ m ɛ r ɛ	p r ɛ m ɛ r ɛ
ɪ ŋ g r aː t ʊ m	ɪ ŋ g r aː t ʊ m
ɪ m f l ɪ g ɛ r ɛ	iː n f l iː g ɛ r ɛ
k r j aː t uː r a m	k r ɛ aː t uː r a m
p uː p ɪ lː ʊ m	p uː p ɪ lː ʊ m
a kː uː s aː r ɛ	a kː uː s aː r ɛ
l a m aː	l aː m a m
w ɔ r t ɪ k k ɛ m	w ɔ r t ɪ k ɛ m
j ʊ d ɪ k j ʊ m	j uː d ɪ k j ʊ m
s ɔ nː ʊ m	s ɔ m n ʊ m
s eː n ʊ m	s ɪ n ʊ m
s t uː d j aː r ɛ	s t ʊ d eː r ɛ
ɪ n w ɛ n t oː r ɛ	ɪ n w ɛ n t oː r ɛ m
r eː f k ɛ r ɛ	r ɛ f ɪ k ɛ r ɛ
a sː uː m ɪ r ɛ	a sː uː m ɛ r ɛ
t j aː	tʰ iː a m
d ɛ s ɪ d j a m	d eː s ɪ d j a m
a w oː g aː r ɛ	a d w ɔ k aː r ɛ
s p ɛ k uː l aː t oː r ɛ m	s p ɛ k ʊ l aː t oː r ɛ m
k ʊ l t ɛ lː ʊ m	k ʊ l t ɛ lː ʊ m
n a t ʊ m	n aː t ʊ m
k ɔ d ɪ k ɪ lː ʊ m	k oː d ɪ k ɪ lː ʊ m
ɪ n d ɪ ŋ n aː r ɛ	ɪ n d ɪ ŋ n aː r iː
k ɔ lː ɛ g j ʊ m	k ɔ lː eː g j ʊ m
ɛ n aː rː a m t j oː n ɛ m	eː n aː rː aː t j oː n ɛ m
f ɪ k ʊ m	f iː k ʊ m
ɪ b ɪ l ɛ	ɪ b ɪ l ɛ m
r ɛ l ɪ k j a m	r ɛ l ɪ kʷ ʊ m
a k aɪ oː	aː k ɛu m
n a s ʊ m	n aː s ʊ m
k ɔ n s t ɪ t uː t j oː n ɛ m	k oː n s t ɪ t uː t j oː n ɛ m
a d ʊ m b r aː r ɛ	a d ʊ m b r aː r ɛ
ɔ b ɛ d ɛ m t ɛ r ɛ	ɔ b ɔ ɪ d iː r ɛ
ɪ m f aː n t ʊ m	iː n f a n d ʊ m
d ɪ m aː n aː r ɛ	d iː m aː n aː r ɛ
p a r w ʊ m	p a r w ʊ m
w ɪ n k ʊ l aː r ɛ	w ɪ ŋ k ʊ l aː r ɛ
ɪ r aː k ʊ n d ʊ m	iː r aː k ʊ n d ʊ m
l ɛ t ɛ r a m	l ɪ tː ɛ r a m
k ɔ m p ɪ l aː t j oː n ɛ m	k ɔ m p iː l aː t j oː n ɛ m
f aʊ s t ʊ m	f aʊ s t ʊ m
k ɔ n s ɔ l ɪ d aː r ɛ	k oː n s ɔ l ɪ d aː r ɛ
w a n ɪ	w a nː ʊ m
ɛ k s p a n d ɛ r ɛ	ɛ k s p a n d ɛ r ɛ
ɪ n w ɔ l w ɛ r ɛ	ɪ n w ɔ l w ɛ r ɛ
k ɔ m p r a m t oː r ɛ	k ɔ m p a r aː t oː r ɛ m
r ʊ p ɛ	r uː p ɛ m
p a r ʊ m	p a r ɛ m
f ɛ t ɛ r ɛ	f eː t eː r ɛ
s uː b l ɪ m aː t j oː n ɛ m	s ʊ b l iː m aː t j oː n ɛ m
a b ɪ l ɛ	aː b ɪ l ɛ m
k ɔ m p r ɔ m ɛ t ɛ r ɛ m	k ɔ m p r oː m ɪ tː ɛ r ɛ
aʊ d ɪ t oː r j ʊ m	aʊ d iː t oː r j ʊ m
p r aː n d s ʊ m	p r a n d j ʊ m
a s ɛ t aː t ɛ m	a s eː ɪ t aː t ɛ m
a n t ɛ k ɛ sː oː r ɛ	a n t ɛ k ɛ sː oː r ɛ m
ɛ j ʊ n oː	j eː j uː n j ʊ m
w a k ʊ ɪ t aː t ɛ m	w a k ʊ ɪ t aː t ɛ m
l ɛ ɛ r ɛ	l ɛ g ɛ r ɛ
k uː d ɛ r ɛ m	k l aʊ d ɛ r ɛ
f uː g aː r ɛ	f ʊ g aː r ɛ
s ɔ l ɛ r t ɛ m	s ɔ lː ɛ r t ɛ m
s t ɪ m ʊ l a m t j oː n ɛ m	s t ɪ m ʊ l aː t j oː n ɛ m
p ɔ n t ɪ f ɪ k aː t ʊ m	p ɔ n t ɪ f ɪ k aː t ʊ m
k ɔ n t ɛ n t ʊ m	k ɔ n t ɛ n t ʊ m
a m ʊ r k j a m	a m ʊ r k a m
ɛ k s p ʊ l s aː r ɛ	ɛ k s p ʊ l s aː r ɛ
ɛ k s ɛ kʷ ʊ r ɛ	ɛ k sː ɛ kʷ iː
ɛ k s ʊ l k ɛ r aː t j oː n ɛ m	ɛ k s ʊ l k ɛ r aː t j oː n ɛ m
k ɪ t ɪ s ʊ m	k y t ɪ s ʊ m
g r aː b aː t aː	g r a b aː t ʊ m
a k r ɪ m oː n j a m	aː k r ɪ m oː n j a m
f l ɔ s k ʊ l ʊ m	f l ɔ s k ʊ l ʊ m
l ʊ k ɛ lː ʊ m	l ɔ k ɛ lː ʊ m
a s k ɛ n d ɛ r ɛ	a s k ɛ n d ɛ r ɛ
t ɛ n ʊ ɛ	t ɛ n ʊ ɛ m
k ɔ l ɔ r aː r ɛ	k ɔ l oː r aː r ɛ
ɪ n mː ɛ r g ɛ r ɛ	ɪ mː ɛ r g ɛ r ɛ
a fː l ɪ g ɛ r ɛ	a fː l iː g ɛ r ɛ
n ɛ k t aː r ɛ	n ɛ k t a r
p a nː ʊ m	p a nː ʊ m
d ɪ s p ɔ s ɪ t j ʊ m n ɛ m	d ɪ s p ɔ s ɪ t j oː n ɛ m
l ɪ t aː r ɛ	l ɪ t aː r ɛ
a n t ɪ s t ɛ t ɛ m	a n t ɪ s t ɪ t ɛ m
w ɛ r t ɪ g ɪ n ɛ	w ɛ r t iː g ɪ n ɛ m
ɛ r ɛ t ɪ k ɛ m	h aɪ r ɛ t ɪ k ʊ m
m ɔ r t aː l ɪ t aː t ɛ m	m ɔ r t aː l ɪ t aː t ɛ m
a b ɛ t ʊ m	a b ɪ eː t ɛ m
n ɔ t a m	n ɔ t a m
r ɛ n ʊ n k j aː r ɛ	r ɛ n ʊ n t j aː r ɛ
n ʊ m ɛ r oː s ʊ m	n ʊ m ɛ r oː s ʊ m
p ɛ r g ʊ r j ʊ m	p ɛ r ɪ uː r j ʊ m
w ɛ k aː	w ɪ k j a m
k a r b ʊ n k ʊ l ʊ m	k a r b ʊ ŋ k ʊ l ʊ m
b l aː n d ɪ t j a m	b l a n d ɪ t j a m
m ʊ r ɪ k ɛ m	m uː r ɪ k ɛ m
s kʷ aː m a m	s kʷ aː m a m
w ɔ r ʊ m	w ɔ r ʊ m
m ɪ s t ʊ r a m	m ɪ s t uː r a m
ɛ m aː l ɛ	h ɪ ɛ m aː l ɛ m
ɪ n t ɪ m p ɛ s t ɪ w ɪ t aː t ɛ m	ɪ n t ɛ m p ɛ s t iː w ɪ t aː t ɛ m
ɛ k s p ʊ ŋ n aː r ɛ	ɛ k s p ʊ ŋ n aː r ɛ
ɛ l ɪ d ɛ r ɛ	eː l iː d ɛ r ɛ
w ɪ s ɪ t aː t j ʊ m n ɛ m	w iː s ɪ t aː t j oː n ɛ m
t a pː ɛ t ɛ m	t a p eː t ɛ m
m a t ɛ r n ɪ t aː t ɛ m	m aː t ɛ r n ɪ t aː t ɛ m
ɪ n t ɪ m aː t j oː n ɛ m	ɪ n t ɪ m aː t j oː n ɛ m
t ʊ n d aː r ɛ	t ɔ n d eː r ɛ
ɔ r t ʊ m	h ɔ r t ʊ m
s a t ɪ r a m	s a t ɪ r a m
p ɛ r ɪ t a m r s iː	p ɪ g r ɪ t aː r iː
t ɛ k m a m	tʰ eː k a m
p r ɔ a m	p r oː r a m
g ʊ s t ɪ f ɪ k aː t ʊ m r ɛ m	j uː s t ɪ f ɪ k aː t oː r ɛ m
d ɪ s t ɛ ŋ d ɛ r ɛ	d eː s k ɛ n d ɛ r ɛ
k ɔ sː ʊ m	k ɔ sː ʊ m
d ɛ p r ɛ d aː t j ʊ m n ɛ m	d eː p r aɪ d aː t j oː n ɛ m
ɪ n f l ɪ k t j oː n ɛ m	ɪ n f l ɪ k t j oː n ɛ m
s a n aː t j ʊ m n ɛ m	s aː n aː t j oː n ɛ m
ɛ k s ɛ k r aː t j ʊ m n ɛ m	ɛ k sː eː k r aː t j oː n ɛ m
ɔ t r ɛ	ʊ t r ʊ m
a k aː	a k j a m
r ɛ n ʊ ɪ r ɛ	r ɛ n ʊ ɛ r ɛ
b a s ɛ lː a m	w aː s k ɛ lː ʊ m
s uː b ɪ r ɛ	s ʊ b iː r ɛ
g r a n d ɛ m	g r a n d ɛ m
p a t r j aː r k aː t ʊ m	p a t r j a r kʰ a t ʊ m
k ɛ r ɛ m ɔ n j aː l ɛ m	k aɪ r ɪ m oː n j aː l ɛ m
k ɪ p a m	k eː p a m
r ɛ t ɛ n ɛ r ɛ	r ɛ t ɪ n eː r ɛ
g r aː t ɛ m	k r aː t ɛ m
f r ɛ n aː r ɛ	f r eː n aː r ɛ
ɪ b r ɪ d ʊ m	h y b r ɪ d a m
m ɛ d ɪ j ɔ k r ɛ ɛ m	m ɛ d ɪ ɔ k r ɛ m
g ɪ r aː r ɛ	g y r aː r ɛ
p ʊ l w ɛ r ɪ zː aː r ɛ m	p ʊ l w ɛ r iː zː aː r ɛ
p ʊ l w ɪ n aː r ɛ	p ʊ l w iː n a r
a m aː t oː r ɛ	a m aː t oː r ɛ m
m a r ɪ t ʊ m	m a r iː t ʊ m
m a n ɪ p ʊ l ʊ m	m a n ɪ p ʊ l ʊ m
r ɛ k ʊ s aː t j oː n ɛ m	r ɛ k uː s aː t j oː n ɛ m
ɪ n t ɛ g r a m r ɛ	ɪ n t ɛ g r aː r ɛ
l ɪ b ɛ l ʊ m	l ɪ b ɛ lː ʊ m
k ɔ rː ɛ k t oː r ɛ	k ɔ rː ɛ k t oː r ɛ m
b ɛ n ɛ f ɪ k ʊ m	b ɛ n ɛ f ɪ k ʊ m
r ɛ l ɛ g aː t j oː n ɛ m	r ɛ l eː g aː t j oː n ɛ m
a nː ɔ n a m	a nː oː n a m
m ɪ r aː k oː l ʊ m	m iː r aː k ʊ l ʊ m
d ɪ sː ɛ m ɪ n aː r ɛ	d ɪ sː eː m ɪ n aː r ɛ
k ɔ n s a ŋ gʷ ɪ n ɪ t aː t ɛ m	k oː n s a ŋ gʷ ɪ n ɪ t aː t ɛ m
w a g aː r ɛ	w a g aː r iː
a d ʊ n t j oː n ɛ m	a d j ʊ ŋ k t j oː n ɛ m
l ʊ k t aː r ɛ	l ʊ k t aː r iː
s k ʊ rː ɛ r ɛ	ɛ k s k ʊ rː ɛ r ɛ
p a b ʊ l ʊ m m	p aː b ʊ l ʊ m
ɛ r ɛ d ɪ m aː t ɛ m	h eː r eː d ɪ t aː t ɛ m
a p aː r ɪ t j oː n ɛ m	a pː aː r ɪ t j oː n ɛ m
ʊ m b r oː s ʊ m	ʊ m b r oː s ʊ m
g r aː w ɪ t aː t j oː n ɛ m	g r a w ɪ t aː t j oː n ɛ m
s ɔ l ɪ d aː r ɛ	s ɔ l ɪ d aː r ɛ
s uː b m ɛ r m ʊ m	s uː b ɛ r ɛ m
k ɛ r w ʊ j a m	k ɛ r w ɪ s j a m
uː l t ɛ r j ʊ m r ɛ	ʊ l t ɛ r j oː r ɛ m
p aʊ s a m	p aʊ s a m
d a t a m	d a t a
t r aː t aː t ʊ m	t r a k t aː t ʊ m
ɛ b r ɛ ʊ m	h ɛ b r aɪ ʊ m
k ɔ n s ʊ p t j oː n ɛ m	k oː n s uː m p t j oː n ɛ m
t ɛ n oː r ɛ	t ɛ n oː r ɛ m
l ɔ k aː r ɛ	l ɔ k aː r ɛ
k a m p j oː n ɛ m	k a m p j oː n ɛ m
a ŋ g ɔ s aː	a ŋ g ʊ s t j a m
w ɛ s p r ʊ m	w ɛ s p ɛ r ʊ m
p a p a m	p aː p a m
k ɔ n d ɪ t j oː n ɛ	k ɔ n d ɪ k j oː n ɛ m
k a r aː m ɛ lː ʊ m	k a l a m ɛ lː ʊ m
m ɪ lː a m	m iː lː j a
a r b ɔ r ɛ t ʊ m	a r b ɔ r eː t ʊ m
a pː ɛ lː aː r ɛ	a pː ɛ lː aː r ɛ
k oː n ɔ p ɛ ʊ m	k oː n oː p eː ʊ m
t r ɛ p ɪ d aː r ɛ	t r ɛ p ɪ d aː r ɛ
d ɛ g r aː d aː t j oː n ɛ m	d eː g r a d aː t j oː n ɛ m
ɔ b j ɛ k t ʊ m	ɔ b ɪ ɛ k t ʊ m
w ɔ l t aː r ɛ	w ɔ l uː t aː r ɛ
s ɛ t aː	s aɪ t a m
r ɛ p ɛ t ɛ r ɛ	r ɛ p ɛ t ɛ r ɛ
p a l ʊ m b aː r j ʊ m	p a l ʊ m b aː r j ʊ m
ʊ r k ɛ m	ʊ l iː k ɛ m
w a r j ʊ	w a r j ʊ m
s k ɔ r j a m	s k oː r j a m
k ɪ k ɔ n ɛ a m	k ɪ k oː n j a m
l ɪ k t oː r ɛ	l iː k t oː r ɛ m
g l aː k ʊ m	g l a k ɪ ɛ m
ɛ k s k ɪ t aː r ɛ	ɛ k s k ɪ t aː r ɛ
k ɔ n k ɪ t a m t j oː n ɛ m	k ɔ ŋ k ɪ t aː t j oː n ɛ m
a l j ɪ ɛ n aː t j oː n ɛ m	a l ɪ eː n aː t j oː n ɛ m
b r a n k a m	b r a ŋ k a m
ɛ ɔ	ɛu m
a m aː r ɛ t a m	a m aː r ɪ t ɪ ɛ m
k ɔ n k aː w ʊ m	k ɔ ŋ k a w ʊ m
t r ɪ lː ʊ m	t r iː b ʊ l ʊ m
a d ɪ t a m m ɛ n t ʊ m	a dː ɪ t aː m ɛ n t ʊ m
l ɛ ɔ p aː r d ʊ m	l ɛ ɔ p a r d ʊ m
w a r ɪ ɛ t aː t ɛ m	w a r ɪ ɛ t aː t ɛ m
n uː b ɛ	n uː b ɛ m
p a r aː r ɛ	p a r aː r ɛ
w a k ɪ lː a m r ɛ	w a k ɪ lː aː r ɛ
m a k n aː t ɛ m	m a ŋ n aː t ɛ m
m ʊ n d ʊ m	m ʊ n d ʊ m
ɪ n f r ɪ ŋ g ɛ r ɛ	iː n f r ɪ ŋ g ɛ r ɛ
s p ɔ r t a m	s p ɔ r t a m
k l aː r ɪ t aː t ɛ m	k l aː r ɪ t aː t ɛ m
s p ʊ r k aː r ɛ	s p ʊ r k aː r ɛ
p a l ʊ d oː s ʊ m	p a l uː d oː s ʊ m
a s ɔ l aː r ɛ	a sː ɔ l aː r ɛ
a lː ɔ n d ʊ m r a m	a l aʊ d a m
ɛ k s t r ɛ ʊ t ɛ r ɛ	ɛ k s t r uː d ɛ r ɛ
d ɛ n ɔ m ɪ n aː t oː r ɛ m	d eː n oː m ɪ n aː t oː r ɛ m
ɛ m b r j aː k ʊ m	eː b r j aː k ʊ m
l ɪ n aː r ʊ m	l iː n aː r j ʊ m
p a t ɛ r n ʊ m	p a t ɛ r n ʊ m
ɪ rː ʊ m p ɛ r ɛ	ɪ rː ʊ m p ɛ r ɛ
b a l t ɪ k ʊ m	b a l t ɪ k ʊ m
f ɛ s t ɪ w ɪ t aː t ɛ m	f eː s t iː w ɪ t aː t ɛ m
s ɔ l ɛ r ɛ	s ɔ l eː r ɛ
m uː n ɪ k ɪ p j ʊ m	m uː n ɪ k ɪ p j ʊ m
a kː uː s a m t oː r ɛ	a kː uː s aː t oː r ɛ m
s a n aː b ɪ l ɛ	s aː n aː b ɪ l ɛ m
ɛ k s p oː n ɛ	ɛ k s p oː n ɛ r ɛ
p ɛ r s ɛ kʷ ɪ r ɛ	p ɛ r s ɛ kʷ iː
ɪ ŋ g ʊ s t ʊ m	ɪ n ɪ uː s t ʊ m
a l j ɛ n t ʊ m	a n h eː l ɪ t ʊ m
a s k ʊ n d ɛ r ɛ	a b s k ɔ n d ɛ r ɛ
a l aː b aː s t r ʊ m	a l a b a s t r ʊ m
m ɔ s k ʊ m	m ʊ s t ɛu m
b a k t ɪ s m ʊ m	b a p t ɪ s m ʊ m
ɔ kː l ʊ d ɛ r ɛ	ɔ kː l uː d ɛ r ɛ
l ɔ ŋ g ɪ n kʷ ɪ t aː t ɛ m	l ɔ ŋ g ɪ ŋ kʷ ɪ t aː t ɛ m
t r ɪ p l ʊ m	t r ɪ p l ʊ m
p a r t ɪ r ɛ	p a r t iː r ɛ
k oː nː ʊ m	k ʊ nː ʊ m
ɔ l ɪ g aː r k a m	ɔ l ɪ g a r kʰ a m
a b uː s aː r ɛ	a b uː t iː
k ɛ r t ɪ t uː m d ɪ n ɛ m	k ɛ r t ɪ t uː d ɪ n ɛ m
r ɛ p aː r aː r ɛ	r ɛ p a r aː r ɛ
ɛ lː ʊ m	ɛ lː ʊ m
iː k l ɛ s a m	ɛ kː l eː s j a m
ɛ b r ɪ ɛ t aː t ɛ	eː b r ɪ ɛ t aː t ɛ m
a nː ɪ k ɪ l aː r ɛ	a nː ɪ h ɪ l aː r ɛ
m a g ɛ s t aː t ɛ m	m a j ɛ s t aː t ɛ m
m ʊ n ɪ r	m uː n iː r ɛ
w ɛ r s ɪ f ɪ k aː r ɛ	w ɛ r s ɪ f ɪ k aː r ɛ
n ʊ m ɛ r aː r j ʊ m	n ʊ m ɛ r aː r j ʊ m
s ɪ t j ʊ m	s ɪ t ʊ m
p r ɔ t ɛ r w ʊ m	p r ɔ t ɛ r w ʊ m
k a lː ɛ	k a lː ɛ m
uː s uː r aː r j ʊ m	uː s uː r aː r j ʊ m
m uː r ɛ n a m	m ʊ r eː n a m
s ɪ l w a m	s ɪ l w a m
t uː r p ɪ t uː d ɪ n ɛ m	t ʊ r p ɪ t uː d ɪ n ɛ m
r ɛ p l ɪ k aː t j oː n ɛ m	r ɛ p l ɪ k aː t j oː n ɛ m
s ɪ l ɪ k ɛ m	s ɪ l ɪ k ɛ m
d ɔ m ɛ s t ɪ k ʊ m	d ɔ m ɛ s t ɪ k ʊ m
d ɛ l ɪ t j a m	d eː l ɪ k j aː s
ɔ fː ɪ k ɪ n a m	ɔ fː ɪ k iː n a m
n ɛ g l ɪ j ɛ n t j a m	n ɛ g l ɛ g ɛ n t j a m
ɪ n t ɛ n t j oː n ɛ m	ɪ n t ɛ n t j oː n ɛ m
n ɛ f aː s t ʊ m	n ɛ f aː s t ʊ m
ɪ n k ɛ n s ʊ m	ɪ ŋ k eː n s ʊ m
a k ɛ r b ɪ t aː t ɛ m	a k ɛ r b ɪ t aː t ɛ m
ɔ r d ɪ n aː t oː r	ɔ r d ɪ n aː t oː r ɛ m
m a r ɪ s k a m	m a r ɪ s k a m
a t r aː b ɪ l j aː r j ʊ m	aː t r a b iː l aː r j ʊ m
s ʊ mː ʊ m	s ʊ mː ʊ m
l a n t aː r ʊ m	l a ŋ k j aː r j ʊ m
s k ʊ d ɛ lː a m	s k ʊ t ɛ lː a m
g ʊ b aː	j ʊ b a m
r ɪ p a m	r iː p a m
g ɔ k ʊ n d ʊ m	j uː k ʊ n d ʊ m
k ɪ m b aː l ʊ m	k y m b a l ʊ m
ɪ n s t r ʊ k t j oː n oː	iː n s t r ʊ k t j oː n ɛ m
p r ɔ m ʊ l g aː t j oː n ɛ m	p r oː m ʊ l g aː t j oː n ɛ m
m ɛ d ɪ k aː r ɛ	m ɛ d ɪ k aː r ɛ
l ɪ n ɛ aː r ɛ	l iː n ɛ aː r ɛ
l ɛ mː aː	l ɛ mː a
n aʊ s ɛ aː	n aʊ s j a m
r a p ɪ r ɛ	r a p ɛ r ɛ
a b aː t j aː l	a bː aː t j aː l ɛ m
n ʊ m ɛ r ʊ m	n ʊ m ɛ r ʊ m
a tː r aː ɪ r ɛ	a tː r a h ɛ r ɛ
s uː fː ɪ k j ɛ n t j a m	s ʊ fː ɪ k ɪ ɛ n t j a m
s ɛ s kʷ ɪ p ɛ d aː l ɛ m	s eː s kʷ ɪ p ɛ d aː l ɛ m
ɛ fː ʊ n d ɪ r ɛ	ɛ fː ʊ n d ɛ r ɛ
n ɛ m ɔ r aː l ɛ	n ɛ m ɔ r aː l ɛ m
ɛ d ɪ k ɔ l a m	aɪ d ɪ k ʊ l a m
p r ɔ n ɔ s t ɪ k	p r ɔ ŋ n oː s ɛ m
uː r ɪ n a m	uː r iː n a m
l uː k ɪ ʊ m l oː	ɛ lː y kʰ n j ʊ m
m a n k ʊ m	m a ŋ k ʊ m
s ɔ p t w oː s ʊ m	s ʊ m p t ʊ oː s ʊ m
k a n t oː n ɛ m	k a n t j oː n ɛ m
a k ɪ t aː r ɛ	oː s k ɪ t aː r ɛ
s ɛ k r ɪ t ʊ m	s k r iː p t ʊ m
ɛ l ɪ m ɪ n a m t j oː n ɛ m	eː l ɪ m ɪ n aː t j oː n ɛ m
m ɛ r d a m	m ɛ r d a m
p a pː aː r ɛ	p a pː aː r ɛ
ɔ s t r ʊ	aʊ s t r ʊ m
k ʊ w aː r ɛ	k ʊ b aː r ɛ
t r ɛ p ɪ d ʊ m	t r ɛ p ɪ d ʊ m
d ɛ n ɔ m ɪ n aː t j oː n ɛ m	d eː n oː m ɪ n aː t j oː n ɛ m
r ɛ k aː l k ɪ t r aː r ɛ	r ɛ k a l k ɪ t r aː r ɛ
f ɪ d ʊ k aː	f iː d uː k j a m
aʊ r ɪ r	h aʊ r iː r ɛ
p ɛ kː aː r ɛ	p ɛ kː aː r ɛ
k a l aː m ɪ t aː t ɛ m	k a l a m ɪ t aː t ɛ m
ɔ b s ɛ k j ʊ m s ʊ m	ɔ b s ɛ kʷ j oː s ʊ m
