s a k r ɪ f ɪ k j ʊ m	s a k r ɪ f ɪ k j ʊ m
r ɔ m ɪ k ɛ	r ʊ m ɪ k ɛ m
k ɔ m uː n aː l	k ɔ mː uː n aː l ɛ m
s a n aː t j ʊ m n ɛ m	s aː n aː t j oː n ɛ m
g r ʊ n j ɪ r ɛ	g r ʊ nː iː r ɛ
ɔ m ɪ k ɪ d j ʊ m	h ɔ m ɪ k iː d j ʊ m
s ɪ ɪ n t ɪ f ɪ k ʊ m	s k ɪ ɛ n t ɪ f ɪ k ʊ m
w a r oː n	w aː r oː n ɛ m
ɪ s ɔ l aː t ʊ m	iː n s ʊ l aː t ʊ m
t r a n s f ɛ r ɛ r ɛ	t r aː n s f ɛ rː ɛ
a s k r ɪ w ɛ r ɛ	aː s k r iː b ɛ r ɛ
l a w aː t j oː n ɛ m	l a w aː t j oː n ɛ m
r a p ɪ d ɪ t aː	r a p ɪ d ɪ t aː t ɛ m
a g r ʊ m	a g r ʊ m
ɛ m ʊ ŋ g ɛ r ɛ	eː m ʊ ŋ g ɛ r ɛ
a nː oː s ʊ m	a nː oː s ʊ m
r ɪ p ʊ d j aː r ɛ	r ɛ p ʊ d j aː r ɛ
f ɛ m ɛ l a m	f eː m ɛ lː a m
b a l b ʊ t j aː r ɛ	b a l b uː t iː r ɛ
s k ʊ d ɛ lː a m	s k ʊ t ɛ lː a m
m ɪ l ɪ t aː r ɛ	m iː l ɪ t aː r ɛ
a n ʊ t ɪ n ʊ m	a nː oː t ɪ n ʊ m
f ʊ l g ʊ r aː r ɛ	f ʊ l g ʊ r aː r ɛ
d ʊ s	d ɛu m
r ɛ aː t ʊ m	r ɛ aː t ʊ m
p a w ɪ d ʊ m	p a w ɪ d ʊ m
s p ɔ r t a m	s p ɔ r t a m
a k t r ɪ k ɛ	aː k t r iː k ɛ m
ɪ n mː ɔ l aː r ɛ	ɪ mː ɔ l aː r ɛ
p a l ɛ s t r a m	p a l aɪ s t r a m
m ɛ s ɛ m	m eː n s ɛ m
d ɪ s p ɔ s ɪ t j ʊ m n ɛ m	d ɪ s p ɔ s ɪ t j oː n ɛ m
w ɛ r n ɪ k ɛ	w ɛ r n iː k ɛ m
p ɔ m ɛ t ʊ m	p ɔ m eː t ʊ m
k ɛ n s ʊ r aː	k eː n s uː r a m
t a k s aː r ɛ	t a k s aː r ɛ
a n aː t r aː m	a n a t ɛ m
n ɪ d oː r ɛ	n iː d oː r ɛ m
aʊ d aː k j a m	aʊ d aː k j a m
b aː s j ʊ m	b aː s j ʊ m
s uː g g ɛ r ɛ r ɛ	s ʊ gː ɛ r ɛ r ɛ
f uː l k r ʊ m m	f ʊ l k r ʊ m
t ɛ n s j oː n ɛ	t eː n s j oː n ɛ m
w ɪ w aː k ɛ	w iː w aː k ɛ m
s ɪ g ɪ l aː r ɛ	s ɪ g ɪ lː aː r ɛ
a w ɪ d ɪ t aː	a w ɪ d ɪ t aː t ɛ m
k ɛ r w ʊ j a m	k ɛ r w ɛ s j a m
ɪ m p ɛ t r aː r ɛ	ɪ m p ɛ t r aː r ɛ
d ɛ l ɛ t j ʊ m n ɛ m	d eː l eː t j oː n ɛ m
s ɔ p ʊ m r ɛ	s ɔ p oː r ɛ m
ɛ s t ɛ r n ʊ m	h ɛ s t ɛ r n ʊ m
aʊ d aː k ɛ	aʊ d aː k ɛ m
ɛ r ɔ d ɛ r ɛ	eː r oː d ɛ r ɛ
t uː	t uː
r a n ɔ k j ʊ m l	r aː n ʊ ŋ k ʊ l ʊ m
m ɛ b r aː n ʊ m s ʊ m	m ɛ m b r aː n ɛu m
g ʊ w ɛ r n aː t oː r ɛ m	g ʊ b ɛ r n aː t oː r ɛ m
ɔ s t ɛ n t aː r ɛ	ɔ s t ɛ n t aː r ɛ
ɛ k s k r ɛ t aː r ɛ	ɛ k s k ɛ r n ɛ r ɛ
p ɛ n ɛ t r aː r ɛ	p ɛ n ɛ t r aː r ɛ
f a s t ɪ d aː r ɛ	f a s t iː d iː r ɛ
p ɛ n ʊ r j a m	p eː n uː r j a m
n ɛ f aː n d ʊ m	n ɛ f a n d ʊ m
s k ɔ r t a m	s k ɔ r t ɛ a m
t ɔ r s ʊ m	tʰ y r s ʊ m
r ʊ g ʊ m	r ɔ g ʊ m
k ɔ n s ɪ l j a m r ɛ	k ɔ ŋ k ɪ l j aː r ɛ
ɛ g s ɛ m p l aː r	ɛ k s ɛ m p l a r
p ɔ s t ʊ l aː t j oː n ɛ m	p ɔ s t ʊ l aː t j oː n ɛ m
a b ɪ l ɪ t aː t ɛ m	h a b ɪ l ɪ t aː t ɛ m
p ʊ t ʊ m	p ʊ t ʊ m
a aː r	a fː l aː r ɛ
a m ɛ n t ʊ m	aː m ɛ n t ʊ m
a l k ɛ	a l k ɛ m
uː m ʊ s	h ʊ m ʊ m
s a t ɛ lː ɪ t ɛ	s a t ɛ lː ɪ t ɛ m
s k uː d ʊ m	s k uː t ʊ m
l uː k ɪ f ɛ m r ʊ m	l uː k ɪ f ɛ r ʊ m
s ɔ l ɪ l ɔ kʷ j ʊ m	s oː l ɪ l ɔ kʷ j ʊ m
ɪ m p uː l s j oː n ɛ m	ɪ m p ʊ l s j oː n ɛ m
ɪ n mː ɔ l aː t j oː n ɛ m	ɪ mː ɔ l aː t j oː n ɛ m
l a k t a m r ɛ	l a k t aː r ɛ
a b ɔ m ɪ n aː r ɛ	a b oː m ɪ n aː r iː
f a r ɪ n oː s ʊ m	f a r iː n oː s ʊ m
p ɛ r k a m	p ɛ r k a m
a k ɪ t aː r ɛ	oː s k ɪ t aː r ɛ
a n l j aː r ɛ	ɪ lː ɪ g aː r ɛ
r ɛ p ɛ r k uː sː j oː n ɛ m	r ɛ p ɛ r k ʊ t ɛ r ɛ
f uː r t ʊ m	f uː r t ʊ m
m a l t a m	m a l tʰ a m
f ɛ rː ʊ g ɛ n ɛ m	f ɛ rː uː g ɪ n ɛ m
p a r t ʊ m	p a r t ʊ m
k ʊ l uː m ɛ lː a m	k ɔ l ʊ m ɛ lː a m
m ɛ t r k ʊ m	m ɛ t r ʊ m
m ɛ n uː s j a m m	m ɪ n uː t j a m
g a l ɛ g ʊ m	g a lː aɪ k ʊ m
t ɪ m oː r ɛ	t ɪ m oː r ɛ m
k r ɪ s p aː r ɛ	k r ɪ s p aː r ɛ
k ɪ k m oː	k ɪ kː ʊ m
p r ɔ d ɪ g j ʊ m s j ʊ m	p r oː d ɪ g j oː s ʊ m
ɔ rː d ɪ d ʊ m	h ɔ rː ɪ d ʊ m
k ɔ p ʊ l a m t j oː n ɛ m	k oː p ʊ l aː t j oː n ɛ m
l ɛ ɛ m	l eː g ɛ m
aʊ g uː r j ʊ m	aʊ g ʊ r j ʊ m
s a n aː r ɛ	s aː n aː r ɛ
ɛ s w ɛ l a m r ɛ	eː w ɪ g ɪ l aː r ɛ
p a nː ɪ kː uː l a m	p aː n ɪ k ʊ l a m
r ɛ kː aː t aː r ɛ	r ɛ k a p t j aː r ɛ
ɪ n k ɛ n d j aː r j ʊ m	ɪ ŋ k ɛ n d j aː r j ʊ m
ɪ n b ɛ r n aː l ɛ	h iː b ɛ r n aː l ɛ m
ɪ n t ɪ m p ɛ s t ɪ w ɪ t aː t ɛ m	ɪ n t ɛ m p ɛ s t iː w ɪ t aː t ɛ m
t ʊ n k iː r ɛ	t ʊ n d ɛ r ɛ
d uː k ɪ r ɛ	d uː k ɛ r ɛ
ɛ n ɛ r w aː r ɛ	eː n ɛ r w aː r ɛ
t ʊ n d ɛ r ɛ	t ɔ n d eː r ɛ
ɛ b r ɪ ɛ t aː t ɛ	eː b r ɪ ɛ t aː t ɛ m
d j aː l ɛ k t ʊ m	d j a l ɛ k t ɔ n
k ɔ m p l ɛ m ɛ n t ʊ m	k ɔ m p l eː m ɛ n t ʊ m
k ɛ n t aʊ r j aː	k ɛ n t aʊ r eːa m
p r ɛ t ɛ n d ɛ r ɛ	p r aɪ t ɛ n d ɛ r ɛ
d ɛ b ɛ lː aː r ɛ	d eː b ɛ lː aː r ɛ
p l ʊ m b ɛ ʊ m	p l ʊ m b ɛu m
p r ɔ p ɪ n kʷ ʊ m	p r ɔ p ɪ ŋ kʷ ʊ m
a l w ɛ ʊ m	a l w ɛu m
s ʊ b s ɛ m kʷ ɪ r ɛ	s ʊ b s ɛ kʷ iː
j uː g ɛ r ʊ m	j uː g ɛ r ʊ m
ɪ n k ɔ l ʊ m ɛ m	ɪ ŋ k ɔ l ʊ m ɛ m
m ɛ s t m ɪ k ʊ m	m ɪ k s t iː k j ʊ m
k ɔ n t r aː k t ɛ	k ɔ n t r a h ɛ r ɛ
p a w ɪ m ɛ n t ʊ m	p a w iː m ɛ n t ʊ m
w ɛ n ɛ t m ɛ m ʊ m n ɛ m	w ɛ n ɛ t ʊ m
w ɔ l uː b ɪ l ɛ	w ɔ l uː b ɪ l ɛ m
a b j ɛ k t aː r ɛ	a b ɪ k ɛ r ɛ
r ɛ t ɛ n ɛ r ɛ	r ɛ t ɪ n eː r ɛ
p r aː n d ɛ r ɛ	p r a n d eː r ɛ
s aː n m oː m	s aː n ʊ m
l ɛ n aː r ɛ	l ɪ ŋ n aː r iː
l aʊ r ʊ m k ɛ r aː s ʊ m	l aʊ r ɔ k ɛ r a s ʊ m
g uː r ɪ s p r uː d ɛ n t a m	j uː r ɪ s p r uː d ɛ n t j a m
a r aː t r ʊ m	a r aː t r ʊ m
a t ɪ k ʊ m	aː t ɪ k ʊ m
ɛ w ɔ l ʊ t j oː n ɛ	eː w ɔ l uː t j oː n ɛ m
r ɛ s k ɪ n d ɛ r ɛ	r ɛ s k ɪ n d ɛ r ɛ
ɔ l oː r	ɔ l oː r ɛ m
r uː g ɪ r ɛ	r uː g iː r ɛ
n ʊ m ɛ r oː s ʊ m	n ʊ m ɛ r oː s ʊ m
ɔ r d j ʊ m	h ɔ r d ɛu m
m ɪ s t ʊ r a m	m ɪ s t uː r a m
d ɪ s t ʊ r b aː r ɛ	d ɪ s t ʊ r b aː r ɛ
ɪ n t ɛ r k ɛ d ɛ r ɛ m	ɪ n t ɛ r k eː d ɛ r ɛ
s ɛ k aː l ɛ	s ɛ k aː l ɛ
d a n oː s ʊ m	d a m n oː s ʊ m
kʷ a d r ʊ p l ɪ k aː r ɛ m	kʷ a d r ʊ p l ɪ k aː r ɛ
ɪ d ɔ n ɛ m aː t	ɪ d oː n ɛ ɪ t aː t ɛ m
l ʊ t ʊ m	l uː k t ʊ m
s ʊ r d ʊ m	s ʊ r d ʊ m
a d ɪ p ɛ m	a d ɪ p ɛ m
f ɔ k aː r j aː	f ɔ k aː r j ʊ m
ɛ s ɪ t aː r ɛ	h aɪ s ɪ t aː r ɛ
l a r g ʊ m	l a r g ʊ m
s ɛ p t ɛ n t r j oː n ɛ m	s ɛ p t ɛ n t r j oː n ɛ m
m ɪ l oː r ɛ	m ɛ l j oː r ɛ m
s ɪ t uː l a m	s ɪ t ʊ l a m
s k r ʊ t aː r ɛ	s k r uː t aː r ɛ
ɪ w ʊ m	iː w ʊ m
f r aː t ɛ r n ɪ t aː t ɛ m	f r aː t ɛ r n ɪ t aː t ɛ m
p l aː n ɪ t j ɛ m	p l aː n ɪ t ɪ ɛ m
p r ɔ f ɛ r ɪ r ɛ	p r oː f ɛ rː ɛ
f ɛ r ɪ r ɪ	f ɛ r iː r ɛ
j a s p ɪ d ɛ m	j a s p ɪ d ɛ m
a aː	a k j a m
a tː ɛ s t a m r ɛ	a tː ɛ s t aː r iː
ɪ n f r ɪ ŋ g ɛ r ɛ	iː n f r ɪ ŋ g ɛ r ɛ
k ɔ n s ɪ s t ɛ r ɛ	k oː n s ɪ s t ɛ r ɛ
k a pː ɛ lː a m	k a pː ɛ lː a m
b ɪ l ɛ	b iː l ɛ m
ɪ ŋ g ɛ n j ʊ m s ʊ m	ɪ ŋ g ɛ n j oː s ʊ m
m uː n ɪ f ɪ k ɛ n t j a m	m uː n ɪ f ɪ k ɛ n t j a m
r ɛ w ɛ d r ɛ	r ɛ w ɪ d eː r ɛ
l aʊ d ɛ	l aʊ d ɛ m
w ɛ r ɪ f ɪ k aː r ɛ	w eː r ɪ f ɪ k aː r ɛ
ɪ m b ɛ k ɪ lː ɛ	ɪ m b eː k ɪ lː ʊ m
ɛ k s k l uː d ɛ r ɛ	ɛ k s k l uː d ɛ r ɛ
s p aː r g ɛ r ɛ	s p a r g ɛ r ɛ
l ɪ m ɪ t r oː f ɛ m	l iː m ɪ t r ɔ pʰ ʊ m
r a s ɛ k aː r ɛ	r ɛ s ɛ k aː r ɛ
k ɔ l oː s t r ʊ m m	k ɔ l ɔ s t r a m
t ɛ n ʊ ɛ	t ɛ n ʊ ɛ m
ɪ ŋ n ɔ r aː r ɛ	ɪ ŋ n oː r aː r ɛ
ɔ l aː r ʊ m	ɔ lː aː r j ʊ m
r a s t r ʊ m	r aː s t r ʊ m
p a r t ʊ r j ɛ n r ɛ m	p a r t ʊ r iː r ɛ
s a k ʊ d ɛ r ɛ	s ʊ kː ʊ t ɛ r ɛ
b oː t ʊ m	w oː t ʊ m
l uː k ɛ r n a m	l ʊ k ɛ r n a m
k r a m t ɪ k ʊ l a m	k r aː t ɪ k ʊ l a m
r ɛ s t aː r ɛ	r ɛ s t aː r ɛ
g r a n d ɪ k ʊ m	g r a n d ɪ n ɛ m
ɪ n mː aː r k ɛ s ɪ b ɛ l ɛ m	ɪ mː a r k ɛ s k ɪ b ɪ l ɛ m
k r ɛ d ɪ t oː r ɛ	k r eː d ɪ t oː r ɛ m
a fː ɛ k t j oː n ɛ m	a fː ɛ k t j oː n ɛ m
k ɔ ŋ g ʊ r aː t j oː n ɛ m	k ɔ n ɪ uː r aː t j oː n ɛ m
ɛ k s aʊ d ɪ r ɛ	ɛ k s aʊ d iː r ɛ
a s t ʊ t ʊ m	a s t uː t ʊ m
d ɛ k ɛ p t ɪ w ʊ m	d ɛ k ɛ p t iː w ʊ m
s ɪ k ɔ f a n t aː	s yː k ɔ pʰ a n t a m
ɔ l ɛ ʊ m s ʊ m	ɔ l ɛ oː s ʊ m
n ɔ m ɪ n aː r ɛ	n oː m ɪ n aː r ɛ
p r oː n ʊ m	p r oː n ʊ m
w ʊ l p ɪ n ʊ m	w ʊ l p iː n ʊ m
w ɛ r aː k ɛ	w eː r aː k ɛ m
ɛ k s t ɪ ŋ gʷ ɛ r ɛ m	ɛ k s t ɪ ŋ gʷ ɛ r ɛ
a lː ʊ ŋ g aː r ɛ	eː l ɔ ŋ g aː r ɛ
p ɛ t ʊ m	p eː d ɪ t ʊ m
s ʊ s p ɛ n d ɛ r ɛ	s ʊ s p ɛ n d ɛ r ɛ
a sː ɪ s t ɛ r ɛ	a sː ɪ s t ɛ r ɛ
w oː l a r ɛ	w ɔ l aː r ɛ
a lː uː k k ɛ	h a lː ʊ m
k ɛ r k aː r ɛ	k ɪ r k aː r ɛ
g ʊ s t ʊ m	g ʊ s t ʊ m
a s p ʊ m r t aː r ɛ	a s p ɔ r t aː r ɛ
f a b r ɪ k aː r ɛ	f a b r ɪ k aː r ɛ
s ʊ mː ɪ n ɪ s t r aː r ɛ m	s ʊ b m ɪ n ɪ s t r aː r ɛ
k ʊ p l a m	k oː p ʊ l a m
f a b r ɪ k aː t j oː n ɛ m	f aː b r ɪ k aː t j oː n ɛ m
b ɛ n ɛ f ɪ k j ʊ m	b ɛ n ɛ f ɪ k j ʊ m
k r ɔ k oː m	k r ɔ k ʊ m
w ɛ r ɪ t aː t ɛ m	w eː r ɪ t aː t ɛ m
d ɛ k l aː m aː r ɛ	d eː k l aː m aː r ɛ
r ɛ t r ɪ b ʊ ɛ r ɛ m	r ɛ t r ɪ b ʊ ɛ r ɛ
a m aː r ɛ t j a m	a m aː r ɪ t ɪ ɛ m
g a n ʊ m r ɛ	g a n aː r ɛ
a pː r ɛ h ɛ n s j oː n ɛ m	a pː r ɛ h ɛ n s j oː n ɛ m
s t r oː p ʊ m	s t r ɔ pː ʊ m
g a lː ɛ t a m	g a lː ɛ t a m
s k r ʊ t aː r ɛ	s k r uː t aː r iː
p ɛ r g ʊ r ʊ m	p ɛ r ɪ uː r ʊ m
ɪ n s ɪ ŋ n j a m	iː n s ɪ ŋ n ɛ
t r ɪ f ʊ l ʊ m	t r ɪ f ɔ l j ʊ m
uː s aː r j ʊ m	uː s w aː r j ʊ m
g l ɔ r j aː r ɛ	g l oː r j aː r iː
p r ɛ p oː s t ɛ m	p r aɪ p ɔ s ɪ t ʊ m
b ɛ n ɛ w ɔ l ʊ m	b ɛ n ɛ w ɔ l ʊ m
m a r t ɛ lː ʊ m	m a r t ɛ lː ʊ m
k a r a m	k a r a m
ɛ k s p ɔ r t aː t j oː n ɛ m	ɛ k s p ɔ r t aː t j oː n ɛ m
ɪ n t ɛ m p ɛ s t ɪ w ʊ m	ɪ n t ɛ m p ɛ s t iː w ʊ m
a b d uː k t j oː n ɛ m	a b d ʊ k t j oː n ɛ m
aʊ k k j ʊ m n ɛ	aʊ k t j oː n ɛ m
k a m ɪ n ʊ m	k a m iː n ʊ m
t ɪ t ʊ l aː r ɛ	t ɪ t ʊ l aː r ɛ m
m a sː a m	m a sː a m
l ʊ p a m	l ʊ p a m
ɪ n ɛ b r j a m r ɛ	ɪ n eː b r j aː r ɛ
aʊ r aː	aʊ r a m
r ɪ k t ʊ	r ɪ k t ʊ m
a b ɪ t aː l ɛ	h a b ɪ t w aː l ɛ m
s ɛ r ɛ m n a r ɛ	s ɛ r eː n aː r ɛ
f uː r oː r ɛ	f uː r aː r iː
k ɛ s p ɪ t ɛ m	k aɪ s p ɪ t ɛ m
ɪ m nː ʊ m	h y m n ʊ m
b oː aː r j ʊ m	b ɔ aː r j ʊ m
m ɛ d ɪ k aː r ɛ	m ɛ d ɪ k aː r ɛ
ɛ k l ɪ p sː ɛ	ɛ k l iː p s ɛ m
w ʊ l p ɛ	w ʊ l p ɛ m
k a l ɪ k ɛ m	k a l ɪ k ɛ m
m ɔ s t r aː r ɛ	m oː n s t r aː r ɛ
t r aː b aː l ʊ m	t r ɪ p aː l ɛ m
ɔ r aː r ɛ	oː r aː r ɛ
p ɪ n s ʊ m	p eː n s ʊ m
d ɛ g uː s t aː r ɛ	d eː g ʊ s t aː r ɛ
b ɔ m b aː r d a m	b ɔ m b a r d a m
ɪ p ɛ r t ɛ p t ɪ b l ɛ m ɛ m	ɪ m p ɛ r k ɛ p t ɪ b ɪ l ɛ m
a d aː m a n t ɛ m	a d a m a n t ɛ m
l ɪ n ɪ t aː r ɛ	l iː m ɪ t aː r ɛ
p ɔ r k ɪ n ʊ m	p ɔ r k iː n ʊ m
m ʊ r ɪ k ɛ m	m uː r ɪ k ɛ m
ɪ n w ɪ t aː r ɛ	ɪ n w iː t aː r ɛ
n uː k ɛ r ɛ	n ɔ k eː r ɛ
d ɛ t r aː ɛ r ɛ	d eː t r a h ɛ r ɛ
ɛ k s t r ɪ n t ɛ k ʊ m	ɛ k s t r iː n s ɛ k ʊ m
l ɪ n k k ɛ m	l y ŋ k ɛ m
n ɔ nː ʊ m	n ɔ nː ʊ m
m a n ʊ b r j ʊ m	m a n uː b r j ʊ m
n a t ɪ w ɪ t aː t ɛ m	n aː t iː w ɪ t aː t ɛ m
k a p t aː r ɛ	k a p t aː r ɛ
a w ɛ r s j oː n ɛ	aː w ɛ r s j oː n ɛ m
t a b ɛ r n a m	t a b ɛ r n a m
s ɔ m ɪ ɛ r ɛ m	s a g m aː r j ʊ m
a lː ɔ k ʊ t j oː n ɛ m	a lː ɔ k uː t j oː n ɛ m
t r uː k ʊ l ɛ n t ʊ m	t r ʊ k ʊ l ɛ n t ʊ m
m ɔ r t aː l ɪ t aː t ɛ m	m ɔ r t aː l ɪ t aː t ɛ m
s t ɔ l ɪ d ʊ m	s t ɔ l ɪ d ʊ m
r ʊ ɛ r	r ʊ ɛ r ɛ
p a d r ɛ m	p a t r ɛ m
s ʊ p ɛ r ɛ m pː oː n ɛ	s ʊ p ɛ r p oː n ɛ r ɛ
k a pː l ʊ m	k a p ʊ l ʊ m
d ɛ k ɔ rː ɛ r m ɛ	d eː k ʊ rː ɛ r ɛ
t r a n s uː b s t a n t j aː r ɛ	t r aː n s ʊ b s t a n t j aː r ɛ
ɔ kː aː s j oː n ɛ	ɔ kː aː s j oː n ɛ m
a m aː t oː r ɛ	a m aː t oː r ɛ m
a b ɪ t aː r ɛ	h a b ɪ t aː r ɛ
k r uː l d ɛ m t ɛ m	k r uː d eː l ɪ t aː t ɛ m
ʊ l t ʊ m r ɛ	ʊ l t oː r ɛ m
a b l aː kʷ ɛ aː t j ʊ m n ɛ m	a b l a kʷ ɛ aː t j oː n ɛ m
ɛ s t ʊ m	ɪ s t ʊ m
a rː ɔ g aː r ɛ	a rː ɔ g aː r ɛ
l ɛ w ɪ g a m r ɛ	l ɛ w ɪ g aː r ɛ
t oː r ɛ	t oː r ɛ m
k a w ʊ m	k a w ʊ m
t r aː m a m	t r aː m a m
d ɛ s w j a m r ɛ	d eː w j aː r ɛ
a k oː	a k ʊ m
g ɛ s t j oː n	g ɛ s t iː r ɛ
d ɪ m a n d aː r ɛ	d eː m a n d aː r ɛ
k ɔ n g ʊ n g ɛ r ɛ	k ɔ n j ʊ ŋ g ɛ r ɛ
t r ɪ g ɛ s ɪ m ʊ m	t r iː g eː s ɪ m ʊ m
n a t aː l ɪ t j ʊ m	n aː t aː l iː k j ʊ m
f ɛ r ʊ l aː	f ɛ r ʊ l a m
a w j ɛ s ʊ m	aː w ɛ r s ʊ m
p ɪ n t ʊ r a m	p ɪ k t uː r a m
ɛ r ɔ g aː r ɛ	eː r ɔ g aː r ɛ
t r aː b ɛ k ʊ l a m	t r a b eː k ʊ l a m
k ɔ kʷ ɛ	k ɔ kː ʊ m
m uː n ɪ r	m uː n iː r ɛ
s t r aː d a m	s t r aː t a m
ɪ n mː ʊ t aː r ɛ	ɪ mː uː t aː r ɛ
p l ɪ n ɪ t aː	p l eː n ɪ t aː t ɛ m
l uː k ɪ ʊ m l oː	ɛ lː y kʰ n j ʊ m
ɔ r k ʊ m	ɔ r k ʊ m
ɔ s t r ʊ	aʊ s t r ʊ m
ɔ p uː l ɛ n t ʊ m	ɔ p ʊ l ɛ n t ʊ m
ʊ ŋ g uː l aː t ʊ m	ʊ ŋ g ʊ l aː t ʊ m
s ɔ n ɔ r ʊ m	s ɔ n oː r ʊ m
ɪ nː ɔ w aː t j oː n ɛ m	ɪ nː ɔ w aː t j oː n ɛ m
k oː r ʊ m	kʰ ɔ r ʊ m
g r aː w a m r ɛ	g r a w aː r ɛ
ɔ d j ʊ m	ɔ d j ʊ m
j uː s t ʊ m	j uː s t ʊ m
w a k uː ɪ t aː t ɛ m	w a k ʊ ɪ t aː t ɛ m
k r ʊ k ɪ f ɛ r ʊ m	k r ʊ k ɪ f ɛ r ʊ m
l ɪ m ʊ m	l iː m ʊ m
ɪ n ʊ l t ʊ m	ɪ n ʊ l t ʊ m
d ɛ k r ɛ t ʊ m	d eː k r eː t ʊ m
k ɪ l ʊ m	k ɪ l j ʊ m
f ɪ d ɛ l ɛ	f ɪ d eː l ɛ m
d uː b ɪ t aː t j ʊ m n ɛ m	d ʊ b ɪ t aː t j oː n ɛ m
l oː k aː	l uː t ɛu m
n ʊ t r ɪ k ɛ	n uː t r iː k ɛ m
m a l ɛ	m a l ʊ m
k ʊ lː aː	k uː n a m
ɛ r ɔ ɛ	h eː r oː ɛ m
m a t r ɪ t ɪ d a m	m aː t r ɪ k iː d a m
t r ʊ n k aː r ɛ	t r ʊ ŋ k aː r ɛ
k ɔ nː ɛ k sː j oː n ɛ m	k ɔ nː ɛ k s j oː n ɛ m
p ɔ k ʊ m m	p aʊ k ʊ m
a s ɛ r t j oː n ɛ m	a sː ɛ r t j oː n ɛ m
k ɪ w ɪ k ʊ m	k iː w ɪ k ʊ m
ɔ p ɛ r ɪ r j ʊ m	ɔ p ɛ r aː r j ʊ m
g ɛ n j aː l ɛ	g ɛ n j aː l ɛ m
w ɪ t ʊ l ʊ	w ɪ t ʊ l ʊ m
f a k ɛ t ʊ m	f a k eː t ʊ m
l ɛ k t oː r ɛ	l eː k t oː r ɛ m
d aː m b uː l aː t j oː n ɛ m	d ɛ a m b ʊ l aː t j oː n ɛ m
s k r ʊ t ɪ n j ʊ m	s k r uː t ɪ n j ʊ m
k a r n aː r ʊ m	k a r n aː r j ʊ m
kʷ ɪ n kʷ ɛ n aː l ɛ	kʷ iː ŋ kʷ ɛ nː aː l ɛ m
r ɛ k l ɪ n aː r ɛ	r ɛ k l iː n aː r ɛ
s a kː uː l ʊ	s a kː ʊ l ʊ m
ɔ b l aː t j oː n ɛ m	ɔ b l aː t j oː n ɛ m
t ɔ l ɛ r ɛ	t ɔ lː ɛ r ɛ
m ɔ r t aː r j ʊ m	m ɔ r t w aː r j ʊ m
n ʊ p t j ɛ m s	n uː p t j aː s
t r a n s k r ɪ w ɛ r ɛ m	t r aː n s k r iː b ɛ r ɛ
d ɪ k t j oː n ɛ m	d ɪ k t j oː n ɛ m
r eː m ʊ m	r eː m ʊ m
ɛ l ɛ g aː n t ɛ m	eː l ɛ g a n t ɛ m
k a n t ɪ k ʊ m	k a n t ɪ k ʊ m
s ɛ g aː r ɛ	s ɛ k aː r ɛ
ɛ b r ɛ ʊ m	h ɛ b r aɪ ʊ m
n ɔ k ɛ t ʊ m	n ʊ k eː t ʊ m
p ɪ ŋ kʷ ɛ	p ɪ ŋ gʷ ɛ m
s ɪ m j ʊ m	s iː m j ʊ m
f r ɛ kʷ ɛ n t a m r ɛ	f r ɛ kʷ ɛ n t aː r ɛ
d ɔ t aː r ɛ	d oː t aː r ɛ
g a l ɛ r ʊ m	g a l eː r ʊ m
k f ɪ l ʊ l oː	f iː l ɪ ɔ l ʊ m
s ɛ p aː r aː r ɛ	s eː p a r aː r ɛ
n ɛ f aː r j ʊ m	n ɛ f aː r j ʊ m
k ʊ r ʊ m	k ɔ r j ʊ m
f ɪ k t j oː n ɛ m	f ɪ k t j oː n ɛ m
r ʊ t aː r ɛ	r ʊ k t aː r ɛ
ɪ m p aː r t ɪ r ɛ	ɪ m p a r t iː r ɛ
d ɪ sː ɪ m ʊ l aː t j ʊ m n ɛ m	d ɪ sː ɪ m ʊ l aː t j oː n ɛ m
d ɛ r aː t uː r a m	d iː r ɛ k t uː r a m
s ɛ r p ɛ n t ɪ n ʊ m	s ɛ r p ɛ n t iː n ʊ m
b r a n k a m	b r a ŋ k a m
g ɔ s ʊ m	g ɛu s j aː s
a l b ʊ m m ɛ	a l b uː m ɛ n
ɪ n f ɔ r m ɛ	iː n f oː r m ɛ m
f ɛ r w ɛ r ɛ	f ɛ r w eː r ɛ
m ɛ r ɪ t ɛ r ɛ	m ɛ r eː r ɛ
f r ɛ n aː r ɛ	f r eː n aː r ɛ
l ɪ d a m t oː r ɛ	l aʊ d aː t oː r ɛ m
s ɔ l ʊ m	s ɔ l j ʊ m
h ɛ lː ʊ m	ɛ lː ʊ m
p ʊ l w ɪ n aː r ɛ	p ʊ l w iː n a r
k ɔ n d ɛ m n a m t j oː n ɛ m	k ɔ n d ɛ m n aː t j oː n ɛ m
r ɛ g ʊ l aː r ɪ t aː t ɛ m	r eː g ʊ l aː r ɪ t aː t ɛ m
k ɔ n t ɛ n t j oː n ɛ m	k ɔ n t ɛ n t j oː n ɛ m
w ɔ l t aː r ɛ	w ɔ l uː t aː r ɛ
ɪ m p ɛ r aː r ɛ	ɪ m p ɛ r aː r ɛ
m ʊ s k a m	m ʊ s k a m
ɪ n k ʊ rː ɛ r ɛ	ɪ ŋ k ʊ rː ɛ r ɛ
s ʊ kː ʊ m b ɛ r ɛ	s ʊ kː ʊ m b ɛ r ɛ
