a k k ɛ d ɛ r ɛ	a kː eː d ɛ r ɛ
p uː ɛ aː r ɛ	p ʊ t eː r ɛ
l aʊ d ɛ m	l aʊ d ɛ m
s k ʊ rː ɛ r ɛ	ɛ k s k ʊ rː ɛ r ɛ
k r ɛ s p ʊ m	k r ɪ s p ʊ m
a t kː ɪ r ɪ r ɛ	a kː w iː r ɛ r ɛ
ɪ ŋ g ɛ n j ʊ m	ɪ ŋ g ɛ n j ʊ m
k ɪ k m ʊ m	k ɪ kː ʊ m
a r m aː m ɪ n t ʊ m	a r m aː m ɛ n t ʊ m
k ɔ n k ɪ s ʊ m	k ɔ ŋ k ɪ d ɛ r ɛ
f ɔ r m a m	f oː r m a m
s k r ɪ n j ʊ m	s k r iː n j ʊ m
p r ɔ s t ɪ t ʊ ɪ r ɛ	p r oː s t ɪ t ʊ ɛ r ɛ
s k ɔ t j a m	s k ɔ t j a m
f ɪ l j aː s t r ʊ m	f iː l j a s t r ʊ m
w ɪ n k ʊ l aː r ɛ	w ɪ ŋ k ʊ l aː r ɛ
n aː sː a m	n a sː a m
ɪ n kʷ j ɛ t aː r ɛ	ɪ ŋ kʷ ɪ eː t aː r ɛ
m ɪ l oː r ɛ	m ɛ l j oː r ɛ m
r ɪ g ʊ r oː s ʊ m	r ɪ g ɔ r ɔ s ʊ m
ɪ n f r ɛ n aː r ɛ	iː n f r eː n aː r ɛ
k ʊ r a t ʊ r a m	k uː r aː t uː r a m
k r ɪ b r aː r ɛ	k r iː b r aː r ɛ
a r m ɪ l a m	a r m ɪ lː a m
d ɛ n uː d aː t j oː n ɛ m	d eː n uː d aː t j oː n ɛ m
d ɛ t ɛ r m ɪ n aː t j ɔ n ɛ	d eː t ɛ r m ɪ n aː t j oː n ɛ m
ɛ l aː t j oː n ɛ m	eː l aː t j oː n ɛ m
p ɪ t ʊ m	p iː k ʊ m
g r aː t ɪ t ɛ m m	g r aː t ɪ t uː d ɪ n ɛ m
f ɪ d ɛ l ɛ	f ɪ d eː l ɛ m
m ɛ t ɛ r ɛ	m ɪ tː ɛ r ɛ
k ɔ n mː uː t aː r ɛ	k ɔ mː uː t aː r ɛ
kʷ ɪ n kʷ ɛ nː aː l ɛ	kʷ iː ŋ kʷ ɛ nː aː l ɛ m
l ʊ n aː t j ʊ m n ɛ m	l uː n aː t j oː n ɛ m
f ɛ ʊ d ʊ m	f ɛu d ʊ m
k ɔ n f ɛ s aː r	k oː n f ɪ t eː r iː
s ɛ r p ɛ n t ɪ n ʊ m	s ɛ r p ɛ n t iː n ʊ m
s ɛ k uː r ɛ m	s ɛ k uː r ɛ m
ɛ r b aː r j ʊ m	h ɛ r b aː r j ʊ m
t r a n s f ɛ r ɛ r	t r aː n s f ɛ rː ɛ
p uː p ɪ lː ʊ m	p uː p ɪ lː ʊ m
t ɪ t ʊ l aː r ɛ	t ɪ t ʊ l aː r ɛ m
f l ɛ k t ɪ r ɛ	f l ɛ k t ɛ r ɛ
k ɔ mː ɛ r k j aː l ɛ	k ɔ mː ɛ r k j aː l ɛ m
s k r uː p uː l oː s ʊ m	s k r uː p ʊ l oː s ʊ m
a b aː l ɪ ɛ n aː t j oː n ɛ m	a b a l ɪ eː n aː t j oː n ɛ m
s aː n j ɛ m	s a n ɪ ɛ m
w ɪ r aː g ʊ m	w ɪ r aː g ɪ n ɛ m
d ɛ m ɔ n s t r aː r ɛ	d eː m oː n s t r aː r ɛ
f r ɛ kʷ ɛ n t a m r ɛ	f r ɛ kʷ ɛ n t aː r ɛ
n aː t uː r a m	n aː t uː r a m
ɪ n f ɛ l ɪ k ɛ	iː n f eː l iː k ɛ m
a g ɪ l ɪ t aː t ɛ m	a g ɪ l ɪ t aː t ɛ m
a p ɔ s t oː l ʊ m	a p ɔ s t ɔ l ʊ m
k ɔ n t aː r ɛ	k ɔ m p ʊ t aː r ɛ
k ɔ n d ɛ n s aː t j oː n ɛ m	k ɔ n d eː n s aː t j oː n ɛ m
m aː n t ɛ b ʊ m	m a ŋ k ɪ p ɛ m
w ɛ n ɛ r aː r ɛ	w ɛ n ɛ r aː r iː
ɔ s p ɪ t aː l ɛ	h ɔ s p ɪ t aː l ɛ
l a t r aː r ɛ	l a t r oː n ɛ m
a n s a m	aː n s a m
r ɛ g ʊ l aː r ɛ	r eː g ʊ l aː r ɛ m
kʷ aː l ɪ t aː t ɛ m	kʷ aː l ɪ t aː t ɛ m
a r aː b ɪ l ɛ	a r aː b ɪ l ɛ m
k l ɛ m ɛ n t ɪ sː ɪ m ʊ m	k l eː m eː n t ɪ sː ɪ m ʊ m
f ɪ r ɛ	f ɪ ɛ r iː
t r ɛ m ʊ l ʊ m	t r ɛ m ʊ l ʊ m
m uː g ɪ r ɛ	m uː g iː r ɛ
n aː w ɛ m	n aː w ɛ m
p r ɛ n ʊ m	p r aɪ ŋ n aː t ɛ m
f uː r j oː s ʊ m	f ʊ r j oː s ʊ m
s ʊ b t ɪ l ɪ t ɛ m	s ʊ b t iː l ɪ t aː t ɛ m
g uː m ɛ n t ʊ m	j uː m ɛ n t ʊ m
g r aː k ʊ a m	g r aː k ʊ l a m
f aː s t ɪ d j ʊ m	f a s t iː d j ʊ m
r ɛ p ɛ lː ɛ r ɛ	r ɛ p ɛ lː ɛ r ɛ
b aː s ɪ l ɪ k a m	b a s ɪ l ɪ k a m
t ʊ r m ɛ n t ʊ m	t ɔ r m ɛ n t ʊ m
m a l ɛ d ɪ k ɛ r ɛ	m a l ɛ d iː k ɛ r ɛ
m ɛ m w ɛ r ʊ m	w eː r ʊ m
ɔ r j ɪ ɛ n t ɛ m	ɔ r ɪ ɛ n t ɛ m
a s t r ʊ m	a s t r ʊ m
l ʊ d ɪ b r j ʊ m	l uː d iː b r j ʊ m
ɪ m p ɛ r aː t oː r j ʊ m	ɪ m p ɛ r aː t oː r j ʊ m
ɔ k ɪ d ɛ r ɛ	ɔ kː ɪ d ɛ r ɛ
k ɔ s t uː m ɛ m	k oː n s ʊ eː t uː d ɪ n ɛ m
ɔ l ɪ r ɛ	ɔ l eː r ɛ
t ɪ n j a m	t ɪ n ɛ a m
r ɛ w ɛ r ɛ n t ɛ m	r ɛ w ɛ r ɛ n t ɛ m
p ʊ b ɛ m	p uː b ɛ r ɛ m
s p ɛ k ɪ f ɪ k ʊ m	s p ɛ k ɪ f ɪ k ʊ m
ɪ n ɔ b ɪ l ɛ	ɪ ŋ n oː b ɪ l ɛ m
g ʊ g ʊ l a m	z iː z y pʰ ʊ m
n ɛ p ɛ t ɛ m a m	n ɛ p ɛ t a m
k a n t oː n ɛ m	k a n t j oː n ɛ m
a l t ɛ r k aː r ɛ	a l t ɛ r k aː r iː
k oː r s ʊ m	k ɔ r s ʊ m
k aʊ t j oː n ɛ	k aʊ t j oː n ɛ m
s aː k r ɪ l ɛ g ʊ m	s a k r ɪ l ɛ g ʊ m
ɔ ɪ k ʊ m s ʊ m	ɔ fː ɪ k j oː s ʊ m
m ɪ r aː k oː l ʊ m	m iː r aː k ʊ l ʊ m
m ɪ l ɪ t ɛ m	m iː l ɪ t ɛ m
p ɛ kː aː t oː r ɛ	p ɛ kː aː t oː r ɛ m
f ɛ r w ɛ r ɛ	f ɛ r w eː r ɛ
s a ŋ gʷ ɪ n aː r j ʊ m	s a ŋ gʷ ɪ n aː r j ʊ m
n aː d aː d oː r ɛ	n a t aː t oː r ɛ m
r ɛ g ʊ l aː r ɪ t aː t ɛ m	r eː g ʊ l aː r ɪ t aː t ɛ m
ɛ k s ɪ gʷ ʊ m	ɛ k s ɪ gʷ ʊ m
m a k ɛ lː ʊ m	m a k ɛ lː ʊ m
m aː t r ɪ k ʊ l a m	m aː t r iː k ʊ l a m
aː lː ʊ ŋ g aː r ɛ	eː l ɔ ŋ g aː r ɛ
s t ɔ l ɪ d ʊ m	s t ɔ l ɪ d ʊ m
s t ɛ l aː r	s t eː lː aː r ɛ m
j uː s t ɪ f ɪ k aː t j oː n ɛ	j uː s t ɪ f ɪ k aː t j oː n ɛ m
a m ɛ lː a m	a ŋ n ɛ lː a m
l a p aː a m	a l a p a m
b aː r b aː r ɪ d zː aː r ɛ	b a r b a r iː zː aː r ɛ
s k aː p ʊ l a m	s k a p ʊ l a m
a l ɪ t ʊ m	h aː l ɪ t ʊ m
d ɛ m oː n j ʊ m	d aɪ m ɔ n j ʊ m
ɛ d ɪ f ɪ k aː r ɛ	aɪ d ɪ f ɪ k aː r ɛ
n ɛ m ɔ r aː l ɛ	n ɛ m ɔ r aː l ɛ m
t ɛ r ʊ m	t ɔ r ʊ m
t a r d ɪ	t a r d ʊ m
kʷ a t r aː t ʊ m	kʷ a d r aː t ʊ m
a m ɔ w ɪ b ɪ l ɛ	aː m ɔ w eː r ɛ
a r d ʊ m	a r d ʊː m
ɪ p ɔ t ɛ k a m	h y p ɔ tʰ eː k a m
k aː d uː k ʊ m	k a d uː k ʊ m
ɛ m ʊ l aː t oː r ɛ	aɪ m ʊ l aː t oː r ɛ m
s aː p eː r ɛ	s a p ɛ r ɛ
k l ʊ a m r ɛ	g l oː k iː r ɛ
w ɛ r g ɪ ɛ l y ɛ	w ɪ r ɪ d aː r j ʊ m
g l ɔ r j ɔ s ɪ sː ɪ m ʊ m	g l oː r j oː s ɪ sː ɪ m ʊ m
a d ɪ p ɛ m	a d ɪ p ɛ m
d ɛ t ɛ n ɛ r ɛ	d eː t ɪ n eː r ɛ
a r k aː n ʊ m	a r k aː n ʊ m
t oː r w ʊ m	t ɔ r w ʊ m
j uː g ʊ l aː r ɛ	j ʊ g ʊ l aː r ɛ
m aː l ɛ d ɪ k t j oː n ɛ m	m a l ɛ d ɪ k t j oː n ɛ m
ɛ k s ɪ g ɛ r ɛ	ɛ k s ɪ g ɛ r ɛ
r ɛ l ɛ w aː r ɛ	r ɛ l ɛ w aː r ɛ
t ɛ n t aː r ɛ	t ɛ n t aː r ɛ
ɪ n t aː m p ɛ s t ɪ w ɪ t aː t ɛ m	ɪ n t ɛ m p ɛ s t iː w ɪ t aː t ɛ m
b ɛ r ɪ lː ʊ m	b eː r y lː ʊ m
t ɛ n s j oː n ɛ	t eː n s j oː n ɛ m
uː s w ʊ aː l ɛ	uː s w aː l ɛ m
p r ɛ p ɔ s t ɛ r ʊ m	p r aɪ p ɔ s t ɛ r ʊ m
f ɪ l ɔ s ɔ f j a m	pʰ ɪ l ɔ s ɔ pʰ j a m
m ɛ s ɛ r ɛ	m ɪ s k eː r ɛ
m aː t ɛ r n ʊ m m	m aː t ɛ r n ʊ m
m ʊ n ɪ f ɪ k ʊ m	m uː n ɪ f ɪ k ʊ m
k ɔ p ʊ l aː t j oː n ɛ m	k oː p ʊ l aː t j oː n ɛ m
m aː n t ɛ n ɛ r ɛ	m a n ʊ t ɛ n eː r ɛ
f ɛ n ɪ k j ʊ m	pʰ ɔ ɪ n iː k ɛu m
m uː n ɪ k ɪ p j ʊ m	m uː n ɪ k ɪ p j ʊ m
a m ɛ l ʊ m	a ŋ n ɛ lː ʊ m
g ɛ m ɛ l ʊ m	g ɛ m ɛ lː ʊ m
d ɛ p uː r aː r ɛ	d eː p uː r aː r ɛ
h k ɛ	kʷ ɛ m
k ɛ l t a m	k ɛ l t a m
p r ɪ m ɔ g ɛ n ɪ t ʊ m	p r iː m oː g ɛ n ɪ t ʊ m
w ɔ l t aː r ɛ	w ɔ l uː t aː r ɛ
a d ʊ n aː r ɛ	a d uː n aː r ɛ
g ɛ mː a m	g ɛ mː a m
k aː mː ɪ n ʊ m	k a mː iː n ʊ m
b aː j m aː r ɛ	b aː j ʊ l aː r ɛ
ɔ b w j aː r ɛ	ɔ b w j aː r ɛ
d ɔ n ɛ m ɔ s t aː r ɛ	d ɛ h ɔ n ɛ s t aː r ɛ
f ɔ r aː r ɛ	f ɔ r aː r ɛ
r ɛ s p ɔ n s ʊ m	r ɛ s p oː n s ʊ m
ɔ b s k uː r ʊ m	ɔ b s k uː r ʊ m
kʷ ɛ s ɪ t ʊ m	kʷ aɪ s iː t ʊ m
m j ɛ d ʊ m	m ɛ t ʊ m
f aː m oː s ʊ m	f aː m oː s ʊ m
ɪ n d aː g aː r ɛ	ɪ n d aː g aː r ɛ
p r ɔ t ɛ s t aː t j oː n ɛ m	p r oː t ɛ s t aː t j oː n ɛ m
f uː n ɛ b r ɛ m	f uː n ɛ b r ɛ m
t r uː k uː l ɛ n t ʊ m	t r ʊ k ʊ l ɛ n t ʊ m
s aː s ʊ m	s a k s ʊ m
ɔ w eː l a m	ɔ w ɪ k ʊ l a m
l aː p ɪ d aː r ɛ	l a p ɪ d aː r ɛ
k aː r n aː r ʊ m	k a r n aː r j ʊ m
m ɛ n d aː k ɛ m	m ɛ n d aː k ɛ m
p ɔ sː ɛ sː j oː n ɛ m	p ɔ sː ɛ sː j oː n ɛ m
ɪ n t ɛ r d ɪ k ɛ	ɪ n t ɛ r d iː k ɛ r ɛ
s ʊ p r ɛ sː ɛ d eː r ɛ	s ʊ p ɛ r s ɛ d eː r ɛ
ɔ s t ɛ n s ɪ w ʊ m	ɔ s t eː n s iː w ʊ m
w eː l a m	w eː l ʊ m
m ɪ t ɪ g aː r ɛ	m iː t ɪ g aː r ɛ
d ɛ n t aː t ʊ m	d ɛ n t aː t ʊ m
ɔ b s ɛ k j ʊ m s ʊ m	ɔ b s ɛ kʷ j oː s ʊ m
ɪ n t ɛ n t j oː n ɛ m	ɪ n t ɛ n t j oː n ɛ m
b aː s j aː r ɛ	b aː s j aː r ɛ
d ɪ s k r ɪ m ɪ n aː t j oː n ɛ m	d ɪ s k r iː m ɪ n aː t j oː n ɛ m
l aː b oː r ɛ m	l a b oː r ɛ m
t a n t ʊ m	t a n t ʊ m
s p aː r g ɛ r ɛ	s p a r g ɛ r ɛ
d ɛ s ɪ s t ɛ r	d eː s ɪ s t ɛ r ɛ
p ɛ d ɛ s t r ɛ m	p ɛ d ɛ s t r ɛ m
a d ɪ k t ʊ m	a dː ɪ k t ʊ m
r ɔ t aː r ɛ	r ɔ t aː r ɛ
k ɪ n j ɛ n t ɔ s	kʷ iː ŋ g ɛ n t oː s
s aː k ʊ d ɛ r	s ʊ kː ʊ t ɛ r ɛ
m ɔ r ɪ b ʊ n d ʊ m	m ɔ r ɪ b ʊ n d ʊ m
f ɛ n d ɛ r ɛ	f ɪ n d ɛ r ɛ
k ɔ m p r ɔ m ɛ t ɛ r ɛ	k ɔ m p r oː m ɪ tː ɛ r ɛ
r ɛ g ɛ r ɛ	r ɛ g ɛ r ɛ
k ɔ n k l aː m a m r ɛ	k ɔ ŋ k l aː m aː r ɛ
b ʊ w aː r ʊ m	b ɔ w aː r j ʊ m
t ɛ s t ʊ d ɪ n ɛ m	t ɛ s t uː d ɪ n ɛ m
kʷ aː d r ɪ l aː t ɛ r ʊ m	kʷ a d r ɪ l a t ɛ r ʊ m
s ʊ s p ɛ t ɛ m	s ʊ s p ɛ k t j oː n ɛ m
p r ɪ s oː n ɛ m	p r ɛ h ɛ n s j oː n ɛ m
a b aː t j ɛ aː l	a bː aː t j aː l ɛ m
p aː r t ɪ r ɛ	p a r t iː r ɛ
s a l uː t aː t j oː n ɛ	s a l uː t aː t j oː n ɛ m
k ɛ d ɛ r ɛ	k eː d ɛ r ɛ
b aː s ɪ l ɪ s k ʊ m	b a s ɪ l ɪ s k ʊ m
ɛ l oː s ʊ m	z eː l oː s ʊ m
p ɔ r k a m	p ɔ r k a m
m ɛ d ɪ k ɪ n aː l ɛ	m ɛ d ɪ k iː n aː l ɛ m
ɛ w ɔ l k w ɛ r ɛ	eː w ɔ l w ɛ r ɛ
b ʊ lː a m	b ʊ lː a m
g ɛ r ɛ r	g ɛ r ɛ r ɛ
s t ɪ r p ɛ m	s t ɪ r p ɛ m
l ʊ t r d ʊ m	l uː r ɪ d ʊ m
uː s uː r aː r j ʊ m	uː s uː r aː r j ʊ m
s a l t ʊ m	s a l t ʊ m
m t ɛ m p ɛ r aː r ɛ	t ɛ m p ɛ r aː r ɛ
f ɛ k ʊ n d oː	f eː k ʊ n d ʊ m
t ɪ n a m	t iː n a m
k ɛ l ɛ b r aː t j oː n ɛ m	k ɛ l ɛ b r aː t j oː n ɛ m
g ɔ d ɛ r ɛ	g aʊ d eː r ɛ
a pː l aʊ s ʊ m	a pː l aʊ s ʊ m
d ɛ f ɛ n s oː r ɛ	d eː f eː n s oː r ɛ m
r ɛ p r ɛ h ɛ n s j oː n ɛ m	r ɛ p r ɛ h ɛ n s j oː n ɛ m
ɪ m b ɛ k ɪ lː ɪ t aː t ɛ m	ɪ m b eː k ɪ lː ɪ t aː t ɛ m
ɪ n ɛ b r j aː r ɛ	ɪ n eː b r j aː r ɛ
r ʊ t ɪ l aː r ɛ	r ʊ t ɪ l aː r ɛ
s aː k r aː m ɛ n t aː l ɛ	s a k r aː m ɛ n t aː l ɛ m
l ɛ k t oː r ɛ	l eː k t oː r ɛ m
ɛ l ɛ w aː r ɛ	eː l ɛ w aː r ɛ
l oː t a m	l uː t ɛu m
s ɪ d ɛ r ɛ ʊ m	s iː d ɛ r ɛu m
n ɔ t ɔ r j ʊ m	n oː t oː r j ʊ m
f aː s t ʊ m	f aː s t ʊ m
g ɛ m ɪ n aː t j oː n ɛ m	g ɛ m ɪ n aː t j oː n ɛ m
ɪ n t ɛ r g ɛ k t j oː n	ɪ n t ɛ r j ɛ k t j oː n ɛ m
p ɪ s m p a d ʊ m	ɛ p ɪ s k ɔ p aː t ʊ m
k ʊ p uː l aː r ɛ	k oː p ʊ l aː r ɛ
ɔ t j ʊ m	oː t j ʊ m
s a ŋ gʷ ɪ n ɔ l ɛ n t ʊ m	s a ŋ gʷ ɪ n ɔ l ɛ n t ʊ m
ɪ n mː ɔ l aː t j oː n ɛ m	ɪ mː ɔ l aː t j oː n ɛ m
t ʊ b ɛ r ɔ s ʊ m	t uː b ɛ r oː s ʊ m
ɪ ŋ gʷ ɪ n ɛ m	ɪ ŋ gʷ ɛ n
p j ɛ r n a m	p ɛ r n a m
w oː m ɪ t ʊ m	w ɔ m ɪ t ʊ m
m ɛ r aː n d a m	m ɛ r ɛ n d a m
k ɔ n k ɛ r n ɛ r ɛ	k ɔ ŋ k ɛ r n ɛ r ɛ
ɔ r t ʊ m	h ɔ r t ʊ m
a r b ɛ t ʊ m	a r b ʊ t ʊ m
k ɪ r k ʊ n f l ʊ ɪ r ɛ	k ɪ r k ʊ m f l ʊ ɛ r ɛ
m aː t aː r ɛ	m a k t aː r ɛ
s ɪ g m r	s eː k uː r ʊ m
t r aː j l a m	t r aː g ʊ l a m
t ɔ r n ʊ m	t ɔ r n ʊ m
k ɔ n s a ŋ gʷ ɪ n ɪ t aː t ɛ m	k oː n s a ŋ gʷ ɪ n ɪ t aː t ɛ m
ʊ l t ɛ r j ɔ r ɛ	ʊ l t ɛ r j oː r ɛ m
ʊ s ɪ n ɔ l ʊ m	l ʊ s k ɪ n j a m
t ɛ r ɛ b r a m	t ɛ r ɛ b r a m
uː l k ɛ r a m	ʊ l k ʊ s
r ɛ t ɛ n ɛ r ɛ	r ɛ t ɪ n eː r ɛ
k r j aː t uː r a m	k r ɛ aː t uː r a m
r ɛ f r ɪ g ɛ r j ʊ m	r eː f r iː g ɛ r j ʊ m
l uː k r aː r ɛ	l ʊ k r aː r iː
l a ŋ gʷ ɪ d ʊ m	l a ŋ gʷ ɪ d ʊ m
p r oː w ɛ d eː r ɛ	p r oː w ɪ d eː r ɛ
f a b r ɪ k aː r ɛ	f a b r ɪ k aː r ɛ
uː s aː r j ʊ m	uː s w aː r j ʊ m
a kː ɔ rː ɛ r ɛ	a kː ʊ rː ɛ r ɛ
p r ɛ j uː d ɪ k aː r ɛ	p r aɪ j uː d ɪ k aː r ɛ
a g aː r ɪ k ʊ m	a g a r ɪ k ʊ m
ɪ w ɪ k k ɛ	iː b ɪ k ɛ m
n aʊ s j aː b ʊ n d ʊ m	n aʊ s ɛ aː b ʊ n d ʊ m
a r k a ŋ g ɛ l ʊ m	a r kʰ a ŋ g ɛ l ʊ m
s aː k r aː r ɛ	s a k r aː r ɛ
a w ɛ n a m	a w eː n a m
uː r g ɛ r ɛ	ʊ r g eː r ɛ
s k j ɛ m m ʊ l ʊ m	s k ɪ uː r ʊ m
ɪ n ɛ m mː ʊ t aː r	ɪ mː uː t aː r ɛ
t m ɛ s aʊ r ʊ m	tʰ eː s aʊ r ʊ m
a sː ɪ d ʊ m	a sː ɪ d ʊː m
a b sː ɔ l b ɛ r ɛ	a b s ɔ l w ɛ r ɛ
s ɛ r ɛ n aː r ɛ	s ɛ r eː n aː r ɛ
t r aː k j ʊ m	tʰ r aː k j ʊ m
a m a r ɛ t j a m	a m aː r ɪ t ɪ ɛ m
p r ɪ n k ɪ p aː l ɪ t aː t ɛ m	p r ɪ ŋ k ɪ p aː l ɪ t aː t ɛ m
s k r ʊ t aː r	s k r uː t aː r iː
p a l oː	p aː l ʊ m
t uː	t uː
k ɛ sː aː r ɛ	k ɛ sː aː r ɛ
a l n ʊ m	a l n ʊ m
b l a n d ʊ m	b l a n d ʊ m
f uː r ɪ b ʊ n d ʊ m	f ʊ r ɪ b ʊ n d ʊ m
w ɛ s t ɪ t ʊ m	w ɛ s t iː t ʊ m
t ɛ m ɛ r ɪ t aː t ɛ m	t ɛ m ɛ r ɪ t aː t ɛ m
f r aː k s ɪ n ɪ ʊ m	f r a k s ɪ n ɛu m
ɔ p r ɔ b r j ʊ m	ɔ pː r ɔ b r j ʊ m
p r ɔ k aː k ɛ	p r ɔ k aː k ɛ m
p r ɛ w ɛ r ɛ	p r aɪ w ɪ d eː r ɛ
d ɪ sː ɛ k aː r ɛ	d ɪ sː ɛ k aː r ɛ
t j ɛ p ɪ d ʊ m	t ɛ p ɪ d ʊ m
t ɔ r t ɪ l ɛ	t ɔ r t ɪ l ɛ m
r ɛ p r ɛ h ɛ n s ɪ b ɪ l ɛ	r ɛ p r ɛ h ɛ n s ɪ b ɪ l ɛ m
g l ʊ t ɪ n ɛ	g l uː t ɛ n
k ʊ j	k uː j ʊ m
p aː k t ʊ m	p a k t ʊ m
k a b l ʊ m	k a p ʊ l ʊ m
s eː r a m	s eː r ʊ m
p ɛ t ʊ m	p eː d ɪ t ʊ m
k ɔ m p l ɛ m ɛ n t ʊ m	k ɔ m p l eː m ɛ n t ʊ m
l ɪ b ɛ l ʊ m	l ɪ b ɛ lː ʊ m
ɪ n mː uː n ɛ m	ɪ mː uː n ɛ m
l aː r t ʊ m	l a r d ʊ m
ɪ n ʊ s ɪ t aː t ʊ m	ɪ n uː s ɪ t aː t ʊ m
f ɪ k t j oː n ɛ m	f ɪ k t j oː n ɛ m
p ɛ r s w aː d ɛ r ɛ	p ɛ r s w aː d eː r ɛ
l uː n aː r ɛ	l uː n aː r ɛ m
m ɔ d ɪ k ʊ m	m ɔ d ɪ k ʊ m
s p ɔ s a m	s p oː n s a m
ɛ d ɪ k ɔ l a m	aɪ d ɪ k ʊ l a m
a b ɛ t ʊ m	a b ɪ eː t ɛ m
b ɛ n ɛ f ɪ k ʊ m	b ɛ n ɛ f ɪ k ʊ m
t r a n s k r ɪ w ɛ r ɛ	t r aː n s k r iː b ɛ r ɛ
aʊ k k j ɔ n ɛ	aʊ k t j oː n ɛ m
uː r b ɛ m	ʊ r b ɛ m
b r ɪ ɛ w ɛ t aː t ɛ m	b r ɛ w ɪ t aː t ɛ m
uː b ɛ r ʊ m	uː b ɛ r
t ɛ n t aː r ɛ	t ɛ m p t aː r ɛ
s t r j a m	s t r j a m
b ʊ k ɪ n a m	b uː k ɪ n a m
d ɪ s p ɛ r g ɛ r ɛ	d ɪ s p ɛ r g ɛ r ɛ
a b sː uː r d ɪ t aː t ɛ m	a b s ʊ r d ɪ t aː t ɛ m
ɛ ɛ m ɪ n a m r ɛ	ɛ fː eː m ɪ n aː r ɛ
k aː l ɪ d ɪ t ɛ m	k a l ɪ d ɪ t aː t ɛ m
k ɔ ɛ r t ɪ m j oː n	k ɔ ɪ r k ɪ t j oː n ɛ m
k aː r b ʊ n k ʊ l ʊ m	k a r b ʊ ŋ k ʊ l ʊ m
k aː k ɪ d aː t ɛ m	a k ɪ d ɪ t aː t ɛ m
f r ɔ n t oː n ɛ m	f r ɔ n t oː n ɛ m
uː m ɪ d ʊ m	h uː m ɪ d ʊ m
d ɪ s t ɛ n d ɛ r ɛ	d ɪ s t ɛ n d ɛ r ɛ
ɔ n k l	a w ʊ ŋ k ʊ l ʊ m
w ɛ r ɛ k ʊ n d ʊ m	w ɛ r eː k ʊ n d ʊ m
k aː l a m ʊ m m	k a l a m ʊ m
ɪ n t ɛ r w ɛ r t ɪ r	ɪ n t ɛ r w ɛ r t ɛ r ɛ
w ɛ t r ɪ k ɛ	w iː t ɪ k ɛ m
g ɛ n t ɪ l ɛ m	g ɛ n t iː l ɛ m
n ʊ t r ɪ t a m	n uː t r iː k j ʊ m
s ʊ p r ɛ m nː aː t ʊ r aː l ɛ	s ʊ p ɛ r n aː t uː r aː l ɛ m
s ɔ lː ɛ k ɪ t ʊ m	s ɔ lː ɪ k ɪ t ʊ m
p r oː a m	p r oː r a m
m ɪ s t ɪ k ʊ m	m y s t ɪ k ʊ m
k ɔ n w ɔ k aː r ɛ	k ɔ n w ɔ k aː r ɛ
m aː n ɪ p ʊ l ʊ m	m a n ɪ p ʊ l ʊ m
k ɔ n k ʊ r s ʊ m	k ɔ ŋ k ʊ r s ʊ m
g uː s t aː t j oː n ɛ m	g ʊ s t aː t j oː n ɛ m
a pː ɔ r t aː r ɛ	a pː ɔ r t aː r ɛ
ɪ n k aʊ t ʊ m	ɪ ŋ k aʊ t ʊ m
a ŋ g ɛ l ɪ k ʊ m	a ŋ g ɛ l ɪ k ʊ m
ɪ r s ʊ t ʊ m	h ɪ r s uː t ʊ m
ɪ rː ɪ g aː r ɛ	ɪ rː ɪ g aː r ɛ
p ɛ r k ʊ t ɛ r	p ɛ r k ʊ t ɛ r ɛ
aʊ k m ɛ n t aː t j oː n ɛ m	aʊ g m ɛ n t aː t j oː n ɛ m
a r b uː s t ɪ w ʊ m	a r b ʊ s t iː w ʊ m
ɔ r b k ɛ m	ɔ r b ɛ m
b a l aː r ɛ	b aː l aː r ɛ
k ɛ sː aː t j oː n ɛ m	k ɛ sː aː t j oː n ɛ m
k ɛ r w ʊ a m	k ɛ r w ɪ s j a m
k ɔ n s ɔ l ɪ d aː r ɛ	k oː n s ɔ l ɪ d aː r ɛ
r ɪ p a m	r iː p a m
r ʊ ɪ n oː s ʊ m	r ʊ iː n oː s ʊ m
aʊ d aː k ɛ	aʊ d aː k ɛ m
l ɛ t ɪ t j a m m	l aɪ t ɪ t j a m
f l uː ɪ r ɛ	f l ʊ ɛ r ɛ
r ɛ k ɛ t a m	r ɛ k ɛ p t a m
s j ɛ rː a m	s ɛ rː a m
a r m aː t ʊ m	a r m aː t ʊ m
p ɛ kː aː r ɛ	p ɛ kː aː r ɛ
d ɛ l ɛ k t aː t j oː n ɛ m	d eː l ɛ k t aː t j oː n ɛ m
b ɪ l ɛ m	b iː l ɛ m
l ɪ ɛ t ʊ m	l aɪ t ʊ m
a n t r ʊ m	a n t r ʊ m
p a s t oː r ɛ	p aː s t oː r ɛ m
m ʊ d ɛ r	m ɔ l ɛ r ɛ
ɛ t ɛ r ɛ	aɪ tʰ ɛ r ɛ m
k ɔ r n j ɛ ʊ m	k ɔ r n ɛu m
ɛ k k ɛ lː ɛ n t j a m	ɛ k s k ɛ lː ɛ n t j a m
a t ɪ t aː r ɛ	oː s k ɪ t aː r ɛ
m ɛ r ɪ d j ɔ n aː l ɛ	m ɛ r iː d j oː n aː l ɛ m
w aː g aː r ɛ	w a g aː r iː
d ɪ f ɛ n s j oː n ɛ m	d eː f eː n s j oː n ɛ m
p r ɛ s aː r ɛ	p r ɛ t j aː r ɛ
t ɪ t ɪ lː a m r ɛ	t iː t ɪ lː aː r ɛ
b r ʊ k ʊ m	b r uː kʰ ʊ m
a pː a r aː r ɛ	a pː a r aː r ɛ
l ɪ n k k ɛ m	l y ŋ k ɛ m
p ɛ r n ɪ k j oː s ʊ m	p ɛ r n ɪ k j oː s ʊ m
k ʊ k ʊ m	k ɔ kʷ ʊ m
s ɛ rː aː r ɛ	s ɛ rː aː r ɛ
a d ɪ ʊ ŋ k t j oː n ɛ m	a d j ʊ ŋ k t j oː n ɛ m
ɪ n s t r ʊ ɪ r ɛ	iː n s t r ʊ ɛ r ɛ
r oː t ɛ lː a m	r ɔ t ɛ lː a m
s t ɪ w aː r ɛ	s t iː p aː r ɛ
s t uː p r ʊ m	s t ʊ p r ʊ m
