g l aʊ k ʊ m	g l aʊ k ʊ m
b ʊ w aː r ʊ m	b ɔ w aː r j ʊ m
a n s a m	aː n s a m
k ɪ n t ʊ m	k ɪ ŋ k t ʊ m
k r ɪ s p aː r ɛ	k r ɪ s p aː r ɛ
k ɛ d ɛ r ɛ	k eː d ɛ r ɛ
p ɔ n d ɛ r aː r ɛ	p ɔ n d ɛ r aː r ɛ
t ɛ rː ɛ ʊ m	t ɛ rː ɛu m
k a r aː k t ɛ r ɛ	kʰ a r a k t eː r ɛ m
a g aː r ɪ k ʊ m	a g a r ɪ k ʊ m
s ɛ k s t ʊ m	s ɛ k s t ʊ m
s k ɔ p aː r ɛ	s k ɔ p ɛ r ɛ
r ɛ k l aː m aː r ɛ	r ɛ k l aː m aː r ɛ
l ɪ n t ɛ r n a m	l a n t ɛ r n a m
d ɛ w ʊ m w ɛ r ɛ	d eː w ɔ w eː r ɛ
m a n j ʊ m	m a ŋ n ʊ m
k a m b r oː n ɛ m	k r aː b r oː n ɛ m
a p ɛ ɛ l a m	a p ɪ k ʊ l a m
a lː oː k aː r ɛ	a lː ɔ k aː r ɛ
g r aː n aː t ʊ m	g r aː n aː t ʊ m
k ɛ k ʊ m	k aɪ k ʊ m
s p oː s ʊ m	s p oː n s ʊ m
r ɛ w ɔ k aː r ɛ	r ɛ w ɔ k aː r ɛ
s ʊ m t ʊ m	s uː m p t ʊ m
ɪ m p r ɔ b ʊ m	ɪ m p r ɔ b ʊ m
kʷ ɛ s t j oː n ɛ	kʷ aɪ s t j oː n ɛ m
k a t ɛ n t ɛ m aː r ɛ	k a t eː n aː r ɛ
k oː s ʊ m	k ɔ k s ʊ m
a b g ʊ r aː t j oː n ɛ m	a b ɪ uː r aː t j oː n ɛ m
ɪ n t ɛ r aː p ʊ n g ɛ m r ɛ m	ɪ n t ɛ r p ʊ ŋ g ɛ r ɛ
k ɔ p t ʊ r a m	k ɔ k t uː r a m
ɪ n w ɛ n t r ɪ k ɛ	ɪ n w ɛ n t r iː k ɛ m
ɛ m ʊ w ɛ r ɛ	eː m ɔ w eː r ɛ
ɔ p r ɔ b r j ʊ m	ɔ pː r ɔ b r j ʊ m
w ɪ n aː k a m	w iː n aː k ɛu m
d ɔ k t oː r ɛ	d ɔ k t oː r ɛ m
p ɔ t r ɛ m	p ʊ t r ɛ m
ɛ k s ɪ t ʊ m	ɛ k s ɪ t ʊ m
w ɪ t ʊ p ɛ r aː t j oː n ɛ m	w ɪ t ʊ p ɛ r aː t j oː n ɛ m
k a r p ɛ n t ʊ m	k a r p ɛ n t ʊ m
p r ɛ s aː g j aː r ɛ	p r aɪ s aː g iː r ɛ
f a k ɪ l ɪ t aː t ɛ m	f a k ɪ l ɪ t aː t ɛ m
ɔ m ɛ n t ʊ m	oː m ɛ n t ʊ m
b ʊ b ɔ n ɪ k ʊ m	b uː b oː n ɪ k ʊ m
ɔ r t ɔ g r aː f j a m	ɔ r tʰ ɔ g r a pʰ j a m
f ɔ k ɛ	f aʊ k ɛ m
ɪ n d ɔ l ɛ m	ɪ n d ɔ l ɛ m
s ɛ sː ʊ m	s ɛ sː ʊ m
s p ɔ l j ʊ m	s p ɔ l j ʊ m
k aʊ t j oː n ɛ	k aʊ t j oː n ɛ m
f ɪ n ɛ s t r a m	f ɛ n ɛ s t r a m
k ɔ lː ɛ r a m	kʰ ɔ l ɛ r a m
n a w ɛ m	n aː w ɛ m
m a s k l ʊ m m	m a s k ʊ l ʊ m
ɪ n s ɪ n w aː r ɛ	iː n s ɪ n w aː r ɛ
f r ʊ ɪ r ɛ	f r ʊ iː
s ɛ n ɛ	s ɛ n ɛ m
k l aʊ s ʊ l a m	k l aʊ s ʊ l a m
k ɔ r j aː k ɛ ʊ m	k ɔ r j a k ɛu m
l uː k j ɪ d ʊ m	l uː k ɪ d ʊ m
a k k ɛ d ɛ r ɛ	a kː eː d ɛ r ɛ
a r k j a m	a r kʰ j a m
f ɪ r m ɛ m	f ɪ r m ʊ m
m uː s k ʊ l aː r ɛ	m uː s k ʊ l aː r ɛ m
ɔ fː ɛ r t ɔ r j ʊ m	ɔ fː ɛ r t oː r j ʊ m
s ɪ l w a m	s ɪ l w a m
p l aː s m aː r ɛ	p l a s m aː r ɛ
b oː r s a m	b ʊ r s a m
ɪ n k ɔ l a m	ɪ ŋ k ɔ l a m
k ɔ n s oː n aː r ɛ	k oː n s ɔ n aː r ɛ
l a r t ʊ m	l a r d ʊ m
g uː m ɛ n t ʊ m	j uː m ɛ n t ʊ m
a l n ʊ m m	a l n ʊ m
m ɛ d ɪ j ɔ k r ɛ m	m ɛ d ɪ ɔ k r ɛ m
s t r j a m	s t r j a m
p l aː k ɪ d ʊ m	p l a k ɪ d ʊ m
ʊ b ɛ n k a m	j ʊ w ɛ ŋ k a m
n a t aː l ɛ	n aː t aː l ɛ m
s ʊ p ʊ t aː r ɛ	s ʊ pː ʊ t aː r ɛ
p r ɔ l ɔ kʷ j ʊ m	p r oː l ɔ kʷ j ʊ m
f ɛ rː oː l ʊ m	w ɛ r ɪ k ʊ l ʊ m
h s t r ɪ k aː r ɛ	ɛ k s t r iː k aː r ɛ
f r uː k t oː s ʊ m	f r ʊ k t ʊ oː s ʊ m
f ʊ n d aː m ɛ n t ʊ m	f ʊ n d aː m ɛ n t ʊ m
ɪ m b ɛ k ɪ lː ɪ t aː t ɛ m	ɪ m b eː k ɪ lː ɪ t aː t ɛ m
m a r m g ʊ l ʊ m	m ɛ r g ʊ m
d ɪ sː ɛ kː aː r ɛ	d eː s ɪ kː aː r ɛ
ɪ n k r ɛ d ɪ b ɪ l ɛ m	ɪ ŋ k r eː d ɪ b ɪ l ɛ m
ɪ t ɪ n ɛ r aː r j ʊ m	ɪ t ɪ n ɛ r aː r j ʊ m
w ʊ l p ɪ n ʊ m	w ʊ l p iː n ʊ m
ɛ m ʊ ŋ g ɛ r ɛ	eː m ʊ ŋ g ɛ r ɛ
d ɛ b ɛ lː aː r ɛ	d eː b ɛ lː aː r ɛ
s a k r ɪ l ɛ g ʊ m	s a k r ɪ l ɛ g ʊ m
k ɔ m ɛ n t aː r j ʊ m	k ɔ mː ɛ n t aː r j ʊ m
a k k ɛ n t ʊ m	a kː ɛ n t ʊ m
ɪ n f ʊ n d ɛ r ɛ	iː n f ʊ n d ɛ r ɛ
f r a n k ɛ s ɛ	f r a ŋ k eː n s ɛ m
b a r b aː t ʊ m	b a r b aː t ʊ m
k ɪ n t uː r a m	k ɪ ŋ k t uː r a m
a b j ɛ k t aː r ɛ	a b ɪ k ɛ r ɛ
k ɔ ŋ j ʊ g aː t j oː n ɛ m	k ɔ n j ʊ g aː t j oː n ɛ m
ɛ k s aː g ɛ r aː t j oː n ɛ m	ɛ k s a gː ɛ r aː t j oː n ɛ m
s a r k ɪ n a m	s a r k ɪ n a m
ɔ k k ɪ d ɛ n t ɛ m	ɔ kː ɪ d ɛ n t ɛ m
k ɔ m ʊ n ɛ	k ɔ mː uː n ɛ m
r ɛ t r aː k t j oː n ɛ m	r ɛ t r a k t j oː n ɛ m
s a b l ʊ m	s a b ʊ l ʊ m
k r ɪ b m ʊ m	k r iː b r ʊ m
s a n j ɛ m m	s a n ɪ ɛ m
k oː ɪ t ʊ m	k ɔ ɪ t ʊ m
a w ɛ l ʊ m	a w ʊ l ʊ m
r a d j aː t j oː n ɛ	r a d j aː t j oː n ɛ m
m a nː j aː r ʊ m	m a n w aː r j ʊ m
ɪ n s t aʊ r aː r ɛ	iː n s t aʊ r aː r ɛ
k l aʊ s uː r a m	k l aʊ s uː r a m
s k r ʊ t aː r ɛ	s k r uː t aː r iː
ɔ s p ɪ t j ʊ m	h ɔ s p ɪ t j ʊ m
g l aː a m	g l aː r ɛ a m
a d uː d ɪ k aː r ɛ	a d ɪ uː d ɪ k aː r ɛ
k ɔ n f ɛ r ɪ r ɛ	k oː n f ɛ rː ɛ
ɔ l ɪ g aː r k a m	ɔ l ɪ g a r kʰ a m
ɔ s p ɛ d aː r ɛ	h ɔ s p ɪ t aː r iː
k ɪ k ʊ t a m	k ɪ k uː t a m
p ɛ kː aː r ɛ	p ɛ kː aː r ɛ
s k a n d ʊ l a m	s k a n d ʊ l a m
r ɛ k ɛ sː ʊ m	r ɛ k ɛ sː ʊ m
ɪ lː ɛ g aː l ɛ	ɪ lː eː g aː l ɛ m
k a t ɛ k ɪ d zː aː r ɛ m	k a t eː kʰ iː zː aː r ɛ
l a m b r ʊ s k a m	l aː b r ʊ s k a m
s ɛ g aː r ɛ	s ɛ k aː r ɛ
k ɔ n t ɪ n w aː t j oː n ɛ m	k ɔ n t ɪ n w aː t j oː n ɛ m
w oː l aː r ɛ	w ɔ l aː r ɛ
s ʊ mː ɛ t ɛ r ɛ	s ʊ mː ɪ tː ɛ r ɛ
f aː s k ɛ m	f a s k ɛ m
p a l m aː r ɛ m	p a l m aː r ɛ m
k ɪ p r ɛ s ʊ m	k ʊ p r ɛ sː ʊ m
k a pː ɛ lː a m	k a pː ɛ lː a m
t a l ʊ t	t aː l ʊ m
d ɪ s k r ɪ m ɪ n aː t j oː n ɛ m	d ɪ s k r iː m ɪ n aː t j oː n ɛ m
r ɛ t j aː r j ʊ m	r eː t j aː r j ʊ m
a r k a m	a r kʰ a m
n uː b ɛ	n uː b ɛ m
m a t ʊ t ɪ n ʊ m	m aː t uː t iː n ʊ m
b a s t ɛ r n a m	b a s t ɛ r n a m
ʊ r k ɛ m	ʊ l iː k ɛ m
p r ɔ m ʊ l g aː t j oː n ɛ m	p r oː m ʊ l g aː t j oː n ɛ m
p ɛ t aː t j ʊ m	p ɪ tː a k j ʊ m
a b r ɔ t aː n ʊ m	a b r ɔ t ɔ n ʊ m
kʷ a l ɪ f ɪ k aː r ɛ	kʷ aː l ɪ f ɪ k aː r ɛ
p ɛ r p ɛ t r aː r ɛ	p ɛ r p ɛ t r aː r ɛ
g uː d ɪ t j aː l ɛ	j uː d ɪ k j aː l ɛ m
a d ɪ t ʊ m	a d ɪ t ʊ m
l aʊ r ɔ k ɛ r aː s ʊ m	l aʊ r ɔ k ɛ r a s ʊ m
d ɪ m ɛ t ɛ r ɛ	d iː m ɪ tː ɛ r ɛ
k ɔ rː ɔ d ɛ r ɛ	k ɔ rː oː d ɛ r ɛ
l uː b r ɪ k ʊ m	l uː b r ɪ k ʊ m
l ʊ t r d ʊ m	l uː r ɪ d ʊ m
ɛ t ɛ r ɛ ʊ m	aɪ tʰ ɛ r j ʊ m
g r a n d ɛ m	g r a n d ɛ m
k ɔ n t r aː k t ɛ	k ɔ n t r a h ɛ r ɛ
ɛ n t ɛ m	ɛ n s
l a k r ɪ m aː r ɛ	l a k r ɪ m aː r ɛ
a b ɛ rː aː r ɛ	a b ɛ rː aː r ɛ
ɛ s k ɔ p r ʊ m	s k a l p r ʊ m
g ɛ m ɪ t ʊ m	g ɛ m ɪ t ʊ m
s a l m a m	s a g m a m
m a r a m	m a rː a m
ɪ n mː ɔ l aː t j oː n ɛ m	ɪ mː ɔ l aː t j oː n ɛ m
d ʊ b l ʊ m	d ʊ p l ʊ m
d ɛ r aː t uː r a m	d iː r ɛ k t uː r a m
a t r ʊ m	aː t r ʊ m
uː s aː r ɛ	uː t iː
m uː k ɔ r ɛ m	m uː k oː r ɛ m
ɛ g r ʊ m	aɪ g r ʊ m
ɪ ŋ j uː r j a m	ɪ n ɪ uː r j a m
s ɛ k ɛ r n ɛ r ɛ	s eː k ɛ r n ɛ r ɛ
a d ʊ d ɪ k aː t j oː n ɛ m	a d ɪ uː d ɪ k aː t j oː n ɛ m
k aʊ t ɛ l a m	k aʊ t eː l a m
k ɔ m p aː t r ɛ m	k ɔ m p a t r ɛ m
f ɛ k ʊ n d oː	f eː k ʊ n d ʊ m
ɪ m aː g ɪ n ɛ	ɪ m aː g ɪ n ɛ m
w a r j ɪ ɛ g aː t j oː n ɛ m	w a r ɪ ɛ g aː t j oː n ɛ m
g ʊ w ɛ n t ʊ t ɛ m	j ʊ w ɛ n t uː t ɛ m
p ɛ lː ɪ k ʊ l a m	p ɛ lː ɪ k ʊ l a m
p ʊ l k r ɪ t ʊ t ɛ m	p ʊ l kʰ r ɪ t uː d ɪ n ɛ m
m ɪ t ɪ g aː t j oː n ɛ m	m iː t ɪ g aː t j oː n ɛ m
d ɪ g ɪ t aː r ɛ	d ɪ g ɪ t aː r ɛ
t r a n s ʊ b s t a n t j aː r ɛ m	t r aː n s ʊ b s t a n t j aː r ɛ
k a n s aː r ɛ	k a m p s aː r ɛ
b aː s j ʊ m	b aː s j ʊ m
p r ɛ j uː d ɪ k aː r ɛ m	p r aɪ j uː d ɪ k aː r ɛ
p uː b l ɪ k ʊ m	p uː b l ɪ k ʊ m
g ʊ r ʊ m	ɪ uː s
j ɔ j ʊ m	l ɔ l j ʊ m
ɔ n ɛ s ɛ	ɔ n ʊ s
m a n ɪ f j ɛ s t ʊ m	m a n ɪ f ɛ s t ʊ m
f ɛ d ʊ m	f ɔ ɪ d ʊ s
l ɛ n ɛ	l eː n ɛ m
p r ɔ l ɔ ŋ g aː r ɛ	p r oː l ɔ ŋ g aː r ɛ
ɪ s k ʊ m	ɪ s k ʊ m
a s t ʊ lː a m	a sː ʊ l a m
aː k eː r	aː k r ɛ m
a l aː k r ɪ t aː t ɛ m	a l a k r ɪ t aː t ɛ m
b ɪ l ɛ m	b iː l ɛ m
p r ɔ f ɛ t j a m	p r ɔ pʰ eː t iː a m
p ɛ n ɪ t ɛ n ɛ m t j aː l	p aɪ n ɪ t ɛ n t j aː l ɛ m
d ɛ s ʊ l t oː r j ʊ m	d eː s ʊ l t oː r j ʊ m
w ɛ r ɪ t aː t ɛ m	w eː r ɪ t aː t ɛ m
f r ɔ n t aː l ɛ	f r ɔ n t aː l ɛ m
s a n aː r ɛ	s aː n aː r ɛ
f ɪ n k ʊ j ʊ m m	f eː n ʊ k ʊ l ʊ m
k ɔ n t aː r ɛ	k ɔ m p ʊ t aː r ɛ
k ɔ n f ɪ n ɛ	k ɔ n f iː n ɛ m
b a r b uː l ɛ m	b a r b ʊ l a m
r ɛ f l ʊ ɪ r ɛ	r ɛ f l ʊ ɛ r ɛ
f l aː g r aː r ɛ	f l a g r aː r ɛ
p ɪ n t aː r ɛ	p ɪ ŋ g ɛ r ɛ
ɛ k s ɪ gʷ ʊ m	ɛ k s ɪ gʷ ʊ m
w a g ɪ r ɛ	w aː g iː r ɛ
w ɪ s ɪ b ɪ l ɪ t aː t ɛ m	w iː s ɪ b ɪ l ɪ t aː t ɛ m
ɛ w ɔ l k j w ɛ r ɛ m	eː w ɔ l w ɛ r ɛ
r ɛ g j ʊ m	r eː g j ʊ m
k ɪ r k ʊ n d aː r ɛ m	k ɪ r k ʊ m d a r ɛ
ɔ l ɛ aː t ʊ m	ɔ l ɛ aː t ʊ m
k ɔ p ʊ l aː t j oː n ɛ m	k oː p ʊ l aː t j oː n ɛ m
m a n k ʊ m	m a ŋ k ʊ m
d ɪ s p ɔ s aː r ɛ	d eː s p oː n s aː r ɛ
s ɪ r p ʊ m	s k ɪ r p ʊ m
uː r g ɛ r ɛ	ʊ r g eː r ɛ
g r aː n d ɪ k ʊ m	g r a n d ɪ n ɛ m
ɛ l uː d ɛ r ɛ	eː l uː d ɛ r ɛ
a s k ɛ n s j oː n ɛ m	a s k eː n s j oː n ɛ m
a d w ɛ k t j oː n ɛ m	a d w ɛ k t j oː n ɛ m
l oː d aː t oː r ɛ	l aʊ d aː t oː r ɛ m
k a n d ɛ l a	k a n d eː l a m
l oː m b ʊ m	l ʊ m b ʊ m
g ɛ n j aː l ɛ	g ɛ n j aː l ɛ m
g uː s t aː t j oː n ɛ m	g ʊ s t aː t j oː n ɛ m
ɪ m p aː w ɪ d ʊ m	ɪ m p a w ɪ d ʊ m
m ɪ r aː k oː l ʊ m	m iː r aː k ʊ l ʊ m
b ʊ k ɪ n a m	b uː k ɪ n a m
k oː n ʊ m	k oː n ʊ m
l ɔ k ʊ t oː r ɛ	l ɔ k uː t oː r ɛ m
ɛ n ʊ m ɛ r aː r ɛ	eː n ʊ m ɛ r aː r ɛ
n ɔ t ɔ r j ʊ m	n oː t oː r j ʊ m
s t aː t ʊ ɪ r ɛ	s t a t ʊ ɛ r ɛ
p l aː n ɪ t j ɛ m	p l aː n ɪ t ɪ ɛ m
a nː aː l ɪ	a nː aː l ɛ m
s kʷ aː m a m	s kʷ aː m a m
l a w aː t oː r j j ʊ m	l a w aː t oː r j ʊ m
s ɔ lː ɪ k ɪ t aː r ɛ	s ɔ lː ɪ k ɪ t aː r ɛ
t r a n kʷ ɪ lː ʊ m	t r a ŋ kʷ ɪ lː ʊ m
ɪ n w ɪ d j a m	ɪ n w ɪ d j a m
n ʊ m ɛ r aː r ɛ	n ʊ m ɛ r aː r ɛ
d ɛ s p ɛ r aː t ʊ m	d eː s p eː r aː t ʊ m
p ɔ sː ɛ sː oː r ɛ	p ɔ sː ɛ sː oː r ɛ m
aʊ t ɔ r ɪ t aː t ɛ m	aʊ k t oː r ɪ t aː t ɛ m
w ɪ g ɔ r aː r ɛ	w ɪ g oː r aː r ɛ
f ɔ r n aː l j a m	f ɔ r n aː k ʊ l a m
d ɪ l ɪ g ɛ n ɛ m t j a m	d iː l ɪ g ɛ n t j a m
r ɔ s m aː r ɪ n ʊ m	r oː r ɛ mː a r iː n ʊ m
b a r b aː r ɪ d zː aː r ɛ m	b a r b a r iː zː aː r ɛ
ɪ m p aː r t ɪ r ɛ	ɪ m p a r t iː r ɛ
k a l w ɪ r ɛ	k a l w iː
f a k t oː r ɛ	f a k t oː r ɛ m
w ɛ s k ɛ m m	w eː s k ʊ m
k ɔ d ɪ k ɛ m	k oː d ɪ k ɛ m
ɪ n ɪ t j ʊ m	ɪ n ɪ t j ʊ m
l ɛ t ɛ r a m	l ɪ tː ɛ r a m
d ɛ k ɔ rː ɛ r m ɛ	d eː k ʊ rː ɛ r ɛ
p a r s ɪ m ɔ n j a m	p a r s ɪ m oː n j a m
t ɪ t ʊ b r ɛ	t ɪ t ʊ b aː r ɛ
k ɔ r ɔ n ɪ d ɛ	k ɔ r oː n ɪ d ɛ m
s ɪ m j a m	s iː m j a m
l ɛ p r a m	l ɛ p r a m
b a r ɪ t oː n ʊ m	b a r y t ɔ n ʊ m
ɔ n ʊ s t ʊ m	ɔ n ʊ s t ʊ m
t ɛ t r ɪ k ʊ m	t aɪ t r ɪ k ʊ m
l ɛ n aː d oː r ɛ	l ɪ ŋ n aː t oː r ɛ m
m ɔ r s ʊ m	m ɔ r s ʊ m
b ɪ n k ʊ m l ʊ m	w ɪ ŋ k ʊ l ʊ m
p a t r j aː r k a m	p a t r j a r kʰ a m
k ɔ n t r ɪ b ʊ ɪ r ɛ m	k ɔ n t r ɪ b ʊ ɛ r ɛ
l a ŋ gʷ ɪ d ʊ m	l a ŋ gʷ ɪ d ʊ m
m ʊ n t oː s ʊ m	m ɔ n t ʊ oː s ʊ m
ɛ k s p ʊ l s aː r ɛ	ɛ k s p ʊ l s aː r ɛ
k oː n k a m	k ɔ ŋ kʰ a m
b r ɪ t aː n ɪ k ʊ m	b r ɪ t a nː ɪ k ʊ m
n ɛ r w oː s ʊ m	n ɛ r w oː s ʊ m
k a lː ʊ m	k a lː ʊ m
k r uː d ɛ l ɛ	k r uː d eː l ɛ m
k ɔ t ɛ m n	k oː t ɛ m
f ʊ l ɛ m k aː r ɛ	f ɔ lː ɪ k aː r ɛ
ɪ r aː k ʊ n d ʊ m	iː r aː k ʊ n d ʊ m
n aʊ f r aː g aː r ɛ	n aʊ f r a g aː r ɛ
ɔ lː aː r ʊ m	ɔ lː aː r j ʊ m
s ɛ r m oː n ɛ m	s ɛ r m oː n ɛ m
f r ɔ n d oː s ʊ m	f r ɔ n d oː s ʊ m
p ɛ r f ɪ d ʊ m	p ɛ r f ɪ d ʊ m
ɛ t ʊ m	eː t ʊ m
n ʊ m ɛ r aː r j ʊ m	n ʊ m ɛ r aː r j ʊ m
r ʊ p ɛ	r uː p ɛ m
r a d ɪ k ɪ n ɛ m	r aː d iː k ɛ m
t r aː t aː t ʊ m	t r a k t aː t ʊ m
d ɪ k aː k ɛ	d ɪ k aː k ɛ m
a g ɪ r ɛ	a g ɛ r ɛ
t r a n s aː k t j oː n ɛ m	t r aː n s aː k t j oː n ɛ m
n ɔ s ɔ k ɔ m j ʊ m	n ɔ s ɔ k ɔ m iː ʊ m
p r ɔ b l ɛ m aː t ɪ k ʊ m	p r ɔ b l eː m a t ɪ k ʊ m
g r aː m aː t ɪ k aː l ɛ m	g r a mː a t ɪ k aː l ɛ m
n a t aː r ɛ	n a t aː r ɛ
p ʊ l k r ʊ m	p ʊ l kʰ r ʊ m
ɛ t ɛ r ɛ	aɪ tʰ ɛ r ɛ m
m uː l ʊ m	m uː l ʊ m
l ɪ n k k ɛ m	l y ŋ k ɛ m
ɛ m ʊ l aː t oː r ɛ	aɪ m ʊ l aː t oː r ɛ m
a r k a ŋ g ɛ l ʊ m	a r kʰ a ŋ g ɛ l ʊ m
g r aː t ʊ m	g r aː t ʊ m
p ɛ r ɪ m ɛ r ɛ	p ɛ r ɪ m ɛ r ɛ
m ɛ m b r aː n ʊ m s ʊ m	m ɛ m b r aː n ɛu m
r ɛ f l ɛ t ɛ r ɛ	r ɛ f l ɛ k t ɛ r ɛ
g uː d ɛ m ʊ m	j uː d aɪ ʊ m
r a s uː r a m	r aː s uː r a m
r ʊ g ʊ m	r ɔ g ʊ m
t r a n s k r ɪ w ɛ r ɛ m	t r aː n s k r iː b ɛ r ɛ
m a r ɪ t aː r ɛ	m a r iː t aː r ɛ
p ɛ r ɪ g ʊ n t aː r ɛ	p ɛ r k ɔ n t aː r iː
p r ɛ g ʊ s t a m r ɛ	p r aɪ g ʊ s t aː r ɛ
a b r ɔ g aː t j oː n ɛ m	a b r ɔ g aː t j oː n ɛ m
p a s t ʊ m	p aː s t ʊ m
l ɪ m ʊ m	l iː m ʊ m
p ʊ ɛ r ɪ l ɛ	p ʊ ɛ r iː l ɛ m
d j aː l ɛ k t ʊ m	d j a l ɛ k t ɔ n
d ɪ s t ɪ lː aː t j oː n ɛ m	d ɪ s t ɪ lː a t j oː n ɛ m
ɪ n t ɛ r g ɛ k t j oː n ɛ m	ɪ n t ɛ r j ɛ k t j oː n ɛ m
s k uː r ɪ l ɛ	s k ʊ rː iː l ɛ m
s ʊ b r ɔ g aː r ɛ	s ʊ b r ɔ g aː r ɛ
k ɪ m k ɛ m	k iː m ɪ k ɛ m
p ɔ s p oː n ɛ	p ɔ s t p oː n ɛ r ɛ
a aː r ɛ	a fː l aː r ɛ
s t r ɛ ʊ ɛ n ɛ m t ʊ m m	t ɔ n ɪ t r ʊ m
a n ɛ t ʊ m	a n eː tʰ ʊ m
g r aː t ɪ t m	g r aː t ɪ t uː d ɪ n ɛ m
k ɔ n k ɪ n ɪ t a m t ɛ m	k ɔ ŋ k ɪ nː ɪ t aː t ɛ m
l ɪ m ɪ t r ɔ f ɛ m	l iː m ɪ t r ɔ pʰ ʊ m
p ɛ r m aː n t ɛ r ɛ m	p ɛ r m a n eː r ɛ
d ɛ s ɪ d ɛ aː r ɛ	d eː s iː d ɛ r aː r ɛ
r ɪ k ʊ n oː s ɛ r ɛ m	r ɛ k ɔ ŋ n oː s k ɛ r ɛ
p ɔ lː aː r ɛ	p ʊ lː aː r ɛ
p ɛ r ɛ t ɪ l ʊ m	p ɛ t r ɔ s ɛ l iː n ʊ m
k ɔ m p l aː k ɛ r ɛ	k ɔ m p l a k eː r ɛ
ɔ fː ɪ k j ʊ m	ɔ fː ɪ k j ʊ m
d ɪ m ɪ n ʊ ɪ r ɛ m	d iː m ɪ n ʊ ɛ r ɛ
p ɛ l aː g ʊ m	p ɛ l a g ʊ s
a r g uː t j a m	a r g uː t j a m
p a nː ɪ kː uː l a h	p aː n ɪ k ʊ l a m
a nː ʊ n k j aː r ɛ	a nː uː n t j aː r ɛ
ɪ m b ɛ r b ɛ m	ɪ m b ɛ r b ɛ m
g a rː ʊ l ʊ m	g a rː ʊ l ʊ m
g ɛ mː ʊ l a m	g ɛ mː ʊ l a m
l a k t aː r ɛ	l a k t aː r ɛ
r ɛ m ɛ m b r aː r ɛ	r ɛ m ɛ m ɔ r aː r iː
s ɛ r w aː r ɛ	s ɛ r w aː r ɛ
a k j oː n ɪ ɛ t ɛ r ɛ	a kː w ɪ eː s k ɛ r ɛ
h ʊ ŋ g ɛ r ɛ	ʊ ŋ g ɛ r ɛ
f uː r j oː s ʊ m	f ʊ r j oː s ʊ m
k ɔ n f ɛ d ɛ r aː t j oː n ɛ m	k oː n f ɔ ɪ d ɛ r aː t j oː n ɛ m
ʊ b l b ɪ t aː	ɔ b l iː w ɪ s k iː
s ʊ p ɛ r ɛ pː oː n ɛ	s ʊ p ɛ r p oː n ɛ r ɛ
a b l ɛ g aː t j oː n ɛ m	a b l eː g aː t j oː n ɛ m
t r ɪ b ʊ l ʊ m	t r ɪ b ʊ l ʊ m
s ɪ d ɛ r ɛ ʊ m	s iː d ɛ r ɛu m
s ʊ s p ɪ r j aː r ɛ	s ʊ s p iː r aː r ɛ
g ɛ l oː s ʊ m	z eː l oː s ʊ m
r ɛ l ɛ g aː t j oː n ɛ m	r ɛ l eː g aː t j oː n ɛ m
r ɛ l ɪ k j a m	r ɛ l ɪ kʷ ʊ m
ɪ w ʊ m	iː w ʊ m
m ɛ d ɪ t ɛ rː aː n ɛ ʊ m	m ɛ d ɪ t ɛ rː aː n ɛu m
a fː l ɪ g ɛ r ɛ	a fː l iː g ɛ r ɛ
a b sː ɔ l ʊ t j oː n ɛ m	a b s ɔ l uː t j oː n ɛ m
f a b ɛ lː a m	f aː b ɛ lː a m
ɪ n t ɛ g r aː r ɛ	ɪ n t ɛ g r aː r ɛ
a g r ʊ m	a g r ʊ m
w ɪ d ʊ w a m	w ɪ d w a m
w ɪ w ɪ d ʊ m	w iː w ɪ d ʊ m
k ɔ n s l ɪ d a m	k oː n s ɔ l ɪ d a m
p r ɛ d ɪ k ɪ r ɛ	p r aɪ d ɪ k aː r ɛ
d ɛ m oː n ɪ k ʊ m	d aɪ m ɔ n ɪ k ʊ m
r uː b r ɪ k a m	r ʊ b r iː k a m
b ɔ m b ʊ m	b ɔ m b ʊ m
a d ɪ t aː m ɛ n t ʊ m	a dː ɪ t aː m ɛ n t ʊ m
s ɛ p ɛ m	s aɪ p ɛ m
ɔ b s t aː r ɛ	ɔ b s t aː r ɛ
k s k ʊ s aː t j oː n ɛ m	ɛ k s k uː s aː t j oː n ɛ m
p oː pː a m	p ʊ pː ɛ m
k ɔ l ʊ m b a m	k ɔ l ʊ m b a m
s t r ʊ p ʊ m	s t r ɔ pː ʊ m
k a nː a m	k a nː a m
ɛ n d ʊ r ɛ t ɛ r ɛ	ɪ n d uː r eː s k ɛ r ɛ
b a r b aː r ɪ s m ʊ m	b a r b a r ɪ s m ʊ m
s ɔ r t ɪ r ɛ	s ɔ r t iː r iː
ɛ k k ɛ p t aː r ɛ m	ɛ k s k ɪ p ɛ r ɛ
ɪ ŋ g ɛ n j ʊ m s ʊ m	ɪ ŋ g ɛ n j oː s ʊ m
t a pː ɛ t ɛ m	t a p eː t ɛ m
ɪ n g ʊ k t j ʊ m n ɛ m	ɪ n j ʊ ŋ k t j oː n ɛ m
m ɛ l ɔ d j a m	m ɛ l oː d j a m
g a rː ɪ r ɛ	g a rː iː r ɛ
n ʊ t ʊ m	n uː t ʊ m
a s p ɛ k t aː r ɛ	a s p ɛ k t aː r ɛ
s k ʊ m p ɪ r ɛ	k oː n s p ʊ ɛ r ɛ
d j ɔ n ɪ s j aː k ʊ m	d ɪ ɔ n y s j a k ʊ m
a s aː t aː r ɛ	a sː ɛ k t aː r iː
p r ɛ j ʊ d ɪ t j ʊ m	p r aɪ j uː d ɪ k j ʊ m
k ɔ n s ʊ m aː r ɛ	k oː n s ʊ mː aː r ɛ
a r m aː d j ʊ m	a r m aː r j ʊ m
