p aː w ɪ l oː n ɛ m	p aː p ɪ l j oː n ɛ m
p ʊ ɛ r ɪ l ɪ t aː t ɛ m	p ʊ ɛ r iː l ɪ t a t ɛ m
w ɔ m ɛ m r ɛ	w oː m ɛ r ɛ m
k r ɛ p m a m t uː r a m	k r ɛ p aː t uː r a m
r ɛ t oː r	r h eː t ɔ r ɛ m
ɔ r ɪ f ɪ k ʊ m	h ɔ rː ɪ f ɪ k ʊ m
s m ɛ r a l d ʊ m	s m a r a g d ʊ m
a kː aː d ɛ m j a m	a k a d eː m iː a m
p ʊ p ɪ lː ʊ m	p uː p ɪ lː ʊ m
ɔ r ɛ k ʊ j a m	ɔ r ɪ k l a m
k aː p s j s ʊ m	k a p t j oː s ʊ m
s ɔ l ɪ d aː r ɛ	s ɔ l ɪ d aː r ɛ
f ɛ mː ɪ n ɪ n ʊ m	f eː m ɪ n iː n ʊ m
r ɛ t ɪ n aː k l ʊ m	r ɛ t ɪ n aː k ʊ l ʊ m
s ɔ l ɪ d ʊ m	s ɔ l ɪ d ʊ m
s eː r a	s eː r ʊ m
k ɔ m p ɛ t ɪ t j oː n ɛ	k ɔ m p ɛ t iː t j oː n ɛ m
k ɔ n ʊ n g ɛ r ɛ	k ɔ n j ʊ ŋ g ɛ r ɛ
a t ɔ r m ɛ m t ɛ r ɛ	a dː ɔ r m iː s k ɛ r ɛ
t r a m d ɪ r ɛ	t r aː d ɛ r ɛ
p aː r t ʊ m	p a r d ʊ m
a d ʊ l aː r ɛ	a d uː l aː r iː
p aː l j a m r ʊ m	p a l ɛ aː r j ʊ m
w ɪ k ɪ n ɪ t aː t	w iː k iː n ɪ t aː t ɛ m
b oː b ʊ m	b a l b ʊ m
p ɛ r ɪ g ʊ n t aː r ɛ	p ɛ r k ɔ n t aː r iː
k ɔ n f ɛ sː oː r ɛ	k oː n f ɛ sː oː r ɛ m
ɪ n s ɛ r t j oː n ɛ m	iː n s ɛ r t j oː n ɛ m
l uː k s ʊ m	l uː k s ʊ m
k ɔ p ɛ r aː t j oː n ɛ m	k ɔː p ɛ r aː t j oː n ɛ m
ʊ ŋ t ɔ s ʊ m	uː ŋ k t ʊ oː s ʊ m
s ɛ n aː t ʊ m	s ɛ n aː t ʊ m
ɛ s ɪ t aː r ɛ	h aɪ s ɪ t aː r ɛ
p r ɔ t ɛ s t aː r ɛ	p r oː t ɛ s t aː r iː
ɛ k s k uː r s j oː n ɛ m	ɛ k s k ʊ r s j oː n ɛ m
uː r b ɛ m	ʊ r b ɛ m
l ɔ kʷ aː k ɛ	l ɔ kʷ aː k ɛ m
b l a n d ɪ r ɛ	b l a n d iː r iː
k ɔ nː ɛ k t ɛ r ɛ	k oː n ɛ k t ɛ r ɛ
d ɪ sː ɪ m ʊ l aː t j ʊ m n ɛ m	d ɪ sː ɪ m ʊ l aː t j oː n ɛ m
n aː w ɪ ʊ m	n aː w ɪ g j ʊ m
k ʊ l t ɛ lː ʊ m	k ʊ l t ɛ lː ʊ m
a t r aː m ɛ n t ʊ m m	aː t r aː m ɛ n t ʊ m
s k oː p aː	s k oː p a m
l ɪ b ɛ r aː l ɪ t aː t ɛ m	l iː b ɛ r aː l ɪ t aː t ɛ m
p r ɔ s t r aː r ɛ	p r oː s t ɛ r n ɛ r ɛ
p r ɛ d ɪ k ɪ r ɛ	p r aɪ d ɪ k aː r ɛ
g ɛ ɔ g r aː f ɪ k ʊ m	g ɛ oː g r a pʰ ɪ k ʊ m
k ɔ m p ʊ ŋ g ɛ r ɛ	k ɔ m p ʊ ŋ g ɛ r ɛ
a s ɛ lː a m	a s k ɛ lː a m
ɛ k s p ɛ k t aː t j ʊ m n ɛ	ɛ k sː p ɛ k t aː t j oː n ɛ m
g ɪ r aː r ɛ	g y r aː r ɛ
a kː r ɛ m s k ɛ r ɛ	a kː r eː s k ɛ r ɛ
s k aː r a m b ɛ l ʊ m	s k a r a b aɪ ʊ m
s a ŋ gʷ ɪ n ɔ l ɛ n t ʊ m	s a ŋ gʷ ɪ n ɔ l ɛ n t ʊ m
ɔ rː ɛ n d ʊ m	h ɔ rː ɛ n d ʊ m
ɛ k s p ɔ r t aː t j oː n ɛ m	ɛ k s p ɔ r t aː t j oː n ɛ m
p r ɔ s k r ɪ w ɛ r ɛ	p r oː s k r iː b ɛ r ɛ
s ɔ k ɛ r ʊ	s ɔ k ɛ r ʊ m
d ɛ k ɛ p t ɪ w ʊ m	d ɛ k ɛ p t iː w ʊ m
a r g ɛ n t ʊ m	a r g ɛ n t ʊ m
ɛ r ɛ t ɪ k ʊ m	h aɪ r ɛ t ɪ k ʊ m
b ʊ m m b ʊ m	b ɔ m b ʊ m
k ɔ mː ɛ t ɛ r ɛ	k ɔ mː ɪ tː ɛ r ɛ
r a s ɛ k aː r ɛ	r ɛ s ɛ k aː r ɛ
k ɔ m ɔ d ʊ m	k ɔ mː ɔ d ʊ m
k ɛ f aː l eːa aː	k ɛ pʰ a l aɪ a m
d ɛ m w j a m r ɛ	d eː w j aː r ɛ
m a nː j aː r	m a n w aː r j ʊ m
a dː ɪ k t ʊ m	a dː ɪ k t ʊ m
r ɛ l ɛ w aː r ɛ	r ɛ l ɛ w aː r ɛ
p ɔ m ɛ t ʊ m	p ɔ m eː t ʊ m
t r aː s f ʊ n d ɛ r ɛ	t r aː n s f ʊ n d ɛ r ɛ
ɪ ŋ j uː r j a m	ɪ n ɪ uː r j a m
ɪ ŋ g ʊ s t ʊ m	ɪ n ɪ uː s t ʊ m
r ɛ s p ɔ n s ʊ m	r ɛ s p oː n s ʊ m
d ɪ s p ɛ r g ɛ r ɛ	d ɪ s p ɛ r g ɛ r ɛ
ɪ nː ɔ k ʊ m	ɪ nː ɔ k ʊː m
k ɔ n d ɛ n s aː r ɛ	k ɔ n d eː n s aː r ɛ
t ɪ n a m	t iː n a m
ɪ n k ɛ n d ɛ r ɛ	ɪ ŋ k ɛ n d ɛ r ɛ
d ɛ t aː t ɛ m	d ɛ ɪ t aː t ɛ m
m aː l f aː t oː r ɛ	m a l ɛ f a k t oː r ɛ m
r ɛ t j aː r j ʊ m	r eː t j aː r j ʊ m
r ɛ w ɔ k aː t j oː n ɛ m	r ɛ w ɔ k aː t j oː n ɛ m
s ʊ b ɪ t aː n ɛ ʊ m	s ʊ b ɪ t aː n ɛu m
g r aː w ɪ d ʊ m	g r a w ɪ d ʊ m
a w aː l aː n k a	l aː b iː n a m
ɪ l ɛ	ɪ l ɛ m
a d ʊ k t j oː n ɛ m	a d j ʊ ŋ k t j oː n ɛ m
s p ɛ k t aː k ʊ l ʊ m	s p ɛ k t aː k ʊ l ʊ m
k ʊ k ʊ lː ʊ m	k ʊ k ʊ lː ʊ m
aʊ g uː r aː r ɛ	aʊ g ʊ r aː r ɛ
f ɛ m t ɛ r ɛ	f eː t eː r ɛ
p ɪ g oː r ɛ	p ɛ j oː r ɛ m
k ɔ m p l ɪ k aː t j oː n ɛ	k ɔ m p l ɪ k aː t j oː n ɛ m
k aː lː ʊ m	k a lː ʊ m
f ɪ k ʊ m	f iː k ʊ m
r ɛ nː ɔ w aː t j oː n ɛ	r ɛ n ɔ w aː t j oː n ɛ m
l ɪ n ɛ aː	l iː n ɛ a m
b ʊ lː ɪ r ɛ	b ʊ lː iː r ɛ
p aː lː oː r ɛ	p a lː oː r ɛ m
a m ʊ r k aː	a m ʊ r k a m
s t r ɪ ŋ g ɛ r ɛ	s t r ɪ ŋ g ɛ r ɛ
r ɛ m k ɔ rː ɛ r ɛ	r ɛ k ʊ rː ɛ r ɛ
l aː m ɛ n t ʊ m	l aː m ɛ n t ʊ m
m ɛ r ɪ z aː r ɛ	m ɛ r iː d j aː r ɛ
k ɪ r k ʊ l aː r ɛ	k ɪ r k ʊ l aː r ɛ m
f ɛ rː ʊ g ɪ n ɛ m	f ɛ rː uː g ɪ n ɛ m
f j ɛ r ɪ t aː	f ɛ r ɪ t aː t ɛ m
r ʊ g ʊ m s ʊ m	r uː g oː s ʊ m
m aː r ɪ t aː l ɛ	m a r iː t aː l ɛ m
m ɪ s t ʊ r aː	m ɪ s t uː r a m
d ʊ r aː k ɪ n ʊ m	d uː r a k ɪ n ʊ m
k ʊ n k ɛ r ɪ r	k ɔ ŋ kʷ iː r ɛ r ɛ
k r ɪ m ɪ n oː s ʊ m	k r iː m ɪ n oː s ʊ m
p r ɛ ɔ w ɔ k aː t ɪ w ʊ m	p r oː w ɔ k aː t iː w ʊ m
k ɔ n f ɛ r iː r ɛ	k oː n f ɛ rː ɛ
s p oː s ʊ	s p oː n s ʊ m
l ɪ n ɛ aː r ɛ	l iː n ɛ aː r ɛ
ɔ p r ɪ m ɛ r ɛ	ɔ pː r ɪ m ɛ r ɛ
b ɛ rː k oː	w ɛ rː ɛ m
f aː l a ŋ g ɛ m	pʰ a l a ŋ g ɛ m
t r ɛ m m ɛ r ɛ	t r ɛ m ɛ r ɛ
l uː m ɪ n oː s ʊ m	l uː m ɪ n oː s ʊ m
k ɪ r k ʊ n w ɛ n ɪ r ɛ	k ɪ r k ʊ m w ɛ n iː r ɛ
s a m g ɛ t aː r ɛ	s a g ɪ tː aː r ɛ
r ɛ f ɔ r m aː t j oː n ɛ	r ɛ f ɔ r m aː t j oː n ɛ m
w j ɛ n t ʊ m	w ɛ n t ʊ m
p uː l s aː r ɛ	p ʊ l s aː r ɛ
a s p ɛ r s j oː n ɛ m	a s p ɛ r s j oː n ɛ m
s ʊ ɪ n ʊ m	s ʊ iː n ʊ m
a n t r ʊ m	a n t r ʊ m
m w ɛ r ʊ m	w eː r ʊ m
w ɪ s k j ʊ m	w ɪ s k ʊ m
r ɛ k t a ŋ g ʊ l ʊ m	r ɛ k t a ŋ g ʊ l ʊ m
r ɔ m aː n oː	r oː m aː n ʊ m
d ɪ k t aː m ɛ n	d ɪ k t aː m ɛ n
k ɔ mː ɛ r k j aː l ɛ	k ɔ mː ɛ r k j aː l ɛ m
p ɛ r g ʊ r j ʊ m	p ɛ r ɪ uː r j ʊ m
d ʊ l k aː m aː r aː	d uː l k a m aː r a m
a s k r ɪ w ɛ r ɛ	aː s k r iː b ɛ r ɛ
k ɔ l oː n ʊ	k ɔ l oː n ʊ m
p ɛ r k ʊ t ɛ r ɛ	p ɛ r k ʊ t ɛ r ɛ
ɪ l ɛ s ʊ m	ɪ lː aɪ s ʊ m
l ʊ p a m	l ʊ p a m
k ɔ r ɛ	k ɔ r
ɔ n ɔ r aː b ɪ l ɛ	h ɔ n oː r aː b ɪ l ɛ m
ɔ b s ɛ r w aː r ɛ	ɔ b s ɛ r w aː r ɛ
k ʊ l p a m	k ʊ l p a m
b l aː t aː	b l a tː a m
f r a n k ɛ s ɛ	f r a ŋ k eː n s ɛ m
ɪ m p r ɛ ɔ b aː r ɛ	ɪ m p r ɔ b aː r ɛ
m a m k ɛ lː ʊ m	m a k ɛ lː ʊ m
n ɛ b l ʊ m a m	n ɛ b ʊ l a m
ɔ b b j ʊ m	ɔ b w j ʊ m
a s t r ʊ	a s t r ʊ m
m aː n t ʊ m	m aː n s ʊ eː t ʊ m
n aː rː aː r ɛ	n a rː aː r ɛ
k ɔ m ʊ n j oː n ɛ m	k ɔ mː uː n iː r ɛ
g ʊ d ɛ ʊ m	j uː d aɪ ʊ m
ɔ n ɔ r aː r j ʊ m	h ɔ n oː r aː r j ʊ m
k ɔ n t r ɪ s t aː r ɛ	k ɔ n t r iː s t aː r ɛ
s aː k r aː r j ʊ m	s a k r aː r j ʊ m
m ʊ l ɪ n ʊ m	m ɔ l iː n ʊ m
a n oː	aː n ʊ m
d ɔ l k oː r ɛ	d ʊ l k oː r ɛ m
d ɪ s p a r ɪ m r ɛ	d ɪ s p a r eː r ɛ
ɛ k s p l aː n aː t j oː n ɛ m	ɛ k s p l aː n aː t j oː n ɛ m
g ɛ n t ɪ l ɪ t aː t ɛ m	g ɛ n t iː l ɪ t aː t ɛ m
d ɛ p aː r t ɪ r	d eː p a r t iː r ɛ
a kː ɔ m ɔ d aː t j oː n ɛ m	a kː ɔ mː ɔ d aː t j oː n ɛ m
ɪ n w ɪ t aː t j oː n ɛ m	ɪ n w ɪ t aː t j oː n ɛ m
s t aː n j ʊ m	s t a nː ʊ m
ɪ t ɪ n ɛ r aː r j ʊ m	ɪ t ɪ n ɛ r aː r j ʊ m
m ɛ r aː n d aː	m ɛ r ɛ n d a m
ɪ s ɔ l aː t ʊ m	iː n s ʊ l aː t ʊ m
k ʊ w ɪ l	k ʊ b iː l ɛ
a sː ʊ p t j oː n ɛ m	a sː uː m p t j oː n ɛ m
d ɪ sː ɛ k aː r ɛ	d ɪ sː ɛ k aː r ɛ
a r b ɔ r ɛ t ʊ m	a r b ɔ r eː t ʊ m
l aː w aː t j oː n ɛ m	l a w aː t j oː n ɛ m
b aː r k a m	b a r k a m
d ɪ m ɛ t ɛ r ɛ	d iː m ɪ tː ɛ r ɛ
w ɛ n d ɛ m j aː r ɛ	w iː n d eː m j aː r ɛ
t r ɪ s ɛ n aː r j ʊ m	t r iː k eː n aː r j ʊ m
p ɛ t r ɛ m s ɪ l ʊ m	p ɛ t r ɔ s ɛ l iː n ʊ m
p ʊ l p m ʊ m	p ɔ l y p ʊ m
d ɛ s ɔ l a m r ɛ	d eː s oː l aː r ɛ
p ɔ lː aː r ʊ m	p ʊ lː aː r j ʊ m
t ɛ m p ɔ r aː l ɛ	t ɛ m p ɔ r aː l ɛ m
a w ʊ	a w ʊ m
n ɛ k sː ʊ	n ɛ k s ʊ m
k j oː n ɛ	t j oː n ɛ m
p ʊ l p ɪ t m ʊ m	p ʊ l p ɪ t ʊ m
f ɛ n d ɛ r ɛ	f ɪ n d ɛ r ɛ
l aː t ɪ f ʊ n d j ʊ m	l aː t ɪ f ʊ n d j ʊ m
w ʊ l p ɪ n ʊ m	w ʊ l p iː n ʊ m
d ɔ n ɛ m ɛ m s t aː r ɛ	d ɛ h ɔ n ɛ s t aː r ɛ
k ɔ n s ɛ r w aː t j oː n ɛ m	k oː n s ɛ r w aː t j oː n ɛ m
p aː n ɛ r ʊ m	p aː n aː r j ʊ m
g aː r ɪ f j ʊ m	g r a pʰ j ʊ m
k ɛ d r ʊ	k ɛ d r ʊ m
t ɔ r t ʊ m	t ɔ r t ʊ m
ɛ n k ɔ m j ʊ m	ɛ ŋ k oː m j ʊ m
l ʊ s k ʊ m	l ʊ s k ʊ m
k ɪ k ɔ r j aː	k ɪ kʰ ɔ r j ʊ m
k ɛ r t ɛ n aː r ɛ	k ɪ r k ɪ n aː r ɛ
s ɛ w ɛ r ɪ t aː t ɛ m	s ɛ w eː r ɪ t aː t ɛ m
ɪ n f l aː mː aː t j oː n ɛ m	iː n f l a mː aː t j oː n ɛ m
p r ɔ m ɔ n t oː r j ʊ m	p r oː m ʊ n t ʊ r j ʊ m
k l ɛ m ɛ n t ɪ sː ɪ m ʊ m	k l eː m eː n t ɪ sː ɪ m ʊ m
ɪ n d ɪ g ɛ n t a m	ɪ n d ɪ g ɛ n t j a m
s ɛ k ɛ r n ɛ r ɛ	s eː k ɛ r n ɛ r ɛ
m ɔ lː ɪ t j ɛ m	m ɔ lː ɪ t ɪ ɛ m
a k ɪ n ʊ m	a k ɪ n ʊ m
ɔ r d ɪ n aː r j ʊ m	oː r d ɪ n aː r j ʊ m
s t ɛ r k ʊ m l	s t ɛ r k ʊ s
f r ɛ m ɪ t ʊ m	f r ɛ m ɪ t ʊ m
p r ɛ t ɛ r n aː t ʊ r aː l ɛ	p r aɪ t ɛ r n aː t uː r aː l ɛ m
a r ʊ s p ɪ k ɛ	h a r ʊ s p ɪ k ɛ m
d aː m nː aː r ɛ	d a m n aː r ɛ
n uː t r ɪ r ɛ	n uː t r iː r ɛ
r ɔ n k aː r ɛ	r h ɔ ŋ kʰ aː r ɛ
d ɛ l aː t oː r ɛ	d eː l aː t oː r ɛ m
m aː l ɪ ŋ n ʊ m	m a l ɪ ŋ n ʊ m
ɪ n mː aː r k ɛ s ɪ b ɪ l ɛ	ɪ mː a r k ɛ s k ɪ b ɪ l ɛ m
ɔ pː oː n r ɛ	ɔ pː oː n ɛ r ɛ
r ɛ g ʊ l aː r ɛ	r eː g ʊ l aː r ɛ m
r aː d j aː r ɛ	r a d j aː r ɛ
l aː k r ɪ m a m	l a k r ɪ m a m
m ɔ d ɛ r aː t oː r ɛ	m ɔ d ɛ r aː t oː r ɛ m
ɛ k s p l aː n aː r ɛ	ɛ k s p l aː n aː r ɛ
ɛ s k l ʊ m	aɪ s k ʊ l ʊ m
a s t ʊ t j a m	a s t uː t j a m
f ɛ s t ɪ w ɪ t aː t ɛ m	f eː s t iː w ɪ t aː t ɛ m
p l ɪ n ɪ t aː	p l eː n ɪ t aː t ɛ m
ɛ t ɪ f ɪ k aː t j oː n ɛ m	aɪ d ɪ f ɪ k aː t j oː n ɛ m
p r ɛ ɛ t ɛ m r ɪ r ɛ	p r aɪ t ɛ r iː r ɛ
k l s ʊ l aː	k l aʊ s ʊ l a m
ɔ r ɪ g aː n oː	ɔ r iː g a n ʊ m
l ɪ ɛ t ʊ m	l aɪ t ʊ m
k aː r m ɛ m n	k a r m ɛ n
f ɔ r ʊ m	f ɔ r ʊ m
g ɛ r ɛ r ɛ	g ɛ r ɛ r ɛ
ɔ l ɛ aː t ʊ m	ɔ l ɛ aː t ʊ m
f uː r ɛ m n ʊ m	f uː r ɛ m
f l ɔ r ɪ l ɛ g ʊ m	f l oː r ɪ l ɛ g j ʊ m
s ɔ l w ɛ r ɛ	s ɔ l w ɛ r ɛ
w ɛ k ɛ	w ɪ k ɛ m
a s k ɛ n s j oː n ɛ m	a s k eː n s j oː n ɛ m
s ɔ n ɔ r ʊ m	s ɔ n oː r ʊ m
m ɪ l ɪ t ɛ m	m iː l ɪ t ɛ m
p r ɛ w ɛ m n ɪ r ɛ	p r aɪ w ɛ n iː r ɛ
k ɔ n k ʊ s j ɔ n	k ɔ ŋ k ʊ sː j oː n ɛ m
t r a n s f ʊ g a m	t r aː n s f ʊ g a m
p ʊ ŋ n aː k ɛ	p ʊ ŋ n aː k ɛ m
p r aː k t ɪ k ʊ m	p r a k t ɪ k ʊ m
f aː s ɪ n j ʊ m	f a s k ɪ n ʊ m
ɛ r b aː k ɛ ʊ m	h ɛ r b aː k ɛu m
s aː t ɪ r ɪ k ʊ m	s a t ɪ r ɪ k ʊ m
g r aː w ɪ t aː t j oː n ɛ	g r a w ɪ t aː t j oː n ɛ m
t r aː b aː l j ʊ m	t r ɪ p aː l ɛ m
t r ɪ k ɛ	t r iː k ɛ m
k ʊ p ʊ l aː r ɛ	k oː p ʊ l aː r ɛ
w aː g ʊ m	w a g ʊ m
w ɛ r n ɪ k ɛ	w ɛ r n iː k ɛ m
s ʊ l k ʊ m	s ʊ l k ʊ m
ɛ k s ɪ gʷ ʊ	ɛ k s ɪ gʷ ʊ m
a t ɛ f aː l ʊ m	a k ɛ pʰ a l ʊ m
t ɛ r ʊ m	t ɔ r ʊ m
ɪ ŋ gʷ ɪ n ɛ	ɪ ŋ gʷ ɛ n
s ɛ n ɛ	s ɛ n ɛ m
k ɔ n s ɔ m aː r ɛ	k oː n s ʊ mː aː r ɛ
a b ɪ t ʊ w aː l ɛ	h a b ɪ t w aː l ɛ m
w ɛ n d ɛ m j a m	w iː n d eː m j a m
a kː ʊ s aː b ɪ l ɛ	a kː uː s aː b ɪ l ɛ m
t r a n s aː k t j ʊ m n ɛ m	t r aː n s aː k t j oː n ɛ m
d ɪ w ʊ l g aː t j oː n ɛ m	d iː w ʊ l g aː t j oː n ɛ m
ɛ kʷ ɪ w aː l eː r ɛ	aɪ kʷ ɪ w a l eː r ɛ
t ɛ r t j aː r ɛ	t ɛ r t j aː r ɛ
l aʊ r ʊ m k ɛ r aː s ʊ m	l aʊ r ɔ k ɛ r a s ʊ m
t ɔ r p oː r ɛ	t ɔ r p oː r ɛ m
k ɔ l t ɪ ɛ	k ʊ l k ɪ t a m
ɪ r aː t ʊ m	iː r aː t ʊ m
s aː k ʊ m	s a r k ʊ l ʊ m
k ɔ lː ɛ g j ʊ m	k ɔ lː eː g j ʊ m
r ʊ t ʊ m	r uː k t ʊ m
m ɛ s t ɛ r ɛ	m ɪ n ɪ s t ɛ r j ʊ m
ɔ r aː t j oː n ɛ m	oː r aː t j oː n ɛ m
a m ɪ g d aː l a m	a m y g d a l ʊ m
p r ɔ p ɪ n kʷ ɪ t aː t ɛ m	p r ɔ p ɪ ŋ kʷ ɪ t aː t ɛ m
k aː p r ʊ m	k a p r ʊ m
s ɛ l w aː t ɪ k	s ɪ l w aː t ɪ k ʊ m
r ɛ f r ɛ ɪ g ɛ r j ʊ m	r eː f r iː g ɛ r j ʊ m
t ɛ t ʊ m	t eː k t ʊ m
ɔ d oː r ɛ	ɔ d oː r ɛ m
w ɪ t ɛ m	w iː t ɛ m
p r ɛ t ɛ n d ɛ r ɛ	p r aɪ t ɛ n d ɛ r ɛ
k ʊ n t r ɪ b ʊ l aː r ɛ	k ɔ n t r ɪ b ʊ l aː r ɛ
ʊ s ʊ r aː r j ʊ m	uː s uː r aː r j ʊ m
ɛ m s ʊ g aː r ɛ	ɛ k sː uː k aː r ɛ
s ʊ k g ɛ r ɛ r ɛ	s ʊ gː ɛ r ɛ r ɛ
ɔ n ɛ s t aː	h ɔ n ɛ s t aː t ɛ m
n aː t aː t ɔ r j ʊ m	n a t aː t oː r j ʊ m
k a n t oː n ɛ m	k a n t j oː n ɛ m
a n ɛ t ʊ m	a n eː tʰ ʊ m
b ɛ n ɛ f ɪ k ʊ m	b ɛ n ɛ f ɪ k ʊ m
d ɛ n t aː t ʊ m	d ɛ n t aː t ʊ m
k ɔ n s ɪ l j a m r ɛ	k ɔ ŋ k ɪ l j aː r ɛ
t r a n s ʊ b s t a n t j aː r ɛ	t r aː n s ʊ b s t a n t j aː r ɛ
p r ɛ w j ʊ m	p r aɪ w j ʊ m
b ɛ n ɛ f ɪ k j ʊ m	b ɛ n ɛ f ɪ k j ʊ m
t r a n s m ʊ t aː t j oː n ɛ m	t r aː n s m uː t aː t j oː n ɛ m
j ɪ n ɪ p ɛ m r ʊ m	j uː n ɪ p ɛ r ʊ m
m ɛ m w ɛ r n ɛ m ɛ m	w eː r
p r ɔ m ɪ sː j oː n ɛ	p r ɔ m ɪ sː j oː n ɛ m
s ɔ l ɛ r t ɛ m	s ɔ lː ɛ r t ɛ m
m ɛ t ɪ j ɔ k r ɛ ɛ m	m ɛ d ɪ ɔ k r ɛ m
n ɔ w ɪ t j ʊ m	n ɔ w iː k j ʊ m
ɛ m ɛ t ɛ r ɛ	eː m ɪ tː ɛ r ɛ
l ɪ b r ʊ m	l iː b ɛ r ʊ m
w aː lː ʊ m	w a lː ʊ m
g ɛ ɔ g r aː f j a m	g eː ɔ g r a pʰ j a m
a m ɛ n t ʊ m	aː m ɛ n t ʊ m
ʊ s ɪ t aː t ʊ m	uː s ɪ t aː t ʊ m
m ɔ s t r w ʊ s ʊ m	m oː n s t r ʊ oː s ʊ m
d ɛ k ɪ m aː l ɛ	d ɛ k ɪ m a l ɛ m
l ɪ k ɛ n	l iː kʰ eː n a
b aː r b aː r ɪ d zː aː r ɛ	b a r b a r iː zː aː r ɛ
k ɛ d ɛ r ɛ	k eː d ɛ r ɛ
h aː r ʊ m	aː r j ʊ m
ɛ n s ɛ m	eː n s ɛ m
ɛ k m k ɛ lː ɛ n t j a m	ɛ k s k ɛ lː ɛ n t j a m
a k t oː r ɛ	aː k t oː r ɛ m
p l ʊ m b oː s ʊ m	p l ʊ m b oː s ʊ m
s uː fː ɪ k j ɛ n t j a m	s ʊ fː ɪ k ɪ ɛ n t j a m
p r ɔ m ɛ sː a m	p r oː m ɪ sː ʊ m
p r ɛ f ɛ r ɪ r ɛ	p r aɪ f ɛ rː ɛ
d ɪ p r ɪ n d ɛ r ɛ	d eː p r ɛ h ɛ n d ɛ r ɛ
k ʊ l ɛ k ʊ j ʊ m	k aʊ l ɪ k ʊ l ʊ m
ɪ sː ʊ m	ɪ p s ʊ m
a m aː r ɪ t ʊ d iː m ɛ	a m aː r ɪ t uː d ɪ n ɛ m
k ɔ n d ɪ ŋ n ʊ m	k ɔ n d ɪ ŋ n ʊ m
b aː k t ɪ s m ʊ m	b a p t ɪ s m ʊ m
a b aː l ɪ ɛ n aː r ɛ	a b a l ɪ eː n aː r ɛ
kʷ aː s a m r ɛ	kʷ a sː aː r ɛ
k l aʊ d ɪ k a m r ɛ	k l aʊ d ɪ k aː r ɛ
d ɛ m oː n j ʊ	d aɪ m ɔ n j ʊ m
t ɛ rː ɛ m m ɔ t ʊ m	t ɛ rː aɪ m ɔ t ʊ m
p aʊ p ɛ r ʊ m	p aʊ p ɛ r ɛ m
a t r aː r ɛ	a tː r a h ɛ r ɛ
ɛ t ʊ m	eː t ʊ m
ɛ l ɪ d ɛ r ɛ	eː l iː d ɛ r ɛ
ɪ m p uː l s ʊ m	ɪ m p ʊ l s ʊ m
s p ʊ s aː r ɛ	s p oː n s aː r ɛ
g aː rː ʊ l ʊ m	g a rː ʊ l ʊ m
a k ɛ t ʊ m	a k eː t ʊ m
m ɛ l j oː r a r ɛ	m ɛ l j oː r aː r ɛ
p r ɛ w aː l eː r ɛ	p r aɪ w a l eː r ɛ
ɪ n ʊ m	iː n ʊ m
a s t ɔ r ɛ	a s t ʊ r ɛ m
ɔ k k ɪ d ɛ n t ɛ m	ɔ kː ɪ d ɛ n t ɛ m
p r ɔ w ɛ n ɪ r ɛ	p r oː w ɛ n iː r ɛ
a b dː ɔ m ɛ n	a b d oː m ɛ n
k r aː p uː l m aː	k r aː p ʊ l a m
a g ɪ t aː t oː r ɛ	a g ɪ t aː t oː r ɛ m
f r ɛ aː k s ɪ n ɪ ʊ m	f r a k s ɪ n ɛu m
ɪ nː ɔ w aː t j oː n ɛ m	ɪ nː ɔ w aː t j oː n ɛ m
ɪ n d ɪ ŋ n aː r ɛ	ɪ n d ɪ ŋ n aː r iː
k ɔ sː ʊ m	k ɔ sː ʊ m
k ɔ m uː n aː l	k ɔ mː uː n aː l ɛ m
f ʊ n t a n a m	f ɔ n t aː n a m
ɛ s ɛ r k ɪ t ʊ m	ɛ k s ɛ r k ɪ t ʊ m
ɪ m p ɛ m d ɪ m ɛ n t ʊ m	ɪ m p ɛ d iː m ɛ n t ʊ m
k ʊ ɪ r ʊ m	k ɔ r j ʊ m
a p aː r ɪ t j ɔ n	a pː aː r ɪ t j oː n ɛ m
s ɔ m b r a m	ʊ m b r a m
p a nː ʊ m	p a nː ʊ m
n aː rː aː t j ɔ n	n aː rː aː t j oː n ɛ m
ɪ n s p ɛ k t j ʊ m n aː r ɛ	iː n s p ɛ k t aː r ɛ
n ʊ p t j a s	n uː p t j aː s
ɔ b j ɛ k t ʊ m	ɔ b ɪ ɛ k t ʊ m
g ɔ k ʊ n d ɪ t aː t ɛ m	j uː k ʊ n d ɪ t aː t ɛ m
k ɔ n f ɪ r m aː t j oː n ɛ m	k oː n f ɪ r m aː t j oː n ɛ m
l a ŋ gʷ ɪ d ʊ m	l a ŋ gʷ ɪ d ʊ m
ɔ n oː r ɛ	h ɔ n oː r ɛ m
m ɛ d ɪ t ɛ rː aː n ɛ ʊ m	m ɛ d ɪ t ɛ rː aː n ɛu m
b aː r b uː l aː	b a r b ʊ l a m
a m b ɪ gʷ ɪ t aː t	a m b ɪ gʷ ɪ t aː t ɛ m
aː k ɪ d aː t ɛ m	a k ɪ d ɪ t aː t ɛ m
s kʷ aː l ɪ d ʊ m	s kʷ aː l ɪ d ʊ m
uː k s ɔ r ɪ k ɪ d j ʊ m	ʊ k s oː r ɪ k iː d j ʊ m
p l ʊ b j ɔ s ʊ m	p l ʊ w j oː s ʊ m
g ʊ d ɪ t j aː l ɛ	j uː d ɪ k j aː l ɛ m
aʊ d ɪ t j oː n ɛ	aʊ d iː t j oː n ɛ m
s t ɪ p ʊ l a m r ɛ	s t ɪ p ʊ l aː r iː
ɪ mː aː g ɪ n aː t ɪ w ʊ m	ɪ m aː g ɪ n aː t ɪ w ʊ m
p ɔ k ʊ	p aʊ k ʊ m
ɔ r d ɪ n aː t oː r	ɔ r d ɪ n aː t oː r ɛ m
ɪ m p ɛ m t ɪ g ɪ n ɛ m	ɪ m p ɛ t iː g ɪ n ɛ m
f aː t ɛ m	f a k ɪ ɛ m
b ɪ k a m	b iː g a m
s uː kː k j n aː r ɛ	s uː g ɛ r ɛ
ɛ r ʊ m g aː r ɛ	eː r ɔ g aː r ɛ
k r ɪ m ɪ n ɛ	k r iː m ɛ n
l ɔ k aː l ɛ	l ɔ k aː l ɛ m
r ɪ t ʊ m	r iː t ʊ m
p ɪ s m ʊ m p a d ʊ m	ɛ p ɪ s k ɔ p aː t ʊ m
l aʊ d ɛ	l aʊ d ɛ m
p aː t r a s t r ʊ m	p a t r a s t r ʊ m
f a l s aː r ɛ	f a l s aː r ɛ
s ʊ g ɛ lː ʊ m	s ɪ g ɪ lː ʊ m
k ɔ m p ɛ m l ɪ r ɛ	k ɔ m p ɛ lː ɛ r ɛ
n aː t uː r a m	n aː t uː r a m
