ɛ k s ʊ l t aː t j oː n ɛ m	ɛ k s ʊ l t a t j oː n ɛ m
p uː b l ɪ k ʊ m	p uː b l ɪ k ʊ m
uː m ɪ l j a m t j oː n ɛ m	h ʊ m ɪ l j aː t j oː n ɛ m
f ɪ k t j oː n ɛ m	f ɪ k t j oː n ɛ m
a k k ɛ n t ʊ m	a kː ɛ n t ʊ m
ɪ n s t aʊ r aː r ɛ	iː n s t aʊ r aː r ɛ
j uː d ɪ k a m t oː r ɛ	j uː d ɪ k aː t oː r ɛ m
p ɛ r ɪ g ʊ n t aː r ɛ	p ɛ r k ɔ n t aː r iː
ɛ rː aː r ɛ	ɛ rː aː r ɛ
a r b ʊ s t ɪ w ʊ m	a r b ʊ s t iː w ʊ m
n ɛ s k j ʊ m	n ɛ s k j ʊ m
ɛ k s f ɔ l j aː r ɛ	ɛ k s f oː l j aː r ɛ
r ɔ m aː n oː	r oː m aː n ʊ m
ɪ n w ɪ t aː r ɛ	ɪ n w iː t aː r ɛ
s a n t ʊ m r j ɛ t a m	s a t ʊ r eː j a m
ɛ m ɛ t ɛ r ɛ	eː m ɪ tː ɛ r ɛ
t oː r ɛ	t oː r ɛ m
r ʊ g ɪ n ɛ	aɪ r uː g ɪ n ɛ m
d ɪ s p ɔ s aː r ɛ	d eː s p oː n s aː r ɛ
p a r aː g r aː f ʊ m	p a r a g r a pʰ ʊ m
ɔ l ɪ r ɛ	ɔ l eː r ɛ
s t r ɪ g a m	s t r iː g a m
s a l m a m	s a g m a m
k ɪ n t uː r a m	k ɪ ŋ k t uː r a m
b r aː k aː	b r aː k a m
rː uː t a m	r uː t a m
ɔ s t ɪ l ɛ	h ɔ s t iː l ɛ m
ɔ s k ʊ l a m t j oː n ɛ m	ɔ s k ʊ l aː t j oː n ɛ m
m a l f aː t oː r ɛ	m a l ɛ f a k t oː r ɛ m
ɪ l ʊ d ɪ r ɛ	ɪ lː uː d ɛ r ɛ
w ɪ s ɪ t aː t j ʊ m n ɛ m	w iː s ɪ t aː t j oː n ɛ m
n a w ɪ r ʊ m	n aː w ɪ g j ʊ m
p ɔ s aː r ɛ	p aʊ s aː r ɛ
d ɪ sː ɛ kː aː t j oː n ɛ m	d eː s ɪ kː aː t j oː n ɛ m
b s t r uː k j ʊ m	s t r uː tʰ j oː n ɛ m
l oː ʊ d a m t oː r ɛ	l aʊ d aː t oː r ɛ m
k ɛ g aː r ɛ	k aɪ k aː r ɛ
a n l j aː r ɛ	ɪ lː ɪ g aː r ɛ
p ɪ nː aː k ʊ l ʊ m	p ɪ nː aː k ʊ l ʊ m
r ɛ g ɛ r ɛ	r ɛ g ɛ r ɛ
l a p ɪ d ɛ	l a p ɪ d ɛ m
r ɛ w ɛ r t a m r ɛ	r ɛ w ɛ r t iː
p ɪ g r ɛ m ɪ t j a m	p ɪ g r ɪ t j a m
l a r w aː	l aː r w a m
g aː r j aː	g l aː r ɛ a m
w ɪ d ʊ ɪ t aː	w ɪ d ʊ ɪ t aː t ɛ m
a p ɪ k k ɛ m	a p ɪ k ɛ m
s ʊ g g ɛ r ɛ r ɛ	s ʊ gː ɛ r ɛ r ɛ
p r ɛ k ɔ n ʊ m s k ɛ r ɛ m	p r aɪ k ɔ ŋ n ɔ s k ɛ r ɛ
s t aː t ɛ r a m	s t a t eː r a m
d ɛ n t aː t ʊ m	d ɛ n t aː t ʊ m
ɛ r ɪ m ʊ m	h ɛ r eː m ʊ m
ɛ k s p ʊ ŋ n aː r ɛ	ɛ k s p ʊ ŋ n aː r ɛ
k ɔ n s ʊ m aː t j oː n ɛ m	k oː n s ʊ mː aː t j oː n ɛ m
p a w ɪ d ʊ m	p a w ɪ d ʊ m
g l ɔ s a m	g l ɔ sː a m
s k aː r a m b ɛ l ʊ m	s k a r a b aɪ ʊ m
r ɛ p ʊ t aː r ɛ	r ɛ p ʊ t aː r ɛ
d ɪ s t ɛ ŋ d ɛ r ɛ	d eː s k ɛ n d ɛ r ɛ
k ɛ l ɛ m r ɛ	k ɛ l ɛ r ɛ m
m a r a m w ɪ l a m	m iː r aː b ɪ l ɛ m
r uː g ɪ r ɛ	r uː g iː r ɛ
k ɛ r t ɛ n aː r ɛ	k ɪ r k ɪ n aː r ɛ
p ʊ ɛ r ɪ l ɪ t aː t ɛ m	p ʊ ɛ r iː l ɪ t a t ɛ m
r uː m ɪ n aː r ɛ	r uː m ɪ n aː r iː
s ɛ r w ɪ t ʊ t ɛ m	s ɛ r w ɪ t uː t ɛ m
w ɔ m ɪ k ʊ m	w ɔ m ɪ k ʊ m
m a n ʊ b r j ʊ m	m a n uː b r j ʊ m
d r aː p ɛ ʊ m	d r a pː ʊ m
p r ɛ k ɛ d ɛ r ɛ	p r aɪ k eː d ɛ r ɛ
g r aː t ɪ t uː m	g r aː t ɪ t uː d ɪ n ɛ m
ɔ r ɪ g ɪ n aː r j ʊ m	ɔ r iː g ɪ n aː r j ʊ m
t r aː d ɪ r ɛ	t r aː d ɛ r ɛ
k ɔ n mː uː t aː r ɛ	k ɔ mː uː t aː r ɛ
a sː ʊ n t j oː n ɛ m	a sː uː m p t j oː n ɛ m
p ɛ s t ɛ m	p ɛ s t ɛ m
w ɛ r m ɪ n oː s ʊ m	w ɛ r m ɪ n oː s ʊ m
b a l t ɛ ʊ m	b a l t ɛu m
k ɛ r w a m	k ɛ r w a m
s a p eː r ɛ	s a p ɛ r ɛ
a d ɔ r m ɛ m t ɛ r ɛ	a dː ɔ r m iː s k ɛ r ɛ
a r d w ʊ m	a r d ʊː m
t r aː k j ʊ m	tʰ r aː k j ʊ m
s ɛ n aː r ɛ	s ɪ ŋ n aː r ɛ
s a r k ɪ n a m	s a r k ɪ n a m
ɛ k s aʊ r ɪ r ɛ	ɛ k s h aʊ r iː r ɛ
k ɔ l m ʊ m	k ʊ l m ʊ m
ɔ p r ɪ m ɛ r ɛ	ɔ pː r ɪ m ɛ r ɛ
t r a n s ɪ r ɛ	t r aː n s iː r ɛ
f ɪ sː j oː n ɛ m	f ɪ sː j oː n ɛ m
g ɔ j ʊ m	l ɔ l j ʊ m
k uː r a m	k uː r a m
s ɪ l w ɛ s t r ɛ ɛ m	s ɪ l w ɛ s t r ɛ m
a n t ɪ k ɪ p a m r ɛ	a n t ɪ k ɪ p aː r ɛ
k ʊ k ʊ l ʊ	k ʊ k uː l ʊ m
ɛ k s k r ɛ t aː r ɛ	ɛ k s k ɛ r n ɛ r ɛ
r ʊ b ɪ ɛ n	r oː b iː g ɪ n ɛ m
p a l ʊ d ɛ m	p a l uː d ɛ m
a b s t r a h ɛ r ɛ	a b s t r a h ɛ r ɛ
ɛ gʷ aː l t aː t ɛ m	aɪ kʷ aː l ɪ t aː t ɛ m
a nː w ʊ m	a nː ʊː m
a n ʊ t ɪ n ʊ m	a nː oː t ɪ n ʊ m
r ʊ t aː r ɛ	r ʊ k t aː r ɛ
s t ɛ r k ʊ m m	s t ɛ r k ʊ s
t ɛ n d ɛ r ɛ	t ɛ n d ɛ r ɛ
ɛ k s ɛ k r a m r ɛ	ɛ k sː ɛ k r aː r iː
t ɛ r s ʊ m	t ɛ r s ʊ m
ɪ ŋ g ɛ n j ʊ m	ɪ ŋ g ɛ n j ʊ m
p r ɛ d aː t j oː n ɛ m	p r aɪ d aː t j oː n ɛ m
f ɛ r ɛ m t r ʊ m	f ɛ r ɛ t r ʊ m
p r ɛ j uː d ɪ k aː r ɛ m	p r aɪ j uː d ɪ k aː r ɛ
f ɪ n kː aː r ɛ	f iː g ɛ r ɛ
ɪ n f r ɪ n aː r ɛ	iː n f r eː n aː r ɛ
f ɪ r ɛ	f ɪ ɛ r iː
p r ɛ t ɛ r n aː t uː r aː l ɛ m	p r aɪ t ɛ r n aː t uː r aː l ɛ m
k r ɛ m a m r ɛ	k r ɛ m aː r ɛ
m ɛ d ɪ t ɛ rː aː n ɛ ʊ m	m ɛ d ɪ t ɛ rː aː n ɛu m
l ɪ b ɪ d oː	l ɪ b iː d ɪ n ɛ m
t a ŋ g ɛ r ɛ	t a ŋ g ɛ r ɛ
ɪ n s ɛ r ɪ r ɛ	iː n s ɛ r ɛ r ɛ
a k l ʊ t ɪ n a m r ɛ	a gː l uː t ɪ n aː r ɛ
a s ɪ l ʊ m	a s y l ʊ m
m ɛ r m g ʊ l ʊ m	m ɛ r g ʊ m
k ɔ n s ɛ kʷ ɛ n t j a m	k oː n s ɛ kʷ ɛ n t j a m
k ɔ s t aː t ʊ m	k ɔ s t aː t ʊ m
ɔ b sː ɛ d ɛ r ɛ	ɔ b s ɪ d eː r ɛ
t r ɪ lː ʊ m	t r iː b ʊ l ʊ m
k oː l t k ɛ	k ʊ l k ɪ t a m
s uː b s ɪ d j ʊ m	s ʊ b s ɪ d j ʊ m
s uː b l ɪ m aː t j oː n ɛ m	s ʊ b l iː m aː t j oː n ɛ m
p ɔ l ʊ m	p ɔ l ʊ m
n ʊ t r ɪ k ɛ	n uː t r iː k ɛ m
r ɛ l ɛ g aː r ɛ	r ɛ l ɛ g ɛ r ɛ
m ɔ r j a m	m ʊ r j a m
ʊ s ɪ n oː l ʊ m	l ʊ s k ɪ n j a m
r ɔ r ɛ m aː r ɪ n ʊ m	r oː s m a r iː n ʊ m
ɛ k aː r ɪ s t j a m	ɛu kʰ a r ɪ s t j a m
m a l ɪ ŋ n ʊ m	m a l ɪ ŋ n ʊ m
d ɛ l ɪ b ɛ r aː t j oː n ɛ m	d eː l iː b ɛ r aː t j oː n ɛ m
f ɔ k a m	pʰ oː k a m
s ɛ n d aː r ɛ	s ɛ d eː r ɛ
aʊ d aː k ɛ	aʊ d aː k ɛ m
j ɛ r aː r k a m	h ɪ ɛ r a r kʰ a m
ɔ b s t ɛ t r ɪ k a m	ɔ b s t ɛ t r iː k ɛ m
ɛ s t r ɛ nː a m	s t r eː n a m
m ɔ n d aː r ɛ	m ʊ n d aː r ɛ
s ɛ t aː	s aɪ t a m
k ʊ k ʊ lː a m	k ʊ k ʊ lː a m
k ʊ k ɪ n aː r ɛ	k ɔ kʷ iː n aː r ɛ
d ɛ r oː m p ɛ r ɛ	d iː r ʊ m p ɛ r ɛ
d ɛ w ɛ n ɪ r ɛ	d eː w ɛ n iː r ɛ
p l aː n ɪ t j ɛ m	p l aː n ɪ t ɪ ɛ m
uː b ɪ k a m t j oː n ɛ m	ʊ b ɪ k aː t j oː n ɛ m
s a ŋ gʷ ɪ n oː s ʊ m	s a ŋ gʷ ɪ n oː s ʊ m
p ɛ r ɪ k l ɪ t aː r ɛ	p ɛ r iː k l ɪ t aː r iː
w ʊ l g ʊ m	w ʊ l g ʊ s
p ʊ l k r ʊ m	p ʊ l kʰ r ʊ m
m ʊ l t ɪ p l ɪ k aː t j oː n ɛ m	m ʊ l t ɪ p l ɪ k aː t j oː n ɛ m
s uː pː l ɪ k aː r ɛ	s ʊ pː l ɪ k aː r ɛ
s ɛ n s aː t j oː n ɛ m	s eː n s aː t j oː n ɛ m
w a k ɪ lː a m t j oː n ɛ m	w a k ɪ lː aː t j oː n ɛ m
ɪ m p ɛ lː ɛ r ɛ	ɪ m p ɛ lː ɛ r ɛ
m ɔ d ʊ l aː r ɛ	m ɔ d ʊ l aː r iː
ɪ n mː aː t ʊ r ʊ m	ɪ mː aː t uː r ʊ m
s k ɔ p aː r ɛ	s k ɔ p ɛ r ɛ
k a p t aː r ɛ	k a p t aː r ɛ
ɪ n ɪ t j aː l ɛ	ɪ n ɪ t j aː l ɛ m
r ɛ g m ʊ m g aː r ɛ	m ʊ sː aː r ɛ
p r oː ɪ b ɪ r ɛ	p r ɔ h ɪ b eː r ɛ
l ɪ m p ɪ d ɛ m	l ɪ m p ɪ d ʊ m
f ɛ k ʊ n d oː	f eː k ʊ n d ʊ m
k ɔ n d uː k ɪ r ɛ	k ɔ n d uː k ɛ r ɛ
b l a n d ɪ r ɛ	b l a n d iː r iː
b ɛ rː k oː	w ɛ rː ɛ m
r uː d ɛ m	r ʊ d ɛ m
r ɔ t ɛ lː a m	r ɔ t ɛ lː a m
a d ɪ r	a dː ɛ r ɛ
s k ɔ l aː s t ɪ k ʊ m	s kʰ ɔ l a s t ɪ k ʊ m
s ɪ m p l ɪ k ɛ m	s ɪ m p l ɪ k ɛ m
f r aː ŋ g ɛ r ɛ	f r a ŋ g ɛ r ɛ
ɪ m p aː w ɪ d ʊ m	ɪ m p a w ɪ d ʊ m
k a l ɛ n d a m s	k a l ɛ n d aː s
ɪ n t r ɔ iː t ʊ m	ɪ n t r ɔ ɪ t ʊ m
w ɛ t ɛ r ɛ	w ɛ t ɛ r ɛ m
p ɛ r k oː l aː r ɛ	p ɛ r k oː l aː r ɛ
ɛ g r ʊ m	aɪ g r ʊ m
r a p t aː r ɛ	r a p t aː r ɛ
m ɛ n t ʊ m	m ɛ n t ʊ m
a s k ʊ n d ɛ r ɛ	a b s k ɔ n d ɛ r ɛ
m ʊ n t oː s ʊ m	m ɔ n t ʊ oː s ʊ m
ɔ r ɪ g ɪ n ɛ	ɔ r iː g ɪ n ɛ m
ɛ k s k ɛ s ɪ w ʊ m	ɛ k s k ɛ sː ɪ w ʊ m
m ɪ l ɪ t aː r ɛ	m iː l ɪ t aː r ɛ
l ɪ r ɪ k ʊ m	l y r ɪ k ʊ m
ɪ n ʊ n d aː t j oː n ɛ m	ɪ n ʊ n d aː t j oː n ɛ m
t r ɪ p l ɪ k k ɛ	t r ɪ p l ɪ k ɛ m
k a r ʊ m	k aː r ʊ m
r ɛ t r ɔ k ɛ d ɛ r ɛ m	r ɛ t r oː k eː d ɛ r ɛ
a s ɛ r t j oː n ɛ m	a sː ɛ r t j oː n ɛ m
d ɛ s w j a m r ɛ	d eː w j aː r ɛ
h ɛ l k ɪ n aː m ɛ	iː l ɪ k ɛ m
d ɪ k t aː m ɛ n	d ɪ k t aː m ɛ n
r a d j aː r ɛ	r a d j aː r ɛ
s a n aː r ɛ	s aː n aː r ɛ
ɔ b t ɛ m p ɛ r aː r ɛ	ɔ b t ɛ m p ɛ r aː r ɛ
a b j ɛ m k t j oː n ɛ m	a b ɪ ɛ k t j oː n ɛ m
p r ʊ d ɛ r ɛ	p r uː r iː r ɛ
k ɔ n k ɪ s ʊ m	k ɔ ŋ k ɪ d ɛ r ɛ
a sː ɪ s ʊ m	a sː ɛ sː ʊ m
a d ɪ k r ɛ	a dː iː k ɛ r ɛ
ɪ m p ɛ m d ɛ r ɛ	ɪ m p ɛ d iː r ɛ
a l t ɛ r k aː t j oː n ɛ m	a l t ɛ r k aː t j oː n ɛ m
ɪ n w ɛ s t ɪ r ɛ	ɪ n w ɛ s t iː r ɛ
p r ʊ n ʊ m	p r uː n ʊ m
m ɪ n ʊ ɪ r ɛ	m ɪ n ʊ ɛ r ɛ
r ɛ s aː r k ɪ r ɛ	r ɛ s a r k iː r ɛ
p ɪ n t aː r ɛ	p ɪ ŋ g ɛ r ɛ
f ʊ s t ɪ g aː r ɛ	f uː s t iː g aː r ɛ
a r k aː n ʊ m	a r k a n ʊ m
a k ɛ t ʊ m	a k eː t ʊ m
ɪ n b ɛ n ɛ m ɪ n aː r ɛ	w ɛ n eː n aː r ɛ
m ɛ s ɛ m	m eː n s ɛ m
p ɛ lː ɪ k ʊ l a m	p ɛ lː ɪ k ʊ l a m
d ɔ t aː t j ʊ m n ɛ m	d oː t aː t j oː n ɛ m
uː n ɪ k ʊ m	uː n ɪ k ʊ m
m ɪ t ɪ g a m r ɛ	m iː t ɪ g aː r ɛ
p ɛ r ɪ k ʊ m l oː s ʊ m	p ɛ r iː k ʊ l oː s ʊ m
m ʊ s aː r aː n ʊ m	m uː s a r aː n ɛu m
a m aː t oː r ɛ	a m aː t oː r ɛ m
r ɛ t ɪ	r eː t ɛ
a l ʊ t ɪ n aː r ɛ	aː l uː k ɪ n aː r iː
a r g ɪ lː a m	a r g ɪ lː a m
s ɛ l w aː t ɪ k	s ɪ l w aː t ɪ k ʊ m
kʷ ɪ n t ʊ m	kʷ iː n t ʊ m
ɪ d ɛ n t ɪ d aː t ɛ m	iː d ɛ n t ɪ t aː t ɛ m
s t ɔ r j a m	s t ɔ r ɛ a m
g l ɔ r j ʊ m s ɪ sː ɪ m ʊ m	g l oː r j oː s ɪ sː ɪ m ʊ m
ɪ rː ɪ g a m r ɛ	ɪ rː ɪ g aː r ɛ
ɪ ŋ j uː r j a m	ɪ n ɪ uː r j a m
t ɔ r ɛ ʊ w ɪ s k ʊ m	t ʊ r b ɪ s k ʊ m
ɛ g r ɛ g ɪ ʊ m	eː g r ɛ g j ʊ m
w ɪ lː aː n ʊ m	w iː lː aː n ʊ m
ɪ m p l ɪ k aː r ɛ	ɪ m p l ɪ k aː r ɛ
a l ɪ j ɛ n aː r ɛ	a l ɪ eː n aː r ɛ
ɔ r p ɪ m ɛ n t ʊ m	aʊ r ɪ p ɪ g m ɛ n t ʊ m
s a p j ɛ n t j a m	s a p ɪ ɛ n t j a m
g ɛ m ɪ t ʊ m	g ɛ m ɪ t ʊ m
l ɪ n ɛ aː r ɛ	l iː n ɛ aː r ɛ
p ɛ d ɪ k ɛ lː ʊ m	p ɛ d iː k ɛ lː ʊ m
p ɪ s m ʊ m p aː d ʊ m	ɛ p ɪ s k ɔ p aː t ʊ m
k ɔ nː ɛ k t ɛ r ɛ	k oː n ɛ k t ɛ r ɛ
t r a n s uː b s t a n t j aː r ɛ	t r aː n s ʊ b s t a n t j aː r ɛ
a ɪ d j a m	a k eː d j a m
s p ʊ m aː r ɛ	s p uː m aː r ɛ
w a k ɪ lː a m r ɛ	w a k ɪ lː aː r ɛ
p r ɛ s a m g j aː r ɛ	p r aɪ s aː g iː r ɛ
r ɛ k ʊ r s j oː n ɛ m	r ɛ k ʊ r s j oː n ɛ m
ɔ d oː r ɛ	ɔ d oː r ɛ m
p ɔ r k a	p ɔ r k a m
a kː r ɛ t j oː n ɛ	a kː r eː t j oː n ɛ m
k a t ɛ k ɪ d zː aː r ɛ m	k a t eː kʰ iː zː aː r ɛ
t r ʊ k ɛ	t r ʊ k ɛ m
p l ʊ m b ɛ ʊ m	p l ʊ m b ɛu m
m ɔ k ʊ n ɛ m	m uː t ʊ l ʊ m
t ɛ rː ɛ m m oː t ʊ m	t ɛ rː aɪ m ɔ t ʊ m
d ʊ l k ɪ t uː m d ɪ r ɛ m	d ʊ l k ɪ t uː d ɪ n ɛ m
n ɔ s ɔ k oː m j ʊ m	n ɔ s ɔ k ɔ m iː ʊ m
k ʊ l ʊ m ɛ lː a m	k ɔ l ʊ m ɛ lː a m
d ɪ f ɛ n s j oː n ɛ m	d eː f eː n s j oː n ɛ m
ɪ ŋ g ɛ r ɪ r ɛ	ɪ ŋ g ɛ r ɛ r ɛ
m ɔ r b ʊ m	m ɔ r b ʊ m
aʊ d aː k j a m	aʊ d aː k j a m
f ɛ r w ɛ r ɛ	f ɛ r w eː r ɛ
k uː l t ʊ m	k ʊ l t ʊ m
ɛ k s aː l t a m r ɛ	ɛ k s a l t aː r ɛ
s k aː n d ʊ m l a m	s k a n d ʊ l a m
p r ɔ m ʊ l g aː t j oː n ɛ m	p r oː m ʊ l g aː t j oː n ɛ m
ɛ k s p oː n ɛ	ɛ k s p oː n ɛ r ɛ
a s p ɛ k t aː r ɛ	a s p ɛ k t aː r ɛ
r a p ɪ d ɪ t aː	r a p ɪ d ɪ t aː t ɛ m
ɛ k s ɪ g ʊ m	ɛ k s ɪ gʷ ʊ m
k ɔ ŋ n oː m ɛ n	k oː ŋ n oː m ɛ n
a sː uː m ɪ r ɛ	a sː uː m ɛ r ɛ
t a b ʊ l a m	t a b l a m
k a m b j aː r ɛ	k a m b iː r ɛ
b a kː a l ɛ m r aː t ʊ m	b a kː a l aʊ r ɛ a t ʊ m
ɛ k s ʊ l t aː	ɛ k s ʊ l t aː r ɛ
s k a n d ɪ r ɛ	s k a n d ɛ r ɛ
a b ɪ t aː r ɛ	h a b ɪ t aː r ɛ
ɛ l uː d ɪ r ɛ	eː l uː d ɛ r ɛ
s aː b ʊ rː a m	s a b ʊ rː a m
a gː r aː w aː r ɛ	a gː r a w aː r ɛ
w a lː ʊ m	w a lː ʊ m
d ɪ m a n d aː r ɛ	d eː m a n d aː r ɛ
ɪ n k aː r n aː t j oː n ɛ m	ɪ ŋ k a r n aː t j oː n ɛ m
p r ɔ m ɛ s a m	p r oː m ɪ sː ʊ m
w a lː ɛ t ʊ m	w a lː ɛ tː ʊ m
p ɔ lː ɪ k ɛ m	p ɔ lː ɪ k ɛ m
d eː ŋ ɪ f ɪ k aː r ɛ	d ɛ ɪ f ɪ k aː r ɛ
ɛ l aː t j oː n	eː l aː t j oː n ɛ m
w ɛ n j a m	w ɛ n j a m
m k ʊ m t ʊ m n ɛ m	m aː l ʊ m k ɔ t oː n j ʊ m
p a l ʊ d oː s ʊ m	p a l uː d oː s ʊ m
a d ʊ l t ɛ r ɪ n ʊ m	a d ʊ l t ɛ r iː n ʊ m
a b aː l ɪ ɛ n aː r ɛ	a b a l ɪ eː n aː r ɛ
r ɔ k d r ɪ k n	r ɪ d ɪ k a m
ɛ k s k ɔ r j aː r ɛ	ɛ k s k ɔ r j aː r ɛ
d ɛ m ɔ m s t r aː t j oː n ɛ m	d eː m oː n s t r aː t j oː n ɛ m
d uː b ɪ t aː t j ʊ m n ɛ m	d ʊ b ɪ t aː t j oː n ɛ m
s ʊ b j ʊ g aː r ɛ	s ʊ b j ʊ g aː r ɛ
w ɛ l ɔ k ɛ	w eː l oː k ɛ m
n ɔ m ɪ n aː t j oː n ɛ m	n oː m ɪ n aː t j oː n ɛ m
a d uː l t ɛ r aː r ɛ	a d ʊ l t ɛ r aː r ɛ
m ɪ l oː r ɛ	m ɛ l j oː r ɛ m
a fː ɪ r m aː r ɛ	a fː ɪ r m aː r ɛ
ɪ n f ɛ k t j oː n ɛ m	ɪ n f ɛ k t j oː n ɛ m
a g r ɛ s t ɛ m	a g r ɛ s t ɛ m
s ɪ l ɪ k j ʊ m	s ɪ l ɪ k j ʊ m
s ʊ s p ɛ n s j oː n ɛ m	s ʊ s p eː n s j oː n ɛ m
k ɔ n k ɪ t a m t j oː n ɛ m	k ɔ ŋ k ɪ t aː t j oː n ɛ m
ɪ m p ɛ m d ɪ m ɛ n t ʊ m	ɪ m p ɛ d iː m ɛ n t ʊ m
p a r ɪ ɛ t aː l ɛ	p a r ɪ ɛ t aː l ɛ m
s uː t ʊ r a m	s uː t uː r a m
d ɪ p t oː ŋ g ʊ m	d ɪ pʰ tʰ ɔ ŋ g ʊ m
p a n ɪ k ʊ m	p aː n ɪ k j ʊ m
k ɪ k oː r j ɛ m	k ɪ kʰ ɔ r j ʊ m
t r a n s f ɛ r ɛ r ɛ	t r aː n s f ɛ rː ɛ
p r ɔ m ɪ s j oː n ɛ	p r ɔ m ɪ sː j oː n ɛ m
m ʊ l aː r ɛ	m ɔ lː iː r ɛ
p a t ɛ r n ʊ m	p a t ɛ r n ʊ m
d ɛ r ɪ s oː r j ʊ m	d eː r iː s oː r j ʊ m
p ɛ d ɛ s t r ɛ m	p ɛ d ɛ s t r ɛ m
ɛ k s p ʊ ŋ g ɛ r ɛ	ɛ k s p ʊ ŋ g ɛ r ɛ
k ɔ m p l ɪ k aː t j oː n ɛ m	k ɔ m p l ɪ k aː t j oː n ɛ m
s ɛ p t ɛ n t r j oː n aː l ɛ m	s ɛ p t ɛ n t r j oː n aː l ɛ m
f ɔ sː a m	f ɔ sː a m
k ɔ r t ɛ m	k ɔ h ɔ r t ɛ m
k a pː l ʊ m	k a p ʊ l ʊ m
h k ɛ	kʷ ɛ m
a nː eː k aː r ɛ	n ɛ k aː r ɛ
t r aː t aː t ʊ m	t r a k t aː t ʊ m
p ɔ r k ɪ n ʊ m	p ɔ r k iː n ʊ m
ɔ r aː t oː r ɛ	oː r aː t oː r ɛ m
f r ʊ ɪ r ɛ	f r ʊ iː
m a g ʊ m	m a g ʊ m
a ŋ g ʊ s t aː r ɛ	a ŋ g ʊ s t aː r ɛ
a m aː r ɪ t uː t ɪ m ɛ m	a m aː r ɪ t uː d ɪ n ɛ m
p ɔ r t ʊ g ɛ s ɛ	p ɔ r t ʊ k eː n s ɛ m
f aʊ k ɪ m	f aʊ k eː s
g ɛ m ɪ n aː r ɛ	g ɛ m ɪ n aː r ɛ
s ɔ m n ɪ f ɛ r ʊ m	s ɔ m n ɪ f ɛ r ʊ m
l ɪ m aː r ɛ	l iː m aː r ɛ
s k aː p ʊ l a m	s k a p ʊ l a m
t r uː k ʊ l ɛ n t ʊ m	t r ʊ k ʊ l ɛ n t ʊ m
p a r t ɪ t j oː n ɛ m	p a r t iː t j oː n ɛ m
a m ɪ g d aː l aː	a m y g d a l ʊ m
a b s ɔ r p t j oː n ɛ m	a b s ɔ r p t j oː n ɛ m
p r ɛ n ʊ m	p r aɪ ŋ n aː t ɛ m
b ʊ k ɪ n ɛ	b uː k ɪ n ʊ m
t r a n s f uː g a m	t r aː n s f ʊ g a m
s ɪ g ɪ lː aː r ɛ	s ɪ g ɪ lː aː r ɛ
a s k ɛ n s j oː n ɛ m	a s k eː n s j oː n ɛ m
l uː k ɪ n ʊ m l oː	ɛ lː y kʰ n j ʊ m
uː s ʊ m	uː s ʊ m
a gː r ɛ d iː r ɛ	a gː r ɛ d iː
f ʊ l w ʊ m	f ʊ l w ʊ m
g a lː ʊ m	g a lː ʊ m
d ɛ m oː n j ʊ m	d aɪ m ɔ n j ʊ m
r ɪ l ʊ k ɛ r ɛ	r ɛ l uː k eː r ɛ
k ɔ t ʊ m	k aʊ t ʊ m
s ʊ n ʊ m	s ɔ n ʊ m
k ʊ n k ɛ r ɪ r	k ɔ ŋ kʷ iː r ɛ r ɛ
n a w ɪ g aː r ɛ	n aː w ɪ g aː r ɛ
ɪ t uː d ɪ n ɛ	t uː d ɪ n ɛ m
p r ɔ ɪ b ɪ t j oː n ɛ m	p r ɔ h ɪ b ɪ t j oː n ɛ m
p r ɔ k sː ɪ m ʊ m	p r ɔ k s ɪ m ʊ m
j uː r a m t oː r ɛ	j uː r aː t oː r ɛ m
n a rː aː t j oː n ɛ m	n aː rː aː t j oː n ɛ m
b ɛ n ɛ d ɪ k ɛ r ɛ	b ɛ n ɛ d iː k ɛ r ɛ
a tː r ɪ b ʊ ɛ r ɛ	a tː r ɪ b ʊ ɛ r ɛ
w a g aː b ʊ n d ʊ m	w a g aː b ʊ n d ʊ m
s ɛ r w ɪ t uː m r ɛ ɛ m	s ɛ r w ɪ t uː d ɪ n ɛ m
a t l aː n t ɪ k ʊ m	aː t l a n t ɪ k ʊ m
ɔ d j ɪ ɛ r n ʊ m	h ɔ d ɪ ɛ r n ʊ m
k a l k aː ʊ m	k a l k aː n ɛu m
r ɛ w ɛ m r s aː r ɛ	r ɛ w ɛ r s aː r ɛ
ɛ j ʊ n oː	j eː j uː n j ʊ m
k a w aː lː ɛ r ʊ m	k a b a lː aː r j ʊ m
k ɪ n t ʊ m	k ɪ ŋ k t ʊ m
t r ɪ p l ʊ m	t r ɪ p l ʊ m
ɛ k s ɔ r t aː t j oː n ɛ m	ɛ k s h ɔ r t aː t j oː n ɛ m
s m ɛ r aː l d ʊ m	s m a r a g d ʊ m
h ɪ ɛ r ɔ s ɔ l ɛ m ɛ m ɪ t aː n ʊ m	h ɪ ɛ r ɔ s ɔ l y m iː t aː n ʊ m
a k ɛ r b ɪ t aː t ɛ m	a k ɛ r b ɪ t aː t ɛ m
ɪ n t r ɪ m ɛ m t ɛ r ɛ m ɛ m	ɪ n t r oː m ɪ tː ɛ r ɛ
p a l m ʊ m	p a l m ʊ m
t ɪ n j a m	t ɪ n ɛ a m
a b ɔ l ɪ t j oː n ɛ m	a b ɔ l ɪ t j oː n ɛ m
p ɛ r s w aː d ɛ r ɛ m	p ɛ r s w aː d eː r ɛ
s a t ɪ r a m	s a t ɪ r a m
s a l uː t aː r ɛ	s a l uː t aː r ɛ
ɔ r b ɪ t ɛ m	ɔ r b ɛ m
m ɛ s t ɛ r ɛ	m ɪ s k eː r ɛ
d ɛ l ʊ b r ʊ m	d eː l uː b r ʊ m
s a l w ʊ m	s a l w ʊ m
n ɛ k s ʊ m	n ɛ k s ʊ m
k ʊ m n aː t ʊ m	k ɔ ŋ n aː t ʊ m
d ɛ k ɔ r aː r ɛ	d ɛ k ɔ r aː r ɛ
r uː m oː r ɛ	r uː m oː r ɛ m
f a s ɔ l a m	f a s k ɪ ɔ l a m
s ʊ p l ɛ m ɛ n ɛ m t ʊ m	s ʊ pː l eː m ɛ n t ʊ m
ɪ b ɪ s	iː b ɛ m iː b ɪ n
s uː s k ɪ t aː r ɛ	s ʊ s k ɪ t aː r ɛ
s uː p ɛ r b j ʊ m	s ʊ p ɛ r b ʊ m
k ɔ m p r ɛ ɪ aː n s ɪ w ɛ l ɛ m	k ɔ m p r ɛ h ɛ n s ɪ b ɪ l ɛ m
