l oː d aː t oː r ɛ	l aʊ d aː t oː r ɛ m
f a s k ɪ n j ʊ m	f a s k ɪ n ʊ m
p a s t ɪ m n aː k a m	p a s t ɪ n aː k a m
s ɛ k s t ʊ m	s ɛ k s t ʊ m
k ɔ n s ʊ l t aː t j oː n ɛ m	k oː n s ʊ l t aː t j oː n ɛ m
m a r s ʊ p j ʊ m	m a r s uː p j ʊ m
a s t ʊ l a m	a sː ʊ l a m
s k ʊ m j m ʊ l ʊ m	s k ɪ uː r ʊ m
m ɔ k ʊ l ɛ m	m uː t ʊ l ʊ m
k ɔ n s ɛ kʷ ɪ r ɛ	k oː n s ɛ kʷ iː
a s p ɛ k t ʊ m	a s p ɛ k t ʊ m
g a lː ʊ m m	g a l b ɪ n ʊ m
d ɪ w ɪ n aː r ɛ	d iː w iː n aː r ɛ
p a r aː r ɛ	p a r aː r ɛ
s k oː l ʊ m	s k ɔ p ʊ l ʊ m
r a k ɪ m oː s ʊ m	r a k eː m oː s ʊ m
n ʊ t r ɪ t a m	n uː t r iː k j ʊ m
d ɛ s ɪ d j a m	d eː s ɪ d j a m
p r ɛ s k j ɛ n t j a m	p r aɪ s k ɪ ɛ n t j a m
s ʊ s t ɛ n t aː k ʊ l ʊ m	s ʊ s t ɛ n t aː k ʊ l ʊ m
g ɛ m ɪ n aː t j oː n ɛ m	g ɛ m ɪ n aː t j oː n ɛ m
p ɛ lː aː r j ʊ m	p ɛ lː aː r j ʊ m
a n ɪ m ʊ m	a n ɪ m ʊ m
k l aʊ d ɪ k aː r ɛ	k l aʊ d ɪ k aː r ɛ
ɪ n aː l aː r ɛ	ɪ n h aː l aː r ɛ
t r a n s m ɪ g r aː r ɛ m	t r aː n s m ɪ g r aː r ɛ
t r ʊ k ɛ	t r ʊ k ɛ m
k a m p ɛ s t r ɛ m	k a m p ɛ s t r ɛ m
ɔ r b ʊ m	ɔ r b ʊ m
l ɪ m ʊ m	l iː m ʊ m
p a l p ɪ t aː t j oː n ɛ m	p a l p ɪ t aː t j oː n ɛ m
t ɛ s t ɪ m oː n j ʊ m	t ɛ s t ɪ m oː n j ʊ m
m ɛ r ɪ t ʊ m	m ɛ r ɪ t ʊ m
f ɪ l ɔ s ɔ f j a m	pʰ ɪ l ɔ s ɔ pʰ j a m
s k ʊ rː a m	s k ʊ rː a m
b l aː ŋ t ɛ m m aː	b l a s pʰ eː m aː r ɛ
k a p r ɪ n ʊ m	k a p r iː n ʊ m
m ɪ k a m	m iː k a m
k r ɪ m ɪ n aː l ɛ	k r iː m ɪ n aː l ɛ m
t a k s aː t j ʊ m n ɛ m	t a k s aː t j oː n ɛ m
k ɪ d a m	k iː d a m
ɛ k l ɛ s a m	ɛ kː l eː s j a m
k ɔ n mː uː t aː r ɛ	k ɔ mː uː t aː r ɛ
l ɛ ŋ n aː r ʊ m	l ɪ ŋ n aː r j ʊ m
r ɛ g j ʊ m	r eː g j ʊ m
l a m b ɪ r ɛ	l a m b ɛ r ɛ
f ɔ r n ɪ k s ɛ m	f ɔ r n ɪ k ɛ m
p a s t oː r ɛ	p aː s t oː r ɛ m
l uː k aː n ɪ k a m	l uː k aː n ɪ k a m
g a rː ʊ l ʊ m	g a rː ʊ l ʊ m
ɛ kʷ ɪ l ɪ b r j ʊ m	aɪ kʷ ɪ l iː b r j ʊ m
m ɔ lː ɪ k ɛ m	m ɔ lː ɪ t ɪ ɛ m
ɛ r ɪ m ʊ m	ɛ r eː m ʊ m
k ɔ n t r ɪ b ʊ ɛ r ɛ m	k ɔ n t r ɪ b ʊ ɛ r ɛ
m ɔ r d ɛ r ɛ	m ɔ r d eː r ɛ
ɔ s aː r j ʊ m	ɔ sː w aː r j ʊ m
k ɛ d r ʊ m	k ɛ d r ʊ m
a r m aː t ʊ m	a r m aː t ʊ m
m ɛ t aː lː	m ɛ t a lː ʊ m
r ɪ t ʊ m	r iː t ʊ m
t ɔ l ɛ r ɛ	t ɔ lː ɛ r ɛ
m ɔ t ʊ m	m ʊ tː ʊ m
p r ɔ p ɪ n kʷ ʊ m	p r ɔ p ɪ ŋ kʷ ʊ m
m a n k ɛ b ʊ m	m a ŋ k ɪ p ɛ m
s a l aː r j ʊ m	s a l aː r j ʊ m
p r ɔ w a m	p r oː r a m
d uː r aː r ɛ	d uː r aː r ɛ
s k ʊ d ɛ lː a m	s k ʊ t ɛ lː a m
t ɔ p s ɪ k aː r ɛ	t ɔ k s ɪ k aː r ɛ
ɔ s p ɪ t j ʊ m	h ɔ s p ɪ t j ʊ m
r ɛ w ɔ k aː r ɛ	r ɛ w ɔ k aː r ɛ
d ɪ r ɪ m ɛ r ɛ	d ɪ r ɪ m ɛ r ɛ
k r uː l d ɛ m t ɛ m	k r uː d eː l ɪ t aː t ɛ m
ɪ n f l ɛ k sː j oː n ɛ m	iː n f l ɛ k t j oː n ɛ m
ɛ k s p ʊ ŋ n aː r ɛ	ɛ k s p ʊ ŋ n aː r ɛ
p uː ŋ n aː k ɛ	p ʊ ŋ n aː k ɛ m
d ɛ t ɛ k t aː r m m	d eː t ɛ g ɛ r ɛ
aʊ d ɪ t oː r ɛ	aʊ d iː t oː r ɛ m
k ɔ m p l ɛ m ɛ n t ʊ m	k ɔ m p l eː m ɛ n t ʊ m
ɛ k s uː l t aː	ɛ k s ʊ l t aː r ɛ
m a r a m	m a rː a m
d a nː a m t ʊ m	d a m n aː t ʊ m
w ɛ k s aː r ɛ	w eː k s aː r ɛ
d ɪ s k r ɛ p aː r ɛ	d ɪ s k r ɛ p aː r ɛ
p a r t ɪ t j oː n ɛ m	p a r t iː t j oː n ɛ m
l ɛ p r a m	l ɛ p r a m
ɪ n s ɪ ŋ n j a m	iː n s ɪ ŋ n ɛ
kʷ ɛ s t j oː n aː r j ʊ m	kʷ aɪ s t j oː n aː r j ʊ m
p a r d ʊ m	p a r d ʊ m
s k r ʊ t aː r	s k r uː t aː r iː
p r ɪ m ɔ g ɛ n ɪ t ʊ m	p r iː m oː g ɛ n ɪ t ʊ m
ɪ n k ɪ t aː t j oː n ɛ m	ɪ ŋ k ɪ t aː t j oː n ɛ m
w ɛ s p ɛ m r ʊ m	w ɛ s p ɛ r ʊ m
w ɛ n d ɛ m j a m	w iː n d eː m j a m
k ɔ j a m t ʊ m	k ɔ mː ɛ aː t ʊ m
ɪ m p ɛ lː ɛ r ɛ	ɪ m p ɛ lː ɛ r ɛ
b ɔ t ʊ l ɪ n ʊ m	b ɔ t ʊ l ʊ m
l uː n uː l a m	l uː n ʊ l a m
fː aː s k ɪ n aː r ɛ	f a s k ɪ n aː r ɛ
ɔ b l ɪ g aː t j oː n ɛ	ɔ b l ɪ g aː t j oː n ɛ m
a r m ʊ m s	a r m ʊ m
p a w ʊ r	p a w oː r ɛ m
f ɪ l j aː l ɛ	f iː l j aː l ɛ m
j a s p ɪ d ɛ m	j a s p ɪ d ɛ m
p uː d ɪ k ʊ m	p ʊ d iː k ʊ m
t ɛ t r ʊ m	t aɪ t r ʊ m
k ɛ r t aː r ɛ	k ɛ r t aː r ɛ
d ɪ s k r ɛ t j oː n ɛ	d ɪ s k r eː t j oː n ɛ m
f ɛ r ɛ t r ʊ m	f ɛ r ɛ t r ʊ m
kʷ a d r aː r ɛ	kʷ aː d r aː r ɛ
ɛ k s k ɛ s ɪ w ʊ m	ɛ k s k ɛ sː ɪ w ʊ m
ɔ rː ɪ ʊ m	h ɔ rː ɛu m
p ɛ r t ɛ n t ɛ r ɛ m	p ɛ r t ɪ n eː r ɛ
a k ɛ oː	aː k ɛu m
f eː mː ɪ n a m	f eː m ɪ n a m
t aː t ɛ m	t a t ɛ m
f ɛ s t ʊ m	f eː s t ʊ m
w a r j ʊ m	w a r j ʊ m
g r aː k ɪ l ɛ	g r a k ɪ l ɛ m
k ɔ n f l uː ɪ r ɛ	k oː n f l ʊ ɛ r ɛ
r uː g ɪ r ɛ	r uː g iː r ɛ
k l aː m oː r ɛ	k l aː m oː r ɛ m
r ɪ s t aʊ r aː r ɛ	r ɛ s t aʊ r aː r ɛ
m ɪ k s t j oː n	m ɪ k s t j oː n ɛ m
p ɛ r k a m	p ɛ r k a m
k ɔ n t ɛ m p l aː r ɛ	k ɔ n t ɛ m p l aː r iː
d ɛ s t ɪ n aː r ɛ	d eː s t ɪ n aː r ɛ
k ɔ l oː n j a	k ɔ l oː n j a m
k r ɪ t ɪ k ʊ m	k r ɪ t ɪ k ʊ m
k ɔ m p r aː t oː r ɛ	k ɔ m p a r aː t oː r ɛ m
d ɛ p ɛ n d ɛ r ɛ	d eː p ɛ n d eː r ɛ
ɛ l ɛ g aː n t ɛ m	eː l ɛ g a n t ɛ m
ɔ s k ʊ l aː t j oː n ɛ m	ɔ s k ʊ l aː t j oː n ɛ m
a t w ɛ r t ɪ r ɛ	a d w ɛ r t ɛ r ɛ
f a r t aː r ɛ	f a r k iː r ɛ
aʊ r ɔ r a m	aʊ r oː r a m
p r ɛ g ʊ s t a m r ɛ	p r aɪ g ʊ s t aː r ɛ
p r ɛ g oː n ɛ m	p r aɪ k oː n ɛ m
ɪ m w ɛ s t ɪ g aː r ɛ	ɪ n w ɛ s t iː g aː r ɛ
ɪ n t ɛ r m ɛ t ɛ r s ɛ m	ɪ n t ɛ r m ɪ tː ɛ r ɛ
k ɔ n k l aː m a m r ɛ	k ɔ ŋ k l aː m aː r ɛ
m a t aː r ɛ	m a k t aː r ɛ
t r ɪ f ɔ l ʊ m	t r ɪ f ɔ l j ʊ m
f uː n ɛ b r ɛ m	f uː n ɛ b r ɛ m
f uː l g ɪ r ɛ	f ʊ l g eː r ɛ
p r ɛ w ɛ n ɪ r ɛ	p r aɪ w ɛ n iː r ɛ
m ɛ s ɛ m	m eː n s ɛ m
g r aː t ɪ f j aː r ɛ	g r aː t ɪ f ɪ k aː r iː
aʊ r ɪ g a m	aʊ r iː g a m
n ŋ d ɛ	n oː d aː r ɛ
s ʊ sː ʊ rː ʊ m	s ʊ s ʊ rː ʊ m
uː s uː r aː r j ʊ m	uː s uː r aː r j ʊ m
b ɔ t ɛ lː ʊ m	b ɔ t ɛ lː ʊ m
p ɛ n aː t ɛ s	p ɛ n aː t ɛ m
ɪ n f ɛ s t aː r ɛ	iː n f ɛ s t aː r ɛ
a d ɔ r aː r ɛ	a d oː r aː r ɛ
l aː p m a m	a l a p a m
r ɛ t ɪ k ɛ r ɛ	r ɛ t ɪ k eː r ɛ
s k ɔ aː k ɛ r ɛ	ɛ k s k ɔ kʷ ɛ r ɛ
l ɔ k ʊ t oː r	l ɔ k uː t oː r ɛ m
p ɛ r m ɪ t ɛ r ɛ	p ɛ r m ɪ tː ɛ r ɛ
uː s ɪ t aː r ɛ	uː s ɪ t aː r iː
ɪ n w ɛ n t r ɪ k ɛ	ɪ n w ɛ n t r iː k ɛ m
a b j ɛ k t aː r ɛ	a b ɪ k ɛ r ɛ
ɪ n t r ɪ m ɛ t ɛ r ɛ m ɛ m	ɪ n t r oː m ɪ tː ɛ r ɛ
r a b ʊ l a m	r a b ʊ l a m
m uː n ɪ k ɪ p j ʊ m	m uː n ɪ k ɪ p j ʊ m
r ɛ w ɛ r t ɛ r ɛ	r ɛ w ɛ r t iː
kʷ ɪ n kʷ ɛ n aː l ɛ	kʷ iː ŋ kʷ ɛ nː aː l ɛ m
m a nː j aː r	m a n w aː r j ʊ m
ɔ b s t ɛ t r ɪ k a m	ɔ b s t ɛ t r iː k ɛ m
t ɪ n t ɛ r ɛ	t ɪ ŋ g ɛ r ɛ
ɪ n t ɛ lː ɛ k j oː n ɛ m	ɪ n t ɛ lː ɛ k t j oː n ɛ m
w ɛ s t ɪ t ʊ m	w ɛ s t iː t ʊ m
m a t ɛ r n ɪ t aː t ɛ m	m aː t ɛ r n ɪ t aː t ɛ m
ɛ k s ɪ s t ɛ r ɛ	ɛ k s ɪ s t ɛ r ɛ
k aʊ d aː l ɛ	k aʊ d aː l ɛ m
ɛ d ɪ f ɪ k aː t j oː n ɛ m	aɪ d ɪ f ɪ k aː t j oː n ɛ m
m ɔ t ɪ w ʊ m	m oː t ɪ w ʊ m
s p uː r j ʊ m	s p ʊ r j ʊ m
d ɪ sː ɛ kː aː r ɛ	d eː s ɪ kː aː r ɛ
k ɔ n s ɛ r w aː t j oː n ɛ m	k oː n s ɛ r w aː t j oː n ɛ m
k ʊ l p aː r ɛ	k ʊ l p aː r ɛ
n ʊ m ɛ r aː r ɛ	n ʊ m ɛ r aː r ɛ
fː ɛ t ʊ m	f ɪ l ɪ k t ʊ m
r ɛ s ɛ r w aː t j oː n ɛ m	r ɛ s ɛ r w aː t j oː n ɛ m
s ʊ w ɛ n ɪ r ɛ	s ʊ b w ɛ n iː r ɛ
m a r k ɪ d ʊ m	m a r k ɪ d ʊ m
aʊ s t r ʊ m	aʊ s t r ʊ m
ɪ n s uː l aː r ɛ	iː n s ʊ l aː r ɛ m
k a p ɪ t d ʊ m	k a p ɪ t ʊ l ʊ m
d ɛ t ɛ r g ɛ r ɛ	d eː t ɛ r g eː r ɛ
d ɛ f ɛ n s oː r ɛ	d eː f eː n s oː r ɛ m
m ɪ l oː r ɛ	m ɛ l j oː r ɛ m
w ʊ l g ʊ m	w ʊ l g ʊ s
w ɪ k ʊ m	w iː k ʊ m
k ɔ n ʊ n g ɛ r ɛ	k ɔ n j ʊ ŋ g ɛ r ɛ
a k k ɛ p t aː r ɛ	a kː ɪ p ɛ r ɛ
p ɔ l ʊ m	p ɔ l ʊ m
ɛ k s k ɔ g ɪ t a m r ɛ	ɛ k s k oː g ɪ t aː r ɛ
ɪ p ɔ t ɛ k a m	h y p ɔ tʰ eː k a m
s uː b ɛ lː a	s uː b ʊ l a m
p a s t a m	p a s t a m
ɛ k s aʊ r ɪ r ɛ	ɛ k s h aʊ r iː r ɛ
n ɔ nː ʊ m	n ɔ nː ʊ m
k ɔ m uː n aː l	k ɔ mː uː n aː l ɛ m
p ɔ r k a m	p ɔ r k a m
ɪ m p j ʊ m	ɪ m p j ʊ m
a t r ʊ m	aː t r ʊ m
r a d ɪ k j ʊ m	r aː d iː k ʊ l a m
s k aː b j ɛ m	s k a b ɪ ɛ m
f ʊ l g oː r ɛ	f ʊ l g ʊ r
r ɛ k ɪ t aː t j oː n ɛ m	r ɛ k ɪ t aː t j oː n ɛ m
r a p ɪ r ɛ	r a p ɛ r ɛ
t ɛ k s t ʊ r a m	t ɛ k s t uː r a m
f ɔ r m aː r ɛ	f ɔ r aː r ɛ
a k j oː n ɪ ɛ t ɛ r ɛ	a kː w ɪ eː s k ɛ r ɛ
d ɛ k s t r ʊ m	d ɛ k s t r ʊ m
b ʊ lː a m	b ʊ lː a m
ɔ n ɔ m aː t oː p ɛ j a m	ɔ n ɔ m a t ɔ p ɔ ɪ j a m
d a n aː r ɛ	d a m n aː r ɛ
s uː b uː r b a m n ʊ m	s ʊ b ʊ r b aː n ʊ m
f ɛ m ʊ r ɛ	f ɛ m ʊ r
s p ɛ t j ɛ m	s p ɛ k ɪ ɛ m
t r a s s k ɛ n d ɛ r ɛ	t r aː n s k ɛ n d ɛ r ɛ
p r ɔ p r ɪ j ɛ t aː t ɛ m	p r oː p r ɪ ɛ t aː t ɛ m
s p ɛ l t a m	s p ɛ l t a m
ɔ b ɪ ɛ k t ɪ w ʊ m	ɔ b j ɛ k t iː w ʊ m
m ɛ s t ʊ m	m aɪ s t ʊ m
r ɛ n ɔ k j ʊ	r aː n ʊ ŋ k ʊ l ʊ m
p r ɛ ɔ kː uː p aː r ɛ	p r aɪ ɔ kː ʊ p aː r ɛ
ɔ w eː l a m	ɔ w ɪ k ʊ l a m
l ɛ t ʊ m	l eː k t ʊ m
a b s t ɛ n ɛ r ɛ	a b s t ɪ n eː r ɛ
g ɔ r d ʊ m	g ʊ r d ʊ m
n ɛ s p ʊ r ʊ m	m ɛ s p ɪ l ʊ m
w ɛ g ɛ t ʊ m	w ɛ g ɛ t ʊ m
ʊ r k ɛ m	ʊ l iː k ɛ m
ɪ s t r j oː n ɛ m	h ɪ s t r j oː n ɛ m
a n t ɛ p oː n ɛ	a n t ɛ p oː n ɛ r ɛ
a w ɛ l ʊ m	a w ʊ l ʊ m
l a sː ʊ m	l a sː ʊ m
ɪ n w ɪ d j oː s ʊ m	ɪ n w ɪ d j oː s ʊ m
k ɔ r w ɪ n ʊ m	k ɔ r w iː n ʊ m
m ɛ l oː n ɛ m	m eː l oː n ɛ m
a m p ɔ lː a m	a m p ʊ lː a m
ɔ p r ɪ m ɛ r	ɔ pː r ɪ m ɛ r ɛ
s t r j a m	s t r j a m
p r ɛ d aː r ɛ	p r aɪ d aː r iː
g ʊ n t uː r a m	j uː ŋ k t uː r a m
p r ɛ ɔ kː uː p aː t j oː n ɛ m	p r aɪ ɔ kː ʊ p aː t j oː n ɛ m
m a l w a m	m a l w a m
a ŋ g ʊ s t aː r ɛ	a ŋ g ʊ s t aː r ɛ
a r k b ɛ s k ʊ m p ʊ m	a r kʰ ɪ ɛ p ɪ s k ɔ p ʊ m
ɪ r m aː n d aː t ɛ m	g ɛ r m aː n ɪ t aː t ɛ m
t a r d aː r ɛ	t a r d aː r ɛ
ɔ r ɪ ʊ n d ʊ m	ɔ r j ʊ n d ʊ m
t a b ʊ l a m	t a b l a m
w ɔ l uː p t ɛ m	w ɔ l ʊ p t aː t ɛ m
p a g ʊ r ʊ m	p a g uː r ʊ m
k oː n k aː w ʊ m	k ɔ ŋ k a w ʊ m
a k ɪ d j a m	a k eː d j a m
p ɛ r s w aː d ɛ r ɛ m	p ɛ r s w aː d eː r ɛ
rː uː t a m	r uː t a m
d ɛ l ɪ b ɛ r aː r ɛ	d eː l iː b ɛ r aː r ɛ
d ɛ t ɛ r m ɪ n aː t j oː n ɛ m	d eː t ɛ r m ɪ n aː t j oː n ɛ m
f r ɛ m ɪ r ɛ	f r ɛ m ɛ r ɛ
m a n j ʊ m	m a ŋ n ʊ m
w ɛ r ɛ k ʊ n d ʊ m	w ɛ r eː k ʊ n d ʊ m
m ɪ l ɪ t aː r ɛ	m iː l ɪ t aː r ɛ
a k s ɛ m	uː ŋ k t j oː n ɛ m
a lː ʊ d ɪ r ɛ	a lː uː d ɛ r ɛ
j ɛ r ɛ r	g ɛ r ɛ r ɛ
g l aː n d ʊ l oː s ʊ m	g l a n d ʊ l oː s ʊ m
a l ɛ aː	aː l ɛ a m
ɔ k uː l aː r ɛ	ɔ k ʊ l aː r ɛ m
m a t ʊ t ɪ n ʊ m	m aː t uː t iː n ʊ m
d ɪ s t ɪ lː aː t j oː n ɛ m	d ɪ s t ɪ lː a t j oː n ɛ m
p a rː ɔ k ʊ m	p a r ɔ kʰ ʊ m
k ɪ n t uː r a m	k ɪ ŋ k t uː r a m
s k ɔ l aː s t ɪ k ʊ m	s kʰ ɔ l a s t ɪ k ʊ m
s a l uː t aː t j oː n ɛ	s a l uː t aː t j oː n ɛ m
f ɛ r m ɛ n t ʊ m	f ɛ r m ɛ n t ʊ m
p r ɔ f ɛ r ɪ r ɛ	p r oː f ɛ rː ɛ
k a r aː m ɛ lː ʊ m	k a l a m ɛ lː ʊ m
k ɔ n mː ɔ t j oː n ɛ	k ɔ mː oː t j oː n ɛ m
ɪ n s ɪ ŋ n ɛ m	iː n s ɪ ŋ n ɛ m
p r ɛ s ɛ n t aː t j oː n ɛ m	p r aɪ s ɛ n t aː t j oː n ɛ m
t r ɛ p ɪ d aː r ɛ	t r ɛ p ɪ d aː r ɛ
p a l ʊ m b ʊ m	p a l ʊ m b ʊ m
d ɪ k aː k ɛ	d ɪ k aː k ɛ m
r ɔ b ɛ r ɛ m	r oː b ʊ r
a l t aː r ɛ	a l t a r ɛ m
l kʷ ɛ r n k ɛ m	kʷ ɛ r k ʊ m
b ɛ t ɛ m m aː b a m	b eː t a m
t ɛ s oː r ʊ m	tʰ eː s aʊ r ʊ m
p ɪ s aː r ɛ	p iː n s ɛ r ɛ
k ɛ r n ɛ r ɛ	k ɛ r n ɛ r ɛ
p ɔ lː aː r ɛ	p ʊ lː aː r ɛ
k a r n oː s ʊ m	k a r n oː s ʊ m
ɪ rː ɛ g ʊ l aː r ɛ	ɪ rː eː g ʊ l aː r ɛ m
s p uː t ʊ m	s p uː t ʊ m
ɪ l aː t ɪ w ʊ m	ɪ lː aː t iː w ʊ m
w ɪ lː aː n ʊ m	w iː lː aː n ʊ m
d eː ŋ ɪ f ɪ k aː r ɛ	d ɛ ɪ f ɪ k aː r ɛ
p ɔ r t j oː n	p ɔ r t j oː n ɛ m
k ɪ k aː l a m	k ɪ k aː d a m
l ɛ ɛ m	l eː g ɛ m
k a t ɛ l a m	k a t ɛ lː a m
f r ɪ g ʊ m m	f r iː g ɪ d ʊ m
g r a n aː r ʊ m	g r aː n aː r j ʊ m
d ʊ b ɪ t aː r ɛ	d ʊ b ɪ t aː r ɛ
p a l m aː r ɛ m	p a l m aː r ɛ m
p r ɛ g ʊ d ɪ t j ʊ m	p r aɪ j uː d ɪ k j ʊ m
r ʊ k j ʊ m	r oː s k ɪ d ʊ m
r ɛ d ɪ k g ɛ r ɛ	r ɛ d ɪ g ɛ r ɛ
k ɔ n d ɪ t j oː n ɛ	k ɔ n d ɪ k j oː n ɛ m
t r aː b ɛ k ʊ l a m	t r a b eː k ʊ l a m
k r ɛ p m aː t uː r a m	k r ɛ p aː t uː r a m
f a t ʊ m	f aː t ʊ m
s kʷ aː l ʊ m	s kʷ aː l ʊ m
k ɔ ɛ r t ɪ t j oː n ɛ m	k ɔ ɪ r k ɪ t j oː n ɛ m
ɪ n t ɪ m aː t j oː n ɛ m	ɪ n t ɪ m aː t j oː n ɛ m
d ɛ t ɛ n t j oː n ɛ m	d eː t ɛ n t j oː n ɛ m
r oː d r ɛ ɪ k n	r ɪ d ɪ k a m
a n ɔ r m aː l ɛ m	a n oː r m a l ʊ m
a s p ɛ r s j oː n ɛ m	a s p ɛ r s j oː n ɛ m
ɛ k s t ɛ r m ɪ n aː t j oː n ɛ m	ɛ k s t ɛ r m ɪ n aː t j oː n ɛ m
ɪ n kʷ ɪ n aː r ɛ	ɪ ŋ kʷ ɪ n aː r ɛ
m a k ʊ s ʊ m	m a k ʊ l oː s ʊ m
t a k ɛ r ɛ	t a k eː r ɛ
k a t ɛ lː ʊ m	k a t ɛ lː ʊ m
s k ʊ r s ʊ m	ɛ k s k ʊ r s ʊ m
a b sː uː r t ɪ t aː t ɛ m	a b s ʊ r d ɪ t aː t ɛ m
f a k ʊ n ɛ m m j a m	f aː k ʊ n d j a m
w ɪ s ʊ m m	w iː s ʊ m
g ɛ ɔ g r aː f ɪ k ʊ m	g ɛ oː g r a pʰ ɪ k ʊ m
k ɪ t aː r a m	k ɪ tʰ a r a m
ɔ b s t aː r ɛ	ɔ b s t aː r ɛ
k ɔ n d ɔ n aː r ɛ	k ɔ n d oː n aː r ɛ
t ʊ g ʊ r j ʊ m	t ʊ g ʊ r j ʊ m
ɔ k t aː w ʊ m	ɔ k t aː w ʊ m
p r ɔ w ɔ k aː t oː r ɛ	p r oː w ɔ k aː t oː r ɛ m
d ɛ s ɔ l aː r ɛ	d eː s oː l aː r ɛ
w ɪ b r aː t j oː n ɛ m	w ɪ b r aː t j oː n ɛ m
s ɔ lː ɛ k ɪ t ʊ m	s ɔ lː ɪ k ɪ t ʊ m
p a n ɪ k ʊ m	p aː n ɪ k j ʊ m
k a w aː r ɛ	k a w aː r ɛ
uː n ɪ k ʊ m	uː n ɪ k ʊ m
b oː t ʊ m	w oː t ʊ m
m uː s k ʊ l aː r ɛ	m uː s k ʊ l aː r ɛ m
t r ɪ b ʊ l aː r ɛ	t r ɪ b ʊ l aː r ɛ
s ʊ s p ɛ n s j oː n ɛ m	s ʊ s p eː n s j oː n ɛ m
ɪ lː ɛ g aː l ɛ	ɪ lː eː g aː l ɛ m
g ɛ n t ɪ l ɛ m	g ɛ n t iː l ɛ m
m a mː ɛ lː a m	m a m ɪ lː a m
m ɪ n oː r ɛ	m ɪ n oː r ɛ m
a l t ɛ r k aː t j oː n ɛ m	a l t ɛ r k aː t j oː n ɛ m
j oː n ɪ ɛ m r ɔ s oː l ɪ m ɪ t m m ʊ m	h ɪ ɛ r ɔ s ɔ l y m iː t aː n ʊ m
d ɛ k ɪ m aː r ɛ	d ɛ k ɪ m aː r ɛ
a n aː r k j a m	a n a r kʰ j a m
b ɛ aː t ʊ m	b ɛ aː t ʊ m
k ɔ n s ɛ ŋ t ɪ r ɛ	k oː n s ɛ n t iː r ɛ
r a d j aː r ɛ	r a d j aː r ɛ
d ɛ w ɔ l w ɛ r ɛ	d eː w ɔ l w ɛ r ɛ
k ɔ lː ɛ k t a m	k ɔ lː eː k t a m
k ɪ p ʊ lː a m	k eː p ʊ lː a m
r a k ɛ m ʊ m	r a k eː m ʊ m
d ɪ f l ʊ ɛ r	d ɪ fː l ʊ ɛ r ɛ
a s k ɛ n d ɛ r ɛ	a s k ɛ n d ɛ r ɛ
a d uː d ɪ k aː r ɛ	a d ɪ uː d ɪ k aː r ɛ
h k ɛ	kʷ ɛ m
f l ɛ k sː ɪ b ɪ l ɪ t a m t ɛ m	f l ɛ k s ɪ b ɪ l ɪ t aː t ɛ m
m uː l ʊ m	m uː l ʊ m
p ɛ l aː g ʊ m	p ɛ l a g ʊ s
k ɔ n s ɪ ŋ n aː r ɛ	k oː n s ɪ ŋ n aː r ɛ
k oː s ʊ m	k ɔ k s ʊ m
ɪ ŋ n ɔ m ɪ n j a m	ɪ ŋ n oː m ɪ n j a m
s ɪ l ɪ k ɛ m	s ɪ l ɪ k ɛ m
s oː r ɛ m a m	s ɔ r oː r ɛ m
m ɛ n aː k a m	m ɪ n aː k ɛ m
p ɛ r ɪ t ʊ m	p ɛ r iː t ʊ m
p a r ɔ n ɔ m aː s j a m	p a r ɔ n ɔ m a s j a m
l ɪ b ɛ r aː t j oː n ɛ m	l iː b ɛ r aː t j oː n ɛ m
k ɔ n k aː t ɛ n aː r ɛ	k ɔ ŋ k a t eː n aː r ɛ
g r ʊ n j ɪ r ɛ	g r ʊ nː iː r ɛ
f a m a m	f aː m a m
r ɪ s ʊ m	r iː s ʊ m
k ɪ k ɛ m	k ɪ k ɛ r
f r aː t ɛ r n ɪ t aː t ɛ m	f r aː t ɛ r n ɪ t aː t ɛ m
a k r ɪ t aː t ɛ m	aː k r ɪ t aː t ɛ m
s ɪ n k ɛ r ʊ m	s ɪ ŋ k eː r ʊ m
s ʊ n rː ɪ d ɪ r ɛ	s ʊ b r iː d eː r ɛ
k ɪ r k ʊ n pʰ l uː ɪ r ɛ m	k ɪ r k ʊ m f l ʊ ɛ r ɛ
ɪ n t ɛ ɪ r ɛ	ɪ n t ʊ eː r iː
k ɛ n s oː r ɛ	k eː n s oː r ɛ m
m ʊ n ɪ t j oː n	m uː n iː t j oː n ɛ m
k ɔ n d ɪ ŋ n ʊ m	k ɔ n d ɪ ŋ n ʊ m
k ɪ p r ɛ s ʊ m	k ʊ p r ɛ sː ʊ m
p uː l p ɪ t m ʊ m	p ʊ l p ɪ t ʊ m
b j ɛ n ɛ	b ɪ ɛ nː ɛ m
p ɔ t r ɛ m	p ʊ t r ɛ m
g r aː m ɪ n ʊ m	g r aː m ɪ n ɛu m
b r ɪ t aː n ɪ k ʊ m	b r ɪ t a nː ɪ k ʊ m
p r ɛ s k r ɪ w ɪ r ɛ	p r aɪ s k r iː b ɛ r ɛ
b a l t ɪ k ʊ m	b a l t ɪ k ʊ m
k ɔ lː aʊ d aː r ɛ	k ɔ lː aʊ d aː r ɛ
p eː r k ɔ rː ɛ r ɛ	p ɛ r k ʊ rː ɛ r ɛ
t j aː	tʰ iː a m
t r aː m ɪ t ɛ r ɛ	t r aː m ɪ tː ɛ r ɛ
s a k ʊ d ɛ r	s ʊ kː ʊ t ɛ r ɛ
a s ɛ t aː t ɛ m	a s eː ɪ t aː t ɛ m
f ʊ ŋ g oː s ʊ m	f ʊ ŋ g oː s ʊ m
ɪ n t r ɔ d uː k t j oː n ɛ m	ɪ n t r oː d ʊ k t j oː n ɛ m
a fː j aː n t aː r ɛ	a fː ɪ d ɛ n t j aː r ɛ
