d ɛ s p ɛ r aː t ʊ m	d eː s p eː r aː t ʊ m
d ʊ ɛ k ɛ n t ɔ s	d ʊ k ɛ n t oː s
aː m ɪ k aː l ɛ	a m iː k aː l ɛ m
k ɔ n d ɪ s k ɛ n d ɛ r ɛ	k ɔ n d eː s k ɛ n d ɛ r ɛ
m aː r a m	m a rː a m
j uː g ʊ l aː r ɛ	j ʊ g ʊ l aː r ɛ
kʷ a t r aː t ʊ m	kʷ a d r aː t ʊ m
ɪ n f l a t j oː n ɛ m	iː n f l aː t j oː n ɛ m
w ɔ l uː b ɪ l ɛ	w ɔ l uː b ɪ l ɛ m
aː d ʊ m b r aː r ɛ	a d ʊ m b r aː r ɛ
w ɪ n j ɛ t ʊ m	w iː n eː t ʊ m
a t w ɛ r t ɪ r ɛ	a d w ɛ r t ɛ r ɛ
m ɪ l j ɛ r j ʊ m	m iː lː j aː r j ʊ m
l ɔ kʷ aː k ɛ	l ɔ kʷ aː k ɛ m
a r gʷ ɛ r ɛ	a r gʷ ɛ r ɛ
s k a n d ɪ r ɛ	s k a n d ɛ r ɛ
aʊ r ɪ g a m	aʊ r iː g a m
ɪ n g ʊ k t j ʊ m n ɛ m	ɪ n j ʊ ŋ k t j oː n ɛ m
d ɛ p aː r t ɪ r	d eː p a r t iː r ɛ
d ɛ m oː r aː r ɛ	d eː m ɔ r aː r iː
d ɛ n ɛ g aː r ɛ	d eː n ɛ g aː r ɛ
f ɛ s t ɪ w ʊ m	f ɛ s t iː w ʊ m
k ɔ l ɔ m b ʊ m	k ɔ l ʊ m b ʊ m
aː m ɛ n t ɛ	aː m ɛ n t ɛ m
g l ɔ t oː n ɛ	g l ʊ tː oː n ɛ m
ɛ t ɛ r ɛ	aɪ tʰ ɛ r ɛ m
l aː k t aː r j ʊ m	l a k t aː r j ʊ m
a t ɪ ŋ g ɛ r ɛ	a tː ɪ ŋ g ɛ r ɛ
k ɔ n s ɔ r t ɛ m	k oː n s ɔ r t ɛ m
ɛ k s p a n d ɛ r ɛ	ɛ k s p a n d ɛ r ɛ
g ɛ r ɛ r ɛ	g ɛ r ɛ r ɛ
ɪ n k ɔ m p ɛ t ɛ n t ɛ m	ɪ ŋ k ɔ m p ɛ t ɛ n t ɛ m
t r uː k uː l ɛ n t ʊ m	t r ʊ k ʊ l ɛ n t ʊ m
s ʊ n rː ɪ d ɪ r ɛ	s ʊ b r iː d eː r ɛ
aː pː aː r aː t ʊ m	a pː a r aː t ʊ m
p ɔ pː a m	p ʊ pː ɛ m
b a r b a r ɪ s m ʊ m	b a r b a r ɪ s m ʊ m
w ɪ t ʊ m	w ɔ k ɪ t ʊ m
s aː n aː b ɪ l ɛ	s aː n aː b ɪ l ɛ m
s ɔ lː ɪ k ɪ t aː r ɛ	s ɔ lː ɪ k ɪ t aː r ɛ
k j ʊ n kʷ ɛ k	kʷ ɛ m k ʊ m kʷ ɛ
s ʊ g ɛ lː ʊ m	s ɪ g ɪ lː ʊ m
s ɪ n s ɪ p t	s ɪ ŋ k ɪ p ʊ t
b a l t ɛ ʊ m	b a l t ɛu m
ɛ fː ʊ n d ɪ r ɛ	ɛ fː ʊ n d ɛ r ɛ
a b ɪ t a t j oː n ɛ m	h a b ɪ t aː t j oː n ɛ m
f aː ɪ n a m	f aː g ɪ n ʊ m
p r eː m ɛ r ɛ	p r ɛ m ɛ r ɛ
ʊ ŋ gʷ ɛ n t ʊ m	ʊ ŋ gʷ ɛ n t ʊ m
l ʊ t ʊ m	l ʊ t ʊ m
a t ʊ l t ɛ r ʊ m	a d ʊ l t ɛ r ʊ m
p l aː n t ʊ m	p l a ŋ k t ʊ m
a nː oː s ʊ m	a nː oː s ʊ m
n ɔ m ɪ n a t j oː n ɛ	n oː m ɪ n aː t j oː n ɛ m
ɛ k s a k ɛ r b a t j oː n ɛ m	ɛ k s a k ɛ r b aː t j oː n ɛ m
k oː s ʊ m	k ɔ k s ʊ m
ɪ m p ɛ r ɪ t j a m	ɪ m p ɛ r iː t j a m
p ɛ k uː n j a m m	p ɛ k uː n j a m
k ɛ r n ɛ r ɛ	k ɛ r n ɛ r ɛ
ɪ n s ʊ l s ʊ m	iː n s ʊ l s ʊ m
s p ɛ k t aː k ʊ l ʊ m	s p ɛ k t aː k ʊ l ʊ m
k a s t ɪ g aː r ɛ	k a s t iː g aː r ɛ
p r ɛ k aː r ɛ	p r ɛ k aː r iː
n ʊ d oː s ʊ m	n oː d oː s ʊ m
w a r ɛ r ɛ	w ɛ rː ɛ r ɛ
m ɛ r ɪ t ɛ r ɛ	m ɛ r eː r ɛ
f a s t ɪ d j ʊ m	f a s t iː d j ʊ m
d ɔ t aː t j oː n ɛ m	d oː t aː t j oː n ɛ m
a k t ɛ s ʊ m	a kː ɛ sː ʊ m
f aː s ɛ m	f a s k ɛ m
w ɛ n d ɛ m j a m	w iː n d eː m j a m
k ɔ n s ɪ s t ɛ r ɛ	k oː n s ɪ s t ɛ r ɛ
g l ʊ t ɪ n ɛ	g l uː t ɛ n
n ʊ m ɛ r oː s ʊ m	n ʊ m ɛ r oː s ʊ m
a l a b a s t r ʊ m	a l a b a s t r ʊ m
ɔ s aː r j ʊ m	ɔ sː w aː r j ʊ m
ɔ b s ɛ r w aː r ɛ	ɔ b s ɛ r w aː r ɛ
kʷ ɛ s t j ɔ n aː r j ʊ m	kʷ aɪ s t j oː n aː r j ʊ m
a m ɪ k t ʊ m	a m ɪ k t ʊ m
ɪ n d ɪ ŋ n aː r ɛ	ɪ n d ɪ ŋ n aː r iː
g r a n d ɪ k ʊ m	g r a n d ɪ n ɛ m
r ɪ n ɛ	r eː n ɛ m
k ɔ rː ɛ k t oː r ɛ	k ɔ rː ɛ k t oː r ɛ m
f r a t ɛ r n ɪ t aː t ɛ m	f r aː t ɛ r n ɪ t aː t ɛ m
t ɛ s t ɪ m oː n j ʊ m	t ɛ s t ɪ m oː n j ʊ m
k ɪ r k ʊ n d aː r ɛ	k ɪ r k ʊ m d a r ɛ
k l ʊ a m r ɛ	g l oː k iː r ɛ
ɔ n ɛ s t ɛ m	h ɔ n ɛ s t aː t ɛ m
r a s ɛ k aː r ɛ	r ɛ s ɛ k aː r ɛ
ɛ k s ɛ k r aː t j ʊ m n ɛ m	ɛ k sː eː k r aː t j oː n ɛ m
ɪ m f ɛ k t aː r ɛ	iː n f ɪ k ɛ r ɛ
k a l w ʊ m	k a l w ʊ m
a n ɪ k ɪ l a t j oː n ɛ m	a nː ɪ h ɪ l aː t j oː n ɛ m
s ɛ p a r aː r ɛ	s eː p a r aː r ɛ
ɪ rː ɛ g ʊ l aː r ɛ	ɪ rː eː g ʊ l aː r ɛ m
k aː mː ɪ n ʊ m	k a mː iː n ʊ m
ɛ m fː uː m eː k aː r ɛ	f uː m ɪ g aː r ɛ
p aː d eː lː a m	p a t ɛ lː a m
d ɛ t ɛ p t ɪ oː aː r	d eː k ɪ p ɛ r ɛ
a rː ɔ g aː r ɛ	a rː ɔ g aː r ɛ
k ʊ lː ɛ k ʊ j ʊ m	k aʊ l ɪ k ʊ l ʊ m
p l a t ɛ j a m	p l a t eːa m
s m ʊ w eː r ɛ	eː m ɔ w eː r ɛ
p ɪ s aː r ɛ	p iː n s ɛ r ɛ
ɪ n t ɛ r d ɪ r ɛ	ɪ n t ɛ r d iː k ɛ r ɛ
b a s ɪ l ɪ s k ʊ m	b a s ɪ l ɪ s k ʊ m
ɪ n ɔ s k ɛ r ɛ	ɪ ŋ n oː s k ɛ r ɛ
f ʊ n d ɪ b ʊ l ʊ m	f ʊ n d ɪ b ʊ l ʊ m
m ɪ t ɪ g aː r ɛ	m iː t ɪ g aː r ɛ
p ɔ lː aː r j ʊ m	p ʊ lː aː r j ʊ m
s ʊ mː ɪ n ɪ s t r aː r ɛ	s ʊ b m ɪ n ɪ s t r aː r ɛ
ɔ m ɪ k ɪ d j ʊ m	h ɔ m ɪ k iː d j ʊ m
ɪ n k a p aː k	ɪ ŋ k a p aː k ɛ m
aː m b ʊ s	a m b oː s
ɪ ŋ g ɛ r ɪ r ɛ	ɪ ŋ g ɛ r ɛ r ɛ
m s p ɪ r aː r ɛ	s p iː r aː r ɛ
f ʊ n ɛ r ɛ ʊ m	f uː n ɛ r ɛu m
m a n aː r ɛ	m aː n aː r ɛ
g r a t j oː s ʊ m	g r aː t j oː s ʊ m
m ɔ r d aː k ɛ	m ɔ r d aː k ɛ m
aː ŋ g ɔ s a m	a ŋ g ʊ s t j a m
k ɔ l ʊ m b ɪ n ʊ m	k ɔ l ʊ m b iː n ʊ m
d ɪ s t ɛ n d ɛ r ɛ	d ɪ s t ɛ n d ɛ r ɛ
ɔ r j ɪ ɛ n t aː l ɛ	ɔ r ɪ ɛ n t aː l ɛ m
k ɔ t ʊ m	k aʊ t ʊ m
k ɔ lː ɛ m	k ɔ lː ɛ m
p ɔ s t uː l aː r ɛ	p ɔ s t ʊ l aː r ɛ
a d ɔ r m ɪ r ɛ	a dː ɔ r m iː r ɛ
l a b oː r ɛ m	l a b oː r ɛ m
ɛ s k ɔ t ɛ r ɛ	ɛ k s k ʊ t ɛ r ɛ
d ɛ l ɪ n kʷ ɛ r ɛ	d eː l ɪ ŋ kʷ ɛ r ɛ
ʊ r k ɛ m	ʊ l iː k ɛ m
ɛ n t ɛ m	ɛ n s
r ɛ f r ɪ g ɛ r j ʊ m	r eː f r iː g ɛ r j ʊ m
aː m ɛ t ɪ s t aː	a m ɛ tʰ y s t a m
ɪ n d ɪ s k r ɛ t j oː n ɛ m	ɪ n d ɪ s k r eː t j oː n ɛ m
r ʊ b ɪ ɪ n	r oː b iː g ɪ n ɛ m
t a r d ɪ ʊ	t a r d ʊ m
k ɔ ŋ j uː g a t j oː n ɛ m	k ɔ n j ʊ g aː t j oː n ɛ m
a w eː n a m	a w eː n a m
k ɔ d ɪ k ɛ m	k oː d ɪ k ɛ m
s ɛ r p ɛ n t ɪ n ʊ m	s ɛ r p ɛ n t iː n ʊ m
w ɛ n ɛ t m ʊ m	w ɛ n ɛ t ʊ m
a s ɪ m ɪ l aː r ɛ	a sː ɪ m ʊ l aː r ɛ
ɪ n t ɛ g r aː r ɛ	ɪ n t ɛ g r aː r ɛ
d uː k aː t ʊ m	d ʊ k aː t ʊ m
p r ɔ p ʊ ŋ n aː r ɛ	p r oː p ʊ ŋ n aː r ɛ
s aː l m a m	s a g m a m
r ɛ s t aː r ɛ	r ɛ s t aː r ɛ
m ɪ n uː s a m	m ɪ n uː t j a m
l uː k s uː r j a m	l ʊ k s ʊ r j a m
m a t aː s a m	m a t a k s a m
f l uː w j aː l ɛ	f l ʊ w j aː l ɛ m
b ɪ k a m	b iː g a m
ɪ m p ɪ ŋ g ɛ r ɛ	ɪ m p ɪ ŋ g ɛ r ɛ
ʊ n k ɪ n ʊ m	ʊ ŋ k iː n ʊ m
r ɪ k ɛ p t aː r ɛ	r ɛ k ɛ p t aː r ɛ
s uː t uː r a m	s uː t uː r a m
p ɛ k ɔ r a m	p ɛ k ʊ s
ɛ r ɛ d aː r	h eː r eː d ɪ t aː r ɛ
s ʊ n	s ɔ n ʊ m
a r k ɛ r ʊ m	a r k w aː r j ʊ m
w oː m ɪ t ʊ m	w ɔ m ɪ t ʊ m
aː w ɪ d ɪ t ɛ m	a w ɪ d ɪ t aː t ɛ m
r ɛ k t a ŋ g ʊ l ʊ m	r ɛ k t a ŋ g ʊ l ʊ m
t ɪ p uː l a m	t ɪ pː ʊ l a m
s t r ɪ g a m	s t r iː g a m
p r ɔ k ɛ lː a m	p r ɔ k ɛ lː a m
aː w ʊ m g aː r ɛ	a d w ɔ k aː r ɛ
ɪ lː a t j oː n ɛ m	ɪ lː aː t j oː n ɛ m
d ɛ l ɪ n kʷ ɛ n t j a m	d eː l ɪ ŋ kʷ ɛ n t j a m
k a d aː w ɛ r ɛ	k a d aː w ɛ r
s ɔ lː ɪ k ɪ t uː d ɪ n ɛ m	s ɔ lː ɪ k ɪ t uː d ɪ n ɛ m
ɛ w ɔ k a t j oː n ɛ m	eː w ɔ k aː t j oː n ɛ m
ɪ n k a r n aː r ɛ	ɪ ŋ k a r n aː r ɛ
k ɔ n t r ɪ t j oː n ɛ m	k ɔ n t r iː t j oː n ɛ m
f oː r m aː g ʊ m	f oː r m aː t ɪ k ʊ m
ɪ ŋ n ɛ ʊ m	ɪ ŋ n ɛu m
a n ɛ g aː r ɛ	eː n ɛ k aː r ɛ
a l ɪ j ɛ n aː r ɛ	a l ɪ eː n aː r ɛ
d aː m b uː l a t j oː n ɛ m	d ɛ a m b ʊ l aː t j oː n ɛ m
p a s t ɪ n aː k a	p a s t ɪ n aː k a m
k a p aː k ɛ	k a p aː k ɛ m
f l aː mː a m	f l a mː a m
s ɛ g r ɛ g aː r ɛ	s eː g r ɛ g aː r ɛ
a k ʊ m ɪ n aː r ɛ	a k uː m ɪ n aː r ɛ
aː g a p ɛ m	a g a p eː n
k ʊ l t oː r ɛ	k ʊ l t oː r ɛ m
p oː m ɪ k ɛ	p uː m ɪ k ɛ m
ɪ n f ɪ g ɛ r ɛ	iː n f iː g ɛ r ɛ
ɪ ŋ n aː r ʊ m	ɪ ŋ n aː r ʊ m
ɪ n ɛ b r j aː r ɛ	ɪ n eː b r j aː r ɛ
d ɛ p r ɛ d aː t j ʊ m n ɛ m	d eː p r aɪ d aː t j oː n ɛ m
n a t a l ɪ t j ʊ m	n aː t aː l iː k j ʊ m
ɔ r k ʊ m	ɔ r k ʊ m
t r ɪ k ɛ	t r iː k ɛ m
m ɔ r d ɛ r ɛ	m ɔ r d eː r ɛ
n ɪ d oː r ɛ	n iː d oː r ɛ m
ɪ m p ɛ r j oː s ʊ m	ɪ m p ɛ r j oː s ʊ m
r j ɛ aː l ɪ t aː t ɛ m	r ɛ aː l ɪ t aː t ɛ m
p a k ɪ f ɪ k ʊ m	p aː k ɪ f ɪ k ʊ m
n ɛ r w ʊ m	n ɛ r w ʊ m
b a kː a l eː r aː t ʊ m	b a kː a l aʊ r ɛ a t ʊ m
kʷ ɛ s ɪ t ʊ m	kʷ aɪ s iː t ʊ m
p ɛ r m ɪ t ɛ r ɛ	p ɛ r m ɪ tː ɛ r ɛ
r aʊ k ʊ m	r aʊ k ʊ m
s ɪ r p ʊ m	s k ɪ r p ʊ m
r ɛ g ʊ m l a m	r eː g ʊ l a m
l uː m ɪ n oː s ʊ m	l uː m ɪ n oː s ʊ m
f ɪ b ʊ lː a m	f iː b ʊ l a m
w a k uː ɪ t aː t ɛ m	w a k ʊ ɪ t aː t ɛ m
aː n aː l ɪ s iː	a n a l y s ɛ m
s k ʊ r a m	s k ʊ rː a m
l uː k r ʊ m	l ʊ k r ʊ m
m aː t ʊ t ɪ n ʊ m	m aː t uː t iː n ʊ m
a r k aː n ʊ m	a r k a n ʊ m
aː n ɔ n a m	a nː oː n a m
l a k r ɪ m oː s ʊ m	l a k r ɪ m oː s ʊ m
f a l a ŋ g ɛ m	pʰ a l a ŋ g ɛ m
r uː m ɪ n aː r ɛ	r uː m ɪ n aː r iː
k r ɛ m a m	k r aː m ʊ m
w ɛ r ɪ f ɪ k a t j oː n ɛ	w ɛ r ɪ f ɪ k aː t j oː n ɛ m
aː b s k ɪ s a m	a b s k ɪ n d ɛ r ɛ
s ɛ pː ʊ l aː r ɛ	s ɛ p ɛ l iː r ɛ
s ʊ g lː ɔ t ʊ m	s ɪ ŋ g ʊ l t ʊ m
k ɔ j a m t ʊ m	k ɔ mː ɛ aː t ʊ m
w ɛ k s aː r ɛ	w eː k s aː r ɛ
f l uː ɪ r ɛ	f l ʊ ɛ r ɛ
p aː w ɪ d ʊ m	p a w ɪ d ʊ m
ɔ p ʊ l ɛ n t ʊ m	ɔ p ʊ l ɛ n t ʊ m
aː nː ʊ m	a nː ʊː m
p r ɔ k uː r aː r ɛ	p r oː k uː r aː r ɛ
m ɪ r t ʊ m	m y r t ʊ m
w aː r j ʊ	w a r j ʊ m
f r ɛ n aː r ɛ	f r eː n aː r ɛ
ɔ pː ɔ r t uː n ɪ t aː t ɛ m	ɔ pː ɔ r t uː n ɪ t aː t ɛ m
w ɛ s t ɪ r ɛ	w ɛ s t iː r ɛ
ʊ l k ɛ r a m	ʊ l k ʊ s
k r ɪ m ɪ n ɛ	k r iː m ɛ n
p aː ɪ s ɛ	p aː g eː n s ɛ m
b r ɪ t aː n ɪ k ʊ m	b r ɪ t a nː ɪ k ʊ m
p a sː aː r ɛ	p a n d ɛ r ɛ
ɪ m p ɛ r j ʊ m	ɪ m p ɛ r j ʊ m
l ɛ g aː t ʊ m	l eː g aː t ʊ m
m aː t ɛ r n ɪ t aː t ɛ m	m aː t ɛ r n ɪ t aː t ɛ m
ɛ d ɪ f ɪ k aː r ɛ	aɪ d ɪ f ɪ k aː r ɛ
k ɔ m a n d aː r ɛ	k ɔ mː ɛ n d aː r ɛ
s aː l k ɪ ɛ m	s a l ɪ k ɛ m
ɛ k s p ɛ d ɪ r ɛ	ɛ k s p ɛ d iː r ɛ
t r a n s m ɪ t ɛ r ɛ	t r aː n s m ɪ tː ɛ r ɛ
ɪ n d ɔ l ɛ m	ɪ n d ɔ l ɛ m
p aː l j ʊ m	p a lː j ʊ m
b ɛ t a m	w ɪ tː a m
k ɔ n f ɛ r ɪ r ɛ	k oː n f ɛ rː ɛ
ɛ m ʊ l a t oː r ɛ	aɪ m ʊ l aː t oː r ɛ m
s ɔ m ɪ aː r ɛ m	s a g m aː r j ʊ m
m ɪ g r aː r ɛ	m ɪ g r aː r ɛ
ɪ n s t aʊ r aː r ɛ	iː n s t aʊ r aː r ɛ
ʊ s ɪ t aː t ʊ m	uː s ɪ t aː t ʊ m
p ʊ n aː r ɛ	p ʊ ŋ n aː r ɛ
s a l ɪ n a m	s a l iː n a m
ɪ n mː a t ʊ r ʊ m	ɪ mː aː t uː r ʊ m
k ɔ n s ɔ l a t j oː n ɛ m	k oː n s oː l aː t j oː n ɛ m
ɛ k s uː l k ɛ r a t j oː n ɛ m	ɛ k s ʊ l k ɛ r aː t j oː n ɛ m
p ɛ r m ɪ sː j oː n ɛ m	p ɛ r m ɪ sː j oː n ɛ m
r ɛ n ɔ kː j ʊ l	r aː n ʊ ŋ k ʊ l ʊ m
g r a n aː r ʊ m	g r aː n aː r j ʊ m
a k t aː r ɛ	aː k t w aː r ɛ
k ʊ r aː t ʊ r a m	k uː r aː t uː r a m
k ɔ n s oː n aː r ɛ	k oː n s ɔ n aː r ɛ
a m ɪ k a m	a m iː k a m
p ɛ r t ʊ r b a t oː n ɛ m	p ɛ r t ʊ r b aː t j oː n ɛ m
ɪ n mː ɔ r t aː l	ɪ mː ɔ r t aː l ɛ m
aː g r ʊ m	a g r ʊ m
ɛ p ɪ s t ɔ l a m	ɛ p ɪ s t ɔ l a m
ɔ n ɔ r aː r j ʊ m	h ɔ n oː r aː r j ʊ m
d ɛ n ɔ m ɪ n a t j oː n ɛ m	d eː n oː m ɪ n aː t j oː n ɛ m
m ɛ d j ʊ m	m ɛ d j ʊ m
ɔ s t ɛ n t aː r ɛ	ɔ s t ɛ n t aː r ɛ
r ɛ s ɛ d ɛ r ɛ	r ɛ s ɪ d eː r ɛ
p ɛ r ɪ m ɛ r ɛ	p ɛ r ɪ m ɛ r ɛ
f ʊ m d ɪ r	f ɔ d ɛ r ɛ
t r ɪ n ɪ t aː t ɛ m	t r iː n ɪ t aː t ɛ m
p ɛ s t r ɪ n ʊ m	p ɪ s t r iː n ʊ m
s t r ɪ g ɛ m	s t r ɪ g ɛ m
aː k ʊ m	a k ʊ m
t aʊ r ɪ f ɔ r m ɛ	t aʊ r ɪ f oː r m ɛ m
aː n t ɪ s t ɪ t ɛ m	a n t ɪ s t ɪ t ɛ m
b ɔ m b ʊ m	b ɔ m b ʊ m
s ɔ nː ʊ m	s ɔ m n ʊ m
s ɛ n aː r ɛ	s ɪ ŋ n aː r ɛ
j ʊ b ɛ n k a m	j ʊ w ɛ ŋ k a m
p oː m ʊ m	p oː m ʊ m
w ɛ r ɛ k ʊ n d ʊ m	w ɛ r eː k ʊ n d ʊ m
a ʊ r a s j oː n ɛ m	a d ɪ uː r aː t j oː n ɛ m
r ɔ n k aː r ɛ	r h ɔ ŋ kʰ aː r ɛ
ɛ k s ɪ g ɛ r ɛ	ɛ k s ɪ g ɛ r ɛ
k ɔ l oː s t r ʊ m	k ɔ l ɔ s t r a m
aː j ʊ n a r ɛ	j eː j uː n aː r ɛ
ɛ n k n a m	iː l ɪ k ɛ m
w ɪ w ɪ d ʊ m	w iː w ɪ d ʊ m
s a k r ɪ l ɛ g ʊ m	s a k r ɪ l ɛ g ʊ m
f a r m a k ɛ ʊ t ɪ k ʊ m	pʰ a r m a k ɛu t ɪ k ʊ m
ɪ n f ɛ l ɪ k ɛ	iː n f eː l iː k ɛ m
b ɔ t ʊ l ɪ n ʊ m	b ɔ t ʊ l ʊ m
k ɛ r ɛ m ɔ n j aː l ɛ	k aɪ r ɪ m oː n j aː l ɛ m
k a r n oː s ʊ m	k a r n oː s ʊ m
ɪ n s p ɛ k t j ʊ m n aː r ɛ	iː n s p ɛ k t aː r ɛ
r uː g ɪ r ɛ	r uː g iː r ɛ
s aː l aː k ɛ	s a l aː k ɛ m
ɪ m p ɛ d ɪ r ɛ	ɪ m p ɛ d iː r ɛ
t ɛ s ʊ r a m	t eː n s uː r a m
ɪ m p r ɛ k aː r ɛ	ɪ m p r ɛ k aː r iː
g ɔ d ɛ r ɛ	g aʊ d eː r ɛ
w ɪ t ɛ lː ʊ m	w ɪ t ɛ lː ʊ m
s kʷ aː l ʊ m	s kʷ aː l ʊ m
s ɛ l w aː t ɪ k	s ɪ l w aː t ɪ k ʊ m
a s k ɛ n s j oː n ɛ m	a s k eː n s j oː n ɛ m
a d ɪ k t ʊ m	a dː ɪ k t ʊ m
t r ɪ s ɛ n aː r j ʊ m	t r iː k eː n aː r j ʊ m
k ɔ n t ɪ n w a t j oː n ɛ m	k ɔ n t ɪ n w aː t j oː n ɛ m
ɪ m p uː l s j oː n ɛ m	ɪ m p ʊ l s j oː n ɛ m
k ɔ m p l a k ɛ r ɛ	k ɔ m p l a k eː r ɛ
f a b r ɪ k a t j oː n ɛ m	f aː b r ɪ k aː t j oː n ɛ m
f a b ɛ lː a m	f aː b ɛ lː a m
w ɔ s	w oː s
aʊ r ɪ r ɛ	h aʊ r iː r ɛ
r ʊ p ɛ	r uː p ɛ m
s ʊ s t ɛ n t aː r ɛ	s ʊ s t ɛ n t aː r ɛ
f ɪ l j aː l ɛ	f iː l j aː l ɛ m
d ɛ k ɔ r aː r ɛ	d ɛ k ɔ r aː r ɛ
t ɛ n aː k ʊ l ʊ m	k eː n aː k ʊ l ʊ m
n a rː aː r ɛ	n a rː aː r ɛ
ɪ n f l a mː a t j oː n ɛ m	iː n f l a mː aː t j oː n ɛ m
kʷ aː s a r ɛ	kʷ a sː aː r ɛ
ɔ b sː ɛ kʷ j ʊ m	ɔ b s ɛ kʷ j ʊ m
p r ɛ d a t j oː n ɛ m	p r aɪ d aː t j oː n ɛ m
b aː g a m	b aː k a m
k a n ɪ k ʊ l a m	k a n iː k ʊ l a m
m a n t ɪ p m j ʊ m	m a ŋ k ɪ p j ʊ m
t ɛ n ɛ	t ɛ n ʊ ɛ m
b l ɛ t ʊ m	b l ɪ t ʊ m
p ɛ kː aː r ɛ	p ɛ kː aː r ɛ
ɛ k s a s p ɛ r a t j oː n ɛ m	ɛ k s a s p ɛ r aː t j oː n ɛ m
s t ʊ l t ʊ m	s t ʊ l t ʊ m
ɔ n aː g r ʊ m	ɔ n a g r ʊ m
l ɛ n a d oː r ɛ	l ɪ ŋ n aː t oː r ɛ m
s ʊ s p ɛ n s j oː n ɛ m	s ʊ s p eː n s j oː n ɛ m
d ɛ f l ʊ ɪ r ɛ	d eː f l ʊ ɛ r ɛ
p aː l p ɛ b r aː l	p a l p ɛ b r aː l ɛ m
s t uː d j ʊ m	s t ʊ d j ʊ m
l ɪ n eː m ɛ n t ʊ m	l iː n ɛ aː m ɛ n t ʊ m
ɛ r g aː s t ʊ l ʊ m	ɛ r g a s t ʊ l ʊ m
ɪ rː ʊ m p ɛ r ɛ	ɪ rː ʊ m p ɛ r ɛ
a b n ʊ ɪ r ɛ	a b n ʊ ɛ r ɛ
d ɛ k ɔ rː ɛ r ɛ	d eː k ʊ rː ɛ r ɛ
p ɪ ŋ kʷ ɛ	p ɪ ŋ gʷ ɛ m
k ɔ ŋ g uː r a t j oː n ɛ m	k ɔ n ɪ uː r aː t j oː n ɛ m
a gː r ɛ d ɪ r ɛ	a gː r ɛ d iː
d ɛ s uː l t oː r j ʊ m	d eː s ʊ l t oː r j ʊ m
p ɛ r s ɛ k ʊ t oː r ɛ	p ɛ r s ɛ k uː t oː r ɛ m
k ɔ r n j ɛ ʊ m	k ɔ r n ɛu m
d ɪ m a n d aː r ɛ	d eː m a n d aː r ɛ
s a ŋ t j oː n ɛ m	s aː ŋ k t j oː n ɛ m
r a k ɪ m oː s ʊ m	r a k eː m oː s ʊ m
s t a b ɪ l ɛ m k ɪ r ɛ	s t a b ɪ l iː r ɛ
ɔ s p ɛ d aː r ɛ	h ɔ s p ɪ t aː r iː
g ɛ l aː r ɛ	g ɛ l aː r ɛ
p r ɛ ɔ kː uː p aː r ɛ	p r aɪ ɔ kː ʊ p aː r ɛ
f ʊ l g ʊ r aː r ɛ	f ʊ l g ʊ r aː r ɛ
k r ɛ aː t r ɪ k ɛ	k r ɛ aː t r iː k ɛ m
b ɪ n k l ʊ m	w ɪ ŋ k ʊ l ʊ m
ʊ m b r aː t ɪ k ʊ m	ʊ m b r aː t ɪ k ʊ m
k ɔ n s a ŋ gʷ ɪ n ɪ t aː t ɛ m	k oː n s a ŋ gʷ ɪ n ɪ t aː t ɛ m
b ɛ r ɪ lː ʊ m	b eː r y lː ʊ m
p r ɛ s ɛ n t ɪ r	p r aɪ s ɛ n t iː r ɛ
f ɔ r n ɪ k aː t oː r ɛ	f ɔ r n ɪ k aː t oː r ɛ m
s ɛ n s a t j oː n ɛ m	s eː n s aː t j oː n ɛ m
m aː l ɛ d ɪ k t j oː n ɛ m	m a l ɛ d ɪ k t j oː n ɛ m
f ʊ ŋ g oː s ʊ m	f ʊ ŋ g oː s ʊ m
ɪ n k ɔ n k ʊ sː ʊ m	ɪ ŋ k ɔ ŋ k ʊ sː ʊ m
w ɛ r ɪ f ɪ k aː r ɛ	w eː r ɪ f ɪ k aː r ɛ
f r a t ɛ r n ʊ m	f r aː t ɛ r n ʊ m
t aː l aː m ʊ m	tʰ a l a m ʊ m
k ɛ r t aː r ɛ	k ɛ r t aː r ɛ
p ɛ l a g ʊ m	p ɛ l a g ʊ s
f j ɛ b ʊ m l ɛ	f l eː b ɪ l ɛ m
a b ɔ m ɪ n aː r ɛ	a b oː m ɪ n aː r iː
s ʊ m	s ʊ ɛ m
s a g ɪ t aː r j ʊ m	s a g ɪ tː aː r j ʊ m
p uː p ɪ lː ʊ m	p uː p ɪ lː ʊ m
d ɪ s ɛ r t ʊ m	d ɪ s ɛ r t ʊ m
k ɔ m p a r ɪ t r ɛ	k ɔ m p aː r eː r ɛ
w ɪ b r aː r ɛ	w ɪ b r aː r ɛ
aː n ɛ m ɔ n ɛ	a n ɛ m oː n eː n
a d ɔ l ɛ s k ɛ n t j a m	a d ʊ l eː s k ɛ n t j a m
w ɪ lː a n ʊ m	w iː lː aː n ʊ m
w ɛ t ʊ s t ʊ m	w ɛ t ʊ s t ʊ m
ɔ m ɛ n t ʊ m	oː m ɛ n t ʊ m
t j ɔ	tʰ iː ʊ m
w ɪ n k ʊ l aː r ɛ	w ɪ ŋ k ʊ l aː r ɛ
s a t uː r aː r ɛ	s a t ʊ r aː r ɛ
f r ɔ n t aː l ɛ	f r ɔ n t aː l ɛ m
t r ɛ m ʊ l ʊ m	t r ɛ m ʊ l ʊ m
a s ɛ t aː r ɛ	a sː ɛ k t aː r iː
p ɛ r k ɪ r ɪ r ɛ	p ɛ r kʷ iː r ɛ r ɛ
s ɔ l aː r ɛ	s oː l aː r ɛ m
t ɪ m oː n ɛ m	t eː m oː n ɛ m
p ɛ r p ɛ t w aː t j ɔ n ɛ m	p ɛ r p ɛ t w aː t oː n ɛ m
ɪ m p j ʊ m	ɪ m p j ʊ m
w ɛ n j a m	w ɛ n j a m
l ɪ m a k a	l iː m aː k ɛ m
d ɛ k s t ɛ r ɪ t aː t ɛ m	d ɛ k s t ɛ r ɪ t aː t ɛ m
k a s t aː n a	k a s t a n ɛ a m
k ɔ n mː ʊ w ɛ r ɛ	k ɔ mː ɔ w eː r ɛ
