m a r ɪ t aː r ɛ	m a r iː t aː r ɛ
a k r ɪ t ʊ d ɛ m	aː k r ɪ t uː d ɪ n ɛ m
s oː n a m	z oː n a m
r a s t r ɛ lː ʊ m	r aː s t ɛ lː ʊ m
d ɛ k ɔ k t j oː n ɛ m	d ɛ k ɔ k t j oː n ɛ m
ɔ r aː r ɛ	oː r aː r ɛ
s a k r ɪ l ɛ g ʊ m	s a k r ɪ l ɛ g ʊ m
ɛ k s t aː s ɪ	ɛ k s t a s ɛ m
p r ɔ t ɔ k oː l aː r j ʊ m	p r oː t ɔ k ɔ lː aː r j ʊ m
a sː ɪ d ʊ m	a sː ɪ d ʊː m
m uː l ʊ m	m uː l ʊ m
ɛ b r j ʊ m	eː b r j ʊ m
p l aː ŋ g ɛ r ɛ	p l a ŋ g ɛ r ɛ
m uː n ɪ f ɪ k ɛ n t j a m	m uː n ɪ f ɪ k ɛ n t j a m
uː m ɪ d ʊ m	uː m ɪ d ʊ m
t ɛ n s j oː n ɛ	t eː n s j oː n ɛ m
p r ɛ ɔ kː uː p aː r ɛ	p r aɪ ɔ kː ʊ p aː r ɛ
p ɔ lː aː r ɛ	p ʊ lː aː r ɛ
d ɛ n ɛ g aː r ɛ	d eː n ɛ g aː r ɛ
f ʊ n d aː t oː r ɛ	f ʊ n d aː t oː r ɛ m
k oː ŋ g j ʊ m	k ɔ ŋ g j ʊ m
k ɪ n aː r ɛ	k eː n aː r ɛ
s t r ɛ p ɪ t ʊ m	s t r ɛ p ɪ t ʊ m
a fː ɪ r m aː r ɛ	a fː ɪ r m aː r ɛ
s k aː r a m b ɛ m ʊ m	s k a r a b aɪ ʊ m
a l w ɛ r ʊ m	a l b aː r j ʊ m
f l ɛ k sː j oː n ɛ m	f l ɛ k s j oː n ɛ m
d ɛ m oː n ɪ k ʊ m	d aɪ m ɔ n ɪ k ʊ m
t aː sː ʊ m n	t a k s ʊ m
s uː b s ɪ d j ʊ m	s ʊ b s ɪ d j ʊ m
ɪ n s t aʊ r aː r ɛ	iː n s t aʊ r aː r ɛ
k ʊ p l a m	k oː p ʊ l a m
f r ʊ s t aː	f r ʊ s t a m
a r b ʊ s t ɪ w ʊ m	a r b ʊ s t iː w ʊ m
uː s uː r a m	uː s uː r a m
p r ɛ d j aː l ɛ	p r aɪ d j aː l ɛ m
a l k j ɔ n	a l k y ɔ n ɛ m
p a r t ɪ k ʊ l aː r ɛ	p a r t ɪ k ʊ l aː r ɛ m
ɪ n ɪ t j ʊ m	ɪ n ɪ t j ʊ m
ɔ r b ʊ m	ɔ r b ʊ m
ʊ s ɪ t aː r ɛ	uː s ɪ t aː r iː
s ʊ p ɛ r w a m k aː n ɛu ʊ m	s ʊ p ɛ r w a k ʊː m
d uː k ɪ r ɛ	d uː k ɛ r ɛ
f ɛ s t ɪ n aː r ɛ	f ɛ s t iː n aː r ɛ
p ɔ r t aː r ɛ	p ɔ r t aː r ɛ
w ɛ r t ɪ g ɪ n ɛ	w ɛ r t iː g ɪ n ɛ m
d ɛ m ʊ t aː r ɛ	d eː m uː t aː r ɛ
k ɔ n t r aː d ɪ k t oː r ɛ m	k ɔ n t r aː d ɪ k t oː r ɛ m
ɪ m p r ɔ b aː r ɛ	ɪ m p r ɔ b aː r ɛ
s a l ɪ n a m	s a l iː n a m
a w ɪ ʊ m	a w ɛ m
a r aː n aː	a r aː n ɛ a m
p a r w ʊ m	p a r w ʊ m
m a r t ɛ lː ʊ m	m a r t ɛ lː ʊ m
t ʊ r d ʊ m	t ʊ r d ʊ m
a sː ɛ r ɪ r ɛ	a sː ɛ r ɛ r ɛ
w ɪ t r ʊ m	w ɪ t r ʊ m
d ɛ l ɪ n kʷ ɛ r ɛ	d eː l ɪ ŋ kʷ ɛ r ɛ
n ʊ m ɛ r ɔ s ɪ t aː t ɛ m	n ʊ m ɛ r oː s ɪ t aː t ɛ m
b a r d ʊ m	b a r d ʊ m
ɪ m p aː w ɪ d ʊ m	ɪ m p a w ɪ d ʊ m
k a r aː m ɛ lː ʊ m	k a l a m ɛ lː ʊ m
w ɪ m ɪ n ɛ m	w iː m ɛ n
s ʊ s t ɛ n t aː r ɛ	s ʊ s t ɛ n t aː r ɛ
s ɪ r ɛ m	s eː r ʊ m
a s t r ʊ m	a s t r ʊ m
f ɛ rː aː m j ɛ n t a m	f ɛ rː aː m ɛ n t ʊ m
p r ɔ m ɛ sː a m	p r oː m ɪ sː ʊ m
l ɪ m ɪ n ɛ	l iː m ɛ n
s ʊ n rː ɪ d ɪ r ɛ	s ʊ b r iː d eː r ɛ
k ɪ d aː	k iː d a m
ɛ k s k ɔ g ɪ t a m r ɛ	ɛ k s k oː g ɪ t aː r ɛ
a lː ʊ d ɪ r ɛ	a lː uː d ɛ r ɛ
f a t ɪ k aː r ɛ	f a t iː g aː r ɛ
k a mː ɪ n ʊ m	k a mː iː n ʊ m
t ɛ k s t ɪ l	t ɛ k s t ɪ l ɛ
k a m p ɛ s t r ɛ m	k a m p ɛ s t r ɛ m
ɪ l aː r ɛ	h ɪ l a r ɛ m
f ɪ n ɪ t j oː n ɛ m	f iː n iː t j oː n ɛ m
f ʊ n ɛ r ɛ ʊ m	f uː n ɛ r ɛu m
f ɔ r n ɪ k aː t oː r ɛ m	f ɔ r n ɪ k aː t oː r ɛ m
r ɛ m ɛ m b r aː r ɛ	r ɛ m ɛ m ɔ r aː r iː
ɛ k s ɛ m p l aː r ɛ	ɛ k s ɛ m p l aː r ɛ m
p ɔ s t r ɪ b ʊ l ʊ m	p r oː s t ɪ b ʊ l ʊ m
d ʊ w eː r ɛ	d eː b eː r ɛ
ʊ ŋ gʷ ɛ n t ʊ m	ʊ ŋ gʷ ɛ n t ʊ m
ɪ p ɛ r t ɛ p t ɪ b l ɛ m ɛ m	ɪ m p ɛ r k ɛ p t ɪ b ɪ l ɛ m
k ɪ m k ɛ m	k iː m ɪ k ɛ m
r ɛ f r ɪ g ɛ r j ʊ m	r eː f r iː g ɛ r j ʊ m
k ɔ r j a n d ʊ m r ʊ m	k ɔ r j a n d r ʊ m
k ɛ r ɛ m ɔ n j aː l ɛ m	k aɪ r ɪ m oː n j aː l ɛ m
b l a n d ɪ r ɛ	b l a n d iː r iː
d ɛ t ɛ r m ɪ n aː t j ʊ m n ɛ m	d eː t ɛ r m ɪ n aː t j oː n ɛ m
k ɔ m p r ɔ m ɛ t ɛ r ɛ m	k ɔ m p r oː m ɪ tː ɛ r ɛ
a k oː	a k ʊ m
f ɛ r w ɛ r ɛ	f ɛ r w eː r ɛ
f ɛ d ʊ m	f ɔ ɪ d ʊ s
a s	a sː ɛ m
a d w ɛ r b j aː l ɛ m	a d w ɛ r b j aː l ɛ m
f l oː r iː r ɛ	f l oː r eː r ɛ
m ɔ d ɪ k ʊ m	m ɔ d ɪ k ʊ m
a fː j aː n t aː r ɛ	a fː ɪ d ɛ n t j aː r ɛ
s ʊ m ɛ r ɛ	s uː m ɛ r ɛ
ɛ r aː r j ʊ m	aɪ r aː r j ʊ m
a n ɪ m aː l ɛ	a n ɪ m a l
m ɔ r d aː k ɛ	m ɔ r d aː k ɛ m
p r ɔ w ɛ d eː r ɛ	p r oː w ɪ d eː r ɛ
r ɛ uː m a m	r h ɛu m a
oː s ʊ m	oː s ʊ m
d ɛ p aː r t ɪ r	d eː p a r t iː r ɛ
g l ɔ s a m	g l ɔ sː a m
w ɪ r aː g ʊ m	w ɪ r aː g ɪ n ɛ m
a n ɪ m ɔ m	a n ɪ m ʊ m
a k ɛ r b ɪ t aː t ɛ m	a k ɛ r b ɪ t aː t ɛ m
m a t r ɪ m oː n j ʊ m	m aː t r ɪ m oː n j ʊ m
d ʊ b l ʊ m	d ʊ p l ʊ m
a tː r aː ɛ r ɛ	a tː r a h ɛ r ɛ
b r aː k aː	b r aː k a m
p a l ɛ s t r a m	p a l aɪ s t r a m
b ɪ l ɛ	b iː l ɛ m
p ʊ g ɪ l ɛ	p ʊ g ɪ l ɛ m
n ɔ t ɔ r j ʊ m	n oː t oː r j ʊ m
s t r ʊ p ʊ m	s t r ɔ pː ʊ m
a b aː l ɪ ɛ n aː r ɛ	a b a l ɪ eː n aː r ɛ
n ɔ w ʊ m	n ɔ w ʊ m
s uː b m ɛ r m ʊ m	s uː b ɛ r ɛ m
k l aː w ɪ k oː r d j ʊ m	k l aː w iː kʰ ɔ r d j ʊ m
p ɔ s aː r ɛ	p aʊ s aː r ɛ
b ɪ k a m	b iː g a m
a r m ʊ m s	a r m ʊ m
g a rː ʊ l ʊ m	g a rː ʊ l ʊ m
ɔ l f aː t ɔ r j ʊ m	ɔ l f a k t oː r j ʊ m
ɪ ŋ g ʊ s t ʊ m	ɪ n ɪ uː s t ʊ m
a w ɛ r s j oː n ɛ	aː w ɛ r s j oː n ɛ m
m ɛ t r k ʊ m	m ɛ t r ʊ m
r ʊ g ʊ m	r ɔ g ʊ m
ɪ n t ɛ r p oː n ɛ	ɪ n t ɛ r p oː n ɛ r ɛ
ɪ n f ɪ g ɛ r ɛ	iː n f iː g ɛ r ɛ
d a nː a m t ʊ m	d a m n aː t ʊ m
f ɛ s t ʊ m	f eː s t ʊ m
uː n ɪ f ɔ r m ɛ m	uː n ɪ f oː r m ɛ m
p a l ʊ d oː s ʊ m	p a l uː d oː s ʊ m
l ɪ b aː r ɛ	l iː b aː r ɛ
p ʊ l w ɛ r ɪ zː aː r ɛ m	p ʊ l w ɛ r iː zː aː r ɛ
k ɔ nː ɛ k sː j oː n ɛ m	k ɔ nː ɛ k s j oː n ɛ m
r a n ʊ m	a r aː n ɛu m
g r ɛ g ɛ m	g r ɛ g ɛ m
l ɪ n t ɛ r n a m	l a n t ɛ r n a m
p r ɔ s ɛ m kʷ ɪ r ɛ m	p r oː s ɛ kʷ iː
k ɔ r j aː k ɛ ʊ m	k ɔ r j a k ɛu m
uː r g ɛ r ɛ	ʊ r g eː r ɛ
l ɪ k ɛ n	l iː kʰ eː n a
ɪ n kʷ j ɛ t a m r ɛ	ɪ ŋ kʷ ɪ eː t aː r ɛ
w ɪ d ʊ ɪ t aː	w ɪ d ʊ ɪ t aː t ɛ m
kʷ a d r ʊ p l ɪ k aː r ɛ m	kʷ a d r ʊ p l ɪ k aː r ɛ
r uː g a m	r uː g a m
ɔ b b j ʊ m	ɔ b w j ʊ m
f ɪ s k ʊ m	f ɪ s k ʊ m
ɛ l ɪ m ɪ n a m t j oː n ɛ m	eː l ɪ m ɪ n aː t j oː n ɛ m
f ɛ k ʊ l ɛ n t ʊ m	f aɪ k ʊ l ɛ n t ʊ m
k a k t ɪ w ʊ m	k a p t iː w ʊ m
s ɪ t j ʊ m	s ɪ t ʊ m
f eː mː ɪ n a m	f eː m ɪ n a m
k ɔ r ɛ	kʰ ɔ r eːa m
d ɛ t ɛ p t ɪ oː n aː r	d eː k ɪ p ɛ r ɛ
g ɔ d ɛ r ɛ	g aʊ d eː r ɛ
d ɪ n s aː r ɛ	d eː n s aː r ɛ
s ɛ r w ɪ ɛ n t ɛ	s ɛ r w ɪ ɛ n t ɛ m
s p ɛ l t aː	s p ɛ l t a m
ɔ t r ɛ	ʊ t r ʊ m
k ɔ n s ʊ m ɛ r ɛ	k oː n s uː m ɛ r ɛ
ɪ g l ɛ s ɛ	a ŋ g l eː n s ɛ m
g uː s t aː t j oː n ɛ m	g ʊ s t aː t j oː n ɛ m
k ɪ k ɛ m	k ɪ k ɛ r
kʷ a r t ʊ m	kʷ aː r t ʊ m
f ɛ sː aː r ɛ	f a t eː r iː
w ɛ n t ɪ l aː t j oː n ɛ m	w ɛ n t ɪ l aː t j oː n ɛ m
k ɔ n d ʊ m n aː r ɛ	k ɔ n d oː n aː r ɛ
l ɛ n t ʊ m	l ɛ n t ʊ m
n ɪ d oː r ɛ	n iː d oː r ɛ m
ɔ n oː r ɛ	h ɔ n oː r ɛ m
a b sː ɔ l ʊ t j oː n ɛ m	a b s ɔ l uː t j oː n ɛ m
b ɛ aː t ʊ m	b ɛ aː t ʊ m
f a k ʊ n d ʊ m	f aː k ʊ n d ʊ m
b a r aː t r ʊ m	b a r a tʰ r ʊ m
p r ɛ s ʊ m ɛ r ɛ	p r aɪ s uː m ɛ r ɛ
p r ɔ f ɛ t j a m	p r ɔ pʰ eː t iː a m
p ʊ t aː r ɛ m	p ʊ t aː r ɛ
p r ɔ g r ɛ m d ɪ r ɛ	p r oː g r ɛ d iː
s p ɔ l a m r ɛ	s p ɔ l j aː r ɛ
ɪ n k ɔ n s t a n t ɛ m	ɪ ŋ k oː n s t a n t ɛ m
ɪ r m aː n d aː t ɛ m	g ɛ r m aː n ɪ t aː t ɛ m
k ɔ m p ʊ n g ɛ r ɛ m	k ɔ m p ʊ ŋ g ɛ r ɛ
t r a n s k ɛ n d ɛ r ɛ	t r aː n s k ɛ n d ɛ r ɛ
s ɛ d aː r ɛ	s eː d aː r ɛ
ɛ k s t ɛ n d ɛ r ɛ	ɛ k s t ɛ n d ɛ r ɛ
k ɔ n f ɔ r m ɛ m	k oː n f oː r m ɛ m
l a k r ɪ m aː r ɛ	l a k r ɪ m aː r ɛ
g a l ɛ g ʊ m	g a lː aɪ k ʊ m
k uː p ɪ d ɪ t aː	k ʊ p ɪ d ɪ t aː t ɛ m
l ʊ p a m	l ʊ p a m
d ɛ p ɛ r ɪ t ɛ r ɛ m	d eː p ɛ r iː r ɛ
ɪ n f ɔ r m ɛ	iː n f oː r m ɛ m
ɪ n k ɪ d ɛ r ɛ	ɪ ŋ k ɪ d ɛ r ɛ
m a l ɛ d ɪ k ɛ r ɛ	m a l ɛ d iː k ɛ r ɛ
a s t ʊ t ʊ m	a s t uː t ʊ m
d ɛ g ɔ l aː r ɛ	d eː k ɔ lː aː r ɛ
f ɔ r m aː g ʊ m	f oː r m aː t ɪ k ʊ m
r a p ɪ r ɛ	r a p ɛ r ɛ
k ɔ n s ɔ l ɪ d aː r ɛ	k oː n s ɔ l ɪ d aː r ɛ
t ɛ n ɛ b r ɛ m s	t ɛ n ɛ b r aː s
s k oː l ʊ m	s k ɔ p ʊ l ʊ m
ɔ fː ɛ r t ɔ r j ʊ m	ɔ fː ɛ r t oː r j ʊ m
s p ʊ m aː r ɛ	s p uː m aː r ɛ
s a r k ɪ n a m	s a r k ɪ n a m
k ɔ m p aː r ɛ t ɛ r ɛ m	k ɔ m p aː r eː r ɛ
a r k aː	a r k a m
a kː uː s aː t oː r ɛ	a kː uː s aː t oː r ɛ m
s ʊ r j ɪ r ɛ	s ʊ r g ɛ r ɛ
p ɛ r s w aː d ɛ r ɛ m	p ɛ r s w aː d eː r ɛ
m ɛ s ɛ m	m eː n s ɛ m
ɛ k s aː l a m r ɛ	ɛ k s h aː l aː r ɛ
k ɔ r t ɛ m	k ɔ h ɔ r t ɛ m
m ɛ l ɔ r aː r ɛ	m ɛ l j oː r aː r ɛ
a d ʊ l t ɛ r ɪ n ʊ m	a d ʊ l t ɛ r iː n ʊ m
l uː s t r a m r ɛ	l ʊ s t r aː r ɛ
a s p ɛ k t aː r ɛ	a s p ɛ k t aː r ɛ
a m aː t ɔ r j ʊ m	a m aː t oː r j ʊ m
ɪ ŋ n ɔ m ɪ n j a m	ɪ ŋ n oː m ɪ n j a m
ɪ n t r ɔ ɪ t ʊ m	ɪ n t r ɔ ɪ t ʊ m
d ɔ t aː r ɛ	d oː t aː r ɛ
p r ɔ w ɔ k a m t ɪ w ʊ m	p r oː w ɔ k aː t iː w ʊ m
m ɔ r t aː r j ʊ m	m ɔ r t w aː r j ʊ m
ɛ s k ɔ t ɛ r ɛ	ɛ k s k ʊ t ɛ r ɛ
ɔ s k ʊ l a m t j oː n ɛ m	ɔ s k ʊ l aː t j oː n ɛ m
k a l k ɛ m	k a l k ɛ m
r ɪ s t aʊ r aː r ɛ	r ɛ s t aʊ r aː r ɛ
n ɪ w ɛ lː ɔ	l iː b ɛ lː a m
m a t uː r ʊ m	m aː t uː r ʊ m
s ɛ p aː r aː r ɛ	s eː p a r aː r ɛ
t ɛ n ɛ r ɛ	t ɛ n eː r ɛ
ɪ n w ɪ t aː t j oː n ɛ m	ɪ n w ɪ t aː t j oː n ɛ m
ɪ m p j ʊ m	ɪ m p j ʊ m
ɔ b s ɛ r w aː r ɛ	ɔ b s ɛ r w aː r ɛ
t a n t ʊ m	t a n t ʊ m
a s p aː r a g ʊ m	a s p a r a g ʊ m
k l aː w ʊ m	k l aː w ʊ m
s t uː d j aː r ɛ	s t ʊ d eː r ɛ
m a g ɛ s t aː t ɛ m	m a j ɛ s t aː t ɛ m
aʊ g uː r aː r ɛ	aʊ g ʊ r aː r ɛ
d a n oː s ʊ m	d a m n oː s ʊ m
s p ʊ s aː r ɛ	s p oː n s aː r ɛ
w ɛ lː ʊ s ʊ m	w ɪ lː oː s ʊ m
l a k s ʊ m	l a k s ʊ m
r ɛ w ɔ k aː r ɛ	r ɛ w ɔ k aː r ɛ
p a b ʊ l ʊ m	p aː b ʊ l ʊ m
r a s ɛ k aː r ɛ	r ɛ s ɛ k aː r ɛ
s ɔ lː ɪ k ɪ t aː t j oː n ɛ m	s ɔ lː ɪ k ɪ t aː t j oː n ɛ m
m a r t ɪ r ɛ	m a r t y r ɛ m
k r ɛ m aː	k r aː m ʊ m
a fː ɪ r m aː t j oː n ɛ m	a fː ɪ r m aː t j oː n ɛ m
b ʊ k ɪ n ɛ	b uː k ɪ n ʊ m
k oː nː ʊ m	k ʊ nː ʊ m
a nː aː l ɪ	a nː aː l ɛ m
d ɛ f l ʊ ɪ r ɛ	d eː f l ʊ ɛ r ɛ
k ɔ n s t ɪ t uː t j oː n ɛ m	k oː n s t ɪ t uː t j oː n ɛ m
t r ɛ p ɪ d ʊ m	t r ɛ p ɪ d ʊ m
m ɪ n ɔ r aː r ɛ	m ɪ n oː r aː r ɛ
k a l oː r ɛ	k a l oː r ɛ m
uː s w ʊ aː l ɛ	uː s w aː l ɛ m
k a m b r oː n ɛ m	k r aː b r oː n ɛ m
a g ɪ t aː r ɛ	a g ɪ t aː r ɛ
a rː ɔ g aː r ɛ	a rː ɔ g aː r ɛ
k ɔ m ɔ d ʊ m	k ɔ mː ɔ d ʊ m
n aː n oː	n aː n ʊ m
ɛ k s t r aː oː r d iː n aː r j ʊ m	ɛ k s t r aː ɔ r d ɪ n aː r j ʊ m
ɪ ŋ g ɛ n j ʊ m	ɪ ŋ g ɛ n j ʊ m
k ɪ r k ʊ l aː r ɛ	k ɪ r k ʊ l aː r ɛ m
s a sː ʊ m	s a k s ʊ m
g ɛ r ʊ n d j ʊ m	g ɛ r ʊ n d j ʊ m
t r aː m ɪ t ɛ m	t r aː m ɪ t ɛ m
k ɛ g aː r ɛ	k aɪ k aː r ɛ
w ɪ ŋ k ɛ r ɛ	w ɪ ŋ k ɛ r ɛ
a d ɪ r ɛ	a d iː r ɛ
p r ɛ m ɛ r ɛ	p r ɛ m ɛ r ɛ
ɔ r k ʊ m	ɔ r k ʊ m
k l aʊ d ɪ k a m r ɛ	k l aʊ d ɪ k aː r ɛ
p ɪ k a m	p iː k a m
s t aː n j ʊ m	s t a nː ʊ m
k a lː ɛ	k a lː ɛ m
a nː ʊ n k j aː r ɛ	a nː uː n t j aː r ɛ
d ɔ m ɪ k ɪ l j ʊ m	d ɔ m ɪ k ɪ l j ʊ m
k ɔ n s l iː d a m	k oː n s ɔ l ɪ d a m
a tː ɪ n ɛ r ɛ	a tː ɪ n eː r ɛ
f l aː g r aː r ɛ	f l a g r aː r ɛ
r ɛ l aː t ɪ w ʊ m	r ɛ l aː t iː w ʊ m
ɛ m ɛ n d aː r ɛ	eː m ɛ n d aː r ɛ
p ɛ kː aː r ɛ	p ɛ kː aː r ɛ
p ʊ l k r ʊ m	p ʊ l kʰ r ʊ m
ɪ n w ɪ d j oː s ʊ m	ɪ n w ɪ d j oː s ʊ m
k ɛ r w a m	k ɛ r w a m
ɛ t ʊ m	eː t ʊ m
ʊ s ɪ n oː l ʊ m	l ʊ s k ɪ n j a m
f ɪ d ʊ m	f iː d ʊ m
a p j aː r j ʊ m	a p j aː r j ʊ m
b ʊ k ɪ n a m	b uː k ɪ n a m
f ɛ t ɪ d ʊ m	f eː t ɪ d ʊ m
p r ɛ d ɔ m ɪ n aː r ɛ	p r aɪ d ɔ m ɪ n aː r iː
s a n t ʊ m r j ɛ t a m	s a t ʊ r eː j a m
ɛ k s p ʊ ŋ n aː r ɛ	ɛ k s p ʊ ŋ n aː r ɛ
ɔ s t ɪ l ɛ	h ɔ s t iː l ɛ m
n ɔ nː ʊ m	n ɔ nː ʊ m
d ɛ w ʊ m w ɛ r ɛ	d eː w ɔ w eː r ɛ
r ɛ b ɛ l aː r ɛ	r ɛ b ɛ lː aː r ɛ
p oː m ɪ k ɛ	p uː m ɪ k ɛ m
m a ŋ n ɪ t ʊ d ʊ m	m a ŋ n ɪ t uː d ɪ n ɛ m
k uː r a m t ʊ r a m	k uː r aː t uː r a m
r ɛ p uː b l ɪ k a m	r ɛ m p uː b l ɪ k a m
s uː pː l ɪ k aː r ɛ	s ʊ pː l ɪ k aː r ɛ
n ɪ m j ʊ m	n ɪ m j ʊ m
k ɛ n s ʊ r a m	k eː n s uː r a m
uː s ɛ r ɛ m	ɔ s t j aː r j ʊ m
t ɛ n d ɛ r ɛ	t ɛ n d ɛ r ɛ
l ɪ g aː m ɛ n t ʊ m	l ɪ g aː m ɛ n t ʊ m
s ɔ lː ɪ k ɪ t aː r ɛ	s ɔ lː ɪ k ɪ t aː r ɛ
p a w ɪ l oː n ɛ m	p aː p ɪ l j oː n ɛ m
ɛ k s aʊ d ɪ r ɛ	ɛ k s aʊ d iː r ɛ
g uː b ɪ l aː r ɛ	j uː b ɪ l aː r ɛ
k ɔ n t ɛ n t j oː n ɛ m	k ɔ n t ɛ n t j oː n ɛ m
ɔ m ɛ n t ʊ m	oː m ɛ n t ʊ m
s k r ʊ t aː r ɛ	s k r uː t aː r ɛ
d ɪ s t ɔ r s j oː n ɛ m	d ɪ s t ɔ r t j oː n ɛ m
d ʊ l k oː r a m	d ʊ l k oː r ɛ m
n ɛ g l ɪ j ɛ r ɛ	n ɛ g l ɛ g ɛ r ɛ
k ɔ ŋ j ʊ g aː r ɛ	k ɔ n j ʊ g aː r ɛ
d ɔ ɛ k ɛ n t ʊ m s	d ʊ k ɛ n t oː s
ʊ r k ɛ m	ʊ l iː k ɛ m
ɔ n ɔ m aː t oː p ɛ j a m	ɔ n ɔ m a t ɔ p ɔ ɪ j a m
p r ɔ s t r aː r ɛ	p r oː s t ɛ r n ɛ r ɛ
p a l a m	p aː l a m
uː r ʊ m	uː r ʊ m
m a l f aː t oː r ɛ	m a l ɛ f a k t oː r ɛ m
s p oː s ʊ m	s p oː n s ʊ m
k oː n ʊ m	k oː n ʊ m
a d ɪ t a m m ɛ n t ʊ m	a dː ɪ t aː m ɛ n t ʊ m
k ɔ n k ɔ r d j a m	k ɔ ŋ k ɔ r d j a m
k ɔ ŋ g ʊ r aː r ɛ	k ɔ n ɪ uː r aː r ɛ
w ʊ l p ɛ	w ʊ l p ɛ m
b ʊ lː ɪ r ɛ	b ʊ lː iː r ɛ
ɛ r ɛ t ɪ k ɛ m	h aɪ r ɛ t ɪ k ʊ m
k ɪ w ɪ k ʊ m	k iː w ɪ k ʊ m
d ɛ k l aː m aː r ɛ	d eː k l aː m aː r ɛ
a tː ɛ m p ɛ ɛ r a r ɛ	a tː ɛ m p ɛ r aː r ɛ
d ɛ k ɛ p t ɪ w ʊ m	d ɛ k ɛ p t iː w ʊ m
t r a n s f ɛ r ɛ r ɛ	t r aː n s f ɛ rː ɛ
t r a n kʷ ɪ lː ʊ m	t r a ŋ kʷ ɪ lː ʊ m
p r ɔ s p ɛ r aː r ɛ	p r ɔ s p ɛ r aː r ɛ
k ɔ n k aː t ɛ n aː r ɛ m	k ɔ ŋ k a t eː n aː r ɛ
a ŋ p l ʊ m	a m p l ʊ m
h ʊ ŋ g ɛ r ɛ	ʊ ŋ g ɛ r ɛ
k a l k aː ʊ m	k a l k aː n ɛu m
aʊ r ɪ g aː	aʊ r iː g a m
r ɪ s ʊ m	r iː s ʊ m
w ɛ k ɛ m	w ɪ k ɛ m
t ʊ m	t ʊː m
r aʊ k ʊ m	r aʊ k ʊ m
d ɛ m ɔ m s t r aː r ɛ m	d eː m oː n s t r aː r ɛ
a dː ɪ k t ʊ m	a dː ɪ k t ʊ m
ɔ r d ɪ n aː t oː r	ɔ r d ɪ n aː t oː r ɛ m
a s k ɛ n s j oː n ɛ m	a s k eː n s j oː n ɛ m
p a r s ɪ m oː n j a m	p a r k ɪ m oː n j a m
t r a n s p oː r t aː r ɛ	t r aː n s p ɔ r t aː r ɛ
p ɛ k uː n j aː r j ʊ m	p ɛ k uː n j aː r j ʊ m
t a b ʊ m l a m	t a b ʊ l a m
p ʊ r k ɛ lː ʊ m	p ɔ r k ɛ lː ʊ m
k ɔ n t ɪ n w ʊ m	k ɔ n t ɪ n ʊː m
m a n t ɛ b ʊ m	m a ŋ k ɪ p ɛ m
b ɛ rː k oː	w ɛ rː ɛ m
d ɪ k t aː m ɛ n	d ɪ k t aː m ɛ n
ɪ n d aː g aː r ɛ	ɪ n d aː g aː r ɛ
m ɔ n t oː s ʊ m	m ɔ n t ʊ oː s ʊ m
b ɛ n ɛ f aː t r ɛ	b ɛ n ɛ f a k ɛ r ɛ
a b l aː k t aː r ɛ	a b l a k t aː r ɛ
p ɛ r s ɛ k uː t oː r ɛ m	p ɛ r s ɛ k uː t oː r ɛ m
s ʊ b r ʊ m g aː r ɛ	s ʊ b r ɔ g aː r ɛ
s a p oː n ɛ	s aː p oː n ɛ m
r a s uː r a m	r aː s uː r a m
ɔ b ɛ d ɛ m t ɛ r ɛ	ɔ b ɔ ɪ d iː r ɛ
s p ɔ l j ʊ m	s p ɔ l j ʊ m
a n ɪ s	a n iː s ʊ m
p a pː aː r ɛ	p a pː aː r ɛ
p a l ʊ s t r ɛ m	p a l uː s t r ɛ m
g ɪ r aː r ɛ	g y r aː r ɛ
k ɪ p a m	k eː p a m
f a b r ɪ k aː t j oː n ɛ m	f aː b r ɪ k aː t j oː n ɛ m
k a t ɛ lː ʊ m	k a t ɛ lː ʊ m
k ʊ n aː t ʊ m	k ɔ ŋ n aː t ʊ m
t r a n s ʊ b s t a n t j aː r ɛ	t r aː n s ʊ b s t a n t j aː r ɛ
m ɪ ŋ ŋ aː m	m ɛ n t ʊ l a m
t ɔ r ʊ m	t aʊ r ʊ m
ɪ m p ɛ r aː t oː r j ʊ m	ɪ m p ɛ r aː t oː r j ʊ m
m eː n s a m	m eː n s a m
k ɛ r k aː r ɛ	k ɪ r k aː r ɛ
d ɛ n t ɪ f r ɪ k ʊ m	d ɛ n t ɪ f r ɪ k j ʊ m
d ɛ t ɛ n ɛ r ɛ	d eː t ɪ n eː r ɛ
r uː m oː r ɛ	r uː m oː r ɛ m
ɪ n s ʊ l s ʊ m	iː n s ʊ l s ʊ m
t uː	t uː
r ɛ t ɔ r k ɛ r ɛ	r ɛ t ɔ r kʷ eː r ɛ
s ɔ m ɪ ɛ r ɛ m	s a g m aː r j ʊ m
d ʊ l t ɪ s oː n ʊ m	d ʊ l k ɪ s ɔ n ʊ m
r ʊ t ʊ m	r oː s k ɪ d ʊ m
ɛ l ɛ f a n t ɪ n ʊ m	ɛ l ɛ pʰ a n t ɪ n ʊ m
p r ɔ p aː g aː t j oː n ɛ m	p r oː p aː g aː t j oː n ɛ m
w ɛ r s ɪ k ʊ l ʊ m	w ɛ r s ɪ k ʊ l ʊ m
