ɪ l ʊ m	h iː l ʊ m
k a s t aː n a m	k a s t a n ɛ a m
p ɪ kː ʊ m	p iː k ʊ m
k ɔ n d uː k ɛ r ɛ	k ɔ n d uː k ɛ r ɛ
k ɪ r k ʊ m w ɛ n ɪ r ɛ m	k ɪ r k ʊ m w ɛ n iː r ɛ
j uː r aː t oː r ɛ	j uː r aː t oː r ɛ m
r a p ɪ r ɛ	r a p ɛ r ɛ
l a p ɪ d aː t j ʊ m n ɛ m	l a p ɪ d aː t j oː n ɛ m
a r k j a m	a r kʰ j a m
a r m aː m ɛ n t ʊ m	a r m aː m ɛ n t ʊ m
k r eː d ɛ n t j a m	k r eː d ɛ n t j a m
ɪ n mː ʊ t aː r ɛ	ɪ mː uː t aː r ɛ
r ɪ p a m	r iː p a m
d ɪ s t r ʊ t k j oː n ɛ m	d eː s t r ʊ k t j oː n ɛ m
d ɛ f ɔ r m ɛ m	d eː f oː r m ɛ m
s ɪ n k ɛ r ʊ m	s ɪ ŋ k eː r ʊ m
ɛ k ʊ ŋ	ɛ kː ʊ m
b oː b ʊ m	b a l b ʊ m
b ɛ n ɛ d ɛ t ʊ m	b ɛ n ɛ d ɪ k t ʊ m
a r d ʊ m	a r d ʊː m
m a k l ʊ s ʊ m	m a k ʊ l oː s ʊ m
k ɛ lː a m	k ɛ lː a m
p ɔ pː a m	p ʊ pː ɛ m
k a pː l ʊ m	k a p ʊ l ʊ m
l ɛ t ɛ r a m	l ɪ tː ɛ r a m
ɔ r k ʊ m	ɔ r k ʊ m
p ɛ l ɪ m b oː lː aː r ɛ	p ɛ r a m b ʊ l aː r ɛ
w ɪ p ʊ r a m	w iː p ɛ r a m
m uː n ɪ f ɪ k ɛ n t j a m	m uː n ɪ f ɪ k ɛ n t j a m
ɪ p r ɔ b ɪ t aː t ɛ m	ɪ m p r ɔ b ɪ t aː t ɛ m
k ɛ f aː l eːa	k ɛ pʰ a l aɪ a m
r ʊ g ɪ n ɛ	aɪ r uː g ɪ n ɛ m
r ɛ w ɔ k aː r ɛ	r ɛ w ɔ k aː r ɛ
f ɔ r t ʊ ɪ t ʊ m	f ɔ r t ʊ iː t ʊ m
a r ɪ n oː s ʊ m	a r eː n oː s ʊ m
m ɛ n t ʊ m	m ɛ n t ʊ m
a s t ʊ r ɛ	a s t ʊ r ɛ m
k ɛ g aː r ɛ	k aɪ k aː r ɛ
ɪ w ɪ k t ɛ	iː b ɪ k ɛ m
a k a n t ʊ m	a k a n tʰ ʊ m
d ɛ k ɔ rː ɛ r m ɛ	d eː k ʊ rː ɛ r ɛ
l ʊ s t r ʊ m	l ʊ s t r ʊ m
d ɛ l ɪ t j a m	d eː l ɪ k j aː s
k a l oː r ɛ	k a l oː r ɛ m
k a l ɪ k ɛ m	k a l ɪ k ɛ m
t ɔ r t ɪ l ɛ	t ɔ r t ɪ l ɛ m
k a m p ɛ s t r ɛ m	k a m p ɛ s t r ɛ m
f ʊ l w ʊ m	f ʊ l w ʊ m
p r ɛ s t aː r ɛ	p r aɪ s t aː r ɛ
r ɪ p ʊ d j aː r ɛ	r ɛ p ʊ d j aː r ɛ
a b uː s ɪ w ʊ m	a b uː s iː w ʊ m
p a r s ɪ m oː n j a m	p a r k ɪ m oː n j a m
s ɛ k r ɪ t ʊ m	s k r iː p t ʊ m
d ɛ s ʊ l t oː r j ʊ m	d eː s ʊ l t oː r j ʊ m
s ɔ m n ɪ f ɛ r ʊ m	s ɔ m n ɪ f ɛ r ʊ m
w ɛ n t ʊ m	w ɛ n t ʊ m
p a l ʊ d aː m ɛ n t ʊ m	p a l uː d aː m ɛ n t ʊ m
k a m p j oː n ɛ m	k a m p j oː n ɛ m
ɔ b t ɛ n ɛ r ɛ	ɔ b t ɪ n eː r ɛ
ɪ n b ɛ r n aː l ɛ	h iː b ɛ r n aː l ɛ m
t ɛ m ɛ r ɪ t aː t ɛ m	t ɛ m ɛ r ɪ t aː t ɛ m
p l aː n oː	p l aː n ʊ m
t a b ʊ l a m	t a b l a m
a n t aː r ɛ	j ɛ n t aː r ɛ
l ɪ b ɛ r aː t oː r ɛ	l iː b ɛ r aː t oː r ɛ m
n a rː aː t j oː n ɛ m	n aː rː aː t ʊ m
w ɪ n k ʊ l aː r ɛ	w ɪ ŋ k ʊ l aː r ɛ
a j ʊ n oː	j eː j uː n j ʊ m
l ɛ k ʊ m	l aː ɪ k ʊ m
s ɛ rː a m	s ɛ rː a m
ɪ n aʊ d ɪ t ʊ m	ɪ n aʊ d iː t ʊ m
s k ɪ n t ɪ lː aː r ɛ m	s k ɪ n t ɪ lː aː r ɛ
kʷ a d r ʊ p l a m r ɛ	kʷ a d r ʊ p l aː r ɛ
t r aː d ɪ t oː r ɛ	t r aː d ɪ t oː r ɛ m
kʷ ɔ t ɪ d j aː n ʊ m	kʷ ɔ t iː d j aː n ʊ m
p ɛ r ɪ t j a m	p ɛ r iː t j a m
k ɛ r w a m	k ɛ r w a m
n aʊ s ɛ a m	n aʊ s j a m
p ɔ r t j oː n	p ɔ r t j oː n ɛ m
r ɛ p uː b l ɪ k a m	r ɛ m p uː b l ɪ k a m
uː m ɪ l j aː t j oː n ɛ m	h ʊ m ɪ l j aː t j oː n ɛ m
d ɛ m ɔ m s t r aː t j oː n ɛ m	d eː m oː n s t r aː t j oː n ɛ m
p r ɔ w ɔ k aː t ɪ w ʊ m	p r oː w ɔ k aː t iː w ʊ m
ɛ r ɪ m ʊ m	ɛ r eː m ʊ m
b oː a t ʊ m	b ɔ aː t ʊ m
p r ɔ f ɪ t ʊ m	p r oː f ɛ k t ʊ m
d ʊ w eː r ɛ	d eː b eː r ɛ
m a s k l ʊ m m	m a s k ʊ l ʊ m
f ɔ sː aː t ʊ m	f ɔ sː aː t ʊ m
b aː s j aː r ɛ	b aː s j aː r ɛ
s uː fː ɪ k j ɛ n t j a m	s ʊ fː ɪ k ɪ ɛ n t j a m
a r ɔ m aː t ɪ k ʊ m	a r oː m a t ɪ k ʊ m
a k ʊ m ɛ n	a k uː m ɛ n
g ɛ r m ɛ m n	g ɛ r m ɛ n
a kː uː s aː t oː r j ʊ m	a kː uː s aː t oː r j ʊ m
r ɛ p oː n ɛ	r ɛ p oː n ɛ r ɛ
a s k ɛ n s j oː n ɛ m	a s k eː n s j oː n ɛ m
ɛ l ɪ d ɛ r ɛ	eː l iː d ɛ r ɛ
m a n d aː r ɛ	m a n d aː r ɛ
f r ɔ n t oː n ɛ m	f r ɔ n t oː n ɛ m
k ɔ r ɛ	k ɔ r
r ɔ k d r ɛ ɪ k ʊ m n ɛ m	r ɪ d ɪ k a m
r ɛ f l ʊ ɪ r ɛ	r ɛ f l ʊ ɛ r ɛ
a r m aː d j ʊ m	a r m aː r j ʊ m
w ɛ n j a m	w ɛ n j a m
f ɔ lː ɪ k ɛ l ʊ m	f ɔ lː ɪ k ʊ l ʊ m
m ɔ r d aː k ɛ	m ɔ r d aː k ɛ m
p ɔ t r ɛ m	p ʊ t r ɛ m
k s p ʊ r g aː r ɛ	ɛ k s p ʊ r g aː r ɛ
l ɪ b aː r ɛ	l iː b aː r ɛ
p ɛ r m aː n ɛ t ɛ r ɛ m	p ɛ r m a n eː r ɛ
a t r aː m ɛ n t ʊ m m	aː t r aː m ɛ n t ʊ m
aʊ d ɪ t oː r j ʊ m	aʊ d iː t oː r j ʊ m
a k t oː r ɛ	aː k t oː r ɛ m
ɪ r ɔ g aː r ɛ	ɪ rː ɔ g aː r ɛ
r ɛ k ɪ t aː t j oː n ɛ m	r ɛ k ɪ t aː t j oː n ɛ m
ɪ lː aː t j oː n ɛ m	ɪ lː aː t j oː n ɛ m
k a p aː k ɛ	k a p aː k ɛ m
a b s t ɛ n ɛ r ɛ	a b s t ɪ n eː r ɛ
w ɪ k ʊ m	w iː k ʊ m
f ɔ d ɪ r	f ɔ d ɛ r ɛ
s uː p ɛ r j oː r ɛ	s ʊ p ɛ r j oː r ɛ m
s k r ʊ t aː r ɛ	s k r uː t aː r ɛ
ɪ t aː l j aː n ʊ m	iː t a l j aː n ʊ m
r a k ɪ m oː s ʊ m	r a k eː m oː s ʊ m
l a m ɛ n t ʊ m	l aː m ɛ n t ʊ m
k ɔ n d ɛ n s aː r ɛ	k ɔ n d eː n s aː r ɛ
m ɛ d ɪ t aː b ʊ n t ʊ m	m ɛ d ɪ t aː b ʊ n d ʊ m
l ɪ g aː m ɛ n t ʊ m	l ɪ g aː m ɛ n t ʊ m
f r ɔ n t aː l ɛ	f r ɔ n t aː l ɛ m
r ɪ s t aʊ r aː r ɛ	r ɛ s t aʊ r aː r ɛ
k r ɛ p aː t uː r a m	k r ɛ p aː t uː r a m
p a k aː r ɛ	p aː k aː r ɛ
k a r a m	k a r a m
f l uː ɪ r ɛ	f l ʊ ɛ r ɛ
k ɔ n k ʊ l k aː r ɛ	k ɔ ŋ k ʊ l k aː r ɛ
a l g oː r ɛ	a l g oː r ɛ m
d ɪ sː ɪ m ɪ l ɛ	d ɪ sː ɪ m ɪ l ɛ m
m ɛ r ɛ t r ɪ k j ʊ m	m ɛ r ɛ t r iː k j ʊ m
g ʊ w ɛ n t ʊ t ɛ m	j ʊ w ɛ n t uː t ɛ m
s ɔ r t ɛ m	s ɔ r t ɛ m
l a ŋ gʷ ɪ d ʊ m	l a ŋ gʷ ɪ d ʊ m
g r aː w ɪ d ʊ m	g r a w ɪ d ʊ m
a p l ɪ t oː d ɪ	a m p l ɪ t uː d ɪ n ɛ m
k ɔ m p l aː k ɛ r ɛ	k ɔ m p l a k eː r ɛ
l ɛ g aː t ʊ m	l eː g aː t ʊ m
n a s ʊ t ʊ m	n aː s uː t ʊ m
a d ɔ r aː r ɛ	a d oː r aː r ɛ
p r j ɔ r ɛ	p r j oː r ɛ m
ɪ n g ʊ n t j ʊ m n ɛ m	ɪ n j ʊ ŋ k t j oː n ɛ m
s p ɪ n aː l ɛ	s p iː n aː l ɛ m
w ɛ s k ʊ m m	w eː s k ʊ m
k a l k aː r ɛ ʊ m	k a l k aː r j ʊ m
m a mː ɛ lː a m	m a m ɪ lː a m
ɪ n w ɪ g ɪ l aː r ɛ	ɪ n w ɪ g ɪ l aː r ɛ
a w iː ʊ m	a w ɛ m
t ɪ m oː r ɛ	t ɪ m oː r ɛ m
d ɪ s k r ɛ t j oː n ɛ m	d ɪ s k r eː t j oː n ɛ m
t ʊ b ɛ r ɔ s ʊ m	t uː b ɛ r oː s ʊ m
m ɛ d ʊ m	m ɛ t ʊ m
w ɛ t ʊ s t ɛ m	w ɛ t ʊ s t aː t ɛ m
p a l j ʊ m	p a lː j ʊ m
ɔ d oː r ɛ	ɔ d oː r ɛ m
k aː pː oː n ɛ	k aː p oː n ɛ m
a s aː r ʊ m	a s a r ʊ m
h ɛ r ʊ m	aː r j ʊ m
ɔ k k ɪ d ɛ n t ɛ m	ɔ kː ɪ d ɛ n t ɛ m
ɪ d oː n ɛ ʊ m	ɪ d oː n ɛu m
k ɔ n s t a n t j a m	k oː n s t a n t j a m
k ɔ n f l uː iː r ɛ	k oː n f l ʊ ɛ r ɛ
a l w ɛ ʊ m	a l w ɛu m
n ʊ m ɛ r aː r ɛ	n ʊ m ɛ r aː r ɛ
d ʊ l ʊ r oː s ʊ m	d ɔ l oː r oː s ʊ m
p ɛ r w ɛ r t ɪ r ɛ	p ɛ r w ɛ r t ɛ r ɛ
f ʊ n t a n a m	f ɔ n t aː n a m
g l aː k ʊ m	g l a k ɪ ɛ m
b ɛ t m aː a m	b eː t a m
g l aː j oː l ʊ m	g l a d ɪ ɔ l ʊ m
k ɛ k ʊ m	k aɪ k ʊ m
ɪ n f a n t j a m	iː n f a n t j a m
l a t ɪ f ʊ n d j ʊ m	l aː t ɪ f ʊ n d j ʊ m
t r aː d ɪ r ɛ	t r aː d ɛ r ɛ
k ɔ lː ɛ g j ʊ m	k ɔ lː eː g j ʊ m
n ɔ m ɪ n aː r ɛ	n oː m ɪ n aː r ɛ
m ɔ r aː l ɪ d aː t ɛ m	m oː r aː l ɪ t aː t ɛ m
t r aː m ɪ t ɛ r ɛ	t r aː m ɪ tː ɛ r ɛ
l ɪ b ɛ r aː l ɪ t aː t ɛ m	l iː b ɛ r aː l ɪ t aː t ɛ m
s a l aː t ɪ t aː t ɛ m	s a l aː k ɪ t aː t ɛ m
ɪ m p l ɔ r aː r ɛ	ɪ m p l oː r aː r ɛ
f a k ʊ n d ʊ m	f aː k ʊ n d ʊ m
r a z ɔ n aː b ʊ l ɛ	r a t j oː n aː b ɪ l ɛ m
s ʊ r k ɪ r ɛ	s a r k iː r ɛ
d ɪ sː ɛ kː aː r ɛ	d eː s ɪ kː aː r ɛ
kʷ a d r ɪ l aː t ɛ r ʊ m	kʷ a d r ɪ l a t ɛ r ʊ m
s ʊ s p ɪ r ʊ m	s ʊ s p ɪ r j ʊ m
d oː n ʊ m	d oː n ʊ m
w ɔ l ʊ b ɪ l ɛ	w ɔ l uː b ɪ l ɛ m
f ʊ l ɛ k aː r ɛ	f ɔ lː ɪ k aː r ɛ
r ʊ t ɪ l aː r ɛ	r ʊ t ɪ l aː r ɛ
m a d r ɛ	m aː t r ɛ m
a sː uː m ɛ r ɛ	a sː uː m ɛ r ɛ
w ɛ r aː k ɛ	w eː r aː k ɛ m
m ɛ m b r aː n aː k ɛ ʊ m	m ɛ m b r aː n aː k ɛu m
m ɪ s k ɛ lː aː n ɛ ʊ m	m ɪ s k ɛ lː aː n ɛu m
r ɪ s ʊ m	r iː s ʊ m
l uː p ɪ n ʊ m	l ʊ p iː n ʊ m
ɔ r ɪ f ɪ k ʊ m	h ɔ rː ɪ f ɪ k ʊ m
ɪ n t r ɪ n t ɛ k ʊ m	ɪ n t r iː n s ɛ k ʊ m
p uː p ɪ lː ʊ m	p uː p ɪ lː ʊ m
r a b ʊ l a m	r a b ʊ l a m
ɛ t ɛ r ɛ	aɪ tʰ ɛ r ɛ m
ɔ s p ɛ d aː r ɛ	h ɔ s p ɪ t aː r iː
ɛ k s ʊ l t aː	ɛ k s ʊ l t aː r ɛ
p r ɔ k ɛ d ɛ r ɛ	p r oː k eː d ɛ r ɛ
n a l ɪ k a m	n a t ɛ m
p a l ʊ d ɛ m	p a l uː d ɛ m
a g ɪ r ɛ	a g ɛ r ɛ
l k ɔ t oː n ɛ m	m aː l ʊ m k ɔ t oː n j ʊ m
w ɛ n t r ɛ m	w ɛ n t r ɛ m
k a l aː r ɛ	kʰ a l aː r ɛ
k ɔ m p ɛ t ɪ t j oː n ɛ m	k ɔ m p ɛ t iː t j oː n ɛ m
r ɪ k ɛ p t aː t oː r ɛ m	r ɛ k ɛ p t aː t oː r ɛ m
p ɛ t ʊ m	p eː d ɪ t ʊ m
ɪ m b ɪ b ɛ r ɛ	ɪ m b ɪ b ɛ r ɛ
s uː d aː r ɛ	s uː d aː r ɛ
l ɪ m ɪ t r oː f ɛ m	l iː m ɪ t r ɔ pʰ ʊ m
a w aː l aː n k ɛ m	l aː b iː n a m
m ɛ r ɪ t ɛ r ɛ	m ɛ r eː r ɛ
m ɪ n ɔ r aː r ɛ	m ɪ n oː r aː r ɛ
r ɛ k uː s aː r ɛ	r ɛ k uː s aː r ɛ
w ɛ n ɛ r aː r ɛ	w ɛ n ɛ r aː r iː
k a p ɪ t ɛ lː ʊ m	k a p ɪ t ɛ lː ʊ m
t ɔ s oː n ɛ m	t oː n s j oː n ɛ m
s a l aː r j ʊ m	s a l aː r j ʊ m
p r ɛ g ʊ s t a m r ɛ	p r aɪ g ʊ s t aː r ɛ
l a k t aː r ɛ	l a k t aː r ɛ
ɪ n f ɛ r m iː t aː t ɛ m	iː n f ɪ r m ɪ t aː t ɛ m
a nː ɪ k ɪ l aː t j oː n ɛ m	a nː ɪ h ɪ l aː t j oː n ɛ m
ɔ p uː l ɛ n t ʊ m	ɔ p ʊ l ɛ n t ʊ m
s ʊ b t ɪ l ɛ	s ʊ b t iː l ɛ m
t r a n s ɪ t ʊ m	t r aː n s ɪ t ʊ m
w ɛ r g ɪ n ɛ	w ɪ r g ɪ n ɛ m
m uː s k ʊ l aː r ɛ	m uː s k ʊ l aː r ɛ m
a r z ɪ n ɛ	a gː ɛ r ɛ m
ɛ n ɛ r w aː r ɛ	eː n ɛ r w aː r ɛ
f aʊ k ɛ m	f aʊ k eː s
p r ɛ t ɛ r n aː t uː r aː l ɛ m	p r aɪ t ɛ r n aː t uː r aː l ɛ m
ɛ k s ɪ t ʊ m	ɛ k s ɪ t ʊ m
m p ɪ l aː r ɛ	p ɪ l aː r ɛ
w ɛ g ɛ t ʊ m	w ɛ g ɛ t ʊ m
ɪ m p j ʊ m	ɪ m p j ʊ m
d ɛ t ɛ r g ɛ r ɛ	d eː t ɛ r g eː r ɛ
b a r k a m	b a r k a m
a d aː m a n t ɛ m	a d a m a n t ɛ m
m a n t ʊ m	m aː n s ʊ eː t ʊ m
g a rː ɪ r ɛ	g a rː iː r ɛ
r ɛ w ɛ n ɪ r ɛ	r ɛ w ɛ n iː r ɛ
d ɛ k ɪ m aː l ɛ	d ɛ k ɪ m a l ɛ m
m ɛ s uː r aː r ɛ	m eː n s uː r aː r ɛ
a r g ɪ n t oː s ʊ m	a r g ɛ n t oː s ʊ m
k ʊ r t aː r ɛ	k ʊ r t aː r ɛ
r a m ʊ m	r aː m ʊ m
m a t uː r ʊ m	m aː t uː r ʊ m
k ɔ n w ɛ k sː ʊ m	k ɔ n w ɛ k s ʊ m
ɔ b s t aː r ɛ	ɔ b s t aː r ɛ
k aː n ʊ m	k aː n ʊ m
p ʊ ɛ r ɪ l ɪ t aː t ɛ m	p ʊ ɛ r iː l ɪ t a t ɛ m
p r ɔ m ɪ sː j oː n ɛ	p r ɔ m ɪ sː j oː n ɛ m
k ɪ k m ʊ m	k ɪ kː ʊ m
t r a n s f ɛ r ɛ r	t r aː n s f ɛ rː ɛ
a sː ɛ r ɪ r ɛ	a sː ɛ r ɛ r ɛ
d uː r aː k ɪ n ʊ m	d uː r a k ɪ n ʊ m
s a r k ɪ n a m	s a r k ɪ n a m
h ɛ k s ɪ r ɛ	ɛ k s iː r ɛ
t ɔ r t oː n	t ɔ r t j oː n ɛ m
r a d ɪ k j ʊ m	r aː d iː k ʊ l a m
n ɪ w ɛ ʊ m	n ɪ w ɛu m
a k t ʊ m	aː k t ʊ m
k ɛ r t aː r ɛ	k ɛ r t aː r ɛ
l a k r ɪ m oː s ʊ m	l a k r ɪ m oː s ʊ m
d ɛ b ɛ lː aː r ɛ	d eː b ɛ lː aː r ɛ
a w ʊ m	a w ʊ m
k ɔ n f ʊ t aː r ɛ	k oː n f uː t aː r ɛ
k ɔ l oː n ʊ m	k ɔ l oː n ʊ m
n ɛ s p ɛ l ʊ m	m ɛ s p ɪ l ʊ m
t r a s k ɛ n d ɛ r iː	t r aː n s k ɛ n d ɛ r ɛ
k ɪ b aː r ɛ	k ɪ b aː r ɛ
t r aː k j ʊ m	tʰ r aː k j ʊ m
w ɛ r ɛ k ʊ n d ʊ m	w ɛ r eː k ʊ n d ʊ m
d ɪ sː ɛ kː aː t j oː n ɛ m	d eː s ɪ kː aː t j oː n ɛ m
a p ɛ ɛ l a m	a p ɪ k ʊ l a m
a s ɛ r t j oː n ɛ m	a sː ɛ r t j oː n ɛ m
a pː j ʊ m	a p j ʊ m
f ɪ d ɛ l ɛ	f ɪ d eː l ɛ m
f ɛ r m ɛ n t aː t j oː n ɛ m	f ɛ r m ɛ n t aː t j oː n ɛ m
s a n t ʊ m	s aː ŋ k t ʊ m
k ʊ p ʊ l aː r ɛ	k oː p ʊ l aː r ɛ
s kʷ aː m a m	s kʷ aː m a m
r ʊ s t ɪ k aː n ʊ m	r uː s t ɪ k aː n ʊ m
ɔ w eː l a m	ɔ w ɪ k ʊ l a m
p l aː n ɪ t j ɛ m	p l aː n ɪ t ɪ ɛ m
k a l ɛ n d aː s	k a l ɛ n d aː s
j oː n ɪ r ɔ s oː l ɪ m ɪ t m n ʊ m	h ɪ ɛ r ɔ s ɔ l y m iː t aː n ʊ m
p r ɔ n ɔ s t ɪ k	p r ɔ ŋ n oː s ɛ m
kʷ ɛ t a n t a m	kʷ ɪ eː t a n t j a m
ɔ p ɛ r aː r ɛ	ɔ p ɛ r aː r iː
f uː g aː k ɛ	f ʊ g aː k ɛ m
t r aː l a m	t r aː g ʊ l a m
ɪ d ɔ n ɛ m aː t ɛ m	ɪ d oː n ɛ ɪ t aː t ɛ m
a kʷ ɪ f ʊ l ʊ m	a kʷ ɪ f ɔ l j ʊ m
s k uː t ɪ ɛ r ʊ m	s k uː t aː r j ʊ m
s uː b ɔ r n aː r ɛ	s ʊ b oː r n aː r ɛ
ɔ s t ɛ n s ɪ w ʊ m	ɔ s t eː n s iː w ʊ m
s ɔ lː ɪ k ɪ t aː t j oː n ɛ m	s ɔ lː ɪ k ɪ t aː t j oː n ɛ m
d ɪ w ɪ n aː r ɛ	d iː w iː n aː r ɛ
m eː s a m	m eː s a m
k r ɪ m ɪ n aː t j oː n ɛ m	k r iː m ɪ n aː t j oː n ɛ m
f l oː r iː r ɛ	f l oː r eː r ɛ
a nː oː s ʊ m	a nː oː s ʊ m
k a d ʊ k ʊ m	k a d uː k ʊ m
a l t ɪ t uː d ɪ n ɛ m	a l t ɪ t uː d ɪ n ɛ m
k ɛ r t ʊ m	k ɛ r t ʊ m
n ɔ t ɔ r j ʊ m	n oː t oː r j ʊ m
r ɛ s ʊ s k ɪ t aː t j oː n ɛ m	r ɛ s ʊ s k ɪ t aː t j oː n ɛ m
p a l p ɛ b r a m	p a l p ɛ b r a m
k ɔ rː ɔ d ɛ r ɛ	k ɔ rː oː d ɛ r ɛ
k r ɛ s p ʊ m	k r ɪ s p ʊ m
s uː k k j n aː r ɛ	s uː g ɛ r ɛ
d ɛ n t aː l ɛ	d ɛ n t aː l ɛ m
m ɛ d ɪ k aː m ɛ n t ʊ m	m ɛ d ɪ k aː m ɛ n t ʊ m
f a s t ɪ d j oː s ʊ m	f a s t iː d j oː s ʊ m
s ʊ b t r aː k t j oː n ɛ m	s ʊ b t r a k t j oː n ɛ m
f a s k ɛ m	f a s k ɛ m
p r ɛ p oː s t ɛ m	p r aɪ p ɔ s ɪ t ʊ m
ɛ fː ɛ k t ɪ w ʊ m	ɛ fː ɛ k t iː w ʊ m
k r ɪ b r aː r ɛ	k r iː b r aː r ɛ
k ʊ r w aː r ɛ	k ʊ r w aː r ɛ
b ɔ l ɛ t ʊ m	b oː l eː t ʊ m
d ɛ f ɛ k t j oː n ɛ m	d eː f ɛ k t j oː n ɛ m
p r ɔ m ɔ n t oː r j ʊ m	p r oː m ʊ n t ʊ r j ʊ m
ɪ m p ɛ r aː r ɛ	ɪ m p ɛ r aː r ɛ
s ɛ rː ɛ ɪ n	s ɛ rː aː g ɪ n ɛ m
d ɛ n ɔ m ɪ n aː t j oː n ɛ m	d eː n oː m ɪ n aː t j oː n ɛ m
ɛ s k ɔ p r ʊ m	s k a l p r ʊ m
f ɔ r n ɪ k aː r ɛ	f ɔ r n ɪ k aː r iː
ɛ k l ɪ p sː ɛ	ɛ k l iː p s ɛ m
a d uː l aː r ɛ	a d uː l aː r iː
aː k eː r ʊ m	aː k r ɛ m
ɪ m p ɛ t r aː r ɛ	ɪ m p ɛ t r aː r ɛ
d ɛ p r ɛ k aː r ɛ	d eː p r ɛ k aː r iː
d ɪ s p aː r ɪ t r ɛ	d ɪ s p a r eː r ɛ
ɛ r ɔ g aː r ɛ	eː r ɔ g aː r ɛ
b aː j ʊ m	b a d j ʊ m
ɔ l ʊ m	ɔ l ʊ m
aʊ r a m	aʊ r a m
a p r ɪ r ɛ	a p ɛ r iː r ɛ
k ɔ ɛ r t ɪ t j oː n ɛ m	k ɔ ɪ r k ɪ t j oː n ɛ m
a kʷ ɪ l ɪ n ʊ m	a kʷ ɪ l iː n ʊ m
t r ɔ n ʊ m	tʰ r ɔ n ʊ m
t ɔ r ʊ w ɪ s k ʊ m	t ʊ r b ɪ s k ʊ m
m a ŋ g aː r ɛ	m a n d uː k aː r ɛ
m iː g ɛ r ɛ	m eː j ɛ r ɛ
a d ʊ n t ʊ m	a d j ʊ ŋ k t ʊ m
p ɛ r m ɪ sː j oː n ɛ m	p ɛ r m ɪ sː j oː n ɛ m
s p ɛ t j ɛ m	s p ɛ k ɪ ɛ m
p l a n t aː r ɛ	p l a n t aː r ɛ
g a t a m	k a tː a m
k a n t oː r ɛ	k a n t oː r ɛ m
p ɪ k t oː r ɛ	p ɪ k t oː r ɛ m
ɪ n w ɪ d j a m	ɪ n w ɪ d j a m
r ɛ t r aː r ɛ	r ɛ t r a h ɛ r ɛ
k ɪ b aː t j oː n ɛ m	k ɪ b aː t j oː n ɛ m
k ɔ m p aː t r ɛ m	k ɔ m p a t r ɛ m
p ɛ r s ɪ k a m	p ɛ r s ɪ k a m
a b ɪ l ɛ	aː b ɪ l ɛ m
ɪ n t ʊ ɪ r ɛ	ɪ n t ʊ eː r iː
p ɛ k t ɪ n aː r ɛ	p ɛ k t ɪ n aː r ɛ
a pː ɔ r t aː r ɛ	a pː ɔ r t aː r ɛ
m ɛ s uː r a m	m eː n s uː r a m
a g r ɛ s t ɛ m	a g r ɛ s t ɛ m
k r ʊ lː a m r ɛ	k ɔ rː ʊ ɛ r ɛ
k a r n ɛ f ɪ k ɛ m	k a r n ɪ f ɪ k ɛ m
b a p t ɪ s t ɛ r j ʊ m	b a p t ɪ s t eː r j ʊ m
p l ʊ m b ɛ ʊ m	p l ʊ m b ɛu m
f l ɔ r ɪ d ʊ m	f l oː r ɪ d ʊ m
k ɔ n t ɛ m p l aː r iː	k ɔ n t ɛ m p l aː r iː
k a l k ʊ l ʊ m	k a l k ʊ l ʊ m
ɪ n w ɪ k t ʊ m	ɪ n w ɪ k t ʊ m
ɛ k s p a n d ɛ r ɛ	ɛ k s p a n d ɛ r ɛ
ɔ r t ʊ m	h ɔ r t ʊ m
uː r l aː r ɛ	ʊ l ʊ l aː r ɛ
ɛ k s ɔ r t aː t j oː n ɛ m	ɛ k s h ɔ r t aː t j oː n ɛ m
a k k ɛ p t aː r ɛ	a kː ɪ p ɛ r ɛ
ɔ b s ɛ r w aː r ɛ	ɔ b s ɛ r w aː r ɛ
p r ɛ f ɛ r ɪ r ɛ	p r aɪ f ɛ rː ɛ
ɛ k s k r ɛ t aː r ɛ	ɛ k s k ɛ r n ɛ r ɛ
k aː r m ɪ n aː r ɛ m	k a r m ɪ n aː r ɛ
t ɛ n oː r ɛ	t ɛ n oː r ɛ m
ɪ n d aː m n ɛ m	ɪ n d ɛ m n ɛ m
l ɔ t oː s ʊ m	l ʊ t oː s ʊ m
ɪ n k ɛ n d ɛ r ɛ	ɪ ŋ k ɛ n d ɛ r ɛ
t ɪ m oː n ɛ m	t eː m oː n ɛ m
h k ɛ	kʷ ɛ m
k a n k ɛ r ʊ m	k a ŋ k r ʊ m
a fː ɛ rː ɛ r	aʊ f ɛ rː ɛ
ɪ rː ʊ m p ɛ r ɛ	ɪ rː ʊ m p ɛ r ɛ
t aː sː ʊ m n	t a k s ʊ m
ɛ n t ɛ m	ɛ n s
f uː r oː r ɛ	f uː r aː r iː
ɛ k s t aː s iː m	ɛ k s t a s ɛ m
r ɛ d ɪ k g ɛ r ɛ	r ɛ d ɪ g ɛ r ɛ
p r ɛ ɔ kː uː p aː t j oː n ɛ m	p r aɪ ɔ kː ʊ p aː t j oː n ɛ m
s ɛ r p ɛ n t ɪ n ʊ m	s ɛ r p ɛ n t iː n ʊ m
d ɪ s ɛ s p ɛ r aː t j oː n ɛ m	d eː s p eː r aː t j oː n ɛ m
a n ʊ m	aː n ʊ m
