f ɔ r n ɪ k aː r ɛ	f ɔ r n ɪ k aː r iː
k ɔ l p ʊ m	k ɔ l a pʰ ʊ m
a d w ɛ k t j oː n ɛ m	a d w ɛ k t j oː n ɛ m
ɛ k s k ɔ r j aː r ɛ	ɛ k s k ɔ r j aː r ɛ
b a r ɪ t ɔ n ʊ m	b a r y t ɔ n ʊ m
k a p r ɪ n ʊ m	k a p r iː n ʊ m
a kː uː s aː r ɛ	a kː uː s aː r ɛ
a sː ɛ r ɪ r ɛ	a sː ɛ r ɛ r ɛ
r ɪ k t ʊ s	r ɪ k t ʊ m
aʊ r ɪ r	h aʊ r iː r ɛ
f uː g aː k ɛ	f ʊ g aː k ɛ m
p r ɛ d j aː l ɛ	p r aɪ d j aː l ɛ m
a k k ɛ s ʊ m	a kː ɛ sː ʊ m
a m b ɪ gʷ ɪ t aː t ɛ m	a m b ɪ gʷ ɪ t aː t ɛ m
f r ʊ ɪ r ɛ	f r ʊ iː
k l aː j oː l ʊ m	g l a d ɪ ɔ l ʊ m
r uː g a m	r uː g a m
l a n t ɪ r ʊ m	l a ŋ k j aː r j ʊ m
uː s ʊ m	uː s ʊ m
f l ɛ k t ɛ r ɛ	f l ɛ k t ɛ r ɛ
d ɛ k ɔ k t j oː n ɛ m	d ɛ k ɔ k t j oː n ɛ m
a lː ɪ	ɪ lː ʊ ŋ k
ɔ d oː r ɛ	ɔ d oː r ɛ m
a s t aː	h a s t a m
p r ɔ d ɪ g a m r ɛ	p r oː d ɪ g ɛ r ɛ
k r ɛ d ɪ b ɪ l ɪ t aː t ɛ m	k r eː d ɪ b ɪ l ɪ t aː t ɛ m
l ɪ t aː r ɛ	l ɪ t aː r ɛ
t r a n s p oː r ɛ	t r aː n s p oː n ɛ r ɛ
l a w a m t oː r j j ʊ m	l a w aː t oː r j ʊ m
p ɔ lː aː r j ʊ m	p ʊ lː aː r j ʊ m
t ʊ r m a m	t ʊ r m a m
ɪ lː ɛ g aː l ɛ	ɪ lː eː g aː l ɛ m
t ɛ rː ɛ n ʊ m	t ɛ rː eː n ʊ m
b ɛ n ɛ d ɪ k ɛ r ɛ	b ɛ n ɛ d iː k ɛ r ɛ
n ʊ m ɛ r oː s ʊ m	n ʊ m ɛ r oː s ʊ m
s ʊ r g ɪ r ɛ	s ʊ r g ɛ r ɛ
fː uː m eː aː r ɛ	f uː m ɪ g aː r ɛ
k ɔ n f ɛ d ɛ r aː t j oː n ɛ m	k oː n f ɔ ɪ d ɛ r aː t j oː n ɛ m
p a l m ʊ m	p a l m ʊ m
t ɔ s oː n ɛ m	t oː n s j oː n ɛ m
p r ɔ s t r aː r ɛ	p r oː s t ɛ r n ɛ r ɛ
ɪ ŋ g ɛ n j ʊ m s ʊ m	ɪ ŋ g ɛ n j oː s ʊ m
s uː b ɪ lː a m	s uː b ʊ l a m
l a d r ɪ l ʊ m	l a t ɛ r k ʊ l ʊ m
k ɛ r oː s ʊ m	k eː r oː s ʊ m
m ɪ n ɔ r aː r ɛ	m ɪ n oː r aː r ɛ
ɛ s p ɪ r a m r ɛ	s p iː r aː r ɛ
w ɛ r t ɛ r ɛ	w ɛ r t ɛ r ɛ
ɪ n t ɛ k r ʊ m	ɪ n t ɛ g r ʊ m
m ɪ s t ɪ k ʊ m	m y s t ɪ k ʊ m
ɪ n t r ɪ n t ɛ k ʊ m	ɪ n t r iː n s ɛ k ʊ m
w ɛ t ʊ s t aː	w ɛ t ʊ s t aː t ɛ m
k ɔ n k ʊ r s ʊ m	k ɔ ŋ k ʊ r s ʊ m
f uː l g ɪ r ɛ	f ʊ l g eː r ɛ
ɪ n kʷ j ɛ t uː d ɪ n ɛ m	ɪ ŋ kʷ ɪ eː t uː d ɪ n ɛ m
t ɛ m p ɔ r aː r j ʊ m	t ɛ m p ɔ r aː r j ʊ m
k ɛ g aː r ɛ	k aɪ k aː r ɛ
m ʊ n g ɪ r ɛ	m ʊ l g eː r ɛ
p ɛ k uː n j aː r j ʊ m	p ɛ k uː n j aː r j ʊ m
t r ɪ p l ʊ m	t r ɪ p l ʊ m
a b sː ɔ l b ɛ r ɛ	a b s ɔ l w ɛ r ɛ
d ɛ k ɪ m aː t j ʊ m n ɛ m	d ɛ k ɪ m aː t j oː n ɛ m
k ɔ n f ɪ r m aː t j oː n ɛ m	k oː n f ɪ r m aː t j oː n ɛ m
k ɔ r n j ʊ m	k ɔ r n ɛu m
a b l ɛ g a m t j oː n ɛ m	a b l eː g aː t j oː n ɛ m
s ʊ mː a m	s ʊ mː a m
t a m ɪ s ʊ m	t a m ɪ s j ʊ m
p ɛ r f ɪ d ʊ m	p ɛ r f ɪ d ʊ m
k ɪ d j ʊ m	k iː d j ʊ m
m ɔ t ʊ m	m ʊ tː ʊ m
w a g ɪ r ɛ	w aː g iː r ɛ
k a d ʊ k ʊ m	k a d uː k ʊ m
l ɪ n k k ɛ m	l y ŋ k ɛ m
m ɪ ŋ g ɛ r ɛ	m ɪ ŋ g ɛ r ɛ
l ɪ t ɛ	l iː t ɛ m
k ɔ n t ʊ r b a m t j oː n ɛ m	k ɔ n t ʊ r b aː t j oː n ɛ m
k ɪ m b aː l ʊ m	k y m b a l ʊ m
k ɔ k ɪ n ɪ l a m	k ɔ kː ɪ n a m
a sː ɪ n aː r ɛ	a sː ɪ ŋ n aː r ɛ
b ʊ ʊ m	b uː b oː n ɛ m
w ɛ r t ɪ g ɪ n ɛ	w ɛ r t iː g ɪ n ɛ m
g r aː t ʊ m	g r aː t ʊ m
d ɛ n t aː t ʊ m	d ɛ n t aː t ʊ m
p l aː g j ʊ m	p l a g j ʊ m
s ɪ m j ʊ m	s iː m j ʊ m
b aː s j ʊ m	b aː s j ʊ m
n ɪ d ɪ f ɔ r m ɛ	n iː d ɪ f oː r m ɛ m
k ɔ rː ɔ d ɛ r ɛ	k ɔ rː oː d ɛ r ɛ
k ɛ f aː l eːa j aː	k ɛ pʰ a l aɪ a m
d ɛ n ɛ g aː r ɛ	d eː n ɛ g aː r ɛ
p uː aː r ɛ	p ʊ t eː r ɛ
m ɔ lː ɪ k j ɛ m	m ɔ lː ɪ t ɪ ɛ m
k a n d oː r ɛ	k a n d oː r ɛ m
k a s t r ʊ m	k a s t r ʊ m
w a k ɪ lː a m t j oː n ɛ m	w a k ɪ lː aː t j oː n ɛ m
r ɛ g ʊ m	r eː g j ʊ m
ɔ fː r k ɪ r ɛ	ɔ fː ɛ rː ɛ
f eː r j a m	f eː r j aː s
n ɛ g l ɪ j ɛ r ɛ	n ɛ g l ɛ g ɛ r ɛ
b ɔ m b aː r d a m	b ɔ m b a r d a m
t aː s ʊ m n	t a k s ʊ m
t ɛ m p ɛ r aː r ɛ	t ɛ m p ɛ r aː r ɛ
g ɛ n t ɪ l ɛ m	g ɛ n t iː l ɛ m
t r a n s m ɪ t ɛ r ɛ m	t r aː n s m ɪ tː ɛ r ɛ
k r ɛ s t aː r ɛ	k r ʊ s t aː r ɛ
k ɔ r ɔ n ɪ d ɛ	k ɔ r oː n ɪ d ɛ m
m a ŋ g aː r ɛ	m a n d uː k aː r ɛ
s ɔ r ɔ r ɪ t aː t ɛ	s ɔ r oː r ɪ t aː t ɛ m
t ɪ p ʊ l a m	t ɪ pː ʊ l a m
k ɔ l ʊ m b ɪ n ʊ m	k ɔ l ʊ m b iː n ʊ m
l ɪ n a m	l iː n ɛ a m
l a k r ɪ m oː s ʊ m	l a k r ɪ m oː s ʊ m
p r ɛ t ɛ r n aː t uː r aː l ɛ m	p r aɪ t ɛ r n aː t uː r aː l ɛ m
a d ɔ r m ɛ m t ɛ r ɛ	a dː ɔ r m iː s k ɛ r ɛ
ɪ n ʊ n d aː t j ɛ m n	ɪ n ʊ n d aː t j oː n ɛ m
s t aː t ɛ r aː	s t a t eː r a m
ɪ n s aː n ʊ m	iː n s aː n ʊ m
d ɛ k s t r ʊ m	d ɛ k s t r ʊ m
d ɛ b ɪ l ɪ t aː r ɛ	d eː b ɪ l ɪ t aː r ɛ
k ʊ p ʊ l aː r ɛ	k oː p ʊ l aː r ɛ
l ɛ ɔ p aː r d ʊ m	l ɛ ɔ p a r d ʊ m
d ʊ l k ɪ f ɪ k aː r ɛ m	d ʊ l k ɪ f ɪ k aː r ɛ
r ɪ w ʊ m	r iː w ʊ m
f ɛ s t ɪ n aː r ɛ	f ɛ s t iː n aː r ɛ
p j ɛ t ɪ k a m	p ɛ d ɪ k a m
r ɪ g ʊ r oː s ʊ m	r ɪ g ɔ r ɔ s ʊ m
k a m ɪ n ʊ m	k a m iː n ʊ m
ɪ r k ɪ n ʊ m	h ɪ r k iː n ʊ m
f a b r ɪ k aː t j oː n ɛ m	f aː b r ɪ k aː t j oː n ɛ m
g ʊ s t ʊ m	g ʊ s t ʊ m
s p ʊ s a m	s p oː n s a m
p ɛ k t ɪ n aː r ɛ	p ɛ k t ɪ n aː r ɛ
f ɪ k ʊ m	f iː k ʊ m
a n aː t r aː m	a n a t ɛ m
ɔ l ʊ m	ɔ l ʊ m
r ɛ n ɔ k j ʊ m l	r aː n ʊ ŋ k ʊ l ʊ m
m a t r ɪ t ɪ t j ʊ m	m aː t r ɪ k iː d j ʊ m
p r ɛ j ʊ d ɪ t j ʊ m	p r aɪ j uː d ɪ k j ʊ m
l ɛ t ɪ t j aː m	l aɪ t ɪ t j a m
p r ɔ s ɛ m kʷ ɪ r ɛ m	p r oː s ɛ kʷ iː
r ɛ k ɪ t aː t j oː n ɛ m	r ɛ k ɪ t aː t j oː n ɛ m
m ʊ t aː r ɛ	m uː t w aː r iː
ɛ n aː rː a m t j oː n ɛ m	eː n aː rː aː t j oː n ɛ m
g ɛ ɔ m ɛ t r j aː	g ɛ oː m ɛ t r j a m
b a s ɪ l ɪ s k ʊ m	b a s ɪ l ɪ s k ʊ m
p ɔ s aː r ɛ	p aʊ s aː r ɛ
k a r b ʊ n k ʊ l ʊ m	k a r b ʊ ŋ k ʊ l ʊ m
a b g ʊ r aː t j oː n ɛ m	a b ɪ uː r aː t j oː n ɛ m
p ɔ sː ɛ d ɛ r ɛ	p ɔ sː ɪ d eː r ɛ
k ɔ m w ɪ t j ʊ m	k ɔ n w iː k j ʊ m
b a l b ʊ t j aː r ɛ	b a l b uː t iː r ɛ
d ɪ s t ɛ ŋ d ɛ r ɛ	d eː s k ɛ n d ɛ r ɛ
ɪ n t ɪ r ɛ ɛ	ɪ n t ʊ eː r iː
p r aː n d ɛ r ɛ	p r a n d eː r ɛ
p ɔ n d ɛ r aː t j ʊ m n ɛ m	p ɔ n d ɛ r aː t j oː n ɛ m
k r ʊ k ɪ f ɛ r ʊ m	k r ʊ k ɪ f ɛ r ʊ m
ɛ l ɛ w aː r ɛ	eː l ɛ w aː r ɛ
k ɛ l ɪ b eː	k aɪ l ɪ b ɛ m
ɪ m p ɛ r j aː l ɛ	ɪ m p ɛ r j aː l ɛ m
g ɛ t ʊ m	j a k t ʊ m
n ɔ t ɪ t j a m	n oː t ɪ t j a m
d ɛ s ɪ n ɛ n t a m	d eː s ɪ n ɛ n t j a m
s a t ɪ r ɪ k ʊ m	s a t ɪ r ɪ k ʊ m
ɪ n w ɪ g ɪ l aː r ɛ	ɪ n w ɪ g ɪ l aː r ɛ
k ɔ n d ɛ n s aː t j oː n ɛ m	k ɔ n d eː n s aː t j oː n ɛ m
ɪ n mː ʊ t aː r ɛ	ɪ mː uː t aː r ɛ
ɛ k k ɛ lː ɛ n t j a m	ɛ k s k ɛ lː ɛ n t j a m
n a t aː l ɪ t j ʊ m	n aː t aː l iː k j ʊ m
ɔ r aː t r ɪ k ɛ	ɔ r aː t r iː k ɛ m
a k ɪ n ʊ m	a k ɪ n ʊ m
w j ɔ l aː r ɛ	w ɪ ɔ l aː r ɛ
ɔ fː ɪ k j ʊ m	ɔ fː ɪ k j ʊ m
kʷ a l ɪ t aː t ɛ m	kʷ aː l ɪ t aː t ɛ m
a k ʊ m ɛ m	a k uː m ɛ n
ɔ r p ɪ m ɛ n t ʊ m	aʊ r ɪ p ɪ g m ɛ n t ʊ m
a w ɪ ʊ m	a w ɛ m
s k r ʊ t aː r ɛ	s k r uː t aː r iː
k r ɪ m ɪ n a m t j oː n ɛ m	k r iː m ɪ n aː t j oː n ɛ m
l ɛ g aː t ʊ m	l eː g aː t ʊ m
p r ɔ w ɛ n t ʊ m	p r oː w ɛ n t ʊ m
t aː t ɛ m	t a t ɛ m
k ɔ n s t ɪ t uː t j oː n ɛ m	k oː n s t ɪ t uː t j oː n ɛ m
t ɛ l a m m	t eː g ʊ l a m
k a l ɛ n t a m s	k a l ɛ n d aː s
k ʊ n s ɔ b r ɪ n ʊ m	k oː n s oː b r iː n ʊ m
a m ɛ n ɪ t aː t ɛ m	a m ɔ ɪ n ɪ t aː t ɛ m
ɪ n f ɛ r m ʊ m	iː n f ɪ r m ʊ m
k r ʊ r	k r ʊ oː r ɛ m
ɪ m b ɛ k ɪ lː ɪ t aː t ɛ m	ɪ m b eː k ɪ lː ɪ t aː t ɛ m
s t r ɪ ŋ g ɛ r ɛ	s t r ɪ ŋ g ɛ r ɛ
p a r ʊ m	p a r ɛ m
s ɛ k r ɪ t ʊ m	s k r iː p t ʊ m
j uː s t ʊ m	j uː s t ʊ m
p r ɔ m ɔ n t oː r j ʊ m	p r oː m ʊ n t ʊ r j ʊ m
s t r ɪ d ɛ r ɛ	s t r iː d ɛ r ɛ
k s p ʊ r g aː r ɛ	ɛ k s p ʊ r g aː r ɛ
ɔ k t aː w ʊ m	ɔ k t aː w ʊ m
k s p ɛ n d ɛ r ɛ	ɛ k s p ɛ n d ɛ r ɛ
b a s ɛ lː a m	w aː s k ɛ lː ʊ m
k ʊ m p ɪ r ɛ	k oː n s p ʊ ɛ r ɛ
a l t ɛ r k aː r ɛ	a l t ɛ r k aː r iː
p ɛ r s p ɪ k ʊ m	p ɛ r s p ɪ k ʊː m
m a g ʊ m	m a g ʊ m
n ɔ m n aː r ɛ	n oː m ɪ n aː r ɛ
l iː n t ɛ r n aː	l a n t ɛ r n a m
p ɪ p aː r ɛ	p iː p aː r ɛ
t r a m ɪ t ɛ r ɛ	t r aː m ɪ tː ɛ r ɛ
a t w ɛ r t ɪ r ɛ	a d w ɛ r t ɛ r ɛ
a d ɪ r	a dː ɛ r ɛ
k ɔ m ɛ r ɛ	k ɔ m ɛ d ɛ r ɛ
k ʊ l t r ʊ m	k ʊ l t r ʊ m
r ɛ p r ɔ w aː r ɛ	r ɛ p r ɔ b aː r ɛ
p a w ɪ d ʊ m	p a w ɪ d ʊ m
ɛ k s t ɛ m r j oː r ɛ	ɛ k s t ɛ r j oː r ɛ m
g l aː d j ʊ m m	g l a d j ʊ m
p a l p ɛ b r aː l	p a l p ɛ b r aː l ɛ m
p r ɔ s p ɛ r aː r ɛ	p r ɔ s p ɛ r aː r ɛ
r ɛ g ɛ r ɛ	r ɛ g ɛ r ɛ
p r ɔ s t ɪ t ʊ iː r ɛ m	p r oː s t ɪ t ʊ ɛ r ɛ
s k aː p ʊ l a m	s k a p ʊ l a m
m a n ɪ f ɛ m s t aː r ɛ m	m a n ɪ f ɛ s t aː r ɛ
p a s t oː r ɛ	p aː s t oː r ɛ m
p r ɔ rː ʊ m p ɛ r ɛ	p r oː r ʊ m p ɛ r ɛ
m a t uː r ʊ m	m aː t uː r ʊ m
s ɛ k s w aː l ɪ t aː t ɛ m	s ɛ k s w aː l ɪ t aː t ɛ m
p r aː w ʊ m	p r aː w ʊ m
k ʊ rː ɪ k ʊ l ʊ m	k ʊ rː ɪ k ʊ l ʊ m
t r aː b aː l	t r a b aː l ɛ m
r aʊ k ʊ m	r aʊ k ʊ m
a k t ɪ w ʊ m	aː k t iː w ʊ m
p r ɛ s k r ɪ w ɪ r ɛ m	p r aɪ s k r iː b ɛ r ɛ
a b l ʊ ɛ r ɛ	a b l ʊ ɛ r ɛ
k ɔ n d ɛ m n a m t j oː n ɛ m	k ɔ n d ɛ m n aː t j oː n ɛ m
k ɔ k ʊ m ɛ r ʊ m	k ʊ k ʊ m ɛ r ɛ m
k r uː d ɛ l ɛ	k r uː d eː l ɛ m
p r ɔ d uː k t ɪ w ʊ m	p r oː d ʊ k t iː w ʊ m
w ɛ r s aː t ɪ l	w ɛ r s aː t ɪ l ɛ m
s k oː l ʊ m	s k ɔ p ʊ l ʊ m
f eː mː ɪ n a m	f eː m ɪ n a m
d uː k aː t ʊ m	d ʊ k aː t ʊ m
r ɛ k ɛ t a m	r ɛ k ɛ p t a m
r ɛ k t ɪ t uː d	r ɛ k t ɪ t uː d ɪ n ɛ m
g r a n d ɛ m	g r a n d ɛ m
l ɪ n aː r ʊ m	l iː n aː r j ʊ m
f ɔ r t ʊ ɪ t ʊ m	f ɔ r t ʊ iː t ʊ m
a b d ʊ k t j oː n ɛ m	a b d ʊ k t j oː n ɛ m
r ʊ ɪ n oː s ʊ m	r ʊ iː n oː s ʊ m
a fː ɛ k t ʊ m	a fː ɛ k t ʊ m
w ɪ p ɛ r ɪ n ʊ m	w ɪ p ɛ r iː n ʊ m
l a r j ɔ m	aʊ r ɛ ɔ l ʊ m
t ɛ m ɛ r ɛ	t ɪ m eː r ɛ
k ʊ n kʷ ɛ m k	kʷ ɛ m k ʊ m kʷ ɛ
m ɔ d ʊ l aː r ɛ	m ɔ d ʊ l aː r iː
d ʊ s	d ɛu m
kʷ ɛ s ɪ t ʊ m	kʷ aɪ s iː t ʊ m
a d mː ɪ n ɪ s t r aː r ɛ m	a d m ɪ n ɪ s t r aː r ɛ
s ɔ l aː r ɛ	s oː l aː r ɛ m
r uː m oː r ɛ	r uː m oː r ɛ m
g ɛ r m ɛ m n	g ɛ r m ɛ n
ɔ p ɛ r ɪ r j ʊ m	ɔ p ɛ r aː r j ʊ m
ɪ n d aː m n ɛ m	ɪ n d ɛ m n ɛ m
a s t ʊ r ɛ	a s t ʊ r ɛ m
k ɛ lː aː	k ɛ lː a m
k ɔ n w ɛ n ɪ r ɛ	k ɔ n w ɛ n iː r ɛ
a l k ɛ	a l k ɛ m
w ɪ lː aː n oː	w iː lː aː n ʊ m
r a lː ʊ m	r a lː ʊ m
ɪ m f aː n t ʊ m	iː n f a n d ʊ m
s ɔ r ɪ k ɛ	s oː r ɪ k ɛ m
t ɛ m ɛ r ɪ t aː t ɛ m	t ɛ m ɛ r ɪ t aː t ɛ m
p ʊ l w ɛ r ɪ zː aː r ɛ m	p ʊ l w ɛ r iː zː aː r ɛ
d ɛ t ɛ n t j oː n ɛ m	d eː t ɛ n t j oː n ɛ m
d ɛ l aː t j oː n ɛ m	d eː l aː t j oː n ɛ m
a s k ɛ n s j oː n ɛ m	a s k eː n s j oː n ɛ m
s p ʊ t ʊ m	s p uː t ʊ m
k ɪ m k ɛ m	k iː m ɪ k ɛ m
p ɪ kː ʊ m	p iː k ʊ m
f ɔ r m ɛ m	f oː r m ɛ m
w ɛ n t r ɛ m	w ɛ n t r ɛ m
k ʊ m ʊ l aː r ɛ	k ʊ m ʊ l aː r ɛ
f a k ɛ t ʊ m	f a k eː t ʊ m
d ɔ n ɪ s j aː k ʊ m	d ɪ ɔ n y s j a k ʊ m
f ʊ r ʊ n k ʊ l ʊ m	f uː r ʊ ŋ k ʊ l ʊ m
l a k t ɛ ʊ m	l a k t ɛu m
r ʊ w ʊ m	r ʊ b ʊ m
k a b l ʊ m	k a p ʊ l ʊ m
p l ʊ b j oː s ʊ m	p l ʊ w j oː s ʊ m
d ɛ n ʊ d aː t j oː n ɛ m	d eː n uː d aː t j oː n ɛ m
ɪ n t ɛ rː ʊ p t j oː n ɛ m	ɪ n t ɛ rː ʊ p t j oː n ɛ m
d ɛ w aː n ɪ r ɛ m	eː w aː n eː s k ɛ r ɛ
a m aː t ɔ r j ʊ m	a m aː t oː r j ʊ m
p a nː ʊ m	p a nː ʊ m
b a j m aː r ɛ	b aː j ʊ l aː r ɛ
ɛ s ɪ t aː r ɛ	h aɪ s ɪ t aː r ɛ
f uː r j oː s ʊ m	f ʊ r j oː s ʊ m
ɪ m f l ɪ g ɛ r ɛ	iː n f l iː g ɛ r ɛ
s t r ɔ p ʊ m	s t r ɔ pː ʊ m
t ɔ r p ɛ d ʊ m	t ɔ r p eː d ɪ n ɛ m
d ɛ k ɔ r aː r ɛ	d ɛ k ɔ r aː r ɛ
m ʊ l t a m	m ʊ l t a m
kʷ ɪ t a n t a m	kʷ ɪ eː t a n t j a m
s ɪ l w a m	s ɪ l w a m
p ɛ r ɪ t ʊ m	p ɛ r iː t ʊ m
f a t ʊ m	f aː t ʊ m
k a r a m	k a r a m
b a r aː t r ʊ m	b a r a tʰ r ʊ m
a kː uː s aː b ɛ l ɛ	a kː uː s aː b ɪ l ɛ m
f ʊ l g ʊ m r ɛ	f ʊ l g ʊ r
t ɛ s ʊ r a m	t eː n s uː r a m
k uː r a m t ʊ r a m	k uː r aː t uː r a m
r ɛ k l aː m aː t j ɛ m n	r eː k l aː m aː t j oː n ɛ m
t r t ʊ f ʊ m	t uː b ɛ r
p r ɔ l ɔ ŋ g aː r ɛ	p r oː l ɔ ŋ g aː r ɛ
a s t ʊ r ɛ	a s t ʊ r ɛ m
s p uː m oː s ʊ m	s p uː m oː s ʊ m
f ɛ ʊ d ʊ m	f ɛu d ʊ m
w ɪ s ɪ t aː t j ʊ m n ɛ m	w iː s ɪ t aː t j oː n ɛ m
ɪ n f ʊ n d ɛ r ɛ	iː n f ʊ n d ɛ r ɛ
a k s ɛ m	uː ŋ k t j oː n ɛ m
g r aː m aː m	g r aː m ɛ n
ɔ b t ɛ m p ɛ r aː r ɛ	ɔ b t ɛ m p ɛ r aː r ɛ
t r aː d ɪ t oː r ɛ	t r aː d ɪ t oː r ɛ m
f ɛ t aː r ɛ	f eː t aː r ɛ
k a r n aː r ʊ m	k a r n aː r j ʊ m
d ɪ fː ʊ n d ɛ r ɛ	d ɪ fː ʊ n d ɛ r ɛ
aʊ t ɔ n aː l ɛ	aʊ t ʊ m n aː l ɛ m
ɪ w oː r j ʊ m	ɛ b ʊ r
m ɛ s uː r a m	m eː n s uː r a m
s ɛ m p ɪ t ɛ r n ʊ m	s ɛ m p ɪ t ɛ r n ʊ m
w ɪ k ɪ n a m	w iː k iː n a m
d ɛ l ɪ b ɛ r aː t j oː n ɛ m	d eː l iː b ɛ r aː t j oː n ɛ m
r a p ɪ r ɛ	r a p ɛ r ɛ
p r ɛ m ɪ k j aː s	p r iː m ɪ t j a m
ɪ n d ɪ g ɛ n t a m	ɪ n d ɪ g ɛ n t j a m
r ɛ s t aː r ɛ	r ɛ s t aː r ɛ
s a m b ʊ k ʊ m	s a m b uː k ʊ m
s ɛ r aː f ɪ k ʊ m	s ɛ r a pʰ ɪ k ʊ m
f r uː ɪ k t ʊ m	f r uː k t ʊ m
m ɪ l ɪ t aː r ɛ	m iː l ɪ t aː r ɛ
s p ɛ t ɪ m ɛ n	s p ɛ k ɪ m ɛ n
m a n j ʊ m	m a ŋ n ʊ m
k a p t j k ʊ m	k a p t j oː s ʊ m
m ʊ l t ɪ p l ɪ k aː t j oː n ɛ m	m ʊ l t ɪ p l ɪ k aː t j oː n ɛ m
k a r ɛ k ɛ r ɛ	k a r eː r ɛ
w ɪ d ʊ ɪ t aː	w ɪ d ʊ ɪ t aː t ɛ m
d r aː p ɛ ʊ m	d r a pː ʊ m
ʊ r k ɛ m	ʊ l iː k ɛ m
a b ɪ t ʊ m	h a b ɪ t ʊ m
ʊ s ɪ t aː r ɛ	uː s ɪ t aː r iː
g ɛ m ɛ ʊ m	g ɛ m ɛ lː ʊ m
ɛ d ɪ l	aɪ d iː l ɛ m
l ɪ m ɔ s n a m	ɛ l ɛ eː m ɔ s y n a m
l ɪ ɛ t ʊ m	l aɪ t ʊ m
d j aː b ɔ l ɪ k ʊ m	d j a b ɔ l ɪ k ʊ m
n ɛ p ɛ t ɛ a m	n ɛ p ɛ t a m
aʊ l aː	aʊ l a m
b a k ɛ l ɛ r ɛ	b a kː a l aʊ r ɛu m
l ɔ k aː l ɛ	l ɔ k aː l ɛ m
r ɔ s m aː r ɪ n ʊ m	r oː r ɛ mː a r iː n ʊ m
k a l ɛ f aː k t j oː n ɛ m	k a l ɛ f a k t j oː n ɛ m
f r ɛ kʷ ɛ n t ɛ m	f r ɛ kʷ ɛ n t ɛ m
r ɛ f r ɪ g ɛ r j ʊ m	r eː f r iː g ɛ r j ʊ m
ʊ m ɪ l j a m t j oː n ɛ m	h ʊ m ɪ l j aː t j oː n ɛ m
a k oː n ɪ t ʊ m	a k ɔ n iː t ʊ m
ɛ k s p ɔ r t aː t j oː n ɛ m	ɛ k s p ɔ r t aː t j oː n ɛ m
ɔ s t ɛ n s ɪ w ʊ m	ɔ s t eː n s iː w ʊ m
s a n t ʊ m r j ɛ t a m	s a t ʊ r eː j a m
g r aː w ɪ t aː t j oː n ɛ m	g r a w ɪ t aː t j oː n ɛ m
m a k ɛ lː aː j ʊ m	m a k ɛ lː aː r j ʊ m
a sː ɔ k j aː r ɛ	a sː ɔ k j aː r ɛ
s p ɛ sː ʊ m	s p ɪ sː ʊ m
l aː p t aː r j ʊ m	l a k t aː r j ʊ m
ɪ f ɛ r w ɛ m t ɛ r ɛ	ɛ fː ɛ r w eː s k ɛ r ɛ
m ɪ l aː r j ʊ m	m iː lː j aː r j ʊ m
s ɔ b r ɛ m w ɛ n ɪ r	s ʊ p ɛ r w ɛ n iː r ɛ
ɪ n b ɛ n ɛ m ɪ n aː r ɛ	w ɛ n eː n aː r ɛ
ɪ rː ɪ g a m r ɛ	ɪ rː ɪ g aː r ɛ
a lː ɔ n d ʊ m l a m	a l aʊ d a m
ɪ n s ɛ m n aː r ɛ	iː n s ɪ ŋ n aː r ɛ
k a n k ɛ m r ʊ m	k a ŋ k r ʊ m
m ɔ n t aː n j oː s ʊ m	m ɔ n t aː n j oː s ʊ m
a kː r ɛ s k ɛ r ɛ	a kː r eː s k ɛ r ɛ
s p ʊ m aː r ɛ	s p uː m aː r ɛ
ɛ g s ɛ m p l aː r	ɛ k s ɛ m p l a r
r ɛ w ɛ r s aː r ɛ	r ɛ w ɛ r s aː r ɛ
w ɔ r aː r ɛ	w ɔ r aː r ɛ
g ʊ ŋ g ɛ r ɛ	j ʊ ŋ g ɛ r ɛ
a r m ʊ m s	a r m ʊ m
a n t ɛ k ɛ d ɛ r ɛ	a n t ɛ k eː d ɛ r ɛ
s p ɛ k uː l aː t oː r ɛ m	s p ɛ k ʊ l aː t oː r ɛ m
w ɛ k aː	w ɪ k j a m
ɪ n ʊ m	iː n ʊ m
l ɪ m aː r ɛ	l iː m aː r ɛ
k a r p ɛ n t ʊ m	k a r p ɛ n t ʊ m
k ɔ m p l ɛ t ʊ m	k ɔ m p l eː t ʊ m
m ɛ l ɔ d j a m	m ɛ l oː d j a m
m ɔ r t aː r j ʊ m	m ɔ r t aː r j ʊ m
k uː p ɪ d ɪ t aː	k ʊ p ɪ d ɪ t aː t ɛ m
f ɛ mː ɪ n ɪ n ʊ m	f eː m ɪ n iː n ʊ m
p ɪ s m ʊ m p aː d ʊ m	ɛ p ɪ s k ɔ p aː t ʊ m
ɪ m b r j aː k ʊ m	eː b r j aː k ʊ m
ɪ m p j ʊ m	ɪ m p j ʊ m
p r ɛ s ɪ d ɛ r ɛ	p r aɪ s ɪ d eː r ɛ
ɪ r aː	iː r a m
k ɔ n f ɛ sː oː r ɛ	k oː n f ɛ sː oː r ɛ m
ɛ r ɛ t ɪ k ɛ m	h aɪ r ɛ t ɪ k ʊ m
p ʊ l k r ɛ ɪ t ʊ t ɛ m	p ʊ l kʰ r ɪ t uː d ɪ n ɛ m
b uː f a l ʊ m	b uː b a l ʊ m
m a l ɛ d ɪ k ɛ r ɛ	m a l ɛ d iː k ɛ r ɛ
k ɛ r j ʊ m	k eː r ɛu m
d ɪ k t aː m ɛ n	d ɪ k t aː m ɛ n
gʷ a s t aː r ɛ	w a s t aː r ɛ
p r ɔ d ɪ g j ʊ m	p r oː d ɪ g j ʊ m
s ɛ p ɛ m	s aɪ p ɛ m
f a aː	f aː g ɛ a m
