g aʊ d ʊ m	g aʊ d j ʊ m
b l ɛ t ʊ m	b l ɪ t ʊ m
l ɛ p r a m	l ɛ p r a m
ɔ kː a s j oː n ɛ	ɔ kː aː s j oː n ɛ m
p eː r k ɔ rː ɛ r ɛ	p ɛ r k ʊ rː ɛ r ɛ
ɪ n d aː g aː r ɛ	ɪ n d aː g aː r ɛ
k a l oː r ɛ	k a l oː r ɛ m
f ɔ sː a m	f ɔ sː a m
s aː p j ɛ n t a m	s a p ɪ ɛ n t j a m
a m a r ɪ g aː r ɛ	a m aː r ɪ k aː r ɛ
m ɔ d ɛ r	m ɔ l ɛ r ɛ
b aː s j aː r ɛ	b aː s j aː r ɛ
t oː r ʊ m	t ɔ r ʊ m
s aː n t ɪ t aː t ɛ m	s aː ŋ k t ɪ t aː t ɛ m
s t a b ɪ l ɛ m k ɪ r ɛ	s t a b ɪ l iː r ɛ
n aː t ʊ m	n aː t ʊ m
k aː t aː r aː k t a m	k a t a r a k t a m
g r aː w ɪ d ʊ m	g r a w ɪ d ʊ m
d ɛ t ɛ n t j oː n ɛ m	d eː t ɛ n t j oː n ɛ m
k ɔ m p ɛ t ɪ t oː r ɛ	k ɔ m p ɛ t iː t oː r ɛ m
s t aː t w a m	s t a t w a m
a k r ɪ m oː n j a m	aː k r ɪ m oː n j a m
k ɛ n t aʊ r a m	k ɛ n t aʊ r eːa m
w ɪ r g ʊ l a m	w ɪ r g ʊ l a m
t aː m iː s ʊ m	t a m ɪ s j ʊ m
ɔ n ɔ r ɪ f ɪ k ʊ m	h ɔ n oː r ɪ f ɪ k ʊ m
aː k t ʊ m	aː k t ʊ m
g ɛ m ɪ n aː r ɛ	g ɛ m ɪ n aː r ɛ
k ɛ s p ɪ t ɛ m	k aɪ s p ɪ t ɛ m
ɔ rː ɛ n d ʊ m	h ɔ rː ɛ n d ʊ m
s ɔ b r ɪ n ʊ m	s oː b r iː n ʊ m
s a p oː n ɛ	s aː p oː n ɛ m
k oː l t ɛ m	k ʊ l k ɪ t a m
ɪ n mː ɛ d j aː t ʊ m	ɪ mː ɛ d j aː t ʊ m
p a r t ʊ r ɪ n r ɛ	p a r t ʊ r iː r ɛ
n ɔ t ɔ r j ʊ m	n oː t oː r j ʊ m
s t r ɪ d ɛ r ɛ	s t r iː d ɛ r ɛ
a b a t j a m	a bː aː t j a m
b a r b a r ɪ s m ʊ m	b a r b a r ɪ s m ʊ m
d ɛ m ɔ m s t r a t j oː n ɛ m	d eː m oː n s t r aː t j oː n ɛ m
m a t uː r ʊ m	m aː t uː r ʊ m
k ɔ m uː n ɛ	k ɔ mː uː n ɛ m
k ɔ n t ɛ s t aː r ɛ	k ɔ n t ɛ s t aː r iː
t a r d ɪ	t a r d ʊ m
f aː t ɛ m	f a k ɪ ɛ m
k ɔ n d ɪ t j oː n ɛ	k ɔ n d ɪ k j oː n ɛ m
l ɪ m ɪ n ɛ	l iː m ɛ n
ɛ r aː r j ʊ m	aɪ r aː r j ʊ m
d ɛ m oː n ɪ k ʊ m	d aɪ m ɔ n ɪ k ʊ m
aʊ t ɔ r ɪ t aː t ɛ m	aʊ k t oː r ɪ t aː t ɛ m
n ʊ t ʊ m	n uː t ʊ m
ɛ t aː t ɛ m	aɪ t aː t ɛ m
t r ʊ k ɛ	t r ʊ k ɛ m
t r aː s l ʊ k ɪ r ɛ	t r aː n s l uː k eː r ɛ
p r ɔ d uː k t ɪ w ʊ m	p r oː d ʊ k t iː w ʊ m
d ɛ p ɛ r ɪ t j ʊ m n ɛ m	d eː p ɛ r ɪ t j oː n ɛ m
f ɪ m ʊ m	f ɪ m ʊ m
f ɛ r ɪ r ɪ	f ɛ r iː r ɛ
n ʊ t r ɪ k ɛ	n uː t r iː k ɛ m
p aː l j ʊ r	p a l ɪ uː r ʊ m
k ɔ n mː uː t aː r ɛ	k ɔ mː uː t aː r ɛ
k l ɛ m ɛ n t ɪ sː ɪ m ʊ m	k l eː m eː n t ɪ sː ɪ m ʊ m
l ɔ ŋ g ɪ n kʷ ɪ t aː t ɛ m	l ɔ ŋ g ɪ ŋ kʷ ɪ t aː t ɛ m
p ɔ r t j oː n	p ɔ r t j oː n ɛ m
r ɛ f l ɛ t ɪ r ɛ	r ɛ f l ɛ k t ɛ r ɛ
p ɛ n s ɪ l ɛ	p eː n s ɪ l ɛ m
d ɪ s ɛ r t ʊ m	d ɪ s ɛ r t ʊ m
f uː g aː k ɛ	f ʊ g aː k ɛ m
ɪ m p aː r t ɪ r ɛ	ɪ m p a r t iː r ɛ
ɔ b t ʊ s ʊ m	ɔ b t uː s ʊ m
k ɔ l a m	k aʊ d a m
f ɪ l ʊ	f l ʊ k t ʊ m
f l oː r iː r ɛ	f l oː r eː r ɛ
r ʊ p ɛ	r uː p ɛ m
s ʊ p ɛ r w a k aː n ɛ ʊ m	s ʊ p ɛ r w a k aː n ɛu m
d ɛ ŋ n aː r ɛ	d ɪ ŋ n aː r ɛ
b aː a t ʊ m	b ɔ aː t ʊ m
k ɔ n w ɔ k aː r ɛ	k ɔ n w ɔ k aː r ɛ
n ɛ f a s	n ɛ f aː s
ɔ b ɛ d j ɛ n t j a m	ɔ b ɔ ɪ d ɪ ɛ n t j a m
b a j m aː r ɛ	b aː j ʊ l aː r ɛ
p aː w ɪ m ɛ n t ʊ m	p a w iː m ɛ n t ʊ m
n ʊ m ɛ r aː r j ʊ m	n ʊ m ɛ r aː r j ʊ m
ɪ n kʷ ɪ n aː r ɛ	ɪ ŋ kʷ ɪ n aː r ɛ
f r a t ɛ r n aː l	f r aː t ɛ r n aː l ɛ m
p ɔ s t ɛ r ʊ m	p ɔ s t ɛ r ʊ m
s oː r ɛ m a m	s ɔ r oː r ɛ m
p aʊ s a m	p aʊ s a m
f l uː ɪ r ɛ	f l ʊ ɛ r ɛ
d ʊ l k aː m aː r a m	d uː l k a m aː r a m
s ɔ l ɪ l ɔ kʷ j ʊ m	s oː l ɪ l ɔ kʷ j ʊ m
k ɔ kː ɪ n ɪ l a m	k ɔ kː ɪ n a m
p a n a k a m	p a n a k eːa m
r ɛ g j ʊ m	r eː g j ʊ m
p a d r a s t r ʊ m	p a t r a s t r ʊ m
p a r t ɪ t j oː n ɛ m	p a r t iː t j oː n ɛ m
t j a	tʰ iː a m
k r ɛ d ɪ b ɪ l ɪ t aː t ɛ m	k r eː d ɪ b ɪ l ɪ t aː t ɛ m
k a r aː k t ɛ r ɛ	kʰ a r a k t eː r ɛ m
t m ɛ s aʊ r ʊ m	tʰ eː s aʊ r ʊ m
k ɔ m ʊ n j oː n ɛ m	k ɔ mː uː n iː r ɛ
k ʊ ɛ r ʊ m	k ɔ r j ʊ m
w ɔ m ɛ r ɛ	w ɔ m ɛ r ɛ
ɛ k s ɪ s t ɛ n t j a m	ɛ k s ɪ s t ɛ n t j a m
s ʊ b j ʊ k g aː r ɛ	s ʊ b j ʊ g aː r ɛ
n aː s ʊ t ʊ m	n aː s uː t ʊ m
m ʊ n t oː s ʊ m	m ɔ n t ʊ oː s ʊ m
ɔ kː uː l t aː r ɛ	ɔ kː ʊ l t aː r ɛ
s ʊ b mː ɛ r s j oː n ɛ	s ʊ mː ɛ r s j oː n ɛ m
f ɛ mː ɪ n ɪ n ʊ m	f eː m ɪ n iː n ʊ m
p uː aː r ɛ	p ʊ t eː r ɛ
a sː ɪ d ʊ m	a sː ɪ d ʊː m
k ɪ m b aː l ʊ m	k y m b a l ʊ m
p aː r t ʊ m	p a r t ʊ m
aː s t r ʊ m	a s t r ʊ m
d ɛ t ɛ r m ɪ n aː t j ɔ n ɛ	d eː t ɛ r m ɪ n aː t j oː n ɛ m
m ɪ s t ʊ r a m	m ɪ s t uː r a m
k ʊ l p a m	k ʊ l p a m
p ʊ t r ɪ r ɛ	p ʊ t r ɛ r ɛ
a b aː k ʊ l ʊ m	a b a k ʊ l ʊ m
p ʊ r ɪ n ʊ m	p uː r ɛ m
g ɛ n ɪ t ɪ w ʊ m	g ɛ n ɪ t iː w ʊ m
ɛ k ɔ n d ɛ k ɪ r	k ɔ n d iː k ɛ r ɛ
ɪ n t ɛ r p r ɛ t aː b ɪ l ɛ	ɪ n t ɛ r p r ɛ t aː b ɪ l ɛ m
ɪ m p uː l s ʊ m	ɪ m p ʊ l s ʊ m
l ʊ r ɛ l ʊ m	l aʊ r ʊ m
ɪ n kʷ j ɛ t uː d n ɛ m	ɪ ŋ kʷ ɪ eː t uː d ɪ n ɛ m
w ɛ g ɛ t ʊ m	w ɛ g ɛ t ʊ m
t r ɪ g ɛ s ɪ m ʊ m	t r iː g eː s ɪ m ʊ m
ɛ d ɪ l	aɪ d iː l ɛ m
d ɛ s ɛ m n aː r ɛ	d eː s ɪ ŋ n aː r ɛ
uː r ʊ m	uː r ʊ m
k aː n ɛ s t r ʊ m	k a n ɪ s t r ʊ m
t ɛ r t j aː r ɛ	t ɛ r t j aː r ɛ
s a l ɪ n a m	s a l iː n a m
r aː p t ʊ m	r a p t ʊ m
p r oː h ɪ b ɪ r ɛ	p r ɔ h ɪ b eː r ɛ
w eː l aː r ɛ	w eː l aː r ɛ
s a k ɛ r d ɔ t j ʊ m	s a k ɛ r d oː t j ʊ m
g uː d ɛ ʊ m	j uː d aɪ ʊ m
a k k ɛ sː oː r j ʊ m	a kː ɛ sː oː r j ʊ m
t ɛ d ʊ l a m	s kʰ ɛ d ʊ l a m
n ɔ n a m	n ɔ nː a m
k ɪ p ɔ lː a m	k eː p ʊ lː a m
f a l a ŋ g ɛ m	pʰ a l a ŋ g ɛ m
s ɛ m ɛ n	s eː m ɛ n
p aː k t ʊ m	p a k t ʊ m
g r aː n oː	g r aː n ʊ m
d uː r ʊ m	d uː r ʊ m
t r a d uː k t j oː n ɛ	t r aː d ʊ k t j oː n ɛ m
n ɪ d ʊ m	n iː d ʊ m
m ʊ n ɪ f ɪ k ʊ m	m uː n ɪ f ɪ k ʊ m
ɪ n mː ɔ r t aː l	ɪ mː ɔ r t aː l ɛ m
k ɔ m w ɪ t j ʊ m	k ɔ n w iː k j ʊ m
k r ɪ n ɛ m	k r iː n ɛ m
s ʊ fː r ʊ t ɪ k ɛ	s ʊ fː r ʊ t ɪ k ɛ m
p a r j ɪ ɛ t aː l ɛ	p a r ɪ ɛ t aː l ɛ m
m ɔ t ɪ w ʊ m	m oː t ɪ w ʊ m
p r ɛ d j aː l ɛ	p r aɪ d j aː l ɛ m
s ɪ m ʊ r	s eː k uː r ʊ m
a n ɛ t ʊ m	a n eː tʰ ʊ m
k ɔ n t ɛ m p l aː r ɛ	k ɔ n t ɛ m p l aː r iː
r a k ɪ m oː s ʊ m	r a k eː m oː s ʊ m
g r a m ɪ n ɪ ʊ m	g r aː m ɪ n ɛu m
ʊ n k a m	ʊ ŋ k j a m
j aː s p d ɛ m	j a s p ɪ d ɛ m
m ɔ n a s t ɛ r ʊ	m ɔ n a s t eː r j ʊ m
k aː s t r ʊ m	k a s t r ʊ m
m ɛ n t ʊ m n	m ɛ n t ʊ m
ɪ r a m	iː r a m
k ɪ b a t j oː n ɛ m	k ɪ b aː t j oː n ɛ m
b r ɔ kː ʊ m	b r ɔ kː ʊ m
ɔ n ɔ r aː r j ʊ m	h ɔ n oː r aː r j ʊ m
p a lː oː r ɛ	p a lː oː r ɛ m
ʊ m b r oː s ʊ m	ʊ m b r oː s ʊ m
ɛ r ɔ m p ɛ r ɛ	eː r ʊ m p ɛ r ɛ
a b s t r ɛ r ɛ	a b s t r a h ɛ r ɛ
d ʊ l k ɪ f ɪ k aː r ɛ	d ʊ l k ɪ f ɪ k aː r ɛ
ɪ n mː a r k ɛ s ɪ b ɪ l ɛ	ɪ mː a r k ɛ s k ɪ b ɪ l ɛ m
ɛ s t ɪ ʊ m	aɪ s t aː t ɛ m
k ɔ l ɔ m b ʊ m	k ɔ l ʊ m b ʊ m
s ʊ mː ɪ n ɪ s t r aː r ɛ	s ʊ b m ɪ n ɪ s t r aː r ɛ
k ɔ n k ʊ rː ɛ r ɛ	k ɔ ŋ k ʊ rː ɛ r ɛ
ɛ k s p ʊ ŋ n aː r ɛ	ɛ k s p ʊ ŋ n aː r ɛ
s ɛ pː ʊ lː aː r ɛ	s ɛ p ɛ l iː r ɛ
a r b ɔ r ɛ t ʊ m	a r b ɔ r eː t ʊ m
p ʊ l k r ʊ m	p ʊ l kʰ r ʊ m
aʊ k m ɛ n t a t j oː n ɛ m	aʊ g m ɛ n t aː t j oː n ɛ m
ɔ l ɪ g aː r k a m	ɔ l ɪ g a r kʰ a m
p ɛ r k a m	p ɛ r k a m
s a t ɪ s f a k ɛ r ɛ	s a t ɪ s f a k ɛ r ɛ
s ʊ r k ɪ r ɛ	s a r k iː r ɛ
r ɪ p a m	r iː p a m
p r ɛ s k r ɪ w ɪ r ɛ	p r aɪ s k r iː b ɛ r ɛ
w ʊ ʊ m	b uː b oː n ɛ m
aʊ d ɪ t oː r j ʊ m	aʊ d iː t oː r j ʊ m
ɔ r j ɪ ɛ n t ɛ m	ɔ r ɪ ɛ n t ɛ m
m ɪ ŋ g ɛ r ɛ	m ɪ ŋ g ɛ r ɛ
s ɛ p ʊ l k r ʊ m	s ɛ p ʊ l k r ʊ m
ɔ s p ɪ t j ʊ m	h ɔ s p ɪ t j ʊ m
ɪ m p ɛ lː ɛ r ɛ	ɪ m p ɛ lː ɛ r ɛ
ɛ k s ɪ t ʊ m	ɛ k s ɪ t ʊ m
kʷ a d ɛ r n ʊ m	kʷ a t ɛ r n oː s
a k a n t ʊ m	a k a n tʰ ʊ m
a n ɔ d ɪ n ʊ m	a n oː d y n ɔ n
r ɛ p a r aː r ɛ	r ɛ p a r aː r ɛ
ɪ ŋ g ɛ r ɪ r ɛ	ɪ ŋ g ɛ r ɛ r ɛ
d ɪ w ʊ l g aː r ɛ	d iː w ʊ l g aː r ɛ
p r ɔ l ɔ ŋ g a t j oː n ɛ m	p r oː l ɔ ŋ g aː t oː n ɛ m
s k r ɪ b a m	s k r iː b a m
m ɪ n ɔ r aː r ɛ	m ɪ n oː r aː r ɛ
a ŋ g ɛ l ɪ k ʊ m	a ŋ g ɛ l ɪ k ʊ m
s k j ɛ m m ʊ l ʊ m	s k ɪ uː r ʊ m
ʊ m ɪ lː j aː r ɛ	h ʊ m ɪ l j aː r ɛ
ɪ m b ɛ k ɪ l ɛ	ɪ m b eː k ɪ lː ʊ m
p a t r ɪ t j ʊ m	p aː t r ɪ k j ʊ m
k ɔ n k ɛ r n ɛ r ɛ	k ɔ ŋ k ɛ r n ɛ r ɛ
s ɔ l ɪ d ʊ m	s ɔ l ɪ d ʊ m
s p ɔ l a m r ɛ	s p ɔ l j aː r ɛ
ɛ k s t ɪ r p a t j oː n ɛ	ɛ k sː t ɪ r p aː t j oː n ɛ m
r ɔ s t r ʊ m	r oː s t r ʊ m
s ʊ r d ʊ m	s ʊ r d ʊ m
ɪ l ʊ m	h iː l ʊ m
ɪ n a l aː r ɛ	ɪ n h aː l aː r ɛ
w n a t oː r	w eː n aː t oː r ɛ m
m ɔ l ɛ k ʊ l a m	m oː l ɛ k ʊ l a m
k uː l t ʊ m	k ʊ l t ʊ m
p uː s t ʊ l a m	p ʊ s t ʊ l a m
f a b r ɪ k a t j oː n ɛ m	f aː b r ɪ k aː t j oː n ɛ m
ɛ k s t r a ɔ r d ɪ n aː r j ʊ m	ɛ k s t r aː ɔ r d ɪ n aː r j ʊ m
m a t r ɪ k ʊ l a m	m aː t r iː k ʊ l a m
d ɪ s t ɔ r kʷ ɛ r ɛ	d ɪ s t ɔ r kʷ eː r ɛ
w ɛ lː ɔ s ʊ m	w ɪ lː oː s ʊ m
ɪ n d uː r aː r ɛ	ɪ n d uː r aː r ɛ
ʊ b ɪ k a t j oː n ɛ m	ʊ b ɪ k aː t j oː n ɛ m
d s a b ʊ rː a m	s a b ʊ rː a m
b ɛ t ɛ m aː b a m	b eː t a m
d ɛ l ɪ t ʊ m	d eː l ɪ k t ʊ m
r a n ɔ kː j ʊ	r aː n ʊ ŋ k ʊ l ʊ m
k ɔ n t ʊ r b a t j oː n ɛ m	k ɔ n t ʊ r b aː t j oː n ɛ m
b l a n d ʊ m	b l a n d ʊ m
a r ɪ n oː s ʊ m	a r eː n oː s ʊ m
a d ɪ k t ʊ m	a dː ɪ k t ʊ m
t r a n s g r ɛ d ɪ r ɛ	t r aː n s g r ɛ d iː
ɔ p r ɔ b r j ʊ m	ɔ pː r ɔ b r j ʊ m
g ʊ r ɪ s p r ʊ d ɛ n t a m	j uː r ɪ s p r uː d ɛ n t j a m
k ɪ n ɛ m	k y ŋ n ʊ m
m ɛ r k aː r ɛ	m ɛ r k aː r iː
r ɪ s	r ɛ m
p ɛ k uː l j ʊ m	p ɛ k uː l j ʊ m
g aː t a m	k a tː a m
s ɪ n t ɪ f ɪ k ʊ m	s k ɪ ɛ n t ɪ f ɪ k ʊ m
s aː t ɪ r a m	s a t ɪ r a m
s aː k r aː m ɛ n t aː l ɛ	s a k r aː m ɛ n t aː l ɛ m
uː n ɪ f ɔ r m ɛ m	uː n ɪ f oː r m ɛ m
r ɔ r aː r ɛ	r oː r aː r ɛ
f a b r ɪ k aː r ɛ	f a b r ɪ k aː r ɛ
aː d ɪ t ʊ m	a d ɪ t ʊ m
uː s t ʊ l aː r ɛ	ʊ s t ʊ l aː r ɛ
p r ɛ d ɪ k ɪ r ɛ	p r aɪ d ɪ k aː r ɛ
m uː s k ʊ l aː r ɛ	m uː s k ʊ l aː r ɛ m
r ɛ m ʊ w eː r ɛ	r ɛ m ɔ w eː r ɛ
s p uː m aː r ɛ	s p uː m aː r ɛ
ɪ n t ɛ rː ʊ m p ɛ r ɛ	ɪ n t ɛ rː ʊ m p ɛ r ɛ
s ɪ t j ʊ m	s ɪ t ʊ m
k ɔ n k ʊ l k aː r ɛ	k ɔ ŋ k ʊ l k aː r ɛ
s ɛ k sː w a l ɪ t aː t ɛ m	s ɛ k s w aː l ɪ t aː t ɛ m
d ɪ g ɪ t aː r ɛ	d ɪ g ɪ t aː r ɛ
m ɛ l aː	m aː l ʊ m
p r ɔ ɪ b ɪ t j oː n	p r ɔ h ɪ b ɪ t j oː n ɛ m
a r aː n ɛ m	a r aː n ɛ a m
ʊ d ɪ t ʊ m	aʊ d iː t ʊ m
s t uː d j aː r ɛ	s t ʊ d eː r ɛ
s ʊ s t ɛ n t aː k ʊ l ʊ m	s ʊ s t ɛ n t aː k ʊ l ʊ m
ɛ s ɛ kʷ j ɛ m s	ɛ k sː ɛ kʷ j a m
m ɔ r ɪ b ʊ n d ʊ m	m ɔ r ɪ b ʊ n d ʊ m
m a mː ɛ lː a m	m a m ɪ lː a m
k aː r a m	k a r a m
b ɛ s t j aː r j ʊ m	b eː s t j aː r j ʊ m
k ɛ r w ʊ t a m	k ɛ r w ɪ s j a m
w ɪ w aː r j ʊ m	w iː w aː r j ʊ m
ɛ l ɛ n k ʊ m	ɛ l ɛ ŋ kʰ ʊ m
k ɔ m p l ɛ m ɛ n t ʊ m	k ɔ m p l eː m ɛ n t ʊ m
aː sː eː r ɛ	a sː ɪ d eː r ɛ
f l ɛ k sː ɪ b ɪ l ɪ t a m t ɛ m	f l ɛ k s ɪ b ɪ l ɪ t aː t ɛ m
r ɛ nː ɔ w a t j oː n ɛ	r ɛ n ɔ w aː t j oː n ɛ m
ɔ b t ɛ m p ɛ r aː r ɛ	ɔ b t ɛ m p ɛ r aː r ɛ
p r j ɔ r ɛ	p r j oː r ɛ m
p aʊ p ɛ r ɛ m	p aʊ p ɛ r ɛ m
k r uː ɛ n t aː r ɛ	k r ʊ ɛ n t aː r ɛ
p r ɔ s ɛ n j ɔ m	p r ɔ s k eː n j ʊ m
k ɔ mː ɛ t ɛ r ɛ	k ɔ mː ɪ tː ɛ r ɛ
p a s t a m	p a s t a m
m ɛ m ɔ b r aː r ɛ	m ɛ m ɔ r aː r ɛ
w a g aː r ɛ	w a g aː r iː
r ʊ ɛ r ɛ	r ʊ ɛ r ɛ
k aː w aː lː ɛ r ʊ m	k a b a lː aː r j ʊ m
s t r ɪ g ɪ l ɛ	s t r ɪ g ɪ l ɛ m
a m ɪ k a m	a m iː k a m
ɪ d ɛ n t ɪ d aː d ɛ m	iː d ɛ n t ɪ t aː t ɛ m
ɪ n t ɪ m a t j oː n ɛ m	ɪ n t ɪ m aː t j oː n ɛ m
s ɔ m ɪ aː r ɛ m	s a g m aː r j ʊ m
ɛ m ʊ l a t oː r ɛ	aɪ m ʊ l aː t oː r ɛ m
d ɛ g r a d a t j oː n ɛ m	d eː g r a d aː t j oː n ɛ m
d ɪ k t aː m ɛ n	d ɪ k t aː m ɛ n
aː s ɛ lː a m	a s k ɛ lː a m
d ʊ aː	d ʊ k t j oː n ɛ m
g ɛ ɔ g r aː f ɪ k ʊ m	g ɛ oː g r a pʰ ɪ k ʊ m
a kː r ɛ s k ɛ r ɛ	a kː r eː s k ɛ r ɛ
uː r ɪ n a m	uː r iː n a m
s p uː t ʊ m	s p uː t ʊ m
f aː m a m	f aː m a m
p l a n ɪ t j ɛ m	p l aː n ɪ t ɪ ɛ m
ɔ l ɛ aː t ʊ m	ɔ l ɛ aː t ʊ m
m ɔ t j oː n ɛ m	m oː t j oː n ɛ m
ɪ m f ɛ k t aː r ɛ	iː n f ɪ k ɛ r ɛ
d ɛ l a t oː r ɛ	d eː l aː t oː r ɛ m
m aː n t ɛ b ʊ m	m a ŋ k ɪ p ɛ m
p ɔ p l ɪ t ɛ m	p ɔ p l ɪ t ɛ m
z a n t aː l ʊ m	z ɪ n z a l a m
t ɛ l ɪ k ʊ m	k aɪ l ɪ k ʊ m
ɛ k s p l a n a t j oː n ɛ m	ɛ k s p l aː n aː t j oː n ɛ m
r ɛ p l ɪ k a t j oː n ɛ	r ɛ p l ɪ k aː t j oː n ɛ m
t aː k t ɪ l ɛ	t aː k t ɪ l ɛ m
k ɪ r k ʊ n s k r ɪ w ɛ r ɛ	k ɪ r k ʊ m s k r iː b ɛ r ɛ
m a ŋ n ɛ s j ʊ m	m a ŋ n eː s j ʊ m
r ɪ p ʊ d j aː r ɛ	r ɛ p ʊ d j aː r ɛ
aː nː uː lː aː r ɛ	a nː uː lː aː r ɛ
ɪ n d ɪ ŋ n ʊ m	ɪ n d iː ŋ n ʊ m
a b s t ɛ n ɛ r ɛ	a b s t ɪ n eː r ɛ
ɪ n s ɛ ɪ r ɛ	iː n s ɛ kʷ iː
k a m b j aː r ɛ	k a m b iː r ɛ
s ʊ mː a m	s ʊ mː a m
r ɛ k ɛ n t ɛ m	r ɛ k ɛ n t ɛ m
k ɔ rː ɔ s j oː n ɛ	k ɔ rː oː s j oː n ɛ m
w aː lː ʊ m	w a lː ʊ m
k ʊ l ɛ w r a m	k ɔ l ʊ b r a m
p ɔ l ʊ ɛ r ɛ	p ɔ lː ʊ ɛ r ɛ
s t ɪ m ʊ l a t j oː n ɛ m	s t ɪ m ʊ l aː t j oː n ɛ m
a w ʊ m	a w ʊ m
w a l eː r ɛ	w a l eː r ɛ
b l aː t a m	b l a tː a m
r ʊ g ʊ m	r ɔ g ʊ m
m ɪ l aː r j ʊ m	m iː lː j aː r j ʊ m
b ɛ n ɛ f aː k r ɛ	b ɛ n ɛ f a k ɛ r ɛ
ɪ sː ɪ m ʊ m	ɪ sː ɪ m ʊ m
t ɛ d j oː s ʊ m	t aɪ d j oː s ʊ m
t r a n s p oː r ɛ	t r aː n s p oː n ɛ r ɛ
s ɔ lː ɛ k ɪ t ʊ m	s ɔ lː ɪ k ɪ t ʊ m
n a t aː l ɛ	n aː t aː l ɛ m
ɪ n k l ɪ t ʊ m	ɪ ŋ k l ɪ t ʊ m
a d mː ɔ n ɪ s t aː r ɛ	a d m ɔ n eː r ɛ
p ɪ ŋ gʷ ɛ	p ɪ ŋ gʷ ɛ m
r uː m oː r ɛ	r uː m oː r ɛ m
s k ɔ r t a m	s k ɔ r t ɛ a m
aː k ʊ m	a k ʊ m
g ʊ r n aː l ɛ	d j ʊ r n aː l ɛ m
w ɪ r aː g ʊ m	w ɪ r aː g ɪ n ɛ m
ɪ n k ɛ n d ɛ r ɛ	ɪ ŋ k ɛ n d ɛ r ɛ
k a p ɛ r ɛ	k a p ɛ r ɛ
s ɛ r j oː s ʊ m	s eː r j oː s ʊ m
s ɛ k t ɪ m a n a m	s ɛ p t ɪ m aː n a m
a ɛ r ɪ ʊ m	aː ɛ r j ʊ m
t r ɛ t ʊ m	t r a k t ʊ m
s ɪ m p l ɪ k ɛ m	s ɪ m p l ɪ k ɛ m
a pː ɛ lː aː r ɛ	a pː ɛ lː aː r ɛ
d ɔ l oː	d ɔ l ʊ m
k ɪ b aː r ɛ	k ɪ b aː r ɛ
s aː l m a m	s a g m a m
ɛ g r ɛ g ɪ ʊ m	eː g r ɛ g j ʊ m
f r aː s k ʊ m	f l a s k oː n ɛ m
p ɛ t ɪ r ɛ	p ɛ t ɛ r ɛ
k a t ɛ d r aː l ɛ	k a tʰ ɛ d r aː l ɛ m
ɪ m p ɔ s ɪ t j oː n ɛ m	ɪ m p ɔ s ɪ t j oː n ɛ m
k ɛ sː aː r ɛ	k ɛ sː aː r ɛ
p aː l p ɪ t aː r ɛ	p a l p ɪ t aː r ɛ
p r ɔ s t ɪ t ʊ ɪ r ɛ	p r oː s t ɪ t ʊ ɛ r ɛ
t r ɪ b uː t ʊ m	t r ɪ b uː t ʊ m
f r ɪ ɪ g ɪ d aː t ɛ m	f r iː g ɪ d ɪ t aː t ɛ m
k oː l aː r ɛ	k ɔ l ɛ r ɛ
l kʷ ɛ r n k ɛ m	kʷ ɛ r k ʊ m
ɪ n ɔ s t ɛ r ɛ	ɪ ŋ n oː s k ɛ r ɛ
b aː l b ʊ t j ɛ r ɛ	b a l b uː t iː r ɛ
b ɛ m s t r uː k	s t r uː tʰ j oː n ɛ m
m ɔ d ɛ r a t oː r ɛ	m ɔ d ɛ r aː t oː r ɛ m
aː g r ʊ m	a g r ʊ m
t ɔ m ʊ m	t ɔ m ʊ m
d ɛ n t aː l ɛ	d ɛ n t aː l ɛ m
h ɪ s p aː n ɪ k ʊ m	h ɪ s p aː n ɪ k ʊ m
k r ɪ t ɪ k ʊ m	k r ɪ t ɪ k ʊ m
k ɔ a g uː l a t j oː n ɛ m	k ɔ aː g ʊ l aː t j oː n ɛ m
ɪ n t ɛ rː uː p t j oː n ɛ m	ɪ n t ɛ rː ʊ p t j oː n ɛ m
n ɛ r w oː s ʊ m	n ɛ r w oː s ʊ m
ɪ n ɔ b ɪ l ɛ	ɪ ŋ n oː b ɪ l ɛ m
t j oː n ɛ	t j oː n ɛ m
f ɛ r w ɛ r ɛ	f ɛ r w eː r ɛ
d ɪ s p a r aː r ɛ	d ɪ s p a r aː r ɛ
t r ɪ n ɪ t aː t ɛ m	t r iː n ɪ t aː t ɛ m
p ɛ t aː t ʊ m	p ɪ tː a k j ʊ m
g ɛ n ɛ r ʊ m	g ɛ n ʊ s
d ɪ sː ɛ kː aː r ɛ	d eː s ɪ kː aː r ɛ
ɛ k s t ɔ r k ɛ r ɛ	ɛ k s t ɔ r kʷ eː r ɛ
a d ɔ r a t j oː n ɛ m	a d oː r aː t j oː n ɛ m
ɛ r b aː r j ʊ m	h ɛ r b aː r j ʊ m
s a l t ʊ m	s a l t ʊ m
a t ɛ n t ʊ m	a tː ɛ n t ʊ m
r ɛ m ɛ k ɛ r ɛ	r ɛ m ɪ s k eː r ɛ
d ɛ l ɪ n kʷ ɛ r ɛ	d eː l ɪ ŋ kʷ ɛ r ɛ
s ɔ n j ʊ m	s ɔ m n j ʊ m
ɪ n s ɪ ŋ n ɛ m	iː n s ɪ ŋ n ɛ m
f uː lː ɪ g ɪ n ɛ	f uː l iː g ɪ n ɛ m
ɛ m ɛ r g ɛ r ɛ	eː m ɛ r g ɛ r ɛ
k r ɪ m ɪ n ɛ	k r iː m ɛ n
f uː r oː r ɛ	f uː r aː r iː
k ɔ n f ɛ r ɪ r ɛ	k oː n f ɛ rː ɛ
