t ʊ m r t ʊ m r ɛ	t ɔ r t oː r ɛ m
f ʊ n ɛ	f uː n ɛ m
p ɔ r t aː b ɪ l ɛ	p ɔ r t aː b ɪ l ɛ m
k ɔ n w ɔ k aː r ɛ	k ɔ n w ɔ k aː r ɛ
s aː l ɪ w aː r ɛ	s a l iː w aː r ɛ
ɔ l ɛ ʊ m s ʊ m	ɔ l ɛ oː s ʊ m
k j uː d ɛ r ɛ m	k l aʊ d ɛ r ɛ
a t l aː n t ɪ k ʊ m	aː t l a n t ɪ k ʊ m
m oː r ɛ m	m oː r ɛ m
p r ɛ s ɛ n t ɪ r	p r aɪ s ɛ n t iː r ɛ
f ɛ l ɪ k ɪ t aː t ɛ m	f eː l iː k ɪ t aː t ɛ m
p ɔ k ʊ m	p aʊ k ʊ m
s k r ʊ t aː r ɛ	s k r uː t aː r iː
b ɛ s t ɪ ɔ l a m	b eː s t ɪ ɔ l a m
ɛ k s ɛ k r a m r ɛ	ɛ k sː ɛ k r aː r iː
a k oː n ɪ t ʊ m	a k ɔ n iː t ʊ m
s aː t ɛ lː ɪ t ɛ	s a t ɛ lː ɪ t ɛ m
ɛ k s uː l k ɛ r aː t j oː n ɛ m	ɛ k s ʊ l k ɛ r aː t j oː n ɛ m
l ʊ n ʊ l a m	l uː n ʊ l a m
k a m b j ʊ m m	k a m b j ʊ m
a k t ɪ w ʊ m	aː k t iː w ʊ m
k ɪ k ɔ n a m	k ɪ k oː n j a m
ɔ r aː t j oː n ɛ m	oː r aː t j oː n ɛ m
a ŋ ɛ lː a m	a ŋ n ɛ lː a m
r ɛ l ɛ g aː r ɛ	r ɛ l ɪ g aː r ɛ
ɛ l uː k uː b r aː r ɛ	eː l uː k ʊ b r aː r ɛ
m ɔ r d aː k ɛ	m ɔ r d aː k ɛ m
r ɛ b ɛ l aː r ɛ	r ɛ b ɛ lː aː r ɛ
d ɪ s p ɛ r k ɪ r ɛ	d ɪ s p ɛ r iː r ɛ
ɔ p ɛ r aː r ɛ	ɔ p ɛ r aː r iː
m ʊ l k ɛ r ɛ	m ʊ l k eː r ɛ
b ɛ n ɛ f ɪ k ʊ m	b ɛ n ɛ f ɪ k ʊ m
f l ɛ k t ɪ r ɛ	f l ɛ k t ɛ r ɛ
r aː d j aː t j oː n ɛ	r a d j aː t j oː n ɛ m
d ɛ k ɔ r aː r ɛ	d ɛ k ɔ r aː r ɛ
a l g j aː n	a l ɪ kʷ ɛ m
k ɔ n k ɪ s ʊ m	k ɔ ŋ k ɪ d ɛ r ɛ
k m aː pː oː n ɛ	k aː p oː n ɛ m
k aː w aː lː ɛ r ʊ m	k a b a lː aː r j ʊ m
k r uː ɛ n t ʊ m	k r ʊ ɛ n t ʊ m
f aː s t ɪ d aː r ɛ	f a s t iː d iː r ɛ
r ɛ d ɪ t ʊ m	r ɛ d ɪ t ʊ m
l ɔ ŋ g ɛ w ʊ m	l ɔ ŋ g aɪ w ʊ m
k l ʊ s uː r a m	k l aʊ s uː r a m
w ɛ r s ɪ k ʊ l ʊ m	w ɛ r s ɪ k ʊ l ʊ m
a lː ɛ g aː t j oː n ɛ m	a lː eː g aː t j oː n ɛ m
d ɛ w j aː t j ʊ m n ɛ m	d eː w j aː t j oː n ɛ m
kʷ aː d r ʊ p l ɪ k aː r ɛ	kʷ a d r ʊ p l ɪ k aː r ɛ
r ɛ s aː r k ɪ r ɛ	r ɛ s a r k iː r ɛ
w ɪ k ɪ n a m	w iː k iː n a m
a n ɪ m aː l ɛ	a n ɪ m a l
p ɔ p ɛ r t aː t	p aʊ p ɛ r t aː t ɛ m
g aː lː a m	g a lː a m
ɪ n k uː l k aː r ɛ	ɪ ŋ k ʊ l k aː r ɛ
f l a m m ɪ l d ʊ m	f a m eː l ɪ k ʊ m
kʷ aː s a m r ɛ	kʷ a sː aː r ɛ
ɪ m b ɛ k ɪ lː ɛ	ɪ m b eː k ɪ lː ʊ m
k ʊ l t oː r ɛ	k ʊ l t oː r ɛ m
n ɛ f aː s t ʊ m	n ɛ f aː s t ʊ m
r ɛ k ɛ d ɛ r ɛ	r ɛ k eː d ɛ r ɛ
k aː n d oː r ɛ	k a n d oː r ɛ m
k ɪ p a m	k eː p a m
ɛ s t ɪ w ʊ m m	aɪ s t iː w ʊ m
gʷ aː s t aː r ɛ	w a s t aː r ɛ
ɔ r t ʊ m	h ɔ r t ʊ m
k ɪ s t ɛ r n a m	k ɪ s t ɛ r n a m
ɛ t ɛ r ɛ	aɪ tʰ ɛ r ɛ m
a t ɛ s t a m r ɛ	a tː ɛ s t aː r iː
p r ɔ l ɔ ŋ g aː t j oː n ɛ m	p r oː l ɔ ŋ g aː t oː n ɛ m
w ɪ t r ʊ m	w ɪ t r ʊ m
a kː r ɛ m s k ɛ r ɛ	a kː r eː s k ɛ r ɛ
ɪ d ɛ n t ɪ k ʊ m	iː d ɛ n t ɪ k ʊ m
ɪ s k ʊ m	ɪ s k ʊ m
f aː b r ʊ m	f a b r ʊ m
k aː p t uː r a m	k a p t uː r a m
k ɔ n k ɛ d ɛ r ɛ	k ɔ ŋ k eː d ɛ r ɛ
t ɪ t ʊ b ɛ r ɛ	t ɪ t ʊ b aː r ɛ
n aː l ɪ k a m	n a t ɛ m
t ɔ r ʊ m	t aʊ r ʊ m
r ɛ k l aː m aː r ɛ	r ɛ k l aː m aː r ɛ
f ʊ s t aː	f ʊ s t a m
p j ɛ r n aː	p ɛ r n a m
uː s ʊ m	uː s ʊ m
k ʊ p uː l aː r ɛ	k oː p ʊ l aː r ɛ
a sː uː m ɛ r ɛ	a sː uː m ɛ r ɛ
a t mː ɪ n ɪ s t r aː r ɛ	a d m ɪ n ɪ s t r aː r ɛ
n ɛ d aː	n oː d aː r ɛ
r a d ɪ k n ɛ	r aː d iː k ɛ m
a g ɪ l ɪ t aː t ɛ m	a g ɪ l ɪ t aː t ɛ m
ɪ n d aː m n ɛ m	ɪ n d ɛ m n ɛ m
p ɛ r ɪ k ʊ l oː s ʊ m	p ɛ r iː k ʊ l oː s ʊ m
a s p ɛ r g ɛ r ɛ	a s p ɛ r g ɛ r ɛ
w aː t ɛ m	w aː t ɛ m
ɪ n t ɛ r p r ɛ t aː b ɪ l ɛ	ɪ n t ɛ r p r ɛ t aː b ɪ l ɛ m
ɔ r j ɪ ɛ n t aː l ɛ	ɔ r ɪ ɛ n t aː l ɛ m
r aː p ʊ m	r aː p ʊ m
s ɛ m kʷ aː k ɛ	s ɛ kʷ aː k ɛ m
d ɪ s ɛ r t ʊ m	d ɪ s ɛ r t ʊ m
a r k ɪ b ɛ s k p ʊ m	a r kʰ ɪ ɛ p ɪ s k ɔ p ʊ m
k ɔ n t aː r ɛ	k ɔ m p ʊ t aː r ɛ
j uː g ɛ r ʊ m	j uː g ɛ r ʊ m
m ɛ r ɪ t ɔ r j ʊ m	m ɛ r ɪ t oː r j ʊ m
r ɛ k uː s aː r ɛ	r ɛ k uː s aː r ɛ
k ɔ m ɛ n t aː r j ʊ m	k ɔ mː ɛ n t aː r j ʊ m
s aː t uː r aː r ɛ	s a t ʊ r aː r ɛ
b j ɛ t ɛ m aː b aː	b eː t a m
f ɔ r n ɪ k aː t oː r ɛ	f ɔ r n ɪ k aː t oː r ɛ m
n ʊ m ɛ r aː r j ʊ m	n ʊ m ɛ r aː r j ʊ m
t r a n s k r ɪ w ɛ r ɛ	t r aː n s k r iː b ɛ r ɛ
a b dː ɔ m ɛ n	a b d oː m ɛ n
t r ɪ s ɛ n aː r j ʊ m	t r iː k eː n aː r j ʊ m
f l ɔ kː oː s ʊ m	f l ɔ kː oː s ʊ m
f aː k ɛ t j a m	f a k eː t j a m
a sː eː r ɛ	a sː ɪ d eː r ɛ
m ɛ r ɪ d j ɔ n aː l ɛ	m ɛ r iː d j oː n aː l ɛ m
l ɛ m n aː r ɛ	l ɪ ŋ n aː r iː
a d aː m a n t ɛ m	a d a m a n t ɛ m
p ɔ lː aː r j ʊ m	p ʊ lː aː r j ʊ m
w aː rː ɛ r ɛ	w ɛ rː ɛ r ɛ
ɪ n d ɛ m f ɪ n ɪ t ʊ m	ɪ n d eː f iː n iː t ʊ m
t r a n s m ɪ t ɛ r ɛ	t r aː n s m ɪ tː ɛ r ɛ
n aː t uː r a m	n aː t uː r a m
s ɪ n k ɛ r ʊ m	s ɪ ŋ k eː r ʊ m
b ɛ m s t r uː k j	s t r uː tʰ j oː n ɛ m
s ɔ m nː ɪ f ɛ r ʊ m	s ɔ m n ɪ f ɛ r ʊ m
t r aː m a m	t r aː m a m
p r ɔ rː ɔ g aː r ɛ	p r oː r ɔ g aː r ɛ
ɔ r k ɛ s t r a m	ɔ r kʰ eː s t r a m
p aː r t ɪ t j oː n ɛ m	p a r t iː t j oː n ɛ m
l uː k j ɪ d	l uː k ɪ d ʊ m
d ʊ l t ɪ s ɔ n ʊ m	d ʊ l k ɪ s ɔ n ʊ m
ɪ m p ɛ r aː t oː r j ʊ m	ɪ m p ɛ r aː t oː r j ʊ m
k ʊ p r ɪ k	k uː p r ʊ m
a p ɪ k k ɛ m	a p ɪ k ɛ m
t r ɪ lː ʊ m	t r iː b ʊ l ʊ m
a s p ɪ r aː t j oː n ɛ	a s p iː r aː t j oː n ɛ m
f uː g aː k ɛ	f ʊ g aː k ɛ m
a f l ɛ n t j aː	a fː l ʊ ɛ n t j a m
k ʊ m r ʊ s k aː r ɛ	k ɔ r ʊ s k aː r ɛ
s ɛ r aː f ɪ k ʊ m	s ɛ r a pʰ ɪ k ʊ m
ɪ n ʊ l t ʊ m	ɪ n ʊ l t ʊ m
a s ɛ lː a m	a s k ɛ lː a m
a k a n t ʊ m	a k a n tʰ ʊ m
b ʊ k s ʊ m	b ʊ k s ʊ m
m eː n s a m	m eː n s a m
g ʊ r ɪ s p r ʊ d ɛ n t a m	j uː r ɪ s p r uː d ɛ n t j a m
w ɪ s ʊ m m	w iː s ʊ m
l ɛ t ʊ m	f ɪ l ɪ k t ʊ m
b aː t ɪ s t ɛ r j ʊ m	b a p t ɪ s t eː r j ʊ m
l ɪ g aː t j oː n ɛ m	l ɪ g aː t j oː n ɛ m
p r ɔ ɪ b ɪ t j ɔ n	p r ɔ h ɪ b ɪ t j oː n ɛ m
f r ɛ kʷ ɛ n t ɛ m	f r ɛ kʷ ɛ n t ɛ m
ɛ k s ɔ r t aː r ɛ	ɛ k s h ɔ r t aː r iː
r ʊ b oː r ɛ	r ʊ b oː r ɛ m
p ɪ l a m	p iː l a m
a d k uː d ɪ k aː r ɛ	a d ɪ uː d ɪ k aː r ɛ
k ɛ t aː r ɛ	kʷ ɪ eː t aː r ɛ
m ɔ d ɛ r aː t oː r ɛ	m ɔ d ɛ r aː t oː r ɛ m
k ɛ r t aː m ɛ	k ɛ r t aː m ɛ n
ɔ l ɪ g aː r k ɪ k ʊ m	ɔ l ɪ g a r kʰ ɪ k ʊ m
p aː t r ɔ k ɪ n j ʊ m	p a t r oː k ɪ n j ʊ m
b aː k ɛ l j ɛ r ɛ	b a kː a l aʊ r ɛu m
g ɛ m ɪ t ʊ m	g ɛ m ɪ t ʊ m
s ʊ b j ʊ k g aː r ɛ	s ʊ b j ʊ g aː r ɛ
aʊ k m ɛ n t aː t j oː n ɛ m	aʊ g m ɛ n t aː t j oː n ɛ m
s ɔ d aː l ɪ t aː t ɛ m	s ɔ d aː l ɪ t aː t ɛ m
d ɛ k ɪ m aː l ɛ	d ɛ k ɪ m a l ɛ m
d ɛ p r ɪ m ɛ r ɛ	d eː p r ɪ m ɛ r ɛ
k ɔ s t uː m ɛ m	k oː n s ʊ eː t uː d ɪ n ɛ m
p ɪ n t oː r ɛ	p ɪ k t oː r ɛ m
ɔ p ʊ l ɛ n t ʊ m	ɔ p ʊ l ɛ n t ʊ m
b a s ɛ lː a	w aː s k ɛ lː ʊ m
w ɪ t ɛ lː ʊ m	w ɪ t ɛ lː ʊ m
a ŋ g ɛ l ɪ k ʊ m	a ŋ g ɛ l ɪ k ʊ m
ɛ kʷ ɪ l ɪ b r j ʊ m	aɪ kʷ ɪ l iː b r j ʊ m
a d ʊ n aː r ɛ	a d uː n aː r ɛ
ɔ k ɪ d ɛ r ɛ	ɔ kː ɪ d ɛ r ɛ
a r g uː t j a m	a r g uː t j a m
f aː ɪ n a m	f aː g ɪ n ʊ m
f aː k ɛ t ʊ m	f a k eː t ʊ m
a lː ɪ w j aː r ɛ	a lː ɛ w j aː r ɛ
t ɔ g a m	t ɔ g a m
b ɛ n ɛ w ɔ l ʊ m	b ɛ n ɛ w ɔ l ʊ m
s k r ɪ k t uː r a m	s k r iː p t uː r a m
s ɪ m ɪ l ɛ	s ɪ m ɪ l ɛ m
w ɛ n j aː	w ɛ n j a m
ɪ n s k r ɪ w ɛ r ɛ	iː n s k r iː b ɛ r ɛ
t ɪ m ɪ d ʊ m	t ɪ m ɪ d ʊ m
s ɛ ŋ t ɪ r ɛ	s ɛ n t iː r ɛ
b aː j l aː r ɛ	b aː j ʊ l aː r ɛ
s ʊ r t ɪ r ɛ	s ɔ r t iː r iː
n ʊ m ɛ m r aː r ɛ	n ʊ m ɛ r aː r ɛ
a d ɔ r aː r ɛ	a d oː r aː r ɛ
s ɛ r p ɛ n t ɪ n ʊ m	s ɛ r p ɛ n t iː n ʊ m
a fː l ɪ k t j oː n ɛ m	a fː l ɪ k t j oː n ɛ m
t eːa n ɪ r n ʊ m	t ɛ n ɛ r ʊ m
a n aː t aː m	a n a t ɛ m
b ɔ t ʊ l ɪ n ʊ m	b ɔ t ʊ l ʊ m
s ɔ r t ɛ m	s ɔ r t ɛ m
r ɛ t aː r d a m r ɛ	r ɛ t a r d aː r ɛ
k aː w ɪ lː aː r ɛ	k a w ɪ lː aː r iː
kʷ aː d r aː r ɛ	kʷ aː d r aː r ɛ
p r ɔ b l ɛ m aː t ɪ k ʊ m	p r ɔ b l eː m a t ɪ k ʊ m
m ɛ r a m w ɪ l a m	m iː r aː b ɪ l ɛ m
p r ɔ s k r ɪ w ɛ r ɛ	p r oː s k r iː b ɛ r ɛ
a b s t r ʊ s ʊ	a b s t r uː s ʊ m
ɔ r d ɪ n aː r j ʊ m	oː r d ɪ n aː r j ʊ m
d ɛ s k r ɪ w ɛ r ɛ	d eː s k r iː b ɛ r ɛ
ɪ ŋ j uː r j a m	ɪ n ɪ uː r j a m
p ɛ k uː l j ʊ m	p ɛ k uː l j ʊ m
k ɔ n k ɛ r n ɛ r ɛ	k ɔ ŋ k ɛ r n ɛ r ɛ
p ɛ r d r ɪ k	p ɛ r d iː k ɛ m
p ɔ lː ɪ k ɛ m	p ɔ lː ɪ k ɛ m
m ɪ n oː r ɛ	m ɪ n oː r ɛ m
a g ɪ t aː r ɛ	a g ɪ t aː r ɛ
ɪ n d ɪ s k r ɛ t j oː n ɛ m	ɪ n d ɪ s k r eː t j oː n ɛ m
t r ɪ f ɔ l j a m t ʊ m	t r ɪ f ɔ l j aː t ʊ m
l a m k r ɪ m oː s ʊ m	l a k r ɪ m oː s ʊ m
p ʊ n aː r ɛ	p ʊ ŋ n aː r ɛ
d ɪ m a n d aː r ɛ	d eː m a n d aː r ɛ
ɪ n k ɔ r w aː r ɛ	ɪ ŋ k ʊ r w aː r ɛ
a l t ɛ r k aː t j oː n ɛ m	a l t ɛ r k aː t j oː n ɛ m
p r ɔ f ʊ n d ɪ t aː t ɛ m	p r ɔ f ʊ n d ɪ t aː t ɛ m
ɪ nː ɔ k ʊ m	ɪ nː ɔ k ʊː m
s ʊ p ɛ r b j a m	s ʊ p ɛ r b j a m
k ɛ sː aː t j oː n ɛ m	k ɛ sː aː t j oː n ɛ m
ɪ n t ɛ r w ɛ n t j oː n ɛ m	ɪ n t ɛ r w ɛ n t j oː n ɛ m
f a m r ɪ n oː s ʊ m	f a r iː n oː s ʊ m
t aː k t ɪ l ɛ	t aː k t ɪ l ɛ m
k ɔ n k ɪ l j aː b ʊ l ʊ m	k ɔ ŋ k ɪ l j aː b ʊ l ʊ m
m aː r ɪ s k a m	m a r ɪ s k a m
a w ʊ	a w ʊ m
ɔ kː l ʊ d ɛ r ɛ	ɔ kː l uː d ɛ r ɛ
l aː b oː r ɛ m	l a b oː r ɛ m
d oː t aː r ɛ	d oː t aː r ɛ
l uː k s ʊ m	l uː k s ʊ m
a s p aː r a g ʊ m	a s p a r a g ʊ m
k ɔ n f l uː iː r ɛ	k oː n f l ʊ ɛ r ɛ
w ɛ r s aː t ɪ l	w ɛ r s aː t ɪ l ɛ m
ɔ n ʊ s t ʊ m	ɔ n ʊ s t ʊ m
a m aː n ʊ ɛ n s ɛ m	aː m a n ʊ eː n s ɛ m
w ɛ r n ɪ k ɛ	w ɛ r n iː k ɛ m
t r a n s f ɛ r ɛ r ɛ	t r aː n s f ɛ rː ɛ
b a s ʊ m	b a sː ʊ m
t ʊ r d ʊ m	t ʊ r d ʊ m
ɛ f ɛ k t ɪ w ʊ m	ɛ fː ɛ k t iː w ʊ m
r a p ɪ r ɛ	r a p ɛ r ɛ
p a l j ʊ r	p a l ɪ uː r ʊ m
d ɪ s k r ɛ t j oː n ɛ	d ɪ s k r eː t j oː n ɛ m
k ɔ l ʊ m b ɪ n ʊ m	k ɔ l ʊ m b iː n ʊ m
ɪ b r ɪ d ʊ m	h y b r ɪ d a m
r aː k ɛ m ʊ m	r a k eː m ʊ m
t r a n s m uː t aː t j oː n ɛ m	t r aː n s m uː t aː t j oː n ɛ m
w ɪ g oː r	w ɪ g oː r ɛ m
s uː kː k j n aː r ɛ	s uː g ɛ r ɛ
s ʊ l k ʊ m	s ʊ l k ʊ m
kʷ aː l ɪ f ɪ k aː r ɛ	kʷ aː l ɪ f ɪ k aː r ɛ
t ʊ s oː n ɛ m	t oː n s j oː n ɛ m
k r ɪ m ɪ n ɛ	k r iː m ɛ n
d z ɪ d aː n j aː	z iː zː a n j a
k r ɛ d ɪ b ɪ l ɛ	k r eː d ɪ b ɪ l ɛ m
r aː p ɪ d ɪ t aː	r a p ɪ d ɪ t aː t ɛ m
a ɪ d j aː	a k eː d j a m
f aː k ʊ n d j a m	f aː k ʊ n d j a m
k j ɛ r j ʊ m	k eː r ɛu m
ɪ rː ɪ g a m r ɛ	ɪ rː ɪ g aː r ɛ
p aː r s ɪ m ɔ n j a m	p a r s ɪ m oː n j a m
b ɛ s t j aː r j ʊ m	b eː s t j aː r j ʊ m
t r a n s g r ɛ d ɪ r ɛ	t r aː n s g r ɛ d iː
m a r ɪ d ʊ m	m a r k ɪ d ʊ m
m a k ɪ n aː r ɛ	m aː kʰ ɪ n aː r iː
ɪ n g ʊ ŋ k t j ʊ m n ɛ m	ɪ n j ʊ ŋ k t j oː n ɛ m
f ɪ n kː aː r ɛ	f iː g ɛ r ɛ
d ɛ k l aː m aː r ɛ	d eː k l aː m aː r ɛ
ɔ s p ɛ m d aː r ɛ	h ɔ s p ɪ t aː r iː
s ʊ lː ɛ m w aː r ɛ	s ʊ b l ɛ w aː r ɛ
s t r aː g ʊ m	s t r aː g ɛ m
k ɔ n t r ɔ w ɛ r s j a m	k ɔ n t r oː w ɛ r s j a m
d a m nː oː s ʊ m	d a m n oː s ʊ m
p r ɔ t ɛ s t aː t j oː n ɛ m	p r oː t ɛ s t aː t j oː n ɛ m
ɪ n f a n t j a m	iː n f a n t j a m
p r ɛ s uː m ɛ r ɛ	p r aɪ s uː m ɛ r ɛ
b ɪ k a m	b iː g a m
a d ɔ r aː t j oː n ɛ m	a d oː r aː t j oː n ɛ m
d ɛ m k ɔ rː ɛ r m ɛ	d eː k ʊ rː ɛ r ɛ
k aː t aː r aː k t a m	k a t a r a k t a m
s ɪ t uː l a m	s ɪ t ʊ l a m
a s p ɛ r s j oː n ɛ m	a s p ɛ r s j oː n ɛ m
r ɛ m ʊ w eː r ɛ	r ɛ m ɔ w eː r ɛ
ɪ ŋ g r aː t ʊ m	ɪ ŋ g r aː t ʊ m
d ɛ k ɛ t ɔ r j ʊ m	d ɛ k ɛ p t oː r j ʊ m
p r ɛ t ɪ p ɪ t j ʊ m	p r aɪ k ɪ p ɪ t j ʊ m
b j ɛ nː j ʊ m	b ɪ ɛ nː j ʊ m
ɛ m a n k ɪ p aː t j oː n ɛ m	eː m a ŋ k ɪ p aː t j oː n ɛ m
g r aː w ɪ d ʊ m	g r a w ɪ d ʊ m
m ɔ r ɪ b ʊ n d ʊ m	m ɔ r ɪ b ʊ n d ʊ m
m ɪ r t ʊ m	m y r t ʊ m
g l ʊ t oː n ɛ	g l ʊ tː oː n ɛ m
t ɛ k s t ʊ r a m	t ɛ k s t uː r a m
ɔ n ɔ r aː b ɪ l ɛ	h ɔ n oː r aː b ɪ l ɛ m
k ʊ m n k ɪ nː ɪ t aː t ɛ m	k ɔ ŋ k ɪ nː ɪ t aː t ɛ m
d ɛ ɪ f ɪ k aː r ɛ	d ɛ ɪ f ɪ k aː r ɛ
d ɔ r m ɪ t oː r j ʊ m	d ɔ r m iː t oː r j ʊ m
k ɛ r oː s ʊ m	k eː r oː s ʊ m
p r ɛ w aː l eː r ɛ	p r aɪ w a l eː r ɛ
a s aː t aː r ɛ	a sː ɛ k t aː r iː
ɛ l ɛ f a n t ɪ n ʊ m	ɛ l ɛ pʰ a n t ɪ n ʊ m
l aː r w aː	l aː r w a m
ɪ m nː ʊ m	h y m n ʊ m
t ɛ r t j ʊ m	t ɛ r t j ʊ m
d ɛ k ɪ m ʊ m	d ɛ k ɪ m ʊ m
p ɔ n d ɛ r aː r ɛ	p ɔ n d ɛ r aː r ɛ
ɪ n f r ɛ n aː r ɛ	iː n f r eː n aː r ɛ
a l b ʊ m ɛ	a l b uː m ɛ n
p uː ŋ n aː k ɛ	p ʊ ŋ n aː k ɛ m
m aː t r ɪ k ʊ l a m	m aː t r iː k ʊ l a m
ɪ l ʊ m	h iː l ʊ m
w ɛ n ɛ t m ʊ m	w ɛ n ɛ t ʊ m
a f j aː n t aː r ɛ	a fː ɪ d ɛ n t j aː r ɛ
k aː lː ʊ m	k a lː ʊ m
a r m aː r j ʊ m	a r m aː r j ʊ m
k ɔ nː ɛ k t ɛ r ɛ	k oː n ɛ k t ɛ r ɛ
w ɔ m ɪ t aː r ɛ	w ɔ m ɪ t aː r ɛ
ɛ n t ɛ m	ɛ n s
a n ɛ m ɔ n ɛ	a n ɛ m oː n eː n
ɔ r ɪ g ɪ n ɛ	ɔ r iː g ɪ n ɛ m
p r ɔ w ɛ n t ʊ m	p r oː w ɛ n t ʊ m
f ɪ d ʊ k aː	f iː d uː k j a m
k ɔ n t r aː k t ɛ	k ɔ n t r a h ɛ r ɛ
t r aː d uː k t j oː n ɛ	t r aː d ʊ k t j oː n ɛ m
a f ɔ g aː r ɛ	ɔ fː oː k aː r ɛ
p aː r t ɪ k ʊ l a m	p a r t ɪ k ʊ l a m
a b ɪ t ʊ aː l ɛ	h a b ɪ t w aː l ɛ m
ɪ n f ɛ k t j oː n ɛ m	ɪ n f ɛ k t j oː n ɛ m
k ɔ n s ɔ l aː r ɛ	k oː n s oː l aː r iː
p ʊ pː a m	p ʊ pː ɛ m
g r a n d ɪ k ʊ m	g r a n d ɪ n ɛ m
k l aː r ɪ t aː t ɛ m	k l aː r ɪ t aː t ɛ m
d uː r aː r ɛ	d uː r aː r ɛ
r ɛ f l oː r ɪ r ɛ	r ɛ f l oː r eː r ɛ
t ɛ rː ɛ n ʊ m	t ɛ rː eː n ʊ m
f aː r t ʊ m	f a r t ʊ m
s ɛ p ʊ l t uː r a m	s ɛ p ʊ l t uː r a m
d uː k ɪ r ɛ	d uː k ɛ r ɛ
s k aː r a m b ɛ l ʊ m	s k a r a b aɪ ʊ m
p aː l p ɛ b r aː l	p a l p ɛ b r aː l ɛ m
p ɛ r p ɛ t r a m r ɛ	p ɛ r p ɛ t r aː r ɛ
f ʊ m d ɪ r	f ɔ d ɛ r ɛ
d ɛ m f ɔ r m ɛ m	d eː f oː r m ɛ m
m uː n ɪ k ɪ p aː l ɛ	m uː n ɪ k ɪ p aː l ɛ m
k r ʊ s t oː s ʊ m	k r ʊ s t oː s ʊ m
p r ɪ n k ɪ p aː l ɪ t aː t ɛ m	p r ɪ ŋ k ɪ p aː l ɪ t aː t ɛ m
m ʊ t aː r ɛ	m uː t w aː r iː
n ɪ w ɛ ʊ m	n ɪ w ɛu m
s ɛ t aː	s aɪ t a m
d ɔ r aː r ɛ	d ɛ aʊ r aː r ɛ
w ɛ g ɛ m t ʊ m	w ɛ g ɛ t ʊ m
a b ɪ g ɪ ʊ m	a b ɪ g ɛu m
a b n ɔ r m ɛ	a b n oː r m ɛ m
s ɪ k ɔ f a n t a m	s yː k ɔ pʰ a n t a m
a b ɪ l ɪ t aː t ɛ m	h a b ɪ l ɪ t aː t ɛ m
ɛ k s k ɔ g ɪ t a m r ɛ	ɛ k s k oː g ɪ t aː r ɛ
k ɛ k ʊ m	k aɪ k ʊ m
l ʊ s k ʊ m	l ʊ s k ʊ m
k ɔ s t aː t ʊ m	k ɔ s t aː t ʊ m
r ɛ p r ɛ n d ɛ r ɛ	r ɛ p r ɛ h ɛ n d ɛ r ɛ
m aː n t ɛ n ɛ r ɛ	m a n ʊ t ɛ n eː r ɛ
f aː l d ɪ s t ɔ r j ʊ m	f a l d ɪ s t oː l j ʊ m
ʊ m b r aː t ɪ k ʊ m	ʊ m b r aː t ɪ k ʊ m
a p aː r ɪ t j ɔ n	a pː aː r ɪ t j oː n ɛ m
m ʊ j ʊ m	m ɔ d j ʊ m
p aː s k aː r ʊ m	p ɪ s k aː r j ʊ m
s aː t ɪ r aː	s a t ɪ r a m
f eː mː ɪ n a m	f eː m ɪ n a m
t ɔ l ɛ r ɛ	t ɔ lː ɛ r ɛ
ɛ l ʊ ɛ r ɛ	eː l ʊ ɛ r ɛ
m ɛ aː r ɛ	m eː j ɛ r ɛ
r ɛ t ɪ k ɛ r ɛ	r ɛ t ɪ k eː r ɛ
f aʊ k ɪ m	f aʊ k eː s
g r aː b aː t aː	g r a b aː t ʊ m
r ɛ k t ɪ t ʊ d	r ɛ k t ɪ t uː d ɪ n ɛ m
a b j uː r aː r ɛ	a b ɪ uː r aː r ɛ
a k k ɛ p t j oː n ɛ m	a kː ɛ p t j oː n ɛ m
k r ɛ aː t r ɪ k ɛ	k r ɛ aː t r iː k ɛ m
r ɛ p r ʊ w aː r ɛ	r ɛ p r ɔ b aː r ɛ
p ɛ k t ɪ n aː r ɛ	p ɛ k t ɪ n aː r ɛ
k ɪ n aː r ɛ	k eː n aː r ɛ
a kː ɪ s ɪ t j oː n ɛ	a kː w ɪ s iː t j oː n ɛ m
ɪ n d uː r aː r ɛ	ɪ n d uː r aː r ɛ
a s t ʊ lː a m	a sː ʊ l a m
s aː k r aː r j ʊ m	s a k r aː r j ʊ m
k ɔ n mː ɔ w ɛ r ɛ	k ɔ mː ɔ w eː r ɛ
r ɛ p r ɛ h ɛ n s ɪ b ɪ l ɛ	r ɛ p r ɛ h ɛ n s ɪ b ɪ l ɛ m
l ɔ k aː l ɛ	l ɔ k aː l ɛ m
ʊ l t ʊ m r ɛ	ʊ l t oː r ɛ m
r ɪ s p l ɛ n d k ɛ r ɛ	r ɛ s p l ɛ n d eː r ɛ
a b r ɛ w j aː t j oː n ɛ m	a bː r ɛ w j aː t j oː n ɛ m
k aː l k ɔ l aː t j oː n ɛ m	k a l k ʊ l aː t j oː n ɛ m
t ɛ m ɛ r ɛ	t ɪ m eː r ɛ
p ɪ n s ʊ m	p eː n s ʊ m
a t w ɛ r t ɪ r ɛ	a d w ɛ r t ɛ r ɛ
ʊ n t ɔ s ʊ m	uː ŋ k t ʊ oː s ʊ m
a s ɪ m ɪ l aː r ɛ	a sː ɪ m ʊ l aː r ɛ
a s aː r	a fː l aː r ɛ
w ɛ r g ɪ n ɛ	w ɪ r g ɪ n ɛ m
p r ɛ w ɛ m n ɪ r ɛ	p r aɪ w ɛ n iː r ɛ
k ʊ rː ɛ aː	k ɔ rː ɪ g j a m
r ɛ m k ɔ rː ɛ r ɛ	r ɛ k ʊ rː ɛ r ɛ
l ɛ g ɪ	l eː g ɛ m
p ɛ l aː g ʊ m	p ɛ l a g ʊ s
ɔ p r ɪ m ɛ r ɛ	ɔ pː r ɪ m ɛ r ɛ
k ɔ n f j aː r ɛ	k oː n f iː d ɛ r ɛ
k ɔ n s oː n aː r ɛ	k oː n s ɔ n aː r ɛ
a b n ɛ g aː r ɛ	a b n ɛ g aː r ɛ
t r ɛ p ɪ d aː t j oː n ɛ m	t r ɛ p ɪ d aː t j oː n ɛ m
